smartctl 7.1 2019-12-30 r5022 [FreeBSD 12.1-RELEASE-p9 amd64] (local build)
Copyright (C) 2002-19, Bruce Allen, Christian Franke, www.smartmontools.org

=== START OF INFORMATION SECTION ===
Device Model:     KINGSTON SNS4151S316G
Serial Number:    --
Firmware Version: S9FM01.1
User Capacity:    16,013,942,784 bytes [16.0 GB]
Sector Size:      512 bytes logical/physical
Rotation Rate:    Solid State Device
Form Factor:      2.5 inches
Device is:        Not in smartctl database [for details use: -P showall]
ATA Version is:   ACS-3 (minor revision not indicated)
SATA Version is:  SATA 3.1, 6.0 Gb/s (current: 6.0 Gb/s)
Local Time is:    Sat Oct  3 01:35:35 2020 AEST
SMART support is: Available - device has SMART capability.
SMART support is: Enabled
AAM feature is:   Unavailable
APM feature is:   Disabled
Rd look-ahead is: Enabled
Write cache is:   Enabled
DSN feature is:   Unavailable
ATA Security is:  Disabled, NOT FROZEN [SEC1]
Wt Cache Reorder: Unavailable

=== START OF READ SMART DATA SECTION ===
SMART overall-health self-assessment test result: PASSED

General SMART Values:
Offline data collection status:  (0x00)	Offline data collection activity
					was never started.
					Auto Offline Data Collection: Disabled.
Self-test execution status:      (   0)	The previous self-test routine completed
					without error or no self-test has ever 
					been run.
Total time to complete Offline 
data collection: 		(   30) seconds.
Offline data collection
capabilities: 			 (0x1b) SMART execute Offline immediate.
					Auto Offline data collection on/off support.
					Suspend Offline collection upon new
					command.
					Offline surface scan supported.
					Self-test supported.
					No Conveyance Self-test supported.
					No Selective Self-test supported.
SMART capabilities:            (0x0003)	Saves SMART data before entering
					power-saving mode.
					Supports SMART auto save timer.
Error logging capability:        (0x01)	Error logging supported.
					General Purpose Logging supported.
Short self-test routine 
recommended polling time: 	 (   1) minutes.
Extended self-test routine
recommended polling time: 	 (   2) minutes.

SMART Attributes Data Structure revision number: 16
Vendor Specific SMART Attributes with Thresholds:
ID# ATTRIBUTE_NAME          FLAGS    VALUE WORST THRESH FAIL RAW_VALUE
  1 Raw_Read_Error_Rate     -O-R--   100   100   000    -    0
  2 Throughput_Performance  P-S---   100   100   050    -    0
  3 Spin_Up_Time            POS---   100   100   050    -    0
  5 Reallocated_Sector_Ct   PO--C-   100   100   050    -    0
  7 Unknown_SSD_Attribute   PO-R--   100   100   050    -    0
  8 Unknown_SSD_Attribute   P-S---   100   100   050    -    0
  9 Power_On_Hours          -O--C-   100   100   000    -    30062
 10 Unknown_SSD_Attribute   PO--C-   100   100   050    -    0
 12 Power_Cycle_Count       -O--C-   100   100   000    -    549
167 Unknown_Attribute       -O---K   100   100   000    -    0
168 Unknown_Attribute       -O--C-   100   100   000    -    0
169 Unknown_Attribute       ------   100   100   000    -    8
170 Unknown_Attribute       PO--C-   100   100   010    -    7
172 Unknown_Attribute       -O--CK   100   100   000    -    0
175 Program_Fail_Count_Chip PO--C-   100   100   010    -    0
181 Program_Fail_Cnt_Total  -O--C-   100   100   000    -    0
187 Reported_Uncorrect      -O--CK   100   100   000    -    0
192 Power-Off_Retract_Count -O--C-   100   100   000    -    31
196 Reallocated_Event_Count ------   100   100   000    -    0
197 Current_Pending_Sector  -O--CK   100   100   000    -    1684300900
199 UDMA_CRC_Error_Count    -O--CK   100   100   000    -    0
233 Media_Wearout_Indicator PO--C-   100   100   000    -    7752758
240 Unknown_SSD_Attribute   PO--C-   100   100   050    -    0
241 Total_LBAs_Written      -O--C-   100   100   000    -    3350538
242 Total_LBAs_Read         -O--C-   100   100   000    -    4541788
243 Unknown_Attribute       -O--C-   100   100   000    -    110382343808100
244 Unknown_Attribute       ------   100   100   000    -    536
245 Unknown_Attribute       ------   100   100   000    -    969
246 Unknown_Attribute       ------   100   100   000    -    2244077
                            ||||||_ K auto-keep
                            |||||__ C event count
                            ||||___ R error rate
                            |||____ S speed/performance
                            ||_____ O updated online
                            |______ P prefailure warning

General Purpose Log Directory Version 1
SMART           Log Directory Version 1 [multi-sector log support]
Address    Access  R/W   Size  Description
0x00       GPL,SL  R/O      1  Log Directory
0x01           SL  R/O      1  Summary SMART error log
0x02           SL  R/O     51  Comprehensive SMART error log
0x03       GPL     R/O     64  Ext. Comprehensive SMART error log
0x06           SL  R/O      1  SMART self-test log
0x07       GPL     R/O      1  Extended self-test log
0x10       GPL     R/O      1  NCQ Command Error log
0x11       GPL     R/O      1  SATA Phy Event Counters log
0x30       GPL     R/O      9  IDENTIFY DEVICE data log
0x80-0x9f  GPL,SL  R/W     16  Host vendor specific log

SMART Extended Comprehensive Error Log Version: 1 (64 sectors)
No Errors Logged

SMART Extended Self-test Log Version: 1 (1 sectors)
Num  Test_Description    Status                  Remaining  LifeTime(hours)  LBA_of_first_error
# 1  Short offline       Completed without error       00%       533         -

Selective Self-tests/Logging not supported

SCT Commands not supported

Device Statistics (GP/SMART Log 0x04) not supported

Pending Defects log (GP Log 0x0c) not supported

SATA Phy Event Counters (GP Log 0x11)
ID      Size     Value  Description
0x0001  2            0  Command failed due to ICRC error
0x0003  2            0  R_ERR response for device-to-host data FIS
0x0004  2            0  R_ERR response for host-to-device data FIS
0x0006  2            0  R_ERR response for device-to-host non-data FIS
0x0007  2            0  R_ERR response for host-to-device non-data FIS
0x0008  2            0  Device-to-host non-data FIS retries
0x0009  4            3  Transition from drive PhyRdy to drive PhyNRdy
0x000a  4            4  Device-to-host register FISes sent due to a COMRESET
0x000f  2            0  R_ERR response for host-to-device data FIS, CRC
0x0010  2            0  R_ERR response for host-to-device data FIS, non-CRC
0x0012  2            0  R_ERR response for host-to-device non-data FIS, CRC
0x0013  2            0  R_ERR response for host-to-device non-data FIS, non-CRC

