smartctl 7.2 2021-09-14 r5236 [FreeBSD 13.0-RELEASE-p7 amd64] (local build)
Copyright (C) 2002-20, Bruce Allen, Christian Franke, www.smartmontools.org

=== START OF INFORMATION SECTION ===
Model Family:     Phison Driven OEM SSDs
Device Model:     SPCC Solid State Disk
Serial Number:    --
Firmware Version: SBFM61.3
User Capacity:    128,035,676,160 bytes [128 GB]
Sector Size:      512 bytes logical/physical
Rotation Rate:    Solid State Device
Form Factor:      2.5 inches
TRIM Command:     Available
Device is:        In smartctl database [for details use: -P show]
ATA Version is:   ACS-4 (minor revision not indicated)
SATA Version is:  SATA 3.2, 6.0 Gb/s (current: 3.0 Gb/s)
Local Time is:    Wed Mar 16 21:54:59 2022 MSK
SMART support is: Available - device has SMART capability.
SMART support is: Enabled
AAM feature is:   Unavailable
APM feature is:   Unavailable
Rd look-ahead is: Enabled
Write cache is:   Enabled
DSN feature is:   Unavailable
ATA Security is:  Disabled, frozen [SEC2]
Wt Cache Reorder: Unavailable

=== START OF READ SMART DATA SECTION ===
SMART overall-health self-assessment test result: PASSED

General SMART Values:
Offline data collection status:  (0x00)	Offline data collection activity
					was never started.
					Auto Offline Data Collection: Disabled.
Self-test execution status:      (   0)	The previous self-test routine completed
					without error or no self-test has ever 
					been run.
Total time to complete Offline 
data collection: 		(65535) seconds.
Offline data collection
capabilities: 			 (0x79) SMART execute Offline immediate.
					No Auto Offline data collection support.
					Suspend Offline collection upon new
					command.
					Offline surface scan supported.
					Self-test supported.
					Conveyance Self-test supported.
					Selective Self-test supported.
SMART capabilities:            (0x0003)	Saves SMART data before entering
					power-saving mode.
					Supports SMART auto save timer.
Error logging capability:        (0x01)	Error logging supported.
					General Purpose Logging supported.
Short self-test routine 
recommended polling time: 	 (   2) minutes.
Extended self-test routine
recommended polling time: 	 (  30) minutes.
Conveyance self-test routine
recommended polling time: 	 (   6) minutes.

SMART Attributes Data Structure revision number: 16
Vendor Specific SMART Attributes with Thresholds:
ID# ATTRIBUTE_NAME          FLAGS    VALUE WORST THRESH FAIL RAW_VALUE
  1 Raw_Read_Error_Rate     PO-R--   100   100   050    -    0
  9 Power_On_Hours          -O--C-   100   100   000    -    7714
 12 Power_Cycle_Count       -O--C-   100   100   000    -    1808
168 SATA_Phy_Error_Count    -O--C-   100   100   000    -    0
170 Bad_Blk_Ct_Erl/Lat      PO----   100   100   000    -    0/59
173 MaxAvgErase_Ct          -O--C-   100   100   000    -    115 (Average 82)
192 Unsafe_Shutdown_Count   -O--C-   100   100   000    -    43
194 Temperature_Celsius     PO---K   067   067   000    -    33 (Min/Max 33/33)
218 CRC_Error_Count         PO-R--   100   100   050    -    2124
231 SSD_Life_Left           PO--C-   100   100   000    -    97
241 Lifetime_Writes_GiB     -O--C-   100   100   000    -    6221
                            ||||||_ K auto-keep
                            |||||__ C event count
                            ||||___ R error rate
                            |||____ S speed/performance
                            ||_____ O updated online
                            |______ P prefailure warning

General Purpose Log Directory Version 1
SMART           Log Directory Version 1 [multi-sector log support]
Address    Access  R/W   Size  Description
0x00       GPL,SL  R/O      1  Log Directory
0x01           SL  R/O      1  Summary SMART error log
0x02           SL  R/O     51  Comprehensive SMART error log
0x03       GPL     R/O     64  Ext. Comprehensive SMART error log
0x04       GPL,SL  R/O      8  Device Statistics log
0x06           SL  R/O      1  SMART self-test log
0x07       GPL     R/O      1  Extended self-test log
0x09           SL  R/W      1  Selective self-test log
0x10       GPL     R/O      1  NCQ Command Error log
0x11       GPL     R/O      1  SATA Phy Event Counters log
0x30       GPL,SL  R/O      9  IDENTIFY DEVICE data log
0x80-0x9f  GPL,SL  R/W     16  Host vendor specific log

SMART Extended Comprehensive Error Log Version: 1 (64 sectors)
Device Error Count: 2115 (device log contains only the most recent 256 errors)
	CR     = Command Register
	FEATR  = Features Register
	COUNT  = Count (was: Sector Count) Register
	LBA_48 = Upper bytes of LBA High/Mid/Low Registers ]  ATA-8
	LH     = LBA High (was: Cylinder High) Register    ]   LBA
	LM     = LBA Mid (was: Cylinder Low) Register      ] Register
	LL     = LBA Low (was: Sector Number) Register     ]
	DV     = Device (was: Device/Head) Register
	DC     = Device Control Register
	ER     = Error register
	ST     = Status register
Powered_Up_Time is measured from power on, and printed as
DDd+hh:mm:SS.sss where DD=days, hh=hours, mm=minutes,
SS=sec, and sss=millisec. It "wraps" after 49.710 days.

Error 2115 [66] occurred at disk power-on lifetime: 0 hours (0 days + 0 hours)
  When the command that caused the error occurred, the device was active or idle.

  After command completion occurred, registers were:
  ER -- ST COUNT  LBA_48  LH LM LL DV DC
  -- -- -- == -- == == == -- -- -- -- --
  84 -- 51 00 80 00 00 00 00 03 00 e0 00  Error: ICRC, ABRT 128 sectors at LBA = 0x00000300 = 768

  Commands leading to the command that caused the error were:
  CR FEATR COUNT  LBA_48  LH LM LL DV DC  Powered_Up_Time  Command/Feature_Name
  -- == -- == -- == == == -- -- -- -- --  ---------------  --------------------
  25 00 00 00 80 00 00 00 00 03 00 e0 00     00:00:00.000  READ DMA EXT
  25 00 00 00 80 00 00 00 00 02 80 e0 00     00:00:00.000  READ DMA EXT
  25 00 00 00 80 00 00 00 00 02 00 e0 00     00:00:00.000  READ DMA EXT
  25 00 00 00 80 00 00 00 00 01 80 e0 00     00:00:00.000  READ DMA EXT
  25 00 00 00 80 00 00 00 00 01 00 e0 00     00:00:00.000  READ DMA EXT

Error 2114 [65] occurred at disk power-on lifetime: 0 hours (0 days + 0 hours)
  When the command that caused the error occurred, the device was active or idle.

  After command completion occurred, registers were:
  ER -- ST COUNT  LBA_48  LH LM LL DV DC
  -- -- -- == -- == == == -- -- -- -- --
  84 -- 51 00 80 00 00 00 00 01 00 e0 00  Error: ICRC, ABRT 128 sectors at LBA = 0x00000100 = 256

  Commands leading to the command that caused the error were:
  CR FEATR COUNT  LBA_48  LH LM LL DV DC  Powered_Up_Time  Command/Feature_Name
  -- == -- == -- == == == -- -- -- -- --  ---------------  --------------------
  25 00 00 00 80 00 00 00 00 01 00 e0 00     00:00:00.000  READ DMA EXT
  25 00 00 00 80 00 00 00 00 00 80 e0 00     00:00:00.000  READ DMA EXT
  25 00 00 00 80 00 00 00 00 00 00 e0 00     00:00:00.000  READ DMA EXT
  e1 00 00 00 00 00 00 00 00 00 00 a0 00     00:00:00.000  IDLE IMMEDIATE
  25 00 00 00 80 00 00 00 00 00 00 e0 00     00:00:00.000  READ DMA EXT

Error 2113 [64] occurred at disk power-on lifetime: 0 hours (0 days + 0 hours)
  When the command that caused the error occurred, the device was active or idle.

  After command completion occurred, registers were:
  ER -- ST COUNT  LBA_48  LH LM LL DV DC
  -- -- -- == -- == == == -- -- -- -- --
  84 -- 51 00 80 00 00 00 00 00 00 e0 00  Error: ICRC, ABRT 128 sectors at LBA = 0x00000000 = 0

  Commands leading to the command that caused the error were:
  CR FEATR COUNT  LBA_48  LH LM LL DV DC  Powered_Up_Time  Command/Feature_Name
  -- == -- == -- == == == -- -- -- -- --  ---------------  --------------------
  25 00 00 00 80 00 00 00 00 00 00 e0 00     00:00:00.000  READ DMA EXT
  e1 00 00 00 00 00 00 00 00 00 00 a0 00     00:00:00.000  IDLE IMMEDIATE
  b0 00 d5 00 01 00 00 00 c2 4f 06 a0 00     00:00:00.000  SMART READ LOG
  b0 00 d5 00 01 00 00 00 c2 4f 00 a0 00     00:00:00.000  SMART READ LOG
  b0 00 d0 00 01 00 00 00 c2 4f 00 a0 00     00:00:00.000  SMART READ DATA

Error 2112 [63] occurred at disk power-on lifetime: 0 hours (0 days + 0 hours)
  When the command that caused the error occurred, the device was active or idle.

  After command completion occurred, registers were:
  ER -- ST COUNT  LBA_48  LH LM LL DV DC
  -- -- -- == -- == == == -- -- -- -- --
  84 -- 51 00 80 00 00 00 29 d5 80 e0 00  Error: ICRC, ABRT 128 sectors at LBA = 0x0029d580 = 2741632

  Commands leading to the command that caused the error were:
  CR FEATR COUNT  LBA_48  LH LM LL DV DC  Powered_Up_Time  Command/Feature_Name
  -- == -- == -- == == == -- -- -- -- --  ---------------  --------------------
  25 00 00 00 80 00 00 00 29 d5 80 e0 00     00:00:00.000  READ DMA EXT
  25 00 00 00 80 00 00 00 29 d5 00 e0 00     00:00:00.000  READ DMA EXT
  25 00 00 00 80 00 00 00 29 d4 80 e0 00     00:00:00.000  READ DMA EXT
  25 00 00 00 80 00 00 00 29 d4 00 e0 00     00:00:00.000  READ DMA EXT
  25 00 00 00 80 00 00 00 29 d3 80 e0 00     00:00:00.000  READ DMA EXT

Error 2111 [62] occurred at disk power-on lifetime: 0 hours (0 days + 0 hours)
  When the command that caused the error occurred, the device was active or idle.

  After command completion occurred, registers were:
  ER -- ST COUNT  LBA_48  LH LM LL DV DC
  -- -- -- == -- == == == -- -- -- -- --
  84 -- 51 00 f0 00 00 07 44 08 10 e0 00  Error: ICRC, ABRT 240 sectors at LBA = 0x07440810 = 121899024

  Commands leading to the command that caused the error were:
  CR FEATR COUNT  LBA_48  LH LM LL DV DC  Powered_Up_Time  Command/Feature_Name
  -- == -- == -- == == == -- -- -- -- --  ---------------  --------------------
  25 00 00 00 f0 00 00 07 44 08 10 e0 00     00:00:00.000  READ DMA EXT
  25 00 00 00 08 00 00 07 44 08 08 e0 00     00:00:00.000  READ DMA EXT
  25 00 00 00 08 00 00 07 44 08 00 e0 00     00:00:00.000  READ DMA EXT
  25 00 00 00 08 00 00 00 00 29 80 e0 00     00:00:00.000  READ DMA EXT
  25 00 00 00 10 00 00 00 00 2a 78 e0 00     00:00:00.000  READ DMA EXT

Error 2110 [61] occurred at disk power-on lifetime: 0 hours (0 days + 0 hours)
  When the command that caused the error occurred, the device was active or idle.

  After command completion occurred, registers were:
  ER -- ST COUNT  LBA_48  LH LM LL DV DC
  -- -- -- == -- == == == -- -- -- -- --
  84 -- 51 00 f0 00 00 00 00 29 88 e0 00  Error: ICRC, ABRT 240 sectors at LBA = 0x00002988 = 10632

  Commands leading to the command that caused the error were:
  CR FEATR COUNT  LBA_48  LH LM LL DV DC  Powered_Up_Time  Command/Feature_Name
  -- == -- == -- == == == -- -- -- -- --  ---------------  --------------------
  25 00 00 00 f0 00 00 00 00 29 88 e0 00     00:00:00.000  READ DMA EXT
  25 00 00 00 70 00 00 00 00 08 10 e0 00     00:00:00.000  READ DMA EXT
  25 00 00 00 08 00 00 00 00 08 08 e0 00     00:00:00.000  READ DMA EXT
  25 00 00 00 08 00 00 00 00 08 00 e0 00     00:00:00.000  READ DMA EXT
  25 00 00 00 02 00 00 00 00 08 02 e0 00     00:00:00.000  READ DMA EXT

Error 2109 [60] occurred at disk power-on lifetime: 0 hours (0 days + 0 hours)
  When the command that caused the error occurred, the device was active or idle.

  After command completion occurred, registers were:
  ER -- ST COUNT  LBA_48  LH LM LL DV DC
  -- -- -- == -- == == == -- -- -- -- --
  84 -- 51 00 18 00 00 0e 80 08 18 e0 00  Error: ICRC, ABRT 24 sectors at LBA = 0x0e800818 = 243271704

  Commands leading to the command that caused the error were:
  CR FEATR COUNT  LBA_48  LH LM LL DV DC  Powered_Up_Time  Command/Feature_Name
  -- == -- == -- == == == -- -- -- -- --  ---------------  --------------------
  35 00 00 00 18 00 00 0e 80 08 18 e0 00     00:00:00.000  WRITE DMA EXT
  35 00 00 00 10 00 00 0e 40 08 70 e0 00     00:00:00.000  WRITE DMA EXT
  35 00 00 00 08 00 00 0e 40 08 60 e0 00     00:00:00.000  WRITE DMA EXT
  35 00 00 00 10 00 00 0e 40 08 48 e0 00     00:00:00.000  WRITE DMA EXT
  35 00 00 00 30 00 00 0e 40 08 08 e0 00     00:00:00.000  WRITE DMA EXT

Error 2108 [59] occurred at disk power-on lifetime: 0 hours (0 days + 0 hours)
  When the command that caused the error occurred, the device was active or idle.

  After command completion occurred, registers were:
  ER -- ST COUNT  LBA_48  LH LM LL DV DC
  -- -- -- == -- == == == -- -- -- -- --
  84 -- 51 00 50 00 00 0e 00 08 28 e0 00  Error: ICRC, ABRT 80 sectors at LBA = 0x0e000828 = 234883112

  Commands leading to the command that caused the error were:
  CR FEATR COUNT  LBA_48  LH LM LL DV DC  Powered_Up_Time  Command/Feature_Name
  -- == -- == -- == == == -- -- -- -- --  ---------------  --------------------
  35 00 00 00 50 00 00 0e 00 08 28 e0 00     00:00:00.000  WRITE DMA EXT
  ef 00 03 00 46 00 00 00 00 00 00 a0 00     00:00:00.000  SET FEATURES [Set transfer mode]
  ff 00 d5 00 01 00 00 00 00 00 01 00 04     00:00:00.000  [VENDOR SPECIFIC]
  35 00 00 00 50 00 00 0e 00 08 28 e0 00     00:00:00.000  WRITE DMA EXT
  ef 00 03 00 46 00 00 00 00 00 00 a0 00     00:00:00.000  SET FEATURES [Set transfer mode]

SMART Extended Self-test Log Version: 1 (1 sectors)
Num  Test_Description    Status                  Remaining  LifeTime(hours)  LBA_of_first_error
# 1  Short offline       Completed without error       00%      6890         -

SMART Selective self-test log data structure revision number 0
Note: revision number not 1 implies that no selective self-test has ever been run
 SPAN  MIN_LBA  MAX_LBA  CURRENT_TEST_STATUS
    1        0        0  Not_testing
    2        0        0  Not_testing
    3        0        0  Not_testing
    4        0        0  Not_testing
    5        0        0  Not_testing
Selective self-test flags (0x0):
  After scanning selected spans, do NOT read-scan remainder of disk.
If Selective self-test is pending on power-up, resume after 0 minute delay.

SCT Commands not supported

Device Statistics (GP Log 0x04)
Page  Offset Size        Value Flags Description
0x01  =====  =               =  ===  == General Statistics (rev 1) ==
0x01  0x008  4            1808  ---  Lifetime Power-On Resets
0x01  0x010  4            7714  ---  Power-on Hours
0x01  0x018  6     13047961747  ---  Logical Sectors Written
0x01  0x028  6     12964593689  ---  Logical Sectors Read
0x04  =====  =               =  ===  == General Errors Statistics (rev 1) ==
0x04  0x008  4               0  ---  Number of Reported Uncorrectable Errors
0x05  =====  =               =  ===  == Temperature Statistics (rev 1) ==
0x05  0x008  1              33  ---  Current Temperature
0x05  0x020  1              33  ---  Highest Temperature
0x05  0x028  1              33  ---  Lowest Temperature
0x06  =====  =               =  ===  == Transport Statistics (rev 1) ==
0x06  0x008  4            4355  ---  Number of Hardware Resets
0x06  0x018  4            2124  ---  Number of Interface CRC Errors
0x07  =====  =               =  ===  == Solid State Device Statistics (rev 1) ==
0x07  0x008  1               2  ---  Percentage Used Endurance Indicator
                                |||_ C monitored condition met
                                ||__ D supports DSN
                                |___ N normalized value

Pending Defects log (GP Log 0x0c) not supported

SATA Phy Event Counters (GP Log 0x11)
ID      Size     Value  Description
0x0001  2            0  Command failed due to ICRC error
0x0003  2            0  R_ERR response for device-to-host data FIS
0x0004  2            0  R_ERR response for host-to-device data FIS
0x0006  2            0  R_ERR response for device-to-host non-data FIS
0x0007  2            0  R_ERR response for host-to-device non-data FIS
0x0008  2            0  Device-to-host non-data FIS retries
0x0009  4           10  Transition from drive PhyRdy to drive PhyNRdy
0x000a  4           11  Device-to-host register FISes sent due to a COMRESET
0x000f  2            0  R_ERR response for host-to-device data FIS, CRC
0x0010  2            0  R_ERR response for host-to-device data FIS, non-CRC
0x0012  2            0  R_ERR response for host-to-device non-data FIS, CRC
0x0013  2            0  R_ERR response for host-to-device non-data FIS, non-CRC



