smartctl 7.3 2022-02-28 r5338 [FreeBSD 13.2-RELEASE amd64] (local build)
Copyright (C) 2002-22, Bruce Allen, Christian Franke, www.smartmontools.org

=== START OF INFORMATION SECTION ===
Model Family:     Hitachi Travelstar 5K160
Device Model:     HTS541612J9SA00
Serial Number:    --
LU WWN Device Id: 5 000cca ...
Firmware Version: SBDOC70P
User Capacity:    120,034,123,776 bytes [120 GB]
Sector Size:      512 bytes logical/physical
Device is:        In smartctl database 7.3/5319
ATA Version is:   ATA/ATAPI-7 T13/1532D revision 1
Local Time is:    Sat Sep  9 23:14:49 2023    
SMART support is: Available - device has SMART capability.
SMART support is: Enabled
AAM feature is:   Disabled
APM level is:     128 (minimum power consumption without standby)
Rd look-ahead is: Enabled
Write cache is:   Enabled
DSN feature is:   Unavailable
ATA Security is:  Disabled, frozen [SEC2]
Wt Cache Reorder: Unavailable

=== START OF READ SMART DATA SECTION ===
SMART overall-health self-assessment test result: PASSED

General SMART Values:
Offline data collection status:  (0x00)	Offline data collection activity
					was never started.
					Auto Offline Data Collection: Disabled.
Self-test execution status:      (   0)	The previous self-test routine completed
					without error or no self-test has ever 
					been run.
Total time to complete Offline 
data collection: 		(  645) seconds.
Offline data collection
capabilities: 			 (0x5b) SMART execute Offline immediate.
					Auto Offline data collection on/off support.
					Suspend Offline collection upon new
					command.
					Offline surface scan supported.
					Self-test supported.
					No Conveyance Self-test supported.
					Selective Self-test supported.
SMART capabilities:            (0x0003)	Saves SMART data before entering
					power-saving mode.
					Supports SMART auto save timer.
Error logging capability:        (0x01)	Error logging supported.
					General Purpose Logging supported.
Short self-test routine 
recommended polling time: 	 (   2) minutes.
Extended self-test routine
recommended polling time: 	 (  73) minutes.

SMART Attributes Data Structure revision number: 16
Vendor Specific SMART Attributes with Thresholds:
ID# ATTRIBUTE_NAME          FLAGS    VALUE WORST THRESH FAIL RAW_VALUE
  1 Raw_Read_Error_Rate     PO-R--   100   100   062    -    0
  2 Throughput_Performance  P-S---   100   100   040    -    0
  3 Spin_Up_Time            POS---   063   063   033    -    1
  4 Start_Stop_Count        -O--C-   094   094   000    -    9949
  5 Reallocated_Sector_Ct   PO--CK   100   100   005    -    0
  7 Seek_Error_Rate         PO-R--   100   100   067    -    0
  8 Seek_Time_Performance   P-S---   100   100   040    -    0
  9 Power_On_Hours          -O--C-   075   075   000    -    11268
 10 Spin_Retry_Count        PO--C-   100   100   060    -    0
 12 Power_Cycle_Count       -O--CK   097   097   000    -    5578
191 G-Sense_Error_Rate      -O-R--   100   100   000    -    0
192 Power-Off_Retract_Count -O--CK   098   098   000    -    443
193 Load_Cycle_Count        -O--C-   043   043   000    -    578882
194 Temperature_Celsius     -O----   141   141   000    -    39 (Min/Max 14/60)
196 Reallocated_Event_Count -O--CK   100   100   000    -    40
197 Current_Pending_Sector  -O---K   100   100   000    -    0
198 Offline_Uncorrectable   ---R--   100   100   000    -    0
199 UDMA_CRC_Error_Count    -O-R--   200   253   000    -    24026
223 Load_Retry_Count        -O-R--   093   093   000    -    262147
                            ||||||_ K auto-keep
                            |||||__ C event count
                            ||||___ R error rate
                            |||____ S speed/performance
                            ||_____ O updated online
                            |______ P prefailure warning

General Purpose Log Directory Version 1
SMART           Log Directory Version 1 [multi-sector log support]
Address    Access  R/W   Size  Description
0x00       GPL,SL  R/O      1  Log Directory
0x01           SL  R/O      1  Summary SMART error log
0x02           SL  R/O      1  Comprehensive SMART error log
0x03       GPL     R/O      1  Ext. Comprehensive SMART error log
0x06           SL  R/O      1  SMART self-test log
0x07       GPL     R/O      1  Extended self-test log
0x09           SL  R/W      1  Selective self-test log
0x10       GPL     R/O      1  NCQ Command Error log
0x11       GPL     R/O      1  SATA Phy Event Counters log
0x80-0x9f  GPL,SL  R/W     16  Host vendor specific log

SMART Extended Comprehensive Error Log Version: 1 (1 sectors)
Device Error Count: 24247 (device log contains only the most recent 4 errors)
	CR     = Command Register
	FEATR  = Features Register
	COUNT  = Count (was: Sector Count) Register
	LBA_48 = Upper bytes of LBA High/Mid/Low Registers ]  ATA-8
	LH     = LBA High (was: Cylinder High) Register    ]   LBA
	LM     = LBA Mid (was: Cylinder Low) Register      ] Register
	LL     = LBA Low (was: Sector Number) Register     ]
	DV     = Device (was: Device/Head) Register
	DC     = Device Control Register
	ER     = Error register
	ST     = Status register
Powered_Up_Time is measured from power on, and printed as
DDd+hh:mm:SS.sss where DD=days, hh=hours, mm=minutes,
SS=sec, and sss=millisec. It "wraps" after 49.710 days.

Error 24247 [2] occurred at disk power-on lifetime: 11080 hours (461 days + 16 hours)
  When the command that caused the error occurred, the device was active or idle.

  After command completion occurred, registers were:
  ER -- ST COUNT  LBA_48  LH LM LL DV DC
  -- -- -- == -- == == == -- -- -- -- --
  84 -- 51 00 01 00 00 00 00 00 01 a0 00  Error: ICRC, ABRT at LBA = 0x00000001 = 1

  Commands leading to the command that caused the error were:
  CR FEATR COUNT  LBA_48  LH LM LL DV DC  Powered_Up_Time  Command/Feature_Name
  -- == -- == -- == == == -- -- -- -- --  ---------------  --------------------
  61 0a 00 00 01 00 00 00 00 00 01 a0 ff     02:19:47.600  WRITE FPDMA QUEUED
  61 0a 00 09 80 00 00 08 9a 6f b8 48 ff     02:19:47.600  WRITE FPDMA QUEUED
  61 0a 00 00 a0 00 00 08 9a 5f 28 40 08     02:19:47.000  WRITE FPDMA QUEUED
  61 06 10 00 98 00 00 08 9a 69 28 40 08     02:19:47.000  WRITE FPDMA QUEUED
  61 0a 00 00 90 00 00 08 9a 6f 38 40 08     02:19:47.000  WRITE FPDMA QUEUED

Error 24246 [1] occurred at disk power-on lifetime: 11080 hours (461 days + 16 hours)
  When the command that caused the error occurred, the device was active or idle.

  After command completion occurred, registers were:
  ER -- ST COUNT  LBA_48  LH LM LL DV DC
  -- -- -- == -- == == == -- -- -- -- --
  84 -- 51 00 a0 00 00 08 9a 68 89 48 00  Error: ICRC, ABRT at LBA = 0x089a6889 = 144337033

  Commands leading to the command that caused the error were:
  CR FEATR COUNT  LBA_48  LH LM LL DV DC  Powered_Up_Time  Command/Feature_Name
  -- == -- == -- == == == -- -- -- -- --  ---------------  --------------------
  61 06 08 00 a0 00 00 08 98 12 00 40 08     02:19:46.200  WRITE FPDMA QUEUED
  61 0a 00 00 78 00 00 08 98 08 00 40 08     02:19:46.200  WRITE FPDMA QUEUED
  61 08 c8 00 70 00 00 08 9a 7f 38 40 08     02:19:46.200  WRITE FPDMA QUEUED
  61 06 00 00 68 00 00 08 9a 79 38 40 08     02:19:46.200  WRITE FPDMA QUEUED
  61 0a 00 00 60 00 00 08 9a 6f 38 40 08     02:19:46.200  WRITE FPDMA QUEUED

Error 24245 [0] occurred at disk power-on lifetime: 11080 hours (461 days + 16 hours)
  When the command that caused the error occurred, the device was active or idle.

  After command completion occurred, registers were:
  ER -- ST COUNT  LBA_48  LH LM LL DV DC
  -- -- -- == -- == == == -- -- -- -- --
  84 -- 51 00 01 00 00 00 00 00 01 a0 00  Error: ICRC, ABRT at LBA = 0x00000001 = 1

  Commands leading to the command that caused the error were:
  CR FEATR COUNT  LBA_48  LH LM LL DV DC  Powered_Up_Time  Command/Feature_Name
  -- == -- == -- == == == -- -- -- -- --  ---------------  --------------------
  61 05 40 00 01 00 00 00 00 00 01 a0 ff     02:19:44.500  WRITE FPDMA QUEUED
  61 05 40 01 e0 00 00 08 9c 66 20 48 ff     02:19:44.500  WRITE FPDMA QUEUED
  61 05 40 00 88 00 00 08 9c 70 08 40 08     02:19:44.500  WRITE FPDMA QUEUED
  61 02 c8 00 80 00 00 08 9c 6d 40 40 08     02:19:44.500  WRITE FPDMA QUEUED
  61 05 40 00 78 00 00 08 9c 68 00 40 08     02:19:44.500  WRITE FPDMA QUEUED

Error 24244 [3] occurred at disk power-on lifetime: 11080 hours (461 days + 16 hours)
  When the command that caused the error occurred, the device was active or idle.

  After command completion occurred, registers were:
  ER -- ST COUNT  LBA_48  LH LM LL DV DC
  -- -- -- == -- == == == -- -- -- -- --
  84 -- 51 04 b0 00 00 08 9c 70 99 48 00  Error: ICRC, ABRT at LBA = 0x089c7099 = 144470169

  Commands leading to the command that caused the error were:
  CR FEATR COUNT  LBA_48  LH LM LL DV DC  Powered_Up_Time  Command/Feature_Name
  -- == -- == -- == == == -- -- -- -- --  ---------------  --------------------
  61 02 a0 00 a0 00 00 08 9c 85 60 40 08     02:19:43.500  WRITE FPDMA QUEUED
  61 05 40 00 98 00 00 08 9c 60 00 40 08     02:19:43.500  WRITE FPDMA QUEUED
  61 02 c0 00 90 00 00 08 9c 65 40 40 08     02:19:43.500  WRITE FPDMA QUEUED
  61 05 40 00 88 00 00 08 9c 68 00 40 08     02:19:43.500  WRITE FPDMA QUEUED
  61 02 c8 00 80 00 00 08 9c 6d 40 40 08     02:19:43.500  WRITE FPDMA QUEUED

SMART Extended Self-test Log Version: 1 (1 sectors)
No self-tests have been logged.  [To run self-tests, use: smartctl -t]

SMART Selective self-test log data structure revision number 1
 SPAN  MIN_LBA  MAX_LBA  CURRENT_TEST_STATUS
    1        0        0  Not_testing
    2        0        0  Not_testing
    3        0        0  Not_testing
    4        0        0  Not_testing
    5        0        0  Not_testing
Selective self-test flags (0x0):
  After scanning selected spans, do NOT read-scan remainder of disk.
If Selective self-test is pending on power-up, resume after 0 minute delay.

SCT Commands not supported

Device Statistics (GP/SMART Log 0x04) not supported

Pending Defects log (GP Log 0x0c) not supported

SATA Phy Event Counters (GP Log 0x11)
ID      Size     Value  Description
0x0001  2            0  Command failed due to ICRC error
0x0009  2            6  Transition from drive PhyRdy to drive PhyNRdy
0x000a  2            3  Device-to-host register FISes sent due to a COMRESET
0x000b  2            0  CRC errors within host-to-device FIS
0x000d  2            0  Non-CRC errors within host-to-device FIS

