smartctl 7.1 2019-12-30 r5022 [i386-unknown-openbsd6.8] (local build)
Copyright (C) 2002-19, Bruce Allen, Christian Franke, www.smartmontools.org

=== START OF INFORMATION SECTION ===
Device Model:     Dogfish SSD 64GB
Serial Number:    --
LU WWN Device Id: 0 000000 ...
Firmware Version: 1.00
User Capacity:    64,023,257,088 bytes [64.0 GB]
Sector Size:      512 bytes logical/physical
Rotation Rate:    Solid State Device
Form Factor:      2.5 inches
Device is:        Not in smartctl database [for details use: -P showall]
ATA Version is:   ACS-4 (minor revision not indicated)
SATA Version is:  SATA 3.2, 6.0 Gb/s (current: 1.5 Gb/s)
Local Time is:    Wed Oct 21 16:58:48 2020 AEDT
SMART support is: Available - device has SMART capability.
SMART support is: Enabled

=== START OF READ SMART DATA SECTION ===
SMART Status not supported: Incomplete response, ATA output registers missing
SMART overall-health self-assessment test result: PASSED
Warning: This result is based on an Attribute check.

General SMART Values:
Offline data collection status:  (0x00)	Offline data collection activity
					was never started.
					Auto Offline Data Collection: Disabled.
Self-test execution status:      (   0)	The previous self-test routine completed
					without error or no self-test has ever 
					been run.
Total time to complete Offline 
data collection: 		(65535) seconds.
Offline data collection
capabilities: 			 (0x79) SMART execute Offline immediate.
					No Auto Offline data collection support.
					Suspend Offline collection upon new
					command.
					Offline surface scan supported.
					Self-test supported.
					Conveyance Self-test supported.
					Selective Self-test supported.
SMART capabilities:            (0x0003)	Saves SMART data before entering
					power-saving mode.
					Supports SMART auto save timer.
Error logging capability:        (0x01)	Error logging supported.
					General Purpose Logging supported.
Short self-test routine 
recommended polling time: 	 (   2) minutes.
Extended self-test routine
recommended polling time: 	 (  30) minutes.
Conveyance self-test routine
recommended polling time: 	 (   6) minutes.

SMART Attributes Data Structure revision number: 16
Vendor Specific SMART Attributes with Thresholds:
ID# ATTRIBUTE_NAME          FLAG     VALUE WORST THRESH TYPE      UPDATED  WHEN_FAILED RAW_VALUE
  1 Raw_Read_Error_Rate     0x000b   100   100   050    Pre-fail  Always       -       0
  5 Reallocated_Sector_Ct   0x0000   100   100   000    Old_age   Offline      -       0
  9 Power_On_Hours          0x0032   100   100   000    Old_age   Always       -       251
 12 Power_Cycle_Count       0x0000   100   100   000    Old_age   Offline      -       102
160 Unknown_Attribute       0x0000   100   100   000    Old_age   Offline      -       0
161 Unknown_Attribute       0x0000   100   100   000    Old_age   Offline      -       0
163 Unknown_Attribute       0x0000   100   100   000    Old_age   Offline      -       0
165 Unknown_Attribute       0x0000   100   100   000    Old_age   Offline      -       3
166 Unknown_Attribute       0x0000   100   100   000    Old_age   Offline      -       0
167 Unknown_Attribute       0x0000   100   100   000    Old_age   Offline      -       2
192 Power-Off_Retract_Count 0x0000   100   100   000    Old_age   Offline      -       8
194 Temperature_Celsius     0x0000   100   100   000    Old_age   Offline      -       33
195 Hardware_ECC_Recovered  0x0012   100   100   000    Old_age   Always       -       0
196 Reallocated_Event_Count 0x0000   100   100   000    Old_age   Offline      -       0
199 UDMA_CRC_Error_Count    0x0000   100   100   000    Old_age   Offline      -       0
241 Total_LBAs_Written      0x0000   100   100   000    Old_age   Offline      -       2076
242 Total_LBAs_Read         0x0000   100   100   000    Old_age   Offline      -       1765

SMART Error Log Version: 1
No Errors Logged

SMART Self-test log structure revision number 1
No self-tests have been logged.  [To run self-tests, use: smartctl -t]

SMART Selective self-test log data structure revision number 0
Note: revision number not 1 implies that no selective self-test has ever been run
 SPAN  MIN_LBA  MAX_LBA  CURRENT_TEST_STATUS
    1        0        0  Not_testing
    2        0        0  Not_testing
    3        0        0  Not_testing
    4        0        0  Not_testing
    5        0        0  Not_testing
Selective self-test flags (0x0):
  After scanning selected spans, do NOT read-scan remainder of disk.
If Selective self-test is pending on power-up, resume after 0 minute delay.

