smartctl 7.3 2022-02-28 r5338 [OpenBSD 7.2 amd64] (local build)
Copyright (C) 2002-22, Bruce Allen, Christian Franke, www.smartmontools.org

=== START OF INFORMATION SECTION ===
Model Family:     Silicon Motion based SSDs
Device Model:     KingDian S280 240GB
Serial Number:    --
Firmware Version: Q0526A
User Capacity:    240,057,409,536 bytes [240 GB]
Sector Size:      512 bytes logical/physical
Rotation Rate:    Solid State Device
TRIM Command:     Available, deterministic, zeroed
Device is:        In smartctl database 7.3/5319
ATA Version is:   ACS-2 (minor revision not indicated)
SATA Version is:  SATA 3.1, 6.0 Gb/s (current: 6.0 Gb/s)
Local Time is:    Fri Jan  6 12:24:01 2023 CET
SMART support is: Available - device has SMART capability.
SMART support is: Enabled

=== START OF READ SMART DATA SECTION ===
SMART Status not supported: Incomplete response, ATA output registers missing
SMART overall-health self-assessment test result: PASSED
Warning: This result is based on an Attribute check.

General SMART Values:
Offline data collection status:  (0x00)	Offline data collection activity
					was never started.
					Auto Offline Data Collection: Disabled.
Self-test execution status:      (   0)	The previous self-test routine completed
					without error or no self-test has ever 
					been run.
Total time to complete Offline 
data collection: 		(    0) seconds.
Offline data collection
capabilities: 			 (0x71) SMART execute Offline immediate.
					No Auto Offline data collection support.
					Suspend Offline collection upon new
					command.
					No Offline surface scan supported.
					Self-test supported.
					Conveyance Self-test supported.
					Selective Self-test supported.
SMART capabilities:            (0x0002)	Does not save SMART data before
					entering power-saving mode.
					Supports SMART auto save timer.
Error logging capability:        (0x01)	Error logging supported.
					General Purpose Logging supported.
Short self-test routine 
recommended polling time: 	 (   1) minutes.
Extended self-test routine
recommended polling time: 	 (   2) minutes.
Conveyance self-test routine
recommended polling time: 	 (   1) minutes.
SCT capabilities: 	       (0x0035)	SCT Status supported.
					SCT Feature Control supported.
					SCT Data Table supported.

SMART Attributes Data Structure revision number: 1
Vendor Specific SMART Attributes with Thresholds:
ID# ATTRIBUTE_NAME          FLAG     VALUE WORST THRESH TYPE      UPDATED  WHEN_FAILED RAW_VALUE
  1 Raw_Read_Error_Rate     0x0000   100   100   000    Old_age   Offline      -       0
  5 Reallocated_Sector_Ct   0x0000   100   100   000    Old_age   Offline      -       0
  9 Power_On_Hours          0x0000   100   100   000    Old_age   Offline      -       3083
 12 Power_Cycle_Count       0x0000   100   100   000    Old_age   Offline      -       1044
160 Uncorrectable_Error_Cnt 0x0000   100   100   000    Old_age   Offline      -       0
161 Valid_Spare_Block_Cnt   0x0000   100   100   000    Old_age   Offline      -       75
163 Initial_Bad_Block_Count 0x0000   100   100   000    Old_age   Offline      -       21
164 Total_Erase_Count       0x0000   100   100   000    Old_age   Offline      -       23671
165 Max_Erase_Count         0x0000   100   100   000    Old_age   Offline      -       81
166 Min_Erase_Count         0x0000   100   100   000    Old_age   Offline      -       2
167 Average_Erase_Count     0x0000   100   100   000    Old_age   Offline      -       13
168 Max_Erase_Count_of_Spec 0x0000   100   100   000    Old_age   Offline      -       1000
169 Remaining_Lifetime_Perc 0x0000   100   100   000    Old_age   Offline      -       99
175 Program_Fail_Count_Chip 0x0000   100   100   000    Old_age   Offline      -       0
176 Erase_Fail_Count_Chip   0x0000   100   100   000    Old_age   Offline      -       0
177 Wear_Leveling_Count     0x0000   100   100   050    Old_age   Offline      -       332482
178 Runtime_Invalid_Blk_Cnt 0x0000   100   100   000    Old_age   Offline      -       0
181 Program_Fail_Cnt_Total  0x0000   100   100   000    Old_age   Offline      -       0
182 Erase_Fail_Count_Total  0x0000   100   100   000    Old_age   Offline      -       0
192 Power-Off_Retract_Count 0x0000   100   100   000    Old_age   Offline      -       54
194 Temperature_Celsius     0x0000   100   100   000    Old_age   Offline      -       49
195 Hardware_ECC_Recovered  0x0000   100   100   000    Old_age   Offline      -       0
196 Reallocated_Event_Count 0x0000   100   100   016    Old_age   Offline      -       0
197 Current_Pending_Sector  0x0000   100   100   000    Old_age   Offline      -       0
198 Offline_Uncorrectable   0x0000   100   100   000    Old_age   Offline      -       0
199 UDMA_CRC_Error_Count    0x0000   100   100   050    Old_age   Offline      -       0
232 Available_Reservd_Space 0x0000   100   100   000    Old_age   Offline      -       100
241 Host_Writes_32MiB       0x0000   100   100   000    Old_age   Offline      -       270352
242 Host_Reads_32MiB        0x0000   100   100   000    Old_age   Offline      -       76704
245 TLC_Writes_32MiB        0x0000   100   100   000    Old_age   Offline      -       94684

SMART Error Log Version: 1
No Errors Logged

SMART Self-test log structure revision number 0
Warning: ATA Specification requires self-test log structure revision number = 1
No self-tests have been logged.  [To run self-tests, use: smartctl -t]

SMART Selective self-test log data structure revision number 1
 SPAN  MIN_LBA  MAX_LBA  CURRENT_TEST_STATUS
    1        0        0  Not_testing
    2        0        0  Not_testing
    3        0        0  Not_testing
    4        0        0  Not_testing
    5        0        0  Not_testing
    6        0    65535  Read_scanning was never started
Selective self-test flags (0x0):
  After scanning selected spans, do NOT read-scan remainder of disk.
If Selective self-test is pending on power-up, resume after 0 minute delay.



