smartctl 7.4 2023-08-01 r5530 [FreeBSD 15.0-CURRENT amd64] (local build)
Copyright (C) 2002-23, Bruce Allen, Christian Franke, www.smartmontools.org

=== START OF INFORMATION SECTION ===
Device Model:     NT-256 2242
Serial Number:    --
LU WWN Device Id: 5 000000 ...
Firmware Version: SN13109
User Capacity:    256,060,514,304 bytes [256 GB]
Sector Size:      512 bytes logical/physical
Rotation Rate:    Solid State Device
Form Factor:      2.5 inches
TRIM Command:     Available, deterministic, zeroed
Device is:        Not in smartctl database 7.3/5528
ATA Version is:   ACS-4 (minor revision not indicated)
SATA Version is:  SATA 3.2, 6.0 Gb/s (current: 6.0 Gb/s)
Local Time is:    Thu Apr  3 20:44:49 2025 -03
SMART support is: Available - device has SMART capability.
SMART support is: Enabled
AAM feature is:   Unavailable
APM feature is:   Unavailable
Rd look-ahead is: Enabled
Write cache is:   Enabled
DSN feature is:   Unavailable
ATA Security is:  Disabled, frozen [SEC2]
Wt Cache Reorder: Enabled

=== START OF READ SMART DATA SECTION ===
SMART overall-health self-assessment test result: PASSED

General SMART Values:
Offline data collection status:  (0x02)	Offline data collection activity
					was completed without error.
					Auto Offline Data Collection: Disabled.
Self-test execution status:      (   0)	The previous self-test routine completed
					without error or no self-test has ever 
					been run.
Total time to complete Offline 
data collection: 		(   33) seconds.
Offline data collection
capabilities: 			 (0x7b) SMART execute Offline immediate.
					Auto Offline data collection on/off support.
					Suspend Offline collection upon new
					command.
					Offline surface scan supported.
					Self-test supported.
					Conveyance Self-test supported.
					Selective Self-test supported.
SMART capabilities:            (0x0003)	Saves SMART data before entering
					power-saving mode.
					Supports SMART auto save timer.
Error logging capability:        (0x01)	Error logging supported.
					General Purpose Logging supported.
Short self-test routine 
recommended polling time: 	 (   2) minutes.
Extended self-test routine
recommended polling time: 	 (  85) minutes.
Conveyance self-test routine
recommended polling time: 	 (   2) minutes.
SCT capabilities: 	       (0x0031)	SCT Status supported.
					SCT Feature Control supported.
					SCT Data Table supported.

SMART Attributes Data Structure revision number: 20
Vendor Specific SMART Attributes with Thresholds:
ID# ATTRIBUTE_NAME          FLAGS    VALUE WORST THRESH FAIL RAW_VALUE
  5 Reallocated_Sector_Ct   PO--C-   100   100   050    -    16
  9 Power_On_Hours          -O--C-   100   100   000    -    11725
 12 Power_Cycle_Count       -O--C-   100   100   000    -    306
167 Unknown_Attribute       -O---K   100   100   000    -    0
168 Unknown_Attribute       -O--C-   100   100   000    -    161
169 Unknown_Attribute       PO--C-   100   100   010    -    68720787472
173 Unknown_Attribute       -O--C-   200   200   000    -    1718074999946
175 Program_Fail_Count_Chip -O---K   100   100   010    -    0
180 Unused_Rsvd_Blk_Cnt_Tot PO--CK   096   096   000    -    10
192 Power-Off_Retract_Count -O--C-   100   100   000    -    207
194 Temperature_Celsius     -O---K   038   038   000    -    38 (Min/Max 26/47)
231 Unknown_SSD_Attribute   PO---K   023   023   005    -    845
233 Media_Wearout_Indicator PO---K   100   100   000    -    164581
234 Unknown_Attribute       -O--CK   100   100   005    -    69977280
241 Total_LBAs_Written      -O--CK   100   100   000    -    18493
242 Total_LBAs_Read         -O--CK   100   100   000    -    3704
                            ||||||_ K auto-keep
                            |||||__ C event count
                            ||||___ R error rate
                            |||____ S speed/performance
                            ||_____ O updated online
                            |______ P prefailure warning

General Purpose Log Directory Version 1
SMART           Log Directory Version 1 [multi-sector log support]
Address    Access  R/W   Size  Description
0x00       GPL,SL  R/O      1  Log Directory
0x01           SL  R/O      1  Summary SMART error log
0x02           SL  R/O     51  Comprehensive SMART error log
0x03       GPL     R/O     64  Ext. Comprehensive SMART error log
0x04       GPL,SL  R/O      8  Device Statistics log
0x06           SL  R/O      1  SMART self-test log
0x07       GPL     R/O      1  Extended self-test log
0x09           SL  R/W      1  Selective self-test log
0x10       GPL     R/O      1  NCQ Command Error log
0x11       GPL     R/O      1  SATA Phy Event Counters log
0x30       GPL,SL  R/O      9  IDENTIFY DEVICE data log
0x80-0x9f  GPL,SL  R/W     16  Host vendor specific log
0xe0       GPL,SL  R/W      1  SCT Command/Status
0xe1       GPL,SL  R/W      1  SCT Data Transfer

SMART Extended Comprehensive Error Log Version: 1 (64 sectors)
Device Error Count: 161
	CR     = Command Register
	FEATR  = Features Register
	COUNT  = Count (was: Sector Count) Register
	LBA_48 = Upper bytes of LBA High/Mid/Low Registers ]  ATA-8
	LH     = LBA High (was: Cylinder High) Register    ]   LBA
	LM     = LBA Mid (was: Cylinder Low) Register      ] Register
	LL     = LBA Low (was: Sector Number) Register     ]
	DV     = Device (was: Device/Head) Register
	DC     = Device Control Register
	ER     = Error register
	ST     = Status register
Powered_Up_Time is measured from power on, and printed as
DDd+hh:mm:SS.sss where DD=days, hh=hours, mm=minutes,
SS=sec, and sss=millisec. It "wraps" after 49.710 days.

Error 161 [160] occurred at disk power-on lifetime: 5310 hours (221 days + 6 hours)
  When the command that caused the error occurred, the device was in an unknown state.

  After command completion occurred, registers were:
  ER -- ST COUNT  LBA_48  LH LM LL DV DC
  -- -- -- == -- == == == -- -- -- -- --
  40 -- 41 00 20 00 00 00 b0 66 c0 40 08  Error: UNC at LBA = 0x00b066c0 = 11560640

  Commands leading to the command that caused the error were:
  CR FEATR COUNT  LBA_48  LH LM LL DV DC  Powered_Up_Time  Command/Feature_Name
  -- == -- == -- == == == -- -- -- -- --  ---------------  --------------------
  60 00 20 00 68 00 00 00 b0 66 d0 a0 80     19:10:46.100  READ FPDMA QUEUED
  2f 00 00 00 01 00 00 00 00 03 30 a0 80     19:10:45.500  READ LOG EXT
  2f 00 00 00 01 00 00 00 00 00 30 a0 80     19:10:45.500  READ LOG EXT
  2f 00 00 00 01 00 00 00 00 00 00 a0 80     19:10:45.500  READ LOG EXT
  2f 00 00 00 01 00 00 00 00 00 30 a0 80     19:10:45.500  READ LOG EXT

Error 160 [159] occurred at disk power-on lifetime: 5310 hours (221 days + 6 hours)
  When the command that caused the error occurred, the device was in an unknown state.

  After command completion occurred, registers were:
  ER -- ST COUNT  LBA_48  LH LM LL DV DC
  -- -- -- == -- == == == -- -- -- -- --
  40 -- 41 00 20 00 00 00 b0 66 c0 40 08  Error: UNC at LBA = 0x00b066c0 = 11560640

  Commands leading to the command that caused the error were:
  CR FEATR COUNT  LBA_48  LH LM LL DV DC  Powered_Up_Time  Command/Feature_Name
  -- == -- == -- == == == -- -- -- -- --  ---------------  --------------------
  60 00 20 00 c0 00 00 00 b0 66 d0 a0 80     19:10:45.500  READ FPDMA QUEUED
  ea 00 00 00 00 00 00 00 00 00 00 a0 80     19:10:44.400  FLUSH CACHE EXT
  ea 00 00 00 00 00 00 00 00 00 00 a0 80     19:10:44.400  FLUSH CACHE EXT
  ea 00 00 00 00 00 00 00 00 00 00 a0 80     19:10:44.400  FLUSH CACHE EXT
  ea 00 00 00 00 00 00 00 00 00 00 a0 80     19:10:43.800  FLUSH CACHE EXT

Error 159 [158] occurred at disk power-on lifetime: 2442 hours (101 days + 18 hours)
  When the command that caused the error occurred, the device was in an unknown state.

  After command completion occurred, registers were:
  ER -- ST COUNT  LBA_48  LH LM LL DV DC
  -- -- -- == -- == == == -- -- -- -- --
  40 -- 41 00 08 00 00 05 53 70 f0 40 08  Error: UNC at LBA = 0x055370f0 = 89354480

  Commands leading to the command that caused the error were:
  CR FEATR COUNT  LBA_48  LH LM LL DV DC  Powered_Up_Time  Command/Feature_Name
  -- == -- == -- == == == -- -- -- -- --  ---------------  --------------------
  60 00 08 00 e8 00 00 05 53 70 f0 40 80     12:54:32.000  READ FPDMA QUEUED
  2f 00 00 00 01 00 00 00 00 00 00 a0 80     12:54:31.400  READ LOG EXT
  ef 00 10 00 02 00 00 00 00 00 00 a0 80     12:54:31.400  SET FEATURES [Enable SATA feature]
  ec 00 00 00 00 00 00 00 00 00 00 a0 80     12:54:31.400  IDENTIFY DEVICE
  ef 00 03 00 46 00 00 00 00 00 00 a0 80     12:54:31.400  SET FEATURES [Set transfer mode]

Error 158 [157] occurred at disk power-on lifetime: 2442 hours (101 days + 18 hours)
  When the command that caused the error occurred, the device was in an unknown state.

  After command completion occurred, registers were:
  ER -- ST COUNT  LBA_48  LH LM LL DV DC
  -- -- -- == -- == == == -- -- -- -- --
  40 -- 41 00 b8 00 00 06 11 f8 78 40 08  Error: 

  Commands leading to the command that caused the error were:
  CR FEATR COUNT  LBA_48  LH LM LL DV DC  Powered_Up_Time  Command/Feature_Name
  -- == -- == -- == == == -- -- -- -- --  ---------------  --------------------
  00 00 00 00 00 00 00 05 53 70 f0 40 16     12:54:31.300  NOP [Abort queued commands]
  ea 00 00 00 00 00 00 00 00 00 00 a0 80     12:54:29.800  FLUSH CACHE EXT
  ea 00 00 00 00 00 00 00 00 00 00 a0 80     12:54:29.800  FLUSH CACHE EXT
  ea 00 00 00 00 00 00 00 00 00 00 a0 80     12:54:29.800  FLUSH CACHE EXT
  ea 00 00 00 00 00 00 00 00 00 00 a0 80     12:54:29.800  FLUSH CACHE EXT

Error 157 [156] occurred at disk power-on lifetime: 2442 hours (101 days + 18 hours)
  When the command that caused the error occurred, the device was in an unknown state.

  After command completion occurred, registers were:
  ER -- ST COUNT  LBA_48  LH LM LL DV DC
  -- -- -- == -- == == == -- -- -- -- --
  40 -- 41 00 08 00 00 05 53 70 f0 40 08  Error: UNC at LBA = 0x055370f0 = 89354480

  Commands leading to the command that caused the error were:
  CR FEATR COUNT  LBA_48  LH LM LL DV DC  Powered_Up_Time  Command/Feature_Name
  -- == -- == -- == == == -- -- -- -- --  ---------------  --------------------
  60 00 08 00 58 00 00 05 53 70 f0 a0 80     12:54:29.800  READ FPDMA QUEUED
  ea 00 00 00 00 00 00 00 00 00 00 a0 80     12:54:29.100  FLUSH CACHE EXT
  ea 00 00 00 00 00 00 00 00 00 00 a0 80     12:54:29.100  FLUSH CACHE EXT
  2f 00 00 00 01 00 00 00 00 00 00 a0 80     12:54:29.100  READ LOG EXT
  ef 00 10 00 02 00 00 00 00 00 00 a0 80     12:54:29.100  SET FEATURES [Enable SATA feature]

Error 156 [155] occurred at disk power-on lifetime: 2442 hours (101 days + 18 hours)
  When the command that caused the error occurred, the device was in an unknown state.

  After command completion occurred, registers were:
  ER -- ST COUNT  LBA_48  LH LM LL DV DC
  -- -- -- == -- == == == -- -- -- -- --
  40 -- 41 00 08 00 00 05 53 70 f0 40 08  Error: UNC at LBA = 0x055370f0 = 89354480

  Commands leading to the command that caused the error were:
  CR FEATR COUNT  LBA_48  LH LM LL DV DC  Powered_Up_Time  Command/Feature_Name
  -- == -- == -- == == == -- -- -- -- --  ---------------  --------------------
  60 00 08 00 80 00 00 05 53 70 f0 40 80     12:54:29.100  READ FPDMA QUEUED
  2f 00 00 00 01 00 00 00 00 00 00 a0 80     12:54:28.400  READ LOG EXT
  ef 00 10 00 02 00 00 00 00 00 00 a0 80     12:54:28.400  SET FEATURES [Enable SATA feature]
  ec 00 00 00 00 00 00 00 00 00 00 a0 80     12:54:28.400  IDENTIFY DEVICE
  ef 00 03 00 46 00 00 00 00 00 00 a0 80     12:54:28.400  SET FEATURES [Set transfer mode]

Error 155 [154] occurred at disk power-on lifetime: 2442 hours (101 days + 18 hours)
  When the command that caused the error occurred, the device was in an unknown state.

  After command completion occurred, registers were:
  ER -- ST COUNT  LBA_48  LH LM LL DV DC
  -- -- -- == -- == == == -- -- -- -- --
  40 -- 41 00 08 00 00 05 53 70 f0 40 08  Error: UNC at LBA = 0x055370f0 = 89354480

  Commands leading to the command that caused the error were:
  CR FEATR COUNT  LBA_48  LH LM LL DV DC  Powered_Up_Time  Command/Feature_Name
  -- == -- == -- == == == -- -- -- -- --  ---------------  --------------------
  60 00 08 00 40 00 00 05 53 70 f0 a0 80     12:54:28.400  READ FPDMA QUEUED
  ea 00 00 00 00 00 00 00 00 00 00 a0 80     12:54:27.700  FLUSH CACHE EXT
  ea 00 00 00 00 00 00 00 00 00 00 a0 80     12:54:27.700  FLUSH CACHE EXT
  ea 00 00 00 00 00 00 00 00 00 00 a0 80     12:54:27.700  FLUSH CACHE EXT
  ea 00 00 00 00 00 00 00 00 00 00 a0 80     12:54:27.700  FLUSH CACHE EXT

Error 154 [153] occurred at disk power-on lifetime: 2442 hours (101 days + 18 hours)
  When the command that caused the error occurred, the device was in an unknown state.

  After command completion occurred, registers were:
  ER -- ST COUNT  LBA_48  LH LM LL DV DC
  -- -- -- == -- == == == -- -- -- -- --
  40 -- 41 00 08 00 00 03 8e 4e 18 40 08  Error: UNC at LBA = 0x038e4e18 = 59657752

  Commands leading to the command that caused the error were:
  CR FEATR COUNT  LBA_48  LH LM LL DV DC  Powered_Up_Time  Command/Feature_Name
  -- == -- == -- == == == -- -- -- -- --  ---------------  --------------------
  60 00 08 00 20 00 00 03 8e 4e 18 a0 80     12:54:13.600  READ FPDMA QUEUED
  2f 00 00 00 01 00 00 00 00 00 00 a0 80     12:54:13.100  READ LOG EXT
  ef 00 10 00 02 00 00 00 00 00 00 a0 80     12:54:13.100  SET FEATURES [Enable SATA feature]
  ec 00 00 00 00 00 00 00 00 00 00 a0 80     12:54:13.100  IDENTIFY DEVICE
  ef 00 03 00 46 00 00 00 00 00 00 a0 80     12:54:13.100  SET FEATURES [Set transfer mode]

SMART Extended Self-test Log Version: 1 (1 sectors)
No self-tests have been logged.  [To run self-tests, use: smartctl -t]

SMART Selective self-test log data structure revision number 1
 SPAN  MIN_LBA  MAX_LBA  CURRENT_TEST_STATUS
    1        0        0  Not_testing
    2        0        0  Not_testing
    3        0        0  Not_testing
    4        0        0  Not_testing
    5        0        0  Not_testing
Selective self-test flags (0x0):
  After scanning selected spans, do NOT read-scan remainder of disk.
If Selective self-test is pending on power-up, resume after 0 minute delay.

SCT Status Version:                  3
SCT Version (vendor specific):       1 (0x0001)
Device State:                        Active (0)
Current Temperature:                    38 Celsius
Power Cycle Min/Max Temperature:      ?/40 Celsius
Lifetime    Min/Max Temperature:      ?/ ? Celsius
Under/Over Temperature Limit Count:   0/0

SCT Temperature History Version:     2
Temperature Sampling Period:         1 minute
Temperature Logging Interval:        1 minute
Min/Max recommended Temperature:     -127/127 Celsius
Min/Max Temperature Limit:           -127/127 Celsius
Temperature History Size (Index):    478 (146)

SCT Error Recovery Control command not supported

Device Statistics (GP Log 0x04)
Page  Offset Size        Value Flags Description
0x01  =====  =               =  ===  == General Statistics (rev 1) ==
0x01  0x008  4             306  ---  Lifetime Power-On Resets
0x01  0x010  4           11725  ---  Power-on Hours
0x01  0x018  6     38783620321  ---  Logical Sectors Written
0x01  0x020  6       802664457  ---  Number of Write Commands
0x01  0x028  6      7768991036  ---  Logical Sectors Read
0x01  0x030  6       179511459  ---  Number of Read Commands
0x01  0x038  6  10775213238604  ---  Date and Time TimeStamp
0x07  =====  =               =  ===  == Solid State Device Statistics (rev 1) ==
0x07  0x008  1             179  N--  Percentage Used Endurance Indicator
                                |||_ C monitored condition met
                                ||__ D supports DSN
                                |___ N normalized value

Pending Defects log (GP Log 0x0c) not supported

SATA Phy Event Counters (GP Log 0x11)
ID      Size     Value  Description
0x0001  2          161  Command failed due to ICRC error
0x0003  2            0  R_ERR response for device-to-host data FIS
0x0004  2            0  R_ERR response for host-to-device data FIS
0x0006  2            0  R_ERR response for device-to-host non-data FIS
0x0007  2            0  R_ERR response for host-to-device non-data FIS
0x0008  2            0  Device-to-host non-data FIS retries
0x0009  4            0  Transition from drive PhyRdy to drive PhyNRdy
0x000a  4           75  Device-to-host register FISes sent due to a COMRESET
0x000f  2            0  R_ERR response for host-to-device data FIS, CRC
0x0010  2            0  R_ERR response for host-to-device data FIS, non-CRC
0x0012  2            0  R_ERR response for host-to-device non-data FIS, CRC
0x0013  2            0  R_ERR response for host-to-device non-data FIS, non-CRC



