smartctl 7.2 2021-09-14 r5236 [FreeBSD 13.0-STABLE amd64] (local build)
Copyright (C) 2002-20, Bruce Allen, Christian Franke, www.smartmontools.org

=== START OF INFORMATION SECTION ===
Model Family:     Samsung based SSDs
Device Model:     SAMSUNG SSD PM810 2.5" 7mm 256GB
Serial Number:    --
LU WWN Device Id: 5 0000f0 ...
Firmware Version: AXM06D1Q
User Capacity:    256,060,514,304 bytes [256 GB]
Sector Size:      512 bytes logical/physical
Rotation Rate:    Solid State Device
TRIM Command:     Available
Device is:        In smartctl database [for details use: -P show]
ATA Version is:   ATA8-ACS, ATA/ATAPI-7 T13/1532D revision 1
SATA Version is:  SATA 2.6, 3.0 Gb/s (current: 3.0 Gb/s)
Local Time is:    Tue Feb  1 09:38:46 2022 GMT
SMART support is: Available - device has SMART capability.
SMART support is: Enabled
AAM feature is:   Disabled
APM feature is:   Unavailable
Rd look-ahead is: Enabled
Write cache is:   Enabled
DSN feature is:   Unavailable
ATA Security is:  Disabled, frozen [SEC2]
Wt Cache Reorder: Unavailable

=== START OF READ SMART DATA SECTION ===
SMART overall-health self-assessment test result: PASSED

General SMART Values:
Offline data collection status:  (0x00)	Offline data collection activity
					was never started.
					Auto Offline Data Collection: Disabled.
Self-test execution status:      (   0)	The previous self-test routine completed
					without error or no self-test has ever 
					been run.
Total time to complete Offline 
data collection: 		( 1680) seconds.
Offline data collection
capabilities: 			 (0x53) SMART execute Offline immediate.
					Auto Offline data collection on/off support.
					Suspend Offline collection upon new
					command.
					No Offline surface scan supported.
					Self-test supported.
					No Conveyance Self-test supported.
					Selective Self-test supported.
SMART capabilities:            (0x0003)	Saves SMART data before entering
					power-saving mode.
					Supports SMART auto save timer.
Error logging capability:        (0x01)	Error logging supported.
					General Purpose Logging supported.
Short self-test routine 
recommended polling time: 	 (   2) minutes.
Extended self-test routine
recommended polling time: 	 (  28) minutes.

SMART Attributes Data Structure revision number: 1
Vendor Specific SMART Attributes with Thresholds:
ID# ATTRIBUTE_NAME          FLAGS    VALUE WORST THRESH FAIL RAW_VALUE
  5 Reallocated_Sector_Ct   PO--CK   090   090   ---    -    645
  9 Power_On_Hours          -O--CK   091   091   ---    -    40475
 12 Power_Cycle_Count       -O--CK   097   097   ---    -    2470
175 Program_Fail_Count_Chip -O--CK   089   089   ---    -    437
176 Erase_Fail_Count_Chip   -O--CK   100   100   ---    -    0
177 Wear_Leveling_Count     PO--C-   080   080   ---    -    600
178 Used_Rsvd_Blk_Cnt_Chip  PO--C-   061   061   ---    -    1562
179 Used_Rsvd_Blk_Cnt_Tot   PO--C-   066   066   ---    -    2764
180 Unused_Rsvd_Blk_Cnt_Tot PO--C-   066   066   ---    -    5300
181 Program_Fail_Cnt_Total  -O--CK   092   092   ---    -    645
182 Erase_Fail_Count_Total  -O--CK   100   100   ---    -    0
183 Runtime_Bad_Block       PO--C-   092   092   ---    -    645
187 Uncorrectable_Error_Cnt -O--CK   066   066   ---    -    33731
195 ECC_Error_Rate          -O-RC-   001   001   ---    -    33731
198 Offline_Uncorrectable   ----CK   100   100   ---    -    0
199 CRC_Error_Count         -OSRCK   253   253   ---    -    0
232 Available_Reservd_Space PO--C-   061   061   ---    -    2470
241 Total_LBAs_Written      -O--CK   005   005   ---    -    4096769459
242 Total_LBAs_Read         -O--CK   029   029   ---    -    3062801090
                            ||||||_ K auto-keep
                            |||||__ C event count
                            ||||___ R error rate
                            |||____ S speed/performance
                            ||_____ O updated online
                            |______ P prefailure warning

General Purpose Log Directory Version 1
SMART           Log Directory Version 0
Address    Access  R/W   Size  Description
0x00       GPL,SL  R/O      1  Log Directory
0x01       GPL,SL  R/O      1  Summary SMART error log
0x02       GPL,SL  R/O      1  Comprehensive SMART error log
0x03       GPL,SL  R/O      1  Ext. Comprehensive SMART error log
0x06       GPL,SL  R/O      1  SMART self-test log
0x07       GPL,SL  R/O      1  Extended self-test log
0x09       GPL,SL  R/W      1  Selective self-test log
0x10       GPL,SL  R/O      1  NCQ Command Error log
0x11       GPL,SL  R/O      1  SATA Phy Event Counters log
0x80-0x9f  GPL,SL  R/W      1  Host vendor specific log

Warning! SMART Extended Comprehensive Error Log Structure error: invalid SMART checksum.
SMART Extended Comprehensive Error Log Version: 1 (1 sectors)
Device Error Count: 38380 (device log contains only the most recent 4 errors)
	CR     = Command Register
	FEATR  = Features Register
	COUNT  = Count (was: Sector Count) Register
	LBA_48 = Upper bytes of LBA High/Mid/Low Registers ]  ATA-8
	LH     = LBA High (was: Cylinder High) Register    ]   LBA
	LM     = LBA Mid (was: Cylinder Low) Register      ] Register
	LL     = LBA Low (was: Sector Number) Register     ]
	DV     = Device (was: Device/Head) Register
	DC     = Device Control Register
	ER     = Error register
	ST     = Status register
Powered_Up_Time is measured from power on, and printed as
DDd+hh:mm:SS.sss where DD=days, hh=hours, mm=minutes,
SS=sec, and sss=millisec. It "wraps" after 49.710 days.

Error 38380 [3] occurred at disk power-on lifetime: 21761 hours (906 days + 17 hours)
  When the command that caused the error occurred, the device was active or idle.

  After command completion occurred, registers were:
  ER -- ST COUNT  LBA_48  LH LM LL DV DC
  -- -- -- == -- == == == -- -- -- -- --
  40 -- 51 00 08 00 00 0f 3a 75 58 40 00  Error: WP at LBA = 0x0f3a7558 = 255489368

  Commands leading to the command that caused the error were:
  CR FEATR COUNT  LBA_48  LH LM LL DV DC  Powered_Up_Time  Command/Feature_Name
  -- == -- == -- == == == -- -- -- -- --  ---------------  --------------------
  61 00 08 00 98 00 00 0f 3a 7a d0 40 00     06:30:00.000  WRITE FPDMA QUEUED
  ec 00 00 00 01 00 00 00 00 00 00 00 00     06:30:00.000  IDENTIFY DEVICE

Error 38379 [2] occurred at disk power-on lifetime: 21761 hours (906 days + 17 hours)
  When the command that caused the error occurred, the device was active or idle.

  After command completion occurred, registers were:
  ER -- ST COUNT  LBA_48  LH LM LL DV DC
  -- -- -- == -- == == == -- -- -- -- --
  40 -- 51 00 08 00 00 0f 3a 7a e8 40 00  Error: WP at LBA = 0x0f3a7ae8 = 255490792

  Commands leading to the command that caused the error were:
  CR FEATR COUNT  LBA_48  LH LM LL DV DC  Powered_Up_Time  Command/Feature_Name
  -- == -- == -- == == == -- -- -- -- --  ---------------  --------------------
  61 01 00 00 28 00 00 0f 3a 76 40 40 00     06:29:59.000  WRITE FPDMA QUEUED
  ec 00 00 00 01 00 00 00 00 00 00 00 00     06:29:59.000  IDENTIFY DEVICE

Error 38378 [1] occurred at disk power-on lifetime: 21761 hours (906 days + 17 hours)
  When the command that caused the error occurred, the device was active or idle.

  After command completion occurred, registers were:
  ER -- ST COUNT  LBA_48  LH LM LL DV DC
  -- -- -- == -- == == == -- -- -- -- --
  40 -- 51 00 08 00 00 00 5b cc 78 40 00  Error: WP at LBA = 0x005bcc78 = 6016120

  Commands leading to the command that caused the error were:
  CR FEATR COUNT  LBA_48  LH LM LL DV DC  Powered_Up_Time  Command/Feature_Name
  -- == -- == -- == == == -- -- -- -- --  ---------------  --------------------
  61 00 20 00 c0 00 00 0f 39 e4 c0 40 00     06:29:59.000  WRITE FPDMA QUEUED
  ec 00 00 00 01 00 00 00 00 00 00 00 00     06:29:59.000  IDENTIFY DEVICE

Error 38377 [0] occurred at disk power-on lifetime: 21761 hours (906 days + 17 hours)
  When the command that caused the error occurred, the device was active or idle.

  After command completion occurred, registers were:
  ER -- ST COUNT  LBA_48  LH LM LL DV DC
  -- -- -- == -- == == == -- -- -- -- --
  40 -- 51 00 08 00 00 0f 39 e4 d8 40 00  Error: WP at LBA = 0x0f39e4d8 = 255452376

  Commands leading to the command that caused the error were:
  CR FEATR COUNT  LBA_48  LH LM LL DV DC  Powered_Up_Time  Command/Feature_Name
  -- == -- == -- == == == -- -- -- -- --  ---------------  --------------------
  61 00 08 00 58 00 00 00 5b cc 68 40 00     06:29:59.000  WRITE FPDMA QUEUED
  ec 00 00 00 01 00 00 00 00 00 00 00 00     06:29:59.000  IDENTIFY DEVICE

Warning! SMART Extended Self-test Log Structure error: invalid SMART checksum.
SMART Extended Self-test Log Version: 1 (1 sectors)
Num  Test_Description    Status                  Remaining  LifeTime(hours)  LBA_of_first_error
# 1  Short offline       Completed without error       00%     38613         -
# 2  Short offline       Completed without error       00%     38612         -
# 3  Short offline       Completed without error       00%     15969         -
# 4  Short offline       Completed without error       00%     15969         -
# 5  Short offline       Completed without error       00%         2         -
# 6  Short offline       Completed without error       00%         2         -
# 7  Short offline       Completed without error       00%         2         -
# 8  Short offline       Completed without error       00%         2         -
# 9  Short offline       Completed without error       00%         2         -
#10  Short offline       Completed without error       00%         2         -
#11  Short offline       Completed without error       00%         2         -
#12  Short offline       Completed without error       00%         2         -
#13  Short offline       Completed without error       00%         2         -
#14  Short offline       Completed without error       00%         2         -
#15  Short offline       Completed without error       00%         2         -
#16  Short offline       Completed without error       00%         2         -
#17  Short offline       Completed without error       00%         1         -
#18  Short offline       Completed without error       00%         1         -

SMART Selective self-test log data structure revision number 1
 SPAN  MIN_LBA  MAX_LBA  CURRENT_TEST_STATUS
    1        0        0  Not_testing
    2        0        0  Not_testing
    3        0        0  Not_testing
    4        0        0  Not_testing
    5        0        0  Not_testing
Selective self-test flags (0x0):
  After scanning selected spans, do NOT read-scan remainder of disk.
If Selective self-test is pending on power-up, resume after 0 minute delay.

SCT Commands not supported

Device Statistics (GP/SMART Log 0x04) not supported

Pending Defects log (GP Log 0x0c) not supported

SATA Phy Event Counters (GP Log 0x11)
ID      Size     Value  Description
0x0001  2            0  Command failed due to ICRC error
0x0002  2            0  R_ERR response for data FIS
0x0003  2            0  R_ERR response for device-to-host data FIS
0x0004  2            0  R_ERR response for host-to-device data FIS
0x0005  2            0  R_ERR response for non-data FIS
0x0006  2            0  R_ERR response for device-to-host non-data FIS
0x0007  2            0  R_ERR response for host-to-device non-data FIS
0x0008  2            0  Device-to-host non-data FIS retries
0x0009  2           10  Transition from drive PhyRdy to drive PhyNRdy
0x000a  2           10  Device-to-host register FISes sent due to a COMRESET
0x000b  2            0  CRC errors within host-to-device FIS
0x000d  2            0  Non-CRC errors within host-to-device FIS
0x000f  2            0  R_ERR response for host-to-device data FIS, CRC
0x0010  2            0  R_ERR response for host-to-device data FIS, non-CRC
0x0012  2            0  R_ERR response for host-to-device non-data FIS, CRC
0x0013  2            0  R_ERR response for host-to-device non-data FIS, non-CRC

