smartctl 7.2 2020-12-30 r5155 [FreeBSD 13.0-RELEASE amd64] (local build)
Copyright (C) 2002-20, Bruce Allen, Christian Franke, www.smartmontools.org

=== START OF INFORMATION SECTION ===
Model Family:     Western Digital Scorpio Blue Serial ATA (AF)
Device Model:     WDC WD7500BPVT-80HXZT3
Serial Number:    --
LU WWN Device Id: 5 0014ee ...
Firmware Version: 01.01A01
User Capacity:    750,156,374,016 bytes [750 GB]
Sector Sizes:     512 bytes logical, 4096 bytes physical
Rotation Rate:    5400 rpm
Device is:        In smartctl database [for details use: -P show]
ATA Version is:   ATA8-ACS (minor revision not indicated)
SATA Version is:  SATA 2.6, 3.0 Gb/s
Local Time is:    Sat Apr 17 00:45:48 2021 -03
SMART support is: Available - device has SMART capability.
SMART support is: Enabled
AAM feature is:   Unavailable
APM level is:     96 (intermediate level with standby)
Rd look-ahead is: Enabled
Write cache is:   Enabled
DSN feature is:   Unavailable
ATA Security is:  Disabled, frozen [SEC2]
Wt Cache Reorder: Enabled

=== START OF READ SMART DATA SECTION ===
SMART overall-health self-assessment test result: PASSED

General SMART Values:
Offline data collection status:  (0x00)	Offline data collection activity
					was never started.
					Auto Offline Data Collection: Disabled.
Self-test execution status:      (   0)	The previous self-test routine completed
					without error or no self-test has ever 
					been run.
Total time to complete Offline 
data collection: 		(16560) seconds.
Offline data collection
capabilities: 			 (0x7b) SMART execute Offline immediate.
					Auto Offline data collection on/off support.
					Suspend Offline collection upon new
					command.
					Offline surface scan supported.
					Self-test supported.
					Conveyance Self-test supported.
					Selective Self-test supported.
SMART capabilities:            (0x0003)	Saves SMART data before entering
					power-saving mode.
					Supports SMART auto save timer.
Error logging capability:        (0x01)	Error logging supported.
					General Purpose Logging supported.
Short self-test routine 
recommended polling time: 	 (   2) minutes.
Extended self-test routine
recommended polling time: 	 ( 163) minutes.
Conveyance self-test routine
recommended polling time: 	 (   5) minutes.
SCT capabilities: 	       (0x7035)	SCT Status supported.
					SCT Feature Control supported.
					SCT Data Table supported.

SMART Attributes Data Structure revision number: 16
Vendor Specific SMART Attributes with Thresholds:
ID# ATTRIBUTE_NAME          FLAGS    VALUE WORST THRESH FAIL RAW_VALUE
  1 Raw_Read_Error_Rate     POSR-K   200   200   051    -    117
  3 Spin_Up_Time            POS--K   177   175   021    -    2150
  4 Start_Stop_Count        -O--CK   082   082   000    -    18795
  5 Reallocated_Sector_Ct   PO--CK   200   200   140    -    0
  7 Seek_Error_Rate         -OSR-K   200   200   000    -    0
  9 Power_On_Hours          -O--CK   076   076   000    -    17833
 10 Spin_Retry_Count        -O--CK   100   100   000    -    0
 11 Calibration_Retry_Count -O--CK   100   100   000    -    0
 12 Power_Cycle_Count       -O--CK   095   095   000    -    5930
191 G-Sense_Error_Rate      -O--CK   001   001   000    -    5696
192 Power-Off_Retract_Count -O--CK   200   200   000    -    490
193 Load_Cycle_Count        -O--CK   001   001   000    -    802959
194 Temperature_Celsius     -O---K   114   100   000    -    33
196 Reallocated_Event_Count -O--CK   200   200   000    -    0
197 Current_Pending_Sector  -O--CK   200   200   000    -    2
198 Offline_Uncorrectable   ----CK   100   253   000    -    0
199 UDMA_CRC_Error_Count    -O--CK   200   200   000    -    0
200 Multi_Zone_Error_Rate   ---R--   100   253   000    -    0
                            ||||||_ K auto-keep
                            |||||__ C event count
                            ||||___ R error rate
                            |||____ S speed/performance
                            ||_____ O updated online
                            |______ P prefailure warning

General Purpose Log Directory Version 1
SMART           Log Directory Version 1 [multi-sector log support]
Address    Access  R/W   Size  Description
0x00       GPL,SL  R/O      1  Log Directory
0x01           SL  R/O      1  Summary SMART error log
0x02           SL  R/O      5  Comprehensive SMART error log
0x03       GPL     R/O      6  Ext. Comprehensive SMART error log
0x06           SL  R/O      1  SMART self-test log
0x07       GPL     R/O      1  Extended self-test log
0x09           SL  R/W      1  Selective self-test log
0x10       GPL     R/O      1  NCQ Command Error log
0x11       GPL     R/O      1  SATA Phy Event Counters log
0x80-0x9f  GPL,SL  R/W     16  Host vendor specific log
0xa0-0xa7  GPL,SL  VS      16  Device vendor specific log
0xa8-0xb7  GPL,SL  VS       1  Device vendor specific log
0xbd       GPL,SL  VS       1  Device vendor specific log
0xc0       GPL,SL  VS       1  Device vendor specific log
0xc1       GPL     VS      93  Device vendor specific log
0xe0       GPL,SL  R/W      1  SCT Command/Status
0xe1       GPL,SL  R/W      1  SCT Data Transfer

SMART Extended Comprehensive Error Log Version: 1 (6 sectors)
Device Error Count: 181 (device log contains only the most recent 24 errors)
	CR     = Command Register
	FEATR  = Features Register
	COUNT  = Count (was: Sector Count) Register
	LBA_48 = Upper bytes of LBA High/Mid/Low Registers ]  ATA-8
	LH     = LBA High (was: Cylinder High) Register    ]   LBA
	LM     = LBA Mid (was: Cylinder Low) Register      ] Register
	LL     = LBA Low (was: Sector Number) Register     ]
	DV     = Device (was: Device/Head) Register
	DC     = Device Control Register
	ER     = Error register
	ST     = Status register
Powered_Up_Time is measured from power on, and printed as
DDd+hh:mm:SS.sss where DD=days, hh=hours, mm=minutes,
SS=sec, and sss=millisec. It "wraps" after 49.710 days.

Error 181 [12] occurred at disk power-on lifetime: 17550 hours (731 days + 6 hours)
  When the command that caused the error occurred, the device was active or idle.

  After command completion occurred, registers were:
  ER -- ST COUNT  LBA_48  LH LM LL DV DC
  -- -- -- == -- == == == -- -- -- -- --
  40 -- 51 00 00 00 00 4a 24 09 79 40 00  Error: UNC at LBA = 0x4a240979 = 1243875705

  Commands leading to the command that caused the error were:
  CR FEATR COUNT  LBA_48  LH LM LL DV DC  Powered_Up_Time  Command/Feature_Name
  -- == -- == -- == == == -- -- -- -- --  ---------------  --------------------
  60 00 01 00 18 00 00 4a 24 09 79 40 00     04:07:26.902  READ FPDMA QUEUED
  60 00 30 00 10 00 00 00 41 49 40 40 00     04:07:26.902  READ FPDMA QUEUED
  61 00 08 00 08 00 00 43 8a fc d0 40 00     04:07:26.902  WRITE FPDMA QUEUED
  2f 00 00 00 01 00 00 00 00 00 10 68 00     04:07:26.898  READ LOG EXT
  60 00 01 00 00 00 00 4a 24 09 78 40 00     04:07:24.035  READ FPDMA QUEUED

Error 180 [11] occurred at disk power-on lifetime: 17550 hours (731 days + 6 hours)
  When the command that caused the error occurred, the device was active or idle.

  After command completion occurred, registers were:
  ER -- ST COUNT  LBA_48  LH LM LL DV DC
  -- -- -- == -- == == == -- -- -- -- --
  40 -- 51 00 00 00 00 4a 24 09 78 40 00  Error: UNC at LBA = 0x4a240978 = 1243875704

  Commands leading to the command that caused the error were:
  CR FEATR COUNT  LBA_48  LH LM LL DV DC  Powered_Up_Time  Command/Feature_Name
  -- == -- == -- == == == -- -- -- -- --  ---------------  --------------------
  60 00 01 00 00 00 00 4a 24 09 78 40 00     04:07:24.035  READ FPDMA QUEUED
  60 00 01 00 00 00 00 4a 24 09 77 40 00     04:07:24.035  READ FPDMA QUEUED
  60 00 01 00 00 00 00 4a 24 09 76 40 00     04:07:24.034  READ FPDMA QUEUED
  60 00 01 00 00 00 00 4a 24 09 75 40 00     04:07:24.034  READ FPDMA QUEUED
  60 00 01 00 00 00 00 4a 24 09 74 40 00     04:07:24.034  READ FPDMA QUEUED

Error 179 [10] occurred at disk power-on lifetime: 17550 hours (731 days + 6 hours)
  When the command that caused the error occurred, the device was active or idle.

  After command completion occurred, registers were:
  ER -- ST COUNT  LBA_48  LH LM LL DV DC
  -- -- -- == -- == == == -- -- -- -- --
  40 -- 51 00 00 00 00 4a 24 09 78 40 00  Error: UNC at LBA = 0x4a240978 = 1243875704

  Commands leading to the command that caused the error were:
  CR FEATR COUNT  LBA_48  LH LM LL DV DC  Powered_Up_Time  Command/Feature_Name
  -- == -- == -- == == == -- -- -- -- --  ---------------  --------------------
  60 01 00 00 28 00 00 4a 24 0b 60 40 00     04:07:21.031  READ FPDMA QUEUED
  60 01 00 00 20 00 00 4a 24 0a 60 40 00     04:07:21.030  READ FPDMA QUEUED
  60 01 00 00 18 00 00 4a 24 09 60 40 00     04:07:21.030  READ FPDMA QUEUED
  60 00 08 00 10 00 00 00 20 d2 22 40 00     04:07:21.030  READ FPDMA QUEUED
  61 00 08 00 08 00 00 43 8a f9 38 40 00     04:07:21.030  WRITE FPDMA QUEUED

Error 178 [9] occurred at disk power-on lifetime: 17550 hours (731 days + 6 hours)
  When the command that caused the error occurred, the device was active or idle.

  After command completion occurred, registers were:
  ER -- ST COUNT  LBA_48  LH LM LL DV DC
  -- -- -- == -- == == == -- -- -- -- --
  40 -- 51 00 01 00 00 4a 24 09 78 40 00  Error: UNC at LBA = 0x4a240978 = 1243875704

  Commands leading to the command that caused the error were:
  CR FEATR COUNT  LBA_48  LH LM LL DV DC  Powered_Up_Time  Command/Feature_Name
  -- == -- == -- == == == -- -- -- -- --  ---------------  --------------------
  60 00 20 00 00 00 00 4a 24 09 60 40 00     04:07:18.128  READ FPDMA QUEUED
  61 00 20 00 00 00 00 3a 9f 97 a0 40 00     04:07:18.127  WRITE FPDMA QUEUED
  61 00 20 00 00 00 00 03 70 ad 60 40 00     04:07:18.127  WRITE FPDMA QUEUED
  60 00 20 00 00 00 00 4a 24 09 40 40 00     04:07:18.126  READ FPDMA QUEUED
  61 00 20 00 00 00 00 3a 9f 97 a0 40 00     04:07:18.126  WRITE FPDMA QUEUED

Error 177 [8] occurred at disk power-on lifetime: 16408 hours (683 days + 16 hours)
  When the command that caused the error occurred, the device was active or idle.

  After command completion occurred, registers were:
  ER -- ST COUNT  LBA_48  LH LM LL DV DC
  -- -- -- == -- == == == -- -- -- -- --
  40 -- 51 00 01 00 00 4a 24 09 78 40 00  Error: UNC at LBA = 0x4a240978 = 1243875704

  Commands leading to the command that caused the error were:
  CR FEATR COUNT  LBA_48  LH LM LL DV DC  Powered_Up_Time  Command/Feature_Name
  -- == -- == -- == == == -- -- -- -- --  ---------------  --------------------
  60 01 00 00 40 00 00 4a 24 0b 60 40 00     08:18:11.439  READ FPDMA QUEUED
  60 01 00 00 38 00 00 4a 24 0a 60 40 00     08:18:11.439  READ FPDMA QUEUED
  60 01 00 00 30 00 00 4a 24 09 60 40 00     08:18:11.439  READ FPDMA QUEUED
  60 01 00 00 28 00 00 4a 24 08 60 40 00     08:18:11.439  READ FPDMA QUEUED
  60 01 00 00 20 00 00 4a 24 07 60 40 00     08:18:11.439  READ FPDMA QUEUED

Error 176 [7] occurred at disk power-on lifetime: 16405 hours (683 days + 13 hours)
  When the command that caused the error occurred, the device was active or idle.

  After command completion occurred, registers were:
  ER -- ST COUNT  LBA_48  LH LM LL DV DC
  -- -- -- == -- == == == -- -- -- -- --
  40 -- 51 00 00 00 00 4a 24 09 78 40 00  Error: WP at LBA = 0x4a240978 = 1243875704

  Commands leading to the command that caused the error were:
  CR FEATR COUNT  LBA_48  LH LM LL DV DC  Powered_Up_Time  Command/Feature_Name
  -- == -- == -- == == == -- -- -- -- --  ---------------  --------------------
  61 00 08 00 00 00 00 43 91 46 98 40 00     05:17:03.116  WRITE FPDMA QUEUED
  61 00 20 00 00 00 00 47 5e 10 40 40 00     05:17:03.115  WRITE FPDMA QUEUED
  60 00 20 00 08 00 00 43 91 44 40 40 00     05:17:03.115  READ FPDMA QUEUED
  61 00 20 00 00 00 00 47 5e 45 60 40 00     05:17:03.113  WRITE FPDMA QUEUED
  61 00 08 00 08 00 00 43 8f e4 d8 40 00     05:17:03.113  WRITE FPDMA QUEUED

Error 175 [6] occurred at disk power-on lifetime: 16405 hours (683 days + 13 hours)
  When the command that caused the error occurred, the device was active or idle.

  After command completion occurred, registers were:
  ER -- ST COUNT  LBA_48  LH LM LL DV DC
  -- -- -- == -- == == == -- -- -- -- --
  40 -- 51 00 00 00 00 4a 24 09 7f 40 00  Error: UNC at LBA = 0x4a24097f = 1243875711

  Commands leading to the command that caused the error were:
  CR FEATR COUNT  LBA_48  LH LM LL DV DC  Powered_Up_Time  Command/Feature_Name
  -- == -- == -- == == == -- -- -- -- --  ---------------  --------------------
  60 00 01 00 08 00 00 4a 24 09 7f 40 00     05:16:59.859  READ FPDMA QUEUED
  ea 00 00 00 00 00 00 00 00 00 00 40 00     05:16:59.858  FLUSH CACHE EXT
  2f 00 00 00 01 00 00 00 00 00 10 68 00     05:16:59.843  READ LOG EXT
  61 00 10 00 00 00 00 00 7b cf 18 40 00     05:16:56.951  WRITE FPDMA QUEUED
  60 00 01 00 10 00 00 4a 24 09 7e 40 00     05:16:56.949  READ FPDMA QUEUED

Error 174 [5] occurred at disk power-on lifetime: 16405 hours (683 days + 13 hours)
  When the command that caused the error occurred, the device was active or idle.

  After command completion occurred, registers were:
  ER -- ST COUNT  LBA_48  LH LM LL DV DC
  -- -- -- == -- == == == -- -- -- -- --
  40 -- 51 00 00 00 00 4a 24 09 7e 40 00  Error: WP at LBA = 0x4a24097e = 1243875710

  Commands leading to the command that caused the error were:
  CR FEATR COUNT  LBA_48  LH LM LL DV DC  Powered_Up_Time  Command/Feature_Name
  -- == -- == -- == == == -- -- -- -- --  ---------------  --------------------
  61 00 10 00 00 00 00 00 7b cf 18 40 00     05:16:56.951  WRITE FPDMA QUEUED
  60 00 01 00 10 00 00 4a 24 09 7e 40 00     05:16:56.949  READ FPDMA QUEUED
  ea 00 00 00 00 00 00 00 00 00 00 40 00     05:16:56.949  FLUSH CACHE EXT
  2f 00 00 00 01 00 00 00 00 00 10 68 00     05:16:56.924  READ LOG EXT
  61 00 08 00 00 00 00 00 7b ce 98 40 00     05:16:54.033  WRITE FPDMA QUEUED

SMART Extended Self-test Log Version: 1 (1 sectors)
Num  Test_Description    Status                  Remaining  LifeTime(hours)  LBA_of_first_error
# 1  Short offline       Completed: read failure       90%     15754         1243873080
# 2  Short offline       Completed: read failure       90%     15092         1243873080
# 3  Short offline       Aborted by host               10%     14603         -
# 4  Short offline       Completed: read failure       90%     14375         1243874392
# 5  Short offline       Completed: read failure       90%     14373         1243874392
# 6  Short offline       Completed: read failure       90%     14373         1243874392

SMART Selective self-test log data structure revision number 1
 SPAN  MIN_LBA  MAX_LBA  CURRENT_TEST_STATUS
    1        0        0  Not_testing
    2        0        0  Not_testing
    3        0        0  Not_testing
    4        0        0  Not_testing
    5        0        0  Not_testing
Selective self-test flags (0x0):
  After scanning selected spans, do NOT read-scan remainder of disk.
If Selective self-test is pending on power-up, resume after 0 minute delay.

SCT Status Version:                  3
SCT Version (vendor specific):       258 (0x0102)
Device State:                        Stand-by (1)
Current Temperature:                    33 Celsius
Power Cycle Min/Max Temperature:     31/35 Celsius
Lifetime    Min/Max Temperature:      0/47 Celsius
Under/Over Temperature Limit Count:   0/0
Vendor specific:
01 00 00 00 00 00 00 00 00 00 00 00 00 00 00 00
00 00 00 00 00 00 00 00 00 00 00 00 00 00 00 00

SCT Temperature History Version:     2
Temperature Sampling Period:         1 minute
Temperature Logging Interval:        1 minute
Min/Max recommended Temperature:      0/60 Celsius
Min/Max Temperature Limit:           -41/85 Celsius
Temperature History Size (Index):    128 (60)

SCT Error Recovery Control command not supported

Device Statistics (GP/SMART Log 0x04) not supported

Pending Defects log (GP Log 0x0c) not supported

SATA Phy Event Counters (GP Log 0x11)
ID      Size     Value  Description
0x0001  2            0  Command failed due to ICRC error
0x0002  2            0  R_ERR response for data FIS
0x0003  2            0  R_ERR response for device-to-host data FIS
0x0004  2            0  R_ERR response for host-to-device data FIS
0x0005  2            0  R_ERR response for non-data FIS
0x0006  2            0  R_ERR response for device-to-host non-data FIS
0x0007  2            0  R_ERR response for host-to-device non-data FIS
0x0008  2            0  Device-to-host non-data FIS retries
0x0009  2            9  Transition from drive PhyRdy to drive PhyNRdy
0x000a  2            6  Device-to-host register FISes sent due to a COMRESET
0x000b  2            0  CRC errors within host-to-device FIS
0x000f  2            0  R_ERR response for host-to-device data FIS, CRC
0x0012  2            0  R_ERR response for host-to-device non-data FIS, CRC
0x8000  4         7152  Vendor specific



