smartctl 7.1 2019-12-30 r5022 [FreeBSD 12.2-RC3 amd64] (local build)
Copyright (C) 2002-19, Bruce Allen, Christian Franke, www.smartmontools.org

=== START OF INFORMATION SECTION ===
Model Family:     Seagate Desktop HDD.15
Device Model:     ST4000DM000-1F2168
Serial Number:    --
LU WWN Device Id: 5 000c50 ...
Firmware Version: CC54
User Capacity:    4,000,787,030,016 bytes [4.00 TB]
Sector Sizes:     512 bytes logical, 4096 bytes physical
Rotation Rate:    5900 rpm
Form Factor:      3.5 inches
Device is:        In smartctl database [for details use: -P show]
ATA Version is:   ACS-2, ACS-3 T13/2161-D revision 3b
SATA Version is:  SATA 3.1, 6.0 Gb/s (current: 6.0 Gb/s)
Local Time is:    Fri Dec 18 08:03:06 2020 EST
SMART support is: Available - device has SMART capability.
SMART support is: Enabled
AAM feature is:   Unavailable
APM level is:     128 (minimum power consumption without standby)
Rd look-ahead is: Enabled
Write cache is:   Enabled
DSN feature is:   Unavailable
ATA Security is:  Disabled, NOT FROZEN [SEC1]
Wt Cache Reorder: Unavailable

=== START OF READ SMART DATA SECTION ===
SMART overall-health self-assessment test result: PASSED
See vendor-specific Attribute list for marginal Attributes.

General SMART Values:
Offline data collection status:  (0x00)	Offline data collection activity
					was never started.
					Auto Offline Data Collection: Disabled.
Self-test execution status:      (   0)	The previous self-test routine completed
					without error or no self-test has ever 
					been run.
Total time to complete Offline 
data collection: 		(  107) seconds.
Offline data collection
capabilities: 			 (0x73) SMART execute Offline immediate.
					Auto Offline data collection on/off support.
					Suspend Offline collection upon new
					command.
					No Offline surface scan supported.
					Self-test supported.
					Conveyance Self-test supported.
					Selective Self-test supported.
SMART capabilities:            (0x0003)	Saves SMART data before entering
					power-saving mode.
					Supports SMART auto save timer.
Error logging capability:        (0x01)	Error logging supported.
					General Purpose Logging supported.
Short self-test routine 
recommended polling time: 	 (   1) minutes.
Extended self-test routine
recommended polling time: 	 ( 498) minutes.
Conveyance self-test routine
recommended polling time: 	 (   2) minutes.
SCT capabilities: 	       (0x1085)	SCT Status supported.

SMART Attributes Data Structure revision number: 10
Vendor Specific SMART Attributes with Thresholds:
ID# ATTRIBUTE_NAME          FLAGS    VALUE WORST THRESH FAIL RAW_VALUE
  1 Raw_Read_Error_Rate     POSR--   111   099   006    -    35707584
  3 Spin_Up_Time            PO----   092   091   000    -    0
  4 Start_Stop_Count        -O--CK   037   037   020    -    65535
  5 Reallocated_Sector_Ct   PO--CK   052   052   010    -    62392
  7 Seek_Error_Rate         POSR--   075   060   030    -    37077054
  9 Power_On_Hours          -O--CK   050   050   000    -    43876
 10 Spin_Retry_Count        PO--C-   100   100   097    -    0
 12 Power_Cycle_Count       -O--CK   100   100   020    -    137
183 Runtime_Bad_Block       -O--CK   100   100   000    -    0
184 End-to-End_Error        -O--CK   100   100   099    -    0
187 Reported_Uncorrect      -O--CK   080   080   000    -    20
188 Command_Timeout         -O--CK   100   097   000    -    60 60 60
189 High_Fly_Writes         -O-RCK   100   100   000    -    0
190 Airflow_Temperature_Cel -O---K   074   031   045    Past 26 (132 239 34 26 0)
191 G-Sense_Error_Rate      -O--CK   100   100   000    -    0
192 Power-Off_Retract_Count -O--CK   100   100   000    -    0
193 Load_Cycle_Count        -O--CK   001   001   000    -    455935
194 Temperature_Celsius     -O---K   026   069   000    -    26 (0 9 0 0 0)
197 Current_Pending_Sector  -O--C-   100   100   000    -    0
198 Offline_Uncorrectable   ----C-   100   100   000    -    0
199 UDMA_CRC_Error_Count    -OSRCK   200   200   000    -    0
240 Head_Flying_Hours       ------   100   253   000    -    20288h+00m+40.217s
241 Total_LBAs_Written      ------   100   253   000    -    33020928194
242 Total_LBAs_Read         ------   100   253   000    -    465156558885
                            ||||||_ K auto-keep
                            |||||__ C event count
                            ||||___ R error rate
                            |||____ S speed/performance
                            ||_____ O updated online
                            |______ P prefailure warning

General Purpose Log Directory Version 1
SMART           Log Directory Version 1 [multi-sector log support]
Address    Access  R/W   Size  Description
0x00       GPL,SL  R/O      1  Log Directory
0x01           SL  R/O      1  Summary SMART error log
0x02           SL  R/O      5  Comprehensive SMART error log
0x03       GPL     R/O      5  Ext. Comprehensive SMART error log
0x04       GPL,SL  R/O      8  Device Statistics log
0x06           SL  R/O      1  SMART self-test log
0x07       GPL     R/O      1  Extended self-test log
0x09           SL  R/W      1  Selective self-test log
0x10       GPL     R/O      1  NCQ Command Error log
0x11       GPL     R/O      1  SATA Phy Event Counters log
0x21       GPL     R/O      1  Write stream error log
0x22       GPL     R/O      1  Read stream error log
0x24       GPL     R/O   1223  Current Device Internal Status Data log
0x25       GPL     R/O   1223  Saved Device Internal Status Data log
0x30       GPL,SL  R/O      9  IDENTIFY DEVICE data log
0x80-0x9f  GPL,SL  R/W     16  Host vendor specific log
0xa1       GPL,SL  VS      20  Device vendor specific log
0xa2       GPL     VS    4496  Device vendor specific log
0xa8       GPL,SL  VS     129  Device vendor specific log
0xa9       GPL,SL  VS       1  Device vendor specific log
0xab       GPL     VS       1  Device vendor specific log
0xb0       GPL     VS    5176  Device vendor specific log
0xbe-0xbf  GPL     VS   65535  Device vendor specific log
0xc0       GPL,SL  VS       1  Device vendor specific log
0xc1       GPL,SL  VS      10  Device vendor specific log
0xc3       GPL,SL  VS       8  Device vendor specific log
0xc4       GPL,SL  VS       5  Device vendor specific log
0xe0       GPL,SL  R/W      1  SCT Command/Status
0xe1       GPL,SL  R/W      1  SCT Data Transfer

SMART Extended Comprehensive Error Log Version: 1 (5 sectors)
Device Error Count: 20
	CR     = Command Register
	FEATR  = Features Register
	COUNT  = Count (was: Sector Count) Register
	LBA_48 = Upper bytes of LBA High/Mid/Low Registers ]  ATA-8
	LH     = LBA High (was: Cylinder High) Register    ]   LBA
	LM     = LBA Mid (was: Cylinder Low) Register      ] Register
	LL     = LBA Low (was: Sector Number) Register     ]
	DV     = Device (was: Device/Head) Register
	DC     = Device Control Register
	ER     = Error register
	ST     = Status register
Powered_Up_Time is measured from power on, and printed as
DDd+hh:mm:SS.sss where DD=days, hh=hours, mm=minutes,
SS=sec, and sss=millisec. It "wraps" after 49.710 days.

Error 20 [19] occurred at disk power-on lifetime: 38210 hours (1592 days + 2 hours)
  When the command that caused the error occurred, the device was active or idle.

  After command completion occurred, registers were:
  ER -- ST COUNT  LBA_48  LH LM LL DV DC
  -- -- -- == -- == == == -- -- -- -- --
  40 -- 51 00 00 00 01 50 45 86 68 00 00  Error: UNC at LBA = 0x150458668 = 5641700968

  Commands leading to the command that caused the error were:
  CR FEATR COUNT  LBA_48  LH LM LL DV DC  Powered_Up_Time  Command/Feature_Name
  -- == -- == -- == == == -- -- -- -- --  ---------------  --------------------
  25 00 00 01 00 00 01 50 45 85 80 40 00 12d+09:25:33.468  READ DMA EXT
  25 00 00 01 00 00 01 50 45 85 80 40 00 12d+09:25:29.079  READ DMA EXT
  25 00 00 01 00 00 01 50 45 85 80 40 00 12d+09:25:24.395  READ DMA EXT
  25 00 00 01 00 00 01 50 45 85 80 40 00 12d+09:25:19.970  READ DMA EXT
  25 00 00 01 00 00 01 50 45 85 80 40 00 12d+09:25:15.105  READ DMA EXT

Error 19 [18] occurred at disk power-on lifetime: 38210 hours (1592 days + 2 hours)
  When the command that caused the error occurred, the device was active or idle.

  After command completion occurred, registers were:
  ER -- ST COUNT  LBA_48  LH LM LL DV DC
  -- -- -- == -- == == == -- -- -- -- --
  40 -- 51 00 00 00 01 50 45 86 68 00 00  Error: UNC at LBA = 0x150458668 = 5641700968

  Commands leading to the command that caused the error were:
  CR FEATR COUNT  LBA_48  LH LM LL DV DC  Powered_Up_Time  Command/Feature_Name
  -- == -- == -- == == == -- -- -- -- --  ---------------  --------------------
  25 00 00 01 00 00 01 50 45 85 80 40 00 12d+09:25:29.079  READ DMA EXT
  25 00 00 01 00 00 01 50 45 85 80 40 00 12d+09:25:24.395  READ DMA EXT
  25 00 00 01 00 00 01 50 45 85 80 40 00 12d+09:25:19.970  READ DMA EXT
  25 00 00 01 00 00 01 50 45 85 80 40 00 12d+09:25:15.105  READ DMA EXT
  61 00 00 00 10 00 00 00 40 02 90 40 00 12d+09:25:15.099  WRITE FPDMA QUEUED

Error 18 [17] occurred at disk power-on lifetime: 38210 hours (1592 days + 2 hours)
  When the command that caused the error occurred, the device was active or idle.

  After command completion occurred, registers were:
  ER -- ST COUNT  LBA_48  LH LM LL DV DC
  -- -- -- == -- == == == -- -- -- -- --
  40 -- 51 00 00 00 01 50 45 86 68 00 00  Error: UNC at LBA = 0x150458668 = 5641700968

  Commands leading to the command that caused the error were:
  CR FEATR COUNT  LBA_48  LH LM LL DV DC  Powered_Up_Time  Command/Feature_Name
  -- == -- == -- == == == -- -- -- -- --  ---------------  --------------------
  25 00 00 01 00 00 01 50 45 85 80 40 00 12d+09:25:24.395  READ DMA EXT
  25 00 00 01 00 00 01 50 45 85 80 40 00 12d+09:25:19.970  READ DMA EXT
  25 00 00 01 00 00 01 50 45 85 80 40 00 12d+09:25:15.105  READ DMA EXT
  61 00 00 00 10 00 00 00 40 02 90 40 00 12d+09:25:15.099  WRITE FPDMA QUEUED
  60 00 00 01 00 00 01 50 45 84 80 40 00 12d+09:25:15.099  READ FPDMA QUEUED

Error 17 [16] occurred at disk power-on lifetime: 38210 hours (1592 days + 2 hours)
  When the command that caused the error occurred, the device was active or idle.

  After command completion occurred, registers were:
  ER -- ST COUNT  LBA_48  LH LM LL DV DC
  -- -- -- == -- == == == -- -- -- -- --
  40 -- 51 00 00 00 01 50 45 86 68 00 00  Error: UNC at LBA = 0x150458668 = 5641700968

  Commands leading to the command that caused the error were:
  CR FEATR COUNT  LBA_48  LH LM LL DV DC  Powered_Up_Time  Command/Feature_Name
  -- == -- == -- == == == -- -- -- -- --  ---------------  --------------------
  25 00 00 01 00 00 01 50 45 85 80 40 00 12d+09:25:19.970  READ DMA EXT
  25 00 00 01 00 00 01 50 45 85 80 40 00 12d+09:25:15.105  READ DMA EXT
  61 00 00 00 10 00 00 00 40 02 90 40 00 12d+09:25:15.099  WRITE FPDMA QUEUED
  60 00 00 01 00 00 01 50 45 84 80 40 00 12d+09:25:15.099  READ FPDMA QUEUED
  60 00 00 01 00 00 01 50 45 83 80 40 00 12d+09:25:15.099  READ FPDMA QUEUED

Error 16 [15] occurred at disk power-on lifetime: 38210 hours (1592 days + 2 hours)
  When the command that caused the error occurred, the device was active or idle.

  After command completion occurred, registers were:
  ER -- ST COUNT  LBA_48  LH LM LL DV DC
  -- -- -- == -- == == == -- -- -- -- --
  40 -- 51 00 00 00 01 50 45 86 68 00 00  Error: UNC at LBA = 0x150458668 = 5641700968

  Commands leading to the command that caused the error were:
  CR FEATR COUNT  LBA_48  LH LM LL DV DC  Powered_Up_Time  Command/Feature_Name
  -- == -- == -- == == == -- -- -- -- --  ---------------  --------------------
  25 00 00 01 00 00 01 50 45 85 80 40 00 12d+09:25:15.105  READ DMA EXT
  61 00 00 00 10 00 00 00 40 02 90 40 00 12d+09:25:15.099  WRITE FPDMA QUEUED
  60 00 00 01 00 00 01 50 45 84 80 40 00 12d+09:25:15.099  READ FPDMA QUEUED
  60 00 00 01 00 00 01 50 45 83 80 40 00 12d+09:25:15.099  READ FPDMA QUEUED
  60 00 00 01 00 00 01 50 45 82 80 40 00 12d+09:25:15.098  READ FPDMA QUEUED

Error 15 [14] occurred at disk power-on lifetime: 38210 hours (1592 days + 2 hours)
  When the command that caused the error occurred, the device was active or idle.

  After command completion occurred, registers were:
  ER -- ST COUNT  LBA_48  LH LM LL DV DC
  -- -- -- == -- == == == -- -- -- -- --
  40 -- 51 00 00 00 01 50 45 7c 80 00 00  Error: UNC at LBA = 0x150457c80 = 5641698432

  Commands leading to the command that caused the error were:
  CR FEATR COUNT  LBA_48  LH LM LL DV DC  Powered_Up_Time  Command/Feature_Name
  -- == -- == -- == == == -- -- -- -- --  ---------------  --------------------
  60 00 00 01 00 00 01 50 45 7c 80 40 00 12d+09:25:10.750  READ FPDMA QUEUED
  2f 00 00 00 01 00 00 00 00 00 10 00 00 12d+09:25:09.794  READ LOG EXT
  60 00 00 01 00 00 01 50 45 7c 80 40 00 12d+09:25:05.860  READ FPDMA QUEUED
  2f 00 00 00 01 00 00 00 00 00 10 00 00 12d+09:25:05.373  READ LOG EXT
  60 00 00 01 00 00 01 50 45 7c 80 40 00 12d+09:25:01.392  READ FPDMA QUEUED

Error 14 [13] occurred at disk power-on lifetime: 38210 hours (1592 days + 2 hours)
  When the command that caused the error occurred, the device was active or idle.

  After command completion occurred, registers were:
  ER -- ST COUNT  LBA_48  LH LM LL DV DC
  -- -- -- == -- == == == -- -- -- -- --
  40 -- 51 00 00 00 01 50 45 7c 80 00 00  Error: UNC at LBA = 0x150457c80 = 5641698432

  Commands leading to the command that caused the error were:
  CR FEATR COUNT  LBA_48  LH LM LL DV DC  Powered_Up_Time  Command/Feature_Name
  -- == -- == -- == == == -- -- -- -- --  ---------------  --------------------
  60 00 00 01 00 00 01 50 45 7c 80 40 00 12d+09:25:05.860  READ FPDMA QUEUED
  2f 00 00 00 01 00 00 00 00 00 10 00 00 12d+09:25:05.373  READ LOG EXT
  60 00 00 01 00 00 01 50 45 7c 80 40 00 12d+09:25:01.392  READ FPDMA QUEUED
  2f 00 00 00 01 00 00 00 00 00 10 00 00 12d+09:25:01.032  READ LOG EXT
  60 00 00 01 00 00 01 50 45 7c 80 40 00 12d+09:24:57.070  READ FPDMA QUEUED

Error 13 [12] occurred at disk power-on lifetime: 38210 hours (1592 days + 2 hours)
  When the command that caused the error occurred, the device was active or idle.

  After command completion occurred, registers were:
  ER -- ST COUNT  LBA_48  LH LM LL DV DC
  -- -- -- == -- == == == -- -- -- -- --
  40 -- 51 00 00 00 01 50 45 7c 80 00 00  Error: UNC at LBA = 0x150457c80 = 5641698432

  Commands leading to the command that caused the error were:
  CR FEATR COUNT  LBA_48  LH LM LL DV DC  Powered_Up_Time  Command/Feature_Name
  -- == -- == -- == == == -- -- -- -- --  ---------------  --------------------
  60 00 00 01 00 00 01 50 45 7c 80 40 00 12d+09:25:01.392  READ FPDMA QUEUED
  2f 00 00 00 01 00 00 00 00 00 10 00 00 12d+09:25:01.032  READ LOG EXT
  60 00 00 01 00 00 01 50 45 7c 80 40 00 12d+09:24:57.070  READ FPDMA QUEUED
  60 00 00 00 10 00 00 00 40 02 90 40 00 12d+09:24:57.069  READ FPDMA QUEUED
  2f 00 00 00 01 00 00 00 00 00 10 00 00 12d+09:24:56.420  READ LOG EXT

SMART Extended Self-test Log Version: 1 (1 sectors)
Num  Test_Description    Status                  Remaining  LifeTime(hours)  LBA_of_first_error
# 1  Short offline       Completed without error       00%     43468         -
# 2  Short offline       Completed without error       00%     42748         -
# 3  Short offline       Completed without error       00%     37217         -
# 4  Short offline       Completed without error       00%     37049         -
# 5  Short offline       Completed without error       00%     36881         -
# 6  Short offline       Completed without error       00%     36727         -
# 7  Short offline       Completed without error       00%     36559         -

SMART Selective self-test log data structure revision number 1
 SPAN  MIN_LBA  MAX_LBA  CURRENT_TEST_STATUS
    1        0        0  Not_testing
    2        0        0  Not_testing
    3        0        0  Not_testing
    4        0        0  Not_testing
    5        0        0  Not_testing
Selective self-test flags (0x0):
  After scanning selected spans, do NOT read-scan remainder of disk.
If Selective self-test is pending on power-up, resume after 0 minute delay.

SCT Status Version:                  3
SCT Version (vendor specific):       522 (0x020a)
Device State:                        Active (0)
Current Temperature:                    26 Celsius
Power Cycle Min/Max Temperature:     26/34 Celsius
Lifetime    Min/Max Temperature:     10/69 Celsius
Under/Over Temperature Limit Count:   0/0

SCT Data Table command not supported

SCT Error Recovery Control command not supported

Device Statistics (GP Log 0x04)
Page  Offset Size        Value Flags Description
0x01  =====  =               =  ===  == General Statistics (rev 2) ==
0x01  0x008  4             137  ---  Lifetime Power-On Resets
0x01  0x010  4           43876  ---  Power-on Hours
0x01  0x018  6     33137520221  ---  Logical Sectors Written
0x01  0x020  6       154145888  ---  Number of Write Commands
0x01  0x028  6    386500804539  ---  Logical Sectors Read
0x01  0x030  6      1550093981  ---  Number of Read Commands
0x01  0x038  6               -  ---  Date and Time TimeStamp
0x03  =====  =               =  ===  == Rotating Media Statistics (rev 1) ==
0x03  0x008  4           26586  ---  Spindle Motor Power-on Hours
0x03  0x010  4            5245  ---  Head Flying Hours
0x03  0x018  4          455935  ---  Head Load Events
0x03  0x020  4           62392  ---  Number of Reallocated Logical Sectors
0x03  0x028  4               0  ---  Read Recovery Attempts
0x03  0x030  4               0  ---  Number of Mechanical Start Failures
0x04  =====  =               =  ===  == General Errors Statistics (rev 1) ==
0x04  0x008  4              20  ---  Number of Reported Uncorrectable Errors
0x04  0x010  4              60  ---  Resets Between Cmd Acceptance and Completion
                                |||_ C monitored condition met
                                ||__ D supports DSN
                                |___ N normalized value

Pending Defects log (GP Log 0x0c) not supported

SATA Phy Event Counters (GP Log 0x11)
ID      Size     Value  Description
0x000a  2           10  Device-to-host register FISes sent due to a COMRESET
0x0001  2            0  Command failed due to ICRC error
0x0003  2            0  R_ERR response for device-to-host data FIS
0x0004  2            0  R_ERR response for host-to-device data FIS
0x0006  2            0  R_ERR response for device-to-host non-data FIS
0x0007  2            0  R_ERR response for host-to-device non-data FIS

