smartctl 7.4 2023-08-01 r5530 [FreeBSD 13.2-RELEASE-p11 amd64] (local build)
Copyright (C) 2002-23, Bruce Allen, Christian Franke, www.smartmontools.org

=== START OF INFORMATION SECTION ===
Model Number:                       CT500P3SSD8
Serial Number:                      --
Firmware Version:                   P9CR30A
PCI Vendor/Subsystem ID:            0xc0a9
IEEE OUI Identifier:                0x00a075
Controller ID:                      1
NVMe Version:                       1.4
Number of Namespaces:               1
Namespace 1 Size/Capacity:          500,107,862,016 [500 GB]
Namespace 1 Formatted LBA Size:     512
Namespace 1 IEEE EUI-64:            6479a7 ...
Local Time is:                      Mon Apr 15 11:23:14 2024 EDT
Firmware Updates (0x12):            1 Slot, no Reset required
Optional Admin Commands (0x0017):   Security Format Frmw_DL Self_Test
Optional NVM Commands (0x005e):     Wr_Unc DS_Mngmt Wr_Zero Sav/Sel_Feat Timestmp
Log Page Attributes (0x06):         Cmd_Eff_Lg Ext_Get_Lg
Maximum Data Transfer Size:         64 Pages
Warning  Comp. Temp. Threshold:     85 Celsius
Critical Comp. Temp. Threshold:     95 Celsius

Supported Power States
St Op     Max   Active     Idle   RL RT WL WT  Ent_Lat  Ex_Lat
 0 +     6.00W  0.0000W       -    0  0  0  0        0       0
 1 +     3.00W  0.0000W       -    0  0  0  0        0       0
 2 +     1.50W  0.0000W       -    0  0  0  0        0       0
 3 -   0.0250W  0.0000W       -    3  3  3  3     5000    1900
 4 -   0.0030W       -        -    4  4  4  4    13000  100000

Supported LBA Sizes (NSID 0x1)
Id Fmt  Data  Metadt  Rel_Perf
 0 +     512       0         1
 1 -    4096       0         0

=== START OF SMART DATA SECTION ===
SMART overall-health self-assessment test result: PASSED

SMART/Health Information (NVMe Log 0x02)
Critical Warning:                   0x00
Temperature:                        59 Celsius
Available Spare:                    100%
Available Spare Threshold:          5%
Percentage Used:                    25%
Data Units Read:                    441,372 [225 GB]
Data Units Written:                 36,094,706 [18.4 TB]
Host Read Commands:                 9,462,401
Host Write Commands:                487,333,664
Controller Busy Time:               1,455
Power Cycles:                       8
Power On Hours:                     5,549
Unsafe Shutdowns:                   4
Media and Data Integrity Errors:    0
Error Information Log Entries:      0
Warning  Comp. Temperature Time:    0
Critical Comp. Temperature Time:    0
Temperature Sensor 1:               59 Celsius
Temperature Sensor 2:               70 Celsius
Temperature Sensor 8:               59 Celsius

Error Information (NVMe Log 0x01, 16 of 16 entries)
No Errors Logged

Self-test Log (NVMe Log 0x06)
Self-test status: No self-test in progress
No Self-tests Logged

