smartctl 7.4 2023-08-01 r5530 [FreeBSD 13.2-RELEASE-p11 amd64] (local build)
Copyright (C) 2002-23, Bruce Allen, Christian Franke, www.smartmontools.org

=== START OF INFORMATION SECTION ===
Model Family:     Intel 730 and DC S35x0/3610/3700 Series SSDs
Device Model:     INTEL SSDSC2BB120G6
Serial Number:    --
LU WWN Device Id: 5 5cd2e4 ...
Firmware Version: G2010150
User Capacity:    120,034,123,776 bytes [120 GB]
Sector Sizes:     512 bytes logical, 4096 bytes physical
Rotation Rate:    Solid State Device
Form Factor:      2.5 inches
TRIM Command:     Available, deterministic, zeroed
Device is:        In smartctl database 7.3/5528
ATA Version is:   ACS-2 T13/2015-D revision 3
SATA Version is:  SATA 2.6, 6.0 Gb/s (current: 6.0 Gb/s)
Local Time is:    Wed Jun 19 13:50:24 2024 CEST
SMART support is: Available - device has SMART capability.
SMART support is: Enabled
AAM feature is:   Unavailable
APM feature is:   Unavailable
Rd look-ahead is: Enabled
Write cache is:   Enabled
DSN feature is:   Unavailable
ATA Security is:  Disabled, NOT FROZEN [SEC1]
Wt Cache Reorder: Enabled

=== START OF READ SMART DATA SECTION ===
SMART overall-health self-assessment test result: PASSED

General SMART Values:
Offline data collection status:  (0x02)	Offline data collection activity
					was completed without error.
					Auto Offline Data Collection: Disabled.
Self-test execution status:      (   0)	The previous self-test routine completed
					without error or no self-test has ever 
					been run.
Total time to complete Offline 
data collection: 		(    2) seconds.
Offline data collection
capabilities: 			 (0x79) SMART execute Offline immediate.
					No Auto Offline data collection support.
					Suspend Offline collection upon new
					command.
					Offline surface scan supported.
					Self-test supported.
					Conveyance Self-test supported.
					Selective Self-test supported.
SMART capabilities:            (0x0003)	Saves SMART data before entering
					power-saving mode.
					Supports SMART auto save timer.
Error logging capability:        (0x01)	Error logging supported.
					General Purpose Logging supported.
Short self-test routine 
recommended polling time: 	 (   1) minutes.
Extended self-test routine
recommended polling time: 	 (   2) minutes.
Conveyance self-test routine
recommended polling time: 	 (   2) minutes.
SCT capabilities: 	       (0x003d)	SCT Status supported.
					SCT Error Recovery Control supported.
					SCT Feature Control supported.
					SCT Data Table supported.

SMART Attributes Data Structure revision number: 1
Vendor Specific SMART Attributes with Thresholds:
ID# ATTRIBUTE_NAME          FLAGS    VALUE WORST THRESH FAIL RAW_VALUE
  5 Reallocated_Sector_Ct   -O--CK   100   100   000    -    0
  9 Power_On_Hours          -O--CK   100   100   000    -    10949
 12 Power_Cycle_Count       -O--CK   100   100   000    -    25
170 Available_Reservd_Space PO--CK   100   100   010    -    0
171 Program_Fail_Count      -O--CK   100   100   000    -    0
172 Erase_Fail_Count        -O--CK   100   100   000    -    0
174 Unsafe_Shutdown_Count   -O--CK   100   100   000    -    19
175 Power_Loss_Cap_Test     PO--CK   100   100   010    -    3990 (61 1065)
183 SATA_Downshift_Count    -O--CK   100   100   000    -    0
184 End-to-End_Error        PO--CK   100   100   090    -    0
187 Reported_Uncorrect      -O--CK   100   100   000    -    0
190 Temperature_Case        -O---K   067   067   000    -    33 (Min/Max 18/33)
192 Unsafe_Shutdown_Count   -O--CK   100   100   000    -    19
194 Temperature_Internal    -O---K   100   100   000    -    33
197 Current_Pending_Sector  -O--C-   100   100   000    -    0
199 CRC_Error_Count         -OSRCK   100   100   000    -    176574
225 Host_Writes_32MiB       -O--CK   100   100   000    -    208307
226 Workld_Media_Wear_Indic -O--CK   100   100   000    -    2211
227 Workld_Host_Reads_Perc  -O--CK   100   100   000    -    4
228 Workload_Minutes        -O--CK   100   100   000    -    656910
232 Available_Reservd_Space PO--CK   100   100   010    -    0
233 Media_Wearout_Indicator -O--CK   098   098   000    -    0
234 Thermal_Throttle        -O--CK   100   100   000    -    0/0
241 Host_Writes_32MiB       -O--CK   100   100   000    -    208307
242 Host_Reads_32MiB        -O--CK   100   100   000    -    9862
243 NAND_Writes_32MiB       -O--CK   100   100   000    -    299499
                            ||||||_ K auto-keep
                            |||||__ C event count
                            ||||___ R error rate
                            |||____ S speed/performance
                            ||_____ O updated online
                            |______ P prefailure warning

General Purpose Log Directory Version 1
SMART           Log Directory Version 1 [multi-sector log support]
Address    Access  R/W   Size  Description
0x00       GPL,SL  R/O      1  Log Directory
0x01       GPL,SL  R/O      1  Summary SMART error log
0x02       GPL,SL  R/O      8  Comprehensive SMART error log
0x03       GPL,SL  R/O     20  Ext. Comprehensive SMART error log
0x04       GPL,SL  R/O      8  Device Statistics log
0x06       GPL,SL  R/O      1  SMART self-test log
0x07       GPL,SL  R/O      2  Extended self-test log
0x08       GPL,SL  R/O      2  Power Conditions log
0x09       GPL,SL  R/W      1  Selective self-test log
0x10       GPL,SL  R/O      1  NCQ Command Error log
0x11       GPL,SL  R/O      1  SATA Phy Event Counters log
0x80-0x9f  GPL,SL  R/W     16  Host vendor specific log
0xb0       GPL,SL  VS       1  Device vendor specific log
0xb1       GPL,SL  VS      33  Device vendor specific log
0xb8       GPL,SL  VS       1  Device vendor specific log
0xb9       GPL     VS    1544  Device vendor specific log
0xb9       SL      VS       8  Device vendor specific log
0xba       GPL     VS    1280  Device vendor specific log
0xdf       GPL,SL  VS       1  Device vendor specific log
0xe0       GPL,SL  R/W      1  SCT Command/Status
0xe1       GPL,SL  R/W      1  SCT Data Transfer

SMART Extended Comprehensive Error Log Version: 1 (20 sectors)
Device Error Count: 50287 (device log contains only the most recent 80 errors)
	CR     = Command Register
	FEATR  = Features Register
	COUNT  = Count (was: Sector Count) Register
	LBA_48 = Upper bytes of LBA High/Mid/Low Registers ]  ATA-8
	LH     = LBA High (was: Cylinder High) Register    ]   LBA
	LM     = LBA Mid (was: Cylinder Low) Register      ] Register
	LL     = LBA Low (was: Sector Number) Register     ]
	DV     = Device (was: Device/Head) Register
	DC     = Device Control Register
	ER     = Error register
	ST     = Status register
Powered_Up_Time is measured from power on, and printed as
DDd+hh:mm:SS.sss where DD=days, hh=hours, mm=minutes,
SS=sec, and sss=millisec. It "wraps" after 49.710 days.

Warning! SMART Extended Comprehensive Error Log Structure error: invalid SMART checksum.
Error 50287 [46] occurred at disk power-on lifetime: 7261 hours (302 days + 13 hours)
  When the command that caused the error occurred, the device was active or idle.

  After command completion occurred, registers were:
  ER -- ST COUNT  LBA_48  LH LM LL DV DC
  -- -- -- == -- == == == -- -- -- -- --
  84 -- 41 00 e0 00 48 00 28 00 20 40 00  Error: ICRC, ABRT at LBA = 0x4800280020 = 309240266784

  Commands leading to the command that caused the error were:
  CR FEATR COUNT  LBA_48  LH LM LL DV DC  Powered_Up_Time  Command/Feature_Name
  -- == -- == -- == == == -- -- -- -- --  ---------------  --------------------
  61 00 00 00 e0 00 48 00 28 00 20 40 00 28d+00:31:17.028  WRITE FPDMA QUEUED
  61 00 00 00 10 00 f9 00 44 0d 10 40 00 28d+00:31:17.027  WRITE FPDMA QUEUED
  61 00 00 00 10 00 f9 00 46 0d 10 40 00 28d+00:31:17.027  WRITE FPDMA QUEUED
  60 00 00 00 10 00 f9 00 44 0d 10 40 00 28d+00:31:17.027  READ FPDMA QUEUED
  60 00 00 00 10 00 f9 00 46 0d 10 40 00 28d+00:31:17.027  READ FPDMA QUEUED

Error 50286 [45] occurred at disk power-on lifetime: 7261 hours (302 days + 13 hours)
  When the command that caused the error occurred, the device was active or idle.

  After command completion occurred, registers were:
  ER -- ST COUNT  LBA_48  LH LM LL DV DC
  -- -- -- == -- == == == -- -- -- -- --
  84 -- 41 01 00 00 f9 00 47 0d 00 40 00  Error: ICRC, ABRT at LBA = 0xf900470d00 = 1069451513088

  Commands leading to the command that caused the error were:
  CR FEATR COUNT  LBA_48  LH LM LL DV DC  Powered_Up_Time  Command/Feature_Name
  -- == -- == -- == == == -- -- -- -- --  ---------------  --------------------
  61 00 00 01 00 00 f9 00 47 0d 00 40 00 28d+00:31:16.701  WRITE FPDMA QUEUED
  61 00 00 00 10 00 f9 00 46 0d 10 40 00 28d+00:31:16.701  WRITE FPDMA QUEUED
  61 00 00 00 e0 00 f9 00 46 0d 20 40 00 28d+00:31:16.701  WRITE FPDMA QUEUED
  61 00 00 01 00 00 f9 00 45 0d 00 40 00 28d+00:31:16.701  WRITE FPDMA QUEUED
  61 00 00 00 10 00 f9 00 44 0d 10 40 00 28d+00:31:16.701  WRITE FPDMA QUEUED

Error 50285 [44] occurred at disk power-on lifetime: 7261 hours (302 days + 13 hours)
  When the command that caused the error occurred, the device was active or idle.

  After command completion occurred, registers were:
  ER -- ST COUNT  LBA_48  LH LM LL DV DC
  -- -- -- == -- == == == -- -- -- -- --
  84 -- 41 01 00 00 48 00 29 00 00 40 00  Error: ICRC, ABRT at LBA = 0x4800290000 = 309240332288

  Commands leading to the command that caused the error were:
  CR FEATR COUNT  LBA_48  LH LM LL DV DC  Powered_Up_Time  Command/Feature_Name
  -- == -- == -- == == == -- -- -- -- --  ---------------  --------------------
  61 00 00 01 00 00 48 00 29 00 00 40 00 28d+00:31:16.072  WRITE FPDMA QUEUED
  61 00 00 00 10 00 48 00 28 00 10 40 00 28d+00:31:16.072  WRITE FPDMA QUEUED
  61 00 00 00 e0 00 48 00 28 00 20 40 00 28d+00:31:16.072  WRITE FPDMA QUEUED
  60 00 00 00 e0 00 f9 00 44 0d 20 40 00 28d+00:31:16.069  READ FPDMA QUEUED
  60 00 00 00 e0 00 48 00 2a 00 20 40 00 28d+00:31:16.069  READ FPDMA QUEUED

Warning! SMART Extended Comprehensive Error Log Structure error: invalid SMART checksum.
Error 50284 [43] occurred at disk power-on lifetime: 7261 hours (302 days + 13 hours)
  When the command that caused the error occurred, the device was active or idle.

  After command completion occurred, registers were:
  ER -- ST COUNT  LBA_48  LH LM LL DV DC
  -- -- -- == -- == == == -- -- -- -- --
  84 -- 41 01 e0 00 f9 00 44 0d 20 40 00  Error: ICRC, ABRT at LBA = 0xf900440d20 = 1069451316512

  Commands leading to the command that caused the error were:
  CR FEATR COUNT  LBA_48  LH LM LL DV DC  Powered_Up_Time  Command/Feature_Name
  -- == -- == -- == == == -- -- -- -- --  ---------------  --------------------
  61 00 00 01 e0 00 f9 00 44 0d 20 40 00 28d+00:31:15.462  WRITE FPDMA QUEUED
  ef 00 02 00 00 00 00 00 00 00 00 40 08 28d+00:31:15.462  SET FEATURES [Enable write cache]
  ef 00 aa 00 00 00 00 00 00 00 00 40 08 28d+00:31:15.461  SET FEATURES [Enable read look-ahead]
  c6 00 00 00 01 00 00 00 00 00 00 40 08 28d+00:31:15.461  SET MULTIPLE MODE
  ef 00 03 00 46 00 00 00 00 00 00 40 08 28d+00:31:15.461  SET FEATURES [Set transfer mode]

Error 50283 [42] occurred at disk power-on lifetime: 7261 hours (302 days + 13 hours)
  When the command that caused the error occurred, the device was active or idle.

  After command completion occurred, registers were:
  ER -- ST COUNT  LBA_48  LH LM LL DV DC
  -- -- -- == -- == == == -- -- -- -- --
  84 -- 41 01 e0 00 f9 00 44 0d 20 40 00  Error: ICRC, ABRT at LBA = 0xf900440d20 = 1069451316512

  Commands leading to the command that caused the error were:
  CR FEATR COUNT  LBA_48  LH LM LL DV DC  Powered_Up_Time  Command/Feature_Name
  -- == -- == -- == == == -- -- -- -- --  ---------------  --------------------
  61 00 00 01 e0 00 f9 00 44 0d 20 40 00 28d+00:31:15.218  WRITE FPDMA QUEUED
  ef 00 02 00 00 00 00 00 00 00 00 40 08 28d+00:31:15.217  SET FEATURES [Enable write cache]
  ef 00 aa 00 00 00 00 00 00 00 00 40 08 28d+00:31:15.217  SET FEATURES [Enable read look-ahead]
  c6 00 00 00 01 00 00 00 00 00 00 40 08 28d+00:31:15.217  SET MULTIPLE MODE
  ef 00 03 00 46 00 00 00 00 00 00 40 08 28d+00:31:15.217  SET FEATURES [Set transfer mode]

Error 50282 [41] occurred at disk power-on lifetime: 7261 hours (302 days + 13 hours)
  When the command that caused the error occurred, the device was active or idle.

  After command completion occurred, registers were:
  ER -- ST COUNT  LBA_48  LH LM LL DV DC
  -- -- -- == -- == == == -- -- -- -- --
  84 -- 41 01 e0 00 f9 00 44 0d 20 40 00  Error: ICRC, ABRT at LBA = 0xf900440d20 = 1069451316512

  Commands leading to the command that caused the error were:
  CR FEATR COUNT  LBA_48  LH LM LL DV DC  Powered_Up_Time  Command/Feature_Name
  -- == -- == -- == == == -- -- -- -- --  ---------------  --------------------
  61 00 00 01 e0 00 f9 00 44 0d 20 40 00 28d+00:31:15.111  WRITE FPDMA QUEUED
  60 00 00 02 00 00 f9 00 44 0d 00 40 00 28d+00:31:15.095  READ FPDMA QUEUED
  ef 00 02 00 00 00 00 00 00 00 00 40 08 28d+00:31:15.094  SET FEATURES [Enable write cache]
  ef 00 aa 00 00 00 00 00 00 00 00 40 08 28d+00:31:15.094  SET FEATURES [Enable read look-ahead]
  c6 00 00 00 01 00 00 00 00 00 00 40 08 28d+00:31:15.094  SET MULTIPLE MODE

Error 50281 [40] occurred at disk power-on lifetime: 7261 hours (302 days + 13 hours)
  When the command that caused the error occurred, the device was active or idle.

  After command completion occurred, registers were:
  ER -- ST COUNT  LBA_48  LH LM LL DV DC
  -- -- -- == -- == == == -- -- -- -- --
  84 -- 41 01 e0 00 48 00 2a 00 20 40 00  Error: ICRC, ABRT at LBA = 0x48002a0020 = 309240397856

  Commands leading to the command that caused the error were:
  CR FEATR COUNT  LBA_48  LH LM LL DV DC  Powered_Up_Time  Command/Feature_Name
  -- == -- == -- == == == -- -- -- -- --  ---------------  --------------------
  61 00 00 01 e0 00 48 00 2a 00 20 40 00 28d+00:31:14.850  WRITE FPDMA QUEUED
  ef 00 02 00 00 00 00 00 00 00 00 40 08 28d+00:31:14.850  SET FEATURES [Enable write cache]
  ef 00 aa 00 00 00 00 00 00 00 00 40 08 28d+00:31:14.850  SET FEATURES [Enable read look-ahead]
  c6 00 00 00 01 00 00 00 00 00 00 40 08 28d+00:31:14.850  SET MULTIPLE MODE
  ef 00 03 00 46 00 00 00 00 00 00 40 08 28d+00:31:14.849  SET FEATURES [Set transfer mode]

Warning! SMART Extended Comprehensive Error Log Structure error: invalid SMART checksum.
Error 50280 [39] occurred at disk power-on lifetime: 7261 hours (302 days + 13 hours)
  When the command that caused the error occurred, the device was active or idle.

  After command completion occurred, registers were:
  ER -- ST COUNT  LBA_48  LH LM LL DV DC
  -- -- -- == -- == == == -- -- -- -- --
  84 -- 41 01 e0 00 48 00 2a 00 20 40 00  Error: ICRC, ABRT at LBA = 0x48002a0020 = 309240397856

  Commands leading to the command that caused the error were:
  CR FEATR COUNT  LBA_48  LH LM LL DV DC  Powered_Up_Time  Command/Feature_Name
  -- == -- == -- == == == -- -- -- -- --  ---------------  --------------------
  61 00 00 01 e0 00 48 00 2a 00 20 40 00 28d+00:31:14.635  WRITE FPDMA QUEUED
  ef 00 02 00 00 00 00 00 00 00 00 40 08 28d+00:31:14.619  SET FEATURES [Enable write cache]
  ef 00 aa 00 00 00 00 00 00 00 00 40 08 28d+00:31:14.619  SET FEATURES [Enable read look-ahead]
  c6 00 00 00 01 00 00 00 00 00 00 40 08 28d+00:31:14.619  SET MULTIPLE MODE
  ef 00 03 00 46 00 00 00 00 00 00 40 08 28d+00:31:14.619  SET FEATURES [Set transfer mode]

SMART Extended Self-test Log Version: 1 (2 sectors)
Num  Test_Description    Status                  Remaining  LifeTime(hours)  LBA_of_first_error
# 1  Short offline       Completed without error       00%      5480         -
# 2  Short offline       Completed without error       00%      1235         -
# 3  Short offline       Completed without error       00%      1211         -
# 4  Short offline       Completed without error       00%      1187         -
# 5  Short offline       Completed without error       00%      1163         -
# 6  Short offline       Completed without error       00%      1139         -
# 7  Short offline       Completed without error       00%      1115         -
# 8  Short offline       Completed without error       00%      1091         -
# 9  Short offline       Completed without error       00%      1067         -
#10  Short offline       Completed without error       00%      1043         -
#11  Short offline       Completed without error       00%      1019         -
#12  Short offline       Completed without error       00%       995         -
#13  Short offline       Completed without error       00%       971         -
#14  Short offline       Completed without error       00%       947         -
#15  Short offline       Completed without error       00%       923         -
#16  Short offline       Completed without error       00%       899         -
#17  Short offline       Completed without error       00%       875         -
#18  Short offline       Completed without error       00%       851         -
#19  Short offline       Completed without error       00%       827         -
#20  Extended offline    Completed without error       00%        15         -
#21  Offline             Completed without error       00%        14         -
#22  Short offline       Completed without error       00%        14         -

SMART Selective self-test log data structure revision number 1
 SPAN  MIN_LBA  MAX_LBA  CURRENT_TEST_STATUS
    1        0        0  Not_testing
    2        0        0  Not_testing
    3        0        0  Not_testing
    4        0        0  Not_testing
    5        0        0  Not_testing
Selective self-test flags (0x0):
  After scanning selected spans, do NOT read-scan remainder of disk.
If Selective self-test is pending on power-up, resume after 0 minute delay.

SCT Status Version:                  3
SCT Version (vendor specific):       1 (0x0001)
Device State:                        Active (0)
Current Temperature:                    33 Celsius
Power Cycle Min/Max Temperature:     18/33 Celsius
Lifetime    Min/Max Temperature:     14/39 Celsius
Specified Max Operating Temperature:    70 Celsius
Under/Over Temperature Limit Count:   0/0
Vendor specific:
00 00 5f 00 00 00 00 00 00 00 00 00 00 00 00 00
00 00 00 00 00 00 00 00 00 00 00 00 00 00 00 00

SCT Temperature History Version:     2
Temperature Sampling Period:         1 minute
Temperature Logging Interval:        1 minute
Min/Max recommended Temperature:      0/70 Celsius
Min/Max Temperature Limit:            0/70 Celsius
Temperature History Size (Index):    478 (226)

SCT Error Recovery Control:
           Read: Disabled
          Write: Disabled

Device Statistics (GP Log 0x04)
Page  Offset Size        Value Flags Description
0x01  =====  =               =  ===  == General Statistics (rev 2) ==
0x01  0x008  4              25  ---  Lifetime Power-On Resets
0x01  0x018  6     13651619981  ---  Logical Sectors Written
0x01  0x020  6       398951163  ---  Number of Write Commands
0x01  0x028  6       646321068  ---  Logical Sectors Read
0x01  0x030  6         5440729  ---  Number of Read Commands
0x04  =====  =               =  ===  == General Errors Statistics (rev 1) ==
0x04  0x008  4               0  ---  Number of Reported Uncorrectable Errors
0x04  0x010  4           11310  ---  Resets Between Cmd Acceptance and Completion
0x05  =====  =               =  ===  == Temperature Statistics (rev 1) ==
0x05  0x008  1              33  ---  Current Temperature
0x05  0x010  1              32  ---  Average Short Term Temperature
0x05  0x018  1              29  ---  Average Long Term Temperature
0x05  0x020  1              39  ---  Highest Temperature
0x05  0x028  1              15  ---  Lowest Temperature
0x05  0x030  1              37  ---  Highest Average Short Term Temperature
0x05  0x038  1              16  ---  Lowest Average Short Term Temperature
0x05  0x040  1              35  ---  Highest Average Long Term Temperature
0x05  0x048  1              21  ---  Lowest Average Long Term Temperature
0x05  0x050  4               0  ---  Time in Over-Temperature
0x05  0x058  1              70  ---  Specified Maximum Operating Temperature
0x05  0x060  4               0  ---  Time in Under-Temperature
0x05  0x068  1               0  ---  Specified Minimum Operating Temperature
0x06  =====  =               =  ===  == Transport Statistics (rev 1) ==
0x06  0x008  4           63853  ---  Number of Hardware Resets
0x06  0x010  4           62752  ---  Number of ASR Events
0x06  0x018  4          176574  ---  Number of Interface CRC Errors
0x07  =====  =               =  ===  == Solid State Device Statistics (rev 1) ==
0x07  0x008  1               2  ---  Percentage Used Endurance Indicator
                                |||_ C monitored condition met
                                ||__ D supports DSN
                                |___ N normalized value

Pending Defects log (GP Log 0x0c) not supported

SATA Phy Event Counters (GP Log 0x11)
ID      Size     Value  Description
0x0001  4            0  Command failed due to ICRC error
0x0003  4            0  R_ERR response for device-to-host data FIS
0x0004  4            0  R_ERR response for host-to-device data FIS
0x0006  4            0  R_ERR response for device-to-host non-data FIS
0x000a  4           27  Device-to-host register FISes sent due to a COMRESET
0x000b  4            0  CRC errors within host-to-device FIS
0x000d  4            0  Non-CRC errors within host-to-device FIS

