smartctl 7.4 2023-08-01 r5530 [FreeBSD 13.2-RELEASE-p5 amd64] (local build)
Copyright (C) 2002-23, Bruce Allen, Christian Franke, www.smartmontools.org

=== START OF INFORMATION SECTION ===
Model Number:                       Samsung SSD 980 250GB
Serial Number:                      --
Firmware Version:                   3B4QFXO7
PCI Vendor/Subsystem ID:            0x144d
IEEE OUI Identifier:                0x002538
Total NVM Capacity:                 250,059,350,016 [250 GB]
Unallocated NVM Capacity:           0
Controller ID:                      5
NVMe Version:                       1.4
Number of Namespaces:               1
Namespace 1 Size/Capacity:          250,059,350,016 [250 GB]
Namespace 1 Utilization:            11,538,681,856 [11.5 GB]
Namespace 1 Formatted LBA Size:     512
Namespace 1 IEEE EUI-64:            002538 ...
Local Time is:                      Sat Nov 25 21:51:45 2023 CST
Firmware Updates (0x16):            3 Slots, no Reset required
Optional Admin Commands (0x0017):   Security Format Frmw_DL Self_Test
Optional NVM Commands (0x0055):     Comp DS_Mngmt Sav/Sel_Feat Timestmp
Log Page Attributes (0x0f):         S/H_per_NS Cmd_Eff_Lg Ext_Get_Lg Telmtry_Lg
Maximum Data Transfer Size:         512 Pages
Warning  Comp. Temp. Threshold:     82 Celsius
Critical Comp. Temp. Threshold:     85 Celsius
Namespace 1 Features (0x10):        NP_Fields

Supported Power States
St Op     Max   Active     Idle   RL RT WL WT  Ent_Lat  Ex_Lat
 0 +     5.24W       -        -    0  0  0  0        0       0

Supported LBA Sizes (NSID 0x1)
Id Fmt  Data  Metadt  Rel_Perf
 0 +     512       0         0

=== START OF SMART DATA SECTION ===
SMART overall-health self-assessment test result: PASSED

SMART/Health Information (NVMe Log 0x02)
Critical Warning:                   0x00
Temperature:                        21 Celsius
Available Spare:                    100%
Available Spare Threshold:          10%
Percentage Used:                    2%
Data Units Read:                    49,977,970 [25.5 TB]
Data Units Written:                 7,936,238 [4.06 TB]
Host Read Commands:                 279,677,159
Host Write Commands:                202,767,813
Controller Busy Time:               824
Power Cycles:                       570
Power On Hours:                     3,287
Unsafe Shutdowns:                   454
Media and Data Integrity Errors:    0
Error Information Log Entries:      0
Warning  Comp. Temperature Time:    0
Critical Comp. Temperature Time:    0
Temperature Sensor 1:               21 Celsius
Temperature Sensor 2:               33 Celsius

Error Information (NVMe Log 0x01, 16 of 64 entries)
No Errors Logged

Self-test Log (NVMe Log 0x06)
Self-test status: No self-test in progress
Num  Test_Description  Status                       Power_on_Hours  Failing_LBA  NSID Seg SCT Code
 0   Short             Aborted: Self-test command             3099            -     -   -   -    -
 1   Extended          Aborted: Self-test command             3099            -     -   -   -    -
 2   Short             Completed without error                3099            -     -   -   -    -
 3   Short             Completed without error                2683            -     -   -   -    -
 4   Extended          Completed without error                2627            -     -   -   -    -
 5   Short             Completed without error                2627            -     -   -   -    -
 6   Extended          Completed without error                2431            -     -   -   -    -
 7   Short             Completed without error                2430            -     -   -   -    -
 8   Extended          Completed without error                2295            -     -   -   -    -
 9   Short             Completed without error                2295            -     -   -   -    -
10   Extended          Completed without error                2278            -     -   -   -    -
11   Extended          Completed without error                2250            -     -   -   -    -
12   Short             Aborted: Self-test command             2249            -     -   -   -    -
13   Short             Aborted: Controller Reset              2244            -     -   -   -    -
14   Short             Completed without error                2244            -     -   -   -    -
15   Extended          Completed without error                 897            -     -   -   -    -
16   Short             Aborted: Self-test command              896            -     -   -   -    -
17   Extended          Aborted: Self-test command              776            -     -   -   -    -
18   Extended          Completed without error                 775            -     -   -   -    -
19   Short             Aborted: Self-test command              775            -     -   -   -    -

