smartctl 7.3 2022-02-28 r5338 [OpenBSD 7.1 amd64] (local build)
Copyright (C) 2002-22, Bruce Allen, Christian Franke, www.smartmontools.org

=== START OF INFORMATION SECTION ===
Model Family:     JMicron/Maxiotek based SSDs
Device Model:     NT-512
Serial Number:    --
LU WWN Device Id: 5 000000 ...
Firmware Version: H190313
User Capacity:    512,110,190,592 bytes [512 GB]
Sector Size:      512 bytes logical/physical
Rotation Rate:    Solid State Device
Form Factor:      2.5 inches
TRIM Command:     Available, deterministic, zeroed
Device is:        In smartctl database 7.3/5319
ATA Version is:   ACS-2 (minor revision not indicated)
SATA Version is:  SATA 3.2, 6.0 Gb/s (current: 6.0 Gb/s)
Local Time is:    Fri Apr 22 21:32:07 2022 +10
SMART support is: Available - device has SMART capability.
SMART support is: Enabled

=== START OF READ SMART DATA SECTION ===
SMART Status not supported: Incomplete response, ATA output registers missing
SMART overall-health self-assessment test result: PASSED
Warning: This result is based on an Attribute check.

General SMART Values:
Offline data collection status:  (0x00)	Offline data collection activity
					was never started.
					Auto Offline Data Collection: Disabled.
Self-test execution status:      (   0)	The previous self-test routine completed
					without error or no self-test has ever 
					been run.
Total time to complete Offline 
data collection: 		(   33) seconds.
Offline data collection
capabilities: 			 (0x7b) SMART execute Offline immediate.
					Auto Offline data collection on/off support.
					Suspend Offline collection upon new
					command.
					Offline surface scan supported.
					Self-test supported.
					Conveyance Self-test supported.
					Selective Self-test supported.
SMART capabilities:            (0x0003)	Saves SMART data before entering
					power-saving mode.
					Supports SMART auto save timer.
Error logging capability:        (0x01)	Error logging supported.
					General Purpose Logging supported.
Short self-test routine 
recommended polling time: 	 (   2) minutes.
Extended self-test routine
recommended polling time: 	 (   2) minutes.
Conveyance self-test routine
recommended polling time: 	 (   2) minutes.
SCT capabilities: 	       (0x0039)	SCT Status supported.
					SCT Error Recovery Control supported.
					SCT Feature Control supported.
					SCT Data Table supported.

SMART Attributes Data Structure revision number: 16
Vendor Specific SMART Attributes with Thresholds:
ID# ATTRIBUTE_NAME          FLAG     VALUE WORST THRESH TYPE      UPDATED  WHEN_FAILED RAW_VALUE
  9 Power_On_Hours          0x0012   100   100   000    Old_age   Always       -       5446
 12 Power_Cycle_Count       0x0012   100   100   000    Old_age   Always       -       580
167 Unknown_JMF_Attribute   0x0022   100   100   000    Old_age   Always       -       0
168 SATA_Phy_Error_Count    0x0012   100   100   000    Old_age   Always       -       0
169 Unknown_JMF_Attribute   0x0013   094   094   010    Pre-fail  Always       -       28311579
171 Unknown_Attribute       0x0032   000   000   000    Old_age   Always       -       0
172 Unknown_Attribute       0x0032   000   000   000    Old_age   Always       -       0
173 Erase_Count             0x0012   200   200   000    Old_age   Always       -       2 59 21
175 Bad_Cluster_Table_Count 0x0022   100   100   010    Old_age   Always       -       0
180 Unknown_JMF_Attribute   0x0033   100   100   000    Pre-fail  Always       -       7200
187 Unknown_JMF_Attribute   0x0032   100   000   000    Old_age   Always       -       0
192 Unexpect_Power_Loss_Ct  0x0012   100   100   000    Old_age   Always       -       73
194 Temperature_Celsius     0x0022   030   030   000    Old_age   Always       -       30 (Min/Max 10/50)
206 Unknown_SSD_Attribute   0x0032   200   200   000    Old_age   Always       -       2
207 Unknown_SSD_Attribute   0x0032   200   200   000    Old_age   Always       -       59
208 Unknown_SSD_Attribute   0x0032   200   200   000    Old_age   Always       -       21
209 Unknown_SSD_Attribute   0x0032   200   200   000    Old_age   Always       -       1230
210 Unknown_Attribute       0x0032   200   200   000    Old_age   Always       -       1247
211 Unknown_Attribute       0x0032   200   200   000    Old_age   Always       -       1131
231 Unknown_JMF_Attribute   0x0023   100   100   005    Pre-fail  Always       -       0
241 Total_LBAs_Written      0x0032   100   100   000    Old_age   Always       -       13969770765
242 Total_LBAs_Read         0x0032   100   100   000    Old_age   Always       -       38767938557
245 Unknown_Attribute       0x0032   100   100   000    Old_age   Always       -       0

SMART Error Log Version: 1
No Errors Logged

SMART Self-test log structure revision number 1
No self-tests have been logged.  [To run self-tests, use: smartctl -t]

SMART Selective self-test log data structure revision number 1
 SPAN  MIN_LBA  MAX_LBA  CURRENT_TEST_STATUS
    1        0        0  Not_testing
    2        0        0  Not_testing
    3        0        0  Not_testing
    4        0        0  Not_testing
    5        0        0  Not_testing
Selective self-test flags (0x0):
  After scanning selected spans, do NOT read-scan remainder of disk.
If Selective self-test is pending on power-up, resume after 0 minute delay.

