smartctl 7.4 2023-08-01 r5530 [FreeBSD 14.2-RELEASE-p2 amd64] (local build)
Copyright (C) 2002-23, Bruce Allen, Christian Franke, www.smartmontools.org

=== START OF INFORMATION SECTION ===
Model Family:     Silicon Motion based SSDs
Device Model:     TS240GSSD220S
Serial Number:    --
LU WWN Device Id: 5 7c3548 ...
Firmware Version: R0510A0
User Capacity:    240,057,409,536 bytes [240 GB]
Sector Size:      512 bytes logical/physical
Rotation Rate:    Solid State Device
Form Factor:      2.5 inches
TRIM Command:     Available, deterministic
Device is:        In smartctl database 7.3/5528
ATA Version is:   ACS-2 T13/2015-D revision 3
SATA Version is:  SATA 3.2, 6.0 Gb/s (current: 6.0 Gb/s)
Local Time is:    Sun Apr 20 01:15:50 2025 MSK
SMART support is: Available - device has SMART capability.
SMART support is: Enabled
AAM feature is:   Unavailable
APM level is:     128 (minimum power consumption without standby)
Rd look-ahead is: Enabled
Write cache is:   Enabled
DSN feature is:   Unavailable
ATA Security is:  Disabled, frozen [SEC2]
Wt Cache Reorder: Unavailable

=== START OF READ SMART DATA SECTION ===
SMART overall-health self-assessment test result: PASSED

General SMART Values:
Offline data collection status:  (0x00)	Offline data collection activity
					was never started.
					Auto Offline Data Collection: Disabled.
Self-test execution status:      (   0)	The previous self-test routine completed
					without error or no self-test has ever 
					been run.
Total time to complete Offline 
data collection: 		(  120) seconds.
Offline data collection
capabilities: 			 (0x11) SMART execute Offline immediate.
					No Auto Offline data collection support.
					Suspend Offline collection upon new
					command.
					No Offline surface scan supported.
					Self-test supported.
					No Conveyance Self-test supported.
					No Selective Self-test supported.
SMART capabilities:            (0x0002)	Does not save SMART data before
					entering power-saving mode.
					Supports SMART auto save timer.
Error logging capability:        (0x01)	Error logging supported.
					General Purpose Logging supported.
Short self-test routine 
recommended polling time: 	 (   2) minutes.
Extended self-test routine
recommended polling time: 	 (  10) minutes.

SMART Attributes Data Structure revision number: 1
Vendor Specific SMART Attributes with Thresholds:
ID# ATTRIBUTE_NAME          FLAGS    VALUE WORST THRESH FAIL RAW_VALUE
  1 Raw_Read_Error_Rate     -O--CK   100   100   050    -    0
  5 Reallocated_Sector_Ct   -O--CK   100   100   050    -    0
  9 Power_On_Hours          -O--CK   100   100   050    -    1907
 12 Power_Cycle_Count       -O--CK   100   100   050    -    726
160 Uncorrectable_Error_Cnt -O--CK   100   100   050    -    0
161 Valid_Spare_Block_Cnt   PO--CK   100   100   050    -    100
163 Initial_Bad_Block_Count -O--CK   100   100   050    -    27
164 Total_Erase_Count       -O--CK   100   100   050    -    16656
165 Max_Erase_Count         -O--CK   100   100   050    -    42
166 Min_Erase_Count         -O--CK   100   100   050    -    20
167 Average_Erase_Count     -O--CK   100   100   050    -    34
168 Max_Erase_Count_of_Spec -O--CK   100   100   050    -    1500
169 Remaining_Lifetime_Perc -O--CK   100   100   050    -    98
175 Program_Fail_Count_Chip -O--CK   100   100   050    -    0
176 Erase_Fail_Count_Chip   -O--CK   100   100   050    -    0
177 Wear_Leveling_Count     -O--CK   100   100   050    -    0
178 Runtime_Invalid_Blk_Cnt -O--CK   100   100   050    -    0
181 Program_Fail_Cnt_Total  -O--CK   100   100   050    -    0
182 Erase_Fail_Count_Total  -O--CK   100   100   050    -    0
192 Power-Off_Retract_Count -O--CK   100   100   050    -    443
194 Temperature_Celsius     -O---K   100   100   050    -    43
195 Hardware_ECC_Recovered  -O--CK   100   100   050    -    0
196 Reallocated_Event_Count -O--CK   100   100   050    -    0
197 Current_Pending_Sector  -O--CK   100   100   050    -    0
198 Offline_Uncorrectable   -O--CK   100   100   050    -    0
199 UDMA_CRC_Error_Count    -O--CK   100   100   050    -    1
232 Available_Reservd_Space -O--CK   100   100   050    -    100
241 Host_Writes_32MiB       ----CK   100   100   050    -    75408
242 Host_Reads_32MiB        ----CK   100   100   050    -    91326
245 TLC_Writes_32MiB        -O--CK   100   100   050    -    54987
                            ||||||_ K auto-keep
                            |||||__ C event count
                            ||||___ R error rate
                            |||____ S speed/performance
                            ||_____ O updated online
                            |______ P prefailure warning

General Purpose Log Directory Version 1
SMART           Log Directory Version 1 [multi-sector log support]
Address    Access  R/W   Size  Description
0x00       GPL,SL  R/O      1  Log Directory
0x01           SL  R/O      1  Summary SMART error log
0x02           SL  R/O      1  Comprehensive SMART error log
0x03       GPL     R/O      1  Ext. Comprehensive SMART error log
0x04       GPL,SL  R/O      8  Device Statistics log
0x06           SL  R/O      1  SMART self-test log
0x07       GPL     R/O      1  Extended self-test log
0x10       GPL     R/O      1  NCQ Command Error log
0x11       GPL     R/O      1  SATA Phy Event Counters log
0x30       GPL,SL  R/O      9  IDENTIFY DEVICE data log
0x80-0x9f  GPL,SL  R/W     16  Host vendor specific log
0xde       GPL     VS       8  Device vendor specific log

SMART Extended Comprehensive Error Log Version: 1 (1 sectors)
Device Error Count: 225 (device log contains only the most recent 4 errors)
	CR     = Command Register
	FEATR  = Features Register
	COUNT  = Count (was: Sector Count) Register
	LBA_48 = Upper bytes of LBA High/Mid/Low Registers ]  ATA-8
	LH     = LBA High (was: Cylinder High) Register    ]   LBA
	LM     = LBA Mid (was: Cylinder Low) Register      ] Register
	LL     = LBA Low (was: Sector Number) Register     ]
	DV     = Device (was: Device/Head) Register
	DC     = Device Control Register
	ER     = Error register
	ST     = Status register
Powered_Up_Time is measured from power on, and printed as
DDd+hh:mm:SS.sss where DD=days, hh=hours, mm=minutes,
SS=sec, and sss=millisec. It "wraps" after 49.710 days.

Error 225 [0] log entry is empty
Error 224 [3] log entry is empty
Error 223 [2] log entry is empty
Error 222 [1] occurred at disk power-on lifetime: 0 hours (0 days + 0 hours)
  When the command that caused the error occurred, the device was active or idle.

  After command completion occurred, registers were:
  ER -- ST COUNT  LBA_48  LH LM LL DV DC
  -- -- -- == -- == == == -- -- -- -- --
  00 -- 00 00 00 00 00 00 00 00 00 00 00

  Commands leading to the command that caused the error were:
  CR FEATR COUNT  LBA_48  LH LM LL DV DC  Powered_Up_Time  Command/Feature_Name
  -- == -- == -- == == == -- -- -- -- --  ---------------  --------------------
  b0 00 d1 01 01 00 00 4f 00 c2 01 40 08     00:00:00.000  SMART READ ATTRIBUTE THRESHOLDS [OBS-4]
  2f 00 00 01 01 00 00 00 00 00 03 40 08     00:00:00.000  READ LOG EXT
  2f 00 00 01 01 00 00 00 00 00 00 40 08     00:00:00.000  READ LOG EXT
  b0 00 d5 01 01 00 00 4f 00 c2 00 40 08     00:00:00.000  SMART READ LOG
  b0 00 da 00 00 00 00 4f 00 c2 00 40 08     00:00:00.000  SMART RETURN STATUS

SMART Extended Self-test Log Version: 1 (1 sectors)
Num  Test_Description    Status                  Remaining  LifeTime(hours)  LBA_of_first_error
# 1  Short offline       Completed without error       00%      1729         -
# 2  Offline             Aborted by host               00%       607         -
# 3  Offline             Aborted by host               00%       607         -
# 4  Offline             Aborted by host               00%       607         -
# 5  Offline             Aborted by host               00%       607         -

Selective Self-tests/Logging not supported

SCT Commands not supported

Device Statistics (GP Log 0x04)
Page  Offset Size        Value Flags Description
0x01  =====  =               =  ===  == General Statistics (rev 1) ==
0x01  0x008  4             726  ---  Lifetime Power-On Resets
0x01  0x010  4            1907  ---  Power-on Hours
0x01  0x018  6       647026404  ---  Logical Sectors Written
0x01  0x020  6           20901  ---  Number of Write Commands
0x01  0x028  6      1690187679  ---  Logical Sectors Read
0x01  0x030  6           14443  ---  Number of Read Commands
0x07  =====  =               =  ===  == Solid State Device Statistics (rev 1) ==
0x07  0x008  1               2  ---  Percentage Used Endurance Indicator
                                |||_ C monitored condition met
                                ||__ D supports DSN
                                |___ N normalized value

Pending Defects log (GP Log 0x0c) not supported

SATA Phy Event Counters (GP Log 0x11)
ID      Size     Value  Description
0x0001  4            0  Command failed due to ICRC error
0x0002  4            0  R_ERR response for data FIS
0x0005  4            0  R_ERR response for non-data FIS
0x000a  4            2  Device-to-host register FISes sent due to a COMRESET

