smartctl 7.2 2020-12-30 r5155 [FreeBSD 12.1-RELEASE-p12-HBSD amd64] (local build)
Copyright (C) 2002-20, Bruce Allen, Christian Franke, www.smartmontools.org

=== START OF INFORMATION SECTION ===
Model Number:                       SAMSUNG MZVPW128HEGM-00000
Serial Number:                      --
Firmware Version:                   CXZ7400Q
PCI Vendor/Subsystem ID:            0x144d
IEEE OUI Identifier:                0x002538
Total NVM Capacity:                 128,035,676,160 [128 GB]
Unallocated NVM Capacity:           0
Controller ID:                      2
NVMe Version:                       1.2
Number of Namespaces:               1
Namespace 1 Size/Capacity:          128,035,676,160 [128 GB]
Namespace 1 Utilization:            39,884,423,168 [39.8 GB]
Namespace 1 Formatted LBA Size:     512
Namespace 1 IEEE EUI-64:            002538 ...
Local Time is:                      Sat Jan 23 13:26:58 2021 CET
Firmware Updates (0x16):            3 Slots, no Reset required
Optional Admin Commands (0x0017):   Security Format Frmw_DL Self_Test
Optional NVM Commands (0x001f):     Comp Wr_Unc DS_Mngmt Wr_Zero Sav/Sel_Feat
Log Page Attributes (0x03):         S/H_per_NS Cmd_Eff_Lg
Warning  Comp. Temp. Threshold:     70 Celsius
Critical Comp. Temp. Threshold:     73 Celsius

Supported Power States
St Op     Max   Active     Idle   RL RT WL WT  Ent_Lat  Ex_Lat
 0 +     6.80W       -        -    0  0  0  0        0       0
 1 +     5.60W       -        -    1  1  1  1        0       0
 2 +     4.40W       -        -    2  2  2  2        0       0
 3 -   0.0400W       -        -    3  3  3  3      210    1500
 4 -   0.0050W       -        -    4  4  4  4     2200    6000

Supported LBA Sizes (NSID 0x1)
Id Fmt  Data  Metadt  Rel_Perf
 0 +     512       0         0

=== START OF SMART DATA SECTION ===
SMART overall-health self-assessment test result: PASSED

SMART/Health Information (NVMe Log 0x02)
Critical Warning:                   0x00
Temperature:                        47 Celsius
Available Spare:                    100%
Available Spare Threshold:          10%
Percentage Used:                    1%
Data Units Read:                    1,072,898 [549 GB]
Data Units Written:                 5,483,729 [2.80 TB]
Host Read Commands:                 4,633,241
Host Write Commands:                80,105,612
Controller Busy Time:               35
Power Cycles:                       59
Power On Hours:                     4,151
Unsafe Shutdowns:                   31
Media and Data Integrity Errors:    0
Error Information Log Entries:      374
Warning  Comp. Temperature Time:    0
Critical Comp. Temperature Time:    0
Temperature Sensor 1:               47 Celsius
Temperature Sensor 2:               66 Celsius

Error Information (NVMe Log 0x01, 16 of 64 entries)
Num   ErrCount  SQId   CmdId  Status  PELoc          LBA  NSID    VS
  0        374     0  0x001e  0x4004  0x02c            0     0     -
  1        373     0  0x001d  0x4004  0x02c            0     0     -
  2        372     0  0x017f  0x4202  0x028            0     0     -
  3        371     0  0x017e  0x4202  0x028            0     0     -
  4        370     0  0x017d  0x4202  0x028            0     0     -
  5        369     0  0x017c  0x4202  0x028            0     0     -
  6        368     0  0x017b  0x4202  0x028            0     0     -
  7        367     0  0x017a  0x4202  0x028            0     0     -
  8        366     0  0x0179  0x4202  0x028            0     0     -
  9        365     0  0x0178  0x4202  0x028            0     0     -
 10        364     0  0x0177  0x4202  0x028            0     0     -
 11        363     0  0x0176  0x4202  0x028            0     0     -
 12        362     0  0x0175  0x4202  0x028            0     0     -
 13        361     0  0x0174  0x4202  0x028            0     0     -
 14        360     0  0x0173  0x4202  0x028            0     0     -
 15        359     0  0x0172  0x4202  0x028            0     0     -
... (48 entries not read)

