smartctl 7.3 2022-02-28 r5338 [FreeBSD 13.1-RELEASE amd64] (local build)
Copyright (C) 2002-22, Bruce Allen, Christian Franke, www.smartmontools.org

=== START OF INFORMATION SECTION ===
Model Number:                       KIOXIA-EXCERIA PLUS G2 SSD
Serial Number:                      --
Firmware Version:                   ECFA11.3
PCI Vendor/Subsystem ID:            0x1e0f
IEEE OUI Identifier:                0x8ce38e
Total NVM Capacity:                 1,000,204,886,016 [1.00 TB]
Unallocated NVM Capacity:           0
Controller ID:                      1
NVMe Version:                       1.3
Number of Namespaces:               1
Namespace 1 Size/Capacity:          1,000,204,886,016 [1.00 TB]
Namespace 1 Formatted LBA Size:     512
Namespace 1 IEEE EUI-64:            8ce38e ...
Local Time is:                      Tue Mar 14 12:12:51 2023 UTC
Firmware Updates (0x12):            1 Slot, no Reset required
Optional Admin Commands (0x0017):   Security Format Frmw_DL Self_Test
Optional NVM Commands (0x005f):     Comp Wr_Unc DS_Mngmt Wr_Zero Sav/Sel_Feat Timestmp
Log Page Attributes (0x0a):         Cmd_Eff_Lg Telmtry_Lg
Maximum Data Transfer Size:         512 Pages
Warning  Comp. Temp. Threshold:     72 Celsius
Critical Comp. Temp. Threshold:     90 Celsius

Supported Power States
St Op     Max   Active     Idle   RL RT WL WT  Ent_Lat  Ex_Lat
 0 +    10.73W       -        -    0  0  0  0        1       1
 1 +     7.69W       -        -    1  1  1  1        1       1
 2 +     6.18W       -        -    2  2  2  2        1       1
 3 -   0.0500W       -        -    3  3  3  3     7000    5000
 4 -   0.0050W       -        -    4  4  4  4    13000   36000

Supported LBA Sizes (NSID 0x1)
Id Fmt  Data  Metadt  Rel_Perf
 0 +     512       0         2
 1 -    4096       0         1

=== START OF SMART DATA SECTION ===
SMART overall-health self-assessment test result: PASSED

SMART/Health Information (NVMe Log 0x02)
Critical Warning:                   0x00
Temperature:                        39 Celsius
Available Spare:                    100%
Available Spare Threshold:          5%
Percentage Used:                    12%
Data Units Read:                    72,993,303 [37.3 TB]
Data Units Written:                 55,581,492 [28.4 TB]
Host Read Commands:                 649,919,429
Host Write Commands:                667,075,880
Controller Busy Time:               2,023
Power Cycles:                       662
Power On Hours:                     5,494
Unsafe Shutdowns:                   34
Media and Data Integrity Errors:    0
Error Information Log Entries:      436,204
Warning  Comp. Temperature Time:    113
Critical Comp. Temperature Time:    0
Thermal Temp. 1 Transition Count:   46
Thermal Temp. 1 Total Time:         99546

Error Information (NVMe Log 0x01, 16 of 63 entries)
No Errors Logged

