smartctl 7.2 2020-12-30 r5155 [FreeBSD 12.2-RELEASE-p11 amd64] (local build)
Copyright (C) 2002-20, Bruce Allen, Christian Franke, www.smartmontools.org

=== START OF INFORMATION SECTION ===
Device Model:     WDC WD120EDAZ-11F3RA0
Serial Number:    --
LU WWN Device Id: 5 000cca ...
Firmware Version: 81.00A81
User Capacity:    12,000,138,625,024 bytes [12.0 TB]
Sector Sizes:     512 bytes logical, 4096 bytes physical
Rotation Rate:    5400 rpm
Form Factor:      3.5 inches
Device is:        Not in smartctl database [for details use: -P showall]
ATA Version is:   ACS-2, ATA8-ACS T13/1699-D revision 4
SATA Version is:  SATA 3.2, 6.0 Gb/s (current: 3.0 Gb/s)
Local Time is:    Sun Jan  9 14:36:37 2022 EST
SMART support is: Available - device has SMART capability.
SMART support is: Enabled
AAM feature is:   Unavailable
APM feature is:   Disabled
Rd look-ahead is: Enabled
Write cache is:   Enabled
DSN feature is:   Unavailable
ATA Security is:  Disabled, NOT FROZEN [SEC1]
Wt Cache Reorder: Enabled

=== START OF READ SMART DATA SECTION ===
SMART overall-health self-assessment test result: PASSED

General SMART Values:
Offline data collection status:  (0x84)	Offline data collection activity
					was suspended by an interrupting command from host.
					Auto Offline Data Collection: Enabled.
Self-test execution status:      (   0)	The previous self-test routine completed
					without error or no self-test has ever 
					been run.
Total time to complete Offline 
data collection: 		(   87) seconds.
Offline data collection
capabilities: 			 (0x5b) SMART execute Offline immediate.
					Auto Offline data collection on/off support.
					Suspend Offline collection upon new
					command.
					Offline surface scan supported.
					Self-test supported.
					No Conveyance Self-test supported.
					Selective Self-test supported.
SMART capabilities:            (0x0003)	Saves SMART data before entering
					power-saving mode.
					Supports SMART auto save timer.
Error logging capability:        (0x01)	Error logging supported.
					General Purpose Logging supported.
Short self-test routine 
recommended polling time: 	 (   2) minutes.
Extended self-test routine
recommended polling time: 	 (1360) minutes.
SCT capabilities: 	       (0x003d)	SCT Status supported.
					SCT Error Recovery Control supported.
					SCT Feature Control supported.
					SCT Data Table supported.

SMART Attributes Data Structure revision number: 16
Vendor Specific SMART Attributes with Thresholds:
ID# ATTRIBUTE_NAME          FLAGS    VALUE WORST THRESH FAIL RAW_VALUE
  1 Raw_Read_Error_Rate     PO-R--   100   100   016    -    0
  2 Throughput_Performance  --S---   126   126   054    -    116
  3 Spin_Up_Time            POS---   253   253   024    -    131 (Average 129)
  4 Start_Stop_Count        -O--C-   100   100   000    -    97
  5 Reallocated_Sector_Ct   PO--CK   100   100   005    -    0
  7 Seek_Error_Rate         -O-R--   100   100   067    -    0
  8 Seek_Time_Performance   --S---   140   140   020    -    15
  9 Power_On_Hours          -O--C-   099   099   000    -    9229
 10 Spin_Retry_Count        -O--C-   100   100   060    -    0
 12 Power_Cycle_Count       -O--CK   100   100   000    -    87
 22 Unknown_Attribute       PO---K   100   100   025    -    100
192 Power-Off_Retract_Count -O--CK   100   100   000    -    421
193 Load_Cycle_Count        -O--C-   100   100   000    -    421
194 Temperature_Celsius     -O----   004   004   000    -    25 (Min/Max 21/53)
196 Reallocated_Event_Count -O--CK   100   100   000    -    0
197 Current_Pending_Sector  -O---K   100   100   000    -    0
198 Offline_Uncorrectable   ---R--   100   100   000    -    0
199 UDMA_CRC_Error_Count    -O-R--   200   200   000    -    4076
                            ||||||_ K auto-keep
                            |||||__ C event count
                            ||||___ R error rate
                            |||____ S speed/performance
                            ||_____ O updated online
                            |______ P prefailure warning

General Purpose Log Directory Version 1
SMART           Log Directory Version 1 [multi-sector log support]
Address    Access  R/W   Size  Description
0x00       GPL,SL  R/O      1  Log Directory
0x01           SL  R/O      1  Summary SMART error log
0x02           SL  R/O      1  Comprehensive SMART error log
0x03       GPL     R/O      1  Ext. Comprehensive SMART error log
0x04       GPL     R/O    256  Device Statistics log
0x04       SL      R/O    255  Device Statistics log
0x06           SL  R/O      1  SMART self-test log
0x07       GPL     R/O      1  Extended self-test log
0x08       GPL     R/O      2  Power Conditions log
0x09           SL  R/W      1  Selective self-test log
0x0c       GPL     R/O   5501  Pending Defects log
0x10       GPL     R/O      1  NCQ Command Error log
0x11       GPL     R/O      1  SATA Phy Event Counters log
0x12       GPL     R/O      1  SATA NCQ Non-Data log
0x13       GPL     R/O      1  SATA NCQ Send and Receive log
0x15       GPL     R/W      1  Rebuild Assist log
0x21       GPL     R/O      1  Write stream error log
0x22       GPL     R/O      1  Read stream error log
0x24       GPL     R/O    256  Current Device Internal Status Data log
0x25       GPL     R/O    256  Saved Device Internal Status Data log
0x30       GPL,SL  R/O      9  IDENTIFY DEVICE data log
0x80-0x9f  GPL,SL  R/W     16  Host vendor specific log
0xe0       GPL,SL  R/W      1  SCT Command/Status
0xe1       GPL,SL  R/W      1  SCT Data Transfer

SMART Extended Comprehensive Error Log Version: 1 (1 sectors)
Device Error Count: 4076 (device log contains only the most recent 4 errors)
	CR     = Command Register
	FEATR  = Features Register
	COUNT  = Count (was: Sector Count) Register
	LBA_48 = Upper bytes of LBA High/Mid/Low Registers ]  ATA-8
	LH     = LBA High (was: Cylinder High) Register    ]   LBA
	LM     = LBA Mid (was: Cylinder Low) Register      ] Register
	LL     = LBA Low (was: Sector Number) Register     ]
	DV     = Device (was: Device/Head) Register
	DC     = Device Control Register
	ER     = Error register
	ST     = Status register
Powered_Up_Time is measured from power on, and printed as
DDd+hh:mm:SS.sss where DD=days, hh=hours, mm=minutes,
SS=sec, and sss=millisec. It "wraps" after 49.710 days.

Error 4076 [3] occurred at disk power-on lifetime: 9229 hours (384 days + 13 hours)
  When the command that caused the error occurred, the device was doing SMART Offline or Self-test.

  After command completion occurred, registers were:
  ER -- ST COUNT  LBA_48  LH LM LL DV DC
  -- -- -- == -- == == == -- -- -- -- --
  84 -- 41 00 00 00 00 00 00 00 00 00 00  Error: ICRC, ABRT at LBA = 0x00000000 = 0

  Commands leading to the command that caused the error were:
  CR FEATR COUNT  LBA_48  LH LM LL DV DC  Powered_Up_Time  Command/Feature_Name
  -- == -- == -- == == == -- -- -- -- --  ---------------  --------------------
  60 01 00 00 18 00 03 a6 a5 c0 d0 40 00  6d+21:57:01.332  READ FPDMA QUEUED
  60 01 00 00 10 00 03 a6 a5 cf d0 40 00  6d+21:57:01.331  READ FPDMA QUEUED
  60 01 00 00 00 00 03 a6 a5 ce d0 40 00  6d+21:57:01.331  READ FPDMA QUEUED
  60 01 00 00 48 00 03 a6 a5 cd d0 40 00  6d+21:57:01.330  READ FPDMA QUEUED
  60 01 00 00 40 00 03 a6 a5 cc d0 40 00  6d+21:57:01.330  READ FPDMA QUEUED

Error 4075 [2] occurred at disk power-on lifetime: 9229 hours (384 days + 13 hours)
  When the command that caused the error occurred, the device was doing SMART Offline or Self-test.

  After command completion occurred, registers were:
  ER -- ST COUNT  LBA_48  LH LM LL DV DC
  -- -- -- == -- == == == -- -- -- -- --
  84 -- 41 00 00 00 00 00 00 00 00 00 00  Error: ICRC, ABRT at LBA = 0x00000000 = 0

  Commands leading to the command that caused the error were:
  CR FEATR COUNT  LBA_48  LH LM LL DV DC  Powered_Up_Time  Command/Feature_Name
  -- == -- == -- == == == -- -- -- -- --  ---------------  --------------------
  60 01 00 00 28 00 04 aa a0 5e 40 40 00  6d+21:56:55.550  READ FPDMA QUEUED
  60 01 00 00 70 00 04 aa a0 6d 40 40 00  6d+21:56:55.548  READ FPDMA QUEUED
  60 01 00 00 68 00 04 aa a0 6c 40 40 00  6d+21:56:55.548  READ FPDMA QUEUED
  60 01 00 00 60 00 04 aa a0 6b 40 40 00  6d+21:56:55.548  READ FPDMA QUEUED
  60 01 00 00 10 00 04 aa a0 6a 40 40 00  6d+21:56:55.547  READ FPDMA QUEUED

Error 4074 [1] occurred at disk power-on lifetime: 9229 hours (384 days + 13 hours)
  When the command that caused the error occurred, the device was doing SMART Offline or Self-test.

  After command completion occurred, registers were:
  ER -- ST COUNT  LBA_48  LH LM LL DV DC
  -- -- -- == -- == == == -- -- -- -- --
  84 -- 41 00 00 00 00 00 00 00 00 00 00  Error: ICRC, ABRT at LBA = 0x00000000 = 0

  Commands leading to the command that caused the error were:
  CR FEATR COUNT  LBA_48  LH LM LL DV DC  Powered_Up_Time  Command/Feature_Name
  -- == -- == -- == == == -- -- -- -- --  ---------------  --------------------
  60 01 00 00 20 00 03 a8 a8 57 b0 40 00  6d+21:56:51.610  READ FPDMA QUEUED
  60 01 00 00 38 00 03 a8 a8 62 b0 40 00  6d+21:56:51.609  READ FPDMA QUEUED
  60 01 00 00 00 00 03 a8 a8 61 b0 40 00  6d+21:56:51.609  READ FPDMA QUEUED
  60 01 00 00 60 00 03 a8 a8 60 b0 40 00  6d+21:56:51.607  READ FPDMA QUEUED
  60 01 00 00 30 00 03 a8 a8 5f b0 40 00  6d+21:56:51.607  READ FPDMA QUEUED

Error 4073 [0] occurred at disk power-on lifetime: 9229 hours (384 days + 13 hours)
  When the command that caused the error occurred, the device was doing SMART Offline or Self-test.

  After command completion occurred, registers were:
  ER -- ST COUNT  LBA_48  LH LM LL DV DC
  -- -- -- == -- == == == -- -- -- -- --
  84 -- 41 00 00 00 00 00 00 00 00 00 00  Error: ICRC, ABRT at LBA = 0x00000000 = 0

  Commands leading to the command that caused the error were:
  CR FEATR COUNT  LBA_48  LH LM LL DV DC  Powered_Up_Time  Command/Feature_Name
  -- == -- == -- == == == -- -- -- -- --  ---------------  --------------------
  60 01 00 00 58 00 03 a8 9d fd d0 40 00  6d+21:56:49.280  READ FPDMA QUEUED
  60 01 00 00 30 00 03 a8 9e 0c d0 40 00  6d+21:56:49.277  READ FPDMA QUEUED
  60 01 00 00 28 00 03 a8 9e 0b d0 40 00  6d+21:56:49.277  READ FPDMA QUEUED
  60 01 00 00 20 00 03 a8 9e 0a d0 40 00  6d+21:56:49.277  READ FPDMA QUEUED
  60 01 00 00 18 00 03 a8 9e 09 d0 40 00  6d+21:56:49.277  READ FPDMA QUEUED

SMART Extended Self-test Log Version: 1 (1 sectors)
No self-tests have been logged.  [To run self-tests, use: smartctl -t]

SMART Selective self-test log data structure revision number 1
 SPAN  MIN_LBA  MAX_LBA  CURRENT_TEST_STATUS
    1        0        0  Not_testing
    2        0        0  Not_testing
    3        0        0  Not_testing
    4        0        0  Not_testing
    5        0        0  Not_testing
Selective self-test flags (0x0):
  After scanning selected spans, do NOT read-scan remainder of disk.
If Selective self-test is pending on power-up, resume after 0 minute delay.

SCT Status Version:                  3
SCT Version (vendor specific):       256 (0x0100)
Device State:                        SMART Off-line Data Collection executing in background (4)
Current Temperature:                    25 Celsius
Power Cycle Min/Max Temperature:     24/29 Celsius
Lifetime    Min/Max Temperature:     21/53 Celsius
Under/Over Temperature Limit Count:   0/0

SCT Temperature History Version:     2
Temperature Sampling Period:         1 minute
Temperature Logging Interval:        1 minute
Min/Max recommended Temperature:      0/65 Celsius
Min/Max Temperature Limit:           -40/70 Celsius
Temperature History Size (Index):    128 (114)

SCT Error Recovery Control:
           Read: Disabled
          Write: Disabled

Device Statistics (GP Log 0x04)
Page  Offset Size        Value Flags Description
0x01  =====  =               =  ===  == General Statistics (rev 1) ==
0x01  0x008  4              87  ---  Lifetime Power-On Resets
0x01  0x010  4            9229  ---  Power-on Hours
0x01  0x018  6     46261045042  ---  Logical Sectors Written
0x01  0x020  6       161243133  ---  Number of Write Commands
0x01  0x028  6    226059738732  ---  Logical Sectors Read
0x01  0x030  6       866933722  ---  Number of Read Commands
0x01  0x038  6     33224441600  ---  Date and Time TimeStamp
0x03  =====  =               =  ===  == Rotating Media Statistics (rev 1) ==
0x03  0x008  4            8234  ---  Spindle Motor Power-on Hours
0x03  0x010  4            8234  ---  Head Flying Hours
0x03  0x018  4             421  ---  Head Load Events
0x03  0x020  4               0  ---  Number of Reallocated Logical Sectors
0x03  0x028  4               0  ---  Read Recovery Attempts
0x03  0x030  4               0  ---  Number of Mechanical Start Failures
0x04  =====  =               =  ===  == General Errors Statistics (rev 1) ==
0x04  0x008  4               0  ---  Number of Reported Uncorrectable Errors
0x04  0x010  4           65535  ---  Resets Between Cmd Acceptance and Completion
0x05  =====  =               =  ===  == Temperature Statistics (rev 1) ==
0x05  0x008  1              25  ---  Current Temperature
0x05  0x010  1              24  N--  Average Short Term Temperature
0x05  0x018  1              24  N--  Average Long Term Temperature
0x05  0x020  1              53  ---  Highest Temperature
0x05  0x028  1              21  ---  Lowest Temperature
0x05  0x030  1              49  N--  Highest Average Short Term Temperature
0x05  0x038  1              22  N--  Lowest Average Short Term Temperature
0x05  0x040  1              45  N--  Highest Average Long Term Temperature
0x05  0x048  1              23  N--  Lowest Average Long Term Temperature
0x05  0x050  4               0  ---  Time in Over-Temperature
0x05  0x058  1              65  ---  Specified Maximum Operating Temperature
0x05  0x060  4               0  ---  Time in Under-Temperature
0x05  0x068  1               0  ---  Specified Minimum Operating Temperature
0x06  =====  =               =  ===  == Transport Statistics (rev 1) ==
0x06  0x008  4          182455  ---  Number of Hardware Resets
0x06  0x010  4               8  ---  Number of ASR Events
0x06  0x018  4            4076  ---  Number of Interface CRC Errors
0xff  =====  =               =  ===  == Vendor Specific Statistics (rev 1) ==
                                |||_ C monitored condition met
                                ||__ D supports DSN
                                |___ N normalized value

Pending Defects log (GP Log 0x0c)
No Defects Logged

SATA Phy Event Counters (GP Log 0x11)
ID      Size     Value  Description
0x0001  2         3843  Command failed due to ICRC error
0x0002  2        11211  R_ERR response for data FIS
0x0003  2         3080  R_ERR response for device-to-host data FIS
0x0004  2         8131  R_ERR response for host-to-device data FIS
0x0005  2           28  R_ERR response for non-data FIS
0x0006  2            1  R_ERR response for device-to-host non-data FIS
0x0007  2           27  R_ERR response for host-to-device non-data FIS
0x0008  2            0  Device-to-host non-data FIS retries
0x0009  2         8190  Transition from drive PhyRdy to drive PhyNRdy
0x000a  2         8191  Device-to-host register FISes sent due to a COMRESET
0x000b  2         8148  CRC errors within host-to-device FIS
0x000d  2           10  Non-CRC errors within host-to-device FIS



