smartctl 7.1 2019-12-30 r5022 [FreeBSD 13.0-ALPHA1-HBSD amd64] (local build)
Copyright (C) 2002-19, Bruce Allen, Christian Franke, www.smartmontools.org

=== START OF INFORMATION SECTION ===
Model Number:                       HP SSD EX950 512GB
Serial Number:                      --
Firmware Version:                   SS0411B
PCI Vendor/Subsystem ID:            0x126f
IEEE OUI Identifier:                0x000000
Controller ID:                      1
Number of Namespaces:               1
Namespace 1 Size/Capacity:          512,110,190,592 [512 GB]
Namespace 1 Utilization:            926,212,096 [926 MB]
Namespace 1 Formatted LBA Size:     512
Local Time is:                      Mon Jan 25 16:43:12 2021 PST
Firmware Updates (0x14):            2 Slots, no Reset required
Optional Admin Commands (0x0017):   Security Format Frmw_DL Self_Test
Optional NVM Commands (0x005f):     Comp Wr_Unc DS_Mngmt Wr_Zero Sav/Sel_Feat Timestmp
Maximum Data Transfer Size:         64 Pages
Warning  Comp. Temp. Threshold:     75 Celsius
Critical Comp. Temp. Threshold:     80 Celsius

Supported Power States
St Op     Max   Active     Idle   RL RT WL WT  Ent_Lat  Ex_Lat
 0 +     9.00W       -        -    0  0  0  0        0       0
 1 +     4.60W       -        -    1  1  1  1        0       0
 2 +     3.80W       -        -    2  2  2  2        0       0
 3 -   0.0450W       -        -    3  3  3  3     2000    2000
 4 -   0.0040W       -        -    4  4  4  4    15000   15000

Supported LBA Sizes (NSID 0x1)
Id Fmt  Data  Metadt  Rel_Perf
 0 +     512       0         0

=== START OF SMART DATA SECTION ===
SMART overall-health self-assessment test result: PASSED

SMART/Health Information (NVMe Log 0x02)
Critical Warning:                   0x00
Temperature:                        31 Celsius
Available Spare:                    100%
Available Spare Threshold:          10%
Percentage Used:                    3%
Data Units Read:                    23,406,227 [11.9 TB]
Data Units Written:                 16,488,422 [8.44 TB]
Host Read Commands:                 182,502,469
Host Write Commands:                309,868,595
Controller Busy Time:               12,488
Power Cycles:                       93
Power On Hours:                     4,436
Unsafe Shutdowns:                   25
Media and Data Integrity Errors:    0
Error Information Log Entries:      0
Warning  Comp. Temperature Time:    0
Critical Comp. Temperature Time:    0
Thermal Temp. 1 Transition Count:   1
Thermal Temp. 1 Total Time:         16

Error Information (NVMe Log 0x01, max 256 entries)
No Errors Logged



