smartctl 7.2 2020-12-30 r5155 [FreeBSD 13.0-RELEASE-p3 amd64] (local build)
Copyright (C) 2002-20, Bruce Allen, Christian Franke, www.smartmontools.org

=== START OF INFORMATION SECTION ===
Model Family:     Toshiba 2.5" HDD MQ01ABD...
Device Model:     TOSHIBA MQ01ABD100
Serial Number:    --
LU WWN Device Id: 5 000039 ...
Firmware Version: AX0R5J
User Capacity:    1,000,204,886,016 bytes [1.00 TB]
Sector Sizes:     512 bytes logical, 4096 bytes physical
Rotation Rate:    5400 rpm
Form Factor:      2.5 inches
Device is:        In smartctl database [for details use: -P show]
ATA Version is:   ATA8-ACS (minor revision not indicated)
SATA Version is:  SATA 3.0, 6.0 Gb/s (current: 6.0 Gb/s)
Local Time is:    Mon Jul 12 09:16:03 2021 CEST
SMART support is: Available - device has SMART capability.
SMART support is: Enabled
AAM feature is:   Unavailable
APM level is:     128 (minimum power consumption without standby)
Rd look-ahead is: Enabled
Write cache is:   Enabled
DSN feature is:   Unavailable
ATA Security is:  Disabled, frozen [SEC2]
Wt Cache Reorder: Enabled

=== START OF READ SMART DATA SECTION ===
SMART overall-health self-assessment test result: PASSED

General SMART Values:
Offline data collection status:  (0x00)	Offline data collection activity
					was never started.
					Auto Offline Data Collection: Disabled.
Self-test execution status:      (   0)	The previous self-test routine completed
					without error or no self-test has ever 
					been run.
Total time to complete Offline 
data collection: 		(  120) seconds.
Offline data collection
capabilities: 			 (0x5b) SMART execute Offline immediate.
					Auto Offline data collection on/off support.
					Suspend Offline collection upon new
					command.
					Offline surface scan supported.
					Self-test supported.
					No Conveyance Self-test supported.
					Selective Self-test supported.
SMART capabilities:            (0x0003)	Saves SMART data before entering
					power-saving mode.
					Supports SMART auto save timer.
Error logging capability:        (0x01)	Error logging supported.
					General Purpose Logging supported.
Short self-test routine 
recommended polling time: 	 (   2) minutes.
Extended self-test routine
recommended polling time: 	 ( 248) minutes.
SCT capabilities: 	       (0x003d)	SCT Status supported.
					SCT Error Recovery Control supported.
					SCT Feature Control supported.
					SCT Data Table supported.

SMART Attributes Data Structure revision number: 16
Vendor Specific SMART Attributes with Thresholds:
ID# ATTRIBUTE_NAME          FLAGS    VALUE WORST THRESH FAIL RAW_VALUE
  1 Raw_Read_Error_Rate     PO-R--   100   100   050    -    0
  2 Throughput_Performance  P-S---   100   100   050    -    0
  3 Spin_Up_Time            POS--K   100   100   001    -    1709
  4 Start_Stop_Count        -O--CK   100   100   000    -    21106
  5 Reallocated_Sector_Ct   PO--CK   100   100   050    -    0
  7 Seek_Error_Rate         PO-R--   100   100   050    -    0
  8 Seek_Time_Performance   P-S---   100   100   050    -    0
  9 Power_On_Hours          -O--CK   051   051   000    -    19888
 10 Spin_Retry_Count        PO--CK   253   100   030    -    0
 12 Power_Cycle_Count       -O--CK   100   100   000    -    1390
191 G-Sense_Error_Rate      -O--CK   100   100   000    -    3163
192 Power-Off_Retract_Count -O--CK   100   100   000    -    68
193 Load_Cycle_Count        -O--CK   077   077   000    -    232848
194 Temperature_Celsius     -O---K   100   100   000    -    47 (Min/Max 15/74)
196 Reallocated_Event_Count -O--CK   100   100   000    -    0
197 Current_Pending_Sector  -O--CK   100   100   000    -    0
198 Offline_Uncorrectable   ----CK   100   100   000    -    0
199 UDMA_CRC_Error_Count    -O--CK   200   200   000    -    4212
220 Disk_Shift              -O----   100   100   000    -    0
222 Loaded_Hours            -O--CK   079   079   000    -    8492
223 Load_Retry_Count        -O--CK   100   100   000    -    0
224 Load_Friction           -O---K   100   100   000    -    0
226 Load-in_Time            -OS--K   100   100   000    -    258
240 Head_Flying_Hours       P-----   100   100   001    -    0
                            ||||||_ K auto-keep
                            |||||__ C event count
                            ||||___ R error rate
                            |||____ S speed/performance
                            ||_____ O updated online
                            |______ P prefailure warning

General Purpose Log Directory Version 1
SMART           Log Directory Version 1 [multi-sector log support]
Address    Access  R/W   Size  Description
0x00       GPL,SL  R/O      1  Log Directory
0x01           SL  R/O      1  Summary SMART error log
0x02           SL  R/O     51  Comprehensive SMART error log
0x03       GPL     R/O     64  Ext. Comprehensive SMART error log
0x04       GPL,SL  R/O      8  Device Statistics log
0x06           SL  R/O      1  SMART self-test log
0x07       GPL     R/O      1  Extended self-test log
0x09           SL  R/W      1  Selective self-test log
0x10       GPL     R/O      1  NCQ Command Error log
0x11       GPL     R/O      1  SATA Phy Event Counters log
0x80-0x9f  GPL,SL  R/W     16  Host vendor specific log
0xe0       GPL,SL  R/W      1  SCT Command/Status
0xe1       GPL,SL  R/W      1  SCT Data Transfer

SMART Extended Comprehensive Error Log Version: 1 (64 sectors)
Device Error Count: 4212 (device log contains only the most recent 256 errors)
	CR     = Command Register
	FEATR  = Features Register
	COUNT  = Count (was: Sector Count) Register
	LBA_48 = Upper bytes of LBA High/Mid/Low Registers ]  ATA-8
	LH     = LBA High (was: Cylinder High) Register    ]   LBA
	LM     = LBA Mid (was: Cylinder Low) Register      ] Register
	LL     = LBA Low (was: Sector Number) Register     ]
	DV     = Device (was: Device/Head) Register
	DC     = Device Control Register
	ER     = Error register
	ST     = Status register
Powered_Up_Time is measured from power on, and printed as
DDd+hh:mm:SS.sss where DD=days, hh=hours, mm=minutes,
SS=sec, and sss=millisec. It "wraps" after 49.710 days.

Error 4212 [115] occurred at disk power-on lifetime: 2800 hours (116 days + 16 hours)
  When the command that caused the error occurred, the device was active or idle.

  After command completion occurred, registers were:
  ER -- ST COUNT  LBA_48  LH LM LL DV DC
  -- -- -- == -- == == == -- -- -- -- --
  84 -- 41 00 f8 00 00 1b 52 e3 ef 40 00  Error: ICRC, ABRT at LBA = 0x1b52e3ef = 458417135

  Commands leading to the command that caused the error were:
  CR FEATR COUNT  LBA_48  LH LM LL DV DC  Powered_Up_Time  Command/Feature_Name
  -- == -- == -- == == == -- -- -- -- --  ---------------  --------------------
  61 01 00 00 08 00 00 1b 52 e4 f0 40 00 46d+10:10:19.016  WRITE FPDMA QUEUED
  61 01 00 00 00 00 00 1b 52 e3 f0 40 00 46d+10:10:19.016  WRITE FPDMA QUEUED
  61 01 00 00 f8 00 00 1b 52 e2 f0 40 00 46d+10:10:19.016  WRITE FPDMA QUEUED
  ef 00 02 00 00 00 00 00 00 00 00 40 00 46d+10:10:19.015  SET FEATURES [Enable write cache]
  ef 00 aa 00 00 00 00 00 00 00 00 40 00 46d+10:10:19.015  SET FEATURES [Enable read look-ahead]

Error 4211 [114] occurred at disk power-on lifetime: 2800 hours (116 days + 16 hours)
  When the command that caused the error occurred, the device was active or idle.

  After command completion occurred, registers were:
  ER -- ST COUNT  LBA_48  LH LM LL DV DC
  -- -- -- == -- == == == -- -- -- -- --
  84 -- 41 00 78 00 00 06 56 a8 67 40 00  Error: ICRC, ABRT at LBA = 0x0656a867 = 106342503

  Commands leading to the command that caused the error were:
  CR FEATR COUNT  LBA_48  LH LM LL DV DC  Powered_Up_Time  Command/Feature_Name
  -- == -- == -- == == == -- -- -- -- --  ---------------  --------------------
  61 01 00 00 a0 00 00 06 56 ac 68 40 00 46d+09:49:12.660  WRITE FPDMA QUEUED
  61 01 00 00 98 00 00 06 56 ab 68 40 00 46d+09:49:12.660  WRITE FPDMA QUEUED
  61 01 00 00 90 00 00 06 56 aa 68 40 00 46d+09:49:12.660  WRITE FPDMA QUEUED
  61 01 00 00 88 00 00 06 56 a9 68 40 00 46d+09:49:12.660  WRITE FPDMA QUEUED
  61 01 00 00 80 00 00 06 56 a8 68 40 00 46d+09:49:12.660  WRITE FPDMA QUEUED

Error 4210 [113] occurred at disk power-on lifetime: 2800 hours (116 days + 16 hours)
  When the command that caused the error occurred, the device was active or idle.

  After command completion occurred, registers were:
  ER -- ST COUNT  LBA_48  LH LM LL DV DC
  -- -- -- == -- == == == -- -- -- -- --
  84 -- 41 00 00 00 00 01 30 5b ef 40 00  Error: ICRC, ABRT at LBA = 0x01305bef = 19946479

  Commands leading to the command that caused the error were:
  CR FEATR COUNT  LBA_48  LH LM LL DV DC  Powered_Up_Time  Command/Feature_Name
  -- == -- == -- == == == -- -- -- -- --  ---------------  --------------------
  61 01 00 00 20 00 00 01 30 5e f0 40 00 46d+09:31:45.125  WRITE FPDMA QUEUED
  61 01 00 00 18 00 00 01 30 5d f0 40 00 46d+09:31:45.125  WRITE FPDMA QUEUED
  61 01 00 00 10 00 00 01 30 5c f0 40 00 46d+09:31:45.125  WRITE FPDMA QUEUED
  61 01 00 00 08 00 00 01 30 5b f0 40 00 46d+09:31:45.125  WRITE FPDMA QUEUED
  61 01 00 00 00 00 00 01 30 5a f0 40 00 46d+09:31:45.125  WRITE FPDMA QUEUED

Error 4209 [112] occurred at disk power-on lifetime: 2800 hours (116 days + 16 hours)
  When the command that caused the error occurred, the device was active or idle.

  After command completion occurred, registers were:
  ER -- ST COUNT  LBA_48  LH LM LL DV DC
  -- -- -- == -- == == == -- -- -- -- --
  84 -- 41 00 00 00 00 45 54 b8 9f 40 00  Error: ICRC, ABRT at LBA = 0x4554b89f = 1163180191

  Commands leading to the command that caused the error were:
  CR FEATR COUNT  LBA_48  LH LM LL DV DC  Powered_Up_Time  Command/Feature_Name
  -- == -- == -- == == == -- -- -- -- --  ---------------  --------------------
  61 01 00 00 00 00 00 45 54 b7 a0 40 00 46d+09:24:52.768  WRITE FPDMA QUEUED
  ea 00 00 00 00 00 00 00 00 00 00 40 00 46d+09:24:51.124  FLUSH CACHE EXT
  61 00 08 00 f0 00 00 74 70 6b 98 40 00 46d+09:24:51.123  WRITE FPDMA QUEUED
  61 00 08 00 e8 00 00 74 70 69 98 40 00 46d+09:24:51.123  WRITE FPDMA QUEUED
  61 00 08 00 e0 00 00 00 00 03 98 40 00 46d+09:24:51.123  WRITE FPDMA QUEUED

Error 4208 [111] occurred at disk power-on lifetime: 2799 hours (116 days + 15 hours)
  When the command that caused the error occurred, the device was active or idle.

  After command completion occurred, registers were:
  ER -- ST COUNT  LBA_48  LH LM LL DV DC
  -- -- -- == -- == == == -- -- -- -- --
  84 -- 41 00 08 00 00 57 7c 0e b7 40 00  Error: ICRC, ABRT at LBA = 0x577c0eb7 = 1467748023

  Commands leading to the command that caused the error were:
  CR FEATR COUNT  LBA_48  LH LM LL DV DC  Powered_Up_Time  Command/Feature_Name
  -- == -- == -- == == == -- -- -- -- --  ---------------  --------------------
  61 00 10 00 38 00 00 57 7c 13 b8 40 00 46d+09:10:31.847  WRITE FPDMA QUEUED
  61 01 00 00 30 00 00 57 7c 12 b8 40 00 46d+09:10:31.847  WRITE FPDMA QUEUED
  61 01 00 00 28 00 00 57 7c 11 b8 40 00 46d+09:10:31.847  WRITE FPDMA QUEUED
  61 01 00 00 20 00 00 57 7c 10 b8 40 00 46d+09:10:31.847  WRITE FPDMA QUEUED
  61 01 00 00 18 00 00 57 7c 0f b8 40 00 46d+09:10:31.847  WRITE FPDMA QUEUED

Error 4207 [110] occurred at disk power-on lifetime: 2799 hours (116 days + 15 hours)
  When the command that caused the error occurred, the device was active or idle.

  After command completion occurred, registers were:
  ER -- ST COUNT  LBA_48  LH LM LL DV DC
  -- -- -- == -- == == == -- -- -- -- --
  84 -- 41 00 f0 00 00 59 3e f0 cf 40 00  Error: ICRC, ABRT at LBA = 0x593ef0cf = 1497297103

  Commands leading to the command that caused the error were:
  CR FEATR COUNT  LBA_48  LH LM LL DV DC  Powered_Up_Time  Command/Feature_Name
  -- == -- == -- == == == -- -- -- -- --  ---------------  --------------------
  61 01 00 00 28 00 00 59 3e f6 d0 40 00 46d+09:07:14.515  WRITE FPDMA QUEUED
  61 01 00 00 20 00 00 59 3e f5 d0 40 00 46d+09:07:14.515  WRITE FPDMA QUEUED
  61 01 00 00 18 00 00 59 3e f4 d0 40 00 46d+09:07:14.515  WRITE FPDMA QUEUED
  61 01 00 00 10 00 00 59 3e f3 d0 40 00 46d+09:07:14.515  WRITE FPDMA QUEUED
  61 01 00 00 08 00 00 59 3e f2 d0 40 00 46d+09:07:14.515  WRITE FPDMA QUEUED

Error 4206 [109] occurred at disk power-on lifetime: 2799 hours (116 days + 15 hours)
  When the command that caused the error occurred, the device was active or idle.

  After command completion occurred, registers were:
  ER -- ST COUNT  LBA_48  LH LM LL DV DC
  -- -- -- == -- == == == -- -- -- -- --
  84 -- 41 00 a8 00 00 53 41 3e 6f 40 00  Error: ICRC, ABRT at LBA = 0x53413e6f = 1396784751

  Commands leading to the command that caused the error were:
  CR FEATR COUNT  LBA_48  LH LM LL DV DC  Powered_Up_Time  Command/Feature_Name
  -- == -- == -- == == == -- -- -- -- --  ---------------  --------------------
  61 00 20 00 e0 00 00 53 41 44 70 40 00 46d+09:00:12.292  WRITE FPDMA QUEUED
  61 01 00 00 d8 00 00 53 41 43 70 40 00 46d+09:00:12.292  WRITE FPDMA QUEUED
  61 01 00 00 d0 00 00 53 41 42 70 40 00 46d+09:00:12.292  WRITE FPDMA QUEUED
  61 01 00 00 c8 00 00 53 41 41 70 40 00 46d+09:00:12.292  WRITE FPDMA QUEUED
  61 01 00 00 c0 00 00 53 41 40 70 40 00 46d+09:00:12.292  WRITE FPDMA QUEUED

Error 4205 [108] occurred at disk power-on lifetime: 1185 hours (49 days + 9 hours)
  When the command that caused the error occurred, the device was active or idle.

  After command completion occurred, registers were:
  ER -- ST COUNT  LBA_48  LH LM LL DV DC
  -- -- -- == -- == == == -- -- -- -- --
  84 -- 41 00 a8 00 00 00 68 4d 5f 40 00  Error: ABRT

  Commands leading to the command that caused the error were:
  CR FEATR COUNT  LBA_48  LH LM LL DV DC  Powered_Up_Time  Command/Feature_Name
  -- == -- == -- == == == -- -- -- -- --  ---------------  --------------------
  2f 00 00 00 01 00 00 00 00 00 10 e0 00     00:00:26.884  READ LOG EXT
  60 01 00 00 c8 00 00 00 68 50 60 40 00     00:00:26.884  READ FPDMA QUEUED
  60 01 00 00 c0 00 00 00 68 4f 60 40 00     00:00:26.884  READ FPDMA QUEUED
  60 01 00 00 b8 00 00 00 68 4e 60 40 00     00:00:26.884  READ FPDMA QUEUED
  60 01 00 00 b0 00 00 00 68 4d 60 40 00     00:00:26.884  READ FPDMA QUEUED

SMART Extended Self-test Log Version: 1 (1 sectors)
Num  Test_Description    Status                  Remaining  LifeTime(hours)  LBA_of_first_error
# 1  Extended offline    Completed without error       00%     10570         -
# 2  Extended offline    Aborted by host               90%      1189         -
# 3  Short offline       Completed without error       00%      1187         -
# 4  Extended offline    Aborted by host               80%      1187         -
# 5  Extended captive    Aborted by host               90%      1186         -
# 6  Extended captive    Aborted by host               90%      1186         -

SMART Selective self-test log data structure revision number 1
 SPAN  MIN_LBA  MAX_LBA  CURRENT_TEST_STATUS
    1        0        0  Not_testing
    2        0        0  Not_testing
    3        0        0  Not_testing
    4        0        0  Not_testing
    5        0        0  Not_testing
Selective self-test flags (0x0):
  After scanning selected spans, do NOT read-scan remainder of disk.
If Selective self-test is pending on power-up, resume after 0 minute delay.

SCT Status Version:                  2
SCT Version (vendor specific):       1 (0x0001)
Device State:                        Active (0)
Current Temperature:                    47 Celsius
Power Cycle Min/Max Temperature:     27/52 Celsius
Lifetime    Min/Max Temperature:     15/74 Celsius
Under/Over Temperature Limit Count:   0/53716

SCT Temperature History Version:     2
Temperature Sampling Period:         1 minute
Temperature Logging Interval:        1 minute
Min/Max recommended Temperature:      5/55 Celsius
Min/Max Temperature Limit:            5/55 Celsius
Temperature History Size (Index):    478 (369)

SCT Error Recovery Control:
           Read: Disabled
          Write: Disabled

Device Statistics (GP Log 0x04)
Page  Offset Size        Value Flags Description
0x01  =====  =               =  ===  == General Statistics (rev 2) ==
0x01  0x008  4            1390  ---  Lifetime Power-On Resets
0x01  0x010  4           19746  ---  Power-on Hours
0x01  0x018  6     17951225480  ---  Logical Sectors Written
0x01  0x020  6       454348842  ---  Number of Write Commands
0x01  0x028  6      7649268704  ---  Logical Sectors Read
0x01  0x030  6       106280470  ---  Number of Read Commands
0x02  =====  =               =  ===  == Free-Fall Statistics (rev 1) ==
0x02  0x010  4            3163  ---  Overlimit Shock Events
0x03  =====  =               =  ===  == Rotating Media Statistics (rev 1) ==
0x03  0x008  4           17152  ---  Spindle Motor Power-on Hours
0x03  0x010  4            8492  ---  Head Flying Hours
0x03  0x018  4          232848  ---  Head Load Events
0x03  0x020  4             232  ---  Number of Reallocated Logical Sectors
0x03  0x028  4               0  ---  Read Recovery Attempts
0x03  0x030  4               0  ---  Number of Mechanical Start Failures
0x04  =====  =               =  ===  == General Errors Statistics (rev 1) ==
0x04  0x008  4               0  ---  Number of Reported Uncorrectable Errors
0x04  0x010  4           26046  ---  Resets Between Cmd Acceptance and Completion
0x05  =====  =               =  ===  == Temperature Statistics (rev 1) ==
0x05  0x008  1              47  ---  Current Temperature
0x05  0x010  1              42  N--  Average Short Term Temperature
0x05  0x018  1              40  N--  Average Long Term Temperature
0x05  0x020  1              74  ---  Highest Temperature
0x05  0x028  1              15  ---  Lowest Temperature
0x05  0x030  1              63  N--  Highest Average Short Term Temperature
0x05  0x038  1              23  N--  Lowest Average Short Term Temperature
0x05  0x040  1              55  N--  Highest Average Long Term Temperature
0x05  0x048  1              29  N--  Lowest Average Long Term Temperature
0x05  0x050  4          106488  ---  Time in Over-Temperature
0x05  0x058  1              55  ---  Specified Maximum Operating Temperature
0x05  0x060  4               0  ---  Time in Under-Temperature
0x05  0x068  1               5  ---  Specified Minimum Operating Temperature
0x06  =====  =               =  ===  == Transport Statistics (rev 1) ==
0x06  0x008  4          492795  ---  Number of Hardware Resets
0x06  0x018  4            4212  ---  Number of Interface CRC Errors
0x07  =====  =               =  ===  == Solid State Device Statistics (rev 1) ==
0x07  0x008  1              33  N--  Percentage Used Endurance Indicator
                                |||_ C monitored condition met
                                ||__ D supports DSN
                                |___ N normalized value

Pending Defects log (GP Log 0x0c) not supported

SATA Phy Event Counters (GP Log 0x11)
ID      Size     Value  Description
0x0001  4            0  Command failed due to ICRC error
0x0002  4            0  R_ERR response for data FIS
0x0003  4            0  R_ERR response for device-to-host data FIS
0x0004  4            0  R_ERR response for host-to-device data FIS
0x0005  4            0  R_ERR response for non-data FIS
0x0006  4            0  R_ERR response for device-to-host non-data FIS
0x0007  4            0  R_ERR response for host-to-device non-data FIS
0x0008  4            0  Device-to-host non-data FIS retries
0x0009  4           55  Transition from drive PhyRdy to drive PhyNRdy
0x000a  4           42  Device-to-host register FISes sent due to a COMRESET
0x000b  4            0  CRC errors within host-to-device FIS
0x000d  4            0  Non-CRC errors within host-to-device FIS
0x000f  4            0  R_ERR response for host-to-device data FIS, CRC
0x0010  4            0  R_ERR response for host-to-device data FIS, non-CRC
0x0012  4            0  R_ERR response for host-to-device non-data FIS, CRC
0x0013  4            0  R_ERR response for host-to-device non-data FIS, non-CRC



