smartctl 7.4 2023-08-01 r5530 [FreeBSD 14.0-RELEASE-p4 amd64] (local build)
Copyright (C) 2002-23, Bruce Allen, Christian Franke, www.smartmontools.org

=== START OF INFORMATION SECTION ===
Model Family:     Silicon Motion based SSDs
Device Model:     Patriot P210 256GB
Serial Number:    --
LU WWN Device Id: 0 000000 ...
Firmware Version: HT3414B2
User Capacity:    256,060,514,304 bytes [256 GB]
Sector Size:      512 bytes logical/physical
Rotation Rate:    Solid State Device
Form Factor:      2.5 inches
TRIM Command:     Available
Device is:        In smartctl database 7.3/5528
ATA Version is:   ACS-4 T13/BSR INCITS 529 revision 5
SATA Version is:  SATA 3.2, 6.0 Gb/s (current: 6.0 Gb/s)
Local Time is:    Sat Mar 23 22:34:02 2024 PDT
SMART support is: Available - device has SMART capability.
SMART support is: Enabled
AAM feature is:   Unavailable
APM feature is:   Unavailable
Rd look-ahead is: Enabled
Write cache is:   Enabled
DSN feature is:   Unavailable
ATA Security is:  Disabled, frozen [SEC2]
Wt Cache Reorder: Unavailable

=== START OF READ SMART DATA SECTION ===
SMART overall-health self-assessment test result: PASSED

General SMART Values:
Offline data collection status:  (0x00)	Offline data collection activity
					was never started.
					Auto Offline Data Collection: Disabled.
Self-test execution status:      (   0)	The previous self-test routine completed
					without error or no self-test has ever 
					been run.
Total time to complete Offline 
data collection: 		(  120) seconds.
Offline data collection
capabilities: 			 (0x5d) SMART execute Offline immediate.
					No Auto Offline data collection support.
					Abort Offline collection upon new
					command.
					Offline surface scan supported.
					Self-test supported.
					No Conveyance Self-test supported.
					Selective Self-test supported.
SMART capabilities:            (0x0002)	Does not save SMART data before
					entering power-saving mode.
					Supports SMART auto save timer.
Error logging capability:        (0x01)	Error logging supported.
					General Purpose Logging supported.
Short self-test routine 
recommended polling time: 	 (   4) minutes.
Extended self-test routine
recommended polling time: 	 (   8) minutes.

SMART Attributes Data Structure revision number: 1
Vendor Specific SMART Attributes with Thresholds:
ID# ATTRIBUTE_NAME          FLAGS    VALUE WORST THRESH FAIL RAW_VALUE
  1 Raw_Read_Error_Rate     -O--CK   100   100   050    -    0
  5 Reallocated_Sector_Ct   -O--CK   100   100   050    -    0
  9 Power_On_Hours          -O--CK   100   100   050    -    13
 12 Power_Cycle_Count       -O--CK   100   100   050    -    33
160 Uncorrectable_Error_Cnt -O--CK   100   100   050    -    0
161 Valid_Spare_Block_Cnt   -O--CK   100   100   050    -    100
163 Initial_Bad_Block_Count -O--CK   100   100   050    -    112
164 Total_Erase_Count       -O--CK   100   100   050    -    0
165 Max_Erase_Count         -O--CK   100   100   050    -    0
166 Min_Erase_Count         -O--CK   100   100   050    -    0
167 Average_Erase_Count     -O--CK   100   100   050    -    0
168 Max_Erase_Count_of_Spec -O--CK   100   100   050    -    0
169 Remaining_Lifetime_Perc -O--CK   100   100   050    -    100
175 Program_Fail_Count_Chip -O--CK   100   100   050    -    0
176 Erase_Fail_Count_Chip   -O--CK   100   100   050    -    0
177 Wear_Leveling_Count     -O--CK   100   100   050    -    22263
178 Runtime_Invalid_Blk_Cnt -O--CK   100   100   050    -    0
181 Program_Fail_Cnt_Total  -O--CK   100   100   050    -    0
182 Erase_Fail_Count_Total  -O--CK   100   100   050    -    0
192 Power-Off_Retract_Count -O--CK   100   100   050    -    9
194 Temperature_Celsius     -O--CK   100   100   050    -    18
195 Hardware_ECC_Recovered  -O--CK   100   100   050    -    0
196 Reallocated_Event_Count -O--CK   100   100   050    -    0
197 Current_Pending_Sector  -O--CK   100   100   050    -    0
198 Offline_Uncorrectable   -O--CK   100   100   050    -    0
199 UDMA_CRC_Error_Count    -O--CK   100   100   050    -    0
232 Available_Reservd_Space -O--CK   100   100   050    -    100
241 Host_Writes_32MiB       -O--CK   100   100   050    -    4365
242 Host_Reads_32MiB        -O--CK   100   100   050    -    2436
                            ||||||_ K auto-keep
                            |||||__ C event count
                            ||||___ R error rate
                            |||____ S speed/performance
                            ||_____ O updated online
                            |______ P prefailure warning

General Purpose Log Directory Version 1
SMART           Log Directory Version 1 [multi-sector log support]
Address    Access  R/W   Size  Description
0x00       GPL,SL  R/O      1  Log Directory
0x01       GPL,SL  R/O      1  Summary SMART error log
0x02       GPL,SL  R/O      1  Comprehensive SMART error log
0x03       GPL,SL  R/O      1  Ext. Comprehensive SMART error log
0x04       GPL,SL  R/O      8  Device Statistics log
0x06       GPL,SL  R/O      1  SMART self-test log
0x07       GPL,SL  R/O      1  Extended self-test log
0x09       GPL,SL  R/W      1  Selective self-test log
0x10       GPL,SL  R/O      1  NCQ Command Error log
0x11       GPL,SL  R/O      1  SATA Phy Event Counters log
0x30       GPL,SL  R/O      9  IDENTIFY DEVICE data log
0x80-0x9f  GPL,SL  R/W     16  Host vendor specific log
0xa0       GPL,SL  VS      16  Device vendor specific log
0xe0       GPL,SL  R/W      1  SCT Command/Status
0xe1       GPL,SL  R/W      1  SCT Data Transfer

SMART Extended Comprehensive Error Log Version: 1 (1 sectors)
Device Error Count: 24 (device log contains only the most recent 4 errors)
	CR     = Command Register
	FEATR  = Features Register
	COUNT  = Count (was: Sector Count) Register
	LBA_48 = Upper bytes of LBA High/Mid/Low Registers ]  ATA-8
	LH     = LBA High (was: Cylinder High) Register    ]   LBA
	LM     = LBA Mid (was: Cylinder Low) Register      ] Register
	LL     = LBA Low (was: Sector Number) Register     ]
	DV     = Device (was: Device/Head) Register
	DC     = Device Control Register
	ER     = Error register
	ST     = Status register
Powered_Up_Time is measured from power on, and printed as
DDd+hh:mm:SS.sss where DD=days, hh=hours, mm=minutes,
SS=sec, and sss=millisec. It "wraps" after 49.710 days.

Error 24 [3] occurred at disk power-on lifetime: 10 hours (0 days + 10 hours)
  When the command that caused the error occurred, the device was in an unknown state.

  After command completion occurred, registers were:
  ER -- ST COUNT  LBA_48  LH LM LL DV DC
  -- -- -- == -- == == == -- -- -- -- --
  04 -- 40 00 48 00 03 28 00 a4 d0 00 00   at LBA = 0x32800a4d0 = 13556032720

  Commands leading to the command that caused the error were:
  CR FEATR COUNT  LBA_48  LH LM LL DV DC  Powered_Up_Time  Command/Feature_Name
  -- == -- == -- == == == -- -- -- -- --  ---------------  --------------------
  60 00 0a 00 48 00 03 28 00 a4 d0 40 00     00:14:00.900  READ FPDMA QUEUED
  60 01 00 00 40 00 03 27 00 a4 d0 40 00     00:14:00.900  READ FPDMA QUEUED
  60 01 00 00 38 00 03 26 00 a4 d0 40 00     00:14:00.900  READ FPDMA QUEUED
  61 00 02 00 30 00 02 47 00 7a 58 40 00     00:14:00.800  WRITE FPDMA QUEUED
  61 00 10 00 28 00 00 53 00 be 90 40 00     00:14:00.800  WRITE FPDMA QUEUED

Error 23 [2] occurred at disk power-on lifetime: 10 hours (0 days + 10 hours)
  When the command that caused the error occurred, the device was in an unknown state.

  After command completion occurred, registers were:
  ER -- ST COUNT  LBA_48  LH LM LL DV DC
  -- -- -- == -- == == == -- -- -- -- --
  04 -- 40 00 80 00 01 10 00 90 d0 00 00   at LBA = 0x1100090d0 = 4563439824

  Commands leading to the command that caused the error were:
  CR FEATR COUNT  LBA_48  LH LM LL DV DC  Powered_Up_Time  Command/Feature_Name
  -- == -- == -- == == == -- -- -- -- --  ---------------  --------------------
  60 01 00 00 80 00 01 10 00 90 d0 40 00     00:13:45.770  READ FPDMA QUEUED
  60 01 00 00 78 00 01 0f 00 90 d0 40 00     00:13:45.770  READ FPDMA QUEUED
  60 01 00 00 70 00 01 0e 00 90 d0 40 00     00:13:45.770  READ FPDMA QUEUED
  60 01 00 00 68 00 01 0d 00 90 d0 40 00     00:13:45.770  READ FPDMA QUEUED
  60 01 00 00 60 00 01 0c 00 90 d0 40 00     00:13:45.770  READ FPDMA QUEUED

Error 22 [1] occurred at disk power-on lifetime: 10 hours (0 days + 10 hours)
  When the command that caused the error occurred, the device was in an unknown state.

  After command completion occurred, registers were:
  ER -- ST COUNT  LBA_48  LH LM LL DV DC
  -- -- -- == -- == == == -- -- -- -- --
  04 -- 40 00 80 00 00 a3 00 05 00 00 00   at LBA = 0xa3000500 = 2734687488

  Commands leading to the command that caused the error were:
  CR FEATR COUNT  LBA_48  LH LM LL DV DC  Powered_Up_Time  Command/Feature_Name
  -- == -- == -- == == == -- -- -- -- --  ---------------  --------------------
  60 00 a0 00 80 00 00 a3 00 05 00 40 00     00:07:27.510  READ FPDMA QUEUED
  60 01 00 00 78 00 00 a2 00 05 00 40 00     00:07:27.510  READ FPDMA QUEUED
  60 00 f8 00 70 00 03 f6 00 67 30 40 00     00:07:27.510  READ FPDMA QUEUED
  60 00 a0 00 68 00 02 2d 00 73 b8 40 00     00:07:27.510  READ FPDMA QUEUED
  60 00 60 00 60 00 04 20 00 d0 e8 40 00     00:07:27.510  READ FPDMA QUEUED

Error 21 [0] occurred at disk power-on lifetime: 10 hours (0 days + 10 hours)
  When the command that caused the error occurred, the device was in an unknown state.

  After command completion occurred, registers were:
  ER -- ST COUNT  LBA_48  LH LM LL DV DC
  -- -- -- == -- == == == -- -- -- -- --
  04 -- 40 00 d8 00 06 ec 00 64 18 00 00   at LBA = 0x6ec006418 = 29729252376

  Commands leading to the command that caused the error were:
  CR FEATR COUNT  LBA_48  LH LM LL DV DC  Powered_Up_Time  Command/Feature_Name
  -- == -- == -- == == == -- -- -- -- --  ---------------  --------------------
  60 00 f8 00 d8 00 06 ec 00 64 18 40 00     00:02:11.530  READ FPDMA QUEUED
  60 01 00 00 d0 00 06 eb 00 64 18 40 00     00:02:11.530  READ FPDMA QUEUED
  60 01 00 00 c8 00 06 ea 00 64 18 40 00     00:02:11.530  READ FPDMA QUEUED
  60 01 00 00 c0 00 06 e9 00 64 18 40 00     00:02:11.530  READ FPDMA QUEUED
  60 01 00 00 b8 00 06 e8 00 64 18 40 00     00:02:11.530  READ FPDMA QUEUED

SMART Extended Self-test Log Version: 0 (1 sectors)
No self-tests have been logged.  [To run self-tests, use: smartctl -t]

SMART Selective self-test log data structure revision number 0
Note: revision number not 1 implies that no selective self-test has ever been run
 SPAN  MIN_LBA  MAX_LBA  CURRENT_TEST_STATUS
    1        0        0  Not_testing
    2        0        0  Not_testing
    3        0        0  Not_testing
    4        0        0  Not_testing
    5        0        0  Not_testing
Selective self-test flags (0x0):
  After scanning selected spans, do NOT read-scan remainder of disk.
If Selective self-test is pending on power-up, resume after 0 minute delay.

SCT Commands not supported

Device Statistics (GP Log 0x04)
Page  Offset Size        Value Flags Description
0x01  =====  =               =  ===  == General Statistics (rev 1) ==
0x01  0x008  4              33  ---  Lifetime Power-On Resets
0x01  0x010  4              13  ---  Power-on Hours
0x01  0x018  6       286064640  ---  Logical Sectors Written
0x01  0x020  6         1825550  ---  Number of Write Commands
0x01  0x028  6       159645696  ---  Logical Sectors Read
0x01  0x030  6         2333440  ---  Number of Read Commands
0x01  =====  =               =  ===  == General Statistics (rev 1) ==
0x01  0x008  4              33  ---  Lifetime Power-On Resets
0x01  0x010  4              13  ---  Power-on Hours
0x01  0x018  6       286064640  ---  Logical Sectors Written
0x01  0x020  6         1825550  ---  Number of Write Commands
0x01  0x028  6       159645696  ---  Logical Sectors Read
0x01  0x030  6         2333440  ---  Number of Read Commands
0x01  =====  =               =  ===  == General Statistics (rev 1) ==
0x01  0x008  4              33  ---  Lifetime Power-On Resets
0x01  0x010  4              13  ---  Power-on Hours
0x01  0x018  6       286064640  ---  Logical Sectors Written
0x01  0x020  6         1825550  ---  Number of Write Commands
0x01  0x028  6       159645696  ---  Logical Sectors Read
0x01  0x030  6         2333440  ---  Number of Read Commands
0x01  =====  =               =  ===  == General Statistics (rev 1) ==
0x01  0x008  4              33  ---  Lifetime Power-On Resets
0x01  0x010  4              13  ---  Power-on Hours
0x01  0x018  6       286064640  ---  Logical Sectors Written
0x01  0x020  6         1825550  ---  Number of Write Commands
0x01  0x028  6       159645696  ---  Logical Sectors Read
0x01  0x030  6         2333440  ---  Number of Read Commands
0x01  =====  =               =  ===  == General Statistics (rev 1) ==
0x01  0x008  4              33  ---  Lifetime Power-On Resets
0x01  0x010  4              13  ---  Power-on Hours
0x01  0x018  6       286064640  ---  Logical Sectors Written
0x01  0x020  6         1825550  ---  Number of Write Commands
0x01  0x028  6       159645696  ---  Logical Sectors Read
0x01  0x030  6         2333440  ---  Number of Read Commands
0x01  =====  =               =  ===  == General Statistics (rev 1) ==
0x01  0x008  4              33  ---  Lifetime Power-On Resets
0x01  0x010  4              13  ---  Power-on Hours
0x01  0x018  6       286064640  ---  Logical Sectors Written
0x01  0x020  6         1825550  ---  Number of Write Commands
0x01  0x028  6       159645696  ---  Logical Sectors Read
0x01  0x030  6         2333440  ---  Number of Read Commands
0x01  =====  =               =  ===  == General Statistics (rev 1) ==
0x01  0x008  4              33  ---  Lifetime Power-On Resets
0x01  0x010  4              13  ---  Power-on Hours
0x01  0x018  6       286064640  ---  Logical Sectors Written
0x01  0x020  6         1825550  ---  Number of Write Commands
0x01  0x028  6       159645696  ---  Logical Sectors Read
0x01  0x030  6         2333440  ---  Number of Read Commands
0x01  =====  =               =  ===  == General Statistics (rev 1) ==
0x01  0x008  4              33  ---  Lifetime Power-On Resets
0x01  0x010  4              13  ---  Power-on Hours
0x01  0x018  6       286064640  ---  Logical Sectors Written
0x01  0x020  6         1825550  ---  Number of Write Commands
0x01  0x028  6       159645696  ---  Logical Sectors Read
0x01  0x030  6         2333440  ---  Number of Read Commands
                                |||_ C monitored condition met
                                ||__ D supports DSN
                                |___ N normalized value

Pending Defects log (GP Log 0x0c) not supported

SATA Phy Event Counters (GP Log 0x11)
ID      Size     Value  Description
0x0001  2            0  Command failed due to ICRC error
0x0009  2          109  Transition from drive PhyRdy to drive PhyNRdy
0x000a  2           74  Device-to-host register FISes sent due to a COMRESET
0x000b  2           24  CRC errors within host-to-device FIS
0x000d  2           24  Non-CRC errors within host-to-device FIS



