smartctl 7.3 2022-02-28 r5338 [FreeBSD 13.1-RELEASE amd64] (local build)
Copyright (C) 2002-22, Bruce Allen, Christian Franke, www.smartmontools.org

=== START OF INFORMATION SECTION ===
Device Model:     TOSHIBA MQ04ABF100
Serial Number:    --
LU WWN Device Id: 5 000039 ...
Firmware Version: JU0A2E
User Capacity:    1,000,204,886,016 bytes [1.00 TB]
Sector Sizes:     512 bytes logical, 4096 bytes physical
Rotation Rate:    5400 rpm
Form Factor:      2.5 inches
Zoned Device:     Device managed zones
Device is:        Not in smartctl database 7.3/5319
ATA Version is:   ACS-3 T13/2161-D revision 5
SATA Version is:  SATA 3.3, 6.0 Gb/s (current: 6.0 Gb/s)
Local Time is:    Sun Feb  5 03:02:18 2023 UTC
SMART support is: Available - device has SMART capability.
SMART support is: Enabled
AAM feature is:   Unavailable
APM level is:     128 (minimum power consumption without standby)
Rd look-ahead is: Enabled
Write cache is:   Enabled
DSN feature is:   Unavailable
ATA Security is:  Disabled, frozen [SEC2]
Wt Cache Reorder: Enabled

=== START OF READ SMART DATA SECTION ===
SMART overall-health self-assessment test result: PASSED

General SMART Values:
Offline data collection status:  (0x82)	Offline data collection activity
					was completed without error.
					Auto Offline Data Collection: Enabled.
Self-test execution status:      (   0)	The previous self-test routine completed
					without error or no self-test has ever 
					been run.
Total time to complete Offline 
data collection: 		(  120) seconds.
Offline data collection
capabilities: 			 (0x5b) SMART execute Offline immediate.
					Auto Offline data collection on/off support.
					Suspend Offline collection upon new
					command.
					Offline surface scan supported.
					Self-test supported.
					No Conveyance Self-test supported.
					Selective Self-test supported.
SMART capabilities:            (0x0003)	Saves SMART data before entering
					power-saving mode.
					Supports SMART auto save timer.
Error logging capability:        (0x01)	Error logging supported.
					General Purpose Logging supported.
Short self-test routine 
recommended polling time: 	 (   2) minutes.
Extended self-test routine
recommended polling time: 	 ( 170) minutes.
SCT capabilities: 	       (0x003d)	SCT Status supported.
					SCT Error Recovery Control supported.
					SCT Feature Control supported.
					SCT Data Table supported.

SMART Attributes Data Structure revision number: 16
Vendor Specific SMART Attributes with Thresholds:
ID# ATTRIBUTE_NAME          FLAGS    VALUE WORST THRESH FAIL RAW_VALUE
  1 Raw_Read_Error_Rate     PO-R--   100   100   050    -    0
  2 Throughput_Performance  P-S---   100   100   050    -    0
  3 Spin_Up_Time            POS--K   100   100   001    -    1314
  4 Start_Stop_Count        -O--CK   100   100   000    -    4108
  5 Reallocated_Sector_Ct   PO--CK   100   100   010    -    0
  7 Seek_Error_Rate         PO-R--   100   100   050    -    0
  8 Seek_Time_Performance   P-S---   100   100   050    -    0
  9 Power_On_Hours          -O--CK   093   093   000    -    2835
 10 Spin_Retry_Count        PO--CK   182   100   030    -    0
 12 Power_Cycle_Count       -O--CK   100   100   000    -    1570
187 Reported_Uncorrect      -O--CK   088   088   000    -    12
191 G-Sense_Error_Rate      -O--CK   100   100   000    -    149
192 Power-Off_Retract_Count -O--CK   099   099   000    -    564
193 Load_Cycle_Count        -O--CK   098   098   000    -    26030
194 Temperature_Celsius     -O---K   100   100   000    -    35 (Min/Max 17/60)
196 Reallocated_Event_Count -O--CK   100   100   000    -    0
197 Current_Pending_Sector  -O--CK   100   100   000    -    0
198 Offline_Uncorrectable   ----CK   100   100   000    -    0
199 UDMA_CRC_Error_Count    -O--CK   200   200   000    -    0
206 Flying_Height           -----K   100   100   000    -    16484
220 Disk_Shift              -O----   100   100   000    -    0
222 Loaded_Hours            -O--CK   095   095   000    -    2223
223 Load_Retry_Count        -O--CK   100   100   000    -    0
224 Load_Friction           -O---K   100   100   000    -    0
226 Load-in_Time            -OS--K   100   100   000    -    276
240 Head_Flying_Hours       P-----   100   100   001    -    0
                            ||||||_ K auto-keep
                            |||||__ C event count
                            ||||___ R error rate
                            |||____ S speed/performance
                            ||_____ O updated online
                            |______ P prefailure warning

General Purpose Log Directory Version 1
SMART           Log Directory Version 1 [multi-sector log support]
Address    Access  R/W   Size  Description
0x00       GPL,SL  R/O      1  Log Directory
0x01           SL  R/O      1  Summary SMART error log
0x02           SL  R/O     51  Comprehensive SMART error log
0x03       GPL     R/O     64  Ext. Comprehensive SMART error log
0x04       GPL,SL  R/O      8  Device Statistics log
0x06           SL  R/O      1  SMART self-test log
0x07       GPL     R/O      1  Extended self-test log
0x09           SL  R/W      1  Selective self-test log
0x10       GPL     R/O      1  NCQ Command Error log
0x11       GPL     R/O      1  SATA Phy Event Counters log
0x24       GPL     R/O  45056  Current Device Internal Status Data log
0x30       GPL,SL  R/O      9  IDENTIFY DEVICE data log
0x80-0x9f  GPL,SL  R/W     16  Host vendor specific log
0xa7       GPL     VS       8  Device vendor specific log
0xdf       GPL     VS       1  Device vendor specific log
0xe0       GPL,SL  R/W      1  SCT Command/Status
0xe1       GPL,SL  R/W      1  SCT Data Transfer

SMART Extended Comprehensive Error Log Version: 1 (64 sectors)
Device Error Count: 14
	CR     = Command Register
	FEATR  = Features Register
	COUNT  = Count (was: Sector Count) Register
	LBA_48 = Upper bytes of LBA High/Mid/Low Registers ]  ATA-8
	LH     = LBA High (was: Cylinder High) Register    ]   LBA
	LM     = LBA Mid (was: Cylinder Low) Register      ] Register
	LL     = LBA Low (was: Sector Number) Register     ]
	DV     = Device (was: Device/Head) Register
	DC     = Device Control Register
	ER     = Error register
	ST     = Status register
Powered_Up_Time is measured from power on, and printed as
DDd+hh:mm:SS.sss where DD=days, hh=hours, mm=minutes,
SS=sec, and sss=millisec. It "wraps" after 49.710 days.

Error 14 [13] occurred at disk power-on lifetime: 2089 hours (87 days + 1 hours)
  When the command that caused the error occurred, the device was active or idle.

  After command completion occurred, registers were:
  ER -- ST COUNT  LBA_48  LH LM LL DV DC
  -- -- -- == -- == == == -- -- -- -- --
  40 -- 41 00 48 00 00 03 a2 ec c8 40 00  Error: WP at LBA = 0x03a2ecc8 = 61009096

  Commands leading to the command that caused the error were:
  CR FEATR COUNT  LBA_48  LH LM LL DV DC  Powered_Up_Time  Command/Feature_Name
  -- == -- == -- == == == -- -- -- -- --  ---------------  --------------------
  61 00 08 00 58 00 00 00 71 47 48 40 00     00:02:37.230  WRITE FPDMA QUEUED
  61 00 08 00 50 00 00 00 72 9f a8 40 00     00:02:37.229  WRITE FPDMA QUEUED
  60 00 08 00 48 00 00 03 a2 ec c8 40 00     00:02:37.229  READ FPDMA QUEUED
  61 00 08 00 40 00 00 00 75 9d d8 40 00     00:02:37.229  WRITE FPDMA QUEUED
  2f 00 00 00 01 00 00 00 00 00 10 e0 00     00:02:37.194  READ LOG EXT

Error 13 [12] occurred at disk power-on lifetime: 2089 hours (87 days + 1 hours)
  When the command that caused the error occurred, the device was active or idle.

  After command completion occurred, registers were:
  ER -- ST COUNT  LBA_48  LH LM LL DV DC
  -- -- -- == -- == == == -- -- -- -- --
  40 -- 41 00 38 00 00 03 a2 ec c8 40 00  Error: UNC at LBA = 0x03a2ecc8 = 61009096

  Commands leading to the command that caused the error were:
  CR FEATR COUNT  LBA_48  LH LM LL DV DC  Powered_Up_Time  Command/Feature_Name
  -- == -- == -- == == == -- -- -- -- --  ---------------  --------------------
  60 00 08 00 38 00 00 03 a2 ec c8 40 00     00:02:33.371  READ FPDMA QUEUED
  61 00 08 00 30 00 00 00 75 86 c8 40 00     00:02:33.371  WRITE FPDMA QUEUED
  61 00 08 00 28 00 00 00 75 82 28 40 00     00:02:33.371  WRITE FPDMA QUEUED
  61 00 08 00 20 00 00 00 75 7e 68 40 00     00:02:33.371  WRITE FPDMA QUEUED
  61 00 08 00 18 00 00 00 75 3d 78 40 00     00:02:33.371  WRITE FPDMA QUEUED

Error 12 [11] occurred at disk power-on lifetime: 2089 hours (87 days + 1 hours)
  When the command that caused the error occurred, the device was active or idle.

  After command completion occurred, registers were:
  ER -- ST COUNT  LBA_48  LH LM LL DV DC
  -- -- -- == -- == == == -- -- -- -- --
  40 -- 41 00 08 00 00 03 a2 ec c8 40 00  Error: WP at LBA = 0x03a2ecc8 = 61009096

  Commands leading to the command that caused the error were:
  CR FEATR COUNT  LBA_48  LH LM LL DV DC  Powered_Up_Time  Command/Feature_Name
  -- == -- == -- == == == -- -- -- -- --  ---------------  --------------------
  61 00 08 00 10 00 00 00 00 09 20 40 00     00:02:29.529  WRITE FPDMA QUEUED
  60 00 08 00 08 00 00 03 a2 ec c8 40 00     00:02:29.529  READ FPDMA QUEUED
  61 00 08 00 f8 00 00 00 14 76 58 40 00     00:02:29.528  WRITE FPDMA QUEUED
  61 00 08 00 f0 00 00 00 75 38 b8 40 00     00:02:29.528  WRITE FPDMA QUEUED
  2f 00 00 00 01 00 00 00 00 00 10 e0 00     00:02:29.528  READ LOG EXT

Error 11 [10] occurred at disk power-on lifetime: 2089 hours (87 days + 1 hours)
  When the command that caused the error occurred, the device was active or idle.

  After command completion occurred, registers were:
  ER -- ST COUNT  LBA_48  LH LM LL DV DC
  -- -- -- == -- == == == -- -- -- -- --
  40 -- 41 00 e8 00 00 03 a2 ec c8 40 00  Error: WP at LBA = 0x03a2ecc8 = 61009096

  Commands leading to the command that caused the error were:
  CR FEATR COUNT  LBA_48  LH LM LL DV DC  Powered_Up_Time  Command/Feature_Name
  -- == -- == -- == == == -- -- -- -- --  ---------------  --------------------
  61 00 08 00 f0 00 00 00 75 38 b8 40 00     00:02:29.225  WRITE FPDMA QUEUED
  60 00 08 00 e8 00 00 03 a2 ec c8 40 00     00:02:25.714  READ FPDMA QUEUED
  60 00 08 00 e0 00 00 03 a2 ec c0 40 00     00:02:25.713  READ FPDMA QUEUED
  60 00 08 00 d8 00 00 03 a2 ec b8 40 00     00:02:25.713  READ FPDMA QUEUED
  60 00 08 00 d0 00 00 03 a2 ec b0 40 00     00:02:25.713  READ FPDMA QUEUED

Error 10 [9] occurred at disk power-on lifetime: 2089 hours (87 days + 1 hours)
  When the command that caused the error occurred, the device was active or idle.

  After command completion occurred, registers were:
  ER -- ST COUNT  LBA_48  LH LM LL DV DC
  -- -- -- == -- == == == -- -- -- -- --
  40 -- 41 00 a8 00 00 03 a2 ec c8 40 00  Error: WP at LBA = 0x03a2ecc8 = 61009096

  Commands leading to the command that caused the error were:
  CR FEATR COUNT  LBA_48  LH LM LL DV DC  Powered_Up_Time  Command/Feature_Name
  -- == -- == -- == == == -- -- -- -- --  ---------------  --------------------
  61 00 08 00 b0 00 00 00 75 23 c0 40 00     00:02:25.382  WRITE FPDMA QUEUED
  60 00 40 00 a8 00 00 03 a2 ec a0 40 00     00:02:21.867  READ FPDMA QUEUED
  60 00 40 00 a0 00 00 03 a2 ec 60 40 00     00:02:21.867  READ FPDMA QUEUED
  60 00 40 00 98 00 00 03 a2 ec 20 40 00     00:02:21.867  READ FPDMA QUEUED
  60 00 40 00 90 00 00 03 a2 eb e0 40 00     00:02:21.866  READ FPDMA QUEUED

Error 9 [8] occurred at disk power-on lifetime: 2089 hours (87 days + 1 hours)
  When the command that caused the error occurred, the device was active or idle.

  After command completion occurred, registers were:
  ER -- ST COUNT  LBA_48  LH LM LL DV DC
  -- -- -- == -- == == == -- -- -- -- --
  40 -- 41 00 c0 00 00 03 a2 ec c8 40 00  Error: WP at LBA = 0x03a2ecc8 = 61009096

  Commands leading to the command that caused the error were:
  CR FEATR COUNT  LBA_48  LH LM LL DV DC  Powered_Up_Time  Command/Feature_Name
  -- == -- == -- == == == -- -- -- -- --  ---------------  --------------------
  61 00 70 00 e0 00 00 00 72 9f 38 40 00     00:02:21.426  WRITE FPDMA QUEUED
  60 01 00 00 d8 00 00 03 a2 ef 20 40 00     00:02:17.877  READ FPDMA QUEUED
  60 01 00 00 d0 00 00 03 a2 ee 20 40 00     00:02:17.877  READ FPDMA QUEUED
  60 01 00 00 c8 00 00 03 a2 ed 20 40 00     00:02:17.877  READ FPDMA QUEUED
  60 01 00 00 c0 00 00 03 a2 ec 20 40 00     00:02:17.877  READ FPDMA QUEUED

Error 8 [7] occurred at disk power-on lifetime: 2089 hours (87 days + 1 hours)
  When the command that caused the error occurred, the device was active or idle.

  After command completion occurred, registers were:
  ER -- ST COUNT  LBA_48  LH LM LL DV DC
  -- -- -- == -- == == == -- -- -- -- --
  40 -- 41 00 b0 00 00 03 a2 ec c8 40 00  Error: UNC at LBA = 0x03a2ecc8 = 61009096

  Commands leading to the command that caused the error were:
  CR FEATR COUNT  LBA_48  LH LM LL DV DC  Powered_Up_Time  Command/Feature_Name
  -- == -- == -- == == == -- -- -- -- --  ---------------  --------------------
  60 00 08 00 b0 00 00 03 a2 ec c8 40 00     00:01:12.782  READ FPDMA QUEUED
  61 00 08 00 a8 00 00 00 14 5e b0 40 00     00:01:12.782  WRITE FPDMA QUEUED
  2f 00 00 00 01 00 00 00 00 00 10 e0 00     00:01:12.761  READ LOG EXT
  60 00 08 00 a0 00 00 03 a2 ec c8 40 00     00:01:08.938  READ FPDMA QUEUED
  61 00 08 00 98 00 00 00 14 3b b8 40 00     00:01:08.938  WRITE FPDMA QUEUED

Error 7 [6] occurred at disk power-on lifetime: 2089 hours (87 days + 1 hours)
  When the command that caused the error occurred, the device was active or idle.

  After command completion occurred, registers were:
  ER -- ST COUNT  LBA_48  LH LM LL DV DC
  -- -- -- == -- == == == -- -- -- -- --
  40 -- 41 00 a0 00 00 03 a2 ec c8 40 00  Error: UNC at LBA = 0x03a2ecc8 = 61009096

  Commands leading to the command that caused the error were:
  CR FEATR COUNT  LBA_48  LH LM LL DV DC  Powered_Up_Time  Command/Feature_Name
  -- == -- == -- == == == -- -- -- -- --  ---------------  --------------------
  60 00 08 00 a0 00 00 03 a2 ec c8 40 00     00:01:08.938  READ FPDMA QUEUED
  61 00 08 00 98 00 00 00 14 3b b8 40 00     00:01:08.938  WRITE FPDMA QUEUED
  61 00 08 00 90 00 00 00 73 47 e8 40 00     00:01:08.938  WRITE FPDMA QUEUED
  61 00 08 00 88 00 00 00 05 69 20 40 00     00:01:08.938  WRITE FPDMA QUEUED
  61 00 08 00 80 00 00 00 73 47 d0 40 00     00:01:08.937  WRITE FPDMA QUEUED

SMART Extended Self-test Log Version: 1 (1 sectors)
No self-tests have been logged.  [To run self-tests, use: smartctl -t]

SMART Selective self-test log data structure revision number 1
 SPAN  MIN_LBA  MAX_LBA  CURRENT_TEST_STATUS
    1        0        0  Not_testing
    2        0        0  Not_testing
    3        0        0  Not_testing
    4        0        0  Not_testing
    5        0        0  Not_testing
Selective self-test flags (0x0):
  After scanning selected spans, do NOT read-scan remainder of disk.
If Selective self-test is pending on power-up, resume after 0 minute delay.

SCT Status Version:                  3
SCT Version (vendor specific):       1 (0x0001)
Device State:                        Active (0)
Current Temperature:                    35 Celsius
Power Cycle Min/Max Temperature:     33/39 Celsius
Lifetime    Min/Max Temperature:     17/60 Celsius
Under/Over Temperature Limit Count:   0/0

SCT Temperature History Version:     2
Temperature Sampling Period:         1 minute
Temperature Logging Interval:        1 minute
Min/Max recommended Temperature:      0/60 Celsius
Min/Max Temperature Limit:            0/60 Celsius
Temperature History Size (Index):    478 (130)

SCT Error Recovery Control:
           Read: Disabled
          Write: Disabled

Device Statistics (GP Log 0x04)
Page  Offset Size        Value Flags Description
0x01  =====  =               =  ===  == General Statistics (rev 1) ==
0x01  0x008  4            1570  ---  Lifetime Power-On Resets
0x01  0x010  4            2835  ---  Power-on Hours
0x01  0x018  6     18084730305  ---  Logical Sectors Written
0x01  0x020  6       163781629  ---  Number of Write Commands
0x01  0x028  6     28232243843  ---  Logical Sectors Read
0x01  0x030  6       238401167  ---  Number of Read Commands
0x01  0x038  6     10207157250  ---  Date and Time TimeStamp
0x02  =====  =               =  ===  == Free-Fall Statistics (rev 1) ==
0x02  0x010  4             149  ---  Overlimit Shock Events
0x03  =====  =               =  ===  == Rotating Media Statistics (rev 1) ==
0x03  0x008  4            2729  ---  Spindle Motor Power-on Hours
0x03  0x010  4            2223  ---  Head Flying Hours
0x03  0x018  4           26030  ---  Head Load Events
0x03  0x020  4               0  ---  Number of Reallocated Logical Sectors
0x03  0x028  4             352  ---  Read Recovery Attempts
0x03  0x030  4               0  ---  Number of Mechanical Start Failures
0x03  0x038  4               0  ---  Number of Realloc. Candidate Logical Sectors
0x03  0x040  4             564  ---  Number of High Priority Unload Events
0x04  =====  =               =  ===  == General Errors Statistics (rev 1) ==
0x04  0x008  4              12  ---  Number of Reported Uncorrectable Errors
0x04  0x010  4               2  ---  Resets Between Cmd Acceptance and Completion
0x05  =====  =               =  ===  == Temperature Statistics (rev 1) ==
0x05  0x008  1              35  ---  Current Temperature
0x05  0x010  1              32  N--  Average Short Term Temperature
0x05  0x018  1              32  N--  Average Long Term Temperature
0x05  0x020  1              60  ---  Highest Temperature
0x05  0x028  1              17  ---  Lowest Temperature
0x05  0x030  1              36  N--  Highest Average Short Term Temperature
0x05  0x038  1              26  N--  Lowest Average Short Term Temperature
0x05  0x040  1              33  N--  Highest Average Long Term Temperature
0x05  0x048  1              29  N--  Lowest Average Long Term Temperature
0x05  0x050  4               7  ---  Time in Over-Temperature
0x05  0x058  1              60  ---  Specified Maximum Operating Temperature
0x05  0x060  4               0  ---  Time in Under-Temperature
0x05  0x068  1               0  ---  Specified Minimum Operating Temperature
0x06  =====  =               =  ===  == Transport Statistics (rev 1) ==
0x06  0x008  4            6053  ---  Number of Hardware Resets
0x06  0x010  4            1843  ---  Number of ASR Events
0x06  0x018  4               0  ---  Number of Interface CRC Errors
0x07  =====  =               =  ===  == Solid State Device Statistics (rev 1) ==
                                |||_ C monitored condition met
                                ||__ D supports DSN
                                |___ N normalized value

Pending Defects log (GP Log 0x0c) not supported

SATA Phy Event Counters (GP Log 0x11)
ID      Size     Value  Description
0x0001  4            0  Command failed due to ICRC error
0x0002  4            0  R_ERR response for data FIS
0x0003  4            0  R_ERR response for device-to-host data FIS
0x0004  4            0  R_ERR response for host-to-device data FIS
0x0005  4            0  R_ERR response for non-data FIS
0x0006  4            0  R_ERR response for device-to-host non-data FIS
0x0007  4            0  R_ERR response for host-to-device non-data FIS
0x0008  4            0  Device-to-host non-data FIS retries
0x0009  4            7  Transition from drive PhyRdy to drive PhyNRdy
0x000a  4            7  Device-to-host register FISes sent due to a COMRESET
0x000b  4            0  CRC errors within host-to-device FIS
0x000d  4            0  Non-CRC errors within host-to-device FIS
0x000f  4            0  R_ERR response for host-to-device data FIS, CRC
0x0010  4            0  R_ERR response for host-to-device data FIS, non-CRC
0x0012  4            0  R_ERR response for host-to-device non-data FIS, CRC
0x0013  4            0  R_ERR response for host-to-device non-data FIS, non-CRC

