smartctl 7.1 2019-12-30 r5022 [FreeBSD 12.2-RELEASE amd64] (local build)
Copyright (C) 2002-19, Bruce Allen, Christian Franke, www.smartmontools.org

=== START OF INFORMATION SECTION ===
Model Number:                       KBG30ZMT512G TOSHIBA
Serial Number:                      --
Firmware Version:                   0106ADLA
PCI Vendor/Subsystem ID:            0x1179
IEEE OUI Identifier:                0x00080d
Controller ID:                      0
Number of Namespaces:               1
Namespace 1 Size/Capacity:          512,110,190,592 [512 GB]
Namespace 1 Formatted LBA Size:     512
Namespace 1 IEEE EUI-64:            00080d ...
Local Time is:                      Sun Nov 22 20:10:04 2020 UTC
Firmware Updates (0x12):            1 Slot, no Reset required
Optional Admin Commands (0x0017):   Security Format Frmw_DL Self_Test
Optional NVM Commands (0x0017):     Comp Wr_Unc DS_Mngmt Sav/Sel_Feat
Maximum Data Transfer Size:         512 Pages
Warning  Comp. Temp. Threshold:     82 Celsius
Critical Comp. Temp. Threshold:     85 Celsius

Supported Power States
St Op     Max   Active     Idle   RL RT WL WT  Ent_Lat  Ex_Lat
 0 +     3.30W       -        -    0  0  0  0        0       0
 1 +     2.80W       -        -    1  1  1  1        0       0
 2 +     2.30W       -        -    2  2  2  2        0       0
 3 -   0.0500W       -        -    4  4  4  4     8000   32000
 4 -   0.0050W       -        -    4  4  4  4     8000   40000

Supported LBA Sizes (NSID 0x1)
Id Fmt  Data  Metadt  Rel_Perf
 0 -    4096       0         0
 1 +     512       0         3

=== START OF SMART DATA SECTION ===
SMART overall-health self-assessment test result: PASSED

SMART/Health Information (NVMe Log 0x02)
Critical Warning:                   0x00
Temperature:                        36 Celsius
Available Spare:                    100%
Available Spare Threshold:          10%
Percentage Used:                    0%
Data Units Read:                    542,638 [277 GB]
Data Units Written:                 1,349,776 [691 GB]
Host Read Commands:                 6,321,199
Host Write Commands:                15,186,590
Controller Busy Time:               103
Power Cycles:                       288
Power On Hours:                     80
Unsafe Shutdowns:                   211
Media and Data Integrity Errors:    0
Error Information Log Entries:      58
Warning  Comp. Temperature Time:    0
Critical Comp. Temperature Time:    0
Temperature Sensor 1:               36 Celsius

Error Information (NVMe Log 0x01, max 64 entries)
No Errors Logged

