smartctl 7.2 2021-09-14 r5236 [FreeBSD 13.0-RELEASE-p7 amd64] (local build)
Copyright (C) 2002-20, Bruce Allen, Christian Franke, www.smartmontools.org

=== START OF INFORMATION SECTION ===
Model Family:     Seagate NAS HDD
Device Model:     ST4000VN000-1H4168
Serial Number:    --
LU WWN Device Id: 5 000c50 ...
Firmware Version: SC46
User Capacity:    4,000,787,030,016 bytes [4.00 TB]
Sector Sizes:     512 bytes logical, 4096 bytes physical
Rotation Rate:    5900 rpm
Form Factor:      3.5 inches
Device is:        In smartctl database [for details use: -P show]
ATA Version is:   ACS-2, ACS-3 T13/2161-D revision 3b
SATA Version is:  SATA 3.1, 6.0 Gb/s (current: 6.0 Gb/s)
Local Time is:    Sun Mar  6 12:09:45 2022 EST
SMART support is: Available - device has SMART capability.
SMART support is: Enabled
AAM feature is:   Unavailable
APM level is:     192 (intermediate level without standby)
Rd look-ahead is: Enabled
Write cache is:   Enabled
DSN feature is:   Unavailable
ATA Security is:  Disabled, NOT FROZEN [SEC1]
Wt Cache Reorder: Enabled

=== START OF READ SMART DATA SECTION ===
SMART overall-health self-assessment test result: PASSED

General SMART Values:
Offline data collection status:  (0x00)	Offline data collection activity
					was never started.
					Auto Offline Data Collection: Disabled.
Self-test execution status:      (   0)	The previous self-test routine completed
					without error or no self-test has ever 
					been run.
Total time to complete Offline 
data collection: 		(  117) seconds.
Offline data collection
capabilities: 			 (0x73) SMART execute Offline immediate.
					Auto Offline data collection on/off support.
					Suspend Offline collection upon new
					command.
					No Offline surface scan supported.
					Self-test supported.
					Conveyance Self-test supported.
					Selective Self-test supported.
SMART capabilities:            (0x0003)	Saves SMART data before entering
					power-saving mode.
					Supports SMART auto save timer.
Error logging capability:        (0x01)	Error logging supported.
					General Purpose Logging supported.
Short self-test routine 
recommended polling time: 	 (   1) minutes.
Extended self-test routine
recommended polling time: 	 ( 497) minutes.
Conveyance self-test routine
recommended polling time: 	 (   2) minutes.
SCT capabilities: 	       (0x10bd)	SCT Status supported.
					SCT Error Recovery Control supported.
					SCT Feature Control supported.
					SCT Data Table supported.

SMART Attributes Data Structure revision number: 10
Vendor Specific SMART Attributes with Thresholds:
ID# ATTRIBUTE_NAME          FLAGS    VALUE WORST THRESH FAIL RAW_VALUE
  1 Raw_Read_Error_Rate     POSR--   117   099   006    -    120872080
  3 Spin_Up_Time            PO----   092   091   000    -    0
  4 Start_Stop_Count        -O--CK   100   100   020    -    33
  5 Reallocated_Sector_Ct   PO--CK   100   100   010    -    0
  7 Seek_Error_Rate         POSR--   090   060   030    -    976048964
  9 Power_On_Hours          -O--CK   053   053   000    -    41591
 10 Spin_Retry_Count        PO--C-   100   100   097    -    0
 12 Power_Cycle_Count       -O--CK   100   100   020    -    32
184 End-to-End_Error        -O--CK   100   100   099    -    0
187 Reported_Uncorrect      -O--CK   080   080   000    -    20
188 Command_Timeout         -O--CK   100   100   000    -    0
189 High_Fly_Writes         -O-RCK   100   100   000    -    0
190 Airflow_Temperature_Cel -O---K   072   051   045    -    28 (Min/Max 21/35)
191 G-Sense_Error_Rate      -O--CK   100   100   000    -    0
192 Power-Off_Retract_Count -O--CK   100   100   000    -    16
193 Load_Cycle_Count        -O--CK   100   100   000    -    33
194 Temperature_Celsius     -O---K   028   049   000    -    28 (0 18 0 0 0)
197 Current_Pending_Sector  -O--C-   100   100   000    -    0
198 Offline_Uncorrectable   ----C-   100   100   000    -    0
199 UDMA_CRC_Error_Count    -OSRCK   200   200   000    -    0
                            ||||||_ K auto-keep
                            |||||__ C event count
                            ||||___ R error rate
                            |||____ S speed/performance
                            ||_____ O updated online
                            |______ P prefailure warning

General Purpose Log Directory Version 1
SMART           Log Directory Version 1 [multi-sector log support]
Address    Access  R/W   Size  Description
0x00       GPL,SL  R/O      1  Log Directory
0x01           SL  R/O      1  Summary SMART error log
0x02           SL  R/O      5  Comprehensive SMART error log
0x03       GPL     R/O      5  Ext. Comprehensive SMART error log
0x06           SL  R/O      1  SMART self-test log
0x07       GPL     R/O      1  Extended self-test log
0x09           SL  R/W      1  Selective self-test log
0x10       GPL     R/O      1  NCQ Command Error log
0x11       GPL     R/O      1  SATA Phy Event Counters log
0x15       GPL     R/W      1  Rebuild Assist log
0x21       GPL     R/O      1  Write stream error log
0x22       GPL     R/O      1  Read stream error log
0x30       GPL,SL  R/O      9  IDENTIFY DEVICE data log
0x80-0x9f  GPL,SL  R/W     16  Host vendor specific log
0xa1       GPL,SL  VS      20  Device vendor specific log
0xa2       GPL     VS    4496  Device vendor specific log
0xa8       GPL,SL  VS     129  Device vendor specific log
0xa9       GPL,SL  VS       1  Device vendor specific log
0xab       GPL     VS       1  Device vendor specific log
0xb0       GPL     VS    5176  Device vendor specific log
0xbe-0xbf  GPL     VS   65535  Device vendor specific log
0xc0       GPL,SL  VS       1  Device vendor specific log
0xc1       GPL,SL  VS      10  Device vendor specific log
0xc3       GPL,SL  VS       8  Device vendor specific log
0xc4       GPL,SL  VS       5  Device vendor specific log
0xd1       GPL,SL  VS       8  Device vendor specific log
0xe0       GPL,SL  R/W      1  SCT Command/Status
0xe1       GPL,SL  R/W      1  SCT Data Transfer

SMART Extended Comprehensive Error Log Version: 1 (5 sectors)
Device Error Count: 20
	CR     = Command Register
	FEATR  = Features Register
	COUNT  = Count (was: Sector Count) Register
	LBA_48 = Upper bytes of LBA High/Mid/Low Registers ]  ATA-8
	LH     = LBA High (was: Cylinder High) Register    ]   LBA
	LM     = LBA Mid (was: Cylinder Low) Register      ] Register
	LL     = LBA Low (was: Sector Number) Register     ]
	DV     = Device (was: Device/Head) Register
	DC     = Device Control Register
	ER     = Error register
	ST     = Status register
Powered_Up_Time is measured from power on, and printed as
DDd+hh:mm:SS.sss where DD=days, hh=hours, mm=minutes,
SS=sec, and sss=millisec. It "wraps" after 49.710 days.

Error 20 [19] occurred at disk power-on lifetime: 80 hours (3 days + 8 hours)
  When the command that caused the error occurred, the device was active or idle.

  After command completion occurred, registers were:
  ER -- ST COUNT  LBA_48  LH LM LL DV DC
  -- -- -- == -- == == == -- -- -- -- --
  40 -- 51 00 00 00 00 63 90 de 38 00 00  Error: UNC at LBA = 0x6390de38 = 1670438456

  Commands leading to the command that caused the error were:
  CR FEATR COUNT  LBA_48  LH LM LL DV DC  Powered_Up_Time  Command/Feature_Name
  -- == -- == -- == == == -- -- -- -- --  ---------------  --------------------
  60 00 00 00 08 00 00 17 a0 7c 90 40 00  3d+08:32:45.098  READ FPDMA QUEUED
  60 00 00 00 58 00 00 63 90 de 10 40 00  3d+08:32:45.098  READ FPDMA QUEUED
  2f 00 00 00 01 00 00 00 00 00 10 00 00  3d+08:32:44.916  READ LOG EXT
  60 00 00 00 08 00 00 17 a0 7c 90 40 00  3d+08:32:40.367  READ FPDMA QUEUED
  60 00 00 00 58 00 00 63 90 de 10 40 00  3d+08:32:40.366  READ FPDMA QUEUED

Error 19 [18] occurred at disk power-on lifetime: 80 hours (3 days + 8 hours)
  When the command that caused the error occurred, the device was active or idle.

  After command completion occurred, registers were:
  ER -- ST COUNT  LBA_48  LH LM LL DV DC
  -- -- -- == -- == == == -- -- -- -- --
  40 -- 51 00 00 00 00 63 90 de 38 00 00  Error: UNC at LBA = 0x6390de38 = 1670438456

  Commands leading to the command that caused the error were:
  CR FEATR COUNT  LBA_48  LH LM LL DV DC  Powered_Up_Time  Command/Feature_Name
  -- == -- == -- == == == -- -- -- -- --  ---------------  --------------------
  60 00 00 00 08 00 00 17 a0 7c 90 40 00  3d+08:32:40.367  READ FPDMA QUEUED
  60 00 00 00 58 00 00 63 90 de 10 40 00  3d+08:32:40.366  READ FPDMA QUEUED
  2f 00 00 00 01 00 00 00 00 00 10 00 00  3d+08:32:40.253  READ LOG EXT
  60 00 00 00 08 00 00 17 a0 7c 90 40 00  3d+08:32:35.726  READ FPDMA QUEUED
  60 00 00 00 58 00 00 63 90 de 10 40 00  3d+08:32:35.726  READ FPDMA QUEUED

Error 18 [17] occurred at disk power-on lifetime: 80 hours (3 days + 8 hours)
  When the command that caused the error occurred, the device was active or idle.

  After command completion occurred, registers were:
  ER -- ST COUNT  LBA_48  LH LM LL DV DC
  -- -- -- == -- == == == -- -- -- -- --
  40 -- 51 00 00 00 00 63 90 de 38 00 00  Error: UNC at LBA = 0x6390de38 = 1670438456

  Commands leading to the command that caused the error were:
  CR FEATR COUNT  LBA_48  LH LM LL DV DC  Powered_Up_Time  Command/Feature_Name
  -- == -- == -- == == == -- -- -- -- --  ---------------  --------------------
  60 00 00 00 08 00 00 17 a0 7c 90 40 00  3d+08:32:35.726  READ FPDMA QUEUED
  60 00 00 00 58 00 00 63 90 de 10 40 00  3d+08:32:35.726  READ FPDMA QUEUED
  2f 00 00 00 01 00 00 00 00 00 10 00 00  3d+08:32:35.521  READ LOG EXT
  60 00 00 00 38 00 00 07 df 9f 28 40 00  3d+08:32:30.964  READ FPDMA QUEUED
  60 00 00 00 08 00 00 17 a0 7c 90 40 00  3d+08:32:30.964  READ FPDMA QUEUED

Error 17 [16] occurred at disk power-on lifetime: 80 hours (3 days + 8 hours)
  When the command that caused the error occurred, the device was active or idle.

  After command completion occurred, registers were:
  ER -- ST COUNT  LBA_48  LH LM LL DV DC
  -- -- -- == -- == == == -- -- -- -- --
  40 -- 51 00 00 00 00 63 90 de 38 00 00  Error: UNC at LBA = 0x6390de38 = 1670438456

  Commands leading to the command that caused the error were:
  CR FEATR COUNT  LBA_48  LH LM LL DV DC  Powered_Up_Time  Command/Feature_Name
  -- == -- == -- == == == -- -- -- -- --  ---------------  --------------------
  60 00 00 00 38 00 00 07 df 9f 28 40 00  3d+08:32:30.964  READ FPDMA QUEUED
  60 00 00 00 08 00 00 17 a0 7c 90 40 00  3d+08:32:30.964  READ FPDMA QUEUED
  60 00 00 00 08 00 00 0a 2b 4b e0 40 00  3d+08:32:30.964  READ FPDMA QUEUED
  61 00 00 00 08 00 00 18 de 07 38 40 00  3d+08:32:30.964  WRITE FPDMA QUEUED
  60 00 00 00 58 00 00 63 90 de 10 40 00  3d+08:32:30.964  READ FPDMA QUEUED

Error 16 [15] occurred at disk power-on lifetime: 80 hours (3 days + 8 hours)
  When the command that caused the error occurred, the device was active or idle.

  After command completion occurred, registers were:
  ER -- ST COUNT  LBA_48  LH LM LL DV DC
  -- -- -- == -- == == == -- -- -- -- --
  40 -- 51 00 00 00 00 63 90 de 38 00 00  Error: UNC at LBA = 0x6390de38 = 1670438456

  Commands leading to the command that caused the error were:
  CR FEATR COUNT  LBA_48  LH LM LL DV DC  Powered_Up_Time  Command/Feature_Name
  -- == -- == -- == == == -- -- -- -- --  ---------------  --------------------
  60 00 00 00 58 00 00 63 90 de 10 40 00  3d+08:32:26.117  READ FPDMA QUEUED
  60 00 00 00 08 00 00 63 90 e8 20 40 00  3d+08:32:26.111  READ FPDMA QUEUED
  60 00 00 00 08 00 00 41 6f 9d 20 40 00  3d+08:32:26.111  READ FPDMA QUEUED
  60 00 00 00 08 00 00 41 6f 97 f8 40 00  3d+08:32:26.110  READ FPDMA QUEUED
  61 00 00 00 10 00 00 01 04 02 10 40 00  3d+08:32:26.110  WRITE FPDMA QUEUED

Error 15 [14] occurred at disk power-on lifetime: 80 hours (3 days + 8 hours)
  When the command that caused the error occurred, the device was active or idle.

  After command completion occurred, registers were:
  ER -- ST COUNT  LBA_48  LH LM LL DV DC
  -- -- -- == -- == == == -- -- -- -- --
  40 -- 51 00 00 00 00 63 90 de 38 00 00  Error: UNC at LBA = 0x6390de38 = 1670438456

  Commands leading to the command that caused the error were:
  CR FEATR COUNT  LBA_48  LH LM LL DV DC  Powered_Up_Time  Command/Feature_Name
  -- == -- == -- == == == -- -- -- -- --  ---------------  --------------------
  60 00 00 00 08 00 00 59 69 2e 60 40 00  3d+08:32:21.276  READ FPDMA QUEUED
  60 00 00 00 38 00 00 63 90 de 68 40 00  3d+08:32:21.276  READ FPDMA QUEUED
  60 00 00 00 58 00 00 63 90 de 10 40 00  3d+08:32:21.276  READ FPDMA QUEUED
  2f 00 00 00 01 00 00 00 00 00 10 00 00  3d+08:32:21.094  READ LOG EXT
  60 00 00 00 08 00 00 59 69 2e 60 40 00  3d+08:32:16.531  READ FPDMA QUEUED

Error 14 [13] occurred at disk power-on lifetime: 80 hours (3 days + 8 hours)
  When the command that caused the error occurred, the device was active or idle.

  After command completion occurred, registers were:
  ER -- ST COUNT  LBA_48  LH LM LL DV DC
  -- -- -- == -- == == == -- -- -- -- --
  40 -- 51 00 00 00 00 63 90 de 38 00 00  Error: UNC at LBA = 0x6390de38 = 1670438456

  Commands leading to the command that caused the error were:
  CR FEATR COUNT  LBA_48  LH LM LL DV DC  Powered_Up_Time  Command/Feature_Name
  -- == -- == -- == == == -- -- -- -- --  ---------------  --------------------
  60 00 00 00 08 00 00 59 69 2e 60 40 00  3d+08:32:16.531  READ FPDMA QUEUED
  60 00 00 00 38 00 00 63 90 de 68 40 00  3d+08:32:16.531  READ FPDMA QUEUED
  60 00 00 00 58 00 00 63 90 de 10 40 00  3d+08:32:16.530  READ FPDMA QUEUED
  2f 00 00 00 01 00 00 00 00 00 10 00 00  3d+08:32:16.401  READ LOG EXT
  61 00 00 00 08 00 00 18 dd 5a f0 40 00  3d+08:32:11.860  WRITE FPDMA QUEUED

Error 13 [12] occurred at disk power-on lifetime: 80 hours (3 days + 8 hours)
  When the command that caused the error occurred, the device was active or idle.

  After command completion occurred, registers were:
  ER -- ST COUNT  LBA_48  LH LM LL DV DC
  -- -- -- == -- == == == -- -- -- -- --
  40 -- 51 00 00 00 00 63 90 de 38 00 00  Error: WP at LBA = 0x6390de38 = 1670438456

  Commands leading to the command that caused the error were:
  CR FEATR COUNT  LBA_48  LH LM LL DV DC  Powered_Up_Time  Command/Feature_Name
  -- == -- == -- == == == -- -- -- -- --  ---------------  --------------------
  61 00 00 00 08 00 00 18 dd 5a f0 40 00  3d+08:32:11.860  WRITE FPDMA QUEUED
  60 00 00 00 38 00 00 07 df 9e 48 40 00  3d+08:32:11.860  READ FPDMA QUEUED
  60 00 00 00 38 00 00 07 df 9e 10 40 00  3d+08:32:11.856  READ FPDMA QUEUED
  60 00 00 00 38 00 00 07 df 9d d8 40 00  3d+08:32:11.825  READ FPDMA QUEUED
  60 00 00 00 38 00 00 07 df 9d a0 40 00  3d+08:32:11.822  READ FPDMA QUEUED

SMART Extended Self-test Log Version: 1 (1 sectors)
Num  Test_Description    Status                  Remaining  LifeTime(hours)  LBA_of_first_error
# 1  Short offline       Completed without error       00%     41580         -
# 2  Conveyance offline  Completed without error       00%     41580         -

SMART Selective self-test log data structure revision number 1
 SPAN  MIN_LBA  MAX_LBA  CURRENT_TEST_STATUS
    1        0        0  Not_testing
    2        0        0  Not_testing
    3        0        0  Not_testing
    4        0        0  Not_testing
    5        0        0  Not_testing
Selective self-test flags (0x0):
  After scanning selected spans, do NOT read-scan remainder of disk.
If Selective self-test is pending on power-up, resume after 0 minute delay.

SCT Status Version:                  3
SCT Version (vendor specific):       522 (0x020a)
Device State:                        Active (0)
Current Temperature:                    28 Celsius
Power Cycle Min/Max Temperature:     21/28 Celsius
Lifetime    Min/Max Temperature:     18/49 Celsius
Under/Over Temperature Limit Count:   0/0

SCT Temperature History Version:     2
Temperature Sampling Period:         1 minute
Temperature Logging Interval:        94 minutes
Min/Max recommended Temperature:      1/61 Celsius
Min/Max Temperature Limit:            2/60 Celsius
Temperature History Size (Index):    128 (93)

SCT Error Recovery Control:
           Read:      1 (0.1 seconds)
          Write:      1 (0.1 seconds)

Device Statistics (GP/SMART Log 0x04) not supported

Pending Defects log (GP Log 0x0c) not supported

SATA Phy Event Counters (GP Log 0x11)
ID      Size     Value  Description
0x000a  2            9  Device-to-host register FISes sent due to a COMRESET
0x0001  2            0  Command failed due to ICRC error
0x0003  2            0  R_ERR response for device-to-host data FIS
0x0004  2            0  R_ERR response for host-to-device data FIS
0x0006  2            0  R_ERR response for device-to-host non-data FIS
0x0007  2            0  R_ERR response for host-to-device non-data FIS



