smartctl 7.4 2023-08-01 r5530 [FreeBSD 14.1-STABLE i386] (local build)
Copyright (C) 2002-23, Bruce Allen, Christian Franke, www.smartmontools.org

=== START OF INFORMATION SECTION ===
Device Model:     TOSHIBA THNSNC128GCSJ
Serial Number:    --
Firmware Version: CJLA0201
User Capacity:    128,035,676,160 bytes [128 GB]
Sector Size:      512 bytes logical/physical
Rotation Rate:    Solid State Device
Form Factor:      2.5 inches
TRIM Command:     Available
Device is:        Not in smartctl database 7.3/5528
ATA Version is:   ATA8-ACS (minor revision not indicated)
SATA Version is:  SATA 2.6, 3.0 Gb/s (current: 1.5 Gb/s)
Local Time is:    Thu Nov 21 13:11:11 2024 PST
SMART support is: Available - device has SMART capability.
SMART support is: Enabled
AAM feature is:   Unavailable
APM level is:     128 (minimum power consumption without standby)
Rd look-ahead is: Enabled
Write cache is:   Enabled
DSN feature is:   Unavailable
ATA Security is:  Disabled, NOT FROZEN [SEC1]
Wt Cache Reorder: Enabled

=== START OF READ SMART DATA SECTION ===
SMART overall-health self-assessment test result: PASSED

General SMART Values:
Offline data collection status:  (0x00)	Offline data collection activity
					was never started.
					Auto Offline Data Collection: Disabled.
Self-test execution status:      (   0)	The previous self-test routine completed
					without error or no self-test has ever 
					been run.
Total time to complete Offline 
data collection: 		(  120) seconds.
Offline data collection
capabilities: 			 (0x5b) SMART execute Offline immediate.
					Auto Offline data collection on/off support.
					Suspend Offline collection upon new
					command.
					Offline surface scan supported.
					Self-test supported.
					No Conveyance Self-test supported.
					Selective Self-test supported.
SMART capabilities:            (0x0003)	Saves SMART data before entering
					power-saving mode.
					Supports SMART auto save timer.
Error logging capability:        (0x01)	Error logging supported.
					General Purpose Logging supported.
Short self-test routine 
recommended polling time: 	 (   2) minutes.
Extended self-test routine
recommended polling time: 	 (  12) minutes.
SCT capabilities: 	       (0x0039)	SCT Status supported.
					SCT Error Recovery Control supported.
					SCT Feature Control supported.
					SCT Data Table supported.

SMART Attributes Data Structure revision number: 16
Vendor Specific SMART Attributes with Thresholds:
ID# ATTRIBUTE_NAME          FLAGS    VALUE WORST THRESH FAIL RAW_VALUE
  1 Raw_Read_Error_Rate     -O-R--   099   099   000    -    0
  2 Throughput_Performance  P-S---   100   100   050    -    0
  3 Spin_Up_Time            POS---   100   100   050    -    0
  5 Reallocated_Sector_Ct   PO--C-   100   100   050    -    0
  7 Unknown_SSD_Attribute   PO-R--   100   100   050    -    0
  8 Unknown_SSD_Attribute   P-S---   100   100   050    -    0
  9 Power_On_Hours          -O--C-   100   100   000    -    39059
 10 Unknown_SSD_Attribute   PO--C-   100   100   050    -    0
 12 Power_Cycle_Count       -O--C-   100   100   000    -    4088
167 Unknown_Attribute       -O---K   100   100   000    -    0
168 Unknown_Attribute       -O--C-   100   100   000    -    34
169 Unknown_Attribute       PO--C-   100   100   010    -    1743851750698
170 Unknown_Attribute       PO--C-   100   100   010    -    279189389394
173 Unknown_Attribute       -O--C-   100   100   000    -    171850334907
175 Program_Fail_Count_Chip PO--C-   100   100   010    -    412317646870
192 Power-Off_Retract_Count -O--C-   100   100   000    -    129
194 Temperature_Celsius     PO---K   070   052   030    -    30 (Min/Max 11/48)
197 Current_Pending_Sector  -O--C-   100   100   000    -    0
240 Unknown_SSD_Attribute   PO--C-   100   100   050    -    0
                            ||||||_ K auto-keep
                            |||||__ C event count
                            ||||___ R error rate
                            |||____ S speed/performance
                            ||_____ O updated online
                            |______ P prefailure warning

General Purpose Log Directory Version 1
SMART           Log Directory Version 1 [multi-sector log support]
Address    Access  R/W   Size  Description
0x00       GPL,SL  R/O      1  Log Directory
0x01           SL  R/O      1  Summary SMART error log
0x02           SL  R/O     51  Comprehensive SMART error log
0x03       GPL     R/O     64  Ext. Comprehensive SMART error log
0x06           SL  R/O      1  SMART self-test log
0x07       GPL     R/O      1  Extended self-test log
0x09           SL  R/W      1  Selective self-test log
0x11       GPL     R/O      1  SATA Phy Event Counters log
0x80-0x9f  GPL,SL  R/W     16  Host vendor specific log
0xe0       GPL,SL  R/W      1  SCT Command/Status
0xe1       GPL,SL  R/W      1  SCT Data Transfer

SMART Extended Comprehensive Error Log Version: 1 (64 sectors)
Device Error Count: 14
	CR     = Command Register
	FEATR  = Features Register
	COUNT  = Count (was: Sector Count) Register
	LBA_48 = Upper bytes of LBA High/Mid/Low Registers ]  ATA-8
	LH     = LBA High (was: Cylinder High) Register    ]   LBA
	LM     = LBA Mid (was: Cylinder Low) Register      ] Register
	LL     = LBA Low (was: Sector Number) Register     ]
	DV     = Device (was: Device/Head) Register
	DC     = Device Control Register
	ER     = Error register
	ST     = Status register
Powered_Up_Time is measured from power on, and printed as
DDd+hh:mm:SS.sss where DD=days, hh=hours, mm=minutes,
SS=sec, and sss=millisec. It "wraps" after 49.710 days.

Error 14 [13] occurred at disk power-on lifetime: 35010 hours (1458 days + 18 hours)
  When the command that caused the error occurred, the device was active or idle.

  After command completion occurred, registers were:
  ER -- ST COUNT  LBA_48  LH LM LL DV DC
  -- -- -- == -- == == == -- -- -- -- --
  84 -- 51 08 08 00 00 b0 f5 9e b8 e8 02  Error: ICRC, ABRT 2056 sectors at LBA = 0xb8f59eb8 = 3103104696

  Commands leading to the command that caused the error were:
  CR FEATR COUNT  LBA_48  LH LM LL DV DC  Powered_Up_Time  Command/Feature_Name
  -- == -- == -- == == == -- -- -- -- --  ---------------  --------------------
  c8 00 00 08 08 f5 9e b0 f5 9e b8 e8 02     09:01:04.096  READ DMA
  c8 00 00 00 08 00 00 00 f5 9e b0 e8 02     09:01:04.096  READ DMA
  c8 00 00 00 08 00 00 00 f5 9e b0 e8 02     09:01:04.095  READ DMA
  c8 00 00 00 08 00 00 00 f5 9e a8 e8 02     09:01:04.095  READ DMA
  c8 00 00 00 08 00 00 00 f5 9e a0 e8 02     09:01:04.095  READ DMA

Error 13 [12] occurred at disk power-on lifetime: 35010 hours (1458 days + 18 hours)
  When the command that caused the error occurred, the device was active or idle.

  After command completion occurred, registers were:
  ER -- ST COUNT  LBA_48  LH LM LL DV DC
  -- -- -- == -- == == == -- -- -- -- --
  84 -- 51 08 10 00 00 70 e6 0b 78 e8 02  Error: ICRC, ABRT 2064 sectors at LBA = 0x78e60b78 = 2028342136

  Commands leading to the command that caused the error were:
  CR FEATR COUNT  LBA_48  LH LM LL DV DC  Powered_Up_Time  Command/Feature_Name
  -- == -- == -- == == == -- -- -- -- --  ---------------  --------------------
  c8 00 00 08 10 e6 0b 70 e6 0b 78 e8 02     09:00:02.058  READ DMA
  c8 00 00 00 08 00 00 00 e6 0b 70 e8 02     09:00:02.058  READ DMA
  c8 00 00 00 08 00 00 00 e6 0b 70 e8 02     09:00:02.057  READ DMA
  c8 00 00 00 08 00 00 00 e6 0b 68 e8 02     09:00:02.057  READ DMA
  c8 00 00 00 08 00 00 00 e6 0b 60 e8 02     09:00:02.056  READ DMA

Error 12 [11] occurred at disk power-on lifetime: 32514 hours (1354 days + 18 hours)
  When the command that caused the error occurred, the device was active or idle.

  After command completion occurred, registers were:
  ER -- ST COUNT  LBA_48  LH LM LL DV DC
  -- -- -- == -- == == == -- -- -- -- --
  84 -- 51 00 00 00 00 68 58 c9 68 e4 00  Error: ICRC, ABRT at LBA = 0x6c58c968 = 1817758056

  Commands leading to the command that caused the error were:
  CR FEATR COUNT  LBA_48  LH LM LL DV DC  Powered_Up_Time  Command/Feature_Name
  -- == -- == -- == == == -- -- -- -- --  ---------------  --------------------
  c8 00 00 00 00 58 c8 68 58 c9 68 e4 00 14d+17:17:48.218  READ DMA
  c8 00 00 00 00 00 00 00 58 c8 68 e4 00 14d+17:17:48.218  READ DMA
  c8 00 00 00 00 00 00 00 58 c7 68 e4 00 14d+17:17:48.217  READ DMA
  c8 00 00 00 00 00 00 00 58 c6 68 e4 00 14d+17:17:48.215  READ DMA
  c8 00 00 00 00 00 00 00 58 c5 68 e4 00 14d+17:17:48.214  READ DMA

Error 11 [10] occurred at disk power-on lifetime: 31961 hours (1331 days + 17 hours)
  When the command that caused the error occurred, the device was active or idle.

  After command completion occurred, registers were:
  ER -- ST COUNT  LBA_48  LH LM LL DV DC
  -- -- -- == -- == == == -- -- -- -- --
  84 -- 51 40 40 00 00 28 ac ff 68 e7 00  Error: ICRC, ABRT 16448 sectors at LBA = 0x2facff68 = 799866728

  Commands leading to the command that caused the error were:
  CR FEATR COUNT  LBA_48  LH LM LL DV DC  Powered_Up_Time  Command/Feature_Name
  -- == -- == -- == == == -- -- -- -- --  ---------------  --------------------
  c8 00 00 40 40 ac ff 28 ac ff 68 e7 00     01:21:40.805  READ DMA
  c8 00 00 00 40 00 00 00 ac ff 28 e7 00     01:21:40.805  READ DMA
  c8 00 00 00 40 00 00 00 f9 58 a8 e6 00     01:21:40.802  READ DMA
  c8 00 00 00 38 00 00 00 ac fe e8 e7 00     01:21:40.799  READ DMA
  c8 00 00 00 18 00 00 00 a8 45 78 e7 00     01:21:40.796  READ DMA

Error 10 [9] occurred at disk power-on lifetime: 31872 hours (1328 days + 0 hours)
  When the command that caused the error occurred, the device was active or idle.

  After command completion occurred, registers were:
  ER -- ST COUNT  LBA_48  LH LM LL DV DC
  -- -- -- == -- == == == -- -- -- -- --
  84 -- 51 10 18 00 00 e8 d4 0f 10 e6 02  Error: ICRC, ABRT 4120 sectors at LBA = 0xeed40f10 = 4006874896

  Commands leading to the command that caused the error were:
  CR FEATR COUNT  LBA_48  LH LM LL DV DC  Powered_Up_Time  Command/Feature_Name
  -- == -- == -- == == == -- -- -- -- --  ---------------  --------------------
  c8 00 00 10 18 d4 0e e8 d4 0f 10 e6 02  2d+10:50:52.330  READ DMA
  c8 00 00 00 10 00 00 00 d4 0e e8 e6 02  2d+10:50:52.330  READ DMA
  c8 00 00 00 08 00 00 00 d4 0e e0 e6 02  2d+10:50:52.330  READ DMA
  c8 00 00 00 08 00 00 00 d4 0e a0 e6 02  2d+10:50:52.329  READ DMA
  c8 00 00 00 38 00 00 00 d4 0e a8 e6 02  2d+10:50:52.326  READ DMA

Error 9 [8] occurred at disk power-on lifetime: 31462 hours (1310 days + 22 hours)
  When the command that caused the error occurred, the device was active or idle.

  After command completion occurred, registers were:
  ER -- ST COUNT  LBA_48  LH LM LL DV DC
  -- -- -- == -- == == == -- -- -- -- --
  84 -- 51 30 18 00 00 68 d3 39 28 e6 00  Error: ICRC, ABRT 12312 sectors at LBA = 0x6ed33928 = 1859336488

  Commands leading to the command that caused the error were:
  CR FEATR COUNT  LBA_48  LH LM LL DV DC  Powered_Up_Time  Command/Feature_Name
  -- == -- == -- == == == -- -- -- -- --  ---------------  --------------------
  c8 00 00 30 18 d3 38 68 d3 39 28 e6 00  1d+10:59:52.390  READ DMA
  c8 00 00 00 30 00 00 00 d3 38 68 e6 00  1d+10:59:52.390  READ DMA
  c8 00 00 00 40 00 00 00 d3 38 e8 e6 00  1d+10:59:52.350  READ DMA
  c8 00 00 00 40 00 00 00 d3 38 a8 e6 00  1d+10:59:52.350  READ DMA
  c8 00 00 00 18 00 00 00 d3 32 c8 e6 00  1d+10:59:52.338  READ DMA

Error 8 [7] occurred at disk power-on lifetime: 29291 hours (1220 days + 11 hours)
  When the command that caused the error occurred, the device was active or idle.

  After command completion occurred, registers were:
  ER -- ST COUNT  LBA_48  LH LM LL DV DC
  -- -- -- == -- == == == -- -- -- -- --
  84 -- 51 08 08 00 00 e2 be 03 8a e4 00  Error: ICRC, ABRT 2056 sectors at LBA = 0xe6be038a = 3871212426

  Commands leading to the command that caused the error were:
  CR FEATR COUNT  LBA_48  LH LM LL DV DC  Powered_Up_Time  Command/Feature_Name
  -- == -- == -- == == == -- -- -- -- --  ---------------  --------------------
  c8 00 00 08 08 be 04 e2 be 03 8a e4 00  6d+11:24:41.449  READ DMA
  c8 00 00 00 08 00 00 00 be 04 e2 e4 00  6d+11:24:41.449  READ DMA
  c8 00 00 00 08 00 00 00 be 02 fa e4 00  6d+11:24:41.448  READ DMA
  c8 00 00 00 08 00 00 00 be 06 2a e4 00  6d+11:24:41.443  READ DMA
  c8 00 00 00 08 00 00 00 be 06 22 e4 00  6d+11:24:41.440  READ DMA

Error 7 [6] occurred at disk power-on lifetime: 29196 hours (1216 days + 12 hours)
  When the command that caused the error occurred, the device was active or idle.

  After command completion occurred, registers were:
  ER -- ST COUNT  LBA_48  LH LM LL DV DC
  -- -- -- == -- == == == -- -- -- -- --
  84 -- 51 00 00 00 00 22 bf 40 62 e6 00  Error: ICRC, ABRT at LBA = 0x26bf4062 = 650068066

  Commands leading to the command that caused the error were:
  CR FEATR COUNT  LBA_48  LH LM LL DV DC  Powered_Up_Time  Command/Feature_Name
  -- == -- == -- == == == -- -- -- -- --  ---------------  --------------------
  c8 00 00 00 00 bf 33 22 bf 40 62 e6 00  2d+13:07:25.782  READ DMA
  c8 00 00 00 18 00 00 00 bf 33 22 e6 00  2d+13:07:25.782  READ DMA
  c8 00 00 00 20 00 00 00 bf 32 a2 e6 00  2d+13:07:25.777  READ DMA
  c8 00 00 00 30 00 00 00 bf 2e e2 e6 00  2d+13:07:25.768  READ DMA
  c8 00 00 00 18 00 00 00 bf 2c 62 e6 00  2d+13:07:25.760  READ DMA

SMART Extended Self-test Log Version: 1 (1 sectors)
Num  Test_Description    Status                  Remaining  LifeTime(hours)  LBA_of_first_error
# 1  Extended offline    Completed without error       00%     18073         -

SMART Selective self-test log data structure revision number 1
 SPAN  MIN_LBA  MAX_LBA  CURRENT_TEST_STATUS
    1        0        0  Not_testing
    2        0        0  Not_testing
    3        0        0  Not_testing
    4        0        0  Not_testing
    5        0        0  Not_testing
Selective self-test flags (0x0):
  After scanning selected spans, do NOT read-scan remainder of disk.
If Selective self-test is pending on power-up, resume after 0 minute delay.

SCT Status Version:                  3
SCT Version (vendor specific):       1 (0x0001)
Device State:                        Active (0)
Current Temperature:                    30 Celsius
Power Cycle Min/Max Temperature:     28/33 Celsius
Lifetime    Min/Max Temperature:     11/48 Celsius
Under/Over Temperature Limit Count:   0/0
Vendor specific:
00 00 04 00 01 01 00 05 05 00 00 00 00 00 00 00
00 02 02 00 27 94 61 08 04 00 00 00 00 00 00 03

SCT Temperature History Version:     2
Temperature Sampling Period:         1 minute
Temperature Logging Interval:        1 minute
Min/Max recommended Temperature:      5/40 Celsius
Min/Max Temperature Limit:            0/70 Celsius
Temperature History Size (Index):    128 (61)

SCT Error Recovery Control:
           Read:     80 (8.0 seconds)
          Write:     80 (8.0 seconds)

Device Statistics (GP/SMART Log 0x04) not supported

Pending Defects log (GP Log 0x0c) not supported

SATA Phy Event Counters (GP Log 0x11)
ID      Size     Value  Description
0x0001  2            0  Command failed due to ICRC error
0x0002  4            0  R_ERR response for data FIS
0x0003  2            0  R_ERR response for device-to-host data FIS
0x0004  2            0  R_ERR response for host-to-device data FIS
0x0005  4            0  R_ERR response for non-data FIS
0x0006  2            0  R_ERR response for device-to-host non-data FIS
0x0007  2            0  R_ERR response for host-to-device non-data FIS
0x0008  2            0  Device-to-host non-data FIS retries
0x0009  4            0  Transition from drive PhyRdy to drive PhyNRdy
0x000a  4            0  Device-to-host register FISes sent due to a COMRESET
0x000f  2            0  R_ERR response for host-to-device data FIS, CRC
0x0010  2            0  R_ERR response for host-to-device data FIS, non-CRC
0x0012  2            0  R_ERR response for host-to-device non-data FIS, CRC
0x0013  2            0  R_ERR response for host-to-device non-data FIS, non-CRC

