smartctl 7.2 2020-12-30 r5155 [FreeBSD 13.0-RELEASE-p3 amd64] (local build)
Copyright (C) 2002-20, Bruce Allen, Christian Franke, www.smartmontools.org

=== START OF INFORMATION SECTION ===
Model Family:     Seagate Samsung SpinPoint M9T
Device Model:     ST2000LM003 HN-M201RAD
Serial Number:    --
LU WWN Device Id: 5 0004cf ...
Firmware Version: 2BE10001
User Capacity:    2,000,398,934,016 bytes [2.00 TB]
Sector Sizes:     512 bytes logical, 4096 bytes physical
Rotation Rate:    5400 rpm
Form Factor:      2.5 inches
Device is:        In smartctl database [for details use: -P show]
ATA Version is:   ATA8-ACS T13/1699-D revision 6
SATA Version is:  SATA 3.0, 6.0 Gb/s (current: 6.0 Gb/s)
Local Time is:    Sat Jul  3 10:18:54 2021 EDT
SMART support is: Available - device has SMART capability.
SMART support is: Enabled
AAM feature is:   Disabled
APM feature is:   Disabled
Rd look-ahead is: Enabled
Write cache is:   Enabled
DSN feature is:   Unavailable
ATA Security is:  Disabled, NOT FROZEN [SEC1]
Wt Cache Reorder: Unknown

=== START OF READ SMART DATA SECTION ===
SMART Status not supported: Incomplete response, ATA output registers missing
SMART overall-health self-assessment test result: PASSED
Warning: This result is based on an Attribute check.

General SMART Values:
Offline data collection status:  (0x00)	Offline data collection activity
					was never started.
					Auto Offline Data Collection: Disabled.
Self-test execution status:      (   0)	The previous self-test routine completed
					without error or no self-test has ever 
					been run.
Total time to complete Offline 
data collection: 		(21180) seconds.
Offline data collection
capabilities: 			 (0x5b) SMART execute Offline immediate.
					Auto Offline data collection on/off support.
					Suspend Offline collection upon new
					command.
					Offline surface scan supported.
					Self-test supported.
					No Conveyance Self-test supported.
					Selective Self-test supported.
SMART capabilities:            (0x0003)	Saves SMART data before entering
					power-saving mode.
					Supports SMART auto save timer.
Error logging capability:        (0x01)	Error logging supported.
					General Purpose Logging supported.
Short self-test routine 
recommended polling time: 	 (   1) minutes.
Extended self-test routine
recommended polling time: 	 ( 353) minutes.
SCT capabilities: 	       (0x003f)	SCT Status supported.
					SCT Error Recovery Control supported.
					SCT Feature Control supported.
					SCT Data Table supported.

SMART Attributes Data Structure revision number: 16
Vendor Specific SMART Attributes with Thresholds:
ID# ATTRIBUTE_NAME          FLAGS    VALUE WORST THRESH FAIL RAW_VALUE
  1 Raw_Read_Error_Rate     POSR-K   100   100   051    -    0
  2 Throughput_Performance  -OS--K   252   252   000    -    0
  3 Spin_Up_Time            PO---K   089   088   025    -    3626
  4 Start_Stop_Count        -O--CK   100   100   000    -    83
  5 Reallocated_Sector_Ct   PO--CK   252   252   010    -    0
  7 Seek_Error_Rate         -OSR-K   252   252   051    -    0
  8 Seek_Time_Performance   --S--K   252   252   015    -    0
  9 Power_On_Hours          -O--CK   100   100   000    -    39177
 10 Spin_Retry_Count        -O--CK   252   252   051    -    0
 12 Power_Cycle_Count       -O--CK   100   100   000    -    47
191 G-Sense_Error_Rate      -O---K   252   252   000    -    0
192 Power-Off_Retract_Count -O---K   252   252   000    -    0
194 Temperature_Celsius     -O----   064   064   000    -    33 (Min/Max 17/42)
195 Hardware_ECC_Recovered  -O-RCK   100   100   000    -    0
196 Reallocated_Event_Count -O--CK   252   252   000    -    0
197 Current_Pending_Sector  -O--CK   252   252   000    -    0
198 Offline_Uncorrectable   ----CK   252   252   000    -    0
199 UDMA_CRC_Error_Count    -OS-CK   099   099   000    -    890
200 Multi_Zone_Error_Rate   -O-R-K   100   100   000    -    8
223 Load_Retry_Count        -O--CK   100   100   000    -    2
225 Load_Cycle_Count        -O--CK   082   082   000    -    186463
                            ||||||_ K auto-keep
                            |||||__ C event count
                            ||||___ R error rate
                            |||____ S speed/performance
                            ||_____ O updated online
                            |______ P prefailure warning

General Purpose Log Directory Version 1
SMART           Log Directory Version 1 [multi-sector log support]
Address    Access  R/W   Size  Description
0x00       GPL,SL  R/O      1  Log Directory
0x01           SL  R/O      1  Summary SMART error log
0x02           SL  R/O      2  Comprehensive SMART error log
0x03       GPL     R/O      2  Ext. Comprehensive SMART error log
0x06           SL  R/O      1  SMART self-test log
0x07       GPL     R/O      2  Extended self-test log
0x08       GPL     R/O      2  Power Conditions log
0x09           SL  R/W      1  Selective self-test log
0x10       GPL     R/O      1  NCQ Command Error log
0x11       GPL     R/O      1  SATA Phy Event Counters log
0x80-0x9f  GPL,SL  R/W     16  Host vendor specific log
0xc0-0xdf  GPL,SL  VS      16  Device vendor specific log
0xe0       GPL,SL  R/W      1  SCT Command/Status
0xe1       GPL,SL  R/W      1  SCT Data Transfer

SMART Extended Comprehensive Error Log Version: 1 (2 sectors)
Device Error Count: 890 (device log contains only the most recent 8 errors)
	CR     = Command Register
	FEATR  = Features Register
	COUNT  = Count (was: Sector Count) Register
	LBA_48 = Upper bytes of LBA High/Mid/Low Registers ]  ATA-8
	LH     = LBA High (was: Cylinder High) Register    ]   LBA
	LM     = LBA Mid (was: Cylinder Low) Register      ] Register
	LL     = LBA Low (was: Sector Number) Register     ]
	DV     = Device (was: Device/Head) Register
	DC     = Device Control Register
	ER     = Error register
	ST     = Status register
Powered_Up_Time is measured from power on, and printed as
DDd+hh:mm:SS.sss where DD=days, hh=hours, mm=minutes,
SS=sec, and sss=millisec. It "wraps" after 49.710 days.

Error 890 [1] occurred at disk power-on lifetime: 4497 hours (187 days + 9 hours)
  When the command that caused the error occurred, the device was active or idle.

  After command completion occurred, registers were:
  ER -- ST COUNT  LBA_48  LH LM LL DV DC
  -- -- -- == -- == == == -- -- -- -- --
  84 -- 51 00 68 00 00 b8 02 04 40 40 00  Error: ICRC, ABRT 104 sectors at LBA = 0xb8020440 = 3087139904

  Commands leading to the command that caused the error were:
  CR FEATR COUNT  LBA_48  LH LM LL DV DC  Powered_Up_Time  Command/Feature_Name
  -- == -- == -- == == == -- -- -- -- --  ---------------  --------------------
  25 00 00 00 80 00 00 b8 02 04 28 40 00     01:09:15.807  READ DMA EXT
  25 00 00 00 80 00 00 b8 02 03 a8 40 00     01:09:15.807  READ DMA EXT
  25 00 00 00 80 00 00 b8 02 03 28 40 00     01:09:15.807  READ DMA EXT
  25 00 00 00 80 00 00 b8 02 02 a8 40 00     01:09:15.807  READ DMA EXT
  25 00 00 00 80 00 00 b8 02 02 28 40 00     01:09:15.807  READ DMA EXT

Error 889 [0] occurred at disk power-on lifetime: 4497 hours (187 days + 9 hours)
  When the command that caused the error occurred, the device was active or idle.

  After command completion occurred, registers were:
  ER -- ST COUNT  LBA_48  LH LM LL DV DC
  -- -- -- == -- == == == -- -- -- -- --
  84 -- 51 00 28 00 00 b8 00 8b 40 40 00  Error: ICRC, ABRT 40 sectors at LBA = 0xb8008b40 = 3087043392

  Commands leading to the command that caused the error were:
  CR FEATR COUNT  LBA_48  LH LM LL DV DC  Powered_Up_Time  Command/Feature_Name
  -- == -- == -- == == == -- -- -- -- --  ---------------  --------------------
  25 00 00 00 80 00 00 b8 00 8a e8 40 00     01:09:15.806  READ DMA EXT
  25 00 00 00 80 00 00 b8 00 8a 68 40 00     01:09:15.806  READ DMA EXT
  25 00 00 00 80 00 00 b8 00 89 e8 40 00     01:09:15.806  READ DMA EXT
  25 00 00 00 80 00 00 b8 00 89 68 40 00     01:09:15.806  READ DMA EXT
  25 00 00 00 80 00 00 b8 00 88 e8 40 00     01:09:15.806  READ DMA EXT

Error 888 [7] occurred at disk power-on lifetime: 4497 hours (187 days + 9 hours)
  When the command that caused the error occurred, the device was active or idle.

  After command completion occurred, registers were:
  ER -- ST COUNT  LBA_48  LH LM LL DV DC
  -- -- -- == -- == == == -- -- -- -- --
  84 -- 51 00 68 00 00 b9 b2 84 40 40 00  Error: ICRC, ABRT 104 sectors at LBA = 0xb9b28440 = 3115484224

  Commands leading to the command that caused the error were:
  CR FEATR COUNT  LBA_48  LH LM LL DV DC  Powered_Up_Time  Command/Feature_Name
  -- == -- == -- == == == -- -- -- -- --  ---------------  --------------------
  25 00 00 00 80 00 00 b9 b2 84 28 40 00     01:09:15.798  READ DMA EXT
  25 00 00 00 80 00 00 b9 b2 83 a8 40 00     01:09:15.798  READ DMA EXT
  25 00 00 00 80 00 00 b9 b2 83 28 40 00     01:09:15.798  READ DMA EXT
  25 00 00 00 80 00 00 b9 b2 82 a8 40 00     01:09:15.798  READ DMA EXT
  25 00 00 00 80 00 00 b9 b2 82 28 40 00     01:09:15.798  READ DMA EXT

Error 887 [6] occurred at disk power-on lifetime: 4497 hours (187 days + 9 hours)
  When the command that caused the error occurred, the device was active or idle.

  After command completion occurred, registers were:
  ER -- ST COUNT  LBA_48  LH LM LL DV DC
  -- -- -- == -- == == == -- -- -- -- --
  84 -- 51 00 68 00 00 b9 b0 7b 40 40 00  Error: ICRC, ABRT 104 sectors at LBA = 0xb9b07b40 = 3115350848

  Commands leading to the command that caused the error were:
  CR FEATR COUNT  LBA_48  LH LM LL DV DC  Powered_Up_Time  Command/Feature_Name
  -- == -- == -- == == == -- -- -- -- --  ---------------  --------------------
  25 00 00 00 80 00 00 b9 b0 7b 28 40 00     01:09:15.796  READ DMA EXT
  25 00 00 00 80 00 00 b9 b0 7a a8 40 00     01:09:15.796  READ DMA EXT
  25 00 00 00 80 00 00 b9 b0 7a 28 40 00     01:09:15.796  READ DMA EXT
  25 00 00 00 80 00 00 b9 b0 79 a8 40 00     01:09:15.796  READ DMA EXT
  25 00 00 00 80 00 00 b9 b0 79 28 40 00     01:09:15.796  READ DMA EXT

Error 886 [5] occurred at disk power-on lifetime: 4497 hours (187 days + 9 hours)
  When the command that caused the error occurred, the device was active or idle.

  After command completion occurred, registers were:
  ER -- ST COUNT  LBA_48  LH LM LL DV DC
  -- -- -- == -- == == == -- -- -- -- --
  84 -- 51 00 68 00 00 b9 af 51 c0 40 00  Error: ICRC, ABRT 104 sectors at LBA = 0xb9af51c0 = 3115274688

  Commands leading to the command that caused the error were:
  CR FEATR COUNT  LBA_48  LH LM LL DV DC  Powered_Up_Time  Command/Feature_Name
  -- == -- == -- == == == -- -- -- -- --  ---------------  --------------------
  25 00 00 00 80 00 00 b9 af 51 a8 40 00     01:09:15.794  READ DMA EXT
  25 00 00 00 80 00 00 b9 af 51 28 40 00     01:09:15.794  READ DMA EXT
  35 00 00 00 80 00 00 b9 9f bb e8 40 00     01:09:15.794  WRITE DMA EXT
  35 00 00 00 80 00 00 b9 9f bb 68 40 00     01:09:15.794  WRITE DMA EXT
  35 00 00 00 80 00 00 b9 9f ba e8 40 00     01:09:15.794  WRITE DMA EXT

Error 885 [4] occurred at disk power-on lifetime: 4497 hours (187 days + 9 hours)
  When the command that caused the error occurred, the device was active or idle.

  After command completion occurred, registers were:
  ER -- ST COUNT  LBA_48  LH LM LL DV DC
  -- -- -- == -- == == == -- -- -- -- --
  84 -- 51 00 80 00 00 b8 11 4c 68 40 00  Error: ICRC, ABRT 128 sectors at LBA = 0xb8114c68 = 3088141416

  Commands leading to the command that caused the error were:
  CR FEATR COUNT  LBA_48  LH LM LL DV DC  Powered_Up_Time  Command/Feature_Name
  -- == -- == -- == == == -- -- -- -- --  ---------------  --------------------
  25 00 00 00 80 00 00 b8 11 4c 68 40 00     01:09:15.764  READ DMA EXT
  25 00 00 00 80 00 00 b8 11 4b e8 40 00     01:09:15.764  READ DMA EXT
  25 00 00 00 80 00 00 b8 11 4b 68 40 00     01:09:15.764  READ DMA EXT
  25 00 00 00 80 00 00 b8 11 4a e8 40 00     01:09:15.764  READ DMA EXT
  25 00 00 00 80 00 00 b8 11 4a 68 40 00     01:09:15.764  READ DMA EXT

Error 884 [3] occurred at disk power-on lifetime: 4497 hours (187 days + 9 hours)
  When the command that caused the error occurred, the device was active or idle.

  After command completion occurred, registers were:
  ER -- ST COUNT  LBA_48  LH LM LL DV DC
  -- -- -- == -- == == == -- -- -- -- --
  84 -- 51 00 28 00 00 b9 14 2e 80 40 00  Error: ICRC, ABRT 40 sectors at LBA = 0xb9142e80 = 3105107584

  Commands leading to the command that caused the error were:
  CR FEATR COUNT  LBA_48  LH LM LL DV DC  Powered_Up_Time  Command/Feature_Name
  -- == -- == -- == == == -- -- -- -- --  ---------------  --------------------
  25 00 00 00 80 00 00 b9 14 2e 28 40 00     01:09:15.746  READ DMA EXT
  25 00 00 00 80 00 00 b9 14 2d a8 40 00     01:09:15.746  READ DMA EXT
  25 00 00 00 80 00 00 b9 14 2d 28 40 00     01:09:15.746  READ DMA EXT
  25 00 00 00 80 00 00 b9 14 2c a8 40 00     01:09:15.746  READ DMA EXT
  25 00 00 00 80 00 00 b9 14 2c 28 40 00     01:09:15.746  READ DMA EXT

Error 883 [2] occurred at disk power-on lifetime: 4497 hours (187 days + 9 hours)
  When the command that caused the error occurred, the device was active or idle.

  After command completion occurred, registers were:
  ER -- ST COUNT  LBA_48  LH LM LL DV DC
  -- -- -- == -- == == == -- -- -- -- --
  84 -- 51 00 68 00 00 b7 f7 fb 40 40 00  Error: ICRC, ABRT 104 sectors at LBA = 0xb7f7fb40 = 3086482240

  Commands leading to the command that caused the error were:
  CR FEATR COUNT  LBA_48  LH LM LL DV DC  Powered_Up_Time  Command/Feature_Name
  -- == -- == -- == == == -- -- -- -- --  ---------------  --------------------
  25 00 00 00 80 00 00 b7 f7 fb 28 40 00     01:09:15.733  READ DMA EXT
  25 00 00 00 80 00 00 b7 f7 fa a8 40 00     01:09:15.733  READ DMA EXT
  25 00 00 00 80 00 00 b7 f7 fa 28 40 00     01:09:15.733  READ DMA EXT
  25 00 00 00 80 00 00 b7 f7 f9 a8 40 00     01:09:15.733  READ DMA EXT
  25 00 00 00 80 00 00 b7 f7 f9 28 40 00     01:09:15.733  READ DMA EXT

SMART Extended Self-test Log Version: 1 (2 sectors)
No self-tests have been logged.  [To run self-tests, use: smartctl -t]

SMART Selective self-test log data structure revision number 0
Note: revision number not 1 implies that no selective self-test has ever been run
 SPAN  MIN_LBA  MAX_LBA  CURRENT_TEST_STATUS
    1        0        0  Completed [00% left] (0-65535)
    2        0        0  Not_testing
    3        0        0  Not_testing
    4        0        0  Not_testing
    5        0        0  Not_testing
Selective self-test flags (0x0):
  After scanning selected spans, do NOT read-scan remainder of disk.
If Selective self-test is pending on power-up, resume after 0 minute delay.

SCT Status Version:                  2
SCT Version (vendor specific):       256 (0x0100)
Device State:                        Active (0)
Current Temperature:                    33 Celsius
Power Cycle Min/Max Temperature:     26/42 Celsius
Lifetime    Min/Max Temperature:     17/42 Celsius
Specified Max Operating Temperature:    80 Celsius
Under/Over Temperature Limit Count:   0/0

SCT Temperature History Version:     2
Temperature Sampling Period:         5 minutes
Temperature Logging Interval:        5 minutes
Min/Max recommended Temperature:     -5/80 Celsius
Min/Max Temperature Limit:           -10/85 Celsius
Temperature History Size (Index):    128 (116)

SMART WRITE LOG does not return COUNT and LBA_LOW register
SCT (Get) Error Recovery Control command failed

Device Statistics (GP/SMART Log 0x04) not supported

Pending Defects log (GP Log 0x0c) not supported

SATA Phy Event Counters (GP Log 0x11)
ID      Size     Value  Description
0x0001  4            0  Command failed due to ICRC error
0x0002  4            0  R_ERR response for data FIS
0x0003  4            0  R_ERR response for device-to-host data FIS
0x0004  4            0  R_ERR response for host-to-device data FIS
0x0005  4            0  R_ERR response for non-data FIS
0x0006  4            0  R_ERR response for device-to-host non-data FIS
0x0007  4            0  R_ERR response for host-to-device non-data FIS
0x0008  4            0  Device-to-host non-data FIS retries
0x0009  4            1  Transition from drive PhyRdy to drive PhyNRdy
0x000a  4            0  Device-to-host register FISes sent due to a COMRESET
0x000b  4            0  CRC errors within host-to-device FIS
0x000d  4            0  Non-CRC errors within host-to-device FIS
0x000f  4            0  R_ERR response for host-to-device data FIS, CRC
0x0010  4            0  R_ERR response for host-to-device data FIS, non-CRC
0x0012  4            0  R_ERR response for host-to-device non-data FIS, CRC
0x0013  4            0  R_ERR response for host-to-device non-data FIS, non-CRC
0x8e00  4            0  Vendor specific
0x8e01  4            0  Vendor specific
0x8e02  4            0  Vendor specific
0x8e03  4            0  Vendor specific
0x8e04  4            0  Vendor specific
0x8e05  4            0  Vendor specific
0x8e06  4            0  Vendor specific
0x8e07  4            0  Vendor specific
0x8e08  4            0  Vendor specific
0x8e09  4            0  Vendor specific
0x8e0a  4            0  Vendor specific
0x8e0b  4            0  Vendor specific
0x8e0c  4            0  Vendor specific
0x8e0d  4            0  Vendor specific
0x8e0e  4            0  Vendor specific
0x8e0f  4            0  Vendor specific
0x8e10  4            0  Vendor specific
0x8e11  4            0  Vendor specific

