smartctl 7.2 2020-12-30 r5155 [FreeBSD 12.1-RELEASE-p16-HBSD amd64] (local build)
Copyright (C) 2002-20, Bruce Allen, Christian Franke, www.smartmontools.org

=== START OF INFORMATION SECTION ===
Model Family:     SanDisk based SSDs
Device Model:     SanDisk SDSSDP064G
Serial Number:    --
LU WWN Device Id: 5 001b44 ...
Firmware Version: 2.0.0
User Capacity:    64,023,257,088 bytes [64.0 GB]
Sector Size:      512 bytes logical/physical
Rotation Rate:    Solid State Device
Form Factor:      1.8 inches
TRIM Command:     Available, deterministic
Device is:        In smartctl database [for details use: -P show]
ATA Version is:   ACS-2 T13/2015-D revision 3
SATA Version is:  SATA 3.0, 6.0 Gb/s (current: 6.0 Gb/s)
Local Time is:    Sat Jun 12 22:04:27 2021 CEST
SMART support is: Available - device has SMART capability.
SMART support is: Enabled
AAM feature is:   Unavailable
APM feature is:   Disabled
Rd look-ahead is: Enabled
Write cache is:   Enabled
DSN feature is:   Unavailable
ATA Security is:  Disabled, frozen [SEC2]
Wt Cache Reorder: Unavailable

=== START OF READ SMART DATA SECTION ===
SMART overall-health self-assessment test result: PASSED

General SMART Values:
Offline data collection status:  (0x00)	Offline data collection activity
					was never started.
					Auto Offline Data Collection: Disabled.
Self-test execution status:      (   0)	The previous self-test routine completed
					without error or no self-test has ever 
					been run.
Total time to complete Offline 
data collection: 		(  120) seconds.
Offline data collection
capabilities: 			 (0x51) SMART execute Offline immediate.
					No Auto Offline data collection support.
					Suspend Offline collection upon new
					command.
					No Offline surface scan supported.
					Self-test supported.
					No Conveyance Self-test supported.
					Selective Self-test supported.
SMART capabilities:            (0x0003)	Saves SMART data before entering
					power-saving mode.
					Supports SMART auto save timer.
Error logging capability:        (0x01)	Error logging supported.
					General Purpose Logging supported.
Short self-test routine 
recommended polling time: 	 (   2) minutes.
Extended self-test routine
recommended polling time: 	 (  12) minutes.

SMART Attributes Data Structure revision number: 1
Vendor Specific SMART Attributes with Thresholds:
ID# ATTRIBUTE_NAME          FLAGS    VALUE WORST THRESH FAIL RAW_VALUE
  5 Reallocated_Sector_Ct   -O----   100   100   000    -    0
  9 Power_On_Hours          -O----   100   100   000    -    23677
 12 Power_Cycle_Count       -O----   100   100   000    -    7787
171 Program_Fail_Count      -O----   100   100   000    -    0
172 Erase_Fail_Count        -O----   100   100   000    -    0
173 Avg_Write/Erase_Count   -O----   100   100   000    -    723
174 Unexpect_Power_Loss_Ct  -O----   100   100   000    -    418
187 Reported_Uncorrect      -O----   100   100   000    -    0
230 Perc_Write/Erase_Count  -O----   100   100   000    -    2410
232 Perc_Avail_Resrvd_Space PO----   100   100   005    -    0
234 Perc_Write/Erase_Ct_BC  -O----   100   100   000    -    3717
241 Total_LBAs_Written      -O----   100   100   000    -    26311437768
242 Total_LBAs_Read         -O----   100   100   000    -    17317649660
                            ||||||_ K auto-keep
                            |||||__ C event count
                            ||||___ R error rate
                            |||____ S speed/performance
                            ||_____ O updated online
                            |______ P prefailure warning

General Purpose Log Directory Version 1
SMART           Log Directory Version 1 [multi-sector log support]
Address    Access  R/W   Size  Description
0x00       GPL,SL  R/O      1  Log Directory
0x01       GPL,SL  R/O      1  Summary SMART error log
0x03       GPL,SL  R/O     16  Ext. Comprehensive SMART error log
0x04       GPL,SL  R/O      8  Device Statistics log
0x06       GPL,SL  R/O      1  SMART self-test log
0x10       GPL,SL  R/O      1  NCQ Command Error log
0x11       GPL,SL  R/O      1  SATA Phy Event Counters log
0x30       GPL,SL  R/O      9  IDENTIFY DEVICE data log
0x80-0x9f  GPL,SL  R/W     16  Host vendor specific log
0xa1       GPL,SL  VS       1  Device vendor specific log
0xa2       GPL,SL  VS       2  Device vendor specific log
0xa3       GPL,SL  VS       1  Device vendor specific log

SMART Extended Comprehensive Error Log Version: 1 (16 sectors)
Device Error Count: 21
	CR     = Command Register
	FEATR  = Features Register
	COUNT  = Count (was: Sector Count) Register
	LBA_48 = Upper bytes of LBA High/Mid/Low Registers ]  ATA-8
	LH     = LBA High (was: Cylinder High) Register    ]   LBA
	LM     = LBA Mid (was: Cylinder Low) Register      ] Register
	LL     = LBA Low (was: Sector Number) Register     ]
	DV     = Device (was: Device/Head) Register
	DC     = Device Control Register
	ER     = Error register
	ST     = Status register
Powered_Up_Time is measured from power on, and printed as
DDd+hh:mm:SS.sss where DD=days, hh=hours, mm=minutes,
SS=sec, and sss=millisec. It "wraps" after 49.710 days.

Error 21 [20] occurred at disk power-on lifetime: 22427 hours (934 days + 11 hours)
  When the command that caused the error occurred, the device was in an unknown state.

  After command completion occurred, registers were:
  ER -- ST COUNT  LBA_48  LH LM LL DV DC
  -- -- -- == -- == == == -- -- -- -- --
  10 -- 51 00 08 00 00 00 54 fa 00 ee 00  Error: IDNF at LBA = 0x0e54fa00 = 240450048

  Commands leading to the command that caused the error were:
  CR FEATR COUNT  LBA_48  LH LM LL DV DC  Powered_Up_Time  Command/Feature_Name
  -- == -- == -- == == == -- -- -- -- --  ---------------  --------------------
  30 00 00 00 08 00 00 00 54 fa 00 ee 00     00:12:23.338  WRITE SECTOR(S)
  ca 00 00 00 08 00 00 00 54 fa 00 ee 00     00:12:23.335  WRITE DMA
  c6 00 00 00 01 00 00 00 00 00 00 a0 00     00:12:23.335  SET MULTIPLE MODE
  ef 00 03 00 46 00 00 00 00 00 00 a0 00     00:12:23.334  SET FEATURES [Set transfer mode]
  ef 00 03 00 0c 00 00 00 00 00 00 a0 00     00:12:23.334  SET FEATURES [Set transfer mode]

Error 20 [19] occurred at disk power-on lifetime: 22427 hours (934 days + 11 hours)
  When the command that caused the error occurred, the device was in an unknown state.

  After command completion occurred, registers were:
  ER -- ST COUNT  LBA_48  LH LM LL DV DC
  -- -- -- == -- == == == -- -- -- -- --
  10 -- 51 00 08 00 00 00 54 fa 00 ee 00  Error: IDNF at LBA = 0x0e54fa00 = 240450048

  Commands leading to the command that caused the error were:
  CR FEATR COUNT  LBA_48  LH LM LL DV DC  Powered_Up_Time  Command/Feature_Name
  -- == -- == -- == == == -- -- -- -- --  ---------------  --------------------
  ca 00 00 00 08 00 00 00 54 fa 00 ee 00     00:12:23.335  WRITE DMA
  c6 00 00 00 01 00 00 00 00 00 00 a0 00     00:12:23.335  SET MULTIPLE MODE
  ef 00 03 00 46 00 00 00 00 00 00 a0 00     00:12:23.334  SET FEATURES [Set transfer mode]
  ef 00 03 00 0c 00 00 00 00 00 00 a0 00     00:12:23.334  SET FEATURES [Set transfer mode]
  ec 00 00 00 00 00 00 00 00 00 00 a0 00     00:12:23.334  IDENTIFY DEVICE

Error 19 [18] occurred at disk power-on lifetime: 10646 hours (443 days + 14 hours)
  When the command that caused the error occurred, the device was in an unknown state.

  After command completion occurred, registers were:
  ER -- ST COUNT  LBA_48  LH LM LL DV DC
  -- -- -- == -- == == == -- -- -- -- --
  10 -- 51 00 01 00 00 07 74 1c 67 e0 00  Error: IDNF 1 sectors at LBA = 0x07741c67 = 125049959

  Commands leading to the command that caused the error were:
  CR FEATR COUNT  LBA_48  LH LM LL DV DC  Powered_Up_Time  Command/Feature_Name
  -- == -- == -- == == == -- -- -- -- --  ---------------  --------------------
  25 00 00 00 01 00 00 07 74 1c 67 e0 00  6d+02:07:24.056  READ DMA EXT
  25 00 00 00 10 00 00 00 1f 40 ca e0 00  6d+02:07:23.597  READ DMA EXT
  25 00 00 00 02 00 00 00 1f 41 13 e0 00  6d+02:07:23.577  READ DMA EXT
  25 00 00 00 40 00 00 00 1f 40 8a e0 00  6d+02:07:23.576  READ DMA EXT
  25 00 00 00 39 00 00 00 1f 40 da e0 00  6d+02:07:23.576  READ DMA EXT

Error 18 [17] occurred at disk power-on lifetime: 10646 hours (443 days + 14 hours)
  When the command that caused the error occurred, the device was in an unknown state.

  After command completion occurred, registers were:
  ER -- ST COUNT  LBA_48  LH LM LL DV DC
  -- -- -- == -- == == == -- -- -- -- --
  10 -- 51 00 01 00 00 07 74 1c 67 e0 00  Error: IDNF 1 sectors at LBA = 0x07741c67 = 125049959

  Commands leading to the command that caused the error were:
  CR FEATR COUNT  LBA_48  LH LM LL DV DC  Powered_Up_Time  Command/Feature_Name
  -- == -- == -- == == == -- -- -- -- --  ---------------  --------------------
  25 00 00 00 01 00 00 07 74 1c 67 e0 00  6d+02:07:23.054  READ DMA EXT
  25 00 00 00 01 00 00 07 74 1c 67 e0 00  6d+02:07:22.052  READ DMA EXT
  ea 00 00 00 00 00 00 00 00 00 00 a0 00  6d+02:07:21.580  FLUSH CACHE EXT
  35 00 00 00 08 00 00 00 5f 19 18 e0 00  6d+02:07:21.580  WRITE DMA EXT
  35 00 00 00 08 00 00 00 5f a6 d0 e0 00  6d+02:07:21.580  WRITE DMA EXT

Error 17 [16] occurred at disk power-on lifetime: 10646 hours (443 days + 14 hours)
  When the command that caused the error occurred, the device was in an unknown state.

  After command completion occurred, registers were:
  ER -- ST COUNT  LBA_48  LH LM LL DV DC
  -- -- -- == -- == == == -- -- -- -- --
  10 -- 51 00 01 00 00 07 74 1c 67 e0 00  Error: IDNF 1 sectors at LBA = 0x07741c67 = 125049959

  Commands leading to the command that caused the error were:
  CR FEATR COUNT  LBA_48  LH LM LL DV DC  Powered_Up_Time  Command/Feature_Name
  -- == -- == -- == == == -- -- -- -- --  ---------------  --------------------
  25 00 00 00 01 00 00 07 74 1c 67 e0 00  6d+02:07:22.052  READ DMA EXT
  ea 00 00 00 00 00 00 00 00 00 00 a0 00  6d+02:07:21.580  FLUSH CACHE EXT
  35 00 00 00 08 00 00 00 5f 19 18 e0 00  6d+02:07:21.580  WRITE DMA EXT
  35 00 00 00 08 00 00 00 5f a6 d0 e0 00  6d+02:07:21.580  WRITE DMA EXT
  35 00 00 00 08 00 00 00 57 c6 60 e0 00  6d+02:07:21.580  WRITE DMA EXT

Error 16 [15] occurred at disk power-on lifetime: 10646 hours (443 days + 14 hours)
  When the command that caused the error occurred, the device was in an unknown state.

  After command completion occurred, registers were:
  ER -- ST COUNT  LBA_48  LH LM LL DV DC
  -- -- -- == -- == == == -- -- -- -- --
  10 -- 51 00 01 00 00 07 74 1c 67 e0 00  Error: IDNF 1 sectors at LBA = 0x07741c67 = 125049959

  Commands leading to the command that caused the error were:
  CR FEATR COUNT  LBA_48  LH LM LL DV DC  Powered_Up_Time  Command/Feature_Name
  -- == -- == -- == == == -- -- -- -- --  ---------------  --------------------
  25 00 00 00 01 00 00 07 74 1c 67 e0 00  6d+02:07:21.050  READ DMA EXT
  25 00 00 00 08 00 00 03 bb 7f fa e0 00  6d+02:07:20.848  READ DMA EXT
  25 00 00 00 01 00 00 07 74 1c 67 e0 00  6d+02:07:20.048  READ DMA EXT
  35 00 00 00 40 00 00 01 3c 9f 10 e0 00  6d+02:07:19.566  WRITE DMA EXT
  35 00 00 00 08 00 00 00 74 51 b8 e0 00  6d+02:07:19.566  WRITE DMA EXT

Error 15 [14] occurred at disk power-on lifetime: 10646 hours (443 days + 14 hours)
  When the command that caused the error occurred, the device was in an unknown state.

  After command completion occurred, registers were:
  ER -- ST COUNT  LBA_48  LH LM LL DV DC
  -- -- -- == -- == == == -- -- -- -- --
  10 -- 51 00 01 00 00 07 74 1c 67 e0 00  Error: IDNF 1 sectors at LBA = 0x07741c67 = 125049959

  Commands leading to the command that caused the error were:
  CR FEATR COUNT  LBA_48  LH LM LL DV DC  Powered_Up_Time  Command/Feature_Name
  -- == -- == -- == == == -- -- -- -- --  ---------------  --------------------
  25 00 00 00 01 00 00 07 74 1c 67 e0 00  6d+02:07:20.048  READ DMA EXT
  35 00 00 00 40 00 00 01 3c 9f 10 e0 00  6d+02:07:19.566  WRITE DMA EXT
  35 00 00 00 08 00 00 00 74 51 b8 e0 00  6d+02:07:19.566  WRITE DMA EXT
  35 00 00 00 20 00 00 04 38 5e 20 e0 00  6d+02:07:19.566  WRITE DMA EXT
  35 00 00 00 08 00 00 05 4d 1e d8 e0 00  6d+02:07:19.566  WRITE DMA EXT

Error 14 [13] occurred at disk power-on lifetime: 10646 hours (443 days + 14 hours)
  When the command that caused the error occurred, the device was in an unknown state.

  After command completion occurred, registers were:
  ER -- ST COUNT  LBA_48  LH LM LL DV DC
  -- -- -- == -- == == == -- -- -- -- --
  10 -- 51 00 01 00 00 07 74 1c 67 e0 00  Error: IDNF 1 sectors at LBA = 0x07741c67 = 125049959

  Commands leading to the command that caused the error were:
  CR FEATR COUNT  LBA_48  LH LM LL DV DC  Powered_Up_Time  Command/Feature_Name
  -- == -- == -- == == == -- -- -- -- --  ---------------  --------------------
  25 00 00 00 01 00 00 07 74 1c 67 e0 00  6d+02:07:19.045  READ DMA EXT
  ea 00 00 00 00 00 00 00 00 00 00 a0 00  6d+02:07:18.133  FLUSH CACHE EXT
  35 00 00 00 08 00 00 00 5f 19 18 e0 00  6d+02:07:18.133  WRITE DMA EXT
  35 00 00 00 01 00 00 00 66 00 c0 e0 00  6d+02:07:18.132  WRITE DMA EXT
  ea 00 00 00 00 00 00 00 00 00 00 a0 00  6d+02:07:18.131  FLUSH CACHE EXT

SMART Extended Self-test Log (GP Log 0x07) not supported

Warning! SMART Self-Test Log Structure error: invalid SMART checksum.
SMART Self-test log structure revision number 1
Num  Test_Description    Status                  Remaining  LifeTime(hours)  LBA_of_first_error
# 1  Short offline       Aborted by host               90%     12294         -

SMART Selective self-test log data structure revision number 1
 SPAN  MIN_LBA  MAX_LBA  CURRENT_TEST_STATUS
    1        0        0  Not_testing
    2        0        0  Not_testing
    3        0        0  Not_testing
    4        0        0  Not_testing
    5        0        0  Not_testing
Selective self-test flags (0x0):
  After scanning selected spans, do NOT read-scan remainder of disk.
If Selective self-test is pending on power-up, resume after 0 minute delay.

SCT Commands not supported

Device Statistics (GP Log 0x04)
Page  Offset Size        Value Flags Description
0x05  =====  =               =  ===  == Temperature Statistics (rev 1) ==
0x05  0x008  1              40  ---  Current Temperature
0x05  0x010  1               -  ---  Average Short Term Temperature
0x05  0x018  1               -  ---  Average Long Term Temperature
0x05  0x020  1              51  ---  Highest Temperature
0x05  0x028  1              15  ---  Lowest Temperature
0x05  0x030  1              41  ---  Highest Average Short Term Temperature
0x05  0x038  1              41  ---  Lowest Average Short Term Temperature
0x05  0x040  1               -  ---  Highest Average Long Term Temperature
0x05  0x048  1               -  ---  Lowest Average Long Term Temperature
0x05  0x050  4               0  ---  Time in Over-Temperature
0x05  0x058  1              95  ---  Specified Maximum Operating Temperature
0x05  0x060  4               0  ---  Time in Under-Temperature
0x05  0x068  1               0  ---  Specified Minimum Operating Temperature
0x07  =====  =               =  ===  == Solid State Device Statistics (rev 1) ==
0x07  0x008  1              24  N--  Percentage Used Endurance Indicator
                                |||_ C monitored condition met
                                ||__ D supports DSN
                                |___ N normalized value

Pending Defects log (GP Log 0x0c) not supported

SATA Phy Event Counters (GP Log 0x11)
ID      Size     Value  Description
0x0003  2            0  R_ERR response for device-to-host data FIS
0x0004  2            0  R_ERR response for host-to-device data FIS
0x0006  2            0  R_ERR response for device-to-host non-data FIS
0x0007  2            0  R_ERR response for host-to-device non-data FIS
0x0009  2            7  Transition from drive PhyRdy to drive PhyNRdy
0x000a  2            8  Device-to-host register FISes sent due to a COMRESET
0x000f  2            0  R_ERR response for host-to-device data FIS, CRC
0x0012  2            0  R_ERR response for host-to-device non-data FIS, CRC
0x0001  2            0  Command failed due to ICRC error

