smartctl 7.4 2023-08-01 r5530 [FreeBSD 14.1-STABLE amd64] (local build)
Copyright (C) 2002-23, Bruce Allen, Christian Franke, www.smartmontools.org

=== START OF INFORMATION SECTION ===
Device Model:     ASMT109x- Safe
Serial Number:    --
LU WWN Device Id: 5 002303 ...
Firmware Version: 1.01
User Capacity:    256,053,870,592 bytes [256 GB]
Sector Size:      512 bytes logical/physical
Rotation Rate:    7200 rpm
Form Factor:      M.2
TRIM Command:     Available, deterministic, zeroed
Device is:        Not in smartctl database 7.3/5528
ATA Version is:   ACS-2 (minor revision not indicated)
SATA Version is:  SATA 3.1, 6.0 Gb/s (current: 6.0 Gb/s)
Local Time is:    Sat Dec 28 21:37:34 2024 CET
SMART support is: Available - device has SMART capability.
SMART support is: Enabled
AAM feature is:   Unavailable
APM feature is:   Unavailable
Rd look-ahead is: Enabled
Write cache is:   Enabled
DSN feature is:   Unavailable
ATA Security is:  Disabled, NOT FROZEN [SEC1]
Wt Cache Reorder: Unknown

=== START OF READ SMART DATA SECTION ===
SMART overall-health self-assessment test result: PASSED

General SMART Values:
Offline data collection status:  (0x00)	Offline data collection activity
					was never started.
					Auto Offline Data Collection: Disabled.
Self-test execution status:      (   0)	The previous self-test routine completed
					without error or no self-test has ever 
					been run.
Total time to complete Offline 
data collection: 		(    0) seconds.
Offline data collection
capabilities: 			 (0x11) SMART execute Offline immediate.
					No Auto Offline data collection support.
					Suspend Offline collection upon new
					command.
					No Offline surface scan supported.
					Self-test supported.
					No Conveyance Self-test supported.
					No Selective Self-test supported.
SMART capabilities:            (0x0003)	Saves SMART data before entering
					power-saving mode.
					Supports SMART auto save timer.
Error logging capability:        (0x01)	Error logging supported.
					General Purpose Logging supported.
Short self-test routine 
recommended polling time: 	 (   1) minutes.
Extended self-test routine
recommended polling time: 	 (  10) minutes.
SCT capabilities: 	       (0x003d)	SCT Status supported.
					SCT Error Recovery Control supported.
					SCT Feature Control supported.
					SCT Data Table supported.

SMART Attributes Data Structure revision number: 1
Vendor Specific SMART Attributes with Thresholds:
ID# ATTRIBUTE_NAME          FLAGS    VALUE WORST THRESH FAIL RAW_VALUE
  1 Raw_Read_Error_Rate     POSR-K   100   100   000    -    0
  5 Reallocated_Sector_Ct   PO----   100   100   000    -    0
  9 Power_On_Hours          -O----   100   100   000    -    12475
 12 Power_Cycle_Count       PO----   100   100   000    -    30
170 Unknown_Attribute       -O--CK   100   100   000    -    0
171 Unknown_Attribute       PO----   100   100   000    -    0
172 Unknown_Attribute       PO----   100   100   000    -    0
173 Unknown_Attribute       PO----   100   100   000    -    268
174 Unknown_Attribute       PO----   100   100   000    -    21
175 Unknown_HDD_Attribute   PO----   100   100   000    -    0
176 Unknown_HDD_Attribute   PO----   100   100   000    -    0
178 Unknown_HDD_Attribute   PO----   100   100   000    -    0
179 Unknown_HDD_Attribute   PO----   100   100   000    -    0
180 Unknown_HDD_Attribute   PO--CK   100   100   005    -    107
181 Program_Fail_Cnt_Total  PO----   100   100   000    -    0
182 Unknown_HDD_Attribute   PO----   100   100   000    -    0
183 Runtime_Bad_Block       -O--CK   100   100   000    -    0
194 Temperature_Celsius     -O----   100   100   000    -    38
195 Hardware_ECC_Recovered  PO----   100   100   000    -    0
199 UDMA_CRC_Error_Count    PO----   100   100   000    -    0
232 Available_Reservd_Space PO----   100   100   010    -    100
233 Unknown_HDD_Attribute   PO----   100   100   000    -    71064
241 Total_LBAs_Written      PO----   100   100   000    -    413171
242 Total_LBAs_Read         PO----   100   100   000    -    6546
                            ||||||_ K auto-keep
                            |||||__ C event count
                            ||||___ R error rate
                            |||____ S speed/performance
                            ||_____ O updated online
                            |______ P prefailure warning

General Purpose Log Directory Version 1
SMART           Log Directory Version 1 [multi-sector log support]
Address    Access  R/W   Size  Description
0x00       GPL,SL  R/O      1  Log Directory
0x01           SL  R/O      1  Summary SMART error log
0x02           SL  R/O      1  Comprehensive SMART error log
0x03           SL  R/O      1  Ext. Comprehensive SMART error log
0x04           SL  R/O      8  Device Statistics log
0x06           SL  R/O      1  SMART self-test log
0x07           SL  R/O      1  Extended self-test log
0x09           SL  R/W      1  Selective self-test log
0x10       GPL,SL  R/O      1  NCQ Command Error log
0x11           SL  R/O      1  SATA Phy Event Counters log
0x30           SL  R/O      9  IDENTIFY DEVICE data log
0x80-0x9f  GPL,SL  R/W     16  Host vendor specific log
0xa0-0xa7  GPL     VS      16  Device vendor specific log
0xe0           SL  R/W      1  SCT Command/Status
0xe1           SL  R/W      1  SCT Data Transfer

SMART Extended Comprehensive Error Log (GP Log 0x03) not supported

SMART Error Log Version: 1
No Errors Logged

SMART Extended Self-test Log (GP Log 0x07) not supported

SMART Self-test log structure revision number 0
Warning: ATA Specification requires self-test log structure revision number = 1
No self-tests have been logged.  [To run self-tests, use: smartctl -t]

Selective Self-tests/Logging not supported

SCT Status Version:                  3
SCT Version (vendor specific):       0 (0x0000)
Device State:                        Active (0)
Current Temperature:                    38 Celsius
Power Cycle Min/Max Temperature:     50/50 Celsius
Lifetime    Min/Max Temperature:      0/52 Celsius
Under/Over Temperature Limit Count:   0/0

SCT Temperature History Version:     2
Temperature Sampling Period:         1 minute
Temperature Logging Interval:        1 minute
Min/Max recommended Temperature:      0/100 Celsius
Min/Max Temperature Limit:            0/100 Celsius
Temperature History Size (Index):    128 (32)

SCT Error Recovery Control:
           Read: Disabled
          Write: Disabled

Device Statistics (GP/SMART Log 0x04) not supported

Pending Defects log (GP Log 0x0c) not supported

SATA Phy Event Counters (GP Log 0x11) not supported



