smartctl 7.3 2022-02-28 r5338 [FreeBSD 13.1-RELEASE-p5 amd64] (local build)
Copyright (C) 2002-22, Bruce Allen, Christian Franke, www.smartmontools.org

=== START OF INFORMATION SECTION ===
Model Number:                       TS128GMTE110S
Serial Number:                      --
Firmware Version:                   T1102A0L
PCI Vendor/Subsystem ID:            0x1d79
IEEE OUI Identifier:                0x000000
Total NVM Capacity:                 128,035,676,160 [128 GB]
Unallocated NVM Capacity:           0
Controller ID:                      1
NVMe Version:                       1.3
Number of Namespaces:               1
Namespace 1 Size/Capacity:          128,035,676,160 [128 GB]
Namespace 1 Formatted LBA Size:     512
Local Time is:                      Sun Jan 15 00:48:08 2023 CET
Firmware Updates (0x12):            1 Slot, no Reset required
Optional Admin Commands (0x0007):   Security Format Frmw_DL
Optional NVM Commands (0x0014):     DS_Mngmt Sav/Sel_Feat
Log Page Attributes (0x03):         S/H_per_NS Cmd_Eff_Lg
Maximum Data Transfer Size:         64 Pages
Warning  Comp. Temp. Threshold:     83 Celsius
Critical Comp. Temp. Threshold:     85 Celsius

Supported Power States
St Op     Max   Active     Idle   RL RT WL WT  Ent_Lat  Ex_Lat
 0 +     6.00W       -        -    0  0  0  0        0       0

Supported LBA Sizes (NSID 0x1)
Id Fmt  Data  Metadt  Rel_Perf
 0 +     512       0         0

=== START OF SMART DATA SECTION ===
SMART overall-health self-assessment test result: PASSED

SMART/Health Information (NVMe Log 0x02)
Critical Warning:                   0x00
Temperature:                        64 Celsius
Available Spare:                    100%
Available Spare Threshold:          10%
Percentage Used:                    1%
Data Units Read:                    37,429 [19.1 GB]
Data Units Written:                 917,543 [469 GB]
Host Read Commands:                 762,243
Host Write Commands:                37,091,576
Controller Busy Time:               129
Power Cycles:                       14
Power On Hours:                     572
Unsafe Shutdowns:                   5
Media and Data Integrity Errors:    0
Error Information Log Entries:      0
Warning  Comp. Temperature Time:    0
Critical Comp. Temperature Time:    0

Error Information (NVMe Log 0x01, 16 of 64 entries)
No Errors Logged

