smartctl 7.2 2020-12-30 r5155 [FreeBSD 12.1-RELEASE-p16-HBSD amd64] (local build)
Copyright (C) 2002-20, Bruce Allen, Christian Franke, www.smartmontools.org

=== START OF INFORMATION SECTION ===
Model Family:     Seagate FireCuda 2.5
Device Model:     ST1000LX015-1U7172
Serial Number:    --
LU WWN Device Id: 5 000c50 ...
Firmware Version: SDM1
User Capacity:    1,000,204,886,016 bytes [1.00 TB]
Sector Sizes:     512 bytes logical, 4096 bytes physical
Rotation Rate:    5400 rpm
Form Factor:      2.5 inches
Device is:        In smartctl database [for details use: -P show]
ATA Version is:   ACS-3 T13/2161-D revision 3b
SATA Version is:  SATA 3.1, 6.0 Gb/s (current: 3.0 Gb/s)
Local Time is:    Fri Apr 30 01:16:58 2021 PDT
SMART support is: Available - device has SMART capability.
SMART support is: Enabled
AAM feature is:   Unavailable
APM level is:     1 (minimum power consumption with standby)
Rd look-ahead is: Enabled
Write cache is:   Enabled
DSN feature is:   Unavailable
ATA Security is:  Disabled, frozen [SEC2]
Wt Cache Reorder: Enabled

=== START OF READ SMART DATA SECTION ===
SMART overall-health self-assessment test result: PASSED

General SMART Values:
Offline data collection status:  (0x00)	Offline data collection activity
					was never started.
					Auto Offline Data Collection: Disabled.
Self-test execution status:      ( 121)	The previous self-test completed having
					the read element of the test failed.
Total time to complete Offline 
data collection: 		(    0) seconds.
Offline data collection
capabilities: 			 (0x71) SMART execute Offline immediate.
					No Auto Offline data collection support.
					Suspend Offline collection upon new
					command.
					No Offline surface scan supported.
					Self-test supported.
					Conveyance Self-test supported.
					Selective Self-test supported.
SMART capabilities:            (0x0003)	Saves SMART data before entering
					power-saving mode.
					Supports SMART auto save timer.
Error logging capability:        (0x01)	Error logging supported.
					General Purpose Logging supported.
Short self-test routine 
recommended polling time: 	 (   1) minutes.
Extended self-test routine
recommended polling time: 	 ( 164) minutes.
Conveyance self-test routine
recommended polling time: 	 (   2) minutes.
SCT capabilities: 	       (0x3035)	SCT Status supported.
					SCT Feature Control supported.
					SCT Data Table supported.

SMART Attributes Data Structure revision number: 10
Vendor Specific SMART Attributes with Thresholds:
ID# ATTRIBUTE_NAME          FLAGS    VALUE WORST THRESH FAIL RAW_VALUE
  1 Raw_Read_Error_Rate     POSR--   080   047   006    -    98617440
  3 Spin_Up_Time            PO----   099   099   000    -    0
  4 Start_Stop_Count        -O--CK   096   096   020    -    4664
  5 Reallocated_Sector_Ct   PO--CK   098   097   036    -    1248
  7 Seek_Error_Rate         POSR--   077   060   045    -    26112988590
  9 Power_On_Hours          -O--CK   095   095   000    -    4505 (193 105 0)
 10 Spin_Retry_Count        PO--C-   100   100   097    -    0
 12 Power_Cycle_Count       -O--CK   098   098   020    -    3021
184 End-to-End_Error        -O--CK   100   100   099    -    0
187 Reported_Uncorrect      -O--CK   001   001   000    -    1899
188 Command_Timeout         -O--CK   100   098   000    -    64425885856
189 High_Fly_Writes         -O-RCK   100   100   000    -    0
190 Airflow_Temperature_Cel -O---K   071   042   040    -    29 (Min/Max 22/30)
191 G-Sense_Error_Rate      -O--CK   100   100   000    -    218
192 Power-Off_Retract_Count -O--CK   100   100   000    -    118
193 Load_Cycle_Count        -O--CK   098   098   000    -    5526
194 Temperature_Celsius     -O---K   029   058   000    -    29 (0 13 0 0 0)
197 Current_Pending_Sector  -O--C-   030   023   000    -    5808
198 Offline_Uncorrectable   ----C-   030   023   000    -    5808
199 UDMA_CRC_Error_Count    -OSRCK   200   200   000    -    1
240 Head_Flying_Hours       ------   100   253   000    -    11669h+34m+09.309s
241 Total_LBAs_Written      ------   100   253   000    -    22946776927
242 Total_LBAs_Read         ------   100   253   000    -    26742734565
254 Free_Fall_Sensor        -O--CK   100   100   000    -    0
                            ||||||_ K auto-keep
                            |||||__ C event count
                            ||||___ R error rate
                            |||____ S speed/performance
                            ||_____ O updated online
                            |______ P prefailure warning

General Purpose Log Directory Version 1
SMART           Log Directory Version 1 [multi-sector log support]
Address    Access  R/W   Size  Description
0x00       GPL,SL  R/O      1  Log Directory
0x01           SL  R/O      1  Summary SMART error log
0x02           SL  R/O      5  Comprehensive SMART error log
0x03       GPL     R/O      5  Ext. Comprehensive SMART error log
0x04       GPL,SL  R/O      8  Device Statistics log
0x06           SL  R/O      1  SMART self-test log
0x07       GPL     R/O      1  Extended self-test log
0x09           SL  R/W      1  Selective self-test log
0x10       GPL     R/O      1  NCQ Command Error log
0x11       GPL     R/O      1  SATA Phy Event Counters log
0x21       GPL     R/O      1  Write stream error log
0x22       GPL     R/O      1  Read stream error log
0x24       GPL     R/O    512  Current Device Internal Status Data log
0x30       GPL,SL  R/O      9  IDENTIFY DEVICE data log
0x80-0x9f  GPL,SL  R/W     16  Host vendor specific log
0xa1       GPL,SL  VS      24  Device vendor specific log
0xa2       GPL     VS    6920  Device vendor specific log
0xa8       GPL,SL  VS     136  Device vendor specific log
0xa9       GPL,SL  VS       1  Device vendor specific log
0xab       GPL     VS       1  Device vendor specific log
0xb0       GPL     VS    7680  Device vendor specific log
0xbe-0xbf  GPL     VS   65535  Device vendor specific log
0xc0       GPL,SL  VS       1  Device vendor specific log
0xc1       GPL,SL  VS      16  Device vendor specific log
0xc2       GPL,SL  VS     240  Device vendor specific log
0xc3       GPL,SL  VS       8  Device vendor specific log
0xc4       GPL,SL  VS      24  Device vendor specific log
0xc9       GPL,SL  VS       1  Device vendor specific log
0xca       GPL,SL  VS      16  Device vendor specific log
0xd3       GPL     VS    1920  Device vendor specific log
0xe0       GPL,SL  R/W      1  SCT Command/Status
0xe1       GPL,SL  R/W      1  SCT Data Transfer

SMART Extended Comprehensive Error Log Version: 1 (5 sectors)
Device Error Count: 1858 (device log contains only the most recent 20 errors)
	CR     = Command Register
	FEATR  = Features Register
	COUNT  = Count (was: Sector Count) Register
	LBA_48 = Upper bytes of LBA High/Mid/Low Registers ]  ATA-8
	LH     = LBA High (was: Cylinder High) Register    ]   LBA
	LM     = LBA Mid (was: Cylinder Low) Register      ] Register
	LL     = LBA Low (was: Sector Number) Register     ]
	DV     = Device (was: Device/Head) Register
	DC     = Device Control Register
	ER     = Error register
	ST     = Status register
Powered_Up_Time is measured from power on, and printed as
DDd+hh:mm:SS.sss where DD=days, hh=hours, mm=minutes,
SS=sec, and sss=millisec. It "wraps" after 49.710 days.

Error 1858 [17] occurred at disk power-on lifetime: 4311 hours (179 days + 15 hours)
  When the command that caused the error occurred, the device was active or idle.

  After command completion occurred, registers were:
  ER -- ST COUNT  LBA_48  LH LM LL DV DC
  -- -- -- == -- == == == -- -- -- -- --
  40 -- 51 00 00 00 00 6e 67 69 60 00 00  Error: UNC at LBA = 0x6e676960 = 1852270944

  Commands leading to the command that caused the error were:
  CR FEATR COUNT  LBA_48  LH LM LL DV DC  Powered_Up_Time  Command/Feature_Name
  -- == -- == -- == == == -- -- -- -- --  ---------------  --------------------
  60 00 00 00 40 00 00 6e 67 69 30 40 00     02:29:41.763  READ FPDMA QUEUED
  60 00 00 00 04 00 00 48 78 6f e0 40 00     02:29:41.740  READ FPDMA QUEUED
  60 00 00 00 f8 00 00 48 78 5b a8 40 00     02:29:41.737  READ FPDMA QUEUED
  60 00 00 00 40 00 00 6e 67 60 30 40 00     02:29:41.723  READ FPDMA QUEUED
  60 00 00 00 08 00 00 48 78 5b a0 40 00     02:29:41.686  READ FPDMA QUEUED

Error 1857 [16] occurred at disk power-on lifetime: 4311 hours (179 days + 15 hours)
  When the command that caused the error occurred, the device was active or idle.

  After command completion occurred, registers were:
  ER -- ST COUNT  LBA_48  LH LM LL DV DC
  -- -- -- == -- == == == -- -- -- -- --
  40 -- 51 00 00 00 00 6e 66 6f 88 00 00  Error: WP at LBA = 0x6e666f88 = 1852206984

  Commands leading to the command that caused the error were:
  CR FEATR COUNT  LBA_48  LH LM LL DV DC  Powered_Up_Time  Command/Feature_Name
  -- == -- == -- == == == -- -- -- -- --  ---------------  --------------------
  61 00 00 00 08 00 00 4f f5 bc 80 40 00     02:29:32.859  WRITE FPDMA QUEUED
  61 00 00 01 00 00 00 28 e2 1f 00 40 00     02:29:32.859  WRITE FPDMA QUEUED
  61 00 00 01 00 00 00 28 e2 1e 00 40 00     02:29:32.859  WRITE FPDMA QUEUED
  61 00 00 01 00 00 00 28 e2 1d 00 40 00     02:29:32.859  WRITE FPDMA QUEUED
  61 00 00 01 00 00 00 28 e2 1c 00 40 00     02:29:32.859  WRITE FPDMA QUEUED

Error 1856 [15] occurred at disk power-on lifetime: 4311 hours (179 days + 15 hours)
  When the command that caused the error occurred, the device was active or idle.

  After command completion occurred, registers were:
  ER -- ST COUNT  LBA_48  LH LM LL DV DC
  -- -- -- == -- == == == -- -- -- -- --
  40 -- 51 00 00 00 00 6e 66 6f 88 00 00  Error: WP at LBA = 0x6e666f88 = 1852206984

  Commands leading to the command that caused the error were:
  CR FEATR COUNT  LBA_48  LH LM LL DV DC  Powered_Up_Time  Command/Feature_Name
  -- == -- == -- == == == -- -- -- -- --  ---------------  --------------------
  61 00 00 00 28 00 00 00 65 86 c8 40 00     02:29:22.915  WRITE FPDMA QUEUED
  61 00 00 01 00 00 00 00 65 85 c8 40 00     02:29:22.915  WRITE FPDMA QUEUED
  60 00 00 00 f8 00 00 29 2c b8 e8 40 00     02:29:22.498  READ FPDMA QUEUED
  60 00 00 00 40 00 00 6e 66 6f 78 40 00     02:29:22.481  READ FPDMA QUEUED
  60 00 00 00 08 00 00 29 2c b8 e0 40 00     02:29:22.479  READ FPDMA QUEUED

Error 1855 [14] occurred at disk power-on lifetime: 4311 hours (179 days + 15 hours)
  When the command that caused the error occurred, the device was active or idle.

  After command completion occurred, registers were:
  ER -- ST COUNT  LBA_48  LH LM LL DV DC
  -- -- -- == -- == == == -- -- -- -- --
  40 -- 51 00 00 00 00 6e 66 6f 78 00 00  Error: UNC at LBA = 0x6e666f78 = 1852206968

  Commands leading to the command that caused the error were:
  CR FEATR COUNT  LBA_48  LH LM LL DV DC  Powered_Up_Time  Command/Feature_Name
  -- == -- == -- == == == -- -- -- -- --  ---------------  --------------------
  60 00 00 00 08 00 00 37 30 89 d0 40 00     02:28:44.332  READ FPDMA QUEUED
  61 00 00 00 08 00 00 00 64 1d 58 40 00     02:28:44.332  WRITE FPDMA QUEUED
  61 00 00 00 08 00 00 00 68 8b 90 40 00     02:28:44.331  WRITE FPDMA QUEUED
  60 00 00 00 08 00 00 37 30 89 c8 40 00     02:28:44.330  READ FPDMA QUEUED
  61 00 00 00 08 00 00 00 68 85 70 40 00     02:28:44.330  WRITE FPDMA QUEUED

Error 1854 [13] occurred at disk power-on lifetime: 4311 hours (179 days + 15 hours)
  When the command that caused the error occurred, the device was active or idle.

  After command completion occurred, registers were:
  ER -- ST COUNT  LBA_48  LH LM LL DV DC
  -- -- -- == -- == == == -- -- -- -- --
  40 -- 51 00 00 00 00 6e 66 6f 78 00 00  Error: WP at LBA = 0x6e666f78 = 1852206968

  Commands leading to the command that caused the error were:
  CR FEATR COUNT  LBA_48  LH LM LL DV DC  Powered_Up_Time  Command/Feature_Name
  -- == -- == -- == == == -- -- -- -- --  ---------------  --------------------
  61 00 00 00 08 00 00 00 68 6d a0 40 00     02:28:40.344  WRITE FPDMA QUEUED
  61 00 00 00 08 00 00 2b f7 80 a0 40 00     02:28:40.344  WRITE FPDMA QUEUED
  61 00 00 00 08 00 00 00 64 1d 50 40 00     02:28:40.343  WRITE FPDMA QUEUED
  61 00 00 00 08 00 00 00 68 6d 28 40 00     02:28:40.342  WRITE FPDMA QUEUED
  61 00 00 00 08 00 00 2b f7 80 88 40 00     02:28:40.342  WRITE FPDMA QUEUED

Error 1853 [12] occurred at disk power-on lifetime: 4311 hours (179 days + 15 hours)
  When the command that caused the error occurred, the device was active or idle.

  After command completion occurred, registers were:
  ER -- ST COUNT  LBA_48  LH LM LL DV DC
  -- -- -- == -- == == == -- -- -- -- --
  40 -- 51 00 00 00 00 6e 66 6f 18 00 00  Error: UNC at LBA = 0x6e666f18 = 1852206872

  Commands leading to the command that caused the error were:
  CR FEATR COUNT  LBA_48  LH LM LL DV DC  Powered_Up_Time  Command/Feature_Name
  -- == -- == -- == == == -- -- -- -- --  ---------------  --------------------
  60 00 00 00 08 00 00 37 30 85 20 40 00     02:28:28.895  READ FPDMA QUEUED
  60 00 00 00 40 00 00 6e 66 6e e0 40 00     02:28:28.870  READ FPDMA QUEUED
  60 00 00 01 00 00 00 2f cb 37 88 40 00     02:28:28.869  READ FPDMA QUEUED
  60 00 00 01 00 00 00 2f cb 36 88 40 00     02:28:28.850  READ FPDMA QUEUED
  60 00 00 01 00 00 00 2f cb 35 88 40 00     02:28:28.842  READ FPDMA QUEUED

Error 1852 [11] occurred at disk power-on lifetime: 4311 hours (179 days + 15 hours)
  When the command that caused the error occurred, the device was active or idle.

  After command completion occurred, registers were:
  ER -- ST COUNT  LBA_48  LH LM LL DV DC
  -- -- -- == -- == == == -- -- -- -- --
  40 -- 51 00 00 00 00 6e 72 50 b0 00 00  Error: UNC at LBA = 0x6e7250b0 = 1852985520

  Commands leading to the command that caused the error were:
  CR FEATR COUNT  LBA_48  LH LM LL DV DC  Powered_Up_Time  Command/Feature_Name
  -- == -- == -- == == == -- -- -- -- --  ---------------  --------------------
  60 00 00 01 00 00 00 37 30 7b 60 40 00     02:28:10.671  READ FPDMA QUEUED
  60 00 00 00 20 00 00 3a f1 95 60 40 00     02:28:10.670  READ FPDMA QUEUED
  61 00 00 00 08 00 00 00 64 1c c0 40 00     02:28:10.670  WRITE FPDMA QUEUED
  60 00 00 00 12 00 00 3a f1 95 80 40 00     02:28:10.656  READ FPDMA QUEUED
  60 00 00 00 08 00 00 6e 72 50 b0 40 00     02:28:10.656  READ FPDMA QUEUED

Error 1851 [10] occurred at disk power-on lifetime: 4311 hours (179 days + 15 hours)
  When the command that caused the error occurred, the device was active or idle.

  After command completion occurred, registers were:
  ER -- ST COUNT  LBA_48  LH LM LL DV DC
  -- -- -- == -- == == == -- -- -- -- --
  40 -- 51 00 00 00 00 6e 72 50 b0 00 00  Error: WP at LBA = 0x6e7250b0 = 1852985520

  Commands leading to the command that caused the error were:
  CR FEATR COUNT  LBA_48  LH LM LL DV DC  Powered_Up_Time  Command/Feature_Name
  -- == -- == -- == == == -- -- -- -- --  ---------------  --------------------
  61 00 00 00 30 00 00 00 64 1c 88 40 00     02:28:00.258  WRITE FPDMA QUEUED
  60 00 00 01 00 00 00 37 30 79 60 40 00     02:28:00.258  READ FPDMA QUEUED
  61 00 00 00 08 00 00 00 64 1c 80 40 00     02:28:00.258  WRITE FPDMA QUEUED
  60 00 00 00 18 00 00 23 8d 3e 40 40 00     02:28:00.257  READ FPDMA QUEUED
  60 00 00 00 08 00 00 6e 72 50 b0 40 00     02:28:00.252  READ FPDMA QUEUED

SMART Extended Self-test Log Version: 1 (1 sectors)
Num  Test_Description    Status                  Remaining  LifeTime(hours)  LBA_of_first_error
# 1  Extended offline    Completed: read failure       90%      4484         1852985520
# 2  Extended offline    Completed: read failure       90%      4388         1852985520
# 3  Extended offline    Completed: read failure       90%      4388         1852985520
# 4  Short offline       Completed: read failure       90%      4319         1852985520

SMART Selective self-test log data structure revision number 1
 SPAN  MIN_LBA  MAX_LBA  CURRENT_TEST_STATUS
    1        0        0  Not_testing
    2        0        0  Not_testing
    3        0        0  Not_testing
    4        0        0  Not_testing
    5        0        0  Not_testing
Selective self-test flags (0x0):
  After scanning selected spans, do NOT read-scan remainder of disk.
If Selective self-test is pending on power-up, resume after 0 minute delay.

SCT Status Version:                  3
SCT Version (vendor specific):       522 (0x020a)
Device State:                        Active (0)
Current Temperature:                    29 Celsius
Power Cycle Min/Max Temperature:     22/30 Celsius
Lifetime    Min/Max Temperature:     14/59 Celsius
Specified Max Operating Temperature:    37 Celsius
Under/Over Temperature Limit Count:   0/0

SCT Temperature History Version:     2
Temperature Sampling Period:         1 minute
Temperature Logging Interval:        30 minutes
Min/Max recommended Temperature:     14/55 Celsius
Min/Max Temperature Limit:           10/60 Celsius
Temperature History Size (Index):    128 (87)

SCT Error Recovery Control command not supported

Device Statistics (GP Log 0x04)
Page  Offset Size        Value Flags Description
0x01  =====  =               =  ===  == General Statistics (rev 1) ==
0x01  0x008  4            3021  ---  Lifetime Power-On Resets
0x01  0x010  4            4505  ---  Power-on Hours
0x01  0x018  6     22960486184  ---  Logical Sectors Written
0x01  0x020  6       410155440  ---  Number of Write Commands
0x01  0x028  6     26771479073  ---  Logical Sectors Read
0x01  0x030  6       358744511  ---  Number of Read Commands
0x01  0x038  6               -  ---  Date and Time TimeStamp
0x03  =====  =               =  ===  == Rotating Media Statistics (rev 1) ==
0x03  0x008  4             178  ---  Spindle Motor Power-on Hours
0x03  0x010  4             177  ---  Head Flying Hours
0x03  0x018  4            5526  ---  Head Load Events
0x03  0x020  4            1248  ---  Number of Reallocated Logical Sectors
0x03  0x028  4               0  ---  Read Recovery Attempts
0x03  0x030  4               0  ---  Number of Mechanical Start Failures
0x03  0x038  4            5808  ---  Number of Realloc. Candidate Logical Sectors
0x04  =====  =               =  ===  == General Errors Statistics (rev 1) ==
0x04  0x008  4            5383  ---  Number of Reported Uncorrectable Errors
0x04  0x010  4             158  ---  Resets Between Cmd Acceptance and Completion
0x07  =====  =               =  ===  == Solid State Device Statistics (rev 1) ==
0x07  0x008  1               0  ---  Percentage Used Endurance Indicator
                                |||_ C monitored condition met
                                ||__ D supports DSN
                                |___ N normalized value

Pending Defects log (GP Log 0x0c) not supported

SATA Phy Event Counters (GP Log 0x11)
ID      Size     Value  Description
0x000a  2           54  Device-to-host register FISes sent due to a COMRESET
0x0001  2            0  Command failed due to ICRC error
0x0003  2            0  R_ERR response for device-to-host data FIS
0x0004  2            0  R_ERR response for host-to-device data FIS
0x0006  2            0  R_ERR response for device-to-host non-data FIS
0x0007  2            0  R_ERR response for host-to-device non-data FIS

