smartctl 7.1 2019-12-30 r5022 [FreeBSD 12.1-RELEASE-p2 amd64] (local build)
Copyright (C) 2002-19, Bruce Allen, Christian Franke, www.smartmontools.org

=== START OF INFORMATION SECTION ===
Model Family:     Western Digital Caviar SE Serial ATA
Device Model:     WDC WD1600JD-00GBB0
Serial Number:    --
Firmware Version: 02.05D02
User Capacity:    160,041,885,696 bytes [160 GB]
Sector Size:      512 bytes logical/physical
Device is:        In smartctl database [for details use: -P show]
ATA Version is:   ATA/ATAPI-6 (minor revision not indicated)
Local Time is:    Mon May 25 14:01:47 2020 MSK
SMART support is: Available - device has SMART capability.
SMART support is: Enabled
AAM feature is:   Disabled
APM feature is:   Unavailable
Rd look-ahead is: Enabled
Write cache is:   Enabled
DSN feature is:   Unavailable
ATA Security is:  Disabled, NOT FROZEN [SEC1]
Wt Cache Reorder: Unavailable

=== START OF READ SMART DATA SECTION ===
SMART overall-health self-assessment test result: PASSED

General SMART Values:
Offline data collection status:  (0x82)	Offline data collection activity
					was completed without error.
					Auto Offline Data Collection: Enabled.
Self-test execution status:      (   0)	The previous self-test routine completed
					without error or no self-test has ever 
					been run.
Total time to complete Offline 
data collection: 		( 5061) seconds.
Offline data collection
capabilities: 			 (0x79) SMART execute Offline immediate.
					No Auto Offline data collection support.
					Suspend Offline collection upon new
					command.
					Offline surface scan supported.
					Self-test supported.
					Conveyance Self-test supported.
					Selective Self-test supported.
SMART capabilities:            (0x0003)	Saves SMART data before entering
					power-saving mode.
					Supports SMART auto save timer.
Error logging capability:        (0x01)	Error logging supported.
					No General Purpose Logging support.
Short self-test routine 
recommended polling time: 	 (   2) minutes.
Extended self-test routine
recommended polling time: 	 (  67) minutes.
Conveyance self-test routine
recommended polling time: 	 (   5) minutes.

SMART Attributes Data Structure revision number: 16
Vendor Specific SMART Attributes with Thresholds:
ID# ATTRIBUTE_NAME          FLAGS    VALUE WORST THRESH FAIL RAW_VALUE
  1 Raw_Read_Error_Rate     PO-R--   200   200   051    -    0
  3 Spin_Up_Time            POS---   149   143   021    -    3083
  4 Start_Stop_Count        -O--CK   100   100   040    -    380
  5 Reallocated_Sector_Ct   PO--CK   199   199   140    -    9
  7 Seek_Error_Rate         PO-R--   200   200   051    -    0
  9 Power_On_Hours          -O--CK   001   001   000    -    127774
 10 Spin_Retry_Count        PO--C-   100   100   051    -    0
 11 Calibration_Retry_Count PO--C-   100   100   051    -    0
 12 Power_Cycle_Count       -O--CK   100   100   000    -    379
194 Temperature_Celsius     -O---K   124   253   000    -    26
196 Reallocated_Event_Count -O--CK   194   194   000    -    6
197 Current_Pending_Sector  -O--C-   200   200   000    -    0
198 Offline_Uncorrectable   -O--C-   200   200   000    -    0
199 UDMA_CRC_Error_Count    -O-R--   200   253   000    -    0
200 Multi_Zone_Error_Rate   P--R--   200   155   051    -    0
                            ||||||_ K auto-keep
                            |||||__ C event count
                            ||||___ R error rate
                            |||____ S speed/performance
                            ||_____ O updated online
                            |______ P prefailure warning

Read SMART Log Directory failed: Input/output error

General Purpose Log Directory not supported

SMART Extended Comprehensive Error Log (GP Log 0x03) not supported

SMART Error Log Version: 1
No Errors Logged

SMART Extended Self-test Log (GP Log 0x07) not supported

SMART Self-test log structure revision number 1
Num  Test_Description    Status                  Remaining  LifeTime(hours)  LBA_of_first_error
# 1  Extended offline    Completed without error       00%      1050         -
# 2  Extended offline    Completed without error       00%       582         -

SMART Selective self-test log data structure revision number 1
 SPAN  MIN_LBA  MAX_LBA  CURRENT_TEST_STATUS
    1        0        0  Not_testing
    2        0        0  Not_testing
    3        0        0  Not_testing
    4        0        0  Not_testing
    5        0        0  Not_testing
Selective self-test flags (0x0):
  After scanning selected spans, do NOT read-scan remainder of disk.
If Selective self-test is pending on power-up, resume after 0 minute delay.

SCT Commands not supported

Device Statistics (GP/SMART Log 0x04) not supported

Pending Defects log (GP Log 0x0c) not supported

SATA Phy Event Counters (GP Log 0x11) not supported



