smartctl 7.1 2019-12-30 r5022 [FreeBSD 12.1-RELEASE amd64] (local build)
Copyright (C) 2002-19, Bruce Allen, Christian Franke, www.smartmontools.org

=== START OF INFORMATION SECTION ===
Model Number:                       Samsung SSD 960 EVO 250GB
Serial Number:                      --
Firmware Version:                   3B7QCXE7
PCI Vendor/Subsystem ID:            0x144d
IEEE OUI Identifier:                0x002538
Total NVM Capacity:                 250,059,350,016 [250 GB]
Unallocated NVM Capacity:           0
Controller ID:                      2
Number of Namespaces:               1
Namespace 1 Size/Capacity:          250,059,350,016 [250 GB]
Namespace 1 Utilization:            166,312,419,328 [166 GB]
Namespace 1 Formatted LBA Size:     512
Namespace 1 IEEE EUI-64:            002538 ...
Local Time is:                      Sat Feb 20 08:01:36 2021 EST
Firmware Updates (0x16):            3 Slots, no Reset required
Optional Admin Commands (0x0007):   Security Format Frmw_DL
Optional NVM Commands (0x001f):     Comp Wr_Unc DS_Mngmt Wr_Zero Sav/Sel_Feat
Maximum Data Transfer Size:         512 Pages
Warning  Comp. Temp. Threshold:     77 Celsius
Critical Comp. Temp. Threshold:     79 Celsius

Supported Power States
St Op     Max   Active     Idle   RL RT WL WT  Ent_Lat  Ex_Lat
 0 +     6.04W       -        -    0  0  0  0        0       0
 1 +     5.09W       -        -    1  1  1  1        0       0
 2 +     4.08W       -        -    2  2  2  2        0       0
 3 -   0.0400W       -        -    3  3  3  3      210    1500
 4 -   0.0050W       -        -    4  4  4  4     2200    6000

Supported LBA Sizes (NSID 0x1)
Id Fmt  Data  Metadt  Rel_Perf
 0 +     512       0         0

=== START OF SMART DATA SECTION ===
SMART overall-health self-assessment test result: PASSED

SMART/Health Information (NVMe Log 0x02)
Critical Warning:                   0x00
Temperature:                        36 Celsius
Available Spare:                    100%
Available Spare Threshold:          10%
Percentage Used:                    1%
Data Units Read:                    10,743,687 [5.50 TB]
Data Units Written:                 10,543,346 [5.39 TB]
Host Read Commands:                 111,547,363
Host Write Commands:                55,170,698
Controller Busy Time:               514
Power Cycles:                       1,300
Power On Hours:                     394
Unsafe Shutdowns:                   418
Media and Data Integrity Errors:    0
Error Information Log Entries:      1,995
Warning  Comp. Temperature Time:    0
Critical Comp. Temperature Time:    0
Temperature Sensor 1:               36 Celsius
Temperature Sensor 2:               49 Celsius

Error Information (NVMe Log 0x01, max 64 entries)
Num   ErrCount  SQId   CmdId  Status  PELoc          LBA  NSID    VS
  0       1995     0  0x000a  0x421a  0x028            0     0     -
  1       1994     0  0x000a  0x421a  0x028            0     0     -
  2       1993     0  0x000a  0x421a  0x028            0     0     -
  3       1992     0  0x000a  0x421a  0x028            0     0     -
  4       1991     0  0x000a  0x421a  0x028            0     0     -
  5       1990     0  0x000a  0x421a  0x028            0     0     -
  6       1989     0  0x000a  0x421a  0x028            0     0     -
  7       1988     0  0x000a  0x421a  0x028            0     0     -
  8       1987     0  0x000a  0x421a  0x028            0     0     -
  9       1986     0  0x000a  0x421a  0x028            0     0     -
 10       1985     0  0x000a  0x421a  0x028            0     0     -
 11       1984     0  0x000a  0x421a  0x028            0     0     -
 12       1983     0  0x000a  0x421a  0x028            0     0     -
 13       1982     0  0x000a  0x421a  0x028            0     0     -
 14       1981     0  0x000a  0x421a  0x028            0     0     -
 15       1980     0  0x000a  0x421a  0x028            0     0     -
... (48 entries not shown)

