smartctl 7.1 2019-12-30 r5022 [FreeBSD 12.1-RELEASE-p10 amd64] (local build)
Copyright (C) 2002-19, Bruce Allen, Christian Franke, www.smartmontools.org

=== START OF INFORMATION SECTION ===
Model Number:                       Samsung SSD 960 EVO 250GB
Serial Number:                      --
Firmware Version:                   3B7QCXE7
PCI Vendor/Subsystem ID:            0x144d
IEEE OUI Identifier:                0x002538
Total NVM Capacity:                 250,059,350,016 [250 GB]
Unallocated NVM Capacity:           0
Controller ID:                      2
Number of Namespaces:               1
Namespace 1 Size/Capacity:          250,059,350,016 [250 GB]
Namespace 1 Utilization:            36,554,158,080 [36.5 GB]
Namespace 1 Formatted LBA Size:     512
Namespace 1 IEEE EUI-64:            002538 ...
Local Time is:                      Sat Oct 31 14:34:11 2020 PDT
Firmware Updates (0x16):            3 Slots, no Reset required
Optional Admin Commands (0x0007):   Security Format Frmw_DL
Optional NVM Commands (0x001f):     Comp Wr_Unc DS_Mngmt Wr_Zero Sav/Sel_Feat
Maximum Data Transfer Size:         512 Pages
Warning  Comp. Temp. Threshold:     77 Celsius
Critical Comp. Temp. Threshold:     79 Celsius

Supported Power States
St Op     Max   Active     Idle   RL RT WL WT  Ent_Lat  Ex_Lat
 0 +     6.04W       -        -    0  0  0  0        0       0
 1 +     5.09W       -        -    1  1  1  1        0       0
 2 +     4.08W       -        -    2  2  2  2        0       0
 3 -   0.0400W       -        -    3  3  3  3      210    1500
 4 -   0.0050W       -        -    4  4  4  4     2200    6000

Supported LBA Sizes (NSID 0x1)
Id Fmt  Data  Metadt  Rel_Perf
 0 +     512       0         0

=== START OF SMART DATA SECTION ===
SMART overall-health self-assessment test result: PASSED

SMART/Health Information (NVMe Log 0x02)
Critical Warning:                   0x00
Temperature:                        28 Celsius
Available Spare:                    100%
Available Spare Threshold:          10%
Percentage Used:                    3%
Data Units Read:                    9,236,101 [4.72 TB]
Data Units Written:                 44,438,741 [22.7 TB]
Host Read Commands:                 223,563,059
Host Write Commands:                1,564,910,333
Controller Busy Time:               6,678
Power Cycles:                       265
Power On Hours:                     26,232
Unsafe Shutdowns:                   90
Media and Data Integrity Errors:    0
Error Information Log Entries:      367
Warning  Comp. Temperature Time:    0
Critical Comp. Temperature Time:    0
Temperature Sensor 1:               28 Celsius
Temperature Sensor 2:               41 Celsius

Error Information (NVMe Log 0x01, max 64 entries)
Num   ErrCount  SQId   CmdId  Status  PELoc          LBA  NSID    VS
  0        367     0  0x00b3  0x4212  0x028            0     -     -
  1        366     0  0x00dd  0x4212  0x028            0     -     -
  2        365     0  0x001d  0x4004  0x02c            0     0     -
  3        364     0  0x001c  0x4004  0x02c            0     0     -
  4        363     0  0x001d  0x4004  0x02c            0     0     -
  5        362     0  0x001c  0x4004  0x02c            0     0     -
  6        361     0  0x001d  0x4004  0x02c            0     0     -
  7        360     0  0x001c  0x4004  0x02c            0     0     -
  8        359     0  0x001d  0x4004  0x02c            0     0     -
  9        358     0  0x001c  0x4004  0x02c            0     0     -
 10        357     0  0x001d  0x4004  0x02c            0     0     -
 11        356     0  0x001c  0x4004  0x02c            0     0     -
 12        355     0  0x001d  0x4004  0x02c            0     0     -
 13        354     0  0x001c  0x4004  0x02c            0     0     -
 14        353     0  0x001d  0x4004  0x02c            0     0     -
 15        352     0  0x001c  0x4004  0x02c            0     0     -
... (48 entries not shown)

