smartctl 7.3 2022-02-28 r5338 [FreeBSD 13.0-RELEASE-p11 amd64] (local build)
Copyright (C) 2002-22, Bruce Allen, Christian Franke, www.smartmontools.org

=== START OF INFORMATION SECTION ===
Model Number:                       Samsung SSD 960 EVO 250GB
Serial Number:                      --
Firmware Version:                   3B7QCXE7
PCI Vendor/Subsystem ID:            0x144d
IEEE OUI Identifier:                0x002538
Total NVM Capacity:                 250,059,350,016 [250 GB]
Unallocated NVM Capacity:           0
Controller ID:                      2
NVMe Version:                       1.2
Number of Namespaces:               1
Namespace 1 Size/Capacity:          250,059,350,016 [250 GB]
Namespace 1 Utilization:            249,061,335,040 [249 GB]
Namespace 1 Formatted LBA Size:     512
Namespace 1 IEEE EUI-64:            002538 ...
Local Time is:                      Mon Apr 25 07:31:26 2022 CEST
Firmware Updates (0x16):            3 Slots, no Reset required
Optional Admin Commands (0x0007):   Security Format Frmw_DL
Optional NVM Commands (0x001f):     Comp Wr_Unc DS_Mngmt Wr_Zero Sav/Sel_Feat
Log Page Attributes (0x03):         S/H_per_NS Cmd_Eff_Lg
Maximum Data Transfer Size:         512 Pages
Warning  Comp. Temp. Threshold:     77 Celsius
Critical Comp. Temp. Threshold:     79 Celsius

Supported Power States
St Op     Max   Active     Idle   RL RT WL WT  Ent_Lat  Ex_Lat
 0 +     6.04W       -        -    0  0  0  0        0       0
 1 +     5.09W       -        -    1  1  1  1        0       0
 2 +     4.08W       -        -    2  2  2  2        0       0
 3 -   0.0400W       -        -    3  3  3  3      210    1500
 4 -   0.0050W       -        -    4  4  4  4     2200    6000

Supported LBA Sizes (NSID 0x1)
Id Fmt  Data  Metadt  Rel_Perf
 0 +     512       0         0

=== START OF SMART DATA SECTION ===
SMART overall-health self-assessment test result: PASSED

SMART/Health Information (NVMe Log 0x02)
Critical Warning:                   0x00
Temperature:                        42 Celsius
Available Spare:                    100%
Available Spare Threshold:          10%
Percentage Used:                    50%
Data Units Read:                    42,113,237 [21.5 TB]
Data Units Written:                 168,262,196 [86.1 TB]
Host Read Commands:                 611,628,455
Host Write Commands:                1,834,337,707
Controller Busy Time:               19,001
Power Cycles:                       297
Power On Hours:                     23,533
Unsafe Shutdowns:                   84
Media and Data Integrity Errors:    0
Error Information Log Entries:      16
Warning  Comp. Temperature Time:    0
Critical Comp. Temperature Time:    0
Temperature Sensor 1:               42 Celsius
Temperature Sensor 2:               56 Celsius

Error Information (NVMe Log 0x01, 16 of 64 entries)
Num   ErrCount  SQId   CmdId  Status  PELoc          LBA  NSID    VS
  0         16     0  0x0010  0x4202  0x028            0     0     -
  1         15     0  0x0014  0x4202  0x028            0     0     -
  2         14     0  0x0012  0x4202  0x028            0     0     -
  3         13     0  0x0010  0x4202  0x028            0     0     -
  4         12     0  0x001f  0x4202  0x028            0     0     -
  5         11     0  0x001d  0x4202  0x028            0     0     -
  6         10     0  0x001b  0x4202  0x028            0     0     -
  7          9     0  0x0019  0x4202  0x028            0     0     -
  8          8     0  0x0017  0x4202  0x028            0     0     -
  9          7     0  0x0015  0x4202  0x028            0     0     -
 10          6     0  0x0013  0x4202  0x028            0     0     -
 11          5     0  0x0011  0x4202  0x028            0     0     -
 12          4     0  0x000f  0x4202  0x028            0     0     -
 13          3     0  0x000d  0x4202  0x028            0     0     -
 14          2     0  0x0012  0x4202  0x028            0     0     -
 15          1     0  0x0010  0x4202  0x028            0     0     -
... (48 entries not read)



