smartctl 7.4 2023-08-01 r5530 [OpenBSD 7.7 amd64] (local build)
Copyright (C) 2002-23, Bruce Allen, Christian Franke, www.smartmontools.org

=== START OF INFORMATION SECTION ===
Model Number:                       KBG40ZPZ128G TOSHIBA MEMORY
Serial Number:                      --
Firmware Version:                   AEMS0102
PCI Vendor/Subsystem ID:            0x1e0f
IEEE OUI Identifier:                0x8ce38e
Total NVM Capacity:                 128,035,676,160 [128 GB]
Unallocated NVM Capacity:           0
Controller ID:                      0
NVMe Version:                       1.3
Number of Namespaces:               1
Local Time is:                      Wed Oct  1 12:53:26 2025 UTC
Firmware Updates (0x14):            2 Slots, no Reset required
Optional Admin Commands (0x001f):   Security Format Frmw_DL NS_Mngmt Self_Test
Optional NVM Commands (0x005f):     Comp Wr_Unc DS_Mngmt Wr_Zero Sav/Sel_Feat Timestmp
Log Page Attributes (0x0e):         Cmd_Eff_Lg Ext_Get_Lg Telmtry_Lg
Maximum Data Transfer Size:         512 Pages
Warning  Comp. Temp. Threshold:     82 Celsius
Critical Comp. Temp. Threshold:     86 Celsius

Supported Power States
St Op     Max   Active     Idle   RL RT WL WT  Ent_Lat  Ex_Lat
 0 +     3.00W       -        -    0  0  0  0        1       1
 1 +     2.20W       -        -    1  1  1  1        1       1
 2 +     1.80W       -        -    2  2  2  2        1       1
 3 -   0.0500W       -        -    4  4  4  4      800    1200
 4 -   0.0050W       -        -    4  4  4  4     3000   32000

=== START OF SMART DATA SECTION ===
SMART overall-health self-assessment test result: PASSED

SMART/Health Information (NVMe Log 0x02)
Critical Warning:                   0x00
Temperature:                        34 Celsius
Available Spare:                    100%
Available Spare Threshold:          10%
Percentage Used:                    3%
Data Units Read:                    708,709 [362 GB]
Data Units Written:                 2,172,502 [1.11 TB]
Host Read Commands:                 18,591,541
Host Write Commands:                100,374,681
Controller Busy Time:               202
Power Cycles:                       95
Power On Hours:                     22,085
Unsafe Shutdowns:                   38
Media and Data Integrity Errors:    0
Error Information Log Entries:      0
Warning  Comp. Temperature Time:    0
Critical Comp. Temperature Time:    0
Temperature Sensor 1:               34 Celsius

Error Information (NVMe Log 0x01, 16 of 256 entries)
No Errors Logged

Self-test Log (NVMe Log 0x06)
Self-test status: No self-test in progress
No Self-tests Logged



