smartctl 7.4 2023-08-01 r5530 [FreeBSD 13.2-RELEASE-p11 amd64] (local build)
Copyright (C) 2002-23, Bruce Allen, Christian Franke, www.smartmontools.org

=== START OF INFORMATION SECTION ===
Device Model:     ST240FN0021
Serial Number:    --
LU WWN Device Id: 5 000c50 ...
Firmware Version: B550
User Capacity:    240,057,409,536 bytes [240 GB]
Sector Sizes:     512 bytes logical, 4096 bytes physical
Rotation Rate:    Solid State Device
Form Factor:      2.5 inches
TRIM Command:     Available
Device is:        Not in smartctl database 7.3/5528
ATA Version is:   ATA8-ACS T13/1699-D revision 4
SATA Version is:  SATA 3.0, 6.0 Gb/s (current: 6.0 Gb/s)
Local Time is:    Thu Jun 20 10:04:44 2024 AEST
SMART support is: Available - device has SMART capability.
SMART support is: Enabled
AAM feature is:   Unavailable
APM feature is:   Unavailable
Rd look-ahead is: Enabled
Write cache is:   Enabled
DSN feature is:   Unavailable
ATA Security is:  Disabled, frozen [SEC2]
Wt Cache Reorder: Unavailable

Read SMART Thresholds failed: Input/output error

=== START OF READ SMART DATA SECTION ===
SMART overall-health self-assessment test result: PASSED

General SMART Values:
Offline data collection status:  (0x00)	Offline data collection activity
					was never started.
					Auto Offline Data Collection: Disabled.
Self-test execution status:      (   0)	The previous self-test routine completed
					without error or no self-test has ever 
					been run.
Total time to complete Offline 
data collection: 		(    0) seconds.
Offline data collection
capabilities: 			 (0x19) SMART execute Offline immediate.
					No Auto Offline data collection support.
					Suspend Offline collection upon new
					command.
					Offline surface scan supported.
					Self-test supported.
					No Conveyance Self-test supported.
					No Selective Self-test supported.
SMART capabilities:            (0x0002)	Does not save SMART data before
					entering power-saving mode.
					Supports SMART auto save timer.
Error logging capability:        (0x01)	Error logging supported.
					General Purpose Logging supported.
Short self-test routine 
recommended polling time: 	 (   1) minutes.
Extended self-test routine
recommended polling time: 	 (  21) minutes.

SMART Attributes Data Structure revision number: 0
Vendor Specific SMART Attributes with Thresholds:
ID# ATTRIBUTE_NAME          FLAGS    VALUE WORST THRESH FAIL RAW_VALUE
  1 Raw_Read_Error_Rate     POSR--   166   001   ---    -    0
  5 Reallocated_Sector_Ct   PO--CK   100   100   ---    -    10
  9 Power_On_Hours          -O--CK   100   091   ---    -    76
 12 Power_Cycle_Count       -O--CK   100   100   ---    -    852
171 Unknown_Attribute       -O--CK   100   100   ---    -    0
172 Unknown_Attribute       -O--CK   100   100   ---    -    0
181 Program_Fail_Cnt_Total  -O--CK   100   100   ---    -    0
182 Erase_Fail_Count_Total  -O--CK   100   100   ---    -    0
194 Temperature_Celsius     -O---K   024   000   ---    -    24 (Min/Max 0/48)
201 Unknown_SSD_Attribute   -O--CK   100   099   ---    -    0
204 Soft_ECC_Correction     -O--CK   100   100   ---    -    0
231 Unknown_SSD_Attribute   PO--C-   097   097   ---    -    4
234 Unknown_Attribute       -O--CK   100   100   ---    -    55663
241 Total_LBAs_Written      -O--CK   100   100   ---    -    9203
242 Total_LBAs_Read         -O--CK   100   100   ---    -    4604
250 Read_Error_Retry_Rate   -O--CK   100   100   ---    -    12110
                            ||||||_ K auto-keep
                            |||||__ C event count
                            ||||___ R error rate
                            |||____ S speed/performance
                            ||_____ O updated online
                            |______ P prefailure warning

General Purpose Log Directory Version 1
SMART           Log Directory Version 1 [multi-sector log support]
Address    Access  R/W   Size  Description
0x00       GPL,SL  R/O      1  Log Directory
0x03       GPL,SL  R/O      5  Ext. Comprehensive SMART error log
0x04       GPL,SL  R/O      8  Device Statistics log
0x07       GPL,SL  R/O      2  Extended self-test log
0x10       GPL     R/O      1  NCQ Command Error log
0x11       GPL     R/O      1  SATA Phy Event Counters log
0x80-0x9f  GPL,SL  R/W     16  Host vendor specific log
0xa8       GPL     VS    1041  Device vendor specific log
0xa8       SL      VS     255  Device vendor specific log
0xb7       GPL,SL  VS       4  Device vendor specific log

SMART Extended Comprehensive Error Log Version: 1 (5 sectors)
Device Error Count: 65535 (device log contains only the most recent 20 errors)
	CR     = Command Register
	FEATR  = Features Register
	COUNT  = Count (was: Sector Count) Register
	LBA_48 = Upper bytes of LBA High/Mid/Low Registers ]  ATA-8
	LH     = LBA High (was: Cylinder High) Register    ]   LBA
	LM     = LBA Mid (was: Cylinder Low) Register      ] Register
	LL     = LBA Low (was: Sector Number) Register     ]
	DV     = Device (was: Device/Head) Register
	DC     = Device Control Register
	ER     = Error register
	ST     = Status register
Powered_Up_Time is measured from power on, and printed as
DDd+hh:mm:SS.sss where DD=days, hh=hours, mm=minutes,
SS=sec, and sss=millisec. It "wraps" after 49.710 days.

Error 65535 [18] occurred at disk power-on lifetime: 76 hours (3 days + 4 hours)
  When the command that caused the error occurred, the device was active or idle.

  After command completion occurred, registers were:
  ER -- ST COUNT  LBA_48  LH LM LL DV DC
  -- -- -- == -- == == == -- -- -- -- --
  04 -- 51 00 00 00 00 00 00 00 00 e0 08  Error: ABRT

  Commands leading to the command that caused the error were:
  CR FEATR COUNT  LBA_48  LH LM LL DV DC  Powered_Up_Time  Command/Feature_Name
  -- == -- == -- == == == -- -- -- -- --  ---------------  --------------------
  b0 00 d1 00 01 00 00 00 c2 4f 01 40 08     01:24:07.710  SMART READ ATTRIBUTE THRESHOLDS [OBS-4]
  b0 00 d0 00 01 00 00 00 c2 4f 00 40 08     01:24:07.710  SMART READ DATA
  ec 00 00 00 01 00 00 00 00 00 00 40 08     01:24:07.700  IDENTIFY DEVICE
  60 00 58 00 50 00 00 06 09 be c0 40 08     01:24:07.690  READ FPDMA QUEUED
  60 00 60 00 48 00 00 06 08 69 00 40 08     01:24:07.680  READ FPDMA QUEUED

Error 65534 [17] occurred at disk power-on lifetime: 64 hours (2 days + 16 hours)
  When the command that caused the error occurred, the device was active or idle.

  After command completion occurred, registers were:
  ER -- ST COUNT  LBA_48  LH LM LL DV DC
  -- -- -- == -- == == == -- -- -- -- --
  04 -- 51 00 ff 00 00 00 00 00 00 e0 08  Error: ABRT

  Commands leading to the command that caused the error were:
  CR FEATR COUNT  LBA_48  LH LM LL DV DC  Powered_Up_Time  Command/Feature_Name
  -- == -- == -- == == == -- -- -- -- --  ---------------  --------------------
  b0 00 d1 00 01 00 00 00 c2 4f 01 00 08     00:37:57.920  SMART READ ATTRIBUTE THRESHOLDS [OBS-4]
  b0 00 d0 00 01 00 00 00 c2 4f 00 00 08     00:37:57.920  SMART READ DATA
  ec 00 00 00 01 00 00 00 00 00 00 00 08     00:37:57.840  IDENTIFY DEVICE
  e5 00 00 00 00 00 00 00 00 00 00 00 08     00:37:57.840  CHECK POWER MODE
  ec 00 00 00 01 00 00 00 00 00 00 00 08     00:37:57.840  IDENTIFY DEVICE

Error 65533 [16] occurred at disk power-on lifetime: 64 hours (2 days + 16 hours)
  When the command that caused the error occurred, the device was active or idle.

  After command completion occurred, registers were:
  ER -- ST COUNT  LBA_48  LH LM LL DV DC
  -- -- -- == -- == == == -- -- -- -- --
  04 -- 51 00 ff 00 00 00 00 00 00 e0 08  Error: ABRT

  Commands leading to the command that caused the error were:
  CR FEATR COUNT  LBA_48  LH LM LL DV DC  Powered_Up_Time  Command/Feature_Name
  -- == -- == -- == == == -- -- -- -- --  ---------------  --------------------
  b0 00 d1 00 01 00 00 00 c2 4f 01 00 08     00:33:09.090  SMART READ ATTRIBUTE THRESHOLDS [OBS-4]
  b0 00 d0 00 01 00 00 00 c2 4f 00 00 08     00:33:09.090  SMART READ DATA
  ec 00 00 00 01 00 00 00 00 00 00 00 08     00:33:09.020  IDENTIFY DEVICE
  e5 00 00 00 00 00 00 00 00 00 00 00 08     00:33:09.020  CHECK POWER MODE
  ec 00 00 00 01 00 00 00 00 00 00 00 08     00:33:09.010  IDENTIFY DEVICE

Error 65532 [15] occurred at disk power-on lifetime: 63 hours (2 days + 15 hours)
  When the command that caused the error occurred, the device was active or idle.

  After command completion occurred, registers were:
  ER -- ST COUNT  LBA_48  LH LM LL DV DC
  -- -- -- == -- == == == -- -- -- -- --
  04 -- 51 00 ff 00 00 00 00 00 00 e0 08  Error: ABRT

  Commands leading to the command that caused the error were:
  CR FEATR COUNT  LBA_48  LH LM LL DV DC  Powered_Up_Time  Command/Feature_Name
  -- == -- == -- == == == -- -- -- -- --  ---------------  --------------------
  b0 00 d1 00 01 00 00 00 c2 4f 01 00 08     00:26:33.310  SMART READ ATTRIBUTE THRESHOLDS [OBS-4]
  b0 00 d0 00 01 00 00 00 c2 4f 00 00 08     00:26:33.310  SMART READ DATA
  ec 00 00 00 01 00 00 00 00 00 00 00 08     00:26:33.230  IDENTIFY DEVICE
  e5 00 00 00 00 00 00 00 00 00 00 00 08     00:26:33.230  CHECK POWER MODE
  ec 00 00 00 01 00 00 00 00 00 00 00 08     00:26:33.230  IDENTIFY DEVICE

Error 65531 [14] occurred at disk power-on lifetime: 63 hours (2 days + 15 hours)
  When the command that caused the error occurred, the device was active or idle.

  After command completion occurred, registers were:
  ER -- ST COUNT  LBA_48  LH LM LL DV DC
  -- -- -- == -- == == == -- -- -- -- --
  04 -- 51 00 ff 00 00 00 00 00 00 e0 08  Error: ABRT

  Commands leading to the command that caused the error were:
  CR FEATR COUNT  LBA_48  LH LM LL DV DC  Powered_Up_Time  Command/Feature_Name
  -- == -- == -- == == == -- -- -- -- --  ---------------  --------------------
  b0 00 d1 00 01 00 00 00 c2 4f 01 00 08     00:25:42.550  SMART READ ATTRIBUTE THRESHOLDS [OBS-4]
  b0 00 d0 00 01 00 00 00 c2 4f 00 00 08     00:25:42.550  SMART READ DATA
  ec 00 00 00 01 00 00 00 00 00 00 00 08     00:25:42.470  IDENTIFY DEVICE
  e5 00 00 00 00 00 00 00 00 00 00 00 08     00:25:42.470  CHECK POWER MODE
  ec 00 00 00 01 00 00 00 00 00 00 00 08     00:25:42.470  IDENTIFY DEVICE

Error 65530 [13] occurred at disk power-on lifetime: 59 hours (2 days + 11 hours)
  When the command that caused the error occurred, the device was active or idle.

  After command completion occurred, registers were:
  ER -- ST COUNT  LBA_48  LH LM LL DV DC
  -- -- -- == -- == == == -- -- -- -- --
  04 -- 51 00 ff 00 00 00 00 00 00 e0 08  Error: ABRT

  Commands leading to the command that caused the error were:
  CR FEATR COUNT  LBA_48  LH LM LL DV DC  Powered_Up_Time  Command/Feature_Name
  -- == -- == -- == == == -- -- -- -- --  ---------------  --------------------
  b0 00 d1 00 01 00 00 00 c2 4f 00 00 08     00:00:33.930  SMART READ ATTRIBUTE THRESHOLDS [OBS-4]
  ec 00 00 00 01 00 00 00 00 00 00 00 08     00:00:33.930  IDENTIFY DEVICE
  e5 00 00 00 00 00 00 00 00 00 00 00 08     00:00:33.930  CHECK POWER MODE
  60 00 08 00 b8 00 00 00 00 29 e8 40 08     00:00:33.920  READ FPDMA QUEUED
  60 00 40 00 b0 00 00 00 00 08 20 40 08     00:00:33.910  READ FPDMA QUEUED

Error 65529 [12] occurred at disk power-on lifetime: 59 hours (2 days + 11 hours)
  When the command that caused the error occurred, the device was active or idle.

  After command completion occurred, registers were:
  ER -- ST COUNT  LBA_48  LH LM LL DV DC
  -- -- -- == -- == == == -- -- -- -- --
  04 -- 51 00 02 00 00 00 c2 4f 00 e0 08  Error: ABRT

  Commands leading to the command that caused the error were:
  CR FEATR COUNT  LBA_48  LH LM LL DV DC  Powered_Up_Time  Command/Feature_Name
  -- == -- == -- == == == -- -- -- -- --  ---------------  --------------------
  b0 00 d1 00 01 00 00 00 c2 4f 01 00 08     00:00:32.940  SMART READ ATTRIBUTE THRESHOLDS [OBS-4]
  b0 00 d0 00 01 00 00 00 c2 4f 00 00 08     00:00:32.940  SMART READ DATA
  b0 00 da 00 00 00 00 00 c2 4f 00 00 08     00:00:32.940  SMART RETURN STATUS
  b0 00 d8 00 00 00 00 00 c2 4f 01 00 08     00:00:32.940  SMART ENABLE OPERATIONS
  ec 00 00 00 01 00 00 00 00 00 00 00 08     00:00:32.910  IDENTIFY DEVICE

Error 65528 [11] occurred at disk power-on lifetime: 59 hours (2 days + 11 hours)
  When the command that caused the error occurred, the device was active or idle.

  After command completion occurred, registers were:
  ER -- ST COUNT  LBA_48  LH LM LL DV DC
  -- -- -- == -- == == == -- -- -- -- --
  04 -- 51 00 ff 00 00 00 00 00 00 e0 08  Error: ABRT

  Commands leading to the command that caused the error were:
  CR FEATR COUNT  LBA_48  LH LM LL DV DC  Powered_Up_Time  Command/Feature_Name
  -- == -- == -- == == == -- -- -- -- --  ---------------  --------------------
  b0 00 d1 00 01 00 00 00 c2 4f 00 00 08     00:05:59.750  SMART READ ATTRIBUTE THRESHOLDS [OBS-4]
  ec 00 00 00 01 00 00 00 00 00 00 00 08     00:05:59.750  IDENTIFY DEVICE
  e5 00 00 00 00 00 00 00 00 00 00 00 08     00:05:59.740  CHECK POWER MODE
  60 00 08 00 08 00 00 00 00 29 e8 40 08     00:05:59.740  READ FPDMA QUEUED
  60 00 40 00 00 00 00 00 00 08 20 40 08     00:05:59.730  READ FPDMA QUEUED

SMART Extended Self-test Log Version: 1 (2 sectors)
No self-tests have been logged.  [To run self-tests, use: smartctl -t]

Selective Self-tests/Logging not supported

SCT Commands not supported

Device Statistics (GP Log 0x04)
Page  Offset Size        Value Flags Description
0x01  =====  =               =  ===  == General Statistics (rev 2) ==
0x01  0x008  4             852  ---  Lifetime Power-On Resets
                                |||_ C monitored condition met
                                ||__ D supports DSN
                                |___ N normalized value

Pending Defects log (GP Log 0x0c) not supported

SATA Phy Event Counters (GP Log 0x11)
ID      Size     Value  Description
0x0001  2            0  Command failed due to ICRC error
0x0002  2            0  R_ERR response for data FIS
0x0003  2            0  R_ERR response for device-to-host data FIS
0x0004  2            0  R_ERR response for host-to-device data FIS
0x0005  2            0  R_ERR response for non-data FIS
0x0006  2            0  R_ERR response for device-to-host non-data FIS
0x0007  2            0  R_ERR response for host-to-device non-data FIS
0x0008  2            0  Device-to-host non-data FIS retries
0x0009  2            0  Transition from drive PhyRdy to drive PhyNRdy
0x000a  2            7  Device-to-host register FISes sent due to a COMRESET
0x000b  2            0  CRC errors within host-to-device FIS
0x000d  2            0  Non-CRC errors within host-to-device FIS
0x000f  2            0  R_ERR response for host-to-device data FIS, CRC
0x0010  2            0  R_ERR response for host-to-device data FIS, non-CRC
0x0012  2            0  R_ERR response for host-to-device non-data FIS, CRC
0x0013  2            0  R_ERR response for host-to-device non-data FIS, non-CRC

