smartctl 7.2 2020-12-30 r5155 [FreeBSD 12.2-RELEASE-p8 amd64] (local build)
Copyright (C) 2002-20, Bruce Allen, Christian Franke, www.smartmontools.org

=== START OF INFORMATION SECTION ===
Model Number:                       WDC WDS500G2B0C-00PXH0
Serial Number:                      --
Firmware Version:                   211070WD
PCI Vendor/Subsystem ID:            0x15b7
IEEE OUI Identifier:                0x001b44
Total NVM Capacity:                 500,107,862,016 [500 GB]
Unallocated NVM Capacity:           0
Controller ID:                      1
NVMe Version:                       1.4
Number of Namespaces:               1
Namespace 1 Size/Capacity:          500,107,862,016 [500 GB]
Namespace 1 Formatted LBA Size:     512
Namespace 1 IEEE EUI-64:            001b44 ...
Local Time is:                      Wed Aug 18 22:37:21 2021 MDT
Firmware Updates (0x14):            2 Slots, no Reset required
Optional Admin Commands (0x0017):   Security Format Frmw_DL Self_Test
Optional NVM Commands (0x005f):     Comp Wr_Unc DS_Mngmt Wr_Zero Sav/Sel_Feat Timestmp
Log Page Attributes (0x1e):         Cmd_Eff_Lg Ext_Get_Lg Telmtry_Lg Pers_Ev_Lg
Maximum Data Transfer Size:         128 Pages
Warning  Comp. Temp. Threshold:     80 Celsius
Critical Comp. Temp. Threshold:     85 Celsius
Namespace 1 Features (0x02):        NA_Fields

Supported Power States
St Op     Max   Active     Idle   RL RT WL WT  Ent_Lat  Ex_Lat
 0 +     3.50W    2.10W       -    0  0  0  0        0       0
 1 +     2.40W    1.60W       -    0  0  0  0        0       0
 2 +     1.90W    1.50W       -    0  0  0  0        0       0
 3 -   0.0200W       -        -    3  3  3  3     3900   11000
 4 -   0.0050W       -        -    4  4  4  4     5000   39000

Supported LBA Sizes (NSID 0x1)
Id Fmt  Data  Metadt  Rel_Perf
 0 +     512       0         2
 1 -    4096       0         1

=== START OF SMART DATA SECTION ===
SMART overall-health self-assessment test result: PASSED

SMART/Health Information (NVMe Log 0x02)
Critical Warning:                   0x00
Temperature:                        40 Celsius
Available Spare:                    100%
Available Spare Threshold:          10%
Percentage Used:                    0%
Data Units Read:                    6,745,416 [3.45 TB]
Data Units Written:                 6,941,745 [3.55 TB]
Host Read Commands:                 185,309,509
Host Write Commands:                119,397,984
Controller Busy Time:               303
Power Cycles:                       40
Power On Hours:                     5,016
Unsafe Shutdowns:                   20
Media and Data Integrity Errors:    0
Error Information Log Entries:      1
Warning  Comp. Temperature Time:    0
Critical Comp. Temperature Time:    0

Error Information (NVMe Log 0x01, 16 of 256 entries)
No Errors Logged

