smartctl 7.3 2022-02-28 r5338 [FreeBSD 13.1-STABLE amd64] (local build)
Copyright (C) 2002-22, Bruce Allen, Christian Franke, www.smartmontools.org

=== START OF INFORMATION SECTION ===
Model Family:     Western Digital Red
Device Model:     WDC WD30EFRX-68EUZN0
Serial Number:    --
LU WWN Device Id: 5 0014ee ...
Firmware Version: 82.00A82
User Capacity:    3,000,592,982,016 bytes [3.00 TB]
Sector Sizes:     512 bytes logical, 4096 bytes physical
Rotation Rate:    5400 rpm
Device is:        In smartctl database 7.3/5319
ATA Version is:   ACS-2 (minor revision not indicated)
SATA Version is:  SATA 3.0, 6.0 Gb/s (current: 3.0 Gb/s)
Local Time is:    Fri Dec 23 09:36:39 2022 CET
SMART support is: Available - device has SMART capability.
SMART support is: Enabled
AAM feature is:   Unavailable
APM feature is:   Unavailable
Rd look-ahead is: Enabled
Write cache is:   Enabled
DSN feature is:   Unavailable
ATA Security is:  Disabled, frozen [SEC2]
Wt Cache Reorder: Enabled

=== START OF READ SMART DATA SECTION ===
SMART overall-health self-assessment test result: PASSED

General SMART Values:
Offline data collection status:  (0x00)	Offline data collection activity
					was never started.
					Auto Offline Data Collection: Disabled.
Self-test execution status:      (   0)	The previous self-test routine completed
					without error or no self-test has ever 
					been run.
Total time to complete Offline 
data collection: 		(39840) seconds.
Offline data collection
capabilities: 			 (0x7b) SMART execute Offline immediate.
					Auto Offline data collection on/off support.
					Suspend Offline collection upon new
					command.
					Offline surface scan supported.
					Self-test supported.
					Conveyance Self-test supported.
					Selective Self-test supported.
SMART capabilities:            (0x0003)	Saves SMART data before entering
					power-saving mode.
					Supports SMART auto save timer.
Error logging capability:        (0x01)	Error logging supported.
					General Purpose Logging supported.
Short self-test routine 
recommended polling time: 	 (   2) minutes.
Extended self-test routine
recommended polling time: 	 ( 399) minutes.
Conveyance self-test routine
recommended polling time: 	 (   5) minutes.
SCT capabilities: 	       (0x703d)	SCT Status supported.
					SCT Error Recovery Control supported.
					SCT Feature Control supported.
					SCT Data Table supported.

SMART Attributes Data Structure revision number: 16
Vendor Specific SMART Attributes with Thresholds:
ID# ATTRIBUTE_NAME          FLAGS    VALUE WORST THRESH FAIL RAW_VALUE
  1 Raw_Read_Error_Rate     POSR-K   199   199   051    -    35469
  3 Spin_Up_Time            POS--K   184   180   021    -    5775
  4 Start_Stop_Count        -O--CK   100   100   000    -    31
  5 Reallocated_Sector_Ct   PO--CK   200   200   140    -    0
  7 Seek_Error_Rate         -OSR-K   200   200   000    -    0
  9 Power_On_Hours          -O--CK   011   010   000    -    64984
 10 Spin_Retry_Count        -O--CK   100   253   000    -    0
 11 Calibration_Retry_Count -O--CK   100   253   000    -    0
 12 Power_Cycle_Count       -O--CK   100   100   000    -    30
192 Power-Off_Retract_Count -O--CK   200   200   000    -    15
193 Load_Cycle_Count        -O--CK   178   178   000    -    68566
194 Temperature_Celsius     -O---K   115   107   000    -    35
196 Reallocated_Event_Count -O--CK   200   200   000    -    0
197 Current_Pending_Sector  -O--CK   200   200   000    -    0
198 Offline_Uncorrectable   ----CK   100   253   000    -    0
199 UDMA_CRC_Error_Count    -O--CK   200   200   000    -    0
200 Multi_Zone_Error_Rate   ---R--   195   195   000    -    2234
                            ||||||_ K auto-keep
                            |||||__ C event count
                            ||||___ R error rate
                            |||____ S speed/performance
                            ||_____ O updated online
                            |______ P prefailure warning

General Purpose Log Directory Version 1
SMART           Log Directory Version 1 [multi-sector log support]
Address    Access  R/W   Size  Description
0x00       GPL,SL  R/O      1  Log Directory
0x01           SL  R/O      1  Summary SMART error log
0x02           SL  R/O      5  Comprehensive SMART error log
0x03       GPL     R/O      6  Ext. Comprehensive SMART error log
0x06           SL  R/O      1  SMART self-test log
0x07       GPL     R/O      1  Extended self-test log
0x09           SL  R/W      1  Selective self-test log
0x10       GPL     R/O      1  NCQ Command Error log
0x11       GPL     R/O      1  SATA Phy Event Counters log
0x21       GPL     R/O      1  Write stream error log
0x22       GPL     R/O      1  Read stream error log
0x80-0x9f  GPL,SL  R/W     16  Host vendor specific log
0xa0-0xa7  GPL,SL  VS      16  Device vendor specific log
0xa8-0xb7  GPL,SL  VS       1  Device vendor specific log
0xbd       GPL,SL  VS       1  Device vendor specific log
0xc0       GPL,SL  VS       1  Device vendor specific log
0xc1       GPL     VS      93  Device vendor specific log
0xe0       GPL,SL  R/W      1  SCT Command/Status
0xe1       GPL,SL  R/W      1  SCT Data Transfer

SMART Extended Comprehensive Error Log Version: 1 (6 sectors)
Device Error Count: 1640 (device log contains only the most recent 24 errors)
	CR     = Command Register
	FEATR  = Features Register
	COUNT  = Count (was: Sector Count) Register
	LBA_48 = Upper bytes of LBA High/Mid/Low Registers ]  ATA-8
	LH     = LBA High (was: Cylinder High) Register    ]   LBA
	LM     = LBA Mid (was: Cylinder Low) Register      ] Register
	LL     = LBA Low (was: Sector Number) Register     ]
	DV     = Device (was: Device/Head) Register
	DC     = Device Control Register
	ER     = Error register
	ST     = Status register
Powered_Up_Time is measured from power on, and printed as
DDd+hh:mm:SS.sss where DD=days, hh=hours, mm=minutes,
SS=sec, and sss=millisec. It "wraps" after 49.710 days.

Error 1640 [7] occurred at disk power-on lifetime: 62183 hours (2590 days + 23 hours)
  When the command that caused the error occurred, the device was active or idle.

  After command completion occurred, registers were:
  ER -- ST COUNT  LBA_48  LH LM LL DV DC
  -- -- -- == -- == == == -- -- -- -- --
  40 -- 51 00 80 00 01 49 dc 69 d0 e0 00  Error: UNC 128 sectors at LBA = 0x149dc69d0 = 5534149072

  Commands leading to the command that caused the error were:
  CR FEATR COUNT  LBA_48  LH LM LL DV DC  Powered_Up_Time  Command/Feature_Name
  -- == -- == -- == == == -- -- -- -- --  ---------------  --------------------
  25 00 03 00 80 00 01 49 dc 69 80 e0 00     06:32:26.552  READ DMA EXT
  25 00 03 00 80 00 01 49 dc 69 00 e0 00     06:32:23.420  READ DMA EXT
  25 00 03 00 80 00 01 49 dc 68 80 e0 00     06:32:23.419  READ DMA EXT
  25 00 03 00 80 00 01 49 dc 68 00 e0 00     06:32:23.418  READ DMA EXT
  25 00 03 00 80 00 01 49 dc 67 80 e0 00     06:32:23.418  READ DMA EXT

Error 1639 [6] occurred at disk power-on lifetime: 62023 hours (2584 days + 7 hours)
  When the command that caused the error occurred, the device was active or idle.

  After command completion occurred, registers were:
  ER -- ST COUNT  LBA_48  LH LM LL DV DC
  -- -- -- == -- == == == -- -- -- -- --
  40 -- 51 00 00 00 01 5c f7 c2 28 40 00  Error: UNC at LBA = 0x15cf7c228 = 5854708264

  Commands leading to the command that caused the error were:
  CR FEATR COUNT  LBA_48  LH LM LL DV DC  Powered_Up_Time  Command/Feature_Name
  -- == -- == -- == == == -- -- -- -- --  ---------------  --------------------
  60 00 80 00 b0 00 01 5c f7 c1 e8 40 08  9d+05:25:40.647  READ FPDMA QUEUED
  2f 00 00 00 01 00 00 00 00 00 10 40 08  9d+05:25:40.647  READ LOG EXT
  60 00 80 00 a0 00 01 5c f7 c1 e8 40 08  9d+05:25:33.652  READ FPDMA QUEUED
  2f 00 00 00 01 00 00 00 00 00 10 40 08  9d+05:25:33.652  READ LOG EXT
  60 00 80 00 90 00 01 5c f7 c1 e8 40 08  9d+05:25:26.657  READ FPDMA QUEUED

Error 1638 [5] occurred at disk power-on lifetime: 62023 hours (2584 days + 7 hours)
  When the command that caused the error occurred, the device was active or idle.

  After command completion occurred, registers were:
  ER -- ST COUNT  LBA_48  LH LM LL DV DC
  -- -- -- == -- == == == -- -- -- -- --
  40 -- 51 00 00 00 01 5c f7 c2 28 40 00  Error: UNC at LBA = 0x15cf7c228 = 5854708264

  Commands leading to the command that caused the error were:
  CR FEATR COUNT  LBA_48  LH LM LL DV DC  Powered_Up_Time  Command/Feature_Name
  -- == -- == -- == == == -- -- -- -- --  ---------------  --------------------
  60 00 80 00 a0 00 01 5c f7 c1 e8 40 08  9d+05:25:33.652  READ FPDMA QUEUED
  2f 00 00 00 01 00 00 00 00 00 10 40 08  9d+05:25:33.652  READ LOG EXT
  60 00 80 00 90 00 01 5c f7 c1 e8 40 08  9d+05:25:26.657  READ FPDMA QUEUED
  2f 00 00 00 01 00 00 00 00 00 10 40 08  9d+05:25:26.657  READ LOG EXT
  60 00 80 00 80 00 01 5c f7 c1 e8 40 08  9d+05:25:19.662  READ FPDMA QUEUED

Error 1637 [4] occurred at disk power-on lifetime: 62023 hours (2584 days + 7 hours)
  When the command that caused the error occurred, the device was active or idle.

  After command completion occurred, registers were:
  ER -- ST COUNT  LBA_48  LH LM LL DV DC
  -- -- -- == -- == == == -- -- -- -- --
  40 -- 51 00 00 00 01 5c f7 c2 28 40 00  Error: UNC at LBA = 0x15cf7c228 = 5854708264

  Commands leading to the command that caused the error were:
  CR FEATR COUNT  LBA_48  LH LM LL DV DC  Powered_Up_Time  Command/Feature_Name
  -- == -- == -- == == == -- -- -- -- --  ---------------  --------------------
  60 00 80 00 90 00 01 5c f7 c1 e8 40 08  9d+05:25:26.657  READ FPDMA QUEUED
  2f 00 00 00 01 00 00 00 00 00 10 40 08  9d+05:25:26.657  READ LOG EXT
  60 00 80 00 80 00 01 5c f7 c1 e8 40 08  9d+05:25:19.662  READ FPDMA QUEUED
  2f 00 00 00 01 00 00 00 00 00 10 40 08  9d+05:25:19.662  READ LOG EXT
  60 00 80 00 70 00 01 5c f7 c1 e8 40 08  9d+05:25:12.667  READ FPDMA QUEUED

Error 1636 [3] occurred at disk power-on lifetime: 62023 hours (2584 days + 7 hours)
  When the command that caused the error occurred, the device was active or idle.

  After command completion occurred, registers were:
  ER -- ST COUNT  LBA_48  LH LM LL DV DC
  -- -- -- == -- == == == -- -- -- -- --
  40 -- 51 00 00 00 01 5c f7 c2 28 40 00  Error: UNC at LBA = 0x15cf7c228 = 5854708264

  Commands leading to the command that caused the error were:
  CR FEATR COUNT  LBA_48  LH LM LL DV DC  Powered_Up_Time  Command/Feature_Name
  -- == -- == -- == == == -- -- -- -- --  ---------------  --------------------
  60 00 80 00 80 00 01 5c f7 c1 e8 40 08  9d+05:25:19.662  READ FPDMA QUEUED
  2f 00 00 00 01 00 00 00 00 00 10 40 08  9d+05:25:19.662  READ LOG EXT
  60 00 80 00 70 00 01 5c f7 c1 e8 40 08  9d+05:25:12.667  READ FPDMA QUEUED
  60 00 40 00 68 00 01 5c f7 c1 a8 40 08  9d+05:25:12.664  READ FPDMA QUEUED
  60 00 40 00 60 00 01 5c e4 32 a8 40 08  9d+05:25:12.664  READ FPDMA QUEUED

Error 1635 [2] occurred at disk power-on lifetime: 62023 hours (2584 days + 7 hours)
  When the command that caused the error occurred, the device was active or idle.

  After command completion occurred, registers were:
  ER -- ST COUNT  LBA_48  LH LM LL DV DC
  -- -- -- == -- == == == -- -- -- -- --
  40 -- 51 00 00 00 01 5c f7 c2 28 40 00  Error: UNC at LBA = 0x15cf7c228 = 5854708264

  Commands leading to the command that caused the error were:
  CR FEATR COUNT  LBA_48  LH LM LL DV DC  Powered_Up_Time  Command/Feature_Name
  -- == -- == -- == == == -- -- -- -- --  ---------------  --------------------
  60 00 80 00 70 00 01 5c f7 c1 e8 40 08  9d+05:25:12.667  READ FPDMA QUEUED
  60 00 40 00 68 00 01 5c f7 c1 a8 40 08  9d+05:25:12.664  READ FPDMA QUEUED
  60 00 40 00 60 00 01 5c e4 32 a8 40 08  9d+05:25:12.664  READ FPDMA QUEUED
  25 00 00 00 80 00 01 5c e4 32 28 40 08  9d+05:25:12.661  READ DMA EXT
  2f 00 00 00 01 00 00 00 00 00 10 40 08  9d+05:25:12.661  READ LOG EXT

Error 1634 [1] occurred at disk power-on lifetime: 62023 hours (2584 days + 7 hours)
  When the command that caused the error occurred, the device was active or idle.

  After command completion occurred, registers were:
  ER -- ST COUNT  LBA_48  LH LM LL DV DC
  -- -- -- == -- == == == -- -- -- -- --
  40 -- 51 00 00 00 01 5c e4 31 e8 40 00  Error: UNC at LBA = 0x15ce431e8 = 5853426152

  Commands leading to the command that caused the error were:
  CR FEATR COUNT  LBA_48  LH LM LL DV DC  Powered_Up_Time  Command/Feature_Name
  -- == -- == -- == == == -- -- -- -- --  ---------------  --------------------
  60 00 80 00 48 00 01 5c e4 31 a8 40 08  9d+05:25:05.666  READ FPDMA QUEUED
  2f 00 00 00 01 00 00 00 00 00 10 40 08  9d+05:25:05.666  READ LOG EXT
  60 00 80 00 38 00 01 5c e4 31 a8 40 08  9d+05:24:58.671  READ FPDMA QUEUED
  2f 00 00 00 01 00 00 00 00 00 10 40 08  9d+05:24:58.671  READ LOG EXT
  60 00 80 00 28 00 01 5c e4 31 a8 40 08  9d+05:24:51.676  READ FPDMA QUEUED

Error 1633 [0] occurred at disk power-on lifetime: 62023 hours (2584 days + 7 hours)
  When the command that caused the error occurred, the device was active or idle.

  After command completion occurred, registers were:
  ER -- ST COUNT  LBA_48  LH LM LL DV DC
  -- -- -- == -- == == == -- -- -- -- --
  40 -- 51 00 00 00 01 5c e4 31 e8 40 00  Error: UNC at LBA = 0x15ce431e8 = 5853426152

  Commands leading to the command that caused the error were:
  CR FEATR COUNT  LBA_48  LH LM LL DV DC  Powered_Up_Time  Command/Feature_Name
  -- == -- == -- == == == -- -- -- -- --  ---------------  --------------------
  60 00 80 00 38 00 01 5c e4 31 a8 40 08  9d+05:24:58.671  READ FPDMA QUEUED
  2f 00 00 00 01 00 00 00 00 00 10 40 08  9d+05:24:58.671  READ LOG EXT
  60 00 80 00 28 00 01 5c e4 31 a8 40 08  9d+05:24:51.676  READ FPDMA QUEUED
  2f 00 00 00 01 00 00 00 00 00 10 40 08  9d+05:24:51.676  READ LOG EXT
  60 00 80 00 18 00 01 5c e4 31 a8 40 08  9d+05:24:44.681  READ FPDMA QUEUED

SMART Extended Self-test Log Version: 1 (1 sectors)
Num  Test_Description    Status                  Remaining  LifeTime(hours)  LBA_of_first_error
# 1  Extended offline    Completed without error       00%     62017         -
# 2  Short offline       Completed without error       00%     61989         -
# 3  Short offline       Completed without error       00%     40820         -
# 4  Extended offline    Completed without error       00%     23706         -
# 5  Extended offline    Completed without error       00%     15631         -
# 6  Short offline       Completed without error       00%      6180         -

SMART Selective self-test log data structure revision number 1
 SPAN  MIN_LBA  MAX_LBA  CURRENT_TEST_STATUS
    1        0        0  Not_testing
    2        0        0  Not_testing
    3        0        0  Not_testing
    4        0        0  Not_testing
    5        0        0  Not_testing
Selective self-test flags (0x0):
  After scanning selected spans, do NOT read-scan remainder of disk.
If Selective self-test is pending on power-up, resume after 0 minute delay.

SCT Status Version:                  3
SCT Version (vendor specific):       258 (0x0102)
Device State:                        Active (0)
Current Temperature:                    35 Celsius
Power Cycle Min/Max Temperature:     25/43 Celsius
Lifetime    Min/Max Temperature:      2/43 Celsius
Under/Over Temperature Limit Count:   0/0
Vendor specific:
01 00 00 00 00 00 00 00 00 00 00 00 00 00 00 00
00 00 00 00 00 00 00 00 00 00 00 00 00 00 00 00

SCT Temperature History Version:     2
Temperature Sampling Period:         1 minute
Temperature Logging Interval:        1 minute
Min/Max recommended Temperature:      0/60 Celsius
Min/Max Temperature Limit:           -41/85 Celsius
Temperature History Size (Index):    478 (372)

SCT Error Recovery Control:
           Read:     70 (7.0 seconds)
          Write:     70 (7.0 seconds)

Device Statistics (GP/SMART Log 0x04) not supported

Pending Defects log (GP Log 0x0c) not supported

SATA Phy Event Counters (GP Log 0x11)
ID      Size     Value  Description
0x0001  2            0  Command failed due to ICRC error
0x0002  2            0  R_ERR response for data FIS
0x0003  2            0  R_ERR response for device-to-host data FIS
0x0004  2            0  R_ERR response for host-to-device data FIS
0x0005  2            0  R_ERR response for non-data FIS
0x0006  2            0  R_ERR response for device-to-host non-data FIS
0x0007  2            0  R_ERR response for host-to-device non-data FIS
0x0008  2            0  Device-to-host non-data FIS retries
0x0009  2           35  Transition from drive PhyRdy to drive PhyNRdy
0x000a  2           24  Device-to-host register FISes sent due to a COMRESET
0x000b  2            0  CRC errors within host-to-device FIS
0x000f  2            0  R_ERR response for host-to-device data FIS, CRC
0x0012  2            0  R_ERR response for host-to-device non-data FIS, CRC
0x8000  4     22969325  Vendor specific



