smartctl 7.1 2019-12-30 r5022 [FreeBSD 12.1-RELEASE amd64] (local build)
Copyright (C) 2002-19, Bruce Allen, Christian Franke, www.smartmontools.org

=== START OF INFORMATION SECTION ===
Model Family:     Western Digital Red
Device Model:     WDC WD30EFRX-68EUZN0
Serial Number:    --
LU WWN Device Id: 5 0014ee ...
Firmware Version: 82.00A82
User Capacity:    3,000,592,982,016 bytes [3.00 TB]
Sector Sizes:     512 bytes logical, 4096 bytes physical
Rotation Rate:    5400 rpm
Device is:        In smartctl database [for details use: -P show]
ATA Version is:   ACS-2 (minor revision not indicated)
SATA Version is:  SATA 3.0, 6.0 Gb/s (current: 6.0 Gb/s)
Local Time is:    Fri Oct 30 19:03:56 2020 CDT
SMART support is: Available - device has SMART capability.
SMART support is: Enabled
AAM feature is:   Unavailable
APM feature is:   Unavailable
Rd look-ahead is: Enabled
Write cache is:   Enabled
DSN feature is:   Unavailable
ATA Security is:  Disabled, frozen [SEC2]
Wt Cache Reorder: Enabled

=== START OF READ SMART DATA SECTION ===
SMART overall-health self-assessment test result: PASSED

General SMART Values:
Offline data collection status:  (0x00)	Offline data collection activity
					was never started.
					Auto Offline Data Collection: Disabled.
Self-test execution status:      (   0)	The previous self-test routine completed
					without error or no self-test has ever 
					been run.
Total time to complete Offline 
data collection: 		(39120) seconds.
Offline data collection
capabilities: 			 (0x7b) SMART execute Offline immediate.
					Auto Offline data collection on/off support.
					Suspend Offline collection upon new
					command.
					Offline surface scan supported.
					Self-test supported.
					Conveyance Self-test supported.
					Selective Self-test supported.
SMART capabilities:            (0x0003)	Saves SMART data before entering
					power-saving mode.
					Supports SMART auto save timer.
Error logging capability:        (0x01)	Error logging supported.
					General Purpose Logging supported.
Short self-test routine 
recommended polling time: 	 (   2) minutes.
Extended self-test routine
recommended polling time: 	 ( 393) minutes.
Conveyance self-test routine
recommended polling time: 	 (   5) minutes.
SCT capabilities: 	       (0x703d)	SCT Status supported.
					SCT Error Recovery Control supported.
					SCT Feature Control supported.
					SCT Data Table supported.

SMART Attributes Data Structure revision number: 16
Vendor Specific SMART Attributes with Thresholds:
ID# ATTRIBUTE_NAME          FLAGS    VALUE WORST THRESH FAIL RAW_VALUE
  1 Raw_Read_Error_Rate     POSR-K   200   200   051    -    0
  3 Spin_Up_Time            POS--K   186   177   021    -    5666
  4 Start_Stop_Count        -O--CK   100   100   000    -    122
  5 Reallocated_Sector_Ct   PO--CK   200   200   140    -    0
  7 Seek_Error_Rate         -OSR-K   200   200   000    -    0
  9 Power_On_Hours          -O--CK   084   084   000    -    12066
 10 Spin_Retry_Count        -O--CK   100   100   000    -    0
 11 Calibration_Retry_Count -O--CK   100   100   000    -    0
 12 Power_Cycle_Count       -O--CK   100   100   000    -    122
192 Power-Off_Retract_Count -O--CK   200   200   000    -    92
193 Load_Cycle_Count        -O--CK   200   200   000    -    1182
194 Temperature_Celsius     -O---K   119   106   000    -    31
196 Reallocated_Event_Count -O--CK   200   200   000    -    0
197 Current_Pending_Sector  -O--CK   200   200   000    -    0
198 Offline_Uncorrectable   ----CK   100   253   000    -    0
199 UDMA_CRC_Error_Count    -O--CK   200   200   000    -    0
200 Multi_Zone_Error_Rate   ---R--   200   200   000    -    0
                            ||||||_ K auto-keep
                            |||||__ C event count
                            ||||___ R error rate
                            |||____ S speed/performance
                            ||_____ O updated online
                            |______ P prefailure warning

General Purpose Log Directory Version 1
SMART           Log Directory Version 1 [multi-sector log support]
Address    Access  R/W   Size  Description
0x00       GPL,SL  R/O      1  Log Directory
0x01           SL  R/O      1  Summary SMART error log
0x02           SL  R/O      5  Comprehensive SMART error log
0x03       GPL     R/O      6  Ext. Comprehensive SMART error log
0x04       GPL,SL  R/O      8  Device Statistics log
0x06           SL  R/O      1  SMART self-test log
0x07       GPL     R/O      1  Extended self-test log
0x09           SL  R/W      1  Selective self-test log
0x0c       GPL     R/O   2048  Pending Defects log
0x10       GPL     R/O      1  NCQ Command Error log
0x11       GPL     R/O      1  SATA Phy Event Counters log
0x21       GPL     R/O      1  Write stream error log
0x22       GPL     R/O      1  Read stream error log
0x80-0x9f  GPL,SL  R/W     16  Host vendor specific log
0xa0-0xa7  GPL,SL  VS      16  Device vendor specific log
0xa8-0xb7  GPL,SL  VS       1  Device vendor specific log
0xbd       GPL,SL  VS       1  Device vendor specific log
0xc0       GPL,SL  VS       1  Device vendor specific log
0xc1       GPL     VS      93  Device vendor specific log
0xe0       GPL,SL  R/W      1  SCT Command/Status
0xe1       GPL,SL  R/W      1  SCT Data Transfer

SMART Extended Comprehensive Error Log Version: 1 (6 sectors)
Device Error Count: 19
	CR     = Command Register
	FEATR  = Features Register
	COUNT  = Count (was: Sector Count) Register
	LBA_48 = Upper bytes of LBA High/Mid/Low Registers ]  ATA-8
	LH     = LBA High (was: Cylinder High) Register    ]   LBA
	LM     = LBA Mid (was: Cylinder Low) Register      ] Register
	LL     = LBA Low (was: Sector Number) Register     ]
	DV     = Device (was: Device/Head) Register
	DC     = Device Control Register
	ER     = Error register
	ST     = Status register
Powered_Up_Time is measured from power on, and printed as
DDd+hh:mm:SS.sss where DD=days, hh=hours, mm=minutes,
SS=sec, and sss=millisec. It "wraps" after 49.710 days.

Error 19 [18] occurred at disk power-on lifetime: 11287 hours (470 days + 7 hours)
  When the command that caused the error occurred, the device was active or idle.

  After command completion occurred, registers were:
  ER -- ST COUNT  LBA_48  LH LM LL DV DC
  -- -- -- == -- == == == -- -- -- -- --
  40 -- 51 00 00 00 00 00 00 08 00 40 00  Error: UNC at LBA = 0x00000800 = 2048

  Commands leading to the command that caused the error were:
  CR FEATR COUNT  LBA_48  LH LM LL DV DC  Powered_Up_Time  Command/Feature_Name
  -- == -- == -- == == == -- -- -- -- --  ---------------  --------------------
  60 01 00 00 90 00 00 00 00 08 00 40 08     00:02:50.817  READ FPDMA QUEUED
  60 01 00 00 88 00 00 00 00 00 00 40 08     00:02:50.817  READ FPDMA QUEUED
  60 00 08 00 d8 00 00 02 00 29 30 40 08     00:02:43.038  READ FPDMA QUEUED
  60 00 08 00 c8 00 00 04 01 00 c8 40 08     00:02:43.029  READ FPDMA QUEUED
  60 00 08 00 28 00 00 02 00 2a a8 40 08     00:02:43.023  READ FPDMA QUEUED

Error 18 [17] occurred at disk power-on lifetime: 11244 hours (468 days + 12 hours)
  When the command that caused the error occurred, the device was active or idle.

  After command completion occurred, registers were:
  ER -- ST COUNT  LBA_48  LH LM LL DV DC
  -- -- -- == -- == == == -- -- -- -- --
  40 -- 51 00 00 00 00 00 00 08 00 40 00  Error: UNC at LBA = 0x00000800 = 2048

  Commands leading to the command that caused the error were:
  CR FEATR COUNT  LBA_48  LH LM LL DV DC  Powered_Up_Time  Command/Feature_Name
  -- == -- == -- == == == -- -- -- -- --  ---------------  --------------------
  60 01 00 00 b8 00 00 00 00 08 00 40 08     00:01:35.676  READ FPDMA QUEUED
  60 01 00 00 b0 00 00 00 00 00 00 40 08     00:01:35.676  READ FPDMA QUEUED
  60 00 08 00 30 00 00 08 00 29 48 40 08     00:01:27.880  READ FPDMA QUEUED
  60 00 08 00 28 00 00 08 00 29 38 40 08     00:01:27.869  READ FPDMA QUEUED
  60 00 08 00 20 00 00 02 00 29 30 40 08     00:01:27.869  READ FPDMA QUEUED

Error 17 [16] occurred at disk power-on lifetime: 10485 hours (436 days + 21 hours)
  When the command that caused the error occurred, the device was doing SMART Offline or Self-test.

  After command completion occurred, registers were:
  ER -- ST COUNT  LBA_48  LH LM LL DV DC
  -- -- -- == -- == == == -- -- -- -- --
  40 -- 51 00 00 00 00 00 00 00 00 40 00  Error: UNC at LBA = 0x00000000 = 0

  Commands leading to the command that caused the error were:
  CR FEATR COUNT  LBA_48  LH LM LL DV DC  Powered_Up_Time  Command/Feature_Name
  -- == -- == -- == == == -- -- -- -- --  ---------------  --------------------
  60 01 00 00 00 00 00 00 00 00 00 40 00     12:45:27.592  READ FPDMA QUEUED
  60 01 00 00 00 00 00 00 10 08 00 40 00     12:45:17.508  READ FPDMA QUEUED
  60 01 00 00 08 00 00 00 00 08 00 40 00     12:45:17.508  READ FPDMA QUEUED
  60 01 00 00 00 00 00 00 00 00 00 40 00     12:45:17.508  READ FPDMA QUEUED
  60 01 00 00 00 00 00 00 10 08 00 40 00     12:45:17.439  READ FPDMA QUEUED

Error 16 [15] occurred at disk power-on lifetime: 10472 hours (436 days + 8 hours)
  When the command that caused the error occurred, the device was active or idle.

  After command completion occurred, registers were:
  ER -- ST COUNT  LBA_48  LH LM LL DV DC
  -- -- -- == -- == == == -- -- -- -- --
  10 -- 51 00 00 00 01 36 20 71 08 00 00  Error: IDNF at LBA = 0x136207108 = 5203063048

  Commands leading to the command that caused the error were:
  CR FEATR COUNT  LBA_48  LH LM LL DV DC  Powered_Up_Time  Command/Feature_Name
  -- == -- == -- == == == -- -- -- -- --  ---------------  --------------------
  61 00 08 00 00 00 01 36 20 71 08 40 00     00:33:50.608  WRITE FPDMA QUEUED
  ea 00 00 00 00 00 00 00 00 00 00 40 00     00:33:46.617  FLUSH CACHE EXT
  61 00 08 00 18 00 01 5d 50 a1 50 40 00     00:33:46.617  WRITE FPDMA QUEUED
  61 00 08 00 10 00 01 5d 50 9f 50 40 00     00:33:46.617  WRITE FPDMA QUEUED
  61 00 08 00 08 00 00 00 10 0b 50 40 00     00:33:46.617  WRITE FPDMA QUEUED

Error 15 [14] occurred at disk power-on lifetime: 10233 hours (426 days + 9 hours)
  When the command that caused the error occurred, the device was active or idle.

  After command completion occurred, registers were:
  ER -- ST COUNT  LBA_48  LH LM LL DV DC
  -- -- -- == -- == == == -- -- -- -- --
  10 -- 51 00 00 00 00 de 19 dc d8 40 00  Error: IDNF at LBA = 0xde19dcd8 = 3726236888

  Commands leading to the command that caused the error were:
  CR FEATR COUNT  LBA_48  LH LM LL DV DC  Powered_Up_Time  Command/Feature_Name
  -- == -- == -- == == == -- -- -- -- --  ---------------  --------------------
  61 07 b0 00 00 00 00 de 19 dc d8 40 00     00:21:23.702  WRITE FPDMA QUEUED
  61 07 d0 00 08 00 00 de 19 d5 08 40 00     00:21:23.700  WRITE FPDMA QUEUED
  61 01 00 00 00 00 00 de 19 5f 18 40 00     00:21:23.699  WRITE FPDMA QUEUED
  61 01 00 00 10 00 00 de 19 5b f0 40 00     00:21:23.698  WRITE FPDMA QUEUED
  61 02 00 00 08 00 00 de 19 59 80 40 00     00:21:23.698  WRITE FPDMA QUEUED

Error 14 [13] occurred at disk power-on lifetime: 10232 hours (426 days + 8 hours)
  When the command that caused the error occurred, the device was active or idle.

  After command completion occurred, registers were:
  ER -- ST COUNT  LBA_48  LH LM LL DV DC
  -- -- -- == -- == == == -- -- -- -- --
  10 -- 51 00 00 00 01 24 14 65 78 40 00  Error: IDNF at LBA = 0x124146578 = 4900283768

  Commands leading to the command that caused the error were:
  CR FEATR COUNT  LBA_48  LH LM LL DV DC  Powered_Up_Time  Command/Feature_Name
  -- == -- == -- == == == -- -- -- -- --  ---------------  --------------------
  61 07 d0 00 08 00 01 24 14 65 78 40 00     00:17:08.913  WRITE FPDMA QUEUED
  61 07 80 00 00 00 01 24 14 5d f8 40 00     00:17:08.911  WRITE FPDMA QUEUED
  61 07 b0 00 08 00 01 24 14 56 48 40 00     00:17:08.908  WRITE FPDMA QUEUED
  61 04 d0 00 00 00 01 24 14 51 00 40 00     00:17:08.901  WRITE FPDMA QUEUED
  61 07 c8 00 08 00 01 24 14 49 38 40 00     00:17:08.890  WRITE FPDMA QUEUED

Error 13 [12] occurred at disk power-on lifetime: 10232 hours (426 days + 8 hours)
  When the command that caused the error occurred, the device was active or idle.

  After command completion occurred, registers were:
  ER -- ST COUNT  LBA_48  LH LM LL DV DC
  -- -- -- == -- == == == -- -- -- -- --
  10 -- 51 00 00 00 01 36 17 6a 78 40 00  Error: IDNF at LBA = 0x136176a78 = 5202471544

  Commands leading to the command that caused the error were:
  CR FEATR COUNT  LBA_48  LH LM LL DV DC  Powered_Up_Time  Command/Feature_Name
  -- == -- == -- == == == -- -- -- -- --  ---------------  --------------------
  61 08 00 00 00 00 01 36 17 6a 78 40 00     00:14:31.510  WRITE FPDMA QUEUED
  61 08 00 00 08 00 01 36 17 62 78 40 00     00:14:31.485  WRITE FPDMA QUEUED
  61 08 00 00 00 00 01 36 17 5a 78 40 00     00:14:31.484  WRITE FPDMA QUEUED
  61 08 00 00 08 00 01 36 17 52 78 40 00     00:14:31.481  WRITE FPDMA QUEUED
  61 08 00 00 00 00 01 36 17 4a 78 40 00     00:14:31.479  WRITE FPDMA QUEUED

Error 12 [11] occurred at disk power-on lifetime: 10232 hours (426 days + 8 hours)
  When the command that caused the error occurred, the device was active or idle.

  After command completion occurred, registers were:
  ER -- ST COUNT  LBA_48  LH LM LL DV DC
  -- -- -- == -- == == == -- -- -- -- --
  40 -- 51 00 00 00 00 cc 25 96 a8 40 00  Error: WP at LBA = 0xcc2596a8 = 3425015464

  Commands leading to the command that caused the error were:
  CR FEATR COUNT  LBA_48  LH LM LL DV DC  Powered_Up_Time  Command/Feature_Name
  -- == -- == -- == == == -- -- -- -- --  ---------------  --------------------
  61 08 00 00 10 00 01 36 16 63 e8 40 00     00:14:07.616  WRITE FPDMA QUEUED
  61 08 00 00 10 00 01 36 16 5b e8 40 00     00:14:07.613  WRITE FPDMA QUEUED
  61 08 00 00 10 00 01 36 16 53 e8 40 00     00:14:07.611  WRITE FPDMA QUEUED
  61 05 00 00 10 00 01 36 16 47 d0 40 00     00:14:07.609  WRITE FPDMA QUEUED
  61 01 00 00 10 00 01 36 16 3e c8 40 00     00:14:07.608  WRITE FPDMA QUEUED

SMART Extended Self-test Log Version: 1 (1 sectors)
Num  Test_Description    Status                  Remaining  LifeTime(hours)  LBA_of_first_error
# 1  Extended offline    Completed without error       00%     10492         -
# 2  Extended offline    Completed without error       00%     10229         -
# 3  Extended offline    Interrupted (host reset)      90%     10211         -
# 4  Short offline       Completed without error       00%     10211         -

SMART Selective self-test log data structure revision number 1
 SPAN  MIN_LBA  MAX_LBA  CURRENT_TEST_STATUS
    1        0        0  Not_testing
    2        0        0  Not_testing
    3        0        0  Not_testing
    4        0        0  Not_testing
    5        0        0  Not_testing
Selective self-test flags (0x0):
  After scanning selected spans, do NOT read-scan remainder of disk.
If Selective self-test is pending on power-up, resume after 0 minute delay.

SCT Status Version:                  3
SCT Version (vendor specific):       258 (0x0102)
Device State:                        Active (0)
Current Temperature:                    31 Celsius
Power Cycle Min/Max Temperature:     27/35 Celsius
Lifetime    Min/Max Temperature:      2/44 Celsius
Under/Over Temperature Limit Count:   0/0
Vendor specific:
01 00 00 00 00 00 00 00 00 00 00 00 00 00 00 00
00 00 00 00 00 00 00 00 00 00 00 00 00 00 00 00

SCT Temperature History Version:     2
Temperature Sampling Period:         1 minute
Temperature Logging Interval:        1 minute
Min/Max recommended Temperature:      0/60 Celsius
Min/Max Temperature Limit:           -41/85 Celsius
Temperature History Size (Index):    478 (254)

SCT Error Recovery Control:
           Read:     70 (7.0 seconds)
          Write:     70 (7.0 seconds)

Device Statistics (GP Log 0x04)
Page  Offset Size        Value Flags Description
0x01  =====  =               =  ===  == General Statistics (rev 2) ==
0x01  0x008  4             122  ---  Lifetime Power-On Resets
0x01  0x010  4           12066  ---  Power-on Hours
0x01  0x018  6     43138724687  ---  Logical Sectors Written
0x01  0x020  6       737173259  ---  Number of Write Commands
0x01  0x028  6     47951230455  ---  Logical Sectors Read
0x01  0x030  6        87634354  ---  Number of Read Commands
0x03  =====  =               =  ===  == Rotating Media Statistics (rev 1) ==
0x03  0x008  4           11789  ---  Spindle Motor Power-on Hours
0x03  0x010  4           11362  ---  Head Flying Hours
0x03  0x018  4            1275  ---  Head Load Events
0x03  0x020  4               0  ---  Number of Reallocated Logical Sectors
0x03  0x028  4              19  ---  Read Recovery Attempts
0x03  0x030  4               0  ---  Number of Mechanical Start Failures
0x04  =====  =               =  ===  == General Errors Statistics (rev 1) ==
0x04  0x008  4              19  ---  Number of Reported Uncorrectable Errors
0x04  0x010  4         1376277  ---  Resets Between Cmd Acceptance and Completion
0x05  =====  =               =  ===  == Temperature Statistics (rev 1) ==
0x05  0x008  1              30  ---  Current Temperature
0x05  0x010  1              27  ---  Average Short Term Temperature
0x05  0x018  1              30  ---  Average Long Term Temperature
0x05  0x020  1              43  ---  Highest Temperature
0x05  0x028  1              21  ---  Lowest Temperature
0x05  0x030  1              40  ---  Highest Average Short Term Temperature
0x05  0x038  1              23  ---  Lowest Average Short Term Temperature
0x05  0x040  1              32  ---  Highest Average Long Term Temperature
0x05  0x048  1              28  ---  Lowest Average Long Term Temperature
0x05  0x050  4               0  ---  Time in Over-Temperature
0x05  0x058  1              60  ---  Specified Maximum Operating Temperature
0x05  0x060  4               0  ---  Time in Under-Temperature
0x05  0x068  1               0  ---  Specified Minimum Operating Temperature
0x06  =====  =               =  ===  == Transport Statistics (rev 1) ==
0x06  0x008  4             657  ---  Number of Hardware Resets
0x06  0x010  4          495513  ---  Number of ASR Events
0x06  0x018  4               0  ---  Number of Interface CRC Errors
                                |||_ C monitored condition met
                                ||__ D supports DSN
                                |___ N normalized value

Pending Defects log (GP Log 0x0c)
No Defects Logged

SATA Phy Event Counters (GP Log 0x11)
ID      Size     Value  Description
0x0001  2            0  Command failed due to ICRC error
0x0002  2            0  R_ERR response for data FIS
0x0003  2            0  R_ERR response for device-to-host data FIS
0x0004  2            0  R_ERR response for host-to-device data FIS
0x0005  2            0  R_ERR response for non-data FIS
0x0006  2            0  R_ERR response for device-to-host non-data FIS
0x0007  2            0  R_ERR response for host-to-device non-data FIS
0x0008  2            0  Device-to-host non-data FIS retries
0x0009  2            3  Transition from drive PhyRdy to drive PhyNRdy
0x000a  2            4  Device-to-host register FISes sent due to a COMRESET
0x000b  2            0  CRC errors within host-to-device FIS
0x000f  2            0  R_ERR response for host-to-device data FIS, CRC
0x0012  2            0  R_ERR response for host-to-device non-data FIS, CRC
0x8000  4       535880  Vendor specific



