smartctl 7.5 2025-04-30 r5714 [FreeBSD 14.2-RELEASE-p5 amd64] (local build)
Copyright (C) 2002-25, Bruce Allen, Christian Franke, www.smartmontools.org

=== START OF INFORMATION SECTION ===
Model Family:     Western Digital Gold
Device Model:     WDC WD1005FBYZ-01YCBB3
Serial Number:    --
LU WWN Device Id: 5 0014ee ...
Firmware Version: RR09
User Capacity:    1,000,204,886,016 bytes [1.00 TB]
Sector Size:      512 bytes logical/physical
Rotation Rate:    7200 rpm
Form Factor:      3.5 inches
Device is:        In smartctl database 7.5/5706
ATA Version is:   ACS-3 T13/2161-D revision 5
SATA Version is:  SATA 3.1, 6.0 Gb/s (current: 6.0 Gb/s)
Local Time is:    Sun Oct 12 08:59:34 2025 CEST
SMART support is: Available - device has SMART capability.
SMART support is: Enabled
AAM feature is:   Unavailable
APM level is:     96 (intermediate level with standby)
Rd look-ahead is: Enabled
Write cache is:   Enabled
DSN feature is:   Disabled
ATA Security is:  Disabled, frozen [SEC2]

=== START OF READ SMART DATA SECTION ===
SMART overall-health self-assessment test result: PASSED

General SMART Values:
Offline data collection status:  (0x00)	Offline data collection activity
					was never started.
					Auto Offline Data Collection: Disabled.
Self-test execution status:      (   0)	The previous self-test routine completed
					without error or no self-test has ever 
					been run.
Total time to complete Offline 
data collection: 		(    0) seconds.
Offline data collection
capabilities: 			 (0x7b) SMART execute Offline immediate.
					Auto Offline data collection on/off support.
					Suspend Offline collection upon new
					command.
					Offline surface scan supported.
					Self-test supported.
					Conveyance Self-test supported.
					Selective Self-test supported.
SMART capabilities:            (0x0003)	Saves SMART data before entering
					power-saving mode.
					Supports SMART auto save timer.
Error logging capability:        (0x01)	Error logging supported.
					General Purpose Logging supported.
Short self-test routine 
recommended polling time: 	 (   2) minutes.
Extended self-test routine
recommended polling time: 	 ( 110) minutes.
Conveyance self-test routine
recommended polling time: 	 (   5) minutes.
SCT capabilities: 	       (0x203d)	SCT Status supported.
					SCT Error Recovery Control supported.
					SCT Feature Control supported.
					SCT Data Table supported.

SMART Attributes Data Structure revision number: 16
Vendor Specific SMART Attributes with Thresholds:
ID# ATTRIBUTE_NAME          FLAGS    VALUE WORST THRESH FAIL RAW_VALUE
  1 Raw_Read_Error_Rate     POSR-K   200   200   051    -    0
  3 Spin_Up_Time            POS--K   143   143   021    -    3825
  4 Start_Stop_Count        -O--CK   100   100   000    -    75
  5 Reallocated_Sector_Ct   PO--CK   200   200   140    -    0
  7 Seek_Error_Rate         -OSR-K   100   253   000    -    0
  9 Power_On_Hours          -O--CK   091   091   000    -    7049
 10 Spin_Retry_Count        -O--CK   100   253   000    -    0
 11 Calibration_Retry_Count -O--CK   100   253   000    -    0
 12 Power_Cycle_Count       -O--CK   100   100   000    -    75
 16 Unknown_Attribute       -O---K   000   200   000    -    16922581864
183 Runtime_Bad_Block       -O--CK   100   100   000    -    0
192 Power-Off_Retract_Count -O--CK   200   200   000    -    14
193 Load_Cycle_Count        -O--CK   200   200   000    -    105
194 Temperature_Celsius     -O---K   111   094   000    -    32
196 Reallocated_Event_Count -O--CK   200   200   000    -    0
197 Current_Pending_Sector  -O--CK   200   200   000    -    0
198 Offline_Uncorrectable   ----CK   100   253   000    -    0
199 UDMA_CRC_Error_Count    -O--CK   200   200   000    -    0
200 Multi_Zone_Error_Rate   ---R--   100   253   000    -    0
                            ||||||_ K auto-keep
                            |||||__ C event count
                            ||||___ R error rate
                            |||____ S speed/performance
                            ||_____ O updated online
                            |______ P prefailure warning

General Purpose Log Directory Version 1
SMART           Log Directory Version 1 [multi-sector log support]
Address    Access  R/W   Size  Description
0x00       GPL,SL  R/O      1  Log Directory
0x01           SL  R/O      1  Summary SMART error log
0x02           SL  R/O      5  Comprehensive SMART error log
0x03       GPL     R/O      6  Ext. Comprehensive SMART error log
0x04       GPL,SL  R/O      8  Device Statistics log
0x06           SL  R/O      1  SMART self-test log
0x07       GPL     R/O      1  Extended self-test log
0x08       GPL     R/O      2  Power Conditions log
0x09           SL  R/W      1  Selective self-test log
0x0a       GPL     R/W      8  Device Statistics Notification
0x0c       GPL     R/O    113  Pending Defects log
0x0d       GPL,SL  R/O      8  LPS Mis-alignment log
0x10       GPL     R/O      1  NCQ Command Error log
0x11       GPL     R/O      1  SATA Phy Event Counters log
0x13       GPL     R/O      1  SATA NCQ Send and Receive log
0x24       GPL     R/O    192  Current Device Internal Status Data log
0x30       GPL,SL  R/O      9  IDENTIFY DEVICE data log
0x80-0x9f  GPL,SL  R/W     16  Host vendor specific log
0xa0-0xb6  GPL,SL  VS      16  Device vendor specific log
0xb7       GPL,SL  VS      39  Device vendor specific log
0xc0       GPL,SL  VS       1  Device vendor specific log
0xe0       GPL,SL  R/W      1  SCT Command/Status
0xe1       GPL,SL  R/W      1  SCT Data Transfer

SMART Extended Comprehensive Error Log Version: 1 (6 sectors)
Device Error Count: 558 (device log contains only the most recent 24 errors)
	CR     = Command Register
	FEATR  = Features Register
	COUNT  = Count (was: Sector Count) Register
	LBA_48 = Upper bytes of LBA High/Mid/Low Registers ]  ATA-8
	LH     = LBA High (was: Cylinder High) Register    ]   LBA
	LM     = LBA Mid (was: Cylinder Low) Register      ] Register
	LL     = LBA Low (was: Sector Number) Register     ]
	DV     = Device (was: Device/Head) Register
	DC     = Device Control Register
	ER     = Error register
	ST     = Status register
Powered_Up_Time is measured from power on, and printed as
DDd+hh:mm:SS.sss where DD=days, hh=hours, mm=minutes,
SS=sec, and sss=millisec. It "wraps" after 49.710 days.

Error 558 [5] occurred at disk power-on lifetime: 5335 hours (222 days + 7 hours)
  When the command that caused the error occurred, the device was active or idle.

  After command completion occurred, registers were:
  ER -- ST COUNT  LBA_48  LH LM LL DV DC
  -- -- -- == -- == == == -- -- -- -- --
  04 -- 51 00 01 01 00 00 00 00 00 40 00  Error: ABRT

  Commands leading to the command that caused the error were:
  CR FEATR COUNT  LBA_48  LH LM LL DV DC  Powered_Up_Time  Command/Feature_Name
  -- == -- == -- == == == -- -- -- -- --  ---------------  --------------------
  a1 00 00 00 01 00 00 00 00 00 00 40 08  4d+12:19:35.337  IDENTIFY PACKET DEVICE
  ec 00 00 00 01 00 00 00 00 00 00 40 08  4d+12:19:35.337  IDENTIFY DEVICE
  a1 00 00 00 01 00 00 00 00 00 00 40 08  4d+12:15:33.166  IDENTIFY PACKET DEVICE
  ec 00 00 00 01 00 00 00 00 00 00 40 08  4d+12:15:33.165  IDENTIFY DEVICE
  a0 00 01 00 00 00 00 00 00 00 00 40 08  4d+12:11:21.035  PACKET

Error 557 [4] occurred at disk power-on lifetime: 5335 hours (222 days + 7 hours)
  When the command that caused the error occurred, the device was active or idle.

  After command completion occurred, registers were:
  ER -- ST COUNT  LBA_48  LH LM LL DV DC
  -- -- -- == -- == == == -- -- -- -- --
  04 -- 51 00 01 01 00 00 00 00 00 40 00  Error: ABRT

  Commands leading to the command that caused the error were:
  CR FEATR COUNT  LBA_48  LH LM LL DV DC  Powered_Up_Time  Command/Feature_Name
  -- == -- == -- == == == -- -- -- -- --  ---------------  --------------------
  a1 00 00 00 01 00 00 00 00 00 00 40 08  4d+12:15:33.166  IDENTIFY PACKET DEVICE
  ec 00 00 00 01 00 00 00 00 00 00 40 08  4d+12:15:33.165  IDENTIFY DEVICE
  a0 00 01 00 00 00 00 00 00 00 00 40 08  4d+12:11:21.035  PACKET
  60 00 01 00 a0 00 00 74 70 67 ff 40 08  4d+12:11:21.032  READ FPDMA QUEUED
  a0 00 01 00 00 00 00 00 00 00 00 40 08  4d+12:11:21.030  PACKET

Error 556 [3] occurred at disk power-on lifetime: 5335 hours (222 days + 7 hours)
  When the command that caused the error occurred, the device was active or idle.

  After command completion occurred, registers were:
  ER -- ST COUNT  LBA_48  LH LM LL DV DC
  -- -- -- == -- == == == -- -- -- -- --
  04 -- 51 00 00 00 00 01 00 00 00 40 00  Error: ABRT

  Commands leading to the command that caused the error were:
  CR FEATR COUNT  LBA_48  LH LM LL DV DC  Powered_Up_Time  Command/Feature_Name
  -- == -- == -- == == == -- -- -- -- --  ---------------  --------------------
  a0 00 01 00 00 00 00 00 00 00 00 40 08  4d+12:11:21.035  PACKET
  60 00 01 00 a0 00 00 74 70 67 ff 40 08  4d+12:11:21.032  READ FPDMA QUEUED
  a0 00 01 00 00 00 00 00 00 00 00 40 08  4d+12:11:21.030  PACKET
  60 00 01 00 90 00 00 01 08 28 00 40 08  4d+12:11:21.027  READ FPDMA QUEUED
  a0 00 01 00 00 00 00 00 00 00 00 40 08  4d+12:11:21.024  PACKET

Error 555 [2] occurred at disk power-on lifetime: 5335 hours (222 days + 7 hours)
  When the command that caused the error occurred, the device was active or idle.

  After command completion occurred, registers were:
  ER -- ST COUNT  LBA_48  LH LM LL DV DC
  -- -- -- == -- == == == -- -- -- -- --
  04 -- 51 00 00 00 00 01 00 00 00 40 00  Error: ABRT

  Commands leading to the command that caused the error were:
  CR FEATR COUNT  LBA_48  LH LM LL DV DC  Powered_Up_Time  Command/Feature_Name
  -- == -- == -- == == == -- -- -- -- --  ---------------  --------------------
  a0 00 01 00 00 00 00 00 00 00 00 40 08  4d+12:11:17.227  PACKET
  a0 00 01 00 00 00 00 00 00 00 00 40 08  4d+12:11:17.225  PACKET
  a0 00 01 00 00 00 00 00 00 00 00 40 08  4d+12:11:17.222  PACKET
  a0 00 01 00 00 00 00 00 00 00 00 40 08  4d+12:11:17.220  PACKET
  a0 00 01 00 00 00 00 00 00 00 00 40 08  4d+12:11:17.217  PACKET

Error 554 [1] occurred at disk power-on lifetime: 5335 hours (222 days + 7 hours)
  When the command that caused the error occurred, the device was active or idle.

  After command completion occurred, registers were:
  ER -- ST COUNT  LBA_48  LH LM LL DV DC
  -- -- -- == -- == == == -- -- -- -- --
  04 -- 51 00 00 00 00 00 00 00 00 40 00

  Commands leading to the command that caused the error were:
  CR FEATR COUNT  LBA_48  LH LM LL DV DC  Powered_Up_Time  Command/Feature_Name
  -- == -- == -- == == == -- -- -- -- --  ---------------  --------------------
  e1 00 00 00 00 00 00 00 00 00 00 40 08  4d+12:09:04.725  IDLE IMMEDIATE
  e5 00 00 00 00 00 00 00 00 00 00 40 08  4d+12:09:04.724  CHECK POWER MODE
  ea 00 00 00 00 00 00 00 00 00 00 40 08  4d+12:09:03.322  FLUSH CACHE EXT
  ea 00 00 00 00 00 00 00 00 00 00 40 08  4d+12:09:03.321  FLUSH CACHE EXT
  a1 00 00 00 01 00 00 00 00 00 00 40 08  4d+12:08:16.930  IDENTIFY PACKET DEVICE

Error 553 [0] occurred at disk power-on lifetime: 5335 hours (222 days + 7 hours)
  When the command that caused the error occurred, the device was active or idle.

  After command completion occurred, registers were:
  ER -- ST COUNT  LBA_48  LH LM LL DV DC
  -- -- -- == -- == == == -- -- -- -- --
  04 -- 51 00 00 00 00 00 00 00 00 40 00

  Commands leading to the command that caused the error were:
  CR FEATR COUNT  LBA_48  LH LM LL DV DC  Powered_Up_Time  Command/Feature_Name
  -- == -- == -- == == == -- -- -- -- --  ---------------  --------------------
  ea 00 00 00 00 00 00 00 00 00 00 40 08  4d+12:09:03.322  FLUSH CACHE EXT
  ea 00 00 00 00 00 00 00 00 00 00 40 08  4d+12:09:03.321  FLUSH CACHE EXT
  a1 00 00 00 01 00 00 00 00 00 00 40 08  4d+12:08:16.930  IDENTIFY PACKET DEVICE
  ec 00 00 00 01 00 00 00 00 00 00 40 08  4d+12:08:16.930  IDENTIFY DEVICE
  a1 00 00 00 01 00 00 00 00 00 00 40 08  4d+12:04:22.763  IDENTIFY PACKET DEVICE

Error 552 [23] occurred at disk power-on lifetime: 5334 hours (222 days + 6 hours)
  When the command that caused the error occurred, the device was active or idle.

  After command completion occurred, registers were:
  ER -- ST COUNT  LBA_48  LH LM LL DV DC
  -- -- -- == -- == == == -- -- -- -- --
  04 -- 51 00 01 01 00 00 00 00 00 40 00  Error: ABRT

  Commands leading to the command that caused the error were:
  CR FEATR COUNT  LBA_48  LH LM LL DV DC  Powered_Up_Time  Command/Feature_Name
  -- == -- == -- == == == -- -- -- -- --  ---------------  --------------------
  a1 00 00 00 01 00 00 00 00 00 00 40 08  4d+12:08:16.930  IDENTIFY PACKET DEVICE
  ec 00 00 00 01 00 00 00 00 00 00 40 08  4d+12:08:16.930  IDENTIFY DEVICE
  a1 00 00 00 01 00 00 00 00 00 00 40 08  4d+12:04:22.763  IDENTIFY PACKET DEVICE
  ec 00 00 00 01 00 00 00 00 00 00 40 08  4d+12:04:22.762  IDENTIFY DEVICE
  a1 00 00 00 01 00 00 00 00 00 00 40 08  4d+11:58:40.416  IDENTIFY PACKET DEVICE

Error 551 [22] occurred at disk power-on lifetime: 5334 hours (222 days + 6 hours)
  When the command that caused the error occurred, the device was active or idle.

  After command completion occurred, registers were:
  ER -- ST COUNT  LBA_48  LH LM LL DV DC
  -- -- -- == -- == == == -- -- -- -- --
  04 -- 51 00 01 01 00 00 00 00 00 40 00  Error: ABRT

  Commands leading to the command that caused the error were:
  CR FEATR COUNT  LBA_48  LH LM LL DV DC  Powered_Up_Time  Command/Feature_Name
  -- == -- == -- == == == -- -- -- -- --  ---------------  --------------------
  a1 00 00 00 01 00 00 00 00 00 00 40 08  4d+12:04:22.763  IDENTIFY PACKET DEVICE
  ec 00 00 00 01 00 00 00 00 00 00 40 08  4d+12:04:22.762  IDENTIFY DEVICE
  a1 00 00 00 01 00 00 00 00 00 00 40 08  4d+11:58:40.416  IDENTIFY PACKET DEVICE
  ec 00 00 00 01 00 00 00 00 00 00 40 08  4d+11:58:40.415  IDENTIFY DEVICE
  a1 00 00 00 01 00 00 00 00 00 00 40 08  4d+11:58:02.931  IDENTIFY PACKET DEVICE

SMART Extended Self-test Log Version: 1 (1 sectors)
Num  Test_Description    Status                  Remaining  LifeTime(hours)  LBA_of_first_error
# 1  Extended offline    Completed without error       00%      5228         -

SMART Selective self-test log data structure revision number 1
 SPAN  MIN_LBA  MAX_LBA  CURRENT_TEST_STATUS
    1        0        0  Not_testing
    2        0        0  Not_testing
    3        0        0  Not_testing
    4        0        0  Not_testing
    5        0        0  Not_testing
Selective self-test flags (0x0):
  After scanning selected spans, do NOT read-scan remainder of disk.
If Selective self-test is pending on power-up, resume after 0 minute delay.

SCT Status Version:                  3
SCT Version (vendor specific):       258 (0x0102)
Device State:                        Active (0)
Current Temperature:                    32 Celsius
Power Cycle Min/Max Temperature:     30/36 Celsius
Lifetime    Min/Max Temperature:     23/49 Celsius
Specified Max Operating Temperature:    60 Celsius
Under/Over Temperature Limit Count:   0/0
Vendor specific:
01 00 00 00 00 00 00 00 00 00 00 00 00 00 00 00
00 00 00 00 00 00 00 00 00 00 00 00 00 00 00 00

SCT Temperature History Version:     2
Temperature Sampling Period:         1 minute
Temperature Logging Interval:        1 minute
Min/Max recommended Temperature:      0/60 Celsius
Min/Max Temperature Limit:           -41/85 Celsius
Temperature History Size (Index):    478 (402)

SCT Error Recovery Control:
           Read:     70 (7.0 seconds)
          Write:     70 (7.0 seconds)

Device Statistics (GP Log 0x04)
Page  Offset Size        Value Flags Description
0x01  =====  =               =  ===  == General Statistics (rev 1) ==
0x01  0x008  4              75  -D-  Lifetime Power-On Resets
0x01  0x010  4            7049  -D-  Power-on Hours
0x01  0x018  6     16762122262  -D-  Logical Sectors Written
0x01  0x020  6        96792381  -D-  Number of Write Commands
0x01  0x028  6       160464786  -D-  Logical Sectors Read
0x01  0x030  6         4387927  -D-  Number of Read Commands
0x01  0x038  6      3901563520  -D-  Date and Time TimeStamp
0x01  0x048  2              31  ND-  Workload Utilization
0x03  =====  =               =  ===  == Rotating Media Statistics (rev 1) ==
0x03  0x008  4            7049  -D-  Spindle Motor Power-on Hours
0x03  0x010  4            5197  -D-  Head Flying Hours
0x03  0x018  4             120  -D-  Head Load Events
0x03  0x020  4               0  -D-  Number of Reallocated Logical Sectors
0x03  0x028  4               0  -D-  Read Recovery Attempts
0x03  0x030  4               0  -D-  Number of Mechanical Start Failures
0x03  0x038  4               0  -D-  Number of Realloc. Candidate Logical Sectors
0x03  0x040  4              14  -D-  Number of High Priority Unload Events
0x04  =====  =               =  ===  == General Errors Statistics (rev 1) ==
0x04  0x008  4               0  -D-  Number of Reported Uncorrectable Errors
0x04  0x010  4               0  -D-  Resets Between Cmd Acceptance and Completion
0x05  =====  =               =  ===  == Temperature Statistics (rev 1) ==
0x05  0x008  1              32  -D-  Current Temperature
0x05  0x010  1              33  -D-  Average Short Term Temperature
0x05  0x018  1              33  -D-  Average Long Term Temperature
0x05  0x020  1              50  -D-  Highest Temperature
0x05  0x028  1              24  -D-  Lowest Temperature
0x05  0x030  1              45  -D-  Highest Average Short Term Temperature
0x05  0x038  1              31  -D-  Lowest Average Short Term Temperature
0x05  0x040  1              44  -D-  Highest Average Long Term Temperature
0x05  0x048  1              33  -D-  Lowest Average Long Term Temperature
0x05  0x050  4               0  -D-  Time in Over-Temperature
0x05  0x058  1              60  -D-  Specified Maximum Operating Temperature
0x05  0x060  4               0  -D-  Time in Under-Temperature
0x05  0x068  1               0  -D-  Specified Minimum Operating Temperature
0x06  =====  =               =  ===  == Transport Statistics (rev 1) ==
0x06  0x008  4             741  -D-  Number of Hardware Resets
0x06  0x010  4             478  -D-  Number of ASR Events
0x06  0x018  4               0  -D-  Number of Interface CRC Errors
                                |||_ C monitored condition met
                                ||__ D supports DSN
                                |___ N normalized value

Pending Defects log (GP Log 0x0c)
No Defects Logged

SATA Phy Event Counters (GP Log 0x11)
ID      Size     Value  Description
0x0001  2            0  Command failed due to ICRC error
0x0002  2            0  R_ERR response for data FIS
0x0003  2            0  R_ERR response for device-to-host data FIS
0x0004  2            0  R_ERR response for host-to-device data FIS
0x0005  2            0  R_ERR response for non-data FIS
0x0006  2            0  R_ERR response for device-to-host non-data FIS
0x0007  2            0  R_ERR response for host-to-device non-data FIS
0x0008  2            0  Device-to-host non-data FIS retries
0x0009  2           96  Transition from drive PhyRdy to drive PhyNRdy
0x000a  2          160  Device-to-host register FISes sent due to a COMRESET
0x000b  2            0  CRC errors within host-to-device FIS
0x000d  2            0  Non-CRC errors within host-to-device FIS
0x000f  2            0  R_ERR response for host-to-device data FIS, CRC
0x0012  2            0  R_ERR response for host-to-device non-data FIS, CRC
0x8000  4            0  Vendor specific

