smartctl 7.1 2019-12-30 r5022 [x86_64-unknown-openbsd6.7] (local build)
Copyright (C) 2002-19, Bruce Allen, Christian Franke, www.smartmontools.org

=== START OF INFORMATION SECTION ===
Model Family:     Hitachi/HGST Travelstar Z7K500
Device Model:     HGST HTS725050A7E630
Serial Number:    --
LU WWN Device Id: 5 000cca ...
Firmware Version: GH2ZB550
User Capacity:    500,107,862,016 bytes [500 GB]
Sector Sizes:     512 bytes logical, 4096 bytes physical
Rotation Rate:    7200 rpm
Form Factor:      2.5 inches
Device is:        In smartctl database [for details use: -P show]
ATA Version is:   ATA8-ACS T13/1699-D revision 6
SATA Version is:  SATA 2.6, 6.0 Gb/s (current: 6.0 Gb/s)
Local Time is:    Fri Jul 31 19:23:25 2020 CEST
SMART support is: Available - device has SMART capability.
SMART support is: Enabled

=== START OF READ SMART DATA SECTION ===
SMART Status not supported: Incomplete response, ATA output registers missing
SMART overall-health self-assessment test result: PASSED
Warning: This result is based on an Attribute check.

General SMART Values:
Offline data collection status:  (0x82)	Offline data collection activity
					was completed without error.
					Auto Offline Data Collection: Enabled.
Self-test execution status:      (   0)	The previous self-test routine completed
					without error or no self-test has ever 
					been run.
Total time to complete Offline 
data collection: 		(   45) seconds.
Offline data collection
capabilities: 			 (0x5b) SMART execute Offline immediate.
					Auto Offline data collection on/off support.
					Suspend Offline collection upon new
					command.
					Offline surface scan supported.
					Self-test supported.
					No Conveyance Self-test supported.
					Selective Self-test supported.
SMART capabilities:            (0x0003)	Saves SMART data before entering
					power-saving mode.
					Supports SMART auto save timer.
Error logging capability:        (0x01)	Error logging supported.
					General Purpose Logging supported.
Short self-test routine 
recommended polling time: 	 (   2) minutes.
Extended self-test routine
recommended polling time: 	 (  93) minutes.
SCT capabilities: 	       (0x003d)	SCT Status supported.
					SCT Error Recovery Control supported.
					SCT Feature Control supported.
					SCT Data Table supported.

SMART Attributes Data Structure revision number: 16
Vendor Specific SMART Attributes with Thresholds:
ID# ATTRIBUTE_NAME          FLAG     VALUE WORST THRESH TYPE      UPDATED  WHEN_FAILED RAW_VALUE
  1 Raw_Read_Error_Rate     0x000b   100   100   ---    Pre-fail  Always       -       0
  2 Throughput_Performance  0x0005   198   198   ---    Pre-fail  Offline      -       104
  3 Spin_Up_Time            0x0007   222   222   ---    Pre-fail  Always       -       1
  4 Start_Stop_Count        0x0012   098   098   ---    Old_age   Always       -       4022
  5 Reallocated_Sector_Ct   0x0033   100   100   ---    Pre-fail  Always       -       0
  7 Seek_Error_Rate         0x000b   100   100   ---    Pre-fail  Always       -       0
  8 Seek_Time_Performance   0x0005   112   112   ---    Pre-fail  Offline      -       35
  9 Power_On_Hours          0x0012   082   082   ---    Old_age   Always       -       7912
 10 Spin_Retry_Count        0x0013   100   100   ---    Pre-fail  Always       -       0
 12 Power_Cycle_Count       0x0032   098   098   ---    Old_age   Always       -       3770
191 G-Sense_Error_Rate      0x000a   100   100   ---    Old_age   Always       -       0
192 Power-Off_Retract_Count 0x0032   100   100   ---    Old_age   Always       -       131251
193 Load_Cycle_Count        0x0012   035   035   ---    Old_age   Always       -       655734
194 Temperature_Celsius     0x0002   150   150   ---    Old_age   Always       -       40 (Min/Max 13/50)
196 Reallocated_Event_Count 0x0032   100   100   ---    Old_age   Always       -       0
197 Current_Pending_Sector  0x0022   100   100   ---    Old_age   Always       -       0
198 Offline_Uncorrectable   0x0008   100   100   ---    Old_age   Offline      -       0
199 UDMA_CRC_Error_Count    0x000a   200   200   ---    Old_age   Always       -       0
223 Load_Retry_Count        0x000a   100   100   ---    Old_age   Always       -       0

SMART Error Log Version: 0
No Errors Logged

SMART Self-test log structure revision number 0
Warning: ATA Specification requires self-test log structure revision number = 1
No self-tests have been logged.  [To run self-tests, use: smartctl -t]

SMART Selective self-test log data structure revision number 0
Note: revision number not 1 implies that no selective self-test has ever been run
 SPAN  MIN_LBA  MAX_LBA  CURRENT_TEST_STATUS
    1        0        0  Not_testing
    2        0        0  Not_testing
    3        0        0  Not_testing
    4        0        0  Not_testing
    5        0        0  Not_testing
Selective self-test flags (0x0):
  After scanning selected spans, do NOT read-scan remainder of disk.
If Selective self-test is pending on power-up, resume after 0 minute delay.

