smartctl 7.2 2020-12-30 r5155 [FreeBSD 13.0-RELEASE amd64] (local build)
Copyright (C) 2002-20, Bruce Allen, Christian Franke, www.smartmontools.org

=== START OF INFORMATION SECTION ===
Model Number:                       PM961 NVMe SAMSUNG 256GB
Serial Number:                      --
Firmware Version:                   CXB73D1Q
PCI Vendor/Subsystem ID:            0x144d
IEEE OUI Identifier:                0x002538
Total NVM Capacity:                 256,060,514,304 [256 GB]
Unallocated NVM Capacity:           0
Controller ID:                      2
NVMe Version:                       1.2
Number of Namespaces:               1
Namespace 1 Size/Capacity:          256,060,514,304 [256 GB]
Namespace 1 Utilization:            215,894,241,280 [215 GB]
Namespace 1 Formatted LBA Size:     512
Namespace 1 IEEE EUI-64:            002538 ...
Local Time is:                      Sat Dec 25 02:08:16 2021 EST
Firmware Updates (0x16):            3 Slots, no Reset required
Optional Admin Commands (0x0017):   Security Format Frmw_DL Self_Test
Optional NVM Commands (0x001f):     Comp Wr_Unc DS_Mngmt Wr_Zero Sav/Sel_Feat
Log Page Attributes (0x02):         Cmd_Eff_Lg
Warning  Comp. Temp. Threshold:     68 Celsius
Critical Comp. Temp. Threshold:     71 Celsius

Supported Power States
St Op     Max   Active     Idle   RL RT WL WT  Ent_Lat  Ex_Lat
 0 +     7.60W       -        -    0  0  0  0        0       0
 1 +     5.00W       -        -    1  1  1  1        0       0
 2 +     3.60W       -        -    2  2  2  2        0       0
 3 -   0.0400W       -        -    3  3  3  3      210    1500
 4 -   0.0050W       -        -    4  4  4  4     2200    6000

Supported LBA Sizes (NSID 0x1)
Id Fmt  Data  Metadt  Rel_Perf
 0 +     512       0         0

=== START OF SMART DATA SECTION ===
SMART overall-health self-assessment test result: PASSED

SMART/Health Information (NVMe Log 0x02)
Critical Warning:                   0x00
Temperature:                        41 Celsius
Available Spare:                    100%
Available Spare Threshold:          50%
Percentage Used:                    4%
Data Units Read:                    23,298,839 [11.9 TB]
Data Units Written:                 20,679,391 [10.5 TB]
Host Read Commands:                 386,226,048
Host Write Commands:                371,048,998
Controller Busy Time:               1,485
Power Cycles:                       570
Power On Hours:                     2,690
Unsafe Shutdowns:                   216
Media and Data Integrity Errors:    0
Error Information Log Entries:      1,521
Warning  Comp. Temperature Time:    0
Critical Comp. Temperature Time:    0
Temperature Sensor 1:               41 Celsius
Temperature Sensor 2:               60 Celsius

Error Information (NVMe Log 0x01, 16 of 64 entries)
Num   ErrCount  SQId   CmdId  Status  PELoc          LBA  NSID    VS
  0       1521     0  0x00b2  0x4004  0x028            0     1     -
  1       1520     0  0x00b1  0x4004      -            0     1     -
  2       1519     0  0x00ad  0x4004  0x028            0     1     -
  3       1518     0  0x00ac  0x4004      -            0     1     -
  4       1517     0  0x009b  0x4004  0x028            0     1     -
  5       1516     0  0x009a  0x4004      -            0     1     -
  6       1515     0  0x0093  0x4004  0x028            0     1     -
  7       1514     0  0x0092  0x4004      -            0     1     -
  8       1513     0  0x007e  0x4004  0x028            0     1     -
  9       1512     0  0x007d  0x4004      -            0     1     -
 10       1511     0  0x0079  0x4004  0x028            0     1     -
 11       1510     0  0x0078  0x4004      -            0     1     -
 12       1509     0  0x0064  0x4212  0x028            0     -     -
 13       1508     0  0x0044  0x4004      -            0     1     -
 14       1507     0  0x003c  0x4004  0x02c            0     1     -
 15       1506     0  0x0026  0x4004  0x02c            0     0     -
... (48 entries not read)

