smartctl 7.4 2023-08-01 r5530 [FreeBSD 14.1-RELEASE-p4 amd64] (local build)
Copyright (C) 2002-23, Bruce Allen, Christian Franke, www.smartmontools.org

=== START OF INFORMATION SECTION ===
Model Family:     Toshiba 2.5" HDD MK..32GSX
Device Model:     TOSHIBA MK1032GSX
Serial Number:    --
Firmware Version: AS021G
User Capacity:    100,030,242,816 bytes [100 GB]
Sector Size:      512 bytes logical/physical
Device is:        In smartctl database 7.3/5528
ATA Version is:   ATA/ATAPI-6 (minor revision not indicated)
Local Time is:    Thu Sep 19 02:58:41 2024 MDT
SMART support is: Available - device has SMART capability.
SMART support is: Enabled
AAM feature is:   Unavailable
APM level is:     224 (intermediate level without standby)
Rd look-ahead is: Enabled
Write cache is:   Enabled
DSN feature is:   Unavailable
ATA Security is:  Disabled, frozen [SEC2]
Wt Cache Reorder: Unavailable

=== START OF READ SMART DATA SECTION ===
SMART overall-health self-assessment test result: PASSED

General SMART Values:
Offline data collection status:  (0x00)	Offline data collection activity
					was never started.
					Auto Offline Data Collection: Disabled.
Self-test execution status:      (   0)	The previous self-test routine completed
					without error or no self-test has ever 
					been run.
Total time to complete Offline 
data collection: 		(  384) seconds.
Offline data collection
capabilities: 			 (0x5b) SMART execute Offline immediate.
					Auto Offline data collection on/off support.
					Suspend Offline collection upon new
					command.
					Offline surface scan supported.
					Self-test supported.
					No Conveyance Self-test supported.
					Selective Self-test supported.
SMART capabilities:            (0x0003)	Saves SMART data before entering
					power-saving mode.
					Supports SMART auto save timer.
Error logging capability:        (0x01)	Error logging supported.
					General Purpose Logging supported.
Short self-test routine 
recommended polling time: 	 (   2) minutes.
Extended self-test routine
recommended polling time: 	 (  76) minutes.

SMART Attributes Data Structure revision number: 16
Vendor Specific SMART Attributes with Thresholds:
ID# ATTRIBUTE_NAME          FLAGS    VALUE WORST THRESH FAIL RAW_VALUE
  1 Raw_Read_Error_Rate     PO-R--   100   100   050    -    0
  2 Throughput_Performance  P-S---   100   100   050    -    0
  3 Spin_Up_Time            POS--K   100   100   001    -    1682
  4 Start_Stop_Count        -O--CK   100   100   000    -    6689
  5 Reallocated_Sector_Ct   PO--CK   100   100   050    -    0
  7 Seek_Error_Rate         PO-R--   100   100   050    -    0
  8 Seek_Time_Performance   P-S---   100   100   050    -    0
  9 Power_On_Hours          -O--CK   052   052   000    -    19451
 10 Spin_Retry_Count        PO--CK   233   100   030    -    0
 12 Power_Cycle_Count       -O--CK   100   100   000    -    3513
192 Power-Off_Retract_Count -O--CK   100   100   000    -    217
193 Load_Cycle_Count        -O--CK   036   036   000    -    641363
194 Temperature_Celsius     -O---K   100   100   000    -    30 (Min/Max 6/65)
196 Reallocated_Event_Count -O--CK   100   100   000    -    0
197 Current_Pending_Sector  -O--CK   100   100   000    -    0
198 Offline_Uncorrectable   ----CK   100   100   000    -    0
199 UDMA_CRC_Error_Count    -O--CK   200   200   000    -    0
220 Disk_Shift              -O----   100   100   000    -    8296
222 Loaded_Hours            -O--CK   061   061   000    -    15929
223 Load_Retry_Count        -O--CK   100   100   000    -    0
224 Load_Friction           -O---K   100   100   000    -    0
226 Load-in_Time            -OS--K   100   100   000    -    307
240 Head_Flying_Hours       P-----   100   100   001    -    0
                            ||||||_ K auto-keep
                            |||||__ C event count
                            ||||___ R error rate
                            |||____ S speed/performance
                            ||_____ O updated online
                            |______ P prefailure warning

General Purpose Log Directory Version 1
SMART           Log Directory Version 1 [multi-sector log support]
Address    Access  R/W   Size  Description
0x00       GPL,SL  R/O      1  Log Directory
0x01           SL  R/O      1  Summary SMART error log
0x02           SL  R/O     51  Comprehensive SMART error log
0x03       GPL     R/O     64  Ext. Comprehensive SMART error log
0x06           SL  R/O      1  SMART self-test log
0x07       GPL     R/O      1  Extended self-test log
0x09           SL  R/W      1  Selective self-test log
0x10       GPL     R/O      1  NCQ Command Error log
0x11       GPL     R/O      1  SATA Phy Event Counters log
0x80-0x9f  GPL,SL  R/W     16  Host vendor specific log

SMART Extended Comprehensive Error Log Version: 1 (64 sectors)
Device Error Count: 10
	CR     = Command Register
	FEATR  = Features Register
	COUNT  = Count (was: Sector Count) Register
	LBA_48 = Upper bytes of LBA High/Mid/Low Registers ]  ATA-8
	LH     = LBA High (was: Cylinder High) Register    ]   LBA
	LM     = LBA Mid (was: Cylinder Low) Register      ] Register
	LL     = LBA Low (was: Sector Number) Register     ]
	DV     = Device (was: Device/Head) Register
	DC     = Device Control Register
	ER     = Error register
	ST     = Status register
Powered_Up_Time is measured from power on, and printed as
DDd+hh:mm:SS.sss where DD=days, hh=hours, mm=minutes,
SS=sec, and sss=millisec. It "wraps" after 49.710 days.

Error 10 [9] occurred at disk power-on lifetime: 5078 hours (211 days + 14 hours)
  When the command that caused the error occurred, the device was active or idle.

  After command completion occurred, registers were:
  ER -- ST COUNT  LBA_48  LH LM LL DV DC
  -- -- -- == -- == == == -- -- -- -- --
  84 -- 51 00 01 00 00 00 a1 1e a1 e0 00  Error: ICRC, ABRT 1 sectors at LBA = 0x00a11ea1 = 10559137

  Commands leading to the command that caused the error were:
  CR FEATR COUNT  LBA_48  LH LM LL DV DC  Powered_Up_Time  Command/Feature_Name
  -- == -- == -- == == == -- -- -- -- --  ---------------  --------------------
  c8 00 00 00 08 9d 12 a6 a1 1c 9f e0 00     00:00:17.920  READ DMA
  c8 00 00 00 08 9c 7c 7e 9d 12 9f e0 00     00:00:17.905  READ DMA
  c8 00 00 00 08 9b a9 46 9c 7c 77 e0 00     00:00:17.891  READ DMA
  c8 00 00 00 08 99 82 fe 9b a9 3f e0 00     00:00:17.890  READ DMA
  c8 00 00 00 08 60 73 8e 99 82 f7 e0 00     00:00:17.877  READ DMA

Error 9 [8] occurred at disk power-on lifetime: 4036 hours (168 days + 4 hours)
  When the command that caused the error occurred, the device was active or idle.

  After command completion occurred, registers were:
  ER -- ST COUNT  LBA_48  LH LM LL DV DC
  -- -- -- == -- == == == -- -- -- -- --
  84 -- 51 00 01 00 00 00 9e 29 05 e0 00  Error: ICRC, ABRT 1 sectors at LBA = 0x009e2905 = 10365189

  Commands leading to the command that caused the error were:
  CR FEATR COUNT  LBA_48  LH LM LL DV DC  Powered_Up_Time  Command/Feature_Name
  -- == -- == -- == == == -- -- -- -- --  ---------------  --------------------
  c8 00 00 00 08 5c 87 be 9e 28 9f e0 00     00:16:08.632  READ DMA
  c8 00 00 00 08 9c f1 6e 5c 87 b7 ea 00     00:16:08.564  READ DMA
  c8 00 00 00 08 9e 59 76 9c f1 67 e0 00     00:16:08.554  READ DMA
  c8 00 00 00 08 9e 3d 76 9e 59 6f e0 00     00:16:08.395  READ DMA
  c8 00 00 00 08 3a b0 c6 9e 3d 6f e0 00     00:16:08.369  READ DMA

Error 8 [7] occurred at disk power-on lifetime: 3952 hours (164 days + 16 hours)
  When the command that caused the error occurred, the device was active or idle.

  After command completion occurred, registers were:
  ER -- ST COUNT  LBA_48  LH LM LL DV DC
  -- -- -- == -- == == == -- -- -- -- --
  84 -- 51 00 01 00 00 00 9d 28 bd e0 00  Error: ICRC, ABRT 1 sectors at LBA = 0x009d28bd = 10299581

  Commands leading to the command that caused the error were:
  CR FEATR COUNT  LBA_48  LH LM LL DV DC  Powered_Up_Time  Command/Feature_Name
  -- == -- == -- == == == -- -- -- -- --  ---------------  --------------------
  c8 00 00 00 08 99 5d 3e 9d 28 07 e0 00     00:09:46.167  READ DMA
  c8 00 00 00 08 e2 e4 c8 99 5d 37 e0 00     00:09:46.144  READ DMA
  c8 00 00 00 40 db 31 f4 e2 e4 89 e7 00     00:09:46.144  READ DMA
  c8 00 00 00 18 9e 3b 0e db 31 dd e7 00     00:09:46.125  READ DMA
  c8 00 00 00 08 9d cb 6e 9e 3b 07 e0 00     00:09:46.116  READ DMA

Error 7 [6] occurred at disk power-on lifetime: 3399 hours (141 days + 15 hours)
  When the command that caused the error occurred, the device was active or idle.

  After command completion occurred, registers were:
  ER -- ST COUNT  LBA_48  LH LM LL DV DC
  -- -- -- == -- == == == -- -- -- -- --
  84 -- 51 00 01 00 00 00 a0 9c 94 e0 00  Error: ICRC, ABRT 1 sectors at LBA = 0x00a09c94 = 10525844

  Commands leading to the command that caused the error were:
  CR FEATR COUNT  LBA_48  LH LM LL DV DC  Powered_Up_Time  Command/Feature_Name
  -- == -- == -- == == == -- -- -- -- --  ---------------  --------------------
  c8 00 00 00 08 58 ce 86 a0 9b 57 e0 00     01:31:58.917  READ DMA
  c8 00 00 00 08 a0 84 8e 58 ce 7f e5 00     01:31:58.905  READ DMA
  c8 00 00 00 08 56 4a 46 a0 84 87 e0 00     01:31:58.905  READ DMA
  c8 00 00 00 08 a0 84 96 56 4a 3f e5 00     01:31:58.889  READ DMA
  c8 00 00 00 08 a0 84 86 a0 84 8f e0 00     01:31:58.802  READ DMA

Error 6 [5] occurred at disk power-on lifetime: 2827 hours (117 days + 19 hours)
  When the command that caused the error occurred, the device was active or idle.

  After command completion occurred, registers were:
  ER -- ST COUNT  LBA_48  LH LM LL DV DC
  -- -- -- == -- == == == -- -- -- -- --
  84 -- 51 00 01 00 00 00 98 a9 9c e0 00  Error: ICRC, ABRT 1 sectors at LBA = 0x0098a99c = 10004892

  Commands leading to the command that caused the error were:
  CR FEATR COUNT  LBA_48  LH LM LL DV DC  Powered_Up_Time  Command/Feature_Name
  -- == -- == -- == == == -- -- -- -- --  ---------------  --------------------
  c8 00 00 00 08 98 87 ce 98 a9 77 e0 00     00:31:11.866  READ DMA
  c8 00 00 00 08 98 78 6e 98 87 c7 e0 00     00:31:11.863  READ DMA
  c8 00 00 00 08 98 78 1e 98 78 67 e0 00     00:31:11.861  READ DMA
  c8 00 00 00 08 98 6d 86 98 78 17 e0 00     00:31:11.856  READ DMA
  c8 00 00 00 08 98 5f be 98 6d 7f e0 00     00:31:11.851  READ DMA

Error 5 [4] occurred at disk power-on lifetime: 2699 hours (112 days + 11 hours)
  When the command that caused the error occurred, the device was active or idle.

  After command completion occurred, registers were:
  ER -- ST COUNT  LBA_48  LH LM LL DV DC
  -- -- -- == -- == == == -- -- -- -- --
  84 -- 51 00 01 00 00 00 99 2b fc e0 00  Error: ICRC, ABRT 1 sectors at LBA = 0x00992bfc = 10038268

  Commands leading to the command that caused the error were:
  CR FEATR COUNT  LBA_48  LH LM LL DV DC  Powered_Up_Time  Command/Feature_Name
  -- == -- == -- == == == -- -- -- -- --  ---------------  --------------------
  c8 00 00 00 08 99 2a 7e 99 2a 7f e0 00     01:15:26.647  READ DMA
  c8 00 00 00 08 99 2a 76 99 2a 77 e0 00     01:15:26.647  READ DMA
  c8 00 00 00 08 9b db a6 99 2a 6f e0 00     01:15:26.647  READ DMA
  c8 00 00 00 08 99 2a 6e 9b db 9f e0 00     01:15:26.647  READ DMA
  c8 00 00 00 08 99 5e 1e 99 2a 67 e0 00     01:15:26.647  READ DMA

Error 4 [3] occurred at disk power-on lifetime: 1302 hours (54 days + 6 hours)
  When the command that caused the error occurred, the device was active or idle.

  After command completion occurred, registers were:
  ER -- ST COUNT  LBA_48  LH LM LL DV DC
  -- -- -- == -- == == == -- -- -- -- --
  84 -- 51 00 01 00 00 00 5e 00 4f e0 00  Error: ICRC, ABRT 1 sectors at LBA = 0x005e004f = 6160463

  Commands leading to the command that caused the error were:
  CR FEATR COUNT  LBA_48  LH LM LL DV DC  Powered_Up_Time  Command/Feature_Name
  -- == -- == -- == == == -- -- -- -- --  ---------------  --------------------
  c8 00 00 00 08 5e 00 46 98 0a 5f e0 00     00:37:29.340  READ DMA
  ca 00 00 00 08 b4 a7 33 5e 00 3f e0 00     00:37:29.339  WRITE DMA
  c8 00 00 00 20 2e 34 3e b4 a7 14 e7 00     00:37:29.313  READ DMA
  c8 00 00 00 08 98 0e 26 2e 34 37 e1 00     00:37:29.313  READ DMA
  c8 00 00 00 08 b3 9a 48 98 0e 1f e0 00     00:37:29.289  READ DMA

Error 3 [2] occurred at disk power-on lifetime: 1275 hours (53 days + 3 hours)
  When the command that caused the error occurred, the device was active or idle.

  After command completion occurred, registers were:
  ER -- ST COUNT  LBA_48  LH LM LL DV DC
  -- -- -- == -- == == == -- -- -- -- --
  84 -- 51 00 01 00 00 01 24 5c 21 e1 00  Error: ICRC, ABRT 1 sectors at LBA = 0x01245c21 = 19160097

  Commands leading to the command that caused the error were:
  CR FEATR COUNT  LBA_48  LH LM LL DV DC  Powered_Up_Time  Command/Feature_Name
  -- == -- == -- == == == -- -- -- -- --  ---------------  --------------------
  c8 00 00 00 08 98 93 b6 98 94 df e0 00     00:26:21.276  READ DMA
  c8 00 00 00 08 98 98 c6 98 93 af e0 00     00:26:21.276  READ DMA
  c8 00 00 00 08 98 98 ae 98 98 bf e0 00     00:26:21.275  READ DMA
  c8 00 00 00 08 c7 1a a6 98 98 a7 e0 00     00:26:21.275  READ DMA
  c8 00 00 00 40 c7 1a fe c7 1a 67 e7 00     00:26:21.275  READ DMA

SMART Extended Self-test Log Version: 1 (1 sectors)
Num  Test_Description    Status                  Remaining  LifeTime(hours)  LBA_of_first_error
# 1  Short offline       Completed without error       00%      1477         -

SMART Selective self-test log data structure revision number 1
 SPAN  MIN_LBA  MAX_LBA  CURRENT_TEST_STATUS
    1        0        0  Not_testing
    2        0        0  Not_testing
    3        0        0  Not_testing
    4        0        0  Not_testing
    5        0        0  Not_testing
Selective self-test flags (0x0):
  After scanning selected spans, do NOT read-scan remainder of disk.
If Selective self-test is pending on power-up, resume after 0 minute delay.

SCT Commands not supported

Device Statistics (GP/SMART Log 0x04) not supported

Pending Defects log (GP Log 0x0c) not supported

SATA Phy Event Counters (GP Log 0x11)
ID      Size     Value  Description
0x0001  4            0  Command failed due to ICRC error
0x0002  4            0  R_ERR response for data FIS
0x0003  4            0  R_ERR response for device-to-host data FIS
0x0004  4            0  R_ERR response for host-to-device data FIS
0x0005  4            0  R_ERR response for non-data FIS
0x0006  4            0  R_ERR response for device-to-host non-data FIS
0x0007  4            0  R_ERR response for host-to-device non-data FIS
0x0008  4            0  Device-to-host non-data FIS retries
0x0009  4            2  Transition from drive PhyRdy to drive PhyNRdy
0x000a  4            9  Device-to-host register FISes sent due to a COMRESET
0x000b  4            0  CRC errors within host-to-device FIS
0x000d  4            0  Non-CRC errors within host-to-device FIS
0x000f  4            0  R_ERR response for host-to-device data FIS, CRC
0x0010  4            0  R_ERR response for host-to-device data FIS, non-CRC
0x0012  4            0  R_ERR response for host-to-device non-data FIS, CRC
0x0013  4            0  R_ERR response for host-to-device non-data FIS, non-CRC

