smartctl 7.3 2022-02-28 r5338 [FreeBSD 13.1-RELEASE-p2 amd64] (local build)
Copyright (C) 2002-22, Bruce Allen, Christian Franke, www.smartmontools.org

=== START OF INFORMATION SECTION ===
Model Family:     Seagate Momentus Thin
Device Model:     ST320LT007-9ZV142
Serial Number:    --
LU WWN Device Id: 5 000c50 ...
Firmware Version: 0005LVM1
User Capacity:    320,072,933,376 bytes [320 GB]
Sector Sizes:     512 bytes logical, 4096 bytes physical
Rotation Rate:    7242 rpm
Device is:        In smartctl database 7.3/5319
ATA Version is:   ATA8-ACS T13/1699-D revision 4
SATA Version is:  SATA 2.6, 3.0 Gb/s (current: 3.0 Gb/s)
Local Time is:    Tue Nov  1 09:55:41 2022 WIB
SMART support is: Available - device has SMART capability.
SMART support is: Enabled
AAM feature is:   Unavailable
APM level is:     128 (minimum power consumption without standby)
Rd look-ahead is: Enabled
Write cache is:   Enabled
DSN feature is:   Unavailable
ATA Security is:  Disabled, frozen [SEC2]
Wt Cache Reorder: Unknown

=== START OF READ SMART DATA SECTION ===
SMART overall-health self-assessment test result: PASSED
See vendor-specific Attribute list for marginal Attributes.

General SMART Values:
Offline data collection status:  (0x00)	Offline data collection activity
					was never started.
					Auto Offline Data Collection: Disabled.
Self-test execution status:      (   0)	The previous self-test routine completed
					without error or no self-test has ever 
					been run.
Total time to complete Offline 
data collection: 		(    0) seconds.
Offline data collection
capabilities: 			 (0x73) SMART execute Offline immediate.
					Auto Offline data collection on/off support.
					Suspend Offline collection upon new
					command.
					No Offline surface scan supported.
					Self-test supported.
					Conveyance Self-test supported.
					Selective Self-test supported.
SMART capabilities:            (0x0003)	Saves SMART data before entering
					power-saving mode.
					Supports SMART auto save timer.
Error logging capability:        (0x01)	Error logging supported.
					General Purpose Logging supported.
Short self-test routine 
recommended polling time: 	 (   1) minutes.
Extended self-test routine
recommended polling time: 	 (  64) minutes.
Conveyance self-test routine
recommended polling time: 	 (   2) minutes.
SCT capabilities: 	       (0x303b)	SCT Status supported.
					SCT Error Recovery Control supported.
					SCT Feature Control supported.
					SCT Data Table supported.

SMART Attributes Data Structure revision number: 10
Vendor Specific SMART Attributes with Thresholds:
ID# ATTRIBUTE_NAME          FLAGS    VALUE WORST THRESH FAIL RAW_VALUE
  1 Raw_Read_Error_Rate     POSR--   117   091   034    -    164502672
  3 Spin_Up_Time            PO----   099   098   000    -    0
  4 Start_Stop_Count        -O--CK   098   098   020    -    3030
  5 Reallocated_Sector_Ct   PO--CK   100   100   036    -    0
  7 Seek_Error_Rate         POSR--   081   060   030    -    8858561725
  9 Power_On_Hours          -O--CK   088   088   000    -    11123 (169 231 0)
 10 Spin_Retry_Count        PO--C-   100   100   097    -    0
 12 Power_Cycle_Count       -O--CK   098   098   020    -    3028
184 End-to-End_Error        -O--CK   100   100   099    -    0
187 Reported_Uncorrect      -O--CK   001   001   000    -    895
188 Command_Timeout         -O--CK   100   097   000    -    247
189 High_Fly_Writes         -O-RCK   099   099   000    -    1
190 Airflow_Temperature_Cel -O---K   058   044   045    Past 42 (Min/Max 36/44 #8)
191 G-Sense_Error_Rate      -O--CK   100   100   000    -    81
192 Power-Off_Retract_Count -O--CK   100   100   000    -    86
193 Load_Cycle_Count        -O--CK   043   043   000    -    114356
194 Temperature_Celsius     -O---K   042   056   000    -    42 (0 18 0 0 0)
195 Hardware_ECC_Recovered  -O-RC-   050   034   000    -    164502672
196 Reallocated_Event_Count POSR--   088   088   030    -    10726 (59982 0)
197 Current_Pending_Sector  -O--C-   100   100   000    -    0
198 Offline_Uncorrectable   ----C-   100   100   000    -    0
199 UDMA_CRC_Error_Count    -OSRCK   200   200   000    -    0
250 Read_Error_Retry_Rate   ------   001   001   000    -    82516
251 Unknown_Attribute       ------   100   001   000    -    6923
252 Unknown_Attribute       ------   100   001   000    -    2651
254 Free_Fall_Sensor        -O--CK   100   100   000    -    0
                            ||||||_ K auto-keep
                            |||||__ C event count
                            ||||___ R error rate
                            |||____ S speed/performance
                            ||_____ O updated online
                            |______ P prefailure warning

General Purpose Log Directory Version 1
SMART           Log Directory Version 1 [multi-sector log support]
Address    Access  R/W   Size  Description
0x00       GPL,SL  R/O      1  Log Directory
0x01           SL  R/O      1  Summary SMART error log
0x02           SL  R/O      5  Comprehensive SMART error log
0x03       GPL     R/O      5  Ext. Comprehensive SMART error log
0x06           SL  R/O      1  SMART self-test log
0x07       GPL     R/O      1  Extended self-test log
0x09           SL  R/W      1  Selective self-test log
0x10       GPL     R/O      1  NCQ Command Error log
0x11       GPL     R/O      1  SATA Phy Event Counters log
0x21       GPL     R/O      1  Write stream error log
0x22       GPL     R/O      1  Read stream error log
0x80-0x9f  GPL,SL  R/W     16  Host vendor specific log
0xa1       GPL,SL  VS      20  Device vendor specific log
0xa2       GPL     VS    2248  Device vendor specific log
0xa8       GPL,SL  VS      65  Device vendor specific log
0xa9       GPL,SL  VS       1  Device vendor specific log
0xab       GPL     VS       1  Device vendor specific log
0xb0       GPL     VS    2864  Device vendor specific log
0xbd       GPL     VS       1  Device vendor specific log
0xbe-0xbf  GPL     VS   65535  Device vendor specific log
0xe0       GPL,SL  R/W      1  SCT Command/Status
0xe1       GPL,SL  R/W      1  SCT Data Transfer

SMART Extended Comprehensive Error Log Version: 1 (5 sectors)
Device Error Count: 894 (device log contains only the most recent 20 errors)
	CR     = Command Register
	FEATR  = Features Register
	COUNT  = Count (was: Sector Count) Register
	LBA_48 = Upper bytes of LBA High/Mid/Low Registers ]  ATA-8
	LH     = LBA High (was: Cylinder High) Register    ]   LBA
	LM     = LBA Mid (was: Cylinder Low) Register      ] Register
	LL     = LBA Low (was: Sector Number) Register     ]
	DV     = Device (was: Device/Head) Register
	DC     = Device Control Register
	ER     = Error register
	ST     = Status register
Powered_Up_Time is measured from power on, and printed as
DDd+hh:mm:SS.sss where DD=days, hh=hours, mm=minutes,
SS=sec, and sss=millisec. It "wraps" after 49.710 days.

Error 894 [13] occurred at disk power-on lifetime: 6437 hours (268 days + 5 hours)
  When the command that caused the error occurred, the device was active or idle.

  After command completion occurred, registers were:
  ER -- ST COUNT  LBA_48  LH LM LL DV DC
  -- -- -- == -- == == == -- -- -- -- --
  40 -- 51 00 00 00 00 20 2d 29 c8 00 00  Error: UNC at LBA = 0x202d29c8 = 539830728

  Commands leading to the command that caused the error were:
  CR FEATR COUNT  LBA_48  LH LM LL DV DC  Powered_Up_Time  Command/Feature_Name
  -- == -- == -- == == == -- -- -- -- --  ---------------  --------------------
  60 00 00 00 08 00 00 20 2d 29 c8 40 00     03:39:48.833  READ FPDMA QUEUED
  60 00 00 00 98 00 00 10 ad 7a a8 40 00     03:39:48.833  READ FPDMA QUEUED
  60 00 00 01 00 00 00 10 ad 79 a8 40 00     03:39:48.833  READ FPDMA QUEUED
  60 00 00 00 40 00 00 17 4f 81 d0 40 00     03:39:48.832  READ FPDMA QUEUED
  61 00 00 00 08 00 00 00 5b fb c8 40 00     03:39:48.832  WRITE FPDMA QUEUED

Error 893 [12] occurred at disk power-on lifetime: 6437 hours (268 days + 5 hours)
  When the command that caused the error occurred, the device was active or idle.

  After command completion occurred, registers were:
  ER -- ST COUNT  LBA_48  LH LM LL DV DC
  -- -- -- == -- == == == -- -- -- -- --
  40 -- 51 00 00 00 00 20 2d 29 c8 00 00  Error: UNC at LBA = 0x202d29c8 = 539830728

  Commands leading to the command that caused the error were:
  CR FEATR COUNT  LBA_48  LH LM LL DV DC  Powered_Up_Time  Command/Feature_Name
  -- == -- == -- == == == -- -- -- -- --  ---------------  --------------------
  60 00 00 00 08 00 00 20 2d 29 c8 40 00     03:39:44.255  READ FPDMA QUEUED
  61 00 00 00 08 00 00 00 5b fb c8 40 00     03:39:44.254  WRITE FPDMA QUEUED
  60 00 00 00 40 00 00 17 4f 81 d0 40 00     03:39:44.254  READ FPDMA QUEUED
  60 00 00 01 00 00 00 10 ad 79 a8 40 00     03:39:44.254  READ FPDMA QUEUED
  60 00 00 00 98 00 00 10 ad 7a a8 40 00     03:39:44.253  READ FPDMA QUEUED

Error 892 [11] occurred at disk power-on lifetime: 6437 hours (268 days + 5 hours)
  When the command that caused the error occurred, the device was active or idle.

  After command completion occurred, registers were:
  ER -- ST COUNT  LBA_48  LH LM LL DV DC
  -- -- -- == -- == == == -- -- -- -- --
  40 -- 51 00 00 00 00 20 2d 29 c8 00 00  Error: UNC at LBA = 0x202d29c8 = 539830728

  Commands leading to the command that caused the error were:
  CR FEATR COUNT  LBA_48  LH LM LL DV DC  Powered_Up_Time  Command/Feature_Name
  -- == -- == -- == == == -- -- -- -- --  ---------------  --------------------
  60 00 00 00 98 00 00 10 ad 7a a8 40 00     03:39:39.747  READ FPDMA QUEUED
  60 00 00 01 00 00 00 10 ad 79 a8 40 00     03:39:39.746  READ FPDMA QUEUED
  60 00 00 00 40 00 00 17 4f 81 d0 40 00     03:39:39.746  READ FPDMA QUEUED
  60 00 00 00 08 00 00 20 2d 29 c8 40 00     03:39:39.745  READ FPDMA QUEUED
  61 00 00 00 08 00 00 00 5c 62 f0 40 00     03:39:39.744  WRITE FPDMA QUEUED

Error 891 [10] occurred at disk power-on lifetime: 6437 hours (268 days + 5 hours)
  When the command that caused the error occurred, the device was active or idle.

  After command completion occurred, registers were:
  ER -- ST COUNT  LBA_48  LH LM LL DV DC
  -- -- -- == -- == == == -- -- -- -- --
  40 -- 51 00 00 00 00 20 2d 29 c8 00 00  Error: UNC at LBA = 0x202d29c8 = 539830728

  Commands leading to the command that caused the error were:
  CR FEATR COUNT  LBA_48  LH LM LL DV DC  Powered_Up_Time  Command/Feature_Name
  -- == -- == -- == == == -- -- -- -- --  ---------------  --------------------
  60 00 00 00 08 00 00 20 2d 29 c8 40 00     03:39:34.967  READ FPDMA QUEUED
  60 00 00 00 40 00 00 17 4f 81 d0 40 00     03:39:34.966  READ FPDMA QUEUED
  60 00 00 01 00 00 00 10 ad 79 a8 40 00     03:39:34.966  READ FPDMA QUEUED
  60 00 00 00 98 00 00 10 ad 7a a8 40 00     03:39:34.966  READ FPDMA QUEUED
  2f 00 00 00 01 00 00 00 00 00 10 40 00     03:39:34.965  READ LOG EXT

Error 890 [9] occurred at disk power-on lifetime: 6437 hours (268 days + 5 hours)
  When the command that caused the error occurred, the device was active or idle.

  After command completion occurred, registers were:
  ER -- ST COUNT  LBA_48  LH LM LL DV DC
  -- -- -- == -- == == == -- -- -- -- --
  40 -- 51 00 00 00 00 20 2d 29 c8 00 00  Error: UNC at LBA = 0x202d29c8 = 539830728

  Commands leading to the command that caused the error were:
  CR FEATR COUNT  LBA_48  LH LM LL DV DC  Powered_Up_Time  Command/Feature_Name
  -- == -- == -- == == == -- -- -- -- --  ---------------  --------------------
  60 00 00 00 08 00 00 20 2d 29 c8 40 00     03:39:30.355  READ FPDMA QUEUED
  60 00 00 00 40 00 00 17 4f 81 d0 40 00     03:39:30.355  READ FPDMA QUEUED
  60 00 00 00 98 00 00 10 ad 7a a8 40 00     03:39:30.354  READ FPDMA QUEUED
  60 00 00 01 00 00 00 10 ad 79 a8 40 00     03:39:30.354  READ FPDMA QUEUED
  2f 00 00 00 01 00 00 00 00 00 10 40 00     03:39:30.354  READ LOG EXT

Error 889 [8] occurred at disk power-on lifetime: 6437 hours (268 days + 5 hours)
  When the command that caused the error occurred, the device was active or idle.

  After command completion occurred, registers were:
  ER -- ST COUNT  LBA_48  LH LM LL DV DC
  -- -- -- == -- == == == -- -- -- -- --
  40 -- 51 00 00 00 00 20 2d 29 c8 00 00  Error: UNC at LBA = 0x202d29c8 = 539830728

  Commands leading to the command that caused the error were:
  CR FEATR COUNT  LBA_48  LH LM LL DV DC  Powered_Up_Time  Command/Feature_Name
  -- == -- == -- == == == -- -- -- -- --  ---------------  --------------------
  60 00 00 00 08 00 00 20 2d 29 c8 40 00     03:39:25.776  READ FPDMA QUEUED
  60 00 00 01 00 00 00 10 ad 79 a8 40 00     03:39:25.776  READ FPDMA QUEUED
  60 00 00 00 98 00 00 10 ad 7a a8 40 00     03:39:25.775  READ FPDMA QUEUED
  60 00 00 00 40 00 00 17 4f 81 d0 40 00     03:39:25.775  READ FPDMA QUEUED
  2f 00 00 00 01 00 00 00 00 00 10 40 00     03:39:25.774  READ LOG EXT

Error 888 [7] occurred at disk power-on lifetime: 6437 hours (268 days + 5 hours)
  When the command that caused the error occurred, the device was active or idle.

  After command completion occurred, registers were:
  ER -- ST COUNT  LBA_48  LH LM LL DV DC
  -- -- -- == -- == == == -- -- -- -- --
  40 -- 51 00 00 00 00 20 2d 29 c8 00 00  Error: UNC at LBA = 0x202d29c8 = 539830728

  Commands leading to the command that caused the error were:
  CR FEATR COUNT  LBA_48  LH LM LL DV DC  Powered_Up_Time  Command/Feature_Name
  -- == -- == -- == == == -- -- -- -- --  ---------------  --------------------
  60 00 00 00 40 00 00 17 4f 81 d0 40 00     03:39:21.267  READ FPDMA QUEUED
  60 00 00 00 40 00 00 17 4f 77 f8 40 00     03:39:21.265  READ FPDMA QUEUED
  60 00 00 00 98 00 00 10 ad 7a a8 40 00     03:39:21.253  READ FPDMA QUEUED
  60 00 00 01 00 00 00 10 ad 79 a8 40 00     03:39:21.252  READ FPDMA QUEUED
  60 00 00 00 40 00 00 17 4f 77 78 40 00     03:39:21.240  READ FPDMA QUEUED

Error 887 [6] occurred at disk power-on lifetime: 6437 hours (268 days + 5 hours)
  When the command that caused the error occurred, the device was active or idle.

  After command completion occurred, registers were:
  ER -- ST COUNT  LBA_48  LH LM LL DV DC
  -- -- -- == -- == == == -- -- -- -- --
  40 -- 51 00 00 00 00 20 2d 29 c8 00 00  Error: UNC at LBA = 0x202d29c8 = 539830728

  Commands leading to the command that caused the error were:
  CR FEATR COUNT  LBA_48  LH LM LL DV DC  Powered_Up_Time  Command/Feature_Name
  -- == -- == -- == == == -- -- -- -- --  ---------------  --------------------
  60 00 00 00 b8 00 00 10 ad 73 08 40 00     03:39:16.464  READ FPDMA QUEUED
  60 00 00 01 00 00 00 10 ad 72 08 40 00     03:39:16.463  READ FPDMA QUEUED
  60 00 00 01 00 00 00 10 ad 71 08 40 00     03:39:16.463  READ FPDMA QUEUED
  60 00 00 00 40 00 00 0a 89 75 d0 40 00     03:39:16.462  READ FPDMA QUEUED
  60 00 00 00 40 00 00 0a 89 70 10 40 00     03:39:16.414  READ FPDMA QUEUED

SMART Extended Self-test Log Version: 1 (1 sectors)
Num  Test_Description    Status                  Remaining  LifeTime(hours)  LBA_of_first_error
# 1  Vendor (0x50)       Completed without error       00%         0         -

SMART Selective self-test log data structure revision number 1
 SPAN  MIN_LBA  MAX_LBA  CURRENT_TEST_STATUS
    1        0        0  Not_testing
    2        0        0  Not_testing
    3        0        0  Not_testing
    4        0        0  Not_testing
    5        0        0  Not_testing
Selective self-test flags (0x0):
  After scanning selected spans, do NOT read-scan remainder of disk.
If Selective self-test is pending on power-up, resume after 0 minute delay.

SCT Status Version:                  3
SCT Version (vendor specific):       522 (0x020a)
Device State:                        Active (0)
Current Temperature:                    42 Celsius
Power Cycle Min/Max Temperature:     36/43 Celsius
Lifetime    Min/Max Temperature:     18/56 Celsius
Under/Over Temperature Limit Count:   0/8
Vendor specific:
00 00 00 00 00 00 00 00 00 00 02 00 00 00 00 00
00 00 00 00 00 00 00 00 00 00 00 00 00 00 00 00

SCT Temperature History Version:     2
Temperature Sampling Period:         10 minutes
Temperature Logging Interval:        11 minutes
Min/Max recommended Temperature:      0/ 0 Celsius
Min/Max Temperature Limit:            0/ 0 Celsius
Temperature History Size (Index):    128 (68)

SCT Error Recovery Control:
           Read: Disabled
          Write: Disabled

Device Statistics (GP/SMART Log 0x04) not supported

Pending Defects log (GP Log 0x0c) not supported

SATA Phy Event Counters (GP Log 0x11)
ID      Size     Value  Description
0x000a  2            6  Device-to-host register FISes sent due to a COMRESET
0x0001  2            0  Command failed due to ICRC error
0x0003  2            0  R_ERR response for device-to-host data FIS
0x0004  2            0  R_ERR response for host-to-device data FIS
0x0006  2            0  R_ERR response for device-to-host non-data FIS
0x0007  2            0  R_ERR response for host-to-device non-data FIS

