smartctl 7.3 2022-02-28 r5338 [FreeBSD 13.1-RELEASE amd64] (local build)
Copyright (C) 2002-22, Bruce Allen, Christian Franke, www.smartmontools.org

=== START OF INFORMATION SECTION ===
Model Number:                       SAMSUNG MZVL22T0HBLB-00B00
Serial Number:                      --
Firmware Version:                   GXB7301Q
PCI Vendor/Subsystem ID:            0x144d
IEEE OUI Identifier:                0x002538
Total NVM Capacity:                 2,048,408,248,320 [2.04 TB]
Unallocated NVM Capacity:           0
Controller ID:                      6
NVMe Version:                       1.3
Number of Namespaces:               1
Namespace 1 Size/Capacity:          2,048,408,248,320 [2.04 TB]
Namespace 1 Utilization:            629,063,467,008 [629 GB]
Namespace 1 Formatted LBA Size:     512
Namespace 1 IEEE EUI-64:            002538 ...
Local Time is:                      Fri Mar 17 21:47:52 2023 UTC
Firmware Updates (0x16):            3 Slots, no Reset required
Optional Admin Commands (0x0017):   Security Format Frmw_DL Self_Test
Optional NVM Commands (0x0057):     Comp Wr_Unc DS_Mngmt Sav/Sel_Feat Timestmp
Log Page Attributes (0x0e):         Cmd_Eff_Lg Ext_Get_Lg Telmtry_Lg
Maximum Data Transfer Size:         128 Pages
Warning  Comp. Temp. Threshold:     81 Celsius
Critical Comp. Temp. Threshold:     85 Celsius

Supported Power States
St Op     Max   Active     Idle   RL RT WL WT  Ent_Lat  Ex_Lat
 0 +     8.37W       -        -    0  0  0  0        0       0
 1 +     8.37W       -        -    1  1  1  1        0     200
 2 +     8.37W       -        -    2  2  2  2        0     200
 3 -   0.0500W       -        -    3  3  3  3     2000    1200
 4 -   0.0050W       -        -    4  4  4  4      500    9500

Supported LBA Sizes (NSID 0x1)
Id Fmt  Data  Metadt  Rel_Perf
 0 +     512       0         0

=== START OF SMART DATA SECTION ===
SMART overall-health self-assessment test result: PASSED

SMART/Health Information (NVMe Log 0x02)
Critical Warning:                   0x00
Temperature:                        40 Celsius
Available Spare:                    77%
Available Spare Threshold:          10%
Percentage Used:                    1%
Data Units Read:                    70,665,985 [36.1 TB]
Data Units Written:                 72,189,176 [36.9 TB]
Host Read Commands:                 816,838,918
Host Write Commands:                500,248,270
Controller Busy Time:               2,240
Power Cycles:                       1,693
Power On Hours:                     5,236
Unsafe Shutdowns:                   96
Media and Data Integrity Errors:    1,878
Error Information Log Entries:      1,878
Warning  Comp. Temperature Time:    0
Critical Comp. Temperature Time:    0
Temperature Sensor 1:               40 Celsius
Temperature Sensor 2:               42 Celsius

Error Information (NVMe Log 0x01, 16 of 64 entries)
No Errors Logged

