smartctl 7.3 2022-02-28 r5338 [FreeBSD 13.1-RELEASE-p5 amd64] (local build)
Copyright (C) 2002-22, Bruce Allen, Christian Franke, www.smartmontools.org

=== START OF INFORMATION SECTION ===
Model Number:                       CT250P2SSD8
Serial Number:                      --
Firmware Version:                   P2CR045
PCI Vendor/Subsystem ID:            0xc0a9
IEEE OUI Identifier:                0x00a075
Total NVM Capacity:                 250,059,350,016 [250 GB]
Unallocated NVM Capacity:           0
Controller ID:                      1
NVMe Version:                       1.3
Number of Namespaces:               1
Namespace 1 Size/Capacity:          250,059,350,016 [250 GB]
Namespace 1 Formatted LBA Size:     512
Namespace 1 IEEE EUI-64:            00a075 ...
Local Time is:                      Mon Dec  5 21:33:56 2022 UTC
Firmware Updates (0x12):            1 Slot, no Reset required
Optional Admin Commands (0x0017):   Security Format Frmw_DL Self_Test
Optional NVM Commands (0x005e):     Wr_Unc DS_Mngmt Wr_Zero Sav/Sel_Feat Timestmp
Log Page Attributes (0x0e):         Cmd_Eff_Lg Ext_Get_Lg Telmtry_Lg
Maximum Data Transfer Size:         64 Pages
Warning  Comp. Temp. Threshold:     70 Celsius
Critical Comp. Temp. Threshold:     85 Celsius

Supported Power States
St Op     Max   Active     Idle   RL RT WL WT  Ent_Lat  Ex_Lat
 0 +     3.50W       -        -    0  0  0  0        0       0
 1 +     1.90W       -        -    1  1  1  1        0       0
 2 +     1.50W       -        -    2  2  2  2        0       0
 3 -   0.0700W       -        -    3  3  3  3     5000    1900
 4 -   0.0020W       -        -    4  4  4  4    13000  100000

Supported LBA Sizes (NSID 0x1)
Id Fmt  Data  Metadt  Rel_Perf
 0 +     512       0         1
 1 -    4096       0         0

=== START OF SMART DATA SECTION ===
SMART overall-health self-assessment test result: FAILED!
- temperature is above or below threshold

SMART/Health Information (NVMe Log 0x02)
Critical Warning:                   0x02
Temperature:                        70 Celsius
Available Spare:                    100%
Available Spare Threshold:          5%
Percentage Used:                    2%
Data Units Read:                    5,684,971 [2.91 TB]
Data Units Written:                 14,283,927 [7.31 TB]
Host Read Commands:                 92,969,009
Host Write Commands:                509,102,099
Controller Busy Time:               1,404
Power Cycles:                       71
Power On Hours:                     6,379
Unsafe Shutdowns:                   27
Media and Data Integrity Errors:    0
Error Information Log Entries:      1,095
Warning  Comp. Temperature Time:    244
Critical Comp. Temperature Time:    0
Temperature Sensor 1:               86 Celsius
Thermal Temp. 1 Transition Count:   3
Thermal Temp. 2 Transition Count:   1
Thermal Temp. 1 Total Time:         246811
Thermal Temp. 2 Total Time:         98791

Error Information (NVMe Log 0x01, 16 of 16 entries)
No Errors Logged

