smartctl 7.1 2019-12-30 r5022 [FreeBSD 12.1-RELEASE-p1 amd64] (local build)
Copyright (C) 2002-19, Bruce Allen, Christian Franke, www.smartmontools.org

=== START OF INFORMATION SECTION ===
Model Family:     Intel 320 Series SSDs
Device Model:     INTEL SSDSA2CT040G3
Serial Number:    --
LU WWN Device Id: 5 001517 ...
Firmware Version: 4PC10362
User Capacity:    40,020,664,320 bytes [40.0 GB]
Sector Size:      512 bytes logical/physical
Rotation Rate:    Solid State Device
Device is:        In smartctl database [for details use: -P show]
ATA Version is:   ATA8-ACS T13/1699-D revision 4
SATA Version is:  SATA 2.6, 3.0 Gb/s
Local Time is:    Thu Jun  4 16:07:11 2020 CEST
SMART support is: Available - device has SMART capability.
SMART support is: Enabled
AAM feature is:   Unavailable
APM feature is:   Unavailable
Rd look-ahead is: Enabled
Write cache is:   Enabled
DSN feature is:   Unavailable
ATA Security is:  Disabled, NOT FROZEN [SEC1]
Unexpected SCT status 0x0002 (action_code=4, function_code=2)
Wt Cache Reorder: Unknown (SCT Feature Control command failed)

=== START OF READ SMART DATA SECTION ===
SMART overall-health self-assessment test result: PASSED

General SMART Values:
Offline data collection status:  (0x00)	Offline data collection activity
					was never started.
					Auto Offline Data Collection: Disabled.
Self-test execution status:      (   0)	The previous self-test routine completed
					without error or no self-test has ever 
					been run.
Total time to complete Offline 
data collection: 		(    1) seconds.
Offline data collection
capabilities: 			 (0x75) SMART execute Offline immediate.
					No Auto Offline data collection support.
					Abort Offline collection upon new
					command.
					No Offline surface scan supported.
					Self-test supported.
					Conveyance Self-test supported.
					Selective Self-test supported.
SMART capabilities:            (0x0003)	Saves SMART data before entering
					power-saving mode.
					Supports SMART auto save timer.
Error logging capability:        (0x01)	Error logging supported.
					General Purpose Logging supported.
Short self-test routine 
recommended polling time: 	 (   1) minutes.
Extended self-test routine
recommended polling time: 	 (   1) minutes.
Conveyance self-test routine
recommended polling time: 	 (   1) minutes.
SCT capabilities: 	       (0x003d)	SCT Status supported.
					SCT Error Recovery Control supported.
					SCT Feature Control supported.
					SCT Data Table supported.

SMART Attributes Data Structure revision number: 5
Vendor Specific SMART Attributes with Thresholds:
ID# ATTRIBUTE_NAME          FLAGS    VALUE WORST THRESH FAIL RAW_VALUE
  3 Spin_Up_Time            -----K   100   100   000    -    0
  4 Start_Stop_Count        ----CK   100   100   000    -    0
  5 Reallocated_Sector_Ct   -O--CK   100   100   000    -    0
  9 Power_On_Hours          -O--CK   100   100   000    -    22163
 12 Power_Cycle_Count       -O--CK   100   100   000    -    3722
170 Reserve_Block_Count     PO--CK   100   100   010    -    0
171 Program_Fail_Count      -O--CK   100   100   000    -    0
172 Erase_Fail_Count        -O--CK   100   100   000    -    0
183 SATA_Downshift_Count    ----CK   100   100   000    -    3582
184 End-to-End_Error        -O--CK   100   100   090    -    0
187 Reported_Uncorrect      -O--CK   100   100   000    -    0
192 Unsafe_Shutdown_Count   -O--CK   100   100   000    -    205
199 CRC_Error_Count         ----CK   100   100   000    -    0
225 Host_Writes_32MiB       -O--CK   100   100   000    -    112899
226 Workld_Media_Wear_Indic -O--CK   100   100   000    -    32264075
227 Workld_Host_Reads_Perc  -O--CK   100   100   000    -    2
228 Workload_Minutes        -O--CK   100   100   000    -    2236618971
232 Available_Reservd_Space PO--CK   100   100   010    -    0
233 Media_Wearout_Indicator -O--CK   098   098   000    -    0
241 Host_Writes_32MiB       -O--CK   100   100   000    -    112899
242 Host_Reads_32MiB        -O--CK   100   100   000    -    452068
                            ||||||_ K auto-keep
                            |||||__ C event count
                            ||||___ R error rate
                            |||____ S speed/performance
                            ||_____ O updated online
                            |______ P prefailure warning

Log Directories not read due to '-F nologdir' option

SMART Extended Comprehensive Error Log Version: 1 (2 sectors)
No Errors Logged

SMART Extended Self-test Log Version: 1 (2 sectors)
Num  Test_Description    Status                  Remaining  LifeTime(hours)  LBA_of_first_error
# 1  Offline             Completed without error       00%         0         -
# 2  Vendor (0xff)       Completed without error       00%         0         -
# 3  Vendor (0xff)       Self-test routine in progress 150%       255         -
# 4  Offline             Self-test routine in progress 150%     65535         -
# 5  Vendor (0x4d)       Completed: electrical failure 50%     65280         65535
# 6  Offline             Completed without error       00%         0         -
# 7  Offline             Completed without error       00%         0         -
# 8  Offline             Completed without error       00%         0         -
# 9  Vendor (0xff)       Completed without error       00%         0         -
#10  Vendor (0xff)       Self-test routine in progress 150%       255         -
#11  Offline             Self-test routine in progress 150%     65535         -
#12  Vendor (0x55)       Completed: electrical failure 60%     65280         65535
#13  Vendor (0xc8)       Completed without error       00%     22077         -
#14  Offline             Completed without error       00%       232         -
#15  Offline             Completed without error       00%         0         -
#16  Offline             Completed without error       00%         0         -
#17  Offline             Completed without error       00%         0         -
#18  Offline             Completed without error       00%         0         -
#19  Offline             Completed without error       00%         0         -
#20  Offline             Completed without error       00%         0         -
#21  Vendor (0xff)       Completed without error       00%         0         -
#22  Vendor (0xff)       Self-test routine in progress 150%       255         -
#23  Offline             Self-test routine in progress 150%     65535         -
#24  Vendor (0x4d)       Completed: electrical failure 50%     65280         65535
#25  Offline             Completed without error       00%         0         -

SMART Selective self-test log data structure revision number 0
Note: revision number not 1 implies that no selective self-test has ever been run
 SPAN  MIN_LBA  MAX_LBA  CURRENT_TEST_STATUS
    1        0        0  Not_testing
    2        0        0  Not_testing
    3        0        0  Not_testing
    4        0        0  Not_testing
    5        0        0  Not_testing
Selective self-test flags (0x0):
  After scanning selected spans, do NOT read-scan remainder of disk.
If Selective self-test is pending on power-up, resume after 0 minute delay.

SCT Status Version:                  3
SCT Version (vendor specific):       1 (0x0001)
Device State:                        Active (0)
Current Temperature:                     ? Celsius
Power Cycle Min/Max Temperature:      ?/ ? Celsius
Lifetime    Min/Max Temperature:      ?/ ? Celsius
Under/Over Temperature Limit Count:   0/0

Read SCT Data Table failed: Input/output error
Read SCT Temperature History failed

SCT Error Recovery Control:
           Read: Disabled
          Write: Disabled

Device Statistics (GP Log 0x04)
Page  Offset Size        Value Flags Description
0x01  =====  =               =  ===  == General Statistics (rev 2) ==
0x01  0x008  4            3722  ---  Lifetime Power-On Resets
0x01  0x010  4           22163  ---  Power-on Hours
0x01  0x018  6      7398992755  ---  Logical Sectors Written
0x01  0x020  6       226052580  ---  Number of Write Commands
0x01  0x028  6     29626789825  ---  Logical Sectors Read
0x01  0x030  6       376556487  ---  Number of Read Commands
0x04  =====  =               =  ===  == General Errors Statistics (rev 1) ==
0x04  0x008  4               0  ---  Number of Reported Uncorrectable Errors
0x04  0x010  4               0  ---  Resets Between Cmd Acceptance and Completion
0x06  =====  =               =  ===  == Transport Statistics (rev 1) ==
0x06  0x008  4           14906  ---  Number of Hardware Resets
0x06  0x010  4             290  ---  Number of ASR Events
0x06  0x018  4               0  ---  Number of Interface CRC Errors
0x07  =====  =               =  ===  == Solid State Device Statistics (rev 1) ==
0x07  0x008  1               2  ---  Percentage Used Endurance Indicator
                                |||_ C monitored condition met
                                ||__ D supports DSN
                                |___ N normalized value

Pending Defects log (GP Log 0x0c) not supported

SATA Phy Event Counters (GP Log 0x11)
ID      Size     Value  Description
0x0001  4            0  Command failed due to ICRC error
0x0004  4            0  R_ERR response for host-to-device data FIS
0x0007  4            0  R_ERR response for host-to-device non-data FIS
0x0008  4            0  Device-to-host non-data FIS retries
0x0009  4           19  Transition from drive PhyRdy to drive PhyNRdy
0x000a  4           20  Device-to-host register FISes sent due to a COMRESET
0x000b  4            0  CRC errors within host-to-device FIS
0x000d  4            0  Non-CRC errors within host-to-device FIS
0x000f  4            0  R_ERR response for host-to-device data FIS, CRC
0x0010  4            0  R_ERR response for host-to-device data FIS, non-CRC
0x0012  4            0  R_ERR response for host-to-device non-data FIS, CRC
0x0013  4            0  R_ERR response for host-to-device non-data FIS, non-CRC

