smartctl 7.4 2023-08-01 r5530 [FreeBSD 13.2-RELEASE-p11 amd64] (local build)
Copyright (C) 2002-23, Bruce Allen, Christian Franke, www.smartmontools.org

=== START OF INFORMATION SECTION ===
Model Family:     Western Digital Raptor
Device Model:     WDC WD1500ADFD-00NLR1
Serial Number:    --
Firmware Version: 20.07P20
User Capacity:    150,039,945,216 bytes [150 GB]
Sector Size:      512 bytes logical/physical
Device is:        In smartctl database 7.3/5528
ATA Version is:   ATA/ATAPI-7 published, ANSI INCITS 397-2005
Local Time is:    Tue Aug  6 23:11:56 2024 EDT
SMART support is: Available - device has SMART capability.
SMART support is: Enabled
AAM level is:     128 (quiet), recommended: 128
APM feature is:   Unavailable
Rd look-ahead is: Enabled
Write cache is:   Enabled
DSN feature is:   Unavailable
ATA Security is:  Disabled, frozen [SEC2]
Write SCT (Get) Feature Control Command failed: Input/output error
Wt Cache Reorder: Unknown (SCT Feature Control command failed)

=== START OF READ SMART DATA SECTION ===
SMART overall-health self-assessment test result: PASSED

General SMART Values:
Offline data collection status:  (0x84)	Offline data collection activity
					was suspended by an interrupting command from host.
					Auto Offline Data Collection: Enabled.
Self-test execution status:      (   0)	The previous self-test routine completed
					without error or no self-test has ever 
					been run.
Total time to complete Offline 
data collection: 		( 4783) seconds.
Offline data collection
capabilities: 			 (0x7b) SMART execute Offline immediate.
					Auto Offline data collection on/off support.
					Suspend Offline collection upon new
					command.
					Offline surface scan supported.
					Self-test supported.
					Conveyance Self-test supported.
					Selective Self-test supported.
SMART capabilities:            (0x0003)	Saves SMART data before entering
					power-saving mode.
					Supports SMART auto save timer.
Error logging capability:        (0x01)	Error logging supported.
					General Purpose Logging supported.
Short self-test routine 
recommended polling time: 	 (   2) minutes.
Extended self-test routine
recommended polling time: 	 (  72) minutes.
Conveyance self-test routine
recommended polling time: 	 (   5) minutes.
SCT capabilities: 	       (0x103f)	SCT Status supported.
					SCT Error Recovery Control supported.
					SCT Feature Control supported.
					SCT Data Table supported.

SMART Attributes Data Structure revision number: 16
Vendor Specific SMART Attributes with Thresholds:
ID# ATTRIBUTE_NAME          FLAGS    VALUE WORST THRESH FAIL RAW_VALUE
  1 Raw_Read_Error_Rate     PO-R--   200   200   051    -    0
  3 Spin_Up_Time            POS---   174   155   021    -    4300
  4 Start_Stop_Count        -O--CK   100   100   040    -    711
  5 Reallocated_Sector_Ct   PO--CK   200   200   140    -    0
  7 Seek_Error_Rate         -O-R--   200   200   051    -    0
  9 Power_On_Hours          -O--CK   044   044   000    -    40969
 10 Spin_Retry_Count        -O--C-   100   100   051    -    0
 11 Calibration_Retry_Count -O--C-   100   100   051    -    0
 12 Power_Cycle_Count       -O--CK   100   100   000    -    706
194 Temperature_Celsius     -O---K   094   094   000    -    53
196 Reallocated_Event_Count -O--CK   200   200   000    -    0
197 Current_Pending_Sector  -O--C-   200   200   000    -    0
198 Offline_Uncorrectable   -O--C-   200   200   000    -    0
199 UDMA_CRC_Error_Count    -O-R--   200   253   000    -    0
200 Multi_Zone_Error_Rate   ---R--   200   200   051    -    0
                            ||||||_ K auto-keep
                            |||||__ C event count
                            ||||___ R error rate
                            |||____ S speed/performance
                            ||_____ O updated online
                            |______ P prefailure warning

General Purpose Log Directory Version 1
SMART           Log Directory Version 1 [multi-sector log support]
Address    Access  R/W   Size  Description
0x00       GPL,SL  R/O      1  Log Directory
0x01           SL  R/O      1  Summary SMART error log
0x02           SL  R/O      2  Comprehensive SMART error log
0x03       GPL     R/O      2  Ext. Comprehensive SMART error log
0x06           SL  R/O      1  SMART self-test log
0x07       GPL     R/O      2  Extended self-test log
0x09           SL  R/W      1  Selective self-test log
0x10       GPL     R/O      1  NCQ Command Error log
0x11       GPL     R/O      1  SATA Phy Event Counters log
0x80-0x9f  GPL,SL  R/W     16  Host vendor specific log
0xa0-0xa7  GPL,SL  VS      16  Device vendor specific log
0xa8-0xb7  GPL,SL  VS       1  Device vendor specific log
0xc0       GPL,SL  VS       1  Device vendor specific log
0xe0       GPL,SL  R/W      1  SCT Command/Status
0xe1       GPL,SL  R/W      1  SCT Data Transfer

SMART Extended Comprehensive Error Log Version: 1 (2 sectors)
Device Error Count: 13 (device log contains only the most recent 8 errors)
	CR     = Command Register
	FEATR  = Features Register
	COUNT  = Count (was: Sector Count) Register
	LBA_48 = Upper bytes of LBA High/Mid/Low Registers ]  ATA-8
	LH     = LBA High (was: Cylinder High) Register    ]   LBA
	LM     = LBA Mid (was: Cylinder Low) Register      ] Register
	LL     = LBA Low (was: Sector Number) Register     ]
	DV     = Device (was: Device/Head) Register
	DC     = Device Control Register
	ER     = Error register
	ST     = Status register
Powered_Up_Time is measured from power on, and printed as
DDd+hh:mm:SS.sss where DD=days, hh=hours, mm=minutes,
SS=sec, and sss=millisec. It "wraps" after 49.710 days.

Error 13 [0] occurred at disk power-on lifetime: 1828 hours (76 days + 4 hours)
  When the command that caused the error occurred, the device was active or idle.

  After command completion occurred, registers were:
  ER -- ST COUNT  LBA_48  LH LM LL DV DC
  -- -- -- == -- == == == -- -- -- -- --
  40 -- 51 00 00 00 00 01 14 2d 26 e0 00  Error: UNC at LBA = 0x01142d26 = 18099494

  Commands leading to the command that caused the error were:
  CR FEATR COUNT  LBA_48  LH LM LL DV DC  Powered_Up_Time  Command/Feature_Name
  -- == -- == -- == == == -- -- -- -- --  ---------------  --------------------
  25 00 00 04 00 00 00 01 14 2c 00 40 00 16d+03:56:14.454  READ DMA EXT
  25 00 00 04 00 00 00 01 14 28 00 40 00 16d+03:56:14.454  READ DMA EXT
  25 00 00 04 00 00 00 01 14 24 00 40 00 16d+03:56:14.454  READ DMA EXT
  25 00 00 04 00 00 00 01 14 20 00 40 00 16d+03:56:14.454  READ DMA EXT
  25 00 00 04 00 00 00 01 14 1c 00 40 00 16d+03:56:14.454  READ DMA EXT

Error 12 [7] log entry is empty
Error 11 [6] log entry is empty
Error 10 [5] log entry is empty
Error 9 [4] log entry is empty
Error 8 [3] occurred at disk power-on lifetime: 1811 hours (75 days + 11 hours)
  When the command that caused the error occurred, the device was doing SMART Offline or Self-test.

  After command completion occurred, registers were:
  ER -- ST COUNT  LBA_48  LH LM LL DV DC
  -- -- -- == -- == == == -- -- -- -- --
  40 -- 51 00 00 00 00 00 8a a8 48 e0 00  Error: UNC at LBA = 0x008aa848 = 9087048

  Commands leading to the command that caused the error were:
  CR FEATR COUNT  LBA_48  LH LM LL DV DC  Powered_Up_Time  Command/Feature_Name
  -- == -- == -- == == == -- -- -- -- --  ---------------  --------------------
  25 00 00 04 00 00 00 00 8a a7 1b 40 00 15d+10:40:04.404  READ DMA EXT
  25 00 00 04 00 00 00 00 8a a3 1b 40 00 15d+10:40:04.404  READ DMA EXT
  25 00 00 04 00 00 00 00 8a 9f 1b 40 00 15d+10:40:04.404  READ DMA EXT
  25 00 00 04 00 00 00 00 8a 9b 1b 40 00 15d+10:40:04.404  READ DMA EXT
  25 00 00 04 00 00 00 00 8a 97 1b 40 00 15d+10:40:04.404  READ DMA EXT

Error 7 [2] occurred at disk power-on lifetime: 1810 hours (75 days + 10 hours)
  When the command that caused the error occurred, the device was doing SMART Offline or Self-test.

  After command completion occurred, registers were:
  ER -- ST COUNT  LBA_48  LH LM LL DV DC
  -- -- -- == -- == == == -- -- -- -- --
  40 -- 51 00 f8 00 00 00 8a a8 48 e0 00  Error: UNC 248 sectors at LBA = 0x008aa848 = 9087048

  Commands leading to the command that caused the error were:
  CR FEATR COUNT  LBA_48  LH LM LL DV DC  Powered_Up_Time  Command/Feature_Name
  -- == -- == -- == == == -- -- -- -- --  ---------------  --------------------
  25 00 00 03 f8 00 00 00 8a a8 18 40 00 15d+09:59:40.004  READ DMA EXT
  25 00 00 04 00 00 00 00 8a a8 10 40 00 15d+09:59:40.004  READ DMA EXT
  25 00 00 04 00 00 00 00 8a a8 10 40 00 15d+09:59:40.004  READ DMA EXT
  25 00 00 04 00 00 00 00 8a a8 10 40 00 15d+09:59:40.004  READ DMA EXT
  25 00 00 04 00 00 00 00 8a a8 10 40 00 15d+09:59:40.004  READ DMA EXT

Error 6 [1] occurred at disk power-on lifetime: 1810 hours (75 days + 10 hours)
  When the command that caused the error occurred, the device was doing SMART Offline or Self-test.

  After command completion occurred, registers were:
  ER -- ST COUNT  LBA_48  LH LM LL DV DC
  -- -- -- == -- == == == -- -- -- -- --
  40 -- 51 00 00 00 00 00 8a a8 48 e0 00  Error: UNC at LBA = 0x008aa848 = 9087048

  Commands leading to the command that caused the error were:
  CR FEATR COUNT  LBA_48  LH LM LL DV DC  Powered_Up_Time  Command/Feature_Name
  -- == -- == -- == == == -- -- -- -- --  ---------------  --------------------
  25 00 00 04 00 00 00 00 8a a8 10 40 00 15d+09:59:37.004  READ DMA EXT
  25 00 00 04 00 00 00 00 8a a8 10 40 00 15d+09:59:37.004  READ DMA EXT
  25 00 00 04 00 00 00 00 8a a8 10 40 00 15d+09:59:37.004  READ DMA EXT
  25 00 00 04 00 00 00 00 8a a8 10 40 00 15d+09:59:37.004  READ DMA EXT
  25 00 00 04 00 00 00 00 8a a8 10 40 00 15d+09:59:37.004  READ DMA EXT

SMART Extended Self-test Log Version: 1 (2 sectors)
No self-tests have been logged.  [To run self-tests, use: smartctl -t]

SMART Selective self-test log data structure revision number 1
 SPAN  MIN_LBA  MAX_LBA  CURRENT_TEST_STATUS
    1        0        0  Not_testing
    2        0        0  Not_testing
    3        0        0  Not_testing
    4        0        0  Not_testing
    5        0        0  Not_testing
Selective self-test flags (0x0):
  After scanning selected spans, do NOT read-scan remainder of disk.
If Selective self-test is pending on power-up, resume after 0 minute delay.

SCT Status Version:                  2
SCT Version (vendor specific):       258 (0x0102)
Device State:                        SMART Off-line Data Collection executing in background (4)
Current Temperature:                    53 Celsius
Power Cycle Min/Max Temperature:     --/56 Celsius
Lifetime    Min/Max Temperature:     --/127 Celsius

SCT Temperature History Version:     2
Temperature Sampling Period:         1 minute
Temperature Logging Interval:        1 minute
Min/Max recommended Temperature:      5/55 Celsius
Min/Max Temperature Limit:            1/60 Celsius
Temperature History Size (Index):    128 (92)

SCT Error Recovery Control:
           Read: Disabled
          Write: Disabled

Device Statistics (GP/SMART Log 0x04) not supported

Pending Defects log (GP Log 0x0c) not supported

SATA Phy Event Counters (GP Log 0x11)
ID      Size     Value  Description
0x0001  2            0  Command failed due to ICRC error
0x000a  2           11  Device-to-host register FISes sent due to a COMRESET
0x8000  4      1756195  Vendor specific

