smartctl 7.4 2023-08-01 r5530 [FreeBSD 13.2-RELEASE amd64] (local build)
Copyright (C) 2002-23, Bruce Allen, Christian Franke, www.smartmontools.org

=== START OF INFORMATION SECTION ===
Model Family:     SAMSUNG SpinPoint F1 DT
Device Model:     SAMSUNG HD161GJ
Serial Number:    --
LU WWN Device Id: 5 0024e9 ...
Firmware Version: 1AC01118
User Capacity:    160,040,803,840 bytes [160 GB]
Sector Size:      512 bytes logical/physical
Device is:        In smartctl database 7.3/5528
ATA Version is:   ATA/ATAPI-7, ATA8-ACS T13/1699-D revision 3b
Local Time is:    Mon Oct 30 16:46:12 2023 CET
SMART support is: Available - device has SMART capability.
SMART support is: Enabled
AAM feature is:   Disabled
APM feature is:   Disabled
Rd look-ahead is: Enabled
Write cache is:   Enabled
DSN feature is:   Unavailable
ATA Security is:  Disabled, frozen [SEC2]
Wt Cache Reorder: Enabled

=== START OF READ SMART DATA SECTION ===
SMART overall-health self-assessment test result: PASSED

General SMART Values:
Offline data collection status:  (0x00)	Offline data collection activity
					was never started.
					Auto Offline Data Collection: Disabled.
Self-test execution status:      (   0)	The previous self-test routine completed
					without error or no self-test has ever 
					been run.
Total time to complete Offline 
data collection: 		( 2115) seconds.
Offline data collection
capabilities: 			 (0x7b) SMART execute Offline immediate.
					Auto Offline data collection on/off support.
					Suspend Offline collection upon new
					command.
					Offline surface scan supported.
					Self-test supported.
					Conveyance Self-test supported.
					Selective Self-test supported.
SMART capabilities:            (0x0003)	Saves SMART data before entering
					power-saving mode.
					Supports SMART auto save timer.
Error logging capability:        (0x01)	Error logging supported.
					General Purpose Logging supported.
Short self-test routine 
recommended polling time: 	 (   2) minutes.
Extended self-test routine
recommended polling time: 	 (  36) minutes.
Conveyance self-test routine
recommended polling time: 	 (   5) minutes.
SCT capabilities: 	       (0x003f)	SCT Status supported.
					SCT Error Recovery Control supported.
					SCT Feature Control supported.
					SCT Data Table supported.

SMART Attributes Data Structure revision number: 16
Vendor Specific SMART Attributes with Thresholds:
ID# ATTRIBUTE_NAME          FLAGS    VALUE WORST THRESH FAIL RAW_VALUE
  1 Raw_Read_Error_Rate     POSR--   099   099   051    -    16774
  3 Spin_Up_Time            POS---   086   086   011    -    5240
  4 Start_Stop_Count        -O--CK   098   098   000    -    1776
  5 Reallocated_Sector_Ct   PO--CK   097   097   010    -    19
  7 Seek_Error_Rate         POSR--   253   253   051    -    0
  8 Seek_Time_Performance   P-S--K   100   100   015    -    0
  9 Power_On_Hours          -O--CK   100   100   000    -    1820
 10 Spin_Retry_Count        PO--CK   100   100   051    -    0
 11 Calibration_Retry_Count -O--C-   100   100   000    -    0
 12 Power_Cycle_Count       -O--CK   098   098   000    -    1758
 13 Read_Soft_Error_Rate    -OSR--   099   099   000    -    16774
183 Runtime_Bad_Block       -O--CK   100   100   000    -    10
184 End-to-End_Error        PO--CK   100   100   000    -    0
187 Reported_Uncorrect      -O--CK   100   100   000    -    17072
188 Command_Timeout         -O--CK   100   100   000    -    0
190 Airflow_Temperature_Cel -O---K   084   065   000    -    16 (Min/Max 16/16)
194 Temperature_Celsius     -O---K   079   060   000    -    21 (Min/Max 16/21)
195 Hardware_ECC_Recovered  -O-RC-   100   100   000    -    40606
196 Reallocated_Event_Count -O--CK   100   100   000    -    19
197 Current_Pending_Sector  -O--C-   098   096   000    -    70
198 Offline_Uncorrectable   ----CK   100   100   000    -    0
199 UDMA_CRC_Error_Count    -OSRCK   100   100   000    -    4
200 Multi_Zone_Error_Rate   -O-R--   100   100   000    -    0
201 Soft_Read_Error_Rate    -O-R--   253   253   000    -    0
                            ||||||_ K auto-keep
                            |||||__ C event count
                            ||||___ R error rate
                            |||____ S speed/performance
                            ||_____ O updated online
                            |______ P prefailure warning

General Purpose Log Directory Version 1
SMART           Log Directory Version 1 [multi-sector log support]
Address    Access  R/W   Size  Description
0x00       GPL,SL  R/O      1  Log Directory
0x01           SL  R/O      1  Summary SMART error log
0x02           SL  R/O      2  Comprehensive SMART error log
0x03       GPL     R/O      2  Ext. Comprehensive SMART error log
0x04       GPL     R/O      2  Device Statistics log
0x06           SL  R/O      1  SMART self-test log
0x07       GPL     R/O      2  Extended self-test log
0x09           SL  R/W      1  Selective self-test log
0x10       GPL     R/O      1  NCQ Command Error log
0x11       GPL     R/O      1  SATA Phy Event Counters log
0x20       GPL     R/O      2  Streaming performance log
0x21       GPL     R/O      1  Write stream error log
0x22       GPL     R/O      1  Read stream error log
0x80-0x9f  GPL,SL  R/W     16  Host vendor specific log
0xe0       GPL,SL  R/W      1  SCT Command/Status
0xe1       GPL,SL  R/W      1  SCT Data Transfer

SMART Extended Comprehensive Error Log Version: 1 (2 sectors)
Device Error Count: 8507 (device log contains only the most recent 8 errors)
	CR     = Command Register
	FEATR  = Features Register
	COUNT  = Count (was: Sector Count) Register
	LBA_48 = Upper bytes of LBA High/Mid/Low Registers ]  ATA-8
	LH     = LBA High (was: Cylinder High) Register    ]   LBA
	LM     = LBA Mid (was: Cylinder Low) Register      ] Register
	LL     = LBA Low (was: Sector Number) Register     ]
	DV     = Device (was: Device/Head) Register
	DC     = Device Control Register
	ER     = Error register
	ST     = Status register
Powered_Up_Time is measured from power on, and printed as
DDd+hh:mm:SS.sss where DD=days, hh=hours, mm=minutes,
SS=sec, and sss=millisec. It "wraps" after 49.710 days.

Error 8507 [2] occurred at disk power-on lifetime: 1818 hours (75 days + 18 hours)
  When the command that caused the error occurred, the device was active or idle.

  After command completion occurred, registers were:
  ER -- ST COUNT  LBA_48  LH LM LL DV DC
  -- -- -- == -- == == == -- -- -- -- --
  40 -- 51 00 00 00 00 00 04 04 a9 40 00  Error: UNC at LBA = 0x000404a9 = 263337

  Commands leading to the command that caused the error were:
  CR FEATR COUNT  LBA_48  LH LM LL DV DC  Powered_Up_Time  Command/Feature_Name
  -- == -- == -- == == == -- -- -- -- --  ---------------  --------------------
  25 00 00 00 50 00 00 00 04 04 79 40 00     00:58:12.560  READ DMA EXT

Error 8506 [1] occurred at disk power-on lifetime: 1818 hours (75 days + 18 hours)
  When the command that caused the error occurred, the device was active or idle.

  After command completion occurred, registers were:
  ER -- ST COUNT  LBA_48  LH LM LL DV DC
  -- -- -- == -- == == == -- -- -- -- --
  40 -- 51 00 00 00 00 00 04 04 a9 40 00  Error: UNC at LBA = 0x000404a9 = 263337

  Commands leading to the command that caused the error were:
  CR FEATR COUNT  LBA_48  LH LM LL DV DC  Powered_Up_Time  Command/Feature_Name
  -- == -- == -- == == == -- -- -- -- --  ---------------  --------------------
  25 00 00 00 50 00 00 00 04 04 79 40 00     00:58:10.640  READ DMA EXT

Error 8505 [0] occurred at disk power-on lifetime: 1818 hours (75 days + 18 hours)
  When the command that caused the error occurred, the device was active or idle.

  After command completion occurred, registers were:
  ER -- ST COUNT  LBA_48  LH LM LL DV DC
  -- -- -- == -- == == == -- -- -- -- --
  40 -- 51 00 00 00 00 00 04 04 a9 40 00  Error: UNC at LBA = 0x000404a9 = 263337

  Commands leading to the command that caused the error were:
  CR FEATR COUNT  LBA_48  LH LM LL DV DC  Powered_Up_Time  Command/Feature_Name
  -- == -- == -- == == == -- -- -- -- --  ---------------  --------------------
  25 00 00 00 50 00 00 00 04 04 79 40 00     00:58:08.690  READ DMA EXT

Error 8504 [7] occurred at disk power-on lifetime: 1818 hours (75 days + 18 hours)
  When the command that caused the error occurred, the device was active or idle.

  After command completion occurred, registers were:
  ER -- ST COUNT  LBA_48  LH LM LL DV DC
  -- -- -- == -- == == == -- -- -- -- --
  40 -- 51 00 00 00 00 00 04 04 a9 40 00  Error: UNC at LBA = 0x000404a9 = 263337

  Commands leading to the command that caused the error were:
  CR FEATR COUNT  LBA_48  LH LM LL DV DC  Powered_Up_Time  Command/Feature_Name
  -- == -- == -- == == == -- -- -- -- --  ---------------  --------------------
  25 00 00 00 50 00 00 00 04 04 79 40 00     00:58:06.750  READ DMA EXT
  35 00 00 00 01 00 00 00 04 8c 40 40 00     00:58:06.750  WRITE DMA EXT
  35 00 00 00 01 00 00 00 04 8a ac 40 00     00:58:06.750  WRITE DMA EXT
  2f 00 00 00 01 00 00 00 00 00 10 00 00     00:58:06.750  READ LOG EXT

Error 8503 [6] occurred at disk power-on lifetime: 1818 hours (75 days + 18 hours)
  When the command that caused the error occurred, the device was active or idle.

  After command completion occurred, registers were:
  ER -- ST COUNT  LBA_48  LH LM LL DV DC
  -- -- -- == -- == == == -- -- -- -- --
  00 -- 42 00 00 00 00 00 04 04 a8 40 00   at LBA = 0x000404a8 = 263336

  Commands leading to the command that caused the error were:
  CR FEATR COUNT  LBA_48  LH LM LL DV DC  Powered_Up_Time  Command/Feature_Name
  -- == -- == -- == == == -- -- -- -- --  ---------------  --------------------
  60 00 00 00 50 00 00 00 04 04 79 40 00     00:58:04.780  READ FPDMA QUEUED
  60 00 00 00 40 00 00 00 04 04 39 40 00     00:58:04.780  READ FPDMA QUEUED
  61 00 00 00 01 00 00 00 04 8c 40 40 00     00:58:04.780  WRITE FPDMA QUEUED
  61 00 d2 00 01 00 00 00 04 8a ac 40 00     00:58:04.780  WRITE FPDMA QUEUED
  61 00 00 00 01 00 00 00 04 8a 19 40 00     00:58:04.780  WRITE FPDMA QUEUED

Error 8502 [5] occurred at disk power-on lifetime: 1818 hours (75 days + 18 hours)
  When the command that caused the error occurred, the device was active or idle.

  After command completion occurred, registers were:
  ER -- ST COUNT  LBA_48  LH LM LL DV DC
  -- -- -- == -- == == == -- -- -- -- --
  40 -- 51 00 00 00 00 00 04 04 a9 40 00  Error: UNC at LBA = 0x000404a9 = 263337

  Commands leading to the command that caused the error were:
  CR FEATR COUNT  LBA_48  LH LM LL DV DC  Powered_Up_Time  Command/Feature_Name
  -- == -- == -- == == == -- -- -- -- --  ---------------  --------------------
  25 00 00 02 00 00 00 00 04 03 79 40 00     00:58:02.810  READ DMA EXT

Error 8501 [4] occurred at disk power-on lifetime: 1818 hours (75 days + 18 hours)
  When the command that caused the error occurred, the device was active or idle.

  After command completion occurred, registers were:
  ER -- ST COUNT  LBA_48  LH LM LL DV DC
  -- -- -- == -- == == == -- -- -- -- --
  40 -- 51 00 00 00 00 00 04 04 a9 40 00  Error: UNC at LBA = 0x000404a9 = 263337

  Commands leading to the command that caused the error were:
  CR FEATR COUNT  LBA_48  LH LM LL DV DC  Powered_Up_Time  Command/Feature_Name
  -- == -- == -- == == == -- -- -- -- --  ---------------  --------------------
  25 00 00 02 00 00 00 00 04 03 79 40 00     00:58:00.870  READ DMA EXT

Error 8500 [3] occurred at disk power-on lifetime: 1818 hours (75 days + 18 hours)
  When the command that caused the error occurred, the device was active or idle.

  After command completion occurred, registers were:
  ER -- ST COUNT  LBA_48  LH LM LL DV DC
  -- -- -- == -- == == == -- -- -- -- --
  40 -- 51 00 00 00 00 00 04 04 a9 40 00  Error: UNC at LBA = 0x000404a9 = 263337

  Commands leading to the command that caused the error were:
  CR FEATR COUNT  LBA_48  LH LM LL DV DC  Powered_Up_Time  Command/Feature_Name
  -- == -- == -- == == == -- -- -- -- --  ---------------  --------------------
  25 00 00 02 00 00 00 00 04 03 79 40 00     00:57:58.930  READ DMA EXT

SMART Extended Self-test Log Version: 1 (2 sectors)
No self-tests have been logged.  [To run self-tests, use: smartctl -t]

SMART Selective self-test log data structure revision number 1
 SPAN  MIN_LBA  MAX_LBA  CURRENT_TEST_STATUS
    1        0        0  Not_testing
    2        0        0  Not_testing
    3        0        0  Not_testing
    4        0        0  Not_testing
    5        0        0  Not_testing
Selective self-test flags (0x0):
  After scanning selected spans, do NOT read-scan remainder of disk.
If Selective self-test is pending on power-up, resume after 0 minute delay.

SCT Status Version:                  2
SCT Version (vendor specific):       256 (0x0100)
Device State:                        Active (0)
Current Temperature:                    21 Celsius
Power Cycle Min/Max Temperature:     --/21 Celsius
Lifetime    Min/Max Temperature:     --/40 Celsius

SCT Temperature History Version:     2
Temperature Sampling Period:         1 minute
Temperature Logging Interval:        1 minute
Min/Max recommended Temperature:     -4/72 Celsius
Min/Max Temperature Limit:           -9/77 Celsius
Temperature History Size (Index):    128 (80)

SCT Error Recovery Control:
           Read: Disabled
          Write: Disabled

ATA_READ_LOG_EXT (addr=0x04:0x00, page=0, n=1) failed: Input/output error
Read Device Statistics page 0x00 failed

Pending Defects log (GP Log 0x0c) not supported

SATA Phy Event Counters (GP Log 0x11)
ID      Size     Value  Description
0x000a  2            3  Device-to-host register FISes sent due to a COMRESET
0x0001  2            0  Command failed due to ICRC error
0x0002  2            0  R_ERR response for data FIS
0x0003  2            0  R_ERR response for device-to-host data FIS
0x0004  2            0  R_ERR response for host-to-device data FIS
0x0005  2            0  R_ERR response for non-data FIS
0x0006  2            0  R_ERR response for device-to-host non-data FIS
0x0007  2            0  R_ERR response for host-to-device non-data FIS
0x0008  2            0  Device-to-host non-data FIS retries
0x0009  2            3  Transition from drive PhyRdy to drive PhyNRdy
0x000b  2            0  CRC errors within host-to-device FIS
0x000d  2            0  Non-CRC errors within host-to-device FIS
0x000f  2            0  R_ERR response for host-to-device data FIS, CRC
0x0010  2            0  R_ERR response for host-to-device data FIS, non-CRC
0x0012  2            0  R_ERR response for host-to-device non-data FIS, CRC
0x0013  2            0  R_ERR response for host-to-device non-data FIS, non-CRC



