smartctl 7.4 2023-08-01 r5530 [FreeBSD 13.2-RELEASE-p2 amd64] (local build)
Copyright (C) 2002-23, Bruce Allen, Christian Franke, www.smartmontools.org

=== START OF INFORMATION SECTION ===
Model Number:                       TEAM TM8FP6256G
Serial Number:                      --
Firmware Version:                   VC2S038C
PCI Vendor/Subsystem ID:            0x10ec
IEEE OUI Identifier:                0x00e04c
Controller ID:                      1
NVMe Version:                       1.4
Number of Namespaces:               1
Namespace 1 Size/Capacity:          256,060,514,304 [256 GB]
Namespace 1 Formatted LBA Size:     512
Namespace 1 IEEE EUI-64:            00e04c ...
Local Time is:                      Sat Sep  2 03:54:57 2023 EDT
Firmware Updates (0x02):            1 Slot
Optional Admin Commands (0x0017):   Security Format Frmw_DL Self_Test
Optional NVM Commands (0x0054):     DS_Mngmt Sav/Sel_Feat Timestmp
Log Page Attributes (0x02):         Cmd_Eff_Lg
Maximum Data Transfer Size:         32 Pages
Warning  Comp. Temp. Threshold:     100 Celsius
Critical Comp. Temp. Threshold:     110 Celsius

Supported Power States
St Op     Max   Active     Idle   RL RT WL WT  Ent_Lat  Ex_Lat
 0 +     8.00W       -        -    0  0  0  0        0       0
 1 +     4.00W       -        -    1  1  1  1        0       0
 2 +     3.00W       -        -    2  2  2  2        0       0
 3 -   0.0300W       -        -    3  3  3  3     5000   10000
 4 -   0.0050W       -        -    4  4  4  4    54000   45000

Supported LBA Sizes (NSID 0x1)
Id Fmt  Data  Metadt  Rel_Perf
 0 +     512       0         0

=== START OF SMART DATA SECTION ===
SMART overall-health self-assessment test result: PASSED

SMART/Health Information (NVMe Log 0x02)
Critical Warning:                   0x00
Temperature:                        49 Celsius
Available Spare:                    100%
Available Spare Threshold:          32%
Percentage Used:                    0%
Data Units Read:                    255,524 [130 GB]
Data Units Written:                 1,418,257 [726 GB]
Host Read Commands:                 3,816,095
Host Write Commands:                15,571,024
Controller Busy Time:               0
Power Cycles:                       47
Power On Hours:                     387
Unsafe Shutdowns:                   23
Media and Data Integrity Errors:    0
Error Information Log Entries:      0
Warning  Comp. Temperature Time:    0
Critical Comp. Temperature Time:    0

Error Information (NVMe Log 0x01, 8 of 8 entries)
No Errors Logged

Self-test Log (NVMe Log 0x06)
Self-test status: No self-test in progress
No Self-tests Logged

