smartctl 7.3 2022-02-28 r5338 [FreeBSD 13.2-RELEASE-p1 amd64] (local build)
Copyright (C) 2002-22, Bruce Allen, Christian Franke, www.smartmontools.org

=== START OF INFORMATION SECTION ===
Model Number:                       Patriot M.2 P310 240GB
Serial Number:                      --
Firmware Version:                   EDFM90.1
PCI Vendor/Subsystem ID:            0x1987
IEEE OUI Identifier:                0x6479a7
Total NVM Capacity:                 240,057,409,536 [240 GB]
Unallocated NVM Capacity:           0
Controller ID:                      1
NVMe Version:                       1.3
Number of Namespaces:               1
Namespace 1 Size/Capacity:          240,057,409,536 [240 GB]
Namespace 1 Formatted LBA Size:     512
Namespace 1 IEEE EUI-64:            6479a7 ...
Local Time is:                      Tue Aug  8 06:55:30 2023 AEST
Firmware Updates (0x12):            1 Slot, no Reset required
Optional Admin Commands (0x0017):   Security Format Frmw_DL Self_Test
Optional NVM Commands (0x005e):     Wr_Unc DS_Mngmt Wr_Zero Sav/Sel_Feat Timestmp
Log Page Attributes (0x0a):         Cmd_Eff_Lg Telmtry_Lg
Maximum Data Transfer Size:         64 Pages
Warning  Comp. Temp. Threshold:     70 Celsius
Critical Comp. Temp. Threshold:     80 Celsius

Supported Power States
St Op     Max   Active     Idle   RL RT WL WT  Ent_Lat  Ex_Lat
 0 +     4.50W       -        -    0  0  0  0        0       0
 1 +     2.70W       -        -    1  1  1  1        0       0
 2 +     2.16W       -        -    2  2  2  2        0       0
 3 -   0.0700W       -        -    3  3  3  3     5000    1900
 4 -   0.0050W       -        -    4  4  4  4    13000  100000

Supported LBA Sizes (NSID 0x1)
Id Fmt  Data  Metadt  Rel_Perf
 0 +     512       0         1
 1 -    4096       0         0

=== START OF SMART DATA SECTION ===
SMART overall-health self-assessment test result: PASSED

SMART/Health Information (NVMe Log 0x02)
Critical Warning:                   0x00
Temperature:                        64 Celsius
Available Spare:                    100%
Available Spare Threshold:          5%
Percentage Used:                    7%
Data Units Read:                    1,351,586 [692 GB]
Data Units Written:                 40,651,288 [20.8 TB]
Host Read Commands:                 28,973,111
Host Write Commands:                249,090,934
Controller Busy Time:               1,256
Power Cycles:                       26
Power On Hours:                     4,705
Unsafe Shutdowns:                   9
Media and Data Integrity Errors:    0
Error Information Log Entries:      0
Warning  Comp. Temperature Time:    18324
Critical Comp. Temperature Time:    172
Temperature Sensor 1:               82 Celsius
Thermal Temp. 1 Transition Count:   459
Thermal Temp. 2 Transition Count:   62
Thermal Temp. 1 Total Time:         9499669
Thermal Temp. 2 Total Time:         5178646

Error Information (NVMe Log 0x01, 16 of 16 entries)
No Errors Logged

