smartctl 7.2 2020-12-30 r5155 [FreeBSD 13.0-RELEASE amd64] (local build)
Copyright (C) 2002-20, Bruce Allen, Christian Franke, www.smartmontools.org

=== START OF INFORMATION SECTION ===
Device Model:     INTEL SSDSC2BF180A4L
Serial Number:    --
LU WWN Device Id: 5 5cd2e4 ...
Firmware Version: LADi
User Capacity:    180,045,766,656 bytes [180 GB]
Sector Size:      512 bytes logical/physical
Rotation Rate:    Solid State Device
TRIM Command:     Available, deterministic
Device is:        Not in smartctl database [for details use: -P showall]
ATA Version is:   ACS-2 (minor revision not indicated)
SATA Version is:  SATA 3.0, 6.0 Gb/s (current: 6.0 Gb/s)
Local Time is:    Sun Jun 13 04:50:01 2021 PDT
SMART support is: Available - device has SMART capability.
SMART support is: Enabled
AAM feature is:   Unavailable
APM level is:     254 (maximum performance)
Rd look-ahead is: Enabled
Write cache is:   Enabled
DSN feature is:   Unavailable
ATA Security is:  Disabled, frozen [SEC2]
Wt Cache Reorder: Unavailable

=== START OF READ SMART DATA SECTION ===
SMART overall-health self-assessment test result: PASSED

General SMART Values:
Offline data collection status:  (0x05)	Offline data collection activity
					was aborted by an interrupting command from host.
					Auto Offline Data Collection: Disabled.
Self-test execution status:      (  33)	The self-test routine was interrupted
					by the host with a hard or soft reset.
Total time to complete Offline 
data collection: 		( 4395) seconds.
Offline data collection
capabilities: 			 (0x7f) SMART execute Offline immediate.
					Auto Offline data collection on/off support.
					Abort Offline collection upon new
					command.
					Offline surface scan supported.
					Self-test supported.
					Conveyance Self-test supported.
					Selective Self-test supported.
SMART capabilities:            (0x0003)	Saves SMART data before entering
					power-saving mode.
					Supports SMART auto save timer.
Error logging capability:        (0x01)	Error logging supported.
					General Purpose Logging supported.
Short self-test routine 
recommended polling time: 	 (   1) minutes.
Extended self-test routine
recommended polling time: 	 (  48) minutes.
Conveyance self-test routine
recommended polling time: 	 (   2) minutes.
SCT capabilities: 	       (0x0025)	SCT Status supported.
					SCT Data Table supported.

SMART Attributes Data Structure revision number: 10
Vendor Specific SMART Attributes with Thresholds:
ID# ATTRIBUTE_NAME          FLAGS    VALUE WORST THRESH FAIL RAW_VALUE
  5 Reallocated_Sector_Ct   -O--CK   100   100   000    -    0
  9 Power_On_Hours          -O--CK   100   100   000    -    18696 (70 100 0)
 12 Power_Cycle_Count       -O--CK   100   100   000    -    311
170 Unknown_Attribute       PO--CK   100   100   010    -    0
171 Unknown_Attribute       -O--CK   100   100   000    -    0
172 Unknown_Attribute       -O--CK   100   100   000    -    0
174 Unknown_Attribute       -O--CK   100   100   000    -    33
183 Runtime_Bad_Block       -O--CK   100   100   000    -    16
184 End-to-End_Error        PO--CK   100   100   097    -    0
187 Reported_Uncorrect      -O--CK   100   100   000    -    0
190 Airflow_Temperature_Cel -O--CK   031   054   000    -    31 (Min/Max 10/54)
192 Power-Off_Retract_Count -O--CK   100   100   000    -    33
199 UDMA_CRC_Error_Count    -O--CK   100   100   000    -    0
225 Unknown_SSD_Attribute   -O--CK   100   100   000    -    489147
226 Unknown_SSD_Attribute   -O--CK   100   100   000    -    65535
227 Unknown_SSD_Attribute   -O--CK   100   100   000    -    15
228 Power-off_Retract_Count -O--CK   100   100   000    -    65535
232 Available_Reservd_Space PO--CK   100   100   010    -    0
233 Media_Wearout_Indicator -O--CK   089   089   000    -    0
241 Total_LBAs_Written      -O--CK   100   100   000    -    489147
242 Total_LBAs_Read         -O--CK   100   100   000    -    88217
249 Unknown_Attribute       -O--CK   100   100   000    -    61700
                            ||||||_ K auto-keep
                            |||||__ C event count
                            ||||___ R error rate
                            |||____ S speed/performance
                            ||_____ O updated online
                            |______ P prefailure warning

General Purpose Log Directory Version 1
SMART           Log Directory Version 1 [multi-sector log support]
Address    Access  R/W   Size  Description
0x00       GPL,SL  R/O      1  Log Directory
0x04       GPL,SL  R/O      1  Device Statistics log
0x06           SL  R/O      1  SMART self-test log
0x07       GPL     R/O      1  Extended self-test log
0x09           SL  R/W      1  Selective self-test log
0x10       GPL     R/O      1  NCQ Command Error log
0x11       GPL,SL  R/O      1  SATA Phy Event Counters log
0x30       GPL,SL  R/O     16  IDENTIFY DEVICE data log
0x80-0x9f  GPL,SL  R/W     16  Host vendor specific log
0xb7       GPL,SL  VS      16  Device vendor specific log
0xe0       GPL,SL  R/W      1  SCT Command/Status
0xe1       GPL,SL  R/W      1  SCT Data Transfer

SMART Extended Comprehensive Error Log (GP Log 0x03) not supported

SMART Error Log not supported

SMART Extended Self-test Log Version: 1 (1 sectors)
Num  Test_Description    Status                  Remaining  LifeTime(hours)  LBA_of_first_error
# 1  Offline             Interrupted (host reset)      10%     17557         -
# 2  Offline             Interrupted (host reset)      10%     17557         -
# 3  Offline             Interrupted (host reset)      10%     17557         -
# 4  Offline             Interrupted (host reset)      10%     17034         -
# 5  Offline             Interrupted (host reset)      10%     16821         -
# 6  Offline             Interrupted (host reset)      10%     16821         -
# 7  Offline             Interrupted (host reset)      10%     16821         -
# 8  Offline             Interrupted (host reset)      10%     16802         -
# 9  Offline             Interrupted (host reset)      10%     16724         -
#10  Offline             Interrupted (host reset)      10%     16724         -
#11  Offline             Interrupted (host reset)      10%     16724         -
#12  Offline             Interrupted (host reset)      10%     16724         -
#13  Offline             Interrupted (host reset)      10%     16724         -
#14  Offline             Interrupted (host reset)      10%     16724         -
#15  Offline             Interrupted (host reset)      10%     16724         -
#16  Offline             Interrupted (host reset)      10%     16724         -
#17  Offline             Interrupted (host reset)      10%     16724         -
#18  Offline             Interrupted (host reset)      10%     16511         -
#19  Offline             Interrupted (host reset)      10%     16306         -

SMART Selective self-test log data structure revision number 1
 SPAN  MIN_LBA  MAX_LBA  CURRENT_TEST_STATUS
    1        0        0  Not_testing
    2        0        0  Not_testing
    3        0        0  Not_testing
    4        0        0  Not_testing
    5        0        0  Not_testing
Selective self-test flags (0x0):
  After scanning selected spans, do NOT read-scan remainder of disk.
If Selective self-test is pending on power-up, resume after 0 minute delay.

SCT Status Version:                  3
SCT Version (vendor specific):       0 (0x0000)
Device State:                        Active (0)
Current Temperature:                    31 Celsius
Power Cycle Min/Max Temperature:     10/54 Celsius
Lifetime    Min/Max Temperature:     10/78 Celsius
Under/Over Temperature Limit Count:   0/0

SCT Temperature History Version:     2
Temperature Sampling Period:         1 minute
Temperature Logging Interval:        10 minutes
Min/Max recommended Temperature:      0/70 Celsius
Min/Max Temperature Limit:            0/75 Celsius
Temperature History Size (Index):    478 (426)

SCT Error Recovery Control command not supported

Device Statistics (GP Log 0x04)
Page  Offset Size        Value Flags Description
0x01  =====  =               =  ===  == General Statistics (rev 2) ==
0x01  0x008  4             317  ---  Lifetime Power-On Resets
0x01  0x010  4           18700  ---  Power-on Hours
0x01  0x018  6     32249846440  ---  Logical Sectors Written
0x01  0x028  6      5962624030  ---  Logical Sectors Read
0x04  =====  =               =  ===  == General Errors Statistics (rev 1) ==
0x04  0x008  4               0  ---  Number of Reported Uncorrectable Errors
0x04  0x010  4            2392  ---  Resets Between Cmd Acceptance and Completion
0x05  =====  =               =  ===  == Temperature Statistics (rev 1) ==
0x05  0x008  1              31  ---  Current Temperature
0x05  0x010  1              31  ---  Average Short Term Temperature
0x05  0x018  1               -  ---  Average Long Term Temperature
0x05  0x020  1              48  ---  Highest Temperature
0x05  0x028  1              22  ---  Lowest Temperature
0x05  0x030  1              34  ---  Highest Average Short Term Temperature
0x05  0x038  1              31  ---  Lowest Average Short Term Temperature
0x05  0x040  1               -  ---  Highest Average Long Term Temperature
0x05  0x048  1               -  ---  Lowest Average Long Term Temperature
0x05  0x050  4               0  ---  Time in Over-Temperature
0x05  0x058  1              70  ---  Specified Maximum Operating Temperature
0x05  0x060  4               0  ---  Time in Under-Temperature
0x05  0x068  1               0  ---  Specified Minimum Operating Temperature
0x06  =====  =               =  ===  == Transport Statistics (rev 1) ==
0x06  0x008  4            2392  ---  Number of Hardware Resets
0x06  0x010  4             293  ---  Number of ASR Events
0x06  0x018  4               0  ---  Number of Interface CRC Errors
0x07  =====  =               =  ===  == Solid State Device Statistics (rev 1) ==
0x07  0x008  1              13  ---  Percentage Used Endurance Indicator
                                |||_ C monitored condition met
                                ||__ D supports DSN
                                |___ N normalized value

Pending Defects log (GP Log 0x0c) not supported

SATA Phy Event Counters (GP Log 0x11)
ID      Size     Value  Description
0x0001  2            0  Command failed due to ICRC error
0x0003  2            0  R_ERR response for device-to-host data FIS
0x0004  2            0  R_ERR response for host-to-device data FIS
0x0006  2            0  R_ERR response for device-to-host non-data FIS
0x0007  2            0  R_ERR response for host-to-device non-data FIS
0x0008  2            0  Device-to-host non-data FIS retries
0x0009  2           48  Transition from drive PhyRdy to drive PhyNRdy
0x000a  2           82  Device-to-host register FISes sent due to a COMRESET
0x000f  2            0  R_ERR response for host-to-device data FIS, CRC
0x0010  2            0  R_ERR response for host-to-device data FIS, non-CRC
0x0012  2            0  R_ERR response for host-to-device non-data FIS, CRC
0x0013  2            0  R_ERR response for host-to-device non-data FIS, non-CRC
0x0002  2            0  R_ERR response for data FIS
0x0005  2            0  R_ERR response for non-data FIS
0x000b  2            0  CRC errors within host-to-device FIS
0x000d  2            0  Non-CRC errors within host-to-device FIS



