smartctl 7.3 2022-02-28 r5338 [FreeBSD 13.1-RELEASE amd64] (local build)
Copyright (C) 2002-22, Bruce Allen, Christian Franke, www.smartmontools.org

=== START OF INFORMATION SECTION ===
Model Number:                       SAMSUNG MZVKW512HMJP-000H1
Serial Number:                      --
Firmware Version:                   CXA74H0Q
PCI Vendor/Subsystem ID:            0x144d
IEEE OUI Identifier:                0x002538
Total NVM Capacity:                 512,110,190,592 [512 GB]
Unallocated NVM Capacity:           0
Controller ID:                      2
NVMe Version:                       1.2
Number of Namespaces:               1
Namespace 1 Size/Capacity:          512,110,190,592 [512 GB]
Namespace 1 Utilization:            172,359,491,584 [172 GB]
Namespace 1 Formatted LBA Size:     512
Namespace 1 IEEE EUI-64:            002538 ...
Local Time is:                      Sun Jul 17 04:15:51 2022 CEST
Firmware Updates (0x16):            3 Slots, no Reset required
Optional Admin Commands (0x0017):   Security Format Frmw_DL Self_Test
Optional NVM Commands (0x001f):     Comp Wr_Unc DS_Mngmt Wr_Zero Sav/Sel_Feat
Log Page Attributes (0x03):         S/H_per_NS Cmd_Eff_Lg
Warning  Comp. Temp. Threshold:     70 Celsius
Critical Comp. Temp. Threshold:     73 Celsius

Supported Power States
St Op     Max   Active     Idle   RL RT WL WT  Ent_Lat  Ex_Lat
 0 +     6.80W       -        -    0  0  0  0        0       0
 1 +     5.60W       -        -    1  1  1  1        0       0
 2 +     4.40W       -        -    2  2  2  2        0       0
 3 -   0.0400W       -        -    3  3  3  3      210    1500
 4 -   0.0050W       -        -    4  4  4  4     2200    6000

Supported LBA Sizes (NSID 0x1)
Id Fmt  Data  Metadt  Rel_Perf
 0 +     512       0         0

=== START OF SMART DATA SECTION ===
SMART overall-health self-assessment test result: PASSED

SMART/Health Information (NVMe Log 0x02)
Critical Warning:                   0x00
Temperature:                        38 Celsius
Available Spare:                    100%
Available Spare Threshold:          5%
Percentage Used:                    2%
Data Units Read:                    103,129,580 [52.8 TB]
Data Units Written:                 53,185,925 [27.2 TB]
Host Read Commands:                 5,436,874,328
Host Write Commands:                888,529,310
Controller Busy Time:               6,675
Power Cycles:                       516
Power On Hours:                     14,095
Unsafe Shutdowns:                   72
Media and Data Integrity Errors:    0
Error Information Log Entries:      717
Warning  Comp. Temperature Time:    0
Critical Comp. Temperature Time:    0
Temperature Sensor 1:               38 Celsius
Temperature Sensor 2:               59 Celsius

Error Information (NVMe Log 0x01, 16 of 64 entries)
Num   ErrCount  SQId   CmdId  Status  PELoc          LBA  NSID    VS
  0        717     0  0x0022  0x421a  0x028            0     0     -
  1        716     0  0x0020  0x4212  0x028            0     0     -
  2        715     0  0x0026  0x421a  0x028            0     0     -
  3        714     0  0x0024  0x4212  0x028            0     0     -
  4        713     0  0x0021  0x4016  0x004            0     1     -
  5        712     0  0x0022  0x421a  0x028            0     0     -
  6        711     0  0x0020  0x4212  0x028            0     0     -
  7        710     0  0x0022  0x421a  0x028            0     0     -
  8        709     0  0x0020  0x4212  0x028            0     0     -
  9        708     0  0x0022  0x421a  0x028            0     0     -
 10        707     0  0x0020  0x4212  0x028            0     0     -
 11        706     0  0x0022  0x421a  0x028            0     0     -
 12        705     0  0x0020  0x4212  0x028            0     0     -
 13        704     0  0x0022  0x421a  0x028            0     0     -
 14        703     0  0x0020  0x4212  0x028            0     0     -
 15        702     0  0x0022  0x421a  0x028            0     0     -
... (48 entries not read)

