smartctl 7.2 2021-09-14 r5236 [MidnightBSD 3.1.0 amd64] (local build)
Copyright (C) 2002-20, Bruce Allen, Christian Franke, www.smartmontools.org

=== START OF INFORMATION SECTION ===
Device Model:     Seagate IronWolf ZA1000NM10002-2ZG102
Serial Number:    --
LU WWN Device Id: 5 000c50 ...
Firmware Version: SU3SC013
User Capacity:    1,000,204,886,016 bytes [1.00 TB]
Sector Size:      512 bytes logical/physical
Rotation Rate:    Solid State Device
Form Factor:      2.5 inches
TRIM Command:     Available, deterministic, zeroed
Device is:        Not in smartctl database [for details use: -P showall]
ATA Version is:   ACS-3 (minor revision not indicated)
SATA Version is:  SATA 3.1, 6.0 Gb/s (current: 6.0 Gb/s)
Local Time is:    Sat Aug 19 16:50:15 2023 EDT
SMART support is: Available - device has SMART capability.
SMART support is: Enabled

=== START OF READ SMART DATA SECTION ===
SMART overall-health self-assessment test result: PASSED

General SMART Values:
Offline data collection status:  (0x00)	Offline data collection activity
					was never started.
					Auto Offline Data Collection: Disabled.
Self-test execution status:      (   0)	The previous self-test routine completed
					without error or no self-test has ever 
					been run.
Total time to complete Offline 
data collection: 		(   30) seconds.
Offline data collection
capabilities: 			 (0x79) SMART execute Offline immediate.
					No Auto Offline data collection support.
					Suspend Offline collection upon new
					command.
					Offline surface scan supported.
					Self-test supported.
					Conveyance Self-test supported.
					Selective Self-test supported.
SMART capabilities:            (0x0003)	Saves SMART data before entering
					power-saving mode.
					Supports SMART auto save timer.
Error logging capability:        (0x01)	Error logging supported.
					General Purpose Logging supported.
Short self-test routine 
recommended polling time: 	 (   1) minutes.
Extended self-test routine
recommended polling time: 	 (   2) minutes.
Conveyance self-test routine
recommended polling time: 	 (   3) minutes.

SMART Attributes Data Structure revision number: 16
Vendor Specific SMART Attributes with Thresholds:
ID# ATTRIBUTE_NAME          FLAG     VALUE WORST THRESH TYPE      UPDATED  WHEN_FAILED RAW_VALUE
  1 Raw_Read_Error_Rate     0x000b   100   100   050    Pre-fail  Always       -       0
  9 Power_On_Hours          0x0012   100   100   000    Old_age   Always       -       5872
 12 Power_Cycle_Count       0x0012   100   100   000    Old_age   Always       -       19
 16 Unknown_Attribute       0x0012   100   100   000    Old_age   Always       -       6187
 17 Unknown_Attribute       0x0012   100   100   000    Old_age   Always       -       6187
168 Unknown_Attribute       0x0012   100   100   000    Old_age   Always       -       0
170 Unknown_Attribute       0x0003   100   100   010    Pre-fail  Always       -       198
173 Unknown_Attribute       0x0012   100   100   000    Old_age   Always       -       393251
174 Unknown_Attribute       0x0012   100   100   000    Old_age   Always       -       13
177 Wear_Leveling_Count     0x0000   100   100   000    Old_age   Offline      -       1
192 Power-Off_Retract_Count 0x0012   100   100   000    Old_age   Always       -       13
194 Temperature_Celsius     0x0023   103   084   000    Pre-fail  Always       -       24 (Min/Max 19/43)
218 Unknown_Attribute       0x000b   100   100   050    Pre-fail  Always       -       0
231 Unknown_SSD_Attribute   0x0013   100   100   000    Pre-fail  Always       -       99
232 Available_Reservd_Space 0x0013   100   100   000    Pre-fail  Always       -       0
233 Media_Wearout_Indicator 0x000b   100   100   000    Pre-fail  Always       -       2964
234 Unknown_Attribute       0x000b   100   100   000    Pre-fail  Always       -       16402761896
235 Unknown_Attribute       0x000b   100   100   000    Pre-fail  Always       -       6217801920
241 Total_LBAs_Written      0x0012   100   100   000    Old_age   Always       -       2034
242 Total_LBAs_Read         0x0012   100   100   000    Old_age   Always       -       6700

SMART Error Log Version: 1
No Errors Logged

SMART Self-test log structure revision number 1
Num  Test_Description    Status                  Remaining  LifeTime(hours)  LBA_of_first_error
# 1  Short offline       Completed without error       00%         0         -

SMART Selective self-test log data structure revision number 1
 SPAN  MIN_LBA  MAX_LBA  CURRENT_TEST_STATUS
    1        0        0  Not_testing
    2        0        0  Not_testing
    3        0        0  Not_testing
    4        0        0  Not_testing
    5        0        0  Not_testing
Selective self-test flags (0x0):
  After scanning selected spans, do NOT read-scan remainder of disk.
If Selective self-test is pending on power-up, resume after 0 minute delay.



