smartctl 7.2 2020-12-30 r5155 [FreeBSD 13.0-RELEASE-p4 amd64] (local build)
Copyright (C) 2002-20, Bruce Allen, Christian Franke, www.smartmontools.org

=== START OF INFORMATION SECTION ===
Model Family:     Western Digital Red
Device Model:     WDC WD30EFRX-68AX9N0
Serial Number:    --
LU WWN Device Id: 5 0014ee ...
Firmware Version: 80.00A80
User Capacity:    3,000,592,982,016 bytes [3.00 TB]
Sector Sizes:     512 bytes logical, 4096 bytes physical
Device is:        In smartctl database [for details use: -P show]
ATA Version is:   ACS-2 (minor revision not indicated)
SATA Version is:  SATA 3.0, 6.0 Gb/s (current: 6.0 Gb/s)
Local Time is:    Sun Nov  7 23:28:28 2021 CET
SMART support is: Available - device has SMART capability.
SMART support is: Enabled
AAM feature is:   Unavailable
APM feature is:   Unavailable
Rd look-ahead is: Enabled
Write cache is:   Enabled
DSN feature is:   Unavailable
ATA Security is:  Disabled, NOT FROZEN [SEC1]
Wt Cache Reorder: Enabled

=== START OF READ SMART DATA SECTION ===
SMART overall-health self-assessment test result: PASSED

General SMART Values:
Offline data collection status:  (0x00)	Offline data collection activity
					was never started.
					Auto Offline Data Collection: Disabled.
Self-test execution status:      (   0)	The previous self-test routine completed
					without error or no self-test has ever 
					been run.
Total time to complete Offline 
data collection: 		(42420) seconds.
Offline data collection
capabilities: 			 (0x7b) SMART execute Offline immediate.
					Auto Offline data collection on/off support.
					Suspend Offline collection upon new
					command.
					Offline surface scan supported.
					Self-test supported.
					Conveyance Self-test supported.
					Selective Self-test supported.
SMART capabilities:            (0x0003)	Saves SMART data before entering
					power-saving mode.
					Supports SMART auto save timer.
Error logging capability:        (0x01)	Error logging supported.
					General Purpose Logging supported.
Short self-test routine 
recommended polling time: 	 (   2) minutes.
Extended self-test routine
recommended polling time: 	 ( 425) minutes.
Conveyance self-test routine
recommended polling time: 	 (   5) minutes.
SCT capabilities: 	       (0x70bd)	SCT Status supported.
					SCT Error Recovery Control supported.
					SCT Feature Control supported.
					SCT Data Table supported.

SMART Attributes Data Structure revision number: 16
Vendor Specific SMART Attributes with Thresholds:
ID# ATTRIBUTE_NAME          FLAGS    VALUE WORST THRESH FAIL RAW_VALUE
  1 Raw_Read_Error_Rate     POSR-K   200   200   051    -    0
  3 Spin_Up_Time            POS--K   179   175   021    -    6008
  4 Start_Stop_Count        -O--CK   091   091   000    -    9743
  5 Reallocated_Sector_Ct   PO--CK   200   200   140    -    0
  7 Seek_Error_Rate         -OSR-K   200   200   000    -    0
  9 Power_On_Hours          -O--CK   014   014   000    -    62886
 10 Spin_Retry_Count        -O--CK   100   100   000    -    0
 11 Calibration_Retry_Count -O--CK   100   100   000    -    0
 12 Power_Cycle_Count       -O--CK   100   100   000    -    970
192 Power-Off_Retract_Count -O--CK   200   200   000    -    663
193 Load_Cycle_Count        -O--CK   197   197   000    -    9079
194 Temperature_Celsius     -O---K   107   103   000    -    43
196 Reallocated_Event_Count -O--CK   200   200   000    -    0
197 Current_Pending_Sector  -O--CK   200   200   000    -    0
198 Offline_Uncorrectable   ----CK   100   253   000    -    0
199 UDMA_CRC_Error_Count    -O--CK   200   001   000    -    1362
200 Multi_Zone_Error_Rate   ---R--   100   253   000    -    0
                            ||||||_ K auto-keep
                            |||||__ C event count
                            ||||___ R error rate
                            |||____ S speed/performance
                            ||_____ O updated online
                            |______ P prefailure warning

General Purpose Log Directory Version 1
SMART           Log Directory Version 1 [multi-sector log support]
Address    Access  R/W   Size  Description
0x00       GPL,SL  R/O      1  Log Directory
0x01           SL  R/O      1  Summary SMART error log
0x02           SL  R/O      5  Comprehensive SMART error log
0x03       GPL     R/O      6  Ext. Comprehensive SMART error log
0x06           SL  R/O      1  SMART self-test log
0x07       GPL     R/O      1  Extended self-test log
0x09           SL  R/W      1  Selective self-test log
0x10       GPL     R/O      1  NCQ Command Error log
0x11       GPL     R/O      1  SATA Phy Event Counters log
0x21       GPL     R/O      1  Write stream error log
0x22       GPL     R/O      1  Read stream error log
0x80-0x9f  GPL,SL  R/W     16  Host vendor specific log
0xa0-0xa7  GPL,SL  VS      16  Device vendor specific log
0xa8-0xb7  GPL,SL  VS       1  Device vendor specific log
0xbd       GPL,SL  VS       1  Device vendor specific log
0xc0       GPL,SL  VS       1  Device vendor specific log
0xc1       GPL     VS      93  Device vendor specific log
0xe0       GPL,SL  R/W      1  SCT Command/Status
0xe1       GPL,SL  R/W      1  SCT Data Transfer

SMART Extended Comprehensive Error Log Version: 1 (6 sectors)
Device Error Count: 6
	CR     = Command Register
	FEATR  = Features Register
	COUNT  = Count (was: Sector Count) Register
	LBA_48 = Upper bytes of LBA High/Mid/Low Registers ]  ATA-8
	LH     = LBA High (was: Cylinder High) Register    ]   LBA
	LM     = LBA Mid (was: Cylinder Low) Register      ] Register
	LL     = LBA Low (was: Sector Number) Register     ]
	DV     = Device (was: Device/Head) Register
	DC     = Device Control Register
	ER     = Error register
	ST     = Status register
Powered_Up_Time is measured from power on, and printed as
DDd+hh:mm:SS.sss where DD=days, hh=hours, mm=minutes,
SS=sec, and sss=millisec. It "wraps" after 49.710 days.

Error 6 [5] occurred at disk power-on lifetime: 4571 hours (190 days + 11 hours)
  When the command that caused the error occurred, the device was active or idle.

  After command completion occurred, registers were:
  ER -- ST COUNT  LBA_48  LH LM LL DV DC
  -- -- -- == -- == == == -- -- -- -- --
  04 -- 61 00 0c 00 00 00 00 00 00 00 00  Device Fault; Error: ABRT

  Commands leading to the command that caused the error were:
  CR FEATR COUNT  LBA_48  LH LM LL DV DC  Powered_Up_Time  Command/Feature_Name
  -- == -- == -- == == == -- -- -- -- --  ---------------  --------------------
  ef 00 03 00 0c 00 00 00 00 00 00 00 00  3d+11:37:55.625  SET FEATURES [Set transfer mode]
  e5 00 00 00 00 00 00 00 00 00 00 00 00  3d+11:37:55.625  CHECK POWER MODE
  ec 00 00 00 00 00 00 00 00 00 00 00 00  3d+11:37:55.624  IDENTIFY DEVICE
  ec 00 00 00 00 00 00 00 00 00 00 00 00  3d+11:37:50.757  IDENTIFY DEVICE
  ec 00 00 00 00 00 00 00 00 00 00 00 00  3d+11:37:50.757  IDENTIFY DEVICE

Error 5 [4] occurred at disk power-on lifetime: 4571 hours (190 days + 11 hours)
  When the command that caused the error occurred, the device was active or idle.

  After command completion occurred, registers were:
  ER -- ST COUNT  LBA_48  LH LM LL DV DC
  -- -- -- == -- == == == -- -- -- -- --
  04 -- 61 00 0c 00 00 00 00 00 00 00 00  Device Fault; Error: ABRT

  Commands leading to the command that caused the error were:
  CR FEATR COUNT  LBA_48  LH LM LL DV DC  Powered_Up_Time  Command/Feature_Name
  -- == -- == -- == == == -- -- -- -- --  ---------------  --------------------
  ef 00 03 00 0c 00 00 00 00 00 00 00 00  3d+11:35:05.051  SET FEATURES [Set transfer mode]
  e5 00 00 00 00 00 00 00 00 00 00 00 00  3d+11:35:05.051  CHECK POWER MODE
  ec 00 00 00 00 00 00 00 00 00 00 00 00  3d+11:35:05.049  IDENTIFY DEVICE
  61 01 00 00 a8 00 00 38 cd 94 80 40 00  3d+11:35:02.392  WRITE FPDMA QUEUED
  61 01 00 00 a0 00 00 38 cd 93 80 40 00  3d+11:35:02.391  WRITE FPDMA QUEUED

Error 4 [3] occurred at disk power-on lifetime: 4571 hours (190 days + 11 hours)
  When the command that caused the error occurred, the device was active or idle.

  After command completion occurred, registers were:
  ER -- ST COUNT  LBA_48  LH LM LL DV DC
  -- -- -- == -- == == == -- -- -- -- --
  04 -- 61 00 00 00 00 38 cd 65 88 40 00  Device Fault; Error: ABRT at LBA = 0x38cd6588 = 952984968

  Commands leading to the command that caused the error were:
  CR FEATR COUNT  LBA_48  LH LM LL DV DC  Powered_Up_Time  Command/Feature_Name
  -- == -- == -- == == == -- -- -- -- --  ---------------  --------------------
  61 01 00 00 a8 00 00 38 cd 94 80 40 00  3d+11:35:02.392  WRITE FPDMA QUEUED
  61 01 00 00 a0 00 00 38 cd 93 80 40 00  3d+11:35:02.391  WRITE FPDMA QUEUED
  61 01 00 00 98 00 00 38 cd 92 80 40 00  3d+11:35:02.390  WRITE FPDMA QUEUED
  61 01 00 00 90 00 00 38 cd 91 80 40 00  3d+11:35:02.389  WRITE FPDMA QUEUED
  61 01 00 00 88 00 00 38 cd 90 80 40 00  3d+11:35:02.388  WRITE FPDMA QUEUED

Error 3 [2] occurred at disk power-on lifetime: 4552 hours (189 days + 16 hours)
  When the command that caused the error occurred, the device was active or idle.

  After command completion occurred, registers were:
  ER -- ST COUNT  LBA_48  LH LM LL DV DC
  -- -- -- == -- == == == -- -- -- -- --
  40 -- 51 00 00 00 00 1d 3c b1 40 40 00  Error: UNC at LBA = 0x1d3cb140 = 490516800

  Commands leading to the command that caused the error were:
  CR FEATR COUNT  LBA_48  LH LM LL DV DC  Powered_Up_Time  Command/Feature_Name
  -- == -- == -- == == == -- -- -- -- --  ---------------  --------------------
  60 01 00 00 00 00 00 1d 3c b1 40 40 00  2d+16:52:27.096  READ FPDMA QUEUED
  60 01 00 00 00 00 00 1d 3c b0 40 40 00  2d+16:52:24.430  READ FPDMA QUEUED
  60 01 00 00 00 00 00 1d 3c af 40 40 00  2d+16:52:24.430  READ FPDMA QUEUED
  60 01 00 00 00 00 00 1d 3c ae 40 40 00  2d+16:52:24.430  READ FPDMA QUEUED
  60 01 00 00 00 00 00 1d 3c ad 40 40 00  2d+16:52:24.429  READ FPDMA QUEUED

Error 2 [1] occurred at disk power-on lifetime: 355 hours (14 days + 19 hours)
  When the command that caused the error occurred, the device was active or idle.

  After command completion occurred, registers were:
  ER -- ST COUNT  LBA_48  LH LM LL DV DC
  -- -- -- == -- == == == -- -- -- -- --
  04 -- 61 00 0c 00 00 00 00 00 00 00 00  Device Fault; Error: ABRT

  Commands leading to the command that caused the error were:
  CR FEATR COUNT  LBA_48  LH LM LL DV DC  Powered_Up_Time  Command/Feature_Name
  -- == -- == -- == == == -- -- -- -- --  ---------------  --------------------
  ef 00 03 00 0c 00 00 00 00 00 00 00 00     00:06:35.511  SET FEATURES [Set transfer mode]
  e5 00 00 00 00 00 00 00 00 00 00 00 00     00:06:35.511  CHECK POWER MODE
  ec 00 00 00 00 00 00 00 00 00 00 00 00     00:06:35.510  IDENTIFY DEVICE
  61 01 00 00 08 00 00 52 5c d2 80 40 00     00:06:34.799  WRITE FPDMA QUEUED
  61 01 00 00 00 00 00 52 5c d1 80 40 00     00:06:34.798  WRITE FPDMA QUEUED

Error 1 [0] occurred at disk power-on lifetime: 355 hours (14 days + 19 hours)
  When the command that caused the error occurred, the device was active or idle.

  After command completion occurred, registers were:
  ER -- ST COUNT  LBA_48  LH LM LL DV DC
  -- -- -- == -- == == == -- -- -- -- --
  04 -- 61 00 00 00 00 52 5c a3 40 40 00  Device Fault; Error: ABRT at LBA = 0x525ca340 = 1381802816

  Commands leading to the command that caused the error were:
  CR FEATR COUNT  LBA_48  LH LM LL DV DC  Powered_Up_Time  Command/Feature_Name
  -- == -- == -- == == == -- -- -- -- --  ---------------  --------------------
  61 01 00 00 08 00 00 52 5c d2 80 40 00     00:06:34.799  WRITE FPDMA QUEUED
  61 01 00 00 00 00 00 52 5c d1 80 40 00     00:06:34.798  WRITE FPDMA QUEUED
  61 01 00 00 f8 00 00 52 5c d0 80 40 00     00:06:34.789  WRITE FPDMA QUEUED
  61 01 00 00 f0 00 00 52 5c cf 80 40 00     00:06:34.789  WRITE FPDMA QUEUED
  61 01 00 00 e8 00 00 52 5c ce 80 40 00     00:06:34.789  WRITE FPDMA QUEUED

SMART Extended Self-test Log Version: 1 (1 sectors)
Num  Test_Description    Status                  Remaining  LifeTime(hours)  LBA_of_first_error
# 1  Short offline       Completed without error       00%     38413         -
# 2  Short offline       Completed without error       00%     21397         -
# 3  Short offline       Completed without error       00%     12863         -
# 4  Short offline       Completed without error       00%      6475         -
# 5  Short offline       Interrupted (host reset)      60%      4571         -
# 6  Short offline       Completed without error       00%       504         -

SMART Selective self-test log data structure revision number 1
 SPAN  MIN_LBA  MAX_LBA  CURRENT_TEST_STATUS
    1        0        0  Not_testing
    2        0        0  Not_testing
    3        0        0  Not_testing
    4        0        0  Not_testing
    5        0        0  Not_testing
Selective self-test flags (0x0):
  After scanning selected spans, do NOT read-scan remainder of disk.
If Selective self-test is pending on power-up, resume after 0 minute delay.

SCT Status Version:                  3
SCT Version (vendor specific):       258 (0x0102)
Device State:                        Active (0)
Current Temperature:                    43 Celsius
Power Cycle Min/Max Temperature:     25/47 Celsius
Lifetime    Min/Max Temperature:      2/47 Celsius
Under/Over Temperature Limit Count:   0/0
Vendor specific:
01 00 00 00 00 00 00 00 00 00 00 00 00 00 00 00
00 00 00 00 00 00 00 00 00 00 00 00 00 00 00 00

SCT Temperature History Version:     2
Temperature Sampling Period:         1 minute
Temperature Logging Interval:        1 minute
Min/Max recommended Temperature:      0/60 Celsius
Min/Max Temperature Limit:           -41/85 Celsius
Temperature History Size (Index):    478 (331)

SCT Error Recovery Control:
           Read:     70 (7.0 seconds)
          Write:     70 (7.0 seconds)

Device Statistics (GP/SMART Log 0x04) not supported

Pending Defects log (GP Log 0x0c) not supported

SATA Phy Event Counters (GP Log 0x11)
ID      Size     Value  Description
0x0001  2            0  Command failed due to ICRC error
0x0002  2            0  R_ERR response for data FIS
0x0003  2            0  R_ERR response for device-to-host data FIS
0x0004  2            0  R_ERR response for host-to-device data FIS
0x0005  2            0  R_ERR response for non-data FIS
0x0006  2            0  R_ERR response for device-to-host non-data FIS
0x0007  2            0  R_ERR response for host-to-device non-data FIS
0x0008  2            0  Device-to-host non-data FIS retries
0x0009  2           17  Transition from drive PhyRdy to drive PhyNRdy
0x000a  2           18  Device-to-host register FISes sent due to a COMRESET
0x000b  2            0  CRC errors within host-to-device FIS
0x000f  2            0  R_ERR response for host-to-device data FIS, CRC
0x0012  2            0  R_ERR response for host-to-device non-data FIS, CRC
0x8000  4      2164240  Vendor specific



