smartctl 7.3 2022-02-28 r5338 [FreeBSD 13.1-RELEASE-p7 amd64] (local build)
Copyright (C) 2002-22, Bruce Allen, Christian Franke, www.smartmontools.org

=== START OF INFORMATION SECTION ===
Model Number:                       KINGSTON SA1000M8240G
Serial Number:                      --
Firmware Version:                   E8FK11.T
PCI Vendor/Subsystem ID:            0x2646
IEEE OUI Identifier:                0x0026b7
Total NVM Capacity:                 240,057,409,536 [240 GB]
Unallocated NVM Capacity:           0
Controller ID:                      0
NVMe Version:                       1.2
Number of Namespaces:               1
Namespace 1 Size/Capacity:          240,057,409,536 [240 GB]
Namespace 1 Formatted LBA Size:     512
Namespace 1 IEEE EUI-64:            0026b7 ...
Local Time is:                      Sat Apr  8 20:02:17 2023 -03
Firmware Updates (0x02):            1 Slot
Optional Admin Commands (0x0007):   Security Format Frmw_DL
Optional NVM Commands (0x001e):     Wr_Unc DS_Mngmt Wr_Zero Sav/Sel_Feat
Log Page Attributes (0x04):         Ext_Get_Lg
Maximum Data Transfer Size:         512 Pages
Warning  Comp. Temp. Threshold:     84 Celsius
Critical Comp. Temp. Threshold:     88 Celsius

Supported Power States
St Op     Max   Active     Idle   RL RT WL WT  Ent_Lat  Ex_Lat
 0 +     7.90W  0.0790W       -    0  0  0  0      600     600
 1 +     7.90W  0.0790W       -    0  0  0  0      600     600
 2 +     7.90W  0.0790W       -    0  0  0  0      600     600
 3 -   0.1000W  0.0790W       -    3  3  3  3     1000    1000
 4 -   0.0050W  0.0790W       -    4  4  4  4   400000   90000

Supported LBA Sizes (NSID 0x1)
Id Fmt  Data  Metadt  Rel_Perf
 0 +     512       0         1
 1 -    4096       0         0

=== START OF SMART DATA SECTION ===
SMART overall-health self-assessment test result: PASSED

SMART/Health Information (NVMe Log 0x02)
Critical Warning:                   0x00
Temperature:                        48 Celsius
Available Spare:                    100%
Available Spare Threshold:          10%
Percentage Used:                    16%
Data Units Read:                    21,357,464 [10.9 TB]
Data Units Written:                 37,531,626 [19.2 TB]
Host Read Commands:                 382,791,098
Host Write Commands:                302,512,833
Controller Busy Time:               1,332
Power Cycles:                       3,575
Power On Hours:                     12,192
Unsafe Shutdowns:                   217
Media and Data Integrity Errors:    0
Error Information Log Entries:      31,865
Warning  Comp. Temperature Time:    0
Critical Comp. Temperature Time:    0
Temperature Sensor 2:               48 Celsius

Error Information (NVMe Log 0x01, 16 of 16 entries)
Num   ErrCount  SQId   CmdId  Status  PELoc          LBA  NSID    VS
  0      31866     0  0x400f  0x0005      -            6     0     -
  1      31865     0  0x000b  0x0017      -            1     1     -
  2      31864     0  0x000b  0x0017      -            1     1     -
  3      31863     0  0x000b  0x0017      -            1     1     -
  4      31861     0  0x0015  0x0005      -           12     0     -
  5      31860     0  0x000b  0x0017      -            1     1     -
  6      31859     0  0x000b  0x0017      -            1     1     -
  7      31858     0  0x000b  0x0017      -            1     1     -
  8      31857     0  0x000b  0x0017      -            1     1     -
  9      31856     0  0x000b  0x0017      -            1     1     -
 10      31855     0  0x0000  0x0005      -            6     0     -
 11      31854     0  0x001d  0x0005      -           12     0     -
 12      31853     0  0x000b  0x0017      -            1     1     -
 13      31852     0  0x0002  0x0005      -          208     0     -
 14      31851     0  0x0002  0x0005      -          208     0     -
 15      31846     0  0x000d  0x0005      -           12     0     -

