smartctl 7.3 2022-02-28 r5338 [FreeBSD 13.1-RELEASE-p7 amd64] (local build)
Copyright (C) 2002-22, Bruce Allen, Christian Franke, www.smartmontools.org

=== START OF INFORMATION SECTION ===
Model Number:                       KINGSTON SA1000M8240G
Serial Number:                      --
Firmware Version:                   E8FK11.R
PCI Vendor/Subsystem ID:            0x2646
IEEE OUI Identifier:                0x0026b7
Total NVM Capacity:                 240,057,409,536 [240 GB]
Unallocated NVM Capacity:           0
Controller ID:                      0
NVMe Version:                       1.2
Number of Namespaces:               1
Namespace 1 Size/Capacity:          240,057,409,536 [240 GB]
Namespace 1 Formatted LBA Size:     512
Namespace 1 IEEE EUI-64:            0026b7 ...
Local Time is:                      Mon May 29 00:29:26 2023 MSK
Firmware Updates (0x02):            1 Slot
Optional Admin Commands (0x0007):   Security Format Frmw_DL
Optional NVM Commands (0x001e):     Wr_Unc DS_Mngmt Wr_Zero Sav/Sel_Feat
Log Page Attributes (0x04):         Ext_Get_Lg
Maximum Data Transfer Size:         512 Pages
Warning  Comp. Temp. Threshold:     84 Celsius
Critical Comp. Temp. Threshold:     88 Celsius

Supported Power States
St Op     Max   Active     Idle   RL RT WL WT  Ent_Lat  Ex_Lat
 0 +     7.90W  0.0790W       -    0  0  0  0      600     600
 1 +     7.90W  0.0790W       -    0  0  0  0      600     600
 2 +     7.90W  0.0790W       -    0  0  0  0      600     600
 3 -   0.1000W  0.0790W       -    3  3  3  3     1000    1000
 4 -   0.0050W  0.0790W       -    4  4  4  4   400000   90000

Supported LBA Sizes (NSID 0x1)
Id Fmt  Data  Metadt  Rel_Perf
 0 +     512       0         1
 1 -    4096       0         0

=== START OF SMART DATA SECTION ===
SMART overall-health self-assessment test result: PASSED

SMART/Health Information (NVMe Log 0x02)
Critical Warning:                   0x00
Temperature:                        30 Celsius
Available Spare:                    100%
Available Spare Threshold:          100%
Percentage Used:                    1%
Data Units Read:                    5,049,689 [2.58 TB]
Data Units Written:                 7,286,190 [3.73 TB]
Host Read Commands:                 33,842,496
Host Write Commands:                51,444,739
Controller Busy Time:               196
Power Cycles:                       2,646
Power On Hours:                     8,537
Unsafe Shutdowns:                   150
Media and Data Integrity Errors:    0
Error Information Log Entries:      1,845
Warning  Comp. Temperature Time:    0
Critical Comp. Temperature Time:    0
Temperature Sensor 2:               30 Celsius

Error Information (NVMe Log 0x01, 16 of 16 entries)
Num   ErrCount  SQId   CmdId  Status  PELoc          LBA  NSID    VS
  0       1845     0  0x0018  0x0005      -     33555712     0     -
  1       1844     0  0x0018  0x0005      -     33555712     0     -
  2       1843     0  0x0018  0x0005      -     33555712     0     -
  3       1842     0  0x0018  0x0005      -     33555712     0     -
  4       1841     0  0x0018  0x0005      -     33555712     0     -
  5       1840     0  0x0017  0x0005      -     33555712     0     -
  6       1839     0  0x0016  0x0005      -     33555712     0     -
  7       1838     0  0x0016  0x0005      -     33555712     0     -
  8       1837     0  0x0016  0x0005      -     33555712     0     -
  9       1836     0  0x0016  0x0005      -     33555712     0     -
 10       1835     0  0x0016  0x0005      -     33555712     0     -
 11       1834     0  0x0016  0x0005      -     33555712     0     -
 12       1833     0  0x0016  0x0005      -     33555712     0     -
 13       1832     0  0x0016  0x0005      -     33555712     0     -
 14       1831     0  0x0016  0x0005      -     33555712     0     -
 15       1830     0  0x0002  0x0005      -          208     0     -

