smartctl 7.3 2022-02-28 r5338 [FreeBSD 13.1-RELEASE-p5 amd64] (local build)
Copyright (C) 2002-22, Bruce Allen, Christian Franke, www.smartmontools.org

=== START OF INFORMATION SECTION ===
Model Number:                       Fanxiang S501 128GB
Serial Number:                      --
Firmware Version:                   T1103F0L
PCI Vendor/Subsystem ID:            0x126f
IEEE OUI Identifier:                0x000001
Total NVM Capacity:                 128,035,676,160 [128 GB]
Unallocated NVM Capacity:           0
Controller ID:                      1
NVMe Version:                       1.3
Number of Namespaces:               1
Namespace 1 Size/Capacity:          128,035,676,160 [128 GB]
Namespace 1 Formatted LBA Size:     512
Namespace 1 IEEE EUI-64:            000001 ...
Local Time is:                      Sat Jan 21 17:17:00 2023 GMT
Firmware Updates (0x12):            1 Slot, no Reset required
Optional Admin Commands (0x0007):   Security Format Frmw_DL
Optional NVM Commands (0x0014):     DS_Mngmt Sav/Sel_Feat
Log Page Attributes (0x03):         S/H_per_NS Cmd_Eff_Lg
Maximum Data Transfer Size:         64 Pages
Warning  Comp. Temp. Threshold:     83 Celsius
Critical Comp. Temp. Threshold:     85 Celsius

Supported Power States
St Op     Max   Active     Idle   RL RT WL WT  Ent_Lat  Ex_Lat
 0 +     6.00W       -        -    0  0  0  0        0       0

Supported LBA Sizes (NSID 0x1)
Id Fmt  Data  Metadt  Rel_Perf
 0 +     512       0         0

=== START OF SMART DATA SECTION ===
SMART overall-health self-assessment test result: PASSED

SMART/Health Information (NVMe Log 0x02)
Critical Warning:                   0x00
Temperature:                        48 Celsius
Available Spare:                    100%
Available Spare Threshold:          10%
Percentage Used:                    0%
Data Units Read:                    307,340 [157 GB]
Data Units Written:                 326,912 [167 GB]
Host Read Commands:                 4,797,898
Host Write Commands:                5,199,182
Controller Busy Time:               62
Power Cycles:                       20
Power On Hours:                     19
Unsafe Shutdowns:                   9
Media and Data Integrity Errors:    0
Error Information Log Entries:      0
Warning  Comp. Temperature Time:    0
Critical Comp. Temperature Time:    0

Error Information (NVMe Log 0x01, 16 of 64 entries)
No Errors Logged

