smartctl 7.2 2020-12-30 r5155 [FreeBSD 13.0-RELEASE amd64] (local build)
Copyright (C) 2002-20, Bruce Allen, Christian Franke, www.smartmontools.org

=== START OF INFORMATION SECTION ===
Model Family:     Seagate Momentus 5400.2
Device Model:     ST9120821AS
Serial Number:    --
Firmware Version: 8.03
User Capacity:    118,526,284,800 bytes [118 GB]
Sector Size:      512 bytes logical/physical
Device is:        In smartctl database [for details use: -P show]
ATA Version is:   ATA/ATAPI-7 (minor revision not indicated)
Local Time is:    Fri Jul 15 19:40:12 2022 EDT
SMART support is: Available - device has SMART capability.
SMART support is: Enabled
AAM level is:     254 (maximum performance), recommended: 128
APM level is:     128 (minimum power consumption without standby)
Rd look-ahead is: Enabled
Write cache is:   Enabled
DSN feature is:   Unavailable
ATA Security is:  Disabled, frozen [SEC2]
Wt Cache Reorder: Unavailable

=== START OF READ SMART DATA SECTION ===
SMART overall-health self-assessment test result: PASSED
See vendor-specific Attribute list for marginal Attributes.

General SMART Values:
Offline data collection status:  (0x82)	Offline data collection activity
					was completed without error.
					Auto Offline Data Collection: Enabled.
Self-test execution status:      ( 120)	The previous self-test completed having
					the read element of the test failed.
Total time to complete Offline 
data collection: 		(  426) seconds.
Offline data collection
capabilities: 			 (0x5b) SMART execute Offline immediate.
					Auto Offline data collection on/off support.
					Suspend Offline collection upon new
					command.
					Offline surface scan supported.
					Self-test supported.
					No Conveyance Self-test supported.
					Selective Self-test supported.
SMART capabilities:            (0x0003)	Saves SMART data before entering
					power-saving mode.
					Supports SMART auto save timer.
Error logging capability:        (0x01)	Error logging supported.
					No General Purpose Logging support.
Short self-test routine 
recommended polling time: 	 (   2) minutes.
Extended self-test routine
recommended polling time: 	 ( 111) minutes.
SCT capabilities: 	       (0x0001)	SCT Status supported.

SMART Attributes Data Structure revision number: 10
Vendor Specific SMART Attributes with Thresholds:
ID# ATTRIBUTE_NAME          FLAGS    VALUE WORST THRESH FAIL RAW_VALUE
  1 Raw_Read_Error_Rate     POSR--   100   253   006    -    0
  3 Spin_Up_Time            PO----   095   095   000    -    0
  4 Start_Stop_Count        -O--CK   099   099   020    -    1625
  5 Reallocated_Sector_Ct   PO--CK   100   100   036    -    21
  7 Seek_Error_Rate         POSR--   079   060   030    -    87505702
  9 Power_On_Hours          -O--CK   097   097   000    -    3277
 10 Spin_Retry_Count        PO--C-   100   100   034    -    0
 12 Power_Cycle_Count       -O--CK   099   099   020    -    1822
187 Reported_Uncorrect      -O--CK   001   001   000    -    1364
189 High_Fly_Writes         -O-RCK   072   072   000    -    28
190 Airflow_Temperature_Cel -O---K   061   041   045    Past 39 (Min/Max 20/39)
192 Power-Off_Retract_Count -O--CK   100   100   000    -    895
193 Load_Cycle_Count        -O--CK   051   051   000    -    98164
194 Temperature_Celsius     -O---K   039   059   000    -    39 (0 1 0 0 0)
195 Hardware_ECC_Recovered  -O-RC-   081   047   000    -    140218586
197 Current_Pending_Sector  -O--C-   015   015   000    -    1757
198 Offline_Uncorrectable   ----C-   015   015   000    -    1757
199 UDMA_CRC_Error_Count    -OSRCK   200   200   000    -    0
200 Multi_Zone_Error_Rate   ------   100   253   000    -    0
202 Data_Address_Mark_Errs  -O--CK   100   253   000    -    0
                            ||||||_ K auto-keep
                            |||||__ C event count
                            ||||___ R error rate
                            |||____ S speed/performance
                            ||_____ O updated online
                            |______ P prefailure warning

General Purpose Log Directory not supported

SMART Log Directory Version 1 [multi-sector log support]
Address    Access  R/W   Size  Description
0x00           SL  R/O      1  Log Directory
0x01           SL  R/O      1  Summary SMART error log
0x02           SL  R/O      5  Comprehensive SMART error log
0x03           SL  R/O      5  Ext. Comprehensive SMART error log
0x06           SL  R/O      1  SMART self-test log
0x07           SL  R/O      1  Extended self-test log
0x09           SL  R/W      1  Selective self-test log
0x10           SL  R/O      1  NCQ Command Error log
0x11           SL  R/O      1  SATA Phy Event Counters log
0x20           SL  R/O      1  Streaming performance log [OBS-8]
0x21           SL  R/O      1  Write stream error log
0x22           SL  R/O      1  Read stream error log
0x23           SL  R/O      1  Delayed sector log [OBS-8]
0x80-0x9f      SL  R/W     16  Host vendor specific log
0xa0           SL  VS       1  Device vendor specific log
0xa1           SL  VS      20  Device vendor specific log
0xa2           SL  VS     101  Device vendor specific log
0xa8           SL  VS      20  Device vendor specific log
0xa9           SL  VS       1  Device vendor specific log
0xe0           SL  R/W      1  SCT Command/Status
0xe1           SL  R/W      1  SCT Data Transfer

SMART Extended Comprehensive Error Log (GP Log 0x03) not supported

SMART Error Log Version: 1
ATA Error Count: 237 (device log contains only the most recent five errors)
	CR = Command Register [HEX]
	FR = Features Register [HEX]
	SC = Sector Count Register [HEX]
	SN = Sector Number Register [HEX]
	CL = Cylinder Low Register [HEX]
	CH = Cylinder High Register [HEX]
	DH = Device/Head Register [HEX]
	DC = Device Command Register [HEX]
	ER = Error register [HEX]
	ST = Status register [HEX]
Powered_Up_Time is measured from power on, and printed as
DDd+hh:mm:SS.sss where DD=days, hh=hours, mm=minutes,
SS=sec, and sss=millisec. It "wraps" after 49.710 days.

Error 237 occurred at disk power-on lifetime: 2091 hours (87 days + 3 hours)
  When the command that caused the error occurred, the device was active or idle.

  After command completion occurred, registers were:
  ER ST SC SN CL CH DH
  -- -- -- -- -- -- --
  40 51 20 a6 ad 56 e2  Error: UNC at LBA = 0x0256ada6 = 39234982

  Commands leading to the command that caused the error were:
  CR FR SC SN CL CH DH DC   Powered_Up_Time  Command/Feature_Name
  -- -- -- -- -- -- -- --  ----------------  --------------------
  40 00 20 a6 ad 56 e2 00      00:17:24.140  READ VERIFY SECTOR(S)
  40 00 20 86 ad 56 e2 00      00:17:22.285  READ VERIFY SECTOR(S)
  c8 00 01 b1 66 e3 e4 00      00:17:21.318  READ DMA
  40 00 20 66 ad 56 e2 00      00:17:21.297  READ VERIFY SECTOR(S)
  c8 00 01 00 00 00 e0 00      00:17:19.263  READ DMA

Error 236 occurred at disk power-on lifetime: 2091 hours (87 days + 3 hours)
  When the command that caused the error occurred, the device was active or idle.

  After command completion occurred, registers were:
  ER ST SC SN CL CH DH
  -- -- -- -- -- -- --
  10 51 20 86 ad 56 e2  Error: IDNF at LBA = 0x0256ad86 = 39234950

  Commands leading to the command that caused the error were:
  CR FR SC SN CL CH DH DC   Powered_Up_Time  Command/Feature_Name
  -- -- -- -- -- -- -- --  ----------------  --------------------
  40 00 20 86 ad 56 e2 00      00:17:24.140  READ VERIFY SECTOR(S)
  c8 00 01 b1 66 e3 e4 00      00:17:22.285  READ DMA
  40 00 20 66 ad 56 e2 00      00:17:21.318  READ VERIFY SECTOR(S)
  c8 00 01 00 00 00 e0 00      00:17:21.297  READ DMA
  40 00 20 46 ad 56 e2 00      00:17:19.263  READ VERIFY SECTOR(S)

Error 235 occurred at disk power-on lifetime: 2091 hours (87 days + 3 hours)
  When the command that caused the error occurred, the device was active or idle.

  After command completion occurred, registers were:
  ER ST SC SN CL CH DH
  -- -- -- -- -- -- --
  10 51 20 66 ad 56 e2  Error: IDNF at LBA = 0x0256ad66 = 39234918

  Commands leading to the command that caused the error were:
  CR FR SC SN CL CH DH DC   Powered_Up_Time  Command/Feature_Name
  -- -- -- -- -- -- -- --  ----------------  --------------------
  40 00 20 66 ad 56 e2 00      00:17:24.140  READ VERIFY SECTOR(S)
  c8 00 01 00 00 00 e0 00      00:17:22.285  READ DMA
  40 00 20 46 ad 56 e2 00      00:17:21.318  READ VERIFY SECTOR(S)
  c8 00 01 00 00 00 e0 00      00:17:21.297  READ DMA
  40 00 20 26 ad 56 e2 00      00:17:19.263  READ VERIFY SECTOR(S)

Error 234 occurred at disk power-on lifetime: 2091 hours (87 days + 3 hours)
  When the command that caused the error occurred, the device was active or idle.

  After command completion occurred, registers were:
  ER ST SC SN CL CH DH
  -- -- -- -- -- -- --
  40 51 20 46 ad 56 e2  Error: UNC at LBA = 0x0256ad46 = 39234886

  Commands leading to the command that caused the error were:
  CR FR SC SN CL CH DH DC   Powered_Up_Time  Command/Feature_Name
  -- -- -- -- -- -- -- --  ----------------  --------------------
  40 00 20 46 ad 56 e2 00      00:17:24.140  READ VERIFY SECTOR(S)
  c8 00 01 00 00 00 e0 00      00:17:22.285  READ DMA
  40 00 20 26 ad 56 e2 00      00:17:21.318  READ VERIFY SECTOR(S)
  c8 00 01 00 00 00 e0 00      00:17:21.297  READ DMA
  40 00 20 06 ad 56 e2 00      00:17:19.263  READ VERIFY SECTOR(S)

Error 233 occurred at disk power-on lifetime: 2091 hours (87 days + 3 hours)
  When the command that caused the error occurred, the device was active or idle.

  After command completion occurred, registers were:
  ER ST SC SN CL CH DH
  -- -- -- -- -- -- --
  40 51 20 26 ad 56 e2  Error: UNC at LBA = 0x0256ad26 = 39234854

  Commands leading to the command that caused the error were:
  CR FR SC SN CL CH DH DC   Powered_Up_Time  Command/Feature_Name
  -- -- -- -- -- -- -- --  ----------------  --------------------
  40 00 20 26 ad 56 e2 00      00:17:24.140  READ VERIFY SECTOR(S)
  c8 00 01 00 00 00 e0 00      00:17:22.285  READ DMA
  40 00 20 06 ad 56 e2 00      00:17:21.318  READ VERIFY SECTOR(S)
  40 00 20 e6 ac 56 e2 00      00:17:21.297  READ VERIFY SECTOR(S)
  c8 00 01 b1 66 e3 e4 00      00:17:19.263  READ DMA

SMART Extended Self-test Log (GP Log 0x07) not supported

SMART Self-test log structure revision number 1
Num  Test_Description    Status                  Remaining  LifeTime(hours)  LBA_of_first_error
# 1  Short offline       Completed: read failure       80%      2676         39234044
# 2  Extended offline    Completed: read failure       10%      2676         39234044
# 3  Short offline       Aborted by host               90%      2676         -
# 4  Short offline       Completed without error       00%         0         -

SMART Selective self-test log data structure revision number 1
 SPAN  MIN_LBA  MAX_LBA  CURRENT_TEST_STATUS
    1        0        0  Not_testing
    2        0        0  Not_testing
    3        0        0  Not_testing
    4        0        0  Not_testing
    5        0        0  Not_testing
Selective self-test flags (0x0):
  After scanning selected spans, do NOT read-scan remainder of disk.
If Selective self-test is pending on power-up, resume after 0 minute delay.

SCT Status Version:                  2
SCT Version (vendor specific):       521 (0x0209)
Device State:                        Active (0)
Current Temperature:                    39 Celsius
Power Cycle Min/Max Temperature:     --/ 0 Celsius
Lifetime    Min/Max Temperature:     --/ 0 Celsius

SCT Data Table command not supported

SCT Error Recovery Control command not supported

Device Statistics (GP/SMART Log 0x04) not supported

Pending Defects log (GP Log 0x0c) not supported

SATA Phy Event Counters (GP Log 0x11)
ID      Size     Value  Description
0x000a  2            6  Device-to-host register FISes sent due to a COMRESET
0x0001  2            0  Command failed due to ICRC error
0x0003  2            0  R_ERR response for device-to-host data FIS
0x0004  2            0  R_ERR response for host-to-device data FIS
0x0006  2            0  R_ERR response for device-to-host non-data FIS
0x0007  2            0  R_ERR response for host-to-device non-data FIS



