smartctl 7.4 2023-08-01 r5530 [FreeBSD 13.2-RELEASE-p11 amd64] (local build)
Copyright (C) 2002-23, Bruce Allen, Christian Franke, www.smartmontools.org

=== START OF INFORMATION SECTION ===
Model Number:                       KIOXIA-EXCERIA G2 SSD
Serial Number:                      --
Firmware Version:                   ECFA17.0
PCI Vendor/Subsystem ID:            0x1e0f
IEEE OUI Identifier:                0x8ce38e
Total NVM Capacity:                 1,000,204,886,016 [1.00 TB]
Unallocated NVM Capacity:           0
Controller ID:                      1
NVMe Version:                       1.3
Number of Namespaces:               1
Namespace 1 Size/Capacity:          1,000,204,886,016 [1.00 TB]
Namespace 1 Formatted LBA Size:     512
Namespace 1 IEEE EUI-64:            8ce38e ...
Local Time is:                      Wed Jun 26 23:08:06 2024 CEST
Firmware Updates (0x12):            1 Slot, no Reset required
Optional Admin Commands (0x0017):   Security Format Frmw_DL Self_Test
Optional NVM Commands (0x005f):     Comp Wr_Unc DS_Mngmt Wr_Zero Sav/Sel_Feat Timestmp
Log Page Attributes (0x0a):         Cmd_Eff_Lg Telmtry_Lg
Maximum Data Transfer Size:         512 Pages
Warning  Comp. Temp. Threshold:     72 Celsius
Critical Comp. Temp. Threshold:     90 Celsius

Supported Power States
St Op     Max   Active     Idle   RL RT WL WT  Ent_Lat  Ex_Lat
 0 +     7.69W       -        -    0  0  0  0        1       1
 1 +     6.18W       -        -    1  1  1  1        1       1
 2 +     5.42W       -        -    2  2  2  2        1       1
 3 -   0.0500W       -        -    3  3  3  3     7000    5000
 4 -   0.0050W       -        -    4  4  4  4    13000   36000

Supported LBA Sizes (NSID 0x1)
Id Fmt  Data  Metadt  Rel_Perf
 0 +     512       0         2
 1 -    4096       0         1

=== START OF SMART DATA SECTION ===
SMART overall-health self-assessment test result: PASSED

SMART/Health Information (NVMe Log 0x02)
Critical Warning:                   0x00
Temperature:                        61 Celsius
Available Spare:                    100%
Available Spare Threshold:          5%
Percentage Used:                    18%
Data Units Read:                    75,380,177 [38.5 TB]
Data Units Written:                 81,193,502 [41.5 TB]
Host Read Commands:                 605,683,687
Host Write Commands:                1,502,598,798
Controller Busy Time:               2,515
Power Cycles:                       310
Power On Hours:                     11,023
Unsafe Shutdowns:                   99
Media and Data Integrity Errors:    0
Error Information Log Entries:      1,060
Warning  Comp. Temperature Time:    3
Critical Comp. Temperature Time:    0
Thermal Temp. 1 Transition Count:   169
Thermal Temp. 2 Transition Count:   2
Thermal Temp. 1 Total Time:         183684
Thermal Temp. 2 Total Time:         2943

Error Information (NVMe Log 0x01, 16 of 63 entries)
No Errors Logged

Self-test Log (NVMe Log 0x06)
Self-test status: No self-test in progress
No Self-tests Logged

