smartctl 7.3 2022-02-28 r5338 [FreeBSD 14.0-CURRENT amd64] (local build)
Copyright (C) 2002-22, Bruce Allen, Christian Franke, www.smartmontools.org

=== START OF INFORMATION SECTION ===
Model Family:     Silicon Motion based SSDs
Device Model:     ADATA SU650
Serial Number:    --
LU WWN Device Id: 0 000000 ...
Firmware Version: XA003R17
User Capacity:    240,057,409,536 bytes [240 GB]
Sector Size:      512 bytes logical/physical
Rotation Rate:    Solid State Device
Form Factor:      2.5 inches
TRIM Command:     Available, deterministic
Device is:        In smartctl database 7.3/5319
ATA Version is:   ACS-3, ATA8-ACS T13/1699-D revision 6
SATA Version is:  SATA 3.0, 6.0 Gb/s (current: 6.0 Gb/s)
Local Time is:    Sat Sep 24 21:23:03 2022 EEST
SMART support is: Available - device has SMART capability.
SMART support is: Enabled
AAM feature is:   Unavailable
APM feature is:   Unavailable
Rd look-ahead is: Enabled
Write cache is:   Enabled
DSN feature is:   Unavailable
ATA Security is:  Disabled, frozen [SEC2]
Wt Cache Reorder: Unavailable

=== START OF READ SMART DATA SECTION ===
SMART overall-health self-assessment test result: PASSED

General SMART Values:
Offline data collection status:  (0x00)	Offline data collection activity
					was never started.
					Auto Offline Data Collection: Disabled.
Self-test execution status:      (   0)	The previous self-test routine completed
					without error or no self-test has ever 
					been run.
Total time to complete Offline 
data collection: 		(    1) seconds.
Offline data collection
capabilities: 			 (0x59) SMART execute Offline immediate.
					No Auto Offline data collection support.
					Suspend Offline collection upon new
					command.
					Offline surface scan supported.
					Self-test supported.
					No Conveyance Self-test supported.
					Selective Self-test supported.
SMART capabilities:            (0x0002)	Does not save SMART data before
					entering power-saving mode.
					Supports SMART auto save timer.
Error logging capability:        (0x01)	Error logging supported.
					General Purpose Logging supported.
Short self-test routine 
recommended polling time: 	 (   7) minutes.
Extended self-test routine
recommended polling time: 	 (  23) minutes.

SMART Attributes Data Structure revision number: 10
Vendor Specific SMART Attributes with Thresholds:
ID# ATTRIBUTE_NAME          FLAGS    VALUE WORST THRESH FAIL RAW_VALUE
  1 Raw_Read_Error_Rate     POSR-K   100   100   050    -    0
  5 Reallocated_Sector_Ct   PO--CK   100   100   010    -    0
  9 Power_On_Hours          -O--CK   100   100   000    -    3062
 12 Power_Cycle_Count       -O--CK   100   100   000    -    1621
160 Uncorrectable_Error_Cnt -O--CK   100   100   050    -    0
161 Valid_Spare_Block_Cnt   -O--CK   100   100   050    -    84
163 Initial_Bad_Block_Count -O--CK   100   100   000    -    55
164 Total_Erase_Count       -O--CK   100   100   000    -    115644
165 Max_Erase_Count         -O--CK   100   100   000    -    218
166 Min_Erase_Count         -O--CK   100   100   000    -    48
167 Average_Erase_Count     -O--CK   100   100   000    -    116
148 Total_SLC_Erase_Ct      -O--CK   100   100   000    -    346934
149 Max_SLC_Erase_Ct        -O--CK   100   100   000    -    655
150 Min_SLC_Erase_Ct        -O--CK   100   100   000    -    145
151 Average_SLC_Erase_Ct    -O--CK   100   100   000    -    349
159 DRAM_1_Bit_Error_Count  -O--CK   100   100   000    -    0
168 Max_Erase_Count_of_Spec -O--CK   100   100   000    -    655
169 Remaining_Lifetime_Perc -O--CK   100   100   000    -    97
177 Wear_Leveling_Count     -O--CK   100   100   000    -    191
181 Program_Fail_Cnt_Total  -O--CK   100   100   000    -    0
182 Erase_Fail_Count_Total  -O--CK   100   100   000    -    0
192 Power-Off_Retract_Count -O--CK   100   100   000    -    674
194 Temperature_Celsius     -O--CK   100   100   000    -    36
195 Hardware_ECC_Recovered  -O--CK   100   100   000    -    0
196 Reallocated_Event_Count -O--CK   100   100   000    -    0
199 UDMA_CRC_Error_Count    -O--CK   100   100   000    -    0
232 Available_Reservd_Space -O--CK   100   100   000    -    84
241 Host_Writes_32MiB       -O--CK   100   100   000    -    750493
242 Host_Reads_32MiB        -O--CK   100   100   000    -    515141
245 TLC_Writes_32MiB        -O--CK   100   100   000    -    1074438
                            ||||||_ K auto-keep
                            |||||__ C event count
                            ||||___ R error rate
                            |||____ S speed/performance
                            ||_____ O updated online
                            |______ P prefailure warning

General Purpose Log Directory Version 1
SMART           Log Directory Version 1 [multi-sector log support]
Address    Access  R/W   Size  Description
0x00       GPL,SL  R/O      1  Log Directory
0x01           SL  R/O      1  Summary SMART error log
0x02           SL  R/O      1  Comprehensive SMART error log
0x03       GPL     R/O      2  Ext. Comprehensive SMART error log
0x04       GPL,SL  R/O      5  Device Statistics log
0x06           SL  R/O      1  SMART self-test log
0x07       GPL     R/O      1  Extended self-test log
0x09           SL  R/W      1  Selective self-test log
0x10       GPL     R/O      1  NCQ Command Error log
0x11       GPL     R/O      1  SATA Phy Event Counters log
0x30       GPL,SL  R/O      8  IDENTIFY DEVICE data log
0x80-0x9f  GPL,SL  R/W     16  Host vendor specific log
0xe0       GPL,SL  R/W      1  SCT Command/Status
0xe1       GPL,SL  R/W      1  SCT Data Transfer

SMART Extended Comprehensive Error Log Version: 1 (2 sectors)
Invalid Error Log index = 0x000a (reserved = 0x00)
SMART Extended Self-test Log Version: 1 (1 sectors)
No self-tests have been logged.  [To run self-tests, use: smartctl -t]

SMART Selective self-test log data structure revision number 0
Note: revision number not 1 implies that no selective self-test has ever been run
 SPAN  MIN_LBA  MAX_LBA  CURRENT_TEST_STATUS
    1        0        0  Not_testing
    2        0        0  Not_testing
    3        0        0  Not_testing
    4        0        0  Not_testing
    5        0        0  Not_testing
Selective self-test flags (0x0):
  After scanning selected spans, do NOT read-scan remainder of disk.
If Selective self-test is pending on power-up, resume after 0 minute delay.

SCT Commands not supported

Device Statistics (GP Log 0x04)
Page  Offset Size        Value Flags Description
0x01  =====  =               =  ===  == General Statistics (rev 1) ==
0x01  0x008  4            1621  ---  Lifetime Power-On Resets
0x01  0x010  4            3062  ---  Power-on Hours
0x01  0x018  6     49184337013  ---  Logical Sectors Written
0x01  0x020  6       475260672  ---  Number of Write Commands
0x01  0x028  6     33760343479  ---  Logical Sectors Read
0x01  0x030  6       372644496  ---  Number of Read Commands
0x01  0x038  6     11024644631  ---  Date and Time TimeStamp
0x04  =====  =               =  ===  == General Errors Statistics (rev 1) ==
0x04  0x008  4            2047  ---  Number of Reported Uncorrectable Errors
0x04  0x010  4              56  ---  Resets Between Cmd Acceptance and Completion
0x06  =====  =               =  ===  == Transport Statistics (rev 1) ==
0x06  0x008  4           12299  ---  Number of Hardware Resets
0x06  0x018  4               0  ---  Number of Interface CRC Errors
0x07  =====  =               =  ===  == Solid State Device Statistics (rev 1) ==
0x07  0x008  1               9  ---  Percentage Used Endurance Indicator
                                |||_ C monitored condition met
                                ||__ D supports DSN
                                |___ N normalized value

Pending Defects log (GP Log 0x0c) not supported

SATA Phy Event Counters (GP Log 0x11)
ID      Size     Value  Description
0x0001  4            0  Command failed due to ICRC error
0x000a  4            3  Device-to-host register FISes sent due to a COMRESET

