smartctl 7.4 2023-08-01 r5530 [FreeBSD 14.1-RELEASE-p5 amd64] (local build)
Copyright (C) 2002-23, Bruce Allen, Christian Franke, www.smartmontools.org

=== START OF INFORMATION SECTION ===
Model Family:     Western Digital Blue
Device Model:     WDC WD5000AAKX-003CA0
Serial Number:    --
LU WWN Device Id: 5 0014ee ...
Firmware Version: 15.01H15
User Capacity:    500,106,780,160 bytes [500 GB]
Sector Size:      512 bytes logical/physical
Device is:        In smartctl database 7.3/5528
ATA Version is:   ATA8-ACS (minor revision not indicated)
SATA Version is:  SATA 3.0, 6.0 Gb/s (current: 6.0 Gb/s)
Local Time is:    Tue Nov 12 20:07:58 2024 -03
SMART support is: Available - device has SMART capability.
SMART support is: Enabled
AAM feature is:   Unavailable
APM feature is:   Unavailable
Rd look-ahead is: Enabled
Write cache is:   Enabled
DSN feature is:   Unavailable
ATA Security is:  Disabled, frozen [SEC2]
Wt Cache Reorder: Enabled

=== START OF READ SMART DATA SECTION ===
SMART overall-health self-assessment test result: PASSED

General SMART Values:
Offline data collection status:  (0x82)	Offline data collection activity
					was completed without error.
					Auto Offline Data Collection: Enabled.
Self-test execution status:      (   0)	The previous self-test routine completed
					without error or no self-test has ever 
					been run.
Total time to complete Offline 
data collection: 		( 8160) seconds.
Offline data collection
capabilities: 			 (0x7b) SMART execute Offline immediate.
					Auto Offline data collection on/off support.
					Suspend Offline collection upon new
					command.
					Offline surface scan supported.
					Self-test supported.
					Conveyance Self-test supported.
					Selective Self-test supported.
SMART capabilities:            (0x0003)	Saves SMART data before entering
					power-saving mode.
					Supports SMART auto save timer.
Error logging capability:        (0x01)	Error logging supported.
					General Purpose Logging supported.
Short self-test routine 
recommended polling time: 	 (   2) minutes.
Extended self-test routine
recommended polling time: 	 (  83) minutes.
Conveyance self-test routine
recommended polling time: 	 (   5) minutes.
SCT capabilities: 	       (0x3037)	SCT Status supported.
					SCT Feature Control supported.
					SCT Data Table supported.

SMART Attributes Data Structure revision number: 16
Vendor Specific SMART Attributes with Thresholds:
ID# ATTRIBUTE_NAME          FLAGS    VALUE WORST THRESH FAIL RAW_VALUE
  1 Raw_Read_Error_Rate     POSR-K   200   199   051    -    22931
  3 Spin_Up_Time            POS--K   156   133   021    -    3175
  4 Start_Stop_Count        -O--CK   094   094   000    -    6135
  5 Reallocated_Sector_Ct   PO--CK   200   200   140    -    0
  7 Seek_Error_Rate         -OSR-K   100   253   000    -    0
  9 Power_On_Hours          -O--CK   059   059   000    -    30433
 10 Spin_Retry_Count        -O--CK   100   100   000    -    0
 11 Calibration_Retry_Count -O--CK   100   100   000    -    0
 12 Power_Cycle_Count       -O--CK   097   097   000    -    3661
192 Power-Off_Retract_Count -O--CK   199   199   000    -    775
193 Load_Cycle_Count        -O--CK   199   199   000    -    5359
194 Temperature_Celsius     -O---K   100   093   000    -    43
196 Reallocated_Event_Count -O--CK   200   200   000    -    0
197 Current_Pending_Sector  -O--CK   200   200   000    -    0
198 Offline_Uncorrectable   ----CK   200   200   000    -    0
199 UDMA_CRC_Error_Count    -O--CK   200   200   000    -    2142
200 Multi_Zone_Error_Rate   ---R--   200   200   000    -    0
                            ||||||_ K auto-keep
                            |||||__ C event count
                            ||||___ R error rate
                            |||____ S speed/performance
                            ||_____ O updated online
                            |______ P prefailure warning

General Purpose Log Directory Version 1
SMART           Log Directory Version 1 [multi-sector log support]
Address    Access  R/W   Size  Description
0x00       GPL,SL  R/O      1  Log Directory
0x01           SL  R/O      1  Summary SMART error log
0x02           SL  R/O      5  Comprehensive SMART error log
0x03       GPL     R/O      6  Ext. Comprehensive SMART error log
0x06           SL  R/O      1  SMART self-test log
0x07       GPL     R/O      1  Extended self-test log
0x09           SL  R/W      1  Selective self-test log
0x10       GPL     R/O      1  NCQ Command Error log
0x11       GPL     R/O      1  SATA Phy Event Counters log
0x80-0x9f  GPL,SL  R/W     16  Host vendor specific log
0xa0-0xa7  GPL,SL  VS      16  Device vendor specific log
0xa8-0xb5  GPL,SL  VS       1  Device vendor specific log
0xb6       GPL     VS       1  Device vendor specific log
0xb7       GPL,SL  VS       1  Device vendor specific log
0xc0       GPL,SL  VS       1  Device vendor specific log
0xc1       GPL     VS      24  Device vendor specific log
0xe0       GPL,SL  R/W      1  SCT Command/Status
0xe1       GPL,SL  R/W      1  SCT Data Transfer

SMART Extended Comprehensive Error Log Version: 1 (6 sectors)
Device Error Count: 22931 (device log contains only the most recent 24 errors)
	CR     = Command Register
	FEATR  = Features Register
	COUNT  = Count (was: Sector Count) Register
	LBA_48 = Upper bytes of LBA High/Mid/Low Registers ]  ATA-8
	LH     = LBA High (was: Cylinder High) Register    ]   LBA
	LM     = LBA Mid (was: Cylinder Low) Register      ] Register
	LL     = LBA Low (was: Sector Number) Register     ]
	DV     = Device (was: Device/Head) Register
	DC     = Device Control Register
	ER     = Error register
	ST     = Status register
Powered_Up_Time is measured from power on, and printed as
DDd+hh:mm:SS.sss where DD=days, hh=hours, mm=minutes,
SS=sec, and sss=millisec. It "wraps" after 49.710 days.

Error 22931 [10] occurred at disk power-on lifetime: 21665 hours (902 days + 17 hours)
  When the command that caused the error occurred, the device was active or idle.

  After command completion occurred, registers were:
  ER -- ST COUNT  LBA_48  LH LM LL DV DC
  -- -- -- == -- == == == -- -- -- -- --
  40 -- 51 00 80 00 00 00 03 a5 07 e0 00  Error: UNC 128 sectors at LBA = 0x0003a507 = 238855

  Commands leading to the command that caused the error were:
  CR FEATR COUNT  LBA_48  LH LM LL DV DC  Powered_Up_Time  Command/Feature_Name
  -- == -- == -- == == == -- -- -- -- --  ---------------  --------------------
  25 00 00 00 80 00 00 00 03 a5 00 e0 00     01:39:02.211  READ DMA EXT
  25 00 00 00 80 00 00 00 03 a4 80 e0 00     01:39:02.211  READ DMA EXT
  25 00 00 00 80 00 00 00 03 a4 00 e0 00     01:39:02.210  READ DMA EXT
  25 00 00 00 80 00 00 00 03 a3 80 e0 00     01:39:02.210  READ DMA EXT
  25 00 00 00 80 00 00 00 03 a3 00 e0 00     01:39:02.209  READ DMA EXT

Error 22930 [9] occurred at disk power-on lifetime: 21657 hours (902 days + 9 hours)
  When the command that caused the error occurred, the device was active or idle.

  After command completion occurred, registers were:
  ER -- ST COUNT  LBA_48  LH LM LL DV DC
  -- -- -- == -- == == == -- -- -- -- --
  40 -- 51 00 80 00 00 00 03 a5 07 e0 00  Error: UNC 128 sectors at LBA = 0x0003a507 = 238855

  Commands leading to the command that caused the error were:
  CR FEATR COUNT  LBA_48  LH LM LL DV DC  Powered_Up_Time  Command/Feature_Name
  -- == -- == -- == == == -- -- -- -- --  ---------------  --------------------
  25 00 00 00 80 00 00 00 03 a5 00 e0 00     00:46:39.300  READ DMA EXT
  25 00 00 00 80 00 00 00 03 a4 80 e0 00     00:46:39.300  READ DMA EXT
  25 00 00 00 80 00 00 00 03 a4 00 e0 00     00:46:39.299  READ DMA EXT
  25 00 00 00 80 00 00 00 03 a3 80 e0 00     00:46:39.299  READ DMA EXT
  25 00 00 00 80 00 00 00 03 a3 00 e0 00     00:46:39.298  READ DMA EXT

Error 22929 [8] occurred at disk power-on lifetime: 21651 hours (902 days + 3 hours)
  When the command that caused the error occurred, the device was active or idle.

  After command completion occurred, registers were:
  ER -- ST COUNT  LBA_48  LH LM LL DV DC
  -- -- -- == -- == == == -- -- -- -- --
  40 -- 51 00 80 00 00 00 03 a5 07 e0 00  Error: UNC 128 sectors at LBA = 0x0003a507 = 238855

  Commands leading to the command that caused the error were:
  CR FEATR COUNT  LBA_48  LH LM LL DV DC  Powered_Up_Time  Command/Feature_Name
  -- == -- == -- == == == -- -- -- -- --  ---------------  --------------------
  25 00 00 00 80 00 00 00 03 a5 00 e0 00     00:43:49.434  READ DMA EXT
  25 00 00 00 80 00 00 00 03 a4 80 e0 00     00:43:49.434  READ DMA EXT
  25 00 00 00 80 00 00 00 03 a4 00 e0 00     00:43:49.433  READ DMA EXT
  25 00 00 00 80 00 00 00 03 a3 80 e0 00     00:43:49.433  READ DMA EXT
  25 00 00 00 80 00 00 00 03 a3 00 e0 00     00:43:49.432  READ DMA EXT

Error 22928 [7] occurred at disk power-on lifetime: 21649 hours (902 days + 1 hours)
  When the command that caused the error occurred, the device was active or idle.

  After command completion occurred, registers were:
  ER -- ST COUNT  LBA_48  LH LM LL DV DC
  -- -- -- == -- == == == -- -- -- -- --
  40 -- 51 00 80 00 00 00 03 a5 07 e0 00  Error: UNC 128 sectors at LBA = 0x0003a507 = 238855

  Commands leading to the command that caused the error were:
  CR FEATR COUNT  LBA_48  LH LM LL DV DC  Powered_Up_Time  Command/Feature_Name
  -- == -- == -- == == == -- -- -- -- --  ---------------  --------------------
  25 00 00 00 80 00 00 00 03 a5 00 e0 00     02:15:52.355  READ DMA EXT
  25 00 00 00 80 00 00 00 03 a4 80 e0 00     02:15:52.355  READ DMA EXT
  25 00 00 00 80 00 00 00 03 a4 00 e0 00     02:15:52.354  READ DMA EXT
  25 00 00 00 80 00 00 00 03 a3 80 e0 00     02:15:52.354  READ DMA EXT
  25 00 00 00 80 00 00 00 03 a3 00 e0 00     02:15:52.353  READ DMA EXT

Error 22927 [6] occurred at disk power-on lifetime: 21643 hours (901 days + 19 hours)
  When the command that caused the error occurred, the device was active or idle.

  After command completion occurred, registers were:
  ER -- ST COUNT  LBA_48  LH LM LL DV DC
  -- -- -- == -- == == == -- -- -- -- --
  40 -- 51 00 80 00 00 00 03 a5 07 e0 00  Error: UNC 128 sectors at LBA = 0x0003a507 = 238855

  Commands leading to the command that caused the error were:
  CR FEATR COUNT  LBA_48  LH LM LL DV DC  Powered_Up_Time  Command/Feature_Name
  -- == -- == -- == == == -- -- -- -- --  ---------------  --------------------
  25 00 00 00 80 00 00 00 03 a5 00 e0 00     01:32:16.321  READ DMA EXT
  25 00 00 00 80 00 00 00 03 a4 80 e0 00     01:32:16.321  READ DMA EXT
  25 00 00 00 80 00 00 00 03 a4 00 e0 00     01:32:16.320  READ DMA EXT
  25 00 00 00 80 00 00 00 03 a3 80 e0 00     01:32:16.320  READ DMA EXT
  25 00 00 00 80 00 00 00 03 a3 00 e0 00     01:32:16.320  READ DMA EXT

Error 22926 [5] occurred at disk power-on lifetime: 21636 hours (901 days + 12 hours)
  When the command that caused the error occurred, the device was active or idle.

  After command completion occurred, registers were:
  ER -- ST COUNT  LBA_48  LH LM LL DV DC
  -- -- -- == -- == == == -- -- -- -- --
  40 -- 51 00 80 00 00 00 03 a5 07 e0 00  Error: UNC 128 sectors at LBA = 0x0003a507 = 238855

  Commands leading to the command that caused the error were:
  CR FEATR COUNT  LBA_48  LH LM LL DV DC  Powered_Up_Time  Command/Feature_Name
  -- == -- == -- == == == -- -- -- -- --  ---------------  --------------------
  25 00 00 00 80 00 00 00 03 a5 00 e0 00     00:31:07.381  READ DMA EXT
  25 00 00 00 80 00 00 00 03 a4 80 e0 00     00:31:07.380  READ DMA EXT
  25 00 00 00 80 00 00 00 03 a4 00 e0 00     00:31:07.380  READ DMA EXT
  25 00 00 00 80 00 00 00 03 a3 80 e0 00     00:31:07.379  READ DMA EXT
  25 00 00 00 80 00 00 00 03 a3 00 e0 00     00:31:07.379  READ DMA EXT

Error 22925 [4] occurred at disk power-on lifetime: 21469 hours (894 days + 13 hours)
  When the command that caused the error occurred, the device was active or idle.

  After command completion occurred, registers were:
  ER -- ST COUNT  LBA_48  LH LM LL DV DC
  -- -- -- == -- == == == -- -- -- -- --
  40 -- 51 00 80 00 00 00 03 a5 07 e0 00  Error: UNC 128 sectors at LBA = 0x0003a507 = 238855

  Commands leading to the command that caused the error were:
  CR FEATR COUNT  LBA_48  LH LM LL DV DC  Powered_Up_Time  Command/Feature_Name
  -- == -- == -- == == == -- -- -- -- --  ---------------  --------------------
  25 00 00 00 80 00 00 00 03 a5 00 e0 00     00:42:16.828  READ DMA EXT
  25 00 00 00 80 00 00 00 03 a4 80 e0 00     00:42:16.828  READ DMA EXT
  25 00 00 00 80 00 00 00 03 a4 00 e0 00     00:42:16.827  READ DMA EXT
  25 00 00 00 80 00 00 00 03 a3 80 e0 00     00:42:16.827  READ DMA EXT
  25 00 00 00 80 00 00 00 03 a3 00 e0 00     00:42:16.827  READ DMA EXT

Error 22924 [3] occurred at disk power-on lifetime: 21463 hours (894 days + 7 hours)
  When the command that caused the error occurred, the device was active or idle.

  After command completion occurred, registers were:
  ER -- ST COUNT  LBA_48  LH LM LL DV DC
  -- -- -- == -- == == == -- -- -- -- --
  40 -- 51 00 80 00 00 00 03 a5 07 e0 00  Error: UNC 128 sectors at LBA = 0x0003a507 = 238855

  Commands leading to the command that caused the error were:
  CR FEATR COUNT  LBA_48  LH LM LL DV DC  Powered_Up_Time  Command/Feature_Name
  -- == -- == -- == == == -- -- -- -- --  ---------------  --------------------
  25 00 00 00 80 00 00 00 03 a5 00 e0 00     01:11:37.691  READ DMA EXT
  25 00 00 00 80 00 00 00 03 a4 80 e0 00     01:11:37.691  READ DMA EXT
  25 00 00 00 80 00 00 00 03 a4 00 e0 00     01:11:37.690  READ DMA EXT
  25 00 00 00 80 00 00 00 03 a3 80 e0 00     01:11:37.690  READ DMA EXT
  25 00 00 00 80 00 00 00 03 a3 00 e0 00     01:11:37.689  READ DMA EXT

SMART Extended Self-test Log Version: 1 (1 sectors)
No self-tests have been logged.  [To run self-tests, use: smartctl -t]

SMART Selective self-test log data structure revision number 1
 SPAN  MIN_LBA  MAX_LBA  CURRENT_TEST_STATUS
    1        0        0  Not_testing
    2        0        0  Not_testing
    3        0        0  Not_testing
    4        0        0  Not_testing
    5        0        0  Not_testing
Selective self-test flags (0x0):
  After scanning selected spans, do NOT read-scan remainder of disk.
If Selective self-test is pending on power-up, resume after 0 minute delay.

SCT Status Version:                  3
SCT Version (vendor specific):       258 (0x0102)
Device State:                        Active (0)
Current Temperature:                    43 Celsius
Power Cycle Min/Max Temperature:     31/43 Celsius
Lifetime    Min/Max Temperature:     25/50 Celsius
Under/Over Temperature Limit Count:   0/0

SCT Temperature History Version:     2
Temperature Sampling Period:         1 minute
Temperature Logging Interval:        1 minute
Min/Max recommended Temperature:      0/60 Celsius
Min/Max Temperature Limit:           -41/85 Celsius
Temperature History Size (Index):    478 (323)

SCT Error Recovery Control command not supported

Device Statistics (GP/SMART Log 0x04) not supported

Pending Defects log (GP Log 0x0c) not supported

SATA Phy Event Counters (GP Log 0x11)
ID      Size     Value  Description
0x0001  2            0  Command failed due to ICRC error
0x0002  2            0  R_ERR response for data FIS
0x0003  2            0  R_ERR response for device-to-host data FIS
0x0004  2            0  R_ERR response for host-to-device data FIS
0x0005  2            0  R_ERR response for non-data FIS
0x0006  2            0  R_ERR response for device-to-host non-data FIS
0x0007  2            0  R_ERR response for host-to-device non-data FIS
0x000a  2           18  Device-to-host register FISes sent due to a COMRESET
0x000b  2            0  CRC errors within host-to-device FIS
0x8000  4         9006  Vendor specific



