smartctl 7.4 2023-08-01 r5530 [FreeBSD 13.2-RELEASE-p5 amd64] (local build)
Copyright (C) 2002-23, Bruce Allen, Christian Franke, www.smartmontools.org

=== START OF INFORMATION SECTION ===
Model Number:                       Acer SSD FA100 512GB
Serial Number:                      --
Firmware Version:                   2.4.8.38
PCI Vendor/Subsystem ID:            0x1dee
IEEE OUI Identifier:                0x50c68e
Total NVM Capacity:                 512,110,190,592 [512 GB]
Unallocated NVM Capacity:           0
Controller ID:                      0
NVMe Version:                       1.4
Number of Namespaces:               1
Namespace 1 Size/Capacity:          512,110,190,592 [512 GB]
Namespace 1 Formatted LBA Size:     512
Local Time is:                      Tue Dec  5 23:51:55 2023 MST
Firmware Updates (0x18):            4 Slots, no Reset required
Optional Admin Commands (0x0017):   Security Format Frmw_DL Self_Test
Optional NVM Commands (0x0014):     DS_Mngmt Sav/Sel_Feat
Log Page Attributes (0x02):         Cmd_Eff_Lg
Maximum Data Transfer Size:         32 Pages
Warning  Comp. Temp. Threshold:     85 Celsius
Critical Comp. Temp. Threshold:     87 Celsius

Supported Power States
St Op     Max   Active     Idle   RL RT WL WT  Ent_Lat  Ex_Lat
 0 +     3.00W       -        -    0  0  0  0      100     600
 1 +     2.80W       -        -    1  1  1  1      150     700
 2 +     2.70W       -        -    2  2  2  2      200    1000
 3 -   0.2100W       -        -    3  3  3  3     1000   13000
 4 -   0.0090W       -        -    4  4  4  4     2000   19000

Supported LBA Sizes (NSID 0x1)
Id Fmt  Data  Metadt  Rel_Perf
 0 +     512       0         3

=== START OF SMART DATA SECTION ===
SMART overall-health self-assessment test result: PASSED

SMART/Health Information (NVMe Log 0x02)
Critical Warning:                   0x00
Temperature:                        63 Celsius
Available Spare:                    100%
Available Spare Threshold:          10%
Percentage Used:                    0%
Data Units Read:                    42,368 [21.6 GB]
Data Units Written:                 844,624 [432 GB]
Host Read Commands:                 699,055
Host Write Commands:                21,968,144
Controller Busy Time:               16
Power Cycles:                       12
Power On Hours:                     357
Unsafe Shutdowns:                   5
Media and Data Integrity Errors:    0
Error Information Log Entries:      0
Warning  Comp. Temperature Time:    0
Critical Comp. Temperature Time:    0
Temperature Sensor 1:               74 Celsius
Temperature Sensor 2:               63 Celsius

Error Information (NVMe Log 0x01, 16 of 64 entries)
No Errors Logged

Self-test Log (NVMe Log 0x06)
Self-test status: No self-test in progress
No Self-tests Logged

