smartctl 7.3 2022-02-28 r5338 [FreeBSD 13.2-RELEASE-p2 amd64] (local build)
Copyright (C) 2002-22, Bruce Allen, Christian Franke, www.smartmontools.org

=== START OF INFORMATION SECTION ===
Model Family:     SAMSUNG SpinPoint F1 DT
Device Model:     SAMSUNG HD322HJ
Serial Number:    --
LU WWN Device Id: 5 0000f0 ...
Firmware Version: 1AC01113
User Capacity:    320,071,851,520 bytes [320 GB]
Sector Size:      512 bytes logical/physical
Device is:        In smartctl database 7.3/5319
ATA Version is:   ATA/ATAPI-7, ATA8-ACS T13/1699-D revision 3b
Local Time is:    Mon Sep  4 21:50:58 2023 -03
SMART support is: Available - device has SMART capability.
SMART support is: Enabled
AAM feature is:   Disabled
APM feature is:   Disabled
Rd look-ahead is: Enabled
Write cache is:   Enabled
DSN feature is:   Unavailable
ATA Security is:  Disabled, NOT FROZEN [SEC1]
Wt Cache Reorder: Enabled

=== START OF READ SMART DATA SECTION ===
SMART overall-health self-assessment test result: PASSED

General SMART Values:
Offline data collection status:  (0x00)	Offline data collection activity
					was never started.
					Auto Offline Data Collection: Disabled.
Self-test execution status:      (   0)	The previous self-test routine completed
					without error or no self-test has ever 
					been run.
Total time to complete Offline 
data collection: 		( 4081) seconds.
Offline data collection
capabilities: 			 (0x7b) SMART execute Offline immediate.
					Auto Offline data collection on/off support.
					Suspend Offline collection upon new
					command.
					Offline surface scan supported.
					Self-test supported.
					Conveyance Self-test supported.
					Selective Self-test supported.
SMART capabilities:            (0x0003)	Saves SMART data before entering
					power-saving mode.
					Supports SMART auto save timer.
Error logging capability:        (0x01)	Error logging supported.
					General Purpose Logging supported.
Short self-test routine 
recommended polling time: 	 (   2) minutes.
Extended self-test routine
recommended polling time: 	 (  69) minutes.
Conveyance self-test routine
recommended polling time: 	 (   8) minutes.
SCT capabilities: 	       (0x003f)	SCT Status supported.
					SCT Error Recovery Control supported.
					SCT Feature Control supported.
					SCT Data Table supported.

SMART Attributes Data Structure revision number: 16
Vendor Specific SMART Attributes with Thresholds:
ID# ATTRIBUTE_NAME          FLAGS    VALUE WORST THRESH FAIL RAW_VALUE
  1 Raw_Read_Error_Rate     POSR--   100   100   051    -    0
  3 Spin_Up_Time            POS---   093   093   011    -    2980
  4 Start_Stop_Count        -O--CK   084   084   000    -    15799
  5 Reallocated_Sector_Ct   PO--CK   100   100   010    -    0
  7 Seek_Error_Rate         POSR--   100   100   051    -    0
  8 Seek_Time_Performance   P-S--K   100   100   015    -    9946
  9 Power_On_Hours          -O--CK   094   094   000    -    29716
 10 Spin_Retry_Count        PO--CK   100   100   051    -    1
 11 Calibration_Retry_Count -O--C-   100   100   000    -    0
 12 Power_Cycle_Count       -O--CK   085   085   000    -    15225
 13 Read_Soft_Error_Rate    -OSR--   100   100   000    -    0
183 Runtime_Bad_Block       -O--CK   100   100   000    -    0
184 End-to-End_Error        PO--CK   100   100   000    -    0
187 Reported_Uncorrect      -O--CK   100   100   000    -    0
188 Command_Timeout         -O--CK   100   100   000    -    0
190 Airflow_Temperature_Cel -O---K   071   062   000    -    29 (Min/Max 29/29)
194 Temperature_Celsius     -O---K   071   061   000    -    29 (Min/Max 29/30)
195 Hardware_ECC_Recovered  -O-RC-   100   100   000    -    1267
196 Reallocated_Event_Count -O--CK   100   100   000    -    0
197 Current_Pending_Sector  -O--C-   100   100   000    -    0
198 Offline_Uncorrectable   ----CK   100   100   000    -    0
199 UDMA_CRC_Error_Count    -OSRCK   100   099   000    -    20
200 Multi_Zone_Error_Rate   -O-R--   100   100   000    -    0
201 Soft_Read_Error_Rate    -O-R--   253   253   000    -    0
                            ||||||_ K auto-keep
                            |||||__ C event count
                            ||||___ R error rate
                            |||____ S speed/performance
                            ||_____ O updated online
                            |______ P prefailure warning

General Purpose Log Directory Version 1
SMART           Log Directory Version 1 [multi-sector log support]
Address    Access  R/W   Size  Description
0x00       GPL,SL  R/O      1  Log Directory
0x01           SL  R/O      1  Summary SMART error log
0x02           SL  R/O      2  Comprehensive SMART error log
0x03       GPL     R/O      2  Ext. Comprehensive SMART error log
0x04       GPL     R/O      2  Device Statistics log
0x06           SL  R/O      1  SMART self-test log
0x07       GPL     R/O      2  Extended self-test log
0x09           SL  R/W      1  Selective self-test log
0x10       GPL     R/O      1  NCQ Command Error log
0x11       GPL     R/O      1  SATA Phy Event Counters log
0x21       GPL     R/O      2  Write stream error log
0x22       GPL     R/O      2  Read stream error log
0x80-0x9f  GPL,SL  R/W     16  Host vendor specific log
0xe0       GPL,SL  R/W      1  SCT Command/Status
0xe1       GPL,SL  R/W      1  SCT Data Transfer

SMART Extended Comprehensive Error Log Version: 1 (2 sectors)
Device Error Count: 20 (device log contains only the most recent 8 errors)
	CR     = Command Register
	FEATR  = Features Register
	COUNT  = Count (was: Sector Count) Register
	LBA_48 = Upper bytes of LBA High/Mid/Low Registers ]  ATA-8
	LH     = LBA High (was: Cylinder High) Register    ]   LBA
	LM     = LBA Mid (was: Cylinder Low) Register      ] Register
	LL     = LBA Low (was: Sector Number) Register     ]
	DV     = Device (was: Device/Head) Register
	DC     = Device Control Register
	ER     = Error register
	ST     = Status register
Powered_Up_Time is measured from power on, and printed as
DDd+hh:mm:SS.sss where DD=days, hh=hours, mm=minutes,
SS=sec, and sss=millisec. It "wraps" after 49.710 days.

Error 20 [3] occurred at disk power-on lifetime: 28951 hours (1206 days + 7 hours)
  When the command that caused the error occurred, the device was active or idle.

  After command completion occurred, registers were:
  ER -- ST COUNT  LBA_48  LH LM LL DV DC
  -- -- -- == -- == == == -- -- -- -- --
  04 -- 53 00 19 00 00 0d 41 20 df e0 00  Error: ABRT 25 sectors at LBA = 0x0d4120df = 222372063

  Commands leading to the command that caused the error were:
  CR FEATR COUNT  LBA_48  LH LM LL DV DC  Powered_Up_Time  Command/Feature_Name
  -- == -- == -- == == == -- -- -- -- --  ---------------  --------------------
  35 00 00 00 80 00 00 0d 41 20 78 e0 00     05:32:27.390  WRITE DMA EXT
  35 00 00 00 80 00 00 0d 41 1f f8 e0 00     05:32:27.390  WRITE DMA EXT
  35 00 00 00 40 00 00 0d 41 1f b8 e0 00     05:32:27.390  WRITE DMA EXT
  35 00 00 00 70 00 00 0d 41 1f 48 e0 00     05:32:27.390  WRITE DMA EXT
  35 00 00 00 78 00 00 0d 41 1e d0 e0 00     05:32:27.390  WRITE DMA EXT

Error 19 [2] occurred at disk power-on lifetime: 28950 hours (1206 days + 6 hours)
  When the command that caused the error occurred, the device was active or idle.

  After command completion occurred, registers were:
  ER -- ST COUNT  LBA_48  LH LM LL DV DC
  -- -- -- == -- == == == -- -- -- -- --
  04 -- 53 00 1c 00 00 0d 55 5d 24 e0 00  Error: ABRT 28 sectors at LBA = 0x0d555d24 = 223698212

  Commands leading to the command that caused the error were:
  CR FEATR COUNT  LBA_48  LH LM LL DV DC  Powered_Up_Time  Command/Feature_Name
  -- == -- == -- == == == -- -- -- -- --  ---------------  --------------------
  35 00 00 00 80 00 00 0d 55 5c c0 e0 00     04:17:26.920  WRITE DMA EXT
  35 00 00 00 80 00 00 0d 55 5c 40 e0 00     04:17:26.920  WRITE DMA EXT
  35 00 00 00 80 00 00 0d 55 5b c0 e0 00     04:17:26.920  WRITE DMA EXT
  35 00 00 00 80 00 00 0d 55 5b 40 e0 00     04:17:26.920  WRITE DMA EXT
  35 00 00 00 80 00 00 0d 55 5a c0 e0 00     04:17:26.910  WRITE DMA EXT

Error 18 [1] occurred at disk power-on lifetime: 22458 hours (935 days + 18 hours)
  When the command that caused the error occurred, the device was active or idle.

  After command completion occurred, registers were:
  ER -- ST COUNT  LBA_48  LH LM LL DV DC
  -- -- -- == -- == == == -- -- -- -- --
  00 -- 48 00 18 00 00 13 89 83 50 40 00   at LBA = 0x13898350 = 327779152

  Commands leading to the command that caused the error were:
  CR FEATR COUNT  LBA_48  LH LM LL DV DC  Powered_Up_Time  Command/Feature_Name
  -- == -- == -- == == == -- -- -- -- --  ---------------  --------------------
  61 00 00 00 48 00 00 00 89 83 20 40 00     02:47:03.590  WRITE FPDMA QUEUED
  61 00 00 00 50 00 00 00 89 84 a0 40 00     02:47:03.590  WRITE FPDMA QUEUED
  61 00 00 00 50 00 00 00 89 84 20 40 00     02:47:03.590  WRITE FPDMA QUEUED
  61 00 00 00 48 00 00 00 89 83 a0 40 00     02:47:03.590  WRITE FPDMA QUEUED
  61 00 00 00 48 00 00 00 89 83 20 40 00     02:47:03.590  WRITE FPDMA QUEUED

Error 17 [0] occurred at disk power-on lifetime: 13329 hours (555 days + 9 hours)
  When the command that caused the error occurred, the device was active or idle.

  After command completion occurred, registers were:
  ER -- ST COUNT  LBA_48  LH LM LL DV DC
  -- -- -- == -- == == == -- -- -- -- --
  84 -- 51 ff ef 00 00 00 00 9d e4 e0 00  Error: ABRT at LBA = 0x00009de4 = 40420

  Commands leading to the command that caused the error were:
  CR FEATR COUNT  LBA_48  LH LM LL DV DC  Powered_Up_Time  Command/Feature_Name
  -- == -- == -- == == == -- -- -- -- --  ---------------  --------------------
  29 00 00 00 00 00 00 00 00 9d d3 e0 00     00:00:44.260  READ MULTIPLE EXT
  25 00 00 00 01 00 00 00 00 9d d3 e0 00     00:00:28.320  READ DMA EXT
  25 00 00 00 01 00 00 00 00 9d d2 e0 00     00:00:28.320  READ DMA EXT
  25 00 00 00 01 00 00 00 00 9d d1 e0 00     00:00:28.320  READ DMA EXT
  25 00 00 00 01 00 00 00 00 9d d0 e0 00     00:00:28.320  READ DMA EXT

Error 16 [7] occurred at disk power-on lifetime: 5803 hours (241 days + 19 hours)
  When the command that caused the error occurred, the device was active or idle.

  After command completion occurred, registers were:
  ER -- ST COUNT  LBA_48  LH LM LL DV DC
  -- -- -- == -- == == == -- -- -- -- --
  84 -- 51 ff ef 00 00 00 00 00 25 e0 00  Error: ABRT at LBA = 0x00000025 = 37

  Commands leading to the command that caused the error were:
  CR FEATR COUNT  LBA_48  LH LM LL DV DC  Powered_Up_Time  Command/Feature_Name
  -- == -- == -- == == == -- -- -- -- --  ---------------  --------------------
  29 00 00 00 00 00 00 00 00 00 14 e0 00     00:35:52.180  READ MULTIPLE EXT
  25 00 00 00 01 00 00 00 00 00 14 e0 00     00:35:42.080  READ DMA EXT
  25 00 00 00 01 00 00 00 00 00 13 e0 00     00:35:42.080  READ DMA EXT
  25 00 00 00 01 00 00 00 00 00 12 e0 00     00:35:42.080  READ DMA EXT
  25 00 00 00 01 00 00 00 00 00 11 e0 00     00:35:42.080  READ DMA EXT

Error 15 [6] occurred at disk power-on lifetime: 5802 hours (241 days + 18 hours)
  When the command that caused the error occurred, the device was active or idle.

  After command completion occurred, registers were:
  ER -- ST COUNT  LBA_48  LH LM LL DV DC
  -- -- -- == -- == == == -- -- -- -- --
  84 -- 51 ff ef 00 00 00 00 00 23 e0 00  Error: ABRT at LBA = 0x00000023 = 35

  Commands leading to the command that caused the error were:
  CR FEATR COUNT  LBA_48  LH LM LL DV DC  Powered_Up_Time  Command/Feature_Name
  -- == -- == -- == == == -- -- -- -- --  ---------------  --------------------
  29 00 00 00 00 00 00 00 00 00 12 e0 00     00:26:43.520  READ MULTIPLE EXT
  25 00 00 00 01 00 00 00 00 00 12 e0 00     00:26:33.040  READ DMA EXT
  25 00 00 00 01 00 00 00 00 00 11 e0 00     00:26:33.040  READ DMA EXT
  25 00 00 00 01 00 00 00 00 00 10 e0 00     00:26:33.040  READ DMA EXT
  25 00 00 00 01 00 00 00 00 00 0f e0 00     00:26:33.040  READ DMA EXT

Error 14 [5] occurred at disk power-on lifetime: 5784 hours (241 days + 0 hours)
  When the command that caused the error occurred, the device was active or idle.

  After command completion occurred, registers were:
  ER -- ST COUNT  LBA_48  LH LM LL DV DC
  -- -- -- == -- == == == -- -- -- -- --
  84 -- 51 ff ef 00 00 00 00 00 14 e0 00  Error: ABRT at LBA = 0x00000014 = 20

  Commands leading to the command that caused the error were:
  CR FEATR COUNT  LBA_48  LH LM LL DV DC  Powered_Up_Time  Command/Feature_Name
  -- == -- == -- == == == -- -- -- -- --  ---------------  --------------------
  29 00 00 00 00 00 00 00 00 00 03 e0 00     00:00:48.300  READ MULTIPLE EXT
  25 00 00 00 01 00 00 00 00 00 03 e0 00     00:00:36.020  READ DMA EXT
  25 00 00 00 01 00 00 00 00 00 02 e0 00     00:00:36.020  READ DMA EXT
  25 00 00 00 01 00 00 00 00 00 01 e0 00     00:00:36.020  READ DMA EXT
  25 00 00 00 01 00 00 00 00 00 00 e0 00     00:00:36.020  READ DMA EXT

Error 13 [4] occurred at disk power-on lifetime: 5784 hours (241 days + 0 hours)
  When the command that caused the error occurred, the device was active or idle.

  After command completion occurred, registers were:
  ER -- ST COUNT  LBA_48  LH LM LL DV DC
  -- -- -- == -- == == == -- -- -- -- --
  84 -- 51 ff ef 00 00 00 00 00 2e e0 00  Error: ABRT at LBA = 0x0000002e = 46

  Commands leading to the command that caused the error were:
  CR FEATR COUNT  LBA_48  LH LM LL DV DC  Powered_Up_Time  Command/Feature_Name
  -- == -- == -- == == == -- -- -- -- --  ---------------  --------------------
  29 00 00 00 00 00 00 00 00 00 1d e0 00     00:00:33.160  READ MULTIPLE EXT
  25 00 00 00 01 00 00 00 00 00 1d e0 00     00:00:22.290  READ DMA EXT
  25 00 00 00 01 00 00 00 00 00 1c e0 00     00:00:22.290  READ DMA EXT
  25 00 00 00 01 00 00 00 00 00 1b e0 00     00:00:22.290  READ DMA EXT
  25 00 00 00 01 00 00 00 00 00 1a e0 00     00:00:22.290  READ DMA EXT

SMART Extended Self-test Log Version: 1 (2 sectors)
Num  Test_Description    Status                  Remaining  LifeTime(hours)  LBA_of_first_error
# 1  Short offline       Completed without error       00%     29708         -
# 2  Extended offline    Completed without error       00%     29702         -
# 3  Short offline       Completed without error       00%     29668         -
# 4  Short offline       Completed without error       00%     29655         -
# 5  Short offline       Completed without error       00%     29644         -
# 6  Short offline       Completed without error       00%     29626         -
# 7  Short offline       Completed without error       00%     29610         -
# 8  Short offline       Completed without error       00%     29594         -
# 9  Short offline       Completed without error       00%     29585         -
#10  Short offline       Completed without error       00%     29576         -
#11  Short offline       Completed without error       00%     29571         -
#12  Short offline       Completed without error       00%     29556         -
#13  Short offline       Completed without error       00%     29541         -
#14  Short offline       Completed without error       00%     29525         -
#15  Short offline       Completed without error       00%     29509         -
#16  Short offline       Completed without error       00%     29493         -
#17  Extended offline    Aborted by host               10%     29489         -
#18  Short offline       Completed without error       00%     29484         -
#19  Short offline       Completed without error       00%     29475         -
#20  Short offline       Completed without error       00%     29459         -
#21  Short offline       Completed without error       00%     29448         -

SMART Selective self-test log data structure revision number 1
 SPAN  MIN_LBA  MAX_LBA  CURRENT_TEST_STATUS
    1        0        0  Not_testing
    2        0        0  Not_testing
    3        0        0  Not_testing
    4        0        0  Not_testing
    5        0        0  Not_testing
Selective self-test flags (0x0):
  After scanning selected spans, do NOT read-scan remainder of disk.
If Selective self-test is pending on power-up, resume after 0 minute delay.

SCT Status Version:                  2
SCT Version (vendor specific):       256 (0x0100)
Device State:                        Active (0)
Current Temperature:                    29 Celsius
Power Cycle Min/Max Temperature:     --/30 Celsius
Lifetime    Min/Max Temperature:     --/44 Celsius

SCT Temperature History Version:     2
Temperature Sampling Period:         1 minute
Temperature Logging Interval:        1 minute
Min/Max recommended Temperature:     -4/72 Celsius
Min/Max Temperature Limit:           -9/77 Celsius
Temperature History Size (Index):    128 (10)

SCT Error Recovery Control:
           Read: Disabled
          Write: Disabled

ATA_READ_LOG_EXT (addr=0x04:0x00, page=0, n=1) failed: Input/output error
Read Device Statistics page 0x00 failed

Pending Defects log (GP Log 0x0c) not supported

SATA Phy Event Counters (GP Log 0x11)
ID      Size     Value  Description
0x000a  2           36  Device-to-host register FISes sent due to a COMRESET
0x0001  2            0  Command failed due to ICRC error
0x0002  2            0  R_ERR response for data FIS
0x0003  2            0  R_ERR response for device-to-host data FIS
0x0004  2            0  R_ERR response for host-to-device data FIS
0x0005  2            0  R_ERR response for non-data FIS
0x0006  2            0  R_ERR response for device-to-host non-data FIS
0x0007  2            0  R_ERR response for host-to-device non-data FIS
0x0008  2            0  Device-to-host non-data FIS retries
0x0009  2           36  Transition from drive PhyRdy to drive PhyNRdy
0x000b  2            0  CRC errors within host-to-device FIS
0x000d  2            0  Non-CRC errors within host-to-device FIS
0x000f  2            0  R_ERR response for host-to-device data FIS, CRC
0x0010  2            0  R_ERR response for host-to-device data FIS, non-CRC
0x0012  2            0  R_ERR response for host-to-device non-data FIS, CRC
0x0013  2            0  R_ERR response for host-to-device non-data FIS, non-CRC

