smartctl 7.1 2019-12-30 r5022 [i386-unknown-openbsd6.9] (local build)
Copyright (C) 2002-19, Bruce Allen, Christian Franke, www.smartmontools.org

=== START OF INFORMATION SECTION ===
Device Model:     CHN-mSATAQ3-120
Serial Number:    --
LU WWN Device Id: 0 000000 ...
Firmware Version: Q0707A
User Capacity:    120,034,123,776 bytes [120 GB]
Sector Size:      512 bytes logical/physical
Rotation Rate:    Solid State Device
Form Factor:      2.5 inches
Device is:        Not in smartctl database [for details use: -P showall]
ATA Version is:   ACS-2 (minor revision not indicated)
SATA Version is:  SATA 3.1, 6.0 Gb/s (current: 3.0 Gb/s)
Local Time is:    Tue Aug 17 22:58:44 2021 EDT
SMART support is: Available - device has SMART capability.
SMART support is: Enabled

=== START OF READ SMART DATA SECTION ===
SMART overall-health self-assessment test result: PASSED

General SMART Values:
Offline data collection status:  (0x00)	Offline data collection activity
					was never started.
					Auto Offline Data Collection: Disabled.
Self-test execution status:      (   0)	The previous self-test routine completed
					without error or no self-test has ever 
					been run.
Total time to complete Offline 
data collection: 		(    0) seconds.
Offline data collection
capabilities: 			 (0x11) SMART execute Offline immediate.
					No Auto Offline data collection support.
					Suspend Offline collection upon new
					command.
					No Offline surface scan supported.
					Self-test supported.
					No Conveyance Self-test supported.
					No Selective Self-test supported.
SMART capabilities:            (0x0002)	Does not save SMART data before
					entering power-saving mode.
					Supports SMART auto save timer.
Error logging capability:        (0x01)	Error logging supported.
					General Purpose Logging supported.
Short self-test routine 
recommended polling time: 	 (   1) minutes.
Extended self-test routine
recommended polling time: 	 (   1) minutes.

SMART Attributes Data Structure revision number: 1
Vendor Specific SMART Attributes with Thresholds:
ID# ATTRIBUTE_NAME          FLAG     VALUE WORST THRESH TYPE      UPDATED  WHEN_FAILED RAW_VALUE
  1 Raw_Read_Error_Rate     0x0000   100   100   050    Old_age   Offline      -       0
  5 Reallocated_Sector_Ct   0x0002   100   100   050    Old_age   Always       -       0
  9 Power_On_Hours          0x0000   100   100   050    Old_age   Offline      -       42
 12 Power_Cycle_Count       0x0000   100   100   050    Old_age   Offline      -       45
160 Unknown_Attribute       0x0000   100   100   050    Old_age   Offline      -       0
161 Unknown_Attribute       0x0000   100   100   050    Old_age   Offline      -       50
162 Unknown_Attribute       0x0000   100   100   050    Old_age   Offline      -       1
163 Unknown_Attribute       0x0000   100   100   050    Old_age   Offline      -       6
164 Unknown_Attribute       0x0000   100   100   050    Old_age   Offline      -       1695
165 Unknown_Attribute       0x0000   100   100   050    Old_age   Offline      -       5
166 Unknown_Attribute       0x0000   100   100   050    Old_age   Offline      -       1
167 Unknown_Attribute       0x0000   100   100   050    Old_age   Offline      -       3
168 Unknown_Attribute       0x0000   100   100   050    Old_age   Offline      -       3000
169 Unknown_Attribute       0x0000   100   100   050    Old_age   Offline      -       100
192 Power-Off_Retract_Count 0x0000   100   100   050    Old_age   Offline      -       20
194 Temperature_Celsius     0x0000   100   100   050    Old_age   Offline      -       43
195 Hardware_ECC_Recovered  0x0000   100   100   050    Old_age   Offline      -       14
196 Reallocated_Event_Count 0x0000   100   100   050    Old_age   Offline      -       0
199 UDMA_CRC_Error_Count    0x0000   100   100   050    Old_age   Offline      -       0
241 Total_LBAs_Written      0x0000   100   100   050    Old_age   Offline      -       11059
242 Total_LBAs_Read         0x0000   100   100   050    Old_age   Offline      -       23946
245 Unknown_Attribute       0x0000   100   100   050    Old_age   Offline      -       12149

SMART Error Log Version: 1
No Errors Logged

SMART Self-test log structure revision number 1
No self-tests have been logged.  [To run self-tests, use: smartctl -t]

Selective Self-tests/Logging not supported

