smartctl 7.4 2023-08-01 r5530 [FreeBSD 14.0-RELEASE amd64] (local build)
Copyright (C) 2002-23, Bruce Allen, Christian Franke, www.smartmontools.org

=== START OF INFORMATION SECTION ===
Model Family:     Western Digital Blue Mobile
Device Model:     WDC WD10JPVX-00JC3T0
Serial Number:    --
LU WWN Device Id: 5 0014ee ...
Firmware Version: 01.01A01
User Capacity:    1,000,204,886,016 bytes [1.00 TB]
Sector Sizes:     512 bytes logical, 4096 bytes physical
Rotation Rate:    5400 rpm
Device is:        In smartctl database 7.3/5528
ATA Version is:   ACS-2 (minor revision not indicated)
SATA Version is:  SATA 3.0, 6.0 Gb/s (current: 6.0 Gb/s)
Local Time is:    Thu Feb 15 13:34:59 2024 EST
SMART support is: Available - device has SMART capability.
SMART support is: Enabled
AAM feature is:   Unavailable
APM level is:     128 (minimum power consumption without standby)
Rd look-ahead is: Enabled
Write cache is:   Enabled
DSN feature is:   Unavailable
ATA Security is:  Disabled, frozen [SEC2]
Wt Cache Reorder: Enabled

=== START OF READ SMART DATA SECTION ===
SMART overall-health self-assessment test result: PASSED

General SMART Values:
Offline data collection status:  (0x00)	Offline data collection activity
					was never started.
					Auto Offline Data Collection: Disabled.
Self-test execution status:      (   0)	The previous self-test routine completed
					without error or no self-test has ever 
					been run.
Total time to complete Offline 
data collection: 		(18000) seconds.
Offline data collection
capabilities: 			 (0x7b) SMART execute Offline immediate.
					Auto Offline data collection on/off support.
					Suspend Offline collection upon new
					command.
					Offline surface scan supported.
					Self-test supported.
					Conveyance Self-test supported.
					Selective Self-test supported.
SMART capabilities:            (0x0003)	Saves SMART data before entering
					power-saving mode.
					Supports SMART auto save timer.
Error logging capability:        (0x01)	Error logging supported.
					General Purpose Logging supported.
Short self-test routine 
recommended polling time: 	 (   2) minutes.
Extended self-test routine
recommended polling time: 	 ( 202) minutes.
Conveyance self-test routine
recommended polling time: 	 (   5) minutes.
SCT capabilities: 	       (0x7035)	SCT Status supported.
					SCT Feature Control supported.
					SCT Data Table supported.

SMART Attributes Data Structure revision number: 16
Vendor Specific SMART Attributes with Thresholds:
ID# ATTRIBUTE_NAME          FLAGS    VALUE WORST THRESH FAIL RAW_VALUE
  1 Raw_Read_Error_Rate     POSR-K   200   200   051    -    2791
  3 Spin_Up_Time            POS--K   184   177   021    -    1766
  4 Start_Stop_Count        -O--CK   089   089   000    -    11160
  5 Reallocated_Sector_Ct   PO--CK   200   200   140    -    0
  7 Seek_Error_Rate         -OSR-K   200   200   000    -    0
  9 Power_On_Hours          -O--CK   067   067   000    -    24117
 10 Spin_Retry_Count        -O--CK   100   100   000    -    0
 11 Calibration_Retry_Count -O--CK   100   100   000    -    0
 12 Power_Cycle_Count       -O--CK   099   099   000    -    1857
192 Power-Off_Retract_Count -O--CK   200   200   000    -    504
193 Load_Cycle_Count        -O--CK   118   118   000    -    248611
194 Temperature_Celsius     -O---K   119   100   000    -    28
196 Reallocated_Event_Count -O--CK   200   200   000    -    0
197 Current_Pending_Sector  -O--CK   200   200   000    -    1
198 Offline_Uncorrectable   ----CK   100   253   000    -    0
199 UDMA_CRC_Error_Count    -O--CK   200   199   000    -    395
200 Multi_Zone_Error_Rate   ---R--   100   253   000    -    0
                            ||||||_ K auto-keep
                            |||||__ C event count
                            ||||___ R error rate
                            |||____ S speed/performance
                            ||_____ O updated online
                            |______ P prefailure warning

General Purpose Log Directory Version 1
SMART           Log Directory Version 1 [multi-sector log support]
Address    Access  R/W   Size  Description
0x00       GPL,SL  R/O      1  Log Directory
0x01           SL  R/O      1  Summary SMART error log
0x02           SL  R/O      5  Comprehensive SMART error log
0x03       GPL     R/O      6  Ext. Comprehensive SMART error log
0x06           SL  R/O      1  SMART self-test log
0x07       GPL     R/O      1  Extended self-test log
0x09           SL  R/W      1  Selective self-test log
0x10       GPL     R/O      1  NCQ Command Error log
0x11       GPL     R/O      1  SATA Phy Event Counters log
0x80-0x9f  GPL,SL  R/W     16  Host vendor specific log
0xa0-0xa7  GPL,SL  VS      16  Device vendor specific log
0xa8-0xb6  GPL,SL  VS       1  Device vendor specific log
0xb7       GPL,SL  VS      38  Device vendor specific log
0xbd       GPL,SL  VS       1  Device vendor specific log
0xc0       GPL,SL  VS       1  Device vendor specific log
0xc1       GPL     VS      93  Device vendor specific log
0xe0       GPL,SL  R/W      1  SCT Command/Status
0xe1       GPL,SL  R/W      1  SCT Data Transfer

SMART Extended Comprehensive Error Log Version: 1 (6 sectors)
Device Error Count: 35822 (device log contains only the most recent 24 errors)
	CR     = Command Register
	FEATR  = Features Register
	COUNT  = Count (was: Sector Count) Register
	LBA_48 = Upper bytes of LBA High/Mid/Low Registers ]  ATA-8
	LH     = LBA High (was: Cylinder High) Register    ]   LBA
	LM     = LBA Mid (was: Cylinder Low) Register      ] Register
	LL     = LBA Low (was: Sector Number) Register     ]
	DV     = Device (was: Device/Head) Register
	DC     = Device Control Register
	ER     = Error register
	ST     = Status register
Powered_Up_Time is measured from power on, and printed as
DDd+hh:mm:SS.sss where DD=days, hh=hours, mm=minutes,
SS=sec, and sss=millisec. It "wraps" after 49.710 days.

Error 35822 [21] occurred at disk power-on lifetime: 24012 hours (1000 days + 12 hours)
  When the command that caused the error occurred, the device was active or idle.

  After command completion occurred, registers were:
  ER -- ST COUNT  LBA_48  LH LM LL DV DC
  -- -- -- == -- == == == -- -- -- -- --
  40 -- 51 00 00 00 00 0e 6b 4b b8 40 00  Error: UNC at LBA = 0x0e6b4bb8 = 241912760

  Commands leading to the command that caused the error were:
  CR FEATR COUNT  LBA_48  LH LM LL DV DC  Powered_Up_Time  Command/Feature_Name
  -- == -- == -- == == == -- -- -- -- --  ---------------  --------------------
  60 00 08 00 68 00 00 22 5b be 00 40 00     14:02:17.037  READ FPDMA QUEUED
  60 01 00 00 60 00 00 0e 6b 4f d0 40 00     14:02:17.037  READ FPDMA QUEUED
  60 01 00 00 58 00 00 0e 6b 4e d0 40 00     14:02:17.037  READ FPDMA QUEUED
  60 01 00 00 50 00 00 0e 6b 4d d0 40 00     14:02:17.037  READ FPDMA QUEUED
  60 01 00 00 48 00 00 0e 6b 4c d0 40 00     14:02:17.037  READ FPDMA QUEUED

Error 35821 [20] occurred at disk power-on lifetime: 23998 hours (999 days + 22 hours)
  When the command that caused the error occurred, the device was active or idle.

  After command completion occurred, registers were:
  ER -- ST COUNT  LBA_48  LH LM LL DV DC
  -- -- -- == -- == == == -- -- -- -- --
  40 -- 51 00 00 00 00 0e 6b 4b b8 40 00  Error: UNC at LBA = 0x0e6b4bb8 = 241912760

  Commands leading to the command that caused the error were:
  CR FEATR COUNT  LBA_48  LH LM LL DV DC  Powered_Up_Time  Command/Feature_Name
  -- == -- == -- == == == -- -- -- -- --  ---------------  --------------------
  60 01 00 00 98 00 00 0e 6b 4f d0 40 00     00:00:08.550  READ FPDMA QUEUED
  60 01 00 00 90 00 00 0e 6b 4e d0 40 00     00:00:08.550  READ FPDMA QUEUED
  60 01 00 00 88 00 00 0e 6b 4d d0 40 00     00:00:08.550  READ FPDMA QUEUED
  60 01 00 00 80 00 00 0e 6b 4c d0 40 00     00:00:08.550  READ FPDMA QUEUED
  60 01 00 00 78 00 00 0e 6b 4b d0 40 00     00:00:08.550  READ FPDMA QUEUED

Error 35820 [19] occurred at disk power-on lifetime: 23991 hours (999 days + 15 hours)
  When the command that caused the error occurred, the device was active or idle.

  After command completion occurred, registers were:
  ER -- ST COUNT  LBA_48  LH LM LL DV DC
  -- -- -- == -- == == == -- -- -- -- --
  40 -- 51 00 00 00 00 0e 6b 4b b8 40 00  Error: UNC at LBA = 0x0e6b4bb8 = 241912760

  Commands leading to the command that caused the error were:
  CR FEATR COUNT  LBA_48  LH LM LL DV DC  Powered_Up_Time  Command/Feature_Name
  -- == -- == -- == == == -- -- -- -- --  ---------------  --------------------
  60 01 00 00 10 00 00 0e 6b 4f d0 40 00     14:31:36.951  READ FPDMA QUEUED
  60 01 00 00 08 00 00 0e 6b 4e d0 40 00     14:31:36.951  READ FPDMA QUEUED
  60 01 00 00 f8 00 00 0e 6b 4d d0 40 00     14:31:36.951  READ FPDMA QUEUED
  60 01 00 00 f0 00 00 0e 6b 4c d0 40 00     14:31:36.950  READ FPDMA QUEUED
  60 01 00 00 e8 00 00 0e 6b 4b d0 40 00     14:31:36.950  READ FPDMA QUEUED

Error 35819 [18] occurred at disk power-on lifetime: 23978 hours (999 days + 2 hours)
  When the command that caused the error occurred, the device was active or idle.

  After command completion occurred, registers were:
  ER -- ST COUNT  LBA_48  LH LM LL DV DC
  -- -- -- == -- == == == -- -- -- -- --
  40 -- 51 00 00 00 00 0e 6b 4b b8 40 00  Error: UNC at LBA = 0x0e6b4bb8 = 241912760

  Commands leading to the command that caused the error were:
  CR FEATR COUNT  LBA_48  LH LM LL DV DC  Powered_Up_Time  Command/Feature_Name
  -- == -- == -- == == == -- -- -- -- --  ---------------  --------------------
  60 01 00 00 68 00 00 0e 6b 4f d0 40 00     01:22:16.007  READ FPDMA QUEUED
  60 01 00 00 60 00 00 0e 6b 4e d0 40 00     01:22:16.007  READ FPDMA QUEUED
  60 01 00 00 58 00 00 0e 6b 4d d0 40 00     01:22:16.007  READ FPDMA QUEUED
  60 01 00 00 50 00 00 0e 6b 4c d0 40 00     01:22:16.007  READ FPDMA QUEUED
  60 01 00 00 48 00 00 0e 6b 4b d0 40 00     01:22:16.007  READ FPDMA QUEUED

Error 35818 [17] occurred at disk power-on lifetime: 23874 hours (994 days + 18 hours)
  When the command that caused the error occurred, the device was active or idle.

  After command completion occurred, registers were:
  ER -- ST COUNT  LBA_48  LH LM LL DV DC
  -- -- -- == -- == == == -- -- -- -- --
  40 -- 51 00 00 00 00 0e 6b 4b b8 40 00  Error: UNC at LBA = 0x0e6b4bb8 = 241912760

  Commands leading to the command that caused the error were:
  CR FEATR COUNT  LBA_48  LH LM LL DV DC  Powered_Up_Time  Command/Feature_Name
  -- == -- == -- == == == -- -- -- -- --  ---------------  --------------------
  60 01 00 00 40 00 00 0e 6b 4f d0 40 00     00:29:55.796  READ FPDMA QUEUED
  60 01 00 00 38 00 00 0e 6b 4e d0 40 00     00:29:55.796  READ FPDMA QUEUED
  60 01 00 00 30 00 00 0e 6b 4d d0 40 00     00:29:55.796  READ FPDMA QUEUED
  60 01 00 00 28 00 00 0e 6b 4c d0 40 00     00:29:55.796  READ FPDMA QUEUED
  60 01 00 00 20 00 00 0e 6b 4b d0 40 00     00:29:55.796  READ FPDMA QUEUED

Error 35817 [16] occurred at disk power-on lifetime: 23874 hours (994 days + 18 hours)
  When the command that caused the error occurred, the device was active or idle.

  After command completion occurred, registers were:
  ER -- ST COUNT  LBA_48  LH LM LL DV DC
  -- -- -- == -- == == == -- -- -- -- --
  40 -- 51 00 00 00 00 0e 6b 4b b8 40 00  Error: UNC at LBA = 0x0e6b4bb8 = 241912760

  Commands leading to the command that caused the error were:
  CR FEATR COUNT  LBA_48  LH LM LL DV DC  Powered_Up_Time  Command/Feature_Name
  -- == -- == -- == == == -- -- -- -- --  ---------------  --------------------
  60 01 00 00 68 00 00 0e 6b 4f d0 40 00     00:28:55.222  READ FPDMA QUEUED
  60 01 00 00 60 00 00 0e 6b 4e d0 40 00     00:28:55.222  READ FPDMA QUEUED
  60 01 00 00 58 00 00 0e 6b 4d d0 40 00     00:28:55.222  READ FPDMA QUEUED
  60 01 00 00 50 00 00 0e 6b 4c d0 40 00     00:28:55.222  READ FPDMA QUEUED
  60 01 00 00 48 00 00 0e 6b 4b d0 40 00     00:28:55.222  READ FPDMA QUEUED

Error 35816 [15] occurred at disk power-on lifetime: 23798 hours (991 days + 14 hours)
  When the command that caused the error occurred, the device was active or idle.

  After command completion occurred, registers were:
  ER -- ST COUNT  LBA_48  LH LM LL DV DC
  -- -- -- == -- == == == -- -- -- -- --
  40 -- 51 00 00 00 00 0e 6b 4b b8 40 00  Error: UNC at LBA = 0x0e6b4bb8 = 241912760

  Commands leading to the command that caused the error were:
  CR FEATR COUNT  LBA_48  LH LM LL DV DC  Powered_Up_Time  Command/Feature_Name
  -- == -- == -- == == == -- -- -- -- --  ---------------  --------------------
  60 01 00 00 b0 00 00 0e 6b 4f d0 40 00     00:13:08.273  READ FPDMA QUEUED
  60 01 00 00 a8 00 00 0e 6b 4e d0 40 00     00:13:08.273  READ FPDMA QUEUED
  60 01 00 00 a0 00 00 0e 6b 4d d0 40 00     00:13:08.273  READ FPDMA QUEUED
  60 01 00 00 98 00 00 0e 6b 4c d0 40 00     00:13:08.273  READ FPDMA QUEUED
  60 01 00 00 90 00 00 0e 6b 4b d0 40 00     00:13:08.273  READ FPDMA QUEUED

Error 35815 [14] occurred at disk power-on lifetime: 23798 hours (991 days + 14 hours)
  When the command that caused the error occurred, the device was active or idle.

  After command completion occurred, registers were:
  ER -- ST COUNT  LBA_48  LH LM LL DV DC
  -- -- -- == -- == == == -- -- -- -- --
  40 -- 51 00 00 00 00 0e 6b 4b b8 40 00  Error: UNC at LBA = 0x0e6b4bb8 = 241912760

  Commands leading to the command that caused the error were:
  CR FEATR COUNT  LBA_48  LH LM LL DV DC  Powered_Up_Time  Command/Feature_Name
  -- == -- == -- == == == -- -- -- -- --  ---------------  --------------------
  60 01 00 00 80 00 00 0e 6b 4f d0 40 00     00:12:44.498  READ FPDMA QUEUED
  60 01 00 00 78 00 00 0e 6b 4e d0 40 00     00:12:44.498  READ FPDMA QUEUED
  60 01 00 00 70 00 00 0e 6b 4d d0 40 00     00:12:44.498  READ FPDMA QUEUED
  60 01 00 00 68 00 00 0e 6b 4c d0 40 00     00:12:44.498  READ FPDMA QUEUED
  60 01 00 00 60 00 00 0e 6b 4b d0 40 00     00:12:44.498  READ FPDMA QUEUED

SMART Extended Self-test Log Version: 1 (1 sectors)
Num  Test_Description    Status                  Remaining  LifeTime(hours)  LBA_of_first_error
# 1  Short offline       Completed: read failure       90%     22496         186880624
# 2  Short offline       Completed: read failure       90%     22495         186880624
# 3  Short offline       Completed: read failure       90%     22420         186880624
# 4  Short offline       Completed: read failure       90%     22417         186880624
# 5  Extended offline    Completed: read failure       90%     22283         186880624
# 6  Short offline       Completed: read failure       90%     22210         186880624
# 7  Short offline       Completed: read failure       90%     22207         186880624

SMART Selective self-test log data structure revision number 1
 SPAN  MIN_LBA  MAX_LBA  CURRENT_TEST_STATUS
    1        0        0  Not_testing
    2        0        0  Not_testing
    3        0        0  Not_testing
    4        0        0  Not_testing
    5        0        0  Not_testing
Selective self-test flags (0x0):
  After scanning selected spans, do NOT read-scan remainder of disk.
If Selective self-test is pending on power-up, resume after 0 minute delay.

SCT Status Version:                  3
SCT Version (vendor specific):       258 (0x0102)
Device State:                        Active (0)
Current Temperature:                    28 Celsius
Power Cycle Min/Max Temperature:     25/28 Celsius
Lifetime    Min/Max Temperature:     12/48 Celsius
Under/Over Temperature Limit Count:   0/0
Vendor specific:
01 00 00 00 00 00 00 00 00 00 00 00 00 00 00 00
00 00 00 00 00 00 00 00 00 00 00 00 00 00 00 00

SCT Temperature History Version:     2
Temperature Sampling Period:         1 minute
Temperature Logging Interval:        1 minute
Min/Max recommended Temperature:      0/60 Celsius
Min/Max Temperature Limit:           -41/85 Celsius
Temperature History Size (Index):    128 (40)

SCT Error Recovery Control command not supported

Device Statistics (GP/SMART Log 0x04) not supported

Pending Defects log (GP Log 0x0c) not supported

SATA Phy Event Counters (GP Log 0x11)
ID      Size     Value  Description
0x0001  2            0  Command failed due to ICRC error
0x0002  2            0  R_ERR response for data FIS
0x0003  2            0  R_ERR response for device-to-host data FIS
0x0004  2            0  R_ERR response for host-to-device data FIS
0x0005  2            0  R_ERR response for non-data FIS
0x0006  2            0  R_ERR response for device-to-host non-data FIS
0x0007  2            0  R_ERR response for host-to-device non-data FIS
0x0008  2            0  Device-to-host non-data FIS retries
0x0009  2           35  Transition from drive PhyRdy to drive PhyNRdy
0x000a  2           34  Device-to-host register FISes sent due to a COMRESET
0x000b  2            0  CRC errors within host-to-device FIS
0x000f  2            0  R_ERR response for host-to-device data FIS, CRC
0x0012  2            0  R_ERR response for host-to-device non-data FIS, CRC
0x8000  4        11385  Vendor specific



