smartctl 7.3 2022-02-28 r5338 [FreeBSD 13.0-STABLE amd64] (local build)
Copyright (C) 2002-22, Bruce Allen, Christian Franke, www.smartmontools.org

=== START OF INFORMATION SECTION ===
Model Family:     Western Digital Caviar Blue Serial ATA
Device Model:     WDC WD1600AABS-00PRA0
Serial Number:    --
LU WWN Device Id: 5 0014ee ...
Firmware Version: 05.06H05
User Capacity:    160,041,885,696 bytes [160 GB]
Sector Size:      512 bytes logical/physical
Device is:        In smartctl database 7.3/5319
ATA Version is:   ATA/ATAPI-7 (minor revision not indicated)
Local Time is:    Sun Jan  1 18:18:49 2023 CET
SMART support is: Available - device has SMART capability.
SMART support is: Enabled
AAM feature is:   Disabled
APM feature is:   Unavailable
Rd look-ahead is: Enabled
Write cache is:   Enabled
DSN feature is:   Unavailable
ATA Security is:  Disabled, frozen [SEC2]
Wt Cache Reorder: Enabled

=== START OF READ SMART DATA SECTION ===
SMART overall-health self-assessment test result: PASSED

General SMART Values:
Offline data collection status:  (0x84)	Offline data collection activity
					was suspended by an interrupting command from host.
					Auto Offline Data Collection: Enabled.
Self-test execution status:      (   0)	The previous self-test routine completed
					without error or no self-test has ever 
					been run.
Total time to complete Offline 
data collection: 		( 4560) seconds.
Offline data collection
capabilities: 			 (0x7b) SMART execute Offline immediate.
					Auto Offline data collection on/off support.
					Suspend Offline collection upon new
					command.
					Offline surface scan supported.
					Self-test supported.
					Conveyance Self-test supported.
					Selective Self-test supported.
SMART capabilities:            (0x0003)	Saves SMART data before entering
					power-saving mode.
					Supports SMART auto save timer.
Error logging capability:        (0x01)	Error logging supported.
					General Purpose Logging supported.
Short self-test routine 
recommended polling time: 	 (   2) minutes.
Extended self-test routine
recommended polling time: 	 (  61) minutes.
Conveyance self-test routine
recommended polling time: 	 (   6) minutes.
SCT capabilities: 	       (0x103f)	SCT Status supported.
					SCT Error Recovery Control supported.
					SCT Feature Control supported.
					SCT Data Table supported.

SMART Attributes Data Structure revision number: 16
Vendor Specific SMART Attributes with Thresholds:
ID# ATTRIBUTE_NAME          FLAGS    VALUE WORST THRESH FAIL RAW_VALUE
  1 Raw_Read_Error_Rate     POSR--   200   199   051    -    55533
  3 Spin_Up_Time            PO----   160   117   021    -    2958
  4 Start_Stop_Count        -O--CK   091   091   000    -    9194
  5 Reallocated_Sector_Ct   PO--CK   200   200   140    -    0
  7 Seek_Error_Rate         -OSR--   200   200   051    -    0
  9 Power_On_Hours          -O--CK   053   053   000    -    34998
 10 Spin_Retry_Count        -O--C-   100   100   051    -    0
 11 Calibration_Retry_Count -O--C-   100   100   051    -    0
 12 Power_Cycle_Count       -O--CK   091   091   000    -    9065
192 Power-Off_Retract_Count -O--CK   200   200   000    -    169
193 Load_Cycle_Count        -O--CK   197   197   000    -    9300
194 Temperature_Celsius     -O---K   108   095   000    -    35
196 Reallocated_Event_Count -O--CK   200   200   000    -    0
197 Current_Pending_Sector  -O--C-   200   200   000    -    0
198 Offline_Uncorrectable   ----C-   200   200   000    -    1
199 UDMA_CRC_Error_Count    -OSRCK   200   200   000    -    0
200 Multi_Zone_Error_Rate   ---R--   200   200   051    -    0
                            ||||||_ K auto-keep
                            |||||__ C event count
                            ||||___ R error rate
                            |||____ S speed/performance
                            ||_____ O updated online
                            |______ P prefailure warning

General Purpose Log Directory Version 1
SMART           Log Directory Version 1 [multi-sector log support]
Address    Access  R/W   Size  Description
0x00       GPL,SL  R/O      1  Log Directory
0x01           SL  R/O      1  Summary SMART error log
0x02           SL  R/O      5  Comprehensive SMART error log
0x03       GPL     R/O      6  Ext. Comprehensive SMART error log
0x06           SL  R/O      1  SMART self-test log
0x07       GPL     R/O      1  Extended self-test log
0x09           SL  R/W      1  Selective self-test log
0x10       GPL     R/O      1  NCQ Command Error log
0x11       GPL     R/O      1  SATA Phy Event Counters log
0x80-0x9f  GPL,SL  R/W     16  Host vendor specific log
0xa0-0xa7  GPL,SL  VS      16  Device vendor specific log
0xa8-0xb7  GPL,SL  VS       1  Device vendor specific log
0xc0       GPL,SL  VS       1  Device vendor specific log
0xc1       GPL     VS      12  Device vendor specific log
0xe0       GPL,SL  R/W      1  SCT Command/Status
0xe1       GPL,SL  R/W      1  SCT Data Transfer

SMART Extended Comprehensive Error Log Version: 1 (6 sectors)
Device Error Count: 65253 (device log contains only the most recent 24 errors)
	CR     = Command Register
	FEATR  = Features Register
	COUNT  = Count (was: Sector Count) Register
	LBA_48 = Upper bytes of LBA High/Mid/Low Registers ]  ATA-8
	LH     = LBA High (was: Cylinder High) Register    ]   LBA
	LM     = LBA Mid (was: Cylinder Low) Register      ] Register
	LL     = LBA Low (was: Sector Number) Register     ]
	DV     = Device (was: Device/Head) Register
	DC     = Device Control Register
	ER     = Error register
	ST     = Status register
Powered_Up_Time is measured from power on, and printed as
DDd+hh:mm:SS.sss where DD=days, hh=hours, mm=minutes,
SS=sec, and sss=millisec. It "wraps" after 49.710 days.

Error 65253 [20] occurred at disk power-on lifetime: 0 hours (0 days + 0 hours)
  When the command that caused the error occurred, the device was in an unknown state.

  After command completion occurred, registers were:
  ER -- ST COUNT  LBA_48  LH LM LL DV DC
  -- -- -- == -- == == == -- -- -- -- --
  40 -- 00 01 80 00 51 00 00 e0 01 00 00

  Commands leading to the command that caused the error were:
  CR FEATR COUNT  LBA_48  LH LM LL DV DC  Powered_Up_Time  Command/Feature_Name
  -- == -- == -- == == == -- -- -- -- --  ---------------  --------------------
  00 15 25 30 5e 00 00 00 00 00 00 00 09     00:00:00.000  NOP [Reserved subcommand] [OBS-ACS-2]
  00 80 00 00 17 30 14 09 5e 25 00 00 00     00:00:38.784  NOP [Abort queued commands]
  09 12 25 30 5e 00 80 00 97 00 00 00 09     00:52:49.810  [RESERVED]
  00 80 00 00 97 30 11 09 5e 25 00 00 00     00:00:06.016  NOP [Abort queued commands]

Error 65252 [19] occurred at disk power-on lifetime: 0 hours (0 days + 0 hours)
  When the command that caused the error occurred, the device was in an unknown state.

  After command completion occurred, registers were:
  ER -- ST COUNT  LBA_48  LH LM LL DV DC
  -- -- -- == -- == == == -- -- -- -- --
  40 -- 00 01 00 00 51 00 00 49 01 00 00

  Commands leading to the command that caused the error were:
  CR FEATR COUNT  LBA_48  LH LM LL DV DC  Powered_Up_Time  Command/Feature_Name
  -- == -- == -- == == == -- -- -- -- --  ---------------  --------------------
  00 b8 c8 5d 25 00 00 00 00 00 00 00 09     00:00:00.000  NOP [Reserved subcommand] [OBS-ACS-2]
  00 80 00 00 17 5d b8 09 25 c8 00 00 00     00:00:38.784  NOP [Abort queued commands]
  09 b5 c8 5d 25 00 80 00 97 00 00 00 09     01:41:44.502  [RESERVED]
  00 80 00 00 97 5d b4 09 25 c8 00 00 00     00:00:06.016  NOP [Abort queued commands]

Error 65251 [18] occurred at disk power-on lifetime: 0 hours (0 days + 0 hours)
  When the command that caused the error occurred, the device was in an unknown state.

  After command completion occurred, registers were:
  ER -- ST COUNT  LBA_48  LH LM LL DV DC
  -- -- -- == -- == == == -- -- -- -- --
  40 -- 00 01 08 00 51 00 00 e0 01 00 00

  Commands leading to the command that caused the error were:
  CR FEATR COUNT  LBA_48  LH LM LL DV DC  Powered_Up_Time  Command/Feature_Name
  -- == -- == -- == == == -- -- -- -- --  ---------------  --------------------
  00 23 25 f0 22 00 00 00 00 00 00 00 09     00:00:00.000  NOP [Reserved subcommand] [OBS-ACS-2]
  00 80 00 00 c0 f0 cf 05 21 25 00 00 00     00:00:10.248  NOP [Abort queued commands]
  05 b7 25 f0 21 00 80 00 60 00 00 00 05     04:22:17.281  [RESERVED]
  00 08 00 00 20 f0 9d 09 21 25 00 00 00     00:00:10.248  NOP [Abort queued commands]

Error 65250 [17] occurred at disk power-on lifetime: 0 hours (0 days + 0 hours)
  When the command that caused the error occurred, the device was in an unknown state.

  After command completion occurred, registers were:
  ER -- ST COUNT  LBA_48  LH LM LL DV DC
  -- -- -- == -- == == == -- -- -- -- --
  40 -- 00 01 20 00 51 00 00 e0 01 00 00

  Commands leading to the command that caused the error were:
  CR FEATR COUNT  LBA_48  LH LM LL DV DC  Powered_Up_Time  Command/Feature_Name
  -- == -- == -- == == == -- -- -- -- --  ---------------  --------------------
  00 69 25 f0 19 00 00 00 00 00 00 00 09     00:00:00.000  NOP [Reserved subcommand] [OBS-ACS-2]
  00 80 00 00 98 f0 68 09 19 35 00 00 00     00:00:08.224  NOP [Abort queued commands]
  09 67 35 f0 19 00 80 00 18 00 00 00 09     04:22:15.144  [RESERVED]
  00 80 00 00 18 f0 66 09 19 35 00 00 00     00:00:39.040  NOP [Abort queued commands]

Error 65249 [16] occurred at disk power-on lifetime: 0 hours (0 days + 0 hours)
  When the command that caused the error occurred, the device was in an unknown state.

  After command completion occurred, registers were:
  ER -- ST COUNT  LBA_48  LH LM LL DV DC
  -- -- -- == -- == == == -- -- -- -- --
  40 -- 00 01 08 00 51 00 00 e0 01 00 00

  Commands leading to the command that caused the error were:
  CR FEATR COUNT  LBA_48  LH LM LL DV DC  Powered_Up_Time  Command/Feature_Name
  -- == -- == -- == == == -- -- -- -- --  ---------------  --------------------
  00 4a 25 dd 21 00 00 00 00 00 00 00 09     00:00:00.000  NOP [Reserved subcommand] [OBS-ACS-2]
  00 08 00 00 20 dd 0d 09 21 25 00 00 00     00:00:10.248  NOP [Abort queued commands]
  05 d4 25 dd 20 00 80 00 68 00 00 00 05     04:01:31.882  [RESERVED]
  00 08 00 00 48 dd c9 00 20 35 00 00 00     00:00:57.464  NOP [Abort queued commands]

Error 65248 [15] occurred at disk power-on lifetime: 0 hours (0 days + 0 hours)
  When the command that caused the error occurred, the device was in an unknown state.

  After command completion occurred, registers were:
  ER -- ST COUNT  LBA_48  LH LM LL DV DC
  -- -- -- == -- == == == -- -- -- -- --
  40 -- 00 01 20 00 51 00 00 e0 01 00 00

  Commands leading to the command that caused the error were:
  CR FEATR COUNT  LBA_48  LH LM LL DV DC  Powered_Up_Time  Command/Feature_Name
  -- == -- == -- == == == -- -- -- -- --  ---------------  --------------------
  00 9e 25 dd 18 00 00 00 00 00 00 00 09     00:00:00.000  NOP [Reserved subcommand] [OBS-ACS-2]
  00 80 00 00 68 dd 60 0c 18 35 00 00 00     00:00:08.224  NOP [Abort queued commands]
  0c 53 35 dd 18 00 20 00 e0 00 00 00 0c     04:01:29.684  [RESERVED]
  00 80 00 00 68 dd 52 0c 18 35 00 00 00     00:00:59.520  NOP [Abort queued commands]

Error 65247 [14] occurred at disk power-on lifetime: 0 hours (0 days + 0 hours)
  When the command that caused the error occurred, the device was in an unknown state.

  After command completion occurred, registers were:
  ER -- ST COUNT  LBA_48  LH LM LL DV DC
  -- -- -- == -- == == == -- -- -- -- --
  40 -- 00 01 08 00 51 00 00 e0 01 00 00

  Commands leading to the command that caused the error were:
  CR FEATR COUNT  LBA_48  LH LM LL DV DC  Powered_Up_Time  Command/Feature_Name
  -- == -- == -- == == == -- -- -- -- --  ---------------  --------------------
  00 ef 25 9e ab 00 00 00 00 00 00 00 00     00:00:00.000  NOP [Reserved subcommand] [OBS-ACS-2]
  00 08 00 00 68 9e ef 00 ab 25 00 00 00     00:00:28.680  NOP [Abort queued commands]
  00 c0 25 9e ab 00 08 00 60 00 00 00 00     02:53:18.701  NOP [Reserved subcommand] [OBS-ACS-2]
  00 08 00 00 50 9e be 00 ab 25 00 00 00     00:00:22.536  NOP [Abort queued commands]

Error 65246 [13] occurred at disk power-on lifetime: 0 hours (0 days + 0 hours)
  When the command that caused the error occurred, the device was in an unknown state.

  After command completion occurred, registers were:
  ER -- ST COUNT  LBA_48  LH LM LL DV DC
  -- -- -- == -- == == == -- -- -- -- --
  40 -- 00 01 60 00 51 00 00 e0 01 00 00

  Commands leading to the command that caused the error were:
  CR FEATR COUNT  LBA_48  LH LM LL DV DC  Powered_Up_Time  Command/Feature_Name
  -- == -- == -- == == == -- -- -- -- --  ---------------  --------------------
  00 ac 25 9e a2 00 00 00 00 00 00 00 00     00:00:00.000  NOP [Reserved subcommand] [OBS-ACS-2]
  00 a8 00 00 30 9e ac 04 a2 35 00 00 00     00:00:08.288  NOP [Abort queued commands]
  00 97 35 9e a2 00 00 00 20 00 00 00 00     02:53:16.312  NOP [Reserved subcommand] [OBS-ACS-2]
  00 20 00 00 f0 9e 97 00 a2 35 00 00 00     00:00:00.008  NOP [Abort queued commands]

SMART Extended Self-test Log Version: 1 (1 sectors)
No self-tests have been logged.  [To run self-tests, use: smartctl -t]

SMART Selective self-test log data structure revision number 1
 SPAN  MIN_LBA  MAX_LBA  CURRENT_TEST_STATUS
    1        0        0  Not_testing
    2        0        0  Not_testing
    3        0        0  Not_testing
    4        0        0  Not_testing
    5        0        0  Not_testing
Selective self-test flags (0x0):
  After scanning selected spans, do NOT read-scan remainder of disk.
If Selective self-test is pending on power-up, resume after 0 minute delay.

SCT Status Version:                  2
SCT Version (vendor specific):       258 (0x0102)
Device State:                        SMART Off-line Data Collection executing in background (4)
Current Temperature:                    35 Celsius
Power Cycle Min/Max Temperature:     21/35 Celsius
Lifetime    Min/Max Temperature:     22/49 Celsius
Under/Over Temperature Limit Count:   0/0

SCT Temperature History Version:     2
Temperature Sampling Period:         1 minute
Temperature Logging Interval:        1 minute
Min/Max recommended Temperature:      5/60 Celsius
Min/Max Temperature Limit:            1/85 Celsius
Temperature History Size (Index):    128 (79)

SCT Error Recovery Control:
           Read: Disabled
          Write: Disabled

Device Statistics (GP/SMART Log 0x04) not supported

Pending Defects log (GP Log 0x0c) not supported

SATA Phy Event Counters (GP Log 0x11)
ID      Size     Value  Description
0x0001  2            0  Command failed due to ICRC error
0x0002  2            0  R_ERR response for data FIS
0x0003  2            0  R_ERR response for device-to-host data FIS
0x0004  2            0  R_ERR response for host-to-device data FIS
0x0005  2            0  R_ERR response for non-data FIS
0x0006  2            0  R_ERR response for device-to-host non-data FIS
0x0007  2            0  R_ERR response for host-to-device non-data FIS
0x000a  2           33  Device-to-host register FISes sent due to a COMRESET
0x8000  4        10775  Vendor specific

