smartctl 7.4 2023-08-01 r5530 [FreeBSD 14.0-RELEASE amd64] (local build)
Copyright (C) 2002-23, Bruce Allen, Christian Franke, www.smartmontools.org

=== START OF INFORMATION SECTION ===
Device Model:     SanDisk Z400s M.2 2242 32GB
Serial Number:    --
LU WWN Device Id: 5 001b44 ...
Firmware Version: Z2330012
User Capacity:    32,017,047,552 bytes [32.0 GB]
Sector Sizes:     512 bytes logical, 4096 bytes physical
Rotation Rate:    Solid State Device
Form Factor:      M.2
TRIM Command:     Available, deterministic, zeroed
Device is:        Not in smartctl database 7.3/5528
ATA Version is:   ACS-2 T13/2015-D revision 3
SATA Version is:  SATA 3.2, 6.0 Gb/s (current: 6.0 Gb/s)
Local Time is:    Wed Nov 22 22:50:45 2023    
SMART support is: Available - device has SMART capability.
SMART support is: Enabled
AAM feature is:   Unavailable
APM level is:     128 (minimum power consumption without standby)
Rd look-ahead is: Enabled
Write cache is:   Enabled
DSN feature is:   Unavailable
ATA Security is:  Disabled, frozen [SEC2]
Wt Cache Reorder: Unavailable

=== START OF READ SMART DATA SECTION ===
SMART overall-health self-assessment test result: PASSED
See vendor-specific Attribute list for marginal Attributes.

General SMART Values:
Offline data collection status:  (0x00)	Offline data collection activity
					was never started.
					Auto Offline Data Collection: Disabled.
Self-test execution status:      (   0)	The previous self-test routine completed
					without error or no self-test has ever 
					been run.
Total time to complete Offline 
data collection: 		(  120) seconds.
Offline data collection
capabilities: 			 (0x11) SMART execute Offline immediate.
					No Auto Offline data collection support.
					Suspend Offline collection upon new
					command.
					No Offline surface scan supported.
					Self-test supported.
					No Conveyance Self-test supported.
					No Selective Self-test supported.
SMART capabilities:            (0x0003)	Saves SMART data before entering
					power-saving mode.
					Supports SMART auto save timer.
Error logging capability:        (0x01)	Error logging supported.
					General Purpose Logging supported.
Short self-test routine 
recommended polling time: 	 (   2) minutes.
Extended self-test routine
recommended polling time: 	 (  10) minutes.

SMART Attributes Data Structure revision number: 1
Vendor Specific SMART Attributes with Thresholds:
ID# ATTRIBUTE_NAME          FLAGS    VALUE WORST THRESH FAIL RAW_VALUE
  5 Reallocated_Sector_Ct   -O--CK   100   100   000    -    0
  9 Power_On_Hours          -O--CK   035   100   000    -    547
 12 Power_Cycle_Count       -O--CK   100   100   000    -    4290
175 Program_Fail_Count_Chip -O--CK   100   100   000    -    0
176 Erase_Fail_Count_Chip   -O--CK   100   100   000    -    0
177 Wear_Leveling_Count     -O--CK   100   100   000    -    2532
179 Used_Rsvd_Blk_Cnt_Tot   -O--CK   100   100   000    -    0
180 Unused_Rsvd_Blk_Cnt_Tot PO--CK   100   100   004    -    176
181 Program_Fail_Cnt_Total  -O--CK   100   100   000    -    0
182 Erase_Fail_Count_Total  -O--CK   100   100   000    -    0
187 Reported_Uncorrect      -O--CK   100   100   000    -    0
194 Temperature_Celsius     -O---K   060   046   000    -    40 (Min/Max 0/54)
195 Hardware_ECC_Recovered  -O--CK   100   100   000    -    0
199 UDMA_CRC_Error_Count    ----CK   100   100   000    -    4
238 Unknown_Attribute       -O--CK   000   000   010    NOW  25600
241 Total_LBAs_Written      ----CK   253   253   000    -    15808
242 Total_LBAs_Read         ----CK   253   253   000    -    13400
                            ||||||_ K auto-keep
                            |||||__ C event count
                            ||||___ R error rate
                            |||____ S speed/performance
                            ||_____ O updated online
                            |______ P prefailure warning

General Purpose Log Directory Version 1
SMART           Log Directory Version 1 [multi-sector log support]
Address    Access  R/W   Size  Description
0x00       GPL,SL  R/O      1  Log Directory
0x01           SL  R/O      1  Summary SMART error log
0x02           SL  R/O      1  Comprehensive SMART error log
0x03       GPL     R/O      1  Ext. Comprehensive SMART error log
0x04       GPL,SL  R/O      8  Device Statistics log
0x06           SL  R/O      1  SMART self-test log
0x07       GPL     R/O      1  Extended self-test log
0x10       GPL     R/O      1  NCQ Command Error log
0x11       GPL     R/O      1  SATA Phy Event Counters log
0x30       GPL,SL  R/O      9  IDENTIFY DEVICE data log
0x80-0x9f  GPL,SL  R/W     16  Host vendor specific log

SMART Extended Comprehensive Error Log Version: 1 (1 sectors)
Device Error Count: 4
	CR     = Command Register
	FEATR  = Features Register
	COUNT  = Count (was: Sector Count) Register
	LBA_48 = Upper bytes of LBA High/Mid/Low Registers ]  ATA-8
	LH     = LBA High (was: Cylinder High) Register    ]   LBA
	LM     = LBA Mid (was: Cylinder Low) Register      ] Register
	LL     = LBA Low (was: Sector Number) Register     ]
	DV     = Device (was: Device/Head) Register
	DC     = Device Control Register
	ER     = Error register
	ST     = Status register
Powered_Up_Time is measured from power on, and printed as
DDd+hh:mm:SS.sss where DD=days, hh=hours, mm=minutes,
SS=sec, and sss=millisec. It "wraps" after 49.710 days.

Error 4 [3] occurred at disk power-on lifetime: 65535 hours (2730 days + 15 hours)
  When the command that caused the error occurred, the device was in a vendor specific state.

  After command completion occurred, registers were:
  ER -- ST COUNT  LBA_48  LH LM LL DV DC
  -- -- -- == -- == == == -- -- -- -- --
  ff -- ff ff ff ff ff ff ff ff ff ff ff

  Commands leading to the command that caused the error were:
  CR FEATR COUNT  LBA_48  LH LM LL DV DC  Powered_Up_Time  Command/Feature_Name
  -- == -- == -- == == == -- -- -- -- --  ---------------  --------------------
  ff ff ff ff ff ff ff ff ff ff ff ff ff 49d+17:02:47.295  [VENDOR SPECIFIC]
  ff ff ff ff ff ff ff ff ff ff ff ff ff 49d+17:02:47.295  [VENDOR SPECIFIC]
  ff ff ff ff ff ff ff ff ff ff ff ff ff 49d+17:02:47.295  [VENDOR SPECIFIC]
  ff ff ff ff ff ff ff ff ff ff ff ff ff 49d+17:02:47.295  [VENDOR SPECIFIC]
  ff ff ff ff ff ff ff ff ff ff ff ff ff 49d+17:02:47.295  [VENDOR SPECIFIC]

Error 3 [2] occurred at disk power-on lifetime: 65535 hours (2730 days + 15 hours)
  When the command that caused the error occurred, the device was in a vendor specific state.

  After command completion occurred, registers were:
  ER -- ST COUNT  LBA_48  LH LM LL DV DC
  -- -- -- == -- == == == -- -- -- -- --
  ff -- ff ff ff ff ff ff ff ff ff ff ff

  Commands leading to the command that caused the error were:
  CR FEATR COUNT  LBA_48  LH LM LL DV DC  Powered_Up_Time  Command/Feature_Name
  -- == -- == -- == == == -- -- -- -- --  ---------------  --------------------
  ff ff ff ff ff ff ff ff ff ff ff ff ff 49d+17:02:47.295  [VENDOR SPECIFIC]
  ff ff ff ff ff ff ff ff ff ff ff ff ff 49d+17:02:47.295  [VENDOR SPECIFIC]
  ff ff ff ff ff ff ff ff ff ff ff ff ff 49d+17:02:47.295  [VENDOR SPECIFIC]
  ff ff ff ff ff ff ff ff ff ff ff ff ff 49d+17:02:47.295  [VENDOR SPECIFIC]
  ff ff ff ff ff ff ff ff ff ff ff ff ff 49d+17:02:47.295  [VENDOR SPECIFIC]

Error 2 [1] occurred at disk power-on lifetime: 65535 hours (2730 days + 15 hours)
  When the command that caused the error occurred, the device was in a vendor specific state.

  After command completion occurred, registers were:
  ER -- ST COUNT  LBA_48  LH LM LL DV DC
  -- -- -- == -- == == == -- -- -- -- --
  ff -- ff ff ff ff ff ff ff ff ff ff ff

  Commands leading to the command that caused the error were:
  CR FEATR COUNT  LBA_48  LH LM LL DV DC  Powered_Up_Time  Command/Feature_Name
  -- == -- == -- == == == -- -- -- -- --  ---------------  --------------------
  ff ff ff ff ff ff ff ff ff ff ff ff ff 49d+17:02:47.295  [VENDOR SPECIFIC]
  ff ff ff ff ff ff ff ff ff ff ff ff ff 49d+17:02:47.295  [VENDOR SPECIFIC]
  ff ff ff ff ff ff ff ff ff ff ff ff ff 49d+17:02:47.295  [VENDOR SPECIFIC]
  ff ff ff ff ff ff ff ff ff ff ff ff ff 49d+17:02:47.295  [VENDOR SPECIFIC]
  ff ff ff ff ff ff ff ff ff ff ff ff ff 49d+17:02:47.295  [VENDOR SPECIFIC]

Error 1 [0] occurred at disk power-on lifetime: 65535 hours (2730 days + 15 hours)
  When the command that caused the error occurred, the device was in a vendor specific state.

  After command completion occurred, registers were:
  ER -- ST COUNT  LBA_48  LH LM LL DV DC
  -- -- -- == -- == == == -- -- -- -- --
  ff -- ff ff ff ff ff ff ff ff ff ff ff

  Commands leading to the command that caused the error were:
  CR FEATR COUNT  LBA_48  LH LM LL DV DC  Powered_Up_Time  Command/Feature_Name
  -- == -- == -- == == == -- -- -- -- --  ---------------  --------------------
  ff ff ff ff ff ff ff ff ff ff ff ff ff 49d+17:02:47.295  [VENDOR SPECIFIC]
  ff ff ff ff ff ff ff ff ff ff ff ff ff 49d+17:02:47.295  [VENDOR SPECIFIC]
  ff ff ff ff ff ff ff ff ff ff ff ff ff 49d+17:02:47.295  [VENDOR SPECIFIC]
  ff ff ff ff ff ff ff ff ff ff ff ff ff 49d+17:02:47.295  [VENDOR SPECIFIC]
  ff ff ff ff ff ff ff ff ff ff ff ff ff 49d+17:02:47.295  [VENDOR SPECIFIC]

SMART Extended Self-test Log Version: 1 (1 sectors)
Num  Test_Description    Status                  Remaining  LifeTime(hours)  LBA_of_first_error
# 1  Short offline       Aborted by host               90%       547         -
# 2  Short offline       Aborted by host               90%       547         -
# 3  Short offline       Aborted by host               90%       547         -
# 4  Short offline       Aborted by host               90%       547         -
# 5  Short offline       Aborted by host               90%       547         -
# 6  Short offline       Self-test routine in progress 90%       547         -
# 7  Short offline       Aborted by host               90%       547         -
# 8  Short offline       Aborted by host               90%       547         -
# 9  Short offline       Interrupted (host reset)      90%       547         -
#10  Short offline       Completed without error       00%       547         -
#11  Short offline       Aborted by host               90%       547         -
#12  Short offline       Self-test routine in progress 90%       547         -
#13  Short offline       Interrupted (host reset)      90%       546         -
#14  Short offline       Aborted by host               90%       546         -
#15  Short offline       Aborted by host               90%       546         -
#16  Short offline       Aborted by host               90%       546         -
#17  Short offline       Aborted by host               90%       546         -
#18  Short offline       Interrupted (host reset)      90%       546         -
#19  Short offline       Aborted by host               90%       546         -

Selective Self-tests/Logging not supported

SCT Commands not supported

Device Statistics (GP Log 0x04)
Page  Offset Size        Value Flags Description
0x01  =====  =               =  ===  == General Statistics (rev 1) ==
0x01  0x008  4            4290  ---  Lifetime Power-On Resets
0x01  0x010  4             547  ---  Power-on Hours
0x01  0x018  6      3088409144  ---  Logical Sectors Written
0x01  0x020  6      1556637235  ---  Number of Write Commands
0x01  0x028  6      2332908516  ---  Logical Sectors Read
0x01  0x030  6      1146581899  ---  Number of Read Commands
0x07  =====  =               =  ===  == Solid State Device Statistics (rev 1) ==
0x07  0x008  1              84  ---  Percentage Used Endurance Indicator
                                |||_ C monitored condition met
                                ||__ D supports DSN
                                |___ N normalized value

Pending Defects log (GP Log 0x0c) not supported

SATA Phy Event Counters (GP Log 0x11)
ID      Size     Value  Description
0x0001  4            0  Command failed due to ICRC error
0x0002  4            0  R_ERR response for data FIS
0x0005  4            0  R_ERR response for non-data FIS
0x000a  4           14  Device-to-host register FISes sent due to a COMRESET

