smartctl 7.2 2021-09-14 r5236 [FreeBSD 13.0-STABLE amd64] (local build)
Copyright (C) 2002-20, Bruce Allen, Christian Franke, www.smartmontools.org

=== START OF INFORMATION SECTION ===
Model Number:                       SAMSUNG MZVLB1T0HBLR-00000
Serial Number:                      --
Firmware Version:                   EXF7201Q
PCI Vendor/Subsystem ID:            0x144d
IEEE OUI Identifier:                0x002538
Total NVM Capacity:                 1,024,209,543,168 [1.02 TB]
Unallocated NVM Capacity:           0
Controller ID:                      4
NVMe Version:                       1.3
Number of Namespaces:               1
Namespace 1 Size/Capacity:          1,024,209,543,168 [1.02 TB]
Namespace 1 Utilization:            235,534,548,992 [235 GB]
Namespace 1 Formatted LBA Size:     512
Namespace 1 IEEE EUI-64:            002538 ...
Local Time is:                      Wed Feb  2 13:14:34 2022 GMT
Firmware Updates (0x16):            3 Slots, no Reset required
Optional Admin Commands (0x0017):   Security Format Frmw_DL Self_Test
Optional NVM Commands (0x005f):     Comp Wr_Unc DS_Mngmt Wr_Zero Sav/Sel_Feat Timestmp
Log Page Attributes (0x03):         S/H_per_NS Cmd_Eff_Lg
Maximum Data Transfer Size:         512 Pages
Warning  Comp. Temp. Threshold:     84 Celsius
Critical Comp. Temp. Threshold:     85 Celsius

Supported Power States
St Op     Max   Active     Idle   RL RT WL WT  Ent_Lat  Ex_Lat
 0 +     8.00W       -        -    0  0  0  0        0       0
 1 +     6.30W       -        -    1  1  1  1        0       0
 2 +     3.50W       -        -    2  2  2  2        0       0
 3 -   0.0760W       -        -    3  3  3  3      210    1200
 4 -   0.0050W       -        -    4  4  4  4     2000    8000

Supported LBA Sizes (NSID 0x1)
Id Fmt  Data  Metadt  Rel_Perf
 0 +     512       0         0

=== START OF SMART DATA SECTION ===
SMART overall-health self-assessment test result: PASSED

SMART/Health Information (NVMe Log 0x02)
Critical Warning:                   0x00
Temperature:                        54 Celsius
Available Spare:                    100%
Available Spare Threshold:          10%
Percentage Used:                    0%
Data Units Read:                    996,877 [510 GB]
Data Units Written:                 1,003,249 [513 GB]
Host Read Commands:                 11,623,863
Host Write Commands:                14,228,767
Controller Busy Time:               18
Power Cycles:                       90
Power On Hours:                     16
Unsafe Shutdowns:                   37
Media and Data Integrity Errors:    0
Error Information Log Entries:      223
Warning  Comp. Temperature Time:    0
Critical Comp. Temperature Time:    0
Temperature Sensor 1:               54 Celsius
Temperature Sensor 2:               65 Celsius

Error Information (NVMe Log 0x01, 16 of 64 entries)
No Errors Logged

