smartctl 7.4 2023-08-01 r5530 [FreeBSD 14.2-RELEASE-p2 amd64] (local build)
Copyright (C) 2002-23, Bruce Allen, Christian Franke, www.smartmontools.org

=== START OF INFORMATION SECTION ===
Model Family:     Crucial/Micron Client SSDs
Device Model:     Micron 1100 SATA 512GB
Serial Number:    --
LU WWN Device Id: 5 00a075 ...
Firmware Version: M0DL003
User Capacity:    512,110,190,592 bytes [512 GB]
Sector Sizes:     512 bytes logical, 4096 bytes physical
Rotation Rate:    Solid State Device
Form Factor:      2.5 inches
TRIM Command:     Available, deterministic, zeroed
Device is:        In smartctl database 7.3/5528
ATA Version is:   ACS-3 T13/2161-D revision 5
SATA Version is:  SATA 3.2, 6.0 Gb/s (current: 6.0 Gb/s)
Local Time is:    Tue Mar  4 10:02:50 2025 EST
SMART support is: Available - device has SMART capability.
SMART support is: Enabled
AAM feature is:   Unavailable
APM feature is:   Unavailable
Rd look-ahead is: Enabled
Write cache is:   Enabled
DSN feature is:   Unavailable
ATA Security is:  Disabled, frozen [SEC2]
Wt Cache Reorder: Enabled

=== START OF READ SMART DATA SECTION ===
SMART overall-health self-assessment test result: PASSED
See vendor-specific Attribute list for marginal Attributes.

General SMART Values:
Offline data collection status:  (0x00)	Offline data collection activity
					was never started.
					Auto Offline Data Collection: Disabled.
Self-test execution status:      (   0)	The previous self-test routine completed
					without error or no self-test has ever 
					been run.
Total time to complete Offline 
data collection: 		( 1357) seconds.
Offline data collection
capabilities: 			 (0x7b) SMART execute Offline immediate.
					Auto Offline data collection on/off support.
					Suspend Offline collection upon new
					command.
					Offline surface scan supported.
					Self-test supported.
					Conveyance Self-test supported.
					Selective Self-test supported.
SMART capabilities:            (0x0003)	Saves SMART data before entering
					power-saving mode.
					Supports SMART auto save timer.
Error logging capability:        (0x01)	Error logging supported.
					General Purpose Logging supported.
Short self-test routine 
recommended polling time: 	 (   2) minutes.
Extended self-test routine
recommended polling time: 	 (   7) minutes.
Conveyance self-test routine
recommended polling time: 	 (   3) minutes.
SCT capabilities: 	       (0x0035)	SCT Status supported.
					SCT Feature Control supported.
					SCT Data Table supported.

SMART Attributes Data Structure revision number: 16
Vendor Specific SMART Attributes with Thresholds:
ID# ATTRIBUTE_NAME          FLAGS    VALUE WORST THRESH FAIL RAW_VALUE
  5 Reallocate_NAND_Blk_Cnt PO--CK   100   100   010    -    4
  9 Power_On_Hours          -O--CK   100   100   000    -    443
 12 Power_Cycle_Count       PO--CK   100   100   001    -    6210
181 Program_Fail_Cnt_Total  PO--CK   100   100   001    -    0
182 Erase_Fail_Count_Total  PO--CK   100   100   001    -    0
177 Wear_Leveling_Count     PO--CK   097   097   010    -    58
187 Reported_Uncorrect      PO--CK   100   100   001    -    74
194 Temperature_Celsius     -O---K   078   054   000    -    22 (Min/Max 13/46)
199 UDMA_CRC_Error_Count    -O--CK   100   100   000    -    0
238 Unknown_Attribute       ----CK   097   097   000    -    3
175 Program_Fail_Count_Chip PO--CK   100   100   000    -    0
176 Erase_Fail_Count_Chip   PO--CK   100   100   000    -    0
178 Used_Rsvd_Blk_Cnt_Chip  PO--CK   100   100   000    -    1
180 Unused_Reserve_NAND_Blk PO--CK   000   000   000    -    2472
195 Cumulativ_Corrected_ECC POSR-K   100   000   050    Past 0
241 Total_LBAs_Written      PO--CK   100   100   000    -    26505671526
242 Total_LBAs_Read         PO--CK   100   100   000    -    21692500109
179 Used_Rsvd_Blk_Cnt_Tot   PO--CK   100   100   000    -    4
                            ||||||_ K auto-keep
                            |||||__ C event count
                            ||||___ R error rate
                            |||____ S speed/performance
                            ||_____ O updated online
                            |______ P prefailure warning

General Purpose Log Directory Version 1
SMART           Log Directory Version 1 [multi-sector log support]
Address    Access  R/W   Size  Description
0x00       GPL,SL  R/O      1  Log Directory
0x01           SL  R/O      1  Summary SMART error log
0x02           SL  R/O     51  Comprehensive SMART error log
0x03       GPL     R/O  16383  Ext. Comprehensive SMART error log
0x04       GPL,SL  R/O      8  Device Statistics log
0x06           SL  R/O      1  SMART self-test log
0x07       GPL     R/O      1  Extended self-test log
0x09           SL  R/W      1  Selective self-test log
0x10       GPL     R/O      1  NCQ Command Error log
0x11       GPL     R/O      1  SATA Phy Event Counters log
0x13       GPL     R/O      1  SATA NCQ Send and Receive log
0x24       GPL     R/O   8000  Current Device Internal Status Data log
0x25       GPL     R/O   8000  Saved Device Internal Status Data log
0x30       GPL,SL  R/O      9  IDENTIFY DEVICE data log
0x80-0x9f  GPL,SL  R/W     16  Host vendor specific log
0xa0       GPL     VS   35328  Device vendor specific log
0xa1       GPL,SL  VS       3  Device vendor specific log
0xa2       GPL,SL  VS       1  Device vendor specific log
0xa3       GPL     VS   13824  Device vendor specific log
0xa4       GPL     VS     354  Device vendor specific log
0xa4       SL      VS      98  Device vendor specific log
0xa5       GPL     VS    8000  Device vendor specific log
0xa5       SL      VS      64  Device vendor specific log
0xa6       GPL     VS    8000  Device vendor specific log
0xa6       SL      VS      64  Device vendor specific log
0xa7-0xdf  GPL,SL  VS       1  Device vendor specific log
0xe0       GPL,SL  R/W      1  SCT Command/Status
0xe1       GPL,SL  R/W      1  SCT Data Transfer

SMART Extended Comprehensive Error Log Version: 1 (16383 sectors)
Device Error Count: 74
	CR     = Command Register
	FEATR  = Features Register
	COUNT  = Count (was: Sector Count) Register
	LBA_48 = Upper bytes of LBA High/Mid/Low Registers ]  ATA-8
	LH     = LBA High (was: Cylinder High) Register    ]   LBA
	LM     = LBA Mid (was: Cylinder Low) Register      ] Register
	LL     = LBA Low (was: Sector Number) Register     ]
	DV     = Device (was: Device/Head) Register
	DC     = Device Control Register
	ER     = Error register
	ST     = Status register
Powered_Up_Time is measured from power on, and printed as
DDd+hh:mm:SS.sss where DD=days, hh=hours, mm=minutes,
SS=sec, and sss=millisec. It "wraps" after 49.710 days.

Error 74 [73] occurred at disk power-on lifetime: 190 hours (7 days + 22 hours)
  When the command that caused the error occurred, the device was active or idle.

  After command completion occurred, registers were:
  ER -- ST COUNT  LBA_48  LH LM LL DV DC
  -- -- -- == -- == == == -- -- -- -- --
  40 -- 51 00 01 00 00 00 58 15 47 40 00  Error: UNC at LBA = 0x00581547 = 5772615

  Commands leading to the command that caused the error were:
  CR FEATR COUNT  LBA_48  LH LM LL DV DC  Powered_Up_Time  Command/Feature_Name
  -- == -- == -- == == == -- -- -- -- --  ---------------  --------------------
  60 00 01 00 01 00 00 00 58 15 47 40 00  7d+22:34:00.000  READ FPDMA QUEUED
  2f 00 00 00 01 00 00 00 00 00 10 e0 00  7d+22:34:00.000  READ LOG EXT
  60 00 01 00 01 00 00 00 58 15 47 40 00  7d+22:34:00.000  READ FPDMA QUEUED
  2f 00 00 00 01 00 00 00 00 00 10 e0 00  7d+22:34:00.000  READ LOG EXT
  60 00 01 00 01 00 00 00 58 15 47 40 00  7d+22:34:00.000  READ FPDMA QUEUED

Error 73 [72] occurred at disk power-on lifetime: 190 hours (7 days + 22 hours)
  When the command that caused the error occurred, the device was active or idle.

  After command completion occurred, registers were:
  ER -- ST COUNT  LBA_48  LH LM LL DV DC
  -- -- -- == -- == == == -- -- -- -- --
  40 -- 51 00 01 00 00 00 58 15 46 40 00  Error: UNC at LBA = 0x00581546 = 5772614

  Commands leading to the command that caused the error were:
  CR FEATR COUNT  LBA_48  LH LM LL DV DC  Powered_Up_Time  Command/Feature_Name
  -- == -- == -- == == == -- -- -- -- --  ---------------  --------------------
  60 00 01 00 01 00 00 00 58 15 46 40 00  7d+22:34:00.000  READ FPDMA QUEUED
  2f 00 00 00 01 00 00 00 00 00 10 e0 00  7d+22:34:00.000  READ LOG EXT
  60 00 01 00 01 00 00 00 58 15 45 40 00  7d+22:34:00.000  READ FPDMA QUEUED
  60 00 01 00 01 00 00 00 58 15 46 40 00  7d+22:34:00.000  READ FPDMA QUEUED
  2f 00 00 00 01 00 00 00 00 00 10 e0 00  7d+22:34:00.000  READ LOG EXT

Error 72 [71] occurred at disk power-on lifetime: 190 hours (7 days + 22 hours)
  When the command that caused the error occurred, the device was active or idle.

  After command completion occurred, registers were:
  ER -- ST COUNT  LBA_48  LH LM LL DV DC
  -- -- -- == -- == == == -- -- -- -- --
  40 -- 51 00 01 00 00 00 58 15 45 40 00  Error: UNC at LBA = 0x00581545 = 5772613

  Commands leading to the command that caused the error were:
  CR FEATR COUNT  LBA_48  LH LM LL DV DC  Powered_Up_Time  Command/Feature_Name
  -- == -- == -- == == == -- -- -- -- --  ---------------  --------------------
  60 00 01 00 01 00 00 00 58 15 45 40 00  7d+22:34:00.000  READ FPDMA QUEUED
  61 00 01 00 40 00 00 00 73 19 60 40 00  7d+22:34:00.000  WRITE FPDMA QUEUED
  2f 00 00 00 01 00 00 00 00 00 10 e0 00  7d+22:34:00.000  READ LOG EXT
  61 00 01 00 40 00 00 00 73 19 60 40 00  7d+22:34:00.000  WRITE FPDMA QUEUED
  2f 00 00 00 01 00 00 00 00 00 10 e0 00  7d+22:34:00.000  READ LOG EXT

Error 71 [70] occurred at disk power-on lifetime: 190 hours (7 days + 22 hours)
  When the command that caused the error occurred, the device was active or idle.

  After command completion occurred, registers were:
  ER -- ST COUNT  LBA_48  LH LM LL DV DC
  -- -- -- == -- == == == -- -- -- -- --
  40 -- 51 00 01 00 00 00 58 15 44 40 00  Error: UNC at LBA = 0x00581544 = 5772612

  Commands leading to the command that caused the error were:
  CR FEATR COUNT  LBA_48  LH LM LL DV DC  Powered_Up_Time  Command/Feature_Name
  -- == -- == -- == == == -- -- -- -- --  ---------------  --------------------
  60 00 01 00 01 00 00 00 58 15 44 40 00  7d+22:34:00.000  READ FPDMA QUEUED
  2f 00 00 00 01 00 00 00 00 00 10 e0 00  7d+22:34:00.000  READ LOG EXT
  60 00 01 00 01 00 00 00 58 15 44 40 00  7d+22:34:00.000  READ FPDMA QUEUED
  2f 00 00 00 01 00 00 00 00 00 10 e0 00  7d+22:34:00.000  READ LOG EXT
  60 00 01 00 01 00 00 00 58 15 44 40 00  7d+22:34:00.000  READ FPDMA QUEUED

Error 70 [69] occurred at disk power-on lifetime: 190 hours (7 days + 22 hours)
  When the command that caused the error occurred, the device was active or idle.

  After command completion occurred, registers were:
  ER -- ST COUNT  LBA_48  LH LM LL DV DC
  -- -- -- == -- == == == -- -- -- -- --
  40 -- 51 00 01 00 00 00 58 15 43 40 00  Error: UNC at LBA = 0x00581543 = 5772611

  Commands leading to the command that caused the error were:
  CR FEATR COUNT  LBA_48  LH LM LL DV DC  Powered_Up_Time  Command/Feature_Name
  -- == -- == -- == == == -- -- -- -- --  ---------------  --------------------
  60 00 01 00 01 00 00 00 58 15 43 40 00  7d+22:34:00.000  READ FPDMA QUEUED
  2f 00 00 00 01 00 00 00 00 00 10 e0 00  7d+22:34:00.000  READ LOG EXT
  60 00 01 00 01 00 00 00 58 15 43 40 00  7d+22:34:00.000  READ FPDMA QUEUED
  2f 00 00 00 01 00 00 00 00 00 10 e0 00  7d+22:34:00.000  READ LOG EXT
  60 00 01 00 01 00 00 00 58 15 43 40 00  7d+22:34:00.000  READ FPDMA QUEUED

Error 69 [68] occurred at disk power-on lifetime: 190 hours (7 days + 22 hours)
  When the command that caused the error occurred, the device was active or idle.

  After command completion occurred, registers were:
  ER -- ST COUNT  LBA_48  LH LM LL DV DC
  -- -- -- == -- == == == -- -- -- -- --
  40 -- 51 00 01 00 00 00 58 15 42 40 00  Error: UNC at LBA = 0x00581542 = 5772610

  Commands leading to the command that caused the error were:
  CR FEATR COUNT  LBA_48  LH LM LL DV DC  Powered_Up_Time  Command/Feature_Name
  -- == -- == -- == == == -- -- -- -- --  ---------------  --------------------
  60 00 01 00 01 00 00 00 58 15 42 40 00  7d+22:34:00.000  READ FPDMA QUEUED
  2f 00 00 00 01 00 00 00 00 00 10 e0 00  7d+22:34:00.000  READ LOG EXT
  60 00 01 00 01 00 00 00 58 15 42 40 00  7d+22:34:00.000  READ FPDMA QUEUED
  2f 00 00 00 01 00 00 00 00 00 10 e0 00  7d+22:34:00.000  READ LOG EXT
  60 00 01 00 01 00 00 00 58 15 42 40 00  7d+22:34:00.000  READ FPDMA QUEUED

Error 68 [67] occurred at disk power-on lifetime: 190 hours (7 days + 22 hours)
  When the command that caused the error occurred, the device was active or idle.

  After command completion occurred, registers were:
  ER -- ST COUNT  LBA_48  LH LM LL DV DC
  -- -- -- == -- == == == -- -- -- -- --
  40 -- 51 00 01 00 00 00 58 15 41 40 00  Error: UNC at LBA = 0x00581541 = 5772609

  Commands leading to the command that caused the error were:
  CR FEATR COUNT  LBA_48  LH LM LL DV DC  Powered_Up_Time  Command/Feature_Name
  -- == -- == -- == == == -- -- -- -- --  ---------------  --------------------
  60 00 01 00 01 00 00 00 58 15 41 40 00  7d+22:34:00.000  READ FPDMA QUEUED
  2f 00 00 00 01 00 00 00 00 00 10 e0 00  7d+22:34:00.000  READ LOG EXT
  60 00 01 00 01 00 00 00 58 15 40 40 00  7d+22:34:00.000  READ FPDMA QUEUED
  2f 00 00 00 01 00 00 00 00 00 10 e0 00  7d+22:34:00.000  READ LOG EXT
  60 00 01 00 01 00 00 00 58 15 40 40 00  7d+22:34:00.000  READ FPDMA QUEUED

Error 67 [66] occurred at disk power-on lifetime: 190 hours (7 days + 22 hours)
  When the command that caused the error occurred, the device was active or idle.

  After command completion occurred, registers were:
  ER -- ST COUNT  LBA_48  LH LM LL DV DC
  -- -- -- == -- == == == -- -- -- -- --
  40 -- 51 00 01 00 00 00 58 15 40 40 00  Error: UNC at LBA = 0x00581540 = 5772608

  Commands leading to the command that caused the error were:
  CR FEATR COUNT  LBA_48  LH LM LL DV DC  Powered_Up_Time  Command/Feature_Name
  -- == -- == -- == == == -- -- -- -- --  ---------------  --------------------
  60 00 01 00 01 00 00 00 58 15 40 40 00  7d+22:34:00.000  READ FPDMA QUEUED
  2f 00 00 00 01 00 00 00 00 00 10 e0 00  7d+22:34:00.000  READ LOG EXT
  60 00 01 00 20 00 00 00 58 15 40 40 00  7d+22:34:00.000  READ FPDMA QUEUED
  61 00 00 00 08 00 00 00 58 05 f0 40 00  7d+22:34:00.000  WRITE FPDMA QUEUED
  60 00 00 00 08 00 00 09 47 6e 68 40 00  7d+22:34:00.000  READ FPDMA QUEUED

SMART Extended Self-test Log Version: 1 (1 sectors)
Num  Test_Description    Status                  Remaining  LifeTime(hours)  LBA_of_first_error
# 1  Short offline       Completed without error       00%         0         -

SMART Selective self-test log data structure revision number 1
 SPAN  MIN_LBA  MAX_LBA  CURRENT_TEST_STATUS
    1        0        0  Not_testing
    2        0        0  Not_testing
    3        0        0  Not_testing
    4        0        0  Not_testing
    5        0        0  Not_testing
Selective self-test flags (0x0):
  After scanning selected spans, do NOT read-scan remainder of disk.
If Selective self-test is pending on power-up, resume after 0 minute delay.

SCT Status Version:                  3
SCT Version (vendor specific):       1 (0x0001)
Device State:                        Active (0)
Current Temperature:                    22 Celsius
Power Cycle Min/Max Temperature:     19/35 Celsius
Lifetime    Min/Max Temperature:     13/46 Celsius
Under/Over Temperature Limit Count:   0/0

SCT Temperature History Version:     2
Temperature Sampling Period:         1 minute
Temperature Logging Interval:        1 minute
Min/Max recommended Temperature:      0/70 Celsius
Min/Max Temperature Limit:           -5/75 Celsius
Temperature History Size (Index):    478 (112)

SCT Error Recovery Control command not supported

Device Statistics (GP Log 0x04)
Page  Offset Size        Value Flags Description
0x01  =====  =               =  ===  == General Statistics (rev 1) ==
0x01  0x008  4            6210  ---  Lifetime Power-On Resets
0x01  0x010  4             443  ---  Power-on Hours
0x01  0x018  6     26505671526  ---  Logical Sectors Written
0x01  0x020  6       378865242  ---  Number of Write Commands
0x01  0x028  6     21692500109  ---  Logical Sectors Read
0x01  0x030  6       558462578  ---  Number of Read Commands
0x04  =====  =               =  ===  == General Errors Statistics (rev 1) ==
0x04  0x008  4              74  ---  Number of Reported Uncorrectable Errors
0x04  0x010  4            6208  ---  Resets Between Cmd Acceptance and Completion
0x05  =====  =               =  ===  == Temperature Statistics (rev 1) ==
0x05  0x008  1              22  ---  Current Temperature
0x05  0x010  1              23  ---  Average Short Term Temperature
0x05  0x018  1               -  ---  Average Long Term Temperature
0x05  0x020  1              46  ---  Highest Temperature
0x05  0x028  1              13  ---  Lowest Temperature
0x05  0x030  1              28  ---  Highest Average Short Term Temperature
0x05  0x038  1              23  ---  Lowest Average Short Term Temperature
0x05  0x040  1               -  ---  Highest Average Long Term Temperature
0x05  0x048  1               -  ---  Lowest Average Long Term Temperature
0x05  0x050  4               0  ---  Time in Over-Temperature
0x05  0x058  1              70  ---  Specified Maximum Operating Temperature
0x05  0x060  4               0  ---  Time in Under-Temperature
0x05  0x068  1               0  ---  Specified Minimum Operating Temperature
0x06  =====  =               =  ===  == Transport Statistics (rev 1) ==
0x06  0x008  4           19150  ---  Number of Hardware Resets
0x06  0x010  4              74  ---  Number of ASR Events
0x06  0x018  4               0  ---  Number of Interface CRC Errors
0x07  =====  =               =  ===  == Solid State Device Statistics (rev 1) ==
0x07  0x008  1               3  N--  Percentage Used Endurance Indicator
                                |||_ C monitored condition met
                                ||__ D supports DSN
                                |___ N normalized value

Pending Defects log (GP Log 0x0c) not supported

SATA Phy Event Counters (GP Log 0x11)
ID      Size     Value  Description
0x0001  4            0  Command failed due to ICRC error
0x000a  4           12  Device-to-host register FISes sent due to a COMRESET



