smartctl 7.2 2020-12-30 r5155 [FreeBSD 13.0-STABLE amd64] (local build)
Copyright (C) 2002-20, Bruce Allen, Christian Franke, www.smartmontools.org

=== START OF INFORMATION SECTION ===
Device Model:     SSDPR-CX400-256-G2
Serial Number:    --
Firmware Version: SBFM61.3
User Capacity:    256,060,514,304 bytes [256 GB]
Sector Size:      512 bytes logical/physical
Rotation Rate:    Solid State Device
Form Factor:      2.5 inches
TRIM Command:     Available
Device is:        Not in smartctl database [for details use: -P showall]
ATA Version is:   ACS-4 (minor revision not indicated)
SATA Version is:  SATA 3.2, 6.0 Gb/s (current: 6.0 Gb/s)
Local Time is:    Fri Jun 25 17:29:16 2021 UTC
SMART support is: Available - device has SMART capability.
SMART support is: Enabled
AAM feature is:   Unavailable
APM feature is:   Unavailable
Rd look-ahead is: Enabled
Write cache is:   Enabled
DSN feature is:   Unavailable
ATA Security is:  Disabled, frozen [SEC2]
Wt Cache Reorder: Unavailable

=== START OF READ SMART DATA SECTION ===
SMART overall-health self-assessment test result: PASSED

General SMART Values:
Offline data collection status:  (0x00)	Offline data collection activity
					was never started.
					Auto Offline Data Collection: Disabled.
Self-test execution status:      (   0)	The previous self-test routine completed
					without error or no self-test has ever 
					been run.
Total time to complete Offline 
data collection: 		(65535) seconds.
Offline data collection
capabilities: 			 (0x79) SMART execute Offline immediate.
					No Auto Offline data collection support.
					Suspend Offline collection upon new
					command.
					Offline surface scan supported.
					Self-test supported.
					Conveyance Self-test supported.
					Selective Self-test supported.
SMART capabilities:            (0x0003)	Saves SMART data before entering
					power-saving mode.
					Supports SMART auto save timer.
Error logging capability:        (0x01)	Error logging supported.
					General Purpose Logging supported.
Short self-test routine 
recommended polling time: 	 (   2) minutes.
Extended self-test routine
recommended polling time: 	 (  30) minutes.
Conveyance self-test routine
recommended polling time: 	 (   6) minutes.

SMART Attributes Data Structure revision number: 16
Vendor Specific SMART Attributes with Thresholds:
ID# ATTRIBUTE_NAME          FLAGS    VALUE WORST THRESH FAIL RAW_VALUE
  1 Raw_Read_Error_Rate     PO-R--   100   100   050    -    0
  9 Power_On_Hours          -O--C-   100   100   000    -    1
 12 Power_Cycle_Count       -O--C-   100   100   000    -    13
168 Unknown_Attribute       -O--C-   100   100   000    -    0
170 Unknown_Attribute       PO----   100   100   010    -    171
173 Unknown_Attribute       -O--C-   100   100   000    -    1
192 Power-Off_Retract_Count -O--C-   100   100   000    -    4
194 Temperature_Celsius     PO---K   067   067   000    -    33 (Min/Max 33/33)
218 Unknown_Attribute       PO-R--   100   100   050    -    743
231 Unknown_SSD_Attribute   PO--C-   100   100   000    -    100
241 Total_LBAs_Written      -O--C-   100   100   000    -    30
                            ||||||_ K auto-keep
                            |||||__ C event count
                            ||||___ R error rate
                            |||____ S speed/performance
                            ||_____ O updated online
                            |______ P prefailure warning

General Purpose Log Directory Version 1
SMART           Log Directory Version 1 [multi-sector log support]
Address    Access  R/W   Size  Description
0x00       GPL,SL  R/O      1  Log Directory
0x01           SL  R/O      1  Summary SMART error log
0x02           SL  R/O     51  Comprehensive SMART error log
0x03       GPL     R/O     64  Ext. Comprehensive SMART error log
0x04       GPL,SL  R/O      8  Device Statistics log
0x06           SL  R/O      1  SMART self-test log
0x07       GPL     R/O      1  Extended self-test log
0x09           SL  R/W      1  Selective self-test log
0x10       GPL     R/O      1  NCQ Command Error log
0x11       GPL     R/O      1  SATA Phy Event Counters log
0x30       GPL,SL  R/O      9  IDENTIFY DEVICE data log
0x80-0x9f  GPL,SL  R/W     16  Host vendor specific log

SMART Extended Comprehensive Error Log Version: 1 (64 sectors)
Device Error Count: 13
	CR     = Command Register
	FEATR  = Features Register
	COUNT  = Count (was: Sector Count) Register
	LBA_48 = Upper bytes of LBA High/Mid/Low Registers ]  ATA-8
	LH     = LBA High (was: Cylinder High) Register    ]   LBA
	LM     = LBA Mid (was: Cylinder Low) Register      ] Register
	LL     = LBA Low (was: Sector Number) Register     ]
	DV     = Device (was: Device/Head) Register
	DC     = Device Control Register
	ER     = Error register
	ST     = Status register
Powered_Up_Time is measured from power on, and printed as
DDd+hh:mm:SS.sss where DD=days, hh=hours, mm=minutes,
SS=sec, and sss=millisec. It "wraps" after 49.710 days.

Error 13 [12] occurred at disk power-on lifetime: 0 hours (0 days + 0 hours)
  When the command that caused the error occurred, the device was active or idle.

  After command completion occurred, registers were:
  ER -- ST COUNT  LBA_48  LH LM LL DV DC
  -- -- -- == -- == == == -- -- -- -- --
  84 -- 51 00 40 00 00 00 e4 0f c0 e0 00  Error: ICRC, ABRT 64 sectors at LBA = 0x00e40fc0 = 14946240

  Commands leading to the command that caused the error were:
  CR FEATR COUNT  LBA_48  LH LM LL DV DC  Powered_Up_Time  Command/Feature_Name
  -- == -- == -- == == == -- -- -- -- --  ---------------  --------------------
  c8 00 00 00 40 00 00 00 e4 0f c0 e0 00     00:12:39.729  READ DMA
  c8 00 00 00 40 00 00 00 e4 0f 80 e0 00     00:12:39.725  READ DMA
  c8 00 00 00 40 00 00 00 e4 0f 40 e0 00     00:12:39.720  READ DMA
  c8 00 00 00 40 00 00 00 e4 0f 00 e0 00     00:12:39.716  READ DMA
  c8 00 00 00 40 00 00 00 c0 05 40 e0 00     00:12:39.712  READ DMA

Error 12 [11] occurred at disk power-on lifetime: 0 hours (0 days + 0 hours)
  When the command that caused the error occurred, the device was active or idle.

  After command completion occurred, registers were:
  ER -- ST COUNT  LBA_48  LH LM LL DV DC
  -- -- -- == -- == == == -- -- -- -- --
  84 -- 51 00 7f 00 00 00 16 5f 46 e0 00  Error: ICRC, ABRT 127 sectors at LBA = 0x00165f46 = 1466182

  Commands leading to the command that caused the error were:
  CR FEATR COUNT  LBA_48  LH LM LL DV DC  Powered_Up_Time  Command/Feature_Name
  -- == -- == -- == == == -- -- -- -- --  ---------------  --------------------
  c8 00 00 00 7f 00 00 00 16 5f 46 e0 00     00:12:29.179  READ DMA
  c8 00 00 00 7f 00 00 00 16 5e c7 e0 00     00:12:29.179  READ DMA
  c8 00 00 00 7f 00 00 00 16 5e 48 e0 00     00:12:29.178  READ DMA
  c8 00 00 00 7f 00 00 00 16 5d c9 e0 00     00:12:29.178  READ DMA
  c8 00 00 00 7f 00 00 00 16 5d 4a e0 00     00:12:29.177  READ DMA

Error 11 [10] occurred at disk power-on lifetime: 0 hours (0 days + 0 hours)
  When the command that caused the error occurred, the device was active or idle.

  After command completion occurred, registers were:
  ER -- ST COUNT  LBA_48  LH LM LL DV DC
  -- -- -- == -- == == == -- -- -- -- --
  84 -- 51 00 7f 00 00 00 1d 4f 88 e0 00  Error: ICRC, ABRT 127 sectors at LBA = 0x001d4f88 = 1920904

  Commands leading to the command that caused the error were:
  CR FEATR COUNT  LBA_48  LH LM LL DV DC  Powered_Up_Time  Command/Feature_Name
  -- == -- == -- == == == -- -- -- -- --  ---------------  --------------------
  c8 00 00 00 7f 00 00 00 1d 4f 88 e0 00     00:12:18.549  READ DMA
  c8 00 00 00 40 00 00 00 62 7c 00 e0 00     00:12:18.548  READ DMA
  c8 00 00 00 2a 00 00 00 29 17 da e0 00     00:12:18.539  READ DMA
  c8 00 00 00 7f 00 00 00 29 17 5b e0 00     00:12:18.539  READ DMA
  c8 00 00 00 7f 00 00 00 29 16 dc e0 00     00:12:18.538  READ DMA

Error 10 [9] occurred at disk power-on lifetime: 0 hours (0 days + 0 hours)
  When the command that caused the error occurred, the device was active or idle.

  After command completion occurred, registers were:
  ER -- ST COUNT  LBA_48  LH LM LL DV DC
  -- -- -- == -- == == == -- -- -- -- --
  84 -- 51 00 7f 00 00 00 24 2b c7 e0 00  Error: ICRC, ABRT 127 sectors at LBA = 0x00242bc7 = 2370503

  Commands leading to the command that caused the error were:
  CR FEATR COUNT  LBA_48  LH LM LL DV DC  Powered_Up_Time  Command/Feature_Name
  -- == -- == -- == == == -- -- -- -- --  ---------------  --------------------
  c8 00 00 00 7f 00 00 00 24 2b c7 e0 00     00:12:07.891  READ DMA
  c8 00 00 00 7f 00 00 00 24 2b 48 e0 00     00:12:07.890  READ DMA
  c8 00 00 00 7f 00 00 00 24 2a c9 e0 00     00:12:07.890  READ DMA
  c8 00 00 00 7f 00 00 00 24 2a 4a e0 00     00:12:07.890  READ DMA
  c8 00 00 00 7f 00 00 00 24 29 cb e0 00     00:12:07.889  READ DMA

Error 9 [8] occurred at disk power-on lifetime: 0 hours (0 days + 0 hours)
  When the command that caused the error occurred, the device was active or idle.

  After command completion occurred, registers were:
  ER -- ST COUNT  LBA_48  LH LM LL DV DC
  -- -- -- == -- == == == -- -- -- -- --
  84 -- 51 00 7f 00 00 00 1b 4e 99 e0 00  Error: ICRC, ABRT 127 sectors at LBA = 0x001b4e99 = 1789593

  Commands leading to the command that caused the error were:
  CR FEATR COUNT  LBA_48  LH LM LL DV DC  Powered_Up_Time  Command/Feature_Name
  -- == -- == -- == == == -- -- -- -- --  ---------------  --------------------
  c8 00 00 00 7f 00 00 00 1b 4e 99 e0 00     00:11:57.278  READ DMA
  c8 00 00 00 7f 00 00 00 1b 4e 1a e0 00     00:11:57.277  READ DMA
  c8 00 00 00 7f 00 00 00 1b 4d 9b e0 00     00:11:57.277  READ DMA
  c8 00 00 00 7f 00 00 00 1b 4d 1c e0 00     00:11:57.276  READ DMA
  c8 00 00 00 7f 00 00 00 1b 4c 9d e0 00     00:11:57.276  READ DMA

Error 8 [7] occurred at disk power-on lifetime: 0 hours (0 days + 0 hours)
  When the command that caused the error occurred, the device was active or idle.

  After command completion occurred, registers were:
  ER -- ST COUNT  LBA_48  LH LM LL DV DC
  -- -- -- == -- == == == -- -- -- -- --
  84 -- 51 00 7f 00 00 00 2e 3f 48 e1 00  Error: ICRC, ABRT 127 sectors at LBA = 0x012e3f48 = 19808072

  Commands leading to the command that caused the error were:
  CR FEATR COUNT  LBA_48  LH LM LL DV DC  Powered_Up_Time  Command/Feature_Name
  -- == -- == -- == == == -- -- -- -- --  ---------------  --------------------
  c8 00 00 00 7f 00 00 00 2e 3f 48 e1 00     00:11:46.967  READ DMA
  c8 00 00 00 40 00 00 00 64 95 c0 e0 00     00:11:46.966  READ DMA
  c8 00 00 00 40 00 00 00 0d c0 40 e0 00     00:11:46.966  READ DMA
  c8 00 00 00 40 00 00 00 2e 86 c0 e1 00     00:11:46.965  READ DMA
  c8 00 00 00 40 00 00 00 28 b9 40 e0 00     00:11:46.964  READ DMA

Error 7 [6] occurred at disk power-on lifetime: 0 hours (0 days + 0 hours)
  When the command that caused the error occurred, the device was active or idle.

  After command completion occurred, registers were:
  ER -- ST COUNT  LBA_48  LH LM LL DV DC
  -- -- -- == -- == == == -- -- -- -- --
  84 -- 51 00 7f 00 00 00 29 2b c0 e0 00  Error: ICRC, ABRT 127 sectors at LBA = 0x00292bc0 = 2698176

  Commands leading to the command that caused the error were:
  CR FEATR COUNT  LBA_48  LH LM LL DV DC  Powered_Up_Time  Command/Feature_Name
  -- == -- == -- == == == -- -- -- -- --  ---------------  --------------------
  c8 00 00 00 7f 00 00 00 29 2b c0 e0 00     00:04:52.233  READ DMA
  c8 00 00 00 41 00 00 00 29 c2 38 e0 00     00:04:52.232  READ DMA
  c8 00 00 00 71 00 00 00 f8 cc 78 e0 00     00:04:52.230  READ DMA
  c8 00 00 00 06 00 00 00 2a 40 26 e0 00     00:04:52.228  READ DMA
  c8 00 00 00 7f 00 00 00 2a 3f a7 e0 00     00:04:52.228  READ DMA

Error 6 [5] occurred at disk power-on lifetime: 0 hours (0 days + 0 hours)
  When the command that caused the error occurred, the device was active or idle.

  After command completion occurred, registers were:
  ER -- ST COUNT  LBA_48  LH LM LL DV DC
  -- -- -- == -- == == == -- -- -- -- --
  84 -- 51 00 7f 00 00 00 2b 31 89 e0 00  Error: ICRC, ABRT 127 sectors at LBA = 0x002b3189 = 2830729

  Commands leading to the command that caused the error were:
  CR FEATR COUNT  LBA_48  LH LM LL DV DC  Powered_Up_Time  Command/Feature_Name
  -- == -- == -- == == == -- -- -- -- --  ---------------  --------------------
  c8 00 00 00 7f 00 00 00 2b 31 89 e0 00     00:04:41.784  READ DMA
  c8 00 00 00 7f 00 00 00 2b 31 0a e0 00     00:04:41.783  READ DMA
  c8 00 00 00 7f 00 00 00 2b 30 8b e0 00     00:04:41.783  READ DMA
  c8 00 00 00 7f 00 00 00 2b 30 0c e0 00     00:04:41.782  READ DMA
  c8 00 00 00 7f 00 00 00 2b 2f 8d e0 00     00:04:41.782  READ DMA

SMART Extended Self-test Log Version: 1 (1 sectors)
No self-tests have been logged.  [To run self-tests, use: smartctl -t]

SMART Selective self-test log data structure revision number 0
Note: revision number not 1 implies that no selective self-test has ever been run
 SPAN  MIN_LBA  MAX_LBA  CURRENT_TEST_STATUS
    1        0        0  Not_testing
    2        0        0  Not_testing
    3        0        0  Not_testing
    4        0        0  Not_testing
    5        0        0  Not_testing
Selective self-test flags (0x0):
  After scanning selected spans, do NOT read-scan remainder of disk.
If Selective self-test is pending on power-up, resume after 0 minute delay.

SCT Commands not supported

Device Statistics (GP Log 0x04)
Page  Offset Size        Value Flags Description
0x01  =====  =               =  ===  == General Statistics (rev 1) ==
0x01  0x008  4              13  ---  Lifetime Power-On Resets
0x01  0x010  4               1  ---  Power-on Hours
0x01  0x018  6        64492002  ---  Logical Sectors Written
0x01  0x028  6        23695796  ---  Logical Sectors Read
0x04  =====  =               =  ===  == General Errors Statistics (rev 1) ==
0x04  0x008  4               0  ---  Number of Reported Uncorrectable Errors
0x05  =====  =               =  ===  == Temperature Statistics (rev 1) ==
0x05  0x008  1              33  ---  Current Temperature
0x05  0x020  1              33  ---  Highest Temperature
0x05  0x028  1              33  ---  Lowest Temperature
0x06  =====  =               =  ===  == Transport Statistics (rev 1) ==
0x06  0x008  4             803  ---  Number of Hardware Resets
0x06  0x018  4             743  ---  Number of Interface CRC Errors
0x07  =====  =               =  ===  == Solid State Device Statistics (rev 1) ==
0x07  0x008  1               0  ---  Percentage Used Endurance Indicator
                                |||_ C monitored condition met
                                ||__ D supports DSN
                                |___ N normalized value

Pending Defects log (GP Log 0x0c) not supported

SATA Phy Event Counters (GP Log 0x11)
ID      Size     Value  Description
0x0001  2            0  Command failed due to ICRC error
0x0003  2            0  R_ERR response for device-to-host data FIS
0x0004  2            0  R_ERR response for host-to-device data FIS
0x0006  2            0  R_ERR response for device-to-host non-data FIS
0x0007  2            0  R_ERR response for host-to-device non-data FIS
0x0008  2            0  Device-to-host non-data FIS retries
0x0009  4            3  Transition from drive PhyRdy to drive PhyNRdy
0x000a  4            4  Device-to-host register FISes sent due to a COMRESET
0x000f  2            0  R_ERR response for host-to-device data FIS, CRC
0x0010  2            0  R_ERR response for host-to-device data FIS, non-CRC
0x0012  2            0  R_ERR response for host-to-device non-data FIS, CRC
0x0013  2            0  R_ERR response for host-to-device non-data FIS, non-CRC

