smartctl 7.5 2025-04-30 r5714 [FreeBSD 14.2-RELEASE-p3 amd64] (local build)
Copyright (C) 2002-25, Bruce Allen, Christian Franke, www.smartmontools.org

=== START OF INFORMATION SECTION ===
Model Family:     Intel 545s Series SSDs
Device Model:     INTEL SSDSC2KF512G8 SATA 512GB
Serial Number:    --
LU WWN Device Id: 5 5cd2e4 ...
Firmware Version: LHFD04N
User Capacity:    512,110,190,592 bytes [512 GB]
Sector Size:      512 bytes logical/physical
Rotation Rate:    Solid State Device
Form Factor:      2.5 inches
TRIM Command:     Available, deterministic, zeroed
Device is:        In smartctl database 7.5/5706
ATA Version is:   ACS-3 (minor revision not indicated)
SATA Version is:  SATA 3.2, 6.0 Gb/s (current: 6.0 Gb/s)
Local Time is:    Fri May 23 04:13:45 2025 CEST
SMART support is: Available - device has SMART capability.
SMART support is: Enabled
AAM feature is:   Unavailable
APM level is:     254 (maximum performance)
Rd look-ahead is: Enabled
Write cache is:   Enabled
DSN feature is:   Unavailable
ATA Security is:  Disabled, frozen [SEC2]

=== START OF READ SMART DATA SECTION ===
SMART overall-health self-assessment test result: PASSED

General SMART Values:
Offline data collection status:  (0x00)	Offline data collection activity
					was never started.
					Auto Offline Data Collection: Disabled.
Self-test execution status:      (   0)	The previous self-test routine completed
					without error or no self-test has ever 
					been run.
Total time to complete Offline 
data collection: 		(    0) seconds.
Offline data collection
capabilities: 			 (0x53) SMART execute Offline immediate.
					Auto Offline data collection on/off support.
					Suspend Offline collection upon new
					command.
					No Offline surface scan supported.
					Self-test supported.
					No Conveyance Self-test supported.
					Selective Self-test supported.
SMART capabilities:            (0x0003)	Saves SMART data before entering
					power-saving mode.
					Supports SMART auto save timer.
Error logging capability:        (0x01)	Error logging supported.
					General Purpose Logging supported.
Short self-test routine 
recommended polling time: 	 (   2) minutes.
Extended self-test routine
recommended polling time: 	 (  30) minutes.
SCT capabilities: 	       (0x003d)	SCT Status supported.
					SCT Error Recovery Control supported.
					SCT Feature Control supported.
					SCT Data Table supported.

SMART Attributes Data Structure revision number: 1
Vendor Specific SMART Attributes with Thresholds:
ID# ATTRIBUTE_NAME          FLAGS    VALUE WORST THRESH FAIL RAW_VALUE
  5 Reallocated_Sector_Ct   PO--CK   095   095   010    -    24
  9 Power_On_Hours          -O--CK   100   100   000    -    6395
 12 Power_Cycle_Count       -O--CK   100   100   000    -    70157
170 Unknown_Attribute       PO--CK   097   097   010    -    0
174 Unexpect_Power_Loss_Ct  -O--CK   100   100   000    -    96
175 Program_Fail_Count_Chip PO--CK   050   050   010    -    15
176 Erase_Fail_Count_Chip   PO--CK   100   100   010    -    0
177 Wear_Leveling_Count     PO--CK   095   095   005    -    32006
178 Used_Rsvd_Blk_Cnt_Chip  PO--CK   062   062   010    -    15
179 Used_Rsvd_Blk_Cnt_Tot   PO--CK   098   098   010    -    24
180 Unused_Rsvd_Blk_Cnt_Tot PO--CK   097   097   010    -    1130
181 Program_Fail_Cnt_Total  PO--CK   095   095   010    -    24
182 Erase_Fail_Count_Total  PO--CK   100   100   010    -    0
183 SATA_Downshift_Count    -O--CK   100   100   000    -    0
184 End-to-End_Error        PO--CK   100   100   090    -    0
187 Reported_Uncorrect      -O--CK   100   100   000    -    891270
194 Temperature_Celsius     -O--CK   036   063   000    -    36 (Min/Max 13/63)
195 Hardware_ECC_Recovered  -O--CK   034   034   000    -    168800805260864
199 CRC_Error_Count         -O--CK   100   100   000    -    1
225 Host_Writes_32MiB       -O--CK   100   100   000    -    3793610
226 Workld_Media_Wear_Indic -O--CK   100   100   000    -    0
227 Workld_Host_Reads_Perc  -O--CK   100   100   000    -    0
228 Workload_Minutes        -O--CK   100   100   000    -    0
232 Available_Reservd_Space PO--CK   097   097   010    -    0
233 Media_Wearout_Indicator -O--CK   074   074   000    -    0
238 Unknown_Attribute       -O--CK   074   074   000    -    0
236 Unknown_Attribute       -O--CK   074   074   000    -    0
241 Host_Writes_32MiB       -O--CK   100   100   000    -    3793610
242 Host_Reads_32MiB        -O--CK   100   100   000    -    811721
249 NAND_Writes_1GiB        -O--CK   100   100   000    -    34562
                            ||||||_ K auto-keep
                            |||||__ C event count
                            ||||___ R error rate
                            |||____ S speed/performance
                            ||_____ O updated online
                            |______ P prefailure warning

General Purpose Log Directory Version 1
SMART           Log Directory Version 1 [multi-sector log support]
Address    Access  R/W   Size  Description
0x00       GPL,SL  R/O      1  Log Directory
0x01       GPL,SL  R/O      1  Summary SMART error log
0x02       GPL,SL  R/O      1  Comprehensive SMART error log
0x03       GPL,SL  R/O      1  Ext. Comprehensive SMART error log
0x04       GPL,SL  R/O      8  Device Statistics log
0x06       GPL,SL  R/O      1  SMART self-test log
0x07       GPL,SL  R/O      1  Extended self-test log
0x09       GPL,SL  R/W      1  Selective self-test log
0x10       GPL,SL  R/O      1  NCQ Command Error log
0x11       GPL,SL  R/O      1  SATA Phy Event Counters log
0x30       GPL,SL  R/O      9  IDENTIFY DEVICE data log
0x80-0x9f  GPL,SL  R/W     16  Host vendor specific log
0xdf       GPL,SL  VS       1  Device vendor specific log
0xe0       GPL,SL  R/W      1  SCT Command/Status
0xe1       GPL,SL  R/W      1  SCT Data Transfer

SMART Extended Comprehensive Error Log Version: 1 (1 sectors)
No Errors Logged

SMART Extended Self-test Log Version: 1 (1 sectors)
Num  Test_Description    Status                  Remaining  LifeTime(hours)  LBA_of_first_error
# 1  Short offline       Completed without error       00%         0         -

SMART Selective self-test log data structure revision number 1
 SPAN  MIN_LBA  MAX_LBA  CURRENT_TEST_STATUS
    1        0        0  Not_testing
    2        0        0  Not_testing
    3        0        0  Not_testing
    4        0        0  Not_testing
    5        0        0  Not_testing
Selective self-test flags (0x0):
  After scanning selected spans, do NOT read-scan remainder of disk.
If Selective self-test is pending on power-up, resume after 0 minute delay.

SCT Status Version:                  3
SCT Version (vendor specific):       0 (0x0000)
Device State:                        Active (0)
Current Temperature:                    44 Celsius
Power Cycle Min/Max Temperature:     44/44 Celsius
Lifetime    Min/Max Temperature:     18/74 Celsius
Under/Over Temperature Limit Count:   0/0

SCT Temperature History Version:     2
Temperature Sampling Period:         1 minute
Temperature Logging Interval:        1 minute
Min/Max recommended Temperature:      0/100 Celsius
Min/Max Temperature Limit:            0/100 Celsius
Temperature History Size (Index):    128 (26)

SCT Error Recovery Control:
           Read: Disabled
          Write: Disabled

Device Statistics (GP Log 0x04)
Page  Offset Size        Value Flags Description
0x01  =====  =               =  ===  == General Statistics (rev 1) ==
0x01  0x008  4           70157  ---  Lifetime Power-On Resets
0x01  0x010  4            6395  ---  Power-on Hours
0x01  0x018  6    248618086869  ---  Logical Sectors Written
0x01  0x020  6      3621873973  ---  Number of Write Commands
0x01  0x028  6     53196973387  ---  Logical Sectors Read
0x01  0x030  6      1088845021  ---  Number of Read Commands
0x04  =====  =               =  ===  == General Errors Statistics (rev 1) ==
0x04  0x008  4              76  ---  Number of Reported Uncorrectable Errors
0x04  0x010  4              96  ---  Resets Between Cmd Acceptance and Completion
0x05  =====  =               =  ===  == Temperature Statistics (rev 1) ==
0x05  0x008  1              44  ---  Current Temperature
0x05  0x010  1              26  ---  Average Short Term Temperature
0x05  0x018  1              26  ---  Average Long Term Temperature
0x05  0x020  1              42  ---  Highest Temperature
0x05  0x028  1              17  ---  Lowest Temperature
0x05  0x030  1              29  ---  Highest Average Short Term Temperature
0x05  0x038  1              24  ---  Lowest Average Short Term Temperature
0x05  0x040  1              27  ---  Highest Average Long Term Temperature
0x05  0x048  1               -  ---  Lowest Average Long Term Temperature
0x05  0x050  4               0  ---  Time in Over-Temperature
0x05  0x058  1              85  ---  Specified Maximum Operating Temperature
0x05  0x060  4               0  ---  Time in Under-Temperature
0x05  0x068  1               0  ---  Specified Minimum Operating Temperature
0x06  =====  =               =  ===  == Transport Statistics (rev 1) ==
0x06  0x008  4          211610  ---  Number of Hardware Resets
0x06  0x018  4               1  ---  Number of Interface CRC Errors
0x07  =====  =               =  ===  == Solid State Device Statistics (rev 1) ==
0x07  0x008  1               4  ---  Percentage Used Endurance Indicator
                                |||_ C monitored condition met
                                ||__ D supports DSN
                                |___ N normalized value

Pending Defects log (GP Log 0x0c) not supported

SATA Phy Event Counters (GP Log 0x11)
ID      Size     Value  Description
0x0001  2            0  Command failed due to ICRC error
0x0005  2            0  R_ERR response for non-data FIS
0x000a  2           11  Device-to-host register FISes sent due to a COMRESET

