smartctl 7.3 2022-02-28 r5338 [FreeBSD 13.0-STABLE amd64] (local build)
Copyright (C) 2002-22, Bruce Allen, Christian Franke, www.smartmontools.org

=== START OF INFORMATION SECTION ===
Device Model:     TOSHIBA THNSNH128GBST
Serial Number:    --
LU WWN Device Id: 5 00080d ...
Firmware Version: HTRAN101
User Capacity:    128,035,676,160 bytes [128 GB]
Sector Size:      512 bytes logical/physical
Rotation Rate:    Solid State Device
Form Factor:      2.5 inches
TRIM Command:     Available, deterministic, zeroed
Device is:        Not in smartctl database 7.3/5319
ATA Version is:   ACS-2 (minor revision not indicated)
SATA Version is:  SATA 3.1, 6.0 Gb/s (current: 6.0 Gb/s)
Local Time is:    Sat Jul 23 20:39:48 2022 CEST
SMART support is: Available - device has SMART capability.
SMART support is: Enabled
AAM feature is:   Unavailable
APM level is:     254 (maximum performance)
Rd look-ahead is: Enabled
Write cache is:   Enabled
DSN feature is:   Unavailable
ATA Security is:  Disabled, frozen [SEC2]
Wt Cache Reorder: Enabled

=== START OF READ SMART DATA SECTION ===
SMART overall-health self-assessment test result: PASSED

General SMART Values:
Offline data collection status:  (0x00)	Offline data collection activity
					was never started.
					Auto Offline Data Collection: Disabled.
Self-test execution status:      (   0)	The previous self-test routine completed
					without error or no self-test has ever 
					been run.
Total time to complete Offline 
data collection: 		(  120) seconds.
Offline data collection
capabilities: 			 (0x5b) SMART execute Offline immediate.
					Auto Offline data collection on/off support.
					Suspend Offline collection upon new
					command.
					Offline surface scan supported.
					Self-test supported.
					No Conveyance Self-test supported.
					Selective Self-test supported.
SMART capabilities:            (0x0003)	Saves SMART data before entering
					power-saving mode.
					Supports SMART auto save timer.
Error logging capability:        (0x01)	Error logging supported.
					General Purpose Logging supported.
Short self-test routine 
recommended polling time: 	 (   2) minutes.
Extended self-test routine
recommended polling time: 	 (   8) minutes.
SCT capabilities: 	       (0x0039)	SCT Status supported.
					SCT Error Recovery Control supported.
					SCT Feature Control supported.
					SCT Data Table supported.

SMART Attributes Data Structure revision number: 16
Vendor Specific SMART Attributes with Thresholds:
ID# ATTRIBUTE_NAME          FLAGS    VALUE WORST THRESH FAIL RAW_VALUE
  1 Raw_Read_Error_Rate     -O-R--   100   100   000    -    0
  2 Throughput_Performance  P-S---   100   100   050    -    0
  3 Spin_Up_Time            POS---   100   100   050    -    0
  5 Reallocated_Sector_Ct   PO--C-   100   100   050    -    0
  7 Unknown_SSD_Attribute   PO-R--   100   100   050    -    0
  8 Unknown_SSD_Attribute   P-S---   100   100   050    -    0
  9 Power_On_Hours          -O--C-   100   100   000    -    9946
 10 Unknown_SSD_Attribute   PO--C-   100   100   050    -    0
 12 Power_Cycle_Count       -O--C-   100   100   000    -    2407
167 Unknown_Attribute       -O---K   100   100   000    -    0
168 Unknown_Attribute       -O--C-   100   100   000    -    0
169 Unknown_Attribute       PO--C-   100   100   010    -    100
173 Unknown_Attribute       -O--C-   187   187   000    -    0
175 Program_Fail_Count_Chip PO--C-   100   100   010    -    0
192 Power-Off_Retract_Count -O--C-   100   100   000    -    409
194 Temperature_Celsius     PO---K   067   063   020    -    33 (Min/Max 14/37)
197 Current_Pending_Sector  -O--C-   100   100   000    -    0
240 Unknown_SSD_Attribute   PO--C-   100   100   050    -    0
                            ||||||_ K auto-keep
                            |||||__ C event count
                            ||||___ R error rate
                            |||____ S speed/performance
                            ||_____ O updated online
                            |______ P prefailure warning

General Purpose Log Directory Version 1
SMART           Log Directory Version 1 [multi-sector log support]
Address    Access  R/W   Size  Description
0x00       GPL,SL  R/O      1  Log Directory
0x01           SL  R/O      1  Summary SMART error log
0x02           SL  R/O     51  Comprehensive SMART error log
0x03       GPL     R/O     64  Ext. Comprehensive SMART error log
0x04       GPL,SL  R/O      8  Device Statistics log
0x06           SL  R/O      1  SMART self-test log
0x07       GPL     R/O      1  Extended self-test log
0x09           SL  R/W      1  Selective self-test log
0x10       GPL     R/O      1  NCQ Command Error log
0x11       GPL     R/O      1  SATA Phy Event Counters log
0x30       GPL,SL  R/O      9  IDENTIFY DEVICE data log
0x80-0x9f  GPL,SL  R/W     16  Host vendor specific log
0xe0       GPL,SL  R/W      1  SCT Command/Status
0xe1       GPL,SL  R/W      1  SCT Data Transfer

SMART Extended Comprehensive Error Log Version: 1 (64 sectors)
Device Error Count: 11
	CR     = Command Register
	FEATR  = Features Register
	COUNT  = Count (was: Sector Count) Register
	LBA_48 = Upper bytes of LBA High/Mid/Low Registers ]  ATA-8
	LH     = LBA High (was: Cylinder High) Register    ]   LBA
	LM     = LBA Mid (was: Cylinder Low) Register      ] Register
	LL     = LBA Low (was: Sector Number) Register     ]
	DV     = Device (was: Device/Head) Register
	DC     = Device Control Register
	ER     = Error register
	ST     = Status register
Powered_Up_Time is measured from power on, and printed as
DDd+hh:mm:SS.sss where DD=days, hh=hours, mm=minutes,
SS=sec, and sss=millisec. It "wraps" after 49.710 days.

Error 11 [10] occurred at disk power-on lifetime: 9698 hours (404 days + 2 hours)
  When the command that caused the error occurred, the device was active or idle.

  After command completion occurred, registers were:
  ER -- ST COUNT  LBA_48  LH LM LL DV DC
  -- -- -- == -- == == == -- -- -- -- --
  84 -- 51 00 00 00 00 70 0e 54 80 e5 00  Error: ICRC, ABRT at LBA = 0x750e5480 = 1963873408

  Commands leading to the command that caused the error were:
  CR FEATR COUNT  LBA_48  LH LM LL DV DC  Powered_Up_Time  Command/Feature_Name
  -- == -- == -- == == == -- -- -- -- --  ---------------  --------------------
  ca 00 00 00 00 5f 0a 70 0e 54 80 e5 00     01:19:18.193  WRITE DMA
  ca 00 00 00 08 0e 53 80 5f 0a 70 e0 00     01:19:18.193  WRITE DMA
  ca 00 00 00 00 0e 52 80 0e 53 80 e5 00     01:19:18.192  WRITE DMA
  ca 00 00 00 00 5f 0a f0 0e 52 80 e5 00     01:19:18.192  WRITE DMA
  ca 00 00 00 08 0e 51 80 5f 0a f0 e0 00     01:19:18.191  WRITE DMA

Error 10 [9] occurred at disk power-on lifetime: 7183 hours (299 days + 7 hours)
  When the command that caused the error occurred, the device was active or idle.

  After command completion occurred, registers were:
  ER -- ST COUNT  LBA_48  LH LM LL DV DC
  -- -- -- == -- == == == -- -- -- -- --
  84 -- 51 00 80 00 00 b8 aa 90 38 ee 00  Error: ICRC, ABRT at LBA = 0xbeaa9038 = 3198849080

  Commands leading to the command that caused the error were:
  CR FEATR COUNT  LBA_48  LH LM LL DV DC  Powered_Up_Time  Command/Feature_Name
  -- == -- == -- == == == -- -- -- -- --  ---------------  --------------------
  ca 00 00 00 80 aa 8f b8 aa 90 38 ee 00     00:19:48.671  WRITE DMA
  ca 00 00 00 80 aa 8f 38 aa 8f b8 ee 00     00:19:48.670  WRITE DMA
  ca 00 00 00 80 aa 8e b8 aa 8f 38 ee 00     00:19:48.670  WRITE DMA
  ca 00 00 00 80 aa 8e 38 aa 8e b8 ee 00     00:19:48.669  WRITE DMA
  ca 00 00 00 80 aa 8d b8 aa 8e 38 ee 00     00:19:48.669  WRITE DMA

Error 9 [8] occurred at disk power-on lifetime: 3124 hours (130 days + 4 hours)
  When the command that caused the error occurred, the device was active or idle.

  After command completion occurred, registers were:
  ER -- ST COUNT  LBA_48  LH LM LL DV DC
  -- -- -- == -- == == == -- -- -- -- --
  84 -- 51 00 80 00 00 98 e0 1e 18 ed 00  Error: ICRC, ABRT at LBA = 0x9de01e18 = 2648710680

  Commands leading to the command that caused the error were:
  CR FEATR COUNT  LBA_48  LH LM LL DV DC  Powered_Up_Time  Command/Feature_Name
  -- == -- == -- == == == -- -- -- -- --  ---------------  --------------------
  ca 00 00 00 80 e0 1d 98 e0 1e 18 ed 00     01:35:15.737  WRITE DMA
  ca 00 00 00 80 e0 1d 18 e0 1d 98 ed 00     01:35:15.736  WRITE DMA
  ca 00 00 00 80 e0 1c 98 e0 1d 18 ed 00     01:35:15.734  WRITE DMA
  ca 00 00 00 80 e0 1c 18 e0 1c 98 ed 00     01:35:15.733  WRITE DMA
  ca 00 00 00 80 e0 1b 98 e0 1c 18 ed 00     01:35:15.730  WRITE DMA

Error 8 [7] occurred at disk power-on lifetime: 2924 hours (121 days + 20 hours)
  When the command that caused the error occurred, the device was active or idle.

  After command completion occurred, registers were:
  ER -- ST COUNT  LBA_48  LH LM LL DV DC
  -- -- -- == -- == == == -- -- -- -- --
  84 -- 51 00 00 00 00 98 6a e0 98 e1 00  Error: ICRC, ABRT at LBA = 0x996ae098 = 2573918360

  Commands leading to the command that caused the error were:
  CR FEATR COUNT  LBA_48  LH LM LL DV DC  Powered_Up_Time  Command/Feature_Name
  -- == -- == -- == == == -- -- -- -- --  ---------------  --------------------
  ca 00 00 00 00 6a df 98 6a e0 98 e1 00     00:23:55.573  WRITE DMA
  ca 00 00 00 00 6a de 98 6a df 98 e1 00     00:23:55.570  WRITE DMA
  ca 00 00 00 00 6a dd 98 6a de 98 e1 00     00:23:55.565  WRITE DMA
  ca 00 00 00 00 6a dc 98 6a dd 98 e1 00     00:23:55.564  WRITE DMA
  ca 00 00 00 00 6a db 98 6a dc 98 e1 00     00:23:55.562  WRITE DMA

Error 7 [6] occurred at disk power-on lifetime: 2586 hours (107 days + 18 hours)
  When the command that caused the error occurred, the device was active or idle.

  After command completion occurred, registers were:
  ER -- ST COUNT  LBA_48  LH LM LL DV DC
  -- -- -- == -- == == == -- -- -- -- --
  84 -- 51 00 80 00 00 78 dd 78 f8 ed 00  Error: ICRC, ABRT at LBA = 0x7ddd78f8 = 2111666424

  Commands leading to the command that caused the error were:
  CR FEATR COUNT  LBA_48  LH LM LL DV DC  Powered_Up_Time  Command/Feature_Name
  -- == -- == -- == == == -- -- -- -- --  ---------------  --------------------
  ca 00 00 00 80 dd 78 78 dd 78 f8 ed 00     03:02:39.204  WRITE DMA
  ca 00 00 00 80 dd 77 f8 dd 78 78 ed 00     03:02:39.202  WRITE DMA
  ca 00 00 00 80 dd 77 78 dd 77 f8 ed 00     03:02:39.201  WRITE DMA
  ca 00 00 00 80 dd 76 f8 dd 77 78 ed 00     03:02:39.200  WRITE DMA
  ca 00 00 00 80 dd 76 78 dd 76 f8 ed 00     03:02:39.199  WRITE DMA

Error 6 [5] occurred at disk power-on lifetime: 2566 hours (106 days + 22 hours)
  When the command that caused the error occurred, the device was active or idle.

  After command completion occurred, registers were:
  ER -- ST COUNT  LBA_48  LH LM LL DV DC
  -- -- -- == -- == == == -- -- -- -- --
  84 -- 51 00 00 00 00 60 97 f5 60 e1 00  Error: ICRC, ABRT at LBA = 0x6197f560 = 1637348704

  Commands leading to the command that caused the error were:
  CR FEATR COUNT  LBA_48  LH LM LL DV DC  Powered_Up_Time  Command/Feature_Name
  -- == -- == -- == == == -- -- -- -- --  ---------------  --------------------
  ca 00 00 00 00 97 f4 60 97 f5 60 e1 00     02:30:39.557  WRITE DMA
  ca 00 00 00 00 97 f3 60 97 f4 60 e1 00     02:30:39.556  WRITE DMA
  ca 00 00 00 00 97 f2 60 97 f3 60 e1 00     02:30:39.556  WRITE DMA
  ca 00 00 00 00 97 f1 60 97 f2 60 e1 00     02:30:39.555  WRITE DMA
  ca 00 00 00 00 97 f0 60 97 f1 60 e1 00     02:30:39.555  WRITE DMA

Error 5 [4] occurred at disk power-on lifetime: 2561 hours (106 days + 17 hours)
  When the command that caused the error occurred, the device was active or idle.

  After command completion occurred, registers were:
  ER -- ST COUNT  LBA_48  LH LM LL DV DC
  -- -- -- == -- == == == -- -- -- -- --
  84 -- 51 00 80 00 00 f8 dd 8b 78 ed 00  Error: ICRC, ABRT at LBA = 0xfddd8b78 = 4259154808

  Commands leading to the command that caused the error were:
  CR FEATR COUNT  LBA_48  LH LM LL DV DC  Powered_Up_Time  Command/Feature_Name
  -- == -- == -- == == == -- -- -- -- --  ---------------  --------------------
  ca 00 00 00 80 dd 8a f8 dd 8b 78 ed 00     04:26:13.874  WRITE DMA
  ca 00 00 00 80 dd 8a 78 dd 8a f8 ed 00     04:26:13.873  WRITE DMA
  ca 00 00 00 80 dd 89 f8 dd 8a 78 ed 00     04:26:13.872  WRITE DMA
  ca 00 00 00 80 dd 89 78 dd 89 f8 ed 00     04:26:13.870  WRITE DMA
  ca 00 00 00 80 dd 88 f8 dd 89 78 ed 00     04:26:13.870  WRITE DMA

Error 4 [3] occurred at disk power-on lifetime: 2534 hours (105 days + 14 hours)
  When the command that caused the error occurred, the device was active or idle.

  After command completion occurred, registers were:
  ER -- ST COUNT  LBA_48  LH LM LL DV DC
  -- -- -- == -- == == == -- -- -- -- --
  84 -- 51 00 00 00 00 a0 71 20 a0 e1 00  Error: ICRC, ABRT at LBA = 0xa17120a0 = 2708545696

  Commands leading to the command that caused the error were:
  CR FEATR COUNT  LBA_48  LH LM LL DV DC  Powered_Up_Time  Command/Feature_Name
  -- == -- == -- == == == -- -- -- -- --  ---------------  --------------------
  ca 00 00 00 00 71 1f a0 71 20 a0 e1 00     03:44:47.889  WRITE DMA
  ca 00 00 00 00 71 1e a0 71 1f a0 e1 00     03:44:47.888  WRITE DMA
  ca 00 00 00 00 71 1d a0 71 1e a0 e1 00     03:44:47.888  WRITE DMA
  ca 00 00 00 00 71 1c a0 71 1d a0 e1 00     03:44:47.887  WRITE DMA
  ca 00 00 00 00 71 1b a0 71 1c a0 e1 00     03:44:47.886  WRITE DMA

SMART Extended Self-test Log Version: 1 (1 sectors)
No self-tests have been logged.  [To run self-tests, use: smartctl -t]

SMART Selective self-test log data structure revision number 1
 SPAN  MIN_LBA  MAX_LBA  CURRENT_TEST_STATUS
    1        0        0  Not_testing
    2        0        0  Not_testing
    3        0        0  Not_testing
    4        0        0  Not_testing
    5        0        0  Not_testing
Selective self-test flags (0x0):
  After scanning selected spans, do NOT read-scan remainder of disk.
If Selective self-test is pending on power-up, resume after 0 minute delay.

SCT Status Version:                  3
SCT Version (vendor specific):       3 (0x0003)
Device State:                        Active (0)
Current Temperature:                    33 Celsius
Power Cycle Min/Max Temperature:     33/35 Celsius
Lifetime    Min/Max Temperature:     14/37 Celsius
Specified Max Operating Temperature:    14 Celsius
Under/Over Temperature Limit Count:   0/0
Vendor specific:
00 00 04 00 05 01 00 05 05 00 00 00 00 00 00 00
00 02 00 00 d7 5a 22 02 02 02 00 00 00 00 00 05

SCT Temperature History Version:     2
Temperature Sampling Period:         1 minute
Temperature Logging Interval:        1 minute
Min/Max recommended Temperature:      5/40 Celsius
Min/Max Temperature Limit:            0/80 Celsius
Temperature History Size (Index):    128 (57)

SCT Error Recovery Control:
           Read:    600 (60.0 seconds)
          Write:    600 (60.0 seconds)

Device Statistics (GP Log 0x04)
Page  Offset Size        Value Flags Description
0x01  =====  =               =  ===  == General Statistics (rev 2) ==
0x01  0x008  4            2407  ---  Lifetime Power-On Resets
0x01  0x018  6     13421846647  ---  Logical Sectors Written
0x01  0x020  6       294737723  ---  Number of Write Commands
0x01  0x028  6     34760282639  ---  Logical Sectors Read
0x01  0x030  6       631258652  ---  Number of Read Commands
0x04  =====  =               =  ===  == General Errors Statistics (rev 1) ==
0x04  0x008  4               0  ---  Number of Reported Uncorrectable Errors
0x04  0x010  4               0  ---  Resets Between Cmd Acceptance and Completion
0x05  =====  =               =  ===  == Temperature Statistics (rev 1) ==
0x05  0x008  1              33  ---  Current Temperature
0x05  0x010  1              32  ---  Average Short Term Temperature
0x05  0x018  1              27  ---  Average Long Term Temperature
0x05  0x020  1              34  ---  Highest Temperature
0x05  0x028  1              20  ---  Lowest Temperature
0x05  0x030  1              32  ---  Highest Average Short Term Temperature
0x05  0x038  1              22  ---  Lowest Average Short Term Temperature
0x05  0x040  1              28  ---  Highest Average Long Term Temperature
0x05  0x048  1              25  ---  Lowest Average Long Term Temperature
0x05  0x050  4               0  ---  Time in Over-Temperature
0x05  0x058  1              40  ---  Specified Maximum Operating Temperature
0x05  0x060  4               0  ---  Time in Under-Temperature
0x05  0x068  1               5  ---  Specified Minimum Operating Temperature
0x06  =====  =               =  ===  == Transport Statistics (rev 1) ==
0x06  0x008  4            2252  ---  Number of Hardware Resets
0x06  0x018  4               0  ---  Number of Interface CRC Errors
0x07  =====  =               =  ===  == Solid State Device Statistics (rev 1) ==
0x07  0x008  1              13  N--  Percentage Used Endurance Indicator
                                |||_ C monitored condition met
                                ||__ D supports DSN
                                |___ N normalized value

Pending Defects log (GP Log 0x0c) not supported

SATA Phy Event Counters (GP Log 0x11)
ID      Size     Value  Description
0x0001  2            0  Command failed due to ICRC error
0x0002  4            0  R_ERR response for data FIS
0x0003  2            0  R_ERR response for device-to-host data FIS
0x0004  2            0  R_ERR response for host-to-device data FIS
0x0005  4            0  R_ERR response for non-data FIS
0x0006  2            0  R_ERR response for device-to-host non-data FIS
0x0007  2            0  R_ERR response for host-to-device non-data FIS
0x0008  2            0  Device-to-host non-data FIS retries
0x0009  4           17  Transition from drive PhyRdy to drive PhyNRdy
0x000a  4           18  Device-to-host register FISes sent due to a COMRESET
0x000f  2            0  R_ERR response for host-to-device data FIS, CRC
0x0010  2            0  R_ERR response for host-to-device data FIS, non-CRC
0x0012  2            0  R_ERR response for host-to-device non-data FIS, CRC
0x0013  2            0  R_ERR response for host-to-device non-data FIS, non-CRC

