smartctl 7.2 2020-12-30 r5155 [FreeBSD 13.0-RELEASE amd64] (local build)
Copyright (C) 2002-20, Bruce Allen, Christian Franke, www.smartmontools.org

=== START OF INFORMATION SECTION ===
Model Family:     Western Digital AV-GP (AF)
Device Model:     WDC WD20EURS-63S48Y0
Serial Number:    --
LU WWN Device Id: 5 0014ee ...
Firmware Version: 51.0AB51
User Capacity:    2,000,397,852,160 bytes [2.00 TB]
Sector Sizes:     512 bytes logical, 4096 bytes physical
Device is:        In smartctl database [for details use: -P show]
ATA Version is:   ATA8-ACS (minor revision not indicated)
SATA Version is:  SATA 2.6, 3.0 Gb/s
Local Time is:    Sun Jun 19 21:10:36 2022 EDT
SMART support is: Available - device has SMART capability.
SMART support is: Enabled
AAM level is:     128 (quiet), recommended: 128
APM feature is:   Unavailable
Rd look-ahead is: Enabled
Write cache is:   Enabled
DSN feature is:   Unavailable
ATA Security is:  Disabled, NOT FROZEN [SEC1]
Wt Cache Reorder: Enabled

=== START OF READ SMART DATA SECTION ===
SMART overall-health self-assessment test result: PASSED

General SMART Values:
Offline data collection status:  (0x00)	Offline data collection activity
					was never started.
					Auto Offline Data Collection: Disabled.
Self-test execution status:      (   0)	The previous self-test routine completed
					without error or no self-test has ever 
					been run.
Total time to complete Offline 
data collection: 		(37200) seconds.
Offline data collection
capabilities: 			 (0x7b) SMART execute Offline immediate.
					Auto Offline data collection on/off support.
					Suspend Offline collection upon new
					command.
					Offline surface scan supported.
					Self-test supported.
					Conveyance Self-test supported.
					Selective Self-test supported.
SMART capabilities:            (0x0003)	Saves SMART data before entering
					power-saving mode.
					Supports SMART auto save timer.
Error logging capability:        (0x01)	Error logging supported.
					General Purpose Logging supported.
Short self-test routine 
recommended polling time: 	 (   2) minutes.
Extended self-test routine
recommended polling time: 	 ( 359) minutes.
Conveyance self-test routine
recommended polling time: 	 (   5) minutes.
SCT capabilities: 	       (0x3035)	SCT Status supported.
					SCT Feature Control supported.
					SCT Data Table supported.

SMART Attributes Data Structure revision number: 16
Vendor Specific SMART Attributes with Thresholds:
ID# ATTRIBUTE_NAME          FLAGS    VALUE WORST THRESH FAIL RAW_VALUE
  1 Raw_Read_Error_Rate     POSR-K   200   200   051    -    29
  3 Spin_Up_Time            POS--K   205   157   021    -    4725
  4 Start_Stop_Count        -O--CK   100   100   000    -    958
  5 Reallocated_Sector_Ct   PO--CK   200   200   140    -    0
  7 Seek_Error_Rate         -OSR-K   200   200   000    -    0
  9 Power_On_Hours          -O--CK   001   001   000    -    89286
 10 Spin_Retry_Count        -O--CK   100   100   000    -    0
 11 Calibration_Retry_Count -O--CK   100   100   000    -    0
 12 Power_Cycle_Count       -O--CK   100   100   000    -    839
192 Power-Off_Retract_Count -O--CK   200   200   000    -    687
193 Load_Cycle_Count        -O--CK   200   200   000    -    270
194 Temperature_Celsius     -O---K   109   107   000    -    41
196 Reallocated_Event_Count -O--CK   200   200   000    -    0
197 Current_Pending_Sector  -O--CK   200   200   000    -    1
198 Offline_Uncorrectable   ----CK   100   253   000    -    0
199 UDMA_CRC_Error_Count    -O--CK   200   200   000    -    0
200 Multi_Zone_Error_Rate   ---R--   100   253   000    -    0
                            ||||||_ K auto-keep
                            |||||__ C event count
                            ||||___ R error rate
                            |||____ S speed/performance
                            ||_____ O updated online
                            |______ P prefailure warning

General Purpose Log Directory Version 1
SMART           Log Directory Version 1 [multi-sector log support]
Address    Access  R/W   Size  Description
0x00       GPL,SL  R/O      1  Log Directory
0x01           SL  R/O      1  Summary SMART error log
0x02           SL  R/O      5  Comprehensive SMART error log
0x03       GPL     R/O      6  Ext. Comprehensive SMART error log
0x06           SL  R/O      1  SMART self-test log
0x07       GPL     R/O      1  Extended self-test log
0x09           SL  R/W      1  Selective self-test log
0x10       GPL     R/O      1  NCQ Command Error log
0x11       GPL     R/O      1  SATA Phy Event Counters log
0x21       GPL     R/O      1  Write stream error log
0x22       GPL     R/O      1  Read stream error log
0x80-0x9f  GPL,SL  R/W     16  Host vendor specific log
0xa0-0xa7  GPL,SL  VS      16  Device vendor specific log
0xa8-0xb7  GPL,SL  VS       1  Device vendor specific log
0xbd       GPL,SL  VS       1  Device vendor specific log
0xc0       GPL,SL  VS       1  Device vendor specific log
0xc1       GPL     VS      93  Device vendor specific log
0xe0       GPL,SL  R/W      1  SCT Command/Status
0xe1       GPL,SL  R/W      1  SCT Data Transfer

SMART Extended Comprehensive Error Log Version: 1 (6 sectors)
Device Error Count: 58 (device log contains only the most recent 24 errors)
	CR     = Command Register
	FEATR  = Features Register
	COUNT  = Count (was: Sector Count) Register
	LBA_48 = Upper bytes of LBA High/Mid/Low Registers ]  ATA-8
	LH     = LBA High (was: Cylinder High) Register    ]   LBA
	LM     = LBA Mid (was: Cylinder Low) Register      ] Register
	LL     = LBA Low (was: Sector Number) Register     ]
	DV     = Device (was: Device/Head) Register
	DC     = Device Control Register
	ER     = Error register
	ST     = Status register
Powered_Up_Time is measured from power on, and printed as
DDd+hh:mm:SS.sss where DD=days, hh=hours, mm=minutes,
SS=sec, and sss=millisec. It "wraps" after 49.710 days.

Error 58 [9] occurred at disk power-on lifetime: 23525 hours (980 days + 5 hours)
  When the command that caused the error occurred, the device was active or idle.

  After command completion occurred, registers were:
  ER -- ST COUNT  LBA_48  LH LM LL DV DC
  -- -- -- == -- == == == -- -- -- -- --
  40 -- 51 00 00 00 00 28 4e bd 88 40 00  Error: UNC at LBA = 0x284ebd88 = 676248968

  Commands leading to the command that caused the error were:
  CR FEATR COUNT  LBA_48  LH LM LL DV DC  Powered_Up_Time  Command/Feature_Name
  -- == -- == -- == == == -- -- -- -- --  ---------------  --------------------
  60 01 00 00 98 00 00 28 4e c0 40 40 00     10:53:48.898  READ FPDMA QUEUED
  60 01 00 00 90 00 00 28 4e bf 40 40 00     10:53:48.898  READ FPDMA QUEUED
  60 01 00 00 88 00 00 28 4e be 40 40 00     10:53:48.898  READ FPDMA QUEUED
  60 01 00 00 80 00 00 28 4e bd 40 40 00     10:53:48.898  READ FPDMA QUEUED
  60 01 00 00 78 00 00 28 4e bc 40 40 00     10:53:48.898  READ FPDMA QUEUED

Error 57 [8] occurred at disk power-on lifetime: 23525 hours (980 days + 5 hours)
  When the command that caused the error occurred, the device was active or idle.

  After command completion occurred, registers were:
  ER -- ST COUNT  LBA_48  LH LM LL DV DC
  -- -- -- == -- == == == -- -- -- -- --
  40 -- 51 00 00 00 00 28 4e bd 88 40 00  Error: UNC at LBA = 0x284ebd88 = 676248968

  Commands leading to the command that caused the error were:
  CR FEATR COUNT  LBA_48  LH LM LL DV DC  Powered_Up_Time  Command/Feature_Name
  -- == -- == -- == == == -- -- -- -- --  ---------------  --------------------
  60 01 00 00 50 00 00 28 4e c0 40 40 00     10:52:55.632  READ FPDMA QUEUED
  60 01 00 00 48 00 00 28 4e bf 40 40 00     10:52:55.632  READ FPDMA QUEUED
  60 01 00 00 40 00 00 28 4e be 40 40 00     10:52:55.632  READ FPDMA QUEUED
  60 01 00 00 38 00 00 28 4e bd 40 40 00     10:52:55.632  READ FPDMA QUEUED
  60 01 00 00 30 00 00 28 4e bc 40 40 00     10:52:55.632  READ FPDMA QUEUED

Error 56 [7] occurred at disk power-on lifetime: 23519 hours (979 days + 23 hours)
  When the command that caused the error occurred, the device was active or idle.

  After command completion occurred, registers were:
  ER -- ST COUNT  LBA_48  LH LM LL DV DC
  -- -- -- == -- == == == -- -- -- -- --
  40 -- 51 00 00 00 00 28 4e bd 88 40 00  Error: UNC at LBA = 0x284ebd88 = 676248968

  Commands leading to the command that caused the error were:
  CR FEATR COUNT  LBA_48  LH LM LL DV DC  Powered_Up_Time  Command/Feature_Name
  -- == -- == -- == == == -- -- -- -- --  ---------------  --------------------
  60 01 00 00 20 00 00 28 4e c0 40 40 00     05:08:33.818  READ FPDMA QUEUED
  60 01 00 00 18 00 00 28 4e bf 40 40 00     05:08:33.818  READ FPDMA QUEUED
  60 01 00 00 10 00 00 28 4e be 40 40 00     05:08:33.818  READ FPDMA QUEUED
  60 01 00 00 08 00 00 28 4e bd 40 40 00     05:08:33.818  READ FPDMA QUEUED
  60 01 00 00 f8 00 00 28 4e bc 40 40 00     05:08:33.818  READ FPDMA QUEUED

Error 55 [6] occurred at disk power-on lifetime: 23519 hours (979 days + 23 hours)
  When the command that caused the error occurred, the device was active or idle.

  After command completion occurred, registers were:
  ER -- ST COUNT  LBA_48  LH LM LL DV DC
  -- -- -- == -- == == == -- -- -- -- --
  40 -- 51 00 00 00 00 28 4e bd 88 40 00  Error: UNC at LBA = 0x284ebd88 = 676248968

  Commands leading to the command that caused the error were:
  CR FEATR COUNT  LBA_48  LH LM LL DV DC  Powered_Up_Time  Command/Feature_Name
  -- == -- == -- == == == -- -- -- -- --  ---------------  --------------------
  60 01 00 00 28 00 00 28 4e c0 40 40 00     05:06:38.610  READ FPDMA QUEUED
  60 01 00 00 20 00 00 28 4e bf 40 40 00     05:06:38.610  READ FPDMA QUEUED
  60 01 00 00 18 00 00 28 4e be 40 40 00     05:06:38.610  READ FPDMA QUEUED
  60 01 00 00 10 00 00 28 4e bd 40 40 00     05:06:38.610  READ FPDMA QUEUED
  60 01 00 00 08 00 00 28 4e bc 40 40 00     05:06:38.610  READ FPDMA QUEUED

Error 54 [5] occurred at disk power-on lifetime: 23470 hours (977 days + 22 hours)
  When the command that caused the error occurred, the device was active or idle.

  After command completion occurred, registers were:
  ER -- ST COUNT  LBA_48  LH LM LL DV DC
  -- -- -- == -- == == == -- -- -- -- --
  40 -- 51 00 00 00 00 28 4e bd 88 40 00  Error: UNC at LBA = 0x284ebd88 = 676248968

  Commands leading to the command that caused the error were:
  CR FEATR COUNT  LBA_48  LH LM LL DV DC  Powered_Up_Time  Command/Feature_Name
  -- == -- == -- == == == -- -- -- -- --  ---------------  --------------------
  60 01 00 00 58 00 00 28 4e c0 40 40 00     12:30:55.657  READ FPDMA QUEUED
  60 01 00 00 50 00 00 28 4e bf 40 40 00     12:30:55.657  READ FPDMA QUEUED
  60 01 00 00 48 00 00 28 4e be 40 40 00     12:30:55.657  READ FPDMA QUEUED
  60 01 00 00 40 00 00 28 4e bd 40 40 00     12:30:55.657  READ FPDMA QUEUED
  60 01 00 00 38 00 00 28 4e bc 40 40 00     12:30:55.657  READ FPDMA QUEUED

Error 53 [4] occurred at disk power-on lifetime: 23470 hours (977 days + 22 hours)
  When the command that caused the error occurred, the device was active or idle.

  After command completion occurred, registers were:
  ER -- ST COUNT  LBA_48  LH LM LL DV DC
  -- -- -- == -- == == == -- -- -- -- --
  40 -- 51 00 00 00 00 28 4e bd 88 40 00  Error: UNC at LBA = 0x284ebd88 = 676248968

  Commands leading to the command that caused the error were:
  CR FEATR COUNT  LBA_48  LH LM LL DV DC  Powered_Up_Time  Command/Feature_Name
  -- == -- == -- == == == -- -- -- -- --  ---------------  --------------------
  60 01 00 00 38 00 00 28 4e c0 40 40 00     12:30:52.359  READ FPDMA QUEUED
  60 01 00 00 30 00 00 28 4e bf 40 40 00     12:30:52.359  READ FPDMA QUEUED
  60 01 00 00 28 00 00 28 4e be 40 40 00     12:30:52.359  READ FPDMA QUEUED
  60 01 00 00 20 00 00 28 4e bd 40 40 00     12:30:52.359  READ FPDMA QUEUED
  60 01 00 00 18 00 00 28 4e bc 40 40 00     12:30:52.359  READ FPDMA QUEUED

Error 52 [3] occurred at disk power-on lifetime: 23470 hours (977 days + 22 hours)
  When the command that caused the error occurred, the device was active or idle.

  After command completion occurred, registers were:
  ER -- ST COUNT  LBA_48  LH LM LL DV DC
  -- -- -- == -- == == == -- -- -- -- --
  40 -- 51 00 00 00 00 28 4e bd 88 40 00  Error: UNC at LBA = 0x284ebd88 = 676248968

  Commands leading to the command that caused the error were:
  CR FEATR COUNT  LBA_48  LH LM LL DV DC  Powered_Up_Time  Command/Feature_Name
  -- == -- == -- == == == -- -- -- -- --  ---------------  --------------------
  60 01 00 00 90 00 00 28 4e c0 40 40 00     12:06:21.834  READ FPDMA QUEUED
  60 01 00 00 88 00 00 28 4e bf 40 40 00     12:06:21.834  READ FPDMA QUEUED
  60 01 00 00 80 00 00 28 4e be 40 40 00     12:06:21.834  READ FPDMA QUEUED
  60 01 00 00 78 00 00 28 4e bd 40 40 00     12:06:21.834  READ FPDMA QUEUED
  60 01 00 00 70 00 00 28 4e bc 40 40 00     12:06:21.834  READ FPDMA QUEUED

Error 51 [2] occurred at disk power-on lifetime: 23469 hours (977 days + 21 hours)
  When the command that caused the error occurred, the device was active or idle.

  After command completion occurred, registers were:
  ER -- ST COUNT  LBA_48  LH LM LL DV DC
  -- -- -- == -- == == == -- -- -- -- --
  40 -- 51 00 00 00 00 28 4e bd 88 40 00  Error: UNC at LBA = 0x284ebd88 = 676248968

  Commands leading to the command that caused the error were:
  CR FEATR COUNT  LBA_48  LH LM LL DV DC  Powered_Up_Time  Command/Feature_Name
  -- == -- == -- == == == -- -- -- -- --  ---------------  --------------------
  60 01 00 00 b0 00 00 28 4e c0 40 40 00     11:38:51.402  READ FPDMA QUEUED
  60 01 00 00 a8 00 00 28 4e bf 40 40 00     11:38:51.402  READ FPDMA QUEUED
  60 01 00 00 a0 00 00 28 4e be 40 40 00     11:38:51.402  READ FPDMA QUEUED
  60 01 00 00 98 00 00 28 4e bd 40 40 00     11:38:51.402  READ FPDMA QUEUED
  60 01 00 00 90 00 00 28 4e bc 40 40 00     11:38:51.401  READ FPDMA QUEUED

SMART Extended Self-test Log Version: 1 (1 sectors)
No self-tests have been logged.  [To run self-tests, use: smartctl -t]

SMART Selective self-test log data structure revision number 1
 SPAN  MIN_LBA  MAX_LBA  CURRENT_TEST_STATUS
    1        0        0  Not_testing
    2        0        0  Not_testing
    3        0        0  Not_testing
    4        0        0  Not_testing
    5        0        0  Not_testing
Selective self-test flags (0x0):
  After scanning selected spans, do NOT read-scan remainder of disk.
If Selective self-test is pending on power-up, resume after 0 minute delay.

SCT Status Version:                  3
SCT Version (vendor specific):       258 (0x0102)
Device State:                        Active (0)
Current Temperature:                    41 Celsius
Power Cycle Min/Max Temperature:     41/41 Celsius
Lifetime    Min/Max Temperature:      0/43 Celsius
Under/Over Temperature Limit Count:   0/0

SCT Temperature History Version:     2
Temperature Sampling Period:         1 minute
Temperature Logging Interval:        1 minute
Min/Max recommended Temperature:      0/60 Celsius
Min/Max Temperature Limit:           -41/85 Celsius
Temperature History Size (Index):    478 (440)

SCT Error Recovery Control command not supported

Device Statistics (GP/SMART Log 0x04) not supported

Pending Defects log (GP Log 0x0c) not supported

SATA Phy Event Counters (GP Log 0x11)
ID      Size     Value  Description
0x0001  2            0  Command failed due to ICRC error
0x0002  2            0  R_ERR response for data FIS
0x0003  2            0  R_ERR response for device-to-host data FIS
0x0004  2            0  R_ERR response for host-to-device data FIS
0x0005  2            0  R_ERR response for non-data FIS
0x0006  2            0  R_ERR response for device-to-host non-data FIS
0x0007  2            0  R_ERR response for host-to-device non-data FIS
0x000a  2            4  Device-to-host register FISes sent due to a COMRESET
0x000b  2            0  CRC errors within host-to-device FIS
0x8000  4         2837  Vendor specific



