smartctl 7.2 2020-12-30 r5155 [FreeBSD 13.0-RELEASE amd64] (local build)
Copyright (C) 2002-20, Bruce Allen, Christian Franke, www.smartmontools.org

=== START OF INFORMATION SECTION ===
Model Family:     SAMSUNG SpinPoint P80
Device Model:     SAMSUNG SP0812C
Serial Number:    --
Firmware Version: SU100-32
User Capacity:    80,026,361,856 bytes [80.0 GB]
Sector Size:      512 bytes logical/physical
Device is:        In smartctl database [for details use: -P show]
ATA Version is:   ATA/ATAPI-7 T13/1532D revision 0
Local Time is:    Sun Mar  6 16:23:46 2022 EST
SMART support is: Available - device has SMART capability.
SMART support is: Enabled
AAM feature is:   Unavailable
APM feature is:   Unavailable
Rd look-ahead is: Enabled
Write cache is:   Enabled
DSN feature is:   Unavailable
ATA Security is:  Unavailable
Wt Cache Reorder: Unavailable

=== START OF READ SMART DATA SECTION ===
SMART overall-health self-assessment test result: PASSED

General SMART Values:
Offline data collection status:  (0x82)	Offline data collection activity
					was completed without error.
					Auto Offline Data Collection: Enabled.
Self-test execution status:      (  22)	The self-test routine was aborted by
					the host.
Total time to complete Offline 
data collection: 		( 3000) seconds.
Offline data collection
capabilities: 			 (0x1b) SMART execute Offline immediate.
					Auto Offline data collection on/off support.
					Suspend Offline collection upon new
					command.
					Offline surface scan supported.
					Self-test supported.
					No Conveyance Self-test supported.
					No Selective Self-test supported.
SMART capabilities:            (0x0003)	Saves SMART data before entering
					power-saving mode.
					Supports SMART auto save timer.
Error logging capability:        (0x01)	Error logging supported.
					No General Purpose Logging support.
Short self-test routine 
recommended polling time: 	 (   1) minutes.
Extended self-test routine
recommended polling time: 	 (  50) minutes.

SMART Attributes Data Structure revision number: 16
Vendor Specific SMART Attributes with Thresholds:
ID# ATTRIBUTE_NAME          FLAGS    VALUE WORST THRESH FAIL RAW_VALUE
  1 Raw_Read_Error_Rate     POSR--   100   100   051    -    0
  3 Spin_Up_Time            POS---   100   100   025    -    4160
  4 Start_Stop_Count        -O--CK   100   100   000    -    636
  5 Reallocated_Sector_Ct   PO--CK   100   100   011    -    0
  7 Seek_Error_Rate         POSR--   100   100   051    -    0
  8 Seek_Time_Performance   P-S--K   100   100   015    -    0
  9 Power_On_Half_Minutes   -O--CK   099   099   000    -    5622h+14m
 10 Spin_Retry_Count        PO--CK   100   100   051    -    0
 11 Calibration_Retry_Count -O--C-   100   100   000    -    0
 12 Power_Cycle_Count       -O--CK   100   100   000    -    367
194 Temperature_Celsius     -O---K   124   061   000    -    38
195 Hardware_ECC_Recovered  -O-RC-   100   100   000    -    72346
196 Reallocated_Event_Count -O--CK   100   100   000    -    0
197 Current_Pending_Sector  -O--C-   100   100   000    -    0
198 Total_Offl_Uncorrectabl ----CK   100   100   000    -    0
199 UDMA_CRC_Error_Count    -OSRCK   200   200   000    -    0
200 Multi_Zone_Error_Rate   -O-R--   100   100   051    -    0
201 Soft_Read_Error_Rate    -O-R--   100   100   051    -    0
                            ||||||_ K auto-keep
                            |||||__ C event count
                            ||||___ R error rate
                            |||____ S speed/performance
                            ||_____ O updated online
                            |______ P prefailure warning

General Purpose Log Directory not supported

SMART Log Directory Version 1 [multi-sector log support]
Address    Access  R/W   Size  Description
0x00           SL  R/O      1  Log Directory
0x01           SL  R/O      1  Summary SMART error log
0x02           SL  R/O      2  Comprehensive SMART error log
0x06           SL  R/O      2  SMART self-test log
0x80-0x9f      SL  R/W     16  Host vendor specific log

SMART Extended Comprehensive Error Log (GP Log 0x03) not supported

SMART Error Log Version: 1
ATA Error Count: 541 (device log contains only the most recent five errors)
	CR = Command Register [HEX]
	FR = Features Register [HEX]
	SC = Sector Count Register [HEX]
	SN = Sector Number Register [HEX]
	CL = Cylinder Low Register [HEX]
	CH = Cylinder High Register [HEX]
	DH = Device/Head Register [HEX]
	DC = Device Command Register [HEX]
	ER = Error register [HEX]
	ST = Status register [HEX]
Powered_Up_Time is measured from power on, and printed as
DDd+hh:mm:SS.sss where DD=days, hh=hours, mm=minutes,
SS=sec, and sss=millisec. It "wraps" after 49.710 days.

Error 541 occurred at disk power-on lifetime: 5620 hours (234 days + 4 hours)
  When the command that caused the error occurred, the device was active or idle.

  After command completion occurred, registers were:
  ER ST SC SN CL CH DH
  -- -- -- -- -- -- --
  04 51 00 00 00 00 a0

  Commands leading to the command that caused the error were:
  CR FR SC SN CL CH DH DC   Powered_Up_Time  Command/Feature_Name
  -- -- -- -- -- -- -- --  ----------------  --------------------
  f5 00 00 00 00 00 a0 00      00:01:53.813  SECURITY FREEZE LOCK
  ef 02 00 00 00 00 a0 00      00:01:53.813  SET FEATURES [Enable write cache]
  ef aa 00 00 00 00 a0 00      00:01:53.813  SET FEATURES [Enable read look-ahead]
  ef 03 45 00 00 00 a0 00      00:01:53.813  SET FEATURES [Set transfer mode]
  ef 03 22 00 00 00 a0 00      00:01:53.813  SET FEATURES [Set transfer mode]

Error 540 occurred at disk power-on lifetime: 5620 hours (234 days + 4 hours)
  When the command that caused the error occurred, the device was active or idle.

  After command completion occurred, registers were:
  ER ST SC SN CL CH DH
  -- -- -- -- -- -- --
  04 51 00 00 00 00 a0

  Commands leading to the command that caused the error were:
  CR FR SC SN CL CH DH DC   Powered_Up_Time  Command/Feature_Name
  -- -- -- -- -- -- -- --  ----------------  --------------------
  f5 00 00 00 00 00 a0 00      00:01:53.063  SECURITY FREEZE LOCK
  ef 02 00 00 00 00 a0 00      00:01:53.063  SET FEATURES [Enable write cache]
  ef aa 00 00 00 00 a0 00      00:01:53.063  SET FEATURES [Enable read look-ahead]
  ef 03 45 00 00 00 a0 00      00:01:53.063  SET FEATURES [Set transfer mode]
  ef 03 22 00 00 00 a0 00      00:01:53.063  SET FEATURES [Set transfer mode]

Error 539 occurred at disk power-on lifetime: 5620 hours (234 days + 4 hours)
  When the command that caused the error occurred, the device was active or idle.

  After command completion occurred, registers were:
  ER ST SC SN CL CH DH
  -- -- -- -- -- -- --
  04 51 00 00 00 00 a0

  Commands leading to the command that caused the error were:
  CR FR SC SN CL CH DH DC   Powered_Up_Time  Command/Feature_Name
  -- -- -- -- -- -- -- --  ----------------  --------------------
  f5 00 00 00 00 00 a0 00      01:32:54.313  SECURITY FREEZE LOCK
  ef 02 00 00 00 00 a0 00      01:32:54.313  SET FEATURES [Enable write cache]
  ef aa 00 00 00 00 a0 00      01:32:54.313  SET FEATURES [Enable read look-ahead]
  ef 03 45 00 00 00 a0 00      01:32:54.313  SET FEATURES [Set transfer mode]
  ef 03 22 00 00 00 a0 00      01:32:54.313  SET FEATURES [Set transfer mode]

Error 538 occurred at disk power-on lifetime: 5619 hours (234 days + 3 hours)
  When the command that caused the error occurred, the device was active or idle.

  After command completion occurred, registers were:
  ER ST SC SN CL CH DH
  -- -- -- -- -- -- --
  04 51 00 00 00 00 a0

  Commands leading to the command that caused the error were:
  CR FR SC SN CL CH DH DC   Powered_Up_Time  Command/Feature_Name
  -- -- -- -- -- -- -- --  ----------------  --------------------
  f5 00 00 00 00 00 a0 00      00:14:53.688  SECURITY FREEZE LOCK
  ef 02 00 00 00 00 a0 00      00:14:53.688  SET FEATURES [Enable write cache]
  ef aa 00 00 00 00 a0 00      00:14:53.688  SET FEATURES [Enable read look-ahead]
  ef 03 45 00 00 00 a0 00      00:14:53.688  SET FEATURES [Set transfer mode]
  ef 03 22 00 00 00 a0 00      00:14:53.688  SET FEATURES [Set transfer mode]

Error 537 occurred at disk power-on lifetime: 5619 hours (234 days + 3 hours)
  When the command that caused the error occurred, the device was active or idle.

  After command completion occurred, registers were:
  ER ST SC SN CL CH DH
  -- -- -- -- -- -- --
  04 51 00 00 00 00 a0

  Commands leading to the command that caused the error were:
  CR FR SC SN CL CH DH DC   Powered_Up_Time  Command/Feature_Name
  -- -- -- -- -- -- -- --  ----------------  --------------------
  f5 00 00 00 00 00 a0 00      00:02:10.250  SECURITY FREEZE LOCK
  ef 02 00 00 00 00 a0 00      00:02:10.250  SET FEATURES [Enable write cache]
  ef aa 00 00 00 00 a0 00      00:02:10.250  SET FEATURES [Enable read look-ahead]
  ef 03 45 00 00 00 a0 00      00:02:10.250  SET FEATURES [Set transfer mode]
  ef 03 22 00 00 00 a0 00      00:02:10.250  SET FEATURES [Set transfer mode]

SMART Extended Self-test Log (GP Log 0x07) not supported

SMART Self-test log structure revision number 1
Num  Test_Description    Status                  Remaining  LifeTime(hours)  LBA_of_first_error
# 1  Abort offline test  Aborted by host               60%         0         -

Selective Self-tests/Logging not supported

SCT Commands not supported

Device Statistics (GP/SMART Log 0x04) not supported

Pending Defects log (GP Log 0x0c) not supported

SATA Phy Event Counters (GP Log 0x11) not supported

