smartctl 7.4 2023-08-01 r5530 [FreeBSD 13.2-RELEASE-p7 amd64] (local build)
Copyright (C) 2002-23, Bruce Allen, Christian Franke, www.smartmontools.org

=== START OF INFORMATION SECTION ===
Device Model:     HFS064G3AMNB-2200A
Serial Number:    --
Firmware Version: 10108L00
User Capacity:    64,023,257,088 bytes [64.0 GB]
Sector Size:      512 bytes logical/physical
Rotation Rate:    Solid State Device
TRIM Command:     Available
Device is:        Not in smartctl database 7.3/5528
ATA Version is:   ATA8-ACS (minor revision not indicated)
SATA Version is:  SATA 3.1, 6.0 Gb/s (current: 3.0 Gb/s)
Local Time is:    Mon Dec 25 14:12:02 2023 EET
SMART support is: Available - device has SMART capability.
SMART support is: Enabled
AAM feature is:   Unavailable
APM feature is:   Disabled
Rd look-ahead is: Enabled
Write cache is:   Enabled
DSN feature is:   Unavailable
ATA Security is:  Disabled, frozen [SEC2]
Wt Cache Reorder: Unavailable

=== START OF READ SMART DATA SECTION ===
SMART overall-health self-assessment test result: PASSED

General SMART Values:
Offline data collection status:  (0x02)	Offline data collection activity
					was completed without error.
					Auto Offline Data Collection: Disabled.
Self-test execution status:      (   0)	The previous self-test routine completed
					without error or no self-test has ever 
					been run.
Total time to complete Offline 
data collection: 		(   18) seconds.
Offline data collection
capabilities: 			 (0x19) SMART execute Offline immediate.
					No Auto Offline data collection support.
					Suspend Offline collection upon new
					command.
					Offline surface scan supported.
					Self-test supported.
					No Conveyance Self-test supported.
					No Selective Self-test supported.
SMART capabilities:            (0x0002)	Does not save SMART data before
					entering power-saving mode.
					Supports SMART auto save timer.
Error logging capability:        (0x01)	Error logging supported.
					General Purpose Logging supported.
Short self-test routine 
recommended polling time: 	 (   1) minutes.
Extended self-test routine
recommended polling time: 	 (   4) minutes.

SMART Attributes Data Structure revision number: 0
Vendor Specific SMART Attributes with Thresholds:
ID# ATTRIBUTE_NAME          FLAGS    VALUE WORST THRESH FAIL RAW_VALUE
  1 Raw_Read_Error_Rate     POSR--   166   166   006    -    0
  5 Reallocated_Sector_Ct   -O--CK   100   100   036    -    4
  9 Power_On_Hours          -O--CK   065   065   000    -    31220
 12 Power_Cycle_Count       -O--CK   100   100   020    -    52
100 Unknown_Attribute       -O--CK   100   100   000    -    40253753
171 Unknown_Attribute       -O--CK   253   253   000    -    0
172 Unknown_Attribute       -O--CK   253   253   000    -    0
174 Unknown_Attribute       ----CK   100   100   000    -    39
175 Program_Fail_Count_Chip -O--CK   253   253   000    -    0
176 Erase_Fail_Count_Chip   -O--CK   253   253   000    -    0
177 Wear_Leveling_Count     -O--CK   100   100   000    -    39726128
178 Used_Rsvd_Blk_Cnt_Chip  -O--CK   100   100   000    -    6
179 Used_Rsvd_Blk_Cnt_Tot   -O--CK   100   100   000    -    19
180 Unused_Rsvd_Blk_Cnt_Tot -O--CK   100   100   000    -    1069
181 Program_Fail_Cnt_Total  -O--CK   253   253   000    -    0
182 Erase_Fail_Count_Total  -O--CK   253   253   000    -    0
183 Runtime_Bad_Block       -O--CK   100   100   000    -    2
187 Reported_Uncorrect      -O--CK   100   100   000    -    9
188 Command_Timeout         -O--CK   253   253   000    -    0
191 Unknown_SSD_Attribute   -O--CK   253   253   000    -    0
194 Temperature_Celsius     -O----   053   000   000    -    53 (Min/Max 27/57)
195 Hardware_ECC_Recovered  -O--CK   100   100   000    -    110337552
201 Unknown_SSD_Attribute   -OSR--   100   100   000    -    0
204 Soft_ECC_Correction     -OSR--   100   100   ---    -    2
231 Unknown_SSD_Attribute   PO--CK   082   082   ---    -    19
234 Unknown_Attribute       -O--CK   100   100   ---    -    154789
241 Total_LBAs_Written      -O--CK   100   100   ---    -    37382
242 Total_LBAs_Read         -O--CK   100   100   ---    -    473
250 Read_Error_Retry_Rate   -O--CK   100   100   ---    -    24357
                            ||||||_ K auto-keep
                            |||||__ C event count
                            ||||___ R error rate
                            |||____ S speed/performance
                            ||_____ O updated online
                            |______ P prefailure warning

General Purpose Log Directory Version 1
SMART           Log Directory Version 1 [multi-sector log support]
Address    Access  R/W   Size  Description
0x00       GPL,SL  R/O      1  Log Directory
0x01           SL  R/O      1  Summary SMART error log
0x02           SL  R/O      4  Comprehensive SMART error log
0x03       GPL     R/O      5  Ext. Comprehensive SMART error log
0x04       GPL,SL  R/O      8  Device Statistics log
0x06           SL  R/O      1  SMART self-test log
0x07       GPL     R/O      2  Extended self-test log
0x10       GPL     R/O      1  NCQ Command Error log
0x11       GPL     R/O      1  SATA Phy Event Counters log
0x80-0x9f  GPL,SL  R/W     16  Host vendor specific log

SMART Extended Comprehensive Error Log Version: 1 (5 sectors)
Device Error Count: 4174 (device log contains only the most recent 20 errors)
	CR     = Command Register
	FEATR  = Features Register
	COUNT  = Count (was: Sector Count) Register
	LBA_48 = Upper bytes of LBA High/Mid/Low Registers ]  ATA-8
	LH     = LBA High (was: Cylinder High) Register    ]   LBA
	LM     = LBA Mid (was: Cylinder Low) Register      ] Register
	LL     = LBA Low (was: Sector Number) Register     ]
	DV     = Device (was: Device/Head) Register
	DC     = Device Control Register
	ER     = Error register
	ST     = Status register
Powered_Up_Time is measured from power on, and printed as
DDd+hh:mm:SS.sss where DD=days, hh=hours, mm=minutes,
SS=sec, and sss=millisec. It "wraps" after 49.710 days.

Error 4174 [13] occurred at disk power-on lifetime: 31219 hours (1300 days + 19 hours)
  When the command that caused the error occurred, the device was in an unknown state.

  After command completion occurred, registers were:
  ER -- ST COUNT  LBA_48  LH LM LL DV DC
  -- -- -- == -- == == == -- -- -- -- --
  01 -- 50 00 01 00 00 00 00 00 01 00 00

  Commands leading to the command that caused the error were:
  CR FEATR COUNT  LBA_48  LH LM LL DV DC  Powered_Up_Time  Command/Feature_Name
  -- == -- == -- == == == -- -- -- -- --  ---------------  --------------------
  00 00 00 00 00 00 00 00 00 00 00 00 00 16d+03:42:10.290  NOP [Abort queued commands]
  00 00 00 00 00 00 00 00 00 00 00 00 00 16d+03:42:10.290  NOP [Abort queued commands]
  25 00 00 00 01 00 00 01 4e a9 10 40 40 16d+03:41:53.840  READ DMA EXT
  25 00 00 00 38 00 00 03 5e 88 90 40 40 16d+03:41:53.810  READ DMA EXT
  25 00 00 00 08 00 00 03 4b 5e d8 40 40 16d+03:41:53.800  READ DMA EXT

Error 4173 [12] occurred at disk power-on lifetime: 31219 hours (1300 days + 19 hours)
  When the command that caused the error occurred, the device was in an unknown state.

  After command completion occurred, registers were:
  ER -- ST COUNT  LBA_48  LH LM LL DV DC
  -- -- -- == -- == == == -- -- -- -- --
  00 -- 00 00 00 00 00 00 00 00 00 00 ff   at LBA = 0x00000000 = 0

  Commands leading to the command that caused the error were:
  CR FEATR COUNT  LBA_48  LH LM LL DV DC  Powered_Up_Time  Command/Feature_Name
  -- == -- == -- == == == -- -- -- -- --  ---------------  --------------------
  25 00 00 00 01 00 00 01 4e a9 10 40 40 16d+03:41:53.840  READ DMA EXT
  25 00 00 00 38 00 00 03 5e 88 90 40 40 16d+03:41:53.810  READ DMA EXT
  25 00 00 00 08 00 00 03 4b 5e d8 40 40 16d+03:41:53.800  READ DMA EXT
  25 00 00 00 10 00 00 03 67 fe 60 40 40 16d+03:41:53.790  READ DMA EXT
  25 00 00 00 08 00 00 03 4b 71 c0 40 40 16d+03:41:53.780  READ DMA EXT

Error 4172 [11] occurred at disk power-on lifetime: 31219 hours (1300 days + 19 hours)
  When the command that caused the error occurred, the device was in an unknown state.

  After command completion occurred, registers were:
  ER -- ST COUNT  LBA_48  LH LM LL DV DC
  -- -- -- == -- == == == -- -- -- -- --
  00 -- 00 00 00 00 00 00 00 00 00 00 ff   at LBA = 0x00000000 = 0

  Commands leading to the command that caused the error were:
  CR FEATR COUNT  LBA_48  LH LM LL DV DC  Powered_Up_Time  Command/Feature_Name
  -- == -- == -- == == == -- -- -- -- --  ---------------  --------------------
  25 00 00 00 01 00 00 01 4e a9 10 40 40 16d+03:41:53.840  READ DMA EXT
  25 00 00 00 38 00 00 03 5e 88 90 40 40 16d+03:41:53.810  READ DMA EXT
  25 00 00 00 08 00 00 03 4b 5e d8 40 40 16d+03:41:53.800  READ DMA EXT
  25 00 00 00 10 00 00 03 67 fe 60 40 40 16d+03:41:53.790  READ DMA EXT
  25 00 00 00 08 00 00 03 4b 71 c0 40 40 16d+03:41:53.780  READ DMA EXT

Error 4171 [10] occurred at disk power-on lifetime: 31219 hours (1300 days + 19 hours)
  When the command that caused the error occurred, the device was in an unknown state.

  After command completion occurred, registers were:
  ER -- ST COUNT  LBA_48  LH LM LL DV DC
  -- -- -- == -- == == == -- -- -- -- --
  04 -- 51 00 00 00 00 00 00 00 00 00 00

  Commands leading to the command that caused the error were:
  CR FEATR COUNT  LBA_48  LH LM LL DV DC  Powered_Up_Time  Command/Feature_Name
  -- == -- == -- == == == -- -- -- -- --  ---------------  --------------------
  b1 00 c1 00 00 00 00 00 00 00 00 00 00 16d+03:41:48.660  DEVICE CONFIGURATION FREEZE LOCK [OBS-ACS-3]
  f5 00 00 00 00 00 00 00 00 00 00 00 00 16d+03:41:48.660  SECURITY FREEZE LOCK
  ec 00 00 00 00 00 00 00 00 00 00 00 00 16d+03:41:48.660  IDENTIFY DEVICE
  ec 00 00 00 00 00 00 00 00 00 00 00 00 16d+03:39:59.510  IDENTIFY DEVICE
  ec 00 00 00 00 00 00 00 00 00 00 00 00 16d+03:39:59.490  IDENTIFY DEVICE

Error 4170 [9] occurred at disk power-on lifetime: 31219 hours (1300 days + 19 hours)
  When the command that caused the error occurred, the device was in an unknown state.

  After command completion occurred, registers were:
  ER -- ST COUNT  LBA_48  LH LM LL DV DC
  -- -- -- == -- == == == -- -- -- -- --
  00 -- 00 00 00 00 00 00 00 00 00 00 ff   at LBA = 0x00000000 = 0

  Commands leading to the command that caused the error were:
  CR FEATR COUNT  LBA_48  LH LM LL DV DC  Powered_Up_Time  Command/Feature_Name
  -- == -- == -- == == == -- -- -- -- --  ---------------  --------------------
  25 00 00 00 18 00 00 03 4c da 58 40 40 16d+03:39:51.570  READ DMA EXT
  25 00 00 00 08 00 00 05 98 56 20 40 40 16d+03:39:51.570  READ DMA EXT
  25 00 00 00 18 00 00 01 f4 d8 d8 40 40 16d+03:39:51.570  READ DMA EXT
  25 00 00 00 08 00 00 03 45 2e 38 40 40 16d+03:39:51.570  READ DMA EXT
  25 00 00 00 20 00 00 01 44 f8 b8 40 40 16d+03:39:51.570  READ DMA EXT

Error 4169 [8] occurred at disk power-on lifetime: 31219 hours (1300 days + 19 hours)
  When the command that caused the error occurred, the device was in an unknown state.

  After command completion occurred, registers were:
  ER -- ST COUNT  LBA_48  LH LM LL DV DC
  -- -- -- == -- == == == -- -- -- -- --
  00 -- 00 00 00 00 00 00 00 00 00 00 ff   at LBA = 0x00000000 = 0

  Commands leading to the command that caused the error were:
  CR FEATR COUNT  LBA_48  LH LM LL DV DC  Powered_Up_Time  Command/Feature_Name
  -- == -- == -- == == == -- -- -- -- --  ---------------  --------------------
  25 00 00 00 18 00 00 03 4c da 58 40 40 16d+03:39:51.570  READ DMA EXT
  25 00 00 00 08 00 00 05 98 56 20 40 40 16d+03:39:51.570  READ DMA EXT
  25 00 00 00 18 00 00 01 f4 d8 d8 40 40 16d+03:39:51.570  READ DMA EXT
  25 00 00 00 08 00 00 03 45 2e 38 40 40 16d+03:39:51.570  READ DMA EXT
  25 00 00 00 20 00 00 01 44 f8 b8 40 40 16d+03:39:51.570  READ DMA EXT

Error 4168 [7] occurred at disk power-on lifetime: 31219 hours (1300 days + 19 hours)
  When the command that caused the error occurred, the device was in an unknown state.

  After command completion occurred, registers were:
  ER -- ST COUNT  LBA_48  LH LM LL DV DC
  -- -- -- == -- == == == -- -- -- -- --
  04 -- 51 00 00 00 00 00 00 00 00 00 00

  Commands leading to the command that caused the error were:
  CR FEATR COUNT  LBA_48  LH LM LL DV DC  Powered_Up_Time  Command/Feature_Name
  -- == -- == -- == == == -- -- -- -- --  ---------------  --------------------
  b1 00 c1 00 00 00 00 00 00 00 00 00 00 16d+03:39:50.080  DEVICE CONFIGURATION FREEZE LOCK [OBS-ACS-3]
  f5 00 00 00 00 00 00 00 00 00 00 00 00 16d+03:39:50.080  SECURITY FREEZE LOCK
  ec 00 00 00 00 00 00 00 00 00 00 00 00 16d+03:39:50.080  IDENTIFY DEVICE
  ec 00 00 00 00 00 00 00 00 00 00 00 00 16d+03:39:48.900  IDENTIFY DEVICE
  ec 00 00 00 00 00 00 00 00 00 00 00 00 16d+03:39:48.880  IDENTIFY DEVICE

Error 4167 [6] occurred at disk power-on lifetime: 31219 hours (1300 days + 19 hours)
  When the command that caused the error occurred, the device was in an unknown state.

  After command completion occurred, registers were:
  ER -- ST COUNT  LBA_48  LH LM LL DV DC
  -- -- -- == -- == == == -- -- -- -- --
  00 -- 00 00 00 00 00 00 00 00 00 00 ff

  Commands leading to the command that caused the error were:
  CR FEATR COUNT  LBA_48  LH LM LL DV DC  Powered_Up_Time  Command/Feature_Name
  -- == -- == -- == == == -- -- -- -- --  ---------------  --------------------
  e1 00 00 00 00 00 00 00 00 00 00 40 40 16d+03:39:41.700  IDLE IMMEDIATE
  e5 00 00 00 00 00 00 00 00 00 00 40 40 16d+03:39:41.700  CHECK POWER MODE
  ea 00 00 00 00 00 00 00 00 00 00 40 40 16d+03:39:41.220  FLUSH CACHE EXT
  61 00 08 00 58 00 00 00 00 00 29 40 40 16d+03:39:40.720  WRITE FPDMA QUEUED
  ea 00 00 00 00 00 00 00 00 00 00 40 40 16d+03:39:40.710  FLUSH CACHE EXT

SMART Extended Self-test Log Version: 1 (2 sectors)
Num  Test_Description    Status                  Remaining  LifeTime(hours)  LBA_of_first_error
# 1  Short offline       Completed without error       00%     20010         -

Selective Self-tests/Logging not supported

SCT Commands not supported

Device Statistics (GP Log 0x04)
Page  Offset Size        Value Flags Description
0x01  =====  =               =  ===  == General Statistics (empty) ==
0x04  =====  =               =  ===  == General Errors Statistics (empty) ==
0x05  =====  =               =  ===  == Temperature Statistics (empty) ==
0x06  =====  =               =  ===  == Transport Statistics (empty) ==
0x07  =====  =               =  ===  == Solid State Device Statistics (empty) ==
                                |||_ C monitored condition met
                                ||__ D supports DSN
                                |___ N normalized value

Pending Defects log (GP Log 0x0c) not supported

SATA Phy Event Counters (GP Log 0x11)
ID      Size     Value  Description
0x0001  2            0  Command failed due to ICRC error
0x000a  2           13  Device-to-host register FISes sent due to a COMRESET

