smartctl 7.3 2022-02-28 r5338 [FreeBSD 13.1-RELEASE amd64] (local build)
Copyright (C) 2002-22, Bruce Allen, Christian Franke, www.smartmontools.org

=== START OF INFORMATION SECTION ===
Model Family:     Seagate BarraCuda 3.5 (CMR)
Device Model:     ST1000DM010-2EP102
Serial Number:    --
LU WWN Device Id: 5 000c50 ...
Firmware Version: CC46
User Capacity:    1,000,204,886,016 bytes [1.00 TB]
Sector Sizes:     512 bytes logical, 4096 bytes physical
Rotation Rate:    7200 rpm
Form Factor:      3.5 inches
Device is:        In smartctl database 7.3/5319
ATA Version is:   ATA8-ACS T13/1699-D revision 4
SATA Version is:  SATA 3.0, 6.0 Gb/s (current: 6.0 Gb/s)
Local Time is:    Mon Dec  8 23:37:52 2025 EST
SMART support is: Available - device has SMART capability.
SMART support is: Enabled
AAM feature is:   Unavailable
APM level is:     128 (minimum power consumption without standby)
Rd look-ahead is: Enabled
Write cache is:   Enabled
DSN feature is:   Unavailable
ATA Security is:  Disabled, frozen [SEC2]
Wt Cache Reorder: Unavailable

=== START OF READ SMART DATA SECTION ===
SMART overall-health self-assessment test result: PASSED

General SMART Values:
Offline data collection status:  (0x00)	Offline data collection activity
					was never started.
					Auto Offline Data Collection: Disabled.
Self-test execution status:      (   0)	The previous self-test routine completed
					without error or no self-test has ever 
					been run.
Total time to complete Offline 
data collection: 		(    0) seconds.
Offline data collection
capabilities: 			 (0x73) SMART execute Offline immediate.
					Auto Offline data collection on/off support.
					Suspend Offline collection upon new
					command.
					No Offline surface scan supported.
					Self-test supported.
					Conveyance Self-test supported.
					Selective Self-test supported.
SMART capabilities:            (0x0003)	Saves SMART data before entering
					power-saving mode.
					Supports SMART auto save timer.
Error logging capability:        (0x01)	Error logging supported.
					General Purpose Logging supported.
Short self-test routine 
recommended polling time: 	 (   1) minutes.
Extended self-test routine
recommended polling time: 	 ( 105) minutes.
Conveyance self-test routine
recommended polling time: 	 (   2) minutes.
SCT capabilities: 	       (0x1085)	SCT Status supported.

SMART Attributes Data Structure revision number: 10
Vendor Specific SMART Attributes with Thresholds:
ID# ATTRIBUTE_NAME          FLAGS    VALUE WORST THRESH FAIL RAW_VALUE
  1 Raw_Read_Error_Rate     POSR--   078   061   006    -    82535635
  3 Spin_Up_Time            PO----   097   096   000    -    0
  4 Start_Stop_Count        -O--CK   100   100   020    -    527
  5 Reallocated_Sector_Ct   PO--CK   100   100   010    -    0
  7 Seek_Error_Rate         POSR--   083   060   045    -    203796844
  9 Power_On_Hours          -O--CK   065   065   000    -    30699
 10 Spin_Retry_Count        PO--C-   100   100   097    -    0
 12 Power_Cycle_Count       -O--CK   100   100   020    -    438
183 Runtime_Bad_Block       -O--CK   097   097   000    -    3
184 End-to-End_Error        -O--CK   100   100   099    -    0
187 Reported_Uncorrect      -O--CK   001   001   000    -    393
188 Command_Timeout         -O--CK   100   100   000    -    0 2 2
189 High_Fly_Writes         -O-RCK   100   100   000    -    0
190 Airflow_Temperature_Cel -O---K   063   049   040    -    37 (Min/Max 28/41)
193 Load_Cycle_Count        -O--CK   100   100   000    -    1700
194 Temperature_Celsius     -O---K   037   008   000    -    37 (0 8 0 0 0)
195 Hardware_ECC_Recovered  -O-RC-   016   001   000    -    82535635
197 Current_Pending_Sector  -O--C-   100   100   000    -    0
198 Offline_Uncorrectable   ----C-   100   100   000    -    0
199 UDMA_CRC_Error_Count    -OSRCK   200   200   000    -    0
240 Head_Flying_Hours       ------   100   253   000    -    23794h+05m+49.237s
241 Total_LBAs_Written      ------   100   253   000    -    21458234148
242 Total_LBAs_Read         ------   100   253   000    -    14890827090
                            ||||||_ K auto-keep
                            |||||__ C event count
                            ||||___ R error rate
                            |||____ S speed/performance
                            ||_____ O updated online
                            |______ P prefailure warning

General Purpose Log Directory Version 1
SMART           Log Directory Version 1 [multi-sector log support]
Address    Access  R/W   Size  Description
0x00       GPL,SL  R/O      1  Log Directory
0x01           SL  R/O      1  Summary SMART error log
0x02           SL  R/O      5  Comprehensive SMART error log
0x03       GPL     R/O      5  Ext. Comprehensive SMART error log
0x04       GPL,SL  R/O      8  Device Statistics log
0x06           SL  R/O      1  SMART self-test log
0x07       GPL     R/O      1  Extended self-test log
0x09           SL  R/W      1  Selective self-test log
0x10       GPL     R/O      1  NCQ Command Error log
0x11       GPL     R/O      1  SATA Phy Event Counters log
0x21       GPL     R/O      1  Write stream error log
0x22       GPL     R/O      1  Read stream error log
0x24       GPL     R/O    512  Current Device Internal Status Data log
0x30       GPL,SL  R/O      9  IDENTIFY DEVICE data log
0x80-0x9f  GPL,SL  R/W     16  Host vendor specific log
0xa1       GPL,SL  VS      20  Device vendor specific log
0xa2       GPL     VS    4120  Device vendor specific log
0xa8       GPL,SL  VS     129  Device vendor specific log
0xa9       GPL,SL  VS       1  Device vendor specific log
0xab       GPL     VS       1  Device vendor specific log
0xb0       GPL     VS    4800  Device vendor specific log
0xbe-0xbf  GPL     VS   65535  Device vendor specific log
0xc0       GPL,SL  VS       1  Device vendor specific log
0xc1       GPL,SL  VS      10  Device vendor specific log
0xe0       GPL,SL  R/W      1  SCT Command/Status
0xe1       GPL,SL  R/W      1  SCT Data Transfer

SMART Extended Comprehensive Error Log Version: 1 (5 sectors)
Device Error Count: 393 (device log contains only the most recent 20 errors)
	CR     = Command Register
	FEATR  = Features Register
	COUNT  = Count (was: Sector Count) Register
	LBA_48 = Upper bytes of LBA High/Mid/Low Registers ]  ATA-8
	LH     = LBA High (was: Cylinder High) Register    ]   LBA
	LM     = LBA Mid (was: Cylinder Low) Register      ] Register
	LL     = LBA Low (was: Sector Number) Register     ]
	DV     = Device (was: Device/Head) Register
	DC     = Device Control Register
	ER     = Error register
	ST     = Status register
Powered_Up_Time is measured from power on, and printed as
DDd+hh:mm:SS.sss where DD=days, hh=hours, mm=minutes,
SS=sec, and sss=millisec. It "wraps" after 49.710 days.

Error 393 [12] occurred at disk power-on lifetime: 17610 hours (733 days + 18 hours)
  When the command that caused the error occurred, the device was active or idle.

  After command completion occurred, registers were:
  ER -- ST COUNT  LBA_48  LH LM LL DV DC
  -- -- -- == -- == == == -- -- -- -- --
  40 -- 51 00 00 00 00 00 19 e8 f7 00 00  Error: UNC at LBA = 0x0019e8f7 = 1698039

  Commands leading to the command that caused the error were:
  CR FEATR COUNT  LBA_48  LH LM LL DV DC  Powered_Up_Time  Command/Feature_Name
  -- == -- == -- == == == -- -- -- -- --  ---------------  --------------------
  60 00 00 00 01 00 00 00 19 e8 f7 40 00     12:27:49.239  READ FPDMA QUEUED
  61 00 00 00 08 00 00 08 16 2a c0 40 00     12:27:49.239  WRITE FPDMA QUEUED
  61 00 00 00 08 00 00 0d b3 e4 c8 40 00     12:27:49.238  WRITE FPDMA QUEUED
  61 00 00 00 08 00 00 3a 38 38 98 40 00     12:27:49.238  WRITE FPDMA QUEUED
  61 00 00 00 08 00 00 00 04 06 68 40 00     12:27:49.238  WRITE FPDMA QUEUED

Error 392 [11] occurred at disk power-on lifetime: 17610 hours (733 days + 18 hours)
  When the command that caused the error occurred, the device was active or idle.

  After command completion occurred, registers were:
  ER -- ST COUNT  LBA_48  LH LM LL DV DC
  -- -- -- == -- == == == -- -- -- -- --
  40 -- 51 00 00 00 00 00 19 e8 f6 00 00  Error: WP at LBA = 0x0019e8f6 = 1698038

  Commands leading to the command that caused the error were:
  CR FEATR COUNT  LBA_48  LH LM LL DV DC  Powered_Up_Time  Command/Feature_Name
  -- == -- == -- == == == -- -- -- -- --  ---------------  --------------------
  61 00 00 00 60 00 00 0d b3 e4 d0 40 00     12:27:46.766  WRITE FPDMA QUEUED
  61 00 00 00 08 00 00 00 7d b8 f8 40 00     12:27:46.766  WRITE FPDMA QUEUED
  61 00 00 00 10 00 00 04 c3 a0 a0 40 00     12:27:46.766  WRITE FPDMA QUEUED
  60 00 00 00 01 00 00 00 19 e8 f6 40 00     12:27:46.765  READ FPDMA QUEUED
  ea 00 00 00 00 00 00 00 00 00 00 a0 00     12:27:46.746  FLUSH CACHE EXT

Error 391 [10] occurred at disk power-on lifetime: 17610 hours (733 days + 18 hours)
  When the command that caused the error occurred, the device was active or idle.

  After command completion occurred, registers were:
  ER -- ST COUNT  LBA_48  LH LM LL DV DC
  -- -- -- == -- == == == -- -- -- -- --
  40 -- 51 00 00 00 00 00 19 e8 f5 00 00  Error: WP at LBA = 0x0019e8f5 = 1698037

  Commands leading to the command that caused the error were:
  CR FEATR COUNT  LBA_48  LH LM LL DV DC  Powered_Up_Time  Command/Feature_Name
  -- == -- == -- == == == -- -- -- -- --  ---------------  --------------------
  61 00 00 00 e8 00 00 04 69 77 98 40 00     12:27:44.255  WRITE FPDMA QUEUED
  60 00 00 00 01 00 00 00 19 e8 f5 40 00     12:27:44.254  READ FPDMA QUEUED
  61 00 00 00 10 00 00 3a 38 38 90 40 00     12:27:44.254  WRITE FPDMA QUEUED
  61 00 00 00 28 00 00 05 84 bf 60 40 00     12:27:44.254  WRITE FPDMA QUEUED
  61 00 00 00 38 00 00 3a 38 ad c8 40 00     12:27:44.254  WRITE FPDMA QUEUED

Error 390 [9] occurred at disk power-on lifetime: 17610 hours (733 days + 18 hours)
  When the command that caused the error occurred, the device was active or idle.

  After command completion occurred, registers were:
  ER -- ST COUNT  LBA_48  LH LM LL DV DC
  -- -- -- == -- == == == -- -- -- -- --
  40 -- 51 00 00 00 00 00 19 e8 f4 00 00  Error: WP at LBA = 0x0019e8f4 = 1698036

  Commands leading to the command that caused the error were:
  CR FEATR COUNT  LBA_48  LH LM LL DV DC  Powered_Up_Time  Command/Feature_Name
  -- == -- == -- == == == -- -- -- -- --  ---------------  --------------------
  61 00 00 00 38 00 00 00 7c f6 80 40 00     12:27:41.742  WRITE FPDMA QUEUED
  61 00 00 00 08 00 00 3a 38 38 40 40 00     12:27:41.741  WRITE FPDMA QUEUED
  61 00 00 00 38 00 00 00 7c e7 a0 40 00     12:27:41.741  WRITE FPDMA QUEUED
  61 00 00 00 28 00 00 0d 74 c4 48 40 00     12:27:41.741  WRITE FPDMA QUEUED
  61 00 00 00 38 00 00 3a 38 38 90 40 00     12:27:41.740  WRITE FPDMA QUEUED

Error 389 [8] occurred at disk power-on lifetime: 17610 hours (733 days + 18 hours)
  When the command that caused the error occurred, the device was active or idle.

  After command completion occurred, registers were:
  ER -- ST COUNT  LBA_48  LH LM LL DV DC
  -- -- -- == -- == == == -- -- -- -- --
  40 -- 51 00 00 00 00 00 19 e8 f3 00 00  Error: UNC at LBA = 0x0019e8f3 = 1698035

  Commands leading to the command that caused the error were:
  CR FEATR COUNT  LBA_48  LH LM LL DV DC  Powered_Up_Time  Command/Feature_Name
  -- == -- == -- == == == -- -- -- -- --  ---------------  --------------------
  60 00 00 00 01 00 00 00 19 e8 f3 40 00     12:27:39.282  READ FPDMA QUEUED
  61 00 00 00 08 00 00 00 19 c0 20 40 00     12:27:39.281  WRITE FPDMA QUEUED
  2f 00 00 00 01 00 00 00 00 00 10 e0 00     12:27:39.230  READ LOG EXT
  60 00 00 00 01 00 00 00 19 e8 f2 40 00     12:27:36.834  READ FPDMA QUEUED
  61 00 00 00 08 00 00 3a 38 38 00 40 00     12:27:36.834  WRITE FPDMA QUEUED

Error 388 [7] occurred at disk power-on lifetime: 17610 hours (733 days + 18 hours)
  When the command that caused the error occurred, the device was active or idle.

  After command completion occurred, registers were:
  ER -- ST COUNT  LBA_48  LH LM LL DV DC
  -- -- -- == -- == == == -- -- -- -- --
  40 -- 51 00 00 00 00 00 19 e8 f2 00 00  Error: UNC at LBA = 0x0019e8f2 = 1698034

  Commands leading to the command that caused the error were:
  CR FEATR COUNT  LBA_48  LH LM LL DV DC  Powered_Up_Time  Command/Feature_Name
  -- == -- == -- == == == -- -- -- -- --  ---------------  --------------------
  60 00 00 00 01 00 00 00 19 e8 f2 40 00     12:27:36.834  READ FPDMA QUEUED
  61 00 00 00 08 00 00 3a 38 38 00 40 00     12:27:36.834  WRITE FPDMA QUEUED
  61 00 00 00 08 00 00 00 ab 05 88 40 00     12:27:36.833  WRITE FPDMA QUEUED
  ea 00 00 00 00 00 00 00 00 00 00 a0 00     12:27:36.833  FLUSH CACHE EXT
  2f 00 00 00 01 00 00 00 00 00 10 e0 00     12:27:36.696  READ LOG EXT

Error 387 [6] occurred at disk power-on lifetime: 17610 hours (733 days + 18 hours)
  When the command that caused the error occurred, the device was active or idle.

  After command completion occurred, registers were:
  ER -- ST COUNT  LBA_48  LH LM LL DV DC
  -- -- -- == -- == == == -- -- -- -- --
  40 -- 51 00 00 00 00 00 19 e8 f1 00 00  Error: WP at LBA = 0x0019e8f1 = 1698033

  Commands leading to the command that caused the error were:
  CR FEATR COUNT  LBA_48  LH LM LL DV DC  Powered_Up_Time  Command/Feature_Name
  -- == -- == -- == == == -- -- -- -- --  ---------------  --------------------
  61 00 00 00 08 00 00 3a 38 38 10 40 00     12:27:34.310  WRITE FPDMA QUEUED
  60 00 00 00 01 00 00 00 19 e8 f1 40 00     12:27:34.310  READ FPDMA QUEUED
  61 00 00 00 18 00 00 04 c3 a0 88 40 00     12:27:34.310  WRITE FPDMA QUEUED
  61 00 00 00 a0 00 00 3a 38 ad 28 40 00     12:27:34.310  WRITE FPDMA QUEUED
  61 00 00 00 40 00 00 04 62 e3 20 40 00     12:27:34.310  WRITE FPDMA QUEUED

Error 386 [5] occurred at disk power-on lifetime: 17610 hours (733 days + 18 hours)
  When the command that caused the error occurred, the device was active or idle.

  After command completion occurred, registers were:
  ER -- ST COUNT  LBA_48  LH LM LL DV DC
  -- -- -- == -- == == == -- -- -- -- --
  40 -- 51 00 00 00 00 00 19 e8 f0 00 00  Error: WP at LBA = 0x0019e8f0 = 1698032

  Commands leading to the command that caused the error were:
  CR FEATR COUNT  LBA_48  LH LM LL DV DC  Powered_Up_Time  Command/Feature_Name
  -- == -- == -- == == == -- -- -- -- --  ---------------  --------------------
  61 00 00 00 28 00 00 3a 38 38 d0 40 00     12:27:32.006  WRITE FPDMA QUEUED
  61 00 00 00 28 00 00 05 84 bf 40 40 00     12:27:31.941  WRITE FPDMA QUEUED
  60 00 00 00 01 00 00 00 19 e8 f0 40 00     12:27:31.916  READ FPDMA QUEUED
  60 00 00 00 01 00 00 00 19 e8 ef 40 00     12:27:31.915  READ FPDMA QUEUED
  60 00 00 00 01 00 00 00 19 e8 ee 40 00     12:27:31.915  READ FPDMA QUEUED

SMART Extended Self-test Log Version: 1 (1 sectors)
No self-tests have been logged.  [To run self-tests, use: smartctl -t]

SMART Selective self-test log data structure revision number 1
 SPAN  MIN_LBA  MAX_LBA  CURRENT_TEST_STATUS
    1        0        0  Not_testing
    2        0        0  Not_testing
    3        0        0  Not_testing
    4        0        0  Not_testing
    5        0        0  Not_testing
Selective self-test flags (0x0):
  After scanning selected spans, do NOT read-scan remainder of disk.
If Selective self-test is pending on power-up, resume after 0 minute delay.

SCT Status Version:                  3
SCT Version (vendor specific):       522 (0x020a)
Device State:                        Active (0)
Current Temperature:                    37 Celsius
Power Cycle Min/Max Temperature:     26/41 Celsius
Lifetime    Min/Max Temperature:      8/51 Celsius
Under/Over Temperature Limit Count:   0/0

SCT Data Table command not supported

SCT Error Recovery Control command not supported

Device Statistics (GP Log 0x04)
Page  Offset Size        Value Flags Description
0x01  =====  =               =  ===  == General Statistics (rev 1) ==
0x01  0x008  4             438  ---  Lifetime Power-On Resets
0x01  0x010  4           30699  ---  Power-on Hours
0x01  0x018  6     21480131665  ---  Logical Sectors Written
0x01  0x020  6       326834080  ---  Number of Write Commands
0x01  0x028  6     14917997521  ---  Logical Sectors Read
0x01  0x030  6       180697310  ---  Number of Read Commands
0x01  0x038  6               -  ---  Date and Time TimeStamp
0x03  =====  =               =  ===  == Rotating Media Statistics (rev 1) ==
0x03  0x008  4           17463  ---  Spindle Motor Power-on Hours
0x03  0x010  4            1388  ---  Head Flying Hours
0x03  0x018  4            1700  ---  Head Load Events
0x03  0x020  4               0  ---  Number of Reallocated Logical Sectors
0x03  0x028  4               0  ---  Read Recovery Attempts
0x03  0x030  4               0  ---  Number of Mechanical Start Failures
0x03  0x038  4               0  ---  Number of Realloc. Candidate Logical Sectors
0x04  =====  =               =  ===  == General Errors Statistics (rev 1) ==
0x04  0x008  4             394  ---  Number of Reported Uncorrectable Errors
0x04  0x010  4               1  ---  Resets Between Cmd Acceptance and Completion
0x05  =====  =               =  ===  == Temperature Statistics (rev 1) ==
0x05  0x008  1              37  ---  Current Temperature
0x05  0x010  1              34  ---  Average Short Term Temperature
0x05  0x018  1              34  ---  Average Long Term Temperature
0x05  0x020  1              51  ---  Highest Temperature
0x05  0x028  1              14  ---  Lowest Temperature
0x05  0x030  1              45  ---  Highest Average Short Term Temperature
0x05  0x038  1              28  ---  Lowest Average Short Term Temperature
0x05  0x040  1              37  ---  Highest Average Long Term Temperature
0x05  0x048  1              31  ---  Lowest Average Long Term Temperature
0x05  0x050  4               0  ---  Time in Over-Temperature
0x05  0x058  1              55  ---  Specified Maximum Operating Temperature
0x05  0x060  4               0  ---  Time in Under-Temperature
0x05  0x068  1              13  ---  Specified Minimum Operating Temperature
                                |||_ C monitored condition met
                                ||__ D supports DSN
                                |___ N normalized value

Pending Defects log (GP Log 0x0c) not supported

SATA Phy Event Counters (GP Log 0x11)
ID      Size     Value  Description
0x000a  2            6  Device-to-host register FISes sent due to a COMRESET
0x0001  2            0  Command failed due to ICRC error
0x0003  2            0  R_ERR response for device-to-host data FIS
0x0004  2            0  R_ERR response for host-to-device data FIS
0x0006  2            0  R_ERR response for device-to-host non-data FIS
0x0007  2            0  R_ERR response for host-to-device non-data FIS



