smartctl 7.3 2022-02-28 r5338 [FreeBSD 13.1-RELEASE-p8 amd64] (local build)
Copyright (C) 2002-22, Bruce Allen, Christian Franke, www.smartmontools.org

=== START OF INFORMATION SECTION ===
Device Model:     SUNEAST SE900 SSD 256GB
Serial Number:    --
LU WWN Device Id: 5 000000 ...
Firmware Version: SN12289
User Capacity:    256,060,514,304 bytes [256 GB]
Sector Size:      512 bytes logical/physical
Rotation Rate:    Solid State Device
Form Factor:      2.5 inches
TRIM Command:     Available, deterministic, zeroed
Device is:        Not in smartctl database 7.3/5319
ATA Version is:   ACS-4 (minor revision not indicated)
SATA Version is:  SATA 3.2, 6.0 Gb/s (current: 6.0 Gb/s)
Local Time is:    Tue Jul 25 19:08:51 2023 JST
SMART support is: Available - device has SMART capability.
SMART support is: Enabled
AAM feature is:   Unavailable
APM feature is:   Unavailable
Rd look-ahead is: Enabled
Write cache is:   Enabled
DSN feature is:   Unavailable
ATA Security is:  Disabled, NOT FROZEN [SEC1]
Wt Cache Reorder: Unknown (0xc201)

=== START OF READ SMART DATA SECTION ===
SMART overall-health self-assessment test result: PASSED

General SMART Values:
Offline data collection status:  (0x00)	Offline data collection activity
					was never started.
					Auto Offline Data Collection: Disabled.
Self-test execution status:      (   0)	The previous self-test routine completed
					without error or no self-test has ever 
					been run.
Total time to complete Offline 
data collection: 		(   33) seconds.
Offline data collection
capabilities: 			 (0x7b) SMART execute Offline immediate.
					Auto Offline data collection on/off support.
					Suspend Offline collection upon new
					command.
					Offline surface scan supported.
					Self-test supported.
					Conveyance Self-test supported.
					Selective Self-test supported.
SMART capabilities:            (0x0003)	Saves SMART data before entering
					power-saving mode.
					Supports SMART auto save timer.
Error logging capability:        (0x01)	Error logging supported.
					General Purpose Logging supported.
Short self-test routine 
recommended polling time: 	 (   2) minutes.
Extended self-test routine
recommended polling time: 	 (  85) minutes.
Conveyance self-test routine
recommended polling time: 	 (   2) minutes.
SCT capabilities: 	       (0x0031)	SCT Status supported.
					SCT Feature Control supported.
					SCT Data Table supported.

SMART Attributes Data Structure revision number: 20
Vendor Specific SMART Attributes with Thresholds:
ID# ATTRIBUTE_NAME          FLAGS    VALUE WORST THRESH FAIL RAW_VALUE
  5 Reallocated_Sector_Ct   ------+  100   100   050    -    0
  9 Power_On_Hours          ------+  100   100   000    -    5144
 12 Power_Cycle_Count       ------+  100   100   000    -    79
167 Unknown_Attribute       ------+  100   100   000    -    0
168 Unknown_Attribute       ------+  100   100   000    -    0
169 Unknown_Attribute       ------+  100   100   010    -    131076
171 Unknown_Attribute       ------+  100   100   000    -    23
172 Unknown_Attribute       ------+  100   100   000    -    0
173 Unknown_Attribute       ------+  200   200   000    -    227648143454
175 Program_Fail_Count_Chip ------+  100   100   010    -    0
180 Unused_Rsvd_Blk_Cnt_Tot ------+  100   100   000    -    122
187 Reported_Uncorrect      ------+  100   000   000    -    30
192 Power-Off_Retract_Count ------+  100   100   000    -    77
194 Temperature_Celsius     ------+  030   030   000    -    30 (Min/Max 25/36)
206 Unknown_SSD_Attribute   ------+  200   200   000    -    53
207 Unknown_SSD_Attribute   ------+  200   200   000    -    227
208 Unknown_SSD_Attribute   ------+  200   200   000    -    94
209 Unknown_SSD_Attribute   ------+  200   200   000    -    1
210 Unknown_Attribute       ------+  200   200   000    -    141
211 Unknown_Attribute       ------+  200   200   000    -    73
231 Unknown_SSD_Attribute   ------+  097   097   005    -    3
233 Media_Wearout_Indicator ------+  100   100   000    -    23764
234 Unknown_Attribute       ------+  100   100   005    -    4533442
241 Total_LBAs_Written      ------+  100   100   000    -    4323
242 Total_LBAs_Read         ------+  100   100   000    -    2571
245 Unknown_Attribute       ------+  100   100   000    -    0
                            ||||||_ K auto-keep
                            |||||__ C event count
                            ||||___ R error rate
                            |||____ S speed/performance
                            ||_____ O updated online
                            |______ P prefailure warning

General Purpose Log Directory Version 1
SMART           Log Directory Version 1 [multi-sector log support]
Address    Access  R/W   Size  Description
0x00       GPL,SL  R/O      1  Log Directory
0x01           SL  R/O      1  Summary SMART error log
0x02           SL  R/O     51  Comprehensive SMART error log
0x03       GPL     R/O     64  Ext. Comprehensive SMART error log
0x04       GPL,SL  R/O      8  Device Statistics log
0x06           SL  R/O      1  SMART self-test log
0x07       GPL     R/O      1  Extended self-test log
0x09           SL  R/W      1  Selective self-test log
0x10       GPL     R/O      1  NCQ Command Error log
0x11       GPL     R/O      1  SATA Phy Event Counters log
0x30       GPL,SL  R/O      9  IDENTIFY DEVICE data log
0x80-0x9f  GPL,SL  R/W     16  Host vendor specific log
0xe0       GPL,SL  R/W      1  SCT Command/Status
0xe1       GPL,SL  R/W      1  SCT Data Transfer

SMART Extended Comprehensive Error Log Version: 1 (64 sectors)
Device Error Count: 30
	CR     = Command Register
	FEATR  = Features Register
	COUNT  = Count (was: Sector Count) Register
	LBA_48 = Upper bytes of LBA High/Mid/Low Registers ]  ATA-8
	LH     = LBA High (was: Cylinder High) Register    ]   LBA
	LM     = LBA Mid (was: Cylinder Low) Register      ] Register
	LL     = LBA Low (was: Sector Number) Register     ]
	DV     = Device (was: Device/Head) Register
	DC     = Device Control Register
	ER     = Error register
	ST     = Status register
Powered_Up_Time is measured from power on, and printed as
DDd+hh:mm:SS.sss where DD=days, hh=hours, mm=minutes,
SS=sec, and sss=millisec. It "wraps" after 49.710 days.

Error 30 [29] occurred at disk power-on lifetime: 5144 hours (214 days + 8 hours)
  When the command that caused the error occurred, the device was in an unknown state.

  After command completion occurred, registers were:
  ER -- ST COUNT  LBA_48  LH LM LL DV DC
  -- -- -- == -- == == == -- -- -- -- --
  40 -- 41 00 01 00 00 1d cf 2f fe 40 00  Error: UNC at LBA = 0x1dcf2ffe = 500117502

  Commands leading to the command that caused the error were:
  CR FEATR COUNT  LBA_48  LH LM LL DV DC  Powered_Up_Time  Command/Feature_Name
  -- == -- == -- == == == -- -- -- -- --  ---------------  --------------------
  60 00 00 00 08 00 00 00 33 15 88 00 00     00:05:34.400  READ FPDMA QUEUED
  60 00 00 00 78 00 00 00 33 15 88 00 ff     00:05:24.700  READ FPDMA QUEUED
  60 00 00 00 d8 00 00 00 33 15 88 00 00     00:05:06.600  READ FPDMA QUEUED
  ec 00 00 00 00 00 00 00 00 00 00 00 ff     00:04:56.700  IDENTIFY DEVICE
  60 00 00 00 b0 00 00 00 33 15 88 00 00     00:04:35.700  READ FPDMA QUEUED

Error 29 [28] occurred at disk power-on lifetime: 5144 hours (214 days + 8 hours)
  When the command that caused the error occurred, the device was in an unknown state.

  After command completion occurred, registers were:
  ER -- ST COUNT  LBA_48  LH LM LL DV DC
  -- -- -- == -- == == == -- -- -- -- --
  40 -- 41 00 04 00 00 1d cf 2f c1 40 00  Error: UNC at LBA = 0x1dcf2fc1 = 500117441

  Commands leading to the command that caused the error were:
  CR FEATR COUNT  LBA_48  LH LM LL DV DC  Powered_Up_Time  Command/Feature_Name
  -- == -- == -- == == == -- -- -- -- --  ---------------  --------------------
  60 00 00 00 d8 00 00 00 33 15 88 00 00     00:05:06.600  READ FPDMA QUEUED
  ec 00 00 00 00 00 00 00 00 00 00 00 ff     00:04:56.700  IDENTIFY DEVICE
  60 00 00 00 b0 00 00 00 33 15 88 00 00     00:04:35.700  READ FPDMA QUEUED
  ec 00 00 00 00 00 00 00 00 00 00 00 ff     00:04:30.700  IDENTIFY DEVICE
  60 00 00 00 78 00 00 00 33 15 88 00 80     00:04:10.300  READ FPDMA QUEUED

Error 28 [27] occurred at disk power-on lifetime: 5144 hours (214 days + 8 hours)
  When the command that caused the error occurred, the device was in an unknown state.

  After command completion occurred, registers were:
  ER -- ST COUNT  LBA_48  LH LM LL DV DC
  -- -- -- == -- == == == -- -- -- -- --
  40 -- 41 02 00 00 00 00 33 14 00 40 00  Error: UNC at LBA = 0x00331400 = 3347456

  Commands leading to the command that caused the error were:
  CR FEATR COUNT  LBA_48  LH LM LL DV DC  Powered_Up_Time  Command/Feature_Name
  -- == -- == -- == == == -- -- -- -- --  ---------------  --------------------
  60 00 00 00 b0 00 00 00 33 15 88 00 00     00:04:35.700  READ FPDMA QUEUED
  ec 00 00 00 00 00 00 00 00 00 00 00 ff     00:04:30.700  IDENTIFY DEVICE
  60 00 00 00 78 00 00 00 33 15 88 00 80     00:04:10.300  READ FPDMA QUEUED
  b0 00 d5 00 01 00 00 00 c2 4f e0 00 80     00:04:07.900  SMART READ LOG
  ec 00 00 00 00 00 00 00 00 00 00 00 ff     00:04:06.700  IDENTIFY DEVICE

Error 27 [26] occurred at disk power-on lifetime: 5144 hours (214 days + 8 hours)
  When the command that caused the error occurred, the device was in an unknown state.

  After command completion occurred, registers were:
  ER -- ST COUNT  LBA_48  LH LM LL DV DC
  -- -- -- == -- == == == -- -- -- -- --
  40 -- 41 00 04 00 00 1d cf 2f c1 40 00  Error: UNC at LBA = 0x1dcf2fc1 = 500117441

  Commands leading to the command that caused the error were:
  CR FEATR COUNT  LBA_48  LH LM LL DV DC  Powered_Up_Time  Command/Feature_Name
  -- == -- == -- == == == -- -- -- -- --  ---------------  --------------------
  60 00 00 00 78 00 00 00 33 15 88 00 80     00:04:10.300  READ FPDMA QUEUED
  b0 00 d5 00 01 00 00 00 c2 4f e0 00 80     00:04:07.900  SMART READ LOG
  ec 00 00 00 00 00 00 00 00 00 00 00 ff     00:04:06.700  IDENTIFY DEVICE
  60 00 00 00 18 00 00 00 33 15 88 00 80     00:03:22.300  READ FPDMA QUEUED
  ec 00 00 00 00 00 00 00 00 00 00 00 80     00:03:19.200  IDENTIFY DEVICE

Error 26 [25] occurred at disk power-on lifetime: 5144 hours (214 days + 8 hours)
  When the command that caused the error occurred, the device was in an unknown state.

  After command completion occurred, registers were:
  ER -- ST COUNT  LBA_48  LH LM LL DV DC
  -- -- -- == -- == == == -- -- -- -- --
  40 -- 41 00 04 00 00 1d cf 2f c1 40 00  Error: UNC at LBA = 0x1dcf2fc1 = 500117441

  Commands leading to the command that caused the error were:
  CR FEATR COUNT  LBA_48  LH LM LL DV DC  Powered_Up_Time  Command/Feature_Name
  -- == -- == -- == == == -- -- -- -- --  ---------------  --------------------
  60 00 00 00 18 00 00 00 33 15 88 00 80     00:03:22.300  READ FPDMA QUEUED
  ec 00 00 00 00 00 00 00 00 00 00 00 80     00:03:19.200  IDENTIFY DEVICE
  ec 00 00 00 00 00 00 00 00 00 00 00 80     00:03:19.200  IDENTIFY DEVICE
  ec 00 00 00 00 00 00 00 00 00 00 00 80     00:03:19.200  IDENTIFY DEVICE
  ec 00 00 00 00 00 00 00 00 00 00 00 80     00:03:19.100  IDENTIFY DEVICE

Error 25 [24] occurred at disk power-on lifetime: 5126 hours (213 days + 14 hours)
  When the command that caused the error occurred, the device was in an unknown state.

  After command completion occurred, registers were:
  ER -- ST COUNT  LBA_48  LH LM LL DV DC
  -- -- -- == -- == == == -- -- -- -- --
  40 -- 41 02 00 00 00 00 33 14 00 40 00  Error: UNC at LBA = 0x00331400 = 3347456

  Commands leading to the command that caused the error were:
  CR FEATR COUNT  LBA_48  LH LM LL DV DC  Powered_Up_Time  Command/Feature_Name
  -- == -- == -- == == == -- -- -- -- --  ---------------  --------------------
  60 00 00 00 00 00 00 00 33 15 88 00 00     00:04:37.200  READ FPDMA QUEUED
  00 00 00 00 00 00 00 00 33 15 88 40 ff     00:04:30.100  NOP [Abort queued commands]
  60 00 00 00 d0 00 00 00 33 15 88 00 00     00:04:12.300  READ FPDMA QUEUED
  ec 00 00 00 00 00 00 00 00 00 00 00 ff     00:04:06.100  IDENTIFY DEVICE
  60 00 00 00 a0 00 00 00 33 15 88 00 00     00:03:54.400  READ FPDMA QUEUED

Error 24 [23] occurred at disk power-on lifetime: 5126 hours (213 days + 14 hours)
  When the command that caused the error occurred, the device was in an unknown state.

  After command completion occurred, registers were:
  ER -- ST COUNT  LBA_48  LH LM LL DV DC
  -- -- -- == -- == == == -- -- -- -- --
  40 -- 41 02 00 00 00 00 33 14 00 40 00  Error: UNC at LBA = 0x00331400 = 3347456

  Commands leading to the command that caused the error were:
  CR FEATR COUNT  LBA_48  LH LM LL DV DC  Powered_Up_Time  Command/Feature_Name
  -- == -- == -- == == == -- -- -- -- --  ---------------  --------------------
  60 00 00 00 d0 00 00 00 33 15 88 00 00     00:04:12.300  READ FPDMA QUEUED
  ec 00 00 00 00 00 00 00 00 00 00 00 ff     00:04:06.100  IDENTIFY DEVICE
  60 00 00 00 a0 00 00 00 33 15 88 00 00     00:03:54.400  READ FPDMA QUEUED
  ec 00 00 00 00 00 00 00 00 00 00 00 ff     00:03:53.700  IDENTIFY DEVICE
  00 00 00 00 00 00 00 00 33 15 88 40 07     00:03:32.300  NOP [Abort queued commands]

Error 23 [22] occurred at disk power-on lifetime: 5126 hours (213 days + 14 hours)
  When the command that caused the error occurred, the device was in an unknown state.

  After command completion occurred, registers were:
  ER -- ST COUNT  LBA_48  LH LM LL DV DC
  -- -- -- == -- == == == -- -- -- -- --
  40 -- 41 02 00 00 00 00 33 14 00 40 00  Error: UNC at LBA = 0x00331400 = 3347456

  Commands leading to the command that caused the error were:
  CR FEATR COUNT  LBA_48  LH LM LL DV DC  Powered_Up_Time  Command/Feature_Name
  -- == -- == -- == == == -- -- -- -- --  ---------------  --------------------
  60 00 00 00 a0 00 00 00 33 15 88 00 00     00:03:54.400  READ FPDMA QUEUED
  ec 00 00 00 00 00 00 00 00 00 00 00 ff     00:03:53.700  IDENTIFY DEVICE
  00 00 00 00 00 00 00 00 33 15 88 40 07     00:03:32.300  NOP [Abort queued commands]
  b0 00 d5 00 01 00 00 00 c2 4f e0 00 80     00:03:30.900  SMART READ LOG
  ec 00 00 00 00 00 00 00 00 00 00 00 ff     00:03:29.700  IDENTIFY DEVICE

SMART Extended Self-test Log Version: 1 (1 sectors)
No self-tests have been logged.  [To run self-tests, use: smartctl -t]

SMART Selective self-test log data structure revision number 1
 SPAN  MIN_LBA  MAX_LBA  CURRENT_TEST_STATUS
    1        0        0  Not_testing
    2        0        0  Not_testing
    3        0        0  Not_testing
    4        0        0  Not_testing
    5        0        0  Not_testing
Selective self-test flags (0x0):
  After scanning selected spans, do NOT read-scan remainder of disk.
If Selective self-test is pending on power-up, resume after 0 minute delay.

SCT Status Version:                  3
SCT Version (vendor specific):       1 (0x0001)
Device State:                        Active (0)
Current Temperature:                    31 Celsius
Power Cycle Min/Max Temperature:      ?/32 Celsius
Lifetime    Min/Max Temperature:      ?/ ? Celsius
Under/Over Temperature Limit Count:   0/0

SCT Temperature History Version:     2
Temperature Sampling Period:         1 minute
Temperature Logging Interval:        1 minute
Min/Max recommended Temperature:     -127/127 Celsius
Min/Max Temperature Limit:           -127/127 Celsius
Temperature History Size (Index):    478 (42)

SCT Error Recovery Control command not supported

Device Statistics (GP Log 0x04)
Page  Offset Size        Value Flags Description
0x01  =====  =               =  ===  == General Statistics (rev 1) ==
0x01  0x008  4              79  ---  Lifetime Power-On Resets
0x01  0x010  4            5144  ---  Power-on Hours
0x01  0x018  6      9067817696  ---  Logical Sectors Written
0x01  0x020  6       315034257  ---  Number of Write Commands
0x01  0x028  6      5392229890  ---  Logical Sectors Read
0x01  0x030  6        15547845  ---  Number of Read Commands
0x01  0x038  6   4738688395804  ---  Date and Time TimeStamp
0x07  =====  =               =  ===  == Solid State Device Statistics (rev 1) ==
0x07  0x008  1              15  N--  Percentage Used Endurance Indicator
                                |||_ C monitored condition met
                                ||__ D supports DSN
                                |___ N normalized value

Pending Defects log (GP Log 0x0c) not supported

SATA Phy Event Counters (GP Log 0x11)
ID      Size     Value  Description
0x0001  2           30  Command failed due to ICRC error
0x0003  2            0  R_ERR response for device-to-host data FIS
0x0004  2            0  R_ERR response for host-to-device data FIS
0x0006  2            0  R_ERR response for device-to-host non-data FIS
0x0007  2            0  R_ERR response for host-to-device non-data FIS
0x0008  2            0  Device-to-host non-data FIS retries
0x0009  4            0  Transition from drive PhyRdy to drive PhyNRdy
0x000a  4            8  Device-to-host register FISes sent due to a COMRESET
0x000f  2            0  R_ERR response for host-to-device data FIS, CRC
0x0010  2            0  R_ERR response for host-to-device data FIS, non-CRC
0x0012  2            0  R_ERR response for host-to-device non-data FIS, CRC
0x0013  2            0  R_ERR response for host-to-device non-data FIS, non-CRC

