smartctl 7.1 2019-12-30 r5022 [FreeBSD 12.1-RELEASE-p10 amd64] (local build)
Copyright (C) 2002-19, Bruce Allen, Christian Franke, www.smartmontools.org

=== START OF INFORMATION SECTION ===
Model Family:     Intel 330/335 Series SSDs
Device Model:     INTEL SSDSC2CT240A3
Serial Number:    --
LU WWN Device Id: 5 001517 ...
Firmware Version: 300i
User Capacity:    240,057,409,536 bytes [240 GB]
Sector Size:      512 bytes logical/physical
Rotation Rate:    Solid State Device
Device is:        In smartctl database [for details use: -P show]
ATA Version is:   ACS-2 T13/2015-D revision 3
SATA Version is:  SATA 3.0, 6.0 Gb/s (current: 6.0 Gb/s)
Local Time is:    Wed Oct 28 10:20:53 2020 CDT
SMART support is: Available - device has SMART capability.
SMART support is: Enabled
AAM feature is:   Unavailable
APM level is:     254 (maximum performance)
Rd look-ahead is: Enabled
Write cache is:   Enabled
DSN feature is:   Unavailable
ATA Security is:  Disabled, frozen [SEC2]
Wt Cache Reorder: Unavailable

=== START OF READ SMART DATA SECTION ===
SMART overall-health self-assessment test result: PASSED

General SMART Values:
Offline data collection status:  (0x00)	Offline data collection activity
					was never started.
					Auto Offline Data Collection: Disabled.
Self-test execution status:      (   0)	The previous self-test routine completed
					without error or no self-test has ever 
					been run.
Total time to complete Offline 
data collection: 		( 2097) seconds.
Offline data collection
capabilities: 			 (0x7f) SMART execute Offline immediate.
					Auto Offline data collection on/off support.
					Abort Offline collection upon new
					command.
					Offline surface scan supported.
					Self-test supported.
					Conveyance Self-test supported.
					Selective Self-test supported.
SMART capabilities:            (0x0003)	Saves SMART data before entering
					power-saving mode.
					Supports SMART auto save timer.
Error logging capability:        (0x01)	Error logging supported.
					General Purpose Logging supported.
Short self-test routine 
recommended polling time: 	 (   1) minutes.
Extended self-test routine
recommended polling time: 	 (  48) minutes.
Conveyance self-test routine
recommended polling time: 	 (   2) minutes.
SCT capabilities: 	       (0x0021)	SCT Status supported.
					SCT Data Table supported.

SMART Attributes Data Structure revision number: 10
Vendor Specific SMART Attributes with Thresholds:
ID# ATTRIBUTE_NAME          FLAGS    VALUE WORST THRESH FAIL RAW_VALUE
  5 Reallocated_Sector_Ct   -O--CK   100   100   000    -    7
  9 Power_On_Hours_and_Msec -O--CK   000   000   000    -    951675h+04m+28.810s
 12 Power_Cycle_Count       -O--CK   100   100   000    -    839
181 Program_Fail_Cnt_Total  -O--CK   000   000   000    -    7
182 Erase_Fail_Count_Total  -O--CK   000   000   000    -    0
192 Power-Off_Retract_Count -O--CK   100   100   000    -    821
225 Host_Writes_32MiB       -O--CK   100   100   000    -    1685578
232 Available_Reservd_Space PO--CK   100   100   010    -    0
233 Media_Wearout_Indicator -O--CK   100   100   000    -    0
241 Host_Writes_32MiB       -O--CK   100   100   000    -    1685578
242 Host_Reads_32MiB        -O--CK   100   100   000    -    168643
249 NAND_Writes_1GiB        PO--C-   100   100   000    -    39676
                            ||||||_ K auto-keep
                            |||||__ C event count
                            ||||___ R error rate
                            |||____ S speed/performance
                            ||_____ O updated online
                            |______ P prefailure warning

General Purpose Log Directory Version 1
SMART           Log Directory Version 1 [multi-sector log support]
Address    Access  R/W   Size  Description
0x00       GPL,SL  R/O      1  Log Directory
0x04       GPL,SL  R/O      1  Device Statistics log
0x07       GPL     R/O      1  Extended self-test log
0x09           SL  R/W      1  Selective self-test log
0x10       GPL     R/O      1  NCQ Command Error log
0x11       GPL,SL  R/O      1  SATA Phy Event Counters log
0x80-0x9f  GPL,SL  R/W     16  Host vendor specific log
0xb7       GPL,SL  VS      16  Device vendor specific log
0xe0       GPL,SL  R/W      1  SCT Command/Status
0xe1       GPL,SL  R/W      1  SCT Data Transfer

SMART Extended Comprehensive Error Log (GP Log 0x03) not supported

SMART Error Log not supported

SMART Extended Self-test Log Version: 1 (1 sectors)
Num  Test_Description    Status                  Remaining  LifeTime(hours)  LBA_of_first_error
# 1  Extended offline    Self-test routine in progress 90%     43734         -
# 2  Extended offline    Self-test routine in progress 90%     43733         -
# 3  Extended offline    Self-test routine in progress 90%     43733         -
# 4  Extended offline    Self-test routine in progress 90%     43733         -
# 5  Extended offline    Self-test routine in progress 80%     43733         -
# 6  Extended offline    Self-test routine in progress 80%     43733         -
# 7  Extended offline    Self-test routine in progress 80%     43733         -
# 8  Extended offline    Self-test routine in progress 80%     43733         -
# 9  Extended offline    Self-test routine in progress 80%     43733         -
#10  Extended offline    Self-test routine in progress 80%     43733         -
#11  Extended offline    Self-test routine in progress 80%     43733         -
#12  Extended offline    Self-test routine in progress 80%     43733         -
#13  Extended offline    Self-test routine in progress 80%     43733         -
#14  Extended offline    Self-test routine in progress 80%     43733         -
#15  Extended offline    Self-test routine in progress 80%     43733         -
#16  Extended offline    Self-test routine in progress 80%     43733         -
#17  Extended offline    Self-test routine in progress 80%     43733         -
#18  Extended offline    Self-test routine in progress 70%     43732         -
#19  Extended offline    Self-test routine in progress 90%     43734         -

SMART Selective self-test log data structure revision number 0
Note: revision number not 1 implies that no selective self-test has ever been run
 SPAN  MIN_LBA  MAX_LBA  CURRENT_TEST_STATUS
    1        0        0  Not_testing
    2        0        0  Not_testing
    3        0        0  Not_testing
    4        0        0  Not_testing
    5        0        0  Not_testing
Selective self-test flags (0x0):
  After scanning selected spans, do NOT read-scan remainder of disk.
If Selective self-test is pending on power-up, resume after 0 minute delay.

SCT Status Version:                  3
SCT Version (vendor specific):       0 (0x0000)
Device State:                        Active (0)
Current Temperature:                     ? Celsius
Power Cycle Min/Max Temperature:     127/-127 Celsius
Lifetime    Min/Max Temperature:      0/ 0 Celsius
Under/Over Temperature Limit Count:   0/0

SCT Temperature History Version:     10 (Unknown, should be 2)
Temperature Sampling Period:         1 minute
Temperature Logging Interval:        10 minutes
Min/Max recommended Temperature:      0/100 Celsius
Min/Max Temperature Limit:            0/ 6 Celsius
Temperature History Size (Index):    25700 (75)
Invalid Temperature History Size or Index

SCT Error Recovery Control command not supported

Device Statistics (GP Log 0x04)
Page  Offset Size        Value Flags Description
0x01  =====  =               =  ===  == General Statistics (rev 2) ==
0x01  0x008  4             846  ---  Lifetime Power-On Resets
0x01  0x010  4           56881  ---  Power-on Hours
0x01  0x018  6    110673522426  ---  Logical Sectors Written
0x01  0x028  6     11236977012  ---  Logical Sectors Read
0x04  =====  =               =  ===  == General Errors Statistics (rev 1) ==
0x04  0x008  4               0  ---  Number of Reported Uncorrectable Errors
0x04  0x010  4            5863  ---  Resets Between Cmd Acceptance and Completion
0x06  =====  =               =  ===  == Transport Statistics (rev 1) ==
0x06  0x008  4            5863  ---  Number of Hardware Resets
0x06  0x010  4            2981  ---  Number of ASR Events
0x06  0x018  4               0  ---  Number of Interface CRC Errors
0x07  =====  =               =  ===  == Solid State Device Statistics (rev 1) ==
0x07  0x008  1             255  ---  Percentage Used Endurance Indicator
                                |||_ C monitored condition met
                                ||__ D supports DSN
                                |___ N normalized value

Pending Defects log (GP Log 0x0c) not supported

SATA Phy Event Counters (GP Log 0x11)
ID      Size     Value  Description
0x0001  2            0  Command failed due to ICRC error
0x0003  2            0  R_ERR response for device-to-host data FIS
0x0004  2            0  R_ERR response for host-to-device data FIS
0x0006  2            0  R_ERR response for device-to-host non-data FIS
0x0007  2            0  R_ERR response for host-to-device non-data FIS
0x0008  2            0  Device-to-host non-data FIS retries
0x0009  2            2  Transition from drive PhyRdy to drive PhyNRdy
0x000a  2            3  Device-to-host register FISes sent due to a COMRESET
0x000f  2            0  R_ERR response for host-to-device data FIS, CRC
0x0010  2            0  R_ERR response for host-to-device data FIS, non-CRC
0x0012  2            0  R_ERR response for host-to-device non-data FIS, CRC
0x0013  2            0  R_ERR response for host-to-device non-data FIS, non-CRC
0x0002  2            0  R_ERR response for data FIS
0x0005  2            0  R_ERR response for non-data FIS
0x000b  2            0  CRC errors within host-to-device FIS
0x000d  2            0  Non-CRC errors within host-to-device FIS

