smartctl 7.0 2018-12-30 r4883 [NetBSD 8.99.51 amd64] (local build)
Copyright (C) 2002-18, Bruce Allen, Christian Franke, www.smartmontools.org

=== START OF INFORMATION SECTION ===
Model Family:     Intel 520 Series SSDs
Device Model:     INTEL SSDSC2CW120A3
Serial Number:    --
LU WWN Device Id: 5 5cd2e4 ...
Firmware Version: 400i
User Capacity:    120,034,123,776 bytes [120 GB]
Sector Size:      512 bytes logical/physical
Rotation Rate:    Solid State Device
Device is:        In smartctl database [for details use: -P show]
ATA Version is:   ACS-2 T13/2015-D revision 3
SATA Version is:  SATA 3.0, 3.0 Gb/s (current: 3.0 Gb/s)
Local Time is:    Wed Aug 19 16:17:20 2020 PDT
SMART support is: Available - device has SMART capability.
SMART support is: Enabled

=== START OF READ SMART DATA SECTION ===
SMART overall-health self-assessment test result: PASSED

General SMART Values:
Offline data collection status:  (0x00)	Offline data collection activity
					was never started.
					Auto Offline Data Collection: Disabled.
Self-test execution status:      (   0)	The previous self-test routine completed
					without error or no self-test has ever 
					been run.
Total time to complete Offline 
data collection: 		( 2097) seconds.
Offline data collection
capabilities: 			 (0x7f) SMART execute Offline immediate.
					Auto Offline data collection on/off support.
					Abort Offline collection upon new
					command.
					Offline surface scan supported.
					Self-test supported.
					Conveyance Self-test supported.
					Selective Self-test supported.
SMART capabilities:            (0x0003)	Saves SMART data before entering
					power-saving mode.
					Supports SMART auto save timer.
Error logging capability:        (0x01)	Error logging supported.
					General Purpose Logging supported.
Short self-test routine 
recommended polling time: 	 (   1) minutes.
Extended self-test routine
recommended polling time: 	 (  48) minutes.
Conveyance self-test routine
recommended polling time: 	 (   2) minutes.
SCT capabilities: 	       (0x0021)	SCT Status supported.
					SCT Data Table supported.

SMART Attributes Data Structure revision number: 10
Vendor Specific SMART Attributes with Thresholds:
ID# ATTRIBUTE_NAME          FLAG     VALUE WORST THRESH TYPE      UPDATED  WHEN_FAILED RAW_VALUE
  5 Reallocated_Sector_Ct   0x0032   100   100   000    Old_age   Always       -       0
  9 Power_On_Hours_and_Msec 0x0032   000   000   000    Old_age   Always       -       924445h+28m+30.540s
 12 Power_Cycle_Count       0x0032   096   096   000    Old_age   Always       -       4448
170 Available_Reservd_Space 0x0033   100   100   010    Pre-fail  Always       -       0
171 Program_Fail_Count      0x0032   100   100   000    Old_age   Always       -       0
172 Erase_Fail_Count        0x0032   100   100   000    Old_age   Always       -       0
174 Unexpect_Power_Loss_Ct  0x0032   100   100   000    Old_age   Always       -       2752
184 End-to-End_Error        0x0033   100   100   090    Pre-fail  Always       -       0
187 Uncorrectable_Error_Cnt 0x000f   116   116   050    Pre-fail  Always       -       127730183
192 Power-Off_Retract_Count 0x0032   100   100   000    Old_age   Always       -       2752
225 Host_Writes_32MiB       0x0032   100   100   000    Old_age   Always       -       426109
226 Workld_Media_Wear_Indic 0x0032   100   100   000    Old_age   Always       -       65535
227 Workld_Host_Reads_Perc  0x0032   100   100   000    Old_age   Always       -       43
228 Workload_Minutes        0x0032   100   100   000    Old_age   Always       -       65535
232 Available_Reservd_Space 0x0033   100   100   010    Pre-fail  Always       -       0
233 Media_Wearout_Indicator 0x0032   100   100   000    Old_age   Always       -       0
241 Host_Writes_32MiB       0x0032   100   100   000    Old_age   Always       -       426109
242 Host_Reads_32MiB        0x0032   100   100   000    Old_age   Always       -       331058
249 NAND_Writes_1GiB        0x0013   100   100   000    Pre-fail  Always       -       15219

SMART Error Log not supported

SMART Self-test Log not supported

SMART Selective self-test log data structure revision number 0
Note: revision number not 1 implies that no selective self-test has ever been run
 SPAN  MIN_LBA  MAX_LBA  CURRENT_TEST_STATUS
    1        0        0  Not_testing
    2        0        0  Not_testing
    3        0        0  Not_testing
    4        0        0  Not_testing
    5        0        0  Not_testing
Selective self-test flags (0x0):
  After scanning selected spans, do NOT read-scan remainder of disk.
If Selective self-test is pending on power-up, resume after 0 minute delay.

