smartctl 7.2 2020-12-30 r5155 [FreeBSD 12.2-RELEASE amd64] (local build)
Copyright (C) 2002-20, Bruce Allen, Christian Franke, www.smartmontools.org

=== START OF INFORMATION SECTION ===
Model Family:     Maxtor DiamondMax Plus 9
Device Model:     Maxtor 6Y080M0
Serial Number:    --
Firmware Version: YAR51HW0
User Capacity:    81,964,302,336 bytes [81.9 GB]
Sector Size:      512 bytes logical/physical
Device is:        In smartctl database [for details use: -P show]
ATA Version is:   ATA/ATAPI-7 T13/1532D revision 0
Local Time is:    Tue Nov  9 18:10:14 2021 EET
SMART support is: Available - device has SMART capability.
SMART support is: Enabled
AAM level is:     254 (maximum performance), recommended: 192
APM feature is:   Disabled
Rd look-ahead is: Enabled
Write cache is:   Enabled
DSN feature is:   Unavailable
ATA Security is:  Disabled, frozen [SEC2]
Wt Cache Reorder: Unavailable

=== START OF READ SMART DATA SECTION ===
SMART overall-health self-assessment test result: PASSED

General SMART Values:
Offline data collection status:  (0x82)	Offline data collection activity
					was completed without error.
					Auto Offline Data Collection: Enabled.
Self-test execution status:      (   0)	The previous self-test routine completed
					without error or no self-test has ever 
					been run.
Total time to complete Offline 
data collection: 		(  241) seconds.
Offline data collection
capabilities: 			 (0x5b) SMART execute Offline immediate.
					Auto Offline data collection on/off support.
					Suspend Offline collection upon new
					command.
					Offline surface scan supported.
					Self-test supported.
					No Conveyance Self-test supported.
					Selective Self-test supported.
SMART capabilities:            (0x0003)	Saves SMART data before entering
					power-saving mode.
					Supports SMART auto save timer.
Error logging capability:        (0x01)	Error logging supported.
					No General Purpose Logging support.
Short self-test routine 
recommended polling time: 	 (   2) minutes.
Extended self-test routine
recommended polling time: 	 (  37) minutes.

SMART Attributes Data Structure revision number: 16
Vendor Specific SMART Attributes with Thresholds:
ID# ATTRIBUTE_NAME          FLAGS    VALUE WORST THRESH FAIL RAW_VALUE
  3 Spin_Up_Time            POS--K   226   224   063    -    6456
  4 Start_Stop_Count        -O--CK   245   245   000    -    16157
  5 Reallocated_Sector_Ct   PO--CK   253   253   063    -    0
  6 Read_Channel_Margin     P-----   253   253   100    -    0
  7 Seek_Error_Rate         -O-R--   253   252   000    -    0
  8 Seek_Time_Performance   POS--K   251   238   187    -    37140
  9 Power_On_Minutes        -O--CK   135   135   000    -    756h+07m
 10 Spin_Retry_Count        PO-R-K   253   252   157    -    0
 11 Calibration_Retry_Count PO-R-K   253   252   223    -    0
 12 Power_Cycle_Count       -O--CK   243   243   000    -    4223
192 Power-Off_Retract_Count -O--CK   253   253   000    -    0
193 Load_Cycle_Count        -O--CK   253   253   000    -    0
194 Temperature_Celsius     -O--CK   253   253   000    -    40
195 Hardware_ECC_Recovered  -O-R--   253   252   000    -    2604
196 Reallocated_Event_Count ---R--   253   253   000    -    0
197 Current_Pending_Sector  ---R--   253   253   000    -    0
198 Offline_Uncorrectable   ---R--   253   253   000    -    0
199 UDMA_CRC_Error_Count    ---R--   175   001   000    -    3531
200 Multi_Zone_Error_Rate   -O-R--   253   252   000    -    0
201 Soft_Read_Error_Rate    -O-R--   253   252   000    -    4
202 Data_Address_Mark_Errs  -O-R--   253   249   000    -    0
203 Run_Out_Cancel          PO-R--   253   252   180    -    0
204 Soft_ECC_Correction     -O-R--   253   252   000    -    0
205 Thermal_Asperity_Rate   -O-R--   253   252   000    -    0
207 Spin_High_Current       -O-R-K   253   252   000    -    0
208 Spin_Buzz               -O-R-K   253   252   000    -    0
209 Offline_Seek_Performnce --S--K   196   180   000    -    0
 99 Unknown_Attribute       --S---   253   253   000    -    0
100 Unknown_Attribute       --S---   253   253   000    -    0
101 Unknown_Attribute       --S---   253   253   000    -    0
                            ||||||_ K auto-keep
                            |||||__ C event count
                            ||||___ R error rate
                            |||____ S speed/performance
                            ||_____ O updated online
                            |______ P prefailure warning

Read SMART Log Directory failed: Input/output error

General Purpose Log Directory not supported

SMART Extended Comprehensive Error Log (GP Log 0x03) not supported

SMART Error Log Version: 1
Warning: ATA error count 4189 inconsistent with error log pointer 5

ATA Error Count: 4189 (device log contains only the most recent five errors)
	CR = Command Register [HEX]
	FR = Features Register [HEX]
	SC = Sector Count Register [HEX]
	SN = Sector Number Register [HEX]
	CL = Cylinder Low Register [HEX]
	CH = Cylinder High Register [HEX]
	DH = Device/Head Register [HEX]
	DC = Device Command Register [HEX]
	ER = Error register [HEX]
	ST = Status register [HEX]
Powered_Up_Time is measured from power on, and printed as
DDd+hh:mm:SS.sss where DD=days, hh=hours, mm=minutes,
SS=sec, and sss=millisec. It "wraps" after 49.710 days.

Error 4189 occurred at disk power-on lifetime: 38590 hours (1607 days + 22 hours)
  When the command that caused the error occurred, the device was in an unknown state.

  After command completion occurred, registers were:
  ER ST SC SN CL CH DH
  -- -- -- -- -- -- --
  84 51 20 a0 3c 60 e3  Error: ICRC, ABRT at LBA = 0x03603ca0 = 56638624

  Commands leading to the command that caused the error were:
  CR FR SC SN CL CH DH DC   Powered_Up_Time  Command/Feature_Name
  -- -- -- -- -- -- -- --  ----------------  --------------------
  ca 00 60 60 3c 60 e3 00      01:12:31.056  WRITE DMA
  c6 00 10 00 00 00 e0 00      01:12:31.056  SET MULTIPLE MODE
  ef 03 45 00 00 00 e0 00      01:12:31.056  SET FEATURES [Set transfer mode]
  ec 00 00 00 00 00 e0 00      01:12:31.056  IDENTIFY DEVICE
  ca 00 60 60 3c 60 e3 04      01:12:30.960  WRITE DMA

Error 4188 occurred at disk power-on lifetime: 38590 hours (1607 days + 22 hours)
  When the command that caused the error occurred, the device was in an unknown state.

  After command completion occurred, registers were:
  ER ST SC SN CL CH DH
  -- -- -- -- -- -- --
  84 51 00 68 1c f8 e1  Error: ICRC, ABRT at LBA = 0x01f81c68 = 33037416

  Commands leading to the command that caused the error were:
  CR FR SC SN CL CH DH DC   Powered_Up_Time  Command/Feature_Name
  -- -- -- -- -- -- -- --  ----------------  --------------------
  c8 00 e0 68 1c f8 e1 00      01:10:15.024  READ DMA
  c8 00 e0 68 1c f8 e1 00      01:10:14.960  READ DMA
  c8 00 e0 68 1c f8 e1 00      01:10:14.896  READ DMA
  c8 00 e0 68 1c f8 e1 00      01:10:14.832  READ DMA
  c8 00 e0 68 1c f8 e1 00      01:10:14.768  READ DMA

Error 4187 occurred at disk power-on lifetime: 38590 hours (1607 days + 22 hours)
  When the command that caused the error occurred, the device was in an unknown state.

  After command completion occurred, registers were:
  ER ST SC SN CL CH DH
  -- -- -- -- -- -- --
  84 51 00 68 1c f8 e1  Error: ICRC, ABRT at LBA = 0x01f81c68 = 33037416

  Commands leading to the command that caused the error were:
  CR FR SC SN CL CH DH DC   Powered_Up_Time  Command/Feature_Name
  -- -- -- -- -- -- -- --  ----------------  --------------------
  c8 00 e0 68 1c f8 e1 00      01:10:14.960  READ DMA
  c8 00 e0 68 1c f8 e1 00      01:10:14.896  READ DMA
  c8 00 e0 68 1c f8 e1 00      01:10:14.832  READ DMA
  c8 00 e0 68 1c f8 e1 00      01:10:14.768  READ DMA
  ca 00 10 10 0a 40 e0 00      01:10:14.752  WRITE DMA

Error 4186 occurred at disk power-on lifetime: 38590 hours (1607 days + 22 hours)
  When the command that caused the error occurred, the device was in an unknown state.

  After command completion occurred, registers were:
  ER ST SC SN CL CH DH
  -- -- -- -- -- -- --
  84 51 00 68 1c f8 e1  Error: ICRC, ABRT at LBA = 0x01f81c68 = 33037416

  Commands leading to the command that caused the error were:
  CR FR SC SN CL CH DH DC   Powered_Up_Time  Command/Feature_Name
  -- -- -- -- -- -- -- --  ----------------  --------------------
  c8 00 e0 68 1c f8 e1 00      01:10:14.896  READ DMA
  c8 00 e0 68 1c f8 e1 00      01:10:14.832  READ DMA
  c8 00 e0 68 1c f8 e1 00      01:10:14.768  READ DMA
  ca 00 10 10 0a 40 e0 00      01:10:14.752  WRITE DMA
  ca 00 10 10 b6 8a e9 00      01:10:14.752  WRITE DMA

Error 4185 occurred at disk power-on lifetime: 38590 hours (1607 days + 22 hours)
  When the command that caused the error occurred, the device was in an unknown state.

  After command completion occurred, registers were:
  ER ST SC SN CL CH DH
  -- -- -- -- -- -- --
  84 51 00 68 1c f8 e1  Error: ICRC, ABRT at LBA = 0x01f81c68 = 33037416

  Commands leading to the command that caused the error were:
  CR FR SC SN CL CH DH DC   Powered_Up_Time  Command/Feature_Name
  -- -- -- -- -- -- -- --  ----------------  --------------------
  c8 00 e0 68 1c f8 e1 00      01:10:14.832  READ DMA
  c8 00 e0 68 1c f8 e1 00      01:10:14.768  READ DMA
  ca 00 10 10 0a 40 e0 00      01:10:14.752  WRITE DMA
  ca 00 10 10 b6 8a e9 00      01:10:14.752  WRITE DMA
  ca 00 10 10 b4 8a e9 00      01:10:14.752  WRITE DMA

SMART Extended Self-test Log (GP Log 0x07) not supported

SMART Self-test log structure revision number 1
Num  Test_Description    Status                  Remaining  LifeTime(hours)  LBA_of_first_error
# 1  Short offline       Completed without error       00%     38582         -
# 2  Short offline       Aborted by host               70%     35615         -
# 3  Short offline       Completed without error       00%     34562         -
# 4  Short offline       Completed without error       00%     33869         -
# 5  Short offline       Completed without error       00%     33176         -
# 6  Short offline       Completed without error       00%     32483         -
# 7  Short offline       Completed without error       00%     31827         -
# 8  Short offline       Completed without error       00%     31135         -
# 9  Short offline       Completed without error       00%     30442         -
#10  Short offline       Completed without error       00%     29749         -
#11  Short offline       Completed without error       00%     29076         -
#12  Short offline       Completed without error       00%     28383         -
#13  Short offline       Completed without error       00%     27786         -
#14  Short offline       Completed without error       00%     27094         -
#15  Short offline       Completed without error       00%     26401         -
#16  Short offline       Completed without error       00%     25725         -
#17  Short offline       Completed without error       00%     25050         -
#18  Short offline       Completed without error       00%     24357         -
#19  Short offline       Completed without error       00%     23686         -
#20  Short offline       Completed without error       00%     22993         -
#21  Short offline       Completed without error       00%     22300         -

SMART Selective self-test log data structure revision number 1
 SPAN  MIN_LBA  MAX_LBA  CURRENT_TEST_STATUS
    1        0        0  Not_testing
    2        0        0  Not_testing
    3        0        0  Not_testing
    4        0        0  Not_testing
    5        0        0  Not_testing
Selective self-test flags (0x0):
  After scanning selected spans, do NOT read-scan remainder of disk.
If Selective self-test is pending on power-up, resume after 0 minute delay.

SCT Commands not supported

Device Statistics (GP/SMART Log 0x04) not supported

Pending Defects log (GP Log 0x0c) not supported

SATA Phy Event Counters (GP Log 0x11) not supported

