smartctl 7.3 2022-02-28 r5338 [FreeBSD 13.1-RELEASE amd64] (local build)
Copyright (C) 2002-22, Bruce Allen, Christian Franke, www.smartmontools.org

=== START OF INFORMATION SECTION ===
Model Number:                       PSEJN512GA87EC0
Serial Number:                      --
Firmware Version:                   HPE36P01
PCI Vendor/Subsystem ID:            0x1987
IEEE OUI Identifier:                0x6479a7
Total NVM Capacity:                 512,110,190,592 [512 GB]
Unallocated NVM Capacity:           0
Controller ID:                      1
NVMe Version:                       1.4
Number of Namespaces:               1
Namespace 1 Size/Capacity:          512,110,190,592 [512 GB]
Namespace 1 Formatted LBA Size:     512
Namespace 1 IEEE EUI-64:            6479a7 ...
Local Time is:                      Tue May 28 18:56:28 2024 UTC
Firmware Updates (0x12):            1 Slot, no Reset required
Optional Admin Commands (0x0017):   Security Format Frmw_DL Self_Test
Optional NVM Commands (0x005f):     Comp Wr_Unc DS_Mngmt Wr_Zero Sav/Sel_Feat Timestmp
Log Page Attributes (0x1e):         Cmd_Eff_Lg Ext_Get_Lg Telmtry_Lg Pers_Ev_Lg
Maximum Data Transfer Size:         64 Pages
Warning  Comp. Temp. Threshold:     83 Celsius
Critical Comp. Temp. Threshold:     85 Celsius

Supported Power States
St Op     Max   Active     Idle   RL RT WL WT  Ent_Lat  Ex_Lat
 0 +     5.00W       -        -    0  0  0  0        0       0
 1 +     3.00W       -        -    1  1  1  1        0       0
 2 +     1.50W       -        -    2  2  2  2        0       0
 3 -   0.1000W       -        -    3  3  3  3     5000   10000
 4 -   0.0025W       -        -    4  4  4  4     5000   45000

Supported LBA Sizes (NSID 0x1)
Id Fmt  Data  Metadt  Rel_Perf
 0 +     512       0         1
 1 -    4096       0         0

=== START OF SMART DATA SECTION ===
SMART overall-health self-assessment test result: PASSED

SMART/Health Information (NVMe Log 0x02)
Critical Warning:                   0x00
Temperature:                        38 Celsius
Available Spare:                    100%
Available Spare Threshold:          10%
Percentage Used:                    3%
Data Units Read:                    31,106,954 [15.9 TB]
Data Units Written:                 28,812,698 [14.7 TB]
Host Read Commands:                 171,142,796
Host Write Commands:                274,053,901
Controller Busy Time:               822
Power Cycles:                       1,037
Power On Hours:                     212
Unsafe Shutdowns:                   106
Media and Data Integrity Errors:    0
Error Information Log Entries:      2,671
Warning  Comp. Temperature Time:    0
Critical Comp. Temperature Time:    0
Temperature Sensor 1:               45 Celsius
Temperature Sensor 2:               38 Celsius

Error Information (NVMe Log 0x01, 16 of 63 entries)
Num   ErrCount  SQId   CmdId  Status  PELoc          LBA  NSID    VS
  0       2671     0  0x0014  0xc004  0x028            0     0     -
  1       2670     0  0x301c  0xc004  0x004            0     1     -
  2       2669     0  0x3000  0xc004  0x004            0     1     -
  3       2668     0  0xd01c  0xc004  0x028            0     0     -
  4       2667     0  0x9011  0xc004  0x004            0     1     -
  5       2666     0  0x400f  0xc004  0x004            0     1     -
  6       2665     0  0x8010  0xc004  0x004            0     1     -
  7       2664     0  0x501c  0xc004  0x004            0     1     -
  8       2663     0  0x4000  0xc004  0x004            0     1     -
  9       2662     0  0x1002  0xc004  0x028            0     0     -
 10       2661     0  0xc011  0xc004  0x004            0     1     -
 11       2660     0  0xf010  0xc004  0x004            0     1     -
 12       2659     0  0xa00a  0xc004  0x004            0     1     -
 13       2658     0  0x9009  0xc004  0x004            0     1     -
 14       2657     0  0x0010  0xc004  0x028            0     0     -
 15       2656     0  0x200c  0xc004  0x004            0     1     -
... (47 entries not read)

