smartctl 7.4 2023-08-01 r5530 [FreeBSD 14.2-RELEASE-p2 amd64] (local build)
Copyright (C) 2002-23, Bruce Allen, Christian Franke, www.smartmontools.org

=== START OF INFORMATION SECTION ===
Device Model:     PNY CS900 240 SSD
Serial Number:    --
LU WWN Device Id: 5 f8db4c ...
Firmware Version: CS900J13
User Capacity:    240,057,409,536 bytes [240 GB]
Sector Size:      512 bytes logical/physical
Rotation Rate:    Solid State Device
Form Factor:      2.5 inches
TRIM Command:     Available
Device is:        Not in smartctl database 7.3/5528
ATA Version is:   ACS-4 (minor revision not indicated)
SATA Version is:  SATA 3.2, 6.0 Gb/s (current: 6.0 Gb/s)
Local Time is:    Mon Mar 24 21:37:23 2025 CET
SMART support is: Available - device has SMART capability.
SMART support is: Enabled
AAM feature is:   Unavailable
APM feature is:   Unavailable
Rd look-ahead is: Enabled
Write cache is:   Enabled
DSN feature is:   Unavailable
ATA Security is:  Disabled, frozen [SEC2]
Wt Cache Reorder: Unavailable

=== START OF READ SMART DATA SECTION ===
SMART overall-health self-assessment test result: PASSED

General SMART Values:
Offline data collection status:  (0x00)	Offline data collection activity
					was never started.
					Auto Offline Data Collection: Disabled.
Self-test execution status:      (   0)	The previous self-test routine completed
					without error or no self-test has ever 
					been run.
Total time to complete Offline 
data collection: 		(65535) seconds.
Offline data collection
capabilities: 			 (0x79) SMART execute Offline immediate.
					No Auto Offline data collection support.
					Suspend Offline collection upon new
					command.
					Offline surface scan supported.
					Self-test supported.
					Conveyance Self-test supported.
					Selective Self-test supported.
SMART capabilities:            (0x0003)	Saves SMART data before entering
					power-saving mode.
					Supports SMART auto save timer.
Error logging capability:        (0x01)	Error logging supported.
					General Purpose Logging supported.
Short self-test routine 
recommended polling time: 	 (   2) minutes.
Extended self-test routine
recommended polling time: 	 (  30) minutes.
Conveyance self-test routine
recommended polling time: 	 (   6) minutes.

SMART Attributes Data Structure revision number: 16
Vendor Specific SMART Attributes with Thresholds:
ID# ATTRIBUTE_NAME          FLAGS    VALUE WORST THRESH FAIL RAW_VALUE
  1 Raw_Read_Error_Rate     PO-R--   100   100   050    -    0
  9 Power_On_Hours          -O--C-   100   100   000    -    3326
 12 Power_Cycle_Count       -O--C-   100   100   000    -    1500
168 Unknown_Attribute       -O--C-   100   100   000    -    0
170 Unknown_Attribute       PO----   084   084   010    -    95
173 Unknown_Attribute       -O--C-   100   100   000    -    983058
192 Power-Off_Retract_Count -O--C-   100   100   000    -    523
194 Temperature_Celsius     PO---K   067   067   000    -    33 (Min/Max 33/33)
218 Unknown_Attribute       PO-R--   100   100   050    -    40647
231 Unknown_SSD_Attribute   PO--C-   100   100   000    -    98
241 Total_LBAs_Written      -O--C-   100   100   000    -    1348
                            ||||||_ K auto-keep
                            |||||__ C event count
                            ||||___ R error rate
                            |||____ S speed/performance
                            ||_____ O updated online
                            |______ P prefailure warning

General Purpose Log Directory Version 1
SMART           Log Directory Version 1 [multi-sector log support]
Address    Access  R/W   Size  Description
0x00       GPL,SL  R/O      1  Log Directory
0x01           SL  R/O      1  Summary SMART error log
0x02           SL  R/O     51  Comprehensive SMART error log
0x03       GPL     R/O     64  Ext. Comprehensive SMART error log
0x04       GPL,SL  R/O      8  Device Statistics log
0x06           SL  R/O      1  SMART self-test log
0x07       GPL     R/O      1  Extended self-test log
0x09           SL  R/W      1  Selective self-test log
0x10       GPL     R/O      1  NCQ Command Error log
0x11       GPL     R/O      1  SATA Phy Event Counters log
0x30       GPL,SL  R/O      9  IDENTIFY DEVICE data log
0x80-0x9f  GPL,SL  R/W     16  Host vendor specific log

SMART Extended Comprehensive Error Log Version: 1 (64 sectors)
Device Error Count: 289 (device log contains only the most recent 256 errors)
	CR     = Command Register
	FEATR  = Features Register
	COUNT  = Count (was: Sector Count) Register
	LBA_48 = Upper bytes of LBA High/Mid/Low Registers ]  ATA-8
	LH     = LBA High (was: Cylinder High) Register    ]   LBA
	LM     = LBA Mid (was: Cylinder Low) Register      ] Register
	LL     = LBA Low (was: Sector Number) Register     ]
	DV     = Device (was: Device/Head) Register
	DC     = Device Control Register
	ER     = Error register
	ST     = Status register
Powered_Up_Time is measured from power on, and printed as
DDd+hh:mm:SS.sss where DD=days, hh=hours, mm=minutes,
SS=sec, and sss=millisec. It "wraps" after 49.710 days.

Error 289 [32] occurred at disk power-on lifetime: 0 hours (0 days + 0 hours)
  When the command that caused the error occurred, the device was active or idle.

  After command completion occurred, registers were:
  ER -- ST COUNT  LBA_48  LH LM LL DV DC
  -- -- -- == -- == == == -- -- -- -- --
  84 -- 51 01 00 00 00 00 32 c8 00 40 00  Error: ICRC, ABRT 256 sectors at LBA = 0x0032c800 = 3328000

  Commands leading to the command that caused the error were:
  CR FEATR COUNT  LBA_48  LH LM LL DV DC  Powered_Up_Time  Command/Feature_Name
  -- == -- == -- == == == -- -- -- -- --  ---------------  --------------------
  25 00 00 01 00 00 00 00 32 c8 00 40 00     00:00:00.000  READ DMA EXT
  e1 00 00 00 0f 00 00 00 00 00 00 00 00     00:00:00.000  IDLE IMMEDIATE
  ef 00 02 00 00 00 00 00 00 00 00 00 00     00:00:00.000  SET FEATURES [Enable write cache]
  ef 00 90 00 06 00 00 00 00 00 00 00 00     00:00:00.000  SET FEATURES [Disable SATA feature]
  e1 00 00 00 02 00 00 00 00 00 00 00 00     00:00:00.000  IDLE IMMEDIATE

Error 288 [31] occurred at disk power-on lifetime: 0 hours (0 days + 0 hours)
  When the command that caused the error occurred, the device was active or idle.

  After command completion occurred, registers were:
  ER -- ST COUNT  LBA_48  LH LM LL DV DC
  -- -- -- == -- == == == -- -- -- -- --
  84 -- 51 01 00 00 00 00 00 08 00 40 00  Error: ICRC, ABRT 256 sectors at LBA = 0x00000800 = 2048

  Commands leading to the command that caused the error were:
  CR FEATR COUNT  LBA_48  LH LM LL DV DC  Powered_Up_Time  Command/Feature_Name
  -- == -- == -- == == == -- -- -- -- --  ---------------  --------------------
  25 00 00 01 00 00 00 00 00 08 00 40 00     00:00:00.000  READ DMA EXT
  e1 00 00 00 0f 00 00 00 00 00 00 00 00     00:00:00.000  IDLE IMMEDIATE
  ef 00 02 00 00 00 00 00 00 00 00 00 00     00:00:00.000  SET FEATURES [Enable write cache]
  ef 00 90 00 06 00 00 00 00 00 00 00 00     00:00:00.000  SET FEATURES [Disable SATA feature]
  e1 00 00 00 02 00 00 00 00 00 00 00 00     00:00:00.000  IDLE IMMEDIATE

Error 287 [30] occurred at disk power-on lifetime: 0 hours (0 days + 0 hours)
  When the command that caused the error occurred, the device was active or idle.

  After command completion occurred, registers were:
  ER -- ST COUNT  LBA_48  LH LM LL DV DC
  -- -- -- == -- == == == -- -- -- -- --
  84 -- 51 00 08 00 00 00 5f e6 00 e0 00  Error: ICRC, ABRT 8 sectors at LBA = 0x005fe600 = 6284800

  Commands leading to the command that caused the error were:
  CR FEATR COUNT  LBA_48  LH LM LL DV DC  Powered_Up_Time  Command/Feature_Name
  -- == -- == -- == == == -- -- -- -- --  ---------------  --------------------
  25 00 00 00 08 00 00 00 5f e6 00 e0 00     00:00:00.000  READ DMA EXT
  25 00 00 00 08 00 00 00 5f e5 f8 e0 00     00:00:00.000  READ DMA EXT
  ef 00 90 00 03 00 00 00 00 00 00 a0 00     00:00:00.000  SET FEATURES [Disable SATA feature]
  ef 00 02 00 00 00 00 00 00 00 00 a0 00     00:00:00.000  SET FEATURES [Enable write cache]
  ff 00 d5 00 01 00 00 00 00 00 01 00 ff     00:00:00.000  [VENDOR SPECIFIC]

Error 286 [29] occurred at disk power-on lifetime: 0 hours (0 days + 0 hours)
  When the command that caused the error occurred, the device was active or idle.

  After command completion occurred, registers were:
  ER -- ST COUNT  LBA_48  LH LM LL DV DC
  -- -- -- == -- == == == -- -- -- -- --
  84 -- 51 00 08 00 00 00 5f e5 f8 e0 00  Error: ICRC, ABRT 8 sectors at LBA = 0x005fe5f8 = 6284792

  Commands leading to the command that caused the error were:
  CR FEATR COUNT  LBA_48  LH LM LL DV DC  Powered_Up_Time  Command/Feature_Name
  -- == -- == -- == == == -- -- -- -- --  ---------------  --------------------
  25 00 00 00 08 00 00 00 5f e5 f8 e0 00     00:00:00.000  READ DMA EXT
  25 00 00 00 08 00 00 00 5f e5 f0 e0 00     00:00:00.000  READ DMA EXT
  ef 00 90 00 03 00 00 00 00 00 00 a0 00     00:00:00.000  SET FEATURES [Disable SATA feature]
  ef 00 02 00 00 00 00 00 00 00 00 a0 00     00:00:00.000  SET FEATURES [Enable write cache]
  ff 00 d5 00 01 00 00 00 00 00 01 00 ff     00:00:00.000  [VENDOR SPECIFIC]

Error 285 [28] occurred at disk power-on lifetime: 0 hours (0 days + 0 hours)
  When the command that caused the error occurred, the device was active or idle.

  After command completion occurred, registers were:
  ER -- ST COUNT  LBA_48  LH LM LL DV DC
  -- -- -- == -- == == == -- -- -- -- --
  84 -- 51 00 08 00 00 00 5f e5 f0 e0 00  Error: ICRC, ABRT 8 sectors at LBA = 0x005fe5f0 = 6284784

  Commands leading to the command that caused the error were:
  CR FEATR COUNT  LBA_48  LH LM LL DV DC  Powered_Up_Time  Command/Feature_Name
  -- == -- == -- == == == -- -- -- -- --  ---------------  --------------------
  25 00 00 00 08 00 00 00 5f e5 f0 e0 00     00:00:00.000  READ DMA EXT
  25 00 00 00 08 00 00 00 5f e5 e8 e0 00     00:00:00.000  READ DMA EXT
  25 00 00 00 08 00 00 00 5f e5 e0 e0 00     00:00:00.000  READ DMA EXT
  25 00 00 00 08 00 00 00 5f e5 d8 e0 00     00:00:00.000  READ DMA EXT
  25 00 00 00 08 00 00 00 5f e5 d0 e0 00     00:00:00.000  READ DMA EXT

Error 284 [27] occurred at disk power-on lifetime: 0 hours (0 days + 0 hours)
  When the command that caused the error occurred, the device was active or idle.

  After command completion occurred, registers were:
  ER -- ST COUNT  LBA_48  LH LM LL DV DC
  -- -- -- == -- == == == -- -- -- -- --
  84 -- 51 00 08 00 00 00 5f e5 b8 e0 00  Error: ICRC, ABRT 8 sectors at LBA = 0x005fe5b8 = 6284728

  Commands leading to the command that caused the error were:
  CR FEATR COUNT  LBA_48  LH LM LL DV DC  Powered_Up_Time  Command/Feature_Name
  -- == -- == -- == == == -- -- -- -- --  ---------------  --------------------
  25 00 00 00 08 00 00 00 5f e5 b8 e0 00     00:00:00.000  READ DMA EXT
  ef 00 90 00 03 00 00 00 00 00 00 a0 00     00:00:00.000  SET FEATURES [Disable SATA feature]
  ef 00 02 00 00 00 00 00 00 00 00 a0 00     00:00:00.000  SET FEATURES [Enable write cache]
  ff 00 d5 00 01 00 00 00 00 00 01 00 ff     00:00:00.000  [VENDOR SPECIFIC]
  ff 00 d5 00 01 00 00 00 00 00 01 00 ff     00:00:00.000  [VENDOR SPECIFIC]

Error 283 [26] occurred at disk power-on lifetime: 0 hours (0 days + 0 hours)
  When the command that caused the error occurred, the device was active or idle.

  After command completion occurred, registers were:
  ER -- ST COUNT  LBA_48  LH LM LL DV DC
  -- -- -- == -- == == == -- -- -- -- --
  84 -- 51 00 08 00 00 00 5f e5 48 e0 00  Error: ICRC, ABRT 8 sectors at LBA = 0x005fe548 = 6284616

  Commands leading to the command that caused the error were:
  CR FEATR COUNT  LBA_48  LH LM LL DV DC  Powered_Up_Time  Command/Feature_Name
  -- == -- == -- == == == -- -- -- -- --  ---------------  --------------------
  25 00 00 00 08 00 00 00 5f e5 48 e0 00     00:00:00.000  READ DMA EXT
  25 00 00 00 08 00 00 00 5f e5 40 e0 00     00:00:00.000  READ DMA EXT
  25 00 00 00 08 00 00 00 5f e5 38 e0 00     00:00:00.000  READ DMA EXT
  25 00 00 00 08 00 00 00 5f e5 30 e0 00     00:00:00.000  READ DMA EXT
  25 00 00 00 08 00 00 00 5f e5 28 e0 00     00:00:00.000  READ DMA EXT

Error 282 [25] occurred at disk power-on lifetime: 0 hours (0 days + 0 hours)
  When the command that caused the error occurred, the device was active or idle.

  After command completion occurred, registers were:
  ER -- ST COUNT  LBA_48  LH LM LL DV DC
  -- -- -- == -- == == == -- -- -- -- --
  84 -- 51 00 08 00 00 00 5f e4 c8 e0 00  Error: ICRC, ABRT 8 sectors at LBA = 0x005fe4c8 = 6284488

  Commands leading to the command that caused the error were:
  CR FEATR COUNT  LBA_48  LH LM LL DV DC  Powered_Up_Time  Command/Feature_Name
  -- == -- == -- == == == -- -- -- -- --  ---------------  --------------------
  25 00 00 00 08 00 00 00 5f e4 c8 e0 00     00:00:00.000  READ DMA EXT
  25 00 00 00 08 00 00 00 5f e4 c0 e0 00     00:00:00.000  READ DMA EXT
  25 00 00 00 08 00 00 00 5f e4 b8 e0 00     00:00:00.000  READ DMA EXT
  25 00 00 00 08 00 00 00 5f e4 b0 e0 00     00:00:00.000  READ DMA EXT
  25 00 00 00 08 00 00 00 5f e4 a8 e0 00     00:00:00.000  READ DMA EXT

SMART Extended Self-test Log Version: 1 (1 sectors)
No self-tests have been logged.  [To run self-tests, use: smartctl -t]

SMART Selective self-test log data structure revision number 0
Note: revision number not 1 implies that no selective self-test has ever been run
 SPAN  MIN_LBA  MAX_LBA  CURRENT_TEST_STATUS
    1        0        0  Not_testing
    2        0        0  Not_testing
    3        0        0  Not_testing
    4        0        0  Not_testing
    5        0        0  Not_testing
Selective self-test flags (0x0):
  After scanning selected spans, do NOT read-scan remainder of disk.
If Selective self-test is pending on power-up, resume after 0 minute delay.

SCT Commands not supported

Device Statistics (GP Log 0x04)
Page  Offset Size        Value Flags Description
0x01  =====  =               =  ===  == General Statistics (rev 1) ==
0x01  0x008  4            1500  ---  Lifetime Power-On Resets
0x01  0x010  4            3326  ---  Power-on Hours
0x01  0x018  6      2827634854  ---  Logical Sectors Written
0x01  0x028  6      1453589041  ---  Logical Sectors Read
0x04  =====  =               =  ===  == General Errors Statistics (rev 1) ==
0x04  0x008  4               0  ---  Number of Reported Uncorrectable Errors
0x05  =====  =               =  ===  == Temperature Statistics (rev 1) ==
0x05  0x008  1              33  ---  Current Temperature
0x05  0x020  1              33  ---  Highest Temperature
0x05  0x028  1              33  ---  Lowest Temperature
0x06  =====  =               =  ===  == Transport Statistics (rev 1) ==
0x06  0x018  4           40647  ---  Number of Interface CRC Errors
0x07  =====  =               =  ===  == Solid State Device Statistics (rev 1) ==
0x07  0x008  1               1  ---  Percentage Used Endurance Indicator
                                |||_ C monitored condition met
                                ||__ D supports DSN
                                |___ N normalized value

Pending Defects log (GP Log 0x0c) not supported

SATA Phy Event Counters (GP Log 0x11)
ID      Size     Value  Description
0x0001  2            0  Command failed due to ICRC error
0x0003  2            0  R_ERR response for device-to-host data FIS
0x0004  2            0  R_ERR response for host-to-device data FIS
0x0006  2            0  R_ERR response for device-to-host non-data FIS
0x0007  2            0  R_ERR response for host-to-device non-data FIS
0x0008  2            0  Device-to-host non-data FIS retries
0x0009  4           30  Transition from drive PhyRdy to drive PhyNRdy
0x000a  4           31  Device-to-host register FISes sent due to a COMRESET
0x000f  2            0  R_ERR response for host-to-device data FIS, CRC
0x0010  2            0  R_ERR response for host-to-device data FIS, non-CRC
0x0012  2            0  R_ERR response for host-to-device non-data FIS, CRC
0x0013  2            0  R_ERR response for host-to-device non-data FIS, non-CRC

