smartctl 7.3 2022-02-28 r5338 [FreeBSD 13.1-RELEASE amd64] (local build)
Copyright (C) 2002-22, Bruce Allen, Christian Franke, www.smartmontools.org

=== START OF INFORMATION SECTION ===
Model Number:                       ADATA SWORDFISH
Serial Number:                      --
Firmware Version:                   VC0S0260
PCI Vendor/Subsystem ID:            0x10ec
IEEE OUI Identifier:                0x00e04c
Controller ID:                      1
NVMe Version:                       1.3
Number of Namespaces:               1
Namespace 1 Size/Capacity:          250,059,350,016 [250 GB]
Namespace 1 Formatted LBA Size:     512
Namespace 1 IEEE EUI-64:            564330 ...
Local Time is:                      Wed Mar 15 19:07:34 2023 UTC
Firmware Updates (0x02):            1 Slot
Optional Admin Commands (0x0007):   Security Format Frmw_DL
Optional NVM Commands (0x0014):     DS_Mngmt Sav/Sel_Feat
Log Page Attributes (0x03):         S/H_per_NS Cmd_Eff_Lg
Maximum Data Transfer Size:         32 Pages
Warning  Comp. Temp. Threshold:     118 Celsius
Critical Comp. Temp. Threshold:     150 Celsius

Supported Power States
St Op     Max   Active     Idle   RL RT WL WT  Ent_Lat  Ex_Lat
 0 +     8.00W       -        -    0  0  0  0        0       0
 1 +     4.00W       -        -    1  1  1  1        0       0
 2 +     3.00W       -        -    2  2  2  2        0       0
 3 -   0.0300W       -        -    3  3  3  3     5000   10000
 4 -   0.0080W       -        -    4  4  4  4    20000   45000

Supported LBA Sizes (NSID 0x1)
Id Fmt  Data  Metadt  Rel_Perf
 0 +     512       0         0

=== START OF SMART DATA SECTION ===
SMART overall-health self-assessment test result: PASSED

SMART/Health Information (NVMe Log 0x02)
Critical Warning:                   0x00
Temperature:                        35 Celsius
Available Spare:                    100%
Available Spare Threshold:          32%
Percentage Used:                    7%
Data Units Read:                    45,258,964 [23.1 TB]
Data Units Written:                 31,034,456 [15.8 TB]
Host Read Commands:                 496,590,138
Host Write Commands:                261,728,236
Controller Busy Time:               0
Power Cycles:                       3,155
Power On Hours:                     1,308
Unsafe Shutdowns:                   174
Media and Data Integrity Errors:    0
Error Information Log Entries:      2,994
Warning  Comp. Temperature Time:    0
Critical Comp. Temperature Time:    0

Error Information (NVMe Log 0x01, 8 of 8 entries)
No Errors Logged

