smartctl 7.4 2023-08-01 r5530 [OpenBSD 7.5 amd64] (local build)
Copyright (C) 2002-23, Bruce Allen, Christian Franke, www.smartmontools.org

=== START OF INFORMATION SECTION ===
Model Family:     Crucial/Micron Client SSDs
Device Model:     CT240BX500SSD1
Serial Number:    --
LU WWN Device Id: 5 00a075 ...
Firmware Version: M6CR056
User Capacity:    240,057,409,536 bytes [240 GB]
Sector Size:      512 bytes logical/physical
Rotation Rate:    Solid State Device
Form Factor:      2.5 inches
TRIM Command:     Available
Device is:        In smartctl database 7.3/5528
ATA Version is:   ACS-3 T13/2161-D revision 4
SATA Version is:  SATA 3.3, 6.0 Gb/s (current: 3.0 Gb/s)
Local Time is:    Thu Jul 18 16:58:43 2024 BST
SMART support is: Available - device has SMART capability.
SMART support is: Enabled

=== START OF READ SMART DATA SECTION ===
SMART Status not supported: Incomplete response, ATA output registers missing
SMART overall-health self-assessment test result: PASSED
Warning: This result is based on an Attribute check.

General SMART Values:
Offline data collection status:  (0x00)	Offline data collection activity
					was never started.
					Auto Offline Data Collection: Disabled.
Self-test execution status:      (   0)	The previous self-test routine completed
					without error or no self-test has ever 
					been run.
Total time to complete Offline 
data collection: 		(  120) seconds.
Offline data collection
capabilities: 			 (0x11) SMART execute Offline immediate.
					No Auto Offline data collection support.
					Suspend Offline collection upon new
					command.
					No Offline surface scan supported.
					Self-test supported.
					No Conveyance Self-test supported.
					No Selective Self-test supported.
SMART capabilities:            (0x0002)	Does not save SMART data before
					entering power-saving mode.
					Supports SMART auto save timer.
Error logging capability:        (0x01)	Error logging supported.
					General Purpose Logging supported.
Short self-test routine 
recommended polling time: 	 (   2) minutes.
Extended self-test routine
recommended polling time: 	 (  10) minutes.

SMART Attributes Data Structure revision number: 16
Vendor Specific SMART Attributes with Thresholds:
ID# ATTRIBUTE_NAME          FLAG     VALUE WORST THRESH TYPE      UPDATED  WHEN_FAILED RAW_VALUE
  1 Raw_Read_Error_Rate     0x002f   100   100   000    Pre-fail  Always       -       0
  5 Reallocate_NAND_Blk_Cnt 0x0032   100   100   010    Old_age   Always       -       0
  9 Power_On_Hours          0x0032   100   100   000    Old_age   Always       -       186
 12 Power_Cycle_Count       0x0032   100   100   000    Old_age   Always       -       153
171 Program_Fail_Count      0x0032   100   100   000    Old_age   Always       -       0
172 Erase_Fail_Count        0x0032   100   100   000    Old_age   Always       -       0
173 Ave_Block-Erase_Count   0x0032   100   100   000    Old_age   Always       -       6
174 Unexpect_Power_Loss_Ct  0x0032   100   100   000    Old_age   Always       -       29
180 Unused_Reserve_NAND_Blk 0x0033   100   100   000    Pre-fail  Always       -       17
183 SATA_Interfac_Downshift 0x0032   100   100   000    Old_age   Always       -       0
184 Error_Correction_Count  0x0032   100   100   000    Old_age   Always       -       0
187 Reported_Uncorrect      0x0032   100   100   000    Old_age   Always       -       0
194 Temperature_Celsius     0x0022   061   054   000    Old_age   Always       -       39 (Min/Max 19/46)
196 Reallocated_Event_Count 0x0032   100   100   000    Old_age   Always       -       0
197 Current_Pending_ECC_Cnt 0x0032   100   100   000    Old_age   Always       -       0
198 Offline_Uncorrectable   0x0030   100   100   000    Old_age   Offline      -       0
199 UDMA_CRC_Error_Count    0x0032   100   100   000    Old_age   Always       -       0
202 Percent_Lifetime_Remain 0x0030   100   100   001    Old_age   Offline      -       0
206 Write_Error_Rate        0x000e   100   100   000    Old_age   Always       -       0
210 Success_RAIN_Recov_Cnt  0x0032   100   100   000    Old_age   Always       -       0
246 Total_LBAs_Written      0x0032   100   100   000    Old_age   Always       -       817083233
247 Host_Program_Page_Count 0x0032   100   100   000    Old_age   Always       -       25533851
248 FTL_Program_Page_Count  0x0032   100   100   000    Old_age   Always       -       17654208
249 Unkn_CrucialMicron_Attr 0x0032   100   100   000    Old_age   Always       -       0
250 Read_Error_Retry_Rate   0x0032   100   100   000    Old_age   Always       -       0
251 Unkn_CrucialMicron_Attr 0x0032   100   100   000    Old_age   Always       -       1326249647
252 Unkn_CrucialMicron_Attr 0x0032   100   100   000    Old_age   Always       -       0
253 Unkn_CrucialMicron_Attr 0x0032   100   100   000    Old_age   Always       -       0
254 Unkn_CrucialMicron_Attr 0x0032   100   100   000    Old_age   Always       -       0
223 Unkn_CrucialMicron_Attr 0x0032   100   100   000    Old_age   Always       -       0

SMART Error Log not supported

SMART Self-test log structure revision number 1
No self-tests have been logged.  [To run self-tests, use: smartctl -t]

Selective Self-tests/Logging not supported

The above only provides legacy SMART information - try 'smartctl -x' for more



