smartctl 7.2 2020-12-30 r5155 [FreeBSD 12.1-RELEASE-p20-HBSD amd64] (local build)
Copyright (C) 2002-20, Bruce Allen, Christian Franke, www.smartmontools.org

=== START OF INFORMATION SECTION ===
Model Family:     Western Digital Caviar Blue Serial ATA
Device Model:     WDC WD1600AAJS-22L7A0
Serial Number:    --
LU WWN Device Id: 5 0014ee ...
Firmware Version: 01.03E01
User Capacity:    160,041,885,696 bytes [160 GB]
Sector Size:      512 bytes logical/physical
Device is:        In smartctl database [for details use: -P show]
ATA Version is:   ATA8-ACS (minor revision not indicated)
SATA Version is:  SATA 2.5, 3.0 Gb/s
Local Time is:    Thu Oct 21 11:18:21 2021 KST
SMART support is: Available - device has SMART capability.
SMART support is: Enabled
AAM level is:     254 (maximum performance), recommended: 128
APM feature is:   Unavailable
Rd look-ahead is: Enabled
Write cache is:   Enabled
DSN feature is:   Unavailable
ATA Security is:  Disabled, frozen [SEC2]
Wt Cache Reorder: Enabled

=== START OF READ SMART DATA SECTION ===
SMART overall-health self-assessment test result: PASSED

General SMART Values:
Offline data collection status:  (0x84)	Offline data collection activity
					was suspended by an interrupting command from host.
					Auto Offline Data Collection: Enabled.
Self-test execution status:      (   0)	The previous self-test routine completed
					without error or no self-test has ever 
					been run.
Total time to complete Offline 
data collection: 		( 3000) seconds.
Offline data collection
capabilities: 			 (0x7b) SMART execute Offline immediate.
					Auto Offline data collection on/off support.
					Suspend Offline collection upon new
					command.
					Offline surface scan supported.
					Self-test supported.
					Conveyance Self-test supported.
					Selective Self-test supported.
SMART capabilities:            (0x0003)	Saves SMART data before entering
					power-saving mode.
					Supports SMART auto save timer.
Error logging capability:        (0x01)	Error logging supported.
					General Purpose Logging supported.
Short self-test routine 
recommended polling time: 	 (   2) minutes.
Extended self-test routine
recommended polling time: 	 (  39) minutes.
Conveyance self-test routine
recommended polling time: 	 (   5) minutes.
SCT capabilities: 	       (0x303f)	SCT Status supported.
					SCT Error Recovery Control supported.
					SCT Feature Control supported.
					SCT Data Table supported.

SMART Attributes Data Structure revision number: 16
Vendor Specific SMART Attributes with Thresholds:
ID# ATTRIBUTE_NAME          FLAGS    VALUE WORST THRESH FAIL RAW_VALUE
  1 Raw_Read_Error_Rate     POSR-K   200   200   051    -    22
  3 Spin_Up_Time            POS--K   129   114   021    -    4525
  4 Start_Stop_Count        -O--CK   095   095   000    -    5757
  5 Reallocated_Sector_Ct   PO--CK   200   200   140    -    0
  7 Seek_Error_Rate         -OSR-K   100   253   000    -    0
  9 Power_On_Hours          -O--CK   011   011   000    -    65183
 10 Spin_Retry_Count        -O--CK   100   100   000    -    0
 11 Calibration_Retry_Count -O--CK   100   100   000    -    0
 12 Power_Cycle_Count       -O--CK   095   095   000    -    5606
192 Power-Off_Retract_Count -O--CK   199   199   000    -    1119
193 Load_Cycle_Count        -O--CK   199   199   000    -    5757
194 Temperature_Celsius     -O---K   111   088   000    -    32
196 Reallocated_Event_Count -O--CK   200   200   000    -    0
197 Current_Pending_Sector  -O--CK   200   200   000    -    0
198 Offline_Uncorrectable   ----CK   200   200   000    -    0
199 UDMA_CRC_Error_Count    -O--CK   200   200   000    -    0
200 Multi_Zone_Error_Rate   ---R--   200   200   000    -    0
                            ||||||_ K auto-keep
                            |||||__ C event count
                            ||||___ R error rate
                            |||____ S speed/performance
                            ||_____ O updated online
                            |______ P prefailure warning

General Purpose Log Directory Version 1
SMART           Log Directory Version 1 [multi-sector log support]
Address    Access  R/W   Size  Description
0x00       GPL,SL  R/O      1  Log Directory
0x01           SL  R/O      1  Summary SMART error log
0x02           SL  R/O      5  Comprehensive SMART error log
0x03       GPL     R/O      6  Ext. Comprehensive SMART error log
0x06           SL  R/O      1  SMART self-test log
0x07       GPL     R/O      1  Extended self-test log
0x09           SL  R/W      1  Selective self-test log
0x10       GPL     R/O      1  NCQ Command Error log
0x11       GPL     R/O      1  SATA Phy Event Counters log
0x80-0x9f  GPL,SL  R/W     16  Host vendor specific log
0xa0-0xa7  GPL,SL  VS      16  Device vendor specific log
0xa8-0xb7  GPL,SL  VS       1  Device vendor specific log
0xc0       GPL,SL  VS       1  Device vendor specific log
0xc1       GPL     VS      24  Device vendor specific log
0xe0       GPL,SL  R/W      1  SCT Command/Status
0xe1       GPL,SL  R/W      1  SCT Data Transfer

SMART Extended Comprehensive Error Log Version: 1 (6 sectors)
Device Error Count: 21
	CR     = Command Register
	FEATR  = Features Register
	COUNT  = Count (was: Sector Count) Register
	LBA_48 = Upper bytes of LBA High/Mid/Low Registers ]  ATA-8
	LH     = LBA High (was: Cylinder High) Register    ]   LBA
	LM     = LBA Mid (was: Cylinder Low) Register      ] Register
	LL     = LBA Low (was: Sector Number) Register     ]
	DV     = Device (was: Device/Head) Register
	DC     = Device Control Register
	ER     = Error register
	ST     = Status register
Powered_Up_Time is measured from power on, and printed as
DDd+hh:mm:SS.sss where DD=days, hh=hours, mm=minutes,
SS=sec, and sss=millisec. It "wraps" after 49.710 days.

Error 21 [20] occurred at disk power-on lifetime: 12926 hours (538 days + 14 hours)
  When the command that caused the error occurred, the device was active or idle.

  After command completion occurred, registers were:
  ER -- ST COUNT  LBA_48  LH LM LL DV DC
  -- -- -- == -- == == == -- -- -- -- --
  40 -- 51 00 20 00 01 74 00 8b af e0 00  Error: UNC 32 sectors at LBA = 0x174008baf = 6241160111

  Commands leading to the command that caused the error were:
  CR FEATR COUNT  LBA_48  LH LM LL DV DC  Powered_Up_Time  Command/Feature_Name
  -- == -- == -- == == == -- -- -- -- --  ---------------  --------------------
  25 00 00 00 20 00 00 01 8b 74 af e0 00     00:00:46.286  READ DMA EXT
  25 00 00 00 01 00 00 0b 7a a5 d4 e0 00     00:00:46.266  READ DMA EXT
  25 00 00 00 20 00 00 02 2a da ae e0 00     00:00:46.253  READ DMA EXT
  25 00 00 00 01 00 00 04 53 43 65 e0 00     00:00:46.244  READ DMA EXT
  35 00 00 00 01 00 00 00 00 2b e9 e0 00     00:00:46.244  WRITE DMA EXT

Error 20 [19] occurred at disk power-on lifetime: 12926 hours (538 days + 14 hours)
  When the command that caused the error occurred, the device was active or idle.

  After command completion occurred, registers were:
  ER -- ST COUNT  LBA_48  LH LM LL DV DC
  -- -- -- == -- == == == -- -- -- -- --
  40 -- 51 00 20 00 01 74 00 8b af e0 00  Error: UNC 32 sectors at LBA = 0x174008baf = 6241160111

  Commands leading to the command that caused the error were:
  CR FEATR COUNT  LBA_48  LH LM LL DV DC  Powered_Up_Time  Command/Feature_Name
  -- == -- == -- == == == -- -- -- -- --  ---------------  --------------------
  25 00 00 00 20 00 00 01 8b 74 af e0 00     00:00:44.033  READ DMA EXT
  25 00 00 00 20 00 00 01 89 68 8f e0 00     00:00:44.027  READ DMA EXT
  25 00 00 00 20 00 00 01 89 0e 0f e0 00     00:00:44.026  READ DMA EXT
  25 00 00 00 20 00 00 01 89 0d ef e0 00     00:00:44.022  READ DMA EXT
  25 00 00 00 20 00 00 01 92 7e 6f e0 00     00:00:44.021  READ DMA EXT

Error 19 [18] occurred at disk power-on lifetime: 12834 hours (534 days + 18 hours)
  When the command that caused the error occurred, the device was active or idle.

  After command completion occurred, registers were:
  ER -- ST COUNT  LBA_48  LH LM LL DV DC
  -- -- -- == -- == == == -- -- -- -- --
  40 -- 51 00 20 00 00 3c 00 8b ef e0 00  Error: UNC 32 sectors at LBA = 0x3c008bef = 1006668783

  Commands leading to the command that caused the error were:
  CR FEATR COUNT  LBA_48  LH LM LL DV DC  Powered_Up_Time  Command/Feature_Name
  -- == -- == -- == == == -- -- -- -- --  ---------------  --------------------
  25 00 00 00 20 00 00 00 8b 3c ef e0 00     00:05:45.327  READ DMA EXT
  25 00 00 00 01 00 00 0b 7a a5 d4 e0 00     00:05:45.313  READ DMA EXT
  25 00 00 00 20 00 00 02 af 9a 6e e0 00     00:05:45.303  READ DMA EXT
  25 00 00 00 01 00 00 04 53 43 65 e0 00     00:05:45.293  READ DMA EXT
  35 00 00 00 01 00 00 00 00 2b e9 e0 00     00:05:45.293  WRITE DMA EXT

Error 18 [17] occurred at disk power-on lifetime: 12834 hours (534 days + 18 hours)
  When the command that caused the error occurred, the device was active or idle.

  After command completion occurred, registers were:
  ER -- ST COUNT  LBA_48  LH LM LL DV DC
  -- -- -- == -- == == == -- -- -- -- --
  40 -- 51 00 20 00 00 3c 00 8b ef e0 00  Error: UNC 32 sectors at LBA = 0x3c008bef = 1006668783

  Commands leading to the command that caused the error were:
  CR FEATR COUNT  LBA_48  LH LM LL DV DC  Powered_Up_Time  Command/Feature_Name
  -- == -- == -- == == == -- -- -- -- --  ---------------  --------------------
  25 00 00 00 20 00 00 00 8b 3c ef e0 00     00:05:43.091  READ DMA EXT
  25 00 00 00 20 00 00 00 8b 37 ef e0 00     00:05:43.090  READ DMA EXT
  25 00 00 00 20 00 00 00 8b 37 cf e0 00     00:05:43.090  READ DMA EXT
  25 00 00 00 20 00 00 00 8b 37 af e0 00     00:05:43.089  READ DMA EXT
  35 00 00 00 20 00 00 00 8b 37 af e0 00     00:05:43.089  WRITE DMA EXT

Error 17 [16] occurred at disk power-on lifetime: 12834 hours (534 days + 18 hours)
  When the command that caused the error occurred, the device was active or idle.

  After command completion occurred, registers were:
  ER -- ST COUNT  LBA_48  LH LM LL DV DC
  -- -- -- == -- == == == -- -- -- -- --
  40 -- 51 00 08 00 00 3c 00 8b ef e0 00  Error: UNC 8 sectors at LBA = 0x3c008bef = 1006668783

  Commands leading to the command that caused the error were:
  CR FEATR COUNT  LBA_48  LH LM LL DV DC  Powered_Up_Time  Command/Feature_Name
  -- == -- == -- == == == -- -- -- -- --  ---------------  --------------------
  25 da d8 00 08 00 00 00 8b 3c ef e0 00     00:01:06.089  READ DMA EXT
  35 da d8 00 01 00 00 00 00 2b e9 e0 00     00:01:06.089  WRITE DMA EXT
  35 da d8 00 01 00 00 00 00 00 63 e0 00     00:01:06.089  WRITE DMA EXT
  35 da d8 00 01 00 00 00 00 00 3f e0 00     00:01:06.089  WRITE DMA EXT
  25 da d8 00 08 00 00 00 8b 3c ef e0 00     00:01:03.899  READ DMA EXT

Error 16 [15] occurred at disk power-on lifetime: 12834 hours (534 days + 18 hours)
  When the command that caused the error occurred, the device was active or idle.

  After command completion occurred, registers were:
  ER -- ST COUNT  LBA_48  LH LM LL DV DC
  -- -- -- == -- == == == -- -- -- -- --
  40 -- 51 00 08 00 00 3c 00 8b ef e0 00  Error: UNC 8 sectors at LBA = 0x3c008bef = 1006668783

  Commands leading to the command that caused the error were:
  CR FEATR COUNT  LBA_48  LH LM LL DV DC  Powered_Up_Time  Command/Feature_Name
  -- == -- == -- == == == -- -- -- -- --  ---------------  --------------------
  25 da d8 00 08 00 00 00 8b 3c ef e0 00     00:01:03.899  READ DMA EXT
  35 da d8 00 01 00 00 00 00 2b e9 e0 00     00:01:03.899  WRITE DMA EXT
  35 da d8 00 01 00 00 00 00 00 63 e0 00     00:01:03.899  WRITE DMA EXT
  35 da d8 00 01 00 00 00 00 00 3f e0 00     00:01:03.899  WRITE DMA EXT
  25 da d8 00 08 00 00 00 8b 3c ef e0 00     00:01:01.710  READ DMA EXT

Error 15 [14] occurred at disk power-on lifetime: 12834 hours (534 days + 18 hours)
  When the command that caused the error occurred, the device was active or idle.

  After command completion occurred, registers were:
  ER -- ST COUNT  LBA_48  LH LM LL DV DC
  -- -- -- == -- == == == -- -- -- -- --
  40 -- 51 00 08 00 00 3c 00 8b ef e0 00  Error: UNC 8 sectors at LBA = 0x3c008bef = 1006668783

  Commands leading to the command that caused the error were:
  CR FEATR COUNT  LBA_48  LH LM LL DV DC  Powered_Up_Time  Command/Feature_Name
  -- == -- == -- == == == -- -- -- -- --  ---------------  --------------------
  25 da d8 00 08 00 00 00 8b 3c ef e0 00     00:01:01.710  READ DMA EXT
  35 da d8 00 01 00 00 00 00 2b e9 e0 00     00:01:01.710  WRITE DMA EXT
  35 da d8 00 01 00 00 00 00 00 63 e0 00     00:01:01.710  WRITE DMA EXT
  35 da d8 00 01 00 00 00 00 00 3f e0 00     00:01:01.710  WRITE DMA EXT
  25 da d8 00 08 00 00 00 8b 3c ef e0 00     00:00:59.521  READ DMA EXT

Error 14 [13] occurred at disk power-on lifetime: 12834 hours (534 days + 18 hours)
  When the command that caused the error occurred, the device was active or idle.

  After command completion occurred, registers were:
  ER -- ST COUNT  LBA_48  LH LM LL DV DC
  -- -- -- == -- == == == -- -- -- -- --
  40 -- 51 00 08 00 00 3c 00 8b ef e0 00  Error: UNC 8 sectors at LBA = 0x3c008bef = 1006668783

  Commands leading to the command that caused the error were:
  CR FEATR COUNT  LBA_48  LH LM LL DV DC  Powered_Up_Time  Command/Feature_Name
  -- == -- == -- == == == -- -- -- -- --  ---------------  --------------------
  25 da d8 00 08 00 00 00 8b 3c ef e0 00     00:00:59.521  READ DMA EXT
  35 da d8 00 01 00 00 00 00 2b e9 e0 00     00:00:59.521  WRITE DMA EXT
  35 da d8 00 01 00 00 00 00 00 63 e0 00     00:00:59.521  WRITE DMA EXT
  35 da d8 00 01 00 00 00 00 00 3f e0 00     00:00:59.521  WRITE DMA EXT
  25 da d8 00 08 00 00 00 8b 3c ef e0 00     00:00:57.331  READ DMA EXT

SMART Extended Self-test Log Version: 1 (1 sectors)
Num  Test_Description    Status                  Remaining  LifeTime(hours)  LBA_of_first_error
# 1  Short offline       Interrupted (host reset)      90%     38065         -

SMART Selective self-test log data structure revision number 1
 SPAN  MIN_LBA  MAX_LBA  CURRENT_TEST_STATUS
    1        0        0  Not_testing
    2        0        0  Not_testing
    3        0        0  Not_testing
    4        0        0  Not_testing
    5        0        0  Not_testing
Selective self-test flags (0x0):
  After scanning selected spans, do NOT read-scan remainder of disk.
If Selective self-test is pending on power-up, resume after 0 minute delay.

SCT Status Version:                  2
SCT Version (vendor specific):       258 (0x0102)
Device State:                        SMART Off-line Data Collection executing in background (4)
Current Temperature:                    32 Celsius
Power Cycle Min/Max Temperature:     20/33 Celsius
Lifetime    Min/Max Temperature:     21/43 Celsius
Under/Over Temperature Limit Count:   0/0

SCT Temperature History Version:     2
Temperature Sampling Period:         1 minute
Temperature Logging Interval:        1 minute
Min/Max recommended Temperature:      0/60 Celsius
Min/Max Temperature Limit:           -41/85 Celsius
Temperature History Size (Index):    478 (116)

SCT Error Recovery Control:
           Read: Disabled
          Write: Disabled

Device Statistics (GP/SMART Log 0x04) not supported

Pending Defects log (GP Log 0x0c) not supported

SATA Phy Event Counters (GP Log 0x11)
ID      Size     Value  Description
0x0001  2            0  Command failed due to ICRC error
0x0002  2            0  R_ERR response for data FIS
0x0003  2            0  R_ERR response for device-to-host data FIS
0x0004  2            0  R_ERR response for host-to-device data FIS
0x0005  2            0  R_ERR response for non-data FIS
0x0006  2            0  R_ERR response for device-to-host non-data FIS
0x0007  2            0  R_ERR response for host-to-device non-data FIS
0x000a  2           35  Device-to-host register FISes sent due to a COMRESET
0x8000  4         7053  Vendor specific

