smartctl 7.5 2025-04-30 r5714 [FreeBSD 14.3-RELEASE-p2 amd64] (local build)
Copyright (C) 2002-25, Bruce Allen, Christian Franke, www.smartmontools.org

=== START OF INFORMATION SECTION ===
Model Family:     Western Digital Blue (CMR)
Device Model:     WDC WD5000AAKX-08ERMA0
Serial Number:    --
LU WWN Device Id: 5 0014ee ...
Firmware Version: 19.01H19
User Capacity:    500,107,862,016 bytes [500 GB]
Sector Size:      512 bytes logical/physical
Rotation Rate:    7200 rpm
Device is:        In smartctl database 7.5/5706
ATA Version is:   ATA8-ACS (minor revision not indicated)
SATA Version is:  SATA 3.0, 6.0 Gb/s (current: 3.0 Gb/s)
Local Time is:    Wed Sep 10 00:09:54 2025 -03
SMART support is: Available - device has SMART capability.
SMART support is: Enabled
AAM feature is:   Unavailable
APM feature is:   Unavailable
Rd look-ahead is: Enabled
Write cache is:   Enabled
DSN feature is:   Unavailable
ATA Security is:  Disabled, NOT FROZEN [SEC1]

=== START OF READ SMART DATA SECTION ===
SMART overall-health self-assessment test result: PASSED

General SMART Values:
Offline data collection status:  (0x82)	Offline data collection activity
					was completed without error.
					Auto Offline Data Collection: Enabled.
Self-test execution status:      (   0)	The previous self-test routine completed
					without error or no self-test has ever 
					been run.
Total time to complete Offline 
data collection: 		( 8400) seconds.
Offline data collection
capabilities: 			 (0x7b) SMART execute Offline immediate.
					Auto Offline data collection on/off support.
					Suspend Offline collection upon new
					command.
					Offline surface scan supported.
					Self-test supported.
					Conveyance Self-test supported.
					Selective Self-test supported.
SMART capabilities:            (0x0003)	Saves SMART data before entering
					power-saving mode.
					Supports SMART auto save timer.
Error logging capability:        (0x01)	Error logging supported.
					General Purpose Logging supported.
Short self-test routine 
recommended polling time: 	 (   2) minutes.
Extended self-test routine
recommended polling time: 	 (  85) minutes.
Conveyance self-test routine
recommended polling time: 	 (   5) minutes.
SCT capabilities: 	       (0x3037)	SCT Status supported.
					SCT Feature Control supported.
					SCT Data Table supported.

SMART Attributes Data Structure revision number: 16
Vendor Specific SMART Attributes with Thresholds:
ID# ATTRIBUTE_NAME          FLAGS    VALUE WORST THRESH FAIL RAW_VALUE
  1 Raw_Read_Error_Rate     POSR-K   200   200   051    -    105
  3 Spin_Up_Time            POS--K   140   138   021    -    4000
  4 Start_Stop_Count        -O--CK   091   091   000    -    9339
  5 Reallocated_Sector_Ct   PO--CK   200   200   140    -    0
  7 Seek_Error_Rate         -OSR-K   200   200   000    -    0
  9 Power_On_Hours          -O--CK   084   084   000    -    12012
 10 Spin_Retry_Count        -O--CK   100   100   000    -    0
 11 Calibration_Retry_Count -O--CK   100   100   000    -    0
 12 Power_Cycle_Count       -O--CK   091   091   000    -    9337
192 Power-Off_Retract_Count -O--CK   200   200   000    -    332
193 Load_Cycle_Count        -O--CK   197   197   000    -    9006
194 Temperature_Celsius     -O---K   107   095   000    -    36
196 Reallocated_Event_Count -O--CK   200   200   000    -    0
197 Current_Pending_Sector  -O--CK   200   200   000    -    0
198 Offline_Uncorrectable   ----CK   200   200   000    -    0
199 UDMA_CRC_Error_Count    -O--CK   200   200   000    -    0
200 Multi_Zone_Error_Rate   ---R--   200   200   000    -    0
                            ||||||_ K auto-keep
                            |||||__ C event count
                            ||||___ R error rate
                            |||____ S speed/performance
                            ||_____ O updated online
                            |______ P prefailure warning

General Purpose Log Directory Version 1
SMART           Log Directory Version 1 [multi-sector log support]
Address    Access  R/W   Size  Description
0x00       GPL,SL  R/O      1  Log Directory
0x01           SL  R/O      1  Summary SMART error log
0x02           SL  R/O      5  Comprehensive SMART error log
0x03       GPL     R/O      6  Ext. Comprehensive SMART error log
0x06           SL  R/O      1  SMART self-test log
0x07       GPL     R/O      1  Extended self-test log
0x09           SL  R/W      1  Selective self-test log
0x10       GPL     R/O      1  NCQ Command Error log
0x11       GPL     R/O      1  SATA Phy Event Counters log
0x80-0x9f  GPL,SL  R/W     16  Host vendor specific log
0xa0-0xa7  GPL,SL  VS      16  Device vendor specific log
0xa8-0xb5  GPL,SL  VS       1  Device vendor specific log
0xb6       GPL     VS       1  Device vendor specific log
0xb7       GPL,SL  VS       1  Device vendor specific log
0xbd       GPL,SL  VS       1  Device vendor specific log
0xc0       GPL,SL  VS       1  Device vendor specific log
0xc1       GPL     VS      24  Device vendor specific log
0xe0       GPL,SL  R/W      1  SCT Command/Status
0xe1       GPL,SL  R/W      1  SCT Data Transfer

SMART Extended Comprehensive Error Log Version: 1 (6 sectors)
Device Error Count: 105 (device log contains only the most recent 24 errors)
	CR     = Command Register
	FEATR  = Features Register
	COUNT  = Count (was: Sector Count) Register
	LBA_48 = Upper bytes of LBA High/Mid/Low Registers ]  ATA-8
	LH     = LBA High (was: Cylinder High) Register    ]   LBA
	LM     = LBA Mid (was: Cylinder Low) Register      ] Register
	LL     = LBA Low (was: Sector Number) Register     ]
	DV     = Device (was: Device/Head) Register
	DC     = Device Control Register
	ER     = Error register
	ST     = Status register
Powered_Up_Time is measured from power on, and printed as
DDd+hh:mm:SS.sss where DD=days, hh=hours, mm=minutes,
SS=sec, and sss=millisec. It "wraps" after 49.710 days.

Error 105 [8] occurred at disk power-on lifetime: 11899 hours (495 days + 19 hours)
  When the command that caused the error occurred, the device was active or idle.

  After command completion occurred, registers were:
  ER -- ST COUNT  LBA_48  LH LM LL DV DC
  -- -- -- == -- == == == -- -- -- -- --
  40 -- 51 00 00 00 00 00 40 e7 e1 40 00  Error: UNC at LBA = 0x0040e7e1 = 4253665

  Commands leading to the command that caused the error were:
  CR FEATR COUNT  LBA_48  LH LM LL DV DC  Powered_Up_Time  Command/Feature_Name
  -- == -- == -- == == == -- -- -- -- --  ---------------  --------------------
  60 00 01 00 f8 00 00 00 40 e7 e1 40 00     01:40:28.519  READ FPDMA QUEUED
  61 00 08 00 f0 00 00 00 8a 77 60 40 00     01:40:28.519  WRITE FPDMA QUEUED
  ea 00 00 00 00 00 00 00 00 00 00 e0 00     01:40:28.490  FLUSH CACHE EXT
  61 00 30 00 e0 00 00 00 73 cc 80 40 00     01:40:28.487  WRITE FPDMA QUEUED
  61 00 10 00 d8 00 00 00 8a 76 d8 40 00     01:40:28.487  WRITE FPDMA QUEUED

Error 104 [7] occurred at disk power-on lifetime: 11899 hours (495 days + 19 hours)
  When the command that caused the error occurred, the device was active or idle.

  After command completion occurred, registers were:
  ER -- ST COUNT  LBA_48  LH LM LL DV DC
  -- -- -- == -- == == == -- -- -- -- --
  40 -- 51 00 00 00 00 00 40 e7 e1 40 00  Error: UNC at LBA = 0x0040e7e1 = 4253665

  Commands leading to the command that caused the error were:
  CR FEATR COUNT  LBA_48  LH LM LL DV DC  Powered_Up_Time  Command/Feature_Name
  -- == -- == -- == == == -- -- -- -- --  ---------------  --------------------
  60 00 20 00 b0 00 00 00 40 e7 e0 40 00     01:40:26.241  READ FPDMA QUEUED
  61 00 18 00 a8 00 00 00 3d 77 00 40 00     01:40:26.240  WRITE FPDMA QUEUED
  60 00 18 00 a0 00 00 00 41 4e 28 40 00     01:40:26.240  READ FPDMA QUEUED
  61 00 20 00 98 00 00 05 de 10 20 40 00     01:40:26.240  WRITE FPDMA QUEUED
  61 00 20 00 90 00 00 06 ba b7 20 40 00     01:40:26.239  WRITE FPDMA QUEUED

Error 103 [6] occurred at disk power-on lifetime: 11855 hours (493 days + 23 hours)
  When the command that caused the error occurred, the device was active or idle.

  After command completion occurred, registers were:
  ER -- ST COUNT  LBA_48  LH LM LL DV DC
  -- -- -- == -- == == == -- -- -- -- --
  40 -- 51 00 00 00 00 00 40 e7 e1 40 00  Error: UNC at LBA = 0x0040e7e1 = 4253665

  Commands leading to the command that caused the error were:
  CR FEATR COUNT  LBA_48  LH LM LL DV DC  Powered_Up_Time  Command/Feature_Name
  -- == -- == -- == == == -- -- -- -- --  ---------------  --------------------
  60 00 01 00 80 00 00 00 40 e7 e1 40 00     04:50:45.832  READ FPDMA QUEUED
  61 00 08 00 78 00 00 00 8f 77 88 40 00     04:50:45.832  WRITE FPDMA QUEUED
  60 00 01 00 70 00 00 00 40 e7 e0 40 00     04:50:45.821  READ FPDMA QUEUED
  ea 00 00 00 00 00 00 00 00 00 00 e0 00     04:50:45.776  FLUSH CACHE EXT
  61 00 10 00 60 00 00 00 8a 76 d8 40 00     04:50:45.776  WRITE FPDMA QUEUED

Error 102 [5] occurred at disk power-on lifetime: 11855 hours (493 days + 23 hours)
  When the command that caused the error occurred, the device was active or idle.

  After command completion occurred, registers were:
  ER -- ST COUNT  LBA_48  LH LM LL DV DC
  -- -- -- == -- == == == -- -- -- -- --
  40 -- 51 00 01 00 00 00 40 e7 e1 40 00  Error: UNC at LBA = 0x0040e7e1 = 4253665

  Commands leading to the command that caused the error were:
  CR FEATR COUNT  LBA_48  LH LM LL DV DC  Powered_Up_Time  Command/Feature_Name
  -- == -- == -- == == == -- -- -- -- --  ---------------  --------------------
  60 00 20 00 58 00 00 00 40 e7 e0 40 00     04:50:43.908  READ FPDMA QUEUED
  61 00 20 00 50 00 00 00 84 22 50 40 00     04:50:43.907  WRITE FPDMA QUEUED
  60 00 20 00 48 00 00 00 35 f1 60 40 00     04:50:43.880  READ FPDMA QUEUED
  60 00 08 00 40 00 00 00 8f 92 88 40 00     04:50:43.880  READ FPDMA QUEUED
  61 00 20 00 38 00 00 05 e4 57 60 40 00     04:50:43.879  WRITE FPDMA QUEUED

Error 101 [4] occurred at disk power-on lifetime: 11838 hours (493 days + 6 hours)
  When the command that caused the error occurred, the device was active or idle.

  After command completion occurred, registers were:
  ER -- ST COUNT  LBA_48  LH LM LL DV DC
  -- -- -- == -- == == == -- -- -- -- --
  40 -- 51 00 00 00 00 00 40 e7 e1 40 00  Error: UNC at LBA = 0x0040e7e1 = 4253665

  Commands leading to the command that caused the error were:
  CR FEATR COUNT  LBA_48  LH LM LL DV DC  Powered_Up_Time  Command/Feature_Name
  -- == -- == -- == == == -- -- -- -- --  ---------------  --------------------
  60 00 01 00 18 00 00 00 40 e7 e1 40 00     00:45:27.878  READ FPDMA QUEUED
  60 01 00 00 10 00 00 05 1c de 50 40 00     00:45:27.862  READ FPDMA QUEUED
  60 01 00 00 08 00 00 05 1c dd 50 40 00     00:45:27.862  READ FPDMA QUEUED
  61 00 08 00 f8 00 00 00 8f f0 b8 40 00     00:45:27.862  WRITE FPDMA QUEUED
  60 00 01 00 f0 00 00 00 40 e7 e0 40 00     00:45:27.851  READ FPDMA QUEUED

Error 100 [3] occurred at disk power-on lifetime: 11838 hours (493 days + 6 hours)
  When the command that caused the error occurred, the device was active or idle.

  After command completion occurred, registers were:
  ER -- ST COUNT  LBA_48  LH LM LL DV DC
  -- -- -- == -- == == == -- -- -- -- --
  40 -- 51 00 01 00 00 00 40 e7 e1 40 00  Error: WP at LBA = 0x0040e7e1 = 4253665

  Commands leading to the command that caused the error were:
  CR FEATR COUNT  LBA_48  LH LM LL DV DC  Powered_Up_Time  Command/Feature_Name
  -- == -- == -- == == == -- -- -- -- --  ---------------  --------------------
  61 00 80 00 c8 00 00 02 6a 5f c0 40 00     00:45:25.881  WRITE FPDMA QUEUED
  60 00 20 00 c0 00 00 00 40 e7 e0 40 00     00:45:25.878  READ FPDMA QUEUED
  61 00 20 00 b8 00 00 03 e1 55 00 40 00     00:45:25.876  WRITE FPDMA QUEUED
  61 00 20 00 b0 00 00 00 82 a5 00 40 00     00:45:25.876  WRITE FPDMA QUEUED
  60 01 00 00 a8 00 00 05 1c da 50 40 00     00:45:25.862  READ FPDMA QUEUED

Error 99 [2] occurred at disk power-on lifetime: 11814 hours (492 days + 6 hours)
  When the command that caused the error occurred, the device was active or idle.

  After command completion occurred, registers were:
  ER -- ST COUNT  LBA_48  LH LM LL DV DC
  -- -- -- == -- == == == -- -- -- -- --
  40 -- 51 00 00 00 00 00 40 e7 e1 40 00  Error: UNC at LBA = 0x0040e7e1 = 4253665

  Commands leading to the command that caused the error were:
  CR FEATR COUNT  LBA_48  LH LM LL DV DC  Powered_Up_Time  Command/Feature_Name
  -- == -- == -- == == == -- -- -- -- --  ---------------  --------------------
  60 00 01 00 20 00 00 00 40 e7 e1 40 00     00:21:04.770  READ FPDMA QUEUED
  61 00 08 00 18 00 00 00 4b 71 40 40 00     00:21:04.770  WRITE FPDMA QUEUED
  60 00 01 00 10 00 00 00 40 e7 e0 40 00     00:21:04.758  READ FPDMA QUEUED
  60 00 60 00 08 00 00 00 75 14 c0 40 00     00:21:04.737  READ FPDMA QUEUED
  60 01 00 00 f8 00 00 00 75 13 c0 40 00     00:21:04.737  READ FPDMA QUEUED

Error 98 [1] occurred at disk power-on lifetime: 11814 hours (492 days + 6 hours)
  When the command that caused the error occurred, the device was active or idle.

  After command completion occurred, registers were:
  ER -- ST COUNT  LBA_48  LH LM LL DV DC
  -- -- -- == -- == == == -- -- -- -- --
  40 -- 51 00 00 00 00 00 40 e7 e1 40 00  Error: UNC at LBA = 0x0040e7e1 = 4253665

  Commands leading to the command that caused the error were:
  CR FEATR COUNT  LBA_48  LH LM LL DV DC  Powered_Up_Time  Command/Feature_Name
  -- == -- == -- == == == -- -- -- -- --  ---------------  --------------------
  60 00 20 00 d0 00 00 00 40 e7 e0 40 00     00:21:02.857  READ FPDMA QUEUED
  61 00 20 00 c8 00 00 04 76 7d c0 40 00     00:21:02.856  WRITE FPDMA QUEUED
  61 00 20 00 c0 00 00 04 78 6d a0 40 00     00:21:02.856  WRITE FPDMA QUEUED
  60 00 20 00 b8 00 00 00 47 3d 40 40 00     00:21:02.855  READ FPDMA QUEUED
  61 00 10 00 b0 00 00 00 3e cf a0 40 00     00:21:02.855  WRITE FPDMA QUEUED

SMART Extended Self-test Log Version: 1 (1 sectors)
Num  Test_Description    Status                  Remaining  LifeTime(hours)  LBA_of_first_error
# 1  Short offline       Aborted by host               10%      8770         -
# 2  Vendor (0x50)       Completed without error       00%      8051         -
# 3  Short offline       Completed without error       00%      8051         -
# 4  Vendor (0x50)       Completed without error       00%      7998         -
# 5  Short offline       Completed without error       00%      7998         -
# 6  Vendor (0x50)       Completed without error       00%      7593         -
# 7  Short offline       Completed without error       00%      7593         -
# 8  Vendor (0x50)       Completed without error       00%      7294         -
# 9  Short offline       Completed without error       00%      7294         -
#10  Vendor (0x50)       Completed without error       00%      6482         -
#11  Short offline       Completed without error       00%      6482         -
#12  Vendor (0x50)       Completed without error       00%      6451         -
#13  Short offline       Completed without error       00%      6451         -
#14  Vendor (0x50)       Completed without error       00%      6450         -
#15  Short offline       Completed without error       00%      6450         -
#16  Vendor (0x50)       Completed without error       00%      5443         -
#17  Short offline       Completed without error       00%      5443         -
#18  Vendor (0x50)       Completed without error       00%      4323         -

SMART Selective self-test log data structure revision number 1
 SPAN  MIN_LBA  MAX_LBA  CURRENT_TEST_STATUS
    1        0        0  Not_testing
    2        0        0  Not_testing
    3        0        0  Not_testing
    4        0        0  Not_testing
    5        0        0  Not_testing
Selective self-test flags (0x0):
  After scanning selected spans, do NOT read-scan remainder of disk.
If Selective self-test is pending on power-up, resume after 0 minute delay.

SCT Status Version:                  3
SCT Version (vendor specific):       258 (0x0102)
Device State:                        Active (0)
Current Temperature:                    36 Celsius
Power Cycle Min/Max Temperature:     21/38 Celsius
Lifetime    Min/Max Temperature:      0/48 Celsius
Under/Over Temperature Limit Count:   0/0

SCT Temperature History Version:     2
Temperature Sampling Period:         1 minute
Temperature Logging Interval:        1 minute
Min/Max recommended Temperature:      0/60 Celsius
Min/Max Temperature Limit:           -41/85 Celsius
Temperature History Size (Index):    478 (438)

SCT Error Recovery Control command not supported

Device Statistics (GP/SMART Log 0x04) not supported

Pending Defects log (GP Log 0x0c) not supported

SATA Phy Event Counters (GP Log 0x11)
ID      Size     Value  Description
0x0001  2            0  Command failed due to ICRC error
0x0002  2            0  R_ERR response for data FIS
0x0003  2            0  R_ERR response for device-to-host data FIS
0x0004  2            0  R_ERR response for host-to-device data FIS
0x0005  2            0  R_ERR response for non-data FIS
0x0006  2            0  R_ERR response for device-to-host non-data FIS
0x0007  2            0  R_ERR response for host-to-device non-data FIS
0x000a  2            6  Device-to-host register FISes sent due to a COMRESET
0x000b  2            0  CRC errors within host-to-device FIS
0x8000  4        18821  Vendor specific

