smartctl 7.4 2023-08-01 r5530 [FreeBSD 13.2-RELEASE-p11 amd64] (local build)
Copyright (C) 2002-23, Bruce Allen, Christian Franke, www.smartmontools.org

=== START OF INFORMATION SECTION ===
Model Family:     OCZ Intrepid 3000 SSDs
Device Model:     OCZ INTREPID 3800
Serial Number:    --
LU WWN Device Id: 5 e83a97 ...
Firmware Version: 1.4.7.5
User Capacity:    800,166,076,416 bytes [800 GB]
Sector Size:      512 bytes logical/physical
Rotation Rate:    Solid State Device
TRIM Command:     Available
Device is:        In smartctl database 7.3/5528
ATA Version is:   ACS-2 (minor revision not indicated)
SATA Version is:  SATA 3.1, 6.0 Gb/s (current: 6.0 Gb/s)
Local Time is:    Mon May 27 05:59:25 2024 UTC
SMART support is: Available - device has SMART capability.
SMART support is: Enabled
AAM feature is:   Unavailable
APM feature is:   Unavailable
Rd look-ahead is: Unavailable
Write cache is:   Enabled
DSN feature is:   Unavailable
ATA Security is:  Disabled, NOT FROZEN [SEC1]
Wt Cache Reorder: Unavailable

=== START OF READ SMART DATA SECTION ===
SMART overall-health self-assessment test result: PASSED

General SMART Values:
Offline data collection status:  (0x00)	Offline data collection activity
					was never started.
					Auto Offline Data Collection: Disabled.
Self-test execution status:      (   0)	The previous self-test routine completed
					without error or no self-test has ever 
					been run.
Total time to complete Offline 
data collection: 		(    0) seconds.
Offline data collection
capabilities: 			 (0x1d) SMART execute Offline immediate.
					No Auto Offline data collection support.
					Abort Offline collection upon new
					command.
					Offline surface scan supported.
					Self-test supported.
					No Conveyance Self-test supported.
					No Selective Self-test supported.
SMART capabilities:            (0x0003)	Saves SMART data before entering
					power-saving mode.
					Supports SMART auto save timer.
Error logging capability:        (0x00)	Error logging NOT supported.
					General Purpose Logging supported.
Short self-test routine 
recommended polling time: 	 (   0) minutes.
Extended self-test routine
recommended polling time: 	 (   0) minutes.

SMART Attributes Data Structure revision number: 18
Vendor Specific SMART Attributes with Thresholds:
ID# ATTRIBUTE_NAME          FLAGS    VALUE WORST THRESH FAIL RAW_VALUE
  5 Runtime_Bad_Block       ------   100   100   000    -    0
  9 Power_On_Hours          ------   100   100   000    -    56294
 12 Power_Cycle_Count       ------   100   100   000    -    342
100 Total_Blocks_Erased     ------   100   100   000    -    567285376
171 Avail_OP_Block_Count    ------   087   000   000    -    11700
174 Pwr_Cycle_Ct_Unplanned  ------   061   100   000    -    212
184 Factory_Bad_Block_Count ------   012   100   000    -    1612
187 Total_Unc_NAND_Reads    ------   100   100   000    -    0
190 Temperature_Celsius     ------   048   073   000    -    48
195 Total_Prog_Failures     ------   000   100   000    -    0
196 Total_Erase_Failures    ------   000   100   000    -    0
197 Total_Unc_Read_Failures ------   000   100   000    -    0
198 Host_Reads_GiB          ------   100   100   000    -    190897
199 Host_Writes_GiB         ------   100   100   000    -    200414
202 Total_Read_Bits_Corr_Ct ------   100   100   000    -    4168074283
205 Max_Rated_PE_Count      ------   100   100   000    -    10000
206 Min_Erase_Count         ------   000   100   000    -    0
207 Max_Erase_Count         ------   073   100   000    -    2199
208 Average_Erase_Count     ------   069   100   000    -    2094
210 SATA_CRC_Error_Count    ------   100   100   000    -    264
211 SATA_UNC_Count          ------   100   100   000    -    0
212 NAND_Reads_with_Retry   ------   100   100   000    -    510572
213 Simple_Rd_Rtry_Attempts ------   100   100   000    -    295480
214 Adaptv_Rd_Rtry_Attempts ------   100   100   000    -    215092
221 Int_Data_Path_Prot_Unc  ------   100   100   000    -    13142664
222 RAID_Recovery_Count     ------   100   100   000    -    0
230 SuperCap_Charge_Status  ------   001   100   000    -    1
233 Remaining_Lifetime_Perc ------   080   000   000    -    80
249 Total_NAND_Prog_Ct_GiB  ------   100   100   000    -    1128663
251 Total_NAND_Read_Ct_GiB  ------   100   100   000    -    783553
                            ||||||_ K auto-keep
                            |||||__ C event count
                            ||||___ R error rate
                            |||____ S speed/performance
                            ||_____ O updated online
                            |______ P prefailure warning

General Purpose Log Directory Version 1
SMART           Log Directory Version 1 [multi-sector log support]
Address    Access  R/W   Size  Description
0x00       GPL,SL  R/O      1  Log Directory
0x10       GPL,SL  R/O      1  NCQ Command Error log
0x80-0x9f  GPL,SL  R/W     16  Host vendor specific log
0xa0       GPL     VS   65535  Device vendor specific log
0xa0       SL      VS     255  Device vendor specific log

SMART Extended Comprehensive Error Log (GP Log 0x03) not supported

SMART Error Log not supported

SMART Extended Self-test Log (GP Log 0x07) not supported

SMART Self-test Log not supported

Selective Self-tests/Logging not supported

SCT Commands not supported

Device Statistics (GP/SMART Log 0x04) not supported

Pending Defects log (GP Log 0x0c) not supported

SATA Phy Event Counters (GP Log 0x11) not supported

