smartctl 7.2 2020-12-30 r5155 [FreeBSD 12.1-RELEASE-p19-HBSD amd64] (local build)
Copyright (C) 2002-20, Bruce Allen, Christian Franke, www.smartmontools.org

=== START OF INFORMATION SECTION ===
Model Family:     Western Digital Scorpio Black
Device Model:     WDC WD1600BEKT-66F3T2
Serial Number:    --
LU WWN Device Id: 5 0014ee ...
Firmware Version: 13.01A13
User Capacity:    160,041,885,696 bytes [160 GB]
Sector Size:      512 bytes logical/physical
Rotation Rate:    7200 rpm
Device is:        In smartctl database [for details use: -P show]
ATA Version is:   ATA8-ACS (minor revision not indicated)
SATA Version is:  SATA 2.5, 3.0 Gb/s
Local Time is:    Wed Aug 25 08:17:37 2021 EDT
SMART support is: Available - device has SMART capability.
SMART support is: Enabled
AAM feature is:   Unavailable
APM level is:     128 (minimum power consumption without standby)
Rd look-ahead is: Enabled
Write cache is:   Enabled
DSN feature is:   Unavailable
ATA Security is:  Disabled, frozen [SEC2]
Wt Cache Reorder: Enabled

=== START OF READ SMART DATA SECTION ===
SMART overall-health self-assessment test result: PASSED
See vendor-specific Attribute list for marginal Attributes.

General SMART Values:
Offline data collection status:  (0x84)	Offline data collection activity
					was suspended by an interrupting command from host.
					Auto Offline Data Collection: Enabled.
Self-test execution status:      (   0)	The previous self-test routine completed
					without error or no self-test has ever 
					been run.
Total time to complete Offline 
data collection: 		( 3960) seconds.
Offline data collection
capabilities: 			 (0x5b) SMART execute Offline immediate.
					Auto Offline data collection on/off support.
					Suspend Offline collection upon new
					command.
					Offline surface scan supported.
					Self-test supported.
					No Conveyance Self-test supported.
					Selective Self-test supported.
SMART capabilities:            (0x0003)	Saves SMART data before entering
					power-saving mode.
					Supports SMART auto save timer.
Error logging capability:        (0x01)	Error logging supported.
					General Purpose Logging supported.
Short self-test routine 
recommended polling time: 	 (   2) minutes.
Extended self-test routine
recommended polling time: 	 (  50) minutes.
SCT capabilities: 	       (0x303f)	SCT Status supported.
					SCT Error Recovery Control supported.
					SCT Feature Control supported.
					SCT Data Table supported.

SMART Attributes Data Structure revision number: 16
Vendor Specific SMART Attributes with Thresholds:
ID# ATTRIBUTE_NAME          FLAGS    VALUE WORST THRESH FAIL RAW_VALUE
  1 Raw_Read_Error_Rate     POSR-K   200   200   051    -    0
  3 Spin_Up_Time            POS--K   154   150   021    -    1258
  4 Start_Stop_Count        -O--CK   098   098   000    -    2468
  5 Reallocated_Sector_Ct   PO--CK   200   200   140    -    0
  7 Seek_Error_Rate         POSR-K   200   200   051    -    0
  9 Power_On_Hours          -O--CK   035   035   000    -    47748
 10 Spin_Retry_Count        PO--CK   100   100   051    -    0
 11 Calibration_Retry_Count -O--CK   100   100   000    -    0
 12 Power_Cycle_Count       -O--CK   098   098   000    -    2151
184 End-to-End_Error        PO--CK   100   100   097    -    0
187 Reported_Uncorrect      -O--CK   100   001   000    -    11127
188 Command_Timeout         -O--CK   100   001   000    -    34360394279
190 Airflow_Temperature_Cel -O---K   067   038   040    Past 33
191 G-Sense_Error_Rate      -O--CK   075   075   000    -    25
192 Power-Off_Retract_Count -O--CK   200   200   000    -    386
193 Load_Cycle_Count        -O--CK   200   200   000    -    2472
194 Temperature_Celsius     -O---K   110   081   000    -    33
196 Reallocated_Event_Count -O--CK   200   200   000    -    0
197 Current_Pending_Sector  -O--CK   200   191   000    -    1
198 Offline_Uncorrectable   ----CK   200   200   000    -    13
199 UDMA_CRC_Error_Count    -O--CK   200   200   000    -    0
200 Multi_Zone_Error_Rate   ---R--   200   200   000    -    12
                            ||||||_ K auto-keep
                            |||||__ C event count
                            ||||___ R error rate
                            |||____ S speed/performance
                            ||_____ O updated online
                            |______ P prefailure warning

General Purpose Log Directory Version 1
SMART           Log Directory Version 1 [multi-sector log support]
Address    Access  R/W   Size  Description
0x00       GPL,SL  R/O      1  Log Directory
0x01           SL  R/O      1  Summary SMART error log
0x02           SL  R/O      5  Comprehensive SMART error log
0x03       GPL     R/O      6  Ext. Comprehensive SMART error log
0x06           SL  R/O      1  SMART self-test log
0x07       GPL     R/O      1  Extended self-test log
0x09           SL  R/W      1  Selective self-test log
0x10       GPL     R/O      1  NCQ Command Error log
0x11       GPL     R/O      1  SATA Phy Event Counters log
0x80-0x9f  GPL,SL  R/W     16  Host vendor specific log
0xa0-0xa7  GPL,SL  VS      16  Device vendor specific log
0xa8-0xb7  GPL,SL  VS       1  Device vendor specific log
0xc0       GPL,SL  VS       1  Device vendor specific log
0xc1       GPL     VS      24  Device vendor specific log
0xe0       GPL,SL  R/W      1  SCT Command/Status
0xe1       GPL,SL  R/W      1  SCT Data Transfer

SMART Extended Comprehensive Error Log Version: 1 (6 sectors)
Device Error Count: 9626 (device log contains only the most recent 24 errors)
	CR     = Command Register
	FEATR  = Features Register
	COUNT  = Count (was: Sector Count) Register
	LBA_48 = Upper bytes of LBA High/Mid/Low Registers ]  ATA-8
	LH     = LBA High (was: Cylinder High) Register    ]   LBA
	LM     = LBA Mid (was: Cylinder Low) Register      ] Register
	LL     = LBA Low (was: Sector Number) Register     ]
	DV     = Device (was: Device/Head) Register
	DC     = Device Control Register
	ER     = Error register
	ST     = Status register
Powered_Up_Time is measured from power on, and printed as
DDd+hh:mm:SS.sss where DD=days, hh=hours, mm=minutes,
SS=sec, and sss=millisec. It "wraps" after 49.710 days.

Error 9626 [1] occurred at disk power-on lifetime: 36977 hours (1540 days + 17 hours)
  When the command that caused the error occurred, the device was active or idle.

  After command completion occurred, registers were:
  ER -- ST COUNT  LBA_48  LH LM LL DV DC
  -- -- -- == -- == == == -- -- -- -- --
  10 -- 51 02 00 00 00 5d 00 98 80 40 00  Error: IDNF 512 sectors at LBA = 0x5d009880 = 1560320128

  Commands leading to the command that caused the error were:
  CR FEATR COUNT  LBA_48  LH LM LL DV DC  Powered_Up_Time  Command/Feature_Name
  -- == -- == -- == == == -- -- -- -- --  ---------------  --------------------
  35 00 00 02 00 00 00 00 98 5d 80 40 00     00:06:38.595  WRITE DMA EXT
  35 00 00 02 00 00 00 00 98 5b 80 40 00     00:06:38.577  WRITE DMA EXT
  35 00 00 02 00 00 00 00 98 59 80 40 00     00:06:38.559  WRITE DMA EXT
  35 00 00 02 00 00 00 00 98 57 80 40 00     00:06:38.541  WRITE DMA EXT
  35 00 00 02 00 00 00 00 98 55 80 40 00     00:06:38.523  WRITE DMA EXT

Error 9625 [0] occurred at disk power-on lifetime: 34933 hours (1455 days + 13 hours)
  When the command that caused the error occurred, the device was active or idle.

  After command completion occurred, registers were:
  ER -- ST COUNT  LBA_48  LH LM LL DV DC
  -- -- -- == -- == == == -- -- -- -- --
  40 -- 51 02 00 00 04 76 00 bb 3f 40 00  Error: UNC 512 sectors at LBA = 0x47600bb3f = 19159628607

  Commands leading to the command that caused the error were:
  CR FEATR COUNT  LBA_48  LH LM LL DV DC  Powered_Up_Time  Command/Feature_Name
  -- == -- == -- == == == -- -- -- -- --  ---------------  --------------------
  25 00 00 02 00 00 00 04 bb 76 3f 40 00  4d+20:29:10.548  READ DMA EXT
  25 00 00 02 00 00 00 04 bb 76 3f 40 00  4d+20:29:10.491  READ DMA EXT
  25 00 00 02 00 00 00 04 bb 74 3f 40 00  4d+20:29:10.483  READ DMA EXT
  25 00 00 02 00 00 00 04 bb 74 3f 40 00  4d+20:29:10.475  READ DMA EXT
  25 00 00 02 00 00 00 04 bb 74 3f 40 00  4d+20:29:09.462  READ DMA EXT

Error 9624 [23] occurred at disk power-on lifetime: 34705 hours (1446 days + 1 hours)
  When the command that caused the error occurred, the device was doing SMART Offline or Self-test.

  After command completion occurred, registers were:
  ER -- ST COUNT  LBA_48  LH LM LL DV DC
  -- -- -- == -- == == == -- -- -- -- --
  40 -- 51 08 00 00 07 71 00 bb 7c 40 00  Error: UNC 2048 sectors at LBA = 0x77100bb7c = 31960644476

  Commands leading to the command that caused the error were:
  CR FEATR COUNT  LBA_48  LH LM LL DV DC  Powered_Up_Time  Command/Feature_Name
  -- == -- == -- == == == -- -- -- -- --  ---------------  --------------------
  25 00 00 08 00 00 00 07 bb 71 7c 40 00  2d+21:12:33.793  READ DMA EXT
  25 00 00 08 00 00 00 07 bb 71 7c 40 00  2d+21:12:33.767  READ DMA EXT
  25 00 00 08 00 00 00 07 bb 71 7c 40 00  2d+21:12:32.739  READ DMA EXT
  25 00 00 08 00 00 00 07 bb 69 7c 40 00  2d+21:12:32.717  READ DMA EXT
  25 00 00 08 00 00 00 07 bb 61 7c 40 00  2d+21:12:32.695  READ DMA EXT

Error 9623 [22] occurred at disk power-on lifetime: 34636 hours (1443 days + 4 hours)
  When the command that caused the error occurred, the device was active or idle.

  After command completion occurred, registers were:
  ER -- ST COUNT  LBA_48  LH LM LL DV DC
  -- -- -- == -- == == == -- -- -- -- --
  40 -- 51 02 00 00 02 59 00 8a 5f 40 00  Error: UNC 512 sectors at LBA = 0x259008a5f = 10083142239

  Commands leading to the command that caused the error were:
  CR FEATR COUNT  LBA_48  LH LM LL DV DC  Powered_Up_Time  Command/Feature_Name
  -- == -- == -- == == == -- -- -- -- --  ---------------  --------------------
  25 00 00 02 00 00 00 02 8a 59 5f 40 00     00:02:35.202  READ DMA EXT
  25 00 00 02 00 00 00 02 8a 57 5f 40 00     00:02:35.194  READ DMA EXT
  25 00 00 02 00 00 00 02 8a 55 5f 40 00     00:02:35.184  READ DMA EXT
  25 00 00 02 00 00 00 02 8a 53 5f 40 00     00:02:35.175  READ DMA EXT
  25 00 00 02 00 00 00 02 8a 51 5f 40 00     00:02:35.170  READ DMA EXT

Error 9622 [21] occurred at disk power-on lifetime: 34592 hours (1441 days + 8 hours)
  When the command that caused the error occurred, the device was active or idle.

  After command completion occurred, registers were:
  ER -- ST COUNT  LBA_48  LH LM LL DV DC
  -- -- -- == -- == == == -- -- -- -- --
  40 -- 51 01 00 00 02 ef 00 23 cf 40 00  Error: UNC 256 sectors at LBA = 0x2ef0023cf = 12599698383

  Commands leading to the command that caused the error were:
  CR FEATR COUNT  LBA_48  LH LM LL DV DC  Powered_Up_Time  Command/Feature_Name
  -- == -- == -- == == == -- -- -- -- --  ---------------  --------------------
  25 00 00 01 00 00 00 02 23 ef cf 40 00     05:33:49.406  READ DMA EXT
  25 00 00 00 80 00 00 02 23 ef 4f 40 00     05:33:49.404  READ DMA EXT
  25 00 00 00 40 00 00 02 23 ef 0f 40 00     05:33:49.403  READ DMA EXT
  25 00 00 00 40 00 00 02 23 ee cf 40 00     05:33:49.392  READ DMA EXT
  25 00 00 01 00 00 00 02 19 e4 47 40 00     05:33:49.390  READ DMA EXT

Error 9621 [20] occurred at disk power-on lifetime: 34592 hours (1441 days + 8 hours)
  When the command that caused the error occurred, the device was active or idle.

  After command completion occurred, registers were:
  ER -- ST COUNT  LBA_48  LH LM LL DV DC
  -- -- -- == -- == == == -- -- -- -- --
  40 -- 51 01 00 00 01 ff 00 41 b7 40 00  Error: UNC 256 sectors at LBA = 0x1ff0041b7 = 8573174199

  Commands leading to the command that caused the error were:
  CR FEATR COUNT  LBA_48  LH LM LL DV DC  Powered_Up_Time  Command/Feature_Name
  -- == -- == -- == == == -- -- -- -- --  ---------------  --------------------
  25 00 00 01 00 00 00 01 41 ff b7 40 00     05:33:28.154  READ DMA EXT
  25 00 00 00 08 00 00 00 60 00 af 40 00     05:33:28.154  READ DMA EXT
  25 00 00 00 08 00 00 00 60 00 a7 40 00     05:33:28.146  READ DMA EXT
  25 00 00 00 80 00 00 01 41 ff 37 40 00     05:33:28.146  READ DMA EXT
  25 00 00 00 08 00 00 00 60 00 b7 40 00     05:33:28.134  READ DMA EXT

Error 9620 [19] occurred at disk power-on lifetime: 34587 hours (1441 days + 3 hours)
  When the command that caused the error occurred, the device was active or idle.

  After command completion occurred, registers were:
  ER -- ST COUNT  LBA_48  LH LM LL DV DC
  -- -- -- == -- == == == -- -- -- -- --
  40 -- 51 04 00 00 02 59 00 62 37 40 00  Error: UNC 1024 sectors at LBA = 0x259006237 = 10083131959

  Commands leading to the command that caused the error were:
  CR FEATR COUNT  LBA_48  LH LM LL DV DC  Powered_Up_Time  Command/Feature_Name
  -- == -- == -- == == == -- -- -- -- --  ---------------  --------------------
  25 00 00 04 00 00 00 02 62 59 37 40 00     00:24:50.653  READ DMA EXT
  25 00 00 03 f8 00 00 02 62 55 3f 40 00     00:24:50.645  READ DMA EXT
  25 00 00 04 00 00 00 02 62 51 3f 40 00     00:24:50.642  READ DMA EXT
  25 00 00 04 00 00 00 02 62 4d 3f 40 00     00:24:50.629  READ DMA EXT
  25 00 00 02 00 00 00 02 62 4b 3f 40 00     00:24:50.627  READ DMA EXT

Error 9619 [18] occurred at disk power-on lifetime: 34585 hours (1441 days + 1 hours)
  When the command that caused the error occurred, the device was active or idle.

  After command completion occurred, registers were:
  ER -- ST COUNT  LBA_48  LH LM LL DV DC
  -- -- -- == -- == == == -- -- -- -- --
  40 -- 51 04 00 00 01 98 00 81 0f 40 00  Error: UNC 1024 sectors at LBA = 0x19800810f = 6845137167

  Commands leading to the command that caused the error were:
  CR FEATR COUNT  LBA_48  LH LM LL DV DC  Powered_Up_Time  Command/Feature_Name
  -- == -- == -- == == == -- -- -- -- --  ---------------  --------------------
  25 00 00 04 00 00 00 01 81 98 0f 40 00     02:28:37.864  READ DMA EXT
  25 00 00 04 00 00 00 01 81 94 0f 40 00     02:28:37.811  READ DMA EXT
  25 00 00 04 00 00 00 01 81 90 0f 40 00     02:28:37.807  READ DMA EXT
  25 00 00 04 00 00 00 01 81 8c 0f 40 00     02:28:37.799  READ DMA EXT
  25 00 00 04 00 00 00 01 81 88 0f 40 00     02:28:37.796  READ DMA EXT

SMART Extended Self-test Log Version: 1 (1 sectors)
Num  Test_Description    Status                  Remaining  LifeTime(hours)  LBA_of_first_error
# 1  Short offline       Completed: read failure       90%     43893         273213305
# 2  Short offline       Completed: read failure       90%     41624         273213305
# 3  Short offline       Completed: read failure       90%     41475         273213305
# 4  Short offline       Completed: read failure       90%     34380         13047421
# 5  Short offline       Completed: read failure       90%     34380         13047421
# 6  Short offline       Completed without error       00%     34377         -
# 7  Extended offline    Interrupted (host reset)      80%         0         -

SMART Selective self-test log data structure revision number 1
 SPAN  MIN_LBA  MAX_LBA  CURRENT_TEST_STATUS
    1        0        0  Not_testing
    2        0        0  Not_testing
    3        0        0  Not_testing
    4        0        0  Not_testing
    5        0        0  Not_testing
Selective self-test flags (0x0):
  After scanning selected spans, do NOT read-scan remainder of disk.
If Selective self-test is pending on power-up, resume after 0 minute delay.

SCT Status Version:                  2
SCT Version (vendor specific):       258 (0x0102)
Device State:                        SMART Off-line Data Collection executing in background (4)
Current Temperature:                    32 Celsius
Power Cycle Min/Max Temperature:     32/35 Celsius
Lifetime    Min/Max Temperature:     32/63 Celsius
Under/Over Temperature Limit Count:   0/0
Vendor specific:
01 00 00 00 00 00 00 00 00 00 00 00 00 00 00 00
00 00 00 00 00 00 00 00 00 00 00 00 00 00 00 00

SCT Temperature History Version:     2
Temperature Sampling Period:         1 minute
Temperature Logging Interval:        1 minute
Min/Max recommended Temperature:      0/60 Celsius
Min/Max Temperature Limit:           -41/85 Celsius
Temperature History Size (Index):    128 (73)

SCT Error Recovery Control:
           Read:     85 (8.5 seconds)
          Write:     85 (8.5 seconds)

Device Statistics (GP/SMART Log 0x04) not supported

Pending Defects log (GP Log 0x0c) not supported

SATA Phy Event Counters (GP Log 0x11)
ID      Size     Value  Description
0x0001  2            0  Command failed due to ICRC error
0x0002  2            0  R_ERR response for data FIS
0x0003  2            0  R_ERR response for device-to-host data FIS
0x0004  2            0  R_ERR response for host-to-device data FIS
0x0005  2            0  R_ERR response for non-data FIS
0x0006  2            0  R_ERR response for device-to-host non-data FIS
0x0007  2            0  R_ERR response for host-to-device non-data FIS
0x000a  2           19  Device-to-host register FISes sent due to a COMRESET
0x8000  4         3566  Vendor specific

