smartctl 7.3 2022-02-28 r5338 [FreeBSD 13.0-RELEASE-p6 amd64] (local build)
Copyright (C) 2002-22, Bruce Allen, Christian Franke, www.smartmontools.org

=== START OF INFORMATION SECTION ===
Model Number:                       SAMSUNG MZVLW256HEHP-000L7
Serial Number:                      --
Firmware Version:                   4L7QCXB7
PCI Vendor/Subsystem ID:            0x144d
IEEE OUI Identifier:                0x002538
Total NVM Capacity:                 256,060,514,304 [256 GB]
Unallocated NVM Capacity:           0
Controller ID:                      2
NVMe Version:                       1.2
Number of Namespaces:               1
Namespace 1 Size/Capacity:          256,060,514,304 [256 GB]
Namespace 1 Utilization:            255,559,962,624 [255 GB]
Namespace 1 Formatted LBA Size:     512
Namespace 1 IEEE EUI-64:            002538 ...
Local Time is:                      Tue Jun 21 13:11:21 2022 PDT
Firmware Updates (0x16):            3 Slots, no Reset required
Optional Admin Commands (0x0017):   Security Format Frmw_DL Self_Test
Optional NVM Commands (0x001f):     Comp Wr_Unc DS_Mngmt Wr_Zero Sav/Sel_Feat
Log Page Attributes (0x03):         S/H_per_NS Cmd_Eff_Lg
Warning  Comp. Temp. Threshold:     69 Celsius
Critical Comp. Temp. Threshold:     72 Celsius

Supported Power States
St Op     Max   Active     Idle   RL RT WL WT  Ent_Lat  Ex_Lat
 0 +     7.60W       -        -    0  0  0  0        0       0
 1 +     6.00W       -        -    1  1  1  1        0       0
 2 +     5.10W       -        -    2  2  2  2        0       0
 3 -   0.0400W       -        -    3  3  3  3      210    1500
 4 -   0.0050W       -        -    4  4  4  4     2200    6000

Supported LBA Sizes (NSID 0x1)
Id Fmt  Data  Metadt  Rel_Perf
 0 +     512       0         0

=== START OF SMART DATA SECTION ===
SMART overall-health self-assessment test result: PASSED

SMART/Health Information (NVMe Log 0x02)
Critical Warning:                   0x00
Temperature:                        36 Celsius
Available Spare:                    100%
Available Spare Threshold:          10%
Percentage Used:                    21%
Data Units Read:                    160,495,424 [82.1 TB]
Data Units Written:                 52,375,790 [26.8 TB]
Host Read Commands:                 1,739,039,561
Host Write Commands:                1,217,055,831
Controller Busy Time:               4,084
Power Cycles:                       4,857
Power On Hours:                     6,440
Unsafe Shutdowns:                   160
Media and Data Integrity Errors:    0
Error Information Log Entries:      1,503
Warning  Comp. Temperature Time:    0
Critical Comp. Temperature Time:    0
Temperature Sensor 1:               36 Celsius
Temperature Sensor 2:               45 Celsius

Error Information (NVMe Log 0x01, 16 of 64 entries)
Num   ErrCount  SQId   CmdId  Status  PELoc          LBA  NSID    VS
  0       1503     0  0x0008  0x4004      -            0     0     -
  1       1502     0  0x0008  0x4004      -            0     0     -
  2       1501     0  0x0008  0x4004      -            0     0     -
  3       1500     0  0x0008  0x4004      -            0     0     -
  4       1499     0  0x0008  0x4004      -            0     0     -
  5       1498     0  0x0008  0x4004      -            0     0     -
  6       1497     0  0x0008  0x4004      -            0     0     -
  7       1496     0  0x0008  0x4004      -            0     0     -
  8       1495     0  0x0008  0x4004      -            0     0     -
  9       1494     0  0x0008  0x4004      -            0     0     -
 10       1493     0  0x0008  0x4004      -            0     0     -
 11       1492     0  0x0008  0x4004      -            0     0     -
 12       1491     0  0x0008  0x4004      -            0     0     -
 13       1490     0  0x0008  0x4004      -            0     0     -
 14       1489     0  0x0008  0x4004      -            0     0     -
 15       1488     0  0x0008  0x4004      -            0     0     -
... (48 entries not read)

