smartctl 7.2 2021-09-14 r5236 [MidnightBSD 2.2.6 amd64] (local build)
Copyright (C) 2002-20, Bruce Allen, Christian Franke, www.smartmontools.org

=== START OF INFORMATION SECTION ===
Model Number:                       Samsung SSD 970 PRO 512GB
Serial Number:                      --
Firmware Version:                   1B2QEXP7
PCI Vendor/Subsystem ID:            0x144d
IEEE OUI Identifier:                0x002538
Total NVM Capacity:                 512,110,190,592 [512 GB]
Unallocated NVM Capacity:           0
Controller ID:                      4
NVMe Version:                       1.3
Number of Namespaces:               1
Namespace 1 Size/Capacity:          512,110,190,592 [512 GB]
Namespace 1 Utilization:            108,981,571,584 [108 GB]
Namespace 1 Formatted LBA Size:     512
Namespace 1 IEEE EUI-64:            002538 ...
Local Time is:                      Thu Dec  8 13:28:04 2022 EST
Firmware Updates (0x16):            3 Slots, no Reset required
Optional Admin Commands (0x0037):   Security Format Frmw_DL Self_Test Directvs
Optional NVM Commands (0x005f):     Comp Wr_Unc DS_Mngmt Wr_Zero Sav/Sel_Feat Timestmp
Log Page Attributes (0x03):         S/H_per_NS Cmd_Eff_Lg
Maximum Data Transfer Size:         512 Pages
Warning  Comp. Temp. Threshold:     81 Celsius
Critical Comp. Temp. Threshold:     81 Celsius

Supported Power States
St Op     Max   Active     Idle   RL RT WL WT  Ent_Lat  Ex_Lat
 0 +     6.20W       -        -    0  0  0  0        0       0
 1 +     4.30W       -        -    1  1  1  1        0       0
 2 +     2.10W       -        -    2  2  2  2        0       0
 3 -   0.0400W       -        -    3  3  3  3      210    1200
 4 -   0.0050W       -        -    4  4  4  4     2000    8000

Supported LBA Sizes (NSID 0x1)
Id Fmt  Data  Metadt  Rel_Perf
 0 +     512       0         0

=== START OF SMART DATA SECTION ===
SMART overall-health self-assessment test result: PASSED

SMART/Health Information (NVMe Log 0x02)
Critical Warning:                   0x00
Temperature:                        53 Celsius
Available Spare:                    100%
Available Spare Threshold:          10%
Percentage Used:                    3%
Data Units Read:                    60,229,365 [30.8 TB]
Data Units Written:                 110,501,854 [56.5 TB]
Host Read Commands:                 505,995,887
Host Write Commands:                2,665,328,523
Controller Busy Time:               8,861
Power Cycles:                       92
Power On Hours:                     31,181
Unsafe Shutdowns:                   80
Media and Data Integrity Errors:    0
Error Information Log Entries:      3
Warning  Comp. Temperature Time:    0
Critical Comp. Temperature Time:    0
Temperature Sensor 1:               53 Celsius
Temperature Sensor 2:               75 Celsius

Error Information (NVMe Log 0x01, 16 of 64 entries)
No Errors Logged

