smartctl 7.2 2020-12-30 r5155 [FreeBSD 13.0-RELEASE amd64] (local build)
Copyright (C) 2002-20, Bruce Allen, Christian Franke, www.smartmontools.org

=== START OF INFORMATION SECTION ===
Device Model:     TOSHIBA Q300 Pro
Serial Number:    --
LU WWN Device Id: 5 00080d ...
Firmware Version: JURA0101
User Capacity:    128,035,676,160 bytes [128 GB]
Sector Size:      512 bytes logical/physical
Rotation Rate:    Solid State Device
Form Factor:      2.5 inches
TRIM Command:     Available, deterministic, zeroed
Device is:        Not in smartctl database [for details use: -P showall]
ATA Version is:   ACS-2 (minor revision not indicated)
SATA Version is:  SATA 3.1, 6.0 Gb/s (current: 6.0 Gb/s)
Local Time is:    Tue Nov  1 22:27:10 2022 EDT
SMART support is: Available - device has SMART capability.
SMART support is: Enabled
AAM feature is:   Unavailable
APM level is:     254 (maximum performance)
Rd look-ahead is: Enabled
Write cache is:   Enabled
DSN feature is:   Unavailable
ATA Security is:  Disabled, frozen [SEC2]
Wt Cache Reorder: Enabled

=== START OF READ SMART DATA SECTION ===
SMART overall-health self-assessment test result: PASSED

General SMART Values:
Offline data collection status:  (0x00)	Offline data collection activity
					was never started.
					Auto Offline Data Collection: Disabled.
Self-test execution status:      (  16)	The self-test routine was aborted by
					the host.
Total time to complete Offline 
data collection: 		(  120) seconds.
Offline data collection
capabilities: 			 (0x5b) SMART execute Offline immediate.
					Auto Offline data collection on/off support.
					Suspend Offline collection upon new
					command.
					Offline surface scan supported.
					Self-test supported.
					No Conveyance Self-test supported.
					Selective Self-test supported.
SMART capabilities:            (0x0003)	Saves SMART data before entering
					power-saving mode.
					Supports SMART auto save timer.
Error logging capability:        (0x01)	Error logging supported.
					General Purpose Logging supported.
Short self-test routine 
recommended polling time: 	 (   2) minutes.
Extended self-test routine
recommended polling time: 	 (   5) minutes.
SCT capabilities: 	       (0x003d)	SCT Status supported.
					SCT Error Recovery Control supported.
					SCT Feature Control supported.
					SCT Data Table supported.

SMART Attributes Data Structure revision number: 16
Vendor Specific SMART Attributes with Thresholds:
ID# ATTRIBUTE_NAME          FLAGS    VALUE WORST THRESH FAIL RAW_VALUE
  1 Raw_Read_Error_Rate     -O-R--   100   100   000    -    0
  2 Throughput_Performance  P-S---   100   100   050    -    0
  3 Spin_Up_Time            POS---   100   100   050    -    0
  5 Reallocated_Sector_Ct   PO--C-   100   100   050    -    0
  7 Unknown_SSD_Attribute   PO-R--   100   100   050    -    0
  8 Unknown_SSD_Attribute   P-S---   100   100   050    -    0
  9 Power_On_Hours          -O--C-   100   100   000    -    11967
 10 Unknown_SSD_Attribute   PO--C-   100   100   050    -    0
 12 Power_Cycle_Count       -O--C-   100   100   000    -    12052
167 Unknown_Attribute       -O---K   100   100   000    -    0
168 Unknown_Attribute       -O--C-   100   100   000    -    57
169 Unknown_Attribute       PO--C-   100   100   010    -    100
173 Unknown_Attribute       -O--C-   194   194   000    -    0
175 Program_Fail_Count_Chip PO--C-   100   100   010    -    0
192 Power-Off_Retract_Count -O--C-   100   100   000    -    2224
194 Temperature_Celsius     PO---K   067   050   020    -    33 (Min/Max 0/50)
197 Current_Pending_Sector  -O--C-   100   100   000    -    0
240 Unknown_SSD_Attribute   PO--C-   100   100   050    -    0
                            ||||||_ K auto-keep
                            |||||__ C event count
                            ||||___ R error rate
                            |||____ S speed/performance
                            ||_____ O updated online
                            |______ P prefailure warning

General Purpose Log Directory Version 1
SMART           Log Directory Version 1 [multi-sector log support]
Address    Access  R/W   Size  Description
0x00       GPL,SL  R/O      1  Log Directory
0x01           SL  R/O      1  Summary SMART error log
0x02           SL  R/O     51  Comprehensive SMART error log
0x03       GPL     R/O     64  Ext. Comprehensive SMART error log
0x04       GPL,SL  R/O      8  Device Statistics log
0x06           SL  R/O      1  SMART self-test log
0x07       GPL     R/O      1  Extended self-test log
0x09           SL  R/W      1  Selective self-test log
0x10       GPL     R/O      1  NCQ Command Error log
0x11       GPL     R/O      1  SATA Phy Event Counters log
0x30       GPL,SL  R/O      9  IDENTIFY DEVICE data log
0x80-0x9f  GPL,SL  R/W     16  Host vendor specific log
0xe0       GPL,SL  R/W      1  SCT Command/Status
0xe1       GPL,SL  R/W      1  SCT Data Transfer

SMART Extended Comprehensive Error Log Version: 1 (64 sectors)
Device Error Count: 19
	CR     = Command Register
	FEATR  = Features Register
	COUNT  = Count (was: Sector Count) Register
	LBA_48 = Upper bytes of LBA High/Mid/Low Registers ]  ATA-8
	LH     = LBA High (was: Cylinder High) Register    ]   LBA
	LM     = LBA Mid (was: Cylinder Low) Register      ] Register
	LL     = LBA Low (was: Sector Number) Register     ]
	DV     = Device (was: Device/Head) Register
	DC     = Device Control Register
	ER     = Error register
	ST     = Status register
Powered_Up_Time is measured from power on, and printed as
DDd+hh:mm:SS.sss where DD=days, hh=hours, mm=minutes,
SS=sec, and sss=millisec. It "wraps" after 49.710 days.

Error 19 [18] occurred at disk power-on lifetime: 7235 hours (301 days + 11 hours)
  When the command that caused the error occurred, the device was active or idle.

  After command completion occurred, registers were:
  ER -- ST COUNT  LBA_48  LH LM LL DV DC
  -- -- -- == -- == == == -- -- -- -- --
  84 -- 51 00 08 00 00 0d 0c a8 20 40 80  Error: ICRC, ABRT at LBA = 0x0d0ca820 = 218933280

  Commands leading to the command that caused the error were:
  CR FEATR COUNT  LBA_48  LH LM LL DV DC  Powered_Up_Time  Command/Feature_Name
  -- == -- == -- == == == -- -- -- -- --  ---------------  --------------------
  61 04 00 00 08 00 00 0d 0c a8 20 40 80     00:00:45.004  WRITE FPDMA QUEUED
  61 04 00 00 00 00 00 0d 0c a4 20 40 80     00:00:45.002  WRITE FPDMA QUEUED
  61 04 00 00 08 00 00 0d 0c a0 20 40 80     00:00:44.998  WRITE FPDMA QUEUED
  61 04 00 00 00 00 00 0d 0c 9c 20 40 80     00:00:44.997  WRITE FPDMA QUEUED
  61 04 00 00 08 00 00 0d 0c 98 20 40 80     00:00:44.992  WRITE FPDMA QUEUED

Error 18 [17] occurred at disk power-on lifetime: 7234 hours (301 days + 10 hours)
  When the command that caused the error occurred, the device was active or idle.

  After command completion occurred, registers were:
  ER -- ST COUNT  LBA_48  LH LM LL DV DC
  -- -- -- == -- == == == -- -- -- -- --
  84 -- 51 00 08 00 00 0c f9 07 e8 40 80  Error: ICRC, ABRT at LBA = 0x0cf907e8 = 217647080

  Commands leading to the command that caused the error were:
  CR FEATR COUNT  LBA_48  LH LM LL DV DC  Powered_Up_Time  Command/Feature_Name
  -- == -- == -- == == == -- -- -- -- --  ---------------  --------------------
  61 04 00 00 08 00 00 0c f9 07 e8 40 80     00:34:58.881  WRITE FPDMA QUEUED
  61 04 00 00 00 00 00 0c f9 03 e8 40 80     00:34:58.876  WRITE FPDMA QUEUED
  61 04 00 00 08 00 00 0c f8 ff e8 40 80     00:34:58.868  WRITE FPDMA QUEUED
  61 04 00 00 00 00 00 0c f8 fb e8 40 80     00:34:58.865  WRITE FPDMA QUEUED
  61 04 00 00 08 00 00 0c f8 f7 e8 40 80     00:34:58.858  WRITE FPDMA QUEUED

Error 17 [16] occurred at disk power-on lifetime: 2603 hours (108 days + 11 hours)
  When the command that caused the error occurred, the device was active or idle.

  After command completion occurred, registers were:
  ER -- ST COUNT  LBA_48  LH LM LL DV DC
  -- -- -- == -- == == == -- -- -- -- --
  84 -- 51 00 20 00 00 06 07 9f 6c 40 00  Error: ICRC, ABRT 32 sectors at LBA = 0x06079f6c = 101162860

  Commands leading to the command that caused the error were:
  CR FEATR COUNT  LBA_48  LH LM LL DV DC  Powered_Up_Time  Command/Feature_Name
  -- == -- == -- == == == -- -- -- -- --  ---------------  --------------------
  35 00 00 00 20 00 00 06 07 9f 6c 40 00     00:00:40.853  WRITE DMA EXT
  25 00 00 00 08 00 00 06 b5 ba e5 40 00     00:00:40.851  READ DMA EXT
  25 00 00 00 08 00 00 00 4f 46 e4 40 00     00:00:40.849  READ DMA EXT
  35 00 00 00 06 00 00 06 31 0f c3 40 00     00:00:40.839  WRITE DMA EXT
  35 00 00 00 0a 00 00 06 0f 21 04 40 00     00:00:40.829  WRITE DMA EXT

Error 16 [15] occurred at disk power-on lifetime: 2603 hours (108 days + 11 hours)
  When the command that caused the error occurred, the device was active or idle.

  After command completion occurred, registers were:
  ER -- ST COUNT  LBA_48  LH LM LL DV DC
  -- -- -- == -- == == == -- -- -- -- --
  84 -- 51 00 06 00 00 06 31 0f c3 40 00  Error: ICRC, ABRT 6 sectors at LBA = 0x06310fc3 = 103878595

  Commands leading to the command that caused the error were:
  CR FEATR COUNT  LBA_48  LH LM LL DV DC  Powered_Up_Time  Command/Feature_Name
  -- == -- == -- == == == -- -- -- -- --  ---------------  --------------------
  35 00 00 00 06 00 00 06 31 0f c3 40 00     00:00:40.839  WRITE DMA EXT
  35 00 00 00 0a 00 00 06 0f 21 04 40 00     00:00:40.829  WRITE DMA EXT
  35 00 00 00 01 00 00 06 0d b3 fd 40 00     00:00:40.819  WRITE DMA EXT
  35 00 00 00 08 00 00 00 dc f4 8f 40 00     00:00:40.809  WRITE DMA EXT
  35 00 00 00 01 00 00 00 dc f3 96 40 00     00:00:40.799  WRITE DMA EXT

Error 15 [14] occurred at disk power-on lifetime: 2603 hours (108 days + 11 hours)
  When the command that caused the error occurred, the device was active or idle.

  After command completion occurred, registers were:
  ER -- ST COUNT  LBA_48  LH LM LL DV DC
  -- -- -- == -- == == == -- -- -- -- --
  84 -- 51 00 0a 00 00 06 0f 21 04 40 00  Error: ICRC, ABRT 10 sectors at LBA = 0x060f2104 = 101654788

  Commands leading to the command that caused the error were:
  CR FEATR COUNT  LBA_48  LH LM LL DV DC  Powered_Up_Time  Command/Feature_Name
  -- == -- == -- == == == -- -- -- -- --  ---------------  --------------------
  35 00 00 00 0a 00 00 06 0f 21 04 40 00     00:00:40.829  WRITE DMA EXT
  35 00 00 00 01 00 00 06 0d b3 fd 40 00     00:00:40.819  WRITE DMA EXT
  35 00 00 00 08 00 00 00 dc f4 8f 40 00     00:00:40.809  WRITE DMA EXT
  35 00 00 00 01 00 00 00 dc f3 96 40 00     00:00:40.799  WRITE DMA EXT
  25 00 00 00 08 00 00 00 45 3a 44 40 00     00:00:40.799  READ DMA EXT

Error 14 [13] occurred at disk power-on lifetime: 2603 hours (108 days + 11 hours)
  When the command that caused the error occurred, the device was active or idle.

  After command completion occurred, registers were:
  ER -- ST COUNT  LBA_48  LH LM LL DV DC
  -- -- -- == -- == == == -- -- -- -- --
  84 -- 51 00 01 00 00 06 0d b3 fd 40 00  Error: ICRC, ABRT 1 sectors at LBA = 0x060db3fd = 101561341

  Commands leading to the command that caused the error were:
  CR FEATR COUNT  LBA_48  LH LM LL DV DC  Powered_Up_Time  Command/Feature_Name
  -- == -- == -- == == == -- -- -- -- --  ---------------  --------------------
  35 00 00 00 01 00 00 06 0d b3 fd 40 00     00:00:40.819  WRITE DMA EXT
  35 00 00 00 08 00 00 00 dc f4 8f 40 00     00:00:40.809  WRITE DMA EXT
  35 00 00 00 01 00 00 00 dc f3 96 40 00     00:00:40.799  WRITE DMA EXT
  25 00 00 00 08 00 00 00 45 3a 44 40 00     00:00:40.799  READ DMA EXT
  35 00 00 00 08 00 00 06 7e a2 f4 40 00     00:00:40.781  WRITE DMA EXT

Error 13 [12] occurred at disk power-on lifetime: 2603 hours (108 days + 11 hours)
  When the command that caused the error occurred, the device was active or idle.

  After command completion occurred, registers were:
  ER -- ST COUNT  LBA_48  LH LM LL DV DC
  -- -- -- == -- == == == -- -- -- -- --
  84 -- 51 00 08 00 00 00 dc f4 8f 40 00  Error: ICRC, ABRT 8 sectors at LBA = 0x00dcf48f = 14480527

  Commands leading to the command that caused the error were:
  CR FEATR COUNT  LBA_48  LH LM LL DV DC  Powered_Up_Time  Command/Feature_Name
  -- == -- == -- == == == -- -- -- -- --  ---------------  --------------------
  35 00 00 00 08 00 00 00 dc f4 8f 40 00     00:00:40.809  WRITE DMA EXT
  35 00 00 00 01 00 00 00 dc f3 96 40 00     00:00:40.799  WRITE DMA EXT
  25 00 00 00 08 00 00 00 45 3a 44 40 00     00:00:40.799  READ DMA EXT
  35 00 00 00 08 00 00 06 7e a2 f4 40 00     00:00:40.781  WRITE DMA EXT
  25 00 00 00 30 00 00 01 2e 23 31 40 00     00:00:40.774  READ DMA EXT

Error 12 [11] occurred at disk power-on lifetime: 2603 hours (108 days + 11 hours)
  When the command that caused the error occurred, the device was active or idle.

  After command completion occurred, registers were:
  ER -- ST COUNT  LBA_48  LH LM LL DV DC
  -- -- -- == -- == == == -- -- -- -- --
  84 -- 51 00 01 00 00 00 dc f3 96 40 00  Error: ICRC, ABRT 1 sectors at LBA = 0x00dcf396 = 14480278

  Commands leading to the command that caused the error were:
  CR FEATR COUNT  LBA_48  LH LM LL DV DC  Powered_Up_Time  Command/Feature_Name
  -- == -- == -- == == == -- -- -- -- --  ---------------  --------------------
  35 00 00 00 01 00 00 00 dc f3 96 40 00     00:00:40.799  WRITE DMA EXT
  25 00 00 00 08 00 00 00 45 3a 44 40 00     00:00:40.799  READ DMA EXT
  35 00 00 00 08 00 00 06 7e a2 f4 40 00     00:00:40.781  WRITE DMA EXT
  25 00 00 00 30 00 00 01 2e 23 31 40 00     00:00:40.774  READ DMA EXT
  25 00 00 00 10 00 00 01 23 e4 ed 40 00     00:00:40.774  READ DMA EXT

SMART Extended Self-test Log Version: 1 (1 sectors)
Num  Test_Description    Status                  Remaining  LifeTime(hours)  LBA_of_first_error
# 1  Short offline       Aborted by host               00%     10089         -
# 2  Short offline       Aborted by host               00%      9061         -
# 3  Short offline       Completed without error       00%      6781         -
# 4  Short offline       Completed without error       00%      6765         -
# 5  Short offline       Completed without error       00%      2138         -
# 6  Short offline       Completed without error       00%      2119         -

SMART Selective self-test log data structure revision number 1
 SPAN  MIN_LBA  MAX_LBA  CURRENT_TEST_STATUS
    1        0        0  Not_testing
    2        0        0  Not_testing
    3        0        0  Not_testing
    4        0        0  Not_testing
    5        0        0  Not_testing
Selective self-test flags (0x0):
  After scanning selected spans, do NOT read-scan remainder of disk.
If Selective self-test is pending on power-up, resume after 0 minute delay.

SCT Status Version:                  3
SCT Version (vendor specific):       3 (0x0003)
Device State:                        Active (0)
Current Temperature:                    33 Celsius
Power Cycle Min/Max Temperature:     32/33 Celsius
Lifetime    Min/Max Temperature:      0/50 Celsius
Under/Over Temperature Limit Count:   0/0
Vendor specific:
00 00 04 00 05 01 00 05 05 01 00 00 00 00 00 00
00 02 00 00 f3 5d 91 02 02 02 00 00 00 00 00 06

SCT Temperature History Version:     2
Temperature Sampling Period:         1 minute
Temperature Logging Interval:        1 minute
Min/Max recommended Temperature:      5/40 Celsius
Min/Max Temperature Limit:            0/80 Celsius
Temperature History Size (Index):    128 (49)

SCT Error Recovery Control:
           Read:    600 (60.0 seconds)
          Write:    600 (60.0 seconds)

Device Statistics (GP Log 0x04)
Page  Offset Size        Value Flags Description
0x01  =====  =               =  ===  == General Statistics (rev 2) ==
0x01  0x008  4           12052  ---  Lifetime Power-On Resets
0x01  0x018  6      5575314815  ---  Logical Sectors Written
0x01  0x020  6       102410369  ---  Number of Write Commands
0x01  0x028  6      7932133709  ---  Logical Sectors Read
0x01  0x030  6       145827805  ---  Number of Read Commands
0x04  =====  =               =  ===  == General Errors Statistics (rev 1) ==
0x04  0x008  4               0  ---  Number of Reported Uncorrectable Errors
0x04  0x010  4              13  ---  Resets Between Cmd Acceptance and Completion
0x05  =====  =               =  ===  == Temperature Statistics (rev 1) ==
0x05  0x008  1              33  ---  Current Temperature
0x05  0x010  1              32  ---  Average Short Term Temperature
0x05  0x018  1              25  ---  Average Long Term Temperature
0x05  0x020  1              47  ---  Highest Temperature
0x05  0x028  1               6  ---  Lowest Temperature
0x05  0x030  1              42  ---  Highest Average Short Term Temperature
0x05  0x038  1              11  ---  Lowest Average Short Term Temperature
0x05  0x040  1              35  ---  Highest Average Long Term Temperature
0x05  0x048  1              17  ---  Lowest Average Long Term Temperature
0x05  0x050  4           20740  ---  Time in Over-Temperature
0x05  0x058  1              40  ---  Specified Maximum Operating Temperature
0x05  0x060  4              50  ---  Time in Under-Temperature
0x05  0x068  1               5  ---  Specified Minimum Operating Temperature
0x06  =====  =               =  ===  == Transport Statistics (rev 1) ==
0x06  0x008  4           42405  ---  Number of Hardware Resets
0x06  0x018  4              57  ---  Number of Interface CRC Errors
0x07  =====  =               =  ===  == Solid State Device Statistics (rev 1) ==
0x07  0x008  1               6  N--  Percentage Used Endurance Indicator
                                |||_ C monitored condition met
                                ||__ D supports DSN
                                |___ N normalized value

Pending Defects log (GP Log 0x0c) not supported

SATA Phy Event Counters (GP Log 0x11)
ID      Size     Value  Description
0x0001  2            0  Command failed due to ICRC error
0x0002  4            0  R_ERR response for data FIS
0x0003  2            0  R_ERR response for device-to-host data FIS
0x0004  2            0  R_ERR response for host-to-device data FIS
0x0005  4            0  R_ERR response for non-data FIS
0x0006  2            0  R_ERR response for device-to-host non-data FIS
0x0007  2            0  R_ERR response for host-to-device non-data FIS
0x0008  2            0  Device-to-host non-data FIS retries
0x0009  4            9  Transition from drive PhyRdy to drive PhyNRdy
0x000a  4            9  Device-to-host register FISes sent due to a COMRESET
0x000b  4            0  CRC errors within host-to-device FIS
0x000d  4            0  Non-CRC errors within host-to-device FIS
0x000f  2            0  R_ERR response for host-to-device data FIS, CRC
0x0010  2            0  R_ERR response for host-to-device data FIS, non-CRC
0x0012  2            0  R_ERR response for host-to-device non-data FIS, CRC
0x0013  2            0  R_ERR response for host-to-device non-data FIS, non-CRC



