smartctl 7.3 2022-02-28 r5338 [FreeBSD 13.1-RELEASE-p5 amd64] (local build)
Copyright (C) 2002-22, Bruce Allen, Christian Franke, www.smartmontools.org

=== START OF INFORMATION SECTION ===
Model Family:     Silicon Motion based SSDs
Device Model:     Ramsta SSD S800 120GB
Serial Number:    --
LU WWN Device Id: 0 000000 ...
Firmware Version: RY2DV0
User Capacity:    120,034,123,776 bytes [120 GB]
Sector Size:      512 bytes logical/physical
Rotation Rate:    Solid State Device
Form Factor:      2.5 inches
TRIM Command:     Available
Device is:        In smartctl database 7.3/5319
ATA Version is:   ACS-2 T13/2015-D revision 3
SATA Version is:  SATA 3.2, 6.0 Gb/s (current: 6.0 Gb/s)
Local Time is:    Sat Jan  7 21:40:03 2023 PST
SMART support is: Available - device has SMART capability.
SMART support is: Enabled
AAM feature is:   Unavailable
APM feature is:   Unavailable
Rd look-ahead is: Enabled
Write cache is:   Enabled
DSN feature is:   Unavailable
ATA Security is:  Disabled, frozen [SEC2]
Wt Cache Reorder: Unavailable

=== START OF READ SMART DATA SECTION ===
SMART overall-health self-assessment test result: PASSED

General SMART Values:
Offline data collection status:  (0x00)	Offline data collection activity
					was never started.
					Auto Offline Data Collection: Disabled.
Self-test execution status:      (   0)	The previous self-test routine completed
					without error or no self-test has ever 
					been run.
Total time to complete Offline 
data collection: 		(  120) seconds.
Offline data collection
capabilities: 			 (0x5d) SMART execute Offline immediate.
					No Auto Offline data collection support.
					Abort Offline collection upon new
					command.
					Offline surface scan supported.
					Self-test supported.
					No Conveyance Self-test supported.
					Selective Self-test supported.
SMART capabilities:            (0x0002)	Does not save SMART data before
					entering power-saving mode.
					Supports SMART auto save timer.
Error logging capability:        (0x01)	Error logging supported.
					General Purpose Logging supported.
Short self-test routine 
recommended polling time: 	 (   2) minutes.
Extended self-test routine
recommended polling time: 	 (   4) minutes.

SMART Attributes Data Structure revision number: 1
Vendor Specific SMART Attributes with Thresholds:
ID# ATTRIBUTE_NAME          FLAGS    VALUE WORST THRESH FAIL RAW_VALUE
  1 Raw_Read_Error_Rate     -O--CK   100   100   050    -    0
  5 Reallocated_Sector_Ct   -O--CK   100   100   050    -    0
  9 Power_On_Hours          -O--CK   100   100   050    -    6610
 12 Power_Cycle_Count       -O--CK   100   100   050    -    99
160 Uncorrectable_Error_Cnt -O--CK   100   100   050    -    0
161 Valid_Spare_Block_Cnt   -O--CK   100   100   050    -    0
163 Initial_Bad_Block_Count -O--CK   100   100   050    -    2356
164 Total_Erase_Count       -O--CK   100   100   050    -    111
165 Max_Erase_Count         -O--CK   100   100   050    -    158
166 Min_Erase_Count         -O--CK   100   100   050    -    0
167 Average_Erase_Count     -O--CK   100   100   050    -    73
168 Max_Erase_Count_of_Spec -O--CK   100   100   050    -    0
169 Remaining_Lifetime_Perc -O--CK   100   100   050    -    100
175 Program_Fail_Count_Chip -O--CK   100   100   050    -    100663296
176 Erase_Fail_Count_Chip   -O--CK   100   100   050    -    8872
177 Wear_Leveling_Count     -O--CK   100   100   050    -    3384
178 Runtime_Invalid_Blk_Cnt -O--CK   100   100   050    -    0
181 Program_Fail_Cnt_Total  -O--CK   100   100   050    -    3
182 Erase_Fail_Count_Total  -O--CK   100   100   050    -    0
192 Power-Off_Retract_Count -O--CK   100   100   050    -    61
194 Temperature_Celsius     -O--CK   100   100   050    -    42
195 Hardware_ECC_Recovered  -O--CK   100   100   050    -    0
196 Reallocated_Event_Count -O--CK   100   100   050    -    0
197 Current_Pending_Sector  -O--CK   100   100   050    -    0
198 Offline_Uncorrectable   -O--CK   100   100   050    -    0
199 UDMA_CRC_Error_Count    -O--CK   100   100   050    -    0
232 Available_Reservd_Space -O--CK   100   100   050    -    0
241 Host_Writes_32MiB       -O--CK   100   100   050    -    87893
242 Host_Reads_32MiB        -O--CK   100   100   050    -    490
249 Unkn_SiliconMotion_Attr -O--CK   100   100   050    -    98980
                            ||||||_ K auto-keep
                            |||||__ C event count
                            ||||___ R error rate
                            |||____ S speed/performance
                            ||_____ O updated online
                            |______ P prefailure warning

General Purpose Log Directory Version 1
SMART           Log Directory Version 1 [multi-sector log support]
Address    Access  R/W   Size  Description
0x00       GPL,SL  R/O      1  Log Directory
0x01       GPL,SL  R/O      1  Summary SMART error log
0x02       GPL,SL  R/O      1  Comprehensive SMART error log
0x03       GPL,SL  R/O      1  Ext. Comprehensive SMART error log
0x04       GPL,SL  R/O      8  Device Statistics log
0x06       GPL,SL  R/O      1  SMART self-test log
0x07       GPL,SL  R/O      1  Extended self-test log
0x09       GPL,SL  R/W      1  Selective self-test log
0x10       GPL,SL  R/O      1  NCQ Command Error log
0x11       GPL,SL  R/O      1  SATA Phy Event Counters log
0x30       GPL,SL  R/O      9  IDENTIFY DEVICE data log
0x80-0x9f  GPL,SL  R/W     16  Host vendor specific log
0xa0       GPL,SL  VS      16  Device vendor specific log
0xe0       GPL,SL  R/W      1  SCT Command/Status
0xe1       GPL,SL  R/W      1  SCT Data Transfer

SMART Extended Comprehensive Error Log Version: 1 (1 sectors)
Device Error Count: 2
	CR     = Command Register
	FEATR  = Features Register
	COUNT  = Count (was: Sector Count) Register
	LBA_48 = Upper bytes of LBA High/Mid/Low Registers ]  ATA-8
	LH     = LBA High (was: Cylinder High) Register    ]   LBA
	LM     = LBA Mid (was: Cylinder Low) Register      ] Register
	LL     = LBA Low (was: Sector Number) Register     ]
	DV     = Device (was: Device/Head) Register
	DC     = Device Control Register
	ER     = Error register
	ST     = Status register
Powered_Up_Time is measured from power on, and printed as
DDd+hh:mm:SS.sss where DD=days, hh=hours, mm=minutes,
SS=sec, and sss=millisec. It "wraps" after 49.710 days.

Error 2 [1] occurred at disk power-on lifetime: 5832 hours (243 days + 0 hours)
  When the command that caused the error occurred, the device was in an unknown state.

  After command completion occurred, registers were:
  ER -- ST COUNT  LBA_48  LH LM LL DV DC
  -- -- -- == -- == == == -- -- -- -- --
  04 -- 00 00 01 00 00 4f 00 c2 e0 51 00

  Commands leading to the command that caused the error were:
  CR FEATR COUNT  LBA_48  LH LM LL DV DC  Powered_Up_Time  Command/Feature_Name
  -- == -- == -- == == == -- -- -- -- --  ---------------  --------------------
  b0 00 d5 00 01 00 00 4f 00 c2 e0 00 00     00:00:07.520  SMART READ LOG
  20 00 00 00 01 00 00 00 00 00 00 40 00     00:00:07.510  READ SECTOR(S)
  b0 00 d5 00 01 00 00 4f 00 c2 9a 00 00     00:00:07.510  SMART READ LOG
  ec 00 00 00 01 00 00 00 00 00 00 40 00     00:00:07.510  IDENTIFY DEVICE
  25 00 00 03 b8 00 00 04 00 00 f1 40 00     00:00:04.050  READ DMA EXT

Error 1 [0] occurred at disk power-on lifetime: 5206 hours (216 days + 22 hours)
  When the command that caused the error occurred, the device was in an unknown state.

  After command completion occurred, registers were:
  ER -- ST COUNT  LBA_48  LH LM LL DV DC
  -- -- -- == -- == == == -- -- -- -- --
  04 -- 00 00 01 00 00 4f 00 c2 e0 51 00

  Commands leading to the command that caused the error were:
  CR FEATR COUNT  LBA_48  LH LM LL DV DC  Powered_Up_Time  Command/Feature_Name
  -- == -- == -- == == == -- -- -- -- --  ---------------  --------------------
  b0 00 d5 00 01 00 00 4f 00 c2 e0 00 00     00:03:44.020  SMART READ LOG
  20 00 00 00 01 00 00 00 00 00 00 40 00     00:03:44.020  READ SECTOR(S)
  b0 00 d5 00 01 00 00 4f 00 c2 9a 00 00     00:03:44.010  SMART READ LOG
  ec 00 00 00 01 00 00 00 00 00 00 40 00     00:03:44.010  IDENTIFY DEVICE
  25 00 00 01 08 00 07 7a 00 d3 38 40 00     00:01:56.720  READ DMA EXT

SMART Extended Self-test Log Version: 1 (1 sectors)
Num  Test_Description    Status                  Remaining  LifeTime(hours)  LBA_of_first_error
# 1  Offline             Completed without error       00%      5832         -
# 2  Offline             Self-test routine in progress 10%      5832         -
# 3  Offline             Self-test routine in progress 10%      5832         -
# 4  Offline             Self-test routine in progress 10%      5832         -
# 5  Offline             Self-test routine in progress 10%      5832         -
# 6  Offline             Self-test routine in progress 10%      5832         -
# 7  Offline             Self-test routine in progress 10%      5832         -
# 8  Offline             Self-test routine in progress 10%      5832         -
# 9  Offline             Self-test routine in progress 10%      5832         -
#10  Offline             Self-test routine in progress 10%      5832         -
#11  Offline             Self-test routine in progress 10%      5832         -
#12  Offline             Self-test routine in progress 10%      5832         -
#13  Offline             Self-test routine in progress 10%      5832         -
#14  Offline             Self-test routine in progress 10%      5832         -
#15  Offline             Self-test routine in progress 10%      5832         -
#16  Offline             Self-test routine in progress 10%      5832         -
#17  Offline             Self-test routine in progress 10%      5832         -
#18  Offline             Self-test routine in progress 10%      5832         -
#19  Offline             Self-test routine in progress 10%      5832         -

SMART Selective self-test log data structure revision number 0
Note: revision number not 1 implies that no selective self-test has ever been run
 SPAN  MIN_LBA  MAX_LBA  CURRENT_TEST_STATUS
    1        0        0  Not_testing
    2        0        0  Not_testing
    3        0        0  Not_testing
    4        0        0  Not_testing
    5        0        0  Not_testing
Selective self-test flags (0x0):
  After scanning selected spans, do NOT read-scan remainder of disk.
If Selective self-test is pending on power-up, resume after 0 minute delay.

SCT Commands not supported

Device Statistics (GP Log 0x04)
Page  Offset Size        Value Flags Description
0x01  =====  =               =  ===  == General Statistics (rev 1) ==
0x01  0x008  4              99  ---  Lifetime Power-On Resets
0x01  0x010  4            6610  ---  Power-on Hours
0x01  0x018  6      5760155648  ---  Logical Sectors Written
0x01  0x020  6       113246941  ---  Number of Write Commands
0x01  0x028  6        32112640  ---  Logical Sectors Read
0x01  0x030  6          468981  ---  Number of Read Commands
0x01  =====  =               =  ===  == General Statistics (rev 1) ==
0x01  0x008  4              99  ---  Lifetime Power-On Resets
0x01  0x010  4            6610  ---  Power-on Hours
0x01  0x018  6      5760155648  ---  Logical Sectors Written
0x01  0x020  6       113246941  ---  Number of Write Commands
0x01  0x028  6        32112640  ---  Logical Sectors Read
0x01  0x030  6          468981  ---  Number of Read Commands
0x01  =====  =               =  ===  == General Statistics (rev 1) ==
0x01  0x008  4              99  ---  Lifetime Power-On Resets
0x01  0x010  4            6610  ---  Power-on Hours
0x01  0x018  6      5760155648  ---  Logical Sectors Written
0x01  0x020  6       113246941  ---  Number of Write Commands
0x01  0x028  6        32112640  ---  Logical Sectors Read
0x01  0x030  6          468981  ---  Number of Read Commands
0x01  =====  =               =  ===  == General Statistics (rev 1) ==
0x01  0x008  4              99  ---  Lifetime Power-On Resets
0x01  0x010  4            6610  ---  Power-on Hours
0x01  0x018  6      5760155648  ---  Logical Sectors Written
0x01  0x020  6       113246941  ---  Number of Write Commands
0x01  0x028  6        32112640  ---  Logical Sectors Read
0x01  0x030  6          468981  ---  Number of Read Commands
0x01  =====  =               =  ===  == General Statistics (rev 1) ==
0x01  0x008  4              99  ---  Lifetime Power-On Resets
0x01  0x010  4            6610  ---  Power-on Hours
0x01  0x018  6      5760155648  ---  Logical Sectors Written
0x01  0x020  6       113246941  ---  Number of Write Commands
0x01  0x028  6        32112640  ---  Logical Sectors Read
0x01  0x030  6          468981  ---  Number of Read Commands
0x01  =====  =               =  ===  == General Statistics (rev 1) ==
0x01  0x008  4              99  ---  Lifetime Power-On Resets
0x01  0x010  4            6610  ---  Power-on Hours
0x01  0x018  6      5760155648  ---  Logical Sectors Written
0x01  0x020  6       113246941  ---  Number of Write Commands
0x01  0x028  6        32112640  ---  Logical Sectors Read
0x01  0x030  6          468981  ---  Number of Read Commands
0x01  =====  =               =  ===  == General Statistics (rev 1) ==
0x01  0x008  4              99  ---  Lifetime Power-On Resets
0x01  0x010  4            6610  ---  Power-on Hours
0x01  0x018  6      5760155648  ---  Logical Sectors Written
0x01  0x020  6       113246941  ---  Number of Write Commands
0x01  0x028  6        32112640  ---  Logical Sectors Read
0x01  0x030  6          468981  ---  Number of Read Commands
0x01  =====  =               =  ===  == General Statistics (rev 1) ==
0x01  0x008  4              99  ---  Lifetime Power-On Resets
0x01  0x010  4            6610  ---  Power-on Hours
0x01  0x018  6      5760155648  ---  Logical Sectors Written
0x01  0x020  6       113246941  ---  Number of Write Commands
0x01  0x028  6        32112640  ---  Logical Sectors Read
0x01  0x030  6          468981  ---  Number of Read Commands
                                |||_ C monitored condition met
                                ||__ D supports DSN
                                |___ N normalized value

Pending Defects log (GP Log 0x0c) not supported

SATA Phy Event Counters (GP Log 0x11)
ID      Size     Value  Description
0x0001  4            0  Command failed due to ICRC error
0x0009  4           59  Transition from drive PhyRdy to drive PhyNRdy
0x000a  4          161  Device-to-host register FISes sent due to a COMRESET
0x000b  4            0  CRC errors within host-to-device FIS
0x000d  4            0  Non-CRC errors within host-to-device FIS

