smartctl 7.2 2020-12-30 r5155 [FreeBSD 12.1-RELEASE-p19-HBSD amd64] (local build)
Copyright (C) 2002-20, Bruce Allen, Christian Franke, www.smartmontools.org

=== START OF INFORMATION SECTION ===
Model Family:     Seagate Momentus 5400.3
Device Model:     ST980811AS
Serial Number:    --
Firmware Version: 3.BHD
User Capacity:    80,026,361,856 bytes [80.0 GB]
Sector Size:      512 bytes logical/physical
Device is:        In smartctl database [for details use: -P show]
ATA Version is:   ATA/ATAPI-7 (minor revision not indicated)
Local Time is:    Sun Aug 29 01:10:47 2021 UTC
SMART support is: Available - device has SMART capability.
SMART support is: Enabled
AAM feature is:   Unavailable
APM level is:     128 (minimum power consumption without standby)
Rd look-ahead is: Enabled
Write cache is:   Enabled
DSN feature is:   Unavailable
ATA Security is:  Disabled, NOT FROZEN [SEC1]
Wt Cache Reorder: Unavailable

=== START OF READ SMART DATA SECTION ===
SMART overall-health self-assessment test result: PASSED

General SMART Values:
Offline data collection status:  (0x82)	Offline data collection activity
					was completed without error.
					Auto Offline Data Collection: Enabled.
Self-test execution status:      (  41)	The self-test routine was interrupted
					by the host with a hard or soft reset.
Total time to complete Offline 
data collection: 		(  426) seconds.
Offline data collection
capabilities: 			 (0x53) SMART execute Offline immediate.
					Auto Offline data collection on/off support.
					Suspend Offline collection upon new
					command.
					No Offline surface scan supported.
					Self-test supported.
					No Conveyance Self-test supported.
					Selective Self-test supported.
SMART capabilities:            (0x0003)	Saves SMART data before entering
					power-saving mode.
					Supports SMART auto save timer.
Error logging capability:        (0x01)	Error logging supported.
					No General Purpose Logging support.
Short self-test routine 
recommended polling time: 	 (   2) minutes.
Extended self-test routine
recommended polling time: 	 (  46) minutes.
SCT capabilities: 	       (0x0001)	SCT Status supported.

SMART Attributes Data Structure revision number: 10
Vendor Specific SMART Attributes with Thresholds:
ID# ATTRIBUTE_NAME          FLAGS    VALUE WORST THRESH FAIL RAW_VALUE
  1 Raw_Read_Error_Rate     POSR--   100   253   006    -    0
  3 Spin_Up_Time            -O----   099   099   000    -    0
  4 Start_Stop_Count        PO--CK   100   100   020    -    778
  5 Reallocated_Sector_Ct   PO--CK   100   100   036    -    0
  7 Seek_Error_Rate         POSR--   085   060   030    -    4644498106
  9 Power_On_Hours          -O--CK   090   090   000    -    9441
 10 Spin_Retry_Count        PO--C-   100   100   034    -    0
 12 Power_Cycle_Count       PO--CK   100   100   020    -    796
187 Reported_Uncorrect      -O--CK   100   100   000    -    0
189 High_Fly_Writes         -O-RCK   096   096   000    -    4
190 Airflow_Temperature_Cel -O---K   070   046   045    -    30 (Min/Max 24/35)
192 Power-Off_Retract_Count -O--CK   100   100   000    -    619
193 Load_Cycle_Count        -O--CK   033   033   000    -    134697
194 Temperature_Celsius     -O---K   030   054   000    -    30 (0 17 0 0 0)
195 Hardware_ECC_Recovered  -O-RC-   075   064   000    -    39507770
197 Current_Pending_Sector  -O--C-   100   100   000    -    0
198 Offline_Uncorrectable   ----C-   100   100   000    -    0
199 UDMA_CRC_Error_Count    -OSRCK   200   200   000    -    0
200 Multi_Zone_Error_Rate   ------   100   253   000    -    0
202 Data_Address_Mark_Errs  -O--CK   100   253   000    -    0
                            ||||||_ K auto-keep
                            |||||__ C event count
                            ||||___ R error rate
                            |||____ S speed/performance
                            ||_____ O updated online
                            |______ P prefailure warning

General Purpose Log Directory not supported

SMART Log Directory Version 1 [multi-sector log support]
Address    Access  R/W   Size  Description
0x00           SL  R/O      1  Log Directory
0x01           SL  R/O      1  Summary SMART error log
0x02           SL  R/O      5  Comprehensive SMART error log
0x03           SL  R/O      5  Ext. Comprehensive SMART error log
0x06           SL  R/O      1  SMART self-test log
0x07           SL  R/O      1  Extended self-test log
0x09           SL  R/W      1  Selective self-test log
0x10           SL  R/O      1  NCQ Command Error log
0x11           SL  R/O      1  SATA Phy Event Counters log
0x20           SL  R/O      1  Streaming performance log [OBS-8]
0x21           SL  R/O      1  Write stream error log
0x22           SL  R/O      1  Read stream error log
0x23           SL  R/O      1  Delayed sector log [OBS-8]
0x80-0x9f      SL  R/W     16  Host vendor specific log
0xa0           SL  VS       1  Device vendor specific log
0xa1           SL  VS      20  Device vendor specific log
0xa2           SL  VS     101  Device vendor specific log
0xa8           SL  VS      20  Device vendor specific log
0xa9           SL  VS       1  Device vendor specific log
0xe0           SL  R/W      1  SCT Command/Status
0xe1           SL  R/W      1  SCT Data Transfer

SMART Extended Comprehensive Error Log (GP Log 0x03) not supported

SMART Error Log Version: 1
No Errors Logged

SMART Extended Self-test Log (GP Log 0x07) not supported

SMART Self-test log structure revision number 1
Num  Test_Description    Status                  Remaining  LifeTime(hours)  LBA_of_first_error
# 1  Short offline       Interrupted (host reset)      90%      8780         -

SMART Selective self-test log data structure revision number 1
 SPAN  MIN_LBA  MAX_LBA  CURRENT_TEST_STATUS
    1        0        0  Not_testing
    2        0        0  Not_testing
    3        0        0  Not_testing
    4        0        0  Not_testing
    5        0        0  Not_testing
Selective self-test flags (0x0):
  After scanning selected spans, do NOT read-scan remainder of disk.
If Selective self-test is pending on power-up, resume after 0 minute delay.

SCT Status Version:                  2
SCT Version (vendor specific):       521 (0x0209)
Device State:                        Active (0)
Current Temperature:                    30 Celsius
Power Cycle Min/Max Temperature:     --/ 0 Celsius
Lifetime    Min/Max Temperature:     --/ 0 Celsius

SCT Data Table command not supported

SCT Error Recovery Control command not supported

Device Statistics (GP/SMART Log 0x04) not supported

Pending Defects log (GP Log 0x0c) not supported

SATA Phy Event Counters (GP Log 0x11)
ID      Size     Value  Description
0x000a  2           29  Device-to-host register FISes sent due to a COMRESET
0x0001  2            0  Command failed due to ICRC error
0x0003  2            0  R_ERR response for device-to-host data FIS
0x0004  2            0  R_ERR response for host-to-device data FIS
0x0006  2            0  R_ERR response for device-to-host non-data FIS
0x0007  2            0  R_ERR response for host-to-device non-data FIS
0x0009  2           28  Transition from drive PhyRdy to drive PhyNRdy
0x8002  2            0  Vendor specific
0x8003  2           11  Vendor specific
0x8004  2            0  Vendor specific

