smartctl 7.2 2020-12-30 r5155 [FreeBSD 13.0-RELEASE amd64] (local build)
Copyright (C) 2002-20, Bruce Allen, Christian Franke, www.smartmontools.org

=== START OF INFORMATION SECTION ===
Model Family:     Seagate Laptop SSHD
Device Model:     ST1000LM014-1EJ164
Serial Number:    --
LU WWN Device Id: 5 000c50 ...
Firmware Version: LVD1
User Capacity:    1,000,204,886,016 bytes [1.00 TB]
Sector Sizes:     512 bytes logical, 4096 bytes physical
Rotation Rate:    5400 rpm
Form Factor:      2.5 inches
Device is:        In smartctl database [for details use: -P show]
ATA Version is:   ACS-2, ACS-3 T13/2161-D revision 3b
SATA Version is:  SATA 3.1, 6.0 Gb/s (current: 6.0 Gb/s)
Local Time is:    Sat Oct 22 09:45:32 2022 EDT
SMART support is: Available - device has SMART capability.
SMART support is: Enabled
AAM feature is:   Unavailable
APM level is:     128 (minimum power consumption without standby)
Rd look-ahead is: Enabled
Write cache is:   Enabled
DSN feature is:   Unavailable
ATA Security is:  Disabled, frozen [SEC2]
Wt Cache Reorder: Unavailable

=== START OF READ SMART DATA SECTION ===
SMART overall-health self-assessment test result: PASSED
See vendor-specific Attribute list for marginal Attributes.

General SMART Values:
Offline data collection status:  (0x00)	Offline data collection activity
					was never started.
					Auto Offline Data Collection: Disabled.
Self-test execution status:      (   0)	The previous self-test routine completed
					without error or no self-test has ever 
					been run.
Total time to complete Offline 
data collection: 		(  150) seconds.
Offline data collection
capabilities: 			 (0x73) SMART execute Offline immediate.
					Auto Offline data collection on/off support.
					Suspend Offline collection upon new
					command.
					No Offline surface scan supported.
					Self-test supported.
					Conveyance Self-test supported.
					Selective Self-test supported.
SMART capabilities:            (0x0003)	Saves SMART data before entering
					power-saving mode.
					Supports SMART auto save timer.
Error logging capability:        (0x01)	Error logging supported.
					General Purpose Logging supported.
Short self-test routine 
recommended polling time: 	 (   1) minutes.
Extended self-test routine
recommended polling time: 	 ( 193) minutes.
Conveyance self-test routine
recommended polling time: 	 (   2) minutes.
SCT capabilities: 	       (0x1081)	SCT Status supported.

SMART Attributes Data Structure revision number: 10
Vendor Specific SMART Attributes with Thresholds:
ID# ATTRIBUTE_NAME          FLAGS    VALUE WORST THRESH FAIL RAW_VALUE
  1 Raw_Read_Error_Rate     POSR--   105   099   006    -    8811288
  3 Spin_Up_Time            PO----   098   097   000    -    0
  4 Start_Stop_Count        -O--CK   090   090   020    -    10555
  5 Reallocated_Sector_Ct   PO--CK   100   100   010    -    0
  7 Seek_Error_Rate         POSR--   075   060   030    -    30321702753
  9 Power_On_Hours          -O--CK   093   093   000    -    6242
 10 Spin_Retry_Count        PO--C-   100   100   097    -    0
 12 Power_Cycle_Count       -O--CK   095   095   020    -    5448
184 End-to-End_Error        -O--CK   081   081   099    NOW  19
187 Reported_Uncorrect      -O--CK   098   098   000    -    2
188 Command_Timeout         -O--CK   100   099   000    -    44
189 High_Fly_Writes         -O-RCK   002   002   000    -    98
190 Airflow_Temperature_Cel -O---K   052   031   045    Past 48 (Min/Max 37/48 #6076)
191 G-Sense_Error_Rate      -O--CK   100   100   000    -    0
192 Power-Off_Retract_Count -O--CK   100   100   000    -    710
193 Load_Cycle_Count        -O--CK   083   083   000    -    35115
194 Temperature_Celsius     -O---K   048   069   000    -    48 (0 10 0 0 0)
197 Current_Pending_Sector  -O--C-   100   100   000    -    0
198 Offline_Uncorrectable   ----C-   100   100   000    -    0
199 UDMA_CRC_Error_Count    -OSRCK   200   200   000    -    0
254 Free_Fall_Sensor        -O--CK   100   100   000    -    0
                            ||||||_ K auto-keep
                            |||||__ C event count
                            ||||___ R error rate
                            |||____ S speed/performance
                            ||_____ O updated online
                            |______ P prefailure warning

General Purpose Log Directory Version 1
SMART           Log Directory Version 1 [multi-sector log support]
Address    Access  R/W   Size  Description
0x00       GPL,SL  R/O      1  Log Directory
0x01           SL  R/O      1  Summary SMART error log
0x02           SL  R/O      5  Comprehensive SMART error log
0x03       GPL     R/O      5  Ext. Comprehensive SMART error log
0x06           SL  R/O      1  SMART self-test log
0x07       GPL     R/O      1  Extended self-test log
0x09           SL  R/W      1  Selective self-test log
0x10       GPL     R/O      1  NCQ Command Error log
0x11       GPL     R/O      1  SATA Phy Event Counters log
0x21       GPL     R/O      1  Write stream error log
0x22       GPL     R/O      1  Read stream error log
0x24       GPL     R/O   1223  Current Device Internal Status Data log
0x25       GPL     R/O   1223  Saved Device Internal Status Data log
0x30       GPL,SL  R/O      9  IDENTIFY DEVICE data log
0x80-0x9f  GPL,SL  R/W     16  Host vendor specific log
0xa1       GPL,SL  VS      20  Device vendor specific log
0xa2       GPL     VS    3900  Device vendor specific log
0xa8       GPL,SL  VS     129  Device vendor specific log
0xa9       GPL,SL  VS       1  Device vendor specific log
0xab       GPL     VS       1  Device vendor specific log
0xae       GPL     VS       1  Device vendor specific log
0xb0       GPL     VS    4580  Device vendor specific log
0xbe-0xbf  GPL     VS   65535  Device vendor specific log
0xc1       GPL,SL  VS      10  Device vendor specific log
0xc2       GPL,SL  VS      50  Device vendor specific log
0xc4       GPL,SL  VS       5  Device vendor specific log
0xe0       GPL,SL  R/W      1  SCT Command/Status
0xe1       GPL,SL  R/W      1  SCT Data Transfer

SMART Extended Comprehensive Error Log Version: 1 (5 sectors)
Device Error Count: 19
	CR     = Command Register
	FEATR  = Features Register
	COUNT  = Count (was: Sector Count) Register
	LBA_48 = Upper bytes of LBA High/Mid/Low Registers ]  ATA-8
	LH     = LBA High (was: Cylinder High) Register    ]   LBA
	LM     = LBA Mid (was: Cylinder Low) Register      ] Register
	LL     = LBA Low (was: Sector Number) Register     ]
	DV     = Device (was: Device/Head) Register
	DC     = Device Control Register
	ER     = Error register
	ST     = Status register
Powered_Up_Time is measured from power on, and printed as
DDd+hh:mm:SS.sss where DD=days, hh=hours, mm=minutes,
SS=sec, and sss=millisec. It "wraps" after 49.710 days.

Error 19 [18] occurred at disk power-on lifetime: 6209 hours (258 days + 17 hours)
  When the command that caused the error occurred, the device was active or idle.

  After command completion occurred, registers were:
  ER -- ST COUNT  LBA_48  LH LM LL DV DC
  -- -- -- == -- == == == -- -- -- -- --
  40 -- 51 00 00 00 00 5a c8 38 38 00 00  Error: UNC at LBA = 0x5ac83838 = 1523071032

  Commands leading to the command that caused the error were:
  CR FEATR COUNT  LBA_48  LH LM LL DV DC  Powered_Up_Time  Command/Feature_Name
  -- == -- == -- == == == -- -- -- -- --  ---------------  --------------------
  60 00 00 01 00 00 00 5a c8 38 80 40 00     00:00:35.597  READ FPDMA QUEUED
  60 00 00 01 00 00 00 5a c8 37 80 40 00     00:00:35.597  READ FPDMA QUEUED
  60 00 00 00 08 00 00 5a c9 12 68 40 00     00:00:35.586  READ FPDMA QUEUED
  60 00 00 01 00 00 00 5a c8 35 80 40 00     00:00:35.583  READ FPDMA QUEUED
  60 00 00 00 08 00 00 5a c9 11 e0 40 00     00:00:35.582  READ FPDMA QUEUED

Error 18 [17] occurred at disk power-on lifetime: 6209 hours (258 days + 17 hours)
  When the command that caused the error occurred, the device was active or idle.

  After command completion occurred, registers were:
  ER -- ST COUNT  LBA_48  LH LM LL DV DC
  -- -- -- == -- == == == -- -- -- -- --
  40 -- 51 00 00 00 00 18 c8 1b 6a 00 00  Error: UNC at LBA = 0x18c81b6a = 415767402

  Commands leading to the command that caused the error were:
  CR FEATR COUNT  LBA_48  LH LM LL DV DC  Powered_Up_Time  Command/Feature_Name
  -- == -- == -- == == == -- -- -- -- --  ---------------  --------------------
  60 00 00 01 00 00 00 18 c8 1b 00 40 00     00:00:27.009  READ FPDMA QUEUED
  60 00 00 01 00 00 00 18 c8 1a 00 40 00     00:00:26.997  READ FPDMA QUEUED
  60 00 00 01 00 00 00 18 c8 19 00 40 00     00:00:26.985  READ FPDMA QUEUED
  60 00 00 01 00 00 00 18 c8 18 00 40 00     00:00:26.973  READ FPDMA QUEUED
  60 00 00 01 00 00 00 18 c8 17 00 40 00     00:00:26.969  READ FPDMA QUEUED

Error 17 [16] occurred at disk power-on lifetime: 6204 hours (258 days + 12 hours)
  When the command that caused the error occurred, the device was active or idle.

  After command completion occurred, registers were:
  ER -- ST COUNT  LBA_48  LH LM LL DV DC
  -- -- -- == -- == == == -- -- -- -- --
  40 -- 51 00 00 00 00 00 08 0a 38 00 00  Error: UNC at LBA = 0x00080a38 = 526904

  Commands leading to the command that caused the error were:
  CR FEATR COUNT  LBA_48  LH LM LL DV DC  Powered_Up_Time  Command/Feature_Name
  -- == -- == -- == == == -- -- -- -- --  ---------------  --------------------
  60 00 00 01 f8 00 00 00 08 0a 08 40 00     00:00:41.557  READ FPDMA QUEUED
  60 00 00 00 08 00 00 00 08 09 f8 40 00     00:00:41.556  READ FPDMA QUEUED
  60 00 00 00 08 00 00 00 08 09 f0 40 00     00:00:41.531  READ FPDMA QUEUED
  ef 00 10 00 03 00 00 00 00 00 00 a0 00     00:00:41.531  SET FEATURES [Enable SATA feature]
  ef 00 10 00 02 00 00 00 00 00 00 a0 00     00:00:41.530  SET FEATURES [Enable SATA feature]

Error 16 [15] occurred at disk power-on lifetime: 6204 hours (258 days + 12 hours)
  When the command that caused the error occurred, the device was active or idle.

  After command completion occurred, registers were:
  ER -- ST COUNT  LBA_48  LH LM LL DV DC
  -- -- -- == -- == == == -- -- -- -- --
  40 -- 51 00 00 00 00 00 08 09 50 00 00  Error: UNC at LBA = 0x00080950 = 526672

  Commands leading to the command that caused the error were:
  CR FEATR COUNT  LBA_48  LH LM LL DV DC  Powered_Up_Time  Command/Feature_Name
  -- == -- == -- == == == -- -- -- -- --  ---------------  --------------------
  60 00 00 00 f8 00 00 00 08 09 08 40 00     00:00:38.265  READ FPDMA QUEUED
  60 00 00 00 78 00 00 00 08 08 88 40 00     00:00:38.265  READ FPDMA QUEUED
  60 00 00 00 30 00 00 00 08 08 48 40 00     00:00:38.265  READ FPDMA QUEUED
  60 00 00 00 10 00 00 00 08 08 28 40 00     00:00:38.265  READ FPDMA QUEUED
  60 00 00 00 08 00 00 00 08 08 10 40 00     00:00:38.265  READ FPDMA QUEUED

Error 15 [14] occurred at disk power-on lifetime: 6204 hours (258 days + 12 hours)
  When the command that caused the error occurred, the device was active or idle.

  After command completion occurred, registers were:
  ER -- ST COUNT  LBA_48  LH LM LL DV DC
  -- -- -- == -- == == == -- -- -- -- --
  40 -- 51 00 00 00 00 00 08 09 40 00 00  Error: UNC at LBA = 0x00080940 = 526656

  Commands leading to the command that caused the error were:
  CR FEATR COUNT  LBA_48  LH LM LL DV DC  Powered_Up_Time  Command/Feature_Name
  -- == -- == -- == == == -- -- -- -- --  ---------------  --------------------
  60 00 00 00 08 00 00 00 08 08 48 40 00     00:00:24.304  READ FPDMA QUEUED
  60 00 00 00 68 00 00 74 70 2f 88 40 00     00:00:24.304  READ FPDMA QUEUED
  60 00 00 00 80 00 00 74 70 2f 00 40 00     00:00:24.304  READ FPDMA QUEUED
  60 00 00 00 f8 00 00 74 70 2e 00 40 00     00:00:24.304  READ FPDMA QUEUED
  60 00 00 00 08 00 00 00 00 0c 00 40 00     00:00:24.304  READ FPDMA QUEUED

Error 14 [13] occurred at disk power-on lifetime: 6204 hours (258 days + 12 hours)
  When the command that caused the error occurred, the device was active or idle.

  After command completion occurred, registers were:
  ER -- ST COUNT  LBA_48  LH LM LL DV DC
  -- -- -- == -- == == == -- -- -- -- --
  40 -- 51 00 00 00 00 00 08 08 98 00 00  Error: UNC at LBA = 0x00080898 = 526488

  Commands leading to the command that caused the error were:
  CR FEATR COUNT  LBA_48  LH LM LL DV DC  Powered_Up_Time  Command/Feature_Name
  -- == -- == -- == == == -- -- -- -- --  ---------------  --------------------
  60 00 00 00 08 00 00 00 08 08 48 40 00     00:00:23.773  READ FPDMA QUEUED
  60 00 00 00 f8 00 00 00 08 09 08 40 00     00:00:23.773  READ FPDMA QUEUED
  60 00 00 00 08 00 00 00 00 0c 00 40 00     00:00:23.772  READ FPDMA QUEUED
  60 00 00 00 f8 00 00 74 70 2e 00 40 00     00:00:23.772  READ FPDMA QUEUED
  60 00 00 00 80 00 00 74 70 2f 00 40 00     00:00:23.772  READ FPDMA QUEUED

Error 13 [12] occurred at disk power-on lifetime: 6204 hours (258 days + 12 hours)
  When the command that caused the error occurred, the device was active or idle.

  After command completion occurred, registers were:
  ER -- ST COUNT  LBA_48  LH LM LL DV DC
  -- -- -- == -- == == == -- -- -- -- --
  40 -- 51 00 00 00 00 00 08 08 52 00 00  Error: UNC at LBA = 0x00080852 = 526418

  Commands leading to the command that caused the error were:
  CR FEATR COUNT  LBA_48  LH LM LL DV DC  Powered_Up_Time  Command/Feature_Name
  -- == -- == -- == == == -- -- -- -- --  ---------------  --------------------
  60 00 00 00 68 00 00 74 70 2f 88 40 00     00:00:23.276  READ FPDMA QUEUED
  60 00 00 00 80 00 00 74 70 2f 00 40 00     00:00:23.276  READ FPDMA QUEUED
  60 00 00 00 f8 00 00 74 70 2e 00 40 00     00:00:23.276  READ FPDMA QUEUED
  60 00 00 00 f8 00 00 00 08 09 08 40 00     00:00:23.274  READ FPDMA QUEUED
  60 00 00 00 78 00 00 00 08 08 88 40 00     00:00:23.274  READ FPDMA QUEUED

Error 12 [11] occurred at disk power-on lifetime: 6204 hours (258 days + 12 hours)
  When the command that caused the error occurred, the device was active or idle.

  After command completion occurred, registers were:
  ER -- ST COUNT  LBA_48  LH LM LL DV DC
  -- -- -- == -- == == == -- -- -- -- --
  40 -- 51 00 00 00 00 00 08 08 2c 00 00  Error: UNC at LBA = 0x0008082c = 526380

  Commands leading to the command that caused the error were:
  CR FEATR COUNT  LBA_48  LH LM LL DV DC  Powered_Up_Time  Command/Feature_Name
  -- == -- == -- == == == -- -- -- -- --  ---------------  --------------------
  25 00 00 00 40 00 00 00 08 08 00 e0 00     00:00:06.196  READ DMA EXT
  25 00 00 00 40 00 00 00 08 2c 80 e0 00     00:00:06.171  READ DMA EXT
  25 00 00 00 01 00 00 00 08 08 08 e0 00     00:00:06.086  READ DMA EXT
  25 00 00 00 40 00 00 00 08 08 00 e0 00     00:00:06.052  READ DMA EXT
  25 00 00 00 40 00 00 00 09 2c 80 e0 00     00:00:06.051  READ DMA EXT

SMART Extended Self-test Log Version: 1 (1 sectors)
Num  Test_Description    Status                  Remaining  LifeTime(hours)  LBA_of_first_error
# 1  Short offline       Completed without error       00%      6218         -
# 2  Short offline       Completed without error       00%      6217         -
# 3  Short offline       Completed without error       00%      6216         -
# 4  Extended offline    Interrupted (host reset)      90%      6166         -
# 5  Extended offline    Interrupted (host reset)      90%      6163         -
# 6  Short offline       Interrupted (host reset)      00%      6161         -
# 7  Short offline       Completed without error       00%      6160         -
# 8  Short offline       Completed without error       00%      6159         -
# 9  Short offline       Completed without error       00%      6145         -
#10  Extended offline    Interrupted (host reset)      00%      6082         -
#11  Short offline       Completed without error       00%      6080         -
#12  Extended offline    Interrupted (host reset)      00%      6079         -
#13  Extended offline    Aborted by host               90%      6078         -
#14  Short offline       Completed without error       00%      6077         -
#15  Short offline       Completed without error       00%      6055         -
#16  Extended offline    Aborted by host               80%      6045         -
#17  Short offline       Completed without error       00%      6043         -
#18  Extended offline    Interrupted (host reset)      90%      6041         -
#19  Short offline       Completed without error       00%      6039         -

SMART Selective self-test log data structure revision number 1
 SPAN  MIN_LBA  MAX_LBA  CURRENT_TEST_STATUS
    1        0        0  Not_testing
    2        0        0  Not_testing
    3        0        0  Not_testing
    4        0        0  Not_testing
    5        0        0  Not_testing
Selective self-test flags (0x0):
  After scanning selected spans, do NOT read-scan remainder of disk.
If Selective self-test is pending on power-up, resume after 0 minute delay.

SCT Status Version:                  3
SCT Version (vendor specific):       522 (0x020a)
Device State:                        Active (0)
Current Temperature:                    48 Celsius
Power Cycle Min/Max Temperature:     25/48 Celsius
Lifetime    Min/Max Temperature:     14/68 Celsius
Under/Over Temperature Limit Count:   0/2

SCT Data Table command not supported

SCT Error Recovery Control command not supported

Device Statistics (GP/SMART Log 0x04) not supported

Pending Defects log (GP Log 0x0c) not supported

SATA Phy Event Counters (GP Log 0x11)
ID      Size     Value  Description
0x000a  2            8  Device-to-host register FISes sent due to a COMRESET
0x0001  2            0  Command failed due to ICRC error
0x0003  2            0  R_ERR response for device-to-host data FIS
0x0004  2            0  R_ERR response for host-to-device data FIS
0x0006  2            0  R_ERR response for device-to-host non-data FIS
0x0007  2            0  R_ERR response for host-to-device non-data FIS

