smartctl 7.4 2023-08-01 r5530 [FreeBSD 14.1-RELEASE-p6 amd64] (local build)
Copyright (C) 2002-23, Bruce Allen, Christian Franke, www.smartmontools.org

=== START OF INFORMATION SECTION ===
Model Family:     Seagate Momentus 5400.6
Device Model:     ST9500325AS
Serial Number:    --
LU WWN Device Id: 5 000c50 ...
Firmware Version: D005DEM1
User Capacity:    500,107,862,016 bytes [500 GB]
Sector Size:      512 bytes logical/physical
Rotation Rate:    5400 rpm
Device is:        In smartctl database 7.3/5528
ATA Version is:   ATA8-ACS T13/1699-D revision 4
SATA Version is:  SATA 2.6, 3.0 Gb/s
Local Time is:    Fri Nov  8 23:31:45 2024 IST
SMART support is: Available - device has SMART capability.
SMART support is: Enabled
AAM feature is:   Disabled
APM level is:     128 (minimum power consumption without standby)
Rd look-ahead is: Enabled
Write cache is:   Enabled
DSN feature is:   Unavailable
ATA Security is:  Disabled, frozen [SEC2]
Wt Cache Reorder: Unknown

=== START OF READ SMART DATA SECTION ===
SMART overall-health self-assessment test result: PASSED
See vendor-specific Attribute list for marginal Attributes.

General SMART Values:
Offline data collection status:  (0x00)	Offline data collection activity
					was never started.
					Auto Offline Data Collection: Disabled.
Self-test execution status:      (   0)	The previous self-test routine completed
					without error or no self-test has ever 
					been run.
Total time to complete Offline 
data collection: 		(    0) seconds.
Offline data collection
capabilities: 			 (0x73) SMART execute Offline immediate.
					Auto Offline data collection on/off support.
					Suspend Offline collection upon new
					command.
					No Offline surface scan supported.
					Self-test supported.
					Conveyance Self-test supported.
					Selective Self-test supported.
SMART capabilities:            (0x0003)	Saves SMART data before entering
					power-saving mode.
					Supports SMART auto save timer.
Error logging capability:        (0x01)	Error logging supported.
					General Purpose Logging supported.
Short self-test routine 
recommended polling time: 	 (   2) minutes.
Extended self-test routine
recommended polling time: 	 ( 143) minutes.
Conveyance self-test routine
recommended polling time: 	 (   3) minutes.
SCT capabilities: 	       (0x103f)	SCT Status supported.
					SCT Error Recovery Control supported.
					SCT Feature Control supported.
					SCT Data Table supported.

SMART Attributes Data Structure revision number: 10
Vendor Specific SMART Attributes with Thresholds:
ID# ATTRIBUTE_NAME          FLAGS    VALUE WORST THRESH FAIL RAW_VALUE
  1 Raw_Read_Error_Rate     POSR--   117   089   006    -    136474927
  3 Spin_Up_Time            PO----   098   098   085    -    0
  4 Start_Stop_Count        -O--CK   095   095   020    -    5143
  5 Reallocated_Sector_Ct   PO--CK   100   100   036    -    0
  7 Seek_Error_Rate         POSR--   081   060   030    -    123967835
  9 Power_On_Hours          -O--CK   097   097   000    -    3462
 10 Spin_Retry_Count        PO--C-   100   100   097    -    0
 12 Power_Cycle_Count       -O--CK   097   097   020    -    3318
184 End-to-End_Error        -O--CK   100   100   099    -    0
187 Reported_Uncorrect      -O--CK   001   001   000    -    802
188 Command_Timeout         -O--CK   100   098   000    -    12885098516
189 High_Fly_Writes         -O-RCK   100   100   000    -    0
190 Airflow_Temperature_Cel -O---K   061   033   045    Past 39 (Min/Max 36/40 #281)
191 G-Sense_Error_Rate      -O--CK   027   027   000    -    147707
192 Power-Off_Retract_Count -O--CK   100   100   000    -    593
193 Load_Cycle_Count        -O--CK   066   066   000    -    69664
194 Temperature_Celsius     -O---K   039   067   000    -    39 (0 23 0 0 0)
195 Hardware_ECC_Recovered  -O-RC-   057   042   000    -    136474927
197 Current_Pending_Sector  -O--C-   100   100   000    -    0
198 Offline_Uncorrectable   ----C-   100   100   000    -    0
199 UDMA_CRC_Error_Count    -OSRCK   200   200   000    -    0
240 Head_Flying_Hours       ------   100   253   000    -    3195 (161 108 0)
241 Total_LBAs_Written      ------   100   253   000    -    1026290291
242 Total_LBAs_Read         ------   100   253   000    -    3978432894
254 Free_Fall_Sensor        -O--CK   100   100   000    -    0
                            ||||||_ K auto-keep
                            |||||__ C event count
                            ||||___ R error rate
                            |||____ S speed/performance
                            ||_____ O updated online
                            |______ P prefailure warning

General Purpose Log Directory Version 1
SMART           Log Directory Version 1 [multi-sector log support]
Address    Access  R/W   Size  Description
0x00       GPL,SL  R/O      1  Log Directory
0x01       GPL,SL  R/O      1  Summary SMART error log
0x02       GPL,SL  R/O      5  Comprehensive SMART error log
0x03       GPL,SL  R/O      5  Ext. Comprehensive SMART error log
0x06       GPL,SL  R/O      1  SMART self-test log
0x07       GPL,SL  R/O      1  Extended self-test log
0x09       GPL,SL  R/W      1  Selective self-test log
0x10       GPL,SL  R/O      1  NCQ Command Error log
0x11       GPL,SL  R/O      1  SATA Phy Event Counters log
0x21       GPL,SL  R/O      1  Write stream error log
0x22       GPL,SL  R/O      1  Read stream error log
0x80-0x9f  GPL,SL  R/W     16  Host vendor specific log
0xa1       GPL,SL  VS      20  Device vendor specific log
0xa2       GPL     VS    2248  Device vendor specific log
0xa8       GPL,SL  VS      65  Device vendor specific log
0xa9       GPL,SL  VS       1  Device vendor specific log
0xb0       GPL     VS    2864  Device vendor specific log
0xbe-0xbf  GPL     VS   65535  Device vendor specific log
0xe0       GPL,SL  R/W      1  SCT Command/Status
0xe1       GPL,SL  R/W      1  SCT Data Transfer

SMART Extended Comprehensive Error Log Version: 1 (5 sectors)
Device Error Count: 795 (device log contains only the most recent 20 errors)
	CR     = Command Register
	FEATR  = Features Register
	COUNT  = Count (was: Sector Count) Register
	LBA_48 = Upper bytes of LBA High/Mid/Low Registers ]  ATA-8
	LH     = LBA High (was: Cylinder High) Register    ]   LBA
	LM     = LBA Mid (was: Cylinder Low) Register      ] Register
	LL     = LBA Low (was: Sector Number) Register     ]
	DV     = Device (was: Device/Head) Register
	DC     = Device Control Register
	ER     = Error register
	ST     = Status register
Powered_Up_Time is measured from power on, and printed as
DDd+hh:mm:SS.sss where DD=days, hh=hours, mm=minutes,
SS=sec, and sss=millisec. It "wraps" after 49.710 days.

Error 795 [14] occurred at disk power-on lifetime: 2433 hours (101 days + 9 hours)
  When the command that caused the error occurred, the device was active or idle.

  After command completion occurred, registers were:
  ER -- ST COUNT  LBA_48  LH LM LL DV DC
  -- -- -- == -- == == == -- -- -- -- --
  40 -- 51 00 00 00 9f 00 e7 07 c5 00 00  Error: UNC at LBA = 0x9f00e707c5 = 682914940869

  Commands leading to the command that caused the error were:
  CR FEATR COUNT  LBA_48  LH LM LL DV DC  Powered_Up_Time  Command/Feature_Name
  -- == -- == -- == == == -- -- -- -- --  ---------------  --------------------
  60 00 00 01 00 00 9e 00 f7 07 26 40 00     01:04:12.826  READ FPDMA QUEUED
  60 00 00 01 00 00 9e 00 f6 07 26 40 00     01:04:12.826  READ FPDMA QUEUED
  60 00 00 01 00 00 9e 00 f5 07 26 40 00     01:04:12.825  READ FPDMA QUEUED
  60 00 00 01 00 00 9e 00 f4 07 26 40 00     01:04:12.825  READ FPDMA QUEUED
  60 00 00 01 00 00 9e 00 f3 07 26 40 00     01:04:12.824  READ FPDMA QUEUED

Error 794 [13] occurred at disk power-on lifetime: 2433 hours (101 days + 9 hours)
  When the command that caused the error occurred, the device was active or idle.

  After command completion occurred, registers were:
  ER -- ST COUNT  LBA_48  LH LM LL DV DC
  -- -- -- == -- == == == -- -- -- -- --
  40 -- 51 00 00 00 43 00 f6 02 b5 00 00  Error: UNC at LBA = 0x4300f602b5 = 287778931381

  Commands leading to the command that caused the error were:
  CR FEATR COUNT  LBA_48  LH LM LL DV DC  Powered_Up_Time  Command/Feature_Name
  -- == -- == -- == == == -- -- -- -- --  ---------------  --------------------
  60 00 00 01 00 00 43 00 fa 02 ef 40 00     00:36:13.628  READ FPDMA QUEUED
  60 00 00 01 00 00 43 00 f9 02 ef 40 00     00:36:13.628  READ FPDMA QUEUED
  60 00 00 01 00 00 43 00 f8 02 ef 40 00     00:36:13.628  READ FPDMA QUEUED
  60 00 00 01 00 00 43 00 f7 02 ef 40 00     00:36:13.628  READ FPDMA QUEUED
  60 00 00 01 00 00 43 00 f6 02 ef 40 00     00:36:13.627  READ FPDMA QUEUED

Error 793 [12] occurred at disk power-on lifetime: 2425 hours (101 days + 1 hours)
  When the command that caused the error occurred, the device was active or idle.

  After command completion occurred, registers were:
  ER -- ST COUNT  LBA_48  LH LM LL DV DC
  -- -- -- == -- == == == -- -- -- -- --
  40 -- 51 00 00 00 43 00 f6 02 b5 00 00  Error: UNC at LBA = 0x4300f602b5 = 287778931381

  Commands leading to the command that caused the error were:
  CR FEATR COUNT  LBA_48  LH LM LL DV DC  Powered_Up_Time  Command/Feature_Name
  -- == -- == -- == == == -- -- -- -- --  ---------------  --------------------
  60 00 00 00 38 00 4b 00 21 01 38 40 00     01:21:05.434  READ FPDMA QUEUED
  60 00 00 00 a8 00 4b 00 21 01 90 40 00     01:21:05.434  READ FPDMA QUEUED
  61 00 00 00 08 00 5f 00 63 00 b0 40 00     01:21:05.433  WRITE FPDMA QUEUED
  61 00 00 00 08 00 37 00 13 04 c8 40 00     01:21:05.432  WRITE FPDMA QUEUED
  61 00 00 00 98 00 60 00 6b 00 20 40 00     01:21:05.431  WRITE FPDMA QUEUED

Error 792 [11] occurred at disk power-on lifetime: 2425 hours (101 days + 1 hours)
  When the command that caused the error occurred, the device was active or idle.

  After command completion occurred, registers were:
  ER -- ST COUNT  LBA_48  LH LM LL DV DC
  -- -- -- == -- == == == -- -- -- -- --
  40 -- 51 00 00 00 43 00 f6 02 b5 00 00  Error: UNC at LBA = 0x4300f602b5 = 287778931381

  Commands leading to the command that caused the error were:
  CR FEATR COUNT  LBA_48  LH LM LL DV DC  Powered_Up_Time  Command/Feature_Name
  -- == -- == -- == == == -- -- -- -- --  ---------------  --------------------
  60 00 00 00 01 00 43 00 f6 02 b5 40 00     01:21:02.688  READ FPDMA QUEUED
  ef 00 90 00 03 00 00 00 00 00 00 a0 00     01:21:02.298  SET FEATURES [Disable SATA feature]
  ef 00 02 00 00 00 00 00 00 00 00 a0 00     01:21:02.283  SET FEATURES [Enable write cache]
  00 00 00 00 00 00 00 00 00 00 00 00 ff     01:21:02.187  NOP [Abort queued commands]
  60 00 00 00 08 00 a1 00 36 02 f8 40 00     01:21:00.012  READ FPDMA QUEUED

Error 791 [10] occurred at disk power-on lifetime: 2425 hours (101 days + 1 hours)
  When the command that caused the error occurred, the device was active or idle.

  After command completion occurred, registers were:
  ER -- ST COUNT  LBA_48  LH LM LL DV DC
  -- -- -- == -- == == == -- -- -- -- --
  40 -- 51 00 00 00 43 00 f6 02 b5 00 00  Error: UNC at LBA = 0x4300f602b5 = 287778931381

  Commands leading to the command that caused the error were:
  CR FEATR COUNT  LBA_48  LH LM LL DV DC  Powered_Up_Time  Command/Feature_Name
  -- == -- == -- == == == -- -- -- -- --  ---------------  --------------------
  60 00 00 00 08 00 a1 00 36 02 f8 40 00     01:21:00.012  READ FPDMA QUEUED
  60 00 00 00 01 00 43 00 f6 02 b5 40 00     01:21:00.006  READ FPDMA QUEUED
  60 00 00 00 01 00 43 00 f6 02 b4 40 00     01:21:00.006  READ FPDMA QUEUED
  60 00 00 00 01 00 43 00 f6 02 b3 40 00     01:21:00.005  READ FPDMA QUEUED
  60 00 00 00 01 00 43 00 f6 02 b2 40 00     01:21:00.005  READ FPDMA QUEUED

Error 790 [9] occurred at disk power-on lifetime: 2425 hours (101 days + 1 hours)
  When the command that caused the error occurred, the device was active or idle.

  After command completion occurred, registers were:
  ER -- ST COUNT  LBA_48  LH LM LL DV DC
  -- -- -- == -- == == == -- -- -- -- --
  40 -- 51 00 00 00 43 00 f6 02 b5 00 00  Error: UNC at LBA = 0x4300f602b5 = 287778931381

  Commands leading to the command that caused the error were:
  CR FEATR COUNT  LBA_48  LH LM LL DV DC  Powered_Up_Time  Command/Feature_Name
  -- == -- == -- == == == -- -- -- -- --  ---------------  --------------------
  60 00 00 00 98 00 9d 00 2b 02 d0 40 00     01:20:57.280  READ FPDMA QUEUED
  60 00 00 01 00 00 9d 00 2a 02 d0 40 00     01:20:57.280  READ FPDMA QUEUED
  60 00 00 01 00 00 9d 00 29 02 d0 40 00     01:20:57.280  READ FPDMA QUEUED
  60 00 00 00 40 00 43 00 f6 02 80 40 00     01:20:57.277  READ FPDMA QUEUED
  61 00 00 00 18 00 42 00 bd 02 a8 40 00     01:20:57.275  WRITE FPDMA QUEUED

Error 789 [8] occurred at disk power-on lifetime: 2415 hours (100 days + 15 hours)
  When the command that caused the error occurred, the device was active or idle.

  After command completion occurred, registers were:
  ER -- ST COUNT  LBA_48  LH LM LL DV DC
  -- -- -- == -- == == == -- -- -- -- --
  40 -- 51 00 00 00 43 00 f6 02 b5 00 00  Error: WP at LBA = 0x4300f602b5 = 287778931381

  Commands leading to the command that caused the error were:
  CR FEATR COUNT  LBA_48  LH LM LL DV DC  Powered_Up_Time  Command/Feature_Name
  -- == -- == -- == == == -- -- -- -- --  ---------------  --------------------
  61 00 00 01 00 00 cd 00 15 03 a8 40 00     00:38:25.570  WRITE FPDMA QUEUED
  61 00 00 00 18 00 5f 00 63 00 30 40 00     00:38:25.570  WRITE FPDMA QUEUED
  60 00 00 00 01 00 43 00 f6 02 b5 40 00     00:38:25.569  READ FPDMA QUEUED
  61 00 00 00 08 00 61 00 98 00 00 40 00     00:38:25.569  WRITE FPDMA QUEUED
  60 00 00 00 40 00 03 00 60 22 68 40 00     00:38:25.567  READ FPDMA QUEUED

Error 788 [7] occurred at disk power-on lifetime: 2415 hours (100 days + 15 hours)
  When the command that caused the error occurred, the device was active or idle.

  After command completion occurred, registers were:
  ER -- ST COUNT  LBA_48  LH LM LL DV DC
  -- -- -- == -- == == == -- -- -- -- --
  40 -- 51 00 00 00 43 00 f6 02 b5 00 00  Error: UNC at LBA = 0x4300f602b5 = 287778931381

  Commands leading to the command that caused the error were:
  CR FEATR COUNT  LBA_48  LH LM LL DV DC  Powered_Up_Time  Command/Feature_Name
  -- == -- == -- == == == -- -- -- -- --  ---------------  --------------------
  60 00 00 00 01 00 43 00 f6 02 b5 40 00     00:38:22.769  READ FPDMA QUEUED
  60 00 00 00 20 00 f6 00 87 01 a0 40 00     00:38:22.765  READ FPDMA QUEUED
  60 00 00 00 20 00 f6 00 99 01 a0 40 00     00:38:22.764  READ FPDMA QUEUED
  60 00 00 00 10 00 f6 00 99 01 88 40 00     00:38:22.735  READ FPDMA QUEUED
  ef 00 90 00 03 00 00 00 00 00 00 a0 00     00:38:22.388  SET FEATURES [Disable SATA feature]

SMART Extended Self-test Log Version: 1 (1 sectors)
Num  Test_Description    Status                  Remaining  LifeTime(hours)  LBA_of_first_error
# 1  Short offline       Completed without error       00%      1697         -
# 2  Short offline       Completed without error       00%      1096         -
# 3  Extended offline    Completed without error       00%       797         -
# 4  Extended offline    Aborted by host               90%       793         -
# 5  Short offline       Completed without error       00%       793         -
# 6  Short offline       Completed without error       00%         0         -
# 7  Short offline       Completed without error       00%         0         -

SMART Selective self-test log data structure revision number 1
 SPAN  MIN_LBA  MAX_LBA  CURRENT_TEST_STATUS
    1        0        0  Not_testing
    2        0        0  Not_testing
    3        0        0  Not_testing
    4        0        0  Not_testing
    5        0        0  Not_testing
Selective self-test flags (0x0):
  After scanning selected spans, do NOT read-scan remainder of disk.
If Selective self-test is pending on power-up, resume after 0 minute delay.

SCT Status Version:                  3
SCT Version (vendor specific):       522 (0x020a)
Device State:                        Active (0)
Current Temperature:                    39 Celsius
Power Cycle Min/Max Temperature:     36/40 Celsius
Lifetime    Min/Max Temperature:     23/67 Celsius
Specified Max Operating Temperature:    43 Celsius
Under/Over Temperature Limit Count:   0/0

SCT Temperature History Version:     2
Temperature Sampling Period:         1 minute
Temperature Logging Interval:        1 minute
Min/Max recommended Temperature:     14/55 Celsius
Min/Max Temperature Limit:           10/60 Celsius
Temperature History Size (Index):    128 (95)

SCT Error Recovery Control:
           Read: Disabled
          Write: Disabled

Device Statistics (GP/SMART Log 0x04) not supported

Pending Defects log (GP Log 0x0c) not supported

SATA Phy Event Counters (GP Log 0x11)
ID      Size     Value  Description
0x000a  2           83  Device-to-host register FISes sent due to a COMRESET
0x0001  2            0  Command failed due to ICRC error
0x0003  2            0  R_ERR response for device-to-host data FIS
0x0004  2            0  R_ERR response for host-to-device data FIS
0x0006  2            0  R_ERR response for device-to-host non-data FIS
0x0007  2            0  R_ERR response for host-to-device non-data FIS

