smartctl 7.4 2023-08-01 r5530 [FreeBSD 14.0-RELEASE amd64] (local build)
Copyright (C) 2002-23, Bruce Allen, Christian Franke, www.smartmontools.org

=== START OF INFORMATION SECTION ===
Model Family:     Seagate Momentus 5400.6
Device Model:     ST9500325AS
Serial Number:    --
LU WWN Device Id: 5 000c50 ...
Firmware Version: 0002BSM1
User Capacity:    500,107,862,016 bytes [500 GB]
Sector Size:      512 bytes logical/physical
Rotation Rate:    5400 rpm
Device is:        In smartctl database 7.3/5528
ATA Version is:   ATA8-ACS T13/1699-D revision 4
SATA Version is:  SATA 2.6, 1.5 Gb/s
Local Time is:    Sun Apr  7 09:44:24 2024    
SMART support is: Available - device has SMART capability.
SMART support is: Enabled
AAM feature is:   Unavailable
APM level is:     254 (maximum performance)
Rd look-ahead is: Enabled
Write cache is:   Enabled
DSN feature is:   Unavailable
ATA Security is:  Disabled, frozen [SEC2]
Wt Cache Reorder: Unknown

=== START OF READ SMART DATA SECTION ===
SMART overall-health self-assessment test result: PASSED

General SMART Values:
Offline data collection status:  (0x82)	Offline data collection activity
					was completed without error.
					Auto Offline Data Collection: Enabled.
Self-test execution status:      (   0)	The previous self-test routine completed
					without error or no self-test has ever 
					been run.
Total time to complete Offline 
data collection: 		(    0) seconds.
Offline data collection
capabilities: 			 (0x7b) SMART execute Offline immediate.
					Auto Offline data collection on/off support.
					Suspend Offline collection upon new
					command.
					Offline surface scan supported.
					Self-test supported.
					Conveyance Self-test supported.
					Selective Self-test supported.
SMART capabilities:            (0x0003)	Saves SMART data before entering
					power-saving mode.
					Supports SMART auto save timer.
Error logging capability:        (0x01)	Error logging supported.
					General Purpose Logging supported.
Short self-test routine 
recommended polling time: 	 (   1) minutes.
Extended self-test routine
recommended polling time: 	 ( 143) minutes.
Conveyance self-test routine
recommended polling time: 	 (   2) minutes.
SCT capabilities: 	       (0x103b)	SCT Status supported.
					SCT Error Recovery Control supported.
					SCT Feature Control supported.
					SCT Data Table supported.

SMART Attributes Data Structure revision number: 10
Vendor Specific SMART Attributes with Thresholds:
ID# ATTRIBUTE_NAME          FLAGS    VALUE WORST THRESH FAIL RAW_VALUE
  1 Raw_Read_Error_Rate     POSR--   109   098   006    -    21828112
  3 Spin_Up_Time            PO----   096   096   000    -    0
  4 Start_Stop_Count        -O--CK   099   099   020    -    2033
  5 Reallocated_Sector_Ct   PO--CK   097   097   036    -    73
  7 Seek_Error_Rate         POSR--   070   060   030    -    4306319523
  9 Power_On_Hours          -O--CK   095   095   000    -    4452
 10 Spin_Retry_Count        PO--C-   100   100   097    -    0
 12 Power_Cycle_Count       -O--CK   099   037   020    -    1855
184 End-to-End_Error        -O--CK   100   100   099    -    0
187 Reported_Uncorrect      -O--CK   051   051   000    -    49
188 Command_Timeout         -O--CK   100   098   000    -    4295098452
189 High_Fly_Writes         -O-RCK   100   100   000    -    0
190 Airflow_Temperature_Cel -O---K   068   048   045    -    32 (Min/Max 21/32)
191 G-Sense_Error_Rate      -O--CK   100   100   000    -    19
192 Power-Off_Retract_Count -O--CK   100   100   000    -    525
193 Load_Cycle_Count        -O--CK   084   084   000    -    32028
194 Temperature_Celsius     -O---K   032   052   000    -    32 (0 6 0 0 0)
195 Hardware_ECC_Recovered  -O-RC-   049   044   000    -    21828112
197 Current_Pending_Sector  -O--C-   100   100   000    -    0
198 Offline_Uncorrectable   ----C-   100   100   000    -    0
199 UDMA_CRC_Error_Count    -OSRCK   200   200   000    -    0
                            ||||||_ K auto-keep
                            |||||__ C event count
                            ||||___ R error rate
                            |||____ S speed/performance
                            ||_____ O updated online
                            |______ P prefailure warning

General Purpose Log Directory Version 1
SMART           Log Directory Version 1 [multi-sector log support]
Address    Access  R/W   Size  Description
0x00       GPL,SL  R/O      1  Log Directory
0x01       GPL,SL  R/O      1  Summary SMART error log
0x02       GPL,SL  R/O      5  Comprehensive SMART error log
0x03       GPL,SL  R/O      5  Ext. Comprehensive SMART error log
0x06       GPL,SL  R/O      1  SMART self-test log
0x07       GPL,SL  R/O      1  Extended self-test log
0x09       GPL,SL  R/W      1  Selective self-test log
0x10       GPL,SL  R/O      1  NCQ Command Error log
0x11       GPL,SL  R/O      1  SATA Phy Event Counters log
0x21       GPL,SL  R/O      1  Write stream error log
0x22       GPL,SL  R/O      1  Read stream error log
0x80-0x9f  GPL,SL  R/W     16  Host vendor specific log
0xa1       GPL,SL  VS      20  Device vendor specific log
0xa2       GPL     VS    2248  Device vendor specific log
0xa8       GPL,SL  VS      65  Device vendor specific log
0xa9       GPL,SL  VS       1  Device vendor specific log
0xb0       GPL     VS    2864  Device vendor specific log
0xbe-0xbf  GPL     VS   65535  Device vendor specific log
0xc0       GPL,SL  VS       1  Device vendor specific log
0xe0       GPL,SL  R/W      1  SCT Command/Status
0xe1       GPL,SL  R/W      1  SCT Data Transfer

SMART Extended Comprehensive Error Log Version: 1 (5 sectors)
Device Error Count: 47 (device log contains only the most recent 20 errors)
	CR     = Command Register
	FEATR  = Features Register
	COUNT  = Count (was: Sector Count) Register
	LBA_48 = Upper bytes of LBA High/Mid/Low Registers ]  ATA-8
	LH     = LBA High (was: Cylinder High) Register    ]   LBA
	LM     = LBA Mid (was: Cylinder Low) Register      ] Register
	LL     = LBA Low (was: Sector Number) Register     ]
	DV     = Device (was: Device/Head) Register
	DC     = Device Control Register
	ER     = Error register
	ST     = Status register
Powered_Up_Time is measured from power on, and printed as
DDd+hh:mm:SS.sss where DD=days, hh=hours, mm=minutes,
SS=sec, and sss=millisec. It "wraps" after 49.710 days.

Error 47 [6] occurred at disk power-on lifetime: 2560 hours (106 days + 16 hours)
  When the command that caused the error occurred, the device was active or idle.

  After command completion occurred, registers were:
  ER -- ST COUNT  LBA_48  LH LM LL DV DC
  -- -- -- == -- == == == -- -- -- -- --
  40 -- 51 00 00 00 00 00 54 35 02 00 00  Error: UNC at LBA = 0x00543502 = 5518594

  Commands leading to the command that caused the error were:
  CR FEATR COUNT  LBA_48  LH LM LL DV DC  Powered_Up_Time  Command/Feature_Name
  -- == -- == -- == == == -- -- -- -- --  ---------------  --------------------
  60 00 00 00 08 00 00 00 54 35 00 40 00     01:00:31.678  READ FPDMA QUEUED
  27 00 00 00 00 00 00 00 00 00 00 e0 00     01:00:31.677  READ NATIVE MAX ADDRESS EXT [OBS-ACS-3]
  ec 00 00 00 00 00 00 00 00 00 00 a0 00     01:00:31.676  IDENTIFY DEVICE
  ef 00 03 00 46 00 00 00 00 00 00 a0 00     01:00:31.675  SET FEATURES [Set transfer mode]
  27 00 00 00 00 00 00 00 00 00 00 e0 00     01:00:31.675  READ NATIVE MAX ADDRESS EXT [OBS-ACS-3]

Error 46 [5] occurred at disk power-on lifetime: 2560 hours (106 days + 16 hours)
  When the command that caused the error occurred, the device was active or idle.

  After command completion occurred, registers were:
  ER -- ST COUNT  LBA_48  LH LM LL DV DC
  -- -- -- == -- == == == -- -- -- -- --
  40 -- 51 00 00 00 00 00 54 35 02 00 00  Error: UNC at LBA = 0x00543502 = 5518594

  Commands leading to the command that caused the error were:
  CR FEATR COUNT  LBA_48  LH LM LL DV DC  Powered_Up_Time  Command/Feature_Name
  -- == -- == -- == == == -- -- -- -- --  ---------------  --------------------
  60 00 00 00 08 00 00 00 54 35 00 40 00     01:00:29.344  READ FPDMA QUEUED
  27 00 00 00 00 00 00 00 00 00 00 e0 00     01:00:29.343  READ NATIVE MAX ADDRESS EXT [OBS-ACS-3]
  ec 00 00 00 00 00 00 00 00 00 00 a0 00     01:00:29.342  IDENTIFY DEVICE
  ef 00 03 00 46 00 00 00 00 00 00 a0 00     01:00:29.341  SET FEATURES [Set transfer mode]
  27 00 00 00 00 00 00 00 00 00 00 e0 00     01:00:29.341  READ NATIVE MAX ADDRESS EXT [OBS-ACS-3]

Error 45 [4] occurred at disk power-on lifetime: 2560 hours (106 days + 16 hours)
  When the command that caused the error occurred, the device was active or idle.

  After command completion occurred, registers were:
  ER -- ST COUNT  LBA_48  LH LM LL DV DC
  -- -- -- == -- == == == -- -- -- -- --
  40 -- 51 00 00 00 00 00 54 35 02 00 00  Error: UNC at LBA = 0x00543502 = 5518594

  Commands leading to the command that caused the error were:
  CR FEATR COUNT  LBA_48  LH LM LL DV DC  Powered_Up_Time  Command/Feature_Name
  -- == -- == -- == == == -- -- -- -- --  ---------------  --------------------
  60 00 00 00 08 00 00 00 54 35 00 40 00     01:00:26.948  READ FPDMA QUEUED
  60 00 00 00 08 00 00 3a 00 08 18 40 00     01:00:26.909  READ FPDMA QUEUED
  60 00 00 00 08 00 00 3a 00 08 00 40 00     01:00:26.902  READ FPDMA QUEUED
  60 00 00 00 08 00 00 39 c0 08 00 40 00     01:00:26.894  READ FPDMA QUEUED
  60 00 00 00 08 00 00 39 80 08 00 40 00     01:00:26.872  READ FPDMA QUEUED

Error 44 [3] occurred at disk power-on lifetime: 2560 hours (106 days + 16 hours)
  When the command that caused the error occurred, the device was active or idle.

  After command completion occurred, registers were:
  ER -- ST COUNT  LBA_48  LH LM LL DV DC
  -- -- -- == -- == == == -- -- -- -- --
  40 -- 51 00 00 00 00 00 54 35 02 00 00  Error: UNC at LBA = 0x00543502 = 5518594

  Commands leading to the command that caused the error were:
  CR FEATR COUNT  LBA_48  LH LM LL DV DC  Powered_Up_Time  Command/Feature_Name
  -- == -- == -- == == == -- -- -- -- --  ---------------  --------------------
  25 00 00 00 08 00 00 00 54 35 00 e0 00     00:58:25.359  READ DMA EXT
  00 00 00 00 00 00 00 00 00 00 00 00 04     00:58:25.271  NOP [Abort queued commands]
  25 00 00 00 08 00 00 00 54 35 00 e0 00     00:58:22.927  READ DMA EXT
  00 00 00 00 00 00 00 00 00 00 00 00 04     00:58:22.867  NOP [Abort queued commands]
  25 00 00 00 08 00 00 00 54 35 00 e0 00     00:58:20.484  READ DMA EXT

Error 43 [2] occurred at disk power-on lifetime: 2560 hours (106 days + 16 hours)
  When the command that caused the error occurred, the device was active or idle.

  After command completion occurred, registers were:
  ER -- ST COUNT  LBA_48  LH LM LL DV DC
  -- -- -- == -- == == == -- -- -- -- --
  40 -- 51 00 00 00 00 00 54 35 02 00 00  Error: UNC at LBA = 0x00543502 = 5518594

  Commands leading to the command that caused the error were:
  CR FEATR COUNT  LBA_48  LH LM LL DV DC  Powered_Up_Time  Command/Feature_Name
  -- == -- == -- == == == -- -- -- -- --  ---------------  --------------------
  25 00 00 00 08 00 00 00 54 35 00 e0 00     00:58:22.927  READ DMA EXT
  00 00 00 00 00 00 00 00 00 00 00 00 04     00:58:22.867  NOP [Abort queued commands]
  25 00 00 00 08 00 00 00 54 35 00 e0 00     00:58:20.484  READ DMA EXT
  25 00 00 00 2d 00 00 00 20 c6 13 e0 00     00:58:20.483  READ DMA EXT
  25 00 00 00 13 00 00 00 20 c6 00 e0 00     00:58:20.356  READ DMA EXT

Error 42 [1] occurred at disk power-on lifetime: 2560 hours (106 days + 16 hours)
  When the command that caused the error occurred, the device was active or idle.

  After command completion occurred, registers were:
  ER -- ST COUNT  LBA_48  LH LM LL DV DC
  -- -- -- == -- == == == -- -- -- -- --
  40 -- 51 00 00 00 00 00 54 35 02 00 00  Error: UNC at LBA = 0x00543502 = 5518594

  Commands leading to the command that caused the error were:
  CR FEATR COUNT  LBA_48  LH LM LL DV DC  Powered_Up_Time  Command/Feature_Name
  -- == -- == -- == == == -- -- -- -- --  ---------------  --------------------
  25 00 00 00 08 00 00 00 54 35 00 e0 00     00:58:20.484  READ DMA EXT
  25 00 00 00 2d 00 00 00 20 c6 13 e0 00     00:58:20.483  READ DMA EXT
  25 00 00 00 13 00 00 00 20 c6 00 e0 00     00:58:20.356  READ DMA EXT
  00 00 00 00 00 00 00 00 00 00 00 00 04     00:58:20.347  NOP [Abort queued commands]
  25 00 00 00 13 00 00 00 54 35 00 e0 00     00:58:17.963  READ DMA EXT

Error 41 [0] occurred at disk power-on lifetime: 2560 hours (106 days + 16 hours)
  When the command that caused the error occurred, the device was active or idle.

  After command completion occurred, registers were:
  ER -- ST COUNT  LBA_48  LH LM LL DV DC
  -- -- -- == -- == == == -- -- -- -- --
  40 -- 51 00 00 00 00 00 54 35 02 00 00  Error: UNC at LBA = 0x00543502 = 5518594

  Commands leading to the command that caused the error were:
  CR FEATR COUNT  LBA_48  LH LM LL DV DC  Powered_Up_Time  Command/Feature_Name
  -- == -- == -- == == == -- -- -- -- --  ---------------  --------------------
  25 00 00 00 13 00 00 00 54 35 00 e0 00     00:58:17.963  READ DMA EXT
  00 00 00 00 00 00 00 00 00 00 00 00 04     00:58:17.870  NOP [Abort queued commands]
  25 00 00 00 13 00 00 00 54 35 00 e0 00     00:58:15.497  READ DMA EXT
  00 00 00 00 00 00 00 00 00 00 00 00 04     00:58:15.405  NOP [Abort queued commands]
  25 00 00 00 13 00 00 00 54 35 00 e0 00     00:58:13.075  READ DMA EXT

Error 40 [19] occurred at disk power-on lifetime: 2560 hours (106 days + 16 hours)
  When the command that caused the error occurred, the device was active or idle.

  After command completion occurred, registers were:
  ER -- ST COUNT  LBA_48  LH LM LL DV DC
  -- -- -- == -- == == == -- -- -- -- --
  40 -- 51 00 00 00 00 00 54 35 02 00 00  Error: UNC at LBA = 0x00543502 = 5518594

  Commands leading to the command that caused the error were:
  CR FEATR COUNT  LBA_48  LH LM LL DV DC  Powered_Up_Time  Command/Feature_Name
  -- == -- == -- == == == -- -- -- -- --  ---------------  --------------------
  25 00 00 00 13 00 00 00 54 35 00 e0 00     00:58:15.497  READ DMA EXT
  00 00 00 00 00 00 00 00 00 00 00 00 04     00:58:15.405  NOP [Abort queued commands]
  25 00 00 00 13 00 00 00 54 35 00 e0 00     00:58:13.075  READ DMA EXT
  25 00 00 00 13 00 00 00 54 35 00 e0 00     00:58:10.799  READ DMA EXT
  25 00 00 00 2c 00 00 00 54 34 d4 e0 00     00:58:10.797  READ DMA EXT

SMART Extended Self-test Log Version: 1 (1 sectors)
Num  Test_Description    Status                  Remaining  LifeTime(hours)  LBA_of_first_error
# 1  Short offline       Completed without error       00%      4355         -
# 2  Conveyance offline  Completed without error       00%      4348         -
# 3  Short offline       Completed without error       00%      4347         -
# 4  Conveyance offline  Completed without error       00%      4344         -
# 5  Short offline       Completed without error       00%      4344         -
# 6  Short offline       Completed without error       00%      3071         -
# 7  Conveyance offline  Completed without error       00%      2704         -
# 8  Conveyance offline  Completed without error       00%      2614         -
# 9  Short offline       Completed without error       00%      2596         -
#10  Short offline       Completed without error       00%      2590         -
#11  Conveyance offline  Completed without error       00%      2563         -
#12  Short offline       Completed without error       00%      2563         -
#13  Short offline       Completed: read failure       90%      2559         5518594
#14  Conveyance offline  Completed: read failure       90%      2518         5518594
#15  Short offline       Completed: read failure       90%      2518         5518594
#16  Conveyance offline  Completed: read failure       90%      2514         5518594
#17  Short offline       Completed: read failure       90%      2512         5518594
#18  Short offline       Completed: read failure       90%      2511         5518594
#19  Extended offline    Completed: read failure       90%      2511         5518594

SMART Selective self-test log data structure revision number 1
 SPAN  MIN_LBA  MAX_LBA  CURRENT_TEST_STATUS
    1        0        0  Not_testing
    2        0        0  Not_testing
    3        0        0  Not_testing
    4        0        0  Not_testing
    5        0        0  Not_testing
Selective self-test flags (0x0):
  After scanning selected spans, do NOT read-scan remainder of disk.
If Selective self-test is pending on power-up, resume after 0 minute delay.

SCT Status Version:                  3
SCT Version (vendor specific):       522 (0x020a)
Device State:                        Active (0)
Current Temperature:                    32 Celsius
Power Cycle Min/Max Temperature:     21/32 Celsius
Lifetime    Min/Max Temperature:      6/52 Celsius
Under/Over Temperature Limit Count:   0/57

SCT Temperature History Version:     2
Temperature Sampling Period:         1 minute
Temperature Logging Interval:        1 minute
Min/Max recommended Temperature:      0/ 0 Celsius
Min/Max Temperature Limit:            0/ 0 Celsius
Temperature History Size (Index):    128 (2)

SCT Error Recovery Control:
           Read: Disabled
          Write: Disabled

Device Statistics (GP/SMART Log 0x04) not supported

Pending Defects log (GP Log 0x0c) not supported

SATA Phy Event Counters (GP Log 0x11)
ID      Size     Value  Description
0x000a  2           28  Device-to-host register FISes sent due to a COMRESET
0x0001  2            0  Command failed due to ICRC error
0x0003  2            0  R_ERR response for device-to-host data FIS
0x0004  2            0  R_ERR response for host-to-device data FIS
0x0006  2            0  R_ERR response for device-to-host non-data FIS
0x0007  2            0  R_ERR response for host-to-device non-data FIS



