smartctl 7.2 2020-12-30 r5155 [FreeBSD 13.0-RELEASE amd64] (local build)
Copyright (C) 2002-20, Bruce Allen, Christian Franke, www.smartmontools.org

=== START OF INFORMATION SECTION ===
Model Family:     Seagate Barracuda 7200.12
Device Model:     ST3500413AS
Serial Number:    --
LU WWN Device Id: 5 000c50 ...
Firmware Version: JC45
User Capacity:    500,106,780,160 bytes [500 GB]
Sector Size:      512 bytes logical/physical
Rotation Rate:    7200 rpm
Device is:        In smartctl database [for details use: -P show]
ATA Version is:   ATA8-ACS T13/1699-D revision 4
SATA Version is:  SATA 2.6, 6.0 Gb/s (current: 6.0 Gb/s)
Local Time is:    Fri Apr  8 09:42:03 2022 EDT
SMART support is: Available - device has SMART capability.
SMART support is: Enabled
AAM level is:     128 (quiet), recommended: 208
APM feature is:   Unavailable
Rd look-ahead is: Enabled
Write cache is:   Enabled
DSN feature is:   Unavailable
ATA Security is:  Disabled, frozen [SEC2]
Wt Cache Reorder: Unknown

=== START OF READ SMART DATA SECTION ===
SMART overall-health self-assessment test result: PASSED
See vendor-specific Attribute list for marginal Attributes.

General SMART Values:
Offline data collection status:  (0x82)	Offline data collection activity
					was completed without error.
					Auto Offline Data Collection: Enabled.
Self-test execution status:      (   0)	The previous self-test routine completed
					without error or no self-test has ever 
					been run.
Total time to complete Offline 
data collection: 		(  600) seconds.
Offline data collection
capabilities: 			 (0x7b) SMART execute Offline immediate.
					Auto Offline data collection on/off support.
					Suspend Offline collection upon new
					command.
					Offline surface scan supported.
					Self-test supported.
					Conveyance Self-test supported.
					Selective Self-test supported.
SMART capabilities:            (0x0003)	Saves SMART data before entering
					power-saving mode.
					Supports SMART auto save timer.
Error logging capability:        (0x01)	Error logging supported.
					General Purpose Logging supported.
Short self-test routine 
recommended polling time: 	 (   1) minutes.
Extended self-test routine
recommended polling time: 	 (  83) minutes.
Conveyance self-test routine
recommended polling time: 	 (   2) minutes.
SCT capabilities: 	       (0x103f)	SCT Status supported.
					SCT Error Recovery Control supported.
					SCT Feature Control supported.
					SCT Data Table supported.

SMART Attributes Data Structure revision number: 10
Vendor Specific SMART Attributes with Thresholds:
ID# ATTRIBUTE_NAME          FLAGS    VALUE WORST THRESH FAIL RAW_VALUE
  1 Raw_Read_Error_Rate     POSR--   117   099   006    -    155463143
  3 Spin_Up_Time            PO----   100   100   000    -    0
  4 Start_Stop_Count        -O--CK   089   089   020    -    11286
  5 Reallocated_Sector_Ct   PO--CK   074   074   036    -    1089
  7 Seek_Error_Rate         POSR--   089   060   030    -    821709295
  9 Power_On_Hours          -O--CK   046   046   000    -    47494
 10 Spin_Retry_Count        PO--C-   100   100   097    -    0
 12 Power_Cycle_Count       -O--CK   094   094   020    -    6763
183 Runtime_Bad_Block       -O--CK   070   070   000    -    30
184 End-to-End_Error        -O--CK   091   091   099    NOW  9
187 Reported_Uncorrect      -O--CK   076   076   000    -    24
188 Command_Timeout         -O--CK   100   096   000    -    85900660405
189 High_Fly_Writes         -O-RCK   001   001   000    -    1796
190 Airflow_Temperature_Cel -O---K   069   053   045    -    31 (Min/Max 31/31)
194 Temperature_Celsius     -O---K   031   047   000    -    31 (0 1 0 0 0)
195 Hardware_ECC_Recovered  -O-RC-   038   024   000    -    155463143
197 Current_Pending_Sector  -O--C-   100   100   000    -    0
198 Offline_Uncorrectable   ----C-   100   100   000    -    0
199 UDMA_CRC_Error_Count    -OSRCK   200   001   000    -    4229
240 Head_Flying_Hours       ------   100   253   000    -    65405 (205 121 0)
241 Total_LBAs_Written      ------   100   253   000    -    2494805000
242 Total_LBAs_Read         ------   100   253   000    -    3557569467
                            ||||||_ K auto-keep
                            |||||__ C event count
                            ||||___ R error rate
                            |||____ S speed/performance
                            ||_____ O updated online
                            |______ P prefailure warning

General Purpose Log Directory Version 1
SMART           Log Directory Version 1 [multi-sector log support]
Address    Access  R/W   Size  Description
0x00       GPL,SL  R/O      1  Log Directory
0x01       GPL,SL  R/O      1  Summary SMART error log
0x02       GPL,SL  R/O      5  Comprehensive SMART error log
0x03       GPL     R/O      5  Ext. Comprehensive SMART error log
0x06       GPL,SL  R/O      1  SMART self-test log
0x07       GPL     R/O      1  Extended self-test log
0x09       GPL,SL  R/W      1  Selective self-test log
0x10       GPL     R/O      1  NCQ Command Error log
0x11       GPL     R/O      1  SATA Phy Event Counters log
0x21       GPL     R/O      1  Write stream error log
0x22       GPL     R/O      1  Read stream error log
0x80-0x9f  GPL,SL  R/W     16  Host vendor specific log
0xa1       GPL,SL  VS      20  Device vendor specific log
0xa2       GPL     VS    2248  Device vendor specific log
0xa8       GPL,SL  VS     129  Device vendor specific log
0xa9       GPL,SL  VS       1  Device vendor specific log
0xb0       GPL     VS    2928  Device vendor specific log
0xbd       GPL     VS     252  Device vendor specific log
0xbe-0xbf  GPL     VS   65535  Device vendor specific log
0xc0       GPL,SL  VS       1  Device vendor specific log
0xe0       GPL,SL  R/W      1  SCT Command/Status
0xe1       GPL,SL  R/W      1  SCT Data Transfer

SMART Extended Comprehensive Error Log Version: 1 (5 sectors)
Device Error Count: 64 (device log contains only the most recent 20 errors)
	CR     = Command Register
	FEATR  = Features Register
	COUNT  = Count (was: Sector Count) Register
	LBA_48 = Upper bytes of LBA High/Mid/Low Registers ]  ATA-8
	LH     = LBA High (was: Cylinder High) Register    ]   LBA
	LM     = LBA Mid (was: Cylinder Low) Register      ] Register
	LL     = LBA Low (was: Sector Number) Register     ]
	DV     = Device (was: Device/Head) Register
	DC     = Device Control Register
	ER     = Error register
	ST     = Status register
Powered_Up_Time is measured from power on, and printed as
DDd+hh:mm:SS.sss where DD=days, hh=hours, mm=minutes,
SS=sec, and sss=millisec. It "wraps" after 49.710 days.

Error 64 [3] occurred at disk power-on lifetime: 3999 hours (166 days + 15 hours)
  When the command that caused the error occurred, the device was active or idle.

  After command completion occurred, registers were:
  ER -- ST COUNT  LBA_48  LH LM LL DV DC
  -- -- -- == -- == == == -- -- -- -- --
  40 -- 51 00 00 00 00 01 ce 18 18 00 00  Error: UNC at LBA = 0x01ce1818 = 30283800

  Commands leading to the command that caused the error were:
  CR FEATR COUNT  LBA_48  LH LM LL DV DC  Powered_Up_Time  Command/Feature_Name
  -- == -- == -- == == == -- -- -- -- --  ---------------  --------------------
  42 00 00 00 01 00 00 01 ce 18 18 e0 00     00:06:40.416  READ VERIFY SECTOR(S) EXT
  25 00 00 00 01 00 00 00 00 00 00 e0 00     00:06:40.415  READ DMA EXT
  42 00 00 00 02 00 00 01 ce 18 1a e0 00     00:06:40.403  READ VERIFY SECTOR(S) EXT
  25 00 00 00 01 00 00 00 00 00 00 e0 00     00:06:40.299  READ DMA EXT
  42 00 00 00 02 00 00 01 ce 18 18 e0 00     00:06:37.560  READ VERIFY SECTOR(S) EXT

Error 63 [2] occurred at disk power-on lifetime: 3999 hours (166 days + 15 hours)
  When the command that caused the error occurred, the device was active or idle.

  After command completion occurred, registers were:
  ER -- ST COUNT  LBA_48  LH LM LL DV DC
  -- -- -- == -- == == == -- -- -- -- --
  40 -- 51 00 00 00 00 01 ce 18 18 00 00  Error: UNC at LBA = 0x01ce1818 = 30283800

  Commands leading to the command that caused the error were:
  CR FEATR COUNT  LBA_48  LH LM LL DV DC  Powered_Up_Time  Command/Feature_Name
  -- == -- == -- == == == -- -- -- -- --  ---------------  --------------------
  42 00 00 00 02 00 00 01 ce 18 18 e0 00     00:06:37.560  READ VERIFY SECTOR(S) EXT
  42 00 00 00 04 00 00 01 ce 18 1c e0 00     00:06:37.549  READ VERIFY SECTOR(S) EXT
  25 00 00 00 01 00 00 00 00 3e c1 e0 00     00:06:37.502  READ DMA EXT
  42 00 00 00 04 00 00 01 ce 18 18 e0 00     00:06:34.775  READ VERIFY SECTOR(S) EXT
  25 00 00 00 01 00 00 00 00 00 00 e0 00     00:06:34.671  READ DMA EXT

Error 62 [1] occurred at disk power-on lifetime: 3999 hours (166 days + 15 hours)
  When the command that caused the error occurred, the device was active or idle.

  After command completion occurred, registers were:
  ER -- ST COUNT  LBA_48  LH LM LL DV DC
  -- -- -- == -- == == == -- -- -- -- --
  40 -- 51 00 00 00 00 01 ce 18 18 00 00  Error: UNC at LBA = 0x01ce1818 = 30283800

  Commands leading to the command that caused the error were:
  CR FEATR COUNT  LBA_48  LH LM LL DV DC  Powered_Up_Time  Command/Feature_Name
  -- == -- == -- == == == -- -- -- -- --  ---------------  --------------------
  42 00 00 00 04 00 00 01 ce 18 18 e0 00     00:06:34.775  READ VERIFY SECTOR(S) EXT
  25 00 00 00 01 00 00 00 00 00 00 e0 00     00:06:34.671  READ DMA EXT
  42 00 00 00 08 00 00 01 ce 18 18 e0 00     00:06:31.933  READ VERIFY SECTOR(S) EXT
  25 00 00 00 01 00 00 00 00 00 00 e0 00     00:06:31.932  READ DMA EXT
  42 00 00 00 08 00 00 01 ce 18 10 e0 00     00:06:31.920  READ VERIFY SECTOR(S) EXT

Error 61 [0] occurred at disk power-on lifetime: 3999 hours (166 days + 15 hours)
  When the command that caused the error occurred, the device was active or idle.

  After command completion occurred, registers were:
  ER -- ST COUNT  LBA_48  LH LM LL DV DC
  -- -- -- == -- == == == -- -- -- -- --
  40 -- 51 00 00 00 00 01 ce 18 18 00 00  Error: UNC at LBA = 0x01ce1818 = 30283800

  Commands leading to the command that caused the error were:
  CR FEATR COUNT  LBA_48  LH LM LL DV DC  Powered_Up_Time  Command/Feature_Name
  -- == -- == -- == == == -- -- -- -- --  ---------------  --------------------
  42 00 00 00 08 00 00 01 ce 18 18 e0 00     00:06:31.933  READ VERIFY SECTOR(S) EXT
  25 00 00 00 01 00 00 00 00 00 00 e0 00     00:06:31.932  READ DMA EXT
  42 00 00 00 08 00 00 01 ce 18 10 e0 00     00:06:31.920  READ VERIFY SECTOR(S) EXT
  25 00 00 00 01 00 00 00 00 00 00 e0 00     00:06:31.874  READ DMA EXT
  42 00 00 00 10 00 00 01 ce 18 10 e0 00     00:06:29.152  READ VERIFY SECTOR(S) EXT

Error 60 [19] occurred at disk power-on lifetime: 3999 hours (166 days + 15 hours)
  When the command that caused the error occurred, the device was active or idle.

  After command completion occurred, registers were:
  ER -- ST COUNT  LBA_48  LH LM LL DV DC
  -- -- -- == -- == == == -- -- -- -- --
  40 -- 51 00 00 00 00 01 ce 18 18 00 00  Error: UNC at LBA = 0x01ce1818 = 30283800

  Commands leading to the command that caused the error were:
  CR FEATR COUNT  LBA_48  LH LM LL DV DC  Powered_Up_Time  Command/Feature_Name
  -- == -- == -- == == == -- -- -- -- --  ---------------  --------------------
  42 00 00 00 10 00 00 01 ce 18 10 e0 00     00:06:29.152  READ VERIFY SECTOR(S) EXT
  42 00 00 00 10 00 00 01 ce 18 00 e0 00     00:06:29.143  READ VERIFY SECTOR(S) EXT
  25 00 00 00 01 00 00 00 00 3e c1 e0 00     00:06:29.143  READ DMA EXT
  42 00 00 00 20 00 00 01 ce 18 20 e0 00     00:06:29.131  READ VERIFY SECTOR(S) EXT
  25 00 00 00 01 00 00 00 00 00 00 e0 00     00:06:29.026  READ DMA EXT

Error 59 [18] occurred at disk power-on lifetime: 3999 hours (166 days + 15 hours)
  When the command that caused the error occurred, the device was active or idle.

  After command completion occurred, registers were:
  ER -- ST COUNT  LBA_48  LH LM LL DV DC
  -- -- -- == -- == == == -- -- -- -- --
  40 -- 51 00 00 00 00 01 ce 18 18 00 00  Error: UNC at LBA = 0x01ce1818 = 30283800

  Commands leading to the command that caused the error were:
  CR FEATR COUNT  LBA_48  LH LM LL DV DC  Powered_Up_Time  Command/Feature_Name
  -- == -- == -- == == == -- -- -- -- --  ---------------  --------------------
  42 00 00 00 20 00 00 01 ce 18 00 e0 00     00:06:26.304  READ VERIFY SECTOR(S) EXT
  25 00 00 00 01 00 00 00 00 00 00 e0 00     00:06:26.304  READ DMA EXT
  42 00 00 00 40 00 00 01 ce 18 40 e0 00     00:06:26.292  READ VERIFY SECTOR(S) EXT
  25 00 00 00 01 00 00 00 00 00 00 e0 00     00:06:26.245  READ DMA EXT
  42 00 00 00 40 00 00 01 ce 18 00 e0 00     00:06:23.507  READ VERIFY SECTOR(S) EXT

Error 58 [17] occurred at disk power-on lifetime: 3999 hours (166 days + 15 hours)
  When the command that caused the error occurred, the device was active or idle.

  After command completion occurred, registers were:
  ER -- ST COUNT  LBA_48  LH LM LL DV DC
  -- -- -- == -- == == == -- -- -- -- --
  40 -- 51 00 00 00 00 01 ce 18 18 00 00  Error: UNC at LBA = 0x01ce1818 = 30283800

  Commands leading to the command that caused the error were:
  CR FEATR COUNT  LBA_48  LH LM LL DV DC  Powered_Up_Time  Command/Feature_Name
  -- == -- == -- == == == -- -- -- -- --  ---------------  --------------------
  42 00 00 00 40 00 00 01 ce 18 00 e0 00     00:06:23.507  READ VERIFY SECTOR(S) EXT
  42 00 00 00 80 00 00 01 ce 18 80 e0 00     00:06:23.495  READ VERIFY SECTOR(S) EXT
  25 00 00 00 01 00 00 00 00 3e c1 e0 00     00:06:23.390  READ DMA EXT
  42 00 00 00 80 00 00 01 ce 18 00 e0 00     00:06:20.655  READ VERIFY SECTOR(S) EXT
  25 00 00 00 01 00 00 00 00 00 00 e0 00     00:06:20.609  READ DMA EXT

Error 57 [16] occurred at disk power-on lifetime: 3999 hours (166 days + 15 hours)
  When the command that caused the error occurred, the device was active or idle.

  After command completion occurred, registers were:
  ER -- ST COUNT  LBA_48  LH LM LL DV DC
  -- -- -- == -- == == == -- -- -- -- --
  40 -- 51 00 00 00 00 01 ce 18 18 00 00  Error: UNC at LBA = 0x01ce1818 = 30283800

  Commands leading to the command that caused the error were:
  CR FEATR COUNT  LBA_48  LH LM LL DV DC  Powered_Up_Time  Command/Feature_Name
  -- == -- == -- == == == -- -- -- -- --  ---------------  --------------------
  42 00 00 00 80 00 00 01 ce 18 00 e0 00     00:06:20.655  READ VERIFY SECTOR(S) EXT
  25 00 00 00 01 00 00 00 00 00 00 e0 00     00:06:20.609  READ DMA EXT
  42 00 00 01 00 00 00 01 ce 18 00 e0 00     00:06:17.888  READ VERIFY SECTOR(S) EXT
  25 00 00 00 01 00 00 00 00 00 00 e0 00     00:06:17.887  READ DMA EXT
  42 00 00 01 00 00 00 01 ce 17 00 e0 00     00:06:17.874  READ VERIFY SECTOR(S) EXT

SMART Extended Self-test Log Version: 1 (1 sectors)
Num  Test_Description    Status                  Remaining  LifeTime(hours)  LBA_of_first_error
# 1  Extended offline    Interrupted (host reset)      00%     43623         -
# 2  Short offline       Completed without error       00%     43535         -

SMART Selective self-test log data structure revision number 1
 SPAN  MIN_LBA  MAX_LBA  CURRENT_TEST_STATUS
    1        0        0  Not_testing
    2        0        0  Not_testing
    3        0        0  Not_testing
    4        0        0  Not_testing
    5        0        0  Not_testing
Selective self-test flags (0x0):
  After scanning selected spans, do NOT read-scan remainder of disk.
If Selective self-test is pending on power-up, resume after 0 minute delay.

SCT Status Version:                  3
SCT Version (vendor specific):       522 (0x020a)
Device State:                        Active (0)
Current Temperature:                    31 Celsius
Power Cycle Min/Max Temperature:     31/31 Celsius
Lifetime    Min/Max Temperature:      1/48 Celsius
Under/Over Temperature Limit Count:   0/0

SCT Temperature History Version:     2
Temperature Sampling Period:         1 minute
Temperature Logging Interval:        59 minutes
Min/Max recommended Temperature:     14/55 Celsius
Min/Max Temperature Limit:           10/60 Celsius
Temperature History Size (Index):    128 (88)

SCT Error Recovery Control:
           Read: Disabled
          Write: Disabled

Device Statistics (GP/SMART Log 0x04) not supported

Pending Defects log (GP Log 0x0c) not supported

SATA Phy Event Counters (GP Log 0x11)
ID      Size     Value  Description
0x000a  2            8  Device-to-host register FISes sent due to a COMRESET
0x0001  2            0  Command failed due to ICRC error
0x0003  2            0  R_ERR response for device-to-host data FIS
0x0004  2            0  R_ERR response for host-to-device data FIS
0x0006  2            0  R_ERR response for device-to-host non-data FIS
0x0007  2            0  R_ERR response for host-to-device non-data FIS

