smartctl 7.5 2025-04-30 r5714 [FreeBSD 14.3-RELEASE-p1 amd64] (local build)
Copyright (C) 2002-25, Bruce Allen, Christian Franke, www.smartmontools.org

=== START OF INFORMATION SECTION ===
Model Family:     Western Digital RE4
Device Model:     WDC WD1003FBYX-05Y7B0
Serial Number:    --
LU WWN Device Id: 5 0014ee ...
Firmware Version: 00.0NS03
User Capacity:    1,000,204,886,016 bytes [1.00 TB]
Sector Size:      512 bytes logical/physical
Rotation Rate:    7200 rpm
Device is:        In smartctl database 7.5/5706
ATA Version is:   ATA8-ACS (minor revision not indicated)
SATA Version is:  SATA 3.0, 6.0 Gb/s (current: 6.0 Gb/s)
Local Time is:    Mon Aug 18 23:05:55 2025 CDT
SMART support is: Available - device has SMART capability.
SMART support is: Enabled
AAM feature is:   Unavailable
APM level is:     128 (minimum power consumption without standby)
Rd look-ahead is: Enabled
Write cache is:   Enabled
DSN feature is:   Unavailable
ATA Security is:  Disabled, frozen [SEC2]

=== START OF READ SMART DATA SECTION ===
SMART overall-health self-assessment test result: PASSED

General SMART Values:
Offline data collection status:  (0x82)	Offline data collection activity
					was completed without error.
					Auto Offline Data Collection: Enabled.
Self-test execution status:      (   0)	The previous self-test routine completed
					without error or no self-test has ever 
					been run.
Total time to complete Offline 
data collection: 		(16260) seconds.
Offline data collection
capabilities: 			 (0x7b) SMART execute Offline immediate.
					Auto Offline data collection on/off support.
					Suspend Offline collection upon new
					command.
					Offline surface scan supported.
					Self-test supported.
					Conveyance Self-test supported.
					Selective Self-test supported.
SMART capabilities:            (0x0003)	Saves SMART data before entering
					power-saving mode.
					Supports SMART auto save timer.
Error logging capability:        (0x01)	Error logging supported.
					General Purpose Logging supported.
Short self-test routine 
recommended polling time: 	 (   2) minutes.
Extended self-test routine
recommended polling time: 	 ( 160) minutes.
Conveyance self-test routine
recommended polling time: 	 (   5) minutes.
SCT capabilities: 	       (0x303f)	SCT Status supported.
					SCT Error Recovery Control supported.
					SCT Feature Control supported.
					SCT Data Table supported.

SMART Attributes Data Structure revision number: 16
Vendor Specific SMART Attributes with Thresholds:
ID# ATTRIBUTE_NAME          FLAGS    VALUE WORST THRESH FAIL RAW_VALUE
  1 Raw_Read_Error_Rate     POSR-K   200   200   051    -    0
  3 Spin_Up_Time            POS--K   176   171   021    -    4200
  4 Start_Stop_Count        -O--CK   090   090   000    -    10126
  5 Reallocated_Sector_Ct   PO--CK   200   200   140    -    0
  7 Seek_Error_Rate         -OSR-K   200   200   000    -    0
  9 Power_On_Hours          -O--CK   045   045   000    -    40215
 10 Spin_Retry_Count        -O--CK   100   100   000    -    0
 11 Calibration_Retry_Count -O--CK   100   100   000    -    0
 12 Power_Cycle_Count       -O--CK   098   098   000    -    2836
192 Power-Off_Retract_Count -O--CK   200   200   000    -    643
193 Load_Cycle_Count        -O--CK   197   197   000    -    9498
194 Temperature_Celsius     -O---K   098   091   000    -    49
196 Reallocated_Event_Count -O--CK   200   200   000    -    0
197 Current_Pending_Sector  -O--CK   200   200   000    -    0
198 Offline_Uncorrectable   ----CK   200   200   000    -    0
199 UDMA_CRC_Error_Count    -O--CK   200   200   000    -    5
200 Multi_Zone_Error_Rate   ---R--   200   200   000    -    0
                            ||||||_ K auto-keep
                            |||||__ C event count
                            ||||___ R error rate
                            |||____ S speed/performance
                            ||_____ O updated online
                            |______ P prefailure warning

General Purpose Log Directory Version 1
SMART           Log Directory Version 1 [multi-sector log support]
Address    Access  R/W   Size  Description
0x00       GPL,SL  R/O      1  Log Directory
0x01           SL  R/O      1  Summary SMART error log
0x02           SL  R/O      5  Comprehensive SMART error log
0x03       GPL     R/O      6  Ext. Comprehensive SMART error log
0x06           SL  R/O      1  SMART self-test log
0x07       GPL     R/O      1  Extended self-test log
0x08       GPL     R/O      2  Power Conditions log
0x09           SL  R/W      1  Selective self-test log
0x10       GPL     R/O      1  NCQ Command Error log
0x11       GPL     R/O      1  SATA Phy Event Counters log
0x80       GPL     R/W  65535  Host vendor specific log
0x80       SL      R/W    255  Host vendor specific log
0x81-0x9f  GPL,SL  R/W     16  Host vendor specific log
0xa0-0xa7  GPL,SL  VS      16  Device vendor specific log
0xa8-0xb5  GPL,SL  VS       1  Device vendor specific log
0xb6       GPL     VS       1  Device vendor specific log
0xb7       GPL,SL  VS       1  Device vendor specific log
0xbd       GPL,SL  VS       1  Device vendor specific log
0xc0       GPL,SL  VS       1  Device vendor specific log
0xc1       GPL     VS      24  Device vendor specific log
0xe0       GPL,SL  R/W      1  SCT Command/Status
0xe1       GPL,SL  R/W      1  SCT Data Transfer

SMART Extended Comprehensive Error Log Version: 1 (6 sectors)
Device Error Count: 10
	CR     = Command Register
	FEATR  = Features Register
	COUNT  = Count (was: Sector Count) Register
	LBA_48 = Upper bytes of LBA High/Mid/Low Registers ]  ATA-8
	LH     = LBA High (was: Cylinder High) Register    ]   LBA
	LM     = LBA Mid (was: Cylinder Low) Register      ] Register
	LL     = LBA Low (was: Sector Number) Register     ]
	DV     = Device (was: Device/Head) Register
	DC     = Device Control Register
	ER     = Error register
	ST     = Status register
Powered_Up_Time is measured from power on, and printed as
DDd+hh:mm:SS.sss where DD=days, hh=hours, mm=minutes,
SS=sec, and sss=millisec. It "wraps" after 49.710 days.

Error 10 [9] occurred at disk power-on lifetime: 35397 hours (1474 days + 21 hours)
  When the command that caused the error occurred, the device was active or idle.

  After command completion occurred, registers were:
  ER -- ST COUNT  LBA_48  LH LM LL DV DC
  -- -- -- == -- == == == -- -- -- -- --
  10 -- 51 00 00 00 00 00 5d 20 50 a0 00  Error: IDNF at LBA = 0x005d2050 = 6103120

  Commands leading to the command that caused the error were:
  CR FEATR COUNT  LBA_48  LH LM LL DV DC  Powered_Up_Time  Command/Feature_Name
  -- == -- == -- == == == -- -- -- -- --  ---------------  --------------------
  61 00 08 00 90 00 00 00 5d 20 50 40 00     00:03:07.409  WRITE FPDMA QUEUED
  60 00 10 00 88 00 00 00 00 08 00 40 00     00:03:04.614  READ FPDMA QUEUED
  60 00 10 00 80 00 00 00 00 08 00 40 00     00:03:04.599  READ FPDMA QUEUED
  60 00 10 00 78 00 00 00 00 08 00 40 00     00:03:04.584  READ FPDMA QUEUED
  60 00 10 00 70 00 00 00 00 08 00 40 00     00:03:04.569  READ FPDMA QUEUED

Error 9 [8] occurred at disk power-on lifetime: 32783 hours (1365 days + 23 hours)
  When the command that caused the error occurred, the device was active or idle.

  After command completion occurred, registers were:
  ER -- ST COUNT  LBA_48  LH LM LL DV DC
  -- -- -- == -- == == == -- -- -- -- --
  10 -- 51 00 01 00 00 00 5d 1f 20 a0 00  Error: IDNF at LBA = 0x005d1f20 = 6102816

  Commands leading to the command that caused the error were:
  CR FEATR COUNT  LBA_48  LH LM LL DV DC  Powered_Up_Time  Command/Feature_Name
  -- == -- == -- == == == -- -- -- -- --  ---------------  --------------------
  61 00 08 00 d0 00 00 00 5d 1f 20 40 00     16:45:51.119  WRITE FPDMA QUEUED
  ec 00 00 00 01 00 00 00 00 00 00 e0 00     16:45:13.678  IDENTIFY DEVICE
  b0 00 d0 00 00 00 00 00 c2 4f 00 a0 00     16:44:27.141  SMART READ DATA
  b0 00 da 00 00 00 00 00 c2 4f 00 a0 00     16:44:27.073  SMART RETURN STATUS
  b0 00 d1 00 01 00 00 00 c2 4f 01 a0 00     16:44:27.033  SMART READ ATTRIBUTE THRESHOLDS [OBS-4]

Error 8 [7] occurred at disk power-on lifetime: 32380 hours (1349 days + 4 hours)
  When the command that caused the error occurred, the device was active or idle.

  After command completion occurred, registers were:
  ER -- ST COUNT  LBA_48  LH LM LL DV DC
  -- -- -- == -- == == == -- -- -- -- --
  10 -- 51 00 01 00 00 0f 88 dd 20 a0 00  Error: IDNF at LBA = 0x0f88dd20 = 260627744

  Commands leading to the command that caused the error were:
  CR FEATR COUNT  LBA_48  LH LM LL DV DC  Powered_Up_Time  Command/Feature_Name
  -- == -- == -- == == == -- -- -- -- --  ---------------  --------------------
  61 00 08 00 10 00 00 0f 88 dd 20 40 00     00:03:04.892  WRITE FPDMA QUEUED
  ec 00 00 00 01 00 00 00 00 00 00 e0 00     00:03:03.663  IDENTIFY DEVICE
  61 00 08 00 f8 00 00 00 5d 1f 10 40 00     00:03:02.270  WRITE FPDMA QUEUED
  ea 00 00 00 00 00 00 00 00 00 00 e0 00     00:03:02.265  FLUSH CACHE EXT
  61 00 08 00 e8 00 00 00 5d 1f a0 40 00     00:03:02.265  WRITE FPDMA QUEUED

Error 7 [6] occurred at disk power-on lifetime: 31037 hours (1293 days + 5 hours)
  When the command that caused the error occurred, the device was active or idle.

  After command completion occurred, registers were:
  ER -- ST COUNT  LBA_48  LH LM LL DV DC
  -- -- -- == -- == == == -- -- -- -- --
  10 -- 51 00 01 00 00 0b c3 3d 60 a0 00  Error: IDNF at LBA = 0x0bc33d60 = 197344608

  Commands leading to the command that caused the error were:
  CR FEATR COUNT  LBA_48  LH LM LL DV DC  Powered_Up_Time  Command/Feature_Name
  -- == -- == -- == == == -- -- -- -- --  ---------------  --------------------
  61 00 08 00 98 00 00 0b c3 3d 60 40 00     00:03:09.606  WRITE FPDMA QUEUED
  ec 00 00 00 01 00 00 00 00 00 00 e0 00     00:03:05.053  IDENTIFY DEVICE
  61 00 08 00 88 00 00 00 01 1a 80 40 00     00:03:04.166  WRITE FPDMA QUEUED
  61 00 08 00 80 00 00 00 5d 1f 18 40 00     00:03:00.090  WRITE FPDMA QUEUED
  ea 00 00 00 00 00 00 00 00 00 00 e0 00     00:03:00.084  FLUSH CACHE EXT

Error 6 [5] occurred at disk power-on lifetime: 30689 hours (1278 days + 17 hours)
  When the command that caused the error occurred, the device was active or idle.

  After command completion occurred, registers were:
  ER -- ST COUNT  LBA_48  LH LM LL DV DC
  -- -- -- == -- == == == -- -- -- -- --
  10 -- 51 00 01 00 00 0b c3 3d 60 a0 00  Error: IDNF at LBA = 0x0bc33d60 = 197344608

  Commands leading to the command that caused the error were:
  CR FEATR COUNT  LBA_48  LH LM LL DV DC  Powered_Up_Time  Command/Feature_Name
  -- == -- == -- == == == -- -- -- -- --  ---------------  --------------------
  61 00 08 00 58 00 00 0b c3 3d 60 40 00     00:03:04.735  WRITE FPDMA QUEUED
  ec 00 00 00 01 00 00 00 00 00 00 e0 00     00:03:00.588  IDENTIFY DEVICE
  b0 00 d0 00 00 00 00 00 c2 4f 00 a0 00     00:03:00.561  SMART READ DATA
  b0 00 da 00 00 00 00 00 c2 4f 00 a0 00     00:03:00.494  SMART RETURN STATUS
  b0 00 d0 00 00 00 00 00 c2 4f 00 a0 00     00:03:00.486  SMART READ DATA

Error 5 [4] occurred at disk power-on lifetime: 30352 hours (1264 days + 16 hours)
  When the command that caused the error occurred, the device was active or idle.

  After command completion occurred, registers were:
  ER -- ST COUNT  LBA_48  LH LM LL DV DC
  -- -- -- == -- == == == -- -- -- -- --
  10 -- 51 00 01 00 00 00 5d 1f a0 a0 00  Error: IDNF at LBA = 0x005d1fa0 = 6102944

  Commands leading to the command that caused the error were:
  CR FEATR COUNT  LBA_48  LH LM LL DV DC  Powered_Up_Time  Command/Feature_Name
  -- == -- == -- == == == -- -- -- -- --  ---------------  --------------------
  61 00 08 00 30 00 00 00 5d 1f a0 40 00     00:51:47.945  WRITE FPDMA QUEUED
  ec 00 00 00 01 00 00 00 00 00 00 e0 00     00:51:22.137  IDENTIFY DEVICE
  61 00 08 00 20 00 00 00 5d 1f 10 40 00     00:51:21.064  WRITE FPDMA QUEUED
  ea 00 00 00 00 00 00 00 00 00 00 e0 00     00:51:21.057  FLUSH CACHE EXT
  61 00 08 00 10 00 00 00 5d 1f 20 40 00     00:51:21.057  WRITE FPDMA QUEUED

Error 4 [3] occurred at disk power-on lifetime: 30133 hours (1255 days + 13 hours)
  When the command that caused the error occurred, the device was active or idle.

  After command completion occurred, registers were:
  ER -- ST COUNT  LBA_48  LH LM LL DV DC
  -- -- -- == -- == == == -- -- -- -- --
  10 -- 51 00 01 00 00 00 57 77 a0 a0 00  Error: IDNF at LBA = 0x005777a0 = 5732256

  Commands leading to the command that caused the error were:
  CR FEATR COUNT  LBA_48  LH LM LL DV DC  Powered_Up_Time  Command/Feature_Name
  -- == -- == -- == == == -- -- -- -- --  ---------------  --------------------
  61 00 08 00 d0 00 00 00 57 77 a0 40 00     00:06:12.438  WRITE FPDMA QUEUED
  ec 00 00 00 01 00 00 00 00 00 00 e0 00     00:04:19.041  IDENTIFY DEVICE
  ec 00 00 00 00 00 00 00 00 00 00 a0 00     00:04:14.199  IDENTIFY DEVICE
  ec 00 00 00 00 00 00 00 00 00 00 a0 00     00:04:14.064  IDENTIFY DEVICE
  ec 00 00 00 00 00 00 00 00 00 00 a0 00     00:04:14.060  IDENTIFY DEVICE

Error 3 [2] occurred at disk power-on lifetime: 28116 hours (1171 days + 12 hours)
  When the command that caused the error occurred, the device was active or idle.

  After command completion occurred, registers were:
  ER -- ST COUNT  LBA_48  LH LM LL DV DC
  -- -- -- == -- == == == -- -- -- -- --
  10 -- 51 00 01 00 00 00 57 8f 78 a0 00  Error: IDNF at LBA = 0x00578f78 = 5738360

  Commands leading to the command that caused the error were:
  CR FEATR COUNT  LBA_48  LH LM LL DV DC  Powered_Up_Time  Command/Feature_Name
  -- == -- == -- == == == -- -- -- -- --  ---------------  --------------------
  61 00 08 00 38 00 00 00 57 8f 78 40 00     02:03:57.915  WRITE FPDMA QUEUED
  ec 00 00 00 01 00 00 00 00 00 00 e0 00     02:03:41.825  IDENTIFY DEVICE
  61 00 08 00 28 00 00 00 57 8f 78 40 00     02:03:37.489  WRITE FPDMA QUEUED
  61 00 08 00 20 00 00 00 57 8f 78 40 00     02:03:30.671  WRITE FPDMA QUEUED
  61 00 08 00 18 00 00 00 57 8f 78 40 00     02:03:25.231  WRITE FPDMA QUEUED

SMART Extended Self-test Log Version: 1 (1 sectors)
Num  Test_Description    Status                  Remaining  LifeTime(hours)  LBA_of_first_error
# 1  Short offline       Completed without error       00%     39353         -
# 2  Short offline       Completed without error       00%     39353         -
# 3  Short offline       Completed without error       00%     38140         -
# 4  Short offline       Completed without error       00%     38042         -
# 5  Short offline       Completed without error       00%     37826         -
# 6  Short offline       Completed without error       00%     37815         -
# 7  Short offline       Completed without error       00%     37535         -
# 8  Short offline       Completed without error       00%     37304         -
# 9  Short offline       Completed without error       00%     36963         -
#10  Short offline       Completed without error       00%     36961         -
#11  Short offline       Completed without error       00%     36930         -
#12  Short offline       Completed without error       00%     36882         -
#13  Short offline       Completed without error       00%     36740         -
#14  Short offline       Completed without error       00%     36589         -
#15  Short offline       Completed without error       00%     36424         -
#16  Short offline       Completed without error       00%     36293         -
#17  Short offline       Completed without error       00%     36247         -
#18  Short offline       Completed without error       00%     36167         -

SMART Selective self-test log data structure revision number 1
 SPAN  MIN_LBA  MAX_LBA  CURRENT_TEST_STATUS
    1        0        0  Not_testing
    2        0        0  Not_testing
    3        0        0  Not_testing
    4        0        0  Not_testing
    5        0        0  Not_testing
Selective self-test flags (0x0):
  After scanning selected spans, do NOT read-scan remainder of disk.
If Selective self-test is pending on power-up, resume after 0 minute delay.

SCT Status Version:                  3
SCT Version (vendor specific):       258 (0x0102)
Device State:                        Active (0)
Current Temperature:                    49 Celsius
Power Cycle Min/Max Temperature:     26/56 Celsius
Lifetime    Min/Max Temperature:     24/56 Celsius
Under/Over Temperature Limit Count:   0/0

SCT Temperature History Version:     2
Temperature Sampling Period:         1 minute
Temperature Logging Interval:        1 minute
Min/Max recommended Temperature:      0/60 Celsius
Min/Max Temperature Limit:           -41/85 Celsius
Temperature History Size (Index):    478 (86)

SCT Error Recovery Control:
           Read:     70 (7.0 seconds)
          Write:     70 (7.0 seconds)

Device Statistics (GP/SMART Log 0x04) not supported

Pending Defects log (GP Log 0x0c) not supported

SATA Phy Event Counters (GP Log 0x11)
ID      Size     Value  Description
0x0001  2            0  Command failed due to ICRC error
0x0002  2            0  R_ERR response for data FIS
0x0003  2            0  R_ERR response for device-to-host data FIS
0x0004  2            0  R_ERR response for host-to-device data FIS
0x0005  2            0  R_ERR response for non-data FIS
0x0006  2            0  R_ERR response for device-to-host non-data FIS
0x0007  2            0  R_ERR response for host-to-device non-data FIS
0x0008  2            0  Device-to-host non-data FIS retries
0x0009  2           22  Transition from drive PhyRdy to drive PhyNRdy
0x000a  2           12  Device-to-host register FISes sent due to a COMRESET
0x000b  2            0  CRC errors within host-to-device FIS
0x000f  2            0  R_ERR response for host-to-device data FIS, CRC
0x0012  2            0  R_ERR response for host-to-device non-data FIS, CRC
0x8000  4       462796  Vendor specific



