smartctl 7.2 2020-12-30 r5155 [FreeBSD 13.0-RELEASE amd64] (local build)
Copyright (C) 2002-20, Bruce Allen, Christian Franke, www.smartmontools.org

=== START OF INFORMATION SECTION ===
Model Family:     Hitachi Travelstar 5K500.B
Device Model:     HTS545025B9SA02
Serial Number:    --
LU WWN Device Id: 5 000cca ...
Firmware Version: PB2AC60T
User Capacity:    250,059,350,016 bytes [250 GB]
Sector Size:      512 bytes logical/physical
Rotation Rate:    5400 rpm
Form Factor:      2.5 inches
Device is:        In smartctl database [for details use: -P show]
ATA Version is:   ATA8-ACS T13/1699-D revision 6
SATA Version is:  SATA 2.6, 1.5 Gb/s
Local Time is:    Fri Jul 29 07:52:37 2022 EDT
SMART support is: Available - device has SMART capability.
SMART support is: Enabled
AAM feature is:   Disabled
APM level is:     128 (minimum power consumption without standby)
Rd look-ahead is: Enabled
Write cache is:   Enabled
DSN feature is:   Unavailable
ATA Security is:  Disabled, frozen [SEC2]
Wt Cache Reorder: Enabled

=== START OF READ SMART DATA SECTION ===
SMART overall-health self-assessment test result: PASSED

General SMART Values:
Offline data collection status:  (0x00)	Offline data collection activity
					was never started.
					Auto Offline Data Collection: Disabled.
Self-test execution status:      (   0)	The previous self-test routine completed
					without error or no self-test has ever 
					been run.
Total time to complete Offline 
data collection: 		(  645) seconds.
Offline data collection
capabilities: 			 (0x5b) SMART execute Offline immediate.
					Auto Offline data collection on/off support.
					Suspend Offline collection upon new
					command.
					Offline surface scan supported.
					Self-test supported.
					No Conveyance Self-test supported.
					Selective Self-test supported.
SMART capabilities:            (0x0003)	Saves SMART data before entering
					power-saving mode.
					Supports SMART auto save timer.
Error logging capability:        (0x01)	Error logging supported.
					General Purpose Logging supported.
Short self-test routine 
recommended polling time: 	 (   2) minutes.
Extended self-test routine
recommended polling time: 	 (  83) minutes.
SCT capabilities: 	       (0x003d)	SCT Status supported.
					SCT Error Recovery Control supported.
					SCT Feature Control supported.
					SCT Data Table supported.

SMART Attributes Data Structure revision number: 16
Vendor Specific SMART Attributes with Thresholds:
ID# ATTRIBUTE_NAME          FLAGS    VALUE WORST THRESH FAIL RAW_VALUE
  1 Raw_Read_Error_Rate     PO-R--   100   100   062    -    0
  2 Throughput_Performance  P-S---   100   100   040    -    0
  3 Spin_Up_Time            POS---   204   204   033    -    1
  4 Start_Stop_Count        -O--C-   084   084   000    -    25890
  5 Reallocated_Sector_Ct   PO--CK   100   100   005    -    182
  7 Seek_Error_Rate         PO-R--   100   100   067    -    0
  8 Seek_Time_Performance   P-S---   100   100   040    -    0
  9 Power_On_Hours          -O--C-   041   041   000    -    26274
 10 Spin_Retry_Count        PO--C-   100   100   060    -    0
 12 Power_Cycle_Count       -O--CK   085   085   000    -    24016
160 Unknown_Attribute       -O--CK   100   100   000    -    0
191 G-Sense_Error_Rate      -O-R--   100   100   000    -    7082401071104
192 Power-Off_Retract_Count -O--CK   094   094   000    -    618606560365
193 Load_Cycle_Count        -O--C-   001   001   000    -    1544265
194 Temperature_Celsius     -O----   144   144   000    -    38 (Min/Max 1/49)
195 Hardware_ECC_Recovered  -O-R--   100   100   000    -    0
196 Reallocated_Event_Count -O--CK   100   100   000    -    197
197 Current_Pending_Sector  -O---K   100   100   000    -    6
198 Offline_Uncorrectable   ---R--   100   100   000    -    0
199 UDMA_CRC_Error_Count    -O-R--   200   200   000    -    0
223 Load_Retry_Count        -O-R--   100   100   000    -    0
254 Free_Fall_Sensor        -O--CK   001   001   000    -    32227
                            ||||||_ K auto-keep
                            |||||__ C event count
                            ||||___ R error rate
                            |||____ S speed/performance
                            ||_____ O updated online
                            |______ P prefailure warning

General Purpose Log Directory Version 1
SMART           Log Directory Version 1 [multi-sector log support]
Address    Access  R/W   Size  Description
0x00       GPL,SL  R/O      1  Log Directory
0x01           SL  R/O      1  Summary SMART error log
0x02           SL  R/O      1  Comprehensive SMART error log
0x03       GPL     R/O      1  Ext. Comprehensive SMART error log
0x06           SL  R/O      1  SMART self-test log
0x07       GPL     R/O      1  Extended self-test log
0x09           SL  R/W      1  Selective self-test log
0x10       GPL     R/O      1  NCQ Command Error log
0x11       GPL     R/O      1  SATA Phy Event Counters log
0x80-0x9f  GPL,SL  R/W     16  Host vendor specific log
0xa2           SL  VS       1  Device vendor specific log
0xe0       GPL,SL  R/W      1  SCT Command/Status
0xe1       GPL,SL  R/W      1  SCT Data Transfer

SMART Extended Comprehensive Error Log Version: 1 (1 sectors)
Device Error Count: 243 (device log contains only the most recent 4 errors)
	CR     = Command Register
	FEATR  = Features Register
	COUNT  = Count (was: Sector Count) Register
	LBA_48 = Upper bytes of LBA High/Mid/Low Registers ]  ATA-8
	LH     = LBA High (was: Cylinder High) Register    ]   LBA
	LM     = LBA Mid (was: Cylinder Low) Register      ] Register
	LL     = LBA Low (was: Sector Number) Register     ]
	DV     = Device (was: Device/Head) Register
	DC     = Device Control Register
	ER     = Error register
	ST     = Status register
Powered_Up_Time is measured from power on, and printed as
DDd+hh:mm:SS.sss where DD=days, hh=hours, mm=minutes,
SS=sec, and sss=millisec. It "wraps" after 49.710 days.

Error 243 [2] occurred at disk power-on lifetime: 23731 hours (988 days + 19 hours)
  When the command that caused the error occurred, the device was active or idle.

  After command completion occurred, registers were:
  ER -- ST COUNT  LBA_48  LH LM LL DV DC
  -- -- -- == -- == == == -- -- -- -- --
  40 -- 51 00 0e 00 00 0b 58 48 e2 4b 00  Error: UNC 14 sectors at LBA = 0x0b5848e2 = 190335202

  Commands leading to the command that caused the error were:
  CR FEATR COUNT  LBA_48  LH LM LL DV DC  Powered_Up_Time  Command/Feature_Name
  -- == -- == -- == == == -- -- -- -- --  ---------------  --------------------
  25 00 00 00 10 00 00 0b 58 48 e0 40 00     00:01:04.100  READ DMA EXT
  25 00 00 00 10 00 00 0b 58 48 e0 40 00     00:01:00.300  READ DMA EXT
  2f 00 00 00 01 00 00 00 00 00 10 00 00     00:01:00.300  READ LOG EXT
  60 00 10 00 b8 00 00 0b 58 48 e0 40 00     00:00:55.200  READ FPDMA QUEUED
  60 06 38 00 b0 00 00 09 b0 58 c8 40 00     00:00:55.100  READ FPDMA QUEUED

Error 242 [1] occurred at disk power-on lifetime: 23731 hours (988 days + 19 hours)
  When the command that caused the error occurred, the device was active or idle.

  After command completion occurred, registers were:
  ER -- ST COUNT  LBA_48  LH LM LL DV DC
  -- -- -- == -- == == == -- -- -- -- --
  40 -- 51 00 0e 00 00 0b 58 48 e2 4b 00  Error: UNC 14 sectors at LBA = 0x0b5848e2 = 190335202

  Commands leading to the command that caused the error were:
  CR FEATR COUNT  LBA_48  LH LM LL DV DC  Powered_Up_Time  Command/Feature_Name
  -- == -- == -- == == == -- -- -- -- --  ---------------  --------------------
  25 00 00 00 10 00 00 0b 58 48 e0 40 00     00:01:00.300  READ DMA EXT
  2f 00 00 00 01 00 00 00 00 00 10 00 00     00:01:00.300  READ LOG EXT
  60 00 10 00 b8 00 00 0b 58 48 e0 40 00     00:00:55.200  READ FPDMA QUEUED
  60 06 38 00 b0 00 00 09 b0 58 c8 40 00     00:00:55.100  READ FPDMA QUEUED
  60 08 00 00 a8 00 00 09 b0 50 c8 40 00     00:00:55.100  READ FPDMA QUEUED

Error 241 [0] occurred at disk power-on lifetime: 23732 hours (988 days + 20 hours)
  When the command that caused the error occurred, the device was active or idle.

  After command completion occurred, registers were:
  ER -- ST COUNT  LBA_48  LH LM LL DV DC
  -- -- -- == -- == == == -- -- -- -- --
  40 -- 51 00 06 00 00 0b 58 48 e2 4b 00  Error: UNC 6 sectors at LBA = 0x0b5848e2 = 190335202

  Commands leading to the command that caused the error were:
  CR FEATR COUNT  LBA_48  LH LM LL DV DC  Powered_Up_Time  Command/Feature_Name
  -- == -- == -- == == == -- -- -- -- --  ---------------  --------------------
  25 00 00 00 08 00 00 0b 58 48 e0 40 00     00:44:06.000  READ DMA EXT
  25 00 00 00 08 00 00 0b 58 48 e0 40 00     00:44:02.200  READ DMA EXT
  2f 00 00 00 01 00 00 00 00 00 10 00 00     00:44:02.200  READ LOG EXT
  60 00 08 00 b8 00 00 0b 58 48 e0 40 00     00:43:58.400  READ FPDMA QUEUED
  60 00 08 00 b0 00 00 08 f0 06 28 40 00     00:43:58.400  READ FPDMA QUEUED

Error 240 [3] occurred at disk power-on lifetime: 23732 hours (988 days + 20 hours)
  When the command that caused the error occurred, the device was active or idle.

  After command completion occurred, registers were:
  ER -- ST COUNT  LBA_48  LH LM LL DV DC
  -- -- -- == -- == == == -- -- -- -- --
  40 -- 51 00 06 00 00 0b 58 48 e2 4b 00  Error: UNC 6 sectors at LBA = 0x0b5848e2 = 190335202

  Commands leading to the command that caused the error were:
  CR FEATR COUNT  LBA_48  LH LM LL DV DC  Powered_Up_Time  Command/Feature_Name
  -- == -- == -- == == == -- -- -- -- --  ---------------  --------------------
  25 00 00 00 08 00 00 0b 58 48 e0 40 00     00:44:02.200  READ DMA EXT
  2f 00 00 00 01 00 00 00 00 00 10 00 00     00:44:02.200  READ LOG EXT
  60 00 08 00 b8 00 00 0b 58 48 e0 40 00     00:43:58.400  READ FPDMA QUEUED
  60 00 08 00 b0 00 00 08 f0 06 28 40 00     00:43:58.400  READ FPDMA QUEUED
  61 00 10 00 a8 00 00 06 18 89 68 40 00     00:43:58.400  WRITE FPDMA QUEUED

SMART Extended Self-test Log Version: 1 (1 sectors)
No self-tests have been logged.  [To run self-tests, use: smartctl -t]

SMART Selective self-test log data structure revision number 1
 SPAN  MIN_LBA  MAX_LBA  CURRENT_TEST_STATUS
    1        0        0  Not_testing
    2        0        0  Not_testing
    3        0        0  Not_testing
    4        0        0  Not_testing
    5        0        0  Not_testing
Selective self-test flags (0x0):
  After scanning selected spans, do NOT read-scan remainder of disk.
If Selective self-test is pending on power-up, resume after 0 minute delay.

SCT Status Version:                  3
SCT Version (vendor specific):       256 (0x0100)
Device State:                        Active (0)
Current Temperature:                    38 Celsius
Power Cycle Min/Max Temperature:     23/38 Celsius
Lifetime    Min/Max Temperature:      1/49 Celsius
Specified Max Operating Temperature:    36 Celsius
Under/Over Temperature Limit Count:   0/0

SCT Temperature History Version:     2
Temperature Sampling Period:         1 minute
Temperature Logging Interval:        1 minute
Min/Max recommended Temperature:      5/60 Celsius
Min/Max Temperature Limit:           -40/65 Celsius
Temperature History Size (Index):    478 (54)

SCT Error Recovery Control:
           Read: Disabled
          Write: Disabled

Device Statistics (GP/SMART Log 0x04) not supported

Pending Defects log (GP Log 0x0c) not supported

SATA Phy Event Counters (GP Log 0x11)
ID      Size     Value  Description
0x0001  2            0  Command failed due to ICRC error
0x0002  2            0  R_ERR response for data FIS
0x0005  2            0  R_ERR response for non-data FIS
0x0009  2           10  Transition from drive PhyRdy to drive PhyNRdy
0x000a  2           10  Device-to-host register FISes sent due to a COMRESET
0x000b  2            0  CRC errors within host-to-device FIS
0x000d  2            0  Non-CRC errors within host-to-device FIS

