smartctl 7.2 2021-09-14 r5236 [FreeBSD 13.0-STABLE amd64] (local build)
Copyright (C) 2002-20, Bruce Allen, Christian Franke, www.smartmontools.org

=== START OF INFORMATION SECTION ===
Model Family:     Seagate Momentus 7200.4
Device Model:     ST9320423AS
Serial Number:    --
LU WWN Device Id: 5 000c50 ...
Firmware Version: 0006HPM1
User Capacity:    320,072,933,376 bytes [320 GB]
Sector Size:      512 bytes logical/physical
Rotation Rate:    7200 rpm
Form Factor:      2.5 inches
Device is:        In smartctl database [for details use: -P show]
ATA Version is:   ATA8-ACS T13/1699-D revision 4
SATA Version is:  SATA 2.6, 3.0 Gb/s
Local Time is:    Mon Mar 14 23:30:15 2022 EET
SMART support is: Available - device has SMART capability.
SMART support is: Enabled
AAM feature is:   Unavailable
APM level is:     128 (minimum power consumption without standby)
Rd look-ahead is: Enabled
Write cache is:   Enabled
DSN feature is:   Unavailable
ATA Security is:  Disabled, frozen [SEC2]
Wt Cache Reorder: Unknown

=== START OF READ SMART DATA SECTION ===
SMART overall-health self-assessment test result: PASSED
See vendor-specific Attribute list for marginal Attributes.

General SMART Values:
Offline data collection status:  (0x00)	Offline data collection activity
					was never started.
					Auto Offline Data Collection: Disabled.
Self-test execution status:      (   0)	The previous self-test routine completed
					without error or no self-test has ever 
					been run.
Total time to complete Offline 
data collection: 		(    0) seconds.
Offline data collection
capabilities: 			 (0x53) SMART execute Offline immediate.
					Auto Offline data collection on/off support.
					Suspend Offline collection upon new
					command.
					No Offline surface scan supported.
					Self-test supported.
					No Conveyance Self-test supported.
					Selective Self-test supported.
SMART capabilities:            (0x0003)	Saves SMART data before entering
					power-saving mode.
					Supports SMART auto save timer.
Error logging capability:        (0x01)	Error logging supported.
					General Purpose Logging supported.
Short self-test routine 
recommended polling time: 	 (   2) minutes.
Extended self-test routine
recommended polling time: 	 (  73) minutes.
SCT capabilities: 	       (0x103f)	SCT Status supported.
					SCT Error Recovery Control supported.
					SCT Feature Control supported.
					SCT Data Table supported.

SMART Attributes Data Structure revision number: 10
Vendor Specific SMART Attributes with Thresholds:
ID# ATTRIBUTE_NAME          FLAGS    VALUE WORST THRESH FAIL RAW_VALUE
  1 Raw_Read_Error_Rate     POSR--   106   082   006    -    11226247
  3 Spin_Up_Time            -O----   100   096   000    -    0
  4 Start_Stop_Count        PO--CK   096   096   000    -    5108
  5 Reallocated_Sector_Ct   PO--CK   100   100   036    -    3
  7 Seek_Error_Rate         POSR--   073   060   030    -    30237709547
  9 Power_On_Hours          -O--CK   091   091   000    -    7899
 10 Spin_Retry_Count        PO--C-   100   100   097    -    0
 12 Power_Cycle_Count       PO--CK   096   037   020    -    5048
183 Runtime_Bad_Block       -O--CK   100   253   000    -    0
184 End-to-End_Error        PO--CK   100   100   097    -    0
187 Reported_Uncorrect      -O--CK   001   001   000    -    7546
188 Command_Timeout         -O--CK   100   098   000    -    4295033824
189 High_Fly_Writes         -O-RCK   100   100   000    -    0
190 Airflow_Temperature_Cel -O---K   061   043   045    Past 39 (Min/Max 27/40 #8)
191 G-Sense_Error_Rate      -O--CK   100   100   000    -    73
192 Power-Off_Retract_Count -O--CK   100   100   000    -    285
193 Load_Cycle_Count        -O--CK   072   072   000    -    57417
194 Temperature_Celsius     -O---K   039   057   000    -    39 (0 8 0 0 0)
195 Hardware_ECC_Recovered  -O-RC-   055   053   000    -    11226247
196 Reallocated_Event_Count PO--CK   100   100   036    -    3
197 Current_Pending_Sector  -O--C-   100   100   000    -    0
198 Offline_Uncorrectable   ----C-   100   100   000    -    0
199 UDMA_CRC_Error_Count    -OSRCK   200   200   000    -    0
254 Free_Fall_Sensor        -O--CK   100   100   000    -    0
                            ||||||_ K auto-keep
                            |||||__ C event count
                            ||||___ R error rate
                            |||____ S speed/performance
                            ||_____ O updated online
                            |______ P prefailure warning

General Purpose Log Directory Version 1
SMART           Log Directory Version 1 [multi-sector log support]
Address    Access  R/W   Size  Description
0x00       GPL,SL  R/O      1  Log Directory
0x01       GPL,SL  R/O      1  Summary SMART error log
0x02       GPL,SL  R/O      5  Comprehensive SMART error log
0x03       GPL,SL  R/O      5  Ext. Comprehensive SMART error log
0x06       GPL,SL  R/O      1  SMART self-test log
0x07       GPL,SL  R/O      1  Extended self-test log
0x09       GPL,SL  R/W      1  Selective self-test log
0x10       GPL,SL  R/O      1  NCQ Command Error log
0x11       GPL,SL  R/O      1  SATA Phy Event Counters log
0x21       GPL,SL  R/O      1  Write stream error log
0x22       GPL,SL  R/O      1  Read stream error log
0x80-0x9f  GPL,SL  R/W     16  Host vendor specific log
0xa1       GPL,SL  VS      20  Device vendor specific log
0xa2       GPL     VS    2248  Device vendor specific log
0xa8       GPL,SL  VS      65  Device vendor specific log
0xa9       GPL,SL  VS       1  Device vendor specific log
0xb0       GPL     VS    2864  Device vendor specific log
0xbe-0xbf  GPL     VS   65535  Device vendor specific log
0xe0       GPL,SL  R/W      1  SCT Command/Status
0xe1       GPL,SL  R/W      1  SCT Data Transfer

SMART Extended Comprehensive Error Log Version: 1 (5 sectors)
Device Error Count: 4976 (device log contains only the most recent 20 errors)
	CR     = Command Register
	FEATR  = Features Register
	COUNT  = Count (was: Sector Count) Register
	LBA_48 = Upper bytes of LBA High/Mid/Low Registers ]  ATA-8
	LH     = LBA High (was: Cylinder High) Register    ]   LBA
	LM     = LBA Mid (was: Cylinder Low) Register      ] Register
	LL     = LBA Low (was: Sector Number) Register     ]
	DV     = Device (was: Device/Head) Register
	DC     = Device Control Register
	ER     = Error register
	ST     = Status register
Powered_Up_Time is measured from power on, and printed as
DDd+hh:mm:SS.sss where DD=days, hh=hours, mm=minutes,
SS=sec, and sss=millisec. It "wraps" after 49.710 days.

Error 4976 [15] occurred at disk power-on lifetime: 7477 hours (311 days + 13 hours)
  When the command that caused the error occurred, the device was active or idle.

  After command completion occurred, registers were:
  ER -- ST COUNT  LBA_48  LH LM LL DV DC
  -- -- -- == -- == == == -- -- -- -- --
  40 -- 51 00 00 00 00 9a 00 54 36 00 00  Error: WP at LBA = 0x9a005436 = 2583712822

  Commands leading to the command that caused the error were:
  CR FEATR COUNT  LBA_48  LH LM LL DV DC  Powered_Up_Time  Command/Feature_Name
  -- == -- == -- == == == -- -- -- -- --  ---------------  --------------------
  61 00 00 00 08 00 00 55 00 60 80 40 00     04:10:32.719  WRITE FPDMA QUEUED
  61 00 00 00 08 00 00 dd 00 5e 78 40 00     04:10:32.718  WRITE FPDMA QUEUED
  61 00 00 00 10 00 00 38 00 03 b0 40 00     04:10:32.718  WRITE FPDMA QUEUED
  61 00 00 00 08 00 00 f1 00 62 30 40 00     04:10:32.718  WRITE FPDMA QUEUED
  61 00 00 00 08 00 00 dd 00 5e 88 40 00     04:10:32.717  WRITE FPDMA QUEUED

Error 4975 [14] occurred at disk power-on lifetime: 7477 hours (311 days + 13 hours)
  When the command that caused the error occurred, the device was active or idle.

  After command completion occurred, registers were:
  ER -- ST COUNT  LBA_48  LH LM LL DV DC
  -- -- -- == -- == == == -- -- -- -- --
  40 -- 51 00 00 00 00 9a 00 54 36 00 00  Error: WP at LBA = 0x9a005436 = 2583712822

  Commands leading to the command that caused the error were:
  CR FEATR COUNT  LBA_48  LH LM LL DV DC  Powered_Up_Time  Command/Feature_Name
  -- == -- == -- == == == -- -- -- -- --  ---------------  --------------------
  61 00 00 00 08 00 00 55 00 60 68 40 00     04:10:30.032  WRITE FPDMA QUEUED
  61 00 00 00 10 00 00 ea 00 62 58 40 00     04:10:30.031  WRITE FPDMA QUEUED
  61 00 00 00 08 00 00 48 00 03 80 40 00     04:10:30.031  WRITE FPDMA QUEUED
  61 00 00 00 08 00 00 e9 00 62 98 40 00     04:10:30.030  WRITE FPDMA QUEUED
  61 00 00 00 08 00 00 dd 00 5e 80 40 00     04:10:30.030  WRITE FPDMA QUEUED

Error 4974 [13] occurred at disk power-on lifetime: 7477 hours (311 days + 13 hours)
  When the command that caused the error occurred, the device was active or idle.

  After command completion occurred, registers were:
  ER -- ST COUNT  LBA_48  LH LM LL DV DC
  -- -- -- == -- == == == -- -- -- -- --
  40 -- 51 00 00 00 00 9a 00 54 36 00 00  Error: WP at LBA = 0x9a005436 = 2583712822

  Commands leading to the command that caused the error were:
  CR FEATR COUNT  LBA_48  LH LM LL DV DC  Powered_Up_Time  Command/Feature_Name
  -- == -- == -- == == == -- -- -- -- --  ---------------  --------------------
  61 00 00 00 08 00 00 e0 00 62 70 40 00     04:10:27.275  WRITE FPDMA QUEUED
  61 00 00 00 08 00 00 e0 00 62 30 40 00     04:10:27.275  WRITE FPDMA QUEUED
  61 00 00 00 08 00 00 de 00 62 e8 40 00     04:10:27.274  WRITE FPDMA QUEUED
  61 00 00 00 18 00 00 de 00 62 c0 40 00     04:10:27.274  WRITE FPDMA QUEUED
  61 00 00 00 08 00 00 dd 00 5e 88 40 00     04:10:27.273  WRITE FPDMA QUEUED

Error 4973 [12] occurred at disk power-on lifetime: 7477 hours (311 days + 13 hours)
  When the command that caused the error occurred, the device was active or idle.

  After command completion occurred, registers were:
  ER -- ST COUNT  LBA_48  LH LM LL DV DC
  -- -- -- == -- == == == -- -- -- -- --
  40 -- 51 00 00 00 00 9a 00 54 36 00 00  Error: WP at LBA = 0x9a005436 = 2583712822

  Commands leading to the command that caused the error were:
  CR FEATR COUNT  LBA_48  LH LM LL DV DC  Powered_Up_Time  Command/Feature_Name
  -- == -- == -- == == == -- -- -- -- --  ---------------  --------------------
  61 00 00 00 08 00 00 48 00 03 80 40 00     04:10:24.588  WRITE FPDMA QUEUED
  61 00 00 00 28 00 00 de 00 62 38 40 00     04:10:24.588  WRITE FPDMA QUEUED
  61 00 00 00 08 00 00 dd 00 5e 88 40 00     04:10:24.587  WRITE FPDMA QUEUED
  61 00 00 00 60 00 00 dd 00 62 d0 40 00     04:10:24.587  WRITE FPDMA QUEUED
  61 00 00 00 08 00 00 55 00 60 48 40 00     04:10:24.586  WRITE FPDMA QUEUED

Error 4972 [11] occurred at disk power-on lifetime: 7477 hours (311 days + 13 hours)
  When the command that caused the error occurred, the device was active or idle.

  After command completion occurred, registers were:
  ER -- ST COUNT  LBA_48  LH LM LL DV DC
  -- -- -- == -- == == == -- -- -- -- --
  40 -- 51 00 00 00 00 9a 00 54 36 00 00  Error: UNC at LBA = 0x9a005436 = 2583712822

  Commands leading to the command that caused the error were:
  CR FEATR COUNT  LBA_48  LH LM LL DV DC  Powered_Up_Time  Command/Feature_Name
  -- == -- == -- == == == -- -- -- -- --  ---------------  --------------------
  60 00 00 01 00 00 00 99 00 54 a0 40 00     04:10:16.576  READ FPDMA QUEUED
  60 00 00 01 00 00 00 9a 00 54 a0 40 00     04:10:16.576  READ FPDMA QUEUED
  60 00 00 01 00 00 00 9b 00 54 a0 40 00     04:10:16.576  READ FPDMA QUEUED
  60 00 00 01 00 00 00 9c 00 54 a0 40 00     04:10:16.576  READ FPDMA QUEUED
  60 00 00 01 00 00 00 9d 00 54 a0 40 00     04:10:16.575  READ FPDMA QUEUED

Error 4971 [10] occurred at disk power-on lifetime: 7477 hours (311 days + 13 hours)
  When the command that caused the error occurred, the device was active or idle.

  After command completion occurred, registers were:
  ER -- ST COUNT  LBA_48  LH LM LL DV DC
  -- -- -- == -- == == == -- -- -- -- --
  40 -- 51 00 00 00 00 9a 00 54 36 00 00  Error: UNC at LBA = 0x9a005436 = 2583712822

  Commands leading to the command that caused the error were:
  CR FEATR COUNT  LBA_48  LH LM LL DV DC  Powered_Up_Time  Command/Feature_Name
  -- == -- == -- == == == -- -- -- -- --  ---------------  --------------------
  60 00 00 01 00 00 00 9e 00 54 a0 40 00     04:10:13.961  READ FPDMA QUEUED
  60 00 00 01 00 00 00 9d 00 54 a0 40 00     04:10:13.961  READ FPDMA QUEUED
  60 00 00 01 00 00 00 9c 00 54 a0 40 00     04:10:13.960  READ FPDMA QUEUED
  60 00 00 01 00 00 00 9b 00 54 a0 40 00     04:10:13.960  READ FPDMA QUEUED
  60 00 00 01 00 00 00 9a 00 54 a0 40 00     04:10:13.960  READ FPDMA QUEUED

Error 4970 [9] occurred at disk power-on lifetime: 7438 hours (309 days + 22 hours)
  When the command that caused the error occurred, the device was active or idle.

  After command completion occurred, registers were:
  ER -- ST COUNT  LBA_48  LH LM LL DV DC
  -- -- -- == -- == == == -- -- -- -- --
  40 -- 51 00 00 00 00 9a 00 54 36 00 00  Error: UNC at LBA = 0x9a005436 = 2583712822

  Commands leading to the command that caused the error were:
  CR FEATR COUNT  LBA_48  LH LM LL DV DC  Powered_Up_Time  Command/Feature_Name
  -- == -- == -- == == == -- -- -- -- --  ---------------  --------------------
  60 00 00 00 40 00 00 9a 00 54 00 40 00     02:55:33.767  READ FPDMA QUEUED
  61 00 00 00 01 00 00 e4 00 05 b8 40 00     02:55:33.767  WRITE FPDMA QUEUED
  61 00 00 00 08 00 00 2e 00 47 08 40 00     02:55:33.767  WRITE FPDMA QUEUED
  61 00 00 01 00 00 00 2d 00 47 08 40 00     02:55:33.767  WRITE FPDMA QUEUED
  61 00 00 00 08 00 00 e0 00 5f a8 40 00     02:55:33.767  WRITE FPDMA QUEUED

Error 4969 [8] occurred at disk power-on lifetime: 7438 hours (309 days + 22 hours)
  When the command that caused the error occurred, the device was active or idle.

  After command completion occurred, registers were:
  ER -- ST COUNT  LBA_48  LH LM LL DV DC
  -- -- -- == -- == == == -- -- -- -- --
  40 -- 51 00 00 00 00 9a 00 54 36 00 00  Error: UNC at LBA = 0x9a005436 = 2583712822

  Commands leading to the command that caused the error were:
  CR FEATR COUNT  LBA_48  LH LM LL DV DC  Powered_Up_Time  Command/Feature_Name
  -- == -- == -- == == == -- -- -- -- --  ---------------  --------------------
  60 00 00 00 40 00 00 9a 00 54 00 40 00     02:55:31.094  READ FPDMA QUEUED
  61 00 00 00 20 00 00 cd 00 75 18 40 00     02:55:31.094  WRITE FPDMA QUEUED
  61 00 00 00 08 00 00 e0 00 5f a8 40 00     02:55:31.094  WRITE FPDMA QUEUED
  61 00 00 01 00 00 00 2d 00 47 08 40 00     02:55:31.093  WRITE FPDMA QUEUED
  61 00 00 00 08 00 00 2e 00 47 08 40 00     02:55:31.093  WRITE FPDMA QUEUED

SMART Extended Self-test Log Version: 1 (1 sectors)
Num  Test_Description    Status                  Remaining  LifeTime(hours)  LBA_of_first_error
# 1  Short offline       Completed without error       00%      5074         -
# 2  Short offline       Completed without error       00%      5074         -
# 3  Short offline       Completed without error       00%         3         -

SMART Selective self-test log data structure revision number 1
 SPAN  MIN_LBA  MAX_LBA  CURRENT_TEST_STATUS
    1        0        0  Not_testing
    2        0        0  Not_testing
    3        0        0  Not_testing
    4        0        0  Not_testing
    5        0        0  Not_testing
Selective self-test flags (0x0):
  After scanning selected spans, do NOT read-scan remainder of disk.
If Selective self-test is pending on power-up, resume after 0 minute delay.

SCT Status Version:                  3
SCT Version (vendor specific):       522 (0x020a)
Device State:                        Active (0)
Current Temperature:                    39 Celsius
Power Cycle Min/Max Temperature:     27/40 Celsius
Lifetime    Min/Max Temperature:      8/57 Celsius
Under/Over Temperature Limit Count:   0/437

SCT Temperature History Version:     2
Temperature Sampling Period:         1 minute
Temperature Logging Interval:        1 minute
Min/Max recommended Temperature:      0/ 0 Celsius
Min/Max Temperature Limit:            0/ 0 Celsius
Temperature History Size (Index):    128 (105)

SCT Error Recovery Control:
           Read: Disabled
          Write: Disabled

Device Statistics (GP/SMART Log 0x04) not supported

Pending Defects log (GP Log 0x0c) not supported

SATA Phy Event Counters (GP Log 0x11)
ID      Size     Value  Description
0x000a  2           15  Device-to-host register FISes sent due to a COMRESET
0x0001  2            0  Command failed due to ICRC error
0x0003  2            0  R_ERR response for device-to-host data FIS
0x0004  2            0  R_ERR response for host-to-device data FIS
0x0006  2            0  R_ERR response for device-to-host non-data FIS
0x0007  2            0  R_ERR response for host-to-device non-data FIS

