smartctl 7.3 2022-02-28 r5338 [FreeBSD 13.1-RELEASE-p3 amd64] (local build)
Copyright (C) 2002-22, Bruce Allen, Christian Franke, www.smartmontools.org

=== START OF INFORMATION SECTION ===
Model Family:     Seagate Laptop HDD
Device Model:     ST500LT012-1DG142
Serial Number:    --
LU WWN Device Id: 5 000c50 ...
Firmware Version: 1003YAM1
User Capacity:    500,107,862,016 bytes [500 GB]
Sector Sizes:     512 bytes logical, 4096 bytes physical
Rotation Rate:    5400 rpm
Form Factor:      2.5 inches
Device is:        In smartctl database 7.3/5319
ATA Version is:   ATA8-ACS T13/1699-D revision 4
SATA Version is:  SATA 3.0, 6.0 Gb/s (current: 6.0 Gb/s)
Local Time is:    Thu Nov 17 20:19:26 2022 CST
SMART support is: Available - device has SMART capability.
SMART support is: Enabled
AAM feature is:   Unavailable
APM level is:     128 (minimum power consumption without standby)
Rd look-ahead is: Enabled
Write cache is:   Enabled
DSN feature is:   Unavailable
ATA Security is:  Disabled, frozen [SEC2]
Wt Cache Reorder: Enabled

=== START OF READ SMART DATA SECTION ===
SMART overall-health self-assessment test result: PASSED

General SMART Values:
Offline data collection status:  (0x00)	Offline data collection activity
					was never started.
					Auto Offline Data Collection: Disabled.
Self-test execution status:      (   0)	The previous self-test routine completed
					without error or no self-test has ever 
					been run.
Total time to complete Offline 
data collection: 		(    0) seconds.
Offline data collection
capabilities: 			 (0x53) SMART execute Offline immediate.
					Auto Offline data collection on/off support.
					Suspend Offline collection upon new
					command.
					No Offline surface scan supported.
					Self-test supported.
					No Conveyance Self-test supported.
					Selective Self-test supported.
SMART capabilities:            (0x0003)	Saves SMART data before entering
					power-saving mode.
					Supports SMART auto save timer.
Error logging capability:        (0x01)	Error logging supported.
					General Purpose Logging supported.
Short self-test routine 
recommended polling time: 	 (   2) minutes.
Extended self-test routine
recommended polling time: 	 ( 104) minutes.
SCT capabilities: 	       (0x103d)	SCT Status supported.
					SCT Error Recovery Control supported.
					SCT Feature Control supported.
					SCT Data Table supported.

SMART Attributes Data Structure revision number: 10
Vendor Specific SMART Attributes with Thresholds:
ID# ATTRIBUTE_NAME          FLAGS    VALUE WORST THRESH FAIL RAW_VALUE
  1 Raw_Read_Error_Rate     POSR-K   085   079   006    -    174360815
  3 Spin_Up_Time            PO---K   099   099   000    -    0
  4 Start_Stop_Count        -O--CK   100   100   000    -    451
  5 Reallocated_Sector_Ct   PO--CK   086   086   036    -    2392
  7 Seek_Error_Rate         POSR-K   065   060   030    -    17194032125
  9 Power_On_Hours          -O--CK   100   100   000    -    323
 10 Spin_Retry_Count        PO--CK   100   100   097    -    0
 12 Power_Cycle_Count       -O--CK   100   100   000    -    413
183 Runtime_Bad_Block       -O--CK   100   100   000    -    0
184 End-to-End_Error        PO--CK   100   100   097    -    0
187 Reported_Uncorrect      -O--CK   001   001   000    -    4123
188 Command_Timeout         -O--CK   100   100   000    -    4295032834
189 High_Fly_Writes         -O-RCK   100   100   000    -    0
190 Airflow_Temperature_Cel -O---K   071   056   045    -    29 (Min/Max 29/31)
191 G-Sense_Error_Rate      -O--CK   100   100   000    -    71
192 Power-Off_Retract_Count -O---K   100   100   000    -    23
193 Load_Cycle_Count        -O--CK   096   096   000    -    8578
194 Temperature_Celsius     -O---K   029   044   000    -    29 (0 17 0 0 0)
196 Reallocated_Event_Count -O--CK   086   086   000    -    2392
197 Current_Pending_Sector  -O--CK   091   091   000    -    200
198 Offline_Uncorrectable   ----CK   100   100   000    -    0
199 UDMA_CRC_Error_Count    -O--CK   200   200   000    -    0
254 Free_Fall_Sensor        -O--CK   100   100   000    -    0
                            ||||||_ K auto-keep
                            |||||__ C event count
                            ||||___ R error rate
                            |||____ S speed/performance
                            ||_____ O updated online
                            |______ P prefailure warning

General Purpose Log Directory Version 1
SMART           Log Directory Version 1 [multi-sector log support]
Address    Access  R/W   Size  Description
0x00       GPL,SL  R/O      1  Log Directory
0x01           SL  R/O      1  Summary SMART error log
0x02           SL  R/O      5  Comprehensive SMART error log
0x03       GPL     R/O      5  Ext. Comprehensive SMART error log
0x06           SL  R/O      1  SMART self-test log
0x07       GPL     R/O      1  Extended self-test log
0x09           SL  R/W      1  Selective self-test log
0x10       GPL     R/O      1  NCQ Command Error log
0x11       GPL     R/O      1  SATA Phy Event Counters log
0x21       GPL     R/O      1  Write stream error log
0x22       GPL     R/O      1  Read stream error log
0x80-0x9f  GPL,SL  R/W     16  Host vendor specific log
0xa1       GPL,SL  VS      20  Device vendor specific log
0xa2       GPL     VS    2248  Device vendor specific log
0xa8       GPL,SL  VS      65  Device vendor specific log
0xa9       GPL,SL  VS       1  Device vendor specific log
0xab       GPL     VS       1  Device vendor specific log
0xb0       GPL     VS    2864  Device vendor specific log
0xb6       GPL     VS   16385  Device vendor specific log
0xbd-0xbf  GPL     VS   65535  Device vendor specific log
0xc0       GPL,SL  VS       1  Device vendor specific log
0xc1       GPL,SL  VS      10  Device vendor specific log
0xc3       GPL,SL  VS       8  Device vendor specific log
0xc4       GPL,SL  VS      18  Device vendor specific log
0xe0       GPL,SL  R/W      1  SCT Command/Status
0xe1       GPL,SL  R/W      1  SCT Data Transfer

SMART Extended Comprehensive Error Log Version: 1 (5 sectors)
Device Error Count: 5328 (device log contains only the most recent 20 errors)
	CR     = Command Register
	FEATR  = Features Register
	COUNT  = Count (was: Sector Count) Register
	LBA_48 = Upper bytes of LBA High/Mid/Low Registers ]  ATA-8
	LH     = LBA High (was: Cylinder High) Register    ]   LBA
	LM     = LBA Mid (was: Cylinder Low) Register      ] Register
	LL     = LBA Low (was: Sector Number) Register     ]
	DV     = Device (was: Device/Head) Register
	DC     = Device Control Register
	ER     = Error register
	ST     = Status register
Powered_Up_Time is measured from power on, and printed as
DDd+hh:mm:SS.sss where DD=days, hh=hours, mm=minutes,
SS=sec, and sss=millisec. It "wraps" after 49.710 days.

Error 5328 [7] occurred at disk power-on lifetime: 269 hours (11 days + 5 hours)
  When the command that caused the error occurred, the device was active or idle.

  After command completion occurred, registers were:
  ER -- ST COUNT  LBA_48  LH LM LL DV DC
  -- -- -- == -- == == == -- -- -- -- --
  40 -- 51 00 00 00 00 02 b5 58 70 00 00  Error: UNC at LBA = 0x02b55870 = 45439088

  Commands leading to the command that caused the error were:
  CR FEATR COUNT  LBA_48  LH LM LL DV DC  Powered_Up_Time  Command/Feature_Name
  -- == -- == -- == == == -- -- -- -- --  ---------------  --------------------
  60 00 00 00 08 00 00 02 b5 58 70 40 00     00:11:34.177  READ FPDMA QUEUED
  ef 00 90 00 03 00 00 00 00 00 00 a0 00     00:11:34.159  SET FEATURES [Disable SATA feature]
  ef 00 02 00 00 00 00 00 00 00 00 a0 00     00:11:34.134  SET FEATURES [Enable write cache]
  00 00 00 00 00 00 00 00 00 00 00 00 ff     00:11:34.072  NOP [Abort queued commands]
  61 00 00 00 08 00 00 00 68 19 00 40 00     00:11:04.647  WRITE FPDMA QUEUED

Error 5327 [6] occurred at disk power-on lifetime: 269 hours (11 days + 5 hours)
  When the command that caused the error occurred, the device was active or idle.

  After command completion occurred, registers were:
  ER -- ST COUNT  LBA_48  LH LM LL DV DC
  -- -- -- == -- == == == -- -- -- -- --
  40 -- 51 00 00 00 00 02 b5 58 70 00 00  Error: WP at LBA = 0x02b55870 = 45439088

  Commands leading to the command that caused the error were:
  CR FEATR COUNT  LBA_48  LH LM LL DV DC  Powered_Up_Time  Command/Feature_Name
  -- == -- == -- == == == -- -- -- -- --  ---------------  --------------------
  61 00 00 00 08 00 00 00 68 19 00 40 00     00:11:04.647  WRITE FPDMA QUEUED
  60 00 00 00 08 00 00 02 b5 58 70 40 00     00:11:04.646  READ FPDMA QUEUED
  61 00 00 00 08 00 00 00 68 20 20 40 00     00:11:04.646  WRITE FPDMA QUEUED
  2f 00 00 00 01 00 00 00 00 00 10 e0 00     00:11:04.646  READ LOG EXT
  60 00 00 00 08 00 00 02 b5 58 70 40 00     00:11:02.062  READ FPDMA QUEUED

Error 5326 [5] occurred at disk power-on lifetime: 269 hours (11 days + 5 hours)
  When the command that caused the error occurred, the device was active or idle.

  After command completion occurred, registers were:
  ER -- ST COUNT  LBA_48  LH LM LL DV DC
  -- -- -- == -- == == == -- -- -- -- --
  40 -- 51 00 00 00 00 02 b5 58 70 00 00  Error: UNC at LBA = 0x02b55870 = 45439088

  Commands leading to the command that caused the error were:
  CR FEATR COUNT  LBA_48  LH LM LL DV DC  Powered_Up_Time  Command/Feature_Name
  -- == -- == -- == == == -- -- -- -- --  ---------------  --------------------
  60 00 00 00 08 00 00 02 b5 58 70 40 00     00:11:02.062  READ FPDMA QUEUED
  60 00 00 00 08 00 00 02 b5 58 88 40 00     00:11:02.056  READ FPDMA QUEUED
  60 00 00 00 08 00 00 02 b5 58 80 40 00     00:11:01.914  READ FPDMA QUEUED
  2f 00 00 00 01 00 00 00 00 00 10 e0 00     00:11:01.913  READ LOG EXT
  60 00 00 00 08 00 00 02 b5 58 78 40 00     00:10:59.358  READ FPDMA QUEUED

Error 5325 [4] occurred at disk power-on lifetime: 269 hours (11 days + 5 hours)
  When the command that caused the error occurred, the device was active or idle.

  After command completion occurred, registers were:
  ER -- ST COUNT  LBA_48  LH LM LL DV DC
  -- -- -- == -- == == == -- -- -- -- --
  40 -- 51 00 00 00 00 02 b5 58 78 00 00  Error: UNC at LBA = 0x02b55878 = 45439096

  Commands leading to the command that caused the error were:
  CR FEATR COUNT  LBA_48  LH LM LL DV DC  Powered_Up_Time  Command/Feature_Name
  -- == -- == -- == == == -- -- -- -- --  ---------------  --------------------
  60 00 00 00 08 00 00 02 b5 58 78 40 00     00:10:59.358  READ FPDMA QUEUED
  61 00 00 00 08 00 00 00 6c 28 50 40 00     00:10:59.357  WRITE FPDMA QUEUED
  2f 00 00 00 01 00 00 00 00 00 10 e0 00     00:10:59.357  READ LOG EXT
  60 00 00 00 08 00 00 02 b5 58 78 40 00     00:10:56.883  READ FPDMA QUEUED
  2f 00 00 00 01 00 00 00 00 00 10 e0 00     00:10:56.882  READ LOG EXT

Error 5324 [3] occurred at disk power-on lifetime: 269 hours (11 days + 5 hours)
  When the command that caused the error occurred, the device was active or idle.

  After command completion occurred, registers were:
  ER -- ST COUNT  LBA_48  LH LM LL DV DC
  -- -- -- == -- == == == -- -- -- -- --
  40 -- 51 00 00 00 00 02 b5 58 78 00 00  Error: UNC at LBA = 0x02b55878 = 45439096

  Commands leading to the command that caused the error were:
  CR FEATR COUNT  LBA_48  LH LM LL DV DC  Powered_Up_Time  Command/Feature_Name
  -- == -- == -- == == == -- -- -- -- --  ---------------  --------------------
  60 00 00 00 08 00 00 02 b5 58 78 40 00     00:10:56.883  READ FPDMA QUEUED
  2f 00 00 00 01 00 00 00 00 00 10 e0 00     00:10:56.882  READ LOG EXT
  60 00 00 00 08 00 00 02 b5 58 70 40 00     00:10:54.443  READ FPDMA QUEUED
  2f 00 00 00 01 00 00 00 00 00 10 e0 00     00:10:54.443  READ LOG EXT
  60 00 00 00 08 00 00 02 b5 58 70 40 00     00:10:52.021  READ FPDMA QUEUED

Error 5323 [2] occurred at disk power-on lifetime: 269 hours (11 days + 5 hours)
  When the command that caused the error occurred, the device was active or idle.

  After command completion occurred, registers were:
  ER -- ST COUNT  LBA_48  LH LM LL DV DC
  -- -- -- == -- == == == -- -- -- -- --
  40 -- 51 00 00 00 00 02 b5 58 70 00 00  Error: UNC at LBA = 0x02b55870 = 45439088

  Commands leading to the command that caused the error were:
  CR FEATR COUNT  LBA_48  LH LM LL DV DC  Powered_Up_Time  Command/Feature_Name
  -- == -- == -- == == == -- -- -- -- --  ---------------  --------------------
  60 00 00 00 08 00 00 02 b5 58 70 40 00     00:10:54.443  READ FPDMA QUEUED
  2f 00 00 00 01 00 00 00 00 00 10 e0 00     00:10:54.443  READ LOG EXT
  60 00 00 00 08 00 00 02 b5 58 70 40 00     00:10:52.021  READ FPDMA QUEUED
  60 00 00 00 08 00 00 02 b5 58 68 40 00     00:10:52.020  READ FPDMA QUEUED
  60 00 00 00 08 00 00 02 b5 58 60 40 00     00:10:52.020  READ FPDMA QUEUED

Error 5322 [1] occurred at disk power-on lifetime: 269 hours (11 days + 5 hours)
  When the command that caused the error occurred, the device was active or idle.

  After command completion occurred, registers were:
  ER -- ST COUNT  LBA_48  LH LM LL DV DC
  -- -- -- == -- == == == -- -- -- -- --
  40 -- 51 00 00 00 00 02 b5 58 70 00 00  Error: UNC at LBA = 0x02b55870 = 45439088

  Commands leading to the command that caused the error were:
  CR FEATR COUNT  LBA_48  LH LM LL DV DC  Powered_Up_Time  Command/Feature_Name
  -- == -- == -- == == == -- -- -- -- --  ---------------  --------------------
  60 00 00 00 08 00 00 02 b5 58 70 40 00     00:10:52.021  READ FPDMA QUEUED
  60 00 00 00 08 00 00 02 b5 58 68 40 00     00:10:52.020  READ FPDMA QUEUED
  60 00 00 00 08 00 00 02 b5 58 60 40 00     00:10:52.020  READ FPDMA QUEUED
  60 00 00 00 08 00 00 02 b5 58 58 40 00     00:10:52.019  READ FPDMA QUEUED
  60 00 00 00 08 00 00 02 b5 58 50 40 00     00:10:52.019  READ FPDMA QUEUED

Error 5321 [0] occurred at disk power-on lifetime: 269 hours (11 days + 5 hours)
  When the command that caused the error occurred, the device was active or idle.

  After command completion occurred, registers were:
  ER -- ST COUNT  LBA_48  LH LM LL DV DC
  -- -- -- == -- == == == -- -- -- -- --
  40 -- 51 00 00 00 00 02 b5 58 70 00 00  Error: UNC at LBA = 0x02b55870 = 45439088

  Commands leading to the command that caused the error were:
  CR FEATR COUNT  LBA_48  LH LM LL DV DC  Powered_Up_Time  Command/Feature_Name
  -- == -- == -- == == == -- -- -- -- --  ---------------  --------------------
  60 00 00 00 da 00 00 02 b5 58 08 40 00     00:10:49.147  READ FPDMA QUEUED
  60 00 00 01 00 00 00 02 d9 fd 68 40 00     00:10:49.138  READ FPDMA QUEUED
  60 00 00 01 00 00 00 02 d9 fc 68 40 00     00:10:49.138  READ FPDMA QUEUED
  60 00 00 01 00 00 00 02 d9 fb 68 40 00     00:10:49.123  READ FPDMA QUEUED
  60 00 00 00 80 00 00 02 d4 db e0 40 00     00:10:49.120  READ FPDMA QUEUED

SMART Extended Self-test Log Version: 1 (1 sectors)
Num  Test_Description    Status                  Remaining  LifeTime(hours)  LBA_of_first_error
# 1  Short offline       Completed: read failure       90%       269         45439088
# 2  Short offline       Completed: read failure       90%       269         45439088
# 3  Short offline       Completed without error       00%       180         -
# 4  Short offline       Completed without error       00%       144         -
# 5  Short offline       Completed without error       00%        86         -
# 6  Short offline       Completed without error       00%        50         -
# 7  Short offline       Completed without error       00%        28         -
# 8  Short offline       Completed without error       00%        14         -

SMART Selective self-test log data structure revision number 1
 SPAN  MIN_LBA  MAX_LBA  CURRENT_TEST_STATUS
    1        0        0  Not_testing
    2        0        0  Not_testing
    3        0        0  Not_testing
    4        0        0  Not_testing
    5        0        0  Not_testing
Selective self-test flags (0x0):
  After scanning selected spans, do NOT read-scan remainder of disk.
If Selective self-test is pending on power-up, resume after 0 minute delay.

SCT Status Version:                  3
SCT Version (vendor specific):       522 (0x020a)
Device State:                        Active (0)
Current Temperature:                    29 Celsius
Power Cycle Min/Max Temperature:     28/32 Celsius
Lifetime    Min/Max Temperature:     17/44 Celsius
Under/Over Temperature Limit Count:   0/9

SCT Temperature History Version:     2
Temperature Sampling Period:         1 minute
Temperature Logging Interval:        30 minutes
Min/Max recommended Temperature:      0/ 0 Celsius
Min/Max Temperature Limit:            0/ 0 Celsius
Temperature History Size (Index):    128 (14)

SCT Error Recovery Control:
           Read: Disabled
          Write: Disabled

Device Statistics (GP/SMART Log 0x04) not supported

Pending Defects log (GP Log 0x0c) not supported

SATA Phy Event Counters (GP Log 0x11)
ID      Size     Value  Description
0x000a  2            4  Device-to-host register FISes sent due to a COMRESET
0x0001  2            0  Command failed due to ICRC error
0x0003  2            0  R_ERR response for device-to-host data FIS
0x0004  2            0  R_ERR response for host-to-device data FIS
0x0006  2            0  R_ERR response for device-to-host non-data FIS
0x0007  2            0  R_ERR response for host-to-device non-data FIS

