smartctl 7.3 2022-02-28 r5338 [FreeBSD 13.1-RELEASE-p6 amd64] (local build)
Copyright (C) 2002-22, Bruce Allen, Christian Franke, www.smartmontools.org

=== START OF INFORMATION SECTION ===
Model Family:     Seagate Barracuda 7200.12
Device Model:     ST31000524AS
Serial Number:    --
LU WWN Device Id: 5 000c50 ...
Firmware Version: HP63
User Capacity:    1,000,204,886,016 bytes [1.00 TB]
Sector Size:      512 bytes logical/physical
Rotation Rate:    7200 rpm
Device is:        In smartctl database 7.3/5319
ATA Version is:   ATA8-ACS T13/1699-D revision 4
SATA Version is:  SATA 3.0, 6.0 Gb/s (current: 3.0 Gb/s)
Local Time is:    Tue Mar  7 00:30:02 2023 EST
SMART support is: Available - device has SMART capability.
SMART support is: Enabled
AAM feature is:   Unavailable
APM feature is:   Unavailable
Rd look-ahead is: Enabled
Write cache is:   Enabled
DSN feature is:   Unavailable
ATA Security is:  Disabled, NOT FROZEN [SEC1]
Wt Cache Reorder: Unknown

=== START OF READ SMART DATA SECTION ===
SMART overall-health self-assessment test result: PASSED

General SMART Values:
Offline data collection status:  (0x82)	Offline data collection activity
					was completed without error.
					Auto Offline Data Collection: Enabled.
Self-test execution status:      (   0)	The previous self-test routine completed
					without error or no self-test has ever 
					been run.
Total time to complete Offline 
data collection: 		(  600) seconds.
Offline data collection
capabilities: 			 (0x5b) SMART execute Offline immediate.
					Auto Offline data collection on/off support.
					Suspend Offline collection upon new
					command.
					Offline surface scan supported.
					Self-test supported.
					No Conveyance Self-test supported.
					Selective Self-test supported.
SMART capabilities:            (0x0003)	Saves SMART data before entering
					power-saving mode.
					Supports SMART auto save timer.
Error logging capability:        (0x01)	Error logging supported.
					General Purpose Logging supported.
Short self-test routine 
recommended polling time: 	 (   2) minutes.
Extended self-test routine
recommended polling time: 	 ( 167) minutes.
SCT capabilities: 	       (0x103b)	SCT Status supported.
					SCT Error Recovery Control supported.
					SCT Feature Control supported.
					SCT Data Table supported.

SMART Attributes Data Structure revision number: 10
Vendor Specific SMART Attributes with Thresholds:
ID# ATTRIBUTE_NAME          FLAGS    VALUE WORST THRESH FAIL RAW_VALUE
  1 Raw_Read_Error_Rate     POSR-K   116   099   006    -    108711115
  3 Spin_Up_Time            PO---K   100   100   000    -    0
  4 Start_Stop_Count        -O--CK   094   094   020    -    6529
  5 Reallocated_Sector_Ct   PO--CK   086   086   036    -    611
  7 Seek_Error_Rate         POSR-K   089   060   030    -    882174471
  9 Power_On_Hours          -O--CK   044   044   000    -    49071
 10 Spin_Retry_Count        PO--CK   100   100   097    -    0
 12 Power_Cycle_Count       -O--CK   094   094   020    -    6528
180 Unknown_HDD_Attribute   PO-R-K   100   100   000    -    1282144130
183 Runtime_Bad_Block       -O--CK   097   097   000    -    3
184 End-to-End_Error        PO--CK   100   100   097    -    0
187 Reported_Uncorrect      -O--CK   089   089   000    -    11
188 Command_Timeout         -O--CK   100   097   000    -    8590196741
189 High_Fly_Writes         -O-RCK   097   097   000    -    3
190 Airflow_Temperature_Cel -O---K   074   062   045    -    26 (Min/Max 21/28)
194 Temperature_Celsius     -O---K   026   040   000    -    26 (0 10 0 0 0)
195 Hardware_ECC_Recovered  -O-RCK   029   020   000    -    108711115
196 Reallocated_Event_Count -O--CK   086   086   036    -    611
197 Current_Pending_Sector  -O--CK   085   085   000    -    647
198 Offline_Uncorrectable   ----CK   100   100   000    -    0
199 UDMA_CRC_Error_Count    -O--CK   200   200   000    -    0
                            ||||||_ K auto-keep
                            |||||__ C event count
                            ||||___ R error rate
                            |||____ S speed/performance
                            ||_____ O updated online
                            |______ P prefailure warning

General Purpose Log Directory Version 1
SMART           Log Directory Version 1 [multi-sector log support]
Address    Access  R/W   Size  Description
0x00       GPL,SL  R/O      1  Log Directory
0x01       GPL,SL  R/O      1  Summary SMART error log
0x02       GPL,SL  R/O      5  Comprehensive SMART error log
0x03       GPL     R/O      5  Ext. Comprehensive SMART error log
0x06       GPL,SL  R/O      1  SMART self-test log
0x07       GPL     R/O      1  Extended self-test log
0x09       GPL,SL  R/W      1  Selective self-test log
0x10       GPL     R/O      1  NCQ Command Error log
0x11       GPL     R/O      1  SATA Phy Event Counters log
0x21       GPL     R/O      1  Write stream error log
0x22       GPL     R/O      1  Read stream error log
0x80-0x9f  GPL,SL  R/W     16  Host vendor specific log
0xa1       GPL,SL  VS      20  Device vendor specific log
0xa2       GPL     VS    2248  Device vendor specific log
0xa8       GPL,SL  VS     129  Device vendor specific log
0xa9       GPL,SL  VS       1  Device vendor specific log
0xb0       GPL     VS    2928  Device vendor specific log
0xbd       GPL     VS     252  Device vendor specific log
0xbe-0xbf  GPL     VS   65535  Device vendor specific log
0xe0       GPL,SL  R/W      1  SCT Command/Status
0xe1       GPL,SL  R/W      1  SCT Data Transfer

SMART Extended Comprehensive Error Log Version: 1 (5 sectors)
Device Error Count: 3
	CR     = Command Register
	FEATR  = Features Register
	COUNT  = Count (was: Sector Count) Register
	LBA_48 = Upper bytes of LBA High/Mid/Low Registers ]  ATA-8
	LH     = LBA High (was: Cylinder High) Register    ]   LBA
	LM     = LBA Mid (was: Cylinder Low) Register      ] Register
	LL     = LBA Low (was: Sector Number) Register     ]
	DV     = Device (was: Device/Head) Register
	DC     = Device Control Register
	ER     = Error register
	ST     = Status register
Powered_Up_Time is measured from power on, and printed as
DDd+hh:mm:SS.sss where DD=days, hh=hours, mm=minutes,
SS=sec, and sss=millisec. It "wraps" after 49.710 days.

Error 3 [2] occurred at disk power-on lifetime: 48759 hours (2031 days + 15 hours)
  When the command that caused the error occurred, the device was active or idle.

  After command completion occurred, registers were:
  ER -- ST COUNT  LBA_48  LH LM LL DV DC
  -- -- -- == -- == == == -- -- -- -- --
  40 -- 51 00 00 00 00 3a 24 28 e8 00 00  Error: WP at LBA = 0x3a2428e8 = 975448296

  Commands leading to the command that caused the error were:
  CR FEATR COUNT  LBA_48  LH LM LL DV DC  Powered_Up_Time  Command/Feature_Name
  -- == -- == -- == == == -- -- -- -- --  ---------------  --------------------
  61 00 00 00 08 00 00 3a 14 08 00 40 00     00:01:11.878  WRITE FPDMA QUEUED
  60 00 00 00 08 00 00 3a 24 28 e8 40 00     00:01:11.878  READ FPDMA QUEUED
  ec 00 00 00 00 00 00 00 00 00 00 a0 00     00:01:11.877  IDENTIFY DEVICE
  ef 00 03 00 45 00 00 00 00 00 00 a0 00     00:01:11.876  SET FEATURES [Set transfer mode]
  ec 00 00 00 00 00 00 00 00 00 00 a0 00     00:01:11.855  IDENTIFY DEVICE

Error 2 [1] occurred at disk power-on lifetime: 48759 hours (2031 days + 15 hours)
  When the command that caused the error occurred, the device was active or idle.

  After command completion occurred, registers were:
  ER -- ST COUNT  LBA_48  LH LM LL DV DC
  -- -- -- == -- == == == -- -- -- -- --
  40 -- 51 00 00 00 00 3a 24 28 e8 00 00  Error: UNC at LBA = 0x3a2428e8 = 975448296

  Commands leading to the command that caused the error were:
  CR FEATR COUNT  LBA_48  LH LM LL DV DC  Powered_Up_Time  Command/Feature_Name
  -- == -- == -- == == == -- -- -- -- --  ---------------  --------------------
  60 00 00 00 08 00 00 3a 24 28 e8 40 00     00:01:09.039  READ FPDMA QUEUED
  ec 00 00 00 00 00 00 00 00 00 00 a0 00     00:01:09.038  IDENTIFY DEVICE
  ef 00 03 00 45 00 00 00 00 00 00 a0 00     00:01:09.037  SET FEATURES [Set transfer mode]
  ec 00 00 00 00 00 00 00 00 00 00 a0 00     00:01:08.996  IDENTIFY DEVICE
  47 00 00 00 01 00 00 00 00 00 10 a0 00     00:01:08.929  READ LOG DMA EXT

Error 1 [0] occurred at disk power-on lifetime: 48759 hours (2031 days + 15 hours)
  When the command that caused the error occurred, the device was active or idle.

  After command completion occurred, registers were:
  ER -- ST COUNT  LBA_48  LH LM LL DV DC
  -- -- -- == -- == == == -- -- -- -- --
  40 -- 51 00 00 00 00 3a 24 28 e8 00 00  Error: UNC at LBA = 0x3a2428e8 = 975448296

  Commands leading to the command that caused the error were:
  CR FEATR COUNT  LBA_48  LH LM LL DV DC  Powered_Up_Time  Command/Feature_Name
  -- == -- == -- == == == -- -- -- -- --  ---------------  --------------------
  60 00 00 00 08 00 00 3a 24 24 20 40 00     00:01:06.157  READ FPDMA QUEUED
  60 00 00 00 08 00 00 3a 24 23 d0 40 00     00:01:06.153  READ FPDMA QUEUED
  60 00 00 00 20 00 00 3a 14 08 00 40 00     00:01:06.144  READ FPDMA QUEUED
  60 00 00 00 08 00 00 3a 14 07 f8 40 00     00:01:06.114  READ FPDMA QUEUED
  60 00 00 00 08 00 00 00 10 2c b0 40 00     00:01:06.108  READ FPDMA QUEUED

SMART Extended Self-test Log Version: 1 (1 sectors)
Num  Test_Description    Status                  Remaining  LifeTime(hours)  LBA_of_first_error
# 1  Short offline       Interrupted (host reset)      90%      8324         -
# 2  Short offline       Interrupted (host reset)      90%      8322         -
# 3  Short offline       Completed without error       00%      8007         -
# 4  Short offline       Completed without error       00%      7853         -
# 5  Extended offline    Interrupted (host reset)      90%         0         -

SMART Selective self-test log data structure revision number 1
 SPAN  MIN_LBA  MAX_LBA  CURRENT_TEST_STATUS
    1        0        0  Not_testing
    2        0        0  Not_testing
    3        0        0  Not_testing
    4        0        0  Not_testing
    5        0        0  Not_testing
Selective self-test flags (0x0):
  After scanning selected spans, do NOT read-scan remainder of disk.
If Selective self-test is pending on power-up, resume after 0 minute delay.

SCT Status Version:                  3
SCT Version (vendor specific):       522 (0x020a)
Device State:                        Active (0)
Current Temperature:                    26 Celsius
Power Cycle Min/Max Temperature:     21/28 Celsius
Lifetime    Min/Max Temperature:     10/38 Celsius
Under/Over Temperature Limit Count:   0/0

SCT Temperature History Version:     2
Temperature Sampling Period:         1 minute
Temperature Logging Interval:        59 minutes
Min/Max recommended Temperature:     14/55 Celsius
Min/Max Temperature Limit:           10/60 Celsius
Temperature History Size (Index):    128 (64)

SCT Error Recovery Control:
           Read: Disabled
          Write: Disabled

Device Statistics (GP/SMART Log 0x04) not supported

Pending Defects log (GP Log 0x0c) not supported

SATA Phy Event Counters (GP Log 0x11)
ID      Size     Value  Description
0x000a  2           49  Device-to-host register FISes sent due to a COMRESET
0x0001  2            0  Command failed due to ICRC error
0x0003  2            0  R_ERR response for device-to-host data FIS
0x0004  2            0  R_ERR response for host-to-device data FIS
0x0006  2            0  R_ERR response for device-to-host non-data FIS
0x0007  2            0  R_ERR response for host-to-device non-data FIS

