smartctl 7.2 2020-12-30 r5155 [FreeBSD 12.2-STABLE amd64] (local build)
Copyright (C) 2002-20, Bruce Allen, Christian Franke, www.smartmontools.org

=== START OF INFORMATION SECTION ===
Model Family:     Western Digital Caviar Green
Device Model:     WDC WD10EADS-00L5B1
Serial Number:    --
LU WWN Device Id: 5 0014ee ...
Firmware Version: 01.01A01
User Capacity:    1,000,203,804,160 bytes [1.00 TB]
Sector Size:      512 bytes logical/physical
Device is:        In smartctl database [for details use: -P show]
ATA Version is:   ATA8-ACS (minor revision not indicated)
SATA Version is:  SATA 2.5, 3.0 Gb/s
Local Time is:    Sat Mar  6 13:08:36 2021 +05
SMART support is: Available - device has SMART capability.
SMART support is: Enabled
AAM feature is:   Disabled
APM feature is:   Unavailable
Rd look-ahead is: Enabled
Write cache is:   Enabled
DSN feature is:   Unavailable
ATA Security is:  Disabled, frozen [SEC2]
Wt Cache Reorder: Enabled

=== START OF READ SMART DATA SECTION ===
SMART overall-health self-assessment test result: PASSED

General SMART Values:
Offline data collection status:  (0x84)	Offline data collection activity
					was suspended by an interrupting command from host.
					Auto Offline Data Collection: Enabled.
Self-test execution status:      (   0)	The previous self-test routine completed
					without error or no self-test has ever 
					been run.
Total time to complete Offline 
data collection: 		(23400) seconds.
Offline data collection
capabilities: 			 (0x7b) SMART execute Offline immediate.
					Auto Offline data collection on/off support.
					Suspend Offline collection upon new
					command.
					Offline surface scan supported.
					Self-test supported.
					Conveyance Self-test supported.
					Selective Self-test supported.
SMART capabilities:            (0x0003)	Saves SMART data before entering
					power-saving mode.
					Supports SMART auto save timer.
Error logging capability:        (0x01)	Error logging supported.
					General Purpose Logging supported.
Short self-test routine 
recommended polling time: 	 (   2) minutes.
Extended self-test routine
recommended polling time: 	 ( 268) minutes.
Conveyance self-test routine
recommended polling time: 	 (   5) minutes.
SCT capabilities: 	       (0x303f)	SCT Status supported.
					SCT Error Recovery Control supported.
					SCT Feature Control supported.
					SCT Data Table supported.

SMART Attributes Data Structure revision number: 16
Vendor Specific SMART Attributes with Thresholds:
ID# ATTRIBUTE_NAME          FLAGS    VALUE WORST THRESH FAIL RAW_VALUE
  1 Raw_Read_Error_Rate     POSR-K   200   200   051    -    0
  3 Spin_Up_Time            POS--K   159   153   021    -    7041
  4 Start_Stop_Count        -O--CK   082   082   000    -    18354
  5 Reallocated_Sector_Ct   PO--CK   200   200   140    -    0
  7 Seek_Error_Rate         -OSR-K   100   253   000    -    0
  9 Power_On_Hours          -O--CK   001   001   000    -    85458
 10 Spin_Retry_Count        -O--CK   100   100   000    -    0
 11 Calibration_Retry_Count -O--CK   100   100   000    -    0
 12 Power_Cycle_Count       -O--CK   098   098   000    -    2447
192 Power-Off_Retract_Count -O--CK   200   200   000    -    171
193 Load_Cycle_Count        -O--CK   194   194   000    -    18348
194 Temperature_Celsius     -O---K   111   084   000    -    39
196 Reallocated_Event_Count -O--CK   200   200   000    -    0
197 Current_Pending_Sector  -O--CK   200   200   000    -    0
198 Offline_Uncorrectable   ----CK   200   200   000    -    0
199 UDMA_CRC_Error_Count    -O--CK   200   200   000    -    0
200 Multi_Zone_Error_Rate   ---R--   200   200   000    -    0
                            ||||||_ K auto-keep
                            |||||__ C event count
                            ||||___ R error rate
                            |||____ S speed/performance
                            ||_____ O updated online
                            |______ P prefailure warning

General Purpose Log Directory Version 1
SMART           Log Directory Version 1 [multi-sector log support]
Address    Access  R/W   Size  Description
0x00       GPL,SL  R/O      1  Log Directory
0x01           SL  R/O      1  Summary SMART error log
0x02           SL  R/O      5  Comprehensive SMART error log
0x03       GPL     R/O      6  Ext. Comprehensive SMART error log
0x06           SL  R/O      1  SMART self-test log
0x07       GPL     R/O      1  Extended self-test log
0x09           SL  R/W      1  Selective self-test log
0x10       GPL     R/O      1  NCQ Command Error log
0x11       GPL     R/O      1  SATA Phy Event Counters log
0x80-0x9f  GPL,SL  R/W     16  Host vendor specific log
0xa0-0xa7  GPL,SL  VS      16  Device vendor specific log
0xa8-0xb7  GPL,SL  VS       1  Device vendor specific log
0xc0       GPL,SL  VS       1  Device vendor specific log
0xc1       GPL     VS      24  Device vendor specific log
0xe0       GPL,SL  R/W      1  SCT Command/Status
0xe1       GPL,SL  R/W      1  SCT Data Transfer

SMART Extended Comprehensive Error Log Version: 1 (6 sectors)
Device Error Count: 28 (device log contains only the most recent 24 errors)
	CR     = Command Register
	FEATR  = Features Register
	COUNT  = Count (was: Sector Count) Register
	LBA_48 = Upper bytes of LBA High/Mid/Low Registers ]  ATA-8
	LH     = LBA High (was: Cylinder High) Register    ]   LBA
	LM     = LBA Mid (was: Cylinder Low) Register      ] Register
	LL     = LBA Low (was: Sector Number) Register     ]
	DV     = Device (was: Device/Head) Register
	DC     = Device Control Register
	ER     = Error register
	ST     = Status register
Powered_Up_Time is measured from power on, and printed as
DDd+hh:mm:SS.sss where DD=days, hh=hours, mm=minutes,
SS=sec, and sss=millisec. It "wraps" after 49.710 days.

Error 28 [3] occurred at disk power-on lifetime: 42693 hours (1778 days + 21 hours)
  When the command that caused the error occurred, the device was active or idle.

  After command completion occurred, registers were:
  ER -- ST COUNT  LBA_48  LH LM LL DV DC
  -- -- -- == -- == == == -- -- -- -- --
  04 -- 53 00 10 00 00 00 00 00 00 a0 00  Error: ABRT

  Commands leading to the command that caused the error were:
  CR FEATR COUNT  LBA_48  LH LM LL DV DC  Powered_Up_Time  Command/Feature_Name
  -- == -- == -- == == == -- -- -- -- --  ---------------  --------------------
  b0 00 d6 00 01 00 c2 00 4f 00 e0 a0 00     01:00:10.849  SMART WRITE LOG
  ec 00 00 00 00 00 00 00 00 00 00 a0 00     01:00:10.848  IDENTIFY DEVICE
  61 00 08 00 50 00 5b 00 1f 00 10 40 00     01:00:09.448  WRITE FPDMA QUEUED
  ea 00 00 00 00 00 00 00 00 00 00 e0 00     01:00:09.431  FLUSH CACHE EXT
  61 00 08 00 40 00 5b 00 1f 00 98 40 00     01:00:09.430  WRITE FPDMA QUEUED

Error 27 [2] occurred at disk power-on lifetime: 42693 hours (1778 days + 21 hours)
  When the command that caused the error occurred, the device was active or idle.

  After command completion occurred, registers were:
  ER -- ST COUNT  LBA_48  LH LM LL DV DC
  -- -- -- == -- == == == -- -- -- -- --
  04 -- 53 00 10 00 00 00 00 00 00 a0 00  Error: ABRT

  Commands leading to the command that caused the error were:
  CR FEATR COUNT  LBA_48  LH LM LL DV DC  Powered_Up_Time  Command/Feature_Name
  -- == -- == -- == == == -- -- -- -- --  ---------------  --------------------
  b0 00 d6 00 01 00 c2 00 4f 00 e0 a0 00     00:59:58.512  SMART WRITE LOG
  ec 00 00 00 00 00 00 00 00 00 00 a0 00     00:59:58.510  IDENTIFY DEVICE
  61 00 08 00 f8 00 5b 00 1f 00 10 40 00     00:59:49.378  WRITE FPDMA QUEUED
  ea 00 00 00 00 00 00 00 00 00 00 e0 00     00:59:49.359  FLUSH CACHE EXT
  61 00 08 00 e8 00 5b 00 1f 00 98 40 00     00:59:49.359  WRITE FPDMA QUEUED

Error 26 [1] occurred at disk power-on lifetime: 42693 hours (1778 days + 21 hours)
  When the command that caused the error occurred, the device was active or idle.

  After command completion occurred, registers were:
  ER -- ST COUNT  LBA_48  LH LM LL DV DC
  -- -- -- == -- == == == -- -- -- -- --
  04 -- 53 00 10 00 00 00 00 00 00 a0 00  Error: ABRT

  Commands leading to the command that caused the error were:
  CR FEATR COUNT  LBA_48  LH LM LL DV DC  Powered_Up_Time  Command/Feature_Name
  -- == -- == -- == == == -- -- -- -- --  ---------------  --------------------
  b0 00 d6 00 01 00 c2 00 4f 00 e0 a0 00     00:59:34.261  SMART WRITE LOG
  ec 00 00 00 00 00 00 00 00 00 00 a0 00     00:59:34.260  IDENTIFY DEVICE
  61 00 08 00 a8 00 5b 00 1f 00 10 40 00     00:59:29.342  WRITE FPDMA QUEUED
  ea 00 00 00 00 00 00 00 00 00 00 e0 00     00:59:29.324  FLUSH CACHE EXT
  61 00 08 00 98 00 5b 00 1f 00 98 40 00     00:59:29.323  WRITE FPDMA QUEUED

Error 25 [0] occurred at disk power-on lifetime: 42693 hours (1778 days + 21 hours)
  When the command that caused the error occurred, the device was active or idle.

  After command completion occurred, registers were:
  ER -- ST COUNT  LBA_48  LH LM LL DV DC
  -- -- -- == -- == == == -- -- -- -- --
  04 -- 53 00 10 00 00 00 00 00 00 a0 00  Error: ABRT

  Commands leading to the command that caused the error were:
  CR FEATR COUNT  LBA_48  LH LM LL DV DC  Powered_Up_Time  Command/Feature_Name
  -- == -- == -- == == == -- -- -- -- --  ---------------  --------------------
  b0 00 d6 00 01 00 c2 00 4f 00 e0 a0 00     00:59:21.586  SMART WRITE LOG
  ec 00 00 00 00 00 00 00 00 00 00 a0 00     00:59:21.585  IDENTIFY DEVICE
  61 00 32 00 78 00 86 00 69 02 18 40 00     00:59:20.883  WRITE FPDMA QUEUED
  61 01 00 00 70 00 86 00 68 02 18 40 00     00:59:20.883  WRITE FPDMA QUEUED
  61 01 00 00 68 00 86 00 67 02 18 40 00     00:59:20.882  WRITE FPDMA QUEUED

Error 24 [23] occurred at disk power-on lifetime: 42693 hours (1778 days + 21 hours)
  When the command that caused the error occurred, the device was active or idle.

  After command completion occurred, registers were:
  ER -- ST COUNT  LBA_48  LH LM LL DV DC
  -- -- -- == -- == == == -- -- -- -- --
  04 -- 53 00 10 00 00 00 00 00 00 a0 00  Error: ABRT

  Commands leading to the command that caused the error were:
  CR FEATR COUNT  LBA_48  LH LM LL DV DC  Powered_Up_Time  Command/Feature_Name
  -- == -- == -- == == == -- -- -- -- --  ---------------  --------------------
  b0 00 d6 00 01 00 c2 00 4f 00 e0 a0 00     00:59:19.869  SMART WRITE LOG
  ec 00 00 00 00 00 00 00 00 00 00 a0 00     00:59:19.868  IDENTIFY DEVICE
  61 00 08 00 40 00 5b 00 1f 00 08 40 00     00:59:19.285  WRITE FPDMA QUEUED
  ea 00 00 00 00 00 00 00 00 00 00 e0 00     00:59:19.274  FLUSH CACHE EXT
  61 00 08 00 30 00 5b 00 1f 00 18 40 00     00:59:19.274  WRITE FPDMA QUEUED

Error 23 [22] occurred at disk power-on lifetime: 42693 hours (1778 days + 21 hours)
  When the command that caused the error occurred, the device was active or idle.

  After command completion occurred, registers were:
  ER -- ST COUNT  LBA_48  LH LM LL DV DC
  -- -- -- == -- == == == -- -- -- -- --
  04 -- 53 00 10 00 00 00 00 00 00 a0 00  Error: ABRT

  Commands leading to the command that caused the error were:
  CR FEATR COUNT  LBA_48  LH LM LL DV DC  Powered_Up_Time  Command/Feature_Name
  -- == -- == -- == == == -- -- -- -- --  ---------------  --------------------
  b0 00 d6 00 01 00 c2 00 4f 00 e0 a0 00     00:59:15.403  SMART WRITE LOG
  61 00 08 00 70 00 5b 00 1f 00 98 40 00     00:59:15.403  WRITE FPDMA QUEUED
  ec 00 00 00 00 00 00 00 00 00 00 a0 00     00:59:15.402  IDENTIFY DEVICE
  61 00 62 00 60 00 44 00 31 00 b8 40 00     00:59:15.064  WRITE FPDMA QUEUED
  61 01 00 00 58 00 44 00 30 00 b8 40 00     00:59:15.064  WRITE FPDMA QUEUED

Error 22 [21] occurred at disk power-on lifetime: 33904 hours (1412 days + 16 hours)
  When the command that caused the error occurred, the device was active or idle.

  After command completion occurred, registers were:
  ER -- ST COUNT  LBA_48  LH LM LL DV DC
  -- -- -- == -- == == == -- -- -- -- --
  04 -- 53 00 10 00 00 00 00 00 00 a0 00  Error: ABRT

  Commands leading to the command that caused the error were:
  CR FEATR COUNT  LBA_48  LH LM LL DV DC  Powered_Up_Time  Command/Feature_Name
  -- == -- == -- == == == -- -- -- -- --  ---------------  --------------------
  b0 00 d6 00 01 00 c2 00 4f 00 e0 a0 00     10:31:31.769  SMART WRITE LOG
  ec 00 00 00 00 00 00 00 00 00 00 a0 00     10:31:31.769  IDENTIFY DEVICE
  60 01 00 00 d0 00 94 00 fb 51 10 40 00     10:31:31.601  READ FPDMA QUEUED
  60 01 00 00 c8 00 3f 00 8f 1e 40 40 00     10:31:31.050  READ FPDMA QUEUED
  60 01 00 00 c0 00 39 00 80 1e 40 40 00     10:31:30.934  READ FPDMA QUEUED

Error 21 [20] occurred at disk power-on lifetime: 33904 hours (1412 days + 16 hours)
  When the command that caused the error occurred, the device was active or idle.

  After command completion occurred, registers were:
  ER -- ST COUNT  LBA_48  LH LM LL DV DC
  -- -- -- == -- == == == -- -- -- -- --
  04 -- 53 00 10 00 00 00 00 00 00 a0 00  Error: ABRT

  Commands leading to the command that caused the error were:
  CR FEATR COUNT  LBA_48  LH LM LL DV DC  Powered_Up_Time  Command/Feature_Name
  -- == -- == -- == == == -- -- -- -- --  ---------------  --------------------
  b0 00 d6 00 01 00 c2 00 4f 00 e0 a0 00     10:31:17.505  SMART WRITE LOG
  ec 00 00 00 00 00 00 00 00 00 00 a0 00     10:31:17.505  IDENTIFY DEVICE
  60 01 00 00 58 00 92 00 99 51 10 40 00     10:31:17.369  READ FPDMA QUEUED
  60 01 00 00 50 00 b6 00 7b 51 10 40 00     10:31:17.159  READ FPDMA QUEUED
  60 01 00 00 48 00 ae 00 db 54 28 40 00     10:31:17.072  READ FPDMA QUEUED

SMART Extended Self-test Log Version: 1 (1 sectors)
No self-tests have been logged.  [To run self-tests, use: smartctl -t]

SMART Selective self-test log data structure revision number 1
 SPAN  MIN_LBA  MAX_LBA  CURRENT_TEST_STATUS
    1        0        0  Not_testing
    2        0        0  Not_testing
    3        0        0  Not_testing
    4        0        0  Not_testing
    5        0        0  Not_testing
Selective self-test flags (0x0):
  After scanning selected spans, do NOT read-scan remainder of disk.
If Selective self-test is pending on power-up, resume after 0 minute delay.

SCT Status Version:                  2
SCT Version (vendor specific):       258 (0x0102)
Device State:                        Unknown (18)
Current Temperature:                    39 Celsius
Power Cycle Min/Max Temperature:     20/41 Celsius
Lifetime    Min/Max Temperature:      ?/66 Celsius
Under/Over Temperature Limit Count:   0/0

SCT Temperature History Version:     2
Temperature Sampling Period:         1 minute
Temperature Logging Interval:        1 minute
Min/Max recommended Temperature:      0/60 Celsius
Min/Max Temperature Limit:           -41/85 Celsius
Temperature History Size (Index):    478 (272)

SCT Error Recovery Control:
           Read: Disabled
          Write: Disabled

Device Statistics (GP/SMART Log 0x04) not supported

Pending Defects log (GP Log 0x0c) not supported

SATA Phy Event Counters (GP Log 0x11)
ID      Size     Value  Description
0x0001  2            0  Command failed due to ICRC error
0x0002  2            0  R_ERR response for data FIS
0x0003  2            0  R_ERR response for device-to-host data FIS
0x0004  2            0  R_ERR response for host-to-device data FIS
0x0005  2            0  R_ERR response for non-data FIS
0x0006  2            0  R_ERR response for device-to-host non-data FIS
0x0007  2            0  R_ERR response for host-to-device non-data FIS
0x000a  2           39  Device-to-host register FISes sent due to a COMRESET
0x8000  4       608460  Vendor specific



