smartctl 7.2 2020-12-30 r5155 [FreeBSD 12.1-RELEASE-p14-HBSD amd64] (local build)
Copyright (C) 2002-20, Bruce Allen, Christian Franke, www.smartmontools.org

=== START OF INFORMATION SECTION ===
Device Model:     HFS256G3AMNB-2200A
Serial Number:    --
Firmware Version: 10105L00
User Capacity:    256,060,514,304 bytes [256 GB]
Sector Size:      512 bytes logical/physical
Rotation Rate:    Solid State Device
TRIM Command:     Available
Device is:        Not in smartctl database [for details use: -P showall]
ATA Version is:   ATA8-ACS (minor revision not indicated)
SATA Version is:  SATA 3.1, 6.0 Gb/s (current: 6.0 Gb/s)
Local Time is:    Tue Mar 30 16:08:24 2021 PDT
SMART support is: Available - device has SMART capability.
SMART support is: Enabled
AAM feature is:   Unavailable
APM feature is:   Disabled
Rd look-ahead is: Enabled
Write cache is:   Enabled
DSN feature is:   Unavailable
ATA Security is:  Disabled, frozen [SEC2]
Wt Cache Reorder: Unavailable

=== START OF READ SMART DATA SECTION ===
SMART overall-health self-assessment test result: PASSED

General SMART Values:
Offline data collection status:  (0x00)	Offline data collection activity
					was never started.
					Auto Offline Data Collection: Disabled.
Self-test execution status:      (   0)	The previous self-test routine completed
					without error or no self-test has ever 
					been run.
Total time to complete Offline 
data collection: 		(    0) seconds.
Offline data collection
capabilities: 			 (0x19) SMART execute Offline immediate.
					No Auto Offline data collection support.
					Suspend Offline collection upon new
					command.
					Offline surface scan supported.
					Self-test supported.
					No Conveyance Self-test supported.
					No Selective Self-test supported.
SMART capabilities:            (0x0002)	Does not save SMART data before
					entering power-saving mode.
					Supports SMART auto save timer.
Error logging capability:        (0x01)	Error logging supported.
					General Purpose Logging supported.
Short self-test routine 
recommended polling time: 	 (   1) minutes.
Extended self-test routine
recommended polling time: 	 (  60) minutes.

SMART Attributes Data Structure revision number: 0
Vendor Specific SMART Attributes with Thresholds:
ID# ATTRIBUTE_NAME          FLAGS    VALUE WORST THRESH FAIL RAW_VALUE
  1 Raw_Read_Error_Rate     POSR--   166   166   006    -    0
  5 Reallocated_Sector_Ct   -O--CK   253   253   036    -    0
  9 Power_On_Hours          -O--CK   084   084   000    -    14404
 12 Power_Cycle_Count       -O--CK   100   100   020    -    126
100 Unknown_Attribute       -O--CK   100   100   000    -    15325708
171 Unknown_Attribute       -O--CK   253   253   000    -    0
172 Unknown_Attribute       -O--CK   253   100   000    -    0
174 Unknown_Attribute       ----CK   100   100   000    -    102
175 Program_Fail_Count_Chip -O--CK   253   253   000    -    0
176 Erase_Fail_Count_Chip   -O--CK   253   253   000    -    0
177 Wear_Leveling_Count     -O--CK   100   100   000    -    14376064
178 Used_Rsvd_Blk_Cnt_Chip  -O--CK   100   100   000    -    19
179 Used_Rsvd_Blk_Cnt_Tot   -O--CK   100   100   000    -    123
180 Unused_Rsvd_Blk_Cnt_Tot -O--CK   100   100   000    -    5189
181 Program_Fail_Cnt_Total  -O--CK   253   253   000    -    0
182 Erase_Fail_Count_Total  -O--CK   253   100   000    -    0
187 Reported_Uncorrect      -O--CK   100   100   000    -    325
194 Temperature_Celsius     -O----   039   000   000    -    39 (Min/Max 23/49)
195 Hardware_ECC_Recovered  -O--CK   100   100   000    -    248125108
201 Unknown_SSD_Attribute   -OSR--   100   100   000    -    0
204 Soft_ECC_Correction     -OSR--   001   001   000    -    11510
231 Unknown_SSD_Attribute   PO--CK   253   253   010    -    1
234 Unknown_Attribute       -O--CK   100   100   ---    -    55992
241 Total_LBAs_Written      -O--CK   100   100   ---    -    52847
242 Total_LBAs_Read         -O--CK   100   100   ---    -    38452
250 Read_Error_Retry_Rate   -O--CK   100   100   ---    -    2343016
                            ||||||_ K auto-keep
                            |||||__ C event count
                            ||||___ R error rate
                            |||____ S speed/performance
                            ||_____ O updated online
                            |______ P prefailure warning

General Purpose Log Directory Version 1
SMART           Log Directory Version 1 [multi-sector log support]
Address    Access  R/W   Size  Description
0x00       GPL,SL  R/O      1  Log Directory
0x01           SL  R/O      1  Summary SMART error log
0x02           SL  R/O      4  Comprehensive SMART error log
0x03       GPL     R/O      5  Ext. Comprehensive SMART error log
0x04       GPL,SL  R/O      8  Device Statistics log
0x06           SL  R/O      1  SMART self-test log
0x07       GPL     R/O      2  Extended self-test log
0x10       GPL     R/O      1  NCQ Command Error log
0x11       GPL     R/O      1  SATA Phy Event Counters log
0x80-0x9f  GPL,SL  R/W     16  Host vendor specific log

SMART Extended Comprehensive Error Log Version: 1 (5 sectors)
Device Error Count: 1923 (device log contains only the most recent 20 errors)
	CR     = Command Register
	FEATR  = Features Register
	COUNT  = Count (was: Sector Count) Register
	LBA_48 = Upper bytes of LBA High/Mid/Low Registers ]  ATA-8
	LH     = LBA High (was: Cylinder High) Register    ]   LBA
	LM     = LBA Mid (was: Cylinder Low) Register      ] Register
	LL     = LBA Low (was: Sector Number) Register     ]
	DV     = Device (was: Device/Head) Register
	DC     = Device Control Register
	ER     = Error register
	ST     = Status register
Powered_Up_Time is measured from power on, and printed as
DDd+hh:mm:SS.sss where DD=days, hh=hours, mm=minutes,
SS=sec, and sss=millisec. It "wraps" after 49.710 days.

Error 1923 [2] occurred at disk power-on lifetime: 14373 hours (598 days + 21 hours)
  When the command that caused the error occurred, the device was in an unknown state.

  After command completion occurred, registers were:
  ER -- ST COUNT  LBA_48  LH LM LL DV DC
  -- -- -- == -- == == == -- -- -- -- --
  01 -- 50 00 01 00 00 00 00 00 01 00 00

  Commands leading to the command that caused the error were:
  CR FEATR COUNT  LBA_48  LH LM LL DV DC  Powered_Up_Time  Command/Feature_Name
  -- == -- == -- == == == -- -- -- -- --  ---------------  --------------------
  00 00 00 00 00 00 00 00 00 00 00 00 00     00:00:35.960  NOP [Abort queued commands]
  00 00 00 00 00 00 00 00 00 00 00 00 00     00:00:35.960  NOP [Abort queued commands]
  25 00 00 00 08 00 00 19 7a 2b f0 e0 e0     00:00:29.310  READ DMA EXT
  25 00 00 00 20 00 00 19 79 8f 48 e0 e0     00:00:29.310  READ DMA EXT
  25 00 00 00 20 00 00 19 79 8f 28 e0 e0     00:00:29.310  READ DMA EXT

Error 1922 [1] occurred at disk power-on lifetime: 14373 hours (598 days + 21 hours)
  When the command that caused the error occurred, the device was in an unknown state.

  After command completion occurred, registers were:
  ER -- ST COUNT  LBA_48  LH LM LL DV DC
  -- -- -- == -- == == == -- -- -- -- --
  00 -- 00 00 00 00 00 00 00 00 00 00 ff   at LBA = 0x00000000 = 0

  Commands leading to the command that caused the error were:
  CR FEATR COUNT  LBA_48  LH LM LL DV DC  Powered_Up_Time  Command/Feature_Name
  -- == -- == -- == == == -- -- -- -- --  ---------------  --------------------
  25 00 00 00 08 00 00 19 7a 2b f0 e0 e0     00:00:29.310  READ DMA EXT
  25 00 00 00 20 00 00 19 79 8f 48 e0 e0     00:00:29.310  READ DMA EXT
  25 00 00 00 20 00 00 19 79 8f 28 e0 e0     00:00:29.310  READ DMA EXT
  25 00 00 00 08 00 00 19 7a 2b e8 e0 e0     00:00:29.300  READ DMA EXT
  25 00 00 00 20 00 00 19 79 8f 48 e0 e0     00:00:29.300  READ DMA EXT

Error 1921 [0] occurred at disk power-on lifetime: 14373 hours (598 days + 21 hours)
  When the command that caused the error occurred, the device was in an unknown state.

  After command completion occurred, registers were:
  ER -- ST COUNT  LBA_48  LH LM LL DV DC
  -- -- -- == -- == == == -- -- -- -- --
  00 -- 00 00 00 00 00 00 00 00 00 00 ff   at LBA = 0x00000000 = 0

  Commands leading to the command that caused the error were:
  CR FEATR COUNT  LBA_48  LH LM LL DV DC  Powered_Up_Time  Command/Feature_Name
  -- == -- == -- == == == -- -- -- -- --  ---------------  --------------------
  25 00 00 00 08 00 00 19 7a 2b f0 e0 e0     00:00:29.310  READ DMA EXT
  25 00 00 00 20 00 00 19 79 8f 48 e0 e0     00:00:29.310  READ DMA EXT
  25 00 00 00 20 00 00 19 79 8f 28 e0 e0     00:00:29.310  READ DMA EXT
  25 00 00 00 08 00 00 19 7a 2b e8 e0 e0     00:00:29.300  READ DMA EXT
  25 00 00 00 20 00 00 19 79 8f 48 e0 e0     00:00:29.300  READ DMA EXT

Error 1920 [19] occurred at disk power-on lifetime: 14373 hours (598 days + 21 hours)
  When the command that caused the error occurred, the device was in an unknown state.

  After command completion occurred, registers were:
  ER -- ST COUNT  LBA_48  LH LM LL DV DC
  -- -- -- == -- == == == -- -- -- -- --
  00 -- 00 00 00 00 00 00 00 00 00 00 ff

  Commands leading to the command that caused the error were:
  CR FEATR COUNT  LBA_48  LH LM LL DV DC  Powered_Up_Time  Command/Feature_Name
  -- == -- == -- == == == -- -- -- -- --  ---------------  --------------------
  ef 00 90 00 06 00 00 00 00 00 00 00 00     00:00:00.000  SET FEATURES [Disable SATA feature]
  ec 00 00 00 00 00 00 00 00 00 00 00 00     00:00:00.000  IDENTIFY DEVICE

Error 1919 [18] occurred at disk power-on lifetime: 14373 hours (598 days + 21 hours)
  When the command that caused the error occurred, the device was in an unknown state.

  After command completion occurred, registers were:
  ER -- ST COUNT  LBA_48  LH LM LL DV DC
  -- -- -- == -- == == == -- -- -- -- --
  00 -- 00 00 00 00 00 00 00 00 00 00 ff

  Commands leading to the command that caused the error were:
  CR FEATR COUNT  LBA_48  LH LM LL DV DC  Powered_Up_Time  Command/Feature_Name
  -- == -- == -- == == == -- -- -- -- --  ---------------  --------------------
  ef 00 90 00 06 00 00 00 00 00 00 00 00     00:00:00.000  SET FEATURES [Disable SATA feature]
  ec 00 00 00 00 00 00 00 00 00 00 00 00     00:00:00.000  IDENTIFY DEVICE

Error 1918 [17] occurred at disk power-on lifetime: 14163 hours (590 days + 3 hours)
  When the command that caused the error occurred, the device was in an unknown state.

  After command completion occurred, registers were:
  ER -- ST COUNT  LBA_48  LH LM LL DV DC
  -- -- -- == -- == == == -- -- -- -- --
  01 -- 50 00 01 00 00 00 00 00 01 00 00

  Commands leading to the command that caused the error were:
  CR FEATR COUNT  LBA_48  LH LM LL DV DC  Powered_Up_Time  Command/Feature_Name
  -- == -- == -- == == == -- -- -- -- --  ---------------  --------------------
  00 00 00 00 00 00 00 00 00 00 00 00 00 44d+22:12:16.042  NOP [Abort queued commands]
  00 00 00 00 00 00 00 00 00 00 00 00 00 44d+22:12:16.042  NOP [Abort queued commands]
  25 00 00 00 08 00 00 19 7a 2b f0 40 40 44d+22:12:11.762  READ DMA EXT
  25 00 00 00 40 00 00 19 79 8f 28 40 40 44d+22:12:11.762  READ DMA EXT
  25 00 00 00 08 00 00 19 7a 2b e8 40 40 44d+22:12:11.762  READ DMA EXT

Error 1917 [16] occurred at disk power-on lifetime: 14163 hours (590 days + 3 hours)
  When the command that caused the error occurred, the device was in an unknown state.

  After command completion occurred, registers were:
  ER -- ST COUNT  LBA_48  LH LM LL DV DC
  -- -- -- == -- == == == -- -- -- -- --
  00 -- 00 00 00 00 00 00 00 00 00 00 ff   at LBA = 0x00000000 = 0

  Commands leading to the command that caused the error were:
  CR FEATR COUNT  LBA_48  LH LM LL DV DC  Powered_Up_Time  Command/Feature_Name
  -- == -- == -- == == == -- -- -- -- --  ---------------  --------------------
  25 00 00 00 08 00 00 19 7a 2b f0 40 40 44d+22:12:11.762  READ DMA EXT
  25 00 00 00 40 00 00 19 79 8f 28 40 40 44d+22:12:11.762  READ DMA EXT
  25 00 00 00 08 00 00 19 7a 2b e8 40 40 44d+22:12:11.762  READ DMA EXT
  25 00 00 00 40 00 00 19 79 8f 28 40 40 44d+22:12:11.762  READ DMA EXT
  25 00 00 00 08 00 00 00 06 e2 68 40 40 44d+22:12:11.762  READ DMA EXT

Error 1916 [15] occurred at disk power-on lifetime: 14163 hours (590 days + 3 hours)
  When the command that caused the error occurred, the device was in an unknown state.

  After command completion occurred, registers were:
  ER -- ST COUNT  LBA_48  LH LM LL DV DC
  -- -- -- == -- == == == -- -- -- -- --
  00 -- 00 00 00 00 00 00 00 00 00 00 ff   at LBA = 0x00000000 = 0

  Commands leading to the command that caused the error were:
  CR FEATR COUNT  LBA_48  LH LM LL DV DC  Powered_Up_Time  Command/Feature_Name
  -- == -- == -- == == == -- -- -- -- --  ---------------  --------------------
  25 00 00 00 08 00 00 19 7a 2b f0 40 40 44d+22:12:11.762  READ DMA EXT
  25 00 00 00 40 00 00 19 79 8f 28 40 40 44d+22:12:11.762  READ DMA EXT
  25 00 00 00 08 00 00 19 7a 2b e8 40 40 44d+22:12:11.762  READ DMA EXT
  25 00 00 00 40 00 00 19 79 8f 28 40 40 44d+22:12:11.762  READ DMA EXT
  25 00 00 00 08 00 00 00 06 e2 68 40 40 44d+22:12:11.762  READ DMA EXT

SMART Extended Self-test Log Version: 1 (2 sectors)
No self-tests have been logged.  [To run self-tests, use: smartctl -t]

Selective Self-tests/Logging not supported

SCT Commands not supported

Device Statistics (GP Log 0x04)
Page  Offset Size        Value Flags Description
0x01  =====  =               =  ===  == General Statistics (empty) ==
0x04  =====  =               =  ===  == General Errors Statistics (empty) ==
0x05  =====  =               =  ===  == Temperature Statistics (empty) ==
0x06  =====  =               =  ===  == Transport Statistics (empty) ==
0x07  =====  =               =  ===  == Solid State Device Statistics (empty) ==
                                |||_ C monitored condition met
                                ||__ D supports DSN
                                |___ N normalized value

Pending Defects log (GP Log 0x0c) not supported

SATA Phy Event Counters (GP Log 0x11)
ID      Size     Value  Description
0x0001  2            0  Command failed due to ICRC error
0x000a  2            4  Device-to-host register FISes sent due to a COMRESET

