smartctl 7.2 2020-12-30 r5155 [FreeBSD 12.2-RELEASE amd64] (local build)
Copyright (C) 2002-20, Bruce Allen, Christian Franke, www.smartmontools.org

=== START OF INFORMATION SECTION ===
Model Number:                       ADATA SX8200PNP
Serial Number:                      --
Firmware Version:                   32A0T54B
PCI Vendor/Subsystem ID:            0x1cc1
IEEE OUI Identifier:                0x000000
Controller ID:                      1
NVMe Version:                       1.3
Number of Namespaces:               1
Namespace 1 Size/Capacity:          512,110,190,592 [512 GB]
Namespace 1 Utilization:            185,766,862,848 [185 GB]
Namespace 1 Formatted LBA Size:     512
Local Time is:                      Sat Jul  3 11:07:18 2021 EDT
Firmware Updates (0x14):            2 Slots, no Reset required
Optional Admin Commands (0x0017):   Security Format Frmw_DL Self_Test
Optional NVM Commands (0x005f):     Comp Wr_Unc DS_Mngmt Wr_Zero Sav/Sel_Feat Timestmp
Log Page Attributes (0x0b):         S/H_per_NS Cmd_Eff_Lg Telmtry_Lg
Maximum Data Transfer Size:         64 Pages
Warning  Comp. Temp. Threshold:     75 Celsius
Critical Comp. Temp. Threshold:     80 Celsius

Supported Power States
St Op     Max   Active     Idle   RL RT WL WT  Ent_Lat  Ex_Lat
 0 +     9.00W       -        -    0  0  0  0        0       0
 1 +     4.60W       -        -    1  1  1  1        0       0
 2 +     3.80W       -        -    2  2  2  2        0       0
 3 -   0.0450W       -        -    3  3  3  3     2000    2000
 4 -   0.0040W       -        -    4  4  4  4    15000   15000

Supported LBA Sizes (NSID 0x1)
Id Fmt  Data  Metadt  Rel_Perf
 0 +     512       0         0

=== START OF SMART DATA SECTION ===
SMART overall-health self-assessment test result: PASSED

SMART/Health Information (NVMe Log 0x02)
Critical Warning:                   0x00
Temperature:                        33 Celsius
Available Spare:                    100%
Available Spare Threshold:          10%
Percentage Used:                    0%
Data Units Read:                    3,224,866 [1.65 TB]
Data Units Written:                 4,788,516 [2.45 TB]
Host Read Commands:                 37,721,402
Host Write Commands:                159,092,709
Controller Busy Time:               912
Power Cycles:                       257
Power On Hours:                     3,311
Unsafe Shutdowns:                   115
Media and Data Integrity Errors:    0
Error Information Log Entries:      0
Warning  Comp. Temperature Time:    0
Critical Comp. Temperature Time:    0
Temperature Sensor 2:               33 Celsius
Temperature Sensor 3:               44 Celsius
Temperature Sensor 4:               32 Celsius
Temperature Sensor 5:               32 Celsius
Temperature Sensor 6:               33 Celsius
Thermal Temp. 1 Transition Count:   24
Thermal Temp. 1 Total Time:         541

Error Information (NVMe Log 0x01, 16 of 256 entries)
No Errors Logged



