smartctl 7.3 2022-02-28 r5338 [FreeBSD 13.1-RELEASE amd64] (local build)
Copyright (C) 2002-22, Bruce Allen, Christian Franke, www.smartmontools.org

=== START OF INFORMATION SECTION ===
Model Family:     Seagate Barracuda 7200.10
Device Model:     ST3360320AS
Serial Number:    --
Firmware Version: 3.AAM
User Capacity:    360,080,695,296 bytes [360 GB]
Sector Size:      512 bytes logical/physical
Device is:        In smartctl database 7.3/5319
ATA Version is:   ATA/ATAPI-7 (minor revision not indicated)
Local Time is:    Mon Oct 30 17:49:30 2023 UTC
SMART support is: Available - device has SMART capability.
SMART support is: Enabled
AAM feature is:   Unavailable
APM feature is:   Unavailable
Rd look-ahead is: Enabled
Write cache is:   Enabled
DSN feature is:   Unavailable
ATA Security is:  Disabled, frozen [SEC2]
Wt Cache Reorder: Unavailable

=== START OF READ SMART DATA SECTION ===
SMART overall-health self-assessment test result: PASSED

General SMART Values:
Offline data collection status:  (0x82)	Offline data collection activity
					was completed without error.
					Auto Offline Data Collection: Enabled.
Self-test execution status:      (  25)	The self-test routine was aborted by
					the host.
Total time to complete Offline 
data collection: 		(  430) seconds.
Offline data collection
capabilities: 			 (0x5b) SMART execute Offline immediate.
					Auto Offline data collection on/off support.
					Suspend Offline collection upon new
					command.
					Offline surface scan supported.
					Self-test supported.
					No Conveyance Self-test supported.
					Selective Self-test supported.
SMART capabilities:            (0x0003)	Saves SMART data before entering
					power-saving mode.
					Supports SMART auto save timer.
Error logging capability:        (0x01)	Error logging supported.
					General Purpose Logging supported.
Short self-test routine 
recommended polling time: 	 (   1) minutes.
Extended self-test routine
recommended polling time: 	 ( 132) minutes.

SMART Attributes Data Structure revision number: 10
Vendor Specific SMART Attributes with Thresholds:
ID# ATTRIBUTE_NAME          FLAGS    VALUE WORST THRESH FAIL RAW_VALUE
  1 Raw_Read_Error_Rate     POSR--   100   253   006    -    0
  3 Spin_Up_Time            PO----   096   095   000    -    0
  4 Start_Stop_Count        -O--CK   096   096   020    -    4749
  5 Reallocated_Sector_Ct   PO--CK   100   100   036    -    0
  7 Seek_Error_Rate         POSR--   085   060   030    -    9299269846
  9 Power_On_Hours          -O--CK   094   094   000    -    5601
 10 Spin_Retry_Count        PO--C-   100   100   097    -    0
 12 Power_Cycle_Count       -O--CK   096   096   020    -    4659
187 Reported_Uncorrect      -O--CK   095   095   000    -    5
189 High_Fly_Writes         -O-RCK   098   098   000    -    2
190 Airflow_Temperature_Cel -O---K   057   048   045    -    43 (Min/Max 35/43)
194 Temperature_Celsius     -O---K   043   052   000    -    43 (0 17 0 0 0)
195 Hardware_ECC_Recovered  -O-RC-   069   053   000    -    131111878
197 Current_Pending_Sector  -O--C-   100   100   000    -    0
198 Offline_Uncorrectable   ----C-   100   100   000    -    0
199 UDMA_CRC_Error_Count    -OSRCK   200   199   000    -    4
200 Multi_Zone_Error_Rate   ------   100   253   000    -    0
202 Data_Address_Mark_Errs  -O--CK   100   253   000    -    0
                            ||||||_ K auto-keep
                            |||||__ C event count
                            ||||___ R error rate
                            |||____ S speed/performance
                            ||_____ O updated online
                            |______ P prefailure warning

General Purpose Log Directory Version 1
SMART           Log Directory Version 1 [multi-sector log support]
Address    Access  R/W   Size  Description
0x00       GPL,SL  R/O      1  Log Directory
0x01       GPL,SL  R/O      1  Summary SMART error log
0x02       GPL,SL  R/O      5  Comprehensive SMART error log
0x03       GPL,SL  R/O      5  Ext. Comprehensive SMART error log
0x06       GPL,SL  R/O      1  SMART self-test log
0x07       GPL,SL  R/O      1  Extended self-test log
0x09       GPL,SL  R/W      1  Selective self-test log
0x10       GPL,SL  R/O      1  NCQ Command Error log
0x11       GPL,SL  R/O      1  SATA Phy Event Counters log
0x20       GPL,SL  R/O      1  Streaming performance log [OBS-8]
0x21       GPL,SL  R/O      1  Write stream error log
0x22       GPL,SL  R/O      1  Read stream error log
0x23       GPL,SL  R/O      1  Delayed sector log [OBS-8]
0x80-0x9f  GPL,SL  R/W     16  Host vendor specific log
0xa0       GPL,SL  VS       1  Device vendor specific log
0xa1       GPL,SL  VS      20  Device vendor specific log
0xa2       GPL,SL  VS     101  Device vendor specific log
0xa8       GPL,SL  VS      20  Device vendor specific log
0xa9       GPL,SL  VS       1  Device vendor specific log
0xe0       GPL,SL  R/W      1  SCT Command/Status
0xe1       GPL,SL  R/W      1  SCT Data Transfer
0xff       GPL     -    23040  Reserved

SMART Extended Comprehensive Error Log Version: 1 (5 sectors)
Device Error Count: 12
	CR     = Command Register
	FEATR  = Features Register
	COUNT  = Count (was: Sector Count) Register
	LBA_48 = Upper bytes of LBA High/Mid/Low Registers ]  ATA-8
	LH     = LBA High (was: Cylinder High) Register    ]   LBA
	LM     = LBA Mid (was: Cylinder Low) Register      ] Register
	LL     = LBA Low (was: Sector Number) Register     ]
	DV     = Device (was: Device/Head) Register
	DC     = Device Control Register
	ER     = Error register
	ST     = Status register
Powered_Up_Time is measured from power on, and printed as
DDd+hh:mm:SS.sss where DD=days, hh=hours, mm=minutes,
SS=sec, and sss=millisec. It "wraps" after 49.710 days.

Error 12 [11] occurred at disk power-on lifetime: 5458 hours (227 days + 10 hours)
  When the command that caused the error occurred, the device was active or idle.

  After command completion occurred, registers were:
  ER -- ST COUNT  LBA_48  LH LM LL DV DC
  -- -- -- == -- == == == -- -- -- -- --
  40 -- 51 00 00 00 00 3f 00 2f 0c 40 00  Error: UNC at LBA = 0x3f002f0c = 1056976652

  Commands leading to the command that caused the error were:
  CR FEATR COUNT  LBA_48  LH LM LL DV DC  Powered_Up_Time  Command/Feature_Name
  -- == -- == -- == == == -- -- -- -- --  ---------------  --------------------
  25 00 00 00 10 00 00 3f 00 2f 00 40 00     00:00:45.718  READ DMA EXT
  25 00 00 00 10 00 00 3f 00 2f 00 40 00     00:00:45.717  READ DMA EXT
  25 00 00 00 10 00 00 3f 00 2f 00 40 00     00:00:45.707  READ DMA EXT
  25 00 00 00 10 00 00 3f 00 2f 00 40 00     00:00:45.699  READ DMA EXT
  25 00 00 00 10 00 00 5d 00 06 bd 40 00     00:00:45.699  READ DMA EXT

Error 11 [10] occurred at disk power-on lifetime: 5458 hours (227 days + 10 hours)
  When the command that caused the error occurred, the device was active or idle.

  After command completion occurred, registers were:
  ER -- ST COUNT  LBA_48  LH LM LL DV DC
  -- -- -- == -- == == == -- -- -- -- --
  40 -- 51 00 00 00 00 3f 00 2f 0c 40 00  Error: UNC at LBA = 0x3f002f0c = 1056976652

  Commands leading to the command that caused the error were:
  CR FEATR COUNT  LBA_48  LH LM LL DV DC  Powered_Up_Time  Command/Feature_Name
  -- == -- == -- == == == -- -- -- -- --  ---------------  --------------------
  25 00 00 00 10 00 00 3f 00 2f 00 40 00     00:00:45.718  READ DMA EXT
  25 00 00 00 10 00 00 3f 00 2f 00 40 00     00:00:45.717  READ DMA EXT
  25 00 00 00 10 00 00 3f 00 2f 00 40 00     00:00:45.707  READ DMA EXT
  25 00 00 00 10 00 00 5d 00 06 bd 40 00     00:00:45.699  READ DMA EXT
  35 00 00 00 10 00 00 3e 00 2f 30 40 00     00:00:45.699  WRITE DMA EXT

Error 10 [9] occurred at disk power-on lifetime: 5458 hours (227 days + 10 hours)
  When the command that caused the error occurred, the device was active or idle.

  After command completion occurred, registers were:
  ER -- ST COUNT  LBA_48  LH LM LL DV DC
  -- -- -- == -- == == == -- -- -- -- --
  40 -- 51 00 00 00 00 3f 00 2f 0c 40 00  Error: UNC at LBA = 0x3f002f0c = 1056976652

  Commands leading to the command that caused the error were:
  CR FEATR COUNT  LBA_48  LH LM LL DV DC  Powered_Up_Time  Command/Feature_Name
  -- == -- == -- == == == -- -- -- -- --  ---------------  --------------------
  25 00 00 00 10 00 00 3f 00 2f 00 40 00     00:00:45.718  READ DMA EXT
  25 00 00 00 10 00 00 3f 00 2f 00 40 00     00:00:45.717  READ DMA EXT
  25 00 00 00 10 00 00 5d 00 06 bd 40 00     00:00:45.707  READ DMA EXT
  35 00 00 00 10 00 00 3e 00 2f 30 40 00     00:00:45.699  WRITE DMA EXT
  25 00 00 00 10 00 00 3e 00 2f 30 40 00     00:00:45.699  READ DMA EXT

Error 9 [8] occurred at disk power-on lifetime: 5458 hours (227 days + 10 hours)
  When the command that caused the error occurred, the device was active or idle.

  After command completion occurred, registers were:
  ER -- ST COUNT  LBA_48  LH LM LL DV DC
  -- -- -- == -- == == == -- -- -- -- --
  40 -- 51 00 00 00 00 3f 00 2f 0c 40 00  Error: UNC at LBA = 0x3f002f0c = 1056976652

  Commands leading to the command that caused the error were:
  CR FEATR COUNT  LBA_48  LH LM LL DV DC  Powered_Up_Time  Command/Feature_Name
  -- == -- == -- == == == -- -- -- -- --  ---------------  --------------------
  25 00 00 00 10 00 00 3f 00 2f 00 40 00     00:00:45.718  READ DMA EXT
  25 00 00 00 10 00 00 5d 00 06 bd 40 00     00:00:45.717  READ DMA EXT
  35 00 00 00 10 00 00 3e 00 2f 30 40 00     00:00:45.707  WRITE DMA EXT
  25 00 00 00 10 00 00 3e 00 2f 30 40 00     00:00:45.699  READ DMA EXT
  25 00 00 00 10 00 00 7b 00 06 cc 40 00     00:00:45.699  READ DMA EXT

Error 8 [7] occurred at disk power-on lifetime: 5458 hours (227 days + 10 hours)
  When the command that caused the error occurred, the device was active or idle.

  After command completion occurred, registers were:
  ER -- ST COUNT  LBA_48  LH LM LL DV DC
  -- -- -- == -- == == == -- -- -- -- --
  40 -- 51 00 00 00 00 3f 00 2f 0c 40 00  Error: UNC at LBA = 0x3f002f0c = 1056976652

  Commands leading to the command that caused the error were:
  CR FEATR COUNT  LBA_48  LH LM LL DV DC  Powered_Up_Time  Command/Feature_Name
  -- == -- == -- == == == -- -- -- -- --  ---------------  --------------------
  25 00 00 00 10 00 00 3f 00 2f 00 40 00     00:00:45.718  READ DMA EXT
  25 00 00 00 10 00 00 3f 00 2f 00 40 00     00:00:45.717  READ DMA EXT
  25 00 00 00 10 00 00 3f 00 2f 00 40 00     00:00:45.707  READ DMA EXT
  25 00 00 00 10 00 00 3f 00 2f 00 40 00     00:00:45.699  READ DMA EXT
  25 00 00 00 10 00 00 5d 00 06 bd 40 00     00:00:45.699  READ DMA EXT

Error 7 [6] occurred at disk power-on lifetime: 5458 hours (227 days + 10 hours)
  When the command that caused the error occurred, the device was active or idle.

  After command completion occurred, registers were:
  ER -- ST COUNT  LBA_48  LH LM LL DV DC
  -- -- -- == -- == == == -- -- -- -- --
  40 -- 51 00 00 00 00 3f 00 2f 0c 40 00  Error: UNC at LBA = 0x3f002f0c = 1056976652

  Commands leading to the command that caused the error were:
  CR FEATR COUNT  LBA_48  LH LM LL DV DC  Powered_Up_Time  Command/Feature_Name
  -- == -- == -- == == == -- -- -- -- --  ---------------  --------------------
  25 00 00 00 10 00 00 3f 00 2f 00 40 00     00:00:45.718  READ DMA EXT
  25 00 00 00 10 00 00 3f 00 2f 00 40 00     00:00:45.717  READ DMA EXT
  25 00 00 00 10 00 00 3f 00 2f 00 40 00     00:00:45.707  READ DMA EXT
  25 00 00 00 10 00 00 5d 00 06 bd 40 00     00:00:45.699  READ DMA EXT
  35 00 00 00 10 00 00 3e 00 2f 30 40 00     00:00:45.699  WRITE DMA EXT

Error 6 [5] occurred at disk power-on lifetime: 5458 hours (227 days + 10 hours)
  When the command that caused the error occurred, the device was active or idle.

  After command completion occurred, registers were:
  ER -- ST COUNT  LBA_48  LH LM LL DV DC
  -- -- -- == -- == == == -- -- -- -- --
  40 -- 51 00 00 00 00 3f 00 2f 0c 40 00  Error: UNC at LBA = 0x3f002f0c = 1056976652

  Commands leading to the command that caused the error were:
  CR FEATR COUNT  LBA_48  LH LM LL DV DC  Powered_Up_Time  Command/Feature_Name
  -- == -- == -- == == == -- -- -- -- --  ---------------  --------------------
  25 00 00 00 10 00 00 3f 00 2f 00 40 00     00:00:45.718  READ DMA EXT
  25 00 00 00 10 00 00 3f 00 2f 00 40 00     00:00:45.717  READ DMA EXT
  25 00 00 00 10 00 00 5d 00 06 bd 40 00     00:00:45.707  READ DMA EXT
  35 00 00 00 10 00 00 3e 00 2f 30 40 00     00:00:45.699  WRITE DMA EXT
  25 00 00 00 10 00 00 3e 00 2f 30 40 00     00:00:45.699  READ DMA EXT

Error 5 [4] occurred at disk power-on lifetime: 5458 hours (227 days + 10 hours)
  When the command that caused the error occurred, the device was active or idle.

  After command completion occurred, registers were:
  ER -- ST COUNT  LBA_48  LH LM LL DV DC
  -- -- -- == -- == == == -- -- -- -- --
  40 -- 51 00 00 00 00 3f 00 2f 0c 40 00  Error: UNC at LBA = 0x3f002f0c = 1056976652

  Commands leading to the command that caused the error were:
  CR FEATR COUNT  LBA_48  LH LM LL DV DC  Powered_Up_Time  Command/Feature_Name
  -- == -- == -- == == == -- -- -- -- --  ---------------  --------------------
  25 00 00 00 10 00 00 3f 00 2f 00 40 00     00:00:45.718  READ DMA EXT
  25 00 00 00 10 00 00 5d 00 06 bd 40 00     00:00:45.717  READ DMA EXT
  35 00 00 00 10 00 00 3e 00 2f 30 40 00     00:00:45.707  WRITE DMA EXT
  25 00 00 00 10 00 00 3e 00 2f 30 40 00     00:00:45.699  READ DMA EXT
  25 00 00 00 10 00 00 7b 00 06 cc 40 00     00:00:45.699  READ DMA EXT

SMART Extended Self-test Log Version: 1 (1 sectors)
Num  Test_Description    Status                  Remaining  LifeTime(hours)  LBA_of_first_error
# 1  Short offline       Aborted by host               90%      5570         -
# 2  Short offline       Aborted by host               90%      5570         -

SMART Selective self-test log data structure revision number 1
 SPAN  MIN_LBA  MAX_LBA  CURRENT_TEST_STATUS
    1        0        0  Not_testing
    2        0        0  Not_testing
    3        0        0  Not_testing
    4        0        0  Not_testing
    5        0        0  Not_testing
Selective self-test flags (0x0):
  After scanning selected spans, do NOT read-scan remainder of disk.
If Selective self-test is pending on power-up, resume after 0 minute delay.

SCT Commands not supported

Device Statistics (GP/SMART Log 0x04) not supported

Pending Defects log (GP Log 0x0c) not supported

SATA Phy Event Counters (GP Log 0x11)
ID      Size     Value  Description
0x000a  2           12  Device-to-host register FISes sent due to a COMRESET
0x0001  2            0  Command failed due to ICRC error
0x0003  2            0  R_ERR response for device-to-host data FIS
0x0004  2            0  R_ERR response for host-to-device data FIS
0x0006  2            0  R_ERR response for device-to-host non-data FIS
0x0007  2            0  R_ERR response for host-to-device non-data FIS



