smartctl 7.4 2023-08-01 r5530 [FreeBSD 13.2-STABLE amd64] (local build)
Copyright (C) 2002-23, Bruce Allen, Christian Franke, www.smartmontools.org

=== START OF INFORMATION SECTION ===
Model Family:     Seagate Laptop SSHD
Device Model:     ST500LM000-1EJ162
Serial Number:    --
LU WWN Device Id: 5 000c50 ...
Firmware Version: DEM9
User Capacity:    500,107,862,016 bytes [500 GB]
Sector Sizes:     512 bytes logical, 4096 bytes physical
Rotation Rate:    5400 rpm
Form Factor:      2.5 inches
Device is:        In smartctl database 7.3/5528
ATA Version is:   ACS-2, ACS-3 T13/2161-D revision 3b
SATA Version is:  SATA 3.1, 6.0 Gb/s (current: 6.0 Gb/s)
Local Time is:    Thu Nov 23 13:27:50 2023 CST
SMART support is: Available - device has SMART capability.
SMART support is: Enabled
AAM feature is:   Unavailable
APM level is:     128 (minimum power consumption without standby)
Rd look-ahead is: Enabled
Write cache is:   Enabled
DSN feature is:   Unavailable
ATA Security is:  Disabled, frozen [SEC2]
Wt Cache Reorder: Enabled

=== START OF READ SMART DATA SECTION ===
SMART overall-health self-assessment test result: PASSED
See vendor-specific Attribute list for marginal Attributes.

General SMART Values:
Offline data collection status:  (0x00)	Offline data collection activity
					was never started.
					Auto Offline Data Collection: Disabled.
Self-test execution status:      (   0)	The previous self-test routine completed
					without error or no self-test has ever 
					been run.
Total time to complete Offline 
data collection: 		(  150) seconds.
Offline data collection
capabilities: 			 (0x73) SMART execute Offline immediate.
					Auto Offline data collection on/off support.
					Suspend Offline collection upon new
					command.
					No Offline surface scan supported.
					Self-test supported.
					Conveyance Self-test supported.
					Selective Self-test supported.
SMART capabilities:            (0x0003)	Saves SMART data before entering
					power-saving mode.
					Supports SMART auto save timer.
Error logging capability:        (0x01)	Error logging supported.
					General Purpose Logging supported.
Short self-test routine 
recommended polling time: 	 (   2) minutes.
Extended self-test routine
recommended polling time: 	 ( 104) minutes.
Conveyance self-test routine
recommended polling time: 	 (   3) minutes.
SCT capabilities: 	       (0x10b5)	SCT Status supported.
					SCT Feature Control supported.
					SCT Data Table supported.

SMART Attributes Data Structure revision number: 10
Vendor Specific SMART Attributes with Thresholds:
ID# ATTRIBUTE_NAME          FLAGS    VALUE WORST THRESH FAIL RAW_VALUE
  1 Raw_Read_Error_Rate     POSR--   113   099   006    -    56703480
  3 Spin_Up_Time            PO----   099   099   085    -    0
  4 Start_Stop_Count        -O--CK   100   100   020    -    571
  5 Reallocated_Sector_Ct   PO--CK   100   100   010    -    0
  7 Seek_Error_Rate         POSR--   082   060   030    -    179526844
  9 Power_On_Hours          -O--CK   081   081   000    -    17330
 10 Spin_Retry_Count        PO--C-   100   100   097    -    0
 12 Power_Cycle_Count       -O--CK   100   100   020    -    581
184 End-to-End_Error        -O--CK   079   079   099    NOW  21
187 Reported_Uncorrect      -O--CK   087   087   000    -    13
188 Command_Timeout         -O--CK   100   099   000    -    5
189 High_Fly_Writes         -O-RCK   100   100   000    -    0
190 Airflow_Temperature_Cel -O---K   059   052   045    -    41 (Min/Max 36/41)
191 G-Sense_Error_Rate      -O--CK   100   100   000    -    0
192 Power-Off_Retract_Count -O--CK   100   100   000    -    31
193 Load_Cycle_Count        -O--CK   096   096   000    -    9102
194 Temperature_Celsius     -O---K   041   048   000    -    41 (255 254 0 0 0)
197 Current_Pending_Sector  -O--C-   100   100   000    -    0
198 Offline_Uncorrectable   ----C-   100   100   000    -    0
199 UDMA_CRC_Error_Count    -OSRCK   200   200   000    -    0
240 Head_Flying_Hours       ------   100   253   000    -    22270 (94 133 0)
241 Total_LBAs_Written      ------   100   253   000    -    11522589528
242 Total_LBAs_Read         ------   100   253   000    -    607770000915
254 Free_Fall_Sensor        -O--CK   001   001   000    -    2
                            ||||||_ K auto-keep
                            |||||__ C event count
                            ||||___ R error rate
                            |||____ S speed/performance
                            ||_____ O updated online
                            |______ P prefailure warning

General Purpose Log Directory Version 1
SMART           Log Directory Version 1 [multi-sector log support]
Address    Access  R/W   Size  Description
0x00       GPL,SL  R/O      1  Log Directory
0x01           SL  R/O      1  Summary SMART error log
0x02           SL  R/O      5  Comprehensive SMART error log
0x03       GPL     R/O      5  Ext. Comprehensive SMART error log
0x04       GPL,SL  R/O      8  Device Statistics log
0x06           SL  R/O      1  SMART self-test log
0x07       GPL     R/O      1  Extended self-test log
0x09           SL  R/W      1  Selective self-test log
0x10       GPL     R/O      1  NCQ Command Error log
0x11       GPL     R/O      1  SATA Phy Event Counters log
0x21       GPL     R/O      1  Write stream error log
0x22       GPL     R/O      1  Read stream error log
0x30       GPL,SL  R/O      9  IDENTIFY DEVICE data log
0x80-0x9f  GPL,SL  R/W     16  Host vendor specific log
0xa1       GPL,SL  VS      20  Device vendor specific log
0xa2       GPL     VS    3900  Device vendor specific log
0xa8       GPL,SL  VS     129  Device vendor specific log
0xa9       GPL,SL  VS       1  Device vendor specific log
0xab       GPL     VS       1  Device vendor specific log
0xae       GPL     VS       1  Device vendor specific log
0xb0       GPL     VS    4580  Device vendor specific log
0xbe-0xbf  GPL     VS   65535  Device vendor specific log
0xc1       GPL,SL  VS      10  Device vendor specific log
0xc2       GPL,SL  VS      50  Device vendor specific log
0xc4       GPL,SL  VS       5  Device vendor specific log
0xe0       GPL,SL  R/W      1  SCT Command/Status
0xe1       GPL,SL  R/W      1  SCT Data Transfer

SMART Extended Comprehensive Error Log Version: 1 (5 sectors)
Device Error Count: 39 (device log contains only the most recent 20 errors)
	CR     = Command Register
	FEATR  = Features Register
	COUNT  = Count (was: Sector Count) Register
	LBA_48 = Upper bytes of LBA High/Mid/Low Registers ]  ATA-8
	LH     = LBA High (was: Cylinder High) Register    ]   LBA
	LM     = LBA Mid (was: Cylinder Low) Register      ] Register
	LL     = LBA Low (was: Sector Number) Register     ]
	DV     = Device (was: Device/Head) Register
	DC     = Device Control Register
	ER     = Error register
	ST     = Status register
Powered_Up_Time is measured from power on, and printed as
DDd+hh:mm:SS.sss where DD=days, hh=hours, mm=minutes,
SS=sec, and sss=millisec. It "wraps" after 49.710 days.

Error 39 [18] occurred at disk power-on lifetime: 1265 hours (52 days + 17 hours)
  When the command that caused the error occurred, the device was active or idle.

  After command completion occurred, registers were:
  ER -- ST COUNT  LBA_48  LH LM LL DV DC
  -- -- -- == -- == == == -- -- -- -- --
  40 -- 51 00 00 00 00 0a f9 25 1e 00 00  Error: UNC at LBA = 0x0af9251e = 184100126

  Commands leading to the command that caused the error were:
  CR FEATR COUNT  LBA_48  LH LM LL DV DC  Powered_Up_Time  Command/Feature_Name
  -- == -- == -- == == == -- -- -- -- --  ---------------  --------------------
  60 00 00 01 00 00 00 0a f9 27 f0 40 00     00:00:40.771  READ FPDMA QUEUED
  60 00 00 01 00 00 00 0a f9 26 f0 40 00     00:00:40.659  READ FPDMA QUEUED
  60 00 00 01 00 00 00 0a f9 25 f0 40 00     00:00:40.658  READ FPDMA QUEUED
  60 00 00 01 00 00 00 0a f9 24 f0 40 00     00:00:40.219  READ FPDMA QUEUED
  60 00 00 01 00 00 00 0a f9 23 f0 40 00     00:00:40.218  READ FPDMA QUEUED

Error 38 [17] occurred at disk power-on lifetime: 1265 hours (52 days + 17 hours)
  When the command that caused the error occurred, the device was active or idle.

  After command completion occurred, registers were:
  ER -- ST COUNT  LBA_48  LH LM LL DV DC
  -- -- -- == -- == == == -- -- -- -- --
  40 -- 51 00 00 00 00 0a f9 25 18 00 00  Error: UNC at LBA = 0x0af92518 = 184100120

  Commands leading to the command that caused the error were:
  CR FEATR COUNT  LBA_48  LH LM LL DV DC  Powered_Up_Time  Command/Feature_Name
  -- == -- == -- == == == -- -- -- -- --  ---------------  --------------------
  60 00 00 01 00 00 00 0a f9 27 f0 40 00     00:00:34.005  READ FPDMA QUEUED
  60 00 00 01 00 00 00 0a f9 26 f0 40 00     00:00:33.893  READ FPDMA QUEUED
  60 00 00 01 00 00 00 0a f9 25 f0 40 00     00:00:33.893  READ FPDMA QUEUED
  60 00 00 01 00 00 00 0a f9 24 f0 40 00     00:00:33.454  READ FPDMA QUEUED
  60 00 00 01 00 00 00 0a f9 23 f0 40 00     00:00:33.453  READ FPDMA QUEUED

Error 37 [16] occurred at disk power-on lifetime: 1265 hours (52 days + 17 hours)
  When the command that caused the error occurred, the device was active or idle.

  After command completion occurred, registers were:
  ER -- ST COUNT  LBA_48  LH LM LL DV DC
  -- -- -- == -- == == == -- -- -- -- --
  40 -- 51 00 00 00 00 0a f9 28 22 00 00  Error: UNC at LBA = 0x0af92822 = 184100898

  Commands leading to the command that caused the error were:
  CR FEATR COUNT  LBA_48  LH LM LL DV DC  Powered_Up_Time  Command/Feature_Name
  -- == -- == -- == == == -- -- -- -- --  ---------------  --------------------
  60 00 00 01 00 00 00 0a f9 2a f0 40 00     00:01:36.745  READ FPDMA QUEUED
  60 00 00 01 00 00 00 0a f9 26 f0 40 00     00:01:36.290  READ FPDMA QUEUED
  60 00 00 01 00 00 00 0a f9 1b f0 40 00     00:01:36.290  READ FPDMA QUEUED
  60 00 00 01 00 00 00 0a f8 9d f0 40 00     00:01:36.290  READ FPDMA QUEUED
  60 00 00 01 00 00 00 0a f9 19 f0 40 00     00:01:36.290  READ FPDMA QUEUED

Error 36 [15] occurred at disk power-on lifetime: 1265 hours (52 days + 17 hours)
  When the command that caused the error occurred, the device was active or idle.

  After command completion occurred, registers were:
  ER -- ST COUNT  LBA_48  LH LM LL DV DC
  -- -- -- == -- == == == -- -- -- -- --
  40 -- 51 00 00 00 00 0a f9 25 18 00 00  Error: UNC at LBA = 0x0af92518 = 184100120

  Commands leading to the command that caused the error were:
  CR FEATR COUNT  LBA_48  LH LM LL DV DC  Powered_Up_Time  Command/Feature_Name
  -- == -- == -- == == == -- -- -- -- --  ---------------  --------------------
  60 00 00 01 00 00 00 0a f9 27 f0 40 00     00:01:35.833  READ FPDMA QUEUED
  60 00 00 01 00 00 00 0a f9 26 f0 40 00     00:01:35.721  READ FPDMA QUEUED
  60 00 00 01 00 00 00 0a f9 25 f0 40 00     00:01:35.721  READ FPDMA QUEUED
  60 00 00 01 00 00 00 0a f9 24 f0 40 00     00:01:35.282  READ FPDMA QUEUED
  60 00 00 01 00 00 00 0a f9 23 f0 40 00     00:01:35.281  READ FPDMA QUEUED

Error 35 [14] occurred at disk power-on lifetime: 1265 hours (52 days + 17 hours)
  When the command that caused the error occurred, the device was active or idle.

  After command completion occurred, registers were:
  ER -- ST COUNT  LBA_48  LH LM LL DV DC
  -- -- -- == -- == == == -- -- -- -- --
  40 -- 51 00 00 00 00 0a f9 49 26 00 00  Error: UNC at LBA = 0x0af94926 = 184109350

  Commands leading to the command that caused the error were:
  CR FEATR COUNT  LBA_48  LH LM LL DV DC  Powered_Up_Time  Command/Feature_Name
  -- == -- == -- == == == -- -- -- -- --  ---------------  --------------------
  60 00 00 01 00 00 00 0a f9 4b f0 40 00     00:01:28.999  READ FPDMA QUEUED
  60 00 00 01 00 00 00 0a f9 4a f0 40 00     00:01:28.999  READ FPDMA QUEUED
  60 00 00 01 00 00 00 0a f9 49 f0 40 00     00:01:28.998  READ FPDMA QUEUED
  60 00 00 01 00 00 00 0a f9 48 f0 40 00     00:01:28.559  READ FPDMA QUEUED
  60 00 00 01 00 00 00 0a f9 47 f0 40 00     00:01:28.554  READ FPDMA QUEUED

Error 34 [13] occurred at disk power-on lifetime: 1265 hours (52 days + 17 hours)
  When the command that caused the error occurred, the device was active or idle.

  After command completion occurred, registers were:
  ER -- ST COUNT  LBA_48  LH LM LL DV DC
  -- -- -- == -- == == == -- -- -- -- --
  40 -- 51 00 00 00 00 0a f9 28 20 00 00  Error: UNC at LBA = 0x0af92820 = 184100896

  Commands leading to the command that caused the error were:
  CR FEATR COUNT  LBA_48  LH LM LL DV DC  Powered_Up_Time  Command/Feature_Name
  -- == -- == -- == == == -- -- -- -- --  ---------------  --------------------
  60 00 00 01 00 00 00 0a f9 2b f0 40 00     00:01:28.341  READ FPDMA QUEUED
  60 00 00 01 00 00 00 0a f9 2a f0 40 00     00:01:28.341  READ FPDMA QUEUED
  60 00 00 01 00 00 00 0a f9 22 f0 40 00     00:01:27.803  READ FPDMA QUEUED
  60 00 00 01 00 00 00 0a f8 a6 f0 40 00     00:01:27.803  READ FPDMA QUEUED
  60 00 00 01 00 00 00 0a f9 17 f0 40 00     00:01:27.803  READ FPDMA QUEUED

Error 33 [12] occurred at disk power-on lifetime: 1265 hours (52 days + 17 hours)
  When the command that caused the error occurred, the device was active or idle.

  After command completion occurred, registers were:
  ER -- ST COUNT  LBA_48  LH LM LL DV DC
  -- -- -- == -- == == == -- -- -- -- --
  40 -- 51 00 00 00 00 0a f9 25 16 00 00  Error: UNC at LBA = 0x0af92516 = 184100118

  Commands leading to the command that caused the error were:
  CR FEATR COUNT  LBA_48  LH LM LL DV DC  Powered_Up_Time  Command/Feature_Name
  -- == -- == -- == == == -- -- -- -- --  ---------------  --------------------
  60 00 00 01 00 00 00 0a f9 27 f0 40 00     00:01:27.356  READ FPDMA QUEUED
  60 00 00 01 00 00 00 0a f9 26 f0 40 00     00:01:27.244  READ FPDMA QUEUED
  60 00 00 01 00 00 00 0a f9 25 f0 40 00     00:01:27.244  READ FPDMA QUEUED
  60 00 00 01 00 00 00 0a f9 24 f0 40 00     00:01:26.805  READ FPDMA QUEUED
  60 00 00 01 00 00 00 0a f9 23 f0 40 00     00:01:26.804  READ FPDMA QUEUED

Error 32 [11] occurred at disk power-on lifetime: 1265 hours (52 days + 17 hours)
  When the command that caused the error occurred, the device was active or idle.

  After command completion occurred, registers were:
  ER -- ST COUNT  LBA_48  LH LM LL DV DC
  -- -- -- == -- == == == -- -- -- -- --
  40 -- 51 00 00 00 00 0a f8 9e 56 00 00  Error: UNC at LBA = 0x0af89e56 = 184065622

  Commands leading to the command that caused the error were:
  CR FEATR COUNT  LBA_48  LH LM LL DV DC  Powered_Up_Time  Command/Feature_Name
  -- == -- == -- == == == -- -- -- -- --  ---------------  --------------------
  60 00 00 01 00 00 00 0a f8 bf f0 40 00     00:01:25.881  READ FPDMA QUEUED
  60 00 00 01 00 00 00 0a f8 be f0 40 00     00:01:24.995  READ FPDMA QUEUED
  60 00 00 01 00 00 00 0a f8 bd f0 40 00     00:01:24.994  READ FPDMA QUEUED
  60 00 00 01 00 00 00 0a f8 bc f0 40 00     00:01:24.993  READ FPDMA QUEUED
  60 00 00 01 00 00 00 0a f8 bb f0 40 00     00:01:24.993  READ FPDMA QUEUED

SMART Extended Self-test Log Version: 1 (1 sectors)
Num  Test_Description    Status                  Remaining  LifeTime(hours)  LBA_of_first_error
# 1  Short offline       Completed without error       00%         0         -

SMART Selective self-test log data structure revision number 1
 SPAN  MIN_LBA  MAX_LBA  CURRENT_TEST_STATUS
    1        0        0  Not_testing
    2        0        0  Not_testing
    3        0        0  Not_testing
    4        0        0  Not_testing
    5        0        0  Not_testing
Selective self-test flags (0x0):
  After scanning selected spans, do NOT read-scan remainder of disk.
If Selective self-test is pending on power-up, resume after 0 minute delay.

SCT Status Version:                  3
SCT Version (vendor specific):       522 (0x020a)
Device State:                        Active (0)
Current Temperature:                    40 Celsius
Power Cycle Min/Max Temperature:     25/40 Celsius
Lifetime    Min/Max Temperature:     -2/48 Celsius
Specified Max Operating Temperature:    35 Celsius
Under/Over Temperature Limit Count:   0/0

SCT Temperature History Version:     2
Temperature Sampling Period:         1 minute
Temperature Logging Interval:        59 minutes
Min/Max recommended Temperature:     14/55 Celsius
Min/Max Temperature Limit:           10/60 Celsius
Temperature History Size (Index):    128 (124)

SCT Error Recovery Control command not supported

Device Statistics (GP Log 0x04)
Page  Offset Size        Value Flags Description
0x01  =====  =               =  ===  == General Statistics (rev 2) ==
0x01  0x008  4             581  ---  Lifetime Power-On Resets
0x01  0x010  4           17330  ---  Power-on Hours
0x01  0x018  6     11275088694  ---  Logical Sectors Written
0x01  0x020  6       426584413  ---  Number of Write Commands
0x01  0x028  6     23711259373  ---  Logical Sectors Read
0x01  0x030  6       263301212  ---  Number of Read Commands
0x01  0x038  6               -  ---  Date and Time TimeStamp
0x03  =====  =               =  ===  == Rotating Media Statistics (rev 1) ==
0x03  0x008  4             218  ---  Spindle Motor Power-on Hours
0x03  0x010  4             217  ---  Head Flying Hours
0x03  0x018  4            9102  ---  Head Load Events
0x03  0x020  4               0  ---  Number of Reallocated Logical Sectors
0x03  0x028  4               0  ---  Read Recovery Attempts
0x03  0x030  4               0  ---  Number of Mechanical Start Failures
0x04  =====  =               =  ===  == General Errors Statistics (rev 1) ==
0x04  0x008  4               0  ---  Number of Reported Uncorrectable Errors
0x04  0x010  4               5  ---  Resets Between Cmd Acceptance and Completion
0x07  =====  =               =  ===  == Solid State Device Statistics (rev 1) ==
0x07  0x008  1               0  ---  Percentage Used Endurance Indicator
                                |||_ C monitored condition met
                                ||__ D supports DSN
                                |___ N normalized value

Pending Defects log (GP Log 0x0c) not supported

SATA Phy Event Counters (GP Log 0x11)
ID      Size     Value  Description
0x000a  2            5  Device-to-host register FISes sent due to a COMRESET
0x0001  2            0  Command failed due to ICRC error
0x0003  2            0  R_ERR response for device-to-host data FIS
0x0004  2            0  R_ERR response for host-to-device data FIS
0x0006  2            0  R_ERR response for device-to-host non-data FIS
0x0007  2            0  R_ERR response for host-to-device non-data FIS

