smartctl 7.3 2022-02-28 r5338 [FreeBSD 13.1-RELEASE-p1 amd64] (local build)
Copyright (C) 2002-22, Bruce Allen, Christian Franke, www.smartmontools.org

=== START OF INFORMATION SECTION ===
Model Number:                       Samsung SSD 980 1TB
Serial Number:                      --
Firmware Version:                   2B4QFXO7
PCI Vendor/Subsystem ID:            0x144d
IEEE OUI Identifier:                0x002538
Total NVM Capacity:                 1,000,204,886,016 [1.00 TB]
Unallocated NVM Capacity:           0
Controller ID:                      5
NVMe Version:                       1.4
Number of Namespaces:               1
Namespace 1 Size/Capacity:          1,000,204,886,016 [1.00 TB]
Namespace 1 Utilization:            58,480,836,608 [58.4 GB]
Namespace 1 Formatted LBA Size:     512
Namespace 1 IEEE EUI-64:            002538 ...
Local Time is:                      Fri Aug 26 08:56:36 2022 CEST
Firmware Updates (0x16):            3 Slots, no Reset required
Optional Admin Commands (0x0017):   Security Format Frmw_DL Self_Test
Optional NVM Commands (0x0055):     Comp DS_Mngmt Sav/Sel_Feat Timestmp
Log Page Attributes (0x0f):         S/H_per_NS Cmd_Eff_Lg Ext_Get_Lg Telmtry_Lg
Maximum Data Transfer Size:         512 Pages
Warning  Comp. Temp. Threshold:     82 Celsius
Critical Comp. Temp. Threshold:     85 Celsius
Namespace 1 Features (0x10):        NP_Fields

Supported Power States
St Op     Max   Active     Idle   RL RT WL WT  Ent_Lat  Ex_Lat
 0 +     5.24W       -        -    0  0  0  0        0       0
 1 +     4.49W       -        -    1  1  1  1        0       0
 2 +     2.19W       -        -    2  2  2  2        0     500
 3 -   0.0500W       -        -    3  3  3  3      210    1200
 4 -   0.0050W       -        -    4  4  4  4     1000    9000

Supported LBA Sizes (NSID 0x1)
Id Fmt  Data  Metadt  Rel_Perf
 0 +     512       0         0

=== START OF SMART DATA SECTION ===
SMART overall-health self-assessment test result: PASSED

SMART/Health Information (NVMe Log 0x02)
Critical Warning:                   0x00
Temperature:                        40 Celsius
Available Spare:                    100%
Available Spare Threshold:          10%
Percentage Used:                    0%
Data Units Read:                    54,949 [28.1 GB]
Data Units Written:                 263,930 [135 GB]
Host Read Commands:                 1,075,270
Host Write Commands:                4,951,876
Controller Busy Time:               1
Power Cycles:                       34
Power On Hours:                     29
Unsafe Shutdowns:                   19
Media and Data Integrity Errors:    0
Error Information Log Entries:      0
Warning  Comp. Temperature Time:    0
Critical Comp. Temperature Time:    0
Temperature Sensor 1:               40 Celsius
Temperature Sensor 2:               41 Celsius

Error Information (NVMe Log 0x01, 16 of 64 entries)
No Errors Logged



