smartctl 7.4 2023-08-01 r5530 [FreeBSD 14.0-RELEASE amd64] (local build)
Copyright (C) 2002-23, Bruce Allen, Christian Franke, www.smartmontools.org

=== START OF INFORMATION SECTION ===
Model Family:     SK hynix SATA SSDs
Device Model:     SK hynix SC210 mSATA 256GB
Serial Number:    --
Firmware Version: 20001L00
User Capacity:    256,060,514,304 bytes [256 GB]
Sector Size:      512 bytes logical/physical
Rotation Rate:    Solid State Device
Form Factor:      mSATA
TRIM Command:     Available
Device is:        In smartctl database 7.3/5528
ATA Version is:   ATA8-ACS (minor revision not indicated)
SATA Version is:  SATA 3.1, 6.0 Gb/s (current: 6.0 Gb/s)
Local Time is:    Sun Jun  2 08:58:36 2024 CEST
SMART support is: Available - device has SMART capability.
SMART support is: Enabled
AAM feature is:   Unavailable
APM feature is:   Disabled
Rd look-ahead is: Enabled
Write cache is:   Enabled
DSN feature is:   Unavailable
ATA Security is:  Disabled, frozen [SEC2]
Wt Cache Reorder: Unavailable

=== START OF READ SMART DATA SECTION ===
SMART overall-health self-assessment test result: PASSED

General SMART Values:
Offline data collection status:  (0x02)	Offline data collection activity
					was completed without error.
					Auto Offline Data Collection: Disabled.
Self-test execution status:      (   0)	The previous self-test routine completed
					without error or no self-test has ever 
					been run.
Total time to complete Offline 
data collection: 		(    5) seconds.
Offline data collection
capabilities: 			 (0x19) SMART execute Offline immediate.
					No Auto Offline data collection support.
					Suspend Offline collection upon new
					command.
					Offline surface scan supported.
					Self-test supported.
					No Conveyance Self-test supported.
					No Selective Self-test supported.
SMART capabilities:            (0x0002)	Does not save SMART data before
					entering power-saving mode.
					Supports SMART auto save timer.
Error logging capability:        (0x01)	Error logging supported.
					General Purpose Logging supported.
Short self-test routine 
recommended polling time: 	 (   1) minutes.
Extended self-test routine
recommended polling time: 	 (  17) minutes.

SMART Attributes Data Structure revision number: 0
Vendor Specific SMART Attributes with Thresholds:
ID# ATTRIBUTE_NAME          FLAGS    VALUE WORST THRESH FAIL RAW_VALUE
  1 Raw_Read_Error_Rate     POSR--   166   166   006    -    0
  5 Retired_Block_Count     -O--CK   253   253   036    -    0
  9 Power_On_Hours          -O--CK   091   091   000    -    8664
 12 Power_Cycle_Count       -O--CK   100   100   020    -    5646
100 Total_Erase_Count       -O--CK   100   100   000    -    5396116
171 Program_Fail_Count      -O--CK   253   253   000    -    0
172 Erase_Fail_Count        -O--CK   253   253   000    -    0
174 Unexpect_Power_Loss_Ct  ----CK   100   100   000    -    3114
175 Program_Fail_Count_Chip -O--CK   253   253   000    -    0
176 Unused_Rsvd_Blk_Cnt_Tot -O--CK   253   253   000    -    0
177 Wear_Leveling_Count     -O--CK   098   098   000    -    83
178 Used_Rsvd_Blk_Cnt_Chip  -O--CK   100   100   000    -    44
179 Used_Rsvd_Blk_Cnt_Tot   -O--CK   100   100   000    -    401
180 Erase_Fail_Count        -O--CK   100   100   000    -    3951
181 Non4k_Aligned_Access    -O--CK   253   253   000    -    0
182 Erase_Fail_Count_Total  -O--CK   253   253   000    -    0
183 SATA_Downshift_Count    -O--CK   253   253   000    -    0
187 Reported_Uncorrect      -O--CK   100   100   000    -    538
188 Command_Timeout         -O--CK   253   253   000    -    0
191 Unknown_SK_hynix_Attrib -O--CK   253   253   000    -    0
194 Temperature_Celsius     -O----   041   000   000    -    41 (Min/Max 1/56)
195 Hardware_ECC_Recovered  -O--CK   100   001   000    -    106828805
201 Percent_Lifetime_Remain -OSR--   100   100   000    -    0
204 Soft_ECC_Correction     -OSR--   100   100   ---    -    0
231 SSD_Life_Left           PO--CK   253   253   ---    -    0
234 Unknown_SK_hynix_Attrib -O--CK   100   100   ---    -    18980
241 Total_Writes_GB         -O--CK   100   100   ---    -    14017
242 Total_Reads_GB          -O--CK   100   100   ---    -    27405
250 Read_Retry_Count        -O--CK   100   100   ---    -    1305
                            ||||||_ K auto-keep
                            |||||__ C event count
                            ||||___ R error rate
                            |||____ S speed/performance
                            ||_____ O updated online
                            |______ P prefailure warning

General Purpose Log Directory Version 1
SMART           Log Directory Version 1 [multi-sector log support]
Address    Access  R/W   Size  Description
0x00       GPL,SL  R/O      1  Log Directory
0x01           SL  R/O      1  Summary SMART error log
0x02           SL  R/O      4  Comprehensive SMART error log
0x03       GPL     R/O      5  Ext. Comprehensive SMART error log
0x04       GPL,SL  R/O      8  Device Statistics log
0x06           SL  R/O      1  SMART self-test log
0x07       GPL     R/O      2  Extended self-test log
0x10       GPL     R/O      1  NCQ Command Error log
0x11       GPL     R/O      1  SATA Phy Event Counters log
0x80-0x9f  GPL,SL  R/W     16  Host vendor specific log

SMART Extended Comprehensive Error Log Version: 1 (5 sectors)
Device Error Count: 18893 (device log contains only the most recent 20 errors)
	CR     = Command Register
	FEATR  = Features Register
	COUNT  = Count (was: Sector Count) Register
	LBA_48 = Upper bytes of LBA High/Mid/Low Registers ]  ATA-8
	LH     = LBA High (was: Cylinder High) Register    ]   LBA
	LM     = LBA Mid (was: Cylinder Low) Register      ] Register
	LL     = LBA Low (was: Sector Number) Register     ]
	DV     = Device (was: Device/Head) Register
	DC     = Device Control Register
	ER     = Error register
	ST     = Status register
Powered_Up_Time is measured from power on, and printed as
DDd+hh:mm:SS.sss where DD=days, hh=hours, mm=minutes,
SS=sec, and sss=millisec. It "wraps" after 49.710 days.

Error 18893 [12] occurred at disk power-on lifetime: 8663 hours (360 days + 23 hours)
  When the command that caused the error occurred, the device was in an unknown state.

  After command completion occurred, registers were:
  ER -- ST COUNT  LBA_48  LH LM LL DV DC
  -- -- -- == -- == == == -- -- -- -- --
  01 -- 50 00 01 00 00 00 00 00 01 00 00

  Commands leading to the command that caused the error were:
  CR FEATR COUNT  LBA_48  LH LM LL DV DC  Powered_Up_Time  Command/Feature_Name
  -- == -- == -- == == == -- -- -- -- --  ---------------  --------------------
  00 00 00 00 00 00 00 00 00 00 00 00 00     00:00:16.310  NOP [Abort queued commands]
  00 00 00 00 00 00 00 00 00 00 00 00 00     00:00:16.310  NOP [Abort queued commands]
  25 00 00 00 38 00 00 02 54 89 b0 40 40     00:00:09.930  READ DMA EXT
  25 00 00 00 08 00 00 03 57 48 d0 40 40     00:00:09.930  READ DMA EXT
  25 00 00 00 18 00 00 02 53 fc f0 40 40     00:00:09.910  READ DMA EXT

Error 18892 [11] occurred at disk power-on lifetime: 8663 hours (360 days + 23 hours)
  When the command that caused the error occurred, the device was in an unknown state.

  After command completion occurred, registers were:
  ER -- ST COUNT  LBA_48  LH LM LL DV DC
  -- -- -- == -- == == == -- -- -- -- --
  00 -- 00 00 00 00 00 00 00 00 00 00 ff   at LBA = 0x00000000 = 0

  Commands leading to the command that caused the error were:
  CR FEATR COUNT  LBA_48  LH LM LL DV DC  Powered_Up_Time  Command/Feature_Name
  -- == -- == -- == == == -- -- -- -- --  ---------------  --------------------
  25 00 00 00 38 00 00 02 54 89 b0 40 40     00:00:09.930  READ DMA EXT
  25 00 00 00 08 00 00 03 57 48 d0 40 40     00:00:09.930  READ DMA EXT
  25 00 00 00 18 00 00 02 53 fc f0 40 40     00:00:09.910  READ DMA EXT
  25 00 00 00 88 00 00 02 53 fd 08 40 40     00:00:09.910  READ DMA EXT
  25 00 00 00 08 00 00 02 54 83 e0 40 40     00:00:09.910  READ DMA EXT

Error 18891 [10] occurred at disk power-on lifetime: 8663 hours (360 days + 23 hours)
  When the command that caused the error occurred, the device was in an unknown state.

  After command completion occurred, registers were:
  ER -- ST COUNT  LBA_48  LH LM LL DV DC
  -- -- -- == -- == == == -- -- -- -- --
  00 -- 00 00 00 00 00 00 00 00 00 00 ff   at LBA = 0x00000000 = 0

  Commands leading to the command that caused the error were:
  CR FEATR COUNT  LBA_48  LH LM LL DV DC  Powered_Up_Time  Command/Feature_Name
  -- == -- == -- == == == -- -- -- -- --  ---------------  --------------------
  25 00 00 00 38 00 00 02 54 89 b0 40 40     00:00:09.930  READ DMA EXT
  25 00 00 00 08 00 00 03 57 48 d0 40 40     00:00:09.930  READ DMA EXT
  25 00 00 00 18 00 00 02 53 fc f0 40 40     00:00:09.910  READ DMA EXT
  25 00 00 00 88 00 00 02 53 fd 08 40 40     00:00:09.910  READ DMA EXT
  25 00 00 00 08 00 00 02 54 83 e0 40 40     00:00:09.910  READ DMA EXT

Error 18890 [9] occurred at disk power-on lifetime: 8663 hours (360 days + 23 hours)
  When the command that caused the error occurred, the device was in an unknown state.

  After command completion occurred, registers were:
  ER -- ST COUNT  LBA_48  LH LM LL DV DC
  -- -- -- == -- == == == -- -- -- -- --
  00 -- 00 00 00 00 00 00 00 00 00 00 ff

  Commands leading to the command that caused the error were:
  CR FEATR COUNT  LBA_48  LH LM LL DV DC  Powered_Up_Time  Command/Feature_Name
  -- == -- == -- == == == -- -- -- -- --  ---------------  --------------------
  f5 00 00 00 00 00 00 00 00 00 00 00 00     00:00:02.310  SECURITY FREEZE LOCK
  ec 00 00 00 00 00 00 00 00 00 00 00 00     00:00:02.290  IDENTIFY DEVICE
  ec 00 00 00 00 00 00 00 00 00 00 00 00     00:00:02.270  IDENTIFY DEVICE
  ec 00 00 00 00 00 00 00 00 00 00 00 00     00:00:02.270  IDENTIFY DEVICE
  ec 00 00 00 00 00 00 00 00 00 00 00 00     00:00:00.170  IDENTIFY DEVICE

Error 18889 [8] occurred at disk power-on lifetime: 8663 hours (360 days + 23 hours)
  When the command that caused the error occurred, the device was in an unknown state.

  After command completion occurred, registers were:
  ER -- ST COUNT  LBA_48  LH LM LL DV DC
  -- -- -- == -- == == == -- -- -- -- --
  01 -- 50 00 01 00 00 00 00 00 01 00 00

  Commands leading to the command that caused the error were:
  CR FEATR COUNT  LBA_48  LH LM LL DV DC  Powered_Up_Time  Command/Feature_Name
  -- == -- == -- == == == -- -- -- -- --  ---------------  --------------------
  00 00 00 00 00 00 00 00 00 00 00 00 00     00:00:33.570  NOP [Abort queued commands]
  00 00 00 00 00 00 00 00 00 00 00 00 00     00:00:33.570  NOP [Abort queued commands]
  25 00 00 00 08 00 00 03 57 4b 10 40 40     00:00:27.250  READ DMA EXT
  25 00 00 00 08 00 00 03 16 01 28 40 40     00:00:27.250  READ DMA EXT
  25 00 00 00 30 00 00 03 d6 6e c8 40 40     00:00:27.250  READ DMA EXT

Error 18888 [7] occurred at disk power-on lifetime: 8663 hours (360 days + 23 hours)
  When the command that caused the error occurred, the device was in an unknown state.

  After command completion occurred, registers were:
  ER -- ST COUNT  LBA_48  LH LM LL DV DC
  -- -- -- == -- == == == -- -- -- -- --
  00 -- 00 00 00 00 00 00 00 00 00 00 ff   at LBA = 0x00000000 = 0

  Commands leading to the command that caused the error were:
  CR FEATR COUNT  LBA_48  LH LM LL DV DC  Powered_Up_Time  Command/Feature_Name
  -- == -- == -- == == == -- -- -- -- --  ---------------  --------------------
  25 00 00 00 08 00 00 03 57 4b 10 40 40     00:00:27.250  READ DMA EXT
  25 00 00 00 08 00 00 03 16 01 28 40 40     00:00:27.250  READ DMA EXT
  25 00 00 00 30 00 00 03 d6 6e c8 40 40     00:00:27.250  READ DMA EXT
  25 00 00 00 60 00 00 03 d6 6e f8 40 40     00:00:27.250  READ DMA EXT
  25 00 00 00 08 00 00 03 d6 6f 58 40 40     00:00:27.250  READ DMA EXT

Error 18887 [6] occurred at disk power-on lifetime: 8663 hours (360 days + 23 hours)
  When the command that caused the error occurred, the device was in an unknown state.

  After command completion occurred, registers were:
  ER -- ST COUNT  LBA_48  LH LM LL DV DC
  -- -- -- == -- == == == -- -- -- -- --
  00 -- 00 00 00 00 00 00 00 00 00 00 ff   at LBA = 0x00000000 = 0

  Commands leading to the command that caused the error were:
  CR FEATR COUNT  LBA_48  LH LM LL DV DC  Powered_Up_Time  Command/Feature_Name
  -- == -- == -- == == == -- -- -- -- --  ---------------  --------------------
  25 00 00 00 08 00 00 03 57 4b 10 40 40     00:00:27.250  READ DMA EXT
  25 00 00 00 08 00 00 03 16 01 28 40 40     00:00:27.250  READ DMA EXT
  25 00 00 00 30 00 00 03 d6 6e c8 40 40     00:00:27.250  READ DMA EXT
  25 00 00 00 60 00 00 03 d6 6e f8 40 40     00:00:27.250  READ DMA EXT
  25 00 00 00 08 00 00 03 d6 6f 58 40 40     00:00:27.250  READ DMA EXT

Error 18886 [5] occurred at disk power-on lifetime: 8663 hours (360 days + 23 hours)
  When the command that caused the error occurred, the device was in an unknown state.

  After command completion occurred, registers were:
  ER -- ST COUNT  LBA_48  LH LM LL DV DC
  -- -- -- == -- == == == -- -- -- -- --
  01 -- 50 00 01 00 00 00 00 00 01 00 00

  Commands leading to the command that caused the error were:
  CR FEATR COUNT  LBA_48  LH LM LL DV DC  Powered_Up_Time  Command/Feature_Name
  -- == -- == -- == == == -- -- -- -- --  ---------------  --------------------
  00 00 00 00 00 00 00 00 00 00 00 00 00     00:00:19.700  NOP [Abort queued commands]
  00 00 00 00 00 00 00 00 00 00 00 00 00     00:00:19.700  NOP [Abort queued commands]
  25 00 00 00 08 00 00 03 48 48 28 40 40     00:00:09.710  READ DMA EXT
  25 00 00 00 03 00 00 03 48 4b 30 40 40     00:00:09.710  READ DMA EXT
  25 00 00 00 08 00 00 03 d7 cd 78 40 40     00:00:09.710  READ DMA EXT

Warning! SMART Extended Self-test Log Structure (1/2) error: invalid SMART checksum.
SMART Extended Self-test Log Version: 1 (2 sectors)
Num  Test_Description    Status                  Remaining  LifeTime(hours)  LBA_of_first_error
# 1  Short offline       Completed without error       00%      8663         -
# 2  Short offline       Completed without error       00%      8609         -
# 3  Short offline       Completed without error       00%      8584         -
# 4  Short offline       Completed without error       00%      8583         -
# 5  Short offline       Completed without error       00%      8571         -
# 6  Short offline       Completed without error       00%      8570         -
# 7  Short offline       Completed without error       00%      8570         -
# 8  Short offline       Completed without error       00%      8570         -
# 9  Short offline       Completed without error       00%      8560         -
#10  Short offline       Completed without error       00%      8551         -
#11  Short offline       Completed without error       00%      8547         -
#12  Short offline       Completed without error       00%      8535         -
#13  Short offline       Completed without error       00%      8534         -
#14  Short offline       Completed without error       00%      8534         -
#15  Short offline       Completed without error       00%      8521         -
#16  Short offline       Completed without error       00%      8511         -
#17  Short offline       Completed without error       00%      8459         -
#18  Short offline       Completed without error       00%      8449         -
#19  Short offline       Completed without error       00%      8388         -
#20  Short offline       Completed without error       00%      8210         -
#21  Short offline       Completed without error       00%      8058         -
#22  Short offline       Completed without error       00%      8039         -
#23  Short offline       Completed without error       00%      8039         -
#24  Short offline       Completed without error       00%      7972         -
#25  Short offline       Completed without error       00%      7212         -

Selective Self-tests/Logging not supported

SCT Commands not supported

Device Statistics (GP Log 0x04)
Page  Offset Size        Value Flags Description
0x01  =====  =               =  ===  == General Statistics (empty) ==
0x04  =====  =               =  ===  == General Errors Statistics (empty) ==
0x05  =====  =               =  ===  == Temperature Statistics (empty) ==
0x06  =====  =               =  ===  == Transport Statistics (empty) ==
0x07  =====  =               =  ===  == Solid State Device Statistics (empty) ==
                                |||_ C monitored condition met
                                ||__ D supports DSN
                                |___ N normalized value

Pending Defects log (GP Log 0x0c) not supported

SATA Phy Event Counters (GP Log 0x11)
ID      Size     Value  Description
0x0001  2            0  Command failed due to ICRC error
0x000a  2            4  Device-to-host register FISes sent due to a COMRESET

