smartctl 7.1 2019-12-30 r5022 [FreeBSD 12.1-RELEASE-p10 amd64] (local build)
Copyright (C) 2002-19, Bruce Allen, Christian Franke, www.smartmontools.org

=== START OF INFORMATION SECTION ===
Model Family:     SK hynix SATA SSDs
Device Model:     SK hynix SC210 mSATA 256GB
Serial Number:    --
Firmware Version: 20001L00
User Capacity:    256,060,514,304 bytes [256 GB]
Sector Size:      512 bytes logical/physical
Rotation Rate:    Solid State Device
Form Factor:      mSATA
Device is:        In smartctl database [for details use: -P show]
ATA Version is:   ATA8-ACS (minor revision not indicated)
SATA Version is:  SATA 3.1, 6.0 Gb/s (current: 6.0 Gb/s)
Local Time is:    Mon Oct 19 20:32:07 2020 CDT
SMART support is: Available - device has SMART capability.
SMART support is: Enabled
AAM feature is:   Unavailable
APM feature is:   Disabled
Rd look-ahead is: Enabled
Write cache is:   Enabled
DSN feature is:   Unavailable
ATA Security is:  Disabled, frozen [SEC2]
Wt Cache Reorder: Unavailable

=== START OF READ SMART DATA SECTION ===
SMART overall-health self-assessment test result: PASSED

General SMART Values:
Offline data collection status:  (0x02)	Offline data collection activity
					was completed without error.
					Auto Offline Data Collection: Disabled.
Self-test execution status:      (   0)	The previous self-test routine completed
					without error or no self-test has ever 
					been run.
Total time to complete Offline 
data collection: 		(    5) seconds.
Offline data collection
capabilities: 			 (0x19) SMART execute Offline immediate.
					No Auto Offline data collection support.
					Suspend Offline collection upon new
					command.
					Offline surface scan supported.
					Self-test supported.
					No Conveyance Self-test supported.
					No Selective Self-test supported.
SMART capabilities:            (0x0002)	Does not save SMART data before
					entering power-saving mode.
					Supports SMART auto save timer.
Error logging capability:        (0x01)	Error logging supported.
					General Purpose Logging supported.
Short self-test routine 
recommended polling time: 	 (   1) minutes.
Extended self-test routine
recommended polling time: 	 (  17) minutes.

SMART Attributes Data Structure revision number: 0
Vendor Specific SMART Attributes with Thresholds:
ID# ATTRIBUTE_NAME          FLAGS    VALUE WORST THRESH FAIL RAW_VALUE
  1 Raw_Read_Error_Rate     POSR--   166   166   006    -    0
  5 Retired_Block_Count     -O--CK   253   253   036    -    0
  9 Power_On_Hours          -O--CK   090   090   000    -    9510
 12 Power_Cycle_Count       -O--CK   100   100   020    -    5411
100 Total_Erase_Count       -O--CK   100   100   000    -    8694135
171 Program_Fail_Count      -O--CK   253   253   000    -    0
172 Erase_Fail_Count        -O--CK   253   253   000    -    0
174 Unexpect_Power_Loss_Ct  ----CK   100   100   000    -    371
175 Program_Fail_Count_Chip -O--CK   253   253   000    -    0
176 Unused_Rsvd_Blk_Cnt_Tot -O--CK   253   253   000    -    0
177 Wear_Leveling_Count     -O--CK   096   096   000    -    129
178 Used_Rsvd_Blk_Cnt_Chip  -O--CK   100   100   000    -    27
179 Used_Rsvd_Blk_Cnt_Tot   -O--CK   100   100   000    -    133
180 Erase_Fail_Count        -O--CK   100   100   000    -    4219
181 Non4k_Aligned_Access    -O--CK   253   253   000    -    0
182 Erase_Fail_Count_Total  -O--CK   253   253   000    -    0
183 SATA_Downshift_Count    -O--CK   253   253   000    -    0
187 Reported_Uncorrect      -O--CK   100   100   000    -    139
188 Command_Timeout         -O--CK   253   253   000    -    0
191 Unknown_SSD_Attribute   -O--CK   253   253   000    -    0
194 Temperature_Celsius     -O----   035   000   000    -    35 (Min/Max 1/68)
195 Hardware_ECC_Recovered  -O--CK   100   099   000    -    296205365
201 Percent_Lifetime_Remain -OSR--   100   100   000    -    0
204 Soft_ECC_Correction     -OSR--   100   100   ---    -    0
231 SSD_Life_Left           PO--CK   253   253   ---    -    1
234 Unknown_SK_hynix_Attrib -O--CK   100   100   ---    -    32694
241 Total_Writes_GiB        -O--CK   100   100   ---    -    13703
242 Total_Reads_GiB         -O--CK   100   100   ---    -    19632
250 Read_Retry_Count        -O--CK   100   100   ---    -    273
                            ||||||_ K auto-keep
                            |||||__ C event count
                            ||||___ R error rate
                            |||____ S speed/performance
                            ||_____ O updated online
                            |______ P prefailure warning

General Purpose Log Directory Version 1
SMART           Log Directory Version 1 [multi-sector log support]
Address    Access  R/W   Size  Description
0x00       GPL,SL  R/O      1  Log Directory
0x01           SL  R/O      1  Summary SMART error log
0x02           SL  R/O      4  Comprehensive SMART error log
0x03       GPL     R/O      5  Ext. Comprehensive SMART error log
0x04       GPL,SL  R/O      8  Device Statistics log
0x06           SL  R/O      1  SMART self-test log
0x07       GPL     R/O      2  Extended self-test log
0x10       GPL     R/O      1  NCQ Command Error log
0x11       GPL     R/O      1  SATA Phy Event Counters log
0x80-0x9f  GPL,SL  R/W     16  Host vendor specific log

SMART Extended Comprehensive Error Log Version: 1 (5 sectors)
Device Error Count: 25765 (device log contains only the most recent 20 errors)
	CR     = Command Register
	FEATR  = Features Register
	COUNT  = Count (was: Sector Count) Register
	LBA_48 = Upper bytes of LBA High/Mid/Low Registers ]  ATA-8
	LH     = LBA High (was: Cylinder High) Register    ]   LBA
	LM     = LBA Mid (was: Cylinder Low) Register      ] Register
	LL     = LBA Low (was: Sector Number) Register     ]
	DV     = Device (was: Device/Head) Register
	DC     = Device Control Register
	ER     = Error register
	ST     = Status register
Powered_Up_Time is measured from power on, and printed as
DDd+hh:mm:SS.sss where DD=days, hh=hours, mm=minutes,
SS=sec, and sss=millisec. It "wraps" after 49.710 days.

Error 25765 [4] occurred at disk power-on lifetime: 9509 hours (396 days + 5 hours)
  When the command that caused the error occurred, the device was in an unknown state.

  After command completion occurred, registers were:
  ER -- ST COUNT  LBA_48  LH LM LL DV DC
  -- -- -- == -- == == == -- -- -- -- --
  01 -- 50 00 01 00 00 00 00 00 01 00 00

  Commands leading to the command that caused the error were:
  CR FEATR COUNT  LBA_48  LH LM LL DV DC  Powered_Up_Time  Command/Feature_Name
  -- == -- == -- == == == -- -- -- -- --  ---------------  --------------------
  00 00 00 00 00 00 00 00 00 00 00 00 00     02:00:30.300  NOP [Abort queued commands]
  00 00 00 00 00 00 00 00 00 00 00 00 00     02:00:30.300  NOP [Abort queued commands]
  00 00 00 00 00 00 00 00 00 00 00 00 00     02:00:30.290  NOP [Abort queued commands]
  00 00 00 00 00 00 00 00 00 00 00 00 00     02:00:30.290  NOP [Abort queued commands]
  25 00 00 00 08 00 00 1c 00 9a 10 40 40     02:00:24.010  READ DMA EXT

Error 25764 [3] occurred at disk power-on lifetime: 9509 hours (396 days + 5 hours)
  When the command that caused the error occurred, the device was in an unknown state.

  After command completion occurred, registers were:
  ER -- ST COUNT  LBA_48  LH LM LL DV DC
  -- -- -- == -- == == == -- -- -- -- --
  01 -- 50 00 01 00 00 00 00 00 01 00 00

  Commands leading to the command that caused the error were:
  CR FEATR COUNT  LBA_48  LH LM LL DV DC  Powered_Up_Time  Command/Feature_Name
  -- == -- == -- == == == -- -- -- -- --  ---------------  --------------------
  00 00 00 00 00 00 00 00 00 00 00 00 00     02:00:30.290  NOP [Abort queued commands]
  00 00 00 00 00 00 00 00 00 00 00 00 00     02:00:30.290  NOP [Abort queued commands]
  25 00 00 00 08 00 00 1c 00 9a 10 40 40     02:00:24.010  READ DMA EXT
  25 00 00 00 40 00 00 1b ff 33 e8 40 40     02:00:24.010  READ DMA EXT
  25 00 00 00 08 00 00 1b ff d0 a8 40 40     02:00:24.010  READ DMA EXT

Error 25763 [2] occurred at disk power-on lifetime: 9509 hours (396 days + 5 hours)
  When the command that caused the error occurred, the device was in an unknown state.

  After command completion occurred, registers were:
  ER -- ST COUNT  LBA_48  LH LM LL DV DC
  -- -- -- == -- == == == -- -- -- -- --
  00 -- 00 00 00 00 00 00 00 00 00 00 ff   at LBA = 0x00000000 = 0

  Commands leading to the command that caused the error were:
  CR FEATR COUNT  LBA_48  LH LM LL DV DC  Powered_Up_Time  Command/Feature_Name
  -- == -- == -- == == == -- -- -- -- --  ---------------  --------------------
  25 00 00 00 08 00 00 1c 00 9a 10 40 40     02:00:24.010  READ DMA EXT
  25 00 00 00 40 00 00 1b ff 33 e8 40 40     02:00:24.010  READ DMA EXT
  25 00 00 00 08 00 00 1b ff d0 a8 40 40     02:00:24.010  READ DMA EXT
  25 00 00 00 40 00 00 1b ff 33 e8 40 40     02:00:24.010  READ DMA EXT
  25 00 00 00 08 00 00 00 07 df 28 40 40     02:00:24.010  READ DMA EXT

Error 25762 [1] occurred at disk power-on lifetime: 9509 hours (396 days + 5 hours)
  When the command that caused the error occurred, the device was in an unknown state.

  After command completion occurred, registers were:
  ER -- ST COUNT  LBA_48  LH LM LL DV DC
  -- -- -- == -- == == == -- -- -- -- --
  00 -- 00 00 00 00 00 00 00 00 00 00 ff   at LBA = 0x00000000 = 0

  Commands leading to the command that caused the error were:
  CR FEATR COUNT  LBA_48  LH LM LL DV DC  Powered_Up_Time  Command/Feature_Name
  -- == -- == -- == == == -- -- -- -- --  ---------------  --------------------
  25 00 00 00 08 00 00 1c 00 9a 10 40 40     02:00:24.010  READ DMA EXT
  25 00 00 00 40 00 00 1b ff 33 e8 40 40     02:00:24.010  READ DMA EXT
  25 00 00 00 08 00 00 1b ff d0 a8 40 40     02:00:24.010  READ DMA EXT
  25 00 00 00 40 00 00 1b ff 33 e8 40 40     02:00:24.010  READ DMA EXT
  25 00 00 00 08 00 00 00 07 df 28 40 40     02:00:24.010  READ DMA EXT

Error 25761 [0] occurred at disk power-on lifetime: 9509 hours (396 days + 5 hours)
  When the command that caused the error occurred, the device was in an unknown state.

  After command completion occurred, registers were:
  ER -- ST COUNT  LBA_48  LH LM LL DV DC
  -- -- -- == -- == == == -- -- -- -- --
  00 -- 00 00 00 00 00 00 00 00 00 00 ff

  Commands leading to the command that caused the error were:
  CR FEATR COUNT  LBA_48  LH LM LL DV DC  Powered_Up_Time  Command/Feature_Name
  -- == -- == -- == == == -- -- -- -- --  ---------------  --------------------
  ec 00 00 00 00 00 00 00 00 00 00 00 00     02:00:18.190  IDENTIFY DEVICE
  ec 00 00 00 00 00 00 00 00 00 00 00 00     02:00:18.190  IDENTIFY DEVICE
  ec 00 00 00 00 00 00 00 00 00 00 00 00     02:00:18.150  IDENTIFY DEVICE
  ec 00 00 00 00 00 00 00 00 00 00 00 00     02:00:18.110  IDENTIFY DEVICE
  ec 00 00 00 00 00 00 00 00 00 00 00 00     02:00:18.110  IDENTIFY DEVICE

Error 25760 [19] occurred at disk power-on lifetime: 9509 hours (396 days + 5 hours)
  When the command that caused the error occurred, the device was in an unknown state.

  After command completion occurred, registers were:
  ER -- ST COUNT  LBA_48  LH LM LL DV DC
  -- -- -- == -- == == == -- -- -- -- --
  00 -- 00 00 00 00 00 00 00 00 00 00 ff

  Commands leading to the command that caused the error were:
  CR FEATR COUNT  LBA_48  LH LM LL DV DC  Powered_Up_Time  Command/Feature_Name
  -- == -- == -- == == == -- -- -- -- --  ---------------  --------------------
  ef 00 10 00 06 00 00 00 00 00 00 00 00     02:00:18.030  SET FEATURES [Enable SATA feature]
  ef 00 90 00 06 00 00 00 00 00 00 00 00     02:00:17.980  SET FEATURES [Disable SATA feature]
  ec 00 00 00 00 00 00 00 00 00 00 00 00     02:00:17.980  IDENTIFY DEVICE
  ec 00 00 00 00 00 00 00 00 00 00 00 00     02:00:17.980  IDENTIFY DEVICE
  b0 00 d2 00 f1 00 00 00 c2 4f 00 00 00     02:00:17.930  SMART ENABLE/DISABLE ATTRIBUTE AUTOSAVE

Error 25759 [18] occurred at disk power-on lifetime: 9509 hours (396 days + 5 hours)
  When the command that caused the error occurred, the device was in an unknown state.

  After command completion occurred, registers were:
  ER -- ST COUNT  LBA_48  LH LM LL DV DC
  -- -- -- == -- == == == -- -- -- -- --
  00 -- 00 00 00 00 00 00 00 00 00 00 ff

  Commands leading to the command that caused the error were:
  CR FEATR COUNT  LBA_48  LH LM LL DV DC  Powered_Up_Time  Command/Feature_Name
  -- == -- == -- == == == -- -- -- -- --  ---------------  --------------------
  e1 00 00 00 00 00 00 00 00 00 00 40 40     02:00:04.940  IDLE IMMEDIATE
  ea 00 00 00 00 00 00 00 00 00 00 40 40     02:00:04.840  FLUSH CACHE EXT
  61 00 08 00 c8 00 00 00 06 40 a8 40 40     02:00:04.840  WRITE FPDMA QUEUED
  61 00 10 00 c0 00 00 00 06 de 28 40 40     02:00:04.840  WRITE FPDMA QUEUED
  61 00 08 00 b8 00 00 00 06 40 a8 40 40     02:00:00.390  WRITE FPDMA QUEUED

Error 25758 [17] occurred at disk power-on lifetime: 9509 hours (396 days + 5 hours)
  When the command that caused the error occurred, the device was in an unknown state.

  After command completion occurred, registers were:
  ER -- ST COUNT  LBA_48  LH LM LL DV DC
  -- -- -- == -- == == == -- -- -- -- --
  00 -- 00 00 00 00 00 00 00 00 00 00 ff

  Commands leading to the command that caused the error were:
  CR FEATR COUNT  LBA_48  LH LM LL DV DC  Powered_Up_Time  Command/Feature_Name
  -- == -- == -- == == == -- -- -- -- --  ---------------  --------------------
  e1 00 00 00 00 00 00 00 00 00 00 40 40     02:00:04.940  IDLE IMMEDIATE
  ea 00 00 00 00 00 00 00 00 00 00 40 40     02:00:04.840  FLUSH CACHE EXT
  61 00 08 00 c8 00 00 00 06 40 a8 40 40     02:00:04.840  WRITE FPDMA QUEUED
  61 00 10 00 c0 00 00 00 06 de 28 40 40     02:00:04.840  WRITE FPDMA QUEUED
  61 00 08 00 b8 00 00 00 06 40 a8 40 40     02:00:00.390  WRITE FPDMA QUEUED

SMART Extended Self-test Log Version: 1 (2 sectors)
Num  Test_Description    Status                  Remaining  LifeTime(hours)  LBA_of_first_error
# 1  Short offline       Completed without error       00%      9178         -
# 2  Short offline       Completed without error       00%      8654         -
# 3  Short offline       Completed without error       00%         0         -

Selective Self-tests/Logging not supported

SCT Commands not supported

Device Statistics (GP Log 0x04)
Page  Offset Size        Value Flags Description
0x01  =====  =               =  ===  == General Statistics (empty) ==
0x04  =====  =               =  ===  == General Errors Statistics (empty) ==
0x05  =====  =               =  ===  == Temperature Statistics (empty) ==
0x06  =====  =               =  ===  == Transport Statistics (empty) ==
0x07  =====  =               =  ===  == Solid State Device Statistics (empty) ==
                                |||_ C monitored condition met
                                ||__ D supports DSN
                                |___ N normalized value

Pending Defects log (GP Log 0x0c) not supported

SATA Phy Event Counters (GP Log 0x11)
ID      Size     Value  Description
0x0001  2            0  Command failed due to ICRC error
0x000a  2           11  Device-to-host register FISes sent due to a COMRESET

