smartctl 7.2 2021-09-14 r5236 [FreeBSD 13.0-RELEASE-p7 amd64] (local build)
Copyright (C) 2002-20, Bruce Allen, Christian Franke, www.smartmontools.org

=== START OF INFORMATION SECTION ===
Model Family:     Western Digital Red
Device Model:     WDC WD40EFRX-68WT0N0
Serial Number:    --
LU WWN Device Id: 5 0014ee ...
Firmware Version: 82.00A82
User Capacity:    4,000,787,030,016 bytes [4.00 TB]
Sector Sizes:     512 bytes logical, 4096 bytes physical
Rotation Rate:    5400 rpm
Device is:        In smartctl database [for details use: -P show]
ATA Version is:   ACS-2 (minor revision not indicated)
SATA Version is:  SATA 3.0, 6.0 Gb/s (current: 6.0 Gb/s)
Local Time is:    Sun Mar  6 12:09:46 2022 EST
SMART support is: Available - device has SMART capability.
SMART support is: Enabled
AAM feature is:   Unavailable
APM feature is:   Unavailable
Rd look-ahead is: Enabled
Write cache is:   Enabled
DSN feature is:   Unavailable
ATA Security is:  Disabled, NOT FROZEN [SEC1]
Wt Cache Reorder: Enabled

=== START OF READ SMART DATA SECTION ===
SMART overall-health self-assessment test result: PASSED

General SMART Values:
Offline data collection status:  (0x82)	Offline data collection activity
					was completed without error.
					Auto Offline Data Collection: Enabled.
Self-test execution status:      (   0)	The previous self-test routine completed
					without error or no self-test has ever 
					been run.
Total time to complete Offline 
data collection: 		(52980) seconds.
Offline data collection
capabilities: 			 (0x7b) SMART execute Offline immediate.
					Auto Offline data collection on/off support.
					Suspend Offline collection upon new
					command.
					Offline surface scan supported.
					Self-test supported.
					Conveyance Self-test supported.
					Selective Self-test supported.
SMART capabilities:            (0x0003)	Saves SMART data before entering
					power-saving mode.
					Supports SMART auto save timer.
Error logging capability:        (0x01)	Error logging supported.
					General Purpose Logging supported.
Short self-test routine 
recommended polling time: 	 (   2) minutes.
Extended self-test routine
recommended polling time: 	 ( 530) minutes.
Conveyance self-test routine
recommended polling time: 	 (   5) minutes.
SCT capabilities: 	       (0x703d)	SCT Status supported.
					SCT Error Recovery Control supported.
					SCT Feature Control supported.
					SCT Data Table supported.

SMART Attributes Data Structure revision number: 16
Vendor Specific SMART Attributes with Thresholds:
ID# ATTRIBUTE_NAME          FLAGS    VALUE WORST THRESH FAIL RAW_VALUE
  1 Raw_Read_Error_Rate     POSR-K   200   200   051    -    0
  3 Spin_Up_Time            POS--K   208   180   021    -    6600
  4 Start_Stop_Count        -O--CK   100   100   000    -    366
  5 Reallocated_Sector_Ct   PO--CK   200   200   140    -    0
  7 Seek_Error_Rate         -OSR-K   100   253   000    -    0
  9 Power_On_Hours          -O--CK   026   026   000    -    54623
 10 Spin_Retry_Count        -O--CK   100   100   000    -    0
 11 Calibration_Retry_Count -O--CK   100   100   000    -    0
 12 Power_Cycle_Count       -O--CK   100   100   000    -    153
192 Power-Off_Retract_Count -O--CK   200   200   000    -    137
193 Load_Cycle_Count        -O--CK   199   199   000    -    5038
194 Temperature_Celsius     -O---K   120   105   000    -    32
196 Reallocated_Event_Count -O--CK   200   200   000    -    0
197 Current_Pending_Sector  -O--CK   200   200   000    -    0
198 Offline_Uncorrectable   ----CK   200   200   000    -    0
199 UDMA_CRC_Error_Count    -O--CK   200   200   000    -    0
200 Multi_Zone_Error_Rate   ---R--   200   200   000    -    0
                            ||||||_ K auto-keep
                            |||||__ C event count
                            ||||___ R error rate
                            |||____ S speed/performance
                            ||_____ O updated online
                            |______ P prefailure warning

General Purpose Log Directory Version 1
SMART           Log Directory Version 1 [multi-sector log support]
Address    Access  R/W   Size  Description
0x00       GPL,SL  R/O      1  Log Directory
0x01           SL  R/O      1  Summary SMART error log
0x02           SL  R/O      5  Comprehensive SMART error log
0x03       GPL     R/O      6  Ext. Comprehensive SMART error log
0x06           SL  R/O      1  SMART self-test log
0x07       GPL     R/O      1  Extended self-test log
0x09           SL  R/W      1  Selective self-test log
0x10       GPL     R/O      1  NCQ Command Error log
0x11       GPL     R/O      1  SATA Phy Event Counters log
0x21       GPL     R/O      1  Write stream error log
0x22       GPL     R/O      1  Read stream error log
0x80-0x9f  GPL,SL  R/W     16  Host vendor specific log
0xa0-0xa7  GPL,SL  VS      16  Device vendor specific log
0xa8-0xb7  GPL,SL  VS       1  Device vendor specific log
0xbd       GPL,SL  VS       1  Device vendor specific log
0xc0       GPL,SL  VS       1  Device vendor specific log
0xc1       GPL     VS      93  Device vendor specific log
0xe0       GPL,SL  R/W      1  SCT Command/Status
0xe1       GPL,SL  R/W      1  SCT Data Transfer

SMART Extended Comprehensive Error Log Version: 1 (6 sectors)
Device Error Count: 650 (device log contains only the most recent 24 errors)
	CR     = Command Register
	FEATR  = Features Register
	COUNT  = Count (was: Sector Count) Register
	LBA_48 = Upper bytes of LBA High/Mid/Low Registers ]  ATA-8
	LH     = LBA High (was: Cylinder High) Register    ]   LBA
	LM     = LBA Mid (was: Cylinder Low) Register      ] Register
	LL     = LBA Low (was: Sector Number) Register     ]
	DV     = Device (was: Device/Head) Register
	DC     = Device Control Register
	ER     = Error register
	ST     = Status register
Powered_Up_Time is measured from power on, and printed as
DDd+hh:mm:SS.sss where DD=days, hh=hours, mm=minutes,
SS=sec, and sss=millisec. It "wraps" after 49.710 days.

Error 650 [1] occurred at disk power-on lifetime: 42096 hours (1754 days + 0 hours)
  When the command that caused the error occurred, the device was active or idle.

  After command completion occurred, registers were:
  ER -- ST COUNT  LBA_48  LH LM LL DV DC
  -- -- -- == -- == == == -- -- -- -- --
  04 -- 61 00 00 00 01 d1 c0 bc 80 00 00  Device Fault; Error: ABRT at LBA = 0x1d1c0bc80 = 7814036608

  Commands leading to the command that caused the error were:
  CR FEATR COUNT  LBA_48  LH LM LL DV DC  Powered_Up_Time  Command/Feature_Name
  -- == -- == -- == == == -- -- -- -- --  ---------------  --------------------
  60 01 00 00 38 00 01 d1 c0 bc 80 40 08 12d+08:25:24.921  READ FPDMA QUEUED
  2f 00 00 00 01 00 00 00 00 00 10 40 08 12d+08:25:24.892  READ LOG EXT
  60 01 00 00 28 00 01 d1 c0 bc 80 40 08 12d+08:25:24.776  READ FPDMA QUEUED
  2f 00 00 00 01 00 00 00 00 00 10 40 08 12d+08:25:24.748  READ LOG EXT
  60 01 00 00 18 00 01 d1 c0 bc 80 40 08 12d+08:25:24.632  READ FPDMA QUEUED

Error 649 [0] occurred at disk power-on lifetime: 42096 hours (1754 days + 0 hours)
  When the command that caused the error occurred, the device was active or idle.

  After command completion occurred, registers were:
  ER -- ST COUNT  LBA_48  LH LM LL DV DC
  -- -- -- == -- == == == -- -- -- -- --
  04 -- 61 00 00 00 01 d1 c0 bc 80 00 00  Device Fault; Error: ABRT at LBA = 0x1d1c0bc80 = 7814036608

  Commands leading to the command that caused the error were:
  CR FEATR COUNT  LBA_48  LH LM LL DV DC  Powered_Up_Time  Command/Feature_Name
  -- == -- == -- == == == -- -- -- -- --  ---------------  --------------------
  60 01 00 00 28 00 01 d1 c0 bc 80 40 08 12d+08:25:24.776  READ FPDMA QUEUED
  2f 00 00 00 01 00 00 00 00 00 10 40 08 12d+08:25:24.748  READ LOG EXT
  60 01 00 00 18 00 01 d1 c0 bc 80 40 08 12d+08:25:24.632  READ FPDMA QUEUED
  2f 00 00 00 01 00 00 00 00 00 10 40 08 12d+08:25:24.604  READ LOG EXT
  60 01 00 00 08 00 01 d1 c0 bc 80 40 08 12d+08:25:24.488  READ FPDMA QUEUED

Error 648 [23] occurred at disk power-on lifetime: 42096 hours (1754 days + 0 hours)
  When the command that caused the error occurred, the device was active or idle.

  After command completion occurred, registers were:
  ER -- ST COUNT  LBA_48  LH LM LL DV DC
  -- -- -- == -- == == == -- -- -- -- --
  04 -- 61 00 00 00 01 d1 c0 bc 80 00 00  Device Fault; Error: ABRT at LBA = 0x1d1c0bc80 = 7814036608

  Commands leading to the command that caused the error were:
  CR FEATR COUNT  LBA_48  LH LM LL DV DC  Powered_Up_Time  Command/Feature_Name
  -- == -- == -- == == == -- -- -- -- --  ---------------  --------------------
  60 01 00 00 18 00 01 d1 c0 bc 80 40 08 12d+08:25:24.632  READ FPDMA QUEUED
  2f 00 00 00 01 00 00 00 00 00 10 40 08 12d+08:25:24.604  READ LOG EXT
  60 01 00 00 08 00 01 d1 c0 bc 80 40 08 12d+08:25:24.488  READ FPDMA QUEUED
  2f 00 00 00 01 00 00 00 00 00 10 40 08 12d+08:25:24.459  READ LOG EXT
  60 01 00 00 f8 00 01 d1 c0 bc 80 40 08 12d+08:25:24.343  READ FPDMA QUEUED

Error 647 [22] occurred at disk power-on lifetime: 42096 hours (1754 days + 0 hours)
  When the command that caused the error occurred, the device was active or idle.

  After command completion occurred, registers were:
  ER -- ST COUNT  LBA_48  LH LM LL DV DC
  -- -- -- == -- == == == -- -- -- -- --
  04 -- 61 00 00 00 01 d1 c0 bc 80 00 00  Device Fault; Error: ABRT at LBA = 0x1d1c0bc80 = 7814036608

  Commands leading to the command that caused the error were:
  CR FEATR COUNT  LBA_48  LH LM LL DV DC  Powered_Up_Time  Command/Feature_Name
  -- == -- == -- == == == -- -- -- -- --  ---------------  --------------------
  60 01 00 00 08 00 01 d1 c0 bc 80 40 08 12d+08:25:24.488  READ FPDMA QUEUED
  2f 00 00 00 01 00 00 00 00 00 10 40 08 12d+08:25:24.459  READ LOG EXT
  60 01 00 00 f8 00 01 d1 c0 bc 80 40 08 12d+08:25:24.343  READ FPDMA QUEUED
  2f 00 00 00 01 00 00 00 00 00 10 40 08 12d+08:25:24.315  READ LOG EXT
  60 01 00 00 e8 00 01 d1 c0 ba 80 40 08 12d+08:25:24.199  READ FPDMA QUEUED

Error 646 [21] occurred at disk power-on lifetime: 42096 hours (1754 days + 0 hours)
  When the command that caused the error occurred, the device was active or idle.

  After command completion occurred, registers were:
  ER -- ST COUNT  LBA_48  LH LM LL DV DC
  -- -- -- == -- == == == -- -- -- -- --
  04 -- 61 00 00 00 01 d1 c0 bc 80 00 00  Device Fault; Error: ABRT at LBA = 0x1d1c0bc80 = 7814036608

  Commands leading to the command that caused the error were:
  CR FEATR COUNT  LBA_48  LH LM LL DV DC  Powered_Up_Time  Command/Feature_Name
  -- == -- == -- == == == -- -- -- -- --  ---------------  --------------------
  60 01 00 00 f8 00 01 d1 c0 bc 80 40 08 12d+08:25:24.343  READ FPDMA QUEUED
  2f 00 00 00 01 00 00 00 00 00 10 40 08 12d+08:25:24.315  READ LOG EXT
  60 01 00 00 e8 00 01 d1 c0 ba 80 40 08 12d+08:25:24.199  READ FPDMA QUEUED
  2f 00 00 00 01 00 00 00 00 00 10 40 08 12d+08:25:24.171  READ LOG EXT
  60 01 00 00 d8 00 01 d1 c0 ba 80 40 08 12d+08:25:24.052  READ FPDMA QUEUED

Error 645 [20] occurred at disk power-on lifetime: 42096 hours (1754 days + 0 hours)
  When the command that caused the error occurred, the device was active or idle.

  After command completion occurred, registers were:
  ER -- ST COUNT  LBA_48  LH LM LL DV DC
  -- -- -- == -- == == == -- -- -- -- --
  04 -- 61 00 00 00 01 d1 c0 bc 80 00 00  Device Fault; Error: ABRT at LBA = 0x1d1c0bc80 = 7814036608

  Commands leading to the command that caused the error were:
  CR FEATR COUNT  LBA_48  LH LM LL DV DC  Powered_Up_Time  Command/Feature_Name
  -- == -- == -- == == == -- -- -- -- --  ---------------  --------------------
  60 01 00 00 e8 00 01 d1 c0 ba 80 40 08 12d+08:25:24.199  READ FPDMA QUEUED
  2f 00 00 00 01 00 00 00 00 00 10 40 08 12d+08:25:24.171  READ LOG EXT
  60 01 00 00 d8 00 01 d1 c0 ba 80 40 08 12d+08:25:24.052  READ FPDMA QUEUED
  2f 00 00 00 01 00 00 00 00 00 10 40 08 12d+08:25:24.015  READ LOG EXT
  60 01 00 00 c8 00 01 d1 c0 ba 80 40 08 12d+08:25:23.899  READ FPDMA QUEUED

Error 644 [19] occurred at disk power-on lifetime: 42096 hours (1754 days + 0 hours)
  When the command that caused the error occurred, the device was active or idle.

  After command completion occurred, registers were:
  ER -- ST COUNT  LBA_48  LH LM LL DV DC
  -- -- -- == -- == == == -- -- -- -- --
  04 -- 61 00 00 00 01 d1 c0 bc 80 00 00  Device Fault; Error: ABRT at LBA = 0x1d1c0bc80 = 7814036608

  Commands leading to the command that caused the error were:
  CR FEATR COUNT  LBA_48  LH LM LL DV DC  Powered_Up_Time  Command/Feature_Name
  -- == -- == -- == == == -- -- -- -- --  ---------------  --------------------
  60 01 00 00 d8 00 01 d1 c0 ba 80 40 08 12d+08:25:24.052  READ FPDMA QUEUED
  2f 00 00 00 01 00 00 00 00 00 10 40 08 12d+08:25:24.015  READ LOG EXT
  60 01 00 00 c8 00 01 d1 c0 ba 80 40 08 12d+08:25:23.899  READ FPDMA QUEUED
  2f 00 00 00 01 00 00 00 00 00 10 40 08 12d+08:25:23.871  READ LOG EXT
  60 01 00 00 b8 00 01 d1 c0 ba 80 40 08 12d+08:25:23.755  READ FPDMA QUEUED

Error 643 [18] occurred at disk power-on lifetime: 42096 hours (1754 days + 0 hours)
  When the command that caused the error occurred, the device was active or idle.

  After command completion occurred, registers were:
  ER -- ST COUNT  LBA_48  LH LM LL DV DC
  -- -- -- == -- == == == -- -- -- -- --
  04 -- 61 00 00 00 01 d1 c0 bc 80 00 00  Device Fault; Error: ABRT at LBA = 0x1d1c0bc80 = 7814036608

  Commands leading to the command that caused the error were:
  CR FEATR COUNT  LBA_48  LH LM LL DV DC  Powered_Up_Time  Command/Feature_Name
  -- == -- == -- == == == -- -- -- -- --  ---------------  --------------------
  60 01 00 00 c8 00 01 d1 c0 ba 80 40 08 12d+08:25:23.899  READ FPDMA QUEUED
  2f 00 00 00 01 00 00 00 00 00 10 40 08 12d+08:25:23.871  READ LOG EXT
  60 01 00 00 b8 00 01 d1 c0 ba 80 40 08 12d+08:25:23.755  READ FPDMA QUEUED
  2f 00 00 00 01 00 00 00 00 00 10 40 08 12d+08:25:23.727  READ LOG EXT
  60 01 00 00 a8 00 01 d1 c0 ba 80 40 08 12d+08:25:23.610  READ FPDMA QUEUED

SMART Extended Self-test Log Version: 1 (1 sectors)
Num  Test_Description    Status                  Remaining  LifeTime(hours)  LBA_of_first_error
# 1  Short offline       Completed without error       00%     54622         -
# 2  Short offline       Completed without error       00%     54612         -
# 3  Conveyance offline  Completed without error       00%     54611         -
# 4  Extended offline    Completed without error       00%     51735         -
# 5  Extended offline    Completed without error       00%     46422         -

SMART Selective self-test log data structure revision number 1
 SPAN  MIN_LBA  MAX_LBA  CURRENT_TEST_STATUS
    1        0        0  Not_testing
    2        0        0  Not_testing
    3        0        0  Not_testing
    4        0        0  Not_testing
    5        0        0  Not_testing
Selective self-test flags (0x0):
  After scanning selected spans, do NOT read-scan remainder of disk.
If Selective self-test is pending on power-up, resume after 0 minute delay.

SCT Status Version:                  3
SCT Version (vendor specific):       258 (0x0102)
Device State:                        Active (0)
Current Temperature:                    32 Celsius
Power Cycle Min/Max Temperature:     24/38 Celsius
Lifetime    Min/Max Temperature:      3/47 Celsius
Under/Over Temperature Limit Count:   0/0
Vendor specific:
01 00 00 00 00 00 00 00 00 00 00 00 00 00 00 00
00 00 00 00 00 00 00 00 00 00 00 00 00 00 00 00

SCT Temperature History Version:     2
Temperature Sampling Period:         1 minute
Temperature Logging Interval:        1 minute
Min/Max recommended Temperature:      0/60 Celsius
Min/Max Temperature Limit:           -41/85 Celsius
Temperature History Size (Index):    478 (305)

SCT Error Recovery Control:
           Read:      1 (0.1 seconds)
          Write:      1 (0.1 seconds)

Device Statistics (GP/SMART Log 0x04) not supported

Pending Defects log (GP Log 0x0c) not supported

SATA Phy Event Counters (GP Log 0x11)
ID      Size     Value  Description
0x0001  2            0  Command failed due to ICRC error
0x0002  2            0  R_ERR response for data FIS
0x0003  2            0  R_ERR response for device-to-host data FIS
0x0004  2            0  R_ERR response for host-to-device data FIS
0x0005  2            0  R_ERR response for non-data FIS
0x0006  2            0  R_ERR response for device-to-host non-data FIS
0x0007  2            0  R_ERR response for host-to-device non-data FIS
0x0008  2            0  Device-to-host non-data FIS retries
0x0009  2            8  Transition from drive PhyRdy to drive PhyNRdy
0x000a  2            9  Device-to-host register FISes sent due to a COMRESET
0x000b  2            0  CRC errors within host-to-device FIS
0x000f  2            0  R_ERR response for host-to-device data FIS, CRC
0x0012  2            0  R_ERR response for host-to-device non-data FIS, CRC
0x8000  4       772502  Vendor specific



