smartctl 7.4 2023-08-01 r5530 [FreeBSD 14.0-STABLE amd64] (local build)
Copyright (C) 2002-23, Bruce Allen, Christian Franke, www.smartmontools.org

=== START OF INFORMATION SECTION ===
Model Family:     Western Digital Red
Device Model:     WDC WD40EFRX-68WT0N0
Serial Number:    --
LU WWN Device Id: 5 0014ee ...
Firmware Version: 82.00A82
User Capacity:    4,000,787,030,016 bytes [4.00 TB]
Sector Sizes:     512 bytes logical, 4096 bytes physical
Rotation Rate:    5400 rpm
Device is:        In smartctl database 7.3/5528
ATA Version is:   ACS-2 (minor revision not indicated)
SATA Version is:  SATA 3.0, 6.0 Gb/s (current: 6.0 Gb/s)
Local Time is:    Sun Jan 21 08:01:46 2024 EST
SMART support is: Available - device has SMART capability.
SMART support is: Enabled
AAM feature is:   Unavailable
APM feature is:   Unavailable
Rd look-ahead is: Enabled
Write cache is:   Enabled
DSN feature is:   Unavailable
ATA Security is:  Disabled, frozen [SEC2]
Wt Cache Reorder: Enabled

=== START OF READ SMART DATA SECTION ===
SMART overall-health self-assessment test result: PASSED

General SMART Values:
Offline data collection status:  (0x00)	Offline data collection activity
					was never started.
					Auto Offline Data Collection: Disabled.
Self-test execution status:      (   0)	The previous self-test routine completed
					without error or no self-test has ever 
					been run.
Total time to complete Offline 
data collection: 		(53760) seconds.
Offline data collection
capabilities: 			 (0x7b) SMART execute Offline immediate.
					Auto Offline data collection on/off support.
					Suspend Offline collection upon new
					command.
					Offline surface scan supported.
					Self-test supported.
					Conveyance Self-test supported.
					Selective Self-test supported.
SMART capabilities:            (0x0003)	Saves SMART data before entering
					power-saving mode.
					Supports SMART auto save timer.
Error logging capability:        (0x01)	Error logging supported.
					General Purpose Logging supported.
Short self-test routine 
recommended polling time: 	 (   2) minutes.
Extended self-test routine
recommended polling time: 	 ( 537) minutes.
Conveyance self-test routine
recommended polling time: 	 (   5) minutes.
SCT capabilities: 	       (0x703d)	SCT Status supported.
					SCT Error Recovery Control supported.
					SCT Feature Control supported.
					SCT Data Table supported.

SMART Attributes Data Structure revision number: 16
Vendor Specific SMART Attributes with Thresholds:
ID# ATTRIBUTE_NAME          FLAGS    VALUE WORST THRESH FAIL RAW_VALUE
  1 Raw_Read_Error_Rate     POSR-K   200   200   051    -    0
  3 Spin_Up_Time            POS--K   183   175   021    -    7816
  4 Start_Stop_Count        -O--CK   100   100   000    -    227
  5 Reallocated_Sector_Ct   PO--CK   200   200   140    -    0
  7 Seek_Error_Rate         -OSR-K   200   200   000    -    0
  9 Power_On_Hours          -O--CK   001   001   000    -    76666
 10 Spin_Retry_Count        -O--CK   100   100   000    -    0
 11 Calibration_Retry_Count -O--CK   100   100   000    -    0
 12 Power_Cycle_Count       -O--CK   100   100   000    -    167
192 Power-Off_Retract_Count -O--CK   200   200   000    -    98
193 Load_Cycle_Count        -O--CK   197   197   000    -    10695
194 Temperature_Celsius     -O---K   116   104   000    -    36
196 Reallocated_Event_Count -O--CK   200   200   000    -    0
197 Current_Pending_Sector  -O--CK   200   200   000    -    0
198 Offline_Uncorrectable   ----CK   100   253   000    -    0
199 UDMA_CRC_Error_Count    -O--CK   200   200   000    -    0
200 Multi_Zone_Error_Rate   ---R--   100   253   000    -    0
                            ||||||_ K auto-keep
                            |||||__ C event count
                            ||||___ R error rate
                            |||____ S speed/performance
                            ||_____ O updated online
                            |______ P prefailure warning

General Purpose Log Directory Version 1
SMART           Log Directory Version 1 [multi-sector log support]
Address    Access  R/W   Size  Description
0x00       GPL,SL  R/O      1  Log Directory
0x01           SL  R/O      1  Summary SMART error log
0x02           SL  R/O      5  Comprehensive SMART error log
0x03       GPL     R/O      6  Ext. Comprehensive SMART error log
0x06           SL  R/O      1  SMART self-test log
0x07       GPL     R/O      1  Extended self-test log
0x09           SL  R/W      1  Selective self-test log
0x10       GPL     R/O      1  NCQ Command Error log
0x11       GPL     R/O      1  SATA Phy Event Counters log
0x21       GPL     R/O      1  Write stream error log
0x22       GPL     R/O      1  Read stream error log
0x80-0x9f  GPL,SL  R/W     16  Host vendor specific log
0xa0-0xa7  GPL,SL  VS      16  Device vendor specific log
0xa8-0xb7  GPL,SL  VS       1  Device vendor specific log
0xbd       GPL,SL  VS       1  Device vendor specific log
0xc0       GPL,SL  VS       1  Device vendor specific log
0xc1       GPL     VS      93  Device vendor specific log
0xe0       GPL,SL  R/W      1  SCT Command/Status
0xe1       GPL,SL  R/W      1  SCT Data Transfer

SMART Extended Comprehensive Error Log Version: 1 (6 sectors)
Device Error Count: 9
	CR     = Command Register
	FEATR  = Features Register
	COUNT  = Count (was: Sector Count) Register
	LBA_48 = Upper bytes of LBA High/Mid/Low Registers ]  ATA-8
	LH     = LBA High (was: Cylinder High) Register    ]   LBA
	LM     = LBA Mid (was: Cylinder Low) Register      ] Register
	LL     = LBA Low (was: Sector Number) Register     ]
	DV     = Device (was: Device/Head) Register
	DC     = Device Control Register
	ER     = Error register
	ST     = Status register
Powered_Up_Time is measured from power on, and printed as
DDd+hh:mm:SS.sss where DD=days, hh=hours, mm=minutes,
SS=sec, and sss=millisec. It "wraps" after 49.710 days.

Error 9 [8] occurred at disk power-on lifetime: 36541 hours (1522 days + 13 hours)
  When the command that caused the error occurred, the device was active or idle.

  After command completion occurred, registers were:
  ER -- ST COUNT  LBA_48  LH LM LL DV DC
  -- -- -- == -- == == == -- -- -- -- --
  40 -- 51 00 00 00 00 24 5f 95 30 40 00  Error: UNC at LBA = 0x245f9530 = 610243888

  Commands leading to the command that caused the error were:
  CR FEATR COUNT  LBA_48  LH LM LL DV DC  Powered_Up_Time  Command/Feature_Name
  -- == -- == -- == == == -- -- -- -- --  ---------------  --------------------
  60 01 00 00 98 00 00 24 5f 95 30 40 08 12d+14:23:01.994  READ FPDMA QUEUED
  60 01 00 00 90 00 00 24 5f 94 30 40 08 12d+14:23:00.549  READ FPDMA QUEUED
  60 01 00 00 88 00 00 24 5f 93 30 40 08 12d+14:22:59.593  READ FPDMA QUEUED
  60 01 00 00 80 00 00 24 5f 92 30 40 08 12d+14:22:58.558  READ FPDMA QUEUED
  60 01 00 00 78 00 00 24 5f 91 30 40 08 12d+14:22:57.357  READ FPDMA QUEUED

Error 8 [7] occurred at disk power-on lifetime: 36283 hours (1511 days + 19 hours)
  When the command that caused the error occurred, the device was active or idle.

  After command completion occurred, registers were:
  ER -- ST COUNT  LBA_48  LH LM LL DV DC
  -- -- -- == -- == == == -- -- -- -- --
  40 -- 51 00 01 00 00 e2 e9 c4 30 40 00  Error: UNC at LBA = 0xe2e9c430 = 3806970928

  Commands leading to the command that caused the error were:
  CR FEATR COUNT  LBA_48  LH LM LL DV DC  Powered_Up_Time  Command/Feature_Name
  -- == -- == -- == == == -- -- -- -- --  ---------------  --------------------
  60 00 40 00 60 00 00 e2 e9 c4 30 40 08  1d+20:35:48.793  READ FPDMA QUEUED
  61 00 08 00 58 00 00 00 00 00 b0 40 08  1d+20:35:45.342  WRITE FPDMA QUEUED
  61 00 40 00 50 00 00 00 00 9e b0 40 08  1d+20:35:45.342  WRITE FPDMA QUEUED
  61 00 40 00 48 00 00 00 00 9e 70 40 08  1d+20:35:45.342  WRITE FPDMA QUEUED
  61 00 40 00 40 00 00 00 00 9e 30 40 08  1d+20:35:45.341  WRITE FPDMA QUEUED

Error 7 [6] occurred at disk power-on lifetime: 36239 hours (1509 days + 23 hours)
  When the command that caused the error occurred, the device was active or idle.

  After command completion occurred, registers were:
  ER -- ST COUNT  LBA_48  LH LM LL DV DC
  -- -- -- == -- == == == -- -- -- -- --
  40 -- 51 00 00 00 00 00 00 00 b0 40 00  Error: UNC at LBA = 0x000000b0 = 176

  Commands leading to the command that caused the error were:
  CR FEATR COUNT  LBA_48  LH LM LL DV DC  Powered_Up_Time  Command/Feature_Name
  -- == -- == -- == == == -- -- -- -- --  ---------------  --------------------
  60 00 10 00 40 00 00 00 00 00 b0 40 08     00:03:53.271  READ FPDMA QUEUED
  60 00 08 00 38 00 00 00 00 00 30 40 08     00:03:43.578  READ FPDMA QUEUED
  60 00 08 00 30 00 00 00 00 00 38 40 08     00:03:43.578  READ FPDMA QUEUED
  60 00 08 00 28 00 00 00 00 00 30 40 08     00:03:43.578  READ FPDMA QUEUED
  60 00 08 00 20 00 00 00 00 00 38 40 08     00:03:43.578  READ FPDMA QUEUED

Error 6 [5] occurred at disk power-on lifetime: 36204 hours (1508 days + 12 hours)
  When the command that caused the error occurred, the device was active or idle.

  After command completion occurred, registers were:
  ER -- ST COUNT  LBA_48  LH LM LL DV DC
  -- -- -- == -- == == == -- -- -- -- --
  40 -- 51 00 00 00 00 73 d7 89 b0 40 00  Error: UNC at LBA = 0x73d789b0 = 1943505328

  Commands leading to the command that caused the error were:
  CR FEATR COUNT  LBA_48  LH LM LL DV DC  Powered_Up_Time  Command/Feature_Name
  -- == -- == -- == == == -- -- -- -- --  ---------------  --------------------
  60 01 00 00 20 00 00 73 d7 89 b0 40 08 34d+14:40:02.627  READ FPDMA QUEUED
  60 01 00 00 18 00 00 73 d7 88 b0 40 08 34d+14:40:01.049  READ FPDMA QUEUED
  60 01 00 00 10 00 00 73 d7 87 b0 40 08 34d+14:40:00.248  READ FPDMA QUEUED
  60 01 00 00 08 00 00 73 d7 86 b0 40 08 34d+14:39:59.768  READ FPDMA QUEUED
  60 01 00 00 00 00 00 73 d7 85 b0 40 08 34d+14:39:59.458  READ FPDMA QUEUED

Error 5 [4] occurred at disk power-on lifetime: 36166 hours (1506 days + 22 hours)
  When the command that caused the error occurred, the device was active or idle.

  After command completion occurred, registers were:
  ER -- ST COUNT  LBA_48  LH LM LL DV DC
  -- -- -- == -- == == == -- -- -- -- --
  40 -- 51 00 00 00 00 d9 ee c0 b0 40 00  Error: UNC at LBA = 0xd9eec0b0 = 3656302768

  Commands leading to the command that caused the error were:
  CR FEATR COUNT  LBA_48  LH LM LL DV DC  Powered_Up_Time  Command/Feature_Name
  -- == -- == -- == == == -- -- -- -- --  ---------------  --------------------
  60 00 40 00 b8 00 00 d9 ee c0 b0 40 08 33d+00:04:05.111  READ FPDMA QUEUED
  60 00 80 00 b0 00 01 28 70 c2 f0 40 08 33d+00:03:47.280  READ FPDMA QUEUED
  60 01 00 00 a8 00 01 28 70 c1 f0 40 08 33d+00:03:46.531  READ FPDMA QUEUED
  60 01 00 00 a0 00 01 28 70 c0 f0 40 08 33d+00:03:46.101  READ FPDMA QUEUED
  60 01 00 00 98 00 01 28 70 bf f0 40 08 33d+00:03:45.531  READ FPDMA QUEUED

Error 4 [3] occurred at disk power-on lifetime: 35732 hours (1488 days + 20 hours)
  When the command that caused the error occurred, the device was active or idle.

  After command completion occurred, registers were:
  ER -- ST COUNT  LBA_48  LH LM LL DV DC
  -- -- -- == -- == == == -- -- -- -- --
  40 -- 51 00 00 00 00 06 5b 33 30 40 00  Error: UNC at LBA = 0x065b3330 = 106640176

  Commands leading to the command that caused the error were:
  CR FEATR COUNT  LBA_48  LH LM LL DV DC  Powered_Up_Time  Command/Feature_Name
  -- == -- == -- == == == -- -- -- -- --  ---------------  --------------------
  60 01 00 00 58 00 00 06 5b 33 30 40 08 14d+22:15:36.746  READ FPDMA QUEUED
  60 01 00 00 50 00 00 06 5b 32 30 40 08 14d+22:15:36.744  READ FPDMA QUEUED
  60 01 00 00 48 00 00 06 5b 31 30 40 08 14d+22:15:36.744  READ FPDMA QUEUED
  60 01 00 00 40 00 00 06 5b 30 30 40 08 14d+22:15:36.694  READ FPDMA QUEUED
  60 01 00 00 38 00 00 06 5b 2f 30 40 08 14d+22:15:36.443  READ FPDMA QUEUED

Error 3 [2] occurred at disk power-on lifetime: 24154 hours (1006 days + 10 hours)
  When the command that caused the error occurred, the device was active or idle.

  After command completion occurred, registers were:
  ER -- ST COUNT  LBA_48  LH LM LL DV DC
  -- -- -- == -- == == == -- -- -- -- --
  40 -- 51 00 00 00 00 29 8d d5 30 40 00  Error: UNC at LBA = 0x298dd530 = 697161008

  Commands leading to the command that caused the error were:
  CR FEATR COUNT  LBA_48  LH LM LL DV DC  Powered_Up_Time  Command/Feature_Name
  -- == -- == -- == == == -- -- -- -- --  ---------------  --------------------
  60 01 00 00 c8 00 00 29 8d d5 30 40 08  5d+01:00:12.301  READ FPDMA QUEUED
  60 01 00 00 c0 00 00 29 8d d4 30 40 08  5d+01:00:12.240  READ FPDMA QUEUED
  60 01 00 00 b8 00 00 29 8d d3 30 40 08  5d+01:00:12.069  READ FPDMA QUEUED
  60 01 00 00 b0 00 00 29 8d d2 30 40 08  5d+01:00:11.870  READ FPDMA QUEUED
  60 01 00 00 a8 00 00 29 8d d1 30 40 08  5d+01:00:11.800  READ FPDMA QUEUED

Error 2 [1] occurred at disk power-on lifetime: 24054 hours (1002 days + 6 hours)
  When the command that caused the error occurred, the device was active or idle.

  After command completion occurred, registers were:
  ER -- ST COUNT  LBA_48  LH LM LL DV DC
  -- -- -- == -- == == == -- -- -- -- --
  40 -- 51 00 00 00 00 e0 47 50 30 40 00  Error: UNC at LBA = 0xe0475030 = 3762769968

  Commands leading to the command that caused the error were:
  CR FEATR COUNT  LBA_48  LH LM LL DV DC  Powered_Up_Time  Command/Feature_Name
  -- == -- == -- == == == -- -- -- -- --  ---------------  --------------------
  60 01 00 00 30 00 00 e0 47 50 30 40 08     20:15:41.006  READ FPDMA QUEUED
  60 01 00 00 28 00 00 e0 47 4f 30 40 08     20:15:41.003  READ FPDMA QUEUED
  60 01 00 00 20 00 00 e0 47 4e 30 40 08     20:15:39.672  READ FPDMA QUEUED
  60 01 00 00 18 00 00 e0 47 4d 30 40 08     20:15:38.090  READ FPDMA QUEUED
  60 01 00 00 10 00 00 e0 47 4c 30 40 08     20:15:36.719  READ FPDMA QUEUED

SMART Extended Self-test Log Version: 1 (1 sectors)
Num  Test_Description    Status                  Remaining  LifeTime(hours)  LBA_of_first_error
# 1  Short offline       Completed without error       00%     36192         -
# 2  Short offline       Completed without error       00%       111         -

SMART Selective self-test log data structure revision number 1
 SPAN  MIN_LBA  MAX_LBA  CURRENT_TEST_STATUS
    1        0        0  Not_testing
    2        0        0  Not_testing
    3        0        0  Not_testing
    4        0        0  Not_testing
    5        0        0  Not_testing
Selective self-test flags (0x0):
  After scanning selected spans, do NOT read-scan remainder of disk.
If Selective self-test is pending on power-up, resume after 0 minute delay.

SCT Status Version:                  3
SCT Version (vendor specific):       258 (0x0102)
Device State:                        Active (0)
Current Temperature:                    36 Celsius
Power Cycle Min/Max Temperature:     36/41 Celsius
Lifetime    Min/Max Temperature:     15/49 Celsius
Under/Over Temperature Limit Count:   0/0
Vendor specific:
01 00 00 00 00 00 00 00 00 00 00 00 00 00 00 00
00 00 00 00 00 00 00 00 00 00 00 00 00 00 00 00

SCT Temperature History Version:     2
Temperature Sampling Period:         1 minute
Temperature Logging Interval:        1 minute
Min/Max recommended Temperature:      0/60 Celsius
Min/Max Temperature Limit:           -41/85 Celsius
Temperature History Size (Index):    478 (397)

SCT Error Recovery Control:
           Read:     70 (7.0 seconds)
          Write:     70 (7.0 seconds)

Device Statistics (GP/SMART Log 0x04) not supported

Pending Defects log (GP Log 0x0c) not supported

SATA Phy Event Counters (GP Log 0x11)
ID      Size     Value  Description
0x0001  2            0  Command failed due to ICRC error
0x0002  2            0  R_ERR response for data FIS
0x0003  2            0  R_ERR response for device-to-host data FIS
0x0004  2            0  R_ERR response for host-to-device data FIS
0x0005  2            0  R_ERR response for non-data FIS
0x0006  2            0  R_ERR response for device-to-host non-data FIS
0x0007  2            0  R_ERR response for host-to-device non-data FIS
0x0008  2            0  Device-to-host non-data FIS retries
0x0009  2            9  Transition from drive PhyRdy to drive PhyNRdy
0x000a  2            9  Device-to-host register FISes sent due to a COMRESET
0x000b  2            0  CRC errors within host-to-device FIS
0x000f  2            0  R_ERR response for host-to-device data FIS, CRC
0x0012  2            0  R_ERR response for host-to-device non-data FIS, CRC
0x8000  4        40968  Vendor specific



