smartctl 7.2 2020-12-30 r5155 [FreeBSD 13.0-STABLE-HBSD amd64] (local build)
Copyright (C) 2002-20, Bruce Allen, Christian Franke, www.smartmontools.org

=== START OF INFORMATION SECTION ===
Model Family:     Western Digital Red
Device Model:     WDC WD40EFRX-68WT0N0
Serial Number:    --
LU WWN Device Id: 5 0014ee ...
Firmware Version: 82.00A82
User Capacity:    4,000,787,030,016 bytes [4.00 TB]
Sector Sizes:     512 bytes logical, 4096 bytes physical
Rotation Rate:    5400 rpm
Device is:        In smartctl database [for details use: -P show]
ATA Version is:   ACS-2 (minor revision not indicated)
SATA Version is:  SATA 3.0, 6.0 Gb/s (current: 6.0 Gb/s)
Local Time is:    Wed Mar 17 09:40:19 2021 CET
SMART support is: Available - device has SMART capability.
SMART support is: Enabled
AAM feature is:   Unavailable
APM feature is:   Unavailable
Rd look-ahead is: Enabled
Write cache is:   Enabled
DSN feature is:   Unavailable
ATA Security is:  Disabled, NOT FROZEN [SEC1]
Wt Cache Reorder: Enabled

=== START OF READ SMART DATA SECTION ===
SMART overall-health self-assessment test result: PASSED

General SMART Values:
Offline data collection status:  (0x00)	Offline data collection activity
					was never started.
					Auto Offline Data Collection: Disabled.
Self-test execution status:      (   0)	The previous self-test routine completed
					without error or no self-test has ever 
					been run.
Total time to complete Offline 
data collection: 		(53460) seconds.
Offline data collection
capabilities: 			 (0x7b) SMART execute Offline immediate.
					Auto Offline data collection on/off support.
					Suspend Offline collection upon new
					command.
					Offline surface scan supported.
					Self-test supported.
					Conveyance Self-test supported.
					Selective Self-test supported.
SMART capabilities:            (0x0003)	Saves SMART data before entering
					power-saving mode.
					Supports SMART auto save timer.
Error logging capability:        (0x01)	Error logging supported.
					General Purpose Logging supported.
Short self-test routine 
recommended polling time: 	 (   2) minutes.
Extended self-test routine
recommended polling time: 	 ( 534) minutes.
Conveyance self-test routine
recommended polling time: 	 (   5) minutes.
SCT capabilities: 	       (0x703d)	SCT Status supported.
					SCT Error Recovery Control supported.
					SCT Feature Control supported.
					SCT Data Table supported.

SMART Attributes Data Structure revision number: 16
Vendor Specific SMART Attributes with Thresholds:
ID# ATTRIBUTE_NAME          FLAGS    VALUE WORST THRESH FAIL RAW_VALUE
  1 Raw_Read_Error_Rate     POSR-K   200   200   051    -    10
  3 Spin_Up_Time            POS--K   177   168   021    -    8133
  4 Start_Stop_Count        -O--CK   100   100   000    -    470
  5 Reallocated_Sector_Ct   PO--CK   200   200   140    -    0
  7 Seek_Error_Rate         -OSR-K   200   200   000    -    0
  9 Power_On_Hours          -O--CK   041   041   000    -    43727
 10 Spin_Retry_Count        -O--CK   100   100   000    -    0
 11 Calibration_Retry_Count -O--CK   100   100   000    -    0
 12 Power_Cycle_Count       -O--CK   100   100   000    -    360
192 Power-Off_Retract_Count -O--CK   200   200   000    -    250
193 Load_Cycle_Count        -O--CK   194   194   000    -    20026
194 Temperature_Celsius     -O---K   129   103   000    -    23
196 Reallocated_Event_Count -O--CK   200   200   000    -    0
197 Current_Pending_Sector  -O--CK   200   200   000    -    0
198 Offline_Uncorrectable   ----CK   100   253   000    -    0
199 UDMA_CRC_Error_Count    -O--CK   200   200   000    -    0
200 Multi_Zone_Error_Rate   ---R--   100   253   000    -    0
                            ||||||_ K auto-keep
                            |||||__ C event count
                            ||||___ R error rate
                            |||____ S speed/performance
                            ||_____ O updated online
                            |______ P prefailure warning

General Purpose Log Directory Version 1
SMART           Log Directory Version 1 [multi-sector log support]
Address    Access  R/W   Size  Description
0x00       GPL,SL  R/O      1  Log Directory
0x01           SL  R/O      1  Summary SMART error log
0x02           SL  R/O      5  Comprehensive SMART error log
0x03       GPL     R/O      6  Ext. Comprehensive SMART error log
0x06           SL  R/O      1  SMART self-test log
0x07       GPL     R/O      1  Extended self-test log
0x09           SL  R/W      1  Selective self-test log
0x10       GPL     R/O      1  NCQ Command Error log
0x11       GPL     R/O      1  SATA Phy Event Counters log
0x21       GPL     R/O      1  Write stream error log
0x22       GPL     R/O      1  Read stream error log
0x80-0x9f  GPL,SL  R/W     16  Host vendor specific log
0xa0-0xa7  GPL,SL  VS      16  Device vendor specific log
0xa8-0xb6  GPL,SL  VS       1  Device vendor specific log
0xb7       GPL,SL  VS      39  Device vendor specific log
0xbd       GPL,SL  VS       1  Device vendor specific log
0xc0       GPL,SL  VS       1  Device vendor specific log
0xc1       GPL     VS      93  Device vendor specific log
0xe0       GPL,SL  R/W      1  SCT Command/Status
0xe1       GPL,SL  R/W      1  SCT Data Transfer

SMART Extended Comprehensive Error Log Version: 1 (6 sectors)
Device Error Count: 13
	CR     = Command Register
	FEATR  = Features Register
	COUNT  = Count (was: Sector Count) Register
	LBA_48 = Upper bytes of LBA High/Mid/Low Registers ]  ATA-8
	LH     = LBA High (was: Cylinder High) Register    ]   LBA
	LM     = LBA Mid (was: Cylinder Low) Register      ] Register
	LL     = LBA Low (was: Sector Number) Register     ]
	DV     = Device (was: Device/Head) Register
	DC     = Device Control Register
	ER     = Error register
	ST     = Status register
Powered_Up_Time is measured from power on, and printed as
DDd+hh:mm:SS.sss where DD=days, hh=hours, mm=minutes,
SS=sec, and sss=millisec. It "wraps" after 49.710 days.

Error 13 [12] occurred at disk power-on lifetime: 33226 hours (1384 days + 10 hours)
  When the command that caused the error occurred, the device was active or idle.

  After command completion occurred, registers were:
  ER -- ST COUNT  LBA_48  LH LM LL DV DC
  -- -- -- == -- == == == -- -- -- -- --
  40 -- 51 00 00 00 00 08 3f d0 20 40 00  Error: UNC at LBA = 0x083fd020 = 138399776

  Commands leading to the command that caused the error were:
  CR FEATR COUNT  LBA_48  LH LM LL DV DC  Powered_Up_Time  Command/Feature_Name
  -- == -- == -- == == == -- -- -- -- --  ---------------  --------------------
  60 01 00 00 e0 00 00 08 3f db 80 40 08     08:14:56.861  READ FPDMA QUEUED
  60 01 00 00 d8 00 00 08 3f da 80 40 08     08:14:56.861  READ FPDMA QUEUED
  60 01 00 00 d0 00 00 08 3f d9 80 40 08     08:14:56.861  READ FPDMA QUEUED
  60 01 00 00 c8 00 00 08 3f d8 80 40 08     08:14:56.861  READ FPDMA QUEUED
  60 01 00 00 c0 00 00 08 3f d7 80 40 08     08:14:56.861  READ FPDMA QUEUED

Error 12 [11] occurred at disk power-on lifetime: 33226 hours (1384 days + 10 hours)
  When the command that caused the error occurred, the device was active or idle.

  After command completion occurred, registers were:
  ER -- ST COUNT  LBA_48  LH LM LL DV DC
  -- -- -- == -- == == == -- -- -- -- --
  40 -- 51 00 00 00 00 08 3f d0 20 40 00  Error: UNC at LBA = 0x083fd020 = 138399776

  Commands leading to the command that caused the error were:
  CR FEATR COUNT  LBA_48  LH LM LL DV DC  Powered_Up_Time  Command/Feature_Name
  -- == -- == -- == == == -- -- -- -- --  ---------------  --------------------
  60 01 00 00 70 00 00 08 3f db 80 40 08     08:14:53.400  READ FPDMA QUEUED
  60 01 00 00 68 00 00 08 3f da 80 40 08     08:14:53.400  READ FPDMA QUEUED
  60 01 00 00 60 00 00 08 3f d9 80 40 08     08:14:53.399  READ FPDMA QUEUED
  60 01 00 00 58 00 00 08 3f d8 80 40 08     08:14:53.399  READ FPDMA QUEUED
  60 01 00 00 50 00 00 08 3f d7 80 40 08     08:14:53.399  READ FPDMA QUEUED

Error 11 [10] occurred at disk power-on lifetime: 33226 hours (1384 days + 10 hours)
  When the command that caused the error occurred, the device was active or idle.

  After command completion occurred, registers were:
  ER -- ST COUNT  LBA_48  LH LM LL DV DC
  -- -- -- == -- == == == -- -- -- -- --
  40 -- 51 00 00 00 00 08 3f d0 20 40 00  Error: UNC at LBA = 0x083fd020 = 138399776

  Commands leading to the command that caused the error were:
  CR FEATR COUNT  LBA_48  LH LM LL DV DC  Powered_Up_Time  Command/Feature_Name
  -- == -- == -- == == == -- -- -- -- --  ---------------  --------------------
  60 01 00 00 c0 00 00 08 3f d3 80 40 08     08:14:50.057  READ FPDMA QUEUED
  60 01 00 00 b8 00 00 08 3f d2 80 40 08     08:14:50.057  READ FPDMA QUEUED
  60 01 00 00 b0 00 00 08 3f d1 80 40 08     08:14:50.057  READ FPDMA QUEUED
  60 01 00 00 a8 00 00 08 3f d0 80 40 08     08:14:50.057  READ FPDMA QUEUED
  60 01 00 00 a0 00 00 08 3f cf 80 40 08     08:14:50.057  READ FPDMA QUEUED

Error 10 [9] occurred at disk power-on lifetime: 33224 hours (1384 days + 8 hours)
  When the command that caused the error occurred, the device was active or idle.

  After command completion occurred, registers were:
  ER -- ST COUNT  LBA_48  LH LM LL DV DC
  -- -- -- == -- == == == -- -- -- -- --
  40 -- 51 00 00 00 01 98 07 2a a8 40 00  Error: UNC at LBA = 0x198072aa8 = 6845573800

  Commands leading to the command that caused the error were:
  CR FEATR COUNT  LBA_48  LH LM LL DV DC  Powered_Up_Time  Command/Feature_Name
  -- == -- == -- == == == -- -- -- -- --  ---------------  --------------------
  60 01 00 00 20 00 01 98 07 2b 08 40 08     06:00:32.210  READ FPDMA QUEUED
  60 01 00 00 18 00 01 98 07 2a 08 40 08     06:00:32.210  READ FPDMA QUEUED
  2f 00 00 00 01 00 00 00 00 00 10 40 08     06:00:32.209  READ LOG EXT
  60 01 00 00 08 00 01 98 07 2b 08 40 08     06:00:28.813  READ FPDMA QUEUED
  60 01 00 00 00 00 01 98 07 2a 08 40 08     06:00:28.813  READ FPDMA QUEUED

Error 9 [8] occurred at disk power-on lifetime: 33224 hours (1384 days + 8 hours)
  When the command that caused the error occurred, the device was active or idle.

  After command completion occurred, registers were:
  ER -- ST COUNT  LBA_48  LH LM LL DV DC
  -- -- -- == -- == == == -- -- -- -- --
  40 -- 51 00 00 00 01 98 07 2a a8 40 00  Error: UNC at LBA = 0x198072aa8 = 6845573800

  Commands leading to the command that caused the error were:
  CR FEATR COUNT  LBA_48  LH LM LL DV DC  Powered_Up_Time  Command/Feature_Name
  -- == -- == -- == == == -- -- -- -- --  ---------------  --------------------
  60 01 00 00 08 00 01 98 07 2b 08 40 08     06:00:28.813  READ FPDMA QUEUED
  60 01 00 00 00 00 01 98 07 2a 08 40 08     06:00:28.813  READ FPDMA QUEUED
  2f 00 00 00 01 00 00 00 00 00 10 40 08     06:00:28.812  READ LOG EXT
  60 01 00 00 f0 00 01 98 07 2b 08 40 08     06:00:25.417  READ FPDMA QUEUED
  60 01 00 00 e8 00 01 98 07 2a 08 40 08     06:00:25.417  READ FPDMA QUEUED

Error 8 [7] occurred at disk power-on lifetime: 33224 hours (1384 days + 8 hours)
  When the command that caused the error occurred, the device was active or idle.

  After command completion occurred, registers were:
  ER -- ST COUNT  LBA_48  LH LM LL DV DC
  -- -- -- == -- == == == -- -- -- -- --
  40 -- 51 00 00 00 01 98 07 2a a8 40 00  Error: UNC at LBA = 0x198072aa8 = 6845573800

  Commands leading to the command that caused the error were:
  CR FEATR COUNT  LBA_48  LH LM LL DV DC  Powered_Up_Time  Command/Feature_Name
  -- == -- == -- == == == -- -- -- -- --  ---------------  --------------------
  60 01 00 00 f0 00 01 98 07 2b 08 40 08     06:00:25.417  READ FPDMA QUEUED
  60 01 00 00 e8 00 01 98 07 2a 08 40 08     06:00:25.417  READ FPDMA QUEUED
  2f 00 00 00 01 00 00 00 00 00 10 40 08     06:00:25.416  READ LOG EXT
  60 01 00 00 d8 00 01 98 07 2b 08 40 08     06:00:21.986  READ FPDMA QUEUED
  60 01 00 00 d0 00 01 98 07 2a 08 40 08     06:00:21.986  READ FPDMA QUEUED

Error 7 [6] occurred at disk power-on lifetime: 33224 hours (1384 days + 8 hours)
  When the command that caused the error occurred, the device was active or idle.

  After command completion occurred, registers were:
  ER -- ST COUNT  LBA_48  LH LM LL DV DC
  -- -- -- == -- == == == -- -- -- -- --
  40 -- 51 00 00 00 01 98 07 2a a8 40 00  Error: UNC at LBA = 0x198072aa8 = 6845573800

  Commands leading to the command that caused the error were:
  CR FEATR COUNT  LBA_48  LH LM LL DV DC  Powered_Up_Time  Command/Feature_Name
  -- == -- == -- == == == -- -- -- -- --  ---------------  --------------------
  60 01 00 00 d8 00 01 98 07 2b 08 40 08     06:00:21.986  READ FPDMA QUEUED
  60 01 00 00 d0 00 01 98 07 2a 08 40 08     06:00:21.986  READ FPDMA QUEUED
  2f 00 00 00 01 00 00 00 00 00 10 40 08     06:00:21.986  READ LOG EXT
  60 01 00 00 c0 00 01 98 07 2b 08 40 08     06:00:18.565  READ FPDMA QUEUED
  60 01 00 00 b8 00 01 98 07 2a 08 40 08     06:00:18.565  READ FPDMA QUEUED

Error 6 [5] occurred at disk power-on lifetime: 33224 hours (1384 days + 8 hours)
  When the command that caused the error occurred, the device was active or idle.

  After command completion occurred, registers were:
  ER -- ST COUNT  LBA_48  LH LM LL DV DC
  -- -- -- == -- == == == -- -- -- -- --
  40 -- 51 00 00 00 01 98 07 2a a8 40 00  Error: UNC at LBA = 0x198072aa8 = 6845573800

  Commands leading to the command that caused the error were:
  CR FEATR COUNT  LBA_48  LH LM LL DV DC  Powered_Up_Time  Command/Feature_Name
  -- == -- == -- == == == -- -- -- -- --  ---------------  --------------------
  60 01 00 00 c0 00 01 98 07 2b 08 40 08     06:00:18.565  READ FPDMA QUEUED
  60 01 00 00 b8 00 01 98 07 2a 08 40 08     06:00:18.565  READ FPDMA QUEUED
  60 01 00 00 b0 00 01 98 07 29 08 40 08     06:00:18.564  READ FPDMA QUEUED
  60 01 00 00 a8 00 01 98 07 28 08 40 08     06:00:18.531  READ FPDMA QUEUED
  60 01 00 00 a0 00 01 98 07 27 08 40 08     06:00:18.526  READ FPDMA QUEUED

SMART Extended Self-test Log Version: 1 (1 sectors)
No self-tests have been logged.  [To run self-tests, use: smartctl -t]

SMART Selective self-test log data structure revision number 1
 SPAN  MIN_LBA  MAX_LBA  CURRENT_TEST_STATUS
    1        0        0  Not_testing
    2        0        0  Not_testing
    3        0        0  Not_testing
    4        0        0  Not_testing
    5        0        0  Not_testing
Selective self-test flags (0x0):
  After scanning selected spans, do NOT read-scan remainder of disk.
If Selective self-test is pending on power-up, resume after 0 minute delay.

SCT Status Version:                  3
SCT Version (vendor specific):       258 (0x0102)
Device State:                        Active (0)
Current Temperature:                    23 Celsius
Power Cycle Min/Max Temperature:     20/28 Celsius
Lifetime    Min/Max Temperature:     16/49 Celsius
Under/Over Temperature Limit Count:   0/0
Vendor specific:
01 00 00 00 00 00 00 00 00 00 00 00 00 00 00 00
00 00 00 00 00 00 00 00 00 00 00 00 00 00 00 00

SCT Temperature History Version:     2
Temperature Sampling Period:         1 minute
Temperature Logging Interval:        1 minute
Min/Max recommended Temperature:      0/60 Celsius
Min/Max Temperature Limit:           -41/85 Celsius
Temperature History Size (Index):    478 (438)

SCT Error Recovery Control:
           Read:     70 (7.0 seconds)
          Write:     70 (7.0 seconds)

Device Statistics (GP/SMART Log 0x04) not supported

Pending Defects log (GP Log 0x0c) not supported

SATA Phy Event Counters (GP Log 0x11)
ID      Size     Value  Description
0x0001  2            0  Command failed due to ICRC error
0x0002  2            0  R_ERR response for data FIS
0x0003  2            0  R_ERR response for device-to-host data FIS
0x0004  2            0  R_ERR response for host-to-device data FIS
0x0005  2            0  R_ERR response for non-data FIS
0x0006  2            0  R_ERR response for device-to-host non-data FIS
0x0007  2            0  R_ERR response for host-to-device non-data FIS
0x0008  2            0  Device-to-host non-data FIS retries
0x0009  2            3  Transition from drive PhyRdy to drive PhyNRdy
0x000a  2            3  Device-to-host register FISes sent due to a COMRESET
0x000b  2            0  CRC errors within host-to-device FIS
0x000f  2            0  R_ERR response for host-to-device data FIS, CRC
0x0012  2            0  R_ERR response for host-to-device non-data FIS, CRC
0x8000  4      2407686  Vendor specific



