smartctl 7.3 2022-02-28 r5338 [FreeBSD 13.0-RELEASE-p12 amd64] (local build)
Copyright (C) 2002-22, Bruce Allen, Christian Franke, www.smartmontools.org

=== START OF INFORMATION SECTION ===
Model Family:     Hitachi Deskstar 7K3000
Device Model:     HDS723020BLA642
Serial Number:    --
LU WWN Device Id: 5 000cca ...
Firmware Version: MN6OAA10
User Capacity:    2,000,398,934,016 bytes [2.00 TB]
Sector Size:      512 bytes logical/physical
Rotation Rate:    7200 rpm
Form Factor:      3.5 inches
Device is:        In smartctl database 7.2/5254
ATA Version is:   ATA8-ACS T13/1699-D revision 4
SATA Version is:  SATA 2.6, 6.0 Gb/s (current: 1.5 Gb/s)
Local Time is:    Sun Aug 14 12:34:28 2022 MSK
SMART support is: Available - device has SMART capability.
SMART support is: Enabled
AAM feature is:   Unavailable
APM feature is:   Disabled
Rd look-ahead is: Enabled
Write cache is:   Enabled
DSN feature is:   Unavailable
ATA Security is:  Disabled, NOT FROZEN [SEC1]
Wt Cache Reorder: Enabled

=== START OF READ SMART DATA SECTION ===
SMART overall-health self-assessment test result: PASSED

General SMART Values:
Offline data collection status:  (0x82)	Offline data collection activity
					was completed without error.
					Auto Offline Data Collection: Enabled.
Self-test execution status:      (   0)	The previous self-test routine completed
					without error or no self-test has ever 
					been run.
Total time to complete Offline 
data collection: 		(   24) seconds.
Offline data collection
capabilities: 			 (0x5b) SMART execute Offline immediate.
					Auto Offline data collection on/off support.
					Suspend Offline collection upon new
					command.
					Offline surface scan supported.
					Self-test supported.
					No Conveyance Self-test supported.
					Selective Self-test supported.
SMART capabilities:            (0x0003)	Saves SMART data before entering
					power-saving mode.
					Supports SMART auto save timer.
Error logging capability:        (0x01)	Error logging supported.
					General Purpose Logging supported.
Short self-test routine 
recommended polling time: 	 (   1) minutes.
Extended self-test routine
recommended polling time: 	 ( 302) minutes.
SCT capabilities: 	       (0x003d)	SCT Status supported.
					SCT Error Recovery Control supported.
					SCT Feature Control supported.
					SCT Data Table supported.

SMART Attributes Data Structure revision number: 16
Vendor Specific SMART Attributes with Thresholds:
ID# ATTRIBUTE_NAME          FLAGS    VALUE WORST THRESH FAIL RAW_VALUE
  1 Raw_Read_Error_Rate     PO-R--   100   100   016    -    0
  2 Throughput_Performance  P-S---   136   136   054    -    81
  3 Spin_Up_Time            POS---   146   146   024    -    358 (Average 429)
  4 Start_Stop_Count        -O--C-   100   100   000    -    56
  5 Reallocated_Sector_Ct   PO--CK   100   100   005    -    13
  7 Seek_Error_Rate         PO-R--   100   100   067    -    0
  8 Seek_Time_Performance   P-S---   135   135   020    -    26
  9 Power_On_Hours          -O--C-   093   093   000    -    55846
 10 Spin_Retry_Count        PO--C-   100   100   060    -    0
 12 Power_Cycle_Count       -O--CK   100   100   000    -    54
192 Power-Off_Retract_Count -O--CK   100   100   000    -    673
193 Load_Cycle_Count        -O--C-   100   100   000    -    673
194 Temperature_Celsius     -O----   150   150   000    -    40 (Min/Max 19/54)
196 Reallocated_Event_Count -O--CK   100   100   000    -    13
197 Current_Pending_Sector  -O---K   100   100   000    -    0
198 Offline_Uncorrectable   ---R--   100   100   000    -    0
199 UDMA_CRC_Error_Count    -O-R--   200   200   000    -    37
                            ||||||_ K auto-keep
                            |||||__ C event count
                            ||||___ R error rate
                            |||____ S speed/performance
                            ||_____ O updated online
                            |______ P prefailure warning

General Purpose Log Directory Version 1
SMART           Log Directory Version 1 [multi-sector log support]
Address    Access  R/W   Size  Description
0x00       GPL,SL  R/O      1  Log Directory
0x01           SL  R/O      1  Summary SMART error log
0x03       GPL     R/O      1  Ext. Comprehensive SMART error log
0x04       GPL     R/O      7  Device Statistics log
0x06           SL  R/O      1  SMART self-test log
0x07       GPL     R/O      1  Extended self-test log
0x08       GPL     R/O      2  Power Conditions log
0x09           SL  R/W      1  Selective self-test log
0x10       GPL     R/O      1  NCQ Command Error log
0x11       GPL     R/O      1  SATA Phy Event Counters log
0x20       GPL     R/O      1  Streaming performance log [OBS-8]
0x21       GPL     R/O      1  Write stream error log
0x22       GPL     R/O      1  Read stream error log
0x80-0x9f  GPL,SL  R/W     16  Host vendor specific log
0xe0       GPL,SL  R/W      1  SCT Command/Status
0xe1       GPL,SL  R/W      1  SCT Data Transfer

SMART Extended Comprehensive Error Log Version: 1 (1 sectors)
Device Error Count: 462 (device log contains only the most recent 4 errors)
	CR     = Command Register
	FEATR  = Features Register
	COUNT  = Count (was: Sector Count) Register
	LBA_48 = Upper bytes of LBA High/Mid/Low Registers ]  ATA-8
	LH     = LBA High (was: Cylinder High) Register    ]   LBA
	LM     = LBA Mid (was: Cylinder Low) Register      ] Register
	LL     = LBA Low (was: Sector Number) Register     ]
	DV     = Device (was: Device/Head) Register
	DC     = Device Control Register
	ER     = Error register
	ST     = Status register
Powered_Up_Time is measured from power on, and printed as
DDd+hh:mm:SS.sss where DD=days, hh=hours, mm=minutes,
SS=sec, and sss=millisec. It "wraps" after 49.710 days.

Error 462 [1] occurred at disk power-on lifetime: 55823 hours (2325 days + 23 hours)
  When the command that caused the error occurred, the device was active or idle.

  After command completion occurred, registers were:
  ER -- ST COUNT  LBA_48  LH LM LL DV DC
  -- -- -- == -- == == == -- -- -- -- --
  84 -- 51 00 01 00 00 e4 8b 55 e0 04 00  Error: ICRC, ABRT 1 sectors at LBA = 0xe48b55e0 = 3834336736

  Commands leading to the command that caused the error were:
  CR FEATR COUNT  LBA_48  LH LM LL DV DC  Powered_Up_Time  Command/Feature_Name
  -- == -- == -- == == == -- -- -- -- --  ---------------  --------------------
  25 00 00 00 10 00 00 e4 8b 55 d1 e4 00  4d+15:49:20.054  READ DMA EXT
  25 00 00 00 20 00 00 e4 8b 55 b1 e4 00  4d+15:49:20.054  READ DMA EXT
  25 00 00 00 20 00 00 e4 8b 55 91 e4 00  4d+15:49:20.053  READ DMA EXT
  25 00 00 00 20 00 00 e4 8b 55 71 e4 00  4d+15:49:20.053  READ DMA EXT
  25 00 00 00 20 00 00 e4 8b 55 51 e4 00  4d+15:49:20.053  READ DMA EXT

Error 461 [0] occurred at disk power-on lifetime: 55823 hours (2325 days + 23 hours)
  When the command that caused the error occurred, the device was active or idle.

  After command completion occurred, registers were:
  ER -- ST COUNT  LBA_48  LH LM LL DV DC
  -- -- -- == -- == == == -- -- -- -- --
  84 -- 51 00 01 00 00 c5 4f 77 d0 05 00  Error: ICRC, ABRT 1 sectors at LBA = 0xc54f77d0 = 3310319568

  Commands leading to the command that caused the error were:
  CR FEATR COUNT  LBA_48  LH LM LL DV DC  Powered_Up_Time  Command/Feature_Name
  -- == -- == -- == == == -- -- -- -- --  ---------------  --------------------
  25 00 00 00 20 00 00 c5 4f 77 b1 e5 00  4d+15:49:19.462  READ DMA EXT
  25 00 00 00 20 00 00 c5 4f 77 91 e5 00  4d+15:49:19.444  READ DMA EXT
  25 00 00 00 10 00 00 e8 e0 88 a0 e8 00  4d+15:49:17.727  READ DMA EXT
  25 00 00 00 20 00 00 e8 e0 88 80 e8 00  4d+15:49:17.727  READ DMA EXT
  25 00 00 00 20 00 00 e8 e0 88 60 e8 00  4d+15:49:17.727  READ DMA EXT

Error 460 [3] occurred at disk power-on lifetime: 55805 hours (2325 days + 5 hours)
  When the command that caused the error occurred, the device was active or idle.

  After command completion occurred, registers were:
  ER -- ST COUNT  LBA_48  LH LM LL DV DC
  -- -- -- == -- == == == -- -- -- -- --
  84 -- 51 01 e1 00 00 2a 3a e0 20 0a 00  Error: ICRC, ABRT at LBA = 0x2a3ae020 = 708501536

  Commands leading to the command that caused the error were:
  CR FEATR COUNT  LBA_48  LH LM LL DV DC  Powered_Up_Time  Command/Feature_Name
  -- == -- == -- == == == -- -- -- -- --  ---------------  --------------------
  61 08 00 01 e0 00 00 2a 3a e0 21 4a ff  3d+21:59:16.722  WRITE FPDMA QUEUED
  61 08 00 00 e8 00 00 c5 50 28 41 40 00  3d+21:59:16.715  WRITE FPDMA QUEUED
  61 08 00 00 e0 00 00 c5 50 20 41 40 00  3d+21:59:16.715  WRITE FPDMA QUEUED
  60 08 00 00 d8 00 00 2a 3a ea 01 40 00  3d+21:59:16.698  READ FPDMA QUEUED
  61 00 30 00 d0 00 00 2a 54 dd 61 40 00  3d+21:59:16.688  WRITE FPDMA QUEUED

Error 459 [2] occurred at disk power-on lifetime: 55805 hours (2325 days + 5 hours)
  When the command that caused the error occurred, the device was active or idle.

  After command completion occurred, registers were:
  ER -- ST COUNT  LBA_48  LH LM LL DV DC
  -- -- -- == -- == == == -- -- -- -- --
  84 -- 51 03 81 00 00 2a ae 22 40 0a 00  Error: ICRC, ABRT at LBA = 0x2aae2240 = 716055104

  Commands leading to the command that caused the error were:
  CR FEATR COUNT  LBA_48  LH LM LL DV DC  Powered_Up_Time  Command/Feature_Name
  -- == -- == -- == == == -- -- -- -- --  ---------------  --------------------
  60 08 00 00 10 00 00 2a ae 2d c1 40 00  3d+21:38:28.025  READ FPDMA QUEUED
  60 08 00 00 08 00 00 2a ae 25 c1 40 00  3d+21:38:28.025  READ FPDMA QUEUED
  60 08 00 00 00 00 00 2a ae 1d c1 40 00  3d+21:38:28.017  READ FPDMA QUEUED
  60 08 00 00 f8 00 00 2a ae 15 c1 40 00  3d+21:38:28.003  READ FPDMA QUEUED
  60 08 00 00 f0 00 00 2a ae 0d c1 40 00  3d+21:38:28.003  READ FPDMA QUEUED

SMART Extended Self-test Log Version: 1 (1 sectors)
Num  Test_Description    Status                  Remaining  LifeTime(hours)  LBA_of_first_error
# 1  Extended offline    Completed without error       00%     53783         -
# 2  Short offline       Completed without error       00%     53776         -

SMART Selective self-test log data structure revision number 1
 SPAN  MIN_LBA  MAX_LBA  CURRENT_TEST_STATUS
    1        0        0  Not_testing
    2        0        0  Not_testing
    3        0        0  Not_testing
    4        0        0  Not_testing
    5        0        0  Not_testing
Selective self-test flags (0x0):
  After scanning selected spans, do NOT read-scan remainder of disk.
If Selective self-test is pending on power-up, resume after 0 minute delay.

SCT Status Version:                  3
SCT Version (vendor specific):       256 (0x0100)
Device State:                        Active (0)
Current Temperature:                    40 Celsius
Power Cycle Min/Max Temperature:     26/44 Celsius
Lifetime    Min/Max Temperature:     19/54 Celsius
Under/Over Temperature Limit Count:   0/0

SCT Temperature History Version:     2
Temperature Sampling Period:         1 minute
Temperature Logging Interval:        1 minute
Min/Max recommended Temperature:      0/60 Celsius
Min/Max Temperature Limit:           -40/70 Celsius
Temperature History Size (Index):    128 (52)

SCT Error Recovery Control:
           Read: Disabled
          Write: Disabled

Device Statistics (GP Log 0x04)
Page  Offset Size        Value Flags Description
0x01  =====  =               =  ===  == General Statistics (rev 1) ==
0x01  0x008  4              54  ---  Lifetime Power-On Resets
0x01  0x010  4           55846  ---  Power-on Hours
0x01  0x018  6    255910955630  ---  Logical Sectors Written
0x01  0x020  6       599348085  ---  Number of Write Commands
0x01  0x028  6   1577791477301  ---  Logical Sectors Read
0x01  0x030  6      2995161190  ---  Number of Read Commands
0x03  =====  =               =  ===  == Rotating Media Statistics (rev 1) ==
0x03  0x008  4           54040  ---  Spindle Motor Power-on Hours
0x03  0x010  4           54040  ---  Head Flying Hours
0x03  0x018  4             673  ---  Head Load Events
0x03  0x020  4              13  ---  Number of Reallocated Logical Sectors
0x03  0x028  4            6209  ---  Read Recovery Attempts
0x03  0x030  4               6  ---  Number of Mechanical Start Failures
0x04  =====  =               =  ===  == General Errors Statistics (rev 1) ==
0x04  0x008  4             431  ---  Number of Reported Uncorrectable Errors
0x04  0x010  4             140  ---  Resets Between Cmd Acceptance and Completion
0x05  =====  =               =  ===  == Temperature Statistics (rev 1) ==
0x05  0x008  1              40  ---  Current Temperature
0x05  0x010  1              39  N--  Average Short Term Temperature
0x05  0x018  1              36  N--  Average Long Term Temperature
0x05  0x020  1              54  ---  Highest Temperature
0x05  0x028  1              19  ---  Lowest Temperature
0x05  0x030  1              51  N--  Highest Average Short Term Temperature
0x05  0x038  1              24  N--  Lowest Average Short Term Temperature
0x05  0x040  1              40  N--  Highest Average Long Term Temperature
0x05  0x048  1              25  N--  Lowest Average Long Term Temperature
0x05  0x050  4               0  ---  Time in Over-Temperature
0x05  0x058  1              60  ---  Specified Maximum Operating Temperature
0x05  0x060  4               0  ---  Time in Under-Temperature
0x05  0x068  1               0  ---  Specified Minimum Operating Temperature
0x06  =====  =               =  ===  == Transport Statistics (rev 1) ==
0x06  0x008  4          176711  ---  Number of Hardware Resets
0x06  0x010  4          161183  ---  Number of ASR Events
0x06  0x018  4              37  ---  Number of Interface CRC Errors
                                |||_ C monitored condition met
                                ||__ D supports DSN
                                |___ N normalized value

Pending Defects log (GP Log 0x0c) not supported

SATA Phy Event Counters (GP Log 0x11)
ID      Size     Value  Description
0x0001  2           11  Command failed due to ICRC error
0x0002  2           13  R_ERR response for data FIS
0x0003  2           13  R_ERR response for device-to-host data FIS
0x0004  2            0  R_ERR response for host-to-device data FIS
0x0005  2            0  R_ERR response for non-data FIS
0x0006  2            0  R_ERR response for device-to-host non-data FIS
0x0007  2            0  R_ERR response for host-to-device non-data FIS
0x0009  2         4713  Transition from drive PhyRdy to drive PhyNRdy
0x000a  2         4409  Device-to-host register FISes sent due to a COMRESET
0x000b  2            0  CRC errors within host-to-device FIS
0x000d  2            0  Non-CRC errors within host-to-device FIS



