smartctl 7.1 2019-12-30 r5022 [FreeBSD 12.2-RELEASE amd64] (local build)
Copyright (C) 2002-19, Bruce Allen, Christian Franke, www.smartmontools.org

=== START OF INFORMATION SECTION ===
Device Model:     ADATA SU630
Serial Number:    --
LU WWN Device Id: 5 000000 ...
Firmware Version: N181017a
User Capacity:    480,103,981,056 bytes [480 GB]
Sector Size:      512 bytes logical/physical
Rotation Rate:    Solid State Device
Form Factor:      2.5 inches
Device is:        Not in smartctl database [for details use: -P showall]
ATA Version is:   ACS-2 (minor revision not indicated)
SATA Version is:  SATA 3.2, 6.0 Gb/s (current: 3.0 Gb/s)
Local Time is:    Thu Oct 29 21:18:08 2020 -05
SMART support is: Available - device has SMART capability.
SMART support is: Enabled
AAM feature is:   Unavailable
APM feature is:   Unavailable
Rd look-ahead is: Enabled
Write cache is:   Enabled
DSN feature is:   Unavailable
ATA Security is:  Disabled, frozen [SEC2]
Wt Cache Reorder: Enabled

=== START OF READ SMART DATA SECTION ===
SMART overall-health self-assessment test result: PASSED

General SMART Values:
Offline data collection status:  (0x00)	Offline data collection activity
					was never started.
					Auto Offline Data Collection: Disabled.
Self-test execution status:      (   0)	The previous self-test routine completed
					without error or no self-test has ever 
					been run.
Total time to complete Offline 
data collection: 		(   33) seconds.
Offline data collection
capabilities: 			 (0x7b) SMART execute Offline immediate.
					Auto Offline data collection on/off support.
					Suspend Offline collection upon new
					command.
					Offline surface scan supported.
					Self-test supported.
					Conveyance Self-test supported.
					Selective Self-test supported.
SMART capabilities:            (0x0003)	Saves SMART data before entering
					power-saving mode.
					Supports SMART auto save timer.
Error logging capability:        (0x01)	Error logging supported.
					General Purpose Logging supported.
Short self-test routine 
recommended polling time: 	 (   2) minutes.
Extended self-test routine
recommended polling time: 	 (   2) minutes.
Conveyance self-test routine
recommended polling time: 	 (   2) minutes.
SCT capabilities: 	       (0x0031)	SCT Status supported.
					SCT Feature Control supported.
					SCT Data Table supported.

SMART Attributes Data Structure revision number: 0
Vendor Specific SMART Attributes with Thresholds:
ID# ATTRIBUTE_NAME          FLAGS    VALUE WORST THRESH FAIL RAW_VALUE
  9 Power_On_Hours          -O--C-   100   100   000    -    1878
 12 Power_Cycle_Count       -O--C-   100   100   000    -    1225
167 Unknown_Attribute       -O---K   100   100   000    -    0
168 Unknown_Attribute       -O--C-   100   100   000    -    26
169 Unknown_Attribute       PO--C-   098   098   010    -    12887785483
173 Unknown_Attribute       -O--C-   200   200   000    -    111676620851
175 Program_Fail_Count_Chip PO--C-   100   100   010    -    0
180 Unused_Rsvd_Blk_Cnt_Tot PO--CK   099   099   020    -    2344
192 Power-Off_Retract_Count -O--C-   100   100   000    -    175
194 Temperature_Celsius     -O---K   058   058   030    -    42 (Min/Max 0/43)
231 Temperature_Celsius     PO--CK   097   097   005    -    3
233 Media_Wearout_Indicator -O--CK   100   100   000    -    85495979264
234 Unknown_Attribute       -O--CK   100   100   000    -    47097516928
241 Total_LBAs_Written      -O--CK   100   100   000    -    19087727103
242 Total_LBAs_Read         -O--CK   100   100   000    -    17875544292
                            ||||||_ K auto-keep
                            |||||__ C event count
                            ||||___ R error rate
                            |||____ S speed/performance
                            ||_____ O updated online
                            |______ P prefailure warning

General Purpose Log Directory Version 1
SMART           Log Directory Version 1 [multi-sector log support]
Address    Access  R/W   Size  Description
0x00       GPL,SL  R/O      1  Log Directory
0x01           SL  R/O      1  Summary SMART error log
0x02           SL  R/O     51  Comprehensive SMART error log
0x03       GPL     R/O     64  Ext. Comprehensive SMART error log
0x04       GPL,SL  R/O      8  Device Statistics log
0x06           SL  R/O      1  SMART self-test log
0x07       GPL     R/O      1  Extended self-test log
0x09           SL  R/W      1  Selective self-test log
0x10       GPL     R/O      1  NCQ Command Error log
0x11       GPL     R/O      1  SATA Phy Event Counters log
0x30       GPL,SL  R/O      9  IDENTIFY DEVICE data log
0x80-0x9f  GPL,SL  R/W     16  Host vendor specific log
0xe0       GPL,SL  R/W      1  SCT Command/Status
0xe1       GPL,SL  R/W      1  SCT Data Transfer

SMART Extended Comprehensive Error Log Version: 1 (64 sectors)
Device Error Count: 10
	CR     = Command Register
	FEATR  = Features Register
	COUNT  = Count (was: Sector Count) Register
	LBA_48 = Upper bytes of LBA High/Mid/Low Registers ]  ATA-8
	LH     = LBA High (was: Cylinder High) Register    ]   LBA
	LM     = LBA Mid (was: Cylinder Low) Register      ] Register
	LL     = LBA Low (was: Sector Number) Register     ]
	DV     = Device (was: Device/Head) Register
	DC     = Device Control Register
	ER     = Error register
	ST     = Status register
Powered_Up_Time is measured from power on, and printed as
DDd+hh:mm:SS.sss where DD=days, hh=hours, mm=minutes,
SS=sec, and sss=millisec. It "wraps" after 49.710 days.

Error 10 [9] occurred at disk power-on lifetime: 1476 hours (61 days + 12 hours)
  When the command that caused the error occurred, the device was in an unknown state.

  After command completion occurred, registers were:
  ER -- ST COUNT  LBA_48  LH LM LL DV DC
  -- -- -- == -- == == == -- -- -- -- --
  84 -- 41 00 80 00 00 00 00 00 02 40 00

  Commands leading to the command that caused the error were:
  CR FEATR COUNT  LBA_48  LH LM LL DV DC  Powered_Up_Time  Command/Feature_Name
  -- == -- == -- == == == -- -- -- -- --  ---------------  --------------------
  ec 00 00 00 00 00 00 00 00 00 00 a0 80     00:14:24.200  IDENTIFY DEVICE
  ec 00 00 00 00 00 00 00 00 00 00 a0 80     00:14:24.200  IDENTIFY DEVICE
  ea 00 00 00 00 00 00 00 00 00 00 a0 80     00:14:24.200  FLUSH CACHE EXT
  ec 00 00 00 00 00 00 00 00 00 00 a0 80     00:14:24.200  IDENTIFY DEVICE
  ef 00 02 00 00 00 00 00 00 00 00 a0 80     00:14:24.200  SET FEATURES [Enable write cache]

Error 9 [8] occurred at disk power-on lifetime: 1476 hours (61 days + 12 hours)
  When the command that caused the error occurred, the device was in an unknown state.

  After command completion occurred, registers were:
  ER -- ST COUNT  LBA_48  LH LM LL DV DC
  -- -- -- == -- == == == -- -- -- -- --
  84 -- 41 00 88 00 00 00 46 4b f0 40 08

  Commands leading to the command that caused the error were:
  CR FEATR COUNT  LBA_48  LH LM LL DV DC  Powered_Up_Time  Command/Feature_Name
  -- == -- == -- == == == -- -- -- -- --  ---------------  --------------------
  ea 00 00 00 00 00 00 00 00 00 00 40 80     00:11:56.600  FLUSH CACHE EXT
  ea 00 00 00 00 00 00 00 00 00 00 40 80     00:11:56.500  FLUSH CACHE EXT
  ef 00 02 00 00 00 00 00 00 00 00 40 80     00:11:56.500  SET FEATURES [Enable write cache]
  ef 00 aa 00 00 00 00 00 00 00 00 40 80     00:11:56.500  SET FEATURES [Enable read look-ahead]
  c6 00 00 00 10 00 00 00 00 00 00 40 80     00:11:56.500  SET MULTIPLE MODE

Error 8 [7] occurred at disk power-on lifetime: 1476 hours (61 days + 12 hours)
  When the command that caused the error occurred, the device was in an unknown state.

  After command completion occurred, registers were:
  ER -- ST COUNT  LBA_48  LH LM LL DV DC
  -- -- -- == -- == == == -- -- -- -- --
  84 -- 41 00 70 00 00 10 4a 0a d8 40 08

  Commands leading to the command that caused the error were:
  CR FEATR COUNT  LBA_48  LH LM LL DV DC  Powered_Up_Time  Command/Feature_Name
  -- == -- == -- == == == -- -- -- -- --  ---------------  --------------------
  ea 00 00 00 00 00 00 00 00 00 00 40 80     00:11:00.200  FLUSH CACHE EXT
  ea 00 00 00 00 00 00 00 00 00 00 40 80     00:11:00.200  FLUSH CACHE EXT
  ea 00 00 00 00 00 00 00 00 00 00 40 80     00:11:00.200  FLUSH CACHE EXT
  ea 00 00 00 00 00 00 00 00 00 00 40 80     00:11:00.100  FLUSH CACHE EXT
  ea 00 00 00 00 00 00 00 00 00 00 40 80     00:11:00.100  FLUSH CACHE EXT

Error 7 [6] occurred at disk power-on lifetime: 1476 hours (61 days + 12 hours)
  When the command that caused the error occurred, the device was in an unknown state.

  After command completion occurred, registers were:
  ER -- ST COUNT  LBA_48  LH LM LL DV DC
  -- -- -- == -- == == == -- -- -- -- --
  84 -- 41 00 40 00 00 10 4a 00 b8 40 08

  Commands leading to the command that caused the error were:
  CR FEATR COUNT  LBA_48  LH LM LL DV DC  Powered_Up_Time  Command/Feature_Name
  -- == -- == -- == == == -- -- -- -- --  ---------------  --------------------
  ea 00 00 00 00 00 00 00 00 00 00 40 80     00:10:50.600  FLUSH CACHE EXT
  ef 00 02 00 00 00 00 00 00 00 00 40 80     00:10:50.600  SET FEATURES [Enable write cache]
  ef 00 aa 00 00 00 00 00 00 00 00 40 80     00:10:50.600  SET FEATURES [Enable read look-ahead]
  c6 00 00 00 10 00 00 00 00 00 00 40 80     00:10:50.600  SET MULTIPLE MODE
  ef 00 10 00 02 00 00 00 00 00 00 40 80     00:10:50.600  SET FEATURES [Enable SATA feature]

Error 6 [5] occurred at disk power-on lifetime: 1476 hours (61 days + 12 hours)
  When the command that caused the error occurred, the device was in an unknown state.

  After command completion occurred, registers were:
  ER -- ST COUNT  LBA_48  LH LM LL DV DC
  -- -- -- == -- == == == -- -- -- -- --
  84 -- 41 00 80 00 00 12 4c 21 10 40 08

  Commands leading to the command that caused the error were:
  CR FEATR COUNT  LBA_48  LH LM LL DV DC  Powered_Up_Time  Command/Feature_Name
  -- == -- == -- == == == -- -- -- -- --  ---------------  --------------------
  06 00 01 00 01 00 00 00 00 00 00 40 80     00:10:46.400  DATA SET MANAGEMENT
  06 00 01 00 01 00 00 00 00 00 00 40 80     00:10:46.400  DATA SET MANAGEMENT
  ea 00 00 00 00 00 00 00 00 00 00 40 80     00:10:45.400  FLUSH CACHE EXT
  06 00 01 00 01 00 00 00 00 00 00 40 80     00:10:45.300  DATA SET MANAGEMENT
  06 00 01 00 01 00 00 00 00 00 00 40 80     00:10:45.300  DATA SET MANAGEMENT

Error 5 [4] occurred at disk power-on lifetime: 1476 hours (61 days + 12 hours)
  When the command that caused the error occurred, the device was in an unknown state.

  After command completion occurred, registers were:
  ER -- ST COUNT  LBA_48  LH LM LL DV DC
  -- -- -- == -- == == == -- -- -- -- --
  84 -- 41 00 70 00 00 00 00 00 00 40 00  Error: ICRC, ABRT 112 sectors at LBA = 0x00000000 = 0

  Commands leading to the command that caused the error were:
  CR FEATR COUNT  LBA_48  LH LM LL DV DC  Powered_Up_Time  Command/Feature_Name
  -- == -- == -- == == == -- -- -- -- --  ---------------  --------------------
  25 00 00 00 20 00 00 00 00 00 02 40 80     00:09:04.200  READ DMA EXT
  ef 00 10 00 03 00 00 00 00 00 00 00 80     00:09:04.200  SET FEATURES [Enable SATA feature]
  ef 00 10 00 02 00 00 00 00 00 00 00 80     00:09:04.200  SET FEATURES [Enable SATA feature]
  ef 00 02 00 00 00 00 00 00 00 00 00 80     00:09:04.200  SET FEATURES [Enable write cache]
  ef 00 aa 00 00 00 00 00 00 00 00 00 80     00:09:04.200  SET FEATURES [Enable read look-ahead]

Error 4 [3] occurred at disk power-on lifetime: 1476 hours (61 days + 12 hours)
  When the command that caused the error occurred, the device was in an unknown state.

  After command completion occurred, registers were:
  ER -- ST COUNT  LBA_48  LH LM LL DV DC
  -- -- -- == -- == == == -- -- -- -- --
  84 -- 51 00 20 00 00 00 00 00 02 e0 00  Error: ICRC, ABRT 32 sectors at LBA = 0x00000002 = 2

  Commands leading to the command that caused the error were:
  CR FEATR COUNT  LBA_48  LH LM LL DV DC  Powered_Up_Time  Command/Feature_Name
  -- == -- == -- == == == -- -- -- -- --  ---------------  --------------------
  25 00 00 00 20 00 00 00 00 00 02 e0 80     00:00:47.300  READ DMA EXT
  25 00 00 00 20 00 00 00 00 00 02 e0 ff     00:00:47.300  READ DMA EXT
  25 00 00 00 20 00 00 37 e4 36 88 e0 80     00:00:47.300  READ DMA EXT
  25 00 00 00 01 00 00 37 e4 36 af e0 80     00:00:47.300  READ DMA EXT
  ea 00 00 00 00 00 00 00 00 00 00 e0 80     00:00:47.300  FLUSH CACHE EXT

Error 3 [2] occurred at disk power-on lifetime: 1467 hours (61 days + 3 hours)
  When the command that caused the error occurred, the device was in an unknown state.

  After command completion occurred, registers were:
  ER -- ST COUNT  LBA_48  LH LM LL DV DC
  -- -- -- == -- == == == -- -- -- -- --
  84 -- 51 00 80 00 00 00 00 00 f1 e0 00  Error: ICRC, ABRT 128 sectors at LBA = 0x000000f1 = 241

  Commands leading to the command that caused the error were:
  CR FEATR COUNT  LBA_48  LH LM LL DV DC  Powered_Up_Time  Command/Feature_Name
  -- == -- == -- == == == -- -- -- -- --  ---------------  --------------------
  35 00 00 00 80 00 00 00 00 00 f1 e0 80     00:01:19.500  WRITE DMA EXT
  ea 00 00 00 00 00 00 00 00 00 00 e0 80     00:01:14.500  FLUSH CACHE EXT
  35 00 00 00 80 00 00 00 00 00 f1 e0 80     00:01:14.500  WRITE DMA EXT
  ea 00 00 00 00 00 00 00 00 00 00 e0 80     00:01:14.500  FLUSH CACHE EXT
  35 00 00 00 80 00 00 00 00 00 f1 e0 80     00:01:14.500  WRITE DMA EXT

SMART Extended Self-test Log Version: 1 (1 sectors)
Num  Test_Description    Status                  Remaining  LifeTime(hours)  LBA_of_first_error
# 1  Short offline       Completed without error       00%       819         -

SMART Selective self-test log data structure revision number 1
 SPAN  MIN_LBA  MAX_LBA  CURRENT_TEST_STATUS
    1        0        0  Not_testing
    2        0        0  Not_testing
    3        0        0  Not_testing
    4        0        0  Not_testing
    5        0        0  Not_testing
Selective self-test flags (0x0):
  After scanning selected spans, do NOT read-scan remainder of disk.
If Selective self-test is pending on power-up, resume after 0 minute delay.

SCT Status Version:                  3
SCT Version (vendor specific):       1 (0x0001)
Device State:                        Active (0)
Current Temperature:                    42 Celsius
Power Cycle Min/Max Temperature:      ?/43 Celsius
Lifetime    Min/Max Temperature:      ?/ ? Celsius
Under/Over Temperature Limit Count:   0/0

SCT Temperature History Version:     2
Temperature Sampling Period:         1 minute
Temperature Logging Interval:        1 minute
Min/Max recommended Temperature:     -127/127 Celsius
Min/Max Temperature Limit:           -127/127 Celsius
Temperature History Size (Index):    478 (446)

SCT Error Recovery Control command not supported

Device Statistics (GP Log 0x04)
Page  Offset Size        Value Flags Description
0x01  =====  =               =  ===  == General Statistics (rev 1) ==
0x01  0x008  4            1225  ---  Lifetime Power-On Resets
0x01  0x010  4            1878  ---  Power-on Hours
0x01  0x018  6     19087727103  ---  Logical Sectors Written
0x01  0x020  6       344961838  ---  Number of Write Commands
0x01  0x028  6     17875544292  ---  Logical Sectors Read
0x01  0x030  6       253450546  ---  Number of Read Commands
0x01  0x038  6 129082667802394  ---  Date and Time TimeStamp
0x07  =====  =               =  ===  == Solid State Device Statistics (rev 1) ==
0x07  0x008  1              15  N--  Percentage Used Endurance Indicator
                                |||_ C monitored condition met
                                ||__ D supports DSN
                                |___ N normalized value

Pending Defects log (GP Log 0x0c) not supported

SATA Phy Event Counters (GP Log 0x11)
ID      Size     Value  Description
0x0001  2           26  Command failed due to ICRC error
0x0003  2            0  R_ERR response for device-to-host data FIS
0x0004  2            0  R_ERR response for host-to-device data FIS
0x0006  2            0  R_ERR response for device-to-host non-data FIS
0x0007  2            0  R_ERR response for host-to-device non-data FIS
0x0008  2            0  Device-to-host non-data FIS retries
0x0009  4            0  Transition from drive PhyRdy to drive PhyNRdy
0x000a  4           14  Device-to-host register FISes sent due to a COMRESET
0x000f  2            0  R_ERR response for host-to-device data FIS, CRC
0x0010  2            0  R_ERR response for host-to-device data FIS, non-CRC
0x0012  2            0  R_ERR response for host-to-device non-data FIS, CRC
0x0013  2            0  R_ERR response for host-to-device non-data FIS, non-CRC

