smartctl 7.4 2023-08-01 r5530 [FreeBSD 13.2-RELEASE-p3 amd64] (local build)
Copyright (C) 2002-23, Bruce Allen, Christian Franke, www.smartmontools.org

=== START OF INFORMATION SECTION ===
Model Number:                       SAMSUNG MZVLW256HEHP-000H1
Serial Number:                      --
Firmware Version:                   CXB73H1Q
PCI Vendor/Subsystem ID:            0x144d
IEEE OUI Identifier:                0x002538
Total NVM Capacity:                 256,060,514,304 [256 GB]
Unallocated NVM Capacity:           0
Controller ID:                      2
NVMe Version:                       1.2
Number of Namespaces:               1
Namespace 1 Size/Capacity:          256,060,514,304 [256 GB]
Namespace 1 Utilization:            59,746,742,272 [59.7 GB]
Namespace 1 Formatted LBA Size:     512
Namespace 1 IEEE EUI-64:            002538 ...
Local Time is:                      Tue Oct 31 14:20:35 2023 CET
Firmware Updates (0x16):            3 Slots, no Reset required
Optional Admin Commands (0x0017):   Security Format Frmw_DL Self_Test
Optional NVM Commands (0x001f):     Comp Wr_Unc DS_Mngmt Wr_Zero Sav/Sel_Feat
Log Page Attributes (0x03):         S/H_per_NS Cmd_Eff_Lg
Warning  Comp. Temp. Threshold:     68 Celsius
Critical Comp. Temp. Threshold:     71 Celsius

Supported Power States
St Op     Max   Active     Idle   RL RT WL WT  Ent_Lat  Ex_Lat
 0 +     7.60W       -        -    0  0  0  0        0       0
 1 +     6.00W       -        -    1  1  1  1        0       0
 2 +     5.10W       -        -    2  2  2  2        0       0
 3 -   0.0400W       -        -    3  3  3  3      210    1500
 4 -   0.0050W       -        -    4  4  4  4     2200    6000

Supported LBA Sizes (NSID 0x1)
Id Fmt  Data  Metadt  Rel_Perf
 0 +     512       0         0

=== START OF SMART DATA SECTION ===
SMART overall-health self-assessment test result: PASSED

SMART/Health Information (NVMe Log 0x02)
Critical Warning:                   0x00
Temperature:                        35 Celsius
Available Spare:                    100%
Available Spare Threshold:          5%
Percentage Used:                    3%
Data Units Read:                    7,569,615 [3.87 TB]
Data Units Written:                 26,760,056 [13.7 TB]
Host Read Commands:                 102,133,759
Host Write Commands:                381,397,958
Controller Busy Time:               728
Power Cycles:                       2,653
Power On Hours:                     4,565
Unsafe Shutdowns:                   25
Media and Data Integrity Errors:    0
Error Information Log Entries:      964
Warning  Comp. Temperature Time:    0
Critical Comp. Temperature Time:    0
Temperature Sensor 1:               35 Celsius
Temperature Sensor 2:               63 Celsius

Error Information (NVMe Log 0x01, 16 of 64 entries)
Num   ErrCount  SQId   CmdId  Status  PELoc          LBA  NSID    VS  Message
  0        964     0  0x0014  0x4016  0x004            0     1     -  Invalid Namespace or Format
  1        963     0  0x0014  0x4016  0x004            0     1     -  Invalid Namespace or Format
  2        962     0  0x0014  0x4016  0x004            0     1     -  Invalid Namespace or Format
  3        961     0  0x0014  0x4016  0x004            0     1     -  Invalid Namespace or Format
  4        960     0  0x0014  0x4016  0x004            0     1     -  Invalid Namespace or Format
  5        959     0  0x0014  0x4016  0x004            0     1     -  Invalid Namespace or Format
  6        958     0  0x0014  0x4016  0x004            0     1     -  Invalid Namespace or Format
  7        957     0  0x0014  0x4016  0x004            0     1     -  Invalid Namespace or Format
  8        956     0  0x0014  0x4016  0x004            0     1     -  Invalid Namespace or Format
  9        955     0  0x0014  0x4016  0x004            0     1     -  Invalid Namespace or Format
 10        954     0  0x0014  0x4016  0x004            0     1     -  Invalid Namespace or Format
 11        953     0  0x0014  0x4016  0x004            0     1     -  Invalid Namespace or Format
 12        952     0  0x0014  0x4016  0x004            0     1     -  Invalid Namespace or Format
 13        951     0  0x0014  0x4016  0x004            0     1     -  Invalid Namespace or Format
 14        950     0  0x0014  0x4016  0x004            0     1     -  Invalid Namespace or Format
 15        949     0  0x0014  0x4016  0x004            0     1     -  Invalid Namespace or Format
... (48 entries not read)

Self-test Log (NVMe Log 0x06)
Self-test status: No self-test in progress
No Self-tests Logged

