smartctl 7.3 2022-02-28 r5338 [FreeBSD 13.0-STABLE amd64] (local build)
Copyright (C) 2002-22, Bruce Allen, Christian Franke, www.smartmontools.org

=== START OF INFORMATION SECTION ===
Model Number:                       SAMSUNG MZVLW256HEHP-000H1
Serial Number:                      --
Firmware Version:                   CXB70H1Q
PCI Vendor/Subsystem ID:            0x144d
IEEE OUI Identifier:                0x002538
Total NVM Capacity:                 256,060,514,304 [256 GB]
Unallocated NVM Capacity:           0
Controller ID:                      2
NVMe Version:                       1.2
Number of Namespaces:               1
Namespace 1 Size/Capacity:          256,060,514,304 [256 GB]
Namespace 1 Utilization:            101,078,642,688 [101 GB]
Namespace 1 Formatted LBA Size:     512
Namespace 1 IEEE EUI-64:            002538 ...
Local Time is:                      Sat Apr  9 09:33:16 2022 PDT
Firmware Updates (0x16):            3 Slots, no Reset required
Optional Admin Commands (0x0007):   Security Format Frmw_DL
Optional NVM Commands (0x001f):     Comp Wr_Unc DS_Mngmt Wr_Zero Sav/Sel_Feat
Log Page Attributes (0x03):         S/H_per_NS Cmd_Eff_Lg
Warning  Comp. Temp. Threshold:     77 Celsius
Critical Comp. Temp. Threshold:     80 Celsius

Supported Power States
St Op     Max   Active     Idle   RL RT WL WT  Ent_Lat  Ex_Lat
 0 +     7.60W       -        -    0  0  0  0        0       0
 1 +     6.00W       -        -    1  1  1  1        0       0
 2 +     5.10W       -        -    2  2  2  2        0       0
 3 -   0.0400W       -        -    3  3  3  3      210    1500
 4 -   0.0050W       -        -    4  4  4  4     2200    6000

Supported LBA Sizes (NSID 0x1)
Id Fmt  Data  Metadt  Rel_Perf
 0 +     512       0         0

=== START OF SMART DATA SECTION ===
SMART overall-health self-assessment test result: PASSED

SMART/Health Information (NVMe Log 0x02)
Critical Warning:                   0x00
Temperature:                        33 Celsius
Available Spare:                    100%
Available Spare Threshold:          5%
Percentage Used:                    3%
Data Units Read:                    28,978,328 [14.8 TB]
Data Units Written:                 38,682,294 [19.8 TB]
Host Read Commands:                 203,685,072
Host Write Commands:                1,863,448,555
Controller Busy Time:               5,587
Power Cycles:                       2,591
Power On Hours:                     5,292
Unsafe Shutdowns:                   93
Media and Data Integrity Errors:    0
Error Information Log Entries:      1,236
Warning  Comp. Temperature Time:    0
Critical Comp. Temperature Time:    0
Temperature Sensor 1:               33 Celsius

Error Information (NVMe Log 0x01, 16 of 64 entries)
Num   ErrCount  SQId   CmdId  Status  PELoc          LBA  NSID    VS
  0       1236     0  0x00f9  0x4212  0x028            0     -     -
  1       1235     0  0x0019  0x4004  0x02c            0     0     -
  2       1234     0  0x0018  0x4004  0x02c            0     0     -
  3       1233     0  0x0019  0x4004  0x02c            0     0     -
  4       1232     0  0x0018  0x4004  0x02c            0     0     -
  5       1231     0  0x0008  0x4016  0x004            0     1     -
  6       1230     0  0x00a9  0x4212  0x028            0     -     -
  7       1229     0  0x0019  0x4004  0x02c            0     0     -
  8       1228     0  0x0018  0x4004  0x02c            0     0     -
  9       1227     0  0x006f  0x4212  0x028            0     -     -
 10       1226     0  0x0019  0x4004  0x02c            0     0     -
 11       1225     0  0x0018  0x4004  0x02c            0     0     -
 12       1224     0  0x0021  0x4212  0x028            0     -     -
 13       1223     0  0x0019  0x4004  0x02c            0     0     -
 14       1222     0  0x0018  0x4004  0x02c            0     0     -
 15       1221     0  0x0008  0x4016  0x004            0     1     -
... (48 entries not read)

