smartctl 7.3 2022-02-28 r5338 [FreeBSD 13.1-RELEASE-p8 amd64] (local build)
Copyright (C) 2002-22, Bruce Allen, Christian Franke, www.smartmontools.org

=== START OF INFORMATION SECTION ===
Model Number:                       PM991 NVMe Samsung 256GB
Serial Number:                      --
Firmware Version:                   25304039
PCI Vendor/Subsystem ID:            0x144d
IEEE OUI Identifier:                0x002538
Total NVM Capacity:                 256,060,514,304 [256 GB]
Unallocated NVM Capacity:           0
Controller ID:                      5
NVMe Version:                       1.3
Number of Namespaces:               1
Namespace 1 Size/Capacity:          256,060,514,304 [256 GB]
Namespace 1 Utilization:            193,561,382,912 [193 GB]
Namespace 1 Formatted LBA Size:     512
Local Time is:                      Fri Aug  4 23:48:08 2023 CEST
Firmware Updates (0x16):            3 Slots, no Reset required
Optional Admin Commands (0x0017):   Security Format Frmw_DL Self_Test
Optional NVM Commands (0x005f):     Comp Wr_Unc DS_Mngmt Wr_Zero Sav/Sel_Feat Timestmp
Log Page Attributes (0x0e):         Cmd_Eff_Lg Ext_Get_Lg Telmtry_Lg
Maximum Data Transfer Size:         512 Pages
Warning  Comp. Temp. Threshold:     81 Celsius
Critical Comp. Temp. Threshold:     85 Celsius

Supported Power States
St Op     Max   Active     Idle   RL RT WL WT  Ent_Lat  Ex_Lat
 0 +     4.83W       -        -    0  0  0  0        0       0
 1 +     3.54W       -        -    1  1  1  1        0       0
 2 +     3.04W       -        -    2  2  2  2        0     500
 3 -   0.0500W       -        -    3  3  3  3      210    1200
 4 -   0.0050W       -        -    4  4  4  4     1000    9000

Supported LBA Sizes (NSID 0x1)
Id Fmt  Data  Metadt  Rel_Perf
 0 +     512       0         0

=== START OF SMART DATA SECTION ===
SMART overall-health self-assessment test result: PASSED

SMART/Health Information (NVMe Log 0x02)
Critical Warning:                   0x00
Temperature:                        9 Celsius
Available Spare:                    100%
Available Spare Threshold:          50%
Percentage Used:                    7%
Data Units Read:                    10,935,884 [5.59 TB]
Data Units Written:                 15,574,359 [7.97 TB]
Host Read Commands:                 300,401,416
Host Write Commands:                687,953,141
Controller Busy Time:               5,083
Power Cycles:                       196
Power On Hours:                     4,244
Unsafe Shutdowns:                   105
Media and Data Integrity Errors:    0
Error Information Log Entries:      246
Warning  Comp. Temperature Time:    0
Critical Comp. Temperature Time:    0
Temperature Sensor 1:               9 Celsius

Error Information (NVMe Log 0x01, 16 of 64 entries)
No Errors Logged

