smartctl 7.4 2023-08-01 r5530 [FreeBSD 13.2-RELEASE-p9 amd64] (local build)
Copyright (C) 2002-23, Bruce Allen, Christian Franke, www.smartmontools.org

=== START OF INFORMATION SECTION ===
Model Number:                       CT1000P2SSD8
Serial Number:                      --
Firmware Version:                   P2CR031
PCI Vendor/Subsystem ID:            0xc0a9
IEEE OUI Identifier:                0x6479a7
Total NVM Capacity:                 1,000,204,886,016 [1.00 TB]
Unallocated NVM Capacity:           0
Controller ID:                      1
NVMe Version:                       1.3
Number of Namespaces:               1
Namespace 1 Size/Capacity:          1,000,204,886,016 [1.00 TB]
Namespace 1 Formatted LBA Size:     512
Namespace 1 IEEE EUI-64:            6479a7 ...
Local Time is:                      Thu Feb  1 08:29:17 2024 CET
Firmware Updates (0x12):            1 Slot, no Reset required
Optional Admin Commands (0x0017):   Security Format Frmw_DL Self_Test
Optional NVM Commands (0x005e):     Wr_Unc DS_Mngmt Wr_Zero Sav/Sel_Feat Timestmp
Log Page Attributes (0x0e):         Cmd_Eff_Lg Ext_Get_Lg Telmtry_Lg
Maximum Data Transfer Size:         64 Pages
Warning  Comp. Temp. Threshold:     70 Celsius
Critical Comp. Temp. Threshold:     85 Celsius

Supported Power States
St Op     Max   Active     Idle   RL RT WL WT  Ent_Lat  Ex_Lat
 0 +     3.50W       -        -    0  0  0  0        0       0
 1 +     1.90W       -        -    1  1  1  1        0       0
 2 +     1.50W       -        -    2  2  2  2        0       0
 3 -   0.0700W       -        -    3  3  3  3     5000    1900
 4 -   0.0020W       -        -    4  4  4  4    13000  100000

Supported LBA Sizes (NSID 0x1)
Id Fmt  Data  Metadt  Rel_Perf
 0 +     512       0         1
 1 -    4096       0         0

=== START OF SMART DATA SECTION ===
SMART overall-health self-assessment test result: PASSED

SMART/Health Information (NVMe Log 0x02)
Critical Warning:                   0x00
Temperature:                        48 Celsius
Available Spare:                    100%
Available Spare Threshold:          5%
Percentage Used:                    0%
Data Units Read:                    37,260 [19.0 GB]
Data Units Written:                 5,235,790 [2.68 TB]
Host Read Commands:                 810,694
Host Write Commands:                56,088,598
Controller Busy Time:               697
Power Cycles:                       83
Power On Hours:                     887
Unsafe Shutdowns:                   48
Media and Data Integrity Errors:    0
Error Information Log Entries:      0
Warning  Comp. Temperature Time:    29
Critical Comp. Temperature Time:    0
Thermal Temp. 1 Transition Count:   16
Thermal Temp. 2 Transition Count:   4
Thermal Temp. 1 Total Time:         81760
Thermal Temp. 2 Total Time:         573807

Error Information (NVMe Log 0x01, 16 of 16 entries)
No Errors Logged

Self-test Log (NVMe Log 0x06)
Self-test status: No self-test in progress
No Self-tests Logged

