smartctl 7.3 2022-02-28 r5338 [FreeBSD 13.0-STABLE amd64] (local build)
Copyright (C) 2002-22, Bruce Allen, Christian Franke, www.smartmontools.org

=== START OF INFORMATION SECTION ===
Model Family:     Toshiba 2.5" HDD MQ01ABD...
Device Model:     TOSHIBA MQ01ABD075
Serial Number:    --
LU WWN Device Id: 5 000039 ...
Firmware Version: AX001C
User Capacity:    750,156,374,016 bytes [750 GB]
Sector Sizes:     512 bytes logical, 4096 bytes physical
Rotation Rate:    5400 rpm
Form Factor:      2.5 inches
Device is:        In smartctl database 7.3/5319
ATA Version is:   ATA8-ACS (minor revision not indicated)
SATA Version is:  SATA 2.6, 3.0 Gb/s (current: 3.0 Gb/s)
Local Time is:    Fri May 13 19:39:07 2022 EDT
SMART support is: Available - device has SMART capability.
SMART support is: Enabled
AAM feature is:   Unavailable
APM level is:     128 (minimum power consumption without standby)
Rd look-ahead is: Enabled
Write cache is:   Enabled
DSN feature is:   Unavailable
ATA Security is:  Disabled, frozen [SEC2]
Wt Cache Reorder: Enabled

=== START OF READ SMART DATA SECTION ===
SMART overall-health self-assessment test result: PASSED

General SMART Values:
Offline data collection status:  (0x00)	Offline data collection activity
					was never started.
					Auto Offline Data Collection: Disabled.
Self-test execution status:      ( 121)	The previous self-test completed having
					the read element of the test failed.
Total time to complete Offline 
data collection: 		(  120) seconds.
Offline data collection
capabilities: 			 (0x51) SMART execute Offline immediate.
					No Auto Offline data collection support.
					Suspend Offline collection upon new
					command.
					No Offline surface scan supported.
					Self-test supported.
					No Conveyance Self-test supported.
					Selective Self-test supported.
SMART capabilities:            (0x0003)	Saves SMART data before entering
					power-saving mode.
					Supports SMART auto save timer.
Error logging capability:        (0x01)	Error logging supported.
					General Purpose Logging supported.
Short self-test routine 
recommended polling time: 	 (   2) minutes.
Extended self-test routine
recommended polling time: 	 ( 161) minutes.
SCT capabilities: 	       (0x003d)	SCT Status supported.
					SCT Error Recovery Control supported.
					SCT Feature Control supported.
					SCT Data Table supported.

SMART Attributes Data Structure revision number: 16
Vendor Specific SMART Attributes with Thresholds:
ID# ATTRIBUTE_NAME          FLAGS    VALUE WORST THRESH FAIL RAW_VALUE
  1 Raw_Read_Error_Rate     POSR-K   100   100   050    -    0
  2 Throughput_Performance  POS--K   100   100   050    -    0
  3 Spin_Up_Time            PO---K   100   100   002    -    1500
  4 Start_Stop_Count        -O--CK   100   100   000    -    10705
  5 Reallocated_Sector_Ct   PO--CK   100   100   010    -    0
  7 Seek_Error_Rate         POSR-K   100   100   050    -    0
  8 Seek_Time_Performance   P-S--K   100   100   050    -    0
  9 Power_On_Hours          -O--CK   084   084   000    -    6790
 10 Spin_Retry_Count        PO--CK   253   100   030    -    0
 12 Power_Cycle_Count       -O--CK   100   100   000    -    10613
183 Runtime_Bad_Block       -O--CK   100   100   001    -    2
184 End-to-End_Error        PO--CK   100   100   097    -    0
185 Unknown_Attribute       -O--CK   100   100   001    -    65535
187 Reported_Uncorrect      -O--CK   001   001   000    -    19523
188 Command_Timeout         -O--CK   100   099   000    -    19
189 High_Fly_Writes         -O-RCK   100   100   001    -    0
190 Airflow_Temperature_Cel -O---K   064   056   040    -    36 (Min/Max 30/38)
191 G-Sense_Error_Rate      -O--CK   100   100   000    -    164
192 Power-Off_Retract_Count -O---K   100   100   000    -    6094941
193 Load_Cycle_Count        -O--CK   096   096   000    -    43893
194 Temperature_Celsius     -O---K   064   056   040    -    36 (Min/Max 30/38)
196 Reallocated_Event_Count -O--CK   100   100   000    -    0
197 Current_Pending_Sector  -O--CK   100   100   000    -    736
199 UDMA_CRC_Error_Count    -O--CK   200   200   000    -    0
                            ||||||_ K auto-keep
                            |||||__ C event count
                            ||||___ R error rate
                            |||____ S speed/performance
                            ||_____ O updated online
                            |______ P prefailure warning

General Purpose Log Directory Version 1
SMART           Log Directory Version 1 [multi-sector log support]
Address    Access  R/W   Size  Description
0x00       GPL,SL  R/O      1  Log Directory
0x01           SL  R/O      1  Summary SMART error log
0x02           SL  R/O     51  Comprehensive SMART error log
0x03       GPL     R/O     64  Ext. Comprehensive SMART error log
0x04       GPL,SL  R/O      8  Device Statistics log
0x06           SL  R/O      1  SMART self-test log
0x07       GPL     R/O      1  Extended self-test log
0x09           SL  R/W      1  Selective self-test log
0x10       GPL     R/O      1  NCQ Command Error log
0x11       GPL     R/O      1  SATA Phy Event Counters log
0x80-0x9f  GPL,SL  R/W     16  Host vendor specific log
0xe0       GPL,SL  R/W      1  SCT Command/Status
0xe1       GPL,SL  R/W      1  SCT Data Transfer

SMART Extended Comprehensive Error Log Version: 1 (64 sectors)
Device Error Count: 21240 (device log contains only the most recent 256 errors)
	CR     = Command Register
	FEATR  = Features Register
	COUNT  = Count (was: Sector Count) Register
	LBA_48 = Upper bytes of LBA High/Mid/Low Registers ]  ATA-8
	LH     = LBA High (was: Cylinder High) Register    ]   LBA
	LM     = LBA Mid (was: Cylinder Low) Register      ] Register
	LL     = LBA Low (was: Sector Number) Register     ]
	DV     = Device (was: Device/Head) Register
	DC     = Device Control Register
	ER     = Error register
	ST     = Status register
Powered_Up_Time is measured from power on, and printed as
DDd+hh:mm:SS.sss where DD=days, hh=hours, mm=minutes,
SS=sec, and sss=millisec. It "wraps" after 49.710 days.

Error 21240 [247] occurred at disk power-on lifetime: 6674 hours (278 days + 2 hours)
  When the command that caused the error occurred, the device was active or idle.

  After command completion occurred, registers were:
  ER -- ST COUNT  LBA_48  LH LM LL DV DC
  -- -- -- == -- == == == -- -- -- -- --
  40 -- 51 00 00 00 00 0c 79 6b b8 ec 00  Error: UNC at LBA = 0x0c796bb8 = 209284024

  Commands leading to the command that caused the error were:
  CR FEATR COUNT  LBA_48  LH LM LL DV DC  Powered_Up_Time  Command/Feature_Name
  -- == -- == -- == == == -- -- -- -- --  ---------------  --------------------
  42 00 00 00 10 00 00 0c 79 6b b0 e0 00     00:58:13.049  READ VERIFY SECTOR(S) EXT
  42 00 00 00 10 00 00 0c 79 6b a0 e0 00     00:58:13.036  READ VERIFY SECTOR(S) EXT
  42 00 00 00 20 00 00 0c 79 6c 60 e0 00     00:58:08.731  READ VERIFY SECTOR(S) EXT
  42 00 00 00 20 00 00 0c 79 6c 40 e0 00     00:58:04.427  READ VERIFY SECTOR(S) EXT
  42 00 00 00 20 00 00 0c 79 6c 20 e0 00     00:58:00.127  READ VERIFY SECTOR(S) EXT

Error 21239 [246] occurred at disk power-on lifetime: 6674 hours (278 days + 2 hours)
  When the command that caused the error occurred, the device was active or idle.

  After command completion occurred, registers were:
  ER -- ST COUNT  LBA_48  LH LM LL DV DC
  -- -- -- == -- == == == -- -- -- -- --
  40 -- 51 00 00 00 00 0c 79 6c 68 ec 00  Error: UNC at LBA = 0x0c796c68 = 209284200

  Commands leading to the command that caused the error were:
  CR FEATR COUNT  LBA_48  LH LM LL DV DC  Powered_Up_Time  Command/Feature_Name
  -- == -- == -- == == == -- -- -- -- --  ---------------  --------------------
  42 00 00 00 20 00 00 0c 79 6c 60 e0 00     00:58:08.731  READ VERIFY SECTOR(S) EXT
  42 00 00 00 20 00 00 0c 79 6c 40 e0 00     00:58:04.427  READ VERIFY SECTOR(S) EXT
  42 00 00 00 20 00 00 0c 79 6c 20 e0 00     00:58:00.127  READ VERIFY SECTOR(S) EXT
  42 00 00 00 20 00 00 0c 79 6c 00 e0 00     00:57:55.821  READ VERIFY SECTOR(S) EXT
  42 00 00 00 20 00 00 0c 79 6b e0 e0 00     00:57:51.523  READ VERIFY SECTOR(S) EXT

Error 21238 [245] occurred at disk power-on lifetime: 6674 hours (278 days + 2 hours)
  When the command that caused the error occurred, the device was active or idle.

  After command completion occurred, registers were:
  ER -- ST COUNT  LBA_48  LH LM LL DV DC
  -- -- -- == -- == == == -- -- -- -- --
  40 -- 51 00 00 00 00 0c 79 6c 40 ec 00  Error: UNC at LBA = 0x0c796c40 = 209284160

  Commands leading to the command that caused the error were:
  CR FEATR COUNT  LBA_48  LH LM LL DV DC  Powered_Up_Time  Command/Feature_Name
  -- == -- == -- == == == -- -- -- -- --  ---------------  --------------------
  42 00 00 00 20 00 00 0c 79 6c 40 e0 00     00:58:04.427  READ VERIFY SECTOR(S) EXT
  42 00 00 00 20 00 00 0c 79 6c 20 e0 00     00:58:00.127  READ VERIFY SECTOR(S) EXT
  42 00 00 00 20 00 00 0c 79 6c 00 e0 00     00:57:55.821  READ VERIFY SECTOR(S) EXT
  42 00 00 00 20 00 00 0c 79 6b e0 e0 00     00:57:51.523  READ VERIFY SECTOR(S) EXT
  42 00 00 00 20 00 00 0c 79 6b c0 e0 00     00:57:47.235  READ VERIFY SECTOR(S) EXT

Error 21237 [244] occurred at disk power-on lifetime: 6674 hours (278 days + 2 hours)
  When the command that caused the error occurred, the device was active or idle.

  After command completion occurred, registers were:
  ER -- ST COUNT  LBA_48  LH LM LL DV DC
  -- -- -- == -- == == == -- -- -- -- --
  40 -- 51 00 00 00 00 0c 79 6c 20 ec 00  Error: UNC at LBA = 0x0c796c20 = 209284128

  Commands leading to the command that caused the error were:
  CR FEATR COUNT  LBA_48  LH LM LL DV DC  Powered_Up_Time  Command/Feature_Name
  -- == -- == -- == == == -- -- -- -- --  ---------------  --------------------
  42 00 00 00 20 00 00 0c 79 6c 20 e0 00     00:58:00.127  READ VERIFY SECTOR(S) EXT
  42 00 00 00 20 00 00 0c 79 6c 00 e0 00     00:57:55.821  READ VERIFY SECTOR(S) EXT
  42 00 00 00 20 00 00 0c 79 6b e0 e0 00     00:57:51.523  READ VERIFY SECTOR(S) EXT
  42 00 00 00 20 00 00 0c 79 6b c0 e0 00     00:57:47.235  READ VERIFY SECTOR(S) EXT
  42 00 00 00 20 00 00 0c 79 6b a0 e0 00     00:57:42.936  READ VERIFY SECTOR(S) EXT

Error 21236 [243] occurred at disk power-on lifetime: 6674 hours (278 days + 2 hours)
  When the command that caused the error occurred, the device was active or idle.

  After command completion occurred, registers were:
  ER -- ST COUNT  LBA_48  LH LM LL DV DC
  -- -- -- == -- == == == -- -- -- -- --
  40 -- 51 00 00 00 00 0c 79 6c 00 ec 00  Error: UNC at LBA = 0x0c796c00 = 209284096

  Commands leading to the command that caused the error were:
  CR FEATR COUNT  LBA_48  LH LM LL DV DC  Powered_Up_Time  Command/Feature_Name
  -- == -- == -- == == == -- -- -- -- --  ---------------  --------------------
  42 00 00 00 20 00 00 0c 79 6c 00 e0 00     00:57:55.821  READ VERIFY SECTOR(S) EXT
  42 00 00 00 20 00 00 0c 79 6b e0 e0 00     00:57:51.523  READ VERIFY SECTOR(S) EXT
  42 00 00 00 20 00 00 0c 79 6b c0 e0 00     00:57:47.235  READ VERIFY SECTOR(S) EXT
  42 00 00 00 20 00 00 0c 79 6b a0 e0 00     00:57:42.936  READ VERIFY SECTOR(S) EXT
  42 00 00 00 20 00 00 0c 79 6b 80 e0 00     00:57:42.926  READ VERIFY SECTOR(S) EXT

Error 21235 [242] occurred at disk power-on lifetime: 6674 hours (278 days + 2 hours)
  When the command that caused the error occurred, the device was active or idle.

  After command completion occurred, registers were:
  ER -- ST COUNT  LBA_48  LH LM LL DV DC
  -- -- -- == -- == == == -- -- -- -- --
  40 -- 51 00 00 00 00 0c 79 6b e0 ec 00  Error: UNC at LBA = 0x0c796be0 = 209284064

  Commands leading to the command that caused the error were:
  CR FEATR COUNT  LBA_48  LH LM LL DV DC  Powered_Up_Time  Command/Feature_Name
  -- == -- == -- == == == -- -- -- -- --  ---------------  --------------------
  42 00 00 00 20 00 00 0c 79 6b e0 e0 00     00:57:51.523  READ VERIFY SECTOR(S) EXT
  42 00 00 00 20 00 00 0c 79 6b c0 e0 00     00:57:47.235  READ VERIFY SECTOR(S) EXT
  42 00 00 00 20 00 00 0c 79 6b a0 e0 00     00:57:42.936  READ VERIFY SECTOR(S) EXT
  42 00 00 00 20 00 00 0c 79 6b 80 e0 00     00:57:42.926  READ VERIFY SECTOR(S) EXT
  42 00 00 00 40 00 00 0c 79 6c 80 e0 00     00:57:42.916  READ VERIFY SECTOR(S) EXT

Error 21234 [241] occurred at disk power-on lifetime: 6674 hours (278 days + 2 hours)
  When the command that caused the error occurred, the device was active or idle.

  After command completion occurred, registers were:
  ER -- ST COUNT  LBA_48  LH LM LL DV DC
  -- -- -- == -- == == == -- -- -- -- --
  40 -- 51 00 00 00 00 0c 79 6b c0 ec 00  Error: UNC at LBA = 0x0c796bc0 = 209284032

  Commands leading to the command that caused the error were:
  CR FEATR COUNT  LBA_48  LH LM LL DV DC  Powered_Up_Time  Command/Feature_Name
  -- == -- == -- == == == -- -- -- -- --  ---------------  --------------------
  42 00 00 00 20 00 00 0c 79 6b c0 e0 00     00:57:47.235  READ VERIFY SECTOR(S) EXT
  42 00 00 00 20 00 00 0c 79 6b a0 e0 00     00:57:42.936  READ VERIFY SECTOR(S) EXT
  42 00 00 00 20 00 00 0c 79 6b 80 e0 00     00:57:42.926  READ VERIFY SECTOR(S) EXT
  42 00 00 00 40 00 00 0c 79 6c 80 e0 00     00:57:42.916  READ VERIFY SECTOR(S) EXT
  42 00 00 00 40 00 00 0c 79 6c 40 e0 00     00:57:38.612  READ VERIFY SECTOR(S) EXT

Error 21233 [240] occurred at disk power-on lifetime: 6674 hours (278 days + 2 hours)
  When the command that caused the error occurred, the device was active or idle.

  After command completion occurred, registers were:
  ER -- ST COUNT  LBA_48  LH LM LL DV DC
  -- -- -- == -- == == == -- -- -- -- --
  40 -- 51 00 00 00 00 0c 79 6b b8 ec 00  Error: UNC at LBA = 0x0c796bb8 = 209284024

  Commands leading to the command that caused the error were:
  CR FEATR COUNT  LBA_48  LH LM LL DV DC  Powered_Up_Time  Command/Feature_Name
  -- == -- == -- == == == -- -- -- -- --  ---------------  --------------------
  42 00 00 00 20 00 00 0c 79 6b a0 e0 00     00:57:42.936  READ VERIFY SECTOR(S) EXT
  42 00 00 00 20 00 00 0c 79 6b 80 e0 00     00:57:42.926  READ VERIFY SECTOR(S) EXT
  42 00 00 00 40 00 00 0c 79 6c 80 e0 00     00:57:42.916  READ VERIFY SECTOR(S) EXT
  42 00 00 00 40 00 00 0c 79 6c 40 e0 00     00:57:38.612  READ VERIFY SECTOR(S) EXT
  42 00 00 00 40 00 00 0c 79 6c 00 e0 00     00:57:34.272  READ VERIFY SECTOR(S) EXT

SMART Extended Self-test Log Version: 1 (1 sectors)
Num  Test_Description    Status                  Remaining  LifeTime(hours)  LBA_of_first_error
# 1  Short offline       Completed: read failure       90%      6648         84917432
# 2  Short offline       Completed without error       00%       476         -
# 3  Short offline       Completed without error       00%         6         -

SMART Selective self-test log data structure revision number 1
 SPAN  MIN_LBA  MAX_LBA  CURRENT_TEST_STATUS
    1        0        0  Not_testing
    2        0        0  Not_testing
    3        0        0  Not_testing
    4        0        0  Not_testing
    5        0        0  Not_testing
Selective self-test flags (0x0):
  After scanning selected spans, do NOT read-scan remainder of disk.
If Selective self-test is pending on power-up, resume after 0 minute delay.

SCT Status Version:                  2
SCT Version (vendor specific):       1 (0x0001)
Device State:                        Active (0)
Current Temperature:                    36 Celsius
Power Cycle Min/Max Temperature:     30/38 Celsius
Lifetime    Min/Max Temperature:     17/44 Celsius
Under/Over Temperature Limit Count:   0/0

SCT Temperature History Version:     2
Temperature Sampling Period:         1 minute
Temperature Logging Interval:        1 minute
Min/Max recommended Temperature:      0/60 Celsius
Min/Max Temperature Limit:            0/60 Celsius
Temperature History Size (Index):    478 (238)

SCT Error Recovery Control:
           Read: Disabled
          Write: Disabled

Device Statistics (GP Log 0x04)
Page  Offset Size        Value Flags Description
0x01  =====  =               =  ===  == General Statistics (rev 2) ==
0x01  0x008  4           10613  ---  Lifetime Power-On Resets
0x01  0x010  4            6790  ---  Power-on Hours
0x01  0x018  6     25491034097  ---  Logical Sectors Written
0x01  0x020  6       515596258  ---  Number of Write Commands
0x01  0x028  6     24363598164  ---  Logical Sectors Read
0x01  0x030  6       546455418  ---  Number of Read Commands
0x02  =====  =               =  ===  == Free-Fall Statistics (rev 1) ==
0x02  0x010  4             164  ---  Overlimit Shock Events
0x03  =====  =               =  ===  == Rotating Media Statistics (rev 1) ==
0x03  0x008  4            6782  ---  Spindle Motor Power-on Hours
0x03  0x010  4            6131  ---  Head Flying Hours
0x03  0x018  4           43893  ---  Head Load Events
0x03  0x020  4               0  ---  Number of Reallocated Logical Sectors
0x03  0x028  4             250  ---  Read Recovery Attempts
0x03  0x030  4               0  ---  Number of Mechanical Start Failures
0x04  =====  =               =  ===  == General Errors Statistics (rev 1) ==
0x04  0x008  4           19523  ---  Number of Reported Uncorrectable Errors
0x04  0x010  4              19  ---  Resets Between Cmd Acceptance and Completion
0x05  =====  =               =  ===  == Temperature Statistics (rev 1) ==
0x05  0x008  1              36  ---  Current Temperature
0x05  0x010  1              28  N--  Average Short Term Temperature
0x05  0x018  1              32  N--  Average Long Term Temperature
0x05  0x020  1              44  ---  Highest Temperature
0x05  0x028  1              17  ---  Lowest Temperature
0x05  0x030  1              35  N--  Highest Average Short Term Temperature
0x05  0x038  1              25  N--  Lowest Average Short Term Temperature
0x05  0x040  1              32  N--  Highest Average Long Term Temperature
0x05  0x048  1              30  N--  Lowest Average Long Term Temperature
0x05  0x050  4               0  ---  Time in Over-Temperature
0x05  0x058  1              60  ---  Specified Maximum Operating Temperature
0x05  0x060  4               0  ---  Time in Under-Temperature
0x05  0x068  1               0  ---  Specified Minimum Operating Temperature
0x06  =====  =               =  ===  == Transport Statistics (rev 1) ==
0x06  0x008  4            1524  ---  Number of Hardware Resets
0x06  0x018  4               0  ---  Number of Interface CRC Errors
0x07  =====  =               =  ===  == Solid State Device Statistics (rev 1) ==
0x07  0x008  1              11  N--  Percentage Used Endurance Indicator
                                |||_ C monitored condition met
                                ||__ D supports DSN
                                |___ N normalized value

Pending Defects log (GP Log 0x0c) not supported

SATA Phy Event Counters (GP Log 0x11)
ID      Size     Value  Description
0x0001  4            0  Command failed due to ICRC error
0x0002  4            0  R_ERR response for data FIS
0x0003  4            0  R_ERR response for device-to-host data FIS
0x0004  4            0  R_ERR response for host-to-device data FIS
0x0005  4            0  R_ERR response for non-data FIS
0x0006  4            0  R_ERR response for device-to-host non-data FIS
0x0007  4            0  R_ERR response for host-to-device non-data FIS
0x0008  4            0  Device-to-host non-data FIS retries
0x0009  4           11  Transition from drive PhyRdy to drive PhyNRdy
0x000a  4            7  Device-to-host register FISes sent due to a COMRESET
0x000b  4            0  CRC errors within host-to-device FIS
0x000d  4            0  Non-CRC errors within host-to-device FIS
0x000f  4            0  R_ERR response for host-to-device data FIS, CRC
0x0010  4            0  R_ERR response for host-to-device data FIS, non-CRC
0x0012  4            0  R_ERR response for host-to-device non-data FIS, CRC
0x0013  4            0  R_ERR response for host-to-device non-data FIS, non-CRC

