smartctl 7.3 2022-02-28 r5338 [FreeBSD 13.1-RELEASE amd64] (local build)
Copyright (C) 2002-22, Bruce Allen, Christian Franke, www.smartmontools.org

=== START OF INFORMATION SECTION ===
Model Family:     Hitachi Deskstar 7K80
Device Model:     HDS728080PLA380
Serial Number:    --
LU WWN Device Id: 5 000cca ...
Firmware Version: PF2OA6EA
User Capacity:    82,348,277,760 bytes [82.3 GB]
Sector Size:      512 bytes logical/physical
Device is:        In smartctl database 7.3/5319
ATA Version is:   ATA/ATAPI-7 T13/1532D revision 1
Local Time is:    Sat Sep 23 22:09:54 2023 IDT
SMART support is: Available - device has SMART capability.
SMART support is: Enabled
AAM feature is:   Disabled
APM feature is:   Disabled
Rd look-ahead is: Enabled
Write cache is:   Enabled
DSN feature is:   Unavailable
ATA Security is:  Disabled, frozen [SEC2]
Wt Cache Reorder: Unavailable

=== START OF READ SMART DATA SECTION ===
SMART overall-health self-assessment test result: PASSED

General SMART Values:
Offline data collection status:  (0x80)	Offline data collection activity
					was never started.
					Auto Offline Data Collection: Enabled.
Self-test execution status:      (   0)	The previous self-test routine completed
					without error or no self-test has ever 
					been run.
Total time to complete Offline 
data collection: 		( 1828) seconds.
Offline data collection
capabilities: 			 (0x5b) SMART execute Offline immediate.
					Auto Offline data collection on/off support.
					Suspend Offline collection upon new
					command.
					Offline surface scan supported.
					Self-test supported.
					No Conveyance Self-test supported.
					Selective Self-test supported.
SMART capabilities:            (0x0003)	Saves SMART data before entering
					power-saving mode.
					Supports SMART auto save timer.
Error logging capability:        (0x01)	Error logging supported.
					General Purpose Logging supported.
Short self-test routine 
recommended polling time: 	 (   1) minutes.
Extended self-test routine
recommended polling time: 	 (  31) minutes.

SMART Attributes Data Structure revision number: 16
Vendor Specific SMART Attributes with Thresholds:
ID# ATTRIBUTE_NAME          FLAGS    VALUE WORST THRESH FAIL RAW_VALUE
  1 Raw_Read_Error_Rate     PO-R--   098   098   016    -    65540
  2 Throughput_Performance  P-S---   158   158   050    -    213
  3 Spin_Up_Time            POS---   104   104   024    -    190 (Average 192)
  4 Start_Stop_Count        -O--C-   097   097   000    -    13238
  5 Reallocated_Sector_Ct   PO--CK   100   100   005    -    0
  7 Seek_Error_Rate         PO-R--   100   100   067    -    0
  8 Seek_Time_Performance   P-S---   142   142   020    -    28
  9 Power_On_Hours          -O--C-   096   096   000    -    28881
 10 Spin_Retry_Count        PO--C-   100   100   060    -    0
 12 Power_Cycle_Count       -O--CK   098   098   000    -    8252
192 Power-Off_Retract_Count -O--CK   077   077   050    -    27928
193 Load_Cycle_Count        -O--C-   077   077   050    -    27928
194 Temperature_Celsius     -O----   101   101   000    -    54 (Min/Max 9/59)
196 Reallocated_Event_Count -O--CK   100   100   000    -    0
197 Current_Pending_Sector  -O---K   100   100   000    -    0
198 Offline_Uncorrectable   ---R--   100   100   000    -    0
199 UDMA_CRC_Error_Count    -O-R--   200   253   000    -    7238
                            ||||||_ K auto-keep
                            |||||__ C event count
                            ||||___ R error rate
                            |||____ S speed/performance
                            ||_____ O updated online
                            |______ P prefailure warning

General Purpose Log Directory Version 1
SMART           Log Directory Version 1 [multi-sector log support]
Address    Access  R/W   Size  Description
0x00       GPL,SL  R/O      1  Log Directory
0x01           SL  R/O      1  Summary SMART error log
0x03       GPL     R/O      1  Ext. Comprehensive SMART error log
0x06           SL  R/O      1  SMART self-test log
0x07       GPL     R/O      1  Extended self-test log
0x09           SL  R/W      1  Selective self-test log
0x10       GPL     R/O      1  NCQ Command Error log
0x20       GPL     R/O      1  Streaming performance log [OBS-8]
0x21       GPL     R/O      1  Write stream error log
0x22       GPL     R/O      1  Read stream error log
0x80-0x9f  GPL,SL  R/W     16  Host vendor specific log

SMART Extended Comprehensive Error Log Version: 1 (1 sectors)
Device Error Count: 585 (device log contains only the most recent 4 errors)
	CR     = Command Register
	FEATR  = Features Register
	COUNT  = Count (was: Sector Count) Register
	LBA_48 = Upper bytes of LBA High/Mid/Low Registers ]  ATA-8
	LH     = LBA High (was: Cylinder High) Register    ]   LBA
	LM     = LBA Mid (was: Cylinder Low) Register      ] Register
	LL     = LBA Low (was: Sector Number) Register     ]
	DV     = Device (was: Device/Head) Register
	DC     = Device Control Register
	ER     = Error register
	ST     = Status register
Powered_Up_Time is measured from power on, and printed as
DDd+hh:mm:SS.sss where DD=days, hh=hours, mm=minutes,
SS=sec, and sss=millisec. It "wraps" after 49.710 days.

Error 585 [0] occurred at disk power-on lifetime: 23885 hours (995 days + 5 hours)
  When the command that caused the error occurred, the device was active or idle.

  After command completion occurred, registers were:
  ER -- ST COUNT  LBA_48  LH LM LL DV DC
  -- -- -- == -- == == == -- -- -- -- --
  10 -- 51 00 01 00 00 00 c2 4f 01 00 00  Error: IDNF

  Commands leading to the command that caused the error were:
  CR FEATR COUNT  LBA_48  LH LM LL DV DC  Powered_Up_Time  Command/Feature_Name
  -- == -- == -- == == == -- -- -- -- --  ---------------  --------------------
  b0 00 d5 00 01 00 00 00 c2 4f 01 00 08     04:26:52.400  SMART READ LOG
  b0 00 d5 00 01 00 00 00 c2 4f 00 00 08     04:26:52.400  SMART READ LOG
  b0 00 da 00 00 00 00 00 c2 4f 00 00 08     04:26:52.400  SMART RETURN STATUS
  b0 00 d1 00 01 00 00 00 c2 4f 01 00 08     04:26:52.300  SMART READ ATTRIBUTE THRESHOLDS [OBS-4]
  b0 00 d0 00 01 00 00 00 c2 4f 00 00 08     04:26:52.200  SMART READ DATA

Error 584 [3] occurred at disk power-on lifetime: 1370 hours (57 days + 2 hours)
  When the command that caused the error occurred, the device was active or idle.

  After command completion occurred, registers were:
  ER -- ST COUNT  LBA_48  LH LM LL DV DC
  -- -- -- == -- == == == -- -- -- -- --
  84 -- 51 00 00 00 00 00 5e 00 3e e0 00  Error: ABRT at LBA = 0x005e003e = 6160446

  Commands leading to the command that caused the error were:
  CR FEATR COUNT  LBA_48  LH LM LL DV DC  Powered_Up_Time  Command/Feature_Name
  -- == -- == -- == == == -- -- -- -- --  ---------------  --------------------
  c5 00 00 08 08 60 00 3f 5e 00 37 e0 00     02:24:40.200  WRITE MULTIPLE
  c4 00 00 08 08 60 00 3f 60 00 3f e0 00     02:24:40.200  READ MULTIPLE
  c4 00 00 00 08 5e 02 7e 60 00 3f e0 00     02:24:40.200  READ MULTIPLE
  c5 00 00 08 08 5e 02 7f 5e 02 77 e0 00     02:24:40.200  WRITE MULTIPLE
  c4 00 00 08 08 5e 02 77 5e 02 7f e0 00     02:24:40.200  READ MULTIPLE

Error 583 [2] occurred at disk power-on lifetime: 1370 hours (57 days + 2 hours)
  When the command that caused the error occurred, the device was active or idle.

  After command completion occurred, registers were:
  ER -- ST COUNT  LBA_48  LH LM LL DV DC
  -- -- -- == -- == == == -- -- -- -- --
  00 -- 51 00 07 00 00 00 5e 00 38 e0 00  Error:  at LBA = 0x005e0038 = 6160440

  Commands leading to the command that caused the error were:
  CR FEATR COUNT  LBA_48  LH LM LL DV DC  Powered_Up_Time  Command/Feature_Name
  -- == -- == -- == == == -- -- -- -- --  ---------------  --------------------
  c5 00 00 08 08 60 00 3f 5e 00 37 e0 00     02:24:40.200  WRITE MULTIPLE
  c4 00 00 08 08 60 00 3f 60 00 3f e0 00     02:24:40.200  READ MULTIPLE
  c4 00 00 00 08 5e 02 7e 60 00 3f e0 00     02:24:40.200  READ MULTIPLE
  c5 00 00 08 08 5e 02 7f 5e 02 77 e0 00     02:24:40.200  WRITE MULTIPLE
  c4 00 00 08 08 5e 02 77 5e 02 7f e0 00     02:24:40.200  READ MULTIPLE

Error 582 [1] occurred at disk power-on lifetime: 1370 hours (57 days + 2 hours)
  When the command that caused the error occurred, the device was active or idle.

  After command completion occurred, registers were:
  ER -- ST COUNT  LBA_48  LH LM LL DV DC
  -- -- -- == -- == == == -- -- -- -- --
  00 -- 59 00 06 00 00 07 8a 11 b2 e7 00  Error:  at LBA = 0x078a11b2 = 126489010

  Commands leading to the command that caused the error were:
  CR FEATR COUNT  LBA_48  LH LM LL DV DC  Powered_Up_Time  Command/Feature_Name
  -- == -- == -- == == == -- -- -- -- --  ---------------  --------------------
  c4 00 00 08 08 8a 11 a8 8a 11 b0 e7 00     02:24:40.000  READ MULTIPLE
  c4 00 00 01 08 7e 53 29 8a 11 a8 e7 00     02:24:40.000  READ MULTIPLE
  c4 00 00 08 01 8a 11 a0 7e 53 29 e5 00     02:24:40.000  READ MULTIPLE
  c4 00 00 01 08 71 16 76 8a 11 a0 e7 00     02:24:40.000  READ MULTIPLE
  c4 00 00 01 01 00 00 00 71 16 76 e2 00     02:24:40.000  READ MULTIPLE

SMART Extended Self-test Log Version: 1 (1 sectors)
Num  Test_Description    Status                  Remaining  LifeTime(hours)  LBA_of_first_error
# 1  Short offline       Completed without error       00%     24813         -
# 2  Short offline       Completed without error       00%     24769         -
# 3  Short offline       Completed without error       00%     24754         -
# 4  Short offline       Aborted by host               20%     24384         -
# 5  Short offline       Completed without error       00%      8250         -

Warning! SMART Selective Self-Test Log Structure error: invalid SMART checksum.
SMART Selective self-test log data structure revision number 1
 SPAN  MIN_LBA  MAX_LBA  CURRENT_TEST_STATUS
    1        0        0  Not_testing
    2        0        0  Not_testing
    3        0        0  Not_testing
    4        0        0  Not_testing
    5        0        0  Not_testing
Selective self-test flags (0x0):
  After scanning selected spans, do NOT read-scan remainder of disk.
If Selective self-test is pending on power-up, resume after 0 minute delay.

SCT Commands not supported

Device Statistics (GP/SMART Log 0x04) not supported

Pending Defects log (GP Log 0x0c) not supported

SATA Phy Event Counters (GP Log 0x11) not supported



