smartctl 7.1 2019-12-30 r5022 [FreeBSD 12.2-STABLE amd64] (local build)
Copyright (C) 2002-19, Bruce Allen, Christian Franke, www.smartmontools.org

=== START OF INFORMATION SECTION ===
Model Number:                       SAMSUNG MZVLB256HBHQ-000L7
Serial Number:                      --
Firmware Version:                   4M2QEXH7
PCI Vendor/Subsystem ID:            0x144d
IEEE OUI Identifier:                0x002538
Total NVM Capacity:                 256,060,514,304 [256 GB]
Unallocated NVM Capacity:           0
Controller ID:                      4
Number of Namespaces:               1
Namespace 1 Size/Capacity:          256,060,514,304 [256 GB]
Namespace 1 Utilization:            140,107,390,976 [140 GB]
Namespace 1 Formatted LBA Size:     512
Namespace 1 IEEE EUI-64:            002538 ...
Local Time is:                      Sat Dec  5 03:54:20 2020 UTC
Firmware Updates (0x16):            3 Slots, no Reset required
Optional Admin Commands (0x0017):   Security Format Frmw_DL Self_Test
Optional NVM Commands (0x005f):     Comp Wr_Unc DS_Mngmt Wr_Zero Sav/Sel_Feat Timestmp
Maximum Data Transfer Size:         512 Pages
Warning  Comp. Temp. Threshold:     84 Celsius
Critical Comp. Temp. Threshold:     85 Celsius

Supported Power States
St Op     Max   Active     Idle   RL RT WL WT  Ent_Lat  Ex_Lat
 0 +     8.00W       -        -    0  0  0  0        0       0
 1 +     6.30W       -        -    1  1  1  1        0       0
 2 +     3.50W       -        -    2  2  2  2        0       0
 3 -   0.0760W       -        -    3  3  3  3      210    1200
 4 -   0.0050W       -        -    4  4  4  4     2000    8000

Supported LBA Sizes (NSID 0x1)
Id Fmt  Data  Metadt  Rel_Perf
 0 +     512       0         0

=== START OF SMART DATA SECTION ===
SMART overall-health self-assessment test result: PASSED

SMART/Health Information (NVMe Log 0x02)
Critical Warning:                   0x00
Temperature:                        26 Celsius
Available Spare:                    100%
Available Spare Threshold:          10%
Percentage Used:                    0%
Data Units Read:                    3,412,779 [1.74 TB]
Data Units Written:                 5,714,299 [2.92 TB]
Host Read Commands:                 55,783,850
Host Write Commands:                84,747,037
Controller Busy Time:               294
Power Cycles:                       282
Power On Hours:                     538
Unsafe Shutdowns:                   48
Media and Data Integrity Errors:    0
Error Information Log Entries:      640
Warning  Comp. Temperature Time:    0
Critical Comp. Temperature Time:    0
Temperature Sensor 1:               26 Celsius
Temperature Sensor 2:               25 Celsius

Error Information (NVMe Log 0x01, max 64 entries)
No Errors Logged

