smartctl 7.2 2021-09-14 r5236 [FreeBSD 13.0-RELEASE amd64] (local build)
Copyright (C) 2002-20, Bruce Allen, Christian Franke, www.smartmontools.org

=== START OF INFORMATION SECTION ===
Model Family:     Intel S3520 Series SSDs
Device Model:     INTEL SSDSC2BB012T7
Serial Number:    --
LU WWN Device Id: 5 5cd2e4 ...
Firmware Version: N2010112
User Capacity:    1,200,243,695,616 bytes [1.20 TB]
Sector Sizes:     512 bytes logical, 4096 bytes physical
Rotation Rate:    Solid State Device
Form Factor:      2.5 inches
TRIM Command:     Available, deterministic, zeroed
Device is:        In smartctl database [for details use: -P show]
ATA Version is:   ACS-3 T13/2161-D revision 5
SATA Version is:  SATA 3.1, 6.0 Gb/s (current: 6.0 Gb/s)
Local Time is:    Thu Feb  3 00:23:46 2022 EST
SMART support is: Available - device has SMART capability.
SMART support is: Enabled
AAM feature is:   Unavailable
APM feature is:   Unavailable
Rd look-ahead is: Enabled
Write cache is:   Enabled
DSN feature is:   Unavailable
ATA Security is:  Disabled, NOT FROZEN [SEC1]
Wt Cache Reorder: Enabled

=== START OF READ SMART DATA SECTION ===
SMART overall-health self-assessment test result: PASSED

General SMART Values:
Offline data collection status:  (0x02)	Offline data collection activity
					was completed without error.
					Auto Offline Data Collection: Disabled.
Self-test execution status:      (   0)	The previous self-test routine completed
					without error or no self-test has ever 
					been run.
Total time to complete Offline 
data collection: 		(    2) seconds.
Offline data collection
capabilities: 			 (0x79) SMART execute Offline immediate.
					No Auto Offline data collection support.
					Suspend Offline collection upon new
					command.
					Offline surface scan supported.
					Self-test supported.
					Conveyance Self-test supported.
					Selective Self-test supported.
SMART capabilities:            (0x0003)	Saves SMART data before entering
					power-saving mode.
					Supports SMART auto save timer.
Error logging capability:        (0x01)	Error logging supported.
					General Purpose Logging supported.
Short self-test routine 
recommended polling time: 	 (   1) minutes.
Extended self-test routine
recommended polling time: 	 (   2) minutes.
Conveyance self-test routine
recommended polling time: 	 (   2) minutes.
SCT capabilities: 	       (0x003d)	SCT Status supported.
					SCT Error Recovery Control supported.
					SCT Feature Control supported.
					SCT Data Table supported.

SMART Attributes Data Structure revision number: 1
Vendor Specific SMART Attributes with Thresholds:
ID# ATTRIBUTE_NAME          FLAGS    VALUE WORST THRESH FAIL RAW_VALUE
  5 Reallocated_Sector_Ct   -O--CK   100   100   000    -    1
  9 Power_On_Hours          -O--CK   100   100   000    -    28060
 12 Power_Cycle_Count       -O--CK   100   100   000    -    328
170 Available_Reservd_Space PO--CK   099   099   010    -    0
171 Program_Fail_Count      -O--CK   100   100   000    -    0
172 Erase_Fail_Count        -O--CK   100   100   000    -    0
174 Unsafe_Shutdown_Count   -O--CK   100   100   000    -    53
175 Power_Loss_Cap_Test     PO--CK   100   100   010    -    14310 (476 891)
183 SATA_Downshift_Count    -O--CK   100   100   000    -    0
184 End-to-End_Error_Count  PO--CK   100   100   090    -    0
187 Uncorrectable_Error_Cnt -O--CK   100   100   000    -    0
190 Case_Temperature        -O---K   070   070   000    -    30 (Min/Max 20/36)
192 Unsafe_Shutdown_Count   -O--CK   100   100   000    -    53
194 Drive_Temperature       -O---K   100   100   000    -    30
197 Pending_Sector_Count    -O--C-   100   100   000    -    0
199 CRC_Error_Count         -OSRCK   100   100   000    -    24
225 Host_Writes_32MiB       -O--CK   100   100   000    -    6063721
226 Workld_Media_Wear_Indic -O--CK   100   100   000    -    4750
227 Workld_Host_Reads_Perc  -O--CK   100   100   000    -    54
228 Workload_Minutes        -O--CK   100   100   000    -    1682242
232 Available_Reservd_Space PO--CK   099   099   010    -    0
233 Media_Wearout_Indicator -O--CK   096   096   000    -    0
234 Thermal_Throttle_Status -O--CK   100   100   000    -    0/0
241 Host_Writes_32MiB       -O--CK   100   100   000    -    6063721
242 Host_Reads_32MiB        -O--CK   100   100   000    -    7208505
243 NAND_Writes_32MiB       -O--CK   100   100   000    -    10229030
                            ||||||_ K auto-keep
                            |||||__ C event count
                            ||||___ R error rate
                            |||____ S speed/performance
                            ||_____ O updated online
                            |______ P prefailure warning

General Purpose Log Directory Version 1
SMART           Log Directory Version 1 [multi-sector log support]
Address    Access  R/W   Size  Description
0x00       GPL,SL  R/O      1  Log Directory
0x01           SL  R/O      1  Summary SMART error log
0x02           SL  R/O      8  Comprehensive SMART error log
0x03       GPL     R/O     20  Ext. Comprehensive SMART error log
0x04       GPL,SL  R/O      8  Device Statistics log
0x06           SL  R/O      1  SMART self-test log
0x07       GPL     R/O      2  Extended self-test log
0x08       GPL     R/O      2  Power Conditions log
0x09           SL  R/W      1  Selective self-test log
0x10       GPL     R/O      1  NCQ Command Error log
0x11       GPL     R/O      1  SATA Phy Event Counters log
0x30       GPL,SL  R/O      9  IDENTIFY DEVICE data log
0x80-0x98  GPL,SL  R/W     16  Host vendor specific log
0x9b-0x9f  GPL,SL  R/W     16  Host vendor specific log
0xb8       GPL,SL  VS       1  Device vendor specific log
0xb9       GPL     VS    1704  Device vendor specific log
0xb9       SL      VS     168  Device vendor specific log
0xba       GPL     VS    1280  Device vendor specific log
0xe0       GPL,SL  R/W      1  SCT Command/Status
0xe1       GPL,SL  R/W      8  SCT Data Transfer

SMART Extended Comprehensive Error Log Version: 1 (20 sectors)
Device Error Count: 4
	CR     = Command Register
	FEATR  = Features Register
	COUNT  = Count (was: Sector Count) Register
	LBA_48 = Upper bytes of LBA High/Mid/Low Registers ]  ATA-8
	LH     = LBA High (was: Cylinder High) Register    ]   LBA
	LM     = LBA Mid (was: Cylinder Low) Register      ] Register
	LL     = LBA Low (was: Sector Number) Register     ]
	DV     = Device (was: Device/Head) Register
	DC     = Device Control Register
	ER     = Error register
	ST     = Status register
Powered_Up_Time is measured from power on, and printed as
DDd+hh:mm:SS.sss where DD=days, hh=hours, mm=minutes,
SS=sec, and sss=millisec. It "wraps" after 49.710 days.

Error 4 [3] occurred at disk power-on lifetime: 28030 hours (1167 days + 22 hours)
  When the command that caused the error occurred, the device was active or idle.

  After command completion occurred, registers were:
  ER -- ST COUNT  LBA_48  LH LM LL DV DC
  -- -- -- == -- == == == -- -- -- -- --
  84 -- 41 00 b0 00 00 78 13 cc b0 40 00  Error: ICRC, ABRT at LBA = 0x7813ccb0 = 2014563504

  Commands leading to the command that caused the error were:
  CR FEATR COUNT  LBA_48  LH LM LL DV DC  Powered_Up_Time  Command/Feature_Name
  -- == -- == -- == == == -- -- -- -- --  ---------------  --------------------
  60 00 00 00 b0 00 00 78 13 cc b0 40 00     16:27:44.036  READ FPDMA QUEUED
  60 00 00 00 b0 00 00 78 13 cd 60 40 00     16:27:44.035  READ FPDMA QUEUED
  60 00 00 00 c0 00 00 7c 11 17 80 40 00     16:27:44.034  READ FPDMA QUEUED
  60 00 00 00 a0 00 00 78 13 cc 10 40 00     16:27:44.032  READ FPDMA QUEUED
  60 00 00 00 a0 00 00 73 51 cf 10 40 00     16:27:44.030  READ FPDMA QUEUED

Error 3 [2] occurred at disk power-on lifetime: 28004 hours (1166 days + 20 hours)
  When the command that caused the error occurred, the device was active or idle.

  After command completion occurred, registers were:
  ER -- ST COUNT  LBA_48  LH LM LL DV DC
  -- -- -- == -- == == == -- -- -- -- --
  84 -- 51 01 18 00 00 3c 8f 5d 88 40 00  Error: ICRC, ABRT 280 sectors at LBA = 0x3c8f5d88 = 1016028552

  Commands leading to the command that caused the error were:
  CR FEATR COUNT  LBA_48  LH LM LL DV DC  Powered_Up_Time  Command/Feature_Name
  -- == -- == -- == == == -- -- -- -- --  ---------------  --------------------
  25 00 00 01 18 00 00 3c 8f 5d 88 40 00     00:02:19.669  READ DMA EXT
  25 00 00 01 08 00 00 3d 5f 4d 78 40 00     00:02:19.668  READ DMA EXT
  25 00 00 00 b8 00 00 3d 5f 4c c0 40 00     00:02:19.667  READ DMA EXT
  25 00 00 00 b8 00 00 3d 5f 4c 08 40 00     00:02:19.666  READ DMA EXT
  25 00 00 00 b8 00 00 3d 5f 4b 50 40 00     00:02:19.665  READ DMA EXT

Error 2 [1] occurred at disk power-on lifetime: 27996 hours (1166 days + 12 hours)
  When the command that caused the error occurred, the device was active or idle.

  After command completion occurred, registers were:
  ER -- ST COUNT  LBA_48  LH LM LL DV DC
  -- -- -- == -- == == == -- -- -- -- --
  84 -- 51 00 a8 00 00 01 14 6b c8 40 00  Error: ICRC, ABRT 168 sectors at LBA = 0x01146bc8 = 18115528

  Commands leading to the command that caused the error were:
  CR FEATR COUNT  LBA_48  LH LM LL DV DC  Powered_Up_Time  Command/Feature_Name
  -- == -- == -- == == == -- -- -- -- --  ---------------  --------------------
  25 00 00 00 a8 00 00 01 14 6b c8 40 00     00:01:20.251  READ DMA EXT
  25 00 00 00 b8 00 00 01 14 6b 10 40 00     00:01:20.250  READ DMA EXT
  25 00 00 00 b8 00 00 01 14 6a 58 40 00     00:01:20.249  READ DMA EXT
  25 00 00 00 b8 00 00 01 14 69 a0 40 00     00:01:20.248  READ DMA EXT
  25 00 00 00 b0 00 00 01 14 68 f0 40 00     00:01:20.247  READ DMA EXT

Error 1 [0] occurred at disk power-on lifetime: 26890 hours (1120 days + 10 hours)
  When the command that caused the error occurred, the device was active or idle.

  After command completion occurred, registers were:
  ER -- ST COUNT  LBA_48  LH LM LL DV DC
  -- -- -- == -- == == == -- -- -- -- --
  84 -- 41 01 00 00 00 20 09 8f b8 40 00  Error: ICRC, ABRT at LBA = 0x20098fb8 = 537497528

  Commands leading to the command that caused the error were:
  CR FEATR COUNT  LBA_48  LH LM LL DV DC  Powered_Up_Time  Command/Feature_Name
  -- == -- == -- == == == -- -- -- -- --  ---------------  --------------------
  60 00 00 01 00 00 00 20 09 8f b8 40 00     02:34:49.850  READ FPDMA QUEUED
  60 00 00 01 00 00 00 20 09 90 b8 40 00     02:34:49.850  READ FPDMA QUEUED
  60 00 00 01 00 00 00 20 09 8e b8 40 00     02:34:49.846  READ FPDMA QUEUED
  60 00 00 01 00 00 00 20 09 8d b8 40 00     02:34:49.845  READ FPDMA QUEUED
  60 00 00 01 00 00 00 20 09 8c b8 40 00     02:34:49.844  READ FPDMA QUEUED

SMART Extended Self-test Log Version: 1 (2 sectors)
Num  Test_Description    Status                  Remaining  LifeTime(hours)  LBA_of_first_error
# 1  Short offline       Completed without error       00%       203         -
# 2  Abort offline test  Aborted by host               00%       203         -
# 3  Short offline       Completed without error       00%       202         -
# 4  Abort offline test  Aborted by host               00%       202         -
# 5  Short offline       Completed without error       00%       201         -
# 6  Abort offline test  Aborted by host               00%       201         -
# 7  Short offline       Completed without error       00%       200         -
# 8  Abort offline test  Aborted by host               00%       200         -
# 9  Short offline       Completed without error       00%       199         -
#10  Abort offline test  Aborted by host               00%       199         -
#11  Short offline       Completed without error       00%       198         -
#12  Abort offline test  Aborted by host               00%       198         -
#13  Short offline       Completed without error       00%       197         -
#14  Abort offline test  Aborted by host               00%       197         -
#15  Short offline       Completed without error       00%       196         -
#16  Abort offline test  Aborted by host               00%       196         -
#17  Short offline       Completed without error       00%       195         -
#18  Abort offline test  Aborted by host               00%       195         -
#19  Short offline       Completed without error       00%       194         -
#20  Abort offline test  Aborted by host               00%       194         -
#21  Short offline       Completed without error       00%       193         -
#22  Abort offline test  Aborted by host               00%       193         -
#23  Short offline       Completed without error       00%       192         -
#24  Abort offline test  Aborted by host               00%       192         -
#25  Short offline       Completed without error       00%       191         -

SMART Selective self-test log data structure revision number 1
 SPAN  MIN_LBA  MAX_LBA  CURRENT_TEST_STATUS
    1        0        0  Not_testing
    2        0        0  Not_testing
    3        0        0  Not_testing
    4        0        0  Not_testing
    5        0        0  Not_testing
Selective self-test flags (0x0):
  After scanning selected spans, do NOT read-scan remainder of disk.
If Selective self-test is pending on power-up, resume after 0 minute delay.

SCT Status Version:                  3
SCT Version (vendor specific):       1 (0x0001)
Device State:                        Active (0)
Current Temperature:                    30 Celsius
Power Cycle Min/Max Temperature:     20/36 Celsius
Lifetime    Min/Max Temperature:     14/40 Celsius
Specified Max Operating Temperature:    70 Celsius
Under/Over Temperature Limit Count:   0/0
Vendor specific:
00 00 2c 01 00 00 00 00 00 00 00 00 00 00 00 00
00 00 00 00 00 00 00 00 00 00 00 00 00 00 00 00

SCT Temperature History Version:     2
Temperature Sampling Period:         1 minute
Temperature Logging Interval:        1 minute
Min/Max recommended Temperature:      0/70 Celsius
Min/Max Temperature Limit:            0/70 Celsius
Temperature History Size (Index):    478 (323)

SCT Error Recovery Control:
           Read: Disabled
          Write: Disabled

Device Statistics (GP Log 0x04)
Page  Offset Size        Value Flags Description
0x01  =====  =               =  ===  == General Statistics (rev 2) ==
0x01  0x008  4             328  ---  Lifetime Power-On Resets
0x01  0x018  6    397392025195  ---  Logical Sectors Written
0x01  0x020  6      1873727046  ---  Number of Write Commands
0x01  0x028  6    472416587440  ---  Logical Sectors Read
0x01  0x030  6      1370061787  ---  Number of Read Commands
0x04  =====  =               =  ===  == General Errors Statistics (rev 1) ==
0x04  0x008  4               0  ---  Number of Reported Uncorrectable Errors
0x04  0x010  4               7  ---  Resets Between Cmd Acceptance and Completion
0x05  =====  =               =  ===  == Temperature Statistics (rev 1) ==
0x05  0x008  1              30  ---  Current Temperature
0x05  0x010  1              31  ---  Average Short Term Temperature
0x05  0x018  1              27  ---  Average Long Term Temperature
0x05  0x020  1              40  ---  Highest Temperature
0x05  0x028  1              16  ---  Lowest Temperature
0x05  0x030  1              32  ---  Highest Average Short Term Temperature
0x05  0x038  1              18  ---  Lowest Average Short Term Temperature
0x05  0x040  1              29  ---  Highest Average Long Term Temperature
0x05  0x048  1              19  ---  Lowest Average Long Term Temperature
0x05  0x050  4               0  ---  Time in Over-Temperature
0x05  0x058  1              70  ---  Specified Maximum Operating Temperature
0x05  0x060  4               0  ---  Time in Under-Temperature
0x05  0x068  1               0  ---  Specified Minimum Operating Temperature
0x06  =====  =               =  ===  == Transport Statistics (rev 1) ==
0x06  0x008  4            3118  ---  Number of Hardware Resets
0x06  0x010  4             967  ---  Number of ASR Events
0x06  0x018  4              24  ---  Number of Interface CRC Errors
0x07  =====  =               =  ===  == Solid State Device Statistics (rev 1) ==
0x07  0x008  1               4  ---  Percentage Used Endurance Indicator
                                |||_ C monitored condition met
                                ||__ D supports DSN
                                |___ N normalized value

Pending Defects log (GP Log 0x0c) not supported

SATA Phy Event Counters (GP Log 0x11)
ID      Size     Value  Description
0x0001  4            0  Command failed due to ICRC error
0x0003  4            0  R_ERR response for device-to-host data FIS
0x0004  4            0  R_ERR response for host-to-device data FIS
0x0006  4            0  R_ERR response for device-to-host non-data FIS
0x000a  4            3  Device-to-host register FISes sent due to a COMRESET
0x000b  4            0  CRC errors within host-to-device FIS
0x000d  4            0  Non-CRC errors within host-to-device FIS

