smartctl 7.3 2022-02-28 r5338 [FreeBSD 13.1-RELEASE amd64] (local build)
Copyright (C) 2002-22, Bruce Allen, Christian Franke, www.smartmontools.org

=== START OF INFORMATION SECTION ===
Model Family:     Toshiba 2.5" HDD MK..59GSXP (AF)
Device Model:     TOSHIBA MK3259GSXP
Serial Number:    --
LU WWN Device Id: 5 000039 ...
Firmware Version: GN003J
User Capacity:    320,072,933,376 bytes [320 GB]
Sector Sizes:     512 bytes logical, 4096 bytes physical
Rotation Rate:    5400 rpm
Form Factor:      2.5 inches
Device is:        In smartctl database 7.3/5319
ATA Version is:   ATA8-ACS (minor revision not indicated)
SATA Version is:  SATA 2.6, 3.0 Gb/s (current: 3.0 Gb/s)
Local Time is:    Thu Nov 21 07:45:28 2024 UTC
SMART support is: Available - device has SMART capability.
SMART support is: Enabled
AAM feature is:   Unavailable
APM level is:     128 (minimum power consumption without standby)
Rd look-ahead is: Enabled
Write cache is:   Enabled
DSN feature is:   Unavailable
ATA Security is:  Disabled, frozen [SEC2]
Wt Cache Reorder: Enabled

=== START OF READ SMART DATA SECTION ===
SMART overall-health self-assessment test result: PASSED

General SMART Values:
Offline data collection status:  (0x00)	Offline data collection activity
					was never started.
					Auto Offline Data Collection: Disabled.
Self-test execution status:      ( 112)	The previous self-test completed having
					the read element of the test failed.
Total time to complete Offline 
data collection: 		(  120) seconds.
Offline data collection
capabilities: 			 (0x5b) SMART execute Offline immediate.
					Auto Offline data collection on/off support.
					Suspend Offline collection upon new
					command.
					Offline surface scan supported.
					Self-test supported.
					No Conveyance Self-test supported.
					Selective Self-test supported.
SMART capabilities:            (0x0003)	Saves SMART data before entering
					power-saving mode.
					Supports SMART auto save timer.
Error logging capability:        (0x01)	Error logging supported.
					General Purpose Logging supported.
Short self-test routine 
recommended polling time: 	 (   2) minutes.
Extended self-test routine
recommended polling time: 	 ( 105) minutes.
SCT capabilities: 	       (0x003d)	SCT Status supported.
					SCT Error Recovery Control supported.
					SCT Feature Control supported.
					SCT Data Table supported.

SMART Attributes Data Structure revision number: 16
Vendor Specific SMART Attributes with Thresholds:
ID# ATTRIBUTE_NAME          FLAGS    VALUE WORST THRESH FAIL RAW_VALUE
  1 Raw_Read_Error_Rate     PO-R--   100   100   050    -    0
  2 Throughput_Performance  P-S---   100   100   050    -    0
  3 Spin_Up_Time            POS--K   100   100   001    -    1174
  4 Start_Stop_Count        -O--CK   100   100   000    -    14483
  5 Reallocated_Sector_Ct   PO--CK   100   100   050    -    8
  7 Seek_Error_Rate         PO-R--   100   100   050    -    0
  8 Seek_Time_Performance   P-S---   100   100   050    -    0
  9 Power_On_Hours          -O--CK   060   060   000    -    16124
 10 Spin_Retry_Count        PO--CK   253   100   030    -    0
 12 Power_Cycle_Count       -O--CK   100   100   000    -    9103
191 G-Sense_Error_Rate      -O--CK   100   100   000    -    1065
192 Power-Off_Retract_Count -O--CK   099   099   000    -    785
193 Load_Cycle_Count        -O--CK   083   083   000    -    178581
194 Temperature_Celsius     -O---K   100   100   000    -    32 (Min/Max 3/51)
196 Reallocated_Event_Count -O--CK   100   100   000    -    1
197 Current_Pending_Sector  -O--CK   100   100   000    -    0
198 Offline_Uncorrectable   ----CK   100   100   000    -    0
199 UDMA_CRC_Error_Count    -O--CK   200   200   000    -    1
220 Disk_Shift              -O----   100   100   000    -    44
222 Loaded_Hours            -O--CK   081   081   000    -    7632
223 Load_Retry_Count        -O--CK   100   100   000    -    0
224 Load_Friction           -O---K   100   100   000    -    0
226 Load-in_Time            -OS--K   100   100   000    -    336
240 Head_Flying_Hours       P-----   100   100   001    -    0
                            ||||||_ K auto-keep
                            |||||__ C event count
                            ||||___ R error rate
                            |||____ S speed/performance
                            ||_____ O updated online
                            |______ P prefailure warning

General Purpose Log Directory Version 1
SMART           Log Directory Version 1 [multi-sector log support]
Address    Access  R/W   Size  Description
0x00       GPL,SL  R/O      1  Log Directory
0x01           SL  R/O      1  Summary SMART error log
0x02           SL  R/O     51  Comprehensive SMART error log
0x03       GPL     R/O     64  Ext. Comprehensive SMART error log
0x06           SL  R/O      1  SMART self-test log
0x07       GPL     R/O      1  Extended self-test log
0x09           SL  R/W      1  Selective self-test log
0x10       GPL     R/O      1  NCQ Command Error log
0x11       GPL     R/O      1  SATA Phy Event Counters log
0x80-0x9f  GPL,SL  R/W     16  Host vendor specific log
0xe0       GPL,SL  R/W      1  SCT Command/Status
0xe1       GPL,SL  R/W      1  SCT Data Transfer

SMART Extended Comprehensive Error Log Version: 1 (64 sectors)
Device Error Count: 376 (device log contains only the most recent 256 errors)
	CR     = Command Register
	FEATR  = Features Register
	COUNT  = Count (was: Sector Count) Register
	LBA_48 = Upper bytes of LBA High/Mid/Low Registers ]  ATA-8
	LH     = LBA High (was: Cylinder High) Register    ]   LBA
	LM     = LBA Mid (was: Cylinder Low) Register      ] Register
	LL     = LBA Low (was: Sector Number) Register     ]
	DV     = Device (was: Device/Head) Register
	DC     = Device Control Register
	ER     = Error register
	ST     = Status register
Powered_Up_Time is measured from power on, and printed as
DDd+hh:mm:SS.sss where DD=days, hh=hours, mm=minutes,
SS=sec, and sss=millisec. It "wraps" after 49.710 days.

Error 376 [119] occurred at disk power-on lifetime: 13141 hours (547 days + 13 hours)
  When the command that caused the error occurred, the device was active or idle.

  After command completion occurred, registers were:
  ER -- ST COUNT  LBA_48  LH LM LL DV DC
  -- -- -- == -- == == == -- -- -- -- --
  84 -- 41 00 78 00 00 23 c4 5d ff 63 00  Error: ICRC, ABRT at LBA = 0x23c45dff = 600071679

  Commands leading to the command that caused the error were:
  CR FEATR COUNT  LBA_48  LH LM LL DV DC  Powered_Up_Time  Command/Feature_Name
  -- == -- == -- == == == -- -- -- -- --  ---------------  --------------------
  60 01 00 00 b8 00 00 23 b5 00 00 40 00     00:04:34.547  READ FPDMA QUEUED
  61 0a 00 00 b0 00 00 23 c4 94 00 40 00     00:04:34.238  WRITE FPDMA QUEUED
  61 0a 00 00 a8 00 00 23 c4 8a 00 40 00     00:04:34.238  WRITE FPDMA QUEUED
  61 0a 00 00 a0 00 00 23 c4 80 00 40 00     00:04:34.205  WRITE FPDMA QUEUED
  61 04 00 00 98 00 00 23 c4 7c 00 40 00     00:04:34.205  WRITE FPDMA QUEUED

Error 375 [118] occurred at disk power-on lifetime: 8589 hours (357 days + 21 hours)
  When the command that caused the error occurred, the device was active or idle.

  After command completion occurred, registers were:
  ER -- ST COUNT  LBA_48  LH LM LL DV DC
  -- -- -- == -- == == == -- -- -- -- --
  40 -- 41 00 0a 00 00 14 4e 0c 30 64 00  Error: WP at LBA = 0x144e0c30 = 340659248

  Commands leading to the command that caused the error were:
  CR FEATR COUNT  LBA_48  LH LM LL DV DC  Powered_Up_Time  Command/Feature_Name
  -- == -- == -- == == == -- -- -- -- --  ---------------  --------------------
  61 00 08 00 00 00 00 00 4d 6b 67 40 00     00:59:29.848  WRITE FPDMA QUEUED
  60 00 20 00 08 00 00 14 4e 0c 1f 40 00     00:59:29.528  READ FPDMA QUEUED
  60 01 00 00 00 00 00 14 4e 0b 1f 40 00     00:59:29.528  READ FPDMA QUEUED
  61 00 20 00 08 00 00 00 3c 81 3f 40 00     00:59:29.527  WRITE FPDMA QUEUED
  61 01 00 00 00 00 00 00 3c 80 3f 40 00     00:59:29.527  WRITE FPDMA QUEUED

Error 374 [117] occurred at disk power-on lifetime: 7507 hours (312 days + 19 hours)
  When the command that caused the error occurred, the device was active or idle.

  After command completion occurred, registers were:
  ER -- ST COUNT  LBA_48  LH LM LL DV DC
  -- -- -- == -- == == == -- -- -- -- --
  40 -- 51 00 01 00 00 00 5b b6 67 e0 00  Error: UNC 1 sectors at LBA = 0x005bb667 = 6010471

  Commands leading to the command that caused the error were:
  CR FEATR COUNT  LBA_48  LH LM LL DV DC  Powered_Up_Time  Command/Feature_Name
  -- == -- == -- == == == -- -- -- -- --  ---------------  --------------------
  25 00 00 00 01 00 00 00 5b b6 67 e0 00     00:29:06.500  READ DMA EXT
  25 00 00 00 10 00 00 00 bc 0f 57 e0 00     00:29:06.489  READ DMA EXT
  25 00 00 00 01 00 00 00 5b b6 66 e0 00     00:29:02.467  READ DMA EXT
  25 00 00 00 08 00 00 00 bc 0f 77 e0 00     00:29:02.455  READ DMA EXT
  25 00 00 00 01 00 00 00 5b b6 65 e0 00     00:28:58.422  READ DMA EXT

Error 373 [116] occurred at disk power-on lifetime: 7507 hours (312 days + 19 hours)
  When the command that caused the error occurred, the device was active or idle.

  After command completion occurred, registers were:
  ER -- ST COUNT  LBA_48  LH LM LL DV DC
  -- -- -- == -- == == == -- -- -- -- --
  40 -- 51 00 01 00 00 00 5b b6 66 e0 00  Error: UNC 1 sectors at LBA = 0x005bb666 = 6010470

  Commands leading to the command that caused the error were:
  CR FEATR COUNT  LBA_48  LH LM LL DV DC  Powered_Up_Time  Command/Feature_Name
  -- == -- == -- == == == -- -- -- -- --  ---------------  --------------------
  25 00 00 00 01 00 00 00 5b b6 66 e0 00     00:29:02.467  READ DMA EXT
  25 00 00 00 08 00 00 00 bc 0f 77 e0 00     00:29:02.455  READ DMA EXT
  25 00 00 00 01 00 00 00 5b b6 65 e0 00     00:28:58.422  READ DMA EXT
  25 00 00 00 10 00 00 00 bc 0f 67 e0 00     00:28:58.411  READ DMA EXT
  25 00 00 00 01 00 00 00 5b b6 64 e0 00     00:28:54.388  READ DMA EXT

Error 372 [115] occurred at disk power-on lifetime: 7507 hours (312 days + 19 hours)
  When the command that caused the error occurred, the device was active or idle.

  After command completion occurred, registers were:
  ER -- ST COUNT  LBA_48  LH LM LL DV DC
  -- -- -- == -- == == == -- -- -- -- --
  40 -- 51 00 01 00 00 00 5b b6 65 e0 00  Error: UNC 1 sectors at LBA = 0x005bb665 = 6010469

  Commands leading to the command that caused the error were:
  CR FEATR COUNT  LBA_48  LH LM LL DV DC  Powered_Up_Time  Command/Feature_Name
  -- == -- == -- == == == -- -- -- -- --  ---------------  --------------------
  25 00 00 00 01 00 00 00 5b b6 65 e0 00     00:28:58.422  READ DMA EXT
  25 00 00 00 10 00 00 00 bc 0f 67 e0 00     00:28:58.411  READ DMA EXT
  25 00 00 00 01 00 00 00 5b b6 64 e0 00     00:28:54.388  READ DMA EXT
  25 00 00 00 10 00 00 00 bc 0e e7 e0 00     00:28:54.377  READ DMA EXT
  25 00 00 00 01 00 00 00 5b b6 63 e0 00     00:28:50.333  READ DMA EXT

Error 371 [114] occurred at disk power-on lifetime: 7507 hours (312 days + 19 hours)
  When the command that caused the error occurred, the device was active or idle.

  After command completion occurred, registers were:
  ER -- ST COUNT  LBA_48  LH LM LL DV DC
  -- -- -- == -- == == == -- -- -- -- --
  40 -- 51 00 01 00 00 00 5b b6 64 e0 00  Error: UNC 1 sectors at LBA = 0x005bb664 = 6010468

  Commands leading to the command that caused the error were:
  CR FEATR COUNT  LBA_48  LH LM LL DV DC  Powered_Up_Time  Command/Feature_Name
  -- == -- == -- == == == -- -- -- -- --  ---------------  --------------------
  25 00 00 00 01 00 00 00 5b b6 64 e0 00     00:28:54.388  READ DMA EXT
  25 00 00 00 10 00 00 00 bc 0e e7 e0 00     00:28:54.377  READ DMA EXT
  25 00 00 00 01 00 00 00 5b b6 63 e0 00     00:28:50.333  READ DMA EXT
  25 00 00 00 08 00 00 00 bc 0f 37 e0 00     00:28:50.322  READ DMA EXT
  25 00 00 00 01 00 00 00 5b b6 62 e0 00     00:28:46.299  READ DMA EXT

Error 370 [113] occurred at disk power-on lifetime: 7507 hours (312 days + 19 hours)
  When the command that caused the error occurred, the device was active or idle.

  After command completion occurred, registers were:
  ER -- ST COUNT  LBA_48  LH LM LL DV DC
  -- -- -- == -- == == == -- -- -- -- --
  40 -- 51 00 01 00 00 00 5b b6 63 e0 00  Error: UNC 1 sectors at LBA = 0x005bb663 = 6010467

  Commands leading to the command that caused the error were:
  CR FEATR COUNT  LBA_48  LH LM LL DV DC  Powered_Up_Time  Command/Feature_Name
  -- == -- == -- == == == -- -- -- -- --  ---------------  --------------------
  25 00 00 00 01 00 00 00 5b b6 63 e0 00     00:28:50.333  READ DMA EXT
  25 00 00 00 08 00 00 00 bc 0f 37 e0 00     00:28:50.322  READ DMA EXT
  25 00 00 00 01 00 00 00 5b b6 62 e0 00     00:28:46.299  READ DMA EXT
  25 00 00 00 01 00 00 00 5b b6 61 e0 00     00:28:42.147  READ DMA EXT
  25 00 00 00 40 00 00 00 29 9f 29 e0 00     00:28:42.133  READ DMA EXT

Error 369 [112] occurred at disk power-on lifetime: 7507 hours (312 days + 19 hours)
  When the command that caused the error occurred, the device was active or idle.

  After command completion occurred, registers were:
  ER -- ST COUNT  LBA_48  LH LM LL DV DC
  -- -- -- == -- == == == -- -- -- -- --
  40 -- 51 00 01 00 00 00 5b b6 62 e0 00  Error: UNC 1 sectors at LBA = 0x005bb662 = 6010466

  Commands leading to the command that caused the error were:
  CR FEATR COUNT  LBA_48  LH LM LL DV DC  Powered_Up_Time  Command/Feature_Name
  -- == -- == -- == == == -- -- -- -- --  ---------------  --------------------
  25 00 00 00 01 00 00 00 5b b6 62 e0 00     00:28:46.299  READ DMA EXT
  25 00 00 00 01 00 00 00 5b b6 61 e0 00     00:28:42.147  READ DMA EXT
  25 00 00 00 40 00 00 00 29 9f 29 e0 00     00:28:42.133  READ DMA EXT
  35 00 00 00 20 00 00 12 a1 96 1f e0 00     00:28:42.133  WRITE DMA EXT
  35 00 00 00 20 00 00 02 8f 51 1f e0 00     00:28:42.132  WRITE DMA EXT

SMART Extended Self-test Log Version: 1 (1 sectors)
Num  Test_Description    Status                  Remaining  LifeTime(hours)  LBA_of_first_error
# 1  Short offline       Completed: read failure       00%      7449         6010464

SMART Selective self-test log data structure revision number 1
 SPAN  MIN_LBA  MAX_LBA  CURRENT_TEST_STATUS
    1        0        0  Not_testing
    2        0        0  Not_testing
    3        0        0  Not_testing
    4        0        0  Not_testing
    5        0        0  Not_testing
Selective self-test flags (0x0):
  After scanning selected spans, do NOT read-scan remainder of disk.
If Selective self-test is pending on power-up, resume after 0 minute delay.

SCT Status Version:                  2
SCT Version (vendor specific):       1 (0x0001)
Device State:                        Active (0)
Current Temperature:                    32 Celsius
Power Cycle Min/Max Temperature:     23/34 Celsius
Lifetime    Min/Max Temperature:      3/51 Celsius
Under/Over Temperature Limit Count:   0/0

SCT Temperature History Version:     2
Temperature Sampling Period:         1 minute
Temperature Logging Interval:        1 minute
Min/Max recommended Temperature:      5/55 Celsius
Min/Max Temperature Limit:            5/55 Celsius
Temperature History Size (Index):    478 (467)

SCT Error Recovery Control:
           Read: Disabled
          Write: Disabled

Device Statistics (GP/SMART Log 0x04) not supported

Pending Defects log (GP Log 0x0c) not supported

SATA Phy Event Counters (GP Log 0x11)
ID      Size     Value  Description
0x0001  4            0  Command failed due to ICRC error
0x0002  4            0  R_ERR response for data FIS
0x0003  4            0  R_ERR response for device-to-host data FIS
0x0004  4            0  R_ERR response for host-to-device data FIS
0x0005  4            0  R_ERR response for non-data FIS
0x0006  4            0  R_ERR response for device-to-host non-data FIS
0x0007  4            0  R_ERR response for host-to-device non-data FIS
0x0008  4            0  Device-to-host non-data FIS retries
0x0009  4          105  Transition from drive PhyRdy to drive PhyNRdy
0x000a  4           60  Device-to-host register FISes sent due to a COMRESET
0x000b  4            0  CRC errors within host-to-device FIS
0x000d  4            0  Non-CRC errors within host-to-device FIS
0x000f  4            0  R_ERR response for host-to-device data FIS, CRC
0x0010  4            0  R_ERR response for host-to-device data FIS, non-CRC
0x0012  4            0  R_ERR response for host-to-device non-data FIS, CRC
0x0013  4            0  R_ERR response for host-to-device non-data FIS, non-CRC



