smartctl 7.2 2020-12-30 r5155 [FreeBSD 13.0-RELEASE amd64] (local build)
Copyright (C) 2002-20, Bruce Allen, Christian Franke, www.smartmontools.org

=== START OF INFORMATION SECTION ===
Model Number:                       SPCC M.2 PCIe SSD
Serial Number:                      --
Firmware Version:                   VC2S038E
PCI Vendor/Subsystem ID:            0x10ec
IEEE OUI Identifier:                0x00e04c
Controller ID:                      1
NVMe Version:                       1.4
Number of Namespaces:               1
Namespace 1 Size/Capacity:          1,000,204,886,016 [1.00 TB]
Namespace 1 Formatted LBA Size:     512
Namespace 1 IEEE EUI-64:            00e04c ...
Local Time is:                      Sat Nov  2 17:41:46 2024 EDT
Firmware Updates (0x02):            1 Slot
Optional Admin Commands (0x0017):   Security Format Frmw_DL Self_Test
Optional NVM Commands (0x005e):     Wr_Unc DS_Mngmt Wr_Zero Sav/Sel_Feat Timestmp
Log Page Attributes (0x02):         Cmd_Eff_Lg
Maximum Data Transfer Size:         32 Pages
Warning  Comp. Temp. Threshold:     100 Celsius
Critical Comp. Temp. Threshold:     110 Celsius

Supported Power States
St Op     Max   Active     Idle   RL RT WL WT  Ent_Lat  Ex_Lat
 0 +     8.00W       -        -    0  0  0  0   230000   50000
 1 +     4.00W       -        -    1  1  1  1     4000   50000
 2 +     3.00W       -        -    2  2  2  2     4000  250000
 3 -   0.0300W       -        -    3  3  3  3     5000   10000
 4 -   0.0050W       -        -    4  4  4  4    54000   45000

Supported LBA Sizes (NSID 0x1)
Id Fmt  Data  Metadt  Rel_Perf
 0 +     512       0         0

=== START OF SMART DATA SECTION ===
SMART overall-health self-assessment test result: PASSED

SMART/Health Information (NVMe Log 0x02)
Critical Warning:                   0x00
Temperature:                        44 Celsius
Available Spare:                    100%
Available Spare Threshold:          32%
Percentage Used:                    0%
Data Units Read:                    11,707,293 [5.99 TB]
Data Units Written:                 31,434,954 [16.0 TB]
Host Read Commands:                 119,686,312
Host Write Commands:                176,147,844
Controller Busy Time:               0
Power Cycles:                       1,915
Power On Hours:                     2,672
Unsafe Shutdowns:                   1,218
Media and Data Integrity Errors:    0
Error Information Log Entries:      0
Warning  Comp. Temperature Time:    0
Critical Comp. Temperature Time:    0

Error Information (NVMe Log 0x01, 8 of 8 entries)
No Errors Logged

