smartctl 7.4 2023-08-01 r5530 [FreeBSD 14.0-RELEASE amd64] (local build)
Copyright (C) 2002-23, Bruce Allen, Christian Franke, www.smartmontools.org

=== START OF INFORMATION SECTION ===
Model Family:     Seagate Maxtor DiamondMax 21
Device Model:     MAXTOR STM380215A
Serial Number:    --
Firmware Version: 3.AAD
User Capacity:    80,026,361,856 bytes [80.0 GB]
Sector Size:      512 bytes logical/physical
Device is:        In smartctl database 7.3/5528
ATA Version is:   ATA/ATAPI-7 (minor revision not indicated)
Local Time is:    Thu Jan  9 01:02:07 2025    
SMART support is: Available - device has SMART capability.
SMART support is: Enabled
AAM feature is:   Unavailable
APM feature is:   Unavailable
Rd look-ahead is: Enabled
Write cache is:   Enabled
DSN feature is:   Unavailable
ATA Security is:  Disabled, frozen [SEC2]
Wt Cache Reorder: Unavailable

=== START OF READ SMART DATA SECTION ===
SMART overall-health self-assessment test result: PASSED

General SMART Values:
Offline data collection status:  (0x82)	Offline data collection activity
					was completed without error.
					Auto Offline Data Collection: Enabled.
Self-test execution status:      (   0)	The previous self-test routine completed
					without error or no self-test has ever 
					been run.
Total time to complete Offline 
data collection: 		(  430) seconds.
Offline data collection
capabilities: 			 (0x5b) SMART execute Offline immediate.
					Auto Offline data collection on/off support.
					Suspend Offline collection upon new
					command.
					Offline surface scan supported.
					Self-test supported.
					No Conveyance Self-test supported.
					Selective Self-test supported.
SMART capabilities:            (0x0003)	Saves SMART data before entering
					power-saving mode.
					Supports SMART auto save timer.
Error logging capability:        (0x01)	Error logging supported.
					General Purpose Logging supported.
Short self-test routine 
recommended polling time: 	 (   1) minutes.
Extended self-test routine
recommended polling time: 	 (  27) minutes.

SMART Attributes Data Structure revision number: 10
Vendor Specific SMART Attributes with Thresholds:
ID# ATTRIBUTE_NAME          FLAGS    VALUE WORST THRESH FAIL RAW_VALUE
  1 Raw_Read_Error_Rate     POSR--   116   099   006    -    105336848
  3 Spin_Up_Time            PO----   098   097   000    -    0
  4 Start_Stop_Count        -O--CK   099   099   020    -    1149
  5 Reallocated_Sector_Ct   PO--CK   075   075   036    -    1019
  7 Seek_Error_Rate         POSR--   079   060   030    -    96610548
  9 Power_On_Hours          -O--CK   096   096   000    -    3873
 10 Spin_Retry_Count        PO--C-   100   100   097    -    0
 12 Power_Cycle_Count       -O--CK   099   099   020    -    1209
187 Reported_Uncorrect      -O--CK   100   100   000    -    0
189 High_Fly_Writes         -O-RCK   100   100   000    -    0
190 Airflow_Temperature_Cel -O---K   058   048   045    -    42 (Min/Max 39/43)
194 Temperature_Celsius     -O---K   042   052   000    -    42 (0 16 0 0 0)
195 Hardware_ECC_Recovered  -O-RC-   081   068   000    -    156424924
197 Current_Pending_Sector  -O--C-   100   100   000    -    0
198 Offline_Uncorrectable   ----C-   100   100   000    -    0
199 UDMA_CRC_Error_Count    -OSRCK   200   200   000    -    110
200 Multi_Zone_Error_Rate   ------   100   253   000    -    0
202 Data_Address_Mark_Errs  -O--CK   100   253   000    -    0
                            ||||||_ K auto-keep
                            |||||__ C event count
                            ||||___ R error rate
                            |||____ S speed/performance
                            ||_____ O updated online
                            |______ P prefailure warning

General Purpose Log Directory Version 1
SMART           Log Directory Version 1 [multi-sector log support]
Address    Access  R/W   Size  Description
0x00       GPL,SL  R/O      1  Log Directory
0x01       GPL,SL  R/O      1  Summary SMART error log
0x02       GPL,SL  R/O      5  Comprehensive SMART error log
0x03       GPL,SL  R/O      5  Ext. Comprehensive SMART error log
0x06       GPL,SL  R/O      1  SMART self-test log
0x07       GPL,SL  R/O      1  Extended self-test log
0x09       GPL,SL  R/W      1  Selective self-test log
0x20       GPL,SL  R/O      1  Streaming performance log
0x21       GPL,SL  R/O      1  Write stream error log
0x22       GPL,SL  R/O      1  Read stream error log
0x23       GPL,SL  R/O      1  Delayed sector log
0x80-0x9f  GPL,SL  R/W     16  Host vendor specific log
0xa0       GPL,SL  VS       1  Device vendor specific log
0xa1       GPL,SL  VS      20  Device vendor specific log
0xa2       GPL,SL  VS     101  Device vendor specific log
0xa8       GPL,SL  VS      20  Device vendor specific log
0xa9       GPL,SL  VS       1  Device vendor specific log
0xe0       GPL,SL  R/W      1  SCT Command/Status
0xe1       GPL,SL  R/W      1  SCT Data Transfer
0xff       GPL     -    23552  Reserved

SMART Extended Comprehensive Error Log Version: 1 (5 sectors)
Device Error Count: 145 (device log contains only the most recent 20 errors)
	CR     = Command Register
	FEATR  = Features Register
	COUNT  = Count (was: Sector Count) Register
	LBA_48 = Upper bytes of LBA High/Mid/Low Registers ]  ATA-8
	LH     = LBA High (was: Cylinder High) Register    ]   LBA
	LM     = LBA Mid (was: Cylinder Low) Register      ] Register
	LL     = LBA Low (was: Sector Number) Register     ]
	DV     = Device (was: Device/Head) Register
	DC     = Device Control Register
	ER     = Error register
	ST     = Status register
Powered_Up_Time is measured from power on, and printed as
DDd+hh:mm:SS.sss where DD=days, hh=hours, mm=minutes,
SS=sec, and sss=millisec. It "wraps" after 49.710 days.

Error 145 [4] occurred at disk power-on lifetime: 2904 hours (121 days + 0 hours)
  When the command that caused the error occurred, the device was active or idle.

  After command completion occurred, registers were:
  ER -- ST COUNT  LBA_48  LH LM LL DV DC
  -- -- -- == -- == == == -- -- -- -- --
  84 -- 51 00 00 00 00 00 00 00 00 f0 00  Error: ICRC, ABRT at LBA = 0x00000000 = 0

  Commands leading to the command that caused the error were:
  CR FEATR COUNT  LBA_48  LH LM LL DV DC  Powered_Up_Time  Command/Feature_Name
  -- == -- == -- == == == -- -- -- -- --  ---------------  --------------------
  25 00 00 00 01 00 00 00 00 00 00 f0 00     00:00:18.768  READ DMA EXT
  91 00 00 00 3f 00 0f 00 00 00 00 ff 00     00:00:18.767  INITIALIZE DEVICE PARAMETERS [OBS-6]
  c6 00 00 00 10 00 00 00 00 00 00 f0 00     00:00:18.111  SET MULTIPLE MODE
  91 00 00 00 3f 00 0f 00 00 00 00 ff 00     00:00:17.909  INITIALIZE DEVICE PARAMETERS [OBS-6]
  10 00 00 01 00 00 00 00 00 00 00 f0 00     00:00:04.661  RECALIBRATE [OBS-4]

Error 144 [3] occurred at disk power-on lifetime: 2904 hours (121 days + 0 hours)
  When the command that caused the error occurred, the device was active or idle.

  After command completion occurred, registers were:
  ER -- ST COUNT  LBA_48  LH LM LL DV DC
  -- -- -- == -- == == == -- -- -- -- --
  84 -- 51 00 00 00 00 00 00 00 00 f0 00  Error: ICRC, ABRT at LBA = 0x00000000 = 0

  Commands leading to the command that caused the error were:
  CR FEATR COUNT  LBA_48  LH LM LL DV DC  Powered_Up_Time  Command/Feature_Name
  -- == -- == -- == == == -- -- -- -- --  ---------------  --------------------
  25 00 00 00 01 00 00 8d 00 00 50 f0 00     00:00:25.370  READ DMA EXT
  25 00 00 00 01 00 00 08 00 00 0f f0 00     00:00:25.370  READ DMA EXT
  25 00 00 00 01 00 00 08 00 00 0e f0 00     00:00:25.370  READ DMA EXT
  25 00 00 00 01 00 00 08 00 00 0d f0 00     00:00:25.370  READ DMA EXT
  25 00 00 00 01 00 00 08 00 00 0c f0 00     00:00:25.370  READ DMA EXT

Error 143 [2] occurred at disk power-on lifetime: 2904 hours (121 days + 0 hours)
  When the command that caused the error occurred, the device was active or idle.

  After command completion occurred, registers were:
  ER -- ST COUNT  LBA_48  LH LM LL DV DC
  -- -- -- == -- == == == -- -- -- -- --
  84 -- 51 00 00 00 00 00 00 00 00 f0 00  Error: ICRC, ABRT at LBA = 0x00000000 = 0

  Commands leading to the command that caused the error were:
  CR FEATR COUNT  LBA_48  LH LM LL DV DC  Powered_Up_Time  Command/Feature_Name
  -- == -- == -- == == == -- -- -- -- --  ---------------  --------------------
  25 00 00 00 01 00 00 00 00 00 00 f0 00     00:00:40.316  READ DMA EXT
  c6 00 00 00 10 00 00 00 00 00 00 f0 00     00:00:39.992  SET MULTIPLE MODE
  91 00 00 00 3f 00 0f 00 00 00 00 ff 00     00:00:37.442  INITIALIZE DEVICE PARAMETERS [OBS-6]
  10 00 00 01 00 00 00 00 00 00 00 f0 00     00:00:37.442  RECALIBRATE [OBS-4]
  00 00 00 00 10 00 00 00 00 00 00 00 00     00:00:37.442  NOP [Abort queued commands]

Error 142 [1] occurred at disk power-on lifetime: 2904 hours (121 days + 0 hours)
  When the command that caused the error occurred, the device was active or idle.

  After command completion occurred, registers were:
  ER -- ST COUNT  LBA_48  LH LM LL DV DC
  -- -- -- == -- == == == -- -- -- -- --
  84 -- 51 00 00 00 00 00 00 00 00 f0 00  Error: ICRC, ABRT at LBA = 0x00000000 = 0

  Commands leading to the command that caused the error were:
  CR FEATR COUNT  LBA_48  LH LM LL DV DC  Powered_Up_Time  Command/Feature_Name
  -- == -- == -- == == == -- -- -- -- --  ---------------  --------------------
  25 00 00 00 01 00 00 00 00 00 00 f0 00     00:00:18.762  READ DMA EXT
  91 00 00 00 3f 00 0f 00 00 00 00 ff 00     00:00:18.761  INITIALIZE DEVICE PARAMETERS [OBS-6]
  c6 00 00 00 10 00 00 00 00 00 00 f0 00     00:00:18.104  SET MULTIPLE MODE
  91 00 00 00 3f 00 0f 00 00 00 00 ff 00     00:00:17.902  INITIALIZE DEVICE PARAMETERS [OBS-6]
  10 00 00 01 00 00 00 00 00 00 00 f0 00     00:00:04.429  RECALIBRATE [OBS-4]

Error 141 [0] occurred at disk power-on lifetime: 2904 hours (121 days + 0 hours)
  When the command that caused the error occurred, the device was active or idle.

  After command completion occurred, registers were:
  ER -- ST COUNT  LBA_48  LH LM LL DV DC
  -- -- -- == -- == == == -- -- -- -- --
  84 -- 51 00 00 00 00 00 00 00 00 f0 00  Error: ICRC, ABRT at LBA = 0x00000000 = 0

  Commands leading to the command that caused the error were:
  CR FEATR COUNT  LBA_48  LH LM LL DV DC  Powered_Up_Time  Command/Feature_Name
  -- == -- == -- == == == -- -- -- -- --  ---------------  --------------------
  25 00 00 00 01 00 00 00 00 00 00 f0 00     00:00:18.768  READ DMA EXT
  91 00 00 00 3f 00 0f 00 00 00 00 ff 00     00:00:18.767  INITIALIZE DEVICE PARAMETERS [OBS-6]
  c6 00 00 00 10 00 00 00 00 00 00 f0 00     00:00:18.111  SET MULTIPLE MODE
  91 00 00 00 3f 00 0f 00 00 00 00 ff 00     00:00:17.909  INITIALIZE DEVICE PARAMETERS [OBS-6]
  10 00 00 01 00 00 00 00 00 00 00 f0 00     00:00:04.661  RECALIBRATE [OBS-4]

Error 140 [19] occurred at disk power-on lifetime: 2904 hours (121 days + 0 hours)
  When the command that caused the error occurred, the device was active or idle.

  After command completion occurred, registers were:
  ER -- ST COUNT  LBA_48  LH LM LL DV DC
  -- -- -- == -- == == == -- -- -- -- --
  84 -- 51 00 00 00 00 00 00 00 00 f0 00  Error: ICRC, ABRT at LBA = 0x00000000 = 0

  Commands leading to the command that caused the error were:
  CR FEATR COUNT  LBA_48  LH LM LL DV DC  Powered_Up_Time  Command/Feature_Name
  -- == -- == -- == == == -- -- -- -- --  ---------------  --------------------
  25 00 00 00 01 00 00 8d 00 00 50 f0 00     00:00:25.370  READ DMA EXT
  25 00 00 00 01 00 00 08 00 00 0f f0 00     00:00:25.370  READ DMA EXT
  25 00 00 00 01 00 00 08 00 00 0e f0 00     00:00:25.370  READ DMA EXT
  25 00 00 00 01 00 00 08 00 00 0d f0 00     00:00:25.370  READ DMA EXT
  25 00 00 00 01 00 00 08 00 00 0c f0 00     00:00:25.370  READ DMA EXT

Error 139 [18] occurred at disk power-on lifetime: 2904 hours (121 days + 0 hours)
  When the command that caused the error occurred, the device was active or idle.

  After command completion occurred, registers were:
  ER -- ST COUNT  LBA_48  LH LM LL DV DC
  -- -- -- == -- == == == -- -- -- -- --
  84 -- 51 00 00 00 00 00 00 00 00 f0 00  Error: ICRC, ABRT at LBA = 0x00000000 = 0

  Commands leading to the command that caused the error were:
  CR FEATR COUNT  LBA_48  LH LM LL DV DC  Powered_Up_Time  Command/Feature_Name
  -- == -- == -- == == == -- -- -- -- --  ---------------  --------------------
  25 00 00 00 01 00 00 00 00 00 00 f0 00     00:00:40.316  READ DMA EXT
  c6 00 00 00 10 00 00 00 00 00 00 f0 00     00:00:39.992  SET MULTIPLE MODE
  91 00 00 00 3f 00 0f 00 00 00 00 ff 00     00:00:37.442  INITIALIZE DEVICE PARAMETERS [OBS-6]
  10 00 00 01 00 00 00 00 00 00 00 f0 00     00:00:37.442  RECALIBRATE [OBS-4]
  00 00 00 00 10 00 00 00 00 00 00 00 00     00:00:37.442  NOP [Abort queued commands]

Error 138 [17] occurred at disk power-on lifetime: 2904 hours (121 days + 0 hours)
  When the command that caused the error occurred, the device was active or idle.

  After command completion occurred, registers were:
  ER -- ST COUNT  LBA_48  LH LM LL DV DC
  -- -- -- == -- == == == -- -- -- -- --
  84 -- 51 00 00 00 00 00 00 00 00 f0 00  Error: ICRC, ABRT at LBA = 0x00000000 = 0

  Commands leading to the command that caused the error were:
  CR FEATR COUNT  LBA_48  LH LM LL DV DC  Powered_Up_Time  Command/Feature_Name
  -- == -- == -- == == == -- -- -- -- --  ---------------  --------------------
  25 00 00 00 01 00 00 00 00 00 00 f0 00     00:00:18.762  READ DMA EXT
  91 00 00 00 3f 00 0f 00 00 00 00 ff 00     00:00:18.761  INITIALIZE DEVICE PARAMETERS [OBS-6]
  c6 00 00 00 10 00 00 00 00 00 00 f0 00     00:00:18.104  SET MULTIPLE MODE
  91 00 00 00 3f 00 0f 00 00 00 00 ff 00     00:00:17.902  INITIALIZE DEVICE PARAMETERS [OBS-6]
  10 00 00 01 00 00 00 00 00 00 00 f0 00     00:00:04.429  RECALIBRATE [OBS-4]

SMART Extended Self-test Log Version: 1 (1 sectors)
Num  Test_Description    Status                  Remaining  LifeTime(hours)  LBA_of_first_error
# 1  Short offline       Completed without error       00%         0         -

SMART Selective self-test log data structure revision number 1
 SPAN  MIN_LBA  MAX_LBA  CURRENT_TEST_STATUS
    1        0        0  Not_testing
    2        0        0  Not_testing
    3        0        0  Not_testing
    4        0        0  Not_testing
    5        0        0  Not_testing
Selective self-test flags (0x0):
  After scanning selected spans, do NOT read-scan remainder of disk.
If Selective self-test is pending on power-up, resume after 0 minute delay.

SCT Commands not supported

Device Statistics (GP/SMART Log 0x04) not supported

Pending Defects log (GP Log 0x0c) not supported

SATA Phy Event Counters (GP Log 0x11) not supported



