smartctl 7.4 2023-08-01 r5530 [FreeBSD 14.0-RELEASE amd64] (local build)
Copyright (C) 2002-23, Bruce Allen, Christian Franke, www.smartmontools.org

=== START OF INFORMATION SECTION ===
Model Family:     Western Digital Blue
Device Model:     WDC WD10EALX-009BA0
Serial Number:    --
LU WWN Device Id: 5 0014ee ...
Firmware Version: 15.01H15
User Capacity:    1,000,204,886,016 bytes [1.00 TB]
Sector Size:      512 bytes logical/physical
Device is:        In smartctl database 7.3/5528
ATA Version is:   ATA8-ACS (minor revision not indicated)
SATA Version is:  SATA 3.0, 6.0 Gb/s (current: 3.0 Gb/s)
Local Time is:    Tue Dec  5 15:26:49 2023 EET
SMART support is: Available - device has SMART capability.
SMART support is: Enabled
AAM feature is:   Disabled
APM feature is:   Unavailable
Rd look-ahead is: Enabled
Write cache is:   Enabled
DSN feature is:   Unavailable
ATA Security is:  Disabled, frozen [SEC2]
Wt Cache Reorder: Enabled

=== START OF READ SMART DATA SECTION ===
SMART overall-health self-assessment test result: PASSED

General SMART Values:
Offline data collection status:  (0x84)	Offline data collection activity
					was suspended by an interrupting command from host.
					Auto Offline Data Collection: Enabled.
Self-test execution status:      (   0)	The previous self-test routine completed
					without error or no self-test has ever 
					been run.
Total time to complete Offline 
data collection: 		(17460) seconds.
Offline data collection
capabilities: 			 (0x7b) SMART execute Offline immediate.
					Auto Offline data collection on/off support.
					Suspend Offline collection upon new
					command.
					Offline surface scan supported.
					Self-test supported.
					Conveyance Self-test supported.
					Selective Self-test supported.
SMART capabilities:            (0x0003)	Saves SMART data before entering
					power-saving mode.
					Supports SMART auto save timer.
Error logging capability:        (0x01)	Error logging supported.
					General Purpose Logging supported.
Short self-test routine 
recommended polling time: 	 (   2) minutes.
Extended self-test routine
recommended polling time: 	 ( 202) minutes.
Conveyance self-test routine
recommended polling time: 	 (   5) minutes.
SCT capabilities: 	       (0x3037)	SCT Status supported.
					SCT Feature Control supported.
					SCT Data Table supported.

SMART Attributes Data Structure revision number: 16
Vendor Specific SMART Attributes with Thresholds:
ID# ATTRIBUTE_NAME          FLAGS    VALUE WORST THRESH FAIL RAW_VALUE
  1 Raw_Read_Error_Rate     POSR-K   200   200   051    -    0
  3 Spin_Up_Time            POS--K   178   175   021    -    4091
  4 Start_Stop_Count        -O--CK   100   100   000    -    225
  5 Reallocated_Sector_Ct   PO--CK   200   200   140    -    0
  7 Seek_Error_Rate         -OSR-K   200   200   000    -    0
  9 Power_On_Hours          -O--CK   001   001   000    -    96733
 10 Spin_Retry_Count        -O--CK   100   100   000    -    0
 11 Calibration_Retry_Count -O--CK   100   100   000    -    0
 12 Power_Cycle_Count       -O--CK   100   100   000    -    219
192 Power-Off_Retract_Count -O--CK   200   200   000    -    160
193 Load_Cycle_Count        -O--CK   200   200   000    -    64
194 Temperature_Celsius     -O---K   103   086   000    -    44
196 Reallocated_Event_Count -O--CK   200   200   000    -    0
197 Current_Pending_Sector  -O--CK   200   200   000    -    0
198 Offline_Uncorrectable   ----CK   200   200   000    -    0
199 UDMA_CRC_Error_Count    -O--CK   200   200   000    -    0
200 Multi_Zone_Error_Rate   ---R--   200   200   000    -    0
                            ||||||_ K auto-keep
                            |||||__ C event count
                            ||||___ R error rate
                            |||____ S speed/performance
                            ||_____ O updated online
                            |______ P prefailure warning

General Purpose Log Directory Version 1
SMART           Log Directory Version 1 [multi-sector log support]
Address    Access  R/W   Size  Description
0x00       GPL,SL  R/O      1  Log Directory
0x01           SL  R/O      1  Summary SMART error log
0x02           SL  R/O      5  Comprehensive SMART error log
0x03       GPL     R/O      6  Ext. Comprehensive SMART error log
0x06           SL  R/O      1  SMART self-test log
0x07       GPL     R/O      1  Extended self-test log
0x09           SL  R/W      1  Selective self-test log
0x10       GPL     R/O      1  NCQ Command Error log
0x11       GPL     R/O      1  SATA Phy Event Counters log
0x80-0x9f  GPL,SL  R/W     16  Host vendor specific log
0xa0-0xa7  GPL,SL  VS      16  Device vendor specific log
0xa8-0xb5  GPL,SL  VS       1  Device vendor specific log
0xb6       GPL     VS       1  Device vendor specific log
0xb7       GPL,SL  VS       1  Device vendor specific log
0xc0       GPL,SL  VS       1  Device vendor specific log
0xc1       GPL     VS      24  Device vendor specific log
0xe0       GPL,SL  R/W      1  SCT Command/Status
0xe1       GPL,SL  R/W      1  SCT Data Transfer

SMART Extended Comprehensive Error Log Version: 1 (6 sectors)
Device Error Count: 25 (device log contains only the most recent 24 errors)
	CR     = Command Register
	FEATR  = Features Register
	COUNT  = Count (was: Sector Count) Register
	LBA_48 = Upper bytes of LBA High/Mid/Low Registers ]  ATA-8
	LH     = LBA High (was: Cylinder High) Register    ]   LBA
	LM     = LBA Mid (was: Cylinder Low) Register      ] Register
	LL     = LBA Low (was: Sector Number) Register     ]
	DV     = Device (was: Device/Head) Register
	DC     = Device Control Register
	ER     = Error register
	ST     = Status register
Powered_Up_Time is measured from power on, and printed as
DDd+hh:mm:SS.sss where DD=days, hh=hours, mm=minutes,
SS=sec, and sss=millisec. It "wraps" after 49.710 days.

Error 25 [0] occurred at disk power-on lifetime: 62225 hours (2592 days + 17 hours)
  When the command that caused the error occurred, the device was active or idle.

  After command completion occurred, registers were:
  ER -- ST COUNT  LBA_48  LH LM LL DV DC
  -- -- -- == -- == == == -- -- -- -- --
  40 -- 51 00 5b 00 00 00 77 b8 4c e1 00  Error: UNC 91 sectors at LBA = 0x0177b84c = 24623180

  Commands leading to the command that caused the error were:
  CR FEATR COUNT  LBA_48  LH LM LL DV DC  Powered_Up_Time  Command/Feature_Name
  -- == -- == -- == == == -- -- -- -- --  ---------------  --------------------
  c8 00 00 00 5b 00 00 01 77 b7 ff e1 02     06:52:19.834  READ DMA
  c8 00 00 00 5b 00 00 01 77 b7 ff e1 02     06:52:18.044  READ DMA
  c8 00 00 00 5b 00 00 01 77 b7 ff e1 02     06:52:16.254  READ DMA
  c8 00 00 00 5b 00 00 01 77 b7 ff e1 02     06:52:14.464  READ DMA
  c8 00 00 00 5b 00 00 01 77 b7 ff e1 02     06:52:12.672  READ DMA

Error 24 [23] occurred at disk power-on lifetime: 62225 hours (2592 days + 17 hours)
  When the command that caused the error occurred, the device was active or idle.

  After command completion occurred, registers were:
  ER -- ST COUNT  LBA_48  LH LM LL DV DC
  -- -- -- == -- == == == -- -- -- -- --
  40 -- 51 00 5b 00 00 00 77 b8 4c e1 00  Error: UNC 91 sectors at LBA = 0x0177b84c = 24623180

  Commands leading to the command that caused the error were:
  CR FEATR COUNT  LBA_48  LH LM LL DV DC  Powered_Up_Time  Command/Feature_Name
  -- == -- == -- == == == -- -- -- -- --  ---------------  --------------------
  c8 00 00 00 5b 00 00 01 77 b7 ff e1 02     06:52:18.044  READ DMA
  c8 00 00 00 5b 00 00 01 77 b7 ff e1 02     06:52:16.254  READ DMA
  c8 00 00 00 5b 00 00 01 77 b7 ff e1 02     06:52:14.464  READ DMA
  c8 00 00 00 5b 00 00 01 77 b7 ff e1 02     06:52:12.672  READ DMA
  c8 00 00 00 20 00 00 01 06 2b 7f e1 02     06:52:12.659  READ DMA

Error 23 [22] occurred at disk power-on lifetime: 62225 hours (2592 days + 17 hours)
  When the command that caused the error occurred, the device was active or idle.

  After command completion occurred, registers were:
  ER -- ST COUNT  LBA_48  LH LM LL DV DC
  -- -- -- == -- == == == -- -- -- -- --
  40 -- 51 00 5b 00 00 00 77 b8 4c e1 00  Error: UNC 91 sectors at LBA = 0x0177b84c = 24623180

  Commands leading to the command that caused the error were:
  CR FEATR COUNT  LBA_48  LH LM LL DV DC  Powered_Up_Time  Command/Feature_Name
  -- == -- == -- == == == -- -- -- -- --  ---------------  --------------------
  c8 00 00 00 5b 00 00 01 77 b7 ff e1 02     06:52:16.254  READ DMA
  c8 00 00 00 5b 00 00 01 77 b7 ff e1 02     06:52:14.464  READ DMA
  c8 00 00 00 5b 00 00 01 77 b7 ff e1 02     06:52:12.672  READ DMA
  c8 00 00 00 20 00 00 01 06 2b 7f e1 02     06:52:12.659  READ DMA
  c8 00 00 00 08 00 00 0a fd f3 57 ea 02     06:52:12.659  READ DMA

Error 22 [21] occurred at disk power-on lifetime: 62225 hours (2592 days + 17 hours)
  When the command that caused the error occurred, the device was active or idle.

  After command completion occurred, registers were:
  ER -- ST COUNT  LBA_48  LH LM LL DV DC
  -- -- -- == -- == == == -- -- -- -- --
  40 -- 51 00 5b 00 00 00 77 b8 4c e1 00  Error: UNC 91 sectors at LBA = 0x0177b84c = 24623180

  Commands leading to the command that caused the error were:
  CR FEATR COUNT  LBA_48  LH LM LL DV DC  Powered_Up_Time  Command/Feature_Name
  -- == -- == -- == == == -- -- -- -- --  ---------------  --------------------
  c8 00 00 00 5b 00 00 01 77 b7 ff e1 02     06:52:14.464  READ DMA
  c8 00 00 00 5b 00 00 01 77 b7 ff e1 02     06:52:12.672  READ DMA
  c8 00 00 00 20 00 00 01 06 2b 7f e1 02     06:52:12.659  READ DMA
  c8 00 00 00 08 00 00 0a fd f3 57 ea 02     06:52:12.659  READ DMA
  c8 00 00 00 08 00 00 0a fd f9 f3 ea 02     06:52:12.652  READ DMA

Error 21 [20] occurred at disk power-on lifetime: 62225 hours (2592 days + 17 hours)
  When the command that caused the error occurred, the device was active or idle.

  After command completion occurred, registers were:
  ER -- ST COUNT  LBA_48  LH LM LL DV DC
  -- -- -- == -- == == == -- -- -- -- --
  40 -- 51 00 5b 00 00 00 77 b8 4c e1 00  Error: UNC 91 sectors at LBA = 0x0177b84c = 24623180

  Commands leading to the command that caused the error were:
  CR FEATR COUNT  LBA_48  LH LM LL DV DC  Powered_Up_Time  Command/Feature_Name
  -- == -- == -- == == == -- -- -- -- --  ---------------  --------------------
  c8 00 00 00 5b 00 00 01 77 b7 ff e1 02     06:52:12.672  READ DMA
  c8 00 00 00 20 00 00 01 06 2b 7f e1 02     06:52:12.659  READ DMA
  c8 00 00 00 08 00 00 0a fd f3 57 ea 02     06:52:12.659  READ DMA
  c8 00 00 00 08 00 00 0a fd f9 f3 ea 02     06:52:12.652  READ DMA
  c8 00 00 00 18 00 00 0a fd f3 3f ea 02     06:52:12.644  READ DMA

Error 20 [19] occurred at disk power-on lifetime: 62221 hours (2592 days + 13 hours)
  When the command that caused the error occurred, the device was active or idle.

  After command completion occurred, registers were:
  ER -- ST COUNT  LBA_48  LH LM LL DV DC
  -- -- -- == -- == == == -- -- -- -- --
  40 -- 51 00 20 00 00 00 77 b8 4c e1 00  Error: UNC 32 sectors at LBA = 0x0177b84c = 24623180

  Commands leading to the command that caused the error were:
  CR FEATR COUNT  LBA_48  LH LM LL DV DC  Powered_Up_Time  Command/Feature_Name
  -- == -- == -- == == == -- -- -- -- --  ---------------  --------------------
  c8 00 00 00 20 00 00 01 77 b8 3f e1 02     02:26:43.978  READ DMA
  c8 00 00 00 20 00 00 01 77 b8 3f e1 02     02:26:42.188  READ DMA
  c8 00 00 00 20 00 00 01 77 b8 3f e1 02     02:26:40.398  READ DMA
  c8 00 00 00 20 00 00 01 77 b8 3f e1 02     02:26:38.609  READ DMA
  c8 00 00 00 20 00 00 01 77 b8 3f e1 02     02:26:36.816  READ DMA

Error 19 [18] occurred at disk power-on lifetime: 62221 hours (2592 days + 13 hours)
  When the command that caused the error occurred, the device was active or idle.

  After command completion occurred, registers were:
  ER -- ST COUNT  LBA_48  LH LM LL DV DC
  -- -- -- == -- == == == -- -- -- -- --
  40 -- 51 00 20 00 00 00 77 b8 4c e1 00  Error: UNC 32 sectors at LBA = 0x0177b84c = 24623180

  Commands leading to the command that caused the error were:
  CR FEATR COUNT  LBA_48  LH LM LL DV DC  Powered_Up_Time  Command/Feature_Name
  -- == -- == -- == == == -- -- -- -- --  ---------------  --------------------
  c8 00 00 00 20 00 00 01 77 b8 3f e1 02     02:26:42.188  READ DMA
  c8 00 00 00 20 00 00 01 77 b8 3f e1 02     02:26:40.398  READ DMA
  c8 00 00 00 20 00 00 01 77 b8 3f e1 02     02:26:38.609  READ DMA
  c8 00 00 00 20 00 00 01 77 b8 3f e1 02     02:26:36.816  READ DMA
  c8 00 00 00 20 00 00 01 06 2b 7f e1 02     02:26:36.802  READ DMA

Error 18 [17] occurred at disk power-on lifetime: 62221 hours (2592 days + 13 hours)
  When the command that caused the error occurred, the device was active or idle.

  After command completion occurred, registers were:
  ER -- ST COUNT  LBA_48  LH LM LL DV DC
  -- -- -- == -- == == == -- -- -- -- --
  40 -- 51 00 20 00 00 00 77 b8 4c e1 00  Error: UNC 32 sectors at LBA = 0x0177b84c = 24623180

  Commands leading to the command that caused the error were:
  CR FEATR COUNT  LBA_48  LH LM LL DV DC  Powered_Up_Time  Command/Feature_Name
  -- == -- == -- == == == -- -- -- -- --  ---------------  --------------------
  c8 00 00 00 20 00 00 01 77 b8 3f e1 02     02:26:40.398  READ DMA
  c8 00 00 00 20 00 00 01 77 b8 3f e1 02     02:26:38.609  READ DMA
  c8 00 00 00 20 00 00 01 77 b8 3f e1 02     02:26:36.816  READ DMA
  c8 00 00 00 20 00 00 01 06 2b 7f e1 02     02:26:36.802  READ DMA
  ca 00 00 00 01 00 00 03 80 35 af e3 02     02:26:34.048  WRITE DMA

SMART Extended Self-test Log Version: 1 (1 sectors)
No self-tests have been logged.  [To run self-tests, use: smartctl -t]

SMART Selective self-test log data structure revision number 1
 SPAN  MIN_LBA  MAX_LBA  CURRENT_TEST_STATUS
    1        0        0  Not_testing
    2        0        0  Not_testing
    3        0        0  Not_testing
    4        0        0  Not_testing
    5        0        0  Not_testing
Selective self-test flags (0x0):
  After scanning selected spans, do NOT read-scan remainder of disk.
If Selective self-test is pending on power-up, resume after 0 minute delay.

SCT Status Version:                  2
SCT Version (vendor specific):       258 (0x0102)
Device State:                        Active (0)
Current Temperature:                    44 Celsius
Power Cycle Min/Max Temperature:     28/48 Celsius
Lifetime    Min/Max Temperature:     44/61 Celsius
Under/Over Temperature Limit Count:   0/0

SCT Temperature History Version:     2
Temperature Sampling Period:         1 minute
Temperature Logging Interval:        1 minute
Min/Max recommended Temperature:      0/60 Celsius
Min/Max Temperature Limit:           -41/85 Celsius
Temperature History Size (Index):    478 (273)

SCT Error Recovery Control command not supported

Device Statistics (GP/SMART Log 0x04) not supported

Pending Defects log (GP Log 0x0c) not supported

SATA Phy Event Counters (GP Log 0x11)
ID      Size     Value  Description
0x0001  2            0  Command failed due to ICRC error
0x0002  2            0  R_ERR response for data FIS
0x0003  2            0  R_ERR response for device-to-host data FIS
0x0004  2            0  R_ERR response for host-to-device data FIS
0x0005  2            0  R_ERR response for non-data FIS
0x0006  2            0  R_ERR response for device-to-host non-data FIS
0x0007  2            0  R_ERR response for host-to-device non-data FIS
0x000a  2            7  Device-to-host register FISes sent due to a COMRESET
0x000b  2            0  CRC errors within host-to-device FIS
0x8000  4       613126  Vendor specific



