smartctl 7.1 2019-12-30 r5022 [x86_64-unknown-openbsd6.8] (local build)
Copyright (C) 2002-19, Bruce Allen, Christian Franke, www.smartmontools.org

=== START OF INFORMATION SECTION ===
Model Family:     SanDisk based SSDs
Device Model:     SanDisk SSD U110 16GB
Serial Number:    --
LU WWN Device Id: 5 001b44 ...
Firmware Version: U21B001
User Capacity:    16,013,942,784 bytes [16.0 GB]
Sector Size:      512 bytes logical/physical
Rotation Rate:    Solid State Device
Form Factor:      1.8 inches
Device is:        In smartctl database [for details use: -P show]
ATA Version is:   ACS-2 T13/2015-D revision 3
SATA Version is:  SATA 3.0, 6.0 Gb/s (current: 6.0 Gb/s)
Local Time is:    Tue Oct 20 06:13:04 2020 MSK
SMART support is: Available - device has SMART capability.
SMART support is: Enabled

=== START OF READ SMART DATA SECTION ===
SMART Status not supported: Incomplete response, ATA output registers missing
SMART overall-health self-assessment test result: PASSED
Warning: This result is based on an Attribute check.

General SMART Values:
Offline data collection status:  (0x00)	Offline data collection activity
					was never started.
					Auto Offline Data Collection: Disabled.
Self-test execution status:      (   0)	The previous self-test routine completed
					without error or no self-test has ever 
					been run.
Total time to complete Offline 
data collection: 		(  120) seconds.
Offline data collection
capabilities: 			 (0x51) SMART execute Offline immediate.
					No Auto Offline data collection support.
					Suspend Offline collection upon new
					command.
					No Offline surface scan supported.
					Self-test supported.
					No Conveyance Self-test supported.
					Selective Self-test supported.
SMART capabilities:            (0x0003)	Saves SMART data before entering
					power-saving mode.
					Supports SMART auto save timer.
Error logging capability:        (0x01)	Error logging supported.
					General Purpose Logging supported.
Short self-test routine 
recommended polling time: 	 (   2) minutes.
Extended self-test routine
recommended polling time: 	 (   3) minutes.

SMART Attributes Data Structure revision number: 1
Vendor Specific SMART Attributes with Thresholds:
ID# ATTRIBUTE_NAME          FLAG     VALUE WORST THRESH TYPE      UPDATED  WHEN_FAILED RAW_VALUE
  5 Reallocated_Sector_Ct   0x0002   100   100   000    Old_age   Always       -       0
  9 Power_On_Hours          0x0002   100   100   000    Old_age   Always       -       16933
 12 Power_Cycle_Count       0x0002   100   100   000    Old_age   Always       -       6609
171 Program_Fail_Count      0x0002   100   100   000    Old_age   Always       -       0
172 Erase_Fail_Count        0x0002   100   100   000    Old_age   Always       -       0
173 Avg_Write/Erase_Count   0x0002   100   100   000    Old_age   Always       -       1999
174 Unexpect_Power_Loss_Ct  0x0002   100   100   000    Old_age   Always       -       258
187 Reported_Uncorrect      0x0002   100   100   000    Old_age   Always       -       0
230 Perc_Write/Erase_Count  0x0002   100   100   000    Old_age   Always       -       6663
232 Perc_Avail_Resrvd_Space 0x0003   100   100   005    Pre-fail  Always       -       0
234 Perc_Write/Erase_Ct_BC  0x0002   100   100   000    Old_age   Always       -       5029
241 Total_LBAs_Written      0x0002   100   100   000    Old_age   Always       -       9759497398
242 Total_LBAs_Read         0x0002   100   100   000    Old_age   Always       -       2988911792

SMART Error Log Version: 1
No Errors Logged

SMART Self-test log structure revision number 1
Num  Test_Description    Status                  Remaining  LifeTime(hours)  LBA_of_first_error
# 1  Short offline       Completed without error       00%     14707         -
# 2  Short offline       Completed without error       00%     13547         -
# 3  Short offline       Completed without error       00%     12933         -
# 4  Short offline       Completed without error       00%     12305         -
# 5  Short offline       Completed without error       00%     10164         -
# 6  Short offline       Completed without error       00%      9871         -
# 7  Short offline       Completed without error       00%      6532         -
# 8  Short offline       Completed without error       00%       730         -
# 9  Short offline       Completed without error       00%         3         -

SMART Selective self-test log data structure revision number 65535
Note: revision number not 1 implies that no selective self-test has ever been run
 SPAN               MIN_LBA               MAX_LBA  CURRENT_TEST_STATUS
    1  18446744073709551615  18446744073709551615  Not_testing
    2  18446744073709551615  18446744073709551615  Not_testing
    3  18446744073709551615  18446744073709551615  Not_testing
    4  18446744073709551615  18446744073709551615  Not_testing
    5  18446744073709551615  18446744073709551615  Not_testing
65535  18446744073709551615                 65534  Read_scanning was never started
Selective self-test flags (0xffff):
  Currently read-scanning the remainder of the disk.
If Selective self-test is pending on power-up, resume after 65535 minute delay.



