smartctl 7.3 2022-02-28 r5338 [FreeBSD 13.1-RELEASE-p3 amd64] (local build)
Copyright (C) 2002-22, Bruce Allen, Christian Franke, www.smartmontools.org

=== START OF INFORMATION SECTION ===
Device Model:     Corsair Neutron GTX SSD
Serial Number:    --
Firmware Version: M312
User Capacity:    240,057,409,536 bytes [240 GB]
Sector Size:      512 bytes logical/physical
Rotation Rate:    Solid State Device
TRIM Command:     Available
Device is:        Not in smartctl database 7.3/5319
ATA Version is:   ATA8-ACS (minor revision not indicated)
SATA Version is:  SATA 2.5, 6.0 Gb/s
Local Time is:    Thu Dec  1 11:37:09 2022 CST
SMART support is: Available - device has SMART capability.
SMART support is: Enabled
AAM feature is:   Unavailable
APM feature is:   Unavailable
Rd look-ahead is: Enabled
Write cache is:   Enabled
DSN feature is:   Unavailable
ATA Security is:  Disabled, frozen [SEC2]
Wt Cache Reorder: Unavailable

=== START OF READ SMART DATA SECTION ===
SMART overall-health self-assessment test result: PASSED

General SMART Values:
Offline data collection status:  (0x00)	Offline data collection activity
					was never started.
					Auto Offline Data Collection: Disabled.
Self-test execution status:      (   0)	The previous self-test routine completed
					without error or no self-test has ever 
					been run.
Total time to complete Offline 
data collection: 		(    0) seconds.
Offline data collection
capabilities: 			 (0x19) SMART execute Offline immediate.
					No Auto Offline data collection support.
					Suspend Offline collection upon new
					command.
					Offline surface scan supported.
					Self-test supported.
					No Conveyance Self-test supported.
					No Selective Self-test supported.
SMART capabilities:            (0x0002)	Does not save SMART data before
					entering power-saving mode.
					Supports SMART auto save timer.
Error logging capability:        (0x01)	Error logging supported.
					No General Purpose Logging support.
Short self-test routine 
recommended polling time: 	 (   1) minutes.
Extended self-test routine
recommended polling time: 	 (   5) minutes.

SMART Attributes Data Structure revision number: 0
Vendor Specific SMART Attributes with Thresholds:
ID# ATTRIBUTE_NAME          FLAGS    VALUE WORST THRESH FAIL RAW_VALUE
  1 Raw_Read_Error_Rate     -OSR--   166   166   006    -    0
  5 Reallocated_Sector_Ct   -O--CK   098   098   036    -    294
  9 Power_On_Hours          -O--CK   090   090   000    -    8994
 12 Power_Cycle_Count       -O--CK   100   100   000    -    1694
171 Unknown_Attribute       -O--CK   253   253   000    -    0
172 Unknown_Attribute       -O--CK   100   100   000    -    302
181 Program_Fail_Cnt_Total  -O--CK   253   253   000    -    0
182 Erase_Fail_Count_Total  -O--CK   100   100   000    -    302
194 Temperature_Celsius     -O----   029   000   000    -    29 (Min/Max 15/52)
201 Unknown_SSD_Attribute   -OSR--   100   100   000    -    0
204 Soft_ECC_Correction     -OSR--   100   100   000    -    0
231 Unknown_SSD_Attribute   PO--CK   096   096   010    -    5
234 Unknown_Attribute       -O--CK   100   100   000    -    54943
241 Total_LBAs_Written      -O--CK   100   100   000    -    7537
242 Total_LBAs_Read         -O--CK   100   100   000    -    6147
250 Read_Error_Retry_Rate   -O--CK   100   100   000    -    10626
                            ||||||_ K auto-keep
                            |||||__ C event count
                            ||||___ R error rate
                            |||____ S speed/performance
                            ||_____ O updated online
                            |______ P prefailure warning

General Purpose Log Directory not supported

SMART Log Directory Version 1 [multi-sector log support]
Address    Access  R/W   Size  Description
0x00           SL  R/O      1  Log Directory
0x01           SL  R/O      1  Summary SMART error log
0x02           SL  R/O      4  Comprehensive SMART error log
0x03           SL  R/O      5  Ext. Comprehensive SMART error log
0x04           SL  R/O      8  Device Statistics log
0x06           SL  R/O      1  SMART self-test log

SMART Extended Comprehensive Error Log (GP Log 0x03) not supported

SMART Error Log Version: 1
ATA Error Count: 11991 (device log contains only the most recent five errors)
	CR = Command Register [HEX]
	FR = Features Register [HEX]
	SC = Sector Count Register [HEX]
	SN = Sector Number Register [HEX]
	CL = Cylinder Low Register [HEX]
	CH = Cylinder High Register [HEX]
	DH = Device/Head Register [HEX]
	DC = Device Command Register [HEX]
	ER = Error register [HEX]
	ST = Status register [HEX]
Powered_Up_Time is measured from power on, and printed as
DDd+hh:mm:SS.sss where DD=days, hh=hours, mm=minutes,
SS=sec, and sss=millisec. It "wraps" after 49.710 days.

Error 11991 occurred at disk power-on lifetime: 8974 hours (373 days + 22 hours)
  When the command that caused the error occurred, the device was in an unknown state.

  After command completion occurred, registers were:
  ER ST SC SN CL CH DH
  -- -- -- -- -- -- --
  01 50 01 01 00 00 00

  Commands leading to the command that caused the error were:
  CR FR SC SN CL CH DH DC   Powered_Up_Time  Command/Feature_Name
  -- -- -- -- -- -- -- --  ----------------  --------------------
  00 00 00 00 00 00 00 00      17:14:38.360  NOP [Abort queued commands]
  00 00 00 00 00 00 00 00      17:14:38.360  NOP [Abort queued commands]
  25 00 01 a0 b7 0e 40 40      17:14:31.680  READ DMA EXT
  25 00 10 88 84 8c 40 40      17:14:31.650  READ DMA EXT
  25 00 38 90 43 4b 40 40      17:14:31.630  READ DMA EXT

Error 11990 occurred at disk power-on lifetime: 8974 hours (373 days + 22 hours)
  When the command that caused the error occurred, the device was in an unknown state.

  After command completion occurred, registers were:
  ER ST SC SN CL CH DH
  -- -- -- -- -- -- --
  00 00 00 00 00 00 00   at LBA = 0x00000000 = 0

  Commands leading to the command that caused the error were:
  CR FR SC SN CL CH DH DC   Powered_Up_Time  Command/Feature_Name
  -- -- -- -- -- -- -- --  ----------------  --------------------
  25 00 01 a0 b7 0e 40 40      17:14:31.680  READ DMA EXT
  25 00 10 88 84 8c 40 40      17:14:31.650  READ DMA EXT
  25 00 38 90 43 4b 40 40      17:14:31.630  READ DMA EXT
  25 00 08 f0 f1 e3 40 40      17:14:31.630  READ DMA EXT
  25 00 28 b8 36 8e 40 40      17:14:31.620  READ DMA EXT

Error 11989 occurred at disk power-on lifetime: 8974 hours (373 days + 22 hours)
  When the command that caused the error occurred, the device was in an unknown state.

  After command completion occurred, registers were:
  ER ST SC SN CL CH DH
  -- -- -- -- -- -- --
  00 00 00 00 00 00 00   at LBA = 0x00000000 = 0

  Commands leading to the command that caused the error were:
  CR FR SC SN CL CH DH DC   Powered_Up_Time  Command/Feature_Name
  -- -- -- -- -- -- -- --  ----------------  --------------------
  25 00 01 a0 b7 0e 40 40      17:14:31.680  READ DMA EXT
  25 00 10 88 84 8c 40 40      17:14:31.650  READ DMA EXT
  25 00 38 90 43 4b 40 40      17:14:31.630  READ DMA EXT
  25 00 08 f0 f1 e3 40 40      17:14:31.630  READ DMA EXT
  25 00 28 b8 36 8e 40 40      17:14:31.620  READ DMA EXT

Error 11988 occurred at disk power-on lifetime: 8974 hours (373 days + 22 hours)
  When the command that caused the error occurred, the device was in an unknown state.

  After command completion occurred, registers were:
  ER ST SC SN CL CH DH
  -- -- -- -- -- -- --
  00 00 00 00 00 00 00

  Commands leading to the command that caused the error were:
  CR FR SC SN CL CH DH DC   Powered_Up_Time  Command/Feature_Name
  -- -- -- -- -- -- -- --  ----------------  --------------------
  e1 00 00 00 00 00 40 40      17:14:10.470  IDLE IMMEDIATE
  e5 00 00 00 00 00 40 40      17:14:10.470  CHECK POWER MODE
  ea 00 00 00 00 00 40 40      17:14:09.620  FLUSH CACHE EXT
  61 08 70 29 00 00 40 40      17:14:09.510  WRITE FPDMA QUEUED
  ea 00 00 00 00 00 40 40      17:14:09.500  FLUSH CACHE EXT

Error 11987 occurred at disk power-on lifetime: 8974 hours (373 days + 22 hours)
  When the command that caused the error occurred, the device was in an unknown state.

  After command completion occurred, registers were:
  ER ST SC SN CL CH DH
  -- -- -- -- -- -- --
  01 50 01 01 00 00 00

  Commands leading to the command that caused the error were:
  CR FR SC SN CL CH DH DC   Powered_Up_Time  Command/Feature_Name
  -- -- -- -- -- -- -- --  ----------------  --------------------
  00 00 00 00 00 00 00 00      17:03:11.980  NOP [Abort queued commands]
  00 00 00 00 00 00 00 00      17:03:11.980  NOP [Abort queued commands]
  25 00 01 a0 b7 0e 40 40      17:03:05.330  READ DMA EXT
  25 00 38 98 7d 4b 40 40      17:03:05.290  READ DMA EXT
  25 00 28 b8 36 8e 40 40      17:03:05.280  READ DMA EXT

SMART Extended Self-test Log (GP Log 0x07) not supported

SMART Self-test log structure revision number 1
No self-tests have been logged.  [To run self-tests, use: smartctl -t]

Selective Self-tests/Logging not supported

SCT Commands not supported

Device Statistics (SMART Log 0x04)
Page  Offset Size        Value Flags Description
ATA_SMART_READ_LOG failed: Input/output error
Read Device Statistics pages 0x00-0x80 failed

Pending Defects log (GP Log 0x0c) not supported

SATA Phy Event Counters (GP Log 0x11)
ID      Size     Value  Description
0x0001  2            0  Command failed due to ICRC error
0x0002  2            0  R_ERR response for data FIS
0x0003  2            0  R_ERR response for device-to-host data FIS
0x0004  2            0  R_ERR response for host-to-device data FIS
0x0005  2            0  R_ERR response for non-data FIS
0x0006  2            0  R_ERR response for device-to-host non-data FIS
0x0007  2            0  R_ERR response for host-to-device non-data FIS
0x0008  2            0  Device-to-host non-data FIS retries
0x0009  2            0  Transition from drive PhyRdy to drive PhyNRdy
0x000a  2           15  Device-to-host register FISes sent due to a COMRESET
0x000b  2            0  CRC errors within host-to-device FIS
0x000d  2            0  Non-CRC errors within host-to-device FIS
0x000f  2            0  R_ERR response for host-to-device data FIS, CRC
0x0010  2            0  R_ERR response for host-to-device data FIS, non-CRC
0x0012  2            0  R_ERR response for host-to-device non-data FIS, CRC
0x0013  2            0  R_ERR response for host-to-device non-data FIS, non-CRC

