smartctl 7.2 2020-12-30 r5155 [FreeBSD 12.2-RELEASE-p2 amd64] (local build)
Copyright (C) 2002-20, Bruce Allen, Christian Franke, www.smartmontools.org

=== START OF INFORMATION SECTION ===
Model Family:     Seagate Momentus 5400.6
Device Model:     ST9320325AS
Serial Number:    --
LU WWN Device Id: 5 000c50 ...
Firmware Version: 0003BSM1
User Capacity:    320,068,705,792 bytes [320 GB]
Sector Size:      512 bytes logical/physical
Rotation Rate:    5400 rpm
Device is:        In smartctl database [for details use: -P show]
ATA Version is:   ATA8-ACS T13/1699-D revision 4
SATA Version is:  SATA 2.6, 1.5 Gb/s
Local Time is:    Thu May 20 10:03:14 2021 EEST
SMART support is: Available - device has SMART capability.
SMART support is: Enabled
AAM feature is:   Unavailable
APM feature is:   Disabled
Rd look-ahead is: Enabled
Write cache is:   Enabled
DSN feature is:   Unavailable
ATA Security is:  Disabled, NOT FROZEN [SEC1]
Wt Cache Reorder: Unknown

=== START OF READ SMART DATA SECTION ===
SMART overall-health self-assessment test result: PASSED

General SMART Values:
Offline data collection status:  (0x82)	Offline data collection activity
					was completed without error.
					Auto Offline Data Collection: Enabled.
Self-test execution status:      ( 120)	The previous self-test completed having
					the read element of the test failed.
Total time to complete Offline 
data collection: 		(    0) seconds.
Offline data collection
capabilities: 			 (0x7b) SMART execute Offline immediate.
					Auto Offline data collection on/off support.
					Suspend Offline collection upon new
					command.
					Offline surface scan supported.
					Self-test supported.
					Conveyance Self-test supported.
					Selective Self-test supported.
SMART capabilities:            (0x0003)	Saves SMART data before entering
					power-saving mode.
					Supports SMART auto save timer.
Error logging capability:        (0x01)	Error logging supported.
					General Purpose Logging supported.
Short self-test routine 
recommended polling time: 	 (   1) minutes.
Extended self-test routine
recommended polling time: 	 (  95) minutes.
Conveyance self-test routine
recommended polling time: 	 (   2) minutes.
SCT capabilities: 	       (0x103b)	SCT Status supported.
					SCT Error Recovery Control supported.
					SCT Feature Control supported.
					SCT Data Table supported.

SMART Attributes Data Structure revision number: 10
Vendor Specific SMART Attributes with Thresholds:
ID# ATTRIBUTE_NAME          FLAGS    VALUE WORST THRESH FAIL RAW_VALUE
  1 Raw_Read_Error_Rate     POSR--   099   095   006    -    73279397
  3 Spin_Up_Time            PO----   097   097   000    -    0
  4 Start_Stop_Count        -O--CK   066   066   020    -    34852
  5 Reallocated_Sector_Ct   PO--CK   098   098   036    -    52
  7 Seek_Error_Rate         POSR--   090   060   030    -    1079228078
  9 Power_On_Hours          -O--CK   040   040   000    -    52762
 10 Spin_Retry_Count        PO--C-   100   100   097    -    0
 12 Power_Cycle_Count       -O--CK   098   037   020    -    2682
184 End-to-End_Error        -O--CK   100   100   099    -    0
187 Reported_Uncorrect      -O--CK   001   001   000    -    280
188 Command_Timeout         -O--CK   100   097   000    -    8590065703
189 High_Fly_Writes         -O-RCK   100   100   000    -    0
190 Airflow_Temperature_Cel -O---K   066   049   045    -    34 (Min/Max 26/38)
191 G-Sense_Error_Rate      -O--CK   100   100   000    -    383
192 Power-Off_Retract_Count -O--CK   100   100   000    -    20
193 Load_Cycle_Count        -O--CK   001   001   000    -    1188614
194 Temperature_Celsius     -O---K   034   051   000    -    34 (0 9 0 0 0)
195 Hardware_ECC_Recovered  -O-RC-   051   048   000    -    73279397
197 Current_Pending_Sector  -O--C-   100   100   000    -    1
198 Offline_Uncorrectable   ----C-   100   100   000    -    1
199 UDMA_CRC_Error_Count    -OSRCK   200   200   000    -    0
                            ||||||_ K auto-keep
                            |||||__ C event count
                            ||||___ R error rate
                            |||____ S speed/performance
                            ||_____ O updated online
                            |______ P prefailure warning

General Purpose Log Directory Version 1
SMART           Log Directory Version 1 [multi-sector log support]
Address    Access  R/W   Size  Description
0x00       GPL,SL  R/O      1  Log Directory
0x01       GPL,SL  R/O      1  Summary SMART error log
0x02       GPL,SL  R/O      5  Comprehensive SMART error log
0x03       GPL,SL  R/O      5  Ext. Comprehensive SMART error log
0x06       GPL,SL  R/O      1  SMART self-test log
0x07       GPL,SL  R/O      1  Extended self-test log
0x09       GPL,SL  R/W      1  Selective self-test log
0x10       GPL,SL  R/O      1  NCQ Command Error log
0x11       GPL,SL  R/O      1  SATA Phy Event Counters log
0x21       GPL,SL  R/O      1  Write stream error log
0x22       GPL,SL  R/O      1  Read stream error log
0x80-0x9f  GPL,SL  R/W     16  Host vendor specific log
0xa1       GPL,SL  VS      20  Device vendor specific log
0xa2       GPL     VS    2248  Device vendor specific log
0xa8       GPL,SL  VS      65  Device vendor specific log
0xa9       GPL,SL  VS       1  Device vendor specific log
0xb0       GPL     VS    2864  Device vendor specific log
0xbe-0xbf  GPL     VS   65535  Device vendor specific log
0xc0       GPL,SL  VS       1  Device vendor specific log
0xe0       GPL,SL  R/W      1  SCT Command/Status
0xe1       GPL,SL  R/W      1  SCT Data Transfer

SMART Extended Comprehensive Error Log Version: 1 (5 sectors)
Device Error Count: 2
	CR     = Command Register
	FEATR  = Features Register
	COUNT  = Count (was: Sector Count) Register
	LBA_48 = Upper bytes of LBA High/Mid/Low Registers ]  ATA-8
	LH     = LBA High (was: Cylinder High) Register    ]   LBA
	LM     = LBA Mid (was: Cylinder Low) Register      ] Register
	LL     = LBA Low (was: Sector Number) Register     ]
	DV     = Device (was: Device/Head) Register
	DC     = Device Control Register
	ER     = Error register
	ST     = Status register
Powered_Up_Time is measured from power on, and printed as
DDd+hh:mm:SS.sss where DD=days, hh=hours, mm=minutes,
SS=sec, and sss=millisec. It "wraps" after 49.710 days.

Error 2 [1] occurred at disk power-on lifetime: 50851 hours (2118 days + 19 hours)
  When the command that caused the error occurred, the device was active or idle.

  After command completion occurred, registers were:
  ER -- ST COUNT  LBA_48  LH LM LL DV DC
  -- -- -- == -- == == == -- -- -- -- --
  40 -- 51 00 00 00 00 25 28 8f 6b 00 00  Error: UNC at LBA = 0x25288f6b = 623415147

  Commands leading to the command that caused the error were:
  CR FEATR COUNT  LBA_48  LH LM LL DV DC  Powered_Up_Time  Command/Feature_Name
  -- == -- == -- == == == -- -- -- -- --  ---------------  --------------------
  60 00 00 00 18 00 00 25 28 8f 68 40 00     14:07:26.317  READ FPDMA QUEUED
  ea 00 00 00 00 00 00 00 00 00 00 40 00     14:07:26.303  FLUSH CACHE EXT
  61 00 00 00 08 00 00 07 e8 5d f0 40 00     14:07:26.303  WRITE FPDMA QUEUED
  ea 00 00 00 00 00 00 00 00 00 00 40 00     14:07:26.285  FLUSH CACHE EXT
  61 00 00 00 08 00 00 07 e8 5d e8 40 00     14:07:26.285  WRITE FPDMA QUEUED

Error 1 [0] occurred at disk power-on lifetime: 21655 hours (902 days + 7 hours)
  When the command that caused the error occurred, the device was active or idle.

  After command completion occurred, registers were:
  ER -- ST COUNT  LBA_48  LH LM LL DV DC
  -- -- -- == -- == == == -- -- -- -- --
  40 -- 51 00 00 00 00 1e 6c 68 ec 00 00  Error: UNC at LBA = 0x1e6c68ec = 510421228

  Commands leading to the command that caused the error were:
  CR FEATR COUNT  LBA_48  LH LM LL DV DC  Powered_Up_Time  Command/Feature_Name
  -- == -- == -- == == == -- -- -- -- --  ---------------  --------------------
  25 00 00 00 08 00 00 1e 6c 68 e8 40 00 46d+14:48:31.086  READ DMA EXT
  25 00 00 00 08 00 00 18 d6 d9 38 40 00 46d+14:48:31.065  READ DMA EXT
  25 00 00 00 08 00 00 11 c0 4a f8 40 00 46d+14:48:31.056  READ DMA EXT
  25 00 00 00 20 00 00 11 c0 2b 68 40 00 46d+14:48:31.043  READ DMA EXT
  25 00 00 00 30 00 00 10 8a d2 38 40 00 46d+14:48:31.031  READ DMA EXT

SMART Extended Self-test Log Version: 1 (1 sectors)
Num  Test_Description    Status                  Remaining  LifeTime(hours)  LBA_of_first_error
# 1  Short offline       Completed: read failure       80%     52753         625013731
# 2  Short offline       Completed: read failure       80%     52729         625013731
# 3  Short offline       Completed: read failure       80%     52705         625013731
# 4  Short offline       Completed: read failure       80%     52681         625013731
# 5  Short offline       Completed: read failure       80%     52657         625013731
# 6  Short offline       Completed: read failure       80%     52633         625013731
# 7  Short offline       Completed: read failure       80%     52609         625013731
# 8  Short offline       Completed: read failure       80%     52585         625013731
# 9  Short offline       Completed: read failure       80%     52561         625013731
#10  Short offline       Completed: read failure       80%     52537         625013731
#11  Short offline       Completed: read failure       80%     52513         625013731
#12  Short offline       Completed: read failure       80%     52489         625013731
#13  Short offline       Completed: read failure       80%     52465         625013731
#14  Short offline       Completed: read failure       80%     52441         625013731
#15  Short offline       Completed: read failure       80%     52417         625013731
#16  Short offline       Completed: read failure       80%     52393         625013731
#17  Short offline       Completed: read failure       80%     52369         625013731
#18  Short offline       Completed: read failure       80%     52346         625013731
#19  Short offline       Completed: read failure       80%     52322         625013731

SMART Selective self-test log data structure revision number 1
 SPAN  MIN_LBA  MAX_LBA  CURRENT_TEST_STATUS
    1        0        0  Not_testing
    2        0        0  Not_testing
    3        0        0  Not_testing
    4        0        0  Not_testing
    5        0        0  Not_testing
Selective self-test flags (0x0):
  After scanning selected spans, do NOT read-scan remainder of disk.
If Selective self-test is pending on power-up, resume after 0 minute delay.

SCT Status Version:                  3
SCT Version (vendor specific):       522 (0x020a)
Device State:                        Active (0)
Current Temperature:                    34 Celsius
Power Cycle Min/Max Temperature:     26/38 Celsius
Lifetime    Min/Max Temperature:      9/51 Celsius
Under/Over Temperature Limit Count:   0/24592

SCT Temperature History Version:     2
Temperature Sampling Period:         1 minute
Temperature Logging Interval:        1 minute
Min/Max recommended Temperature:      0/ 0 Celsius
Min/Max Temperature Limit:            0/ 0 Celsius
Temperature History Size (Index):    128 (38)

SCT Error Recovery Control:
           Read: Disabled
          Write: Disabled

Device Statistics (GP/SMART Log 0x04) not supported

Pending Defects log (GP Log 0x0c) not supported

SATA Phy Event Counters (GP Log 0x11)
ID      Size     Value  Description
0x000a  2            5  Device-to-host register FISes sent due to a COMRESET
0x0001  2            0  Command failed due to ICRC error
0x0003  2            0  R_ERR response for device-to-host data FIS
0x0004  2            0  R_ERR response for host-to-device data FIS
0x0006  2            0  R_ERR response for device-to-host non-data FIS
0x0007  2            0  R_ERR response for host-to-device non-data FIS



