smartctl 7.4 2023-08-01 r5530 [FreeBSD 14.0-RELEASE amd64] (local build)
Copyright (C) 2002-23, Bruce Allen, Christian Franke, www.smartmontools.org

=== START OF INFORMATION SECTION ===
Model Family:     Seagate Momentus 5400.6
Device Model:     ST9320325AS
Serial Number:    --
LU WWN Device Id: 5 000c50 ...
Firmware Version: 0003SDM1
User Capacity:    320,072,933,376 bytes [320 GB]
Sector Size:      512 bytes logical/physical
Rotation Rate:    5400 rpm
Device is:        In smartctl database 7.3/5528
ATA Version is:   ATA8-ACS T13/1699-D revision 4
SATA Version is:  SATA 2.6, 3.0 Gb/s
Local Time is:    Sat Sep 27 16:10:23 2025    
SMART support is: Available - device has SMART capability.
SMART support is: Enabled
AAM feature is:   Unavailable
APM level is:     128 (minimum power consumption without standby)
Rd look-ahead is: Enabled
Write cache is:   Enabled
DSN feature is:   Unavailable
ATA Security is:  Disabled, frozen [SEC2]
Wt Cache Reorder: Unknown

=== START OF READ SMART DATA SECTION ===
SMART overall-health self-assessment test result: PASSED
See vendor-specific Attribute list for marginal Attributes.

General SMART Values:
Offline data collection status:  (0x00)	Offline data collection activity
					was never started.
					Auto Offline Data Collection: Disabled.
Self-test execution status:      (   0)	The previous self-test routine completed
					without error or no self-test has ever 
					been run.
Total time to complete Offline 
data collection: 		(    0) seconds.
Offline data collection
capabilities: 			 (0x73) SMART execute Offline immediate.
					Auto Offline data collection on/off support.
					Suspend Offline collection upon new
					command.
					No Offline surface scan supported.
					Self-test supported.
					Conveyance Self-test supported.
					Selective Self-test supported.
SMART capabilities:            (0x0003)	Saves SMART data before entering
					power-saving mode.
					Supports SMART auto save timer.
Error logging capability:        (0x01)	Error logging supported.
					General Purpose Logging supported.
Short self-test routine 
recommended polling time: 	 (   1) minutes.
Extended self-test routine
recommended polling time: 	 (  99) minutes.
Conveyance self-test routine
recommended polling time: 	 (   2) minutes.
SCT capabilities: 	       (0x103b)	SCT Status supported.
					SCT Error Recovery Control supported.
					SCT Feature Control supported.
					SCT Data Table supported.

SMART Attributes Data Structure revision number: 10
Vendor Specific SMART Attributes with Thresholds:
ID# ATTRIBUTE_NAME          FLAGS    VALUE WORST THRESH FAIL RAW_VALUE
  1 Raw_Read_Error_Rate     POSR--   119   094   006    -    227165755
  3 Spin_Up_Time            PO----   099   099   000    -    0
  4 Start_Stop_Count        -O--CK   093   093   020    -    7863
  5 Reallocated_Sector_Ct   PO--CK   100   100   036    -    4
  7 Seek_Error_Rate         POSR--   090   060   030    -    5401220356
  9 Power_On_Hours          -O--CK   052   052   000    -    42706
 10 Spin_Retry_Count        PO--C-   100   100   097    -    0
 12 Power_Cycle_Count       -O--CK   093   037   020    -    7495
184 End-to-End_Error        -O--CK   100   100   099    -    0
187 Reported_Uncorrect      -O--CK   001   001   000    -    119
188 Command_Timeout         -O--CK   100   095   000    -    8590066470
189 High_Fly_Writes         -O-RCK   100   100   000    -    0
190 Airflow_Temperature_Cel -O---K   064   045   045    Past 36 (Min/Max 29/37)
191 G-Sense_Error_Rate      -O--CK   100   100   000    -    550
192 Power-Off_Retract_Count -O--CK   100   100   000    -    266
193 Load_Cycle_Count        -O--CK   001   001   000    -    542631
194 Temperature_Celsius     -O---K   036   055   000    -    36 (0 21 0 0 0)
195 Hardware_ECC_Recovered  -O-RC-   059   052   000    -    227165755
197 Current_Pending_Sector  -O--C-   100   100   000    -    0
198 Offline_Uncorrectable   ----C-   100   100   000    -    0
199 UDMA_CRC_Error_Count    -OSRCK   200   200   000    -    0
254 Free_Fall_Sensor        -O--CK   100   100   000    -    0
                            ||||||_ K auto-keep
                            |||||__ C event count
                            ||||___ R error rate
                            |||____ S speed/performance
                            ||_____ O updated online
                            |______ P prefailure warning

General Purpose Log Directory Version 1
SMART           Log Directory Version 1 [multi-sector log support]
Address    Access  R/W   Size  Description
0x00       GPL,SL  R/O      1  Log Directory
0x01       GPL,SL  R/O      1  Summary SMART error log
0x02       GPL,SL  R/O      5  Comprehensive SMART error log
0x03       GPL,SL  R/O      5  Ext. Comprehensive SMART error log
0x06       GPL,SL  R/O      1  SMART self-test log
0x07       GPL,SL  R/O      1  Extended self-test log
0x09       GPL,SL  R/W      1  Selective self-test log
0x10       GPL,SL  R/O      1  NCQ Command Error log
0x11       GPL,SL  R/O      1  SATA Phy Event Counters log
0x21       GPL,SL  R/O      1  Write stream error log
0x22       GPL,SL  R/O      1  Read stream error log
0x80-0x9f  GPL,SL  R/W     16  Host vendor specific log
0xa1       GPL,SL  VS      20  Device vendor specific log
0xa2       GPL     VS    2248  Device vendor specific log
0xa8       GPL,SL  VS      65  Device vendor specific log
0xa9       GPL,SL  VS       1  Device vendor specific log
0xb0       GPL     VS    2864  Device vendor specific log
0xbe-0xbf  GPL     VS   65535  Device vendor specific log
0xe0       GPL,SL  R/W      1  SCT Command/Status
0xe1       GPL,SL  R/W      1  SCT Data Transfer

SMART Extended Comprehensive Error Log Version: 1 (5 sectors)
Device Error Count: 119 (device log contains only the most recent 20 errors)
	CR     = Command Register
	FEATR  = Features Register
	COUNT  = Count (was: Sector Count) Register
	LBA_48 = Upper bytes of LBA High/Mid/Low Registers ]  ATA-8
	LH     = LBA High (was: Cylinder High) Register    ]   LBA
	LM     = LBA Mid (was: Cylinder Low) Register      ] Register
	LL     = LBA Low (was: Sector Number) Register     ]
	DV     = Device (was: Device/Head) Register
	DC     = Device Control Register
	ER     = Error register
	ST     = Status register
Powered_Up_Time is measured from power on, and printed as
DDd+hh:mm:SS.sss where DD=days, hh=hours, mm=minutes,
SS=sec, and sss=millisec. It "wraps" after 49.710 days.

Error 119 [18] occurred at disk power-on lifetime: 32902 hours (1370 days + 22 hours)
  When the command that caused the error occurred, the device was active or idle.

  After command completion occurred, registers were:
  ER -- ST COUNT  LBA_48  LH LM LL DV DC
  -- -- -- == -- == == == -- -- -- -- --
  40 -- 51 00 00 00 00 03 73 2a 0e 00 00  Error: UNC at LBA = 0x03732a0e = 57879054

  Commands leading to the command that caused the error were:
  CR FEATR COUNT  LBA_48  LH LM LL DV DC  Powered_Up_Time  Command/Feature_Name
  -- == -- == -- == == == -- -- -- -- --  ---------------  --------------------
  60 00 00 00 03 00 00 01 ae a0 13 40 00     00:09:22.345  READ FPDMA QUEUED
  60 00 00 00 08 00 00 02 8f 42 a0 40 00     00:09:22.336  READ FPDMA QUEUED
  60 00 00 00 08 00 00 01 ae 9f d0 40 00     00:09:22.330  READ FPDMA QUEUED
  60 00 00 00 40 00 00 00 16 fb 1a 40 00     00:09:22.324  READ FPDMA QUEUED
  60 00 00 00 20 00 00 00 10 11 a9 40 00     00:09:22.306  READ FPDMA QUEUED

Error 118 [17] occurred at disk power-on lifetime: 32902 hours (1370 days + 22 hours)
  When the command that caused the error occurred, the device was active or idle.

  After command completion occurred, registers were:
  ER -- ST COUNT  LBA_48  LH LM LL DV DC
  -- -- -- == -- == == == -- -- -- -- --
  40 -- 51 00 00 00 00 03 73 2a 0e 00 00  Error: UNC at LBA = 0x03732a0e = 57879054

  Commands leading to the command that caused the error were:
  CR FEATR COUNT  LBA_48  LH LM LL DV DC  Powered_Up_Time  Command/Feature_Name
  -- == -- == -- == == == -- -- -- -- --  ---------------  --------------------
  60 00 00 00 08 00 00 00 08 5b 18 40 00     00:09:19.305  READ FPDMA QUEUED
  60 00 00 00 40 00 00 0b dd f0 50 40 00     00:09:19.304  READ FPDMA QUEUED
  60 00 00 00 40 00 00 04 34 6a 48 40 00     00:09:19.304  READ FPDMA QUEUED
  60 00 00 00 40 00 00 04 34 6c 08 40 00     00:09:19.304  READ FPDMA QUEUED
  60 00 00 00 20 00 00 00 10 11 c9 40 00     00:09:19.303  READ FPDMA QUEUED

Error 117 [16] occurred at disk power-on lifetime: 32902 hours (1370 days + 22 hours)
  When the command that caused the error occurred, the device was active or idle.

  After command completion occurred, registers were:
  ER -- ST COUNT  LBA_48  LH LM LL DV DC
  -- -- -- == -- == == == -- -- -- -- --
  40 -- 51 00 00 00 00 03 73 2a 0e 00 00  Error: WP at LBA = 0x03732a0e = 57879054

  Commands leading to the command that caused the error were:
  CR FEATR COUNT  LBA_48  LH LM LL DV DC  Powered_Up_Time  Command/Feature_Name
  -- == -- == -- == == == -- -- -- -- --  ---------------  --------------------
  61 00 00 00 08 00 00 00 5e dd 78 40 00     00:09:16.669  WRITE FPDMA QUEUED
  61 00 00 00 08 00 00 00 5e dd 80 40 00     00:09:16.669  WRITE FPDMA QUEUED
  60 00 00 00 40 00 00 04 34 6a 48 40 00     00:09:16.668  READ FPDMA QUEUED
  60 00 00 00 40 00 00 04 34 6c 08 40 00     00:09:16.668  READ FPDMA QUEUED
  61 00 00 00 10 00 00 00 5e fe 20 40 00     00:09:16.667  WRITE FPDMA QUEUED

Error 116 [15] occurred at disk power-on lifetime: 32902 hours (1370 days + 22 hours)
  When the command that caused the error occurred, the device was active or idle.

  After command completion occurred, registers were:
  ER -- ST COUNT  LBA_48  LH LM LL DV DC
  -- -- -- == -- == == == -- -- -- -- --
  40 -- 51 00 00 00 00 03 73 2a 0e 00 00  Error: UNC at LBA = 0x03732a0e = 57879054

  Commands leading to the command that caused the error were:
  CR FEATR COUNT  LBA_48  LH LM LL DV DC  Powered_Up_Time  Command/Feature_Name
  -- == -- == -- == == == -- -- -- -- --  ---------------  --------------------
  60 00 00 00 20 00 00 00 10 11 c9 40 00     00:09:14.110  READ FPDMA QUEUED
  60 00 00 00 16 00 00 00 06 96 6c 40 00     00:09:14.109  READ FPDMA QUEUED
  60 00 00 00 40 00 00 00 35 19 ea 40 00     00:09:14.109  READ FPDMA QUEUED
  60 00 00 00 40 00 00 03 06 d4 08 40 00     00:09:14.108  READ FPDMA QUEUED
  60 00 00 00 08 00 00 15 8f 05 20 40 00     00:09:14.108  READ FPDMA QUEUED

Error 115 [14] occurred at disk power-on lifetime: 32902 hours (1370 days + 22 hours)
  When the command that caused the error occurred, the device was active or idle.

  After command completion occurred, registers were:
  ER -- ST COUNT  LBA_48  LH LM LL DV DC
  -- -- -- == -- == == == -- -- -- -- --
  40 -- 51 00 00 00 00 03 73 2a 0e 00 00  Error: WP at LBA = 0x03732a0e = 57879054

  Commands leading to the command that caused the error were:
  CR FEATR COUNT  LBA_48  LH LM LL DV DC  Powered_Up_Time  Command/Feature_Name
  -- == -- == -- == == == -- -- -- -- --  ---------------  --------------------
  61 00 00 00 08 00 00 00 5e dd 70 40 00     00:09:11.582  WRITE FPDMA QUEUED
  61 00 00 00 08 00 00 00 5e dd 88 40 00     00:09:11.581  WRITE FPDMA QUEUED
  61 00 00 00 18 00 00 00 5e fd e0 40 00     00:09:11.580  WRITE FPDMA QUEUED
  60 00 00 00 20 00 00 00 10 11 c9 40 00     00:09:11.580  READ FPDMA QUEUED
  60 00 00 00 40 00 00 17 d7 a7 48 40 00     00:09:11.580  READ FPDMA QUEUED

Error 114 [13] occurred at disk power-on lifetime: 32902 hours (1370 days + 22 hours)
  When the command that caused the error occurred, the device was active or idle.

  After command completion occurred, registers were:
  ER -- ST COUNT  LBA_48  LH LM LL DV DC
  -- -- -- == -- == == == -- -- -- -- --
  40 -- 51 00 00 00 00 03 73 2a 0e 00 00  Error: WP at LBA = 0x03732a0e = 57879054

  Commands leading to the command that caused the error were:
  CR FEATR COUNT  LBA_48  LH LM LL DV DC  Powered_Up_Time  Command/Feature_Name
  -- == -- == -- == == == -- -- -- -- --  ---------------  --------------------
  61 00 00 00 08 00 00 00 5e dd 80 40 00     00:09:08.995  WRITE FPDMA QUEUED
  61 00 00 00 10 00 00 00 5e fd d0 40 00     00:09:08.994  WRITE FPDMA QUEUED
  60 00 00 00 40 00 00 17 d7 a7 48 40 00     00:09:08.994  READ FPDMA QUEUED
  60 00 00 00 40 00 00 00 35 1a 2a 40 00     00:09:08.993  READ FPDMA QUEUED
  60 00 00 00 18 00 00 00 06 c2 aa 40 00     00:09:08.993  READ FPDMA QUEUED

Error 113 [12] occurred at disk power-on lifetime: 32902 hours (1370 days + 22 hours)
  When the command that caused the error occurred, the device was active or idle.

  After command completion occurred, registers were:
  ER -- ST COUNT  LBA_48  LH LM LL DV DC
  -- -- -- == -- == == == -- -- -- -- --
  40 -- 51 00 00 00 00 03 73 2a 0e 00 00  Error: WP at LBA = 0x03732a0e = 57879054

  Commands leading to the command that caused the error were:
  CR FEATR COUNT  LBA_48  LH LM LL DV DC  Powered_Up_Time  Command/Feature_Name
  -- == -- == -- == == == -- -- -- -- --  ---------------  --------------------
  61 00 00 00 08 00 00 00 5e dd 78 40 00     00:09:06.411  WRITE FPDMA QUEUED
  61 00 00 00 08 00 00 00 5e dd 88 40 00     00:09:06.410  WRITE FPDMA QUEUED
  61 00 00 00 08 00 00 00 03 51 f0 40 00     00:09:06.410  WRITE FPDMA QUEUED
  61 00 00 00 38 00 00 00 5e fd 98 40 00     00:09:06.409  WRITE FPDMA QUEUED
  61 00 00 00 08 00 00 00 03 51 d8 40 00     00:09:06.409  WRITE FPDMA QUEUED

Error 112 [11] occurred at disk power-on lifetime: 32902 hours (1370 days + 22 hours)
  When the command that caused the error occurred, the device was active or idle.

  After command completion occurred, registers were:
  ER -- ST COUNT  LBA_48  LH LM LL DV DC
  -- -- -- == -- == == == -- -- -- -- --
  40 -- 51 00 00 00 00 03 73 2a 0e 00 00  Error: UNC at LBA = 0x03732a0e = 57879054

  Commands leading to the command that caused the error were:
  CR FEATR COUNT  LBA_48  LH LM LL DV DC  Powered_Up_Time  Command/Feature_Name
  -- == -- == -- == == == -- -- -- -- --  ---------------  --------------------
  60 00 00 00 40 00 00 0b dd f0 50 40 00     00:09:03.843  READ FPDMA QUEUED
  61 00 00 00 08 00 00 00 08 e6 08 40 00     00:09:03.843  WRITE FPDMA QUEUED
  61 00 00 00 08 00 00 00 03 28 c8 40 00     00:09:03.843  WRITE FPDMA QUEUED
  61 00 00 00 08 00 00 00 03 42 80 40 00     00:09:03.843  WRITE FPDMA QUEUED
  61 00 00 00 08 00 00 00 03 d4 40 40 00     00:09:03.842  WRITE FPDMA QUEUED

SMART Extended Self-test Log Version: 1 (1 sectors)
No self-tests have been logged.  [To run self-tests, use: smartctl -t]

SMART Selective self-test log data structure revision number 1
 SPAN  MIN_LBA  MAX_LBA  CURRENT_TEST_STATUS
    1        0        0  Not_testing
    2        0        0  Not_testing
    3        0        0  Not_testing
    4        0        0  Not_testing
    5        0        0  Not_testing
Selective self-test flags (0x0):
  After scanning selected spans, do NOT read-scan remainder of disk.
If Selective self-test is pending on power-up, resume after 0 minute delay.

SCT Status Version:                  3
SCT Version (vendor specific):       522 (0x020a)
Device State:                        Active (0)
Current Temperature:                    36 Celsius
Power Cycle Min/Max Temperature:     29/37 Celsius
Lifetime    Min/Max Temperature:     21/55 Celsius
Under/Over Temperature Limit Count:   0/162

SCT Temperature History Version:     2
Temperature Sampling Period:         1 minute
Temperature Logging Interval:        1 minute
Min/Max recommended Temperature:      0/ 0 Celsius
Min/Max Temperature Limit:            0/ 0 Celsius
Temperature History Size (Index):    128 (80)

SCT Error Recovery Control:
           Read: Disabled
          Write: Disabled

Device Statistics (GP/SMART Log 0x04) not supported

Pending Defects log (GP Log 0x0c) not supported

SATA Phy Event Counters (GP Log 0x11)
ID      Size     Value  Description
0x000a  2           11  Device-to-host register FISes sent due to a COMRESET
0x0001  2            0  Command failed due to ICRC error
0x0003  2            0  R_ERR response for device-to-host data FIS
0x0004  2            0  R_ERR response for host-to-device data FIS
0x0006  2            0  R_ERR response for device-to-host non-data FIS
0x0007  2            0  R_ERR response for host-to-device non-data FIS



