smartctl 7.4 2023-08-01 r5530 [FreeBSD 14.0-RELEASE amd64] (local build)
Copyright (C) 2002-23, Bruce Allen, Christian Franke, www.smartmontools.org

=== START OF INFORMATION SECTION ===
Model Family:     Seagate Momentus 5400.6
Device Model:     ST9320325AS
Serial Number:    --
LU WWN Device Id: 5 000c50 ...
Firmware Version: 0011LVM1
User Capacity:    320,072,933,376 bytes [320 GB]
Sector Size:      512 bytes logical/physical
Rotation Rate:    5400 rpm
Device is:        In smartctl database 7.3/5528
ATA Version is:   ATA8-ACS T13/1699-D revision 4
SATA Version is:  SATA 2.6, 3.0 Gb/s (current: 3.0 Gb/s)
Local Time is:    Sat Oct 12 12:52:36 2024 CST
SMART support is: Available - device has SMART capability.
SMART support is: Enabled
AAM feature is:   Unavailable
APM level is:     128 (minimum power consumption without standby)
Rd look-ahead is: Enabled
Write cache is:   Enabled
DSN feature is:   Unavailable
ATA Security is:  Disabled, frozen [SEC2]
Wt Cache Reorder: Unknown

=== START OF READ SMART DATA SECTION ===
SMART overall-health self-assessment test result: PASSED
See vendor-specific Attribute list for marginal Attributes.

General SMART Values:
Offline data collection status:  (0x00)	Offline data collection activity
					was never started.
					Auto Offline Data Collection: Disabled.
Self-test execution status:      (   0)	The previous self-test routine completed
					without error or no self-test has ever 
					been run.
Total time to complete Offline 
data collection: 		(    0) seconds.
Offline data collection
capabilities: 			 (0x73) SMART execute Offline immediate.
					Auto Offline data collection on/off support.
					Suspend Offline collection upon new
					command.
					No Offline surface scan supported.
					Self-test supported.
					Conveyance Self-test supported.
					Selective Self-test supported.
SMART capabilities:            (0x0003)	Saves SMART data before entering
					power-saving mode.
					Supports SMART auto save timer.
Error logging capability:        (0x01)	Error logging supported.
					General Purpose Logging supported.
Short self-test routine 
recommended polling time: 	 (   1) minutes.
Extended self-test routine
recommended polling time: 	 (  95) minutes.
Conveyance self-test routine
recommended polling time: 	 (   2) minutes.
SCT capabilities: 	       (0x103b)	SCT Status supported.
					SCT Error Recovery Control supported.
					SCT Feature Control supported.
					SCT Data Table supported.

SMART Attributes Data Structure revision number: 10
Vendor Specific SMART Attributes with Thresholds:
ID# ATTRIBUTE_NAME          FLAGS    VALUE WORST THRESH FAIL RAW_VALUE
  1 Raw_Read_Error_Rate     POSR--   112   080   006    -    45966926
  3 Spin_Up_Time            PO----   099   098   000    -    0
  4 Start_Stop_Count        -O--CK   093   093   020    -    7937
  5 Reallocated_Sector_Ct   PO--CK   097   097   036    -    78
  7 Seek_Error_Rate         POSR--   084   060   030    -    247495096
  9 Power_On_Hours          -O--CK   073   073   000    -    23821 (227 182 0)
 10 Spin_Retry_Count        PO--C-   100   100   097    -    0
 12 Power_Cycle_Count       -O--CK   096   037   020    -    4599
184 End-to-End_Error        -O--CK   100   100   099    -    0
187 Reported_Uncorrect      -O--CK   001   001   000    -    4003
188 Command_Timeout         -O--CK   100   075   000    -    4295033783
189 High_Fly_Writes         -O-RCK   100   100   000    -    0
190 Airflow_Temperature_Cel -O---K   072   039   045    Past 28 (1 1 28 24 0)
191 G-Sense_Error_Rate      -O--CK   100   100   000    -    334
192 Power-Off_Retract_Count -O--CK   100   100   000    -    98
193 Load_Cycle_Count        -O--CK   001   001   000    -    320328
194 Temperature_Celsius     -O---K   028   061   000    -    28 (0 6 0 0 0)
195 Hardware_ECC_Recovered  -O-RC-   057   051   000    -    45966926
197 Current_Pending_Sector  -O--C-   077   077   000    -    108336255095108
198 Offline_Uncorrectable   ----C-   100   100   000    -    0
199 UDMA_CRC_Error_Count    -OSRCK   100   100   000    -    0
                            ||||||_ K auto-keep
                            |||||__ C event count
                            ||||___ R error rate
                            |||____ S speed/performance
                            ||_____ O updated online
                            |______ P prefailure warning

General Purpose Log Directory Version 1
SMART           Log Directory Version 1 [multi-sector log support]
Address    Access  R/W   Size  Description
0x00       GPL,SL  R/O      1  Log Directory
0x01       GPL,SL  R/O      1  Summary SMART error log
0x02       GPL,SL  R/O      5  Comprehensive SMART error log
0x03       GPL,SL  R/O      5  Ext. Comprehensive SMART error log
0x06       GPL,SL  R/O      1  SMART self-test log
0x07       GPL,SL  R/O      1  Extended self-test log
0x09       GPL,SL  R/W      1  Selective self-test log
0x10       GPL,SL  R/O      1  NCQ Command Error log
0x11       GPL,SL  R/O      1  SATA Phy Event Counters log
0x21       GPL,SL  R/O      1  Write stream error log
0x22       GPL,SL  R/O      1  Read stream error log
0x80-0x9f  GPL,SL  R/W     16  Host vendor specific log
0xa1       GPL,SL  VS      20  Device vendor specific log
0xa2       GPL     VS    2248  Device vendor specific log
0xa8       GPL,SL  VS      65  Device vendor specific log
0xa9       GPL,SL  VS       1  Device vendor specific log
0xb0       GPL     VS    2864  Device vendor specific log
0xbe-0xbf  GPL     VS   65535  Device vendor specific log
0xe0       GPL,SL  R/W      1  SCT Command/Status
0xe1       GPL,SL  R/W      1  SCT Data Transfer

SMART Extended Comprehensive Error Log Version: 1 (5 sectors)
Device Error Count: 4003 (device log contains only the most recent 20 errors)
	CR     = Command Register
	FEATR  = Features Register
	COUNT  = Count (was: Sector Count) Register
	LBA_48 = Upper bytes of LBA High/Mid/Low Registers ]  ATA-8
	LH     = LBA High (was: Cylinder High) Register    ]   LBA
	LM     = LBA Mid (was: Cylinder Low) Register      ] Register
	LL     = LBA Low (was: Sector Number) Register     ]
	DV     = Device (was: Device/Head) Register
	DC     = Device Control Register
	ER     = Error register
	ST     = Status register
Powered_Up_Time is measured from power on, and printed as
DDd+hh:mm:SS.sss where DD=days, hh=hours, mm=minutes,
SS=sec, and sss=millisec. It "wraps" after 49.710 days.

Error 4003 [2] occurred at disk power-on lifetime: 23773 hours (990 days + 13 hours)
  When the command that caused the error occurred, the device was active or idle.

  After command completion occurred, registers were:
  ER -- ST COUNT  LBA_48  LH LM LL DV DC
  -- -- -- == -- == == == -- -- -- -- --
  40 -- 51 00 00 00 66 00 48 1e 64 00 00  Error: UNC at LBA = 0x6600481e64 = 438091390564

  Commands leading to the command that caused the error were:
  CR FEATR COUNT  LBA_48  LH LM LL DV DC  Powered_Up_Time  Command/Feature_Name
  -- == -- == -- == == == -- -- -- -- --  ---------------  --------------------
  60 00 00 00 08 00 66 00 48 1e 60 40 00     01:50:15.499  READ FPDMA QUEUED
  60 00 00 00 08 00 66 00 48 1e 58 40 00     01:50:15.499  READ FPDMA QUEUED
  60 00 00 00 08 00 66 00 48 1e 50 40 00     01:50:15.498  READ FPDMA QUEUED
  60 00 00 00 08 00 66 00 48 1e 48 40 00     01:50:15.498  READ FPDMA QUEUED
  60 00 00 00 08 00 66 00 48 1e 40 40 00     01:50:15.498  READ FPDMA QUEUED

Error 4002 [1] occurred at disk power-on lifetime: 23773 hours (990 days + 13 hours)
  When the command that caused the error occurred, the device was active or idle.

  After command completion occurred, registers were:
  ER -- ST COUNT  LBA_48  LH LM LL DV DC
  -- -- -- == -- == == == -- -- -- -- --
  40 -- 51 00 00 00 66 00 48 1e 64 00 00  Error: UNC at LBA = 0x6600481e64 = 438091390564

  Commands leading to the command that caused the error were:
  CR FEATR COUNT  LBA_48  LH LM LL DV DC  Powered_Up_Time  Command/Feature_Name
  -- == -- == -- == == == -- -- -- -- --  ---------------  --------------------
  60 00 00 01 00 00 66 00 48 1e 00 40 00     01:50:13.087  READ FPDMA QUEUED
  60 00 00 01 00 00 65 00 24 1e 20 40 00     01:50:13.025  READ FPDMA QUEUED
  60 00 00 00 58 00 65 00 23 1e c8 40 00     01:50:13.023  READ FPDMA QUEUED
  60 00 00 00 10 00 64 00 83 24 80 40 00     01:50:13.022  READ FPDMA QUEUED
  60 00 00 00 48 00 65 00 23 1e 80 40 00     01:50:13.020  READ FPDMA QUEUED

Error 4001 [0] occurred at disk power-on lifetime: 23763 hours (990 days + 3 hours)
  When the command that caused the error occurred, the device was active or idle.

  After command completion occurred, registers were:
  ER -- ST COUNT  LBA_48  LH LM LL DV DC
  -- -- -- == -- == == == -- -- -- -- --
  40 -- 51 00 00 00 68 00 b6 1e 73 00 00  Error: UNC at LBA = 0x6800b61e73 = 446688534131

  Commands leading to the command that caused the error were:
  CR FEATR COUNT  LBA_48  LH LM LL DV DC  Powered_Up_Time  Command/Feature_Name
  -- == -- == -- == == == -- -- -- -- --  ---------------  --------------------
  60 00 00 00 08 00 68 00 b6 1e 70 40 00     01:14:05.670  READ FPDMA QUEUED
  61 00 00 02 c0 00 90 00 a6 10 40 40 00     01:14:05.670  WRITE FPDMA QUEUED
  61 00 00 05 40 00 90 00 a1 10 00 40 00     01:14:05.670  WRITE FPDMA QUEUED
  61 00 00 02 c0 00 90 00 9e 10 40 40 00     01:14:05.669  WRITE FPDMA QUEUED
  61 00 00 05 40 00 90 00 99 10 00 40 00     01:14:05.669  WRITE FPDMA QUEUED

Error 4000 [19] occurred at disk power-on lifetime: 23763 hours (990 days + 3 hours)
  When the command that caused the error occurred, the device was active or idle.

  After command completion occurred, registers were:
  ER -- ST COUNT  LBA_48  LH LM LL DV DC
  -- -- -- == -- == == == -- -- -- -- --
  40 -- 51 00 00 00 68 00 b6 1e 73 00 00  Error: WP at LBA = 0x6800b61e73 = 446688534131

  Commands leading to the command that caused the error were:
  CR FEATR COUNT  LBA_48  LH LM LL DV DC  Powered_Up_Time  Command/Feature_Name
  -- == -- == -- == == == -- -- -- -- --  ---------------  --------------------
  61 00 00 00 88 00 9a 00 31 12 b0 40 00     01:14:03.360  WRITE FPDMA QUEUED
  60 00 00 00 08 00 68 00 b6 1e 70 40 00     01:14:03.358  READ FPDMA QUEUED
  27 00 00 00 00 00 00 00 00 00 00 e0 00     01:14:03.310  READ NATIVE MAX ADDRESS EXT [OBS-ACS-3]
  ec 00 00 00 00 00 00 00 00 00 00 a0 00     01:14:03.309  IDENTIFY DEVICE
  ef 00 03 00 45 00 00 00 00 00 00 a0 00     01:14:03.308  SET FEATURES [Set transfer mode]

Error 3999 [18] occurred at disk power-on lifetime: 23763 hours (990 days + 3 hours)
  When the command that caused the error occurred, the device was active or idle.

  After command completion occurred, registers were:
  ER -- ST COUNT  LBA_48  LH LM LL DV DC
  -- -- -- == -- == == == -- -- -- -- --
  40 -- 51 00 00 00 68 00 b6 1e 73 00 00  Error: UNC at LBA = 0x6800b61e73 = 446688534131

  Commands leading to the command that caused the error were:
  CR FEATR COUNT  LBA_48  LH LM LL DV DC  Powered_Up_Time  Command/Feature_Name
  -- == -- == -- == == == -- -- -- -- --  ---------------  --------------------
  60 00 00 00 08 00 68 00 b6 1e 70 40 00     01:14:00.978  READ FPDMA QUEUED
  60 00 00 00 08 00 68 00 b6 1e 68 40 00     01:14:00.977  READ FPDMA QUEUED
  60 00 00 00 08 00 68 00 b6 1e 60 40 00     01:14:00.977  READ FPDMA QUEUED
  60 00 00 00 08 00 68 00 b6 1e 58 40 00     01:14:00.976  READ FPDMA QUEUED
  60 00 00 00 08 00 68 00 b6 1e 50 40 00     01:14:00.976  READ FPDMA QUEUED

Error 3998 [17] occurred at disk power-on lifetime: 23763 hours (990 days + 3 hours)
  When the command that caused the error occurred, the device was active or idle.

  After command completion occurred, registers were:
  ER -- ST COUNT  LBA_48  LH LM LL DV DC
  -- -- -- == -- == == == -- -- -- -- --
  40 -- 51 00 00 00 68 00 b6 1e 73 00 00  Error: UNC at LBA = 0x6800b61e73 = 446688534131

  Commands leading to the command that caused the error were:
  CR FEATR COUNT  LBA_48  LH LM LL DV DC  Powered_Up_Time  Command/Feature_Name
  -- == -- == -- == == == -- -- -- -- --  ---------------  --------------------
  60 00 00 01 00 00 68 00 b3 1e d8 40 00     01:13:58.506  READ FPDMA QUEUED
  60 00 00 01 00 00 68 00 b2 1e d8 40 00     01:13:58.478  READ FPDMA QUEUED
  60 00 00 00 30 00 68 00 b2 1e a8 40 00     01:13:58.476  READ FPDMA QUEUED
  60 00 00 00 30 00 68 00 b2 1e 78 40 00     01:13:58.475  READ FPDMA QUEUED
  60 00 00 00 08 00 68 00 b2 1e 70 40 00     01:13:58.473  READ FPDMA QUEUED

Error 3997 [16] occurred at disk power-on lifetime: 23763 hours (990 days + 3 hours)
  When the command that caused the error occurred, the device was active or idle.

  After command completion occurred, registers were:
  ER -- ST COUNT  LBA_48  LH LM LL DV DC
  -- -- -- == -- == == == -- -- -- -- --
  40 -- 51 00 00 00 66 00 df 1e da 00 00  Error: UNC at LBA = 0x6600df1eda = 438101286618

  Commands leading to the command that caused the error were:
  CR FEATR COUNT  LBA_48  LH LM LL DV DC  Powered_Up_Time  Command/Feature_Name
  -- == -- == -- == == == -- -- -- -- --  ---------------  --------------------
  60 00 00 01 00 00 66 00 cb 1e d8 40 00     01:04:59.212  READ FPDMA QUEUED
  60 00 00 01 00 00 66 00 ca 1e d8 40 00     01:04:59.211  READ FPDMA QUEUED
  60 00 00 00 08 00 66 00 ca 1e 50 40 00     01:04:59.152  READ FPDMA QUEUED
  60 00 00 00 08 00 24 00 25 1e b0 40 00     01:04:59.134  READ FPDMA QUEUED
  60 00 00 01 00 00 64 00 b4 1d 58 40 00     01:04:59.114  READ FPDMA QUEUED

Error 3996 [15] occurred at disk power-on lifetime: 20262 hours (844 days + 6 hours)
  When the command that caused the error occurred, the device was active or idle.

  After command completion occurred, registers were:
  ER -- ST COUNT  LBA_48  LH LM LL DV DC
  -- -- -- == -- == == == -- -- -- -- --
  40 -- 51 00 00 00 32 00 77 00 c4 00 00  Error: UNC at LBA = 0x32007700c4 = 214756163780

  Commands leading to the command that caused the error were:
  CR FEATR COUNT  LBA_48  LH LM LL DV DC  Powered_Up_Time  Command/Feature_Name
  -- == -- == -- == == == -- -- -- -- --  ---------------  --------------------
  60 00 00 04 00 00 30 00 b4 00 00 40 00     00:12:48.251  READ FPDMA QUEUED
  60 00 00 04 00 00 30 00 b0 00 00 40 00     00:12:48.251  READ FPDMA QUEUED
  60 00 00 04 00 00 2a 00 a8 00 00 40 00     00:12:43.275  READ FPDMA QUEUED
  60 00 00 04 00 00 2a 00 a4 00 00 40 00     00:12:43.250  READ FPDMA QUEUED
  60 00 00 04 00 00 2a 00 a0 00 00 40 00     00:12:43.250  READ FPDMA QUEUED

SMART Extended Self-test Log Version: 1 (1 sectors)
Num  Test_Description    Status                  Remaining  LifeTime(hours)  LBA_of_first_error
# 1  Short offline       Completed without error       00%      4532         -

SMART Selective self-test log data structure revision number 1
 SPAN  MIN_LBA  MAX_LBA  CURRENT_TEST_STATUS
    1        0        0  Not_testing
    2        0        0  Not_testing
    3        0        0  Not_testing
    4        0        0  Not_testing
    5        0        0  Not_testing
Selective self-test flags (0x0):
  After scanning selected spans, do NOT read-scan remainder of disk.
If Selective self-test is pending on power-up, resume after 0 minute delay.

SCT Status Version:                  3
SCT Version (vendor specific):       522 (0x020a)
Device State:                        Active (0)
Current Temperature:                    28 Celsius
Power Cycle Min/Max Temperature:     24/28 Celsius
Lifetime    Min/Max Temperature:      6/61 Celsius
Under/Over Temperature Limit Count:   0/3
Vendor specific:
00 00 00 00 00 00 00 00 00 00 02 00 00 00 00 00
00 00 00 00 00 00 00 00 00 00 00 00 00 00 00 00

SCT Temperature History Version:     2
Temperature Sampling Period:         10 minutes
Temperature Logging Interval:        1 minute
Min/Max recommended Temperature:      0/ 0 Celsius
Min/Max Temperature Limit:            0/ 0 Celsius
Temperature History Size (Index):    128 (105)

SCT Error Recovery Control:
           Read: Disabled
          Write: Disabled

Device Statistics (GP/SMART Log 0x04) not supported

Pending Defects log (GP Log 0x0c) not supported

SATA Phy Event Counters (GP Log 0x11)
ID      Size     Value  Description
0x000a  2            9  Device-to-host register FISes sent due to a COMRESET
0x0001  2            0  Command failed due to ICRC error
0x0003  2            0  R_ERR response for device-to-host data FIS
0x0004  2            0  R_ERR response for host-to-device data FIS
0x0006  2            0  R_ERR response for device-to-host non-data FIS
0x0007  2            0  R_ERR response for host-to-device non-data FIS

