smartctl 7.2 2020-12-30 r5155 [FreeBSD 13.0-RELEASE amd64] (local build)
Copyright (C) 2002-20, Bruce Allen, Christian Franke, www.smartmontools.org

=== START OF INFORMATION SECTION ===
Model Family:     Seagate Momentus 5400.6
Device Model:     ST9320325AS
Serial Number:    --
LU WWN Device Id: 5 000c50 ...
Firmware Version: D003DEM1
User Capacity:    320,072,933,376 bytes [320 GB]
Sector Size:      512 bytes logical/physical
Rotation Rate:    5400 rpm
Device is:        In smartctl database [for details use: -P show]
ATA Version is:   ATA8-ACS T13/1699-D revision 4
SATA Version is:  SATA 2.6, 3.0 Gb/s
Local Time is:    Wed Oct  5 15:48:39 2022 EDT
SMART support is: Available - device has SMART capability.
SMART support is: Enabled
AAM level is:     208 (intermediate), recommended: 208
APM level is:     128 (minimum power consumption without standby)
Rd look-ahead is: Enabled
Write cache is:   Enabled
DSN feature is:   Unavailable
ATA Security is:  Disabled, frozen [SEC2]
Wt Cache Reorder: Unknown

=== START OF READ SMART DATA SECTION ===
SMART overall-health self-assessment test result: PASSED

General SMART Values:
Offline data collection status:  (0x00)	Offline data collection activity
					was never started.
					Auto Offline Data Collection: Disabled.
Self-test execution status:      (   0)	The previous self-test routine completed
					without error or no self-test has ever 
					been run.
Total time to complete Offline 
data collection: 		(    0) seconds.
Offline data collection
capabilities: 			 (0x73) SMART execute Offline immediate.
					Auto Offline data collection on/off support.
					Suspend Offline collection upon new
					command.
					No Offline surface scan supported.
					Self-test supported.
					Conveyance Self-test supported.
					Selective Self-test supported.
SMART capabilities:            (0x0003)	Saves SMART data before entering
					power-saving mode.
					Supports SMART auto save timer.
Error logging capability:        (0x01)	Error logging supported.
					General Purpose Logging supported.
Short self-test routine 
recommended polling time: 	 (   2) minutes.
Extended self-test routine
recommended polling time: 	 (  99) minutes.
Conveyance self-test routine
recommended polling time: 	 (   3) minutes.
SCT capabilities: 	       (0x103f)	SCT Status supported.
					SCT Error Recovery Control supported.
					SCT Feature Control supported.
					SCT Data Table supported.

SMART Attributes Data Structure revision number: 10
Vendor Specific SMART Attributes with Thresholds:
ID# ATTRIBUTE_NAME          FLAGS    VALUE WORST THRESH FAIL RAW_VALUE
  1 Raw_Read_Error_Rate     POSR--   117   084   006    -    143661246
  3 Spin_Up_Time            PO----   099   098   085    -    0
  4 Start_Stop_Count        -O--CK   095   095   020    -    5925
  5 Reallocated_Sector_Ct   PO--CK   100   100   036    -    0
  7 Seek_Error_Rate         POSR--   081   060   030    -    153223796
  9 Power_On_Hours          -O--CK   094   094   000    -    5433
 10 Spin_Retry_Count        PO--C-   100   100   097    -    0
 12 Power_Cycle_Count       -O--CK   095   095   020    -    5471
184 End-to-End_Error        -O--CK   100   100   099    -    0
187 Reported_Uncorrect      -O--CK   001   001   000    -    7153
188 Command_Timeout         -O--CK   100   092   000    -    8590065745
189 High_Fly_Writes         -O-RCK   100   100   000    -    0
190 Airflow_Temperature_Cel -O---K   065   051   045    -    35 (Min/Max 33/36)
191 G-Sense_Error_Rate      -O--CK   100   100   000    -    248
192 Power-Off_Retract_Count -O--CK   100   100   000    -    125
193 Load_Cycle_Count        -O--CK   077   077   000    -    46045
194 Temperature_Celsius     -O---K   035   049   000    -    35 (0 5 0 0 0)
195 Hardware_ECC_Recovered  -O-RC-   059   053   000    -    143661246
197 Current_Pending_Sector  -O--C-   100   100   000    -    11
198 Offline_Uncorrectable   ----C-   100   100   000    -    11
199 UDMA_CRC_Error_Count    -OSRCK   200   200   000    -    0
240 Head_Flying_Hours       ------   100   253   000    -    5230 (63 236 0)
241 Total_LBAs_Written      ------   100   253   000    -    4183722680
242 Total_LBAs_Read         ------   100   253   000    -    2948804909
254 Free_Fall_Sensor        -O--CK   100   100   000    -    0
                            ||||||_ K auto-keep
                            |||||__ C event count
                            ||||___ R error rate
                            |||____ S speed/performance
                            ||_____ O updated online
                            |______ P prefailure warning

General Purpose Log Directory Version 1
SMART           Log Directory Version 1 [multi-sector log support]
Address    Access  R/W   Size  Description
0x00       GPL,SL  R/O      1  Log Directory
0x01       GPL,SL  R/O      1  Summary SMART error log
0x02       GPL,SL  R/O      5  Comprehensive SMART error log
0x03       GPL,SL  R/O      5  Ext. Comprehensive SMART error log
0x06       GPL,SL  R/O      1  SMART self-test log
0x07       GPL,SL  R/O      1  Extended self-test log
0x09       GPL,SL  R/W      1  Selective self-test log
0x10       GPL,SL  R/O      1  NCQ Command Error log
0x11       GPL,SL  R/O      1  SATA Phy Event Counters log
0x21       GPL,SL  R/O      1  Write stream error log
0x22       GPL,SL  R/O      1  Read stream error log
0x80-0x9f  GPL,SL  R/W     16  Host vendor specific log
0xa1       GPL,SL  VS      20  Device vendor specific log
0xa2       GPL     VS    2248  Device vendor specific log
0xa8       GPL,SL  VS      65  Device vendor specific log
0xa9       GPL,SL  VS       1  Device vendor specific log
0xb0       GPL     VS    2864  Device vendor specific log
0xbe-0xbf  GPL     VS   65535  Device vendor specific log
0xe0       GPL,SL  R/W      1  SCT Command/Status
0xe1       GPL,SL  R/W      1  SCT Data Transfer

SMART Extended Comprehensive Error Log Version: 1 (5 sectors)
Device Error Count: 6839 (device log contains only the most recent 20 errors)
	CR     = Command Register
	FEATR  = Features Register
	COUNT  = Count (was: Sector Count) Register
	LBA_48 = Upper bytes of LBA High/Mid/Low Registers ]  ATA-8
	LH     = LBA High (was: Cylinder High) Register    ]   LBA
	LM     = LBA Mid (was: Cylinder Low) Register      ] Register
	LL     = LBA Low (was: Sector Number) Register     ]
	DV     = Device (was: Device/Head) Register
	DC     = Device Control Register
	ER     = Error register
	ST     = Status register
Powered_Up_Time is measured from power on, and printed as
DDd+hh:mm:SS.sss where DD=days, hh=hours, mm=minutes,
SS=sec, and sss=millisec. It "wraps" after 49.710 days.

Error 6839 [18] occurred at disk power-on lifetime: 5008 hours (208 days + 16 hours)
  When the command that caused the error occurred, the device was active or idle.

  After command completion occurred, registers were:
  ER -- ST COUNT  LBA_48  LH LM LL DV DC
  -- -- -- == -- == == == -- -- -- -- --
  40 -- 51 00 00 00 00 02 03 fb 67 00 00  Error: UNC at LBA = 0x0203fb67 = 33815399

  Commands leading to the command that caused the error were:
  CR FEATR COUNT  LBA_48  LH LM LL DV DC  Powered_Up_Time  Command/Feature_Name
  -- == -- == -- == == == -- -- -- -- --  ---------------  --------------------
  60 00 00 01 00 00 00 02 03 fb 80 40 00     04:19:10.412  READ FPDMA QUEUED
  60 00 00 01 00 00 00 02 03 fa 80 40 00     04:19:10.412  READ FPDMA QUEUED
  60 00 00 01 00 00 00 02 03 f9 80 40 00     04:19:10.411  READ FPDMA QUEUED
  60 00 00 01 00 00 00 02 03 f8 80 40 00     04:19:10.411  READ FPDMA QUEUED
  60 00 00 01 00 00 00 02 03 f7 80 40 00     04:19:10.411  READ FPDMA QUEUED

Error 6838 [17] occurred at disk power-on lifetime: 4976 hours (207 days + 8 hours)
  When the command that caused the error occurred, the device was active or idle.

  After command completion occurred, registers were:
  ER -- ST COUNT  LBA_48  LH LM LL DV DC
  -- -- -- == -- == == == -- -- -- -- --
  40 -- 51 00 00 00 00 00 01 42 79 00 00  Error: WP at LBA = 0x00014279 = 82553

  Commands leading to the command that caused the error were:
  CR FEATR COUNT  LBA_48  LH LM LL DV DC  Powered_Up_Time  Command/Feature_Name
  -- == -- == -- == == == -- -- -- -- --  ---------------  --------------------
  61 00 00 00 08 00 00 00 5e dd 88 40 00     02:58:15.973  WRITE FPDMA QUEUED
  61 00 00 00 01 00 00 06 61 cf 58 40 00     02:58:15.972  WRITE FPDMA QUEUED
  60 00 00 00 08 00 00 0a 69 3d 40 40 00     02:58:15.972  READ FPDMA QUEUED
  61 00 00 00 08 00 00 0e 95 4c f0 40 00     02:58:15.971  WRITE FPDMA QUEUED
  60 00 00 00 80 00 00 00 01 42 00 40 00     02:58:15.971  READ FPDMA QUEUED

Error 6837 [16] occurred at disk power-on lifetime: 4976 hours (207 days + 8 hours)
  When the command that caused the error occurred, the device was active or idle.

  After command completion occurred, registers were:
  ER -- ST COUNT  LBA_48  LH LM LL DV DC
  -- -- -- == -- == == == -- -- -- -- --
  40 -- 51 00 00 00 00 00 01 42 79 00 00  Error: UNC at LBA = 0x00014279 = 82553

  Commands leading to the command that caused the error were:
  CR FEATR COUNT  LBA_48  LH LM LL DV DC  Powered_Up_Time  Command/Feature_Name
  -- == -- == -- == == == -- -- -- -- --  ---------------  --------------------
  60 00 00 00 08 00 00 0a 69 3d 40 40 00     02:58:13.696  READ FPDMA QUEUED
  60 00 00 00 80 00 00 00 01 42 00 40 00     02:58:13.682  READ FPDMA QUEUED
  60 00 00 00 80 00 00 00 01 46 00 40 00     02:58:13.681  READ FPDMA QUEUED
  60 00 00 00 08 00 00 0a 66 76 08 40 00     02:58:13.680  READ FPDMA QUEUED
  ef 00 90 00 03 00 00 00 00 00 00 00 00     02:58:13.680  SET FEATURES [Disable SATA feature]

Error 6836 [15] occurred at disk power-on lifetime: 4976 hours (207 days + 8 hours)
  When the command that caused the error occurred, the device was active or idle.

  After command completion occurred, registers were:
  ER -- ST COUNT  LBA_48  LH LM LL DV DC
  -- -- -- == -- == == == -- -- -- -- --
  40 -- 51 00 00 00 00 00 01 42 79 00 00  Error: UNC at LBA = 0x00014279 = 82553

  Commands leading to the command that caused the error were:
  CR FEATR COUNT  LBA_48  LH LM LL DV DC  Powered_Up_Time  Command/Feature_Name
  -- == -- == -- == == == -- -- -- -- --  ---------------  --------------------
  60 00 00 00 80 00 00 00 01 46 00 40 00     02:58:11.384  READ FPDMA QUEUED
  61 00 00 00 08 00 00 00 5e dd 70 40 00     02:58:11.358  WRITE FPDMA QUEUED
  61 00 00 00 08 00 00 00 5e dd 80 40 00     02:58:11.357  WRITE FPDMA QUEUED
  61 00 00 00 10 00 00 00 5f a7 88 40 00     02:58:11.356  WRITE FPDMA QUEUED
  60 00 00 00 08 00 00 0a 66 76 08 40 00     02:58:11.356  READ FPDMA QUEUED

Error 6835 [14] occurred at disk power-on lifetime: 4976 hours (207 days + 8 hours)
  When the command that caused the error occurred, the device was active or idle.

  After command completion occurred, registers were:
  ER -- ST COUNT  LBA_48  LH LM LL DV DC
  -- -- -- == -- == == == -- -- -- -- --
  40 -- 51 00 00 00 00 00 01 42 79 00 00  Error: UNC at LBA = 0x00014279 = 82553

  Commands leading to the command that caused the error were:
  CR FEATR COUNT  LBA_48  LH LM LL DV DC  Powered_Up_Time  Command/Feature_Name
  -- == -- == -- == == == -- -- -- -- --  ---------------  --------------------
  60 00 00 00 08 00 00 0a 66 76 08 40 00     02:58:09.059  READ FPDMA QUEUED
  60 00 00 00 80 00 00 00 01 45 80 40 00     02:58:09.059  READ FPDMA QUEUED
  60 00 00 00 80 00 00 00 01 42 00 40 00     02:58:09.058  READ FPDMA QUEUED
  ef 00 02 00 00 00 00 00 00 00 00 00 00     02:58:09.058  SET FEATURES [Enable write cache]
  ef 00 02 00 00 00 00 00 00 00 00 00 00     02:58:09.000  SET FEATURES [Enable write cache]

Error 6834 [13] occurred at disk power-on lifetime: 4976 hours (207 days + 8 hours)
  When the command that caused the error occurred, the device was active or idle.

  After command completion occurred, registers were:
  ER -- ST COUNT  LBA_48  LH LM LL DV DC
  -- -- -- == -- == == == -- -- -- -- --
  40 -- 51 00 00 00 00 00 01 42 79 00 00  Error: WP at LBA = 0x00014279 = 82553

  Commands leading to the command that caused the error were:
  CR FEATR COUNT  LBA_48  LH LM LL DV DC  Powered_Up_Time  Command/Feature_Name
  -- == -- == -- == == == -- -- -- -- --  ---------------  --------------------
  61 00 00 00 08 00 00 00 1e ee 20 40 00     02:58:06.772  WRITE FPDMA QUEUED
  60 00 00 00 80 00 00 00 01 45 80 40 00     02:58:06.772  READ FPDMA QUEUED
  60 00 00 00 80 00 00 00 01 42 00 40 00     02:58:06.771  READ FPDMA QUEUED
  ef 00 90 00 03 00 00 00 00 00 00 00 00     02:58:06.770  SET FEATURES [Disable SATA feature]
  ef 00 02 00 00 00 00 00 00 00 00 00 00     02:58:06.770  SET FEATURES [Enable write cache]

Error 6833 [12] occurred at disk power-on lifetime: 4976 hours (207 days + 8 hours)
  When the command that caused the error occurred, the device was active or idle.

  After command completion occurred, registers were:
  ER -- ST COUNT  LBA_48  LH LM LL DV DC
  -- -- -- == -- == == == -- -- -- -- --
  40 -- 51 00 00 00 00 00 01 42 79 00 00  Error: UNC at LBA = 0x00014279 = 82553

  Commands leading to the command that caused the error were:
  CR FEATR COUNT  LBA_48  LH LM LL DV DC  Powered_Up_Time  Command/Feature_Name
  -- == -- == -- == == == -- -- -- -- --  ---------------  --------------------
  60 00 00 00 08 00 00 0a 66 04 20 40 00     02:58:04.416  READ FPDMA QUEUED
  61 00 00 00 08 00 00 00 05 33 28 40 00     02:58:04.404  WRITE FPDMA QUEUED
  61 00 00 00 08 00 00 0e 95 15 48 40 00     02:58:04.403  WRITE FPDMA QUEUED
  61 00 00 00 08 00 00 00 05 33 30 40 00     02:58:04.403  WRITE FPDMA QUEUED
  61 00 00 00 08 00 00 06 61 cf 50 40 00     02:58:04.402  WRITE FPDMA QUEUED

Error 6832 [11] occurred at disk power-on lifetime: 4976 hours (207 days + 8 hours)
  When the command that caused the error occurred, the device was active or idle.

  After command completion occurred, registers were:
  ER -- ST COUNT  LBA_48  LH LM LL DV DC
  -- -- -- == -- == == == -- -- -- -- --
  40 -- 51 00 00 00 00 00 01 42 79 00 00  Error: UNC at LBA = 0x00014279 = 82553

  Commands leading to the command that caused the error were:
  CR FEATR COUNT  LBA_48  LH LM LL DV DC  Powered_Up_Time  Command/Feature_Name
  -- == -- == -- == == == -- -- -- -- --  ---------------  --------------------
  60 00 00 00 80 00 00 00 01 45 00 40 00     02:58:02.050  READ FPDMA QUEUED
  61 00 00 00 08 00 00 00 5e dd 78 40 00     02:58:02.025  WRITE FPDMA QUEUED
  61 00 00 00 08 00 00 00 5e dd 80 40 00     02:58:02.025  WRITE FPDMA QUEUED
  61 00 00 00 08 00 00 00 5f a7 70 40 00     02:58:02.024  WRITE FPDMA QUEUED
  61 00 00 00 08 00 00 06 61 cf 50 40 00     02:58:02.024  WRITE FPDMA QUEUED

SMART Extended Self-test Log Version: 1 (1 sectors)
Num  Test_Description    Status                  Remaining  LifeTime(hours)  LBA_of_first_error
# 1  Short offline       Completed: read failure       90%      4968         31129452
# 2  Short offline       Completed: read failure       50%      4923         82553
# 3  Short offline       Completed: read failure       90%      4789         31131057
# 4  Short offline       Completed: read failure       90%      4575         31129452
# 5  Short offline       Completed: read failure       90%      4541         82553
# 6  Short offline       Completed: read failure       90%      4492         31131057
# 7  Short offline       Completed: read failure       90%      4428         31129453
# 8  Short offline       Completed: read failure       30%      4399         31127848
# 9  Short offline       Completed: read failure       90%      4230         31129452
#10  Short offline       Completed: read failure       90%      4090         82553
#11  Short offline       Completed: read failure       90%      4027         82553
#12  Short offline       Completed without error       00%      1260         -
#13  Short offline       Completed without error       00%      1213         -
#14  Short offline       Completed without error       00%         2         -
#15  Short offline       Completed without error       00%         0         -

SMART Selective self-test log data structure revision number 1
 SPAN  MIN_LBA  MAX_LBA  CURRENT_TEST_STATUS
    1        0        0  Not_testing
    2        0        0  Not_testing
    3        0        0  Not_testing
    4        0        0  Not_testing
    5        0        0  Not_testing
Selective self-test flags (0x0):
  After scanning selected spans, do NOT read-scan remainder of disk.
If Selective self-test is pending on power-up, resume after 0 minute delay.

SCT Status Version:                  3
SCT Version (vendor specific):       522 (0x020a)
Device State:                        Active (0)
Current Temperature:                    35 Celsius
Power Cycle Min/Max Temperature:     33/38 Celsius
Lifetime    Min/Max Temperature:      5/49 Celsius
Specified Max Operating Temperature:    34 Celsius
Under/Over Temperature Limit Count:   0/0

SCT Temperature History Version:     2
Temperature Sampling Period:         1 minute
Temperature Logging Interval:        1 minute
Min/Max recommended Temperature:     14/55 Celsius
Min/Max Temperature Limit:           10/60 Celsius
Temperature History Size (Index):    128 (83)

SCT Error Recovery Control:
           Read: Disabled
          Write: Disabled

Device Statistics (GP/SMART Log 0x04) not supported

Pending Defects log (GP Log 0x0c) not supported

SATA Phy Event Counters (GP Log 0x11)
ID      Size     Value  Description
0x000a  2           58  Device-to-host register FISes sent due to a COMRESET
0x0001  2            0  Command failed due to ICRC error
0x0003  2            0  R_ERR response for device-to-host data FIS
0x0004  2            0  R_ERR response for host-to-device data FIS
0x0006  2            0  R_ERR response for device-to-host non-data FIS
0x0007  2            0  R_ERR response for host-to-device non-data FIS

