smartctl 7.5 2025-04-30 r5714 [FreeBSD 14.3-RELEASE-p4 amd64] (local build)
Copyright (C) 2002-25, Bruce Allen, Christian Franke, www.smartmontools.org

=== START OF INFORMATION SECTION ===
Model Family:     Western Digital AV
Device Model:     WDC WD3200BUCT-63TWBY0
Serial Number:    --
LU WWN Device Id: 5 0014ee ...
Firmware Version: 01.01A01
User Capacity:    320,072,933,376 bytes [320 GB]
Sector Sizes:     512 bytes logical, 4096 bytes physical
Rotation Rate:    5400 rpm
Device is:        In smartctl database 7.5/5706
ATA Version is:   ATA8-ACS (minor revision not indicated)
SATA Version is:  SATA 2.6, 3.0 Gb/s
Local Time is:    Sat Nov 22 16:58:00 2025 MST
SMART support is: Available - device has SMART capability.
SMART support is: Enabled
AAM feature is:   Unavailable
APM level is:     128 (minimum power consumption without standby)
Rd look-ahead is: Enabled
Write cache is:   Enabled
DSN feature is:   Unavailable
ATA Security is:  Disabled, frozen [SEC2]

=== START OF READ SMART DATA SECTION ===
SMART overall-health self-assessment test result: PASSED

General SMART Values:
Offline data collection status:  (0x00)	Offline data collection activity
					was never started.
					Auto Offline Data Collection: Disabled.
Self-test execution status:      (   0)	The previous self-test routine completed
					without error or no self-test has ever 
					been run.
Total time to complete Offline 
data collection: 		( 7080) seconds.
Offline data collection
capabilities: 			 (0x7b) SMART execute Offline immediate.
					Auto Offline data collection on/off support.
					Suspend Offline collection upon new
					command.
					Offline surface scan supported.
					Self-test supported.
					Conveyance Self-test supported.
					Selective Self-test supported.
SMART capabilities:            (0x0003)	Saves SMART data before entering
					power-saving mode.
					Supports SMART auto save timer.
Error logging capability:        (0x01)	Error logging supported.
					General Purpose Logging supported.
Short self-test routine 
recommended polling time: 	 (   2) minutes.
Extended self-test routine
recommended polling time: 	 (  73) minutes.
Conveyance self-test routine
recommended polling time: 	 (   5) minutes.
SCT capabilities: 	       (0x7035)	SCT Status supported.
					SCT Feature Control supported.
					SCT Data Table supported.

SMART Attributes Data Structure revision number: 16
Vendor Specific SMART Attributes with Thresholds:
ID# ATTRIBUTE_NAME          FLAGS    VALUE WORST THRESH FAIL RAW_VALUE
  1 Raw_Read_Error_Rate     POSR-K   200   200   051    -    0
  3 Spin_Up_Time            POS--K   136   134   021    -    2158
  4 Start_Stop_Count        -O--CK   100   100   000    -    147
  5 Reallocated_Sector_Ct   PO--CK   200   200   140    -    0
  7 Seek_Error_Rate         -OSR-K   200   200   000    -    0
  9 Power_On_Hours          -O--CK   001   001   000    -    79931
 10 Spin_Retry_Count        -O--CK   100   100   000    -    0
 11 Calibration_Retry_Count -O--CK   100   100   000    -    0
 12 Power_Cycle_Count       -O--CK   100   100   000    -    147
192 Power-Off_Retract_Count -O--CK   200   200   000    -    121
193 Load_Cycle_Count        -O--CK   200   200   000    -    2013
194 Temperature_Celsius     -O---K   108   091   000    -    35
196 Reallocated_Event_Count -O--CK   200   200   000    -    0
197 Current_Pending_Sector  -O--CK   200   200   000    -    0
198 Offline_Uncorrectable   ----CK   100   253   000    -    0
199 UDMA_CRC_Error_Count    -O--CK   200   200   000    -    0
200 Multi_Zone_Error_Rate   ---R--   200   200   000    -    0
                            ||||||_ K auto-keep
                            |||||__ C event count
                            ||||___ R error rate
                            |||____ S speed/performance
                            ||_____ O updated online
                            |______ P prefailure warning

General Purpose Log Directory Version 1
SMART           Log Directory Version 1 [multi-sector log support]
Address    Access  R/W   Size  Description
0x00       GPL,SL  R/O      1  Log Directory
0x01           SL  R/O      1  Summary SMART error log
0x02           SL  R/O      5  Comprehensive SMART error log
0x03       GPL     R/O      6  Ext. Comprehensive SMART error log
0x06           SL  R/O      1  SMART self-test log
0x07       GPL     R/O      1  Extended self-test log
0x09           SL  R/W      1  Selective self-test log
0x10       GPL     R/O      1  NCQ Command Error log
0x11       GPL     R/O      1  SATA Phy Event Counters log
0x21       GPL     R/O      1  Write stream error log
0x22       GPL     R/O      1  Read stream error log
0x80-0x9f  GPL,SL  R/W     16  Host vendor specific log
0xa0-0xa7  GPL,SL  VS      16  Device vendor specific log
0xa8-0xb7  GPL,SL  VS       1  Device vendor specific log
0xbd       GPL,SL  VS       1  Device vendor specific log
0xc0       GPL,SL  VS       1  Device vendor specific log
0xc1       GPL     VS      93  Device vendor specific log
0xe0       GPL,SL  R/W      1  SCT Command/Status
0xe1       GPL,SL  R/W      1  SCT Data Transfer

SMART Extended Comprehensive Error Log Version: 1 (6 sectors)
Device Error Count: 5
	CR     = Command Register
	FEATR  = Features Register
	COUNT  = Count (was: Sector Count) Register
	LBA_48 = Upper bytes of LBA High/Mid/Low Registers ]  ATA-8
	LH     = LBA High (was: Cylinder High) Register    ]   LBA
	LM     = LBA Mid (was: Cylinder Low) Register      ] Register
	LL     = LBA Low (was: Sector Number) Register     ]
	DV     = Device (was: Device/Head) Register
	DC     = Device Control Register
	ER     = Error register
	ST     = Status register
Powered_Up_Time is measured from power on, and printed as
DDd+hh:mm:SS.sss where DD=days, hh=hours, mm=minutes,
SS=sec, and sss=millisec. It "wraps" after 49.710 days.

Error 5 [4] occurred at disk power-on lifetime: 2730 hours (113 days + 18 hours)
  When the command that caused the error occurred, the device was active or idle.

  After command completion occurred, registers were:
  ER -- ST COUNT  LBA_48  LH LM LL DV DC
  -- -- -- == -- == == == -- -- -- -- --
  40 -- 51 00 00 00 00 24 aa 9e f0 40 00  Error: UNC at LBA = 0x24aa9ef0 = 615161584

  Commands leading to the command that caused the error were:
  CR FEATR COUNT  LBA_48  LH LM LL DV DC  Powered_Up_Time  Command/Feature_Name
  -- == -- == -- == == == -- -- -- -- --  ---------------  --------------------
  60 00 80 00 e0 00 00 24 aa 8d a8 40 08 44d+22:11:10.818  READ FPDMA QUEUED
  60 00 80 00 d8 00 00 24 aa 9e e8 40 08 44d+22:11:10.818  READ FPDMA QUEUED
  60 00 10 00 d0 00 00 24 a9 dd 28 40 08 44d+22:11:10.818  READ FPDMA QUEUED
  2f 00 00 00 01 00 00 00 00 00 10 40 08 44d+22:11:10.817  READ LOG EXT
  61 00 08 00 c0 00 00 10 3b 8b 68 40 08 44d+22:11:07.504  WRITE FPDMA QUEUED

Error 4 [3] occurred at disk power-on lifetime: 2730 hours (113 days + 18 hours)
  When the command that caused the error occurred, the device was active or idle.

  After command completion occurred, registers were:
  ER -- ST COUNT  LBA_48  LH LM LL DV DC
  -- -- -- == -- == == == -- -- -- -- --
  40 -- 51 00 00 00 00 24 aa 9e f0 40 00  Error: WP at LBA = 0x24aa9ef0 = 615161584

  Commands leading to the command that caused the error were:
  CR FEATR COUNT  LBA_48  LH LM LL DV DC  Powered_Up_Time  Command/Feature_Name
  -- == -- == -- == == == -- -- -- -- --  ---------------  --------------------
  61 00 08 00 c0 00 00 10 3b 8b 68 40 08 44d+22:11:07.504  WRITE FPDMA QUEUED
  61 00 08 00 b8 00 00 22 a6 e4 08 40 08 44d+22:11:07.504  WRITE FPDMA QUEUED
  61 00 08 00 b0 00 00 10 3b 8d 70 40 08 44d+22:11:07.504  WRITE FPDMA QUEUED
  61 00 08 00 a8 00 00 10 3b 91 20 40 08 44d+22:11:07.501  WRITE FPDMA QUEUED
  61 00 08 00 a0 00 00 10 3b 91 e8 40 08 44d+22:11:07.500  WRITE FPDMA QUEUED

Error 3 [2] occurred at disk power-on lifetime: 2730 hours (113 days + 18 hours)
  When the command that caused the error occurred, the device was active or idle.

  After command completion occurred, registers were:
  ER -- ST COUNT  LBA_48  LH LM LL DV DC
  -- -- -- == -- == == == -- -- -- -- --
  40 -- 51 00 00 00 00 24 aa 9e f0 40 00  Error: WP at LBA = 0x24aa9ef0 = 615161584

  Commands leading to the command that caused the error were:
  CR FEATR COUNT  LBA_48  LH LM LL DV DC  Powered_Up_Time  Command/Feature_Name
  -- == -- == -- == == == -- -- -- -- --  ---------------  --------------------
  61 01 40 00 f0 00 00 10 ff 44 68 40 08 44d+22:11:04.170  WRITE FPDMA QUEUED
  61 05 00 00 e8 00 00 03 ed a7 28 40 08 44d+22:11:04.170  WRITE FPDMA QUEUED
  61 02 40 00 e0 00 00 02 67 fc e8 40 08 44d+22:11:04.170  WRITE FPDMA QUEUED
  61 00 20 00 d8 00 00 02 66 c2 80 40 08 44d+22:11:04.170  WRITE FPDMA QUEUED
  61 00 40 00 d0 00 00 22 a7 3e 68 40 08 44d+22:11:04.170  WRITE FPDMA QUEUED

Error 2 [1] occurred at disk power-on lifetime: 2730 hours (113 days + 18 hours)
  When the command that caused the error occurred, the device was active or idle.

  After command completion occurred, registers were:
  ER -- ST COUNT  LBA_48  LH LM LL DV DC
  -- -- -- == -- == == == -- -- -- -- --
  40 -- 51 00 00 00 00 24 aa 9e f0 40 00  Error: WP at LBA = 0x24aa9ef0 = 615161584

  Commands leading to the command that caused the error were:
  CR FEATR COUNT  LBA_48  LH LM LL DV DC  Powered_Up_Time  Command/Feature_Name
  -- == -- == -- == == == -- -- -- -- --  ---------------  --------------------
  61 00 40 00 60 00 00 22 a5 69 28 40 08 44d+22:11:00.842  WRITE FPDMA QUEUED
  61 00 40 00 58 00 00 22 a6 e6 a8 40 08 44d+22:11:00.841  WRITE FPDMA QUEUED
  61 00 40 00 50 00 00 22 a5 69 28 40 08 44d+22:11:00.841  WRITE FPDMA QUEUED
  61 00 40 00 48 00 00 00 42 b4 e8 40 08 44d+22:11:00.836  WRITE FPDMA QUEUED
  61 00 c0 00 40 00 00 22 a7 42 28 40 08 44d+22:11:00.836  WRITE FPDMA QUEUED

Error 1 [0] occurred at disk power-on lifetime: 2730 hours (113 days + 18 hours)
  When the command that caused the error occurred, the device was active or idle.

  After command completion occurred, registers were:
  ER -- ST COUNT  LBA_48  LH LM LL DV DC
  -- -- -- == -- == == == -- -- -- -- --
  40 -- 51 00 00 00 00 24 aa 9e f0 40 00  Error: UNC at LBA = 0x24aa9ef0 = 615161584

  Commands leading to the command that caused the error were:
  CR FEATR COUNT  LBA_48  LH LM LL DV DC  Powered_Up_Time  Command/Feature_Name
  -- == -- == -- == == == -- -- -- -- --  ---------------  --------------------
  60 00 80 00 78 00 00 24 aa 8d a8 40 08 44d+22:10:57.532  READ FPDMA QUEUED
  60 00 80 00 70 00 00 24 aa 9e e8 40 08 44d+22:10:57.522  READ FPDMA QUEUED
  60 00 58 00 68 00 00 24 aa bc 08 40 08 44d+22:10:57.520  READ FPDMA QUEUED
  60 00 10 00 60 00 00 24 a9 dd 28 40 08 44d+22:10:57.513  READ FPDMA QUEUED
  60 00 10 00 58 00 00 24 aa 89 f8 40 08 44d+22:10:57.508  READ FPDMA QUEUED

SMART Extended Self-test Log Version: 1 (1 sectors)
Num  Test_Description    Status                  Remaining  LifeTime(hours)  LBA_of_first_error
# 1  Extended offline    Aborted by host               30%       385         -
# 2  Extended offline    Completed without error       00%       384         -
# 3  Extended offline    Completed without error       00%       383         -
# 4  Extended offline    Completed without error       00%       381         -
# 5  Extended offline    Completed without error       00%       379         -
# 6  Extended offline    Completed without error       00%       378         -
# 7  Extended offline    Completed without error       00%       376         -
# 8  Extended offline    Completed without error       00%       375         -
# 9  Extended offline    Completed without error       00%       373         -
#10  Extended offline    Completed without error       00%       372         -
#11  Extended offline    Completed without error       00%       370         -
#12  Extended offline    Completed without error       00%       369         -
#13  Extended offline    Completed without error       00%       367         -
#14  Extended offline    Completed without error       00%       366         -
#15  Extended offline    Completed without error       00%       364         -
#16  Extended offline    Completed without error       00%       362         -
#17  Extended offline    Completed without error       00%       361         -
#18  Extended offline    Completed without error       00%       359         -

SMART Selective self-test log data structure revision number 1
 SPAN  MIN_LBA  MAX_LBA  CURRENT_TEST_STATUS
    1        0        0  Not_testing
    2        0        0  Not_testing
    3        0        0  Not_testing
    4        0        0  Not_testing
    5        0        0  Not_testing
Selective self-test flags (0x0):
  After scanning selected spans, do NOT read-scan remainder of disk.
If Selective self-test is pending on power-up, resume after 0 minute delay.

SCT Status Version:                  3
SCT Version (vendor specific):       258 (0x0102)
Device State:                        Active (0)
Current Temperature:                    35 Celsius
Power Cycle Min/Max Temperature:     24/40 Celsius
Lifetime    Min/Max Temperature:      0/53 Celsius
Under/Over Temperature Limit Count:   0/0
Vendor specific:
03 00 00 00 00 00 00 00 00 00 00 00 00 00 00 00
00 00 00 00 00 00 00 00 00 00 00 00 00 00 00 00

SCT Temperature History Version:     2
Temperature Sampling Period:         1 minute
Temperature Logging Interval:        1 minute
Min/Max recommended Temperature:      0/60 Celsius
Min/Max Temperature Limit:           -41/85 Celsius
Temperature History Size (Index):    478 (27)

SCT Error Recovery Control command not supported

Device Statistics (GP/SMART Log 0x04) not supported

Pending Defects log (GP Log 0x0c) not supported

SATA Phy Event Counters (GP Log 0x11)
ID      Size     Value  Description
0x0001  2            0  Command failed due to ICRC error
0x0002  2            0  R_ERR response for data FIS
0x0003  2            0  R_ERR response for device-to-host data FIS
0x0004  2            0  R_ERR response for host-to-device data FIS
0x0005  2            0  R_ERR response for non-data FIS
0x0006  2            0  R_ERR response for device-to-host non-data FIS
0x0007  2            0  R_ERR response for host-to-device non-data FIS
0x0008  2            0  Device-to-host non-data FIS retries
0x0009  2           31  Transition from drive PhyRdy to drive PhyNRdy
0x000a  2           16  Device-to-host register FISes sent due to a COMRESET
0x000b  2            0  CRC errors within host-to-device FIS
0x000f  2            0  R_ERR response for host-to-device data FIS, CRC
0x0012  2            0  R_ERR response for host-to-device non-data FIS, CRC
0x8000  4      1711599  Vendor specific

