smartctl 7.4 2023-08-01 r5530 [FreeBSD 14.2-RELEASE-p1 amd64] (local build)
Copyright (C) 2002-23, Bruce Allen, Christian Franke, www.smartmontools.org

=== START OF INFORMATION SECTION ===
Model Family:     Toshiba X300
Device Model:     TOSHIBA HDWE160
Serial Number:    --
LU WWN Device Id: 5 000039 ...
Firmware Version: FS2A
User Capacity:    6,001,175,126,016 bytes [6.00 TB]
Sector Sizes:     512 bytes logical, 4096 bytes physical
Rotation Rate:    7200 rpm
Form Factor:      3.5 inches
Device is:        In smartctl database 7.3/5528
ATA Version is:   ATA8-ACS (minor revision not indicated)
SATA Version is:  SATA 3.0, 6.0 Gb/s (current: 6.0 Gb/s)
Local Time is:    Sun Mar 30 16:01:19 2025 MDT
SMART support is: Available - device has SMART capability.
SMART support is: Enabled
AAM feature is:   Unavailable
APM level is:     128 (minimum power consumption without standby)
Rd look-ahead is: Enabled
Write cache is:   Enabled
DSN feature is:   Unavailable
ATA Security is:  Disabled, frozen [SEC2]
Wt Cache Reorder: Enabled

=== START OF READ SMART DATA SECTION ===
SMART overall-health self-assessment test result: PASSED

General SMART Values:
Offline data collection status:  (0x82)	Offline data collection activity
					was completed without error.
					Auto Offline Data Collection: Enabled.
Self-test execution status:      (   0)	The previous self-test routine completed
					without error or no self-test has ever 
					been run.
Total time to complete Offline 
data collection: 		(  120) seconds.
Offline data collection
capabilities: 			 (0x5b) SMART execute Offline immediate.
					Auto Offline data collection on/off support.
					Suspend Offline collection upon new
					command.
					Offline surface scan supported.
					Self-test supported.
					No Conveyance Self-test supported.
					Selective Self-test supported.
SMART capabilities:            (0x0003)	Saves SMART data before entering
					power-saving mode.
					Supports SMART auto save timer.
Error logging capability:        (0x01)	Error logging supported.
					General Purpose Logging supported.
Short self-test routine 
recommended polling time: 	 (   2) minutes.
Extended self-test routine
recommended polling time: 	 ( 656) minutes.
SCT capabilities: 	       (0x003d)	SCT Status supported.
					SCT Error Recovery Control supported.
					SCT Feature Control supported.
					SCT Data Table supported.

SMART Attributes Data Structure revision number: 16
Vendor Specific SMART Attributes with Thresholds:
ID# ATTRIBUTE_NAME          FLAGS    VALUE WORST THRESH FAIL RAW_VALUE
  1 Raw_Read_Error_Rate     PO-R--   100   100   050    -    0
  2 Throughput_Performance  P-S---   100   100   050    -    0
  3 Spin_Up_Time            POS--K   100   100   001    -    10836
  4 Start_Stop_Count        -O--CK   100   100   000    -    380
  5 Reallocated_Sector_Ct   PO--CK   100   100   050    -    0
  7 Seek_Error_Rate         PO-R--   100   100   050    -    0
  8 Seek_Time_Performance   P-S---   100   100   050    -    0
  9 Power_On_Hours          -O--CK   001   001   000    -    51663
 10 Spin_Retry_Count        PO--CK   107   100   030    -    0
 12 Power_Cycle_Count       -O--CK   100   100   000    -    61
191 G-Sense_Error_Rate      -O--CK   100   100   000    -    0
192 Power-Off_Retract_Count -O--CK   100   100   000    -    22
193 Load_Cycle_Count        -O--CK   099   099   000    -    17190
194 Temperature_Celsius     -O---K   100   100   000    -    20 (Min/Max 13/37)
196 Reallocated_Event_Count -O--CK   100   100   000    -    0
197 Current_Pending_Sector  -O--CK   100   100   000    -    0
198 Offline_Uncorrectable   ----CK   100   100   000    -    0
199 UDMA_CRC_Error_Count    -O--CK   200   253   000    -    0
220 Disk_Shift              -O----   100   100   000    -    0
222 Loaded_Hours            -O--CK   001   001   000    -    44671
223 Load_Retry_Count        -O--CK   100   100   000    -    0
224 Load_Friction           -O---K   100   100   000    -    0
226 Load-in_Time            -OS--K   100   100   000    -    553
240 Head_Flying_Hours       P-----   100   100   001    -    0
                            ||||||_ K auto-keep
                            |||||__ C event count
                            ||||___ R error rate
                            |||____ S speed/performance
                            ||_____ O updated online
                            |______ P prefailure warning

General Purpose Log Directory Version 1
SMART           Log Directory Version 1 [multi-sector log support]
Address    Access  R/W   Size  Description
0x00       GPL,SL  R/O      1  Log Directory
0x01           SL  R/O      1  Summary SMART error log
0x02           SL  R/O     51  Comprehensive SMART error log
0x03       GPL     R/O     64  Ext. Comprehensive SMART error log
0x04       GPL,SL  R/O      8  Device Statistics log
0x06           SL  R/O      1  SMART self-test log
0x07       GPL     R/O      1  Extended self-test log
0x08       GPL     R/O      2  Power Conditions log
0x09           SL  R/W      1  Selective self-test log
0x0c       GPL     R/O   2048  Pending Defects log
0x10       GPL     R/O      1  NCQ Command Error log
0x11       GPL     R/O      1  SATA Phy Event Counters log
0x24       GPL     R/O  12288  Current Device Internal Status Data log
0x30       GPL,SL  R/O      9  IDENTIFY DEVICE data log
0x80-0x9f  GPL,SL  R/W     16  Host vendor specific log
0xa7       GPL     VS       8  Device vendor specific log
0xe0       GPL,SL  R/W      1  SCT Command/Status
0xe1       GPL,SL  R/W      1  SCT Data Transfer

SMART Extended Comprehensive Error Log Version: 1 (64 sectors)
No Errors Logged

SMART Extended Self-test Log Version: 1 (1 sectors)
Num  Test_Description    Status                  Remaining  LifeTime(hours)  LBA_of_first_error
# 1  Short offline       Completed without error       00%     51145         -
# 2  Short offline       Completed without error       00%     51121         -
# 3  Extended offline    Completed without error       00%     51112         -
# 4  Short offline       Completed without error       00%     51075         -
# 5  Short offline       Completed without error       00%     51051         -
# 6  Short offline       Completed without error       00%     51027         -
# 7  Short offline       Completed without error       00%     51003         -
# 8  Extended offline    Completed without error       00%     50992         -
# 9  Short offline       Completed without error       00%     50979         -
#10  Short offline       Completed without error       00%     50955         -
#11  Short offline       Completed without error       00%     50931         -
#12  Short offline       Completed without error       00%     50907         -
#13  Short offline       Completed without error       00%     50883         -
#14  Short offline       Completed without error       00%     50859         -
#15  Short offline       Completed without error       00%     50835         -
#16  Extended offline    Completed without error       00%     50822         -
#17  Short offline       Completed without error       00%     50811         -
#18  Short offline       Completed without error       00%     50787         -
#19  Short offline       Completed without error       00%     50763         -

SMART Selective self-test log data structure revision number 1
 SPAN  MIN_LBA  MAX_LBA  CURRENT_TEST_STATUS
    1        0        0  Not_testing
    2        0        0  Not_testing
    3        0        0  Not_testing
    4        0        0  Not_testing
    5        0        0  Not_testing
Selective self-test flags (0x0):
  After scanning selected spans, do NOT read-scan remainder of disk.
If Selective self-test is pending on power-up, resume after 0 minute delay.

SCT Status Version:                  3
SCT Version (vendor specific):       1 (0x0001)
Device State:                        Active (0)
Current Temperature:                    20 Celsius
Power Cycle Min/Max Temperature:     14/20 Celsius
Lifetime    Min/Max Temperature:     13/37 Celsius
Under/Over Temperature Limit Count:   0/0

SCT Temperature History Version:     2
Temperature Sampling Period:         1 minute
Temperature Logging Interval:        1 minute
Min/Max recommended Temperature:      5/55 Celsius
Min/Max Temperature Limit:            5/55 Celsius
Temperature History Size (Index):    478 (325)

SCT Error Recovery Control:
           Read: Disabled
          Write: Disabled

Device Statistics (GP Log 0x04)
Page  Offset Size        Value Flags Description
0x01  =====  =               =  ===  == General Statistics (rev 2) ==
0x01  0x008  4              61  ---  Lifetime Power-On Resets
0x01  0x010  4           51663  ---  Power-on Hours
0x01  0x018  6     93463879473  ---  Logical Sectors Written
0x01  0x020  6       917279496  ---  Number of Write Commands
0x01  0x028  6    369582571286  ---  Logical Sectors Read
0x01  0x030  6      1602445855  ---  Number of Read Commands
0x02  =====  =               =  ===  == Free-Fall Statistics (rev 1) ==
0x02  0x010  4               0  ---  Overlimit Shock Events
0x03  =====  =               =  ===  == Rotating Media Statistics (rev 1) ==
0x03  0x008  4           51372  ---  Spindle Motor Power-on Hours
0x03  0x010  4           44671  ---  Head Flying Hours
0x03  0x018  4           17190  ---  Head Load Events
0x03  0x020  4               0  ---  Number of Reallocated Logical Sectors
0x03  0x028  4               0  ---  Read Recovery Attempts
0x03  0x030  4               0  ---  Number of Mechanical Start Failures
0x04  =====  =               =  ===  == General Errors Statistics (rev 1) ==
0x04  0x008  4               0  ---  Number of Reported Uncorrectable Errors
0x04  0x010  4               1  ---  Resets Between Cmd Acceptance and Completion
0x05  =====  =               =  ===  == Temperature Statistics (rev 1) ==
0x05  0x008  1              20  ---  Current Temperature
0x05  0x010  1              24  N--  Average Short Term Temperature
0x05  0x018  1              22  N--  Average Long Term Temperature
0x05  0x020  1              37  ---  Highest Temperature
0x05  0x028  1              13  ---  Lowest Temperature
0x05  0x030  1              34  N--  Highest Average Short Term Temperature
0x05  0x038  1              20  N--  Lowest Average Short Term Temperature
0x05  0x040  1              32  N--  Highest Average Long Term Temperature
0x05  0x048  1              21  N--  Lowest Average Long Term Temperature
0x05  0x050  4               0  ---  Time in Over-Temperature
0x05  0x058  1              55  ---  Specified Maximum Operating Temperature
0x05  0x060  4               0  ---  Time in Under-Temperature
0x05  0x068  1               5  ---  Specified Minimum Operating Temperature
0x06  =====  =               =  ===  == Transport Statistics (rev 1) ==
0x06  0x008  4             946  ---  Number of Hardware Resets
0x06  0x018  4               0  ---  Number of Interface CRC Errors
0x07  =====  =               =  ===  == Solid State Device Statistics (rev 1) ==
                                |||_ C monitored condition met
                                ||__ D supports DSN
                                |___ N normalized value

Pending Defects log (GP Log 0x0c)
No Defects Logged

SATA Phy Event Counters (GP Log 0x11)
ID      Size     Value  Description
0x0001  4            0  Command failed due to ICRC error
0x0002  4            0  R_ERR response for data FIS
0x0003  4            0  R_ERR response for device-to-host data FIS
0x0004  4            0  R_ERR response for host-to-device data FIS
0x0005  4            0  R_ERR response for non-data FIS
0x0006  4            0  R_ERR response for device-to-host non-data FIS
0x0007  4            0  R_ERR response for host-to-device non-data FIS
0x0008  4            0  Device-to-host non-data FIS retries
0x0009  4            3  Transition from drive PhyRdy to drive PhyNRdy
0x000a  4            3  Device-to-host register FISes sent due to a COMRESET
0x000b  4            0  CRC errors within host-to-device FIS
0x000d  4            0  Non-CRC errors within host-to-device FIS
0x000f  4            0  R_ERR response for host-to-device data FIS, CRC
0x0010  4            0  R_ERR response for host-to-device data FIS, non-CRC
0x0012  4            0  R_ERR response for host-to-device non-data FIS, CRC
0x0013  4            0  R_ERR response for host-to-device non-data FIS, non-CRC



