smartctl 7.3 2022-02-28 r5338 [FreeBSD 13.0-STABLE amd64] (local build)
Copyright (C) 2002-22, Bruce Allen, Christian Franke, www.smartmontools.org

=== START OF INFORMATION SECTION ===
Model Number:                       KBG30ZMV256G KIOXIA
Serial Number:                      --
Firmware Version:                   ADHA0102
PCI Vendor/Subsystem ID:            0x1179
IEEE OUI Identifier:                0x00080d
Controller ID:                      0
NVMe Version:                       1.2.1
Number of Namespaces:               1
Namespace 1 Size/Capacity:          256,060,514,304 [256 GB]
Namespace 1 Formatted LBA Size:     512
Namespace 1 IEEE EUI-64:            00080d ...
Local Time is:                      Tue Aug  2 17:17:23 2022 CEST
Firmware Updates (0x12):            1 Slot, no Reset required
Optional Admin Commands (0x0017):   Security Format Frmw_DL Self_Test
Optional NVM Commands (0x0017):     Comp Wr_Unc DS_Mngmt Sav/Sel_Feat
Log Page Attributes (0x02):         Cmd_Eff_Lg
Maximum Data Transfer Size:         512 Pages
Warning  Comp. Temp. Threshold:     82 Celsius
Critical Comp. Temp. Threshold:     85 Celsius

Supported Power States
St Op     Max   Active     Idle   RL RT WL WT  Ent_Lat  Ex_Lat
 0 +     3.30W       -        -    0  0  0  0        0       0
 1 +     2.70W       -        -    1  1  1  1        0       0
 2 +     2.30W       -        -    2  2  2  2        0       0
 3 -   0.0500W       -        -    4  4  4  4     8000   32000
 4 -   0.0050W       -        -    4  4  4  4     8000   40000

Supported LBA Sizes (NSID 0x1)
Id Fmt  Data  Metadt  Rel_Perf
 0 -    4096       0         0
 1 +     512       0         3

=== START OF SMART DATA SECTION ===
SMART overall-health self-assessment test result: PASSED

SMART/Health Information (NVMe Log 0x02)
Critical Warning:                   0x00
Temperature:                        48 Celsius
Available Spare:                    100%
Available Spare Threshold:          10%
Percentage Used:                    19%
Data Units Read:                    2,970,739 [1.52 TB]
Data Units Written:                 72,541,726 [37.1 TB]
Host Read Commands:                 55,603,454
Host Write Commands:                636,175,701
Controller Busy Time:               1,655
Power Cycles:                       317
Power On Hours:                     10,448
Unsafe Shutdowns:                   50
Media and Data Integrity Errors:    0
Error Information Log Entries:      448
Warning  Comp. Temperature Time:    0
Critical Comp. Temperature Time:    0
Temperature Sensor 1:               48 Celsius

Error Information (NVMe Log 0x01, 16 of 64 entries)
No Errors Logged

