smartctl 7.1 2019-12-30 r5022 [FreeBSD 12.2-STABLE amd64] (local build)
Copyright (C) 2002-19, Bruce Allen, Christian Franke, www.smartmontools.org

=== START OF INFORMATION SECTION ===
Model Number:                       INTEL SSDPEKNW020T8
Serial Number:                      --
Firmware Version:                   002C
PCI Vendor/Subsystem ID:            0x8086
IEEE OUI Identifier:                0x5cd2e4
Controller ID:                      1
Number of Namespaces:               1
Namespace 1 Size/Capacity:          2,048,408,248,320 [2.04 TB]
Namespace 1 Formatted LBA Size:     512
Local Time is:                      Mon Dec  7 21:32:36 2020 CET
Firmware Updates (0x14):            2 Slots, no Reset required
Optional Admin Commands (0x0017):   Security Format Frmw_DL Self_Test
Optional NVM Commands (0x005f):     Comp Wr_Unc DS_Mngmt Wr_Zero Sav/Sel_Feat Timestmp
Maximum Data Transfer Size:         32 Pages
Warning  Comp. Temp. Threshold:     77 Celsius
Critical Comp. Temp. Threshold:     80 Celsius

Supported Power States
St Op     Max   Active     Idle   RL RT WL WT  Ent_Lat  Ex_Lat
 0 +     5.50W       -        -    0  0  0  0        0       0
 1 +     3.60W       -        -    1  1  1  1        0       0
 2 +     2.60W       -        -    2  2  2  2        0       0
 3 -   0.0300W       -        -    3  3  3  3     5000    5000
 4 -   0.0040W       -        -    4  4  4  4     5000    9000

Supported LBA Sizes (NSID 0x1)
Id Fmt  Data  Metadt  Rel_Perf
 0 +     512       0         0

=== START OF SMART DATA SECTION ===
SMART overall-health self-assessment test result: PASSED

SMART/Health Information (NVMe Log 0x02)
Critical Warning:                   0x00
Temperature:                        38 Celsius
Available Spare:                    100%
Available Spare Threshold:          10%
Percentage Used:                    1%
Data Units Read:                    57,628,834 [29.5 TB]
Data Units Written:                 46,150,031 [23.6 TB]
Host Read Commands:                 604,645,898
Host Write Commands:                605,293,878
Controller Busy Time:               13,891
Power Cycles:                       746
Power On Hours:                     4,793
Unsafe Shutdowns:                   41
Media and Data Integrity Errors:    0
Error Information Log Entries:      0
Warning  Comp. Temperature Time:    0
Critical Comp. Temperature Time:    0
Thermal Temp. 1 Transition Count:   80
Thermal Temp. 2 Transition Count:   20
Thermal Temp. 1 Total Time:         2792
Thermal Temp. 2 Total Time:         680

Error Information (NVMe Log 0x01, max 256 entries)
No Errors Logged

