smartctl 7.3 2022-02-28 r5338 [FreeBSD 13.1-RELEASE amd64] (local build)
Copyright (C) 2002-22, Bruce Allen, Christian Franke, www.smartmontools.org

=== START OF INFORMATION SECTION ===
Model Number:                       Asgard AN1TNVMe-M.2/80
Serial Number:                      --
Firmware Version:                   R0802C0
PCI Vendor/Subsystem ID:            0x126f
IEEE OUI Identifier:                0x000000
Controller ID:                      1
NVMe Version:                       1.3
Number of Namespaces:               1
Namespace 1 Size/Capacity:          1,024,209,543,168 [1.02 TB]
Namespace 1 Formatted LBA Size:     512
Namespace 1 IEEE EUI-64:            010000 ...
Local Time is:                      Sat Apr  8 23:03:00 2023 UTC
Firmware Updates (0x06):            3 Slots
Optional Admin Commands (0x0006):   Format Frmw_DL
Optional NVM Commands (0x005f):     Comp Wr_Unc DS_Mngmt Wr_Zero Sav/Sel_Feat Timestmp
Log Page Attributes (0x0f):         S/H_per_NS Cmd_Eff_Lg Ext_Get_Lg Telmtry_Lg
Maximum Data Transfer Size:         64 Pages
Warning  Comp. Temp. Threshold:     70 Celsius
Critical Comp. Temp. Threshold:     80 Celsius

Supported Power States
St Op     Max   Active     Idle   RL RT WL WT  Ent_Lat  Ex_Lat
 0 +     9.00W       -        -    0  0  0  0        0       0

Supported LBA Sizes (NSID 0x1)
Id Fmt  Data  Metadt  Rel_Perf
 0 +     512       0         0

=== START OF SMART DATA SECTION ===
SMART overall-health self-assessment test result: PASSED

SMART/Health Information (NVMe Log 0x02)
Critical Warning:                   0x00
Temperature:                        46 Celsius
Available Spare:                    96%
Available Spare Threshold:          10%
Percentage Used:                    0%
Data Units Read:                    15,502,835 [7.93 TB]
Data Units Written:                 30,573,156 [15.6 TB]
Host Read Commands:                 175,283,629
Host Write Commands:                211,724,397
Controller Busy Time:               654,508
Power Cycles:                       1,678
Power On Hours:                     5,124,018,153,285,616
Unsafe Shutdowns:                   275
Media and Data Integrity Errors:    1
Error Information Log Entries:      0
Warning  Comp. Temperature Time:    700
Critical Comp. Temperature Time:    0

Error Information (NVMe Log 0x01, 16 of 256 entries)
No Errors Logged

