smartctl 7.2 2020-12-30 r5155 [FreeBSD 13.0-RELEASE amd64] (local build)
Copyright (C) 2002-20, Bruce Allen, Christian Franke, www.smartmontools.org

=== START OF INFORMATION SECTION ===
Model Family:     SandForce Driven SSDs
Device Model:     Corsair Force LS SSD
Serial Number:    --
Firmware Version: S9FM02.6
User Capacity:    120,034,123,776 bytes [120 GB]
Sector Size:      512 bytes logical/physical
Rotation Rate:    Solid State Device
Form Factor:      2.5 inches
TRIM Command:     Available
Device is:        In smartctl database [for details use: -P show]
ATA Version is:   ACS-3 (minor revision not indicated)
SATA Version is:  SATA 3.1, 6.0 Gb/s (current: 6.0 Gb/s)
Local Time is:    Sat Jan  8 13:02:34 2022 EST
SMART support is: Available - device has SMART capability.
SMART support is: Enabled
AAM feature is:   Unavailable
APM feature is:   Disabled
Rd look-ahead is: Enabled
Write cache is:   Enabled
DSN feature is:   Unavailable
ATA Security is:  Disabled, frozen [SEC2]
Wt Cache Reorder: Unavailable

=== START OF READ SMART DATA SECTION ===
SMART overall-health self-assessment test result: PASSED

General SMART Values:
Offline data collection status:  (0x00)	Offline data collection activity
					was never started.
					Auto Offline Data Collection: Disabled.
Self-test execution status:      (   0)	The previous self-test routine completed
					without error or no self-test has ever 
					been run.
Total time to complete Offline 
data collection: 		(   30) seconds.
Offline data collection
capabilities: 			 (0x7b) SMART execute Offline immediate.
					Auto Offline data collection on/off support.
					Suspend Offline collection upon new
					command.
					Offline surface scan supported.
					Self-test supported.
					Conveyance Self-test supported.
					Selective Self-test supported.
SMART capabilities:            (0x0003)	Saves SMART data before entering
					power-saving mode.
					Supports SMART auto save timer.
Error logging capability:        (0x01)	Error logging supported.
					General Purpose Logging supported.
Short self-test routine 
recommended polling time: 	 (   1) minutes.
Extended self-test routine
recommended polling time: 	 (   2) minutes.
Conveyance self-test routine
recommended polling time: 	 (   2) minutes.

SMART Attributes Data Structure revision number: 16
Vendor Specific SMART Attributes with Thresholds:
ID# ATTRIBUTE_NAME          FLAGS    VALUE WORST THRESH FAIL RAW_VALUE
  1 Raw_Read_Error_Rate     PO-R--   100   100   050    -    0/0
  5 Retired_Block_Count     PO--C-   100   100   050    -    0
  9 Power_On_Hours_and_Msec -O--C-   100   100   000    -    12942h+00m+00.000s
 12 Power_Cycle_Count       -O--C-   100   100   000    -    2896
162 Unknown_SandForce_Attr  PO----   090   090   000    -    51
170 Reserve_Block_Count     -O----   100   100   000    -    189
172 Erase_Fail_Count        -O--C-   100   100   000    -    0
173 Unknown_SandForce_Attr  ------   100   100   000    -    18878468
174 Unexpect_Power_Loss_Ct  -O--C-   100   100   000    -    108
181 Program_Fail_Count      -O--C-   100   100   000    -    0
187 Reported_Uncorrect      -O--C-   100   100   000    -    0
192 Power-Off_Retract_Count -O--C-   100   100   000    -    108
194 Temperature_Celsius     PO---K   070   070   000    -    30
196 Reallocated_Event_Count ------   100   100   000    -    0
218 Unknown_SandForce_Attr  ------   100   100   000    -    0
231 SSD_Life_Left           PO--C-   100   100   000    -    90
241 Lifetime_Writes_GiB     -O--C-   100   100   000    -    13416
242 Lifetime_Reads_GiB      -O--C-   100   100   000    -    8815
                            ||||||_ K auto-keep
                            |||||__ C event count
                            ||||___ R error rate
                            |||____ S speed/performance
                            ||_____ O updated online
                            |______ P prefailure warning

General Purpose Log Directory Version 1
SMART           Log Directory Version 1 [multi-sector log support]
Address    Access  R/W   Size  Description
0x00       GPL,SL  R/O      1  Log Directory
0x01           SL  R/O      1  Summary SMART error log
0x02           SL  R/O     51  Comprehensive SMART error log
0x03       GPL     R/O     64  Ext. Comprehensive SMART error log
0x04       GPL,SL  R/O      8  Device Statistics log
0x06           SL  R/O      1  SMART self-test log
0x07       GPL     R/O      1  Extended self-test log
0x09           SL  R/W      1  Selective self-test log
0x10       GPL     R/O      1  NCQ Command Error log
0x11       GPL     R/O      1  SATA Phy Event Counters log
0x30       GPL,SL  R/O      9  IDENTIFY DEVICE data log
0x80-0x9f  GPL,SL  R/W     16  Host vendor specific log

SMART Extended Comprehensive Error Log Version: 1 (64 sectors)
No Errors Logged

SMART Extended Self-test Log Version: 1 (1 sectors)
Num  Test_Description    Status                  Remaining  LifeTime(hours)  LBA_of_first_error
# 1  Short offline       Completed without error       00%      7066         -
# 2  Extended offline    Completed without error       00%      7052         -
# 3  Extended offline    Completed without error       00%      6917         -
# 4  Short offline       Completed without error       00%      6827         -
# 5  Short offline       Completed without error       00%      6822         -
# 6  Extended offline    Completed without error       00%      6770         -
# 7  Extended offline    Completed without error       00%      6676         -
# 8  Extended offline    Completed without error       00%      6561         -
# 9  Short offline       Completed without error       00%      6462         -
#10  Short offline       Completed without error       00%      6458         -
#11  Short offline       Completed without error       00%      6453         -
#12  Short offline       Completed without error       00%      6448         -
#13  Short offline       Completed without error       00%      6440         -
#14  Extended offline    Completed without error       00%      6380         -
#15  Short offline       Completed without error       00%      6261         -
#16  Short offline       Completed without error       00%      6241         -
#17  Short offline       Completed without error       00%      6239         -
#18  Short offline       Completed without error       00%      6237         -
#19  Short offline       Completed without error       00%      6236         -

SMART Selective self-test log data structure revision number 0
Note: revision number not 1 implies that no selective self-test has ever been run
 SPAN  MIN_LBA  MAX_LBA  CURRENT_TEST_STATUS
    1        0        0  Not_testing
    2        0        0  Not_testing
    3        0        0  Not_testing
    4        0        0  Not_testing
    5        0        0  Not_testing
Selective self-test flags (0x0):
  After scanning selected spans, do NOT read-scan remainder of disk.
If Selective self-test is pending on power-up, resume after 0 minute delay.

SCT Commands not supported

Device Statistics (GP Log 0x04)
Page  Offset Size        Value Flags Description
0x07  =====  =               =  ===  == Solid State Device Statistics (rev 1) ==
0x07  0x008  1               9  ---  Percentage Used Endurance Indicator
                                |||_ C monitored condition met
                                ||__ D supports DSN
                                |___ N normalized value

Pending Defects log (GP Log 0x0c) not supported

SATA Phy Event Counters (GP Log 0x11)
ID      Size     Value  Description
0x0001  2            0  Command failed due to ICRC error
0x0003  2            0  R_ERR response for device-to-host data FIS
0x0004  2            0  R_ERR response for host-to-device data FIS
0x0006  2            0  R_ERR response for device-to-host non-data FIS
0x0007  2            0  R_ERR response for host-to-device non-data FIS
0x0008  2            0  Device-to-host non-data FIS retries
0x0009  4           18  Transition from drive PhyRdy to drive PhyNRdy
0x000a  4           19  Device-to-host register FISes sent due to a COMRESET
0x000f  2            0  R_ERR response for host-to-device data FIS, CRC
0x0010  2            0  R_ERR response for host-to-device data FIS, non-CRC
0x0012  2            0  R_ERR response for host-to-device non-data FIS, CRC
0x0013  2            0  R_ERR response for host-to-device non-data FIS, non-CRC

