smartctl 7.3 2022-02-28 r5338 [FreeBSD 13.1-RELEASE-p5 amd64] (local build)
Copyright (C) 2002-22, Bruce Allen, Christian Franke, www.smartmontools.org

=== START OF INFORMATION SECTION ===
Model Number:                       HS-SSD-E3000 256G
Serial Number:                      --
Firmware Version:                   SN08321
PCI Vendor/Subsystem ID:            0x1e4b
IEEE OUI Identifier:                0x000000
Total NVM Capacity:                 256,060,514,304 [256 GB]
Unallocated NVM Capacity:           0
Controller ID:                      0
NVMe Version:                       1.4
Number of Namespaces:               1
Namespace 1 Size/Capacity:          256,060,514,304 [256 GB]
Namespace 1 Utilization:            117,319,211,008 [117 GB]
Namespace 1 Formatted LBA Size:     512
Namespace 1 IEEE EUI-64:            000000 ...
Local Time is:                      Tue Feb  7 22:28:52 2023 +07
Firmware Updates (0x14):            2 Slots, no Reset required
Optional Admin Commands (0x0017):   Security Format Frmw_DL Self_Test
Optional NVM Commands (0x001f):     Comp Wr_Unc DS_Mngmt Wr_Zero Sav/Sel_Feat
Log Page Attributes (0x02):         Cmd_Eff_Lg
Maximum Data Transfer Size:         512 Pages
Warning  Comp. Temp. Threshold:     90 Celsius
Critical Comp. Temp. Threshold:     95 Celsius

Supported Power States
St Op     Max   Active     Idle   RL RT WL WT  Ent_Lat  Ex_Lat
 0 +     6.50W       -        -    0  0  0  0        0       0
 1 +     5.80W       -        -    1  1  1  1        0       0
 2 +     3.60W       -        -    2  2  2  2        0       0
 3 -   0.0500W       -        -    3  3  3  3     5000   10000
 4 -   0.0025W       -        -    4  4  4  4     8000   45000

Supported LBA Sizes (NSID 0x1)
Id Fmt  Data  Metadt  Rel_Perf
 0 +     512       0         0

=== START OF SMART DATA SECTION ===
SMART overall-health self-assessment test result: PASSED

SMART/Health Information (NVMe Log 0x02)
Critical Warning:                   0x00
Temperature:                        41 Celsius
Available Spare:                    100%
Available Spare Threshold:          1%
Percentage Used:                    0%
Data Units Read:                    1,189,783 [609 GB]
Data Units Written:                 1,042,482 [533 GB]
Host Read Commands:                 12,794,749
Host Write Commands:                16,181,524
Controller Busy Time:               34
Power Cycles:                       93
Power On Hours:                     547
Unsafe Shutdowns:                   53
Media and Data Integrity Errors:    0
Error Information Log Entries:      339
Warning  Comp. Temperature Time:    0
Critical Comp. Temperature Time:    0
Temperature Sensor 1:               50 Celsius
Temperature Sensor 2:               51 Celsius
Temperature Sensor 3:               52 Celsius
Temperature Sensor 4:               53 Celsius
Temperature Sensor 5:               54 Celsius
Temperature Sensor 6:               55 Celsius
Temperature Sensor 7:               56 Celsius
Temperature Sensor 8:               57 Celsius

Error Information (NVMe Log 0x01, 16 of 64 entries)
No Errors Logged

