smartctl 7.4 2023-08-01 r5530 [FreeBSD 13.2-RELEASE-p11 amd64] (local build)
Copyright (C) 2002-23, Bruce Allen, Christian Franke, www.smartmontools.org

=== START OF INFORMATION SECTION ===
Model Number:                       PC711 NVMe SK hynix 256GB
Serial Number:                      --
Firmware Version:                   41001131
PCI Vendor/Subsystem ID:            0x1c5c
IEEE OUI Identifier:                0xace42e
Controller ID:                      1
NVMe Version:                       1.3
Number of Namespaces:               1
Namespace 1 Size/Capacity:          256,060,514,304 [256 GB]
Namespace 1 Formatted LBA Size:     512
Namespace 1 IEEE EUI-64:            ace42e ...
Local Time is:                      Tue Apr 30 22:32:35 2024 UTC
Firmware Updates (0x16):            3 Slots, no Reset required
Optional Admin Commands (0x0017):   Security Format Frmw_DL Self_Test
Optional NVM Commands (0x005f):     Comp Wr_Unc DS_Mngmt Wr_Zero Sav/Sel_Feat Timestmp
Log Page Attributes (0x1e):         Cmd_Eff_Lg Ext_Get_Lg Telmtry_Lg Pers_Ev_Lg
Maximum Data Transfer Size:         64 Pages
Warning  Comp. Temp. Threshold:     83 Celsius
Critical Comp. Temp. Threshold:     85 Celsius

Supported Power States
St Op     Max   Active     Idle   RL RT WL WT  Ent_Lat  Ex_Lat
 0 +   6.3000W       -        -    0  0  0  0        5       5
 1 +   2.4000W       -        -    1  1  1  1       30      30
 2 +   1.9000W       -        -    2  2  2  2      100     100
 3 -   0.0500W       -        -    3  3  3  3     1000    1000
 4 -   0.0040W       -        -    3  3  3  3     1000    9000

Supported LBA Sizes (NSID 0x1)
Id Fmt  Data  Metadt  Rel_Perf
 0 +     512       0         0
 1 -    4096       0         0

=== START OF SMART DATA SECTION ===
SMART overall-health self-assessment test result: PASSED

SMART/Health Information (NVMe Log 0x02)
Critical Warning:                   0x00
Temperature:                        48 Celsius
Available Spare:                    100%
Available Spare Threshold:          50%
Percentage Used:                    0%
Data Units Read:                    4,475,076 [2.29 TB]
Data Units Written:                 7,696,465 [3.94 TB]
Host Read Commands:                 73,848,006
Host Write Commands:                201,796,893
Controller Busy Time:               419
Power Cycles:                       88
Power On Hours:                     4,108
Unsafe Shutdowns:                   29
Media and Data Integrity Errors:    0
Error Information Log Entries:      0
Warning  Comp. Temperature Time:    0
Critical Comp. Temperature Time:    0
Temperature Sensor 1:               41 Celsius
Temperature Sensor 2:               45 Celsius

Error Information (NVMe Log 0x01, 16 of 256 entries)
No Errors Logged

Self-test Log (NVMe Log 0x06)
Self-test status: No self-test in progress
Num  Test_Description  Status                       Power_on_Hours  Failing_LBA  NSID Seg SCT Code
 0   Short             Completed without error                   2            -     -   -   -    -
 1   Short             Completed without error                   1            -     -   -   -    -

