smartctl 7.4 2023-08-01 r5530 [FreeBSD 13.2-RELEASE-p7 amd64] (local build)
Copyright (C) 2002-23, Bruce Allen, Christian Franke, www.smartmontools.org

=== START OF INFORMATION SECTION ===
Model Family:     SanDisk based SSDs
Device Model:     SanDisk SSD U100 64GB
Serial Number:    --
LU WWN Device Id: 5 001b44 ...
Firmware Version: 10.56.00
User Capacity:    64,023,257,088 bytes [64.0 GB]
Sector Size:      512 bytes logical/physical
Rotation Rate:    Solid State Device
Form Factor:      1.8 inches
TRIM Command:     Available, deterministic
Device is:        In smartctl database 7.3/5528
ATA Version is:   ACS-2 T13/2015-D revision 3
SATA Version is:  SATA 3.0, 6.0 Gb/s (current: 6.0 Gb/s)
Local Time is:    Tue Jan  2 23:40:48 2024 CET
SMART support is: Available - device has SMART capability.
SMART support is: Enabled
AAM feature is:   Unavailable
APM feature is:   Disabled
Rd look-ahead is: Enabled
Write cache is:   Enabled
DSN feature is:   Unavailable
ATA Security is:  Disabled, frozen [SEC2]
Wt Cache Reorder: Unavailable

=== START OF READ SMART DATA SECTION ===
SMART overall-health self-assessment test result: PASSED

General SMART Values:
Offline data collection status:  (0x00)	Offline data collection activity
					was never started.
					Auto Offline Data Collection: Disabled.
Self-test execution status:      (   0)	The previous self-test routine completed
					without error or no self-test has ever 
					been run.
Total time to complete Offline 
data collection: 		(  120) seconds.
Offline data collection
capabilities: 			 (0x51) SMART execute Offline immediate.
					No Auto Offline data collection support.
					Suspend Offline collection upon new
					command.
					No Offline surface scan supported.
					Self-test supported.
					No Conveyance Self-test supported.
					Selective Self-test supported.
SMART capabilities:            (0x0003)	Saves SMART data before entering
					power-saving mode.
					Supports SMART auto save timer.
Error logging capability:        (0x01)	Error logging supported.
					General Purpose Logging supported.
Short self-test routine 
recommended polling time: 	 (   2) minutes.
Extended self-test routine
recommended polling time: 	 (  12) minutes.

SMART Attributes Data Structure revision number: 1
Vendor Specific SMART Attributes with Thresholds:
ID# ATTRIBUTE_NAME          FLAGS    VALUE WORST THRESH FAIL RAW_VALUE
  5 Reallocated_Sector_Ct   -O----   100   100   000    -    0
  9 Power_On_Hours          -O----   100   100   000    -    16697
 12 Power_Cycle_Count       -O----   100   100   000    -    4000
171 Program_Fail_Count      -O----   100   100   000    -    0
172 Erase_Fail_Count        -O----   100   100   000    -    0
173 Avg_Write/Erase_Count   -O----   100   100   000    -    172
174 Unexpect_Power_Loss_Ct  -O----   100   100   000    -    257
187 Reported_Uncorrect      -O----   100   100   000    -    46
230 Perc_Write/Erase_Count  -O----   100   100   000    -    573
232 Perc_Avail_Resrvd_Space PO----   100   100   005    -    0
234 Perc_Write/Erase_Ct_BC  -O----   100   100   000    -    2042
241 Total_LBAs_Written      -O----   100   100   000    -    7835726087
242 Total_LBAs_Read         -O----   100   100   000    -    65279825
                            ||||||_ K auto-keep
                            |||||__ C event count
                            ||||___ R error rate
                            |||____ S speed/performance
                            ||_____ O updated online
                            |______ P prefailure warning

General Purpose Log Directory Version 1
SMART           Log Directory Version 1 [multi-sector log support]
Address    Access  R/W   Size  Description
0x00       GPL,SL  R/O      1  Log Directory
0x01       GPL,SL  R/O      1  Summary SMART error log
0x03       GPL,SL  R/O     16  Ext. Comprehensive SMART error log
0x04       GPL,SL  R/O      8  Device Statistics log
0x06       GPL,SL  R/O      1  SMART self-test log
0x10       GPL,SL  R/O      1  NCQ Command Error log
0x11       GPL,SL  R/O      1  SATA Phy Event Counters log
0x30       GPL,SL  R/O      9  IDENTIFY DEVICE data log
0x80-0x9f  GPL,SL  R/W     16  Host vendor specific log
0xa1       GPL,SL  VS       1  Device vendor specific log
0xa2       GPL,SL  VS       2  Device vendor specific log
0xa3       GPL,SL  VS       1  Device vendor specific log

SMART Extended Comprehensive Error Log Version: 1 (16 sectors)
Device Error Count: 46
	CR     = Command Register
	FEATR  = Features Register
	COUNT  = Count (was: Sector Count) Register
	LBA_48 = Upper bytes of LBA High/Mid/Low Registers ]  ATA-8
	LH     = LBA High (was: Cylinder High) Register    ]   LBA
	LM     = LBA Mid (was: Cylinder Low) Register      ] Register
	LL     = LBA Low (was: Sector Number) Register     ]
	DV     = Device (was: Device/Head) Register
	DC     = Device Control Register
	ER     = Error register
	ST     = Status register
Powered_Up_Time is measured from power on, and printed as
DDd+hh:mm:SS.sss where DD=days, hh=hours, mm=minutes,
SS=sec, and sss=millisec. It "wraps" after 49.710 days.

Error 46 [45] occurred at disk power-on lifetime: 688 hours (28 days + 16 hours)
  When the command that caused the error occurred, the device was active or idle.

  After command completion occurred, registers were:
  ER -- ST COUNT  LBA_48  LH LM LL DV DC
  -- -- -- == -- == == == -- -- -- -- --
  40 -- 51 00 00 00 00 00 0c 9c 40 00 00

  Commands leading to the command that caused the error were:
  CR FEATR COUNT  LBA_48  LH LM LL DV DC  Powered_Up_Time  Command/Feature_Name
  -- == -- == -- == == == -- -- -- -- --  ---------------  --------------------
  ea 00 00 00 00 00 00 00 00 00 00 00 00     00:01:06.295  FLUSH CACHE EXT
  ea 00 00 00 00 00 00 00 00 00 00 00 00     00:01:05.854  FLUSH CACHE EXT
  ea 00 00 00 00 00 00 00 00 00 00 00 00     00:01:05.734  FLUSH CACHE EXT
  ea 00 00 00 00 00 00 00 00 00 00 00 00     00:01:05.658  FLUSH CACHE EXT
  ea 00 00 00 00 00 00 00 00 00 00 00 00     00:01:05.508  FLUSH CACHE EXT

Error 45 [44] occurred at disk power-on lifetime: 592 hours (24 days + 16 hours)
  When the command that caused the error occurred, the device was active or idle.

  After command completion occurred, registers were:
  ER -- ST COUNT  LBA_48  LH LM LL DV DC
  -- -- -- == -- == == == -- -- -- -- --
  40 -- 51 00 00 00 00 00 16 6f 10 28 00  Error: UNC

  Commands leading to the command that caused the error were:
  CR FEATR COUNT  LBA_48  LH LM LL DV DC  Powered_Up_Time  Command/Feature_Name
  -- == -- == -- == == == -- -- -- -- --  ---------------  --------------------
  2f 00 00 00 01 00 00 00 00 00 10 28 00     00:09:19.089  READ LOG EXT
  2f 00 00 00 01 00 00 00 00 00 10 28 00     00:09:19.035  READ LOG EXT
  ea 00 00 00 00 00 00 00 00 00 00 00 00     00:09:18.991  FLUSH CACHE EXT
  ea 00 00 00 00 00 00 00 00 00 00 00 00     00:09:18.990  FLUSH CACHE EXT
  ea 00 00 00 00 00 00 00 00 00 00 00 00     00:09:18.973  FLUSH CACHE EXT

Error 44 [43] occurred at disk power-on lifetime: 592 hours (24 days + 16 hours)
  When the command that caused the error occurred, the device was active or idle.

  After command completion occurred, registers were:
  ER -- ST COUNT  LBA_48  LH LM LL DV DC
  -- -- -- == -- == == == -- -- -- -- --
  40 -- 51 00 00 00 00 00 16 6f 10 28 00  Error: UNC

  Commands leading to the command that caused the error were:
  CR FEATR COUNT  LBA_48  LH LM LL DV DC  Powered_Up_Time  Command/Feature_Name
  -- == -- == -- == == == -- -- -- -- --  ---------------  --------------------
  2f 00 00 00 01 00 00 00 00 00 10 28 00     00:09:19.035  READ LOG EXT
  ea 00 00 00 00 00 00 00 00 00 00 00 00     00:09:18.991  FLUSH CACHE EXT
  ea 00 00 00 00 00 00 00 00 00 00 00 00     00:09:18.990  FLUSH CACHE EXT
  ea 00 00 00 00 00 00 00 00 00 00 00 00     00:09:18.973  FLUSH CACHE EXT
  ea 00 00 00 00 00 00 00 00 00 00 00 00     00:09:18.964  FLUSH CACHE EXT

Error 43 [42] occurred at disk power-on lifetime: 592 hours (24 days + 16 hours)
  When the command that caused the error occurred, the device was active or idle.

  After command completion occurred, registers were:
  ER -- ST COUNT  LBA_48  LH LM LL DV DC
  -- -- -- == -- == == == -- -- -- -- --
  40 -- 51 00 80 00 00 00 16 6f 90 00 00

  Commands leading to the command that caused the error were:
  CR FEATR COUNT  LBA_48  LH LM LL DV DC  Powered_Up_Time  Command/Feature_Name
  -- == -- == -- == == == -- -- -- -- --  ---------------  --------------------
  ea 00 00 00 00 00 00 00 00 00 00 00 00     00:09:18.991  FLUSH CACHE EXT
  ea 00 00 00 00 00 00 00 00 00 00 00 00     00:09:18.990  FLUSH CACHE EXT
  ea 00 00 00 00 00 00 00 00 00 00 00 00     00:09:18.973  FLUSH CACHE EXT
  ea 00 00 00 00 00 00 00 00 00 00 00 00     00:09:18.964  FLUSH CACHE EXT
  ea 00 00 00 00 00 00 00 00 00 00 00 00     00:09:18.899  FLUSH CACHE EXT

Error 42 [41] occurred at disk power-on lifetime: 589 hours (24 days + 13 hours)
  When the command that caused the error occurred, the device was active or idle.

  After command completion occurred, registers were:
  ER -- ST COUNT  LBA_48  LH LM LL DV DC
  -- -- -- == -- == == == -- -- -- -- --
  40 -- 51 00 00 00 00 00 00 00 00 28 00  Error: UNC

  Commands leading to the command that caused the error were:
  CR FEATR COUNT  LBA_48  LH LM LL DV DC  Powered_Up_Time  Command/Feature_Name
  -- == -- == -- == == == -- -- -- -- --  ---------------  --------------------
  2f 00 00 00 01 00 00 00 00 00 10 28 00     00:17:45.927  READ LOG EXT
  ea 00 00 00 00 00 00 00 00 00 00 00 00     00:17:45.310  FLUSH CACHE EXT
  ea 00 00 00 00 00 00 00 00 00 00 00 00     00:17:45.308  FLUSH CACHE EXT
  ea 00 00 00 00 00 00 00 00 00 00 00 00     00:17:45.277  FLUSH CACHE EXT
  ea 00 00 00 00 00 00 00 00 00 00 00 00     00:17:45.274  FLUSH CACHE EXT

Error 41 [40] occurred at disk power-on lifetime: 589 hours (24 days + 13 hours)
  When the command that caused the error occurred, the device was active or idle.

  After command completion occurred, registers were:
  ER -- ST COUNT  LBA_48  LH LM LL DV DC
  -- -- -- == -- == == == -- -- -- -- --
  40 -- 51 00 00 00 00 00 00 00 00 00 00

  Commands leading to the command that caused the error were:
  CR FEATR COUNT  LBA_48  LH LM LL DV DC  Powered_Up_Time  Command/Feature_Name
  -- == -- == -- == == == -- -- -- -- --  ---------------  --------------------
  ea 00 00 00 00 00 00 00 00 00 00 00 00     00:17:45.310  FLUSH CACHE EXT
  ea 00 00 00 00 00 00 00 00 00 00 00 00     00:17:45.308  FLUSH CACHE EXT
  ea 00 00 00 00 00 00 00 00 00 00 00 00     00:17:45.277  FLUSH CACHE EXT
  ea 00 00 00 00 00 00 00 00 00 00 00 00     00:17:45.274  FLUSH CACHE EXT
  ea 00 00 00 00 00 00 00 00 00 00 00 00     00:17:45.270  FLUSH CACHE EXT

Error 40 [39] occurred at disk power-on lifetime: 589 hours (24 days + 13 hours)
  When the command that caused the error occurred, the device was active or idle.

  After command completion occurred, registers were:
  ER -- ST COUNT  LBA_48  LH LM LL DV DC
  -- -- -- == -- == == == -- -- -- -- --
  40 -- 51 00 80 00 00 00 00 00 80 40 00

  Commands leading to the command that caused the error were:
  CR FEATR COUNT  LBA_48  LH LM LL DV DC  Powered_Up_Time  Command/Feature_Name
  -- == -- == -- == == == -- -- -- -- --  ---------------  --------------------
  06 00 01 00 01 00 00 00 00 00 00 40 00     00:17:36.438  DATA SET MANAGEMENT
  06 00 01 00 01 00 00 00 00 00 00 40 00     00:17:36.438  DATA SET MANAGEMENT
  06 00 01 00 01 00 00 00 00 00 00 40 00     00:17:36.438  DATA SET MANAGEMENT
  06 00 01 00 01 00 00 00 00 00 00 40 00     00:17:36.438  DATA SET MANAGEMENT
  06 00 01 00 01 00 00 00 00 00 00 40 00     00:17:36.437  DATA SET MANAGEMENT

Error 39 [38] occurred at disk power-on lifetime: 589 hours (24 days + 13 hours)
  When the command that caused the error occurred, the device was active or idle.

  After command completion occurred, registers were:
  ER -- ST COUNT  LBA_48  LH LM LL DV DC
  -- -- -- == -- == == == -- -- -- -- --
  40 -- 51 00 80 00 00 00 00 00 80 00 00

  Commands leading to the command that caused the error were:
  CR FEATR COUNT  LBA_48  LH LM LL DV DC  Powered_Up_Time  Command/Feature_Name
  -- == -- == -- == == == -- -- -- -- --  ---------------  --------------------
  ea 00 00 00 00 00 00 00 00 00 00 00 00     00:17:12.157  FLUSH CACHE EXT
  ea 00 00 00 00 00 00 00 00 00 00 00 00     00:17:08.054  FLUSH CACHE EXT
  ea 00 00 00 00 00 00 00 00 00 00 00 00     00:17:08.052  FLUSH CACHE EXT
  ea 00 00 00 00 00 00 00 00 00 00 00 00     00:17:08.052  FLUSH CACHE EXT
  ea 00 00 00 00 00 00 00 00 00 00 00 00     00:17:08.051  FLUSH CACHE EXT

SMART Extended Self-test Log (GP Log 0x07) not supported

SMART Self-test log structure revision number 1
No self-tests have been logged.  [To run self-tests, use: smartctl -t]

SMART Selective self-test log data structure revision number 1
 SPAN  MIN_LBA  MAX_LBA  CURRENT_TEST_STATUS
    1        0        0  Not_testing
    2        0        0  Not_testing
    3        0        0  Not_testing
    4        0        0  Not_testing
    5        0        0  Not_testing
Selective self-test flags (0x0):
  After scanning selected spans, do NOT read-scan remainder of disk.
If Selective self-test is pending on power-up, resume after 0 minute delay.

SCT Commands not supported

Device Statistics (GP Log 0x04)
Page  Offset Size        Value Flags Description
0x05  =====  =               =  ===  == Temperature Statistics (rev 1) ==
0x05  0x008  1              38  ---  Current Temperature
0x05  0x010  1              38  ---  Average Short Term Temperature
0x05  0x018  1              38  ---  Average Long Term Temperature
0x05  0x020  1              60  ---  Highest Temperature
0x05  0x028  1               9  ---  Lowest Temperature
0x05  0x030  1              42  ---  Highest Average Short Term Temperature
0x05  0x038  1              42  ---  Lowest Average Short Term Temperature
0x05  0x040  1              40  ---  Highest Average Long Term Temperature
0x05  0x048  1              40  ---  Lowest Average Long Term Temperature
0x05  0x050  4               0  ---  Time in Over-Temperature
0x05  0x058  1              95  ---  Specified Maximum Operating Temperature
0x05  0x060  4               0  ---  Time in Under-Temperature
0x05  0x068  1               0  ---  Specified Minimum Operating Temperature
0x07  =====  =               =  ===  == Solid State Device Statistics (rev 1) ==
0x07  0x008  1               5  N--  Percentage Used Endurance Indicator
                                |||_ C monitored condition met
                                ||__ D supports DSN
                                |___ N normalized value

Pending Defects log (GP Log 0x0c) not supported

SATA Phy Event Counters (GP Log 0x11)
ID      Size     Value  Description
0x0003  2            0  R_ERR response for device-to-host data FIS
0x0004  2            0  R_ERR response for host-to-device data FIS
0x0006  2            0  R_ERR response for device-to-host non-data FIS
0x0007  2            0  R_ERR response for host-to-device non-data FIS
0x0009  2           26  Transition from drive PhyRdy to drive PhyNRdy
0x000a  2           27  Device-to-host register FISes sent due to a COMRESET
0x000f  2            0  R_ERR response for host-to-device data FIS, CRC
0x0012  2            0  R_ERR response for host-to-device non-data FIS, CRC
0x0001  2            0  Command failed due to ICRC error

