smartctl 7.1 2019-12-30 r5022 [FreeBSD 12.2-RELEASE amd64] (local build)
Copyright (C) 2002-19, Bruce Allen, Christian Franke, www.smartmontools.org

=== START OF INFORMATION SECTION ===
Device Model:     Apacer AS330 240GB
Serial Number:    --
Firmware Version: AP223PD0
User Capacity:    240,057,409,536 bytes [240 GB]
Sector Size:      512 bytes logical/physical
Rotation Rate:    Solid State Device
Form Factor:      2.5 inches
Device is:        Not in smartctl database [for details use: -P showall]
ATA Version is:   ACS-2 (minor revision not indicated)
SATA Version is:  SATA 3.1, 6.0 Gb/s (current: 6.0 Gb/s)
Local Time is:    Thu Dec 17 05:42:33 2020 AEDT
SMART support is: Available - device has SMART capability.
SMART support is: Enabled
AAM feature is:   Unavailable
APM level is:     254 (maximum performance)
Rd look-ahead is: Enabled
Write cache is:   Enabled
DSN feature is:   Unavailable
ATA Security is:  Disabled, NOT FROZEN [SEC1]
Wt Cache Reorder: Unavailable

=== START OF READ SMART DATA SECTION ===
SMART Status not supported: Incomplete response, ATA output registers missing
SMART overall-health self-assessment test result: PASSED
Warning: This result is based on an Attribute check.

General SMART Values:
Offline data collection status:  (0x00)	Offline data collection activity
					was never started.
					Auto Offline Data Collection: Disabled.
Self-test execution status:      (   0)	The previous self-test routine completed
					without error or no self-test has ever 
					been run.
Total time to complete Offline 
data collection: 		(   30) seconds.
Offline data collection
capabilities: 			 (0x79) SMART execute Offline immediate.
					No Auto Offline data collection support.
					Suspend Offline collection upon new
					command.
					Offline surface scan supported.
					Self-test supported.
					Conveyance Self-test supported.
					Selective Self-test supported.
SMART capabilities:            (0x0003)	Saves SMART data before entering
					power-saving mode.
					Supports SMART auto save timer.
Error logging capability:        (0x01)	Error logging supported.
					General Purpose Logging supported.
Short self-test routine 
recommended polling time: 	 (   1) minutes.
Extended self-test routine
recommended polling time: 	 (   2) minutes.
Conveyance self-test routine
recommended polling time: 	 (   3) minutes.

SMART Attributes Data Structure revision number: 16
Vendor Specific SMART Attributes with Thresholds:
ID# ATTRIBUTE_NAME          FLAGS    VALUE WORST THRESH FAIL RAW_VALUE
  9 Power_On_Hours          -O--CK   100   100   000    -    24149
 12 Power_Cycle_Count       -O--CK   100   100   000    -    1146
163 Unknown_Attribute       -O--CK   100   100   000    -    230
164 Unknown_Attribute       -O--CK   100   100   000    -    160
166 Unknown_Attribute       -O--CK   100   100   000    -    14
167 Unknown_Attribute       -O--CK   100   100   000    -    0
168 Unknown_Attribute       -O--CK   100   100   000    -    57148
171 Unknown_Attribute       -O--CK   100   100   ---    -    0
172 Unknown_Attribute       -O--CK   100   100   000    -    0
175 Program_Fail_Count_Chip -O--CK   100   100   050    -    31438
192 Power-Off_Retract_Count -O--CK   100   100   000    -    868
194 Temperature_Celsius     -O---K   098   098   057    -    30 (Min/Max 30/30)
231 Temperature_Celsius     -O--C-   100   100   000    -    95
241 Total_LBAs_Written      -O--CK   100   100   000    -    49510100959
                            ||||||_ K auto-keep
                            |||||__ C event count
                            ||||___ R error rate
                            |||____ S speed/performance
                            ||_____ O updated online
                            |______ P prefailure warning

General Purpose Log Directory Version 1
SMART           Log Directory Version 1 [multi-sector log support]
Address    Access  R/W   Size  Description
0x00       GPL,SL  R/O      1  Log Directory
0x01           SL  R/O      1  Summary SMART error log
0x02           SL  R/O     51  Comprehensive SMART error log
0x03       GPL     R/O     64  Ext. Comprehensive SMART error log
0x04       GPL,SL  R/O      6  Device Statistics log
0x06           SL  R/O      1  SMART self-test log
0x07       GPL     R/O      1  Extended self-test log
0x09           SL  R/W      1  Selective self-test log
0x10       GPL     R/O      1  NCQ Command Error log
0x11       GPL     R/O      1  SATA Phy Event Counters log
0x30       GPL,SL  R/O      8  IDENTIFY DEVICE data log
0x80-0x9f  GPL,SL  R/W     16  Host vendor specific log
0xe0       GPL,SL  R/W      1  SCT Command/Status
0xe1       GPL,SL  R/W      1  SCT Data Transfer

SMART Extended Comprehensive Error Log Version: 1 (64 sectors)
Device Error Count: 31438 (device log contains only the most recent 256 errors)
	CR     = Command Register
	FEATR  = Features Register
	COUNT  = Count (was: Sector Count) Register
	LBA_48 = Upper bytes of LBA High/Mid/Low Registers ]  ATA-8
	LH     = LBA High (was: Cylinder High) Register    ]   LBA
	LM     = LBA Mid (was: Cylinder Low) Register      ] Register
	LL     = LBA Low (was: Sector Number) Register     ]
	DV     = Device (was: Device/Head) Register
	DC     = Device Control Register
	ER     = Error register
	ST     = Status register
Powered_Up_Time is measured from power on, and printed as
DDd+hh:mm:SS.sss where DD=days, hh=hours, mm=minutes,
SS=sec, and sss=millisec. It "wraps" after 49.710 days.

Error 31438 [205] occurred at disk power-on lifetime: 18195 hours (758 days + 3 hours)
  When the command that caused the error occurred, the device was active or idle.

  After command completion occurred, registers were:
  ER -- ST COUNT  LBA_48  LH LM LL DV DC
  -- -- -- == -- == == == -- -- -- -- --
  40 -- 51 00 38 00 00 01 19 3d 90 40 00  Error: UNC 56 sectors at LBA = 0x01193d90 = 18431376

  Commands leading to the command that caused the error were:
  CR FEATR COUNT  LBA_48  LH LM LL DV DC  Powered_Up_Time  Command/Feature_Name
  -- == -- == -- == == == -- -- -- -- --  ---------------  --------------------
  25 00 00 00 38 00 00 01 19 3d 90 40 00  2d+04:27:53.466  READ DMA EXT
  25 00 00 00 38 00 00 01 19 3d 90 40 00  2d+04:27:53.457  READ DMA EXT
  25 00 00 00 38 00 00 01 19 3d 90 40 00  2d+04:27:52.752  READ DMA EXT
  25 00 00 00 38 00 00 01 19 3d 90 40 00  2d+04:27:52.744  READ DMA EXT
  25 00 00 00 38 00 00 01 19 3d 90 40 00  2d+04:27:52.002  READ DMA EXT

Error 31437 [204] occurred at disk power-on lifetime: 18195 hours (758 days + 3 hours)
  When the command that caused the error occurred, the device was active or idle.

  After command completion occurred, registers were:
  ER -- ST COUNT  LBA_48  LH LM LL DV DC
  -- -- -- == -- == == == -- -- -- -- --
  40 -- 51 00 38 00 00 01 19 3d 90 40 00  Error: UNC 56 sectors at LBA = 0x01193d90 = 18431376

  Commands leading to the command that caused the error were:
  CR FEATR COUNT  LBA_48  LH LM LL DV DC  Powered_Up_Time  Command/Feature_Name
  -- == -- == -- == == == -- -- -- -- --  ---------------  --------------------
  25 00 00 00 38 00 00 01 19 3d 90 40 00  2d+04:27:53.457  READ DMA EXT
  25 00 00 00 38 00 00 01 19 3d 90 40 00  2d+04:27:52.752  READ DMA EXT
  25 00 00 00 38 00 00 01 19 3d 90 40 00  2d+04:27:52.744  READ DMA EXT
  25 00 00 00 38 00 00 01 19 3d 90 40 00  2d+04:27:52.002  READ DMA EXT
  25 00 00 00 38 00 00 01 19 3d 90 40 00  2d+04:27:51.994  READ DMA EXT

Error 31436 [203] occurred at disk power-on lifetime: 18195 hours (758 days + 3 hours)
  When the command that caused the error occurred, the device was active or idle.

  After command completion occurred, registers were:
  ER -- ST COUNT  LBA_48  LH LM LL DV DC
  -- -- -- == -- == == == -- -- -- -- --
  40 -- 51 00 38 00 00 01 19 3d 90 40 00  Error: UNC 56 sectors at LBA = 0x01193d90 = 18431376

  Commands leading to the command that caused the error were:
  CR FEATR COUNT  LBA_48  LH LM LL DV DC  Powered_Up_Time  Command/Feature_Name
  -- == -- == -- == == == -- -- -- -- --  ---------------  --------------------
  25 00 00 00 38 00 00 01 19 3d 90 40 00  2d+04:27:52.752  READ DMA EXT
  25 00 00 00 38 00 00 01 19 3d 90 40 00  2d+04:27:52.744  READ DMA EXT
  25 00 00 00 38 00 00 01 19 3d 90 40 00  2d+04:27:52.002  READ DMA EXT
  25 00 00 00 38 00 00 01 19 3d 90 40 00  2d+04:27:51.994  READ DMA EXT
  25 00 00 00 38 00 00 01 19 3d 90 40 00  2d+04:27:51.262  READ DMA EXT

Error 31435 [202] occurred at disk power-on lifetime: 18195 hours (758 days + 3 hours)
  When the command that caused the error occurred, the device was active or idle.

  After command completion occurred, registers were:
  ER -- ST COUNT  LBA_48  LH LM LL DV DC
  -- -- -- == -- == == == -- -- -- -- --
  40 -- 51 00 38 00 00 01 19 3d 90 40 00  Error: UNC 56 sectors at LBA = 0x01193d90 = 18431376

  Commands leading to the command that caused the error were:
  CR FEATR COUNT  LBA_48  LH LM LL DV DC  Powered_Up_Time  Command/Feature_Name
  -- == -- == -- == == == -- -- -- -- --  ---------------  --------------------
  25 00 00 00 38 00 00 01 19 3d 90 40 00  2d+04:27:52.744  READ DMA EXT
  25 00 00 00 38 00 00 01 19 3d 90 40 00  2d+04:27:52.002  READ DMA EXT
  25 00 00 00 38 00 00 01 19 3d 90 40 00  2d+04:27:51.994  READ DMA EXT
  25 00 00 00 38 00 00 01 19 3d 90 40 00  2d+04:27:51.262  READ DMA EXT
  25 00 00 00 38 00 00 01 19 3d 90 40 00  2d+04:27:51.253  READ DMA EXT

Error 31434 [201] occurred at disk power-on lifetime: 18195 hours (758 days + 3 hours)
  When the command that caused the error occurred, the device was active or idle.

  After command completion occurred, registers were:
  ER -- ST COUNT  LBA_48  LH LM LL DV DC
  -- -- -- == -- == == == -- -- -- -- --
  40 -- 51 00 38 00 00 01 19 3d 90 40 00  Error: UNC 56 sectors at LBA = 0x01193d90 = 18431376

  Commands leading to the command that caused the error were:
  CR FEATR COUNT  LBA_48  LH LM LL DV DC  Powered_Up_Time  Command/Feature_Name
  -- == -- == -- == == == -- -- -- -- --  ---------------  --------------------
  25 00 00 00 38 00 00 01 19 3d 90 40 00  2d+04:27:52.002  READ DMA EXT
  25 00 00 00 38 00 00 01 19 3d 90 40 00  2d+04:27:51.994  READ DMA EXT
  25 00 00 00 38 00 00 01 19 3d 90 40 00  2d+04:27:51.262  READ DMA EXT
  25 00 00 00 38 00 00 01 19 3d 90 40 00  2d+04:27:51.253  READ DMA EXT
  25 00 00 00 38 00 00 01 19 3d 90 40 00  2d+04:27:50.516  READ DMA EXT

Error 31433 [200] occurred at disk power-on lifetime: 18195 hours (758 days + 3 hours)
  When the command that caused the error occurred, the device was active or idle.

  After command completion occurred, registers were:
  ER -- ST COUNT  LBA_48  LH LM LL DV DC
  -- -- -- == -- == == == -- -- -- -- --
  40 -- 51 00 38 00 00 01 19 3d 90 40 00  Error: UNC 56 sectors at LBA = 0x01193d90 = 18431376

  Commands leading to the command that caused the error were:
  CR FEATR COUNT  LBA_48  LH LM LL DV DC  Powered_Up_Time  Command/Feature_Name
  -- == -- == -- == == == -- -- -- -- --  ---------------  --------------------
  25 00 00 00 38 00 00 01 19 3d 90 40 00  2d+04:27:51.994  READ DMA EXT
  25 00 00 00 38 00 00 01 19 3d 90 40 00  2d+04:27:51.262  READ DMA EXT
  25 00 00 00 38 00 00 01 19 3d 90 40 00  2d+04:27:51.253  READ DMA EXT
  25 00 00 00 38 00 00 01 19 3d 90 40 00  2d+04:27:50.516  READ DMA EXT
  25 00 00 00 38 00 00 01 19 3d 90 40 00  2d+04:27:50.507  READ DMA EXT

Error 31432 [199] occurred at disk power-on lifetime: 18195 hours (758 days + 3 hours)
  When the command that caused the error occurred, the device was active or idle.

  After command completion occurred, registers were:
  ER -- ST COUNT  LBA_48  LH LM LL DV DC
  -- -- -- == -- == == == -- -- -- -- --
  40 -- 51 00 38 00 00 01 19 3d 90 40 00  Error: UNC 56 sectors at LBA = 0x01193d90 = 18431376

  Commands leading to the command that caused the error were:
  CR FEATR COUNT  LBA_48  LH LM LL DV DC  Powered_Up_Time  Command/Feature_Name
  -- == -- == -- == == == -- -- -- -- --  ---------------  --------------------
  25 00 00 00 38 00 00 01 19 3d 90 40 00  2d+04:27:51.262  READ DMA EXT
  25 00 00 00 38 00 00 01 19 3d 90 40 00  2d+04:27:51.253  READ DMA EXT
  25 00 00 00 38 00 00 01 19 3d 90 40 00  2d+04:27:50.516  READ DMA EXT
  25 00 00 00 38 00 00 01 19 3d 90 40 00  2d+04:27:50.507  READ DMA EXT
  25 00 00 00 38 00 00 01 19 3d 90 40 00  2d+04:27:49.757  READ DMA EXT

Error 31431 [198] occurred at disk power-on lifetime: 18195 hours (758 days + 3 hours)
  When the command that caused the error occurred, the device was active or idle.

  After command completion occurred, registers were:
  ER -- ST COUNT  LBA_48  LH LM LL DV DC
  -- -- -- == -- == == == -- -- -- -- --
  40 -- 51 00 38 00 00 01 19 3d 90 40 00  Error: UNC 56 sectors at LBA = 0x01193d90 = 18431376

  Commands leading to the command that caused the error were:
  CR FEATR COUNT  LBA_48  LH LM LL DV DC  Powered_Up_Time  Command/Feature_Name
  -- == -- == -- == == == -- -- -- -- --  ---------------  --------------------
  25 00 00 00 38 00 00 01 19 3d 90 40 00  2d+04:27:51.253  READ DMA EXT
  25 00 00 00 38 00 00 01 19 3d 90 40 00  2d+04:27:50.516  READ DMA EXT
  25 00 00 00 38 00 00 01 19 3d 90 40 00  2d+04:27:50.507  READ DMA EXT
  25 00 00 00 38 00 00 01 19 3d 90 40 00  2d+04:27:49.757  READ DMA EXT
  25 00 00 00 38 00 00 01 19 3d 90 40 00  2d+04:27:49.282  READ DMA EXT

SMART Extended Self-test Log Version: 1 (1 sectors)
No self-tests have been logged.  [To run self-tests, use: smartctl -t]

SMART Selective self-test log data structure revision number 1
 SPAN  MIN_LBA  MAX_LBA  CURRENT_TEST_STATUS
    1        0        0  Not_testing
    2        0        0  Not_testing
    3        0        0  Not_testing
    4        0        0  Not_testing
    5        0        0  Not_testing
Selective self-test flags (0x0):
  After scanning selected spans, do NOT read-scan remainder of disk.
If Selective self-test is pending on power-up, resume after 0 minute delay.

SCT Commands not supported

Device Statistics (GP Log 0x04)
Page  Offset Size        Value Flags Description
0x01  =====  =               =  ===  == General Statistics (rev 2) ==
0x01  0x008  4            1146  ---  Lifetime Power-On Resets
0x01  0x010  4           24149  ---  Power-on Hours
0x01  0x018  6     49510100959  ---  Logical Sectors Written
0x01  0x020  6       680878129  ---  Number of Write Commands
0x01  0x028  6     49355969506  ---  Logical Sectors Read
0x01  0x030  6       655439865  ---  Number of Read Commands
0x04  =====  =               =  ===  == General Errors Statistics (rev 1) ==
0x04  0x008  4           31438  ---  Number of Reported Uncorrectable Errors
0x04  0x010  4             215  ---  Resets Between Cmd Acceptance and Completion
0x05  =====  =               =  ===  == Temperature Statistics (rev 1) ==
0x05  0x008  1              32  ---  Current Temperature
0x05  0x010  1              32  ---  Average Short Term Temperature
0x05  0x018  1              32  ---  Average Long Term Temperature
0x05  0x020  1              50  ---  Highest Temperature
0x05  0x028  1               5  ---  Lowest Temperature
0x05  0x030  1              50  ---  Highest Average Short Term Temperature
0x05  0x038  1              16  ---  Lowest Average Short Term Temperature
0x05  0x040  1              50  ---  Highest Average Long Term Temperature
0x05  0x048  1              16  ---  Lowest Average Long Term Temperature
0x05  0x050  4               0  ---  Time in Over-Temperature
0x05  0x058  1              50  ---  Specified Maximum Operating Temperature
0x05  0x060  4               0  ---  Time in Under-Temperature
0x05  0x068  1               5  ---  Specified Minimum Operating Temperature
0x06  =====  =               =  ===  == Transport Statistics (rev 1) ==
0x06  0x008  4           56371  ---  Number of Hardware Resets
0x06  0x018  4           45815  ---  Number of Interface CRC Errors
0x07  =====  =               =  ===  == Solid State Device Statistics (rev 1) ==
0x07  0x008  1               5  ---  Percentage Used Endurance Indicator
                                |||_ C monitored condition met
                                ||__ D supports DSN
                                |___ N normalized value

Pending Defects log (GP Log 0x0c) not supported

SATA Phy Event Counters (GP Log 0x11)
ID      Size     Value  Description
0x0001  2            0  Command failed due to ICRC error
0x0003  2            0  R_ERR response for device-to-host data FIS
0x0004  2            0  R_ERR response for host-to-device data FIS
0x0006  2            0  R_ERR response for device-to-host non-data FIS
0x0007  2            0  R_ERR response for host-to-device non-data FIS
0x0008  2            0  Device-to-host non-data FIS retries
0x0009  4            1  Transition from drive PhyRdy to drive PhyNRdy
0x000a  4            2  Device-to-host register FISes sent due to a COMRESET
0x000f  2            0  R_ERR response for host-to-device data FIS, CRC
0x0010  2            0  R_ERR response for host-to-device data FIS, non-CRC
0x0012  2            0  R_ERR response for host-to-device non-data FIS, CRC
0x0013  2            0  R_ERR response for host-to-device non-data FIS, non-CRC

