smartctl 7.3 2022-02-28 r5338 [FreeBSD 13.1-RELEASE amd64] (local build)
Copyright (C) 2002-22, Bruce Allen, Christian Franke, www.smartmontools.org

=== START OF INFORMATION SECTION ===
Model Family:     Hitachi/HGST Travelstar 7K750
Device Model:     HTS727550A9E364
Serial Number:    --
LU WWN Device Id: 5 000cca ...
Firmware Version: JF3OA0E0
User Capacity:    500,107,862,016 bytes [500 GB]
Sector Sizes:     512 bytes logical, 4096 bytes physical
Rotation Rate:    7200 rpm
Form Factor:      2.5 inches
Device is:        In smartctl database 7.3/5319
ATA Version is:   ATA8-ACS T13/1699-D revision 6
SATA Version is:  SATA 2.6, 3.0 Gb/s
Local Time is:    Sun Jun 19 06:23:44 2022 EDT
SMART support is: Available - device has SMART capability.
SMART support is: Enabled
AAM feature is:   Unavailable
APM level is:     128 (minimum power consumption without standby)
Rd look-ahead is: Enabled
Write cache is:   Enabled
DSN feature is:   Unavailable
ATA Security is:  Disabled, frozen [SEC2]
Wt Cache Reorder: Enabled

=== START OF READ SMART DATA SECTION ===
SMART overall-health self-assessment test result: PASSED
See vendor-specific Attribute list for marginal Attributes.

General SMART Values:
Offline data collection status:  (0x00)	Offline data collection activity
					was never started.
					Auto Offline Data Collection: Disabled.
Self-test execution status:      (   0)	The previous self-test routine completed
					without error or no self-test has ever 
					been run.
Total time to complete Offline 
data collection: 		(   45) seconds.
Offline data collection
capabilities: 			 (0x51) SMART execute Offline immediate.
					No Auto Offline data collection support.
					Suspend Offline collection upon new
					command.
					No Offline surface scan supported.
					Self-test supported.
					No Conveyance Self-test supported.
					Selective Self-test supported.
SMART capabilities:            (0x0003)	Saves SMART data before entering
					power-saving mode.
					Supports SMART auto save timer.
Error logging capability:        (0x01)	Error logging supported.
					General Purpose Logging supported.
Short self-test routine 
recommended polling time: 	 (   2) minutes.
Extended self-test routine
recommended polling time: 	 ( 116) minutes.
SCT capabilities: 	       (0x003d)	SCT Status supported.
					SCT Error Recovery Control supported.
					SCT Feature Control supported.
					SCT Data Table supported.

SMART Attributes Data Structure revision number: 16
Vendor Specific SMART Attributes with Thresholds:
ID# ATTRIBUTE_NAME          FLAGS    VALUE WORST THRESH FAIL RAW_VALUE
  1 Raw_Read_Error_Rate     POSR-K   100   099   062    -    0
  2 Throughput_Performance  P-S--K   100   100   040    -    0
  3 Spin_Up_Time            PO---K   253   100   033    -    1
  4 Start_Stop_Count        -O--CK   096   096   000    -    6853
  5 Reallocated_Sector_Ct   PO--CK   100   100   005    -    8 (0 1)
  7 Seek_Error_Rate         POSR-K   100   098   067    -    0
  8 Seek_Time_Performance   P-S--K   100   100   040    -    0
  9 Power_On_Hours          -O--CK   040   040   000    -    26383
 10 Spin_Retry_Count        PO--CK   100   100   060    -    0
 12 Power_Cycle_Count       -O--CK   097   097   000    -    6213
183 Runtime_Bad_Block       -O--CK   100   100   000    -    0
184 End-to-End_Error        PO--CK   100   100   097    -    0
187 Reported_Uncorrect      -O--CK   100   099   000    -    1318784663553
188 Command_Timeout         -O--CK   100   099   000    -    34365440103
190 Airflow_Temperature_Cel -O---K   059   043   045    Past 41 (Min/Max 40/41)
191 G-Sense_Error_Rate      -O--CK   054   054   000    -    11864
192 Power-Off_Retract_Count -O--CK   098   098   000    -    32047593
193 Load_Cycle_Count        -O--CK   076   076   000    -    249399
196 Reallocated_Event_Count -O--CK   100   100   000    -    0
197 Current_Pending_Sector  -O--CK   100   100   000    -    0
198 Offline_Uncorrectable   ----CK   100   100   000    -    0
199 UDMA_CRC_Error_Count    -OS-CK   100   100   000    -    0
223 Load_Retry_Count        -O-R-K   100   100   000    -    0
                            ||||||_ K auto-keep
                            |||||__ C event count
                            ||||___ R error rate
                            |||____ S speed/performance
                            ||_____ O updated online
                            |______ P prefailure warning

General Purpose Log Directory Version 1
SMART           Log Directory Version 1 [multi-sector log support]
Address    Access  R/W   Size  Description
0x00       GPL,SL  R/O      1  Log Directory
0x01           SL  R/O      1  Summary SMART error log
0x02           SL  R/O      1  Comprehensive SMART error log
0x03       GPL     R/O      1  Ext. Comprehensive SMART error log
0x06           SL  R/O      1  SMART self-test log
0x07       GPL     R/O      1  Extended self-test log
0x09           SL  R/W      1  Selective self-test log
0x10       GPL     R/O      1  NCQ Command Error log
0x11       GPL     R/O      1  SATA Phy Event Counters log
0x80-0x9f  GPL,SL  R/W     16  Host vendor specific log
0xe0       GPL,SL  R/W      1  SCT Command/Status
0xe1       GPL,SL  R/W      1  SCT Data Transfer

SMART Extended Comprehensive Error Log Version: 1 (1 sectors)
Device Error Count: 27 (device log contains only the most recent 4 errors)
	CR     = Command Register
	FEATR  = Features Register
	COUNT  = Count (was: Sector Count) Register
	LBA_48 = Upper bytes of LBA High/Mid/Low Registers ]  ATA-8
	LH     = LBA High (was: Cylinder High) Register    ]   LBA
	LM     = LBA Mid (was: Cylinder Low) Register      ] Register
	LL     = LBA Low (was: Sector Number) Register     ]
	DV     = Device (was: Device/Head) Register
	DC     = Device Control Register
	ER     = Error register
	ST     = Status register
Powered_Up_Time is measured from power on, and printed as
DDd+hh:mm:SS.sss where DD=days, hh=hours, mm=minutes,
SS=sec, and sss=millisec. It "wraps" after 49.710 days.

Error 27 [2] occurred at disk power-on lifetime: 21973 hours (915 days + 13 hours)
  When the command that caused the error occurred, the device was active or idle.

  After command completion occurred, registers were:
  ER -- ST COUNT  LBA_48  LH LM LL DV DC
  -- -- -- == -- == == == -- -- -- -- --
  10 -- 51 01 00 00 00 24 04 99 98 04 00  Error: IDNF at LBA = 0x24049998 = 604281240

  Commands leading to the command that caused the error were:
  CR FEATR COUNT  LBA_48  LH LM LL DV DC  Powered_Up_Time  Command/Feature_Name
  -- == -- == -- == == == -- -- -- -- --  ---------------  --------------------
  61 00 20 00 a0 00 00 39 58 e0 00 40 00     03:35:38.305  WRITE FPDMA QUEUED
  61 00 08 00 98 00 00 2d be 42 28 40 00     03:35:36.306  WRITE FPDMA QUEUED
  61 00 08 00 90 00 00 2d bc e0 d0 40 00     03:35:35.104  WRITE FPDMA QUEUED
  61 00 08 00 88 00 00 39 7e 01 50 40 00     03:35:34.346  WRITE FPDMA QUEUED
  61 00 08 00 80 00 00 34 50 96 d8 40 00     03:35:34.345  WRITE FPDMA QUEUED

Error 26 [1] occurred at disk power-on lifetime: 20866 hours (869 days + 10 hours)
  When the command that caused the error occurred, the device was active or idle.

  After command completion occurred, registers were:
  ER -- ST COUNT  LBA_48  LH LM LL DV DC
  -- -- -- == -- == == == -- -- -- -- --
  40 -- 51 00 10 00 00 2d e0 d7 1a 0d 00  Error: WP at LBA = 0x2de0d71a = 769709850

  Commands leading to the command that caused the error were:
  CR FEATR COUNT  LBA_48  LH LM LL DV DC  Powered_Up_Time  Command/Feature_Name
  -- == -- == -- == == == -- -- -- -- --  ---------------  --------------------
  61 00 08 00 78 00 00 2e 16 df 08 40 00     09:28:14.362  WRITE FPDMA QUEUED
  61 00 08 00 70 00 00 2d bb 02 60 40 00     09:28:14.361  WRITE FPDMA QUEUED
  61 00 08 00 68 00 00 2d bb 02 48 40 00     09:28:14.361  WRITE FPDMA QUEUED
  61 00 18 00 60 00 00 2e 18 68 70 40 00     09:28:14.360  WRITE FPDMA QUEUED
  60 00 20 00 58 00 00 39 23 3a 40 40 00     09:28:13.411  READ FPDMA QUEUED

Error 25 [0] occurred at disk power-on lifetime: 6382 hours (265 days + 22 hours)
  When the command that caused the error occurred, the device was active or idle.

  After command completion occurred, registers were:
  ER -- ST COUNT  LBA_48  LH LM LL DV DC
  -- -- -- == -- == == == -- -- -- -- --
  40 -- 51 00 08 00 00 00 77 96 fa 00 00  Error: WP at LBA = 0x007796fa = 7837434

  Commands leading to the command that caused the error were:
  CR FEATR COUNT  LBA_48  LH LM LL DV DC  Powered_Up_Time  Command/Feature_Name
  -- == -- == -- == == == -- -- -- -- --  ---------------  --------------------
  61 00 80 00 00 00 00 26 73 75 80 40 00     02:18:11.157  WRITE FPDMA QUEUED
  61 00 80 00 00 00 00 26 73 75 00 40 00     02:18:11.156  WRITE FPDMA QUEUED
  61 00 80 00 00 00 00 26 73 74 80 40 00     02:18:11.155  WRITE FPDMA QUEUED
  61 00 80 00 00 00 00 26 73 74 00 40 00     02:18:11.154  WRITE FPDMA QUEUED
  61 00 80 00 00 00 00 26 73 73 80 40 00     02:18:11.154  WRITE FPDMA QUEUED

Error 24 [3] occurred at disk power-on lifetime: 6382 hours (265 days + 22 hours)
  When the command that caused the error occurred, the device was active or idle.

  After command completion occurred, registers were:
  ER -- ST COUNT  LBA_48  LH LM LL DV DC
  -- -- -- == -- == == == -- -- -- -- --
  40 -- 51 00 40 00 00 00 6a cf 80 00 00  Error: WP at LBA = 0x006acf80 = 6999936

  Commands leading to the command that caused the error were:
  CR FEATR COUNT  LBA_48  LH LM LL DV DC  Powered_Up_Time  Command/Feature_Name
  -- == -- == -- == == == -- -- -- -- --  ---------------  --------------------
  61 00 80 00 00 00 00 26 5f a1 80 40 00     02:18:02.750  WRITE FPDMA QUEUED
  61 00 80 00 00 00 00 26 5f a1 00 40 00     02:18:02.750  WRITE FPDMA QUEUED
  61 00 80 00 00 00 00 26 5f a0 80 40 00     02:18:02.749  WRITE FPDMA QUEUED
  61 00 80 00 00 00 00 26 5f a0 00 40 00     02:18:02.748  WRITE FPDMA QUEUED
  61 00 80 00 00 00 00 26 5f 9f 80 40 00     02:18:02.748  WRITE FPDMA QUEUED

SMART Extended Self-test Log Version: 1 (1 sectors)
Num  Test_Description    Status                  Remaining  LifeTime(hours)  LBA_of_first_error
# 1  Short offline       Completed without error       00%     25317         -
# 2  Short offline       Completed without error       00%     24369         -
# 3  Short offline       Completed without error       00%     19877         -
# 4  Short offline       Completed without error       00%     10054         -
# 5  Short offline       Completed without error       00%     10033         -
# 6  Short offline       Completed without error       00%      9804         -
# 7  Short offline       Completed without error       00%      9804         -
# 8  Short offline       Completed without error       00%      9804         -
# 9  Short offline       Completed without error       00%      9780         -
#10  Short offline       Completed without error       00%      9775         -
#11  Short offline       Completed without error       00%      9768         -
#12  Short offline       Aborted by host               90%      5888         -
#13  Short offline       Completed without error       00%      5886         -
#14  Short offline       Completed without error       00%      5886         -
#15  Short offline       Completed without error       00%      5886         -
#16  Short offline       Completed without error       00%      5886         -
#17  Short offline       Completed without error       00%      5886         -
#18  Short offline       Completed without error       00%      5751         -
#19  Short offline       Completed without error       00%      5707         -

SMART Selective self-test log data structure revision number 1
 SPAN  MIN_LBA  MAX_LBA  CURRENT_TEST_STATUS
    1        0        0  Not_testing
    2        0        0  Not_testing
    3        0        0  Not_testing
    4        0        0  Not_testing
    5        0        0  Not_testing
Selective self-test flags (0x0):
  After scanning selected spans, do NOT read-scan remainder of disk.
If Selective self-test is pending on power-up, resume after 0 minute delay.

SCT Status Version:                  3
SCT Version (vendor specific):       256 (0x0100)
Device State:                        Active (0)
Current Temperature:                    41 Celsius
Power Cycle Min/Max Temperature:     40/41 Celsius
Lifetime    Min/Max Temperature:      0/57 Celsius
Specified Max Operating Temperature:    37 Celsius
Under/Over Temperature Limit Count:   0/0

SCT Temperature History Version:     2
Temperature Sampling Period:         1 minute
Temperature Logging Interval:        1 minute
Min/Max recommended Temperature:      0/60 Celsius
Min/Max Temperature Limit:           -40/65 Celsius
Temperature History Size (Index):    128 (96)

SCT Error Recovery Control:
           Read:     85 (8.5 seconds)
          Write:     85 (8.5 seconds)

Device Statistics (GP/SMART Log 0x04) not supported

Pending Defects log (GP Log 0x0c) not supported

SATA Phy Event Counters (GP Log 0x11)
ID      Size     Value  Description
0x0001  2            0  Command failed due to ICRC error
0x0002  2            0  R_ERR response for data FIS
0x0003  2            0  R_ERR response for device-to-host data FIS
0x0004  2            0  R_ERR response for host-to-device data FIS
0x0005  2            0  R_ERR response for non-data FIS
0x0006  2            0  R_ERR response for device-to-host non-data FIS
0x0007  2            0  R_ERR response for host-to-device non-data FIS
0x0009  2            2  Transition from drive PhyRdy to drive PhyNRdy
0x000a  2            2  Device-to-host register FISes sent due to a COMRESET
0x000b  2            0  CRC errors within host-to-device FIS
0x000d  2            0  Non-CRC errors within host-to-device FIS

