smartctl 7.3 2022-02-28 r5338 [FreeBSD 13.1-RELEASE amd64] (local build)
Copyright (C) 2002-22, Bruce Allen, Christian Franke, www.smartmontools.org

=== START OF INFORMATION SECTION ===
Device Model:     Speed   Star
Serial Number:    --
LU WWN Device Id: 0 000000 ...
Firmware Version: HPS1A30Q
User Capacity:    128,035,676,160 bytes [128 GB]
Sector Size:      512 bytes logical/physical
Rotation Rate:    Solid State Device
Form Factor:      2.5 inches
TRIM Command:     Available
Device is:        Not in smartctl database 7.3/5319
ATA Version is:   ACS-2 T13/2015-D revision 3
SATA Version is:  SATA 3.2, 6.0 Gb/s (current: 6.0 Gb/s)
Local Time is:    Mon Oct 16 14:39:37 2023 UTC
SMART support is: Available - device has SMART capability.
SMART support is: Enabled
AAM feature is:   Unavailable
APM feature is:   Unavailable
Rd look-ahead is: Enabled
Write cache is:   Enabled
DSN feature is:   Unavailable
ATA Security is:  Disabled, frozen [SEC2]
Wt Cache Reorder: Unavailable

=== START OF READ SMART DATA SECTION ===
SMART overall-health self-assessment test result: PASSED

General SMART Values:
Offline data collection status:  (0x00)	Offline data collection activity
					was never started.
					Auto Offline Data Collection: Disabled.
Self-test execution status:      (   0)	The previous self-test routine completed
					without error or no self-test has ever 
					been run.
Total time to complete Offline 
data collection: 		(  120) seconds.
Offline data collection
capabilities: 			 (0x5d) SMART execute Offline immediate.
					No Auto Offline data collection support.
					Abort Offline collection upon new
					command.
					Offline surface scan supported.
					Self-test supported.
					No Conveyance Self-test supported.
					Selective Self-test supported.
SMART capabilities:            (0x0002)	Does not save SMART data before
					entering power-saving mode.
					Supports SMART auto save timer.
Error logging capability:        (0x01)	Error logging supported.
					General Purpose Logging supported.
Short self-test routine 
recommended polling time: 	 (   2) minutes.
Extended self-test routine
recommended polling time: 	 (   4) minutes.

SMART Attributes Data Structure revision number: 1
Vendor Specific SMART Attributes with Thresholds:
ID# ATTRIBUTE_NAME          FLAGS    VALUE WORST THRESH FAIL RAW_VALUE
  1 Raw_Read_Error_Rate     -O--CK   100   100   050    -    0
  5 Reallocated_Sector_Ct   -O--CK   100   100   050    -    0
  9 Power_On_Hours          -O--CK   100   100   050    -    308
 12 Power_Cycle_Count       -O--CK   100   100   050    -    543
160 Unknown_Attribute       -O--CK   100   100   050    -    65558
161 Unknown_Attribute       -O--CK   100   100   050    -    100
163 Unknown_Attribute       -O--CK   100   100   050    -    0
164 Unknown_Attribute       -O--CK   100   100   050    -    43
165 Unknown_Attribute       -O--CK   100   100   050    -    74
166 Unknown_Attribute       -O--CK   100   100   050    -    18
167 Unknown_Attribute       -O--CK   100   100   050    -    33
168 Unknown_Attribute       -O--CK   100   100   050    -    0
169 Unknown_Attribute       -O--CK   100   100   050    -    100
175 Program_Fail_Count_Chip -O--CK   100   100   050    -    16777216
176 Erase_Fail_Count_Chip   -O--CK   100   100   050    -    38049
177 Wear_Leveling_Count     -O--CK   100   100   050    -    117995783
178 Used_Rsvd_Blk_Cnt_Chip  -O--CK   100   100   050    -    1
181 Program_Fail_Cnt_Total  -O--CK   100   100   050    -    0
182 Erase_Fail_Count_Total  -O--CK   100   100   050    -    0
192 Power-Off_Retract_Count -O--CK   100   100   050    -    71
194 Temperature_Celsius     -O--CK   100   100   050    -    40
195 Hardware_ECC_Recovered  -O--CK   100   100   050    -    0
196 Reallocated_Event_Count -O--CK   100   100   050    -    0
197 Current_Pending_Sector  -O--CK   100   100   050    -    0
198 Offline_Uncorrectable   -O--CK   100   100   050    -    0
199 UDMA_CRC_Error_Count    -O--CK   100   100   050    -    0
232 Available_Reservd_Space -O--CK   100   100   050    -    100
241 Total_LBAs_Written      -O--CK   100   100   050    -    33164
242 Total_LBAs_Read         -O--CK   100   100   050    -    27697
245 Unknown_Attribute       -O--CK   100   100   050    -    66695
                            ||||||_ K auto-keep
                            |||||__ C event count
                            ||||___ R error rate
                            |||____ S speed/performance
                            ||_____ O updated online
                            |______ P prefailure warning

General Purpose Log Directory Version 1
SMART           Log Directory Version 1 [multi-sector log support]
Address    Access  R/W   Size  Description
0x00       GPL,SL  R/O      1  Log Directory
0x01       GPL,SL  R/O      1  Summary SMART error log
0x02       GPL,SL  R/O      1  Comprehensive SMART error log
0x03       GPL,SL  R/O      1  Ext. Comprehensive SMART error log
0x04       GPL,SL  R/O      8  Device Statistics log
0x06       GPL,SL  R/O      1  SMART self-test log
0x07       GPL,SL  R/O      1  Extended self-test log
0x09       GPL,SL  R/W      1  Selective self-test log
0x10       GPL,SL  R/O      1  NCQ Command Error log
0x11       GPL,SL  R/O      1  SATA Phy Event Counters log
0x30       GPL,SL  R/O      9  IDENTIFY DEVICE data log
0x80-0x9f  GPL,SL  R/W     16  Host vendor specific log
0xa0       GPL,SL  VS      16  Device vendor specific log
0xe0       GPL,SL  R/W      1  SCT Command/Status
0xe1       GPL,SL  R/W      1  SCT Data Transfer

SMART Extended Comprehensive Error Log Version: 0 (1 sectors)
No Errors Logged

SMART Extended Self-test Log Version: 1 (1 sectors)
Num  Test_Description    Status                  Remaining  LifeTime(hours)  LBA_of_first_error
# 1  Offline             Completed without error       00%       144         -
# 2  Offline             Self-test routine in progress 10%       144         -
# 3  Offline             Self-test routine in progress 10%       144         -
# 4  Offline             Self-test routine in progress 10%       144         -
# 5  Offline             Self-test routine in progress 10%       144         -
# 6  Offline             Self-test routine in progress 10%       144         -
# 7  Offline             Self-test routine in progress 10%       144         -
# 8  Offline             Self-test routine in progress 10%       144         -
# 9  Offline             Self-test routine in progress 10%       144         -
#10  Offline             Self-test routine in progress 10%       144         -
#11  Offline             Self-test routine in progress 10%       144         -
#12  Offline             Self-test routine in progress 10%       144         -
#13  Offline             Self-test routine in progress 10%       144         -
#14  Offline             Self-test routine in progress 10%       144         -
#15  Offline             Self-test routine in progress 10%       144         -
#16  Offline             Self-test routine in progress 10%       144         -
#17  Offline             Self-test routine in progress 10%       144         -
#18  Offline             Self-test routine in progress 10%       144         -
#19  Offline             Self-test routine in progress 10%       144         -

SMART Selective self-test log data structure revision number 0
Note: revision number not 1 implies that no selective self-test has ever been run
 SPAN  MIN_LBA  MAX_LBA  CURRENT_TEST_STATUS
    1        0        0  Not_testing
    2        0        0  Not_testing
    3        0        0  Not_testing
    4        0        0  Not_testing
    5        0        0  Not_testing
Selective self-test flags (0x0):
  After scanning selected spans, do NOT read-scan remainder of disk.
If Selective self-test is pending on power-up, resume after 0 minute delay.

SCT Commands not supported

Device Statistics (GP Log 0x04)
Page  Offset Size        Value Flags Description
0x01  =====  =               =  ===  == General Statistics (rev 1) ==
0x01  0x008  4             543  ---  Lifetime Power-On Resets
0x01  0x010  4             308  ---  Power-on Hours
0x01  0x018  6      2173435904  ---  Logical Sectors Written
0x01  0x020  6        15024062  ---  Number of Write Commands
0x01  0x028  6      1815150592  ---  Logical Sectors Read
0x01  0x030  6        15689960  ---  Number of Read Commands
0x01  =====  =               =  ===  == General Statistics (rev 1) ==
0x01  0x008  4             543  ---  Lifetime Power-On Resets
0x01  0x010  4             308  ---  Power-on Hours
0x01  0x018  6      2173435904  ---  Logical Sectors Written
0x01  0x020  6        15024062  ---  Number of Write Commands
0x01  0x028  6      1815150592  ---  Logical Sectors Read
0x01  0x030  6        15689960  ---  Number of Read Commands
0x01  =====  =               =  ===  == General Statistics (rev 1) ==
0x01  0x008  4             543  ---  Lifetime Power-On Resets
0x01  0x010  4             308  ---  Power-on Hours
0x01  0x018  6      2173435904  ---  Logical Sectors Written
0x01  0x020  6        15024062  ---  Number of Write Commands
0x01  0x028  6      1815150592  ---  Logical Sectors Read
0x01  0x030  6        15689960  ---  Number of Read Commands
0x01  =====  =               =  ===  == General Statistics (rev 1) ==
0x01  0x008  4             543  ---  Lifetime Power-On Resets
0x01  0x010  4             308  ---  Power-on Hours
0x01  0x018  6      2173435904  ---  Logical Sectors Written
0x01  0x020  6        15024062  ---  Number of Write Commands
0x01  0x028  6      1815150592  ---  Logical Sectors Read
0x01  0x030  6        15689960  ---  Number of Read Commands
0x01  =====  =               =  ===  == General Statistics (rev 1) ==
0x01  0x008  4             543  ---  Lifetime Power-On Resets
0x01  0x010  4             308  ---  Power-on Hours
0x01  0x018  6      2173435904  ---  Logical Sectors Written
0x01  0x020  6        15024062  ---  Number of Write Commands
0x01  0x028  6      1815150592  ---  Logical Sectors Read
0x01  0x030  6        15689960  ---  Number of Read Commands
0x01  =====  =               =  ===  == General Statistics (rev 1) ==
0x01  0x008  4             543  ---  Lifetime Power-On Resets
0x01  0x010  4             308  ---  Power-on Hours
0x01  0x018  6      2173435904  ---  Logical Sectors Written
0x01  0x020  6        15024062  ---  Number of Write Commands
0x01  0x028  6      1815150592  ---  Logical Sectors Read
0x01  0x030  6        15689960  ---  Number of Read Commands
0x01  =====  =               =  ===  == General Statistics (rev 1) ==
0x01  0x008  4             543  ---  Lifetime Power-On Resets
0x01  0x010  4             308  ---  Power-on Hours
0x01  0x018  6      2173435904  ---  Logical Sectors Written
0x01  0x020  6        15024062  ---  Number of Write Commands
0x01  0x028  6      1815150592  ---  Logical Sectors Read
0x01  0x030  6        15689960  ---  Number of Read Commands
0x01  =====  =               =  ===  == General Statistics (rev 1) ==
0x01  0x008  4             543  ---  Lifetime Power-On Resets
0x01  0x010  4             308  ---  Power-on Hours
0x01  0x018  6      2173435904  ---  Logical Sectors Written
0x01  0x020  6        15024062  ---  Number of Write Commands
0x01  0x028  6      1815150592  ---  Logical Sectors Read
0x01  0x030  6        15689960  ---  Number of Read Commands
                                |||_ C monitored condition met
                                ||__ D supports DSN
                                |___ N normalized value

Pending Defects log (GP Log 0x0c) not supported

SATA Phy Event Counters (GP Log 0x11)
ID      Size     Value  Description
0x0001  4            0  Command failed due to ICRC error
0x0009  4          340  Transition from drive PhyRdy to drive PhyNRdy
0x000a  4         1728  Device-to-host register FISes sent due to a COMRESET
0x000b  4            0  CRC errors within host-to-device FIS
0x000d  4            0  Non-CRC errors within host-to-device FIS

