smartctl 7.2 2020-12-30 r5155 [FreeBSD 13.0-RELEASE-p4 amd64] (local build)
Copyright (C) 2002-20, Bruce Allen, Christian Franke, www.smartmontools.org

=== START OF INFORMATION SECTION ===
Model Family:     Western Digital RE4-GP
Device Model:     WDC WD2002FYPS-02W3B0
Serial Number:    --
LU WWN Device Id: 5 0014ee ...
Firmware Version: 04.01G01
User Capacity:    2,000,398,934,016 bytes [2.00 TB]
Sector Size:      512 bytes logical/physical
Rotation Rate:    5400 rpm
Device is:        In smartctl database [for details use: -P show]
ATA Version is:   ATA8-ACS (minor revision not indicated)
SATA Version is:  SATA 2.6, 3.0 Gb/s
Local Time is:    Mon Oct 11 09:47:35 2021 CEST
SMART support is: Available - device has SMART capability.
SMART support is: Enabled
AAM level is:     254 (maximum performance), recommended: 128
APM level is:     128 (minimum power consumption without standby)
Rd look-ahead is: Enabled
Write cache is:   Enabled
DSN feature is:   Unavailable
ATA Security is:  Disabled, frozen [SEC2]
Wt Cache Reorder: Enabled

=== START OF READ SMART DATA SECTION ===
SMART overall-health self-assessment test result: PASSED

General SMART Values:
Offline data collection status:  (0x82)	Offline data collection activity
					was completed without error.
					Auto Offline Data Collection: Enabled.
Self-test execution status:      (   0)	The previous self-test routine completed
					without error or no self-test has ever 
					been run.
Total time to complete Offline 
data collection: 		(42660) seconds.
Offline data collection
capabilities: 			 (0x7b) SMART execute Offline immediate.
					Auto Offline data collection on/off support.
					Suspend Offline collection upon new
					command.
					Offline surface scan supported.
					Self-test supported.
					Conveyance Self-test supported.
					Selective Self-test supported.
SMART capabilities:            (0x0003)	Saves SMART data before entering
					power-saving mode.
					Supports SMART auto save timer.
Error logging capability:        (0x01)	Error logging supported.
					General Purpose Logging supported.
Short self-test routine 
recommended polling time: 	 (   2) minutes.
Extended self-test routine
recommended polling time: 	 ( 432) minutes.
Conveyance self-test routine
recommended polling time: 	 (   5) minutes.
SCT capabilities: 	       (0x303f)	SCT Status supported.
					SCT Error Recovery Control supported.
					SCT Feature Control supported.
					SCT Data Table supported.

SMART Attributes Data Structure revision number: 16
Vendor Specific SMART Attributes with Thresholds:
ID# ATTRIBUTE_NAME          FLAGS    VALUE WORST THRESH FAIL RAW_VALUE
  1 Raw_Read_Error_Rate     POSR-K   199   199   051    -    49198
  3 Spin_Up_Time            POS--K   247   227   021    -    9641
  4 Start_Stop_Count        -O--CK   100   100   000    -    38
  5 Reallocated_Sector_Ct   PO--CK   200   200   140    -    0
  7 Seek_Error_Rate         -OSR-K   200   200   000    -    0
  9 Power_On_Hours          -O--CK   001   001   000    -    80912
 10 Spin_Retry_Count        -O--CK   100   253   000    -    0
 11 Calibration_Retry_Count -O--CK   100   253   000    -    0
 12 Power_Cycle_Count       -O--CK   100   100   000    -    37
192 Power-Off_Retract_Count -O--CK   200   200   000    -    24
193 Load_Cycle_Count        -O--CK   171   171   000    -    87318
194 Temperature_Celsius     -O---K   112   092   000    -    40
196 Reallocated_Event_Count -O--CK   200   200   000    -    0
197 Current_Pending_Sector  -O--CK   200   200   000    -    218
198 Offline_Uncorrectable   ----CK   200   200   000    -    98
199 UDMA_CRC_Error_Count    -O--CK   200   200   000    -    0
200 Multi_Zone_Error_Rate   ---R--   199   199   000    -    237
                            ||||||_ K auto-keep
                            |||||__ C event count
                            ||||___ R error rate
                            |||____ S speed/performance
                            ||_____ O updated online
                            |______ P prefailure warning

General Purpose Log Directory Version 1
SMART           Log Directory Version 1 [multi-sector log support]
Address    Access  R/W   Size  Description
0x00       GPL,SL  R/O      1  Log Directory
0x01           SL  R/O      1  Summary SMART error log
0x02           SL  R/O      5  Comprehensive SMART error log
0x03       GPL     R/O      6  Ext. Comprehensive SMART error log
0x06           SL  R/O      1  SMART self-test log
0x07       GPL     R/O      1  Extended self-test log
0x09           SL  R/W      1  Selective self-test log
0x10       GPL     R/O      1  NCQ Command Error log
0x11       GPL     R/O      1  SATA Phy Event Counters log
0x80-0x9f  GPL,SL  R/W     16  Host vendor specific log
0xa0-0xa7  GPL,SL  VS      16  Device vendor specific log
0xa8-0xb5  GPL,SL  VS       1  Device vendor specific log
0xb6       GPL     VS       1  Device vendor specific log
0xb7       GPL,SL  VS       1  Device vendor specific log
0xbd       GPL,SL  VS       1  Device vendor specific log
0xc0       GPL,SL  VS       1  Device vendor specific log
0xc1       GPL     VS      24  Device vendor specific log
0xe0       GPL,SL  R/W      1  SCT Command/Status
0xe1       GPL,SL  R/W      1  SCT Data Transfer

SMART Extended Comprehensive Error Log Version: 1 (6 sectors)
Device Error Count: 23877 (device log contains only the most recent 24 errors)
	CR     = Command Register
	FEATR  = Features Register
	COUNT  = Count (was: Sector Count) Register
	LBA_48 = Upper bytes of LBA High/Mid/Low Registers ]  ATA-8
	LH     = LBA High (was: Cylinder High) Register    ]   LBA
	LM     = LBA Mid (was: Cylinder Low) Register      ] Register
	LL     = LBA Low (was: Sector Number) Register     ]
	DV     = Device (was: Device/Head) Register
	DC     = Device Control Register
	ER     = Error register
	ST     = Status register
Powered_Up_Time is measured from power on, and printed as
DDd+hh:mm:SS.sss where DD=days, hh=hours, mm=minutes,
SS=sec, and sss=millisec. It "wraps" after 49.710 days.

Error 23877 [20] occurred at disk power-on lifetime: 924 hours (38 days + 12 hours)
  When the command that caused the error occurred, the device was active or idle.

  After command completion occurred, registers were:
  ER -- ST COUNT  LBA_48  LH LM LL DV DC
  -- -- -- == -- == == == -- -- -- -- --
  40 -- 51 00 08 00 00 14 06 c4 18 40 00  Error: UNC 8 sectors at LBA = 0x1406c418 = 335987736

  Commands leading to the command that caused the error were:
  CR FEATR COUNT  LBA_48  LH LM LL DV DC  Powered_Up_Time  Command/Feature_Name
  -- == -- == -- == == == -- -- -- -- --  ---------------  --------------------
  25 00 00 00 08 00 00 14 06 c4 18 40 08 32d+17:01:07.210  READ DMA EXT
  25 00 00 00 08 00 00 14 06 c4 18 40 08 32d+17:01:04.934  READ DMA EXT
  25 00 00 00 08 00 00 14 06 c4 18 40 08 32d+17:01:02.659  READ DMA EXT
  25 00 00 00 08 00 00 14 06 c4 18 40 08 32d+17:01:00.383  READ DMA EXT
  25 00 00 00 08 00 00 14 06 c4 18 40 08 32d+17:00:58.112  READ DMA EXT

Error 23876 [19] occurred at disk power-on lifetime: 924 hours (38 days + 12 hours)
  When the command that caused the error occurred, the device was active or idle.

  After command completion occurred, registers were:
  ER -- ST COUNT  LBA_48  LH LM LL DV DC
  -- -- -- == -- == == == -- -- -- -- --
  40 -- 51 00 08 00 00 14 06 c4 18 40 00  Error: UNC 8 sectors at LBA = 0x1406c418 = 335987736

  Commands leading to the command that caused the error were:
  CR FEATR COUNT  LBA_48  LH LM LL DV DC  Powered_Up_Time  Command/Feature_Name
  -- == -- == -- == == == -- -- -- -- --  ---------------  --------------------
  25 00 00 00 08 00 00 14 06 c4 18 40 08 32d+17:01:04.934  READ DMA EXT
  25 00 00 00 08 00 00 14 06 c4 18 40 08 32d+17:01:02.659  READ DMA EXT
  25 00 00 00 08 00 00 14 06 c4 18 40 08 32d+17:01:00.383  READ DMA EXT
  25 00 00 00 08 00 00 14 06 c4 18 40 08 32d+17:00:58.112  READ DMA EXT
  25 00 00 00 40 00 00 14 54 68 e8 40 08 32d+17:00:53.540  READ DMA EXT

Error 23875 [18] occurred at disk power-on lifetime: 924 hours (38 days + 12 hours)
  When the command that caused the error occurred, the device was active or idle.

  After command completion occurred, registers were:
  ER -- ST COUNT  LBA_48  LH LM LL DV DC
  -- -- -- == -- == == == -- -- -- -- --
  40 -- 51 00 08 00 00 14 06 c4 18 40 00  Error: UNC 8 sectors at LBA = 0x1406c418 = 335987736

  Commands leading to the command that caused the error were:
  CR FEATR COUNT  LBA_48  LH LM LL DV DC  Powered_Up_Time  Command/Feature_Name
  -- == -- == -- == == == -- -- -- -- --  ---------------  --------------------
  25 00 00 00 08 00 00 14 06 c4 18 40 08 32d+17:01:02.659  READ DMA EXT
  25 00 00 00 08 00 00 14 06 c4 18 40 08 32d+17:01:00.383  READ DMA EXT
  25 00 00 00 08 00 00 14 06 c4 18 40 08 32d+17:00:58.112  READ DMA EXT
  25 00 00 00 40 00 00 14 54 68 e8 40 08 32d+17:00:53.540  READ DMA EXT
  25 00 00 00 40 00 00 14 54 68 e8 40 08 32d+17:00:48.223  READ DMA EXT

Error 23874 [17] occurred at disk power-on lifetime: 924 hours (38 days + 12 hours)
  When the command that caused the error occurred, the device was active or idle.

  After command completion occurred, registers were:
  ER -- ST COUNT  LBA_48  LH LM LL DV DC
  -- -- -- == -- == == == -- -- -- -- --
  40 -- 51 00 08 00 00 14 06 c4 18 40 00  Error: UNC 8 sectors at LBA = 0x1406c418 = 335987736

  Commands leading to the command that caused the error were:
  CR FEATR COUNT  LBA_48  LH LM LL DV DC  Powered_Up_Time  Command/Feature_Name
  -- == -- == -- == == == -- -- -- -- --  ---------------  --------------------
  25 00 00 00 08 00 00 14 06 c4 18 40 08 32d+17:01:00.383  READ DMA EXT
  25 00 00 00 08 00 00 14 06 c4 18 40 08 32d+17:00:58.112  READ DMA EXT
  25 00 00 00 40 00 00 14 54 68 e8 40 08 32d+17:00:53.540  READ DMA EXT
  25 00 00 00 40 00 00 14 54 68 e8 40 08 32d+17:00:48.223  READ DMA EXT
  25 00 00 00 40 00 00 14 54 68 e8 40 08 32d+17:00:41.984  READ DMA EXT

Error 23873 [16] occurred at disk power-on lifetime: 924 hours (38 days + 12 hours)
  When the command that caused the error occurred, the device was active or idle.

  After command completion occurred, registers were:
  ER -- ST COUNT  LBA_48  LH LM LL DV DC
  -- -- -- == -- == == == -- -- -- -- --
  40 -- 51 00 08 00 00 14 06 c4 18 40 00  Error: UNC 8 sectors at LBA = 0x1406c418 = 335987736

  Commands leading to the command that caused the error were:
  CR FEATR COUNT  LBA_48  LH LM LL DV DC  Powered_Up_Time  Command/Feature_Name
  -- == -- == -- == == == -- -- -- -- --  ---------------  --------------------
  25 00 00 00 08 00 00 14 06 c4 18 40 08 32d+17:00:58.112  READ DMA EXT
  25 00 00 00 40 00 00 14 54 68 e8 40 08 32d+17:00:53.540  READ DMA EXT
  25 00 00 00 40 00 00 14 54 68 e8 40 08 32d+17:00:48.223  READ DMA EXT
  25 00 00 00 40 00 00 14 54 68 e8 40 08 32d+17:00:41.984  READ DMA EXT
  25 00 00 00 40 00 00 14 54 68 e8 40 08 32d+17:00:36.224  READ DMA EXT

Error 23872 [15] occurred at disk power-on lifetime: 924 hours (38 days + 12 hours)
  When the command that caused the error occurred, the device was active or idle.

  After command completion occurred, registers were:
  ER -- ST COUNT  LBA_48  LH LM LL DV DC
  -- -- -- == -- == == == -- -- -- -- --
  40 -- 51 00 40 00 00 14 54 68 e8 40 00  Error: UNC 64 sectors at LBA = 0x145468e8 = 341076200

  Commands leading to the command that caused the error were:
  CR FEATR COUNT  LBA_48  LH LM LL DV DC  Powered_Up_Time  Command/Feature_Name
  -- == -- == -- == == == -- -- -- -- --  ---------------  --------------------
  25 00 00 00 40 00 00 14 54 68 e8 40 08 32d+17:00:53.540  READ DMA EXT
  25 00 00 00 40 00 00 14 54 68 e8 40 08 32d+17:00:48.223  READ DMA EXT
  25 00 00 00 40 00 00 14 54 68 e8 40 08 32d+17:00:41.984  READ DMA EXT
  25 00 00 00 40 00 00 14 54 68 e8 40 08 32d+17:00:36.224  READ DMA EXT
  25 00 00 00 40 00 00 14 54 68 e8 40 08 32d+17:00:33.756  READ DMA EXT

Error 23871 [14] occurred at disk power-on lifetime: 924 hours (38 days + 12 hours)
  When the command that caused the error occurred, the device was active or idle.

  After command completion occurred, registers were:
  ER -- ST COUNT  LBA_48  LH LM LL DV DC
  -- -- -- == -- == == == -- -- -- -- --
  40 -- 51 00 40 00 00 14 54 68 e8 40 00  Error: UNC 64 sectors at LBA = 0x145468e8 = 341076200

  Commands leading to the command that caused the error were:
  CR FEATR COUNT  LBA_48  LH LM LL DV DC  Powered_Up_Time  Command/Feature_Name
  -- == -- == -- == == == -- -- -- -- --  ---------------  --------------------
  25 00 00 00 40 00 00 14 54 68 e8 40 08 32d+17:00:48.223  READ DMA EXT
  25 00 00 00 40 00 00 14 54 68 e8 40 08 32d+17:00:41.984  READ DMA EXT
  25 00 00 00 40 00 00 14 54 68 e8 40 08 32d+17:00:36.224  READ DMA EXT
  25 00 00 00 40 00 00 14 54 68 e8 40 08 32d+17:00:33.756  READ DMA EXT
  2f 00 00 00 01 00 00 00 00 00 10 40 08 32d+17:00:33.755  READ LOG EXT

Error 23870 [13] occurred at disk power-on lifetime: 924 hours (38 days + 12 hours)
  When the command that caused the error occurred, the device was active or idle.

  After command completion occurred, registers were:
  ER -- ST COUNT  LBA_48  LH LM LL DV DC
  -- -- -- == -- == == == -- -- -- -- --
  40 -- 51 00 40 00 00 14 54 68 e8 40 00  Error: UNC 64 sectors at LBA = 0x145468e8 = 341076200

  Commands leading to the command that caused the error were:
  CR FEATR COUNT  LBA_48  LH LM LL DV DC  Powered_Up_Time  Command/Feature_Name
  -- == -- == -- == == == -- -- -- -- --  ---------------  --------------------
  25 00 00 00 40 00 00 14 54 68 e8 40 08 32d+17:00:41.984  READ DMA EXT
  25 00 00 00 40 00 00 14 54 68 e8 40 08 32d+17:00:36.224  READ DMA EXT
  25 00 00 00 40 00 00 14 54 68 e8 40 08 32d+17:00:33.756  READ DMA EXT
  2f 00 00 00 01 00 00 00 00 00 10 40 08 32d+17:00:33.755  READ LOG EXT
  60 00 40 00 f8 00 00 14 54 68 e8 40 08 32d+17:00:27.329  READ FPDMA QUEUED

SMART Extended Self-test Log Version: 1 (1 sectors)
Num  Test_Description    Status                  Remaining  LifeTime(hours)  LBA_of_first_error
# 1  Short offline       Completed: read failure       90%      6542         2564712
# 2  Extended offline    Completed without error       00%       958         -
# 3  Short offline       Completed without error       00%       952         -
# 4  Short offline       Completed without error       00%       952         -
# 5  Short offline       Completed without error       00%       951         -
# 6  Short offline       Completed: read failure       90%       809         270553000
# 7  Short offline       Completed without error       00%     53693         -
# 8  Short offline       Completed: read failure       60%     53677         245588
2 of 3 failed self-tests are outdated by newer successful extended offline self-test # 2

SMART Selective self-test log data structure revision number 1
 SPAN  MIN_LBA  MAX_LBA  CURRENT_TEST_STATUS
    1        0        0  Not_testing
    2        0        0  Not_testing
    3        0        0  Not_testing
    4        0        0  Not_testing
    5        0        0  Not_testing
Selective self-test flags (0x0):
  After scanning selected spans, do NOT read-scan remainder of disk.
If Selective self-test is pending on power-up, resume after 0 minute delay.

SCT Status Version:                  3
SCT Version (vendor specific):       258 (0x0102)
Device State:                        Active (0)
Current Temperature:                    40 Celsius
Power Cycle Min/Max Temperature:     37/47 Celsius
Lifetime    Min/Max Temperature:     37/60 Celsius
Under/Over Temperature Limit Count:   0/0

SCT Temperature History Version:     2
Temperature Sampling Period:         1 minute
Temperature Logging Interval:        1 minute
Min/Max recommended Temperature:      0/60 Celsius
Min/Max Temperature Limit:           -41/85 Celsius
Temperature History Size (Index):    478 (114)

SCT Error Recovery Control:
           Read:     70 (7.0 seconds)
          Write:     70 (7.0 seconds)

Device Statistics (GP/SMART Log 0x04) not supported

Pending Defects log (GP Log 0x0c) not supported

SATA Phy Event Counters (GP Log 0x11)
ID      Size     Value  Description
0x0001  2            0  Command failed due to ICRC error
0x0002  2            0  R_ERR response for data FIS
0x0003  2            0  R_ERR response for device-to-host data FIS
0x0004  2            0  R_ERR response for host-to-device data FIS
0x0005  2            0  R_ERR response for non-data FIS
0x0006  2            0  R_ERR response for device-to-host non-data FIS
0x0007  2            0  R_ERR response for host-to-device non-data FIS
0x000a  2            3  Device-to-host register FISes sent due to a COMRESET
0x000b  2            0  CRC errors within host-to-device FIS
0x8000  4       241477  Vendor specific

