smartctl 7.2 2020-12-30 r5155 [FreeBSD 12.2-RELEASE-p3 amd64] (local build)
Copyright (C) 2002-20, Bruce Allen, Christian Franke, www.smartmontools.org

=== START OF INFORMATION SECTION ===
Model Family:     Seagate Momentus 5400.5
Device Model:     ST9250320AS
Serial Number:    --
LU WWN Device Id: 5 000c50 ...
Firmware Version: DE04
User Capacity:    250,059,350,016 bytes [250 GB]
Sector Size:      512 bytes logical/physical
Device is:        In smartctl database [for details use: -P show]
ATA Version is:   ATA8-ACS T13/1699-D revision 4
SATA Version is:  SATA 2.6, 3.0 Gb/s
Local Time is:    Tue Feb 23 11:37:39 2021 MSK
SMART support is: Available - device has SMART capability.
SMART support is: Enabled
AAM level is:     208 (intermediate), recommended: 208
APM level is:     128 (minimum power consumption without standby)
Rd look-ahead is: Enabled
Write cache is:   Enabled
DSN feature is:   Unavailable
ATA Security is:  Disabled, frozen [SEC2]
Wt Cache Reorder: Unknown

=== START OF READ SMART DATA SECTION ===
SMART overall-health self-assessment test result: PASSED

General SMART Values:
Offline data collection status:  (0x00)	Offline data collection activity
					was never started.
					Auto Offline Data Collection: Disabled.
Self-test execution status:      (   0)	The previous self-test routine completed
					without error or no self-test has ever 
					been run.
Total time to complete Offline 
data collection: 		(    0) seconds.
Offline data collection
capabilities: 			 (0x73) SMART execute Offline immediate.
					Auto Offline data collection on/off support.
					Suspend Offline collection upon new
					command.
					No Offline surface scan supported.
					Self-test supported.
					Conveyance Self-test supported.
					Selective Self-test supported.
SMART capabilities:            (0x0003)	Saves SMART data before entering
					power-saving mode.
					Supports SMART auto save timer.
Error logging capability:        (0x01)	Error logging supported.
					General Purpose Logging supported.
Short self-test routine 
recommended polling time: 	 (   1) minutes.
Extended self-test routine
recommended polling time: 	 (  89) minutes.
Conveyance self-test routine
recommended polling time: 	 (   2) minutes.
SCT capabilities: 	       (0x103f)	SCT Status supported.
					SCT Error Recovery Control supported.
					SCT Feature Control supported.
					SCT Data Table supported.

SMART Attributes Data Structure revision number: 10
Vendor Specific SMART Attributes with Thresholds:
ID# ATTRIBUTE_NAME          FLAGS    VALUE WORST THRESH FAIL RAW_VALUE
  1 Raw_Read_Error_Rate     POSR--   118   099   006    -    173822574
  3 Spin_Up_Time            PO----   099   099   085    -    0
  4 Start_Stop_Count        -O--CK   099   099   020    -    1728
  5 Reallocated_Sector_Ct   PO--CK   100   100   036    -    20
  7 Seek_Error_Rate         POSR--   080   060   030    -    108960506
  9 Power_On_Hours          -O--CK   094   094   000    -    5803
 10 Spin_Retry_Count        PO--C-   100   100   097    -    0
 12 Power_Cycle_Count       -O--CK   099   099   020    -    1702
184 End-to-End_Error        -O--CK   100   100   099    -    0
187 Reported_Uncorrect      -O--CK   098   098   000    -    2
188 Command_Timeout         -O--CK   100   098   000    -    47
189 High_Fly_Writes         -O-RCK   100   100   000    -    0
190 Airflow_Temperature_Cel -O---K   075   056   045    -    25 (Min/Max 23/25)
191 G-Sense_Error_Rate      -O--CK   100   100   000    -    11
192 Power-Off_Retract_Count -O--CK   100   100   000    -    1661
193 Load_Cycle_Count        -O--CK   099   099   000    -    2667
194 Temperature_Celsius     -O---K   025   044   000    -    25 (0 17 0 0 0)
195 Hardware_ECC_Recovered  -O-RC-   046   038   000    -    173822574
197 Current_Pending_Sector  -O--C-   100   100   000    -    0
198 Offline_Uncorrectable   ----C-   100   100   000    -    0
199 UDMA_CRC_Error_Count    -OSRCK   200   200   000    -    0
240 Head_Flying_Hours       ------   100   253   000    -    5778 (47 163 0)
241 Total_LBAs_Written      ------   100   253   000    -    3106663718
242 Total_LBAs_Read         ------   100   253   000    -    1940574413
                            ||||||_ K auto-keep
                            |||||__ C event count
                            ||||___ R error rate
                            |||____ S speed/performance
                            ||_____ O updated online
                            |______ P prefailure warning

General Purpose Log Directory Version 1
SMART           Log Directory Version 1 [multi-sector log support]
Address    Access  R/W   Size  Description
0x00       GPL,SL  R/O      1  Log Directory
0x01       GPL,SL  R/O      1  Summary SMART error log
0x02       GPL,SL  R/O      5  Comprehensive SMART error log
0x03       GPL,SL  R/O      5  Ext. Comprehensive SMART error log
0x06       GPL,SL  R/O      1  SMART self-test log
0x07       GPL,SL  R/O      1  Extended self-test log
0x09       GPL,SL  R/W      1  Selective self-test log
0x10       GPL,SL  R/O      1  NCQ Command Error log
0x11       GPL,SL  R/O      1  SATA Phy Event Counters log
0x21       GPL,SL  R/O      1  Write stream error log
0x22       GPL,SL  R/O      1  Read stream error log
0x80-0x9f  GPL,SL  R/W     16  Host vendor specific log
0xa1       GPL,SL  VS      20  Device vendor specific log
0xa2       GPL     VS    2248  Device vendor specific log
0xa8       GPL,SL  VS      20  Device vendor specific log
0xa9       GPL,SL  VS       1  Device vendor specific log
0xb0       GPL     VS    2819  Device vendor specific log
0xbe-0xbf  GPL     VS   65535  Device vendor specific log
0xe0       GPL,SL  R/W      1  SCT Command/Status
0xe1       GPL,SL  R/W      1  SCT Data Transfer

SMART Extended Comprehensive Error Log Version: 1 (5 sectors)
Device Error Count: 9702 (device log contains only the most recent 20 errors)
	CR     = Command Register
	FEATR  = Features Register
	COUNT  = Count (was: Sector Count) Register
	LBA_48 = Upper bytes of LBA High/Mid/Low Registers ]  ATA-8
	LH     = LBA High (was: Cylinder High) Register    ]   LBA
	LM     = LBA Mid (was: Cylinder Low) Register      ] Register
	LL     = LBA Low (was: Sector Number) Register     ]
	DV     = Device (was: Device/Head) Register
	DC     = Device Control Register
	ER     = Error register
	ST     = Status register
Powered_Up_Time is measured from power on, and printed as
DDd+hh:mm:SS.sss where DD=days, hh=hours, mm=minutes,
SS=sec, and sss=millisec. It "wraps" after 49.710 days.

Error 9702 [1] occurred at disk power-on lifetime: 16 hours (0 days + 16 hours)
  When the command that caused the error occurred, the device was active or idle.

  After command completion occurred, registers were:
  ER -- ST COUNT  LBA_48  LH LM LL DV DC
  -- -- -- == -- == == == -- -- -- -- --
  40 -- 51 00 00 00 01 18 00 64 38 00 00  Error: UNC at LBA = 0x118006438 = 4697646136

  Commands leading to the command that caused the error were:
  CR FEATR COUNT  LBA_48  LH LM LL DV DC  Powered_Up_Time  Command/Feature_Name
  -- == -- == -- == == == -- -- -- -- --  ---------------  --------------------
  60 00 00 00 78 00 01 18 00 64 b8 40 00     00:00:32.898  READ FPDMA QUEUED
  60 00 00 00 80 00 01 18 00 64 38 40 00     00:00:32.897  READ FPDMA QUEUED
  60 00 00 00 48 00 01 15 00 64 a8 40 00     00:00:32.896  READ FPDMA QUEUED
  60 00 00 00 40 00 01 15 00 64 00 40 00     00:00:32.896  READ FPDMA QUEUED
  60 00 00 00 48 00 01 14 00 64 b8 40 00     00:00:32.896  READ FPDMA QUEUED

Error 9701 [0] occurred at disk power-on lifetime: 5 hours (0 days + 5 hours)
  When the command that caused the error occurred, the device was active or idle.

  After command completion occurred, registers were:
  ER -- ST COUNT  LBA_48  LH LM LL DV DC
  -- -- -- == -- == == == -- -- -- -- --
  40 -- 51 00 00 00 02 a5 00 b4 e0 00 00  Error: UNC at LBA = 0x2a500b4e0 = 11358221536

  Commands leading to the command that caused the error were:
  CR FEATR COUNT  LBA_48  LH LM LL DV DC  Powered_Up_Time  Command/Feature_Name
  -- == -- == -- == == == -- -- -- -- --  ---------------  --------------------
  60 00 00 00 a8 00 01 99 00 a8 50 40 00     00:01:29.752  READ FPDMA QUEUED
  60 00 00 01 00 00 01 98 00 a8 50 40 00     00:01:29.752  READ FPDMA QUEUED
  60 00 00 00 20 00 02 a5 00 b4 e0 40 00     00:01:29.245  READ FPDMA QUEUED
  61 00 00 01 00 00 01 fe 00 a7 28 40 00     00:01:29.244  WRITE FPDMA QUEUED
  60 00 00 00 08 00 01 77 00 63 40 40 00     00:01:28.403  READ FPDMA QUEUED

Error 9700 [19] occurred at disk power-on lifetime: 2 hours (0 days + 2 hours)
  When the command that caused the error occurred, the device was active or idle.

  After command completion occurred, registers were:
  ER -- ST COUNT  LBA_48  LH LM LL DV DC
  -- -- -- == -- == == == -- -- -- -- --
  04 -- 71 00 04 00 00 01 00 15 83 40 00  Device Fault; Error: ABRT at LBA = 0x01001583 = 16782723

  Commands leading to the command that caused the error were:
  CR FEATR COUNT  LBA_48  LH LM LL DV DC  Powered_Up_Time  Command/Feature_Name
  -- == -- == -- == == == -- -- -- -- --  ---------------  --------------------
  60 00 00 00 40 00 02 e7 00 03 ea 40 00     00:07:52.033  READ FPDMA QUEUED
  60 00 00 00 40 00 01 99 00 bd 62 40 00     00:07:52.033  READ FPDMA QUEUED
  61 00 00 00 18 00 01 3d 00 ac e8 40 00     00:07:52.033  WRITE FPDMA QUEUED
  60 00 00 00 40 00 01 05 00 d0 72 40 00     00:07:52.033  READ FPDMA QUEUED
  ef 00 02 00 00 00 00 00 00 00 00 00 00     00:07:52.032  SET FEATURES [Enable write cache]

Error 9699 [18] occurred at disk power-on lifetime: 2 hours (0 days + 2 hours)
  When the command that caused the error occurred, the device was active or idle.

  After command completion occurred, registers were:
  ER -- ST COUNT  LBA_48  LH LM LL DV DC
  -- -- -- == -- == == == -- -- -- -- --
  04 -- 71 00 04 00 00 01 00 15 83 40 00  Device Fault; Error: ABRT

  Commands leading to the command that caused the error were:
  CR FEATR COUNT  LBA_48  LH LM LL DV DC  Powered_Up_Time  Command/Feature_Name
  -- == -- == -- == == == -- -- -- -- --  ---------------  --------------------
  ef 00 02 00 00 00 00 00 00 00 00 00 00     00:07:52.032  SET FEATURES [Enable write cache]
  00 00 00 00 00 00 00 00 00 00 00 00 ff     00:07:51.983  NOP [Abort queued commands]
  60 00 00 00 40 00 02 e7 00 03 ea 40 00     00:07:51.955  READ FPDMA QUEUED
  60 00 00 00 40 00 01 99 00 bd 62 40 00     00:07:51.955  READ FPDMA QUEUED
  61 00 00 00 18 00 01 3d 00 ac e8 40 00     00:07:51.955  WRITE FPDMA QUEUED

Error 9698 [17] occurred at disk power-on lifetime: 2 hours (0 days + 2 hours)
  When the command that caused the error occurred, the device was active or idle.

  After command completion occurred, registers were:
  ER -- ST COUNT  LBA_48  LH LM LL DV DC
  -- -- -- == -- == == == -- -- -- -- --
  04 -- 71 00 04 00 00 01 00 15 83 40 00  Device Fault; Error: ABRT at LBA = 0x01001583 = 16782723

  Commands leading to the command that caused the error were:
  CR FEATR COUNT  LBA_48  LH LM LL DV DC  Powered_Up_Time  Command/Feature_Name
  -- == -- == -- == == == -- -- -- -- --  ---------------  --------------------
  60 00 00 00 40 00 02 e7 00 03 ea 40 00     00:07:51.955  READ FPDMA QUEUED
  60 00 00 00 40 00 01 99 00 bd 62 40 00     00:07:51.955  READ FPDMA QUEUED
  61 00 00 00 18 00 01 3d 00 ac e8 40 00     00:07:51.955  WRITE FPDMA QUEUED
  60 00 00 00 40 00 01 05 00 d0 72 40 00     00:07:51.955  READ FPDMA QUEUED
  ef 00 02 00 00 00 00 00 00 00 00 00 00     00:07:51.954  SET FEATURES [Enable write cache]

Error 9697 [16] occurred at disk power-on lifetime: 2 hours (0 days + 2 hours)
  When the command that caused the error occurred, the device was active or idle.

  After command completion occurred, registers were:
  ER -- ST COUNT  LBA_48  LH LM LL DV DC
  -- -- -- == -- == == == -- -- -- -- --
  04 -- 71 00 04 00 00 01 00 15 83 40 00  Device Fault; Error: ABRT

  Commands leading to the command that caused the error were:
  CR FEATR COUNT  LBA_48  LH LM LL DV DC  Powered_Up_Time  Command/Feature_Name
  -- == -- == -- == == == -- -- -- -- --  ---------------  --------------------
  ef 00 02 00 00 00 00 00 00 00 00 00 00     00:07:51.954  SET FEATURES [Enable write cache]
  00 00 00 00 00 00 00 00 00 00 00 00 ff     00:07:51.894  NOP [Abort queued commands]
  60 00 00 00 40 00 02 e7 00 03 ea 40 00     00:07:51.861  READ FPDMA QUEUED
  60 00 00 00 40 00 01 99 00 bd 62 40 00     00:07:51.861  READ FPDMA QUEUED
  61 00 00 00 18 00 01 3d 00 ac e8 40 00     00:07:51.861  WRITE FPDMA QUEUED

Error 9696 [15] occurred at disk power-on lifetime: 2 hours (0 days + 2 hours)
  When the command that caused the error occurred, the device was active or idle.

  After command completion occurred, registers were:
  ER -- ST COUNT  LBA_48  LH LM LL DV DC
  -- -- -- == -- == == == -- -- -- -- --
  04 -- 71 00 04 00 00 01 00 15 83 40 00  Device Fault; Error: ABRT at LBA = 0x01001583 = 16782723

  Commands leading to the command that caused the error were:
  CR FEATR COUNT  LBA_48  LH LM LL DV DC  Powered_Up_Time  Command/Feature_Name
  -- == -- == -- == == == -- -- -- -- --  ---------------  --------------------
  60 00 00 00 40 00 02 e7 00 03 ea 40 00     00:07:51.861  READ FPDMA QUEUED
  60 00 00 00 40 00 01 99 00 bd 62 40 00     00:07:51.861  READ FPDMA QUEUED
  61 00 00 00 18 00 01 3d 00 ac e8 40 00     00:07:51.861  WRITE FPDMA QUEUED
  60 00 00 00 40 00 01 05 00 d0 72 40 00     00:07:51.861  READ FPDMA QUEUED
  ef 00 02 00 00 00 00 00 00 00 00 00 00     00:07:51.861  SET FEATURES [Enable write cache]

Error 9695 [14] occurred at disk power-on lifetime: 2 hours (0 days + 2 hours)
  When the command that caused the error occurred, the device was active or idle.

  After command completion occurred, registers were:
  ER -- ST COUNT  LBA_48  LH LM LL DV DC
  -- -- -- == -- == == == -- -- -- -- --
  04 -- 71 00 04 00 00 01 00 15 83 40 00  Device Fault; Error: ABRT

  Commands leading to the command that caused the error were:
  CR FEATR COUNT  LBA_48  LH LM LL DV DC  Powered_Up_Time  Command/Feature_Name
  -- == -- == -- == == == -- -- -- -- --  ---------------  --------------------
  ef 00 02 00 00 00 00 00 00 00 00 00 00     00:07:51.861  SET FEATURES [Enable write cache]
  00 00 00 00 00 00 00 00 00 00 00 00 ff     00:07:51.805  NOP [Abort queued commands]
  60 00 00 00 40 00 02 e7 00 03 ea 40 00     00:07:51.768  READ FPDMA QUEUED
  60 00 00 00 40 00 01 99 00 bd 62 40 00     00:07:51.768  READ FPDMA QUEUED
  61 00 00 00 18 00 01 3d 00 ac e8 40 00     00:07:51.768  WRITE FPDMA QUEUED

SMART Extended Self-test Log Version: 1 (1 sectors)
Num  Test_Description    Status                  Remaining  LifeTime(hours)  LBA_of_first_error
# 1  Short offline       Completed without error       00%         2         -
# 2  Short offline       Completed without error       00%         1         -
# 3  Short offline       Completed without error       00%         0         -

SMART Selective self-test log data structure revision number 1
 SPAN  MIN_LBA  MAX_LBA  CURRENT_TEST_STATUS
    1        0        0  Not_testing
    2        0        0  Not_testing
    3        0        0  Not_testing
    4        0        0  Not_testing
    5        0        0  Not_testing
Selective self-test flags (0x0):
  After scanning selected spans, do NOT read-scan remainder of disk.
If Selective self-test is pending on power-up, resume after 0 minute delay.

SCT Status Version:                  3
SCT Version (vendor specific):       522 (0x020a)
Device State:                        Active (0)
Current Temperature:                    23 Celsius
Power Cycle Min/Max Temperature:     23/23 Celsius
Lifetime    Min/Max Temperature:     17/44 Celsius
Under/Over Temperature Limit Count:   0/0

SCT Temperature History Version:     2
Temperature Sampling Period:         1 minute
Temperature Logging Interval:        1 minute
Min/Max recommended Temperature:     14/55 Celsius
Min/Max Temperature Limit:           10/60 Celsius
Temperature History Size (Index):    128 (120)

SCT Error Recovery Control:
           Read: Disabled
          Write: Disabled

Device Statistics (GP/SMART Log 0x04) not supported

Pending Defects log (GP Log 0x0c) not supported

SATA Phy Event Counters (GP Log 0x11)
ID      Size     Value  Description
0x000a  2            4  Device-to-host register FISes sent due to a COMRESET
0x0001  2            0  Command failed due to ICRC error
0x0003  2            0  R_ERR response for device-to-host data FIS
0x0004  2            0  R_ERR response for host-to-device data FIS
0x0006  2            0  R_ERR response for device-to-host non-data FIS
0x0007  2            0  R_ERR response for host-to-device non-data FIS

