smartctl 7.2 2020-12-30 r5155 [FreeBSD 13.0-RELEASE amd64] (local build)
Copyright (C) 2002-20, Bruce Allen, Christian Franke, www.smartmontools.org

=== START OF INFORMATION SECTION ===
Model Number:                       KINGSTON RBUSNS8154P3256GJ1
Serial Number:                      --
Firmware Version:                   E8FK12.3
PCI Vendor/Subsystem ID:            0x2646
IEEE OUI Identifier:                0x0026b7
Total NVM Capacity:                 256,060,514,304 [256 GB]
Unallocated NVM Capacity:           0
Controller ID:                      0
NVMe Version:                       1.2
Number of Namespaces:               1
Namespace 1 Size/Capacity:          256,060,514,304 [256 GB]
Namespace 1 Formatted LBA Size:     512
Namespace 1 IEEE EUI-64:            0026b7 ...
Local Time is:                      Tue Dec 14 02:34:48 2021 EST
Firmware Updates (0x12):            1 Slot, no Reset required
Optional Admin Commands (0x0007):   Security Format Frmw_DL
Optional NVM Commands (0x001e):     Wr_Unc DS_Mngmt Wr_Zero Sav/Sel_Feat
Log Page Attributes (0x04):         Ext_Get_Lg
Maximum Data Transfer Size:         512 Pages
Warning  Comp. Temp. Threshold:     84 Celsius
Critical Comp. Temp. Threshold:     88 Celsius

Supported Power States
St Op     Max   Active     Idle   RL RT WL WT  Ent_Lat  Ex_Lat
 0 +     7.90W  0.0790W       -    0  0  0  0      600     600
 1 +     7.90W  0.0790W       -    0  0  0  0      600     600
 2 +     7.90W  0.0790W       -    0  0  0  0      600     600
 3 -   0.1000W  0.0790W       -    3  3  3  3     1000    1000
 4 -   0.0050W  0.0790W       -    4  4  4  4   400000   90000

Supported LBA Sizes (NSID 0x1)
Id Fmt  Data  Metadt  Rel_Perf
 0 +     512       0         1
 1 -    4096       0         0

=== START OF SMART DATA SECTION ===
SMART overall-health self-assessment test result: PASSED

SMART/Health Information (NVMe Log 0x02)
Critical Warning:                   0x00
Temperature:                        40 Celsius
Available Spare:                    100%
Available Spare Threshold:          100%
Percentage Used:                    2%
Data Units Read:                    11,524,923 [5.90 TB]
Data Units Written:                 7,292,578 [3.73 TB]
Host Read Commands:                 188,562,761
Host Write Commands:                117,613,012
Controller Busy Time:               408
Power Cycles:                       718
Power On Hours:                     277
Unsafe Shutdowns:                   68
Media and Data Integrity Errors:    0
Error Information Log Entries:      1,075
Warning  Comp. Temperature Time:    0
Critical Comp. Temperature Time:    0
Temperature Sensor 2:               40 Celsius

Error Information (NVMe Log 0x01, 16 of 16 entries)
Num   ErrCount  SQId   CmdId  Status  PELoc          LBA  NSID    VS
  0       1075     0  0x008d  0x0005      -          127     1     -
  1       1074     0  0x008c  0x0005      -            3     1     -
  2       1073     0  0x0084  0x0005      -          127     1     -
  3       1072     0  0x0083  0x0005      -            3     1     -
  4       1071     0  0x000f  0x0004      -          127     1     -
  5       1070     0  0x000e  0x0004      -            3     1     -
  6       1069     0  0x0008  0x0004      -          127     1     -
  7       1068     0  0x0007  0x0004      -            3     1     -
  8       1067     0  0x0020  0x0005      -          127     1     -
  9       1066     0  0x001f  0x0005      -            3     1     -
 10       1065     0  0x0004  0x0005      -          208     0     -
 11       1064     0  0x0003  0x0005      -            3     1     -
 12       1063     0  0x0001  0x0005      -            6     -     -
 13       1062     0  0x1012  0x0005      -           12     0     -
 14       1061     0  0x1011  0x0005      -            6     0     -
 15       1060     0  0x00ed  0x0005      -          127     1     -

