smartctl 7.4 2023-08-01 r5530 [FreeBSD 14.1-RELEASE-p6 amd64] (local build)
Copyright (C) 2002-23, Bruce Allen, Christian Franke, www.smartmontools.org

=== START OF INFORMATION SECTION ===
Model Family:     Hitachi Travelstar 5K500.B
Device Model:     HTS545050B9A300
Serial Number:    --
LU WWN Device Id: 5 000cca ...
Firmware Version: PB4OCA1G
User Capacity:    500,107,862,016 bytes [500 GB]
Sector Size:      512 bytes logical/physical
Rotation Rate:    5400 rpm
Form Factor:      2.5 inches
Device is:        In smartctl database 7.3/5528
ATA Version is:   ATA8-ACS T13/1699-D revision 6
SATA Version is:  SATA 2.6, 3.0 Gb/s
Local Time is:    Fri Dec 27 07:29:32 2024 CET
SMART support is: Available - device has SMART capability.
SMART support is: Enabled
AAM feature is:   Unavailable
APM level is:     128 (minimum power consumption without standby)
Rd look-ahead is: Enabled
Write cache is:   Enabled
DSN feature is:   Unavailable
ATA Security is:  Disabled, NOT FROZEN [SEC1]
Wt Cache Reorder: Enabled

=== START OF READ SMART DATA SECTION ===
SMART overall-health self-assessment test result: PASSED

General SMART Values:
Offline data collection status:  (0x00)	Offline data collection activity
					was never started.
					Auto Offline Data Collection: Disabled.
Self-test execution status:      (   0)	The previous self-test routine completed
					without error or no self-test has ever 
					been run.
Total time to complete Offline 
data collection: 		(  645) seconds.
Offline data collection
capabilities: 			 (0x51) SMART execute Offline immediate.
					No Auto Offline data collection support.
					Suspend Offline collection upon new
					command.
					No Offline surface scan supported.
					Self-test supported.
					No Conveyance Self-test supported.
					Selective Self-test supported.
SMART capabilities:            (0x0003)	Saves SMART data before entering
					power-saving mode.
					Supports SMART auto save timer.
Error logging capability:        (0x01)	Error logging supported.
					General Purpose Logging supported.
Short self-test routine 
recommended polling time: 	 (   2) minutes.
Extended self-test routine
recommended polling time: 	 ( 158) minutes.
SCT capabilities: 	       (0x003d)	SCT Status supported.
					SCT Error Recovery Control supported.
					SCT Feature Control supported.
					SCT Data Table supported.

SMART Attributes Data Structure revision number: 16
Vendor Specific SMART Attributes with Thresholds:
ID# ATTRIBUTE_NAME          FLAGS    VALUE WORST THRESH FAIL RAW_VALUE
  1 Raw_Read_Error_Rate     POSR-K   100   075   062    -    0
  2 Throughput_Performance  P-S--K   100   100   040    -    0
  3 Spin_Up_Time            PO---K   141   100   033    -    2
  4 Start_Stop_Count        -O--CK   097   097   000    -    5001
  5 Reallocated_Sector_Ct   PO--CK   059   056   005    -    3103 (0 1738)
  7 Seek_Error_Rate         POSR-K   100   100   067    -    0
  8 Seek_Time_Performance   P-S--K   100   100   040    -    0
  9 Power_On_Hours          -O--CK   040   040   000    -    26515
 10 Spin_Retry_Count        PO--CK   100   100   060    -    0
 12 Power_Cycle_Count       -O--CK   097   097   000    -    4739
183 Runtime_Bad_Block       -O--CK   100   100   000    -    0
184 End-to-End_Error        PO--CK   100   100   097    -    0
187 Reported_Uncorrect      -O--CK   098   100   000    -    281470721224512
188 Command_Timeout         -O--CK   100   001   000    -    330726837165
190 Airflow_Temperature_Cel -O---K   071   054   045    -    29 (Min/Max 25/33)
191 G-Sense_Error_Rate      -O--CK   100   100   000    -    57
192 Power-Off_Retract_Count -O--CK   100   100   000    -    6422626
193 Load_Cycle_Count        -O--CK   001   001   000    -    5163898
196 Reallocated_Event_Count -O--CK   056   056   000    -    2395
197 Current_Pending_Sector  -O--CK   098   093   000    -    530
198 Offline_Uncorrectable   ----CK   100   100   000    -    0
199 UDMA_CRC_Error_Count    -OS-CK   100   100   000    -    0
223 Load_Retry_Count        -O-R-K   100   100   000    -    0
                            ||||||_ K auto-keep
                            |||||__ C event count
                            ||||___ R error rate
                            |||____ S speed/performance
                            ||_____ O updated online
                            |______ P prefailure warning

General Purpose Log Directory Version 1
SMART           Log Directory Version 1 [multi-sector log support]
Address    Access  R/W   Size  Description
0x00       GPL,SL  R/O      1  Log Directory
0x01           SL  R/O      1  Summary SMART error log
0x02           SL  R/O      1  Comprehensive SMART error log
0x03       GPL     R/O      1  Ext. Comprehensive SMART error log
0x06           SL  R/O      1  SMART self-test log
0x07       GPL     R/O      1  Extended self-test log
0x09           SL  R/W      1  Selective self-test log
0x10       GPL     R/O      1  NCQ Command Error log
0x11       GPL     R/O      1  SATA Phy Event Counters log
0x80-0x9f  GPL,SL  R/W     16  Host vendor specific log
0xe0       GPL,SL  R/W      1  SCT Command/Status
0xe1       GPL,SL  R/W      1  SCT Data Transfer

SMART Extended Comprehensive Error Log Version: 1 (1 sectors)
Device Error Count: 4189 (device log contains only the most recent 4 errors)
	CR     = Command Register
	FEATR  = Features Register
	COUNT  = Count (was: Sector Count) Register
	LBA_48 = Upper bytes of LBA High/Mid/Low Registers ]  ATA-8
	LH     = LBA High (was: Cylinder High) Register    ]   LBA
	LM     = LBA Mid (was: Cylinder Low) Register      ] Register
	LL     = LBA Low (was: Sector Number) Register     ]
	DV     = Device (was: Device/Head) Register
	DC     = Device Control Register
	ER     = Error register
	ST     = Status register
Powered_Up_Time is measured from power on, and printed as
DDd+hh:mm:SS.sss where DD=days, hh=hours, mm=minutes,
SS=sec, and sss=millisec. It "wraps" after 49.710 days.

Error 4189 [0] occurred at disk power-on lifetime: 5645 hours (235 days + 5 hours)
  When the command that caused the error occurred, the device was active or idle.

  After command completion occurred, registers were:
  ER -- ST COUNT  LBA_48  LH LM LL DV DC
  -- -- -- == -- == == == -- -- -- -- --
  40 -- 51 00 02 00 00 02 10 56 0e 42 00  Error: UNC at LBA = 0x0210560e = 34625038

  Commands leading to the command that caused the error were:
  CR FEATR COUNT  LBA_48  LH LM LL DV DC  Powered_Up_Time  Command/Feature_Name
  -- == -- == -- == == == -- -- -- -- --  ---------------  --------------------
  42 00 00 00 08 00 00 02 10 56 08 40 00     01:38:05.000  READ VERIFY SECTOR(S) EXT
  42 00 00 00 08 00 00 02 10 56 08 40 00     01:37:56.700  READ VERIFY SECTOR(S) EXT
  42 00 00 00 08 00 00 02 10 56 00 40 00     01:37:52.600  READ VERIFY SECTOR(S) EXT
  ec 00 00 00 00 00 00 00 00 00 00 00 00     01:37:52.600  IDENTIFY DEVICE
  ef 00 02 00 00 00 00 00 00 00 00 40 00     01:37:52.600  SET FEATURES [Enable write cache]

Error 4188 [3] occurred at disk power-on lifetime: 5645 hours (235 days + 5 hours)
  When the command that caused the error occurred, the device was active or idle.

  After command completion occurred, registers were:
  ER -- ST COUNT  LBA_48  LH LM LL DV DC
  -- -- -- == -- == == == -- -- -- -- --
  40 -- 51 00 03 00 00 02 10 56 0d 42 00  Error: UNC at LBA = 0x0210560d = 34625037

  Commands leading to the command that caused the error were:
  CR FEATR COUNT  LBA_48  LH LM LL DV DC  Powered_Up_Time  Command/Feature_Name
  -- == -- == -- == == == -- -- -- -- --  ---------------  --------------------
  42 00 00 00 08 00 00 02 10 56 08 40 00     01:37:56.700  READ VERIFY SECTOR(S) EXT
  42 00 00 00 08 00 00 02 10 56 00 40 00     01:37:52.600  READ VERIFY SECTOR(S) EXT
  ec 00 00 00 00 00 00 00 00 00 00 00 00     01:37:52.600  IDENTIFY DEVICE
  ef 00 02 00 00 00 00 00 00 00 00 40 00     01:37:52.600  SET FEATURES [Enable write cache]
  ef 00 03 00 45 00 00 00 00 00 00 40 00     01:37:52.600  SET FEATURES [Set transfer mode]

Error 4187 [2] occurred at disk power-on lifetime: 5645 hours (235 days + 5 hours)
  When the command that caused the error occurred, the device was active or idle.

  After command completion occurred, registers were:
  ER -- ST COUNT  LBA_48  LH LM LL DV DC
  -- -- -- == -- == == == -- -- -- -- --
  40 -- 51 00 02 00 00 02 10 56 06 42 00  Error: UNC at LBA = 0x02105606 = 34625030

  Commands leading to the command that caused the error were:
  CR FEATR COUNT  LBA_48  LH LM LL DV DC  Powered_Up_Time  Command/Feature_Name
  -- == -- == -- == == == -- -- -- -- --  ---------------  --------------------
  42 00 00 00 08 00 00 02 10 56 00 40 00     01:37:52.600  READ VERIFY SECTOR(S) EXT
  ec 00 00 00 00 00 00 00 00 00 00 00 00     01:37:52.600  IDENTIFY DEVICE
  ef 00 02 00 00 00 00 00 00 00 00 40 00     01:37:52.600  SET FEATURES [Enable write cache]
  ef 00 03 00 45 00 00 00 00 00 00 40 00     01:37:52.600  SET FEATURES [Set transfer mode]
  c6 00 00 00 10 00 00 00 00 00 00 40 00     01:37:52.600  SET MULTIPLE MODE

Error 4186 [1] occurred at disk power-on lifetime: 5645 hours (235 days + 5 hours)
  When the command that caused the error occurred, the device was active or idle.

  After command completion occurred, registers were:
  ER -- ST COUNT  LBA_48  LH LM LL DV DC
  -- -- -- == -- == == == -- -- -- -- --
  40 -- 51 00 02 00 00 02 10 56 06 42 00  Error: UNC at LBA = 0x02105606 = 34625030

  Commands leading to the command that caused the error were:
  CR FEATR COUNT  LBA_48  LH LM LL DV DC  Powered_Up_Time  Command/Feature_Name
  -- == -- == -- == == == -- -- -- -- --  ---------------  --------------------
  42 00 00 00 08 00 00 02 10 56 00 40 00     01:36:20.500  READ VERIFY SECTOR(S) EXT
  42 00 00 00 08 00 00 02 10 56 00 40 00     01:36:16.800  READ VERIFY SECTOR(S) EXT
  42 00 00 00 08 00 00 02 10 56 00 40 00     01:36:11.100  READ VERIFY SECTOR(S) EXT
  42 00 00 00 08 00 00 02 10 56 00 40 00     01:36:03.800  READ VERIFY SECTOR(S) EXT
  42 00 00 00 08 00 00 02 10 56 00 40 00     01:36:00.100  READ VERIFY SECTOR(S) EXT

SMART Extended Self-test Log Version: 1 (1 sectors)
No self-tests have been logged.  [To run self-tests, use: smartctl -t]

SMART Selective self-test log data structure revision number 1
 SPAN  MIN_LBA  MAX_LBA  CURRENT_TEST_STATUS
    1        0        0  Not_testing
    2        0        0  Not_testing
    3        0        0  Not_testing
    4        0        0  Not_testing
    5        0        0  Not_testing
Selective self-test flags (0x0):
  After scanning selected spans, do NOT read-scan remainder of disk.
If Selective self-test is pending on power-up, resume after 0 minute delay.

SCT Status Version:                  3
SCT Version (vendor specific):       256 (0x0100)
Device State:                        Active (0)
Current Temperature:                    29 Celsius
Power Cycle Min/Max Temperature:     25/33 Celsius
Lifetime    Min/Max Temperature:     12/46 Celsius
Specified Max Operating Temperature:    30 Celsius
Under/Over Temperature Limit Count:   0/0

SCT Temperature History Version:     2
Temperature Sampling Period:         1 minute
Temperature Logging Interval:        1 minute
Min/Max recommended Temperature:      5/60 Celsius
Min/Max Temperature Limit:           -40/65 Celsius
Temperature History Size (Index):    478 (259)

SCT Error Recovery Control:
           Read:     85 (8.5 seconds)
          Write:     85 (8.5 seconds)

Device Statistics (GP/SMART Log 0x04) not supported

Pending Defects log (GP Log 0x0c) not supported

SATA Phy Event Counters (GP Log 0x11)
ID      Size     Value  Description
0x0001  2            0  Command failed due to ICRC error
0x0002  2            0  R_ERR response for data FIS
0x0005  2            0  R_ERR response for non-data FIS
0x0009  2          127  Transition from drive PhyRdy to drive PhyNRdy
0x000a  2          127  Device-to-host register FISes sent due to a COMRESET
0x000b  2            0  CRC errors within host-to-device FIS
0x000d  2            0  Non-CRC errors within host-to-device FIS

