smartctl 7.4 2023-08-01 r5530 [OpenBSD 7.6 amd64] (local build)
Copyright (C) 2002-23, Bruce Allen, Christian Franke, www.smartmontools.org

=== START OF INFORMATION SECTION ===
Model Family:     Seagate Video 3.5 HDD
Device Model:     ST1000VM002-1SD102
Serial Number:    --
LU WWN Device Id: 5 000c50 ...
Firmware Version: SC11
User Capacity:    1,000,204,886,016 bytes [1.00 TB]
Sector Sizes:     512 bytes logical, 4096 bytes physical
Rotation Rate:    5900 rpm
Form Factor:      3.5 inches
Device is:        In smartctl database 7.3/5528
ATA Version is:   ATA8-ACS T13/1699-D revision 4
SATA Version is:  SATA 3.1, 6.0 Gb/s (current: 6.0 Gb/s)
Local Time is:    Sat Nov  9 08:17:39 2024 -03
SMART support is: Available - device has SMART capability.
SMART support is: Enabled

=== START OF READ SMART DATA SECTION ===
SMART Status not supported: Incomplete response, ATA output registers missing
SMART overall-health self-assessment test result: PASSED
Warning: This result is based on an Attribute check.

General SMART Values:
Offline data collection status:  (0x00)	Offline data collection activity
					was never started.
					Auto Offline Data Collection: Disabled.
Self-test execution status:      (   0)	The previous self-test routine completed
					without error or no self-test has ever 
					been run.
Total time to complete Offline 
data collection: 		(    0) seconds.
Offline data collection
capabilities: 			 (0x73) SMART execute Offline immediate.
					Auto Offline data collection on/off support.
					Suspend Offline collection upon new
					command.
					No Offline surface scan supported.
					Self-test supported.
					Conveyance Self-test supported.
					Selective Self-test supported.
SMART capabilities:            (0x0003)	Saves SMART data before entering
					power-saving mode.
					Supports SMART auto save timer.
Error logging capability:        (0x01)	Error logging supported.
					General Purpose Logging supported.
Short self-test routine 
recommended polling time: 	 (   1) minutes.
Extended self-test routine
recommended polling time: 	 ( 125) minutes.
Conveyance self-test routine
recommended polling time: 	 (   2) minutes.
SCT capabilities: 	       (0x10bb)	SCT Status supported.
					SCT Error Recovery Control supported.
					SCT Feature Control supported.
					SCT Data Table supported.

SMART Attributes Data Structure revision number: 10
Vendor Specific SMART Attributes with Thresholds:
ID# ATTRIBUTE_NAME          FLAG     VALUE WORST THRESH TYPE      UPDATED  WHEN_FAILED RAW_VALUE
  1 Raw_Read_Error_Rate     0x000f   081   063   006    Pre-fail  Always       -       123557921
  3 Spin_Up_Time            0x0003   097   097   000    Pre-fail  Always       -       0
  4 Start_Stop_Count        0x0032   099   099   020    Old_age   Always       -       1797
  5 Reallocated_Sector_Ct   0x0033   100   100   010    Pre-fail  Always       -       0
  7 Seek_Error_Rate         0x000f   087   060   045    Pre-fail  Always       -       485297733
  9 Power_On_Hours          0x0032   083   083   000    Old_age   Always       -       15499
 10 Spin_Retry_Count        0x0013   100   100   097    Pre-fail  Always       -       0
 12 Power_Cycle_Count       0x0032   099   099   020    Old_age   Always       -       1481
184 End-to-End_Error        0x0032   100   100   099    Old_age   Always       -       0
187 Reported_Uncorrect      0x0032   100   100   000    Old_age   Always       -       0
188 Command_Timeout         0x0032   100   099   000    Old_age   Always       -       524299
189 High_Fly_Writes         0x003a   100   100   000    Old_age   Always       -       0
190 Airflow_Temperature_Cel 0x0022   072   052   040    Old_age   Always       -       28 (Min/Max 22/28)
193 Load_Cycle_Count        0x0032   099   099   000    Old_age   Always       -       2276
194 Temperature_Celsius     0x0022   028   008   000    Old_age   Always       -       28 (0 8 0 0 0)
195 Hardware_ECC_Recovered  0x001a   001   001   000    Old_age   Always       -       123557921
197 Current_Pending_Sector  0x0012   100   100   000    Old_age   Always       -       0
198 Offline_Uncorrectable   0x0010   100   100   000    Old_age   Offline      -       0
199 UDMA_CRC_Error_Count    0x003e   200   200   000    Old_age   Always       -       0

SMART Error Log Version: 1
No Errors Logged

SMART Self-test log structure revision number 1
Num  Test_Description    Status                  Remaining  LifeTime(hours)  LBA_of_first_error
# 1  Short offline       Completed without error       00%     14452         -
# 2  Selective offline   Completed without error       00%     11417         -
# 3  Selective offline   Aborted by host               90%     11416         -
# 4  Selective offline   Aborted by host               90%     11415         -
# 5  Selective offline   Aborted by host               90%     11414         -
# 6  Selective offline   Aborted by host               90%     11411         -
# 7  Selective offline   Aborted by host               90%     11410         -
# 8  Selective offline   Aborted by host               90%     11409         -
# 9  Selective offline   Aborted by host               90%     11408         -
#10  Selective offline   Aborted by host               90%     11407         -
#11  Selective offline   Aborted by host               90%     11406         -
#12  Selective offline   Aborted by host               90%     11405         -
#13  Selective offline   Aborted by host               90%     11404         -
#14  Selective offline   Aborted by host               90%     11403         -
#15  Selective offline   Aborted by host               90%     11401         -
#16  Selective offline   Aborted by host               90%     11400         -
#17  Selective offline   Aborted by host               90%     11399         -
#18  Selective offline   Aborted by host               90%     11398         -
#19  Selective offline   Completed without error       00%     10677         -
#20  Selective offline   Aborted by host               90%     10673         -
#21  Selective offline   Aborted by host               90%     10672         -

SMART Selective self-test log data structure revision number 1
 SPAN     MIN_LBA     MAX_LBA  CURRENT_TEST_STATUS
    1  1932266008  1953525167  Not_testing
    2           0           0  Not_testing
    3           0           0  Not_testing
    4           0           0  Not_testing
    5           0           0  Not_testing
Selective self-test flags (0x0):
  After scanning selected spans, do NOT read-scan remainder of disk.
If Selective self-test is pending on power-up, resume after 0 minute delay.

The above only provides legacy SMART information - try 'smartctl -x' for more



