smartctl 7.3 2022-02-28 r5338 [FreeBSD 13.0-STABLE amd64] (local build)
Copyright (C) 2002-22, Bruce Allen, Christian Franke, www.smartmontools.org

=== START OF INFORMATION SECTION ===
Model Family:     JMicron/Maxiotek based SSDs
Device Model:     KingSpec KDM-SA.51-008GMJ
Serial Number:    --
Firmware Version: 120202
User Capacity:    8,012,390,400 bytes [8.01 GB]
Sector Size:      512 bytes logical/physical
Rotation Rate:    Solid State Device
Form Factor:      2.5 inches
TRIM Command:     Available
Device is:        In smartctl database 7.3/5319
ATA Version is:   ATA8-ACS (minor revision not indicated)
SATA Version is:  SATA 2.6, 3.0 Gb/s
Local Time is:    Sat May 14 20:51:58 2022 CDT
SMART support is: Available - device has SMART capability.
SMART support is: Enabled
AAM feature is:   Unavailable
APM feature is:   Disabled
Rd look-ahead is: Enabled
Write cache is:   Enabled
DSN feature is:   Unavailable
ATA Security is:  Disabled, NOT FROZEN [SEC1]
Wt Cache Reorder: Unavailable

=== START OF READ SMART DATA SECTION ===
SMART overall-health self-assessment test result: PASSED

General SMART Values:
Offline data collection status:  (0x00)	Offline data collection activity
					was never started.
					Auto Offline Data Collection: Disabled.
Total time to complete Offline 
data collection: 		(   30) seconds.
Offline data collection
capabilities: 			 (0x00) 	Offline data collection not supported.
SMART capabilities:            (0x0003)	Saves SMART data before entering
					power-saving mode.
					Supports SMART auto save timer.
Error logging capability:        (0x00)	Error logging NOT supported.
					No General Purpose Logging support.

SMART Attributes Data Structure revision number: 16
Vendor Specific SMART Attributes with Thresholds:
ID# ATTRIBUTE_NAME          FLAGS    VALUE WORST THRESH FAIL RAW_VALUE
  1 Raw_Read_Error_Rate     PO-R--   100   100   050    -    16777215
  2 Throughput_Performance  P-S---   100   100   050    -    0
  3 Unknown_JMF_Attribute   POS---   100   100   050    -    0
  5 Reallocated_Sector_Ct   PO--C-   100   100   050    -    0
  7 Unknown_JMF_Attribute   PO-R--   100   100   050    -    0
  8 Unknown_JMF_Attribute   P-S---   100   100   050    -    0
  9 Power_On_Hours          -O--C-   100   100   000    -    7
 10 Unknown_JMF_Attribute   PO--C-   100   100   050    -    0
 12 Power_Cycle_Count       -O--C-   100   100   000    -    40
168 SATA_Phy_Error_Count    -O--C-   100   100   000    -    0
175 Bad_Cluster_Table_Count PO----   100   100   010    -    0
192 Unexpect_Power_Loss_Ct  -O--C-   100   100   000    -    0
194 Temperature_Celsius     -O---K   040   100   000    -    40 (Min/Max 30/60)
197 Current_Pending_Sector  -O--C-   100   100   000    -    0
240 Unknown_JMF_Attribute   PO--C-   100   100   050    -    0
170 Bad_Block_Count         PO----   100   100   010    -    0 4 0
173 Erase_Count             -O--C-   100   100   000    -    0 42 10
                            ||||||_ K auto-keep
                            |||||__ C event count
                            ||||___ R error rate
                            |||____ S speed/performance
                            ||_____ O updated online
                            |______ P prefailure warning

Read SMART Log Directory failed: Input/output error

General Purpose Log Directory not supported

SMART Extended Comprehensive Error Log (GP Log 0x03) not supported

SMART Error Log not supported

SMART Extended Self-test Log (GP Log 0x07) not supported

SMART Self-test Log not supported

Selective Self-tests/Logging not supported

SCT Commands not supported

Device Statistics (GP/SMART Log 0x04) not supported

Pending Defects log (GP Log 0x0c) not supported

SATA Phy Event Counters (GP Log 0x11) not supported



