smartctl 7.3 2022-02-28 r5338 [FreeBSD 13.1-RELEASE-p5 amd64] (local build)
Copyright (C) 2002-22, Bruce Allen, Christian Franke, www.smartmontools.org

=== START OF INFORMATION SECTION ===
Model Family:     Silicon Motion based SSDs
Device Model:     TS128GMTS400S
Serial Number:    --
Firmware Version: Q0926B
User Capacity:    128,035,676,160 bytes [128 GB]
Sector Size:      512 bytes logical/physical
Rotation Rate:    Solid State Device
Form Factor:      M.2
TRIM Command:     Available
Device is:        In smartctl database 7.3/5319
ATA Version is:   ACS-2 (minor revision not indicated)
SATA Version is:  SATA 3.1, 6.0 Gb/s (current: 6.0 Gb/s)
Local Time is:    Mon Jan 23 11:44:05 2023 MSK
SMART support is: Available - device has SMART capability.
SMART support is: Enabled
AAM feature is:   Unavailable
APM feature is:   Unavailable
Rd look-ahead is: Enabled
Write cache is:   Enabled
DSN feature is:   Unavailable
ATA Security is:  Disabled, frozen [SEC2]
Wt Cache Reorder: Unavailable

=== START OF READ SMART DATA SECTION ===
SMART overall-health self-assessment test result: PASSED

General SMART Values:
Offline data collection status:  (0x80)	Offline data collection activity
					was never started.
					Auto Offline Data Collection: Enabled.
Self-test execution status:      (   0)	The previous self-test routine completed
					without error or no self-test has ever 
					been run.
Total time to complete Offline 
data collection: 		(    0) seconds.
Offline data collection
capabilities: 			 (0x71) SMART execute Offline immediate.
					No Auto Offline data collection support.
					Suspend Offline collection upon new
					command.
					No Offline surface scan supported.
					Self-test supported.
					Conveyance Self-test supported.
					Selective Self-test supported.
SMART capabilities:            (0x0002)	Does not save SMART data before
					entering power-saving mode.
					Supports SMART auto save timer.
Error logging capability:        (0x01)	Error logging supported.
					General Purpose Logging supported.
Short self-test routine 
recommended polling time: 	 (   2) minutes.
Extended self-test routine
recommended polling time: 	 (  10) minutes.
Conveyance self-test routine
recommended polling time: 	 (   2) minutes.

SMART Attributes Data Structure revision number: 1
Vendor Specific SMART Attributes with Thresholds:
ID# ATTRIBUTE_NAME          FLAGS    VALUE WORST THRESH FAIL RAW_VALUE
  1 Raw_Read_Error_Rate     ------   100   100   000    -    0
  5 Reallocated_Sector_Ct   ------   100   100   000    -    0
  9 Power_On_Hours          ------   100   100   000    -    790
 12 Power_Cycle_Count       ------   100   100   000    -    863
148 Total_SLC_Erase_Ct      ------   100   100   000    -    430
149 Max_SLC_Erase_Ct        ------   100   100   000    -    56
150 Min_SLC_Erase_Ct        ------   100   100   000    -    0
151 Average_SLC_Erase_Ct    ------   100   100   000    -    26
159 DRAM_1_Bit_Error_Count  ------   100   100   000    -    0
160 Uncorrectable_Error_Cnt ------   100   100   000    -    0
161 Valid_Spare_Block_Cnt   ------   100   100   000    -    12
163 Initial_Bad_Block_Count ------   100   100   000    -    8
164 Total_Erase_Count       ------   100   100   000    -    35170
165 Max_Erase_Count         ------   100   100   000    -    85
166 Min_Erase_Count         ------   100   100   000    -    26
167 Average_Erase_Count     ------   100   100   000    -    67
168 Max_Erase_Count_of_Spec ------   100   100   000    -    1000
169 Remaining_Lifetime_Perc ------   100   100   000    -    94
177 Wear_Leveling_Count     ------   100   100   050    -    0
181 Program_Fail_Cnt_Total  ------   100   100   000    -    0
182 Erase_Fail_Count_Total  ------   100   100   000    -    0
187 Reported_Uncorrect      ------   100   100   000    -    0
192 Power-Off_Retract_Count ------   100   100   000    -    66
194 Temperature_Celsius     ------   100   100   000    -    55
196 Reallocated_Event_Count ------   100   100   016    -    0
199 UDMA_CRC_Error_Count    ------   100   100   050    -    0
232 Available_Reservd_Space ------   100   100   000    -    100
241 Host_Writes_32MiB       ------   100   100   000    -    61669
242 Host_Reads_32MiB        ------   100   100   000    -    62554
245 TLC_Writes_32MiB        ------   100   100   000    -    281360
                            ||||||_ K auto-keep
                            |||||__ C event count
                            ||||___ R error rate
                            |||____ S speed/performance
                            ||_____ O updated online
                            |______ P prefailure warning

General Purpose Log Directory Version 1
SMART           Log Directory Version 1 [multi-sector log support]
Address    Access  R/W   Size  Description
0x00       GPL,SL  R/O      1  Log Directory
0x01           SL  R/O      1  Summary SMART error log
0x02           SL  R/O      1  Comprehensive SMART error log
0x03       GPL     R/O      1  Ext. Comprehensive SMART error log
0x04       GPL,SL  R/O      8  Device Statistics log
0x06           SL  R/O      1  SMART self-test log
0x07       GPL     R/O      1  Extended self-test log
0x09           SL  R/W      1  Selective self-test log
0x10       GPL     R/O      1  NCQ Command Error log
0x24       GPL     R/O     88  Current Device Internal Status Data log
0x25       GPL     R/O    128  Saved Device Internal Status Data log
0x30       GPL,SL  R/O      9  IDENTIFY DEVICE data log
0x80-0x9f  GPL,SL  R/W     16  Host vendor specific log

SMART Extended Comprehensive Error Log Version: 1 (1 sectors)
No Errors Logged

SMART Extended Self-test Log Version: 0 (1 sectors)
No self-tests have been logged.  [To run self-tests, use: smartctl -t]

SMART Selective self-test log data structure revision number 1
 SPAN  MIN_LBA  MAX_LBA  CURRENT_TEST_STATUS
    1        0        0  Not_testing
    2        0        0  Not_testing
    3        0        0  Not_testing
    4        0        0  Not_testing
    5        0        0  Completed [00% left] (0-65535)
Selective self-test flags (0x0):
  After scanning selected spans, do NOT read-scan remainder of disk.
If Selective self-test is pending on power-up, resume after 0 minute delay.

SCT Commands not supported

Device Statistics (GP Log 0x04)
Page  Offset Size        Value Flags Description
0x01  =====  =               =  ===  == General Statistics (rev 2) ==
0x01  0x008  4             863  ---  Lifetime Power-On Resets
0x01  0x010  4             790  ---  Power-on Hours
0x01  0x018  6      4041576335  ---  Logical Sectors Written
0x01  0x020  6        31236127  ---  Number of Write Commands
0x01  0x028  6      4099578394  ---  Logical Sectors Read
0x01  0x030  6        34773925  ---  Number of Read Commands
0x04  =====  =               =  ===  == General Errors Statistics (rev 1) ==
0x04  0x008  4               0  ---  Number of Reported Uncorrectable Errors
0x04  0x010  4              66  ---  Resets Between Cmd Acceptance and Completion
0x05  =====  =               =  ===  == Temperature Statistics (rev 1) ==
0x05  0x008  1              55  ---  Current Temperature
0x05  0x020  1               0  ---  Highest Temperature
0x05  0x028  1               0  ---  Lowest Temperature
0x05  0x058  1              85  ---  Specified Maximum Operating Temperature
0x06  =====  =               =  ===  == Transport Statistics (rev 1) ==
0x06  0x008  4            2345  ---  Number of Hardware Resets
0x06  0x010  4               0  ---  Number of ASR Events
0x06  0x018  4               0  ---  Number of Interface CRC Errors
0x07  =====  =               =  ===  == Solid State Device Statistics (rev 1) ==
0x07  0x008  1               6  ---  Percentage Used Endurance Indicator
                                |||_ C monitored condition met
                                ||__ D supports DSN
                                |___ N normalized value

Pending Defects log (GP Log 0x0c) not supported

SATA Phy Event Counters (GP Log 0x11) not supported

