smartctl 7.2 2020-12-30 r5155 [FreeBSD 13.0-RELEASE amd64] (local build)
Copyright (C) 2002-20, Bruce Allen, Christian Franke, www.smartmontools.org

=== START OF INFORMATION SECTION ===
Device Model:     ST320LT020-9YG142
Serial Number:    --
LU WWN Device Id: 5 000c50 ...
Firmware Version: 0010SDM1
User Capacity:    320,072,933,376 bytes [320 GB]
Sector Sizes:     512 bytes logical, 4096 bytes physical
Rotation Rate:    5400 rpm
Device is:        Not in smartctl database [for details use: -P showall]
ATA Version is:   ATA8-ACS T13/1699-D revision 4
SATA Version is:  SATA 2.6, 3.0 Gb/s
Local Time is:    Thu Jul  7 12:44:40 2022 EDT
SMART support is: Available - device has SMART capability.
SMART support is: Enabled
AAM feature is:   Unavailable
APM level is:     128 (minimum power consumption without standby)
Rd look-ahead is: Enabled
Write cache is:   Enabled
DSN feature is:   Unavailable
ATA Security is:  Disabled, frozen [SEC2]
Wt Cache Reorder: Unknown

=== START OF READ SMART DATA SECTION ===
SMART overall-health self-assessment test result: PASSED

General SMART Values:
Offline data collection status:  (0x00)	Offline data collection activity
					was never started.
					Auto Offline Data Collection: Disabled.
Self-test execution status:      (   0)	The previous self-test routine completed
					without error or no self-test has ever 
					been run.
Total time to complete Offline 
data collection: 		(    0) seconds.
Offline data collection
capabilities: 			 (0x73) SMART execute Offline immediate.
					Auto Offline data collection on/off support.
					Suspend Offline collection upon new
					command.
					No Offline surface scan supported.
					Self-test supported.
					Conveyance Self-test supported.
					Selective Self-test supported.
SMART capabilities:            (0x0003)	Saves SMART data before entering
					power-saving mode.
					Supports SMART auto save timer.
Error logging capability:        (0x01)	Error logging supported.
					General Purpose Logging supported.
Short self-test routine 
recommended polling time: 	 (   2) minutes.
Extended self-test routine
recommended polling time: 	 (  80) minutes.
Conveyance self-test routine
recommended polling time: 	 (   3) minutes.
SCT capabilities: 	       (0x303f)	SCT Status supported.
					SCT Error Recovery Control supported.
					SCT Feature Control supported.
					SCT Data Table supported.

SMART Attributes Data Structure revision number: 10
Vendor Specific SMART Attributes with Thresholds:
ID# ATTRIBUTE_NAME          FLAGS    VALUE WORST THRESH FAIL RAW_VALUE
  1 Raw_Read_Error_Rate     POSR--   115   099   006    -    100115472
  3 Spin_Up_Time            PO----   099   099   085    -    0
  4 Start_Stop_Count        -O--CK   093   093   020    -    8013
  5 Reallocated_Sector_Ct   PO--CK   100   100   036    -    0
  7 Seek_Error_Rate         POSR--   079   060   030    -    96221173
  9 Power_On_Hours          -O--CK   096   096   000    -    4011
 10 Spin_Retry_Count        PO--C-   100   100   097    -    0
 12 Power_Cycle_Count       -O--CK   096   096   020    -    5026
184 End-to-End_Error        -O--CK   100   100   099    -    0
187 Reported_Uncorrect      -O--CK   090   090   000    -    10
188 Command_Timeout         -O--CK   100   098   000    -    85
189 High_Fly_Writes         -O-RCK   100   100   000    -    0
190 Airflow_Temperature_Cel -O---K   063   046   045    -    37 (Min/Max 33/38)
191 G-Sense_Error_Rate      -O--CK   100   100   000    -    71
192 Power-Off_Retract_Count -O--CK   100   100   000    -    415
193 Load_Cycle_Count        -O--CK   052   052   000    -    96098
194 Temperature_Celsius     -O---K   037   054   000    -    37 (0 18 0 0 0)
195 Hardware_ECC_Recovered  -O-RC-   053   039   000    -    100115472
197 Current_Pending_Sector  -O--C-   100   100   000    -    0
198 Offline_Uncorrectable   ----C-   100   100   000    -    0
199 UDMA_CRC_Error_Count    -OSRCK   200   200   000    -    0
240 Head_Flying_Hours       ------   100   253   000    -    3361 (24 209 0)
241 Total_LBAs_Written      ------   100   253   000    -    1129981037
242 Total_LBAs_Read         ------   100   253   000    -    1555406433
250 Read_Error_Retry_Rate   ------   001   001   000    -    22555
251 Unknown_Attribute       ------   100   001   000    -    2007
252 Unknown_Attribute       ------   100   001   000    -    17
254 Free_Fall_Sensor        -O--CK   100   100   000    -    0
                            ||||||_ K auto-keep
                            |||||__ C event count
                            ||||___ R error rate
                            |||____ S speed/performance
                            ||_____ O updated online
                            |______ P prefailure warning

General Purpose Log Directory Version 1
SMART           Log Directory Version 1 [multi-sector log support]
Address    Access  R/W   Size  Description
0x00       GPL,SL  R/O      1  Log Directory
0x01           SL  R/O      1  Summary SMART error log
0x02           SL  R/O      5  Comprehensive SMART error log
0x03       GPL     R/O      5  Ext. Comprehensive SMART error log
0x06           SL  R/O      1  SMART self-test log
0x07       GPL     R/O      1  Extended self-test log
0x09           SL  R/W      1  Selective self-test log
0x10       GPL     R/O      1  NCQ Command Error log
0x11       GPL     R/O      1  SATA Phy Event Counters log
0x21       GPL     R/O      1  Write stream error log
0x22       GPL     R/O      1  Read stream error log
0x80-0x9f  GPL,SL  R/W     16  Host vendor specific log
0xa1       GPL,SL  VS      20  Device vendor specific log
0xa2       GPL     VS    2248  Device vendor specific log
0xa8       GPL,SL  VS      65  Device vendor specific log
0xa9       GPL,SL  VS       1  Device vendor specific log
0xab       GPL     VS       1  Device vendor specific log
0xb0       GPL     VS    2864  Device vendor specific log
0xbd       GPL     VS       1  Device vendor specific log
0xbe-0xbf  GPL     VS   65535  Device vendor specific log
0xe0       GPL,SL  R/W      1  SCT Command/Status
0xe1       GPL,SL  R/W      1  SCT Data Transfer

SMART Extended Comprehensive Error Log Version: 1 (5 sectors)
Device Error Count: 10
	CR     = Command Register
	FEATR  = Features Register
	COUNT  = Count (was: Sector Count) Register
	LBA_48 = Upper bytes of LBA High/Mid/Low Registers ]  ATA-8
	LH     = LBA High (was: Cylinder High) Register    ]   LBA
	LM     = LBA Mid (was: Cylinder Low) Register      ] Register
	LL     = LBA Low (was: Sector Number) Register     ]
	DV     = Device (was: Device/Head) Register
	DC     = Device Control Register
	ER     = Error register
	ST     = Status register
Powered_Up_Time is measured from power on, and printed as
DDd+hh:mm:SS.sss where DD=days, hh=hours, mm=minutes,
SS=sec, and sss=millisec. It "wraps" after 49.710 days.

Error 10 [9] occurred at disk power-on lifetime: 3577 hours (149 days + 1 hours)
  When the command that caused the error occurred, the device was active or idle.

  After command completion occurred, registers were:
  ER -- ST COUNT  LBA_48  LH LM LL DV DC
  -- -- -- == -- == == == -- -- -- -- --
  40 -- 51 00 00 00 00 03 55 55 40 00 00  Error: WP at LBA = 0x03555540 = 55924032

  Commands leading to the command that caused the error were:
  CR FEATR COUNT  LBA_48  LH LM LL DV DC  Powered_Up_Time  Command/Feature_Name
  -- == -- == -- == == == -- -- -- -- --  ---------------  --------------------
  61 00 00 00 08 00 00 00 5e dd 80 40 00     00:26:01.753  WRITE FPDMA QUEUED
  61 00 00 00 08 00 00 00 5f 1a c8 40 00     00:26:01.752  WRITE FPDMA QUEUED
  61 00 00 00 08 00 00 02 42 ae 46 40 00     00:26:01.752  WRITE FPDMA QUEUED
  61 00 00 00 08 00 00 02 42 ae 3e 40 00     00:26:01.751  WRITE FPDMA QUEUED
  61 00 00 00 08 00 00 02 42 ae 36 40 00     00:26:01.751  WRITE FPDMA QUEUED

Error 9 [8] occurred at disk power-on lifetime: 3577 hours (149 days + 1 hours)
  When the command that caused the error occurred, the device was active or idle.

  After command completion occurred, registers were:
  ER -- ST COUNT  LBA_48  LH LM LL DV DC
  -- -- -- == -- == == == -- -- -- -- --
  40 -- 51 00 00 00 00 03 55 55 40 00 00  Error: WP at LBA = 0x03555540 = 55924032

  Commands leading to the command that caused the error were:
  CR FEATR COUNT  LBA_48  LH LM LL DV DC  Powered_Up_Time  Command/Feature_Name
  -- == -- == -- == == == -- -- -- -- --  ---------------  --------------------
  61 00 00 00 08 00 00 00 63 2b 00 40 00     00:25:58.686  WRITE FPDMA QUEUED
  61 00 00 00 08 00 00 00 65 92 10 40 00     00:25:58.685  WRITE FPDMA QUEUED
  61 00 00 00 08 00 00 00 64 6c e0 40 00     00:25:58.685  WRITE FPDMA QUEUED
  61 00 00 00 10 00 00 00 64 09 70 40 00     00:25:58.684  WRITE FPDMA QUEUED
  61 00 00 00 08 00 00 00 63 c9 c0 40 00     00:25:58.683  WRITE FPDMA QUEUED

Error 8 [7] occurred at disk power-on lifetime: 3577 hours (149 days + 1 hours)
  When the command that caused the error occurred, the device was active or idle.

  After command completion occurred, registers were:
  ER -- ST COUNT  LBA_48  LH LM LL DV DC
  -- -- -- == -- == == == -- -- -- -- --
  40 -- 51 00 00 00 00 03 55 55 40 00 00  Error: WP at LBA = 0x03555540 = 55924032

  Commands leading to the command that caused the error were:
  CR FEATR COUNT  LBA_48  LH LM LL DV DC  Powered_Up_Time  Command/Feature_Name
  -- == -- == -- == == == -- -- -- -- --  ---------------  --------------------
  61 00 00 00 08 00 00 00 5e dd 78 40 00     00:25:54.786  WRITE FPDMA QUEUED
  61 00 00 00 08 00 00 00 5e dd 80 40 00     00:25:54.785  WRITE FPDMA QUEUED
  60 00 00 01 00 00 00 03 55 54 a0 40 00     00:25:54.784  READ FPDMA QUEUED
  61 00 00 00 10 00 00 00 5f 1a b8 40 00     00:25:54.784  WRITE FPDMA QUEUED
  ef 00 90 00 03 00 00 00 00 00 00 00 00     00:25:54.784  SET FEATURES [Disable SATA feature]

Error 7 [6] occurred at disk power-on lifetime: 3577 hours (149 days + 1 hours)
  When the command that caused the error occurred, the device was active or idle.

  After command completion occurred, registers were:
  ER -- ST COUNT  LBA_48  LH LM LL DV DC
  -- -- -- == -- == == == -- -- -- -- --
  40 -- 51 00 00 00 00 03 55 55 40 00 00  Error: WP at LBA = 0x03555540 = 55924032

  Commands leading to the command that caused the error were:
  CR FEATR COUNT  LBA_48  LH LM LL DV DC  Powered_Up_Time  Command/Feature_Name
  -- == -- == -- == == == -- -- -- -- --  ---------------  --------------------
  61 00 00 00 08 00 00 00 03 ae 88 40 00     00:25:50.843  WRITE FPDMA QUEUED
  61 00 00 00 08 00 00 00 63 31 50 40 00     00:25:50.842  WRITE FPDMA QUEUED
  61 00 00 00 08 00 00 00 5e dd 88 40 00     00:25:50.842  WRITE FPDMA QUEUED
  60 00 00 01 00 00 00 03 55 54 a0 40 00     00:25:50.841  READ FPDMA QUEUED
  61 00 00 00 01 00 00 00 3c 41 e0 40 00     00:25:50.840  WRITE FPDMA QUEUED

Error 6 [5] occurred at disk power-on lifetime: 3577 hours (149 days + 1 hours)
  When the command that caused the error occurred, the device was active or idle.

  After command completion occurred, registers were:
  ER -- ST COUNT  LBA_48  LH LM LL DV DC
  -- -- -- == -- == == == -- -- -- -- --
  40 -- 51 00 00 00 00 03 55 55 40 00 00  Error: WP at LBA = 0x03555540 = 55924032

  Commands leading to the command that caused the error were:
  CR FEATR COUNT  LBA_48  LH LM LL DV DC  Powered_Up_Time  Command/Feature_Name
  -- == -- == -- == == == -- -- -- -- --  ---------------  --------------------
  61 00 00 00 08 00 00 00 03 ae 88 40 00     00:25:46.874  WRITE FPDMA QUEUED
  61 00 00 00 08 00 00 00 63 31 50 40 00     00:25:46.873  WRITE FPDMA QUEUED
  61 00 00 00 08 00 00 00 5e dd 80 40 00     00:25:46.872  WRITE FPDMA QUEUED
  61 00 00 00 08 00 00 00 66 95 00 40 00     00:25:46.871  WRITE FPDMA QUEUED
  61 00 00 00 08 00 00 00 3c 59 f8 40 00     00:25:46.871  WRITE FPDMA QUEUED

Error 5 [4] occurred at disk power-on lifetime: 3577 hours (149 days + 1 hours)
  When the command that caused the error occurred, the device was active or idle.

  After command completion occurred, registers were:
  ER -- ST COUNT  LBA_48  LH LM LL DV DC
  -- -- -- == -- == == == -- -- -- -- --
  40 -- 51 00 00 00 00 03 55 55 40 00 00  Error: WP at LBA = 0x03555540 = 55924032

  Commands leading to the command that caused the error were:
  CR FEATR COUNT  LBA_48  LH LM LL DV DC  Powered_Up_Time  Command/Feature_Name
  -- == -- == -- == == == -- -- -- -- --  ---------------  --------------------
  61 00 00 00 08 00 00 00 03 ae 88 40 00     00:25:42.994  WRITE FPDMA QUEUED
  61 00 00 00 08 00 00 00 63 31 50 40 00     00:25:42.994  WRITE FPDMA QUEUED
  61 00 00 00 08 00 00 00 5e dd 88 40 00     00:25:42.993  WRITE FPDMA QUEUED
  60 00 00 01 00 00 00 03 55 54 a0 40 00     00:25:42.992  READ FPDMA QUEUED
  61 00 00 00 01 00 00 00 3c 41 e0 40 00     00:25:42.992  WRITE FPDMA QUEUED

Error 4 [3] occurred at disk power-on lifetime: 3577 hours (149 days + 1 hours)
  When the command that caused the error occurred, the device was active or idle.

  After command completion occurred, registers were:
  ER -- ST COUNT  LBA_48  LH LM LL DV DC
  -- -- -- == -- == == == -- -- -- -- --
  40 -- 51 00 00 00 00 03 55 55 40 00 00  Error: WP at LBA = 0x03555540 = 55924032

  Commands leading to the command that caused the error were:
  CR FEATR COUNT  LBA_48  LH LM LL DV DC  Powered_Up_Time  Command/Feature_Name
  -- == -- == -- == == == -- -- -- -- --  ---------------  --------------------
  61 00 00 00 08 00 00 00 03 ae 88 40 00     00:25:39.050  WRITE FPDMA QUEUED
  61 00 00 00 08 00 00 00 63 c8 30 40 00     00:25:39.049  WRITE FPDMA QUEUED
  61 00 00 00 08 00 00 00 5e dd 80 40 00     00:25:39.049  WRITE FPDMA QUEUED
  61 00 00 00 08 00 00 00 45 98 00 40 00     00:25:39.048  WRITE FPDMA QUEUED
  61 00 00 00 08 00 00 00 45 97 f8 40 00     00:25:39.047  WRITE FPDMA QUEUED

Error 3 [2] occurred at disk power-on lifetime: 3577 hours (149 days + 1 hours)
  When the command that caused the error occurred, the device was active or idle.

  After command completion occurred, registers were:
  ER -- ST COUNT  LBA_48  LH LM LL DV DC
  -- -- -- == -- == == == -- -- -- -- --
  40 -- 51 00 00 00 00 03 55 55 40 00 00  Error: WP at LBA = 0x03555540 = 55924032

  Commands leading to the command that caused the error were:
  CR FEATR COUNT  LBA_48  LH LM LL DV DC  Powered_Up_Time  Command/Feature_Name
  -- == -- == -- == == == -- -- -- -- --  ---------------  --------------------
  61 00 00 00 08 00 00 00 5e dd 80 40 00     00:25:35.178  WRITE FPDMA QUEUED
  61 00 00 00 08 00 00 00 5e dd 78 40 00     00:25:35.178  WRITE FPDMA QUEUED
  60 00 00 01 00 00 00 03 55 54 a0 40 00     00:25:35.177  READ FPDMA QUEUED
  61 00 00 00 08 00 00 00 03 4e 28 40 00     00:25:35.176  WRITE FPDMA QUEUED
  61 00 00 00 08 00 00 00 5e dd 88 40 00     00:25:35.176  WRITE FPDMA QUEUED

SMART Extended Self-test Log Version: 1 (1 sectors)
No self-tests have been logged.  [To run self-tests, use: smartctl -t]

SMART Selective self-test log data structure revision number 1
 SPAN  MIN_LBA  MAX_LBA  CURRENT_TEST_STATUS
    1        0        0  Not_testing
    2        0        0  Not_testing
    3        0        0  Not_testing
    4        0        0  Not_testing
    5        0        0  Not_testing
Selective self-test flags (0x0):
  After scanning selected spans, do NOT read-scan remainder of disk.
If Selective self-test is pending on power-up, resume after 0 minute delay.

SCT Status Version:                  3
SCT Version (vendor specific):       522 (0x020a)
Device State:                        Active (0)
Current Temperature:                    37 Celsius
Power Cycle Min/Max Temperature:     33/39 Celsius
Lifetime    Min/Max Temperature:     18/54 Celsius
Specified Max Operating Temperature:    37 Celsius
Under/Over Temperature Limit Count:   0/0

SCT Temperature History Version:     2
Temperature Sampling Period:         1 minute
Temperature Logging Interval:        30 minutes
Min/Max recommended Temperature:     14/55 Celsius
Min/Max Temperature Limit:           10/60 Celsius
Temperature History Size (Index):    128 (91)

SCT Error Recovery Control:
           Read: Disabled
          Write: Disabled

Device Statistics (GP/SMART Log 0x04) not supported

Pending Defects log (GP Log 0x0c) not supported

SATA Phy Event Counters (GP Log 0x11)
ID      Size     Value  Description
0x000a  2            8  Device-to-host register FISes sent due to a COMRESET
0x0001  2            0  Command failed due to ICRC error
0x0003  2            0  R_ERR response for device-to-host data FIS
0x0004  2            0  R_ERR response for host-to-device data FIS
0x0006  2            0  R_ERR response for device-to-host non-data FIS
0x0007  2            0  R_ERR response for host-to-device non-data FIS

