smartctl 7.3 2022-02-28 r5338 [FreeBSD 13.1-RELEASE amd64] (local build)
Copyright (C) 2002-22, Bruce Allen, Christian Franke, www.smartmontools.org

=== START OF INFORMATION SECTION ===
Device Model:     TOSHIBA MQ01ABF032
Serial Number:    --
LU WWN Device Id: 5 000039 ...
Firmware Version: AM001J
User Capacity:    320,072,933,376 bytes [320 GB]
Sector Sizes:     512 bytes logical, 4096 bytes physical
Rotation Rate:    5400 rpm
Form Factor:      2.5 inches
Device is:        Not in smartctl database 7.3/5319
ATA Version is:   ATA8-ACS (minor revision not indicated)
SATA Version is:  SATA 3.0, 6.0 Gb/s (current: 6.0 Gb/s)
Local Time is:    Thu Nov  2 10:17:20 2023 CET
SMART support is: Available - device has SMART capability.
SMART support is: Enabled
AAM feature is:   Unavailable
APM level is:     1 (minimum power consumption with standby)
Rd look-ahead is: Enabled
Write cache is:   Enabled
DSN feature is:   Unavailable
ATA Security is:  Disabled, frozen [SEC2]
Wt Cache Reorder: Enabled

=== START OF READ SMART DATA SECTION ===
SMART overall-health self-assessment test result: PASSED

General SMART Values:
Offline data collection status:  (0x00)	Offline data collection activity
					was never started.
					Auto Offline Data Collection: Disabled.
Self-test execution status:      (   0)	The previous self-test routine completed
					without error or no self-test has ever 
					been run.
Total time to complete Offline 
data collection: 		(  120) seconds.
Offline data collection
capabilities: 			 (0x5b) SMART execute Offline immediate.
					Auto Offline data collection on/off support.
					Suspend Offline collection upon new
					command.
					Offline surface scan supported.
					Self-test supported.
					No Conveyance Self-test supported.
					Selective Self-test supported.
SMART capabilities:            (0x0003)	Saves SMART data before entering
					power-saving mode.
					Supports SMART auto save timer.
Error logging capability:        (0x01)	Error logging supported.
					General Purpose Logging supported.
Short self-test routine 
recommended polling time: 	 (   2) minutes.
Extended self-test routine
recommended polling time: 	 (  84) minutes.
SCT capabilities: 	       (0x003d)	SCT Status supported.
					SCT Error Recovery Control supported.
					SCT Feature Control supported.
					SCT Data Table supported.

SMART Attributes Data Structure revision number: 16
Vendor Specific SMART Attributes with Thresholds:
ID# ATTRIBUTE_NAME          FLAGS    VALUE WORST THRESH FAIL RAW_VALUE
  1 Raw_Read_Error_Rate     PO-R--   100   100   050    -    0
  2 Throughput_Performance  P-S---   100   100   050    -    0
  3 Spin_Up_Time            POS--K   100   100   001    -    1367
  4 Start_Stop_Count        -O--CK   100   100   000    -    19374
  5 Reallocated_Sector_Ct   PO--CK   100   100   050    -    0
  7 Seek_Error_Rate         PO-R--   100   100   050    -    0
  8 Seek_Time_Performance   P-S---   100   100   050    -    0
  9 Power_On_Hours          -O--CK   087   087   000    -    5219
 10 Spin_Retry_Count        PO--CK   253   100   030    -    0
 12 Power_Cycle_Count       -O--CK   100   100   000    -    5767
191 G-Sense_Error_Rate      -O--CK   100   100   000    -    85
192 Power-Off_Retract_Count -O--CK   100   100   000    -    105
193 Load_Cycle_Count        -O--CK   094   094   000    -    65448
194 Temperature_Celsius     -O---K   100   100   000    -    46 (Min/Max 0/63)
196 Reallocated_Event_Count -O--CK   100   100   000    -    0
197 Current_Pending_Sector  -O--CK   100   100   000    -    0
198 Offline_Uncorrectable   ----CK   100   100   000    -    0
199 UDMA_CRC_Error_Count    -O--CK   200   253   000    -    24
220 Disk_Shift              -O----   100   100   000    -    0
222 Loaded_Hours            -O--CK   092   092   000    -    3212
223 Load_Retry_Count        -O--CK   100   100   000    -    0
224 Load_Friction           -O---K   100   100   000    -    0
226 Load-in_Time            -OS--K   100   100   000    -    255
240 Head_Flying_Hours       P-----   100   100   001    -    0
                            ||||||_ K auto-keep
                            |||||__ C event count
                            ||||___ R error rate
                            |||____ S speed/performance
                            ||_____ O updated online
                            |______ P prefailure warning

General Purpose Log Directory Version 1
SMART           Log Directory Version 1 [multi-sector log support]
Address    Access  R/W   Size  Description
0x00       GPL,SL  R/O      1  Log Directory
0x01           SL  R/O      1  Summary SMART error log
0x02           SL  R/O     51  Comprehensive SMART error log
0x03       GPL     R/O     64  Ext. Comprehensive SMART error log
0x04       GPL,SL  R/O      8  Device Statistics log
0x06           SL  R/O      1  SMART self-test log
0x07       GPL     R/O      1  Extended self-test log
0x09           SL  R/W      1  Selective self-test log
0x10       GPL     R/O      1  NCQ Command Error log
0x11       GPL     R/O      1  SATA Phy Event Counters log
0x80-0x9f  GPL,SL  R/W     16  Host vendor specific log
0xe0       GPL,SL  R/W      1  SCT Command/Status
0xe1       GPL,SL  R/W      1  SCT Data Transfer

SMART Extended Comprehensive Error Log Version: 1 (64 sectors)
Device Error Count: 27
	CR     = Command Register
	FEATR  = Features Register
	COUNT  = Count (was: Sector Count) Register
	LBA_48 = Upper bytes of LBA High/Mid/Low Registers ]  ATA-8
	LH     = LBA High (was: Cylinder High) Register    ]   LBA
	LM     = LBA Mid (was: Cylinder Low) Register      ] Register
	LL     = LBA Low (was: Sector Number) Register     ]
	DV     = Device (was: Device/Head) Register
	DC     = Device Control Register
	ER     = Error register
	ST     = Status register
Powered_Up_Time is measured from power on, and printed as
DDd+hh:mm:SS.sss where DD=days, hh=hours, mm=minutes,
SS=sec, and sss=millisec. It "wraps" after 49.710 days.

Error 27 [26] occurred at disk power-on lifetime: 3176 hours (132 days + 8 hours)
  When the command that caused the error occurred, the device was active or idle.

  After command completion occurred, registers were:
  ER -- ST COUNT  LBA_48  LH LM LL DV DC
  -- -- -- == -- == == == -- -- -- -- --
  84 -- 50 00 00 00 00 00 00 00 00 e0 00   at LBA = 0x00000000 = 0

  Commands leading to the command that caused the error were:
  CR FEATR COUNT  LBA_48  LH LM LL DV DC  Powered_Up_Time  Command/Feature_Name
  -- == -- == -- == == == -- -- -- -- --  ---------------  --------------------
  25 00 00 00 01 00 00 00 03 28 00 e0 00     00:03:21.291  READ DMA EXT
  25 00 00 00 01 00 00 00 03 28 00 e0 00     00:03:21.291  READ DMA EXT
  25 00 00 00 01 00 00 00 03 28 00 e0 00     00:03:21.291  READ DMA EXT
  25 00 00 00 01 00 00 00 03 28 00 e0 00     00:03:21.291  READ DMA EXT
  25 00 00 00 01 00 00 00 03 28 00 e0 00     00:03:21.291  READ DMA EXT

Error 26 [25] occurred at disk power-on lifetime: 3176 hours (132 days + 8 hours)
  When the command that caused the error occurred, the device was active or idle.

  After command completion occurred, registers were:
  ER -- ST COUNT  LBA_48  LH LM LL DV DC
  -- -- -- == -- == == == -- -- -- -- --
  84 -- 51 00 00 00 00 00 00 09 52 e0 00  Error: ICRC, ABRT at LBA = 0x00000952 = 2386

  Commands leading to the command that caused the error were:
  CR FEATR COUNT  LBA_48  LH LM LL DV DC  Powered_Up_Time  Command/Feature_Name
  -- == -- == -- == == == -- -- -- -- --  ---------------  --------------------
  25 00 00 00 01 00 00 00 00 09 52 e0 00     00:02:42.518  READ DMA EXT
  25 00 00 00 01 00 00 00 00 09 52 e0 00     00:02:42.518  READ DMA EXT
  25 00 00 00 01 00 00 00 00 09 51 e0 00     00:02:42.518  READ DMA EXT
  25 00 00 00 01 00 00 00 00 09 50 e0 00     00:02:42.514  READ DMA EXT
  25 00 00 00 01 00 00 00 00 09 70 ff 00     00:02:42.514  READ DMA EXT

Error 25 [24] occurred at disk power-on lifetime: 3176 hours (132 days + 8 hours)
  When the command that caused the error occurred, the device was active or idle.

  After command completion occurred, registers were:
  ER -- ST COUNT  LBA_48  LH LM LL DV DC
  -- -- -- == -- == == == -- -- -- -- --
  84 -- 51 00 00 00 00 00 00 08 00 e0 00  Error: ICRC, ABRT at LBA = 0x00000800 = 2048

  Commands leading to the command that caused the error were:
  CR FEATR COUNT  LBA_48  LH LM LL DV DC  Powered_Up_Time  Command/Feature_Name
  -- == -- == -- == == == -- -- -- -- --  ---------------  --------------------
  25 00 00 00 01 00 00 00 00 08 00 e0 00     00:09:44.043  READ DMA EXT
  25 00 00 00 01 00 00 00 00 08 00 e0 00     00:09:44.043  READ DMA EXT
  25 00 00 00 01 00 00 00 00 08 00 e0 00     00:09:44.043  READ DMA EXT
  25 00 00 00 01 00 00 00 00 08 00 e0 00     00:09:44.043  READ DMA EXT
  25 00 00 00 01 00 00 00 00 00 00 e0 00     00:09:44.041  READ DMA EXT

Error 24 [23] occurred at disk power-on lifetime: 3176 hours (132 days + 8 hours)
  When the command that caused the error occurred, the device was active or idle.

  After command completion occurred, registers were:
  ER -- ST COUNT  LBA_48  LH LM LL DV DC
  -- -- -- == -- == == == -- -- -- -- --
  84 -- 51 00 00 00 00 00 03 28 00 e0 00  Error: ICRC, ABRT at LBA = 0x00032800 = 206848

  Commands leading to the command that caused the error were:
  CR FEATR COUNT  LBA_48  LH LM LL DV DC  Powered_Up_Time  Command/Feature_Name
  -- == -- == -- == == == -- -- -- -- --  ---------------  --------------------
  25 00 00 00 01 00 00 00 03 28 00 e0 00     00:08:21.215  READ DMA EXT
  25 00 00 00 01 00 00 00 03 28 00 e0 00     00:08:21.215  READ DMA EXT
  25 00 00 00 01 00 00 00 03 28 00 e0 00     00:08:21.215  READ DMA EXT
  25 00 00 00 01 00 00 00 03 28 00 e0 00     00:08:21.215  READ DMA EXT
  25 00 00 00 01 00 00 00 03 28 00 e0 00     00:08:21.215  READ DMA EXT

Error 23 [22] occurred at disk power-on lifetime: 3176 hours (132 days + 8 hours)
  When the command that caused the error occurred, the device was in standby mode.

  After command completion occurred, registers were:
  ER -- ST COUNT  LBA_48  LH LM LL DV DC
  -- -- -- == -- == == == -- -- -- -- --
  84 -- 51 00 00 00 00 00 00 00 00 e0 00  Error: ICRC, ABRT at LBA = 0x00000000 = 0

  Commands leading to the command that caused the error were:
  CR FEATR COUNT  LBA_48  LH LM LL DV DC  Powered_Up_Time  Command/Feature_Name
  -- == -- == -- == == == -- -- -- -- --  ---------------  --------------------
  25 00 00 00 01 00 00 00 00 00 00 e0 00     00:08:15.138  READ DMA EXT
  25 00 00 00 01 00 00 00 00 00 00 e0 00     00:08:13.348  READ DMA EXT
  ff ff ff ff ff ff ff ff ff ff ff ff 0c     00:08:13.346  [VENDOR SPECIFIC]
  ef 00 03 00 45 00 00 00 00 00 00 e0 00     00:08:13.081  SET FEATURES [Set transfer mode]
  ec 00 00 00 01 00 00 00 00 00 00 e0 00     00:08:13.079  IDENTIFY DEVICE

Error 22 [21] occurred at disk power-on lifetime: 3176 hours (132 days + 8 hours)
  When the command that caused the error occurred, the device was active or idle.

  After command completion occurred, registers were:
  ER -- ST COUNT  LBA_48  LH LM LL DV DC
  -- -- -- == -- == == == -- -- -- -- --
  84 -- 51 00 00 00 00 00 03 28 00 e0 00  Error: ICRC, ABRT at LBA = 0x00032800 = 206848

  Commands leading to the command that caused the error were:
  CR FEATR COUNT  LBA_48  LH LM LL DV DC  Powered_Up_Time  Command/Feature_Name
  -- == -- == -- == == == -- -- -- -- --  ---------------  --------------------
  25 00 00 00 01 00 00 00 03 28 00 e0 00     00:03:17.566  READ DMA EXT
  25 00 00 00 01 00 00 00 03 28 00 e0 00     00:03:17.566  READ DMA EXT
  25 00 00 00 01 00 00 00 03 28 00 e0 00     00:03:17.566  READ DMA EXT
  25 00 00 00 01 00 00 00 03 28 00 e0 00     00:03:17.566  READ DMA EXT
  25 00 00 00 01 00 00 00 03 28 00 e0 00     00:03:17.566  READ DMA EXT

Error 21 [20] occurred at disk power-on lifetime: 3176 hours (132 days + 8 hours)
  When the command that caused the error occurred, the device was active or idle.

  After command completion occurred, registers were:
  ER -- ST COUNT  LBA_48  LH LM LL DV DC
  -- -- -- == -- == == == -- -- -- -- --
  84 -- 51 00 00 00 00 00 00 00 00 e0 00  Error: ICRC, ABRT at LBA = 0x00000000 = 0

  Commands leading to the command that caused the error were:
  CR FEATR COUNT  LBA_48  LH LM LL DV DC  Powered_Up_Time  Command/Feature_Name
  -- == -- == -- == == == -- -- -- -- --  ---------------  --------------------
  25 00 00 00 01 00 00 00 00 00 00 e0 00     00:03:08.701  READ DMA EXT
  f5 00 00 00 00 00 00 00 00 00 00 e0 00     00:03:08.422  SECURITY FREEZE LOCK
  f5 00 00 00 00 00 00 00 00 00 00 e0 00     00:03:08.422  SECURITY FREEZE LOCK
  f5 00 00 00 00 00 00 00 00 00 00 e0 00     00:03:08.422  SECURITY FREEZE LOCK
  f5 00 00 00 00 00 00 00 00 00 00 e0 00     00:03:08.422  SECURITY FREEZE LOCK

Error 20 [19] occurred at disk power-on lifetime: 3176 hours (132 days + 8 hours)
  When the command that caused the error occurred, the device was in standby mode.

  After command completion occurred, registers were:
  ER -- ST COUNT  LBA_48  LH LM LL DV DC
  -- -- -- == -- == == == -- -- -- -- --
  84 -- 51 00 00 00 00 00 00 00 00 e0 00  Error: ICRC, ABRT at LBA = 0x00000000 = 0

  Commands leading to the command that caused the error were:
  CR FEATR COUNT  LBA_48  LH LM LL DV DC  Powered_Up_Time  Command/Feature_Name
  -- == -- == -- == == == -- -- -- -- --  ---------------  --------------------
  25 00 00 00 01 00 00 00 00 00 00 e0 00     00:02:33.423  READ DMA EXT
  25 00 00 00 01 00 00 00 00 00 00 e0 00     00:02:31.635  READ DMA EXT
  ff ff ff ff ff ff ff ff ff ff ff ff 0c     00:02:31.633  [VENDOR SPECIFIC]
  ef 00 03 00 45 00 00 00 00 00 00 e0 00     00:02:31.591  SET FEATURES [Set transfer mode]
  ec 00 00 00 01 00 00 00 00 00 00 e0 00     00:02:31.589  IDENTIFY DEVICE

SMART Extended Self-test Log Version: 1 (1 sectors)
No self-tests have been logged.  [To run self-tests, use: smartctl -t]

SMART Selective self-test log data structure revision number 1
 SPAN  MIN_LBA  MAX_LBA  CURRENT_TEST_STATUS
    1        0        0  Not_testing
    2        0        0  Not_testing
    3        0        0  Not_testing
    4        0        0  Not_testing
    5        0        0  Not_testing
Selective self-test flags (0x0):
  After scanning selected spans, do NOT read-scan remainder of disk.
If Selective self-test is pending on power-up, resume after 0 minute delay.

SCT Status Version:                  2
SCT Version (vendor specific):       1 (0x0001)
Device State:                        Active (0)
Current Temperature:                    46 Celsius
Power Cycle Min/Max Temperature:     25/46 Celsius
Lifetime    Min/Max Temperature:      0/63 Celsius
Under/Over Temperature Limit Count:   4/42

SCT Temperature History Version:     2
Temperature Sampling Period:         1 minute
Temperature Logging Interval:        1 minute
Min/Max recommended Temperature:      5/55 Celsius
Min/Max Temperature Limit:            5/55 Celsius
Temperature History Size (Index):    478 (69)

SCT Error Recovery Control:
           Read: Disabled
          Write: Disabled

Device Statistics (GP Log 0x04)
Page  Offset Size        Value Flags Description
0x01  =====  =               =  ===  == General Statistics (rev 2) ==
0x01  0x008  4            5767  ---  Lifetime Power-On Resets
0x01  0x010  4            5219  ---  Power-on Hours
0x01  0x018  6     13727983381  ---  Logical Sectors Written
0x01  0x020  6       208356186  ---  Number of Write Commands
0x01  0x028  6     23073060889  ---  Logical Sectors Read
0x01  0x030  6       307322830  ---  Number of Read Commands
0x02  =====  =               =  ===  == Free-Fall Statistics (rev 1) ==
0x02  0x010  4              85  ---  Overlimit Shock Events
0x03  =====  =               =  ===  == Rotating Media Statistics (rev 1) ==
0x03  0x008  4            1013  ---  Spindle Motor Power-on Hours
0x03  0x010  4            3212  ---  Head Flying Hours
0x03  0x018  4           65448  ---  Head Load Events
0x03  0x020  4               0  ---  Number of Reallocated Logical Sectors
0x03  0x028  4               0  ---  Read Recovery Attempts
0x03  0x030  4               0  ---  Number of Mechanical Start Failures
0x04  =====  =               =  ===  == General Errors Statistics (rev 1) ==
0x04  0x008  4               0  ---  Number of Reported Uncorrectable Errors
0x04  0x010  4             102  ---  Resets Between Cmd Acceptance and Completion
0x05  =====  =               =  ===  == Temperature Statistics (rev 1) ==
0x05  0x008  1              46  ---  Current Temperature
0x05  0x010  1              42  N--  Average Short Term Temperature
0x05  0x018  1              40  N--  Average Long Term Temperature
0x05  0x020  1              63  ---  Highest Temperature
0x05  0x028  1               0  ---  Lowest Temperature
0x05  0x030  1              46  N--  Highest Average Short Term Temperature
0x05  0x038  1              31  N--  Lowest Average Short Term Temperature
0x05  0x040  1              41  N--  Highest Average Long Term Temperature
0x05  0x048  1              34  N--  Lowest Average Long Term Temperature
0x05  0x050  4              98  ---  Time in Over-Temperature
0x05  0x058  1              55  ---  Specified Maximum Operating Temperature
0x05  0x060  4               4  ---  Time in Under-Temperature
0x05  0x068  1               5  ---  Specified Minimum Operating Temperature
0x06  =====  =               =  ===  == Transport Statistics (rev 1) ==
0x06  0x008  4            9743  ---  Number of Hardware Resets
0x06  0x018  4              24  ---  Number of Interface CRC Errors
0x07  =====  =               =  ===  == Solid State Device Statistics (rev 1) ==
0x07  0x008  1               8  N--  Percentage Used Endurance Indicator
                                |||_ C monitored condition met
                                ||__ D supports DSN
                                |___ N normalized value

Pending Defects log (GP Log 0x0c) not supported

SATA Phy Event Counters (GP Log 0x11)
ID      Size     Value  Description
0x0001  4            0  Command failed due to ICRC error
0x0002  4            0  R_ERR response for data FIS
0x0003  4            0  R_ERR response for device-to-host data FIS
0x0004  4            0  R_ERR response for host-to-device data FIS
0x0005  4            0  R_ERR response for non-data FIS
0x0006  4            0  R_ERR response for device-to-host non-data FIS
0x0007  4            0  R_ERR response for host-to-device non-data FIS
0x0008  4            0  Device-to-host non-data FIS retries
0x0009  4           20  Transition from drive PhyRdy to drive PhyNRdy
0x000a  4           13  Device-to-host register FISes sent due to a COMRESET
0x000b  4            0  CRC errors within host-to-device FIS
0x000d  4            0  Non-CRC errors within host-to-device FIS
0x000f  4            0  R_ERR response for host-to-device data FIS, CRC
0x0010  4            0  R_ERR response for host-to-device data FIS, non-CRC
0x0012  4            0  R_ERR response for host-to-device non-data FIS, CRC
0x0013  4            0  R_ERR response for host-to-device non-data FIS, non-CRC



