smartctl 7.3 2022-02-28 r5338 [FreeBSD 13.2-RELEASE-p1 amd64] (local build)
Copyright (C) 2002-22, Bruce Allen, Christian Franke, www.smartmontools.org

=== START OF INFORMATION SECTION ===
Device Model:     CLOVER  CD253GJ
Serial Number:    --
LU WWN Device Id: 5 0000f0 ...
Firmware Version: 1AJ10001
User Capacity:    250,059,350,016 bytes [250 GB]
Sector Size:      512 bytes logical/physical
Rotation Rate:    7200 rpm
Form Factor:      3.5 inches
Device is:        Not in smartctl database 7.3/5319
ATA Version is:   ATA8-ACS T13/1699-D revision 6
SATA Version is:  SATA 2.6, 3.0 Gb/s
Local Time is:    Thu Jul 27 07:37:18 2023 UTC
SMART support is: Available - device has SMART capability.
SMART support is: Enabled
AAM level is:     0 (vendor specific), recommended: 254
APM feature is:   Disabled
Rd look-ahead is: Enabled
Write cache is:   Enabled
DSN feature is:   Unavailable
ATA Security is:  Disabled, frozen [SEC2]
Wt Cache Reorder: Enabled

=== START OF READ SMART DATA SECTION ===
SMART overall-health self-assessment test result: PASSED

General SMART Values:
Offline data collection status:  (0x00)	Offline data collection activity
					was never started.
					Auto Offline Data Collection: Disabled.
Self-test execution status:      (   0)	The previous self-test routine completed
					without error or no self-test has ever 
					been run.
Total time to complete Offline 
data collection: 		( 2400) seconds.
Offline data collection
capabilities: 			 (0x5b) SMART execute Offline immediate.
					Auto Offline data collection on/off support.
					Suspend Offline collection upon new
					command.
					Offline surface scan supported.
					Self-test supported.
					No Conveyance Self-test supported.
					Selective Self-test supported.
SMART capabilities:            (0x0003)	Saves SMART data before entering
					power-saving mode.
					Supports SMART auto save timer.
Error logging capability:        (0x01)	Error logging supported.
					General Purpose Logging supported.
Short self-test routine 
recommended polling time: 	 (   2) minutes.
Extended self-test routine
recommended polling time: 	 (  40) minutes.
SCT capabilities: 	       (0x003f)	SCT Status supported.
					SCT Error Recovery Control supported.
					SCT Feature Control supported.
					SCT Data Table supported.

SMART Attributes Data Structure revision number: 16
Vendor Specific SMART Attributes with Thresholds:
ID# ATTRIBUTE_NAME          FLAGS    VALUE WORST THRESH FAIL RAW_VALUE
  1 Raw_Read_Error_Rate     POSR-K   100   100   051    -    0
  2 Throughput_Performance  -OS--K   053   053   000    -    2288
  3 Spin_Up_Time            PO---K   084   083   025    -    4971
  4 Start_Stop_Count        -O--CK   095   095   000    -    5106
  5 Reallocated_Sector_Ct   PO--CK   252   252   010    -    0
  7 Seek_Error_Rate         -OSR-K   252   252   051    -    0
  8 Seek_Time_Performance   --S--K   252   252   015    -    0
  9 Power_On_Hours          -O--CK   100   100   000    -    25246
 10 Spin_Retry_Count        -O--CK   252   252   051    -    0
 11 Calibration_Retry_Count -O--CK   252   252   000    -    0
 12 Power_Cycle_Count       -O--CK   097   097   000    -    3241
191 G-Sense_Error_Rate      -O---K   100   100   000    -    10
192 Power-Off_Retract_Count -O---K   252   252   000    -    0
194 Temperature_Celsius     -O----   064   053   000    -    30 (Min/Max 0/47)
195 Hardware_ECC_Recovered  -O-RCK   100   100   000    -    0
196 Reallocated_Event_Count -O--CK   252   252   000    -    0
197 Current_Pending_Sector  -O--CK   252   252   000    -    0
198 Offline_Uncorrectable   ----CK   252   252   000    -    0
199 UDMA_CRC_Error_Count    -OS-CK   100   100   000    -    10
200 Multi_Zone_Error_Rate   -O-R-K   100   100   000    -    22
223 Load_Retry_Count        -O--CK   252   252   000    -    0
225 Load_Cycle_Count        -O--CK   100   100   000    -    5594
                            ||||||_ K auto-keep
                            |||||__ C event count
                            ||||___ R error rate
                            |||____ S speed/performance
                            ||_____ O updated online
                            |______ P prefailure warning

General Purpose Log Directory Version 1
SMART           Log Directory Version 1 [multi-sector log support]
Address    Access  R/W   Size  Description
0x00       GPL,SL  R/O      1  Log Directory
0x01           SL  R/O      1  Summary SMART error log
0x02           SL  R/O      2  Comprehensive SMART error log
0x03       GPL     R/O      2  Ext. Comprehensive SMART error log
0x06           SL  R/O      1  SMART self-test log
0x07       GPL     R/O      2  Extended self-test log
0x08       GPL     R/O      2  Power Conditions log
0x09           SL  R/W      1  Selective self-test log
0x10       GPL     R/O      1  NCQ Command Error log
0x11       GPL     R/O      1  SATA Phy Event Counters log
0x80-0x9f  GPL,SL  R/W     16  Host vendor specific log
0xe0       GPL,SL  R/W      1  SCT Command/Status
0xe1       GPL,SL  R/W      1  SCT Data Transfer

SMART Extended Comprehensive Error Log Version: 1 (2 sectors)
Device Error Count: 10 (device log contains only the most recent 8 errors)
	CR     = Command Register
	FEATR  = Features Register
	COUNT  = Count (was: Sector Count) Register
	LBA_48 = Upper bytes of LBA High/Mid/Low Registers ]  ATA-8
	LH     = LBA High (was: Cylinder High) Register    ]   LBA
	LM     = LBA Mid (was: Cylinder Low) Register      ] Register
	LL     = LBA Low (was: Sector Number) Register     ]
	DV     = Device (was: Device/Head) Register
	DC     = Device Control Register
	ER     = Error register
	ST     = Status register
Powered_Up_Time is measured from power on, and printed as
DDd+hh:mm:SS.sss where DD=days, hh=hours, mm=minutes,
SS=sec, and sss=millisec. It "wraps" after 49.710 days.

Error 10 [1] occurred at disk power-on lifetime: 25231 hours (1051 days + 7 hours)
  When the command that caused the error occurred, the device was active or idle.

  After command completion occurred, registers were:
  ER -- ST COUNT  LBA_48  LH LM LL DV DC
  -- -- -- == -- == == == -- -- -- -- --
  84 -- 51 00 00 00 00 00 00 00 00 a0 00

  Commands leading to the command that caused the error were:
  CR FEATR COUNT  LBA_48  LH LM LL DV DC  Powered_Up_Time  Command/Feature_Name
  -- == -- == -- == == == -- -- -- -- --  ---------------  --------------------
  ec 00 00 00 00 00 00 00 00 00 00 a0 00     00:00:01.426  IDENTIFY DEVICE
  00 00 00 00 01 00 00 00 00 00 01 00 00     00:00:01.426  NOP [Abort queued commands]
  00 00 00 00 01 00 00 00 00 00 01 00 00     00:00:01.426  NOP [Abort queued commands]
  ec 00 00 00 00 00 00 00 00 00 00 a0 00     00:00:01.420  IDENTIFY DEVICE
  00 00 00 00 00 00 00 00 00 00 00 00 08     00:00:01.420  NOP [Abort queued commands]

Error 9 [0] occurred at disk power-on lifetime: 25231 hours (1051 days + 7 hours)
  When the command that caused the error occurred, the device was active or idle.

  After command completion occurred, registers were:
  ER -- ST COUNT  LBA_48  LH LM LL DV DC
  -- -- -- == -- == == == -- -- -- -- --
  84 -- 51 01 70 00 00 00 21 50 00 40 00  Error: ICRC, ABRT at LBA = 0x00215000 = 2183168

  Commands leading to the command that caused the error were:
  CR FEATR COUNT  LBA_48  LH LM LL DV DC  Powered_Up_Time  Command/Feature_Name
  -- == -- == -- == == == -- -- -- -- --  ---------------  --------------------
  60 00 00 01 b0 00 00 00 21 50 10 40 08     00:00:01.406  READ FPDMA QUEUED
  60 00 00 02 00 00 00 00 21 4f c0 40 08     00:00:01.410  READ FPDMA QUEUED
  60 00 00 02 00 00 00 00 21 4d c0 40 08     00:00:01.410  READ FPDMA QUEUED
  60 00 00 02 00 00 00 00 21 4b c0 40 08     00:00:01.410  READ FPDMA QUEUED
  60 00 00 02 00 00 00 00 21 49 c0 40 08     00:00:01.410  READ FPDMA QUEUED

Error 8 [7] occurred at disk power-on lifetime: 25231 hours (1051 days + 7 hours)
  When the command that caused the error occurred, the device was active or idle.

  After command completion occurred, registers were:
  ER -- ST COUNT  LBA_48  LH LM LL DV DC
  -- -- -- == -- == == == -- -- -- -- --
  84 -- 51 ff 70 00 00 00 19 43 00 40 00  Error: ICRC, ABRT at LBA = 0x00194300 = 1655552

  Commands leading to the command that caused the error were:
  CR FEATR COUNT  LBA_48  LH LM LL DV DC  Powered_Up_Time  Command/Feature_Name
  -- == -- == -- == == == -- -- -- -- --  ---------------  --------------------
  60 00 00 00 b0 00 00 00 19 43 10 40 08     00:00:01.371  READ FPDMA QUEUED
  60 00 00 02 00 00 00 00 19 41 c0 40 08     00:00:01.374  READ FPDMA QUEUED
  60 00 00 02 00 00 00 00 19 3f c0 40 08     00:00:01.374  READ FPDMA QUEUED
  60 00 00 02 00 00 00 00 19 3d c0 40 08     00:00:01.373  READ FPDMA QUEUED
  61 00 00 02 c0 00 00 01 c0 a6 40 40 08     00:00:01.373  WRITE FPDMA QUEUED

Error 7 [6] occurred at disk power-on lifetime: 25231 hours (1051 days + 7 hours)
  When the command that caused the error occurred, the device was active or idle.

  After command completion occurred, registers were:
  ER -- ST COUNT  LBA_48  LH LM LL DV DC
  -- -- -- == -- == == == -- -- -- -- --
  84 -- 51 00 e0 00 00 00 0d 64 40 40 00  Error: ICRC, ABRT at LBA = 0x000d6440 = 877632

  Commands leading to the command that caused the error were:
  CR FEATR COUNT  LBA_48  LH LM LL DV DC  Powered_Up_Time  Command/Feature_Name
  -- == -- == -- == == == -- -- -- -- --  ---------------  --------------------
  60 00 00 01 60 00 00 00 0d 64 60 40 08     00:00:01.314  READ FPDMA QUEUED
  60 00 00 02 00 00 00 00 0d 63 c0 40 08     00:00:01.318  READ FPDMA QUEUED
  60 00 00 02 00 00 00 00 0d 61 c0 40 08     00:00:01.318  READ FPDMA QUEUED
  60 00 00 02 00 00 00 00 0d 5f c0 40 08     00:00:01.318  READ FPDMA QUEUED
  60 00 00 02 00 00 00 00 0d 5d c0 40 08     00:00:01.318  READ FPDMA QUEUED

Error 6 [5] occurred at disk power-on lifetime: 25231 hours (1051 days + 7 hours)
  When the command that caused the error occurred, the device was active or idle.

  After command completion occurred, registers were:
  ER -- ST COUNT  LBA_48  LH LM LL DV DC
  -- -- -- == -- == == == -- -- -- -- --
  84 -- 51 fe f0 00 00 00 05 27 40 40 00  Error: ICRC, ABRT at LBA = 0x00052740 = 337728

  Commands leading to the command that caused the error were:
  CR FEATR COUNT  LBA_48  LH LM LL DV DC  Powered_Up_Time  Command/Feature_Name
  -- == -- == -- == == == -- -- -- -- --  ---------------  --------------------
  60 00 00 00 70 00 00 00 05 27 50 40 08     00:00:01.271  READ FPDMA QUEUED
  61 00 00 05 00 00 00 00 47 a6 00 40 08     00:00:01.273  WRITE FPDMA QUEUED
  61 00 00 0a 00 00 00 00 47 9c 00 40 08     00:00:01.273  WRITE FPDMA QUEUED
  61 00 00 0a 00 00 00 00 47 92 00 40 08     00:00:01.273  WRITE FPDMA QUEUED
  61 00 00 0a 00 00 00 00 47 88 00 40 08     00:00:01.273  WRITE FPDMA QUEUED

Error 5 [4] occurred at disk power-on lifetime: 25230 hours (1051 days + 6 hours)
  When the command that caused the error occurred, the device was active or idle.

  After command completion occurred, registers were:
  ER -- ST COUNT  LBA_48  LH LM LL DV DC
  -- -- -- == -- == == == -- -- -- -- --
  84 -- 51 00 00 00 00 00 00 00 00 a0 00

  Commands leading to the command that caused the error were:
  CR FEATR COUNT  LBA_48  LH LM LL DV DC  Powered_Up_Time  Command/Feature_Name
  -- == -- == -- == == == -- -- -- -- --  ---------------  --------------------
  ec 00 00 00 00 00 00 00 00 00 00 a0 00     00:00:01.216  IDENTIFY DEVICE
  00 00 00 00 00 00 00 00 00 00 00 00 08     00:00:01.216  NOP [Abort queued commands]
  00 00 00 00 00 00 00 00 00 00 00 00 08     00:00:01.216  NOP [Abort queued commands]
  00 00 00 01 00 00 00 0d 71 68 48 40 08     00:00:01.211  NOP [Abort queued commands]
  60 00 00 00 90 00 00 0d 6a 04 98 40 08     00:00:01.209  READ FPDMA QUEUED

Error 4 [3] occurred at disk power-on lifetime: 25230 hours (1051 days + 6 hours)
  When the command that caused the error occurred, the device was active or idle.

  After command completion occurred, registers were:
  ER -- ST COUNT  LBA_48  LH LM LL DV DC
  -- -- -- == -- == == == -- -- -- -- --
  84 -- 51 00 38 00 00 0d 6a 04 80 40 00  Error: ICRC, ABRT at LBA = 0x0d6a0480 = 225051776

  Commands leading to the command that caused the error were:
  CR FEATR COUNT  LBA_48  LH LM LL DV DC  Powered_Up_Time  Command/Feature_Name
  -- == -- == -- == == == -- -- -- -- --  ---------------  --------------------
  60 00 00 00 90 00 00 0d 6a 04 98 40 08     00:00:01.209  READ FPDMA QUEUED
  60 00 00 01 00 00 00 0d 6a 04 28 40 08     00:00:01.210  READ FPDMA QUEUED
  60 00 00 01 00 00 00 0d 6a 02 68 40 08     00:00:01.210  READ FPDMA QUEUED
  60 00 00 00 b8 00 00 0d 6c 31 b0 40 08     00:00:01.210  READ FPDMA QUEUED
  60 00 00 01 00 00 00 0d 6c 21 a0 40 08     00:00:01.210  READ FPDMA QUEUED

Error 3 [2] occurred at disk power-on lifetime: 25230 hours (1051 days + 6 hours)
  When the command that caused the error occurred, the device was active or idle.

  After command completion occurred, registers were:
  ER -- ST COUNT  LBA_48  LH LM LL DV DC
  -- -- -- == -- == == == -- -- -- -- --
  84 -- 51 ff d0 00 00 00 b5 e9 80 40 00  Error: ICRC, ABRT at LBA = 0x00b5e980 = 11921792

  Commands leading to the command that caused the error were:
  CR FEATR COUNT  LBA_48  LH LM LL DV DC  Powered_Up_Time  Command/Feature_Name
  -- == -- == -- == == == -- -- -- -- --  ---------------  --------------------
  60 00 00 00 50 00 00 00 b5 e9 b0 40 00     00:00:01.013  READ FPDMA QUEUED
  60 00 00 01 00 00 00 00 b5 e9 00 40 00     00:00:01.014  READ FPDMA QUEUED
  60 00 00 01 00 00 00 00 b5 e8 00 40 00     00:00:01.014  READ FPDMA QUEUED
  60 00 00 01 00 00 00 00 b5 e7 00 40 00     00:00:01.014  READ FPDMA QUEUED
  60 00 00 01 00 00 00 00 b5 e6 00 40 00     00:00:01.014  READ FPDMA QUEUED

SMART Extended Self-test Log Version: 1 (2 sectors)
Num  Test_Description    Status                  Remaining  LifeTime(hours)  LBA_of_first_error
# 1  Extended offline    Completed without error       00%     24234         -
# 2  Short offline       Completed without error       00%     22844         -
# 3  Short offline       Completed without error       00%     22664         -
# 4  Short offline       Completed without error       00%     22660         -
# 5  Extended offline    Interrupted (host reset)      30%     22637         -
# 6  Short offline       Completed without error       00%     22470         -
# 7  Short offline       Completed without error       00%     22398         -
# 8  Short offline       Completed without error       00%     22389         -
# 9  Short offline       Completed without error       00%     22384         -
#10  Short offline       Completed without error       00%     22378         -
#11  Short offline       Completed without error       00%     22369         -
#12  Extended offline    Interrupted (host reset)      40%     22366         -
#13  Short offline       Completed without error       00%     22355         -
#14  Short offline       Completed without error       00%     22342         -
#15  Short offline       Completed without error       00%     22309         -
#16  Short offline       Completed without error       00%     22286         -
#17  Short offline       Completed without error       00%     22277         -
#18  Short offline       Completed without error       00%     22273         -
#19  Extended offline    Completed without error       00%     22267         -
#20  Extended offline    Completed without error       00%     22265         -
#21  Extended offline    Aborted by host               20%     22262         -

SMART Selective self-test log data structure revision number 0
Note: revision number not 1 implies that no selective self-test has ever been run
 SPAN  MIN_LBA  MAX_LBA  CURRENT_TEST_STATUS
    1        0        0  Completed [00% left] (0-65535)
    2        0        0  Not_testing
    3        0        0  Not_testing
    4        0        0  Not_testing
    5        0        0  Not_testing
Selective self-test flags (0x0):
  After scanning selected spans, do NOT read-scan remainder of disk.
If Selective self-test is pending on power-up, resume after 0 minute delay.

SCT Status Version:                  2
SCT Version (vendor specific):       256 (0x0100)
Device State:                        Active (0)
Current Temperature:                    34 Celsius
Power Cycle Min/Max Temperature:      0/ 0 Celsius
Lifetime    Min/Max Temperature:      6/47 Celsius
Specified Max Operating Temperature:    80 Celsius
Under/Over Temperature Limit Count:   0/0

SCT Temperature History Version:     2
Temperature Sampling Period:         5 minutes
Temperature Logging Interval:        5 minutes
Min/Max recommended Temperature:     -5/80 Celsius
Min/Max Temperature Limit:           -10/85 Celsius
Temperature History Size (Index):    128 (23)

SCT Error Recovery Control:
           Read: Disabled
          Write: Disabled

Device Statistics (GP/SMART Log 0x04) not supported

Pending Defects log (GP Log 0x0c) not supported

SATA Phy Event Counters (GP Log 0x11)
ID      Size     Value  Description
0x0001  4            0  Command failed due to ICRC error
0x0002  4            0  R_ERR response for data FIS
0x0003  4            0  R_ERR response for device-to-host data FIS
0x0004  4            0  R_ERR response for host-to-device data FIS
0x0005  4            0  R_ERR response for non-data FIS
0x0006  4            0  R_ERR response for device-to-host non-data FIS
0x0007  4            0  R_ERR response for host-to-device non-data FIS
0x0008  4            0  Device-to-host non-data FIS retries
0x0009  4            3  Transition from drive PhyRdy to drive PhyNRdy
0x000a  4            3  Device-to-host register FISes sent due to a COMRESET
0x000b  4            0  CRC errors within host-to-device FIS
0x000d  4            0  Non-CRC errors within host-to-device FIS
0x000f  4            0  R_ERR response for host-to-device data FIS, CRC
0x0010  4            0  R_ERR response for host-to-device data FIS, non-CRC
0x0012  4            0  R_ERR response for host-to-device non-data FIS, CRC
0x0013  4            0  R_ERR response for host-to-device non-data FIS, non-CRC
0x8e00  4            0  Vendor specific
0x8e01  4            0  Vendor specific
0x8e02  4            0  Vendor specific
0x8e03  4            0  Vendor specific
0x8e04  4            0  Vendor specific
0x8e05  4            0  Vendor specific
0x8e06  4            0  Vendor specific
0x8e07  4            0  Vendor specific
0x8e08  4            0  Vendor specific
0x8e09  4            0  Vendor specific
0x8e0a  4            0  Vendor specific
0x8e0b  4            0  Vendor specific
0x8e0c  4            0  Vendor specific
0x8e0d  4            0  Vendor specific
0x8e0e  4            0  Vendor specific
0x8e0f  4            0  Vendor specific
0x8e10  4            0  Vendor specific
0x8e11  4            0  Vendor specific



