smartctl 7.2 2020-12-30 r5155 [OpenBSD 7.0 amd64] (local build)
Copyright (C) 2002-20, Bruce Allen, Christian Franke, www.smartmontools.org

=== START OF INFORMATION SECTION ===
Model Family:     Kingston SSDNow UV400/500
Device Model:     KINGSTON SUV500MS480G
Serial Number:    --
LU WWN Device Id: 5 0026b7 ...
Firmware Version: 003056RR
User Capacity:    480,103,981,056 bytes [480 GB]
Sector Sizes:     512 bytes logical, 4096 bytes physical
Rotation Rate:    Solid State Device
Form Factor:      mSATA
TRIM Command:     Available, deterministic
Device is:        In smartctl database [for details use: -P show]
ATA Version is:   ACS-4, ATA8-ACS T13/1699-D revision 6
SATA Version is:  SATA 3.1, 6.0 Gb/s (current: 6.0 Gb/s)
Local Time is:    Wed Nov  3 22:53:53 2021 GMT
SMART support is: Available - device has SMART capability.
SMART support is: Enabled

=== START OF READ SMART DATA SECTION ===
SMART Status not supported: Incomplete response, ATA output registers missing
SMART overall-health self-assessment test result: PASSED
Warning: This result is based on an Attribute check.

General SMART Values:
Offline data collection status:  (0x00)	Offline data collection activity
					was never started.
					Auto Offline Data Collection: Disabled.
Self-test execution status:      (   0)	The previous self-test routine completed
					without error or no self-test has ever 
					been run.
Total time to complete Offline 
data collection: 		(    5) seconds.
Offline data collection
capabilities: 			 (0x71) SMART execute Offline immediate.
					No Auto Offline data collection support.
					Suspend Offline collection upon new
					command.
					No Offline surface scan supported.
					Self-test supported.
					Conveyance Self-test supported.
					Selective Self-test supported.
SMART capabilities:            (0x0003)	Saves SMART data before entering
					power-saving mode.
					Supports SMART auto save timer.
Error logging capability:        (0x01)	Error logging supported.
					General Purpose Logging supported.
Short self-test routine 
recommended polling time: 	 (   2) minutes.
Extended self-test routine
recommended polling time: 	 (   5) minutes.
Conveyance self-test routine
recommended polling time: 	 (   0) minutes.
SCT capabilities: 	       (0x003d)	SCT Status supported.
					SCT Error Recovery Control supported.
					SCT Feature Control supported.
					SCT Data Table supported.

SMART Attributes Data Structure revision number: 48
Vendor Specific SMART Attributes with Thresholds:
ID# ATTRIBUTE_NAME          FLAG     VALUE WORST THRESH TYPE      UPDATED  WHEN_FAILED RAW_VALUE
  1 Raw_Read_Error_Rate     0x002f   100   100   000    Pre-fail  Always       -       551
  5 Reallocated_Sector_Ct   0x0033   100   100   010    Pre-fail  Always       -       0
  9 Power_On_Hours          0x0032   100   100   000    Old_age   Always       -       3802
 12 Power_Cycle_Count       0x0032   100   100   000    Old_age   Always       -       18
100 Unknown_Kingston_Attr   0x0032   100   100   000    Old_age   Always       -       309344
101 Unknown_Kingston_Attr   0x0032   100   100   000    Old_age   Always       -       31872
170 Reserved_Block_Count    0x0032   100   100   000    Old_age   Always       -       0
171 Program_Fail_Count      0x0032   100   100   000    Old_age   Always       -       0
172 Erase_Fail_Count        0x0032   100   100   000    Old_age   Always       -       0
174 Unexpect_Power_Loss_Ct  0x0032   100   100   000    Old_age   Always       -       10
175 Program_Fail_Count_Chip 0x0032   100   100   000    Old_age   Always       -       0
176 Erase_Fail_Count_Chip   0x0032   100   100   000    Old_age   Always       -       0
177 Wear_Leveling_Count     0x0032   100   100   000    Old_age   Always       -       109
178 Used_Rsvd_Blk_Cnt_Chip  0x0002   100   100   000    Old_age   Always       -       0
180 Unused_Rsvd_Blk_Cnt_Tot 0x0002   100   100   000    Old_age   Always       -       1385
183 Runtime_Bad_Block       0x0032   100   100   000    Old_age   Always       -       0
187 Reported_Uncorrect      0x0033   100   100   000    Pre-fail  Always       -       0
194 Temperature_Celsius     0x0022   054   100   000    Old_age   Always       -       54 (Min/Max 22/63)
195 Hardware_ECC_Recovered  0x0032   100   100   000    Old_age   Always       -       551
196 Reallocated_Event_Count 0x0032   100   100   000    Old_age   Always       -       0
197 Current_Pending_Sector  0x0032   100   100   000    Old_age   Always       -       0
199 UDMA_CRC_Error_Count    0x0012   100   100   000    Old_age   Always       -       0
201 Unc_Read_Error_Rate     0x0032   100   100   000    Old_age   Always       -       0
204 Soft_ECC_Correction     0x0032   100   100   000    Old_age   Always       -       551
231 SSD_Life_Left           0x0032   100   100   000    Old_age   Always       -       0
233 Media_Wearout_Indicator 0x0032   100   100   000    Old_age   Always       -       1110
234 Unknown_Attribute       0x0032   100   100   000    Old_age   Always       -       374
241 Host_Writes_GiB         0x0032   100   100   000    Old_age   Always       -       629
242 Host_Reads_GiB          0x0032   100   100   000    Old_age   Always       -       29
250 Read_Retry_Count        0x0032   100   100   000    Old_age   Always       -       5808

SMART Error Log Version: 0
No Errors Logged

SMART Self-test log structure revision number 0
Warning: ATA Specification requires self-test log structure revision number = 1
No self-tests have been logged.  [To run self-tests, use: smartctl -t]

SMART Selective self-test log data structure revision number 0
Note: revision number not 1 implies that no selective self-test has ever been run
 SPAN  MIN_LBA  MAX_LBA  CURRENT_TEST_STATUS
    1        0        0  Not_testing
    2        0        0  Not_testing
    3        0        0  Not_testing
    4        0        0  Not_testing
    5        0        0  Not_testing
Selective self-test flags (0x0):
  After scanning selected spans, do NOT read-scan remainder of disk.
If Selective self-test is pending on power-up, resume after 0 minute delay.

