smartctl 7.4 2023-08-01 r5530 [FreeBSD 14.0-RELEASE amd64] (local build)
Copyright (C) 2002-23, Bruce Allen, Christian Franke, www.smartmontools.org

=== START OF INFORMATION SECTION ===
Model Family:     Seagate Desktop SSHD
Device Model:     ST2000DX001-1CM164
Serial Number:    --
LU WWN Device Id: 5 000c50 ...
Firmware Version: CC62
User Capacity:    2,000,398,934,016 bytes [2.00 TB]
Sector Sizes:     512 bytes logical, 4096 bytes physical
Rotation Rate:    7200 rpm
Form Factor:      3.5 inches
Device is:        In smartctl database 7.3/5528
ATA Version is:   ACS-2, ACS-3 T13/2161-D revision 3b
SATA Version is:  SATA 3.1, 6.0 Gb/s (current: 6.0 Gb/s)
Local Time is:    Mon May 20 19:59:51 2024    
SMART support is: Available - device has SMART capability.
SMART support is: Enabled
AAM feature is:   Unavailable
APM level is:     128 (minimum power consumption without standby)
Rd look-ahead is: Enabled
Write cache is:   Enabled
DSN feature is:   Unavailable
ATA Security is:  Disabled, frozen [SEC2]
Wt Cache Reorder: Unavailable

=== START OF READ SMART DATA SECTION ===
SMART overall-health self-assessment test result: PASSED
See vendor-specific Attribute list for marginal Attributes.

General SMART Values:
Offline data collection status:  (0x00)	Offline data collection activity
					was never started.
					Auto Offline Data Collection: Disabled.
Self-test execution status:      (   0)	The previous self-test routine completed
					without error or no self-test has ever 
					been run.
Total time to complete Offline 
data collection: 		(    0) seconds.
Offline data collection
capabilities: 			 (0x73) SMART execute Offline immediate.
					Auto Offline data collection on/off support.
					Suspend Offline collection upon new
					command.
					No Offline surface scan supported.
					Self-test supported.
					Conveyance Self-test supported.
					Selective Self-test supported.
SMART capabilities:            (0x0003)	Saves SMART data before entering
					power-saving mode.
					Supports SMART auto save timer.
Error logging capability:        (0x01)	Error logging supported.
					General Purpose Logging supported.
Short self-test routine 
recommended polling time: 	 (   1) minutes.
Extended self-test routine
recommended polling time: 	 ( 223) minutes.
Conveyance self-test routine
recommended polling time: 	 (   2) minutes.
SCT capabilities: 	       (0x1081)	SCT Status supported.

SMART Attributes Data Structure revision number: 10
Vendor Specific SMART Attributes with Thresholds:
ID# ATTRIBUTE_NAME          FLAGS    VALUE WORST THRESH FAIL RAW_VALUE
  1 Raw_Read_Error_Rate     POSR--   118   099   006    -    192115456
  3 Spin_Up_Time            PO----   096   095   000    -    0
  4 Start_Stop_Count        -O--CK   095   095   020    -    5290
  5 Reallocated_Sector_Ct   PO--CK   100   100   010    -    0
  7 Seek_Error_Rate         POSR--   084   060   030    -    4545903575
  9 Power_On_Hours          -O--CK   065   065   000    -    30979
 10 Spin_Retry_Count        PO--C-   100   100   097    -    0
 12 Power_Cycle_Count       -O--CK   095   095   020    -    5174
183 Runtime_Bad_Block       -O--CK   060   060   000    -    40
184 End-to-End_Error        -O--CK   095   095   099    NOW  5
187 Reported_Uncorrect      -O--CK   099   099   000    -    1
188 Command_Timeout         -O--CK   100   099   000    -    1 91 98
189 High_Fly_Writes         -O-RCK   097   097   000    -    3
190 Airflow_Temperature_Cel -O---K   063   050   045    -    37 (Min/Max 37/38)
191 G-Sense_Error_Rate      -O--CK   100   100   000    -    0
192 Power-Off_Retract_Count -O--CK   100   100   000    -    1943
193 Load_Cycle_Count        -O--CK   095   095   000    -    11302
194 Temperature_Celsius     -O---K   037   050   000    -    37 (0 10 0 0 0)
197 Current_Pending_Sector  -O--C-   100   100   000    -    0
198 Offline_Uncorrectable   ----C-   100   100   000    -    0
199 UDMA_CRC_Error_Count    -OSRCK   200   200   000    -    0
240 Head_Flying_Hours       ------   100   253   000    -    34293h+34m+39.261s
241 Total_LBAs_Written      ------   100   253   000    -    35105156805
242 Total_LBAs_Read         ------   100   253   000    -    60801282201
                            ||||||_ K auto-keep
                            |||||__ C event count
                            ||||___ R error rate
                            |||____ S speed/performance
                            ||_____ O updated online
                            |______ P prefailure warning

General Purpose Log Directory Version 1
SMART           Log Directory Version 1 [multi-sector log support]
Address    Access  R/W   Size  Description
0x00       GPL,SL  R/O      1  Log Directory
0x01           SL  R/O      1  Summary SMART error log
0x02           SL  R/O      5  Comprehensive SMART error log
0x03       GPL     R/O      5  Ext. Comprehensive SMART error log
0x06           SL  R/O      1  SMART self-test log
0x07       GPL     R/O      1  Extended self-test log
0x09           SL  R/W      1  Selective self-test log
0x10       GPL     R/O      1  NCQ Command Error log
0x11       GPL     R/O      1  SATA Phy Event Counters log
0x21       GPL     R/O      1  Write stream error log
0x22       GPL     R/O      1  Read stream error log
0x30       GPL,SL  R/O      9  IDENTIFY DEVICE data log
0x80-0x9f  GPL,SL  R/W     16  Host vendor specific log
0xa1       GPL,SL  VS      20  Device vendor specific log
0xa2       GPL     VS    3900  Device vendor specific log
0xa8       GPL,SL  VS     129  Device vendor specific log
0xa9       GPL,SL  VS       1  Device vendor specific log
0xab       GPL     VS       1  Device vendor specific log
0xb0       GPL     VS    4580  Device vendor specific log
0xbe-0xbf  GPL     VS   65535  Device vendor specific log
0xc0       GPL,SL  VS       1  Device vendor specific log
0xc1       GPL,SL  VS      10  Device vendor specific log
0xc4       GPL,SL  VS       5  Device vendor specific log
0xe0       GPL,SL  R/W      1  SCT Command/Status
0xe1       GPL,SL  R/W      1  SCT Data Transfer

SMART Extended Comprehensive Error Log Version: 1 (5 sectors)
Device Error Count: 6
	CR     = Command Register
	FEATR  = Features Register
	COUNT  = Count (was: Sector Count) Register
	LBA_48 = Upper bytes of LBA High/Mid/Low Registers ]  ATA-8
	LH     = LBA High (was: Cylinder High) Register    ]   LBA
	LM     = LBA Mid (was: Cylinder Low) Register      ] Register
	LL     = LBA Low (was: Sector Number) Register     ]
	DV     = Device (was: Device/Head) Register
	DC     = Device Control Register
	ER     = Error register
	ST     = Status register
Powered_Up_Time is measured from power on, and printed as
DDd+hh:mm:SS.sss where DD=days, hh=hours, mm=minutes,
SS=sec, and sss=millisec. It "wraps" after 49.710 days.

Error 6 [5] occurred at disk power-on lifetime: 27380 hours (1140 days + 20 hours)
  When the command that caused the error occurred, the device was active or idle.

  After command completion occurred, registers were:
  ER -- ST COUNT  LBA_48  LH LM LL DV DC
  -- -- -- == -- == == == -- -- -- -- --
  40 -- 51 00 00 00 00 00 1e 90 a4 00 00  Error: UNC at LBA = 0x001e90a4 = 2003108

  Commands leading to the command that caused the error were:
  CR FEATR COUNT  LBA_48  LH LM LL DV DC  Powered_Up_Time  Command/Feature_Name
  -- == -- == -- == == == -- -- -- -- --  ---------------  --------------------
  25 00 00 00 40 00 00 00 1e 90 80 40 00     00:00:17.539  READ DMA EXT
  25 00 00 00 40 00 00 00 1f b8 80 40 00     00:00:17.538  READ DMA EXT
  25 00 00 00 40 00 00 00 20 66 80 40 00     00:00:17.537  READ DMA EXT
  25 00 00 00 40 00 00 00 20 4d c0 40 00     00:00:17.536  READ DMA EXT
  25 00 00 00 40 00 00 08 3f b8 00 40 00     00:00:17.535  READ DMA EXT

Error 5 [4] occurred at disk power-on lifetime: 27380 hours (1140 days + 20 hours)
  When the command that caused the error occurred, the device was active or idle.

  After command completion occurred, registers were:
  ER -- ST COUNT  LBA_48  LH LM LL DV DC
  -- -- -- == -- == == == -- -- -- -- --
  40 -- 51 00 00 00 00 00 1e 90 9a 00 00  Error: UNC at LBA = 0x001e909a = 2003098

  Commands leading to the command that caused the error were:
  CR FEATR COUNT  LBA_48  LH LM LL DV DC  Powered_Up_Time  Command/Feature_Name
  -- == -- == -- == == == -- -- -- -- --  ---------------  --------------------
  25 00 00 00 40 00 00 00 1e 90 80 40 00     00:00:17.234  READ DMA EXT
  25 00 00 00 40 00 00 00 1e 90 40 40 00     00:00:17.218  READ DMA EXT
  25 00 00 00 40 00 00 dc ac 92 80 40 00     00:00:17.217  READ DMA EXT
  25 00 00 00 40 00 00 dc ab 95 80 40 00     00:00:17.216  READ DMA EXT
  25 00 00 00 40 00 00 dc ab 88 40 40 00     00:00:17.215  READ DMA EXT

Error 4 [3] occurred at disk power-on lifetime: 27380 hours (1140 days + 20 hours)
  When the command that caused the error occurred, the device was active or idle.

  After command completion occurred, registers were:
  ER -- ST COUNT  LBA_48  LH LM LL DV DC
  -- -- -- == -- == == == -- -- -- -- --
  40 -- 51 00 00 00 00 00 1e 90 04 00 00  Error: UNC at LBA = 0x001e9004 = 2002948

  Commands leading to the command that caused the error were:
  CR FEATR COUNT  LBA_48  LH LM LL DV DC  Powered_Up_Time  Command/Feature_Name
  -- == -- == -- == == == -- -- -- -- --  ---------------  --------------------
  60 00 00 01 00 00 00 dc ab 88 00 40 00  2d+02:45:09.279  READ FPDMA QUEUED
  60 00 00 01 00 00 00 00 1e 90 00 40 00  2d+02:45:09.279  READ FPDMA QUEUED
  60 00 00 01 00 00 00 00 00 08 00 40 00  2d+02:45:09.279  READ FPDMA QUEUED
  60 00 00 01 00 00 00 00 00 00 00 40 00  2d+02:45:09.279  READ FPDMA QUEUED
  ea 00 00 00 00 00 00 00 00 00 00 a0 00  2d+02:45:09.156  FLUSH CACHE EXT

Error 3 [2] occurred at disk power-on lifetime: 27179 hours (1132 days + 11 hours)
  When the command that caused the error occurred, the device was active or idle.

  After command completion occurred, registers were:
  ER -- ST COUNT  LBA_48  LH LM LL DV DC
  -- -- -- == -- == == == -- -- -- -- --
  40 -- 51 00 00 00 00 03 3f db 40 00 00  Error: UNC at LBA = 0x033fdb40 = 54516544

  Commands leading to the command that caused the error were:
  CR FEATR COUNT  LBA_48  LH LM LL DV DC  Powered_Up_Time  Command/Feature_Name
  -- == -- == -- == == == -- -- -- -- --  ---------------  --------------------
  60 00 00 07 d8 00 00 03 3f c0 28 40 00     00:39:00.993  READ FPDMA QUEUED
  60 00 00 05 e0 00 00 03 3f c8 00 40 00     00:39:00.993  READ FPDMA QUEUED
  60 00 00 0a 00 00 00 03 3f d1 e0 40 00     00:39:00.993  READ FPDMA QUEUED
  60 00 00 0a 00 00 00 03 3f db e0 40 00     00:39:00.993  READ FPDMA QUEUED
  60 00 00 02 20 00 00 03 3f e5 e0 40 00     00:39:00.993  READ FPDMA QUEUED

Error 2 [1] occurred at disk power-on lifetime: 26459 hours (1102 days + 11 hours)
  When the command that caused the error occurred, the device was active or idle.

  After command completion occurred, registers were:
  ER -- ST COUNT  LBA_48  LH LM LL DV DC
  -- -- -- == -- == == == -- -- -- -- --
  40 -- 51 00 00 00 00 00 1e 90 c4 00 00  Error: UNC at LBA = 0x001e90c4 = 2003140

  Commands leading to the command that caused the error were:
  CR FEATR COUNT  LBA_48  LH LM LL DV DC  Powered_Up_Time  Command/Feature_Name
  -- == -- == -- == == == -- -- -- -- --  ---------------  --------------------
  60 00 00 01 00 00 00 dc ab 88 00 40 00     19:38:04.989  READ FPDMA QUEUED
  60 00 00 01 00 00 00 00 1e 90 00 40 00     19:38:04.989  READ FPDMA QUEUED
  60 00 00 01 00 00 00 00 00 08 00 40 00     19:38:04.989  READ FPDMA QUEUED
  60 00 00 01 00 00 00 00 00 00 00 40 00     19:38:04.989  READ FPDMA QUEUED
  ea 00 00 00 00 00 00 00 00 00 00 a0 00     19:38:04.866  FLUSH CACHE EXT

Error 1 [0] occurred at disk power-on lifetime: 15679 hours (653 days + 7 hours)
  When the command that caused the error occurred, the device was active or idle.

  After command completion occurred, registers were:
  ER -- ST COUNT  LBA_48  LH LM LL DV DC
  -- -- -- == -- == == == -- -- -- -- --
  40 -- 51 00 00 00 00 01 16 74 16 00 00  Error: UNC at LBA = 0x01167416 = 18248726

  Commands leading to the command that caused the error were:
  CR FEATR COUNT  LBA_48  LH LM LL DV DC  Powered_Up_Time  Command/Feature_Name
  -- == -- == -- == == == -- -- -- -- --  ---------------  --------------------
  60 00 00 00 02 00 00 01 32 d2 27 40 00     01:27:22.828  READ FPDMA QUEUED
  61 00 00 00 08 00 00 06 fc ac 78 40 00     01:27:22.828  WRITE FPDMA QUEUED
  61 00 00 00 28 00 00 01 5d 8e 18 40 00     01:27:22.719  WRITE FPDMA QUEUED
  61 00 00 00 60 00 00 06 fd 15 88 40 00     01:27:22.718  WRITE FPDMA QUEUED
  61 00 00 00 20 00 00 04 1b dd c0 40 00     01:27:22.718  WRITE FPDMA QUEUED

SMART Extended Self-test Log Version: 1 (1 sectors)
Num  Test_Description    Status                  Remaining  LifeTime(hours)  LBA_of_first_error
# 1  Extended offline    Completed without error       00%     30866         -
# 2  Extended offline    Completed without error       00%     29309         -
# 3  Extended offline    Completed without error       00%     29191         -
# 4  Extended offline    Completed without error       00%     28611         -
# 5  Extended offline    Completed without error       00%     23192         -
# 6  Extended offline    Completed without error       00%     22884         -
# 7  Extended offline    Completed without error       00%     22743         -
# 8  Extended offline    Interrupted (host reset)      00%     22590         -
# 9  Short offline       Interrupted (host reset)      00%     15677         -
#10  Short offline       Completed without error       00%      1408         -
#11  Vendor (0x50)       Completed without error       00%      1383         -
#12  Short offline       Completed without error       00%      1383         -
#13  Vendor (0x50)       Completed without error       00%         0         -

SMART Selective self-test log data structure revision number 1
 SPAN  MIN_LBA  MAX_LBA  CURRENT_TEST_STATUS
    1        0        0  Not_testing
    2        0        0  Not_testing
    3        0        0  Not_testing
    4        0        0  Not_testing
    5        0        0  Not_testing
Selective self-test flags (0x0):
  After scanning selected spans, do NOT read-scan remainder of disk.
If Selective self-test is pending on power-up, resume after 0 minute delay.

SCT Status Version:                  3
SCT Version (vendor specific):       522 (0x020a)
Device State:                        Active (0)
Current Temperature:                    38 Celsius
Power Cycle Min/Max Temperature:     25/38 Celsius
Lifetime    Min/Max Temperature:     14/50 Celsius
Under/Over Temperature Limit Count:   0/0

SCT Data Table command not supported

SCT Error Recovery Control command not supported

Device Statistics (GP/SMART Log 0x04) not supported

Pending Defects log (GP Log 0x0c) not supported

SATA Phy Event Counters (GP Log 0x11)
ID      Size     Value  Description
0x000a  2           19  Device-to-host register FISes sent due to a COMRESET
0x0001  2            0  Command failed due to ICRC error
0x0003  2            0  R_ERR response for device-to-host data FIS
0x0004  2            0  R_ERR response for host-to-device data FIS
0x0006  2            0  R_ERR response for device-to-host non-data FIS
0x0007  2            0  R_ERR response for host-to-device non-data FIS



