smartctl 7.4 2023-08-01 r5530 [FreeBSD 14.2-RELEASE-p3 amd64] (local build)
Copyright (C) 2002-23, Bruce Allen, Christian Franke, www.smartmontools.org

=== START OF INFORMATION SECTION ===
Model Family:     Plextor M3/M5/M6/M7 Series SSDs
Device Model:     PLEXTOR PX-256M5M
Serial Number:    --
LU WWN Device Id: 5 002303 ...
Add. Product Id:  DM802050
Firmware Version: 1.04
User Capacity:    256,060,514,304 bytes [256 GB]
Sector Size:      512 bytes logical/physical
Rotation Rate:    Solid State Device
TRIM Command:     Available
Device is:        In smartctl database 7.3/5528
ATA Version is:   ATA8-ACS, ATA/ATAPI-7 T13/1532D revision 4a
SATA Version is:  SATA 3.1, 6.0 Gb/s (current: 6.0 Gb/s)
Local Time is:    Sun May 18 11:31:47 2025 CEST
SMART support is: Available - device has SMART capability.
SMART support is: Enabled
AAM feature is:   Unavailable
APM feature is:   Unavailable
Rd look-ahead is: Enabled
Write cache is:   Enabled
DSN feature is:   Unavailable
ATA Security is:  Disabled, frozen [SEC2]
Wt Cache Reorder: Enabled

=== START OF READ SMART DATA SECTION ===
SMART overall-health self-assessment test result: PASSED

General SMART Values:
Offline data collection status:  (0x00)	Offline data collection activity
					was never started.
					Auto Offline Data Collection: Disabled.
Self-test execution status:      (   0)	The previous self-test routine completed
					without error or no self-test has ever 
					been run.
Total time to complete Offline 
data collection: 		(   10) seconds.
Offline data collection
capabilities: 			 (0x15) SMART execute Offline immediate.
					No Auto Offline data collection support.
					Abort Offline collection upon new
					command.
					No Offline surface scan supported.
					Self-test supported.
					No Conveyance Self-test supported.
					No Selective Self-test supported.
SMART capabilities:            (0x0002)	Does not save SMART data before
					entering power-saving mode.
					Supports SMART auto save timer.
Error logging capability:        (0x00)	Error logging supported.
					General Purpose Logging supported.
Short self-test routine 
recommended polling time: 	 (   1) minutes.
Extended self-test routine
recommended polling time: 	 (  10) minutes.
SCT capabilities: 	       (0x003d)	SCT Status supported.
					SCT Error Recovery Control supported.
					SCT Feature Control supported.
					SCT Data Table supported.

SMART Attributes Data Structure revision number: 1
Vendor Specific SMART Attributes with Thresholds:
ID# ATTRIBUTE_NAME          FLAGS    VALUE WORST THRESH FAIL RAW_VALUE
  1 Raw_Read_Error_Rate     PO----   100   100   070    -    0
  5 Reallocated_Sector_Ct   PO----   100   100   000    -    0
  9 Power_On_Hours          -O----   100   100   000    -    418
 12 Power_Cycle_Count       -O----   100   100   000    -    1614
177 Wear_Leveling_Count     PO----   100   100   000    -    33121
178 Used_Rsvd_Blk_Cnt_Chip  PO----   100   100   000    -    1
181 Program_Fail_Cnt_Total  PO----   100   100   000    -    0
182 Erase_Fail_Count_Total  PO----   100   100   000    -    0
187 Reported_Uncorrect      -O----   100   100   000    -    1
192 Power-Off_Retract_Count PO----   100   100   000    -    149
196 Reallocated_Event_Count PO----   100   100   000    -    1
198 Offline_Uncorrectable   PO----   100   100   000    -    0
199 UDMA_CRC_Error_Count    PO----   100   100   000    -    386
232 Available_Reservd_Space PO----   100   100   010    -    0
241 Host_Writes_32MiB       PO----   100   100   000    -    201983
242 Host_Reads_32MiB        PO----   100   100   000    -    178850
                            ||||||_ K auto-keep
                            |||||__ C event count
                            ||||___ R error rate
                            |||____ S speed/performance
                            ||_____ O updated online
                            |______ P prefailure warning

General Purpose Log Directory Version 0
SMART           Log Directory Version 0
Address    Access  R/W   Size  Description
0x00       GPL,SL  R/O      1  Log Directory
0x01       GPL,SL  R/O      1  Summary SMART error log
0x06       GPL,SL  R/O      1  SMART self-test log
0x07       GPL,SL  R/O      1  Extended self-test log
0x10       GPL,SL  R/O      1  NCQ Command Error log
0x11       GPL,SL  R/O      1  SATA Phy Event Counters log
0x80-0x9f  GPL,SL  R/W      1  Host vendor specific log
0xe0       GPL,SL  R/W      1  SCT Command/Status
0xe1       GPL,SL  R/W      1  SCT Data Transfer

SMART Extended Comprehensive Error Log (GP Log 0x03) not supported

SMART Error Log Version: 1
Warning: ATA error count 0 inconsistent with error log pointer 4

ATA Error Count: 0
	CR = Command Register [HEX]
	FR = Features Register [HEX]
	SC = Sector Count Register [HEX]
	SN = Sector Number Register [HEX]
	CL = Cylinder Low Register [HEX]
	CH = Cylinder High Register [HEX]
	DH = Device/Head Register [HEX]
	DC = Device Command Register [HEX]
	ER = Error register [HEX]
	ST = Status register [HEX]
Powered_Up_Time is measured from power on, and printed as
DDd+hh:mm:SS.sss where DD=days, hh=hours, mm=minutes,
SS=sec, and sss=millisec. It "wraps" after 49.710 days.

Error 0 occurred at disk power-on lifetime: 0 hours (0 days + 0 hours)
  When the command that caused the error occurred, the device was in an unknown state.

  After command completion occurred, registers were:
  ER ST SC SN CL CH DH
  -- -- -- -- -- -- --
  99 00 f7 25 e9 70 04

  Commands leading to the command that caused the error were:
  CR FR SC SN CL CH DH DC   Powered_Up_Time  Command/Feature_Name
  -- -- -- -- -- -- -- --  ----------------  --------------------
  00 99 f7 25 dd 70 04 79  24d+20:40:07.936  NOP [Reserved subcommand] [OBS-ACS-2]
  00 99 f7 25 d5 70 04 79  24d+20:40:07.936  NOP [Reserved subcommand] [OBS-ACS-2]
  00 99 f7 25 cd 70 04 c0  24d+23:43:37.984  NOP [Reserved subcommand] [OBS-ACS-2]
  00 99 f7 25 c2 70 04 c0  20d+04:49:14.752  NOP [Reserved subcommand] [OBS-ACS-2]
  00 00 00 03 00 00 00 00  20d+04:49:14.752  NOP [Abort queued commands]

Error -1 occurred at disk power-on lifetime: 0 hours (0 days + 0 hours)
  When the command that caused the error occurred, the device was in an unknown state.

  After command completion occurred, registers were:
  ER ST SC SN CL CH DH
  -- -- -- -- -- -- --
  25 00 ba 70 04 00 00

  Commands leading to the command that caused the error were:
  CR FR SC SN CL CH DH DC   Powered_Up_Time  Command/Feature_Name
  -- -- -- -- -- -- -- --  ----------------  --------------------
  00 25 b2 70 04 00 00 f7  29d+20:32:03.600  NOP [Reserved subcommand] [OBS-ACS-2]
  00 25 a7 70 04 00 00 f7  29d+20:31:28.776  NOP [Reserved subcommand] [OBS-ACS-2]
  00 25 9f 70 04 00 00 f7  29d+20:31:28.776  NOP [Reserved subcommand] [OBS-ACS-2]
  00 25 97 70 04 00 00 f7  29d+20:31:28.800  NOP [Reserved subcommand] [OBS-ACS-2]
  00 03 00 00 00 00 00 00  29d+20:23:07.016  NOP [Reserved subcommand] [OBS-ACS-2]

Error -2 occurred at disk power-on lifetime: 0 hours (0 days + 0 hours)
  When the command that caused the error occurred, the device was in an unknown state.

  After command completion occurred, registers were:
  ER ST SC SN CL CH DH
  -- -- -- -- -- -- --
  70 38 04 00 00 00 08

  Commands leading to the command that caused the error were:
  CR FR SC SN CL CH DH DC   Powered_Up_Time  Command/Feature_Name
  -- -- -- -- -- -- -- --  ----------------  --------------------
  38 70 04 00 00 00 08 83   7d+08:56:23.736  CFA WRITE SECTORS WITHOUT ERASE
  38 70 04 00 00 00 18 7c   7d+08:56:23.736  CFA WRITE SECTORS WITHOUT ERASE
  c8 70 04 00 00 00 08 70   7d+08:56:23.705  READ DMA
  c8 70 04 00 00 00 08 68   7d+08:56:23.705  READ DMA
  c8 00 00 00 00 00 28 00   7d+08:56:23.705  READ DMA

Error -3 occurred at disk power-on lifetime: 768 hours (32 days + 0 hours)
  When the command that caused the error occurred, the device was in an unknown state.

  After command completion occurred, registers were:
  ER ST SC SN CL CH DH
  -- -- -- -- -- -- --
  00 99 00 00 08 48 9a

  Commands leading to the command that caused the error were:
  CR FR SC SN CL CH DH DC   Powered_Up_Time  Command/Feature_Name
  -- -- -- -- -- -- -- --  ----------------  --------------------
  99 00 00 00 08 48 9a 04  21d+19:42:29.367  SLEEP [RET-4]
  99 00 00 00 08 48 9a 04  21d+19:30:28.471  SLEEP [RET-4]
  99 00 00 00 18 48 9a 04  21d+19:21:44.183  SLEEP [RET-4]
  99 00 00 00 08 b0 2c 04  21d+19:12:59.895  SLEEP [RET-4]
  99 00 00 00 18 b0 2c 00  21d+18:59:53.463  SLEEP [RET-4]

Error -4 occurred at disk power-on lifetime: 0 hours (0 days + 0 hours)
  When the command that caused the error occurred, the device was in an unknown state.

  After command completion occurred, registers were:
  ER ST SC SN CL CH DH
  -- -- -- -- -- -- --
  a8 70 2c 99 f7 25 31

  Commands leading to the command that caused the error were:
  CR FR SC SN CL CH DH DC   Powered_Up_Time  Command/Feature_Name
  -- -- -- -- -- -- -- --  ----------------  --------------------
  70 a8 2c 99 f7 25 2a 08      00:00:00.004  SEEK [OBS-7]
  70 a8 2c 99 f7 25 1e 08      00:00:00.004  SEEK [OBS-7]
  72 98 d7 98 f7 25 37 08      00:00:00.004  SEEK [RET-4]
  72 98 d7 98 f7 25 2f 08      00:00:00.004  SEEK [RET-4]
  00 00 00 00 00 03 00 00      00:00:00.000  NOP [Abort queued commands]

SMART Extended Self-test Log Version: 1 (1 sectors)
No self-tests have been logged.  [To run self-tests, use: smartctl -t]

Selective Self-tests/Logging not supported

SCT Status Version:                  3
SCT Version (vendor specific):       1 (0x0001)
Device State:                        Active (0)
Current Temperature:                     ? Celsius
Power Cycle Min/Max Temperature:      ?/ ? Celsius
Lifetime    Min/Max Temperature:      ?/ ? Celsius
Under/Over Temperature Limit Count:   0/0

SCT Temperature History Version:     2
Temperature Sampling Period:         0 minutes
Temperature Logging Interval:        0 minutes
Min/Max recommended Temperature:      ?/ ? Celsius
Min/Max Temperature Limit:            ?/ ? Celsius
Temperature History Size (Index):    128 (0)

SCT Error Recovery Control:
           Read:      2 (0.2 seconds)
          Write:      2 (0.2 seconds)

Device Statistics (GP/SMART Log 0x04) not supported

Pending Defects log (GP Log 0x0c) not supported

SATA Phy Event Counters (GP Log 0x11)
ID      Size     Value  Description
0x0001  2            0  Command failed due to ICRC error
0x0002  2            0  R_ERR response for data FIS
0x0003  2            0  R_ERR response for device-to-host data FIS
0x0004  2            0  R_ERR response for host-to-device data FIS
0x0005  2            0  R_ERR response for non-data FIS
0x0006  2            0  R_ERR response for device-to-host non-data FIS
0x0007  2            0  R_ERR response for host-to-device non-data FIS
0x0008  2            0  Device-to-host non-data FIS retries
0x0009  2            0  Transition from drive PhyRdy to drive PhyNRdy
0x000a  2            4  Device-to-host register FISes sent due to a COMRESET
0x000b  2            0  CRC errors within host-to-device FIS
0x000d  2            0  Non-CRC errors within host-to-device FIS
0x000f  2            0  R_ERR response for host-to-device data FIS, CRC
0x0010  2            0  R_ERR response for host-to-device data FIS, non-CRC
0x0012  2            0  R_ERR response for host-to-device non-data FIS, CRC
0x0013  2            0  R_ERR response for host-to-device non-data FIS, non-CRC

