smartctl 7.2 2020-12-30 r5155 [FreeBSD 13.0-RELEASE amd64] (local build)
Copyright (C) 2002-20, Bruce Allen, Christian Franke, www.smartmontools.org

=== START OF INFORMATION SECTION ===
Model Family:     Apple SD/SM/TS...E/F/G SSDs
Device Model:     APPLE SSD SM128E
Serial Number:    --
LU WWN Device Id: 5 002538 ...
Firmware Version: CXM07A1Q
User Capacity:    121,332,826,112 bytes [121 GB]
Sector Sizes:     512 bytes logical, 4096 bytes physical
Rotation Rate:    Solid State Device
TRIM Command:     Available
Device is:        In smartctl database [for details use: -P show]
ATA Version is:   ATA8-ACS T13/1699-D revision 4c
SATA Version is:  SATA 3.0, 6.0 Gb/s (current: 3.0 Gb/s)
Local Time is:    Mon Jul 26 17:57:19 2021 PDT
SMART support is: Available - device has SMART capability.
SMART support is: Enabled
AAM feature is:   Disabled
APM feature is:   Unavailable
Rd look-ahead is: Enabled
Write cache is:   Enabled
DSN feature is:   Unavailable
ATA Security is:  Disabled, frozen [SEC2]
Wt Cache Reorder: Unavailable

=== START OF READ SMART DATA SECTION ===
SMART overall-health self-assessment test result: PASSED

General SMART Values:
Offline data collection status:  (0x02)	Offline data collection activity
					was completed without error.
					Auto Offline Data Collection: Disabled.
Self-test execution status:      (  25)	The self-test routine was aborted by
					the host.
Total time to complete Offline 
data collection: 		(  480) seconds.
Offline data collection
capabilities: 			 (0x5b) SMART execute Offline immediate.
					Auto Offline data collection on/off support.
					Suspend Offline collection upon new
					command.
					Offline surface scan supported.
					Self-test supported.
					No Conveyance Self-test supported.
					Selective Self-test supported.
SMART capabilities:            (0x0003)	Saves SMART data before entering
					power-saving mode.
					Supports SMART auto save timer.
Error logging capability:        (0x01)	Error logging supported.
					General Purpose Logging supported.
Short self-test routine 
recommended polling time: 	 (   2) minutes.
Extended self-test routine
recommended polling time: 	 (   8) minutes.

SMART Attributes Data Structure revision number: 1
Vendor Specific SMART Attributes with Thresholds:
ID# ATTRIBUTE_NAME          FLAGS    VALUE WORST THRESH FAIL RAW_VALUE
  1 Raw_Read_Error_Rate     -O-RC-   200   200   000    -    0
  5 Reallocated_Sector_Ct   PO--CK   100   100   000    -    0
  9 Power_On_Hours          -O--CK   099   099   000    -    2292
 12 Power_Cycle_Count       -O--CK   096   096   000    -    3936
169 Unknown_Apple_Attrib    PO--C-   253   253   010    -    876437572736
173 Wear_Leveling_Count     -O--CK   190   190   100    -    450991685832
192 Power-Off_Retract_Count -O--C-   099   099   000    -    3901
194 Temperature_Celsius     -O---K   074   049   000    -    26 (Min/Max 0/51)
197 Current_Pending_Sector  -O---K   100   100   000    -    0
199 UDMA_CRC_Error_Count    -O-RC-   200   200   000    -    0
                            ||||||_ K auto-keep
                            |||||__ C event count
                            ||||___ R error rate
                            |||____ S speed/performance
                            ||_____ O updated online
                            |______ P prefailure warning

General Purpose Log Directory Version 1
SMART           Log Directory Version 1 [multi-sector log support]
Address    Access  R/W   Size  Description
0x00       GPL,SL  R/O      1  Log Directory
0x01       GPL,SL  R/O      1  Summary SMART error log
0x02       GPL,SL  R/O      2  Comprehensive SMART error log
0x03       GPL,SL  R/O      2  Ext. Comprehensive SMART error log
0x06       GPL,SL  R/O      1  SMART self-test log
0x07       GPL,SL  R/O      2  Extended self-test log
0x09       GPL,SL  R/W      1  Selective self-test log
0x10       GPL,SL  R/O      1  NCQ Command Error log
0x11       GPL,SL  R/O      1  SATA Phy Event Counters log
0x80-0x9f  GPL,SL  R/W     16  Host vendor specific log

SMART Extended Comprehensive Error Log Version: 1 (2 sectors)
No Errors Logged

SMART Extended Self-test Log Version: 1 (2 sectors)
Num  Test_Description    Status                  Remaining  LifeTime(hours)  LBA_of_first_error
# 1  Short offline       Aborted by host               90%         7         -
# 2  Short offline       Aborted by host               90%         7         -
# 3  Short offline       Aborted by host               90%         7         -
# 4  Short offline       Aborted by host               90%         7         -
# 5  Short offline       Aborted by host               90%         7         -

SMART Selective self-test log data structure revision number 1
 SPAN  MIN_LBA  MAX_LBA  CURRENT_TEST_STATUS
    1        0        0  Not_testing
    2        0        0  Not_testing
    3        0        0  Not_testing
    4        0        0  Not_testing
    5        0        0  Not_testing
Selective self-test flags (0x0):
  After scanning selected spans, do NOT read-scan remainder of disk.
If Selective self-test is pending on power-up, resume after 0 minute delay.

SCT Commands not supported

Device Statistics (GP/SMART Log 0x04) not supported

Pending Defects log (GP Log 0x0c) not supported

SATA Phy Event Counters (GP Log 0x11)
ID      Size     Value  Description
0x0001  2            1  Command failed due to ICRC error
0x0002  2        49152  R_ERR response for data FIS
0x0003  2        53248  R_ERR response for device-to-host data FIS
0x0004  2        57344  R_ERR response for host-to-device data FIS
0x0005  2         7952  R_ERR response for non-data FIS
0x0006  2         2562  R_ERR response for device-to-host non-data FIS
0x0007  2         4096  R_ERR response for host-to-device non-data FIS
0x0008  2         7952  Device-to-host non-data FIS retries
0x0009  2         7953  Transition from drive PhyRdy to drive PhyNRdy
0x000a  2         2739  Device-to-host register FISes sent due to a COMRESET
0x000b  2         6145  CRC errors within host-to-device FIS
0x000d  2         7953  Non-CRC errors within host-to-device FIS
0x000f  2         8176  R_ERR response for host-to-device data FIS, CRC
0x0010  2           15  R_ERR response for host-to-device data FIS, non-CRC
0x0012  2        49153  R_ERR response for host-to-device non-data FIS, CRC
0x0013  2        12112  R_ERR response for host-to-device non-data FIS, non-CRC

