smartctl 7.3 2022-02-28 r5338 [FreeBSD 13.1-RELEASE amd64] (local build)
Copyright (C) 2002-22, Bruce Allen, Christian Franke, www.smartmontools.org

=== START OF INFORMATION SECTION ===
Device Model:     SATA SSD
Serial Number:    --
Firmware Version: SBFQE1.3
User Capacity:    128,035,676,160 bytes [128 GB]
Sector Size:      512 bytes logical/physical
Rotation Rate:    Solid State Device
Form Factor:      2.5 inches
TRIM Command:     Available
Device is:        Not in smartctl database 7.3/5319
ATA Version is:   ACS-4 (minor revision not indicated)
SATA Version is:  SATA 3.2, 6.0 Gb/s (current: 3.0 Gb/s)
Local Time is:    Tue Jan 24 02:57:33 2023 UTC
SMART support is: Available - device has SMART capability.
SMART support is: Enabled
AAM feature is:   Unavailable
APM feature is:   Unavailable
Rd look-ahead is: Enabled
Write cache is:   Enabled
DSN feature is:   Unavailable
ATA Security is:  Disabled, frozen [SEC2]
Wt Cache Reorder: Unavailable

=== START OF READ SMART DATA SECTION ===
SMART overall-health self-assessment test result: PASSED

General SMART Values:
Offline data collection status:  (0x00)	Offline data collection activity
					was never started.
					Auto Offline Data Collection: Disabled.
Self-test execution status:      (   0)	The previous self-test routine completed
					without error or no self-test has ever 
					been run.
Total time to complete Offline 
data collection: 		(65535) seconds.
Offline data collection
capabilities: 			 (0x79) SMART execute Offline immediate.
					No Auto Offline data collection support.
					Suspend Offline collection upon new
					command.
					Offline surface scan supported.
					Self-test supported.
					Conveyance Self-test supported.
					Selective Self-test supported.
SMART capabilities:            (0x0003)	Saves SMART data before entering
					power-saving mode.
					Supports SMART auto save timer.
Error logging capability:        (0x01)	Error logging supported.
					General Purpose Logging supported.
Short self-test routine 
recommended polling time: 	 (   2) minutes.
Extended self-test routine
recommended polling time: 	 (  30) minutes.
Conveyance self-test routine
recommended polling time: 	 (   6) minutes.

SMART Attributes Data Structure revision number: 16
Vendor Specific SMART Attributes with Thresholds:
ID# ATTRIBUTE_NAME          FLAGS    VALUE WORST THRESH FAIL RAW_VALUE
  1 Raw_Read_Error_Rate     PO-R--   100   100   050    -    0
  5 Reallocated_Sector_Ct   PO--C-   100   100   050    -    0
  9 Power_On_Hours          -O--C-   100   100   000    -    12747
 12 Power_Cycle_Count       -O--C-   100   100   000    -    805
161 Unknown_Attribute       -O--C-   100   100   000    -    323
163 Unknown_Attribute       PO----   100   100   050    -    5
165 Unknown_Attribute       ------   100   100   000    -    261
166 Unknown_Attribute       ------   100   100   000    -    0
167 Unknown_Attribute       ------   100   100   000    -    256
172 Unknown_Attribute       -O--C-   100   100   000    -    0
173 Unknown_Attribute       -O---K   100   100   000    -    0
192 Power-Off_Retract_Count -O--C-   100   100   000    -    432
196 Reallocated_Event_Count ------   100   100   000    -    0
198 Offline_Uncorrectable   -O--C-   100   100   000    -    0
199 UDMA_CRC_Error_Count    PO-R--   100   100   050    -    0
241 Total_LBAs_Written      -O--C-   100   100   000    -    12983
242 Total_LBAs_Read         -O--C-   100   100   000    -    14005
                            ||||||_ K auto-keep
                            |||||__ C event count
                            ||||___ R error rate
                            |||____ S speed/performance
                            ||_____ O updated online
                            |______ P prefailure warning

General Purpose Log Directory Version 1
SMART           Log Directory Version 1 [multi-sector log support]
Address    Access  R/W   Size  Description
0x00       GPL,SL  R/O      1  Log Directory
0x01           SL  R/O      1  Summary SMART error log
0x02           SL  R/O     51  Comprehensive SMART error log
0x03       GPL     R/O     64  Ext. Comprehensive SMART error log
0x04       GPL,SL  R/O      8  Device Statistics log
0x06           SL  R/O      1  SMART self-test log
0x07       GPL     R/O      1  Extended self-test log
0x09           SL  R/W      1  Selective self-test log
0x10       GPL     R/O      1  NCQ Command Error log
0x11       GPL     R/O      1  SATA Phy Event Counters log
0x30       GPL,SL  R/O      9  IDENTIFY DEVICE data log
0x80-0x9f  GPL,SL  R/W     16  Host vendor specific log

SMART Extended Comprehensive Error Log Version: 1 (64 sectors)
No Errors Logged

SMART Extended Self-test Log Version: 1 (1 sectors)
Num  Test_Description    Status                  Remaining  LifeTime(hours)  LBA_of_first_error
# 1  Extended offline    Completed without error       00%     12723         -
# 2  Short offline       Completed without error       00%     12722         -
# 3  Short offline       Completed without error       00%     12668         -
# 4  Extended offline    Completed without error       00%     11809         -
# 5  Short offline       Completed without error       00%     11731         -
# 6  Extended offline    Completed without error       00%     11606         -
# 7  Short offline       Completed without error       00%     11606         -
# 8  Short offline       Interrupted (host reset)      00%      5407         -
# 9  Extended offline    Completed without error       00%      2106         -
#10  Short offline       Completed without error       00%         3         -
#11  Short offline       Interrupted (host reset)      00%         1         -

SMART Selective self-test log data structure revision number 0
Note: revision number not 1 implies that no selective self-test has ever been run
 SPAN  MIN_LBA  MAX_LBA  CURRENT_TEST_STATUS
    1        0        0  Not_testing
    2        0        0  Not_testing
    3        0        0  Not_testing
    4        0        0  Not_testing
    5        0        0  Not_testing
Selective self-test flags (0x0):
  After scanning selected spans, do NOT read-scan remainder of disk.
If Selective self-test is pending on power-up, resume after 0 minute delay.

SCT Commands not supported

Device Statistics (GP Log 0x04)
Page  Offset Size        Value Flags Description
0x01  =====  =               =  ===  == General Statistics (rev 1) ==
0x01  0x008  4             805  ---  Lifetime Power-On Resets
0x01  0x010  4           12747  ---  Power-on Hours
0x01  0x018  6     27229118446  ---  Logical Sectors Written
0x01  0x028  6     29372632934  ---  Logical Sectors Read
0x04  =====  =               =  ===  == General Errors Statistics (rev 1) ==
0x04  0x008  4               0  ---  Number of Reported Uncorrectable Errors
0x05  =====  =               =  ===  == Temperature Statistics (rev 1) ==
0x05  0x008  1              33  ---  Current Temperature
0x05  0x020  1              33  ---  Highest Temperature
0x05  0x028  1              33  ---  Lowest Temperature
0x06  =====  =               =  ===  == Transport Statistics (rev 1) ==
0x06  0x018  4               0  ---  Number of Interface CRC Errors
0x07  =====  =               =  ===  == Solid State Device Statistics (rev 1) ==
0x07  0x008  1              25  ---  Percentage Used Endurance Indicator
                                |||_ C monitored condition met
                                ||__ D supports DSN
                                |___ N normalized value

Pending Defects log (GP Log 0x0c) not supported

SATA Phy Event Counters (GP Log 0x11)
ID      Size     Value  Description
0x0001  2            0  Command failed due to ICRC error
0x0003  2            0  R_ERR response for device-to-host data FIS
0x0004  2            0  R_ERR response for host-to-device data FIS
0x0006  2            0  R_ERR response for device-to-host non-data FIS
0x0007  2            0  R_ERR response for host-to-device non-data FIS
0x0008  2            0  Device-to-host non-data FIS retries
0x0009  4           11  Transition from drive PhyRdy to drive PhyNRdy
0x000a  4           12  Device-to-host register FISes sent due to a COMRESET
0x000f  2            0  R_ERR response for host-to-device data FIS, CRC
0x0010  2            0  R_ERR response for host-to-device data FIS, non-CRC
0x0012  2            0  R_ERR response for host-to-device non-data FIS, CRC
0x0013  2            0  R_ERR response for host-to-device non-data FIS, non-CRC

