smartctl 7.2 2021-09-14 r5236 [FreeBSD 13.0-STABLE amd64] (local build)
Copyright (C) 2002-20, Bruce Allen, Christian Franke, www.smartmontools.org

=== START OF INFORMATION SECTION ===
Model Number:                       Samsung 980 PRO with Heatsink 1TB
Serial Number:                      --
Firmware Version:                   3B2QGXA7
PCI Vendor/Subsystem ID:            0x144d
IEEE OUI Identifier:                0x002538
Total NVM Capacity:                 1,000,204,886,016 [1.00 TB]
Unallocated NVM Capacity:           0
Controller ID:                      6
NVMe Version:                       1.3
Number of Namespaces:               1
Namespace 1 Size/Capacity:          1,000,204,886,016 [1.00 TB]
Namespace 1 Utilization:            102,233,333,760 [102 GB]
Namespace 1 Formatted LBA Size:     512
Namespace 1 IEEE EUI-64:            002538 ...
Local Time is:                      Fri Mar 25 11:21:15 2022 CET
Firmware Updates (0x16):            3 Slots, no Reset required
Optional Admin Commands (0x0017):   Security Format Frmw_DL Self_Test
Optional NVM Commands (0x0057):     Comp Wr_Unc DS_Mngmt Sav/Sel_Feat Timestmp
Log Page Attributes (0x0f):         S/H_per_NS Cmd_Eff_Lg Ext_Get_Lg Telmtry_Lg
Maximum Data Transfer Size:         128 Pages
Warning  Comp. Temp. Threshold:     82 Celsius
Critical Comp. Temp. Threshold:     85 Celsius

Supported Power States
St Op     Max   Active     Idle   RL RT WL WT  Ent_Lat  Ex_Lat
 0 +     8.49W       -        -    0  0  0  0        0       0
 1 +     4.48W       -        -    1  1  1  1        0     200
 2 +     3.18W       -        -    2  2  2  2        0    1000
 3 -   0.0400W       -        -    3  3  3  3     2000    1200
 4 -   0.0050W       -        -    4  4  4  4      500    9500

Supported LBA Sizes (NSID 0x1)
Id Fmt  Data  Metadt  Rel_Perf
 0 +     512       0         0

=== START OF SMART DATA SECTION ===
SMART overall-health self-assessment test result: PASSED

SMART/Health Information (NVMe Log 0x02)
Critical Warning:                   0x00
Temperature:                        43 Celsius
Available Spare:                    100%
Available Spare Threshold:          10%
Percentage Used:                    0%
Data Units Read:                    68,009 [34.8 GB]
Data Units Written:                 2,752,870 [1.40 TB]
Host Read Commands:                 1,975,560
Host Write Commands:                39,139,296
Controller Busy Time:               65
Power Cycles:                       20
Power On Hours:                     2,324
Unsafe Shutdowns:                   6
Media and Data Integrity Errors:    0
Error Information Log Entries:      0
Warning  Comp. Temperature Time:    0
Critical Comp. Temperature Time:    0
Temperature Sensor 1:               43 Celsius
Temperature Sensor 2:               46 Celsius

Error Information (NVMe Log 0x01, 16 of 64 entries)
No Errors Logged

