smartctl 7.3 2022-02-28 r5338 [FreeBSD 13.1-RELEASE-p5 amd64] (local build)
Copyright (C) 2002-22, Bruce Allen, Christian Franke, www.smartmontools.org

=== START OF INFORMATION SECTION ===
Model Family:     Western Digital Blue
Device Model:     WDC WD5000AAKX-00ERMA0
Serial Number:    --
LU WWN Device Id: 5 0014ee ...
Firmware Version: 15.01H15
User Capacity:    500,107,862,016 bytes [500 GB]
Sector Size:      512 bytes logical/physical
Device is:        In smartctl database 7.3/5319
ATA Version is:   ATA8-ACS (minor revision not indicated)
SATA Version is:  SATA 3.0, 6.0 Gb/s (current: 6.0 Gb/s)
Local Time is:    Tue Dec  6 08:16:31 2022 UTC
SMART support is: Available - device has SMART capability.
SMART support is: Enabled
AAM feature is:   Unavailable
APM feature is:   Unavailable
Rd look-ahead is: Enabled
Write cache is:   Enabled
DSN feature is:   Unavailable
ATA Security is:  Disabled, frozen [SEC2]
Wt Cache Reorder: Enabled

=== START OF READ SMART DATA SECTION ===
SMART overall-health self-assessment test result: PASSED

General SMART Values:
Offline data collection status:  (0x82)	Offline data collection activity
					was completed without error.
					Auto Offline Data Collection: Enabled.
Self-test execution status:      (   0)	The previous self-test routine completed
					without error or no self-test has ever 
					been run.
Total time to complete Offline 
data collection: 		( 8280) seconds.
Offline data collection
capabilities: 			 (0x7b) SMART execute Offline immediate.
					Auto Offline data collection on/off support.
					Suspend Offline collection upon new
					command.
					Offline surface scan supported.
					Self-test supported.
					Conveyance Self-test supported.
					Selective Self-test supported.
SMART capabilities:            (0x0003)	Saves SMART data before entering
					power-saving mode.
					Supports SMART auto save timer.
Error logging capability:        (0x01)	Error logging supported.
					General Purpose Logging supported.
Short self-test routine 
recommended polling time: 	 (   2) minutes.
Extended self-test routine
recommended polling time: 	 (  84) minutes.
Conveyance self-test routine
recommended polling time: 	 (   5) minutes.
SCT capabilities: 	       (0x3037)	SCT Status supported.
					SCT Feature Control supported.
					SCT Data Table supported.

SMART Attributes Data Structure revision number: 16
Vendor Specific SMART Attributes with Thresholds:
ID# ATTRIBUTE_NAME          FLAGS    VALUE WORST THRESH FAIL RAW_VALUE
  1 Raw_Read_Error_Rate     POSR-K   200   200   051    -    1672
  3 Spin_Up_Time            POS--K   144   144   021    -    3783
  4 Start_Stop_Count        -O--CK   089   089   000    -    11803
  5 Reallocated_Sector_Ct   PO--CK   200   200   140    -    0
  7 Seek_Error_Rate         -OSR-K   200   200   000    -    0
  9 Power_On_Hours          -O--CK   048   048   000    -    38581
 10 Spin_Retry_Count        -O--CK   100   100   000    -    0
 11 Calibration_Retry_Count -O--CK   100   100   000    -    0
 12 Power_Cycle_Count       -O--CK   096   096   000    -    4217
192 Power-Off_Retract_Count -O--CK   200   200   000    -    438
193 Load_Cycle_Count        -O--CK   197   197   000    -    11364
194 Temperature_Celsius     -O---K   102   093   000    -    41
196 Reallocated_Event_Count -O--CK   200   200   000    -    0
197 Current_Pending_Sector  -O--CK   200   200   000    -    10
198 Offline_Uncorrectable   ----CK   200   200   000    -    8
199 UDMA_CRC_Error_Count    -O--CK   200   200   000    -    0
200 Multi_Zone_Error_Rate   ---R--   200   200   000    -    8
                            ||||||_ K auto-keep
                            |||||__ C event count
                            ||||___ R error rate
                            |||____ S speed/performance
                            ||_____ O updated online
                            |______ P prefailure warning

General Purpose Log Directory Version 1
SMART           Log Directory Version 1 [multi-sector log support]
Address    Access  R/W   Size  Description
0x00       GPL,SL  R/O      1  Log Directory
0x01           SL  R/O      1  Summary SMART error log
0x02           SL  R/O      5  Comprehensive SMART error log
0x03       GPL     R/O      6  Ext. Comprehensive SMART error log
0x06           SL  R/O      1  SMART self-test log
0x07       GPL     R/O      1  Extended self-test log
0x09           SL  R/W      1  Selective self-test log
0x10       GPL     R/O      1  NCQ Command Error log
0x11       GPL     R/O      1  SATA Phy Event Counters log
0x80-0x9f  GPL,SL  R/W     16  Host vendor specific log
0xa0-0xa7  GPL,SL  VS      16  Device vendor specific log
0xa8-0xb5  GPL,SL  VS       1  Device vendor specific log
0xb6       GPL     VS       1  Device vendor specific log
0xb7       GPL,SL  VS       1  Device vendor specific log
0xbd       GPL,SL  VS       1  Device vendor specific log
0xc0       GPL,SL  VS       1  Device vendor specific log
0xc1       GPL     VS      24  Device vendor specific log
0xe0       GPL,SL  R/W      1  SCT Command/Status
0xe1       GPL,SL  R/W      1  SCT Data Transfer

SMART Extended Comprehensive Error Log Version: 1 (6 sectors)
Device Error Count: 1679 (device log contains only the most recent 24 errors)
	CR     = Command Register
	FEATR  = Features Register
	COUNT  = Count (was: Sector Count) Register
	LBA_48 = Upper bytes of LBA High/Mid/Low Registers ]  ATA-8
	LH     = LBA High (was: Cylinder High) Register    ]   LBA
	LM     = LBA Mid (was: Cylinder Low) Register      ] Register
	LL     = LBA Low (was: Sector Number) Register     ]
	DV     = Device (was: Device/Head) Register
	DC     = Device Control Register
	ER     = Error register
	ST     = Status register
Powered_Up_Time is measured from power on, and printed as
DDd+hh:mm:SS.sss where DD=days, hh=hours, mm=minutes,
SS=sec, and sss=millisec. It "wraps" after 49.710 days.

Error 1679 [22] occurred at disk power-on lifetime: 36983 hours (1540 days + 23 hours)
  When the command that caused the error occurred, the device was active or idle.

  After command completion occurred, registers were:
  ER -- ST COUNT  LBA_48  LH LM LL DV DC
  -- -- -- == -- == == == -- -- -- -- --
  40 -- 51 00 00 00 00 21 ee 9e 88 40 00  Error: WP at LBA = 0x21ee9e88 = 569286280

  Commands leading to the command that caused the error were:
  CR FEATR COUNT  LBA_48  LH LM LL DV DC  Powered_Up_Time  Command/Feature_Name
  -- == -- == -- == == == -- -- -- -- --  ---------------  --------------------
  61 00 08 00 78 00 00 00 5b 94 08 40 00     01:01:27.917  WRITE FPDMA QUEUED
  60 00 08 00 70 00 00 21 ee 9e 88 40 00     01:01:27.917  READ FPDMA QUEUED
  61 00 48 00 68 00 00 00 5b cc 78 40 00     01:01:27.916  WRITE FPDMA QUEUED
  61 01 00 00 60 00 00 00 5b cb 78 40 00     01:01:27.916  WRITE FPDMA QUEUED
  61 01 00 00 58 00 00 00 5b ca 78 40 00     01:01:27.915  WRITE FPDMA QUEUED

Error 1678 [21] occurred at disk power-on lifetime: 36983 hours (1540 days + 23 hours)
  When the command that caused the error occurred, the device was active or idle.

  After command completion occurred, registers were:
  ER -- ST COUNT  LBA_48  LH LM LL DV DC
  -- -- -- == -- == == == -- -- -- -- --
  40 -- 51 00 00 00 00 21 ee 9e 88 40 00  Error: UNC at LBA = 0x21ee9e88 = 569286280

  Commands leading to the command that caused the error were:
  CR FEATR COUNT  LBA_48  LH LM LL DV DC  Powered_Up_Time  Command/Feature_Name
  -- == -- == -- == == == -- -- -- -- --  ---------------  --------------------
  60 00 08 00 20 00 00 21 ee 9e 88 40 00     01:01:26.023  READ FPDMA QUEUED
  60 00 08 00 18 00 00 00 62 84 20 40 00     01:01:26.023  READ FPDMA QUEUED
  60 00 08 00 10 00 00 07 b3 58 20 40 00     01:01:26.007  READ FPDMA QUEUED
  60 00 08 00 08 00 00 00 01 d3 f0 40 00     01:01:25.988  READ FPDMA QUEUED
  60 00 08 00 f8 00 00 00 62 84 18 40 00     01:01:25.974  READ FPDMA QUEUED

Error 1677 [20] occurred at disk power-on lifetime: 36982 hours (1540 days + 22 hours)
  When the command that caused the error occurred, the device was active or idle.

  After command completion occurred, registers were:
  ER -- ST COUNT  LBA_48  LH LM LL DV DC
  -- -- -- == -- == == == -- -- -- -- --
  40 -- 51 00 00 00 00 21 ed 90 a8 40 00  Error: WP at LBA = 0x21ed90a8 = 569217192

  Commands leading to the command that caused the error were:
  CR FEATR COUNT  LBA_48  LH LM LL DV DC  Powered_Up_Time  Command/Feature_Name
  -- == -- == -- == == == -- -- -- -- --  ---------------  --------------------
  61 00 08 00 70 00 00 00 5b 93 80 40 00     00:03:41.329  WRITE FPDMA QUEUED
  60 00 08 00 68 00 00 21 ed 90 a8 40 00     00:03:41.329  READ FPDMA QUEUED
  ea 00 00 00 00 00 00 00 00 00 00 e0 00     00:03:41.299  FLUSH CACHE EXT
  61 00 08 00 58 00 00 00 5b 93 88 40 00     00:03:41.299  WRITE FPDMA QUEUED
  61 00 10 00 50 00 00 00 5b 96 10 40 00     00:03:41.299  WRITE FPDMA QUEUED

Error 1676 [19] occurred at disk power-on lifetime: 36982 hours (1540 days + 22 hours)
  When the command that caused the error occurred, the device was active or idle.

  After command completion occurred, registers were:
  ER -- ST COUNT  LBA_48  LH LM LL DV DC
  -- -- -- == -- == == == -- -- -- -- --
  40 -- 51 00 00 00 00 21 ed 90 a8 40 00  Error: UNC at LBA = 0x21ed90a8 = 569217192

  Commands leading to the command that caused the error were:
  CR FEATR COUNT  LBA_48  LH LM LL DV DC  Powered_Up_Time  Command/Feature_Name
  -- == -- == -- == == == -- -- -- -- --  ---------------  --------------------
  60 00 08 00 48 00 00 21 ed 90 a8 40 00     00:03:39.406  READ FPDMA QUEUED
  60 00 40 00 40 00 00 00 97 69 68 40 00     00:03:39.053  READ FPDMA QUEUED
  60 00 3b 00 38 00 00 00 97 71 80 40 00     00:03:39.053  READ FPDMA QUEUED
  60 00 40 00 30 00 00 00 97 6f f0 40 00     00:03:38.875  READ FPDMA QUEUED
  60 00 08 00 28 00 00 00 97 6f e8 40 00     00:03:38.870  READ FPDMA QUEUED

Error 1675 [18] occurred at disk power-on lifetime: 34340 hours (1430 days + 20 hours)
  When the command that caused the error occurred, the device was active or idle.

  After command completion occurred, registers were:
  ER -- ST COUNT  LBA_48  LH LM LL DV DC
  -- -- -- == -- == == == -- -- -- -- --
  40 -- 51 00 00 00 00 09 7e 1e 18 40 00  Error: UNC at LBA = 0x097e1e18 = 159260184

  Commands leading to the command that caused the error were:
  CR FEATR COUNT  LBA_48  LH LM LL DV DC  Powered_Up_Time  Command/Feature_Name
  -- == -- == -- == == == -- -- -- -- --  ---------------  --------------------
  60 00 01 00 d8 00 00 09 7e 1e 18 40 00     05:40:34.804  READ FPDMA QUEUED
  2f 00 00 00 01 00 00 00 00 00 10 e0 00     05:40:34.499  READ LOG EXT
  60 00 01 00 d0 00 00 09 7e 1e 18 40 00     05:40:32.621  READ FPDMA QUEUED
  ec 00 00 00 00 00 00 00 00 00 00 a0 00     05:40:32.319  IDENTIFY DEVICE
  2f 00 00 00 01 00 00 00 00 00 10 e0 00     05:40:32.318  READ LOG EXT

Error 1674 [17] occurred at disk power-on lifetime: 34340 hours (1430 days + 20 hours)
  When the command that caused the error occurred, the device was active or idle.

  After command completion occurred, registers were:
  ER -- ST COUNT  LBA_48  LH LM LL DV DC
  -- -- -- == -- == == == -- -- -- -- --
  40 -- 51 00 00 00 00 09 7e 1e 18 40 00  Error: UNC at LBA = 0x097e1e18 = 159260184

  Commands leading to the command that caused the error were:
  CR FEATR COUNT  LBA_48  LH LM LL DV DC  Powered_Up_Time  Command/Feature_Name
  -- == -- == -- == == == -- -- -- -- --  ---------------  --------------------
  60 00 01 00 d0 00 00 09 7e 1e 18 40 00     05:40:32.621  READ FPDMA QUEUED
  ec 00 00 00 00 00 00 00 00 00 00 a0 00     05:40:32.319  IDENTIFY DEVICE
  2f 00 00 00 01 00 00 00 00 00 10 e0 00     05:40:32.318  READ LOG EXT
  60 00 01 00 c0 00 00 09 7e 1e 18 40 00     05:40:30.449  READ FPDMA QUEUED
  60 00 01 00 b8 00 00 09 7e 1e 17 40 00     05:40:30.449  READ FPDMA QUEUED

Error 1673 [16] occurred at disk power-on lifetime: 34340 hours (1430 days + 20 hours)
  When the command that caused the error occurred, the device was active or idle.

  After command completion occurred, registers were:
  ER -- ST COUNT  LBA_48  LH LM LL DV DC
  -- -- -- == -- == == == -- -- -- -- --
  40 -- 51 00 00 00 00 09 7e 1e 18 40 00  Error: UNC at LBA = 0x097e1e18 = 159260184

  Commands leading to the command that caused the error were:
  CR FEATR COUNT  LBA_48  LH LM LL DV DC  Powered_Up_Time  Command/Feature_Name
  -- == -- == -- == == == -- -- -- -- --  ---------------  --------------------
  60 00 01 00 c0 00 00 09 7e 1e 18 40 00     05:40:30.449  READ FPDMA QUEUED
  60 00 01 00 b8 00 00 09 7e 1e 17 40 00     05:40:30.449  READ FPDMA QUEUED
  60 00 01 00 b0 00 00 09 7e 1e 16 40 00     05:40:30.449  READ FPDMA QUEUED
  60 00 01 00 a8 00 00 09 7e 1e 15 40 00     05:40:30.449  READ FPDMA QUEUED
  60 00 01 00 a0 00 00 09 7e 1e 14 40 00     05:40:30.449  READ FPDMA QUEUED

Error 1672 [15] occurred at disk power-on lifetime: 34340 hours (1430 days + 20 hours)
  When the command that caused the error occurred, the device was active or idle.

  After command completion occurred, registers were:
  ER -- ST COUNT  LBA_48  LH LM LL DV DC
  -- -- -- == -- == == == -- -- -- -- --
  40 -- 51 00 00 00 00 09 7e 1e 18 40 00  Error: UNC at LBA = 0x097e1e18 = 159260184

  Commands leading to the command that caused the error were:
  CR FEATR COUNT  LBA_48  LH LM LL DV DC  Powered_Up_Time  Command/Feature_Name
  -- == -- == -- == == == -- -- -- -- --  ---------------  --------------------
  60 00 e8 00 70 00 00 09 7e 1e 08 40 00     05:40:28.160  READ FPDMA QUEUED
  60 01 00 00 68 00 00 09 7e 1d 08 40 00     05:40:28.159  READ FPDMA QUEUED
  60 01 00 00 60 00 00 09 7e 1c 08 40 00     05:40:28.159  READ FPDMA QUEUED
  60 01 00 00 58 00 00 09 7e 1b 08 40 00     05:40:28.159  READ FPDMA QUEUED
  60 00 e8 00 50 00 00 09 7e 1a 20 40 00     05:40:28.156  READ FPDMA QUEUED

SMART Extended Self-test Log Version: 1 (1 sectors)
Num  Test_Description    Status                  Remaining  LifeTime(hours)  LBA_of_first_error
# 1  Short offline       Aborted by host               10%     33691         -
# 2  Short offline       Completed: read failure       90%     33690         569208200

SMART Selective self-test log data structure revision number 1
 SPAN  MIN_LBA  MAX_LBA  CURRENT_TEST_STATUS
    1        0        0  Not_testing
    2        0        0  Not_testing
    3        0        0  Not_testing
    4        0        0  Not_testing
    5        0        0  Not_testing
Selective self-test flags (0x0):
  After scanning selected spans, do NOT read-scan remainder of disk.
If Selective self-test is pending on power-up, resume after 0 minute delay.

SCT Status Version:                  3
SCT Version (vendor specific):       258 (0x0102)
Device State:                        Active (0)
Current Temperature:                    41 Celsius
Power Cycle Min/Max Temperature:     37/43 Celsius
Lifetime    Min/Max Temperature:      0/50 Celsius
Under/Over Temperature Limit Count:   0/0

SCT Temperature History Version:     2
Temperature Sampling Period:         1 minute
Temperature Logging Interval:        1 minute
Min/Max recommended Temperature:      0/60 Celsius
Min/Max Temperature Limit:           -41/85 Celsius
Temperature History Size (Index):    478 (443)

SCT Error Recovery Control command not supported

Device Statistics (GP/SMART Log 0x04) not supported

Pending Defects log (GP Log 0x0c) not supported

SATA Phy Event Counters (GP Log 0x11)
ID      Size     Value  Description
0x0001  2            0  Command failed due to ICRC error
0x0002  2            0  R_ERR response for data FIS
0x0003  2            0  R_ERR response for device-to-host data FIS
0x0004  2            0  R_ERR response for host-to-device data FIS
0x0005  2            0  R_ERR response for non-data FIS
0x0006  2            0  R_ERR response for device-to-host non-data FIS
0x0007  2            0  R_ERR response for host-to-device non-data FIS
0x000a  2           10  Device-to-host register FISes sent due to a COMRESET
0x000b  2            0  CRC errors within host-to-device FIS
0x8000  4       281463  Vendor specific

