smartctl 7.3 2022-02-28 r5338 [FreeBSD 13.1-RELEASE amd64] (local build)
Copyright (C) 2002-22, Bruce Allen, Christian Franke, www.smartmontools.org

=== START OF INFORMATION SECTION ===
Model Family:     Crucial/Micron Client SSDs
Device Model:     CT120BX500SSD1
Serial Number:    --
LU WWN Device Id: 0 000000 ...
Firmware Version: M6CR013
User Capacity:    120,034,123,776 bytes [120 GB]
Sector Size:      512 bytes logical/physical
Rotation Rate:    Solid State Device
Form Factor:      2.5 inches
TRIM Command:     Available, deterministic, zeroed
Device is:        In smartctl database 7.3/5319
ATA Version is:   ACS-2 T13/2015-D revision 3
SATA Version is:  SATA 3.2, 6.0 Gb/s (current: 6.0 Gb/s)
Local Time is:    Sun Jan 29 18:43:21 2023 UTC
SMART support is: Available - device has SMART capability.
SMART support is: Enabled
AAM feature is:   Unavailable
APM level is:     254 (maximum performance)
Rd look-ahead is: Enabled
Write cache is:   Enabled
DSN feature is:   Unavailable
ATA Security is:  Disabled, NOT FROZEN [SEC1]
Wt Cache Reorder: Unavailable

=== START OF READ SMART DATA SECTION ===
SMART Status not supported: Incomplete response, ATA output registers missing
SMART overall-health self-assessment test result: PASSED
Warning: This result is based on an Attribute check.
See vendor-specific Attribute list for marginal Attributes.

General SMART Values:
Offline data collection status:  (0x00)	Offline data collection activity
					was never started.
					Auto Offline Data Collection: Disabled.
Self-test execution status:      (   0)	The previous self-test routine completed
					without error or no self-test has ever 
					been run.
Total time to complete Offline 
data collection: 		(  120) seconds.
Offline data collection
capabilities: 			 (0x11) SMART execute Offline immediate.
					No Auto Offline data collection support.
					Suspend Offline collection upon new
					command.
					No Offline surface scan supported.
					Self-test supported.
					No Conveyance Self-test supported.
					No Selective Self-test supported.
SMART capabilities:            (0x0002)	Does not save SMART data before
					entering power-saving mode.
					Supports SMART auto save timer.
Error logging capability:        (0x01)	Error logging supported.
					General Purpose Logging supported.
Short self-test routine 
recommended polling time: 	 (   2) minutes.
Extended self-test routine
recommended polling time: 	 (  10) minutes.

SMART Attributes Data Structure revision number: 1
Vendor Specific SMART Attributes with Thresholds:
ID# ATTRIBUTE_NAME          FLAGS    VALUE WORST THRESH FAIL RAW_VALUE
  1 Raw_Read_Error_Rate     POSR-K   100   100   050    -    0
  5 Reallocate_NAND_Blk_Cnt -O--CK   100   100   010    -    0
  9 Power_On_Hours          -O--CK   100   100   050    -    1218
 12 Power_Cycle_Count       -O--CK   100   100   050    -    1399
171 Program_Fail_Count      -O--CK   100   100   050    -    0
172 Erase_Fail_Count        -O--CK   100   100   050    -    0
173 Ave_Block-Erase_Count   -O--CK   100   100   050    -    24
174 Unexpect_Power_Loss_Ct  -O--CK   100   100   050    -    845
180 Unused_Reserve_NAND_Blk -O--CK   100   100   050    -    100
183 SATA_Interfac_Downshift -O--CK   100   100   050    -    18
184 Error_Correction_Count  -O--CK   100   100   050    -    0
187 Reported_Uncorrect      -O--CK   100   100   050    -    0
194 Temperature_Celsius     -O---K   063   033   050    Past 37 (Min/Max 28/67)
196 Reallocated_Event_Count -O--CK   100   100   050    -    0
197 Current_Pending_ECC_Cnt -O--CK   100   100   050    -    0
198 Offline_Uncorrectable   ----CK   100   100   050    -    0
199 UDMA_CRC_Error_Count    -O--CK   100   100   050    -    955
202 Percent_Lifetime_Remain ----CK   099   099   001    -    99
206 Write_Error_Rate        -OSR-K   100   100   050    -    0
210 Success_RAIN_Recov_Cnt  -O--CK   100   100   050    -    0
246 Total_LBAs_Written      -O--CK   100   100   050    -    1968617832
247 Host_Program_Page_Count -O--CK   100   100   050    -    61519307
248 FTL_Program_Page_Count  -O--CK   100   100   050    -    23012320
                            ||||||_ K auto-keep
                            |||||__ C event count
                            ||||___ R error rate
                            |||____ S speed/performance
                            ||_____ O updated online
                            |______ P prefailure warning

General Purpose Log Directory Version 1
SMART           Log Directory Version 1 [multi-sector log support]
Address    Access  R/W   Size  Description
0x00       GPL,SL  R/O      1  Log Directory
0x01           SL  R/O      1  Summary SMART error log
0x02           SL  R/O      1  Comprehensive SMART error log
0x03       GPL     R/O      1  Ext. Comprehensive SMART error log
0x04       GPL,SL  R/O      8  Device Statistics log
0x06           SL  R/O      1  SMART self-test log
0x07       GPL     R/O      1  Extended self-test log
0x10       GPL     R/O      1  NCQ Command Error log
0x11       GPL     R/O      1  SATA Phy Event Counters log
0x24       GPL     R/O     88  Current Device Internal Status Data log
0x25       GPL     R/O     32  Saved Device Internal Status Data log
0x30       GPL,SL  R/O      9  IDENTIFY DEVICE data log
0x80-0x9f  GPL,SL  R/W     16  Host vendor specific log

SMART Extended Comprehensive Error Log Version: 1 (1 sectors)
Device Error Count: 1947 (device log contains only the most recent 4 errors)
	CR     = Command Register
	FEATR  = Features Register
	COUNT  = Count (was: Sector Count) Register
	LBA_48 = Upper bytes of LBA High/Mid/Low Registers ]  ATA-8
	LH     = LBA High (was: Cylinder High) Register    ]   LBA
	LM     = LBA Mid (was: Cylinder Low) Register      ] Register
	LL     = LBA Low (was: Sector Number) Register     ]
	DV     = Device (was: Device/Head) Register
	DC     = Device Control Register
	ER     = Error register
	ST     = Status register
Powered_Up_Time is measured from power on, and printed as
DDd+hh:mm:SS.sss where DD=days, hh=hours, mm=minutes,
SS=sec, and sss=millisec. It "wraps" after 49.710 days.

Error 1947 [2] occurred at disk power-on lifetime: 0 hours (0 days + 0 hours)
  When the command that caused the error occurred, the device was active or idle.

  After command completion occurred, registers were:
  ER -- ST COUNT  LBA_48  LH LM LL DV DC
  -- -- -- == -- == == == -- -- -- -- --
  00 -- 00 00 00 00 00 00 00 00 00 00 00

  Commands leading to the command that caused the error were:
  CR FEATR COUNT  LBA_48  LH LM LL DV DC  Powered_Up_Time  Command/Feature_Name
  -- == -- == -- == == == -- -- -- -- --  ---------------  --------------------
  ec 00 00 01 01 00 00 00 00 00 00 00 08     00:00:00.000  IDENTIFY DEVICE
  b0 00 d0 01 01 00 00 4f 00 c2 00 00 08     00:00:00.000  SMART READ DATA
  60 00 20 60 60 00 00 a3 00 2c 12 40 08     00:00:00.000  READ FPDMA QUEUED
  60 00 08 b0 b0 00 00 9f 00 5c 62 40 08     00:00:00.000  READ FPDMA QUEUED
  ec 00 00 01 01 00 00 00 00 00 00 00 08     00:00:00.000  IDENTIFY DEVICE

Error 1946 [1] log entry is empty
Error 1945 [0] occurred at disk power-on lifetime: 0 hours (0 days + 0 hours)
  When the command that caused the error occurred, the device was active or idle.

  After command completion occurred, registers were:
  ER -- ST COUNT  LBA_48  LH LM LL DV DC
  -- -- -- == -- == == == -- -- -- -- --
  00 -- 00 00 00 00 00 00 00 00 00 00 00   at LBA = 0x00000000 = 0

  Commands leading to the command that caused the error were:
  CR FEATR COUNT  LBA_48  LH LM LL DV DC  Powered_Up_Time  Command/Feature_Name
  -- == -- == -- == == == -- -- -- -- --  ---------------  --------------------
  25 00 00 08 08 00 00 01 00 00 d8 40 00     00:00:00.000  READ DMA EXT
  25 00 00 08 08 00 00 01 00 00 f8 40 00     00:00:00.000  READ DMA EXT
  25 00 00 08 08 00 00 01 00 00 f0 40 00     00:00:00.000  READ DMA EXT
  25 00 00 08 08 00 00 01 00 00 e8 40 00     00:00:00.000  READ DMA EXT
  25 00 00 08 08 00 00 01 00 00 e0 40 00     00:00:00.000  READ DMA EXT

Error 1944 [3] occurred at disk power-on lifetime: 0 hours (0 days + 0 hours)
  When the command that caused the error occurred, the device was active or idle.

  After command completion occurred, registers were:
  ER -- ST COUNT  LBA_48  LH LM LL DV DC
  -- -- -- == -- == == == -- -- -- -- --
  00 -- 00 00 00 00 00 00 00 00 00 00 00   at LBA = 0x00000000 = 0

  Commands leading to the command that caused the error were:
  CR FEATR COUNT  LBA_48  LH LM LL DV DC  Powered_Up_Time  Command/Feature_Name
  -- == -- == -- == == == -- -- -- -- --  ---------------  --------------------
  25 00 00 08 08 00 00 01 00 00 d8 40 00     00:00:00.000  READ DMA EXT
  25 00 00 08 08 00 00 01 00 00 f8 40 00     00:00:00.000  READ DMA EXT
  25 00 00 08 08 00 00 01 00 00 f0 40 00     00:00:00.000  READ DMA EXT
  25 00 00 08 08 00 00 01 00 00 e8 40 00     00:00:00.000  READ DMA EXT
  25 00 00 08 08 00 00 01 00 00 e0 40 00     00:00:00.000  READ DMA EXT

SMART Extended Self-test Log Version: 1 (1 sectors)
No self-tests have been logged.  [To run self-tests, use: smartctl -t]

Selective Self-tests/Logging not supported

SCT Commands not supported

Device Statistics (GP Log 0x04)
Page  Offset Size        Value Flags Description
0x01  =====  =               =  ===  == General Statistics (rev 1) ==
0x01  0x008  4            1399  ---  Lifetime Power-On Resets
0x01  0x010  4            1218  ---  Power-on Hours
0x01  0x018  6      1968617832  ---  Logical Sectors Written
0x01  0x020  6        16567611  ---  Number of Write Commands
0x01  0x028  6      2171723253  ---  Logical Sectors Read
0x01  0x030  6        32086450  ---  Number of Read Commands
0x07  =====  =               =  ===  == Solid State Device Statistics (rev 1) ==
0x07  0x008  1               1  ---  Percentage Used Endurance Indicator
                                |||_ C monitored condition met
                                ||__ D supports DSN
                                |___ N normalized value

Pending Defects log (GP Log 0x0c) not supported

SATA Phy Event Counters (GP Log 0x11)
ID      Size     Value  Description
0x0001  4            0  Command failed due to ICRC error
0x0002  4            0  R_ERR response for data FIS
0x0005  4            0  R_ERR response for non-data FIS
0x000a  4           17  Device-to-host register FISes sent due to a COMRESET

