smartctl 7.3 2022-02-28 r5338 [FreeBSD 13.0-STABLE amd64] (local build)
Copyright (C) 2002-22, Bruce Allen, Christian Franke, www.smartmontools.org

=== START OF INFORMATION SECTION ===
Device Model:     SB2
Serial Number:    --
LU WWN Device Id: 0 000000 ...
Firmware Version: SBFM61.2
User Capacity:    128,035,676,160 bytes [128 GB]
Sector Size:      512 bytes logical/physical
Rotation Rate:    Solid State Device
Form Factor:      M.2
TRIM Command:     Available
Device is:        Not in smartctl database 7.3/5319
ATA Version is:   ACS-4 (minor revision not indicated)
SATA Version is:  SATA 3.2, 6.0 Gb/s (current: 6.0 Gb/s)
Local Time is:    Wed May 18 23:37:41 2022 CDT
SMART support is: Available - device has SMART capability.
SMART support is: Enabled
AAM feature is:   Unavailable
APM feature is:   Unavailable
Rd look-ahead is: Enabled
Write cache is:   Enabled
DSN feature is:   Unavailable
ATA Security is:  Disabled, NOT FROZEN [SEC1]
Wt Cache Reorder: Unavailable

=== START OF READ SMART DATA SECTION ===
SMART overall-health self-assessment test result: PASSED

General SMART Values:
Offline data collection status:  (0x00)	Offline data collection activity
					was never started.
					Auto Offline Data Collection: Disabled.
Self-test execution status:      (  16)	The self-test routine was aborted by
					the host.
Total time to complete Offline 
data collection: 		(65535) seconds.
Offline data collection
capabilities: 			 (0x79) SMART execute Offline immediate.
					No Auto Offline data collection support.
					Suspend Offline collection upon new
					command.
					Offline surface scan supported.
					Self-test supported.
					Conveyance Self-test supported.
					Selective Self-test supported.
SMART capabilities:            (0x0003)	Saves SMART data before entering
					power-saving mode.
					Supports SMART auto save timer.
Error logging capability:        (0x01)	Error logging supported.
					General Purpose Logging supported.
Short self-test routine 
recommended polling time: 	 (   2) minutes.
Extended self-test routine
recommended polling time: 	 (  30) minutes.
Conveyance self-test routine
recommended polling time: 	 (   6) minutes.

SMART Attributes Data Structure revision number: 16
Vendor Specific SMART Attributes with Thresholds:
ID# ATTRIBUTE_NAME          FLAGS    VALUE WORST THRESH FAIL RAW_VALUE
  1 Raw_Read_Error_Rate     PO-R--   100   100   050    -    25
  9 Power_On_Hours          -O--C-   100   100   000    -    28091
 12 Power_Cycle_Count       -O--C-   100   100   000    -    203
168 Unknown_Attribute       -O--C-   100   100   000    -    0
170 Unknown_Attribute       PO----   082   082   010    -    8589934707
173 Unknown_Attribute       -O--C-   100   100   000    -    7798930
192 Power-Off_Retract_Count -O--C-   100   100   000    -    143
194 Temperature_Celsius     PO---K   067   067   000    -    33 (Min/Max 33/33)
218 Unknown_Attribute       PO-R--   100   100   050    -    0
231 Unknown_SSD_Attribute   PO--C-   100   100   000    -    96
241 Total_LBAs_Written      -O--C-   100   100   000    -    16906
                            ||||||_ K auto-keep
                            |||||__ C event count
                            ||||___ R error rate
                            |||____ S speed/performance
                            ||_____ O updated online
                            |______ P prefailure warning

General Purpose Log Directory Version 1
SMART           Log Directory Version 1 [multi-sector log support]
Address    Access  R/W   Size  Description
0x00       GPL,SL  R/O      1  Log Directory
0x01           SL  R/O      1  Summary SMART error log
0x02           SL  R/O     51  Comprehensive SMART error log
0x03       GPL     R/O     64  Ext. Comprehensive SMART error log
0x04       GPL,SL  R/O      8  Device Statistics log
0x06           SL  R/O      1  SMART self-test log
0x07       GPL     R/O      1  Extended self-test log
0x09           SL  R/W      1  Selective self-test log
0x10       GPL     R/O      1  NCQ Command Error log
0x11       GPL     R/O      1  SATA Phy Event Counters log
0x30       GPL,SL  R/O      9  IDENTIFY DEVICE data log
0x80-0x9f  GPL,SL  R/W     16  Host vendor specific log

SMART Extended Comprehensive Error Log Version: 1 (64 sectors)
Device Error Count: 25
	CR     = Command Register
	FEATR  = Features Register
	COUNT  = Count (was: Sector Count) Register
	LBA_48 = Upper bytes of LBA High/Mid/Low Registers ]  ATA-8
	LH     = LBA High (was: Cylinder High) Register    ]   LBA
	LM     = LBA Mid (was: Cylinder Low) Register      ] Register
	LL     = LBA Low (was: Sector Number) Register     ]
	DV     = Device (was: Device/Head) Register
	DC     = Device Control Register
	ER     = Error register
	ST     = Status register
Powered_Up_Time is measured from power on, and printed as
DDd+hh:mm:SS.sss where DD=days, hh=hours, mm=minutes,
SS=sec, and sss=millisec. It "wraps" after 49.710 days.

Error 25 [24] occurred at disk power-on lifetime: 4 hours (0 days + 4 hours)
  When the command that caused the error occurred, the device was active or idle.

  After command completion occurred, registers were:
  ER -- ST COUNT  LBA_48  LH LM LL DV DC
  -- -- -- == -- == == == -- -- -- -- --
  40 -- 51 00 f0 00 00 00 02 79 b0 40 02  Error: UNC 240 sectors at LBA = 0x000279b0 = 162224

  Commands leading to the command that caused the error were:
  CR FEATR COUNT  LBA_48  LH LM LL DV DC  Powered_Up_Time  Command/Feature_Name
  -- == -- == -- == == == -- -- -- -- --  ---------------  --------------------
  25 00 00 00 f0 00 00 00 02 79 b0 40 02     00:00:00.000  READ DMA EXT
  25 00 00 00 80 00 00 0a 19 d6 30 40 02     00:00:00.000  READ DMA EXT
  25 00 00 00 10 00 00 00 02 9d 58 40 02     00:00:00.000  READ DMA EXT
  25 00 00 00 f0 00 00 00 02 9c 68 40 02     00:00:00.000  READ DMA EXT
  25 00 00 00 10 00 00 00 02 87 98 40 02     00:00:00.000  READ DMA EXT

Error 24 [23] occurred at disk power-on lifetime: 4 hours (0 days + 4 hours)
  When the command that caused the error occurred, the device was active or idle.

  After command completion occurred, registers were:
  ER -- ST COUNT  LBA_48  LH LM LL DV DC
  -- -- -- == -- == == == -- -- -- -- --
  40 -- 51 00 f0 00 00 00 02 6a a8 40 02  Error: UNC 240 sectors at LBA = 0x00026aa8 = 158376

  Commands leading to the command that caused the error were:
  CR FEATR COUNT  LBA_48  LH LM LL DV DC  Powered_Up_Time  Command/Feature_Name
  -- == -- == -- == == == -- -- -- -- --  ---------------  --------------------
  25 00 00 00 f0 00 00 00 02 6a a8 40 02     00:00:00.000  READ DMA EXT
  25 00 00 00 10 00 00 00 02 89 28 40 02     00:00:00.000  READ DMA EXT
  25 00 00 00 f0 00 00 00 02 88 38 40 02     00:00:00.000  READ DMA EXT
  25 00 00 00 10 00 00 00 02 84 d0 40 02     00:00:00.000  READ DMA EXT
  25 00 00 00 f0 00 00 00 02 83 e0 40 02     00:00:00.000  READ DMA EXT

Error 23 [22] occurred at disk power-on lifetime: 0 hours (0 days + 0 hours)
  When the command that caused the error occurred, the device was active or idle.

  After command completion occurred, registers were:
  ER -- ST COUNT  LBA_48  LH LM LL DV DC
  -- -- -- == -- == == == -- -- -- -- --
  40 -- 51 00 18 00 00 00 02 69 88 40 02  Error: UNC 24 sectors at LBA = 0x00026988 = 158088

  Commands leading to the command that caused the error were:
  CR FEATR COUNT  LBA_48  LH LM LL DV DC  Powered_Up_Time  Command/Feature_Name
  -- == -- == -- == == == -- -- -- -- --  ---------------  --------------------
  25 00 00 00 18 00 00 00 02 69 88 40 02     00:00:00.000  READ DMA EXT
  35 00 00 00 f0 00 00 00 0b 20 00 40 02     00:00:00.000  WRITE DMA EXT
  25 00 00 00 10 00 00 09 f7 fb c0 40 02     00:00:00.000  READ DMA EXT
  25 00 00 00 08 00 00 0b 01 0c 08 40 02     00:00:00.000  READ DMA EXT
  25 00 00 00 20 00 00 0e 84 29 18 40 02     00:00:00.000  READ DMA EXT

Error 22 [21] occurred at disk power-on lifetime: 0 hours (0 days + 0 hours)
  When the command that caused the error occurred, the device was active or idle.

  After command completion occurred, registers were:
  ER -- ST COUNT  LBA_48  LH LM LL DV DC
  -- -- -- == -- == == == -- -- -- -- --
  40 -- 51 00 10 00 00 00 02 81 18 40 02  Error: UNC 16 sectors at LBA = 0x00028118 = 164120

  Commands leading to the command that caused the error were:
  CR FEATR COUNT  LBA_48  LH LM LL DV DC  Powered_Up_Time  Command/Feature_Name
  -- == -- == -- == == == -- -- -- -- --  ---------------  --------------------
  25 00 00 00 10 00 00 00 02 81 18 40 02     00:00:00.000  READ DMA EXT
  ef 00 02 00 00 00 00 00 00 00 00 00 02     00:00:00.000  SET FEATURES [Enable write cache]
  ef 00 03 00 46 00 00 00 00 00 00 00 02     00:00:00.000  SET FEATURES [Set transfer mode]
  ec 00 00 00 00 00 00 00 00 00 00 a0 02     00:00:00.000  IDENTIFY DEVICE
  ff 00 d5 00 01 00 00 00 00 00 01 00 04     00:00:00.000  [VENDOR SPECIFIC]

Error 21 [20] occurred at disk power-on lifetime: 0 hours (0 days + 0 hours)
  When the command that caused the error occurred, the device was active or idle.

  After command completion occurred, registers were:
  ER -- ST COUNT  LBA_48  LH LM LL DV DC
  -- -- -- == -- == == == -- -- -- -- --
  40 -- 51 00 f0 00 00 00 02 80 28 40 02  Error: UNC 240 sectors at LBA = 0x00028028 = 163880

  Commands leading to the command that caused the error were:
  CR FEATR COUNT  LBA_48  LH LM LL DV DC  Powered_Up_Time  Command/Feature_Name
  -- == -- == -- == == == -- -- -- -- --  ---------------  --------------------
  25 00 00 00 f0 00 00 00 02 80 28 40 02     00:00:00.000  READ DMA EXT
  25 00 00 00 10 00 00 00 02 8a 50 40 02     00:00:00.000  READ DMA EXT
  25 00 00 00 f0 00 00 00 02 89 60 40 02     00:00:00.000  READ DMA EXT
  25 00 00 00 08 00 00 00 02 7a 30 40 02     00:00:00.000  READ DMA EXT
  25 00 00 00 10 00 00 00 02 7a a0 40 02     00:00:00.000  READ DMA EXT

Error 20 [19] occurred at disk power-on lifetime: 0 hours (0 days + 0 hours)
  When the command that caused the error occurred, the device was active or idle.

  After command completion occurred, registers were:
  ER -- ST COUNT  LBA_48  LH LM LL DV DC
  -- -- -- == -- == == == -- -- -- -- --
  40 -- 51 00 f0 00 00 00 02 79 b0 40 02  Error: UNC 240 sectors at LBA = 0x000279b0 = 162224

  Commands leading to the command that caused the error were:
  CR FEATR COUNT  LBA_48  LH LM LL DV DC  Powered_Up_Time  Command/Feature_Name
  -- == -- == -- == == == -- -- -- -- --  ---------------  --------------------
  25 00 00 00 f0 00 00 00 02 79 b0 40 02     00:00:00.000  READ DMA EXT
  25 00 00 00 80 00 00 0a 19 d6 30 40 02     00:00:00.000  READ DMA EXT
  25 00 00 00 10 00 00 00 02 9d 58 40 02     00:00:00.000  READ DMA EXT
  25 00 00 00 f0 00 00 00 02 9c 68 40 02     00:00:00.000  READ DMA EXT
  25 00 00 00 10 00 00 00 02 87 98 40 02     00:00:00.000  READ DMA EXT

Error 19 [18] occurred at disk power-on lifetime: 0 hours (0 days + 0 hours)
  When the command that caused the error occurred, the device was active or idle.

  After command completion occurred, registers were:
  ER -- ST COUNT  LBA_48  LH LM LL DV DC
  -- -- -- == -- == == == -- -- -- -- --
  40 -- 51 00 f0 00 00 00 02 6a a8 40 02  Error: UNC 240 sectors at LBA = 0x00026aa8 = 158376

  Commands leading to the command that caused the error were:
  CR FEATR COUNT  LBA_48  LH LM LL DV DC  Powered_Up_Time  Command/Feature_Name
  -- == -- == -- == == == -- -- -- -- --  ---------------  --------------------
  25 00 00 00 f0 00 00 00 02 6a a8 40 02     00:00:00.000  READ DMA EXT
  25 00 00 00 10 00 00 00 02 89 28 40 02     00:00:00.000  READ DMA EXT
  25 00 00 00 f0 00 00 00 02 88 38 40 02     00:00:00.000  READ DMA EXT
  25 00 00 00 10 00 00 00 02 84 d0 40 02     00:00:00.000  READ DMA EXT
  25 00 00 00 f0 00 00 00 02 83 e0 40 02     00:00:00.000  READ DMA EXT

Error 18 [17] occurred at disk power-on lifetime: 0 hours (0 days + 0 hours)
  When the command that caused the error occurred, the device was active or idle.

  After command completion occurred, registers were:
  ER -- ST COUNT  LBA_48  LH LM LL DV DC
  -- -- -- == -- == == == -- -- -- -- --
  40 -- 51 00 f0 00 00 00 02 69 88 40 02  Error: UNC 240 sectors at LBA = 0x00026988 = 158088

  Commands leading to the command that caused the error were:
  CR FEATR COUNT  LBA_48  LH LM LL DV DC  Powered_Up_Time  Command/Feature_Name
  -- == -- == -- == == == -- -- -- -- --  ---------------  --------------------
  25 00 00 00 f0 00 00 00 02 69 88 40 02     00:00:00.000  READ DMA EXT
  25 00 00 00 08 00 00 09 88 07 88 40 02     00:00:00.000  READ DMA EXT
  25 00 00 00 18 00 00 0a c4 2f a0 40 02     00:00:00.000  READ DMA EXT
  25 00 00 00 08 00 00 09 e1 bb 48 40 02     00:00:00.000  READ DMA EXT
  25 00 00 00 78 00 00 09 e1 2a 10 40 02     00:00:00.000  READ DMA EXT

SMART Extended Self-test Log Version: 1 (1 sectors)
Num  Test_Description    Status                  Remaining  LifeTime(hours)  LBA_of_first_error
# 1  Short offline       Aborted by host               00%     27349         -

SMART Selective self-test log data structure revision number 0
Note: revision number not 1 implies that no selective self-test has ever been run
 SPAN  MIN_LBA  MAX_LBA  CURRENT_TEST_STATUS
    1        0        0  Not_testing
    2        0        0  Not_testing
    3        0        0  Not_testing
    4        0        0  Not_testing
    5        0        0  Not_testing
Selective self-test flags (0x0):
  After scanning selected spans, do NOT read-scan remainder of disk.
If Selective self-test is pending on power-up, resume after 0 minute delay.

SCT Commands not supported

Device Statistics (GP Log 0x04)
Page  Offset Size        Value Flags Description
0x01  =====  =               =  ===  == General Statistics (rev 1) ==
0x01  0x008  4             203  ---  Lifetime Power-On Resets
0x01  0x010  4           28091  ---  Power-on Hours
0x01  0x018  6     35456111069  ---  Logical Sectors Written
0x01  0x028  6     16468689051  ---  Logical Sectors Read
0x04  =====  =               =  ===  == General Errors Statistics (rev 1) ==
0x04  0x008  4              25  ---  Number of Reported Uncorrectable Errors
0x05  =====  =               =  ===  == Temperature Statistics (rev 1) ==
0x05  0x008  1              33  ---  Current Temperature
0x05  0x020  1              33  ---  Highest Temperature
0x05  0x028  1              33  ---  Lowest Temperature
0x06  =====  =               =  ===  == Transport Statistics (rev 1) ==
0x06  0x018  4               0  ---  Number of Interface CRC Errors
0x07  =====  =               =  ===  == Solid State Device Statistics (rev 1) ==
0x07  0x008  1               3  ---  Percentage Used Endurance Indicator
                                |||_ C monitored condition met
                                ||__ D supports DSN
                                |___ N normalized value

Pending Defects log (GP Log 0x0c) not supported

SATA Phy Event Counters (GP Log 0x11)
ID      Size     Value  Description
0x0001  2            0  Command failed due to ICRC error
0x0003  2            0  R_ERR response for device-to-host data FIS
0x0004  2            0  R_ERR response for host-to-device data FIS
0x0006  2            0  R_ERR response for device-to-host non-data FIS
0x0007  2            0  R_ERR response for host-to-device non-data FIS
0x0008  2            0  Device-to-host non-data FIS retries
0x0009  4            0  Transition from drive PhyRdy to drive PhyNRdy
0x000a  4            1  Device-to-host register FISes sent due to a COMRESET
0x000f  2            0  R_ERR response for host-to-device data FIS, CRC
0x0010  2            0  R_ERR response for host-to-device data FIS, non-CRC
0x0012  2            0  R_ERR response for host-to-device non-data FIS, CRC
0x0013  2            0  R_ERR response for host-to-device non-data FIS, non-CRC

