smartctl 7.1 2019-12-30 r5022 [FreeBSD 12.1-RELEASE-p9 amd64] (local build)
Copyright (C) 2002-19, Bruce Allen, Christian Franke, www.smartmontools.org

=== START OF INFORMATION SECTION ===
Model Family:     JMicron based SSDs
Device Model:     ADATA SP600
Serial Number:    --
LU WWN Device Id: 5 707c18 ...
Firmware Version: 5.9
User Capacity:    64,023,257,088 bytes [64.0 GB]
Sector Size:      512 bytes logical/physical
Rotation Rate:    Solid State Device
Form Factor:      < 1.8 inches
Device is:        In smartctl database [for details use: -P show]
ATA Version is:   ACS-2 (minor revision not indicated)
SATA Version is:  SATA 3.1, 6.0 Gb/s (current: 6.0 Gb/s)
Local Time is:    Wed Sep  9 18:35:46 2020 EDT
SMART support is: Available - device has SMART capability.
SMART support is: Enabled
AAM feature is:   Unavailable
APM level is:     254 (maximum performance)
Rd look-ahead is: Enabled
Write cache is:   Enabled
DSN feature is:   Unavailable
ATA Security is:  Disabled, NOT FROZEN [SEC1]
Wt Cache Reorder: Enabled

=== START OF READ SMART DATA SECTION ===
SMART overall-health self-assessment test result: PASSED

General SMART Values:
Offline data collection status:  (0x02)	Offline data collection activity
					was completed without error.
					Auto Offline Data Collection: Disabled.
Self-test execution status:      (   0)	The previous self-test routine completed
					without error or no self-test has ever 
					been run.
Total time to complete Offline 
data collection: 		(   32) seconds.
Offline data collection
capabilities: 			 (0x5b) SMART execute Offline immediate.
					Auto Offline data collection on/off support.
					Suspend Offline collection upon new
					command.
					Offline surface scan supported.
					Self-test supported.
					No Conveyance Self-test supported.
					Selective Self-test supported.
SMART capabilities:            (0x0003)	Saves SMART data before entering
					power-saving mode.
					Supports SMART auto save timer.
Error logging capability:        (0x01)	Error logging supported.
					General Purpose Logging supported.
Short self-test routine 
recommended polling time: 	 (   1) minutes.
Extended self-test routine
recommended polling time: 	 (   1) minutes.
SCT capabilities: 	       (0x0039)	SCT Status supported.
					SCT Error Recovery Control supported.
					SCT Feature Control supported.
					SCT Data Table supported.

SMART Attributes Data Structure revision number: 16
Vendor Specific SMART Attributes with Thresholds:
ID# ATTRIBUTE_NAME          FLAGS    VALUE WORST THRESH FAIL RAW_VALUE
  1 Raw_Read_Error_Rate     -O-R--   100   100   000    -    0
  2 Throughput_Performance  P-S---   100   100   050    -    0
  3 Unknown_JMF_Attribute   POS---   100   100   050    -    0
  5 Reallocated_Sector_Ct   PO--C-   100   100   050    -    0
  7 Unknown_JMF_Attribute   PO-R--   100   100   050    -    0
  8 Unknown_JMF_Attribute   P-S---   100   100   050    -    0
  9 Power_On_Hours          -O--C-   100   100   000    -    2025
 10 Unknown_JMF_Attribute   PO--C-   100   100   050    -    0
 12 Power_Cycle_Count       -O--C-   100   100   000    -    32
167 Unknown_JMF_Attribute   -O---K   100   100   000    -    0
168 SATA_Phy_Error_Count    -O--C-   100   100   000    -    81
169 Unknown_JMF_Attribute   PO--C-   100   100   010    -    786437
170 Bad_Block_Count         PO--C-   100   100   010    -    0 0 0
173 Erase_Count             -O--C-   180   180   000    -    449 500 464
175 Bad_Cluster_Table_Count PO--C-   100   100   010    -    0
180 Unknown_JMF_Attribute   PO--CK   100   100   020    -    260
192 Unexpect_Power_Loss_Ct  -O--C-   100   100   000    -    20
194 Temperature_Celsius     -O---K   065   065   030    -    35 (Min/Max 30/37)
197 Current_Pending_Sector  -O--C-   100   100   000    -    0
231 Unknown_JMF_Attribute   PO--CK   085   085   005    -    15
233 Unknown_JMF_Attribute   -O--CK   100   100   000    -    59273153024
234 Unknown_JMF_Attribute   -O--CK   100   100   000    -    88996427584
240 Unknown_JMF_Attribute   PO--C-   100   100   050    -    0
241 Total_LBAs_Written      -O--CK   100   100   000    -    1374673127
242 Total_LBAs_Read         -O--CK   100   100   000    -    751549528
                            ||||||_ K auto-keep
                            |||||__ C event count
                            ||||___ R error rate
                            |||____ S speed/performance
                            ||_____ O updated online
                            |______ P prefailure warning

General Purpose Log Directory Version 1
SMART           Log Directory Version 1 [multi-sector log support]
Address    Access  R/W   Size  Description
0x00       GPL,SL  R/O      1  Log Directory
0x01           SL  R/O      1  Summary SMART error log
0x02           SL  R/O     51  Comprehensive SMART error log
0x03       GPL     R/O     64  Ext. Comprehensive SMART error log
0x04       GPL,SL  R/O      8  Device Statistics log
0x06           SL  R/O      1  SMART self-test log
0x07       GPL     R/O      1  Extended self-test log
0x09           SL  R/W      1  Selective self-test log
0x10       GPL     R/O      1  NCQ Command Error log
0x11       GPL     R/O      1  SATA Phy Event Counters log
0x30       GPL,SL  R/O      9  IDENTIFY DEVICE data log
0x80-0x9f  GPL,SL  R/W     16  Host vendor specific log
0xe0       GPL,SL  R/W      1  SCT Command/Status
0xe1       GPL,SL  R/W      1  SCT Data Transfer

SMART Extended Comprehensive Error Log Version: 1 (64 sectors)
No Errors Logged

SMART Extended Self-test Log Version: 1 (1 sectors)
No self-tests have been logged.  [To run self-tests, use: smartctl -t]

SMART Selective self-test log data structure revision number 1
 SPAN  MIN_LBA  MAX_LBA  CURRENT_TEST_STATUS
    1        0        0  Not_testing
    2        0        0  Not_testing
    3        0        0  Not_testing
    4        0        0  Not_testing
    5        0        0  Not_testing
Selective self-test flags (0x0):
  After scanning selected spans, do NOT read-scan remainder of disk.
If Selective self-test is pending on power-up, resume after 0 minute delay.

SCT Status Version:                  3
SCT Version (vendor specific):       1 (0x0001)
Device State:                        Active (0)
Current Temperature:                     0 Celsius
Power Cycle Min/Max Temperature:     --/ 0 Celsius
Lifetime    Min/Max Temperature:     --/ 0 Celsius

SCT Temperature History Version:     2
Temperature Sampling Period:         1 minute
Temperature Logging Interval:        1 minute
Min/Max recommended Temperature:     -127/127 Celsius
Min/Max Temperature Limit:           -127/127 Celsius
Temperature History Size (Index):    478 (219)

SCT Error Recovery Control:
           Read:     70 (7.0 seconds)
          Write:     70 (7.0 seconds)

Device Statistics (GP Log 0x04)
Page  Offset Size        Value Flags Description
0x01  =====  =               =  ===  == General Statistics (rev 2) ==
0x01  0x008  4              32  ---  Lifetime Power-On Resets
0x01  0x018  6      1374602503  ---  Logical Sectors Written
0x01  0x020  6        14402380  ---  Number of Write Commands
0x01  0x028  6       751541528  ---  Logical Sectors Read
0x01  0x030  6         4336769  ---  Number of Read Commands
0x01  0x038  6      7290000000  ---  Date and Time TimeStamp
0x07  =====  =               =  ===  == Solid State Device Statistics (rev 1) ==
0x07  0x008  1              20  N--  Percentage Used Endurance Indicator
                                |||_ C monitored condition met
                                ||__ D supports DSN
                                |___ N normalized value

Pending Defects log (GP Log 0x0c) not supported

SATA Phy Event Counters (GP Log 0x11)
ID      Size     Value  Description
0x0001  2           81  Command failed due to ICRC error
0x0003  2            0  R_ERR response for device-to-host data FIS
0x0004  2            0  R_ERR response for host-to-device data FIS
0x0006  2            0  R_ERR response for device-to-host non-data FIS
0x0007  2            0  R_ERR response for host-to-device non-data FIS
0x0008  2            0  Device-to-host non-data FIS retries
0x0009  4            0  Transition from drive PhyRdy to drive PhyNRdy
0x000a  4          386  Device-to-host register FISes sent due to a COMRESET
0x000f  2            0  R_ERR response for host-to-device data FIS, CRC
0x0010  2            0  R_ERR response for host-to-device data FIS, non-CRC
0x0012  2            0  R_ERR response for host-to-device non-data FIS, CRC
0x0013  2            0  R_ERR response for host-to-device non-data FIS, non-CRC

