smartctl 7.3 2022-02-28 r5338 [FreeBSD 13.2-RELEASE amd64] (local build)
Copyright (C) 2002-22, Bruce Allen, Christian Franke, www.smartmontools.org

=== START OF INFORMATION SECTION ===
Model Number:                       INTEL SSDPEDKX040T7
Serial Number:                      --
Firmware Version:                   QDV101D1
PCI Vendor/Subsystem ID:            0x8086
IEEE OUI Identifier:                0x5cd2e4
Total NVM Capacity:                 4,000,787,030,016 [4.00 TB]
Unallocated NVM Capacity:           0
Controller ID:                      0
NVMe Version:                       1.2
Number of Namespaces:               1
Namespace 1 Size/Capacity:          4,000,787,030,016 [4.00 TB]
Namespace 1 Formatted LBA Size:     512
Namespace 1 IEEE EUI-64:            5cd2e4 ...
Local Time is:                      Wed May  3 15:46:25 2023 MSK
Firmware Updates (0x02):            1 Slot
Optional Admin Commands (0x0006):   Format Frmw_DL
Optional NVM Commands (0x0006):     Wr_Unc DS_Mngmt
Log Page Attributes (0x02):         Cmd_Eff_Lg
Maximum Data Transfer Size:         32 Pages
Warning  Comp. Temp. Threshold:     70 Celsius
Critical Comp. Temp. Threshold:     80 Celsius

Supported Power States
St Op     Max   Active     Idle   RL RT WL WT  Ent_Lat  Ex_Lat
 0 +    25.00W       -        -    0  0  0  0        0       0

Supported LBA Sizes (NSID 0x1)
Id Fmt  Data  Metadt  Rel_Perf
 0 +     512       0         2
 1 -    4096       0         0

=== START OF SMART DATA SECTION ===
SMART overall-health self-assessment test result: PASSED

SMART/Health Information (NVMe Log 0x02)
Critical Warning:                   0x00
Temperature:                        19 Celsius
Available Spare:                    99%
Available Spare Threshold:          10%
Percentage Used:                    1%
Data Units Read:                    88,558,733 [45.3 TB]
Data Units Written:                 58,614,716 [30.0 TB]
Host Read Commands:                 439,998,435
Host Write Commands:                490,733,042
Controller Busy Time:               268
Power Cycles:                       44
Power On Hours:                     23,972
Unsafe Shutdowns:                   29
Media and Data Integrity Errors:    0
Error Information Log Entries:      0
Warning  Comp. Temperature Time:    0
Critical Comp. Temperature Time:    0

Error Information (NVMe Log 0x01, 16 of 64 entries)
No Errors Logged



