smartctl 7.4 2023-08-01 r5530 [FreeBSD 14.2-RELEASE-p2 amd64] (local build)
Copyright (C) 2002-23, Bruce Allen, Christian Franke, www.smartmontools.org

=== START OF INFORMATION SECTION ===
Model Family:     Samsung based SSDs
Device Model:     Samsung SSD 870 EVO 500GB
Serial Number:    --
LU WWN Device Id: 5 002538 ...
Firmware Version: SVT01B6Q
User Capacity:    500,107,862,016 bytes [500 GB]
Sector Size:      512 bytes logical/physical
Rotation Rate:    Solid State Device
Form Factor:      2.5 inches
TRIM Command:     Available, deterministic, zeroed
Device is:        In smartctl database 7.3/5528
ATA Version is:   ACS-4 T13/BSR INCITS 529 revision 5
SATA Version is:  SATA 3.3, 6.0 Gb/s (current: 6.0 Gb/s)
Local Time is:    Mon Apr 28 11:26:09 2025 UTC
SMART support is: Available - device has SMART capability.
SMART support is: Enabled
AAM feature is:   Unavailable
APM feature is:   Unavailable
Rd look-ahead is: Enabled
Write cache is:   Enabled
DSN feature is:   Unavailable
ATA Security is:  Disabled, frozen [SEC2]
Wt Cache Reorder: Enabled

=== START OF READ SMART DATA SECTION ===
SMART overall-health self-assessment test result: PASSED

General SMART Values:
Offline data collection status:  (0x00)	Offline data collection activity
					was never started.
					Auto Offline Data Collection: Disabled.
Self-test execution status:      (   0)	The previous self-test routine completed
					without error or no self-test has ever 
					been run.
Total time to complete Offline 
data collection: 		(    0) seconds.
Offline data collection
capabilities: 			 (0x53) SMART execute Offline immediate.
					Auto Offline data collection on/off support.
					Suspend Offline collection upon new
					command.
					No Offline surface scan supported.
					Self-test supported.
					No Conveyance Self-test supported.
					Selective Self-test supported.
SMART capabilities:            (0x0003)	Saves SMART data before entering
					power-saving mode.
					Supports SMART auto save timer.
Error logging capability:        (0x01)	Error logging supported.
					General Purpose Logging supported.
Short self-test routine 
recommended polling time: 	 (   2) minutes.
Extended self-test routine
recommended polling time: 	 (  85) minutes.
SCT capabilities: 	       (0x003d)	SCT Status supported.
					SCT Error Recovery Control supported.
					SCT Feature Control supported.
					SCT Data Table supported.

SMART Attributes Data Structure revision number: 1
Vendor Specific SMART Attributes with Thresholds:
ID# ATTRIBUTE_NAME          FLAGS    VALUE WORST THRESH FAIL RAW_VALUE
  5 Reallocated_Sector_Ct   PO--CK   093   093   010    -    32
  9 Power_On_Hours          -O--CK   095   095   000    -    23816
 12 Power_Cycle_Count       -O--CK   099   099   000    -    74
177 Wear_Leveling_Count     PO--C-   093   093   000    -    159
179 Used_Rsvd_Blk_Cnt_Tot   PO--C-   093   093   010    -    32
181 Program_Fail_Cnt_Total  -O--CK   100   100   010    -    0
182 Erase_Fail_Count_Total  -O--CK   100   100   010    -    0
183 Runtime_Bad_Block       PO--C-   093   093   010    -    32
187 Uncorrectable_Error_Cnt -O--CK   099   099   000    -    141
190 Airflow_Temperature_Cel -O--CK   057   048   000    -    43
195 ECC_Error_Rate          -O-RC-   199   199   000    -    141
199 CRC_Error_Count         -OSRCK   100   100   000    -    0
235 POR_Recovery_Count      -O--C-   099   099   000    -    55
241 Total_LBAs_Written      -O--CK   099   099   000    -    157586726368
                            ||||||_ K auto-keep
                            |||||__ C event count
                            ||||___ R error rate
                            |||____ S speed/performance
                            ||_____ O updated online
                            |______ P prefailure warning

General Purpose Log Directory Version 1
SMART           Log Directory Version 1 [multi-sector log support]
Address    Access  R/W   Size  Description
0x00       GPL,SL  R/O      1  Log Directory
0x01           SL  R/O      1  Summary SMART error log
0x02           SL  R/O      1  Comprehensive SMART error log
0x03       GPL     R/O      1  Ext. Comprehensive SMART error log
0x04       GPL,SL  R/O      8  Device Statistics log
0x06           SL  R/O      1  SMART self-test log
0x07       GPL     R/O      1  Extended self-test log
0x09           SL  R/W      1  Selective self-test log
0x10       GPL     R/O      1  NCQ Command Error log
0x11       GPL     R/O      1  SATA Phy Event Counters log
0x13       GPL     R/O      1  SATA NCQ Send and Receive log
0x30       GPL,SL  R/O      9  IDENTIFY DEVICE data log
0x80-0x9f  GPL,SL  R/W     16  Host vendor specific log
0xa1           SL  VS      16  Device vendor specific log
0xa5           SL  VS      16  Device vendor specific log
0xce           SL  VS      16  Device vendor specific log
0xe0       GPL,SL  R/W      1  SCT Command/Status
0xe1       GPL,SL  R/W      1  SCT Data Transfer

SMART Extended Comprehensive Error Log Version: 1 (1 sectors)
Device Error Count: 141 (device log contains only the most recent 4 errors)
	CR     = Command Register
	FEATR  = Features Register
	COUNT  = Count (was: Sector Count) Register
	LBA_48 = Upper bytes of LBA High/Mid/Low Registers ]  ATA-8
	LH     = LBA High (was: Cylinder High) Register    ]   LBA
	LM     = LBA Mid (was: Cylinder Low) Register      ] Register
	LL     = LBA Low (was: Sector Number) Register     ]
	DV     = Device (was: Device/Head) Register
	DC     = Device Control Register
	ER     = Error register
	ST     = Status register
Powered_Up_Time is measured from power on, and printed as
DDd+hh:mm:SS.sss where DD=days, hh=hours, mm=minutes,
SS=sec, and sss=millisec. It "wraps" after 49.710 days.

Error 141 [0] occurred at disk power-on lifetime: 16604 hours (691 days + 20 hours)
  When the command that caused the error occurred, the device was active or idle.

  After command completion occurred, registers were:
  ER -- ST COUNT  LBA_48  LH LM LL DV DC
  -- -- -- == -- == == == -- -- -- -- --
  40 -- 51 0a 00 00 00 06 9a 36 a0 e0 00  Error: UNC 2560 sectors at LBA = 0x069a36a0 = 110769824

  Commands leading to the command that caused the error were:
  CR FEATR COUNT  LBA_48  LH LM LL DV DC  Powered_Up_Time  Command/Feature_Name
  -- == -- == -- == == == -- -- -- -- --  ---------------  --------------------
  25 00 00 0a 00 00 00 06 9a 36 a0 e0 11  3d+22:38:18.156  READ DMA EXT
  25 00 00 02 00 00 00 06 9a 34 a0 e0 11  3d+22:38:18.156  READ DMA EXT
  25 00 00 0a 00 00 00 06 9a 2a a0 e0 11  3d+22:38:18.156  READ DMA EXT
  25 00 00 0a 00 00 00 06 9a 20 a0 e0 11  3d+22:38:18.156  READ DMA EXT
  25 00 00 0a 00 00 00 06 9a 16 a0 e0 11  3d+22:38:18.156  READ DMA EXT

Error 140 [3] occurred at disk power-on lifetime: 16603 hours (691 days + 19 hours)
  When the command that caused the error occurred, the device was active or idle.

  After command completion occurred, registers were:
  ER -- ST COUNT  LBA_48  LH LM LL DV DC
  -- -- -- == -- == == == -- -- -- -- --
  40 -- 51 00 08 00 00 17 24 9a 68 e0 00  Error: UNC 8 sectors at LBA = 0x17249a68 = 388274792

  Commands leading to the command that caused the error were:
  CR FEATR COUNT  LBA_48  LH LM LL DV DC  Powered_Up_Time  Command/Feature_Name
  -- == -- == -- == == == -- -- -- -- --  ---------------  --------------------
  25 00 00 00 08 00 00 17 24 9a 68 e0 11  3d+22:20:12.127  READ DMA EXT
  25 00 00 00 08 00 00 17 28 74 38 e0 11  3d+22:20:12.127  READ DMA EXT
  25 00 00 00 08 00 00 17 28 73 38 e0 11  3d+22:20:12.127  READ DMA EXT
  25 00 00 00 08 00 00 17 28 72 38 e0 11  3d+22:20:12.127  READ DMA EXT
  25 00 00 00 08 00 00 17 28 71 38 e0 11  3d+22:20:12.127  READ DMA EXT

Error 139 [2] occurred at disk power-on lifetime: 16603 hours (691 days + 19 hours)
  When the command that caused the error occurred, the device was active or idle.

  After command completion occurred, registers were:
  ER -- ST COUNT  LBA_48  LH LM LL DV DC
  -- -- -- == -- == == == -- -- -- -- --
  40 -- 51 00 08 00 00 17 28 6f 98 e0 00  Error: UNC 8 sectors at LBA = 0x17286f98 = 388525976

  Commands leading to the command that caused the error were:
  CR FEATR COUNT  LBA_48  LH LM LL DV DC  Powered_Up_Time  Command/Feature_Name
  -- == -- == -- == == == -- -- -- -- --  ---------------  --------------------
  25 00 00 00 08 00 00 17 28 6f 98 e0 11  3d+22:20:09.861  READ DMA EXT
  25 00 00 00 08 00 00 17 24 9a c0 e0 11  3d+22:20:09.861  READ DMA EXT
  25 00 00 00 08 00 00 17 24 99 c0 e0 11  3d+22:20:09.861  READ DMA EXT
  25 00 00 00 08 00 00 17 28 74 90 e0 11  3d+22:20:09.861  READ DMA EXT
  25 00 00 00 08 00 00 17 28 73 90 e0 11  3d+22:20:09.861  READ DMA EXT

Error 138 [1] occurred at disk power-on lifetime: 16603 hours (691 days + 19 hours)
  When the command that caused the error occurred, the device was active or idle.

  After command completion occurred, registers were:
  ER -- ST COUNT  LBA_48  LH LM LL DV DC
  -- -- -- == -- == == == -- -- -- -- --
  40 -- 51 05 c0 00 00 17 28 6f 60 e0 00  Error: UNC 1472 sectors at LBA = 0x17286f60 = 388525920

  Commands leading to the command that caused the error were:
  CR FEATR COUNT  LBA_48  LH LM LL DV DC  Powered_Up_Time  Command/Feature_Name
  -- == -- == -- == == == -- -- -- -- --  ---------------  --------------------
  25 00 00 05 c0 00 00 17 28 6f 60 e0 11  3d+22:20:09.720  READ DMA EXT
  25 00 00 00 60 00 00 17 28 6e f8 e0 11  3d+22:20:09.720  READ DMA EXT
  25 00 00 09 68 00 00 17 28 65 88 e0 11  3d+22:20:09.720  READ DMA EXT
  25 00 00 00 20 00 00 17 28 65 60 e0 11  3d+22:20:09.720  READ DMA EXT
  25 00 00 00 10 00 00 17 28 65 40 e0 11  3d+22:20:09.720  READ DMA EXT

SMART Extended Self-test Log Version: 1 (1 sectors)
Num  Test_Description    Status                  Remaining  LifeTime(hours)  LBA_of_first_error
# 1  Short offline       Completed: read failure       20%     16652         32948176
# 2  Short offline       Completed: read failure       20%     16604         32948176

SMART Selective self-test log data structure revision number 1
 SPAN  MIN_LBA  MAX_LBA  CURRENT_TEST_STATUS
    1        0        0  Not_testing
    2        0        0  Not_testing
    3        0        0  Not_testing
    4        0        0  Not_testing
    5        0        0  Not_testing
  256        0    65535  Read_scanning was never started
Selective self-test flags (0x0):
  After scanning selected spans, do NOT read-scan remainder of disk.
If Selective self-test is pending on power-up, resume after 0 minute delay.

SCT Status Version:                  3
SCT Version (vendor specific):       256 (0x0100)
Device State:                        Active (0)
Current Temperature:                    43 Celsius
Power Cycle Min/Max Temperature:     18/49 Celsius
Lifetime    Min/Max Temperature:     18/52 Celsius
Specified Max Operating Temperature:    70 Celsius
Under/Over Temperature Limit Count:   0/0
SMART Status:                        0xc24f (PASSED)

SCT Temperature History Version:     2
Temperature Sampling Period:         10 minutes
Temperature Logging Interval:        10 minutes
Min/Max recommended Temperature:      0/70 Celsius
Min/Max Temperature Limit:            0/70 Celsius
Temperature History Size (Index):    128 (19)

SCT Error Recovery Control:
           Read: Disabled
          Write: Disabled

Device Statistics (GP Log 0x04)
Page  Offset Size        Value Flags Description
0x01  =====  =               =  ===  == General Statistics (rev 1) ==
0x01  0x008  4              74  ---  Lifetime Power-On Resets
0x01  0x010  4           23816  ---  Power-on Hours
0x01  0x018  6    157586726368  ---  Logical Sectors Written
0x01  0x020  6      1560835739  ---  Number of Write Commands
0x01  0x028  6     56364886222  ---  Logical Sectors Read
0x01  0x030  6       652509124  ---  Number of Read Commands
0x01  0x038  6         2909000  ---  Date and Time TimeStamp
0x04  =====  =               =  ===  == General Errors Statistics (rev 1) ==
0x04  0x008  4             141  ---  Number of Reported Uncorrectable Errors
0x04  0x010  4               1  ---  Resets Between Cmd Acceptance and Completion
0x05  =====  =               =  ===  == Temperature Statistics (rev 1) ==
0x05  0x008  1              43  ---  Current Temperature
0x05  0x020  1              52  ---  Highest Temperature
0x05  0x028  1              18  ---  Lowest Temperature
0x05  0x058  1              70  ---  Specified Maximum Operating Temperature
0x06  =====  =               =  ===  == Transport Statistics (rev 1) ==
0x06  0x008  4             190  ---  Number of Hardware Resets
0x06  0x010  4               0  ---  Number of ASR Events
0x06  0x018  4               0  ---  Number of Interface CRC Errors
0x07  =====  =               =  ===  == Solid State Device Statistics (rev 1) ==
0x07  0x008  1               6  N--  Percentage Used Endurance Indicator
                                |||_ C monitored condition met
                                ||__ D supports DSN
                                |___ N normalized value

Pending Defects log (GP Log 0x0c) not supported

SATA Phy Event Counters (GP Log 0x11)
ID      Size     Value  Description
0x0001  2            0  Command failed due to ICRC error
0x0002  2            0  R_ERR response for data FIS
0x0003  2            0  R_ERR response for device-to-host data FIS
0x0004  2            0  R_ERR response for host-to-device data FIS
0x0005  2            0  R_ERR response for non-data FIS
0x0006  2            0  R_ERR response for device-to-host non-data FIS
0x0007  2            0  R_ERR response for host-to-device non-data FIS
0x0008  2            0  Device-to-host non-data FIS retries
0x0009  2           38  Transition from drive PhyRdy to drive PhyNRdy
0x000a  2           38  Device-to-host register FISes sent due to a COMRESET
0x000b  2            0  CRC errors within host-to-device FIS
0x000d  2            0  Non-CRC errors within host-to-device FIS
0x000f  2            0  R_ERR response for host-to-device data FIS, CRC
0x0010  2            0  R_ERR response for host-to-device data FIS, non-CRC
0x0012  2            0  R_ERR response for host-to-device non-data FIS, CRC
0x0013  2            0  R_ERR response for host-to-device non-data FIS, non-CRC

