smartctl 7.1 2019-12-30 r5022 [NetBSD 9.0_STABLE amd64] (local build)
Copyright (C) 2002-19, Bruce Allen, Christian Franke, www.smartmontools.org

=== START OF INFORMATION SECTION ===
Model Family:     Western Digital Red
Device Model:     WDC WD20EFRX-68EUZN0
Serial Number:    --
LU WWN Device Id: 5 0014ee ...
Firmware Version: 82.00A82
User Capacity:    2,000,398,934,016 bytes [2.00 TB]
Sector Sizes:     512 bytes logical, 4096 bytes physical
Rotation Rate:    5400 rpm
Device is:        In smartctl database [for details use: -P show]
ATA Version is:   ACS-2 (minor revision not indicated)
SATA Version is:  SATA 3.0, 6.0 Gb/s (current: 6.0 Gb/s)
Local Time is:    Wed Dec 16 11:01:21 2020 CET
SMART support is: Available - device has SMART capability.
SMART support is: Enabled

=== START OF READ SMART DATA SECTION ===
SMART overall-health self-assessment test result: PASSED

General SMART Values:
Offline data collection status:  (0x85)	Offline data collection activity
					was aborted by an interrupting command from host.
					Auto Offline Data Collection: Enabled.
Self-test execution status:      (   0)	The previous self-test routine completed
					without error or no self-test has ever 
					been run.
Total time to complete Offline 
data collection: 		(27240) seconds.
Offline data collection
capabilities: 			 (0x7b) SMART execute Offline immediate.
					Auto Offline data collection on/off support.
					Suspend Offline collection upon new
					command.
					Offline surface scan supported.
					Self-test supported.
					Conveyance Self-test supported.
					Selective Self-test supported.
SMART capabilities:            (0x0003)	Saves SMART data before entering
					power-saving mode.
					Supports SMART auto save timer.
Error logging capability:        (0x01)	Error logging supported.
					General Purpose Logging supported.
Short self-test routine 
recommended polling time: 	 (   2) minutes.
Extended self-test routine
recommended polling time: 	 ( 275) minutes.
Conveyance self-test routine
recommended polling time: 	 (   5) minutes.
SCT capabilities: 	       (0x703d)	SCT Status supported.
					SCT Error Recovery Control supported.
					SCT Feature Control supported.
					SCT Data Table supported.

SMART Attributes Data Structure revision number: 16
Vendor Specific SMART Attributes with Thresholds:
ID# ATTRIBUTE_NAME          FLAG     VALUE WORST THRESH TYPE      UPDATED  WHEN_FAILED RAW_VALUE
  1 Raw_Read_Error_Rate     0x002f   200   200   051    Pre-fail  Always       -       0
  3 Spin_Up_Time            0x0027   176   171   021    Pre-fail  Always       -       4158
  4 Start_Stop_Count        0x0032   100   100   000    Old_age   Always       -       166
  5 Reallocated_Sector_Ct   0x0033   200   200   140    Pre-fail  Always       -       0
  7 Seek_Error_Rate         0x002e   200   200   000    Old_age   Always       -       0
  9 Power_On_Hours          0x0032   035   035   000    Old_age   Always       -       48027
 10 Spin_Retry_Count        0x0032   100   100   000    Old_age   Always       -       0
 11 Calibration_Retry_Count 0x0032   100   100   000    Old_age   Always       -       0
 12 Power_Cycle_Count       0x0032   100   100   000    Old_age   Always       -       166
192 Power-Off_Retract_Count 0x0032   200   200   000    Old_age   Always       -       159
193 Load_Cycle_Count        0x0032   200   200   000    Old_age   Always       -       2150
194 Temperature_Celsius     0x0022   108   097   000    Old_age   Always       -       39
196 Reallocated_Event_Count 0x0032   200   200   000    Old_age   Always       -       0
197 Current_Pending_Sector  0x0032   200   200   000    Old_age   Always       -       0
198 Offline_Uncorrectable   0x0030   200   200   000    Old_age   Offline      -       0
199 UDMA_CRC_Error_Count    0x0032   200   200   000    Old_age   Always       -       24
200 Multi_Zone_Error_Rate   0x0008   200   200   000    Old_age   Offline      -       0

SMART Error Log Version: 1
ATA Error Count: 7 (device log contains only the most recent five errors)
	CR = Command Register [HEX]
	FR = Features Register [HEX]
	SC = Sector Count Register [HEX]
	SN = Sector Number Register [HEX]
	CL = Cylinder Low Register [HEX]
	CH = Cylinder High Register [HEX]
	DH = Device/Head Register [HEX]
	DC = Device Command Register [HEX]
	ER = Error register [HEX]
	ST = Status register [HEX]
Powered_Up_Time is measured from power on, and printed as
DDd+hh:mm:SS.sss where DD=days, hh=hours, mm=minutes,
SS=sec, and sss=millisec. It "wraps" after 49.710 days.

Error 7 occurred at disk power-on lifetime: 46398 hours (1933 days + 6 hours)
  When the command that caused the error occurred, the device was active or idle.

  After command completion occurred, registers were:
  ER ST SC SN CL CH DH
  -- -- -- -- -- -- --
  10 51 20 80 a8 b7 40  Error: IDNF at LBA = 0x00b7a880 = 12036224

  Commands leading to the command that caused the error were:
  CR FR SC SN CL CH DH DC   Powered_Up_Time  Command/Feature_Name
  -- -- -- -- -- -- -- --  ----------------  --------------------
  ca 00 20 80 a8 b7 40 08   2d+01:07:48.713  WRITE DMA
  ca 00 20 c0 09 51 44 08   2d+01:07:42.640  WRITE DMA
  ca 00 20 80 83 00 44 08   2d+01:07:42.640  WRITE DMA
  ca 00 20 00 c7 fa 43 08   2d+01:07:42.640  WRITE DMA
  ca 00 20 c0 d0 6d 44 08   2d+01:07:42.640  WRITE DMA

Error 6 occurred at disk power-on lifetime: 46289 hours (1928 days + 17 hours)
  When the command that caused the error occurred, the device was active or idle.

  After command completion occurred, registers were:
  ER ST SC SN CL CH DH
  -- -- -- -- -- -- --
  10 51 01 01 78 f1 40  Error: IDNF at LBA = 0x00f17801 = 15824897

  Commands leading to the command that caused the error were:
  CR FR SC SN CL CH DH DC   Powered_Up_Time  Command/Feature_Name
  -- -- -- -- -- -- -- --  ----------------  --------------------
  ca 00 01 01 78 f1 40 08   2d+05:13:59.625  WRITE DMA
  ca 00 60 c0 28 0c 4a 08   2d+05:13:56.366  WRITE DMA
  ca 00 20 a0 28 0c 4a 08   2d+05:13:56.366  WRITE DMA
  ca 00 60 40 28 0c 4a 08   2d+05:13:56.365  WRITE DMA
  ca 00 20 20 28 0c 4a 08   2d+05:13:56.365  WRITE DMA

Error 5 occurred at disk power-on lifetime: 46159 hours (1923 days + 7 hours)
  When the command that caused the error occurred, the device was active or idle.

  After command completion occurred, registers were:
  ER ST SC SN CL CH DH
  -- -- -- -- -- -- --
  10 51 01 0a 94 f1 40  Error: IDNF at LBA = 0x00f1940a = 15832074

  Commands leading to the command that caused the error were:
  CR FR SC SN CL CH DH DC   Powered_Up_Time  Command/Feature_Name
  -- -- -- -- -- -- -- --  ----------------  --------------------
  ca 00 01 0a 94 f1 40 08   2d+02:08:15.367  WRITE DMA
  ca 00 20 00 cb e8 4d 08   2d+02:08:10.364  WRITE DMA
  ca 00 20 c0 ca e8 4d 08   2d+02:08:10.364  WRITE DMA
  ca 00 60 c0 28 0c 4a 08   2d+02:08:10.280  WRITE DMA
  ca 00 20 a0 28 0c 4a 08   2d+02:08:10.280  WRITE DMA

Error 4 occurred at disk power-on lifetime: 45250 hours (1885 days + 10 hours)
  When the command that caused the error occurred, the device was active or idle.

  After command completion occurred, registers were:
  ER ST SC SN CL CH DH
  -- -- -- -- -- -- --
  10 51 20 00 60 e7 4d  Error: IDNF at LBA = 0x0de76000 = 233267200

  Commands leading to the command that caused the error were:
  CR FR SC SN CL CH DH DC   Powered_Up_Time  Command/Feature_Name
  -- -- -- -- -- -- -- --  ----------------  --------------------
  ca 00 20 00 60 e7 4d 08   2d+06:22:36.636  WRITE DMA
  ca 00 20 00 d2 e5 4d 08   2d+06:22:35.975  WRITE DMA
  ca 00 20 00 bd e5 4d 08   2d+06:22:35.974  WRITE DMA
  ca 00 20 00 60 e7 4d 08   2d+06:22:35.174  WRITE DMA
  ca 00 04 c0 35 00 40 08   2d+06:22:35.024  WRITE DMA

Error 3 occurred at disk power-on lifetime: 44174 hours (1840 days + 14 hours)
  When the command that caused the error occurred, the device was active or idle.

  After command completion occurred, registers were:
  ER ST SC SN CL CH DH
  -- -- -- -- -- -- --
  10 51 04 3c b3 aa 45  Error: IDNF at LBA = 0x05aab33c = 95073084

  Commands leading to the command that caused the error were:
  CR FR SC SN CL CH DH DC   Powered_Up_Time  Command/Feature_Name
  -- -- -- -- -- -- -- --  ----------------  --------------------
  ca 00 04 3c b3 aa 45 08   2d+02:08:48.097  WRITE DMA
  ca 00 18 e0 b5 aa 45 08   2d+02:08:47.098  WRITE DMA
  ca 00 18 e0 f6 52 48 08   2d+02:08:46.081  WRITE DMA
  ca 00 14 80 eb a9 45 08   2d+02:08:45.079  WRITE DMA
  ca 00 40 80 b0 a9 45 08   2d+02:08:45.079  WRITE DMA

SMART Self-test log structure revision number 1
Num  Test_Description    Status                  Remaining  LifeTime(hours)  LBA_of_first_error
# 1  Short offline       Completed without error       00%     48018         -
# 2  Short offline       Completed without error       00%     47994         -
# 3  Short offline       Completed without error       00%     47970         -
# 4  Short offline       Completed without error       00%     47946         -
# 5  Extended offline    Completed without error       00%     47929         -
# 6  Short offline       Completed without error       00%     47922         -
# 7  Short offline       Completed without error       00%     47898         -
# 8  Short offline       Completed without error       00%     47874         -
# 9  Short offline       Completed without error       00%     47850         -
#10  Short offline       Completed without error       00%     47826         -
#11  Short offline       Completed without error       00%     47802         -
#12  Short offline       Completed without error       00%     47778         -
#13  Extended offline    Completed without error       00%     47761         -
#14  Short offline       Completed without error       00%     47754         -
#15  Short offline       Completed without error       00%     47730         -
#16  Short offline       Completed without error       00%     47706         -
#17  Short offline       Completed without error       00%     47682         -
#18  Short offline       Completed without error       00%     47658         -
#19  Short offline       Completed without error       00%     47634         -
#20  Short offline       Completed without error       00%     47610         -
#21  Extended offline    Completed without error       00%     47593         -

SMART Selective self-test log data structure revision number 1
 SPAN  MIN_LBA  MAX_LBA  CURRENT_TEST_STATUS
    1        0        0  Not_testing
    2        0        0  Not_testing
    3        0        0  Not_testing
    4        0        0  Not_testing
    5        0        0  Not_testing
Selective self-test flags (0x0):
  After scanning selected spans, do NOT read-scan remainder of disk.
If Selective self-test is pending on power-up, resume after 0 minute delay.



