smartctl 7.4 2023-08-01 r5530 [FreeBSD 14.0-RELEASE amd64] (local build)
Copyright (C) 2002-23, Bruce Allen, Christian Franke, www.smartmontools.org

=== START OF INFORMATION SECTION ===
Model Family:     Western Digital AV SATA
Device Model:     WDC WD2500AVJS-63B6A0
Serial Number:    --
LU WWN Device Id: 5 0014ee ...
Firmware Version: 01.03A01
User Capacity:    250,059,350,016 bytes [250 GB]
Sector Size:      512 bytes logical/physical
Device is:        In smartctl database 7.3/5528
ATA Version is:   ATA8-ACS (minor revision not indicated)
SATA Version is:  SATA 2.5, 3.0 Gb/s
Local Time is:    Wed Jun 12 13:46:10 2024    
SMART support is: Available - device has SMART capability.
SMART support is: Enabled
AAM level is:     128 (quiet), recommended: 128
APM feature is:   Unavailable
Rd look-ahead is: Enabled
Write cache is:   Enabled
DSN feature is:   Unavailable
ATA Security is:  Disabled, frozen [SEC2]
Wt Cache Reorder: Enabled

=== START OF READ SMART DATA SECTION ===
SMART overall-health self-assessment test result: PASSED

General SMART Values:
Offline data collection status:  (0x00)	Offline data collection activity
					was never started.
					Auto Offline Data Collection: Disabled.
Self-test execution status:      (   0)	The previous self-test routine completed
					without error or no self-test has ever 
					been run.
Total time to complete Offline 
data collection: 		( 5400) seconds.
Offline data collection
capabilities: 			 (0x7b) SMART execute Offline immediate.
					Auto Offline data collection on/off support.
					Suspend Offline collection upon new
					command.
					Offline surface scan supported.
					Self-test supported.
					Conveyance Self-test supported.
					Selective Self-test supported.
SMART capabilities:            (0x0003)	Saves SMART data before entering
					power-saving mode.
					Supports SMART auto save timer.
Error logging capability:        (0x01)	Error logging supported.
					General Purpose Logging supported.
Short self-test routine 
recommended polling time: 	 (   2) minutes.
Extended self-test routine
recommended polling time: 	 (  66) minutes.
Conveyance self-test routine
recommended polling time: 	 (   5) minutes.
SCT capabilities: 	       (0x303f)	SCT Status supported.
					SCT Error Recovery Control supported.
					SCT Feature Control supported.
					SCT Data Table supported.

SMART Attributes Data Structure revision number: 16
Vendor Specific SMART Attributes with Thresholds:
ID# ATTRIBUTE_NAME          FLAGS    VALUE WORST THRESH FAIL RAW_VALUE
  1 Raw_Read_Error_Rate     POSR-K   199   199   051    -    43935
  3 Spin_Up_Time            POS--K   149   144   021    -    3508
  4 Start_Stop_Count        -O--CK   096   096   000    -    4416
  5 Reallocated_Sector_Ct   PO--CK   200   200   140    -    0
  7 Seek_Error_Rate         -OSR-K   100   253   000    -    0
  9 Power_On_Hours          -O--CK   014   014   000    -    63192
 10 Spin_Retry_Count        -O--CK   100   100   000    -    0
 11 Calibration_Retry_Count -O--CK   100   100   000    -    0
 12 Power_Cycle_Count       -O--CK   096   096   000    -    4013
192 Power-Off_Retract_Count -O--CK   199   199   000    -    1437
193 Load_Cycle_Count        -O--CK   199   199   000    -    4416
194 Temperature_Celsius     -O---K   101   075   000    -    42
196 Reallocated_Event_Count -O--CK   200   200   000    -    0
197 Current_Pending_Sector  -O--CK   200   200   000    -    0
198 Offline_Uncorrectable   ----CK   100   253   000    -    0
199 UDMA_CRC_Error_Count    -O--CK   200   200   000    -    4
200 Multi_Zone_Error_Rate   ---R--   100   253   000    -    0
                            ||||||_ K auto-keep
                            |||||__ C event count
                            ||||___ R error rate
                            |||____ S speed/performance
                            ||_____ O updated online
                            |______ P prefailure warning

General Purpose Log Directory Version 1
SMART           Log Directory Version 1 [multi-sector log support]
Address    Access  R/W   Size  Description
0x00       GPL,SL  R/O      1  Log Directory
0x01           SL  R/O      1  Summary SMART error log
0x02           SL  R/O      5  Comprehensive SMART error log
0x03       GPL     R/O      6  Ext. Comprehensive SMART error log
0x06           SL  R/O      1  SMART self-test log
0x07       GPL     R/O      1  Extended self-test log
0x09           SL  R/W      1  Selective self-test log
0x10       GPL     R/O      1  NCQ Command Error log
0x11       GPL     R/O      1  SATA Phy Event Counters log
0x21       GPL     R/O      1  Write stream error log
0x22       GPL     R/O      1  Read stream error log
0x80-0x9f  GPL,SL  R/W     16  Host vendor specific log
0xa0-0xa7  GPL,SL  VS      16  Device vendor specific log
0xa8-0xb7  GPL,SL  VS       1  Device vendor specific log
0xc0       GPL,SL  VS       1  Device vendor specific log
0xc1       GPL     VS      24  Device vendor specific log
0xe0       GPL,SL  R/W      1  SCT Command/Status
0xe1       GPL,SL  R/W      1  SCT Data Transfer

SMART Extended Comprehensive Error Log Version: 1 (6 sectors)
Device Error Count: 52546 (device log contains only the most recent 24 errors)
	CR     = Command Register
	FEATR  = Features Register
	COUNT  = Count (was: Sector Count) Register
	LBA_48 = Upper bytes of LBA High/Mid/Low Registers ]  ATA-8
	LH     = LBA High (was: Cylinder High) Register    ]   LBA
	LM     = LBA Mid (was: Cylinder Low) Register      ] Register
	LL     = LBA Low (was: Sector Number) Register     ]
	DV     = Device (was: Device/Head) Register
	DC     = Device Control Register
	ER     = Error register
	ST     = Status register
Powered_Up_Time is measured from power on, and printed as
DDd+hh:mm:SS.sss where DD=days, hh=hours, mm=minutes,
SS=sec, and sss=millisec. It "wraps" after 49.710 days.

Error 52546 [9] occurred at disk power-on lifetime: 62917 hours (2621 days + 13 hours)
  When the command that caused the error occurred, the device was active or idle.

  After command completion occurred, registers were:
  ER -- ST COUNT  LBA_48  LH LM LL DV DC
  -- -- -- == -- == == == -- -- -- -- --
  40 -- 51 00 00 00 01 4b 00 94 01 40 00  Error: UNC at LBA = 0x14b009401 = 5553296385

  Commands leading to the command that caused the error were:
  CR FEATR COUNT  LBA_48  LH LM LL DV DC  Powered_Up_Time  Command/Feature_Name
  -- == -- == -- == == == -- -- -- -- --  ---------------  --------------------
  60 00 15 00 48 00 00 00 73 96 e8 40 00     00:07:45.587  READ FPDMA QUEUED
  60 00 08 00 40 00 00 02 59 e6 30 40 00     00:07:45.579  READ FPDMA QUEUED
  60 00 38 00 40 00 00 00 88 1f 18 40 00     00:07:45.579  READ FPDMA QUEUED
  60 00 40 00 30 00 00 00 73 96 a8 40 00     00:07:45.569  READ FPDMA QUEUED
  60 00 3a 00 30 00 00 00 72 bb 90 40 00     00:07:45.565  READ FPDMA QUEUED

Error 52545 [8] occurred at disk power-on lifetime: 62917 hours (2621 days + 13 hours)
  When the command that caused the error occurred, the device was active or idle.

  After command completion occurred, registers were:
  ER -- ST COUNT  LBA_48  LH LM LL DV DC
  -- -- -- == -- == == == -- -- -- -- --
  40 -- 51 00 00 00 01 4b 00 94 01 40 00  Error: WP at LBA = 0x14b009401 = 5553296385

  Commands leading to the command that caused the error were:
  CR FEATR COUNT  LBA_48  LH LM LL DV DC  Powered_Up_Time  Command/Feature_Name
  -- == -- == -- == == == -- -- -- -- --  ---------------  --------------------
  61 00 08 00 40 00 00 00 00 17 d0 40 00     00:07:42.337  WRITE FPDMA QUEUED
  61 00 08 00 40 00 00 00 00 17 e0 40 00     00:07:42.336  WRITE FPDMA QUEUED
  60 00 40 00 48 00 00 00 6a a3 b2 40 00     00:07:42.336  READ FPDMA QUEUED
  61 00 10 00 40 00 00 00 00 93 48 40 00     00:07:42.336  WRITE FPDMA QUEUED
  60 00 08 00 38 00 00 00 42 aa 20 40 00     00:07:42.336  READ FPDMA QUEUED

Error 52544 [7] occurred at disk power-on lifetime: 62917 hours (2621 days + 13 hours)
  When the command that caused the error occurred, the device was active or idle.

  After command completion occurred, registers were:
  ER -- ST COUNT  LBA_48  LH LM LL DV DC
  -- -- -- == -- == == == -- -- -- -- --
  40 -- 51 00 00 00 01 4b 00 94 01 40 00  Error: UNC at LBA = 0x14b009401 = 5553296385

  Commands leading to the command that caused the error were:
  CR FEATR COUNT  LBA_48  LH LM LL DV DC  Powered_Up_Time  Command/Feature_Name
  -- == -- == -- == == == -- -- -- -- --  ---------------  --------------------
  60 00 40 00 38 00 00 00 72 b8 f8 40 00     00:07:39.162  READ FPDMA QUEUED
  60 00 08 00 40 00 00 00 42 aa 20 40 00     00:07:39.138  READ FPDMA QUEUED
  60 00 08 00 38 00 00 02 59 53 18 40 00     00:07:39.138  READ FPDMA QUEUED
  60 00 08 00 30 00 00 02 5a 39 70 40 00     00:07:39.138  READ FPDMA QUEUED
  60 00 40 00 28 00 00 01 94 4b 00 40 00     00:07:39.138  READ FPDMA QUEUED

Error 52543 [6] occurred at disk power-on lifetime: 62917 hours (2621 days + 13 hours)
  When the command that caused the error occurred, the device was active or idle.

  After command completion occurred, registers were:
  ER -- ST COUNT  LBA_48  LH LM LL DV DC
  -- -- -- == -- == == == -- -- -- -- --
  40 -- 51 00 00 00 01 4b 00 94 01 40 00  Error: UNC at LBA = 0x14b009401 = 5553296385

  Commands leading to the command that caused the error were:
  CR FEATR COUNT  LBA_48  LH LM LL DV DC  Powered_Up_Time  Command/Feature_Name
  -- == -- == -- == == == -- -- -- -- --  ---------------  --------------------
  60 00 08 00 50 00 00 00 42 aa 20 40 00     00:07:35.929  READ FPDMA QUEUED
  60 00 08 00 48 00 00 02 59 53 18 40 00     00:07:35.920  READ FPDMA QUEUED
  60 00 3c 00 48 00 00 00 73 35 60 40 00     00:07:35.920  READ FPDMA QUEUED
  60 00 40 00 28 00 00 00 69 6e cc 40 00     00:07:35.911  READ FPDMA QUEUED
  61 00 08 00 48 00 00 00 00 0e 88 40 00     00:07:35.892  WRITE FPDMA QUEUED

Error 52542 [5] occurred at disk power-on lifetime: 62917 hours (2621 days + 13 hours)
  When the command that caused the error occurred, the device was active or idle.

  After command completion occurred, registers were:
  ER -- ST COUNT  LBA_48  LH LM LL DV DC
  -- -- -- == -- == == == -- -- -- -- --
  40 -- 51 00 00 00 01 4b 00 94 01 40 00  Error: UNC at LBA = 0x14b009401 = 5553296385

  Commands leading to the command that caused the error were:
  CR FEATR COUNT  LBA_48  LH LM LL DV DC  Powered_Up_Time  Command/Feature_Name
  -- == -- == -- == == == -- -- -- -- --  ---------------  --------------------
  60 00 40 00 40 00 00 01 94 4b 00 40 00     00:07:32.675  READ FPDMA QUEUED
  60 00 08 00 38 00 00 01 62 87 08 40 00     00:07:32.675  READ FPDMA QUEUED
  60 00 40 00 30 00 00 00 03 de aa 40 00     00:07:32.675  READ FPDMA QUEUED
  60 00 40 00 28 00 00 00 88 c0 e8 40 00     00:07:32.675  READ FPDMA QUEUED
  60 00 08 00 20 00 00 03 3e 83 58 40 00     00:07:32.675  READ FPDMA QUEUED

Error 52541 [4] occurred at disk power-on lifetime: 62917 hours (2621 days + 13 hours)
  When the command that caused the error occurred, the device was active or idle.

  After command completion occurred, registers were:
  ER -- ST COUNT  LBA_48  LH LM LL DV DC
  -- -- -- == -- == == == -- -- -- -- --
  40 -- 51 00 00 00 01 4b 00 94 01 40 00  Error: WP at LBA = 0x14b009401 = 5553296385

  Commands leading to the command that caused the error were:
  CR FEATR COUNT  LBA_48  LH LM LL DV DC  Powered_Up_Time  Command/Feature_Name
  -- == -- == -- == == == -- -- -- -- --  ---------------  --------------------
  61 00 08 00 38 00 00 00 00 17 d8 40 00     00:07:29.481  WRITE FPDMA QUEUED
  61 00 08 00 38 00 00 00 00 17 e8 40 00     00:07:29.481  WRITE FPDMA QUEUED
  60 00 40 00 60 00 00 01 94 4b 00 40 00     00:07:29.481  READ FPDMA QUEUED
  60 00 80 00 48 00 00 01 70 ce 10 40 00     00:07:29.481  READ FPDMA QUEUED
  60 00 08 00 40 00 00 01 62 87 08 40 00     00:07:29.481  READ FPDMA QUEUED

Error 52540 [3] occurred at disk power-on lifetime: 62917 hours (2621 days + 13 hours)
  When the command that caused the error occurred, the device was active or idle.

  After command completion occurred, registers were:
  ER -- ST COUNT  LBA_48  LH LM LL DV DC
  -- -- -- == -- == == == -- -- -- -- --
  40 -- 51 00 00 00 01 4b 00 94 01 40 00  Error: WP at LBA = 0x14b009401 = 5553296385

  Commands leading to the command that caused the error were:
  CR FEATR COUNT  LBA_48  LH LM LL DV DC  Powered_Up_Time  Command/Feature_Name
  -- == -- == -- == == == -- -- -- -- --  ---------------  --------------------
  61 00 08 00 48 00 00 00 00 17 e0 40 00     00:07:26.275  WRITE FPDMA QUEUED
  60 00 40 00 60 00 00 00 03 de aa 40 00     00:07:26.262  READ FPDMA QUEUED
  60 00 40 00 58 00 00 00 88 c0 e8 40 00     00:07:26.254  READ FPDMA QUEUED
  60 00 40 00 40 00 00 00 73 35 18 40 00     00:07:26.248  READ FPDMA QUEUED
  60 00 40 00 30 00 00 00 03 db d2 40 00     00:07:26.244  READ FPDMA QUEUED

Error 52539 [2] occurred at disk power-on lifetime: 62917 hours (2621 days + 13 hours)
  When the command that caused the error occurred, the device was active or idle.

  After command completion occurred, registers were:
  ER -- ST COUNT  LBA_48  LH LM LL DV DC
  -- -- -- == -- == == == -- -- -- -- --
  40 -- 51 00 00 00 01 4b 00 94 01 40 00  Error: UNC at LBA = 0x14b009401 = 5553296385

  Commands leading to the command that caused the error were:
  CR FEATR COUNT  LBA_48  LH LM LL DV DC  Powered_Up_Time  Command/Feature_Name
  -- == -- == -- == == == -- -- -- -- --  ---------------  --------------------
  60 00 80 00 68 00 00 00 42 ab 20 40 00     00:07:22.933  READ FPDMA QUEUED
  60 00 40 00 60 00 00 00 03 d2 9a 40 00     00:07:22.926  READ FPDMA QUEUED
  60 00 40 00 60 00 00 00 03 d1 9a 40 00     00:07:22.925  READ FPDMA QUEUED
  61 00 08 00 60 00 00 00 02 34 b8 40 00     00:07:22.920  WRITE FPDMA QUEUED
  60 00 10 00 48 00 00 00 69 6e 34 40 00     00:07:22.920  READ FPDMA QUEUED

SMART Extended Self-test Log Version: 1 (1 sectors)
No self-tests have been logged.  [To run self-tests, use: smartctl -t]

SMART Selective self-test log data structure revision number 1
 SPAN  MIN_LBA  MAX_LBA  CURRENT_TEST_STATUS
    1        0        0  Not_testing
    2        0        0  Not_testing
    3        0        0  Not_testing
    4        0        0  Not_testing
    5        0        0  Not_testing
Selective self-test flags (0x0):
  After scanning selected spans, do NOT read-scan remainder of disk.
If Selective self-test is pending on power-up, resume after 0 minute delay.

SCT Status Version:                  2
SCT Version (vendor specific):       258 (0x0102)
Device State:                        Active (0)
Current Temperature:                    41 Celsius
Power Cycle Min/Max Temperature:     41/42 Celsius
Lifetime    Min/Max Temperature:     41/67 Celsius
Under/Over Temperature Limit Count:   0/0

SCT Temperature History Version:     2
Temperature Sampling Period:         1 minute
Temperature Logging Interval:        1 minute
Min/Max recommended Temperature:      0/60 Celsius
Min/Max Temperature Limit:           -41/85 Celsius
Temperature History Size (Index):    128 (43)

SCT Error Recovery Control:
           Read: Disabled
          Write: Disabled

Device Statistics (GP/SMART Log 0x04) not supported

Pending Defects log (GP Log 0x0c) not supported

SATA Phy Event Counters (GP Log 0x11)
ID      Size     Value  Description
0x0001  2            0  Command failed due to ICRC error
0x0002  2            0  R_ERR response for data FIS
0x0003  2            0  R_ERR response for device-to-host data FIS
0x0004  2            0  R_ERR response for host-to-device data FIS
0x0005  2            0  R_ERR response for non-data FIS
0x0006  2            0  R_ERR response for device-to-host non-data FIS
0x0007  2            0  R_ERR response for host-to-device non-data FIS
0x000a  2           46  Device-to-host register FISes sent due to a COMRESET
0x8000  4         8752  Vendor specific

