smartctl 7.1 2019-12-30 r5022 [FreeBSD 12.1-RELEASE amd64] (local build)
Copyright (C) 2002-19, Bruce Allen, Christian Franke, www.smartmontools.org

=== START OF INFORMATION SECTION ===
Model Family:     Seagate Barracuda 7200.11
Device Model:     ST31500341AS
Serial Number:    --
LU WWN Device Id: 5 000c50 ...
Firmware Version: CC1H
User Capacity:    1,500,300,828,160 bytes [1.50 TB]
Sector Size:      512 bytes logical/physical
Rotation Rate:    7200 rpm
Device is:        In smartctl database [for details use: -P show]
ATA Version is:   ATA8-ACS T13/1699-D revision 4
SATA Version is:  SATA 2.6, 3.0 Gb/s
Local Time is:    Wed Feb 10 06:20:07 2021 EST
SMART support is: Available - device has SMART capability.
SMART support is: Enabled
AAM feature is:   Disabled
APM feature is:   Unavailable
Rd look-ahead is: Enabled
Write cache is:   Enabled
DSN feature is:   Unavailable
ATA Security is:  Disabled, frozen [SEC2]
Wt Cache Reorder: Unknown

=== START OF READ SMART DATA SECTION ===
SMART overall-health self-assessment test result: PASSED
See vendor-specific Attribute list for marginal Attributes.

General SMART Values:
Offline data collection status:  (0x82)	Offline data collection activity
					was completed without error.
					Auto Offline Data Collection: Enabled.
Self-test execution status:      (   0)	The previous self-test routine completed
					without error or no self-test has ever 
					been run.
Total time to complete Offline 
data collection: 		(  617) seconds.
Offline data collection
capabilities: 			 (0x7b) SMART execute Offline immediate.
					Auto Offline data collection on/off support.
					Suspend Offline collection upon new
					command.
					Offline surface scan supported.
					Self-test supported.
					Conveyance Self-test supported.
					Selective Self-test supported.
SMART capabilities:            (0x0003)	Saves SMART data before entering
					power-saving mode.
					Supports SMART auto save timer.
Error logging capability:        (0x01)	Error logging supported.
					General Purpose Logging supported.
Short self-test routine 
recommended polling time: 	 (   1) minutes.
Extended self-test routine
recommended polling time: 	 ( 294) minutes.
Conveyance self-test routine
recommended polling time: 	 (   2) minutes.
SCT capabilities: 	       (0x103f)	SCT Status supported.
					SCT Error Recovery Control supported.
					SCT Feature Control supported.
					SCT Data Table supported.

SMART Attributes Data Structure revision number: 10
Vendor Specific SMART Attributes with Thresholds:
ID# ATTRIBUTE_NAME          FLAGS    VALUE WORST THRESH FAIL RAW_VALUE
  1 Raw_Read_Error_Rate     POSR--   119   099   006    -    201378728
  3 Spin_Up_Time            PO----   098   092   000    -    0
  4 Start_Stop_Count        -O--CK   096   096   020    -    4311
  5 Reallocated_Sector_Ct   PO--CK   100   100   036    -    10
  7 Seek_Error_Rate         POSR--   078   060   030    -    66085722
  9 Power_On_Hours          -O--CK   094   094   000    -    5697
 10 Spin_Retry_Count        PO--C-   100   100   097    -    0
 12 Power_Cycle_Count       -O--CK   096   037   020    -    4514
184 End-to-End_Error        -O--CK   100   100   099    -    0
187 Reported_Uncorrect      -O--CK   099   099   000    -    1
188 Command_Timeout         -O--CK   100   092   000    -    4295230605
189 High_Fly_Writes         -O-RCK   001   001   000    -    199
190 Airflow_Temperature_Cel -O---K   066   039   045    Past 34 (16 134 34 22 0)
194 Temperature_Celsius     -O---K   034   061   000    -    34 (0 15 0 0 0)
195 Hardware_ECC_Recovered  -O-RC-   042   023   000    -    201378728
197 Current_Pending_Sector  -O--C-   100   100   000    -    0
198 Offline_Uncorrectable   ----C-   100   100   000    -    0
199 UDMA_CRC_Error_Count    -OSRCK   200   200   000    -    0
240 Head_Flying_Hours       ------   100   253   000    -    5627 (192 199 0)
241 Total_LBAs_Written      ------   100   253   000    -    4256112907
242 Total_LBAs_Read         ------   100   253   000    -    271413999
                            ||||||_ K auto-keep
                            |||||__ C event count
                            ||||___ R error rate
                            |||____ S speed/performance
                            ||_____ O updated online
                            |______ P prefailure warning

General Purpose Log Directory Version 1
SMART           Log Directory Version 1 [multi-sector log support]
Address    Access  R/W   Size  Description
0x00       GPL,SL  R/O      1  Log Directory
0x01       GPL,SL  R/O      1  Summary SMART error log
0x02       GPL,SL  R/O      5  Comprehensive SMART error log
0x03       GPL,SL  R/O      5  Ext. Comprehensive SMART error log
0x06       GPL,SL  R/O      1  SMART self-test log
0x07       GPL,SL  R/O      1  Extended self-test log
0x09       GPL,SL  R/W      1  Selective self-test log
0x10       GPL,SL  R/O      1  NCQ Command Error log
0x11       GPL,SL  R/O      1  SATA Phy Event Counters log
0x21       GPL,SL  R/O      1  Write stream error log
0x22       GPL,SL  R/O      1  Read stream error log
0x80-0x9f  GPL,SL  R/W     16  Host vendor specific log
0xa1       GPL,SL  VS      20  Device vendor specific log
0xa2       GPL     VS    2248  Device vendor specific log
0xa8       GPL,SL  VS     129  Device vendor specific log
0xa9       GPL,SL  VS       1  Device vendor specific log
0xb0       GPL     VS    2928  Device vendor specific log
0xbe-0xbf  GPL     VS   65535  Device vendor specific log
0xe0       GPL,SL  R/W      1  SCT Command/Status
0xe1       GPL,SL  R/W      1  SCT Data Transfer

SMART Extended Comprehensive Error Log Version: 1 (5 sectors)
Device Error Count: 1
	CR     = Command Register
	FEATR  = Features Register
	COUNT  = Count (was: Sector Count) Register
	LBA_48 = Upper bytes of LBA High/Mid/Low Registers ]  ATA-8
	LH     = LBA High (was: Cylinder High) Register    ]   LBA
	LM     = LBA Mid (was: Cylinder Low) Register      ] Register
	LL     = LBA Low (was: Sector Number) Register     ]
	DV     = Device (was: Device/Head) Register
	DC     = Device Control Register
	ER     = Error register
	ST     = Status register
Powered_Up_Time is measured from power on, and printed as
DDd+hh:mm:SS.sss where DD=days, hh=hours, mm=minutes,
SS=sec, and sss=millisec. It "wraps" after 49.710 days.

Error 1 [0] occurred at disk power-on lifetime: 4916 hours (204 days + 20 hours)
  When the command that caused the error occurred, the device was active or idle.

  After command completion occurred, registers were:
  ER -- ST COUNT  LBA_48  LH LM LL DV DC
  -- -- -- == -- == == == -- -- -- -- --
  40 -- 51 00 00 00 57 4e 00 44 59 00 00  Error: WP at LBA = 0x574e004459 = 374970795097

  Commands leading to the command that caused the error were:
  CR FEATR COUNT  LBA_48  LH LM LL DV DC  Powered_Up_Time  Command/Feature_Name
  -- == -- == -- == == == -- -- -- -- --  ---------------  --------------------
  61 00 00 00 08 00 1c 09 00 80 b0 40 00     00:01:01.482  WRITE FPDMA QUEUED
  61 00 00 00 08 00 1c 09 00 80 a0 40 00     00:01:01.482  WRITE FPDMA QUEUED
  61 00 00 00 08 00 1c 09 00 80 80 40 00     00:01:01.482  WRITE FPDMA QUEUED
  61 00 00 00 10 00 1c 13 00 40 e0 40 00     00:01:01.481  WRITE FPDMA QUEUED
  61 00 00 00 08 00 1c 0c 00 40 c8 40 00     00:01:01.481  WRITE FPDMA QUEUED

SMART Extended Self-test Log Version: 1 (1 sectors)
Num  Test_Description    Status                  Remaining  LifeTime(hours)  LBA_of_first_error
# 1  Short offline       Completed without error       00%      5683         -
# 2  Short offline       Completed without error       00%      5678         -
# 3  Short offline       Completed without error       00%      5669         -
# 4  Short offline       Completed without error       00%      5467         -
# 5  Short offline       Completed without error       00%      5463         -
# 6  Short offline       Completed without error       00%      5460         -
# 7  Short offline       Completed without error       00%      5458         -
# 8  Short offline       Completed without error       00%      5454         -
# 9  Short offline       Completed without error       00%      5449         -
#10  Short offline       Completed without error       00%      5442         -
#11  Short offline       Completed without error       00%      5437         -
#12  Short offline       Completed without error       00%      5409         -
#13  Short offline       Interrupted (host reset)      00%      5408         -
#14  Extended offline    Interrupted (host reset)      00%      5384         -
#15  Short offline       Completed without error       00%      5364         -
#16  Short offline       Completed without error       00%      5358         -
#17  Short offline       Completed without error       00%      5352         -
#18  Extended offline    Interrupted (host reset)      80%      5240         -
#19  Short offline       Completed without error       00%      5239         -

SMART Selective self-test log data structure revision number 1
 SPAN  MIN_LBA  MAX_LBA  CURRENT_TEST_STATUS
    1        0        0  Not_testing
    2        0        0  Not_testing
    3        0        0  Not_testing
    4        0        0  Not_testing
    5        0        0  Not_testing
Selective self-test flags (0x0):
  After scanning selected spans, do NOT read-scan remainder of disk.
If Selective self-test is pending on power-up, resume after 0 minute delay.

SCT Status Version:                  3
SCT Version (vendor specific):       522 (0x020a)
Device State:                        Active (0)
Current Temperature:                    34 Celsius
Power Cycle Min/Max Temperature:     22/34 Celsius
Lifetime    Min/Max Temperature:     15/61 Celsius
Under/Over Temperature Limit Count:   0/0

SCT Temperature History Version:     2
Temperature Sampling Period:         1 minute
Temperature Logging Interval:        1 minute
Min/Max recommended Temperature:     14/55 Celsius
Min/Max Temperature Limit:           10/60 Celsius
Temperature History Size (Index):    128 (51)

SCT Error Recovery Control:
           Read: Disabled
          Write: Disabled

Device Statistics (GP/SMART Log 0x04) not supported

Pending Defects log (GP Log 0x0c) not supported

SATA Phy Event Counters (GP Log 0x11)
ID      Size     Value  Description
0x000a  2            3  Device-to-host register FISes sent due to a COMRESET
0x0001  2            0  Command failed due to ICRC error
0x0003  2            0  R_ERR response for device-to-host data FIS
0x0004  2            0  R_ERR response for host-to-device data FIS
0x0006  2            0  R_ERR response for device-to-host non-data FIS
0x0007  2            0  R_ERR response for host-to-device non-data FIS



