smartctl 7.3 2022-02-28 r5338 [FreeBSD 13.1-RELEASE-p2 amd64] (local build)
Copyright (C) 2002-22, Bruce Allen, Christian Franke, www.smartmontools.org

=== START OF INFORMATION SECTION ===
Model Number:                       INTEL MEMPEK1J016GAD
Serial Number:                      --
Firmware Version:                   K4110420
PCI Vendor/Subsystem ID:            0x8086
IEEE OUI Identifier:                0x5cd2e4
Controller ID:                      0
NVMe Version:                       <1.2
Number of Namespaces:               1
Namespace 1 Size/Capacity:          14,403,239,936 [14.4 GB]
Namespace 1 Formatted LBA Size:     512
Namespace 1 IEEE EUI-64:            5cd2e4 ...
Local Time is:                      Wed Nov  2 11:29:21 2022 EDT
Firmware Updates (0x02):            1 Slot
Optional Admin Commands (0x0006):   Format Frmw_DL
Optional NVM Commands (0x0046):     Wr_Unc DS_Mngmt Timestmp
Log Page Attributes (0x02):         Cmd_Eff_Lg
Maximum Data Transfer Size:         32 Pages

Supported Power States
St Op     Max   Active     Idle   RL RT WL WT  Ent_Lat  Ex_Lat
 0 +     2.80W       -        -    0  0  0  0  1000000   30000
 1 +     2.20W       -        -    0  1  0  1  1000000   30000
 2 +     1.80W       -        -    0  2  0  2  1000000   30000
 3 -   0.0080W       -        -    0  0  0  0  1150000   30000

Supported LBA Sizes (NSID 0x1)
Id Fmt  Data  Metadt  Rel_Perf
 0 +     512       0         2

=== START OF SMART DATA SECTION ===
SMART overall-health self-assessment test result: PASSED

SMART/Health Information (NVMe Log 0x02)
Critical Warning:                   0x00
Temperature:                        37 Celsius
Available Spare:                    100%
Available Spare Threshold:          0%
Percentage Used:                    2%
Data Units Read:                    224,769 [115 GB]
Data Units Written:                 16,238,742 [8.31 TB]
Host Read Commands:                 7,303,072
Host Write Commands:                346,632,917
Controller Busy Time:               0
Power Cycles:                       51
Power On Hours:                     1,138,119
Unsafe Shutdowns:                   30
Media and Data Integrity Errors:    0
Error Information Log Entries:      0

Error Information (NVMe Log 0x01, 16 of 64 entries)
No Errors Logged

