smartctl 7.2 2020-12-30 r5155 [FreeBSD 12.2-RELEASE amd64] (local build)
Copyright (C) 2002-20, Bruce Allen, Christian Franke, www.smartmontools.org

=== START OF INFORMATION SECTION ===
Model Number:                       Samsung SSD 960 PRO 512GB
Serial Number:                      --
Firmware Version:                   4B6QCXP7
PCI Vendor/Subsystem ID:            0x144d
IEEE OUI Identifier:                0x002538
Total NVM Capacity:                 512,110,190,592 [512 GB]
Unallocated NVM Capacity:           0
Controller ID:                      2
NVMe Version:                       1.2
Number of Namespaces:               1
Namespace 1 Size/Capacity:          512,110,190,592 [512 GB]
Namespace 1 Formatted LBA Size:     512
Namespace 1 IEEE EUI-64:            002538 ...
Local Time is:                      Wed Aug  4 17:46:41 2021 EDT
Firmware Updates (0x16):            3 Slots, no Reset required
Optional Admin Commands (0x0007):   Security Format Frmw_DL
Optional NVM Commands (0x001f):     Comp Wr_Unc DS_Mngmt Wr_Zero Sav/Sel_Feat
Log Page Attributes (0x03):         S/H_per_NS Cmd_Eff_Lg
Maximum Data Transfer Size:         512 Pages
Warning  Comp. Temp. Threshold:     73 Celsius
Critical Comp. Temp. Threshold:     76 Celsius

Supported Power States
St Op     Max   Active     Idle   RL RT WL WT  Ent_Lat  Ex_Lat
 0 +     6.90W       -        -    0  0  0  0        0       0
 1 +     5.50W       -        -    1  1  1  1        0       0
 2 +     5.10W       -        -    2  2  2  2        0       0
 3 -   0.0500W       -        -    3  3  3  3      210    1200
 4 -   0.0080W       -        -    4  4  4  4     2000    6000

Supported LBA Sizes (NSID 0x1)
Id Fmt  Data  Metadt  Rel_Perf
 0 +     512       0         0

=== START OF SMART DATA SECTION ===
SMART overall-health self-assessment test result: PASSED

SMART/Health Information (NVMe Log 0x02)
Critical Warning:                   0x00
Temperature:                        45 Celsius
Available Spare:                    100%
Available Spare Threshold:          10%
Percentage Used:                    0%
Data Units Read:                    4,223,412 [2.16 TB]
Data Units Written:                 5,086,149 [2.60 TB]
Host Read Commands:                 73,905,087
Host Write Commands:                71,359,110
Controller Busy Time:               322
Power Cycles:                       262
Power On Hours:                     466
Unsafe Shutdowns:                   35
Media and Data Integrity Errors:    0
Error Information Log Entries:      732
Warning  Comp. Temperature Time:    0
Critical Comp. Temperature Time:    0
Temperature Sensor 1:               45 Celsius
Temperature Sensor 2:               59 Celsius

Error Information (NVMe Log 0x01, 16 of 64 entries)
Num   ErrCount  SQId   CmdId  Status  PELoc          LBA  NSID    VS
  0        732     0  0x00c5  0x4004  0x028            0     1     -
  1        731     0  0x00c3  0x4004      -            0     1     -
  2        730     0  0x00bf  0x4004  0x028            0     1     -
  3        729     0  0x00be  0x4004      -            0     1     -
  4        728     0  0x001f  0x4004  0x028            0     1     -
  5        727     0  0x001e  0x4004      -            0     1     -
  6        726     0  0x001a  0x4212  0x028            0     -     -
  7        725     0  0x0004  0x4212  0x028            0     -     -
  8        724     0  0x0024  0x4004  0x028            0     1     -
  9        723     0  0x0023  0x4004      -            0     1     -
 10        722     0  0x001f  0x4212  0x028            0     -     -
 11        721     0  0x0004  0x4004  0x028            0     0     -
 12        720     0  0x0003  0x4004      -            0     1     -
 13        719     0  0x0001  0x4004      -            0     -     -
 14        718     0  0x0024  0x4004  0x028            0     1     -
 15        717     0  0x0023  0x4004      -            0     1     -
... (48 entries not read)

