smartctl 7.4 2023-08-01 r5530 [FreeBSD 13.2-RELEASE-p10 amd64] (local build)
Copyright (C) 2002-23, Bruce Allen, Christian Franke, www.smartmontools.org

=== START OF INFORMATION SECTION ===
Model Number:                       Samsung SSD 960 PRO 512GB
Serial Number:                      --
Firmware Version:                   2B6QCXP7
PCI Vendor/Subsystem ID:            0x144d
IEEE OUI Identifier:                0x002538
Total NVM Capacity:                 512,110,190,592 [512 GB]
Unallocated NVM Capacity:           0
Controller ID:                      2
NVMe Version:                       1.2
Number of Namespaces:               1
Namespace 1 Size/Capacity:          512,110,190,592 [512 GB]
Namespace 1 Formatted LBA Size:     512
Namespace 1 IEEE EUI-64:            002538 ...
Local Time is:                      Wed Feb 28 22:56:10 2024 CET
Firmware Updates (0x16):            3 Slots, no Reset required
Optional Admin Commands (0x0007):   Security Format Frmw_DL
Optional NVM Commands (0x001f):     Comp Wr_Unc DS_Mngmt Wr_Zero Sav/Sel_Feat
Log Page Attributes (0x03):         S/H_per_NS Cmd_Eff_Lg
Maximum Data Transfer Size:         512 Pages
Warning  Comp. Temp. Threshold:     73 Celsius
Critical Comp. Temp. Threshold:     76 Celsius

Supported Power States
St Op     Max   Active     Idle   RL RT WL WT  Ent_Lat  Ex_Lat
 0 +     6.90W       -        -    0  0  0  0        0       0
 1 +     5.50W       -        -    1  1  1  1        0       0
 2 +     5.10W       -        -    2  2  2  2        0       0
 3 -   0.0500W       -        -    3  3  3  3      210    1200
 4 -   0.0080W       -        -    4  4  4  4     2000    6000

Supported LBA Sizes (NSID 0x1)
Id Fmt  Data  Metadt  Rel_Perf
 0 +     512       0         0

=== START OF SMART DATA SECTION ===
SMART overall-health self-assessment test result: PASSED

SMART/Health Information (NVMe Log 0x02)
Critical Warning:                   0x00
Temperature:                        42 Celsius
Available Spare:                    100%
Available Spare Threshold:          10%
Percentage Used:                    24%
Data Units Read:                    109,371,651 [55.9 TB]
Data Units Written:                 301,026,060 [154 TB]
Host Read Commands:                 1,873,673,653
Host Write Commands:                5,661,314,250
Controller Busy Time:               37,319
Power Cycles:                       188
Power On Hours:                     36,685
Unsafe Shutdowns:                   136
Media and Data Integrity Errors:    0
Error Information Log Entries:      288
Warning  Comp. Temperature Time:    3972
Critical Comp. Temperature Time:    10006
Temperature Sensor 1:               42 Celsius
Temperature Sensor 2:               61 Celsius

Error Information (NVMe Log 0x01, 16 of 64 entries)
Num   ErrCount  SQId   CmdId  Status  PELoc          LBA  NSID    VS  Message
  0        288     0  0x0009  0x4202  0x028            0     0     -  Invalid Queue Identifier
  1        287     0  0x0009  0x4202  0x028            0     0     -  Invalid Queue Identifier
  2        286     0  0x0009  0x4202  0x028            0     0     -  Invalid Queue Identifier
  3        285     0  0x0009  0x4202  0x028            0     0     -  Invalid Queue Identifier
  4        284     0  0x0009  0x4202  0x028            0     0     -  Invalid Queue Identifier
  5        283     0  0x0009  0x4202  0x028            0     0     -  Invalid Queue Identifier
  6        282     0  0x0009  0x4202  0x028            0     0     -  Invalid Queue Identifier
  7        281     0  0x0009  0x4202  0x028            0     0     -  Invalid Queue Identifier
  8        280     0  0x0009  0x4202  0x028            0     0     -  Invalid Queue Identifier
  9        279     0  0x0009  0x4202  0x028            0     0     -  Invalid Queue Identifier
 10        278     0  0x0009  0x4202  0x028            0     0     -  Invalid Queue Identifier
 11        277     0  0x0009  0x4202  0x028            0     0     -  Invalid Queue Identifier
 12        276     0  0x0009  0x4202  0x028            0     0     -  Invalid Queue Identifier
 13        275     0  0x0009  0x4202  0x028            0     0     -  Invalid Queue Identifier
 14        274     0  0x0011  0x421a  0x028            0     0     -  Feature Identifier Not Saveable
 15        273     0  0x0011  0x421a  0x028            0     0     -  Feature Identifier Not Saveable
... (48 entries not read)

Self-tests not supported

