smartctl 7.2 2020-12-30 r5155 [FreeBSD 13.0-RELEASE amd64] (local build)
Copyright (C) 2002-20, Bruce Allen, Christian Franke, www.smartmontools.org

=== START OF INFORMATION SECTION ===
Model Family:     Western Digital Caviar Blue Serial ATA
Device Model:     WDC WD3200AAJS-22B4A0
Serial Number:    --
LU WWN Device Id: 5 0014ee ...
Firmware Version: 01.03A01
User Capacity:    320,072,933,376 bytes [320 GB]
Sector Size:      512 bytes logical/physical
Device is:        In smartctl database [for details use: -P show]
ATA Version is:   ATA8-ACS (minor revision not indicated)
SATA Version is:  SATA 2.5, 3.0 Gb/s
Local Time is:    Fri Feb 11 23:23:50 2022 EST
SMART support is: Available - device has SMART capability.
SMART support is: Enabled
AAM feature is:   Disabled
APM feature is:   Unavailable
Rd look-ahead is: Enabled
Write cache is:   Enabled
DSN feature is:   Unavailable
ATA Security is:  Disabled, frozen [SEC2]
Wt Cache Reorder: Enabled

=== START OF READ SMART DATA SECTION ===
SMART overall-health self-assessment test result: PASSED

General SMART Values:
Offline data collection status:  (0x82)	Offline data collection activity
					was completed without error.
					Auto Offline Data Collection: Enabled.
Self-test execution status:      (   0)	The previous self-test routine completed
					without error or no self-test has ever 
					been run.
Total time to complete Offline 
data collection: 		( 5760) seconds.
Offline data collection
capabilities: 			 (0x7b) SMART execute Offline immediate.
					Auto Offline data collection on/off support.
					Suspend Offline collection upon new
					command.
					Offline surface scan supported.
					Self-test supported.
					Conveyance Self-test supported.
					Selective Self-test supported.
SMART capabilities:            (0x0003)	Saves SMART data before entering
					power-saving mode.
					Supports SMART auto save timer.
Error logging capability:        (0x01)	Error logging supported.
					General Purpose Logging supported.
Short self-test routine 
recommended polling time: 	 (   2) minutes.
Extended self-test routine
recommended polling time: 	 (  70) minutes.
Conveyance self-test routine
recommended polling time: 	 (   5) minutes.
SCT capabilities: 	       (0x303f)	SCT Status supported.
					SCT Error Recovery Control supported.
					SCT Feature Control supported.
					SCT Data Table supported.

SMART Attributes Data Structure revision number: 16
Vendor Specific SMART Attributes with Thresholds:
ID# ATTRIBUTE_NAME          FLAGS    VALUE WORST THRESH FAIL RAW_VALUE
  1 Raw_Read_Error_Rate     POSR-K   199   197   051    -    165865
  3 Spin_Up_Time            POS--K   154   141   021    -    3275
  4 Start_Stop_Count        -O--CK   098   098   000    -    2033
  5 Reallocated_Sector_Ct   PO--CK   199   199   140    -    4
  7 Seek_Error_Rate         -OSR-K   200   200   000    -    0
  9 Power_On_Hours          -O--CK   028   028   000    -    53052
 10 Spin_Retry_Count        -O--CK   100   100   000    -    0
 11 Calibration_Retry_Count -O--CK   100   100   000    -    0
 12 Power_Cycle_Count       -O--CK   099   099   000    -    1700
192 Power-Off_Retract_Count -O--CK   200   200   000    -    577
193 Load_Cycle_Count        -O--CK   200   200   000    -    2033
194 Temperature_Celsius     -O---K   100   083   000    -    43
196 Reallocated_Event_Count -O--CK   128   128   000    -    72
197 Current_Pending_Sector  -O--CK   200   183   000    -    0
198 Offline_Uncorrectable   ----CK   200   190   000    -    8
199 UDMA_CRC_Error_Count    -O--CK   200   200   000    -    0
200 Multi_Zone_Error_Rate   ---R--   200   183   000    -    18
                            ||||||_ K auto-keep
                            |||||__ C event count
                            ||||___ R error rate
                            |||____ S speed/performance
                            ||_____ O updated online
                            |______ P prefailure warning

General Purpose Log Directory Version 1
SMART           Log Directory Version 1 [multi-sector log support]
Address    Access  R/W   Size  Description
0x00       GPL,SL  R/O      1  Log Directory
0x01           SL  R/O      1  Summary SMART error log
0x02           SL  R/O      5  Comprehensive SMART error log
0x03       GPL     R/O      6  Ext. Comprehensive SMART error log
0x06           SL  R/O      1  SMART self-test log
0x07       GPL     R/O      1  Extended self-test log
0x09           SL  R/W      1  Selective self-test log
0x10       GPL     R/O      1  NCQ Command Error log
0x11       GPL     R/O      1  SATA Phy Event Counters log
0x80-0x9f  GPL,SL  R/W     16  Host vendor specific log
0xa0-0xa7  GPL,SL  VS      16  Device vendor specific log
0xa8-0xb7  GPL,SL  VS       1  Device vendor specific log
0xc0       GPL,SL  VS       1  Device vendor specific log
0xc1       GPL     VS      24  Device vendor specific log
0xe0       GPL,SL  R/W      1  SCT Command/Status
0xe1       GPL,SL  R/W      1  SCT Data Transfer

SMART Extended Comprehensive Error Log Version: 1 (6 sectors)
Device Error Count: 22729 (device log contains only the most recent 24 errors)
	CR     = Command Register
	FEATR  = Features Register
	COUNT  = Count (was: Sector Count) Register
	LBA_48 = Upper bytes of LBA High/Mid/Low Registers ]  ATA-8
	LH     = LBA High (was: Cylinder High) Register    ]   LBA
	LM     = LBA Mid (was: Cylinder Low) Register      ] Register
	LL     = LBA Low (was: Sector Number) Register     ]
	DV     = Device (was: Device/Head) Register
	DC     = Device Control Register
	ER     = Error register
	ST     = Status register
Powered_Up_Time is measured from power on, and printed as
DDd+hh:mm:SS.sss where DD=days, hh=hours, mm=minutes,
SS=sec, and sss=millisec. It "wraps" after 49.710 days.

Error 22729 [8] occurred at disk power-on lifetime: 52914 hours (2204 days + 18 hours)
  When the command that caused the error occurred, the device was active or idle.

  After command completion occurred, registers were:
  ER -- ST COUNT  LBA_48  LH LM LL DV DC
  -- -- -- == -- == == == -- -- -- -- --
  40 -- 51 00 00 00 01 ab 00 bd 18 40 00  Error: UNC at LBA = 0x1ab00bd18 = 7163919640

  Commands leading to the command that caused the error were:
  CR FEATR COUNT  LBA_48  LH LM LL DV DC  Powered_Up_Time  Command/Feature_Name
  -- == -- == -- == == == -- -- -- -- --  ---------------  --------------------
  60 00 08 00 80 00 00 01 bd ab 18 40 08     00:07:17.223  READ FPDMA QUEUED
  60 00 20 00 78 00 00 00 0a 40 a0 40 08     00:07:17.212  READ FPDMA QUEUED
  60 00 48 00 70 00 00 00 8f 7d b8 40 08     00:07:17.198  READ FPDMA QUEUED
  60 00 80 00 68 00 00 00 8f 7d 38 40 08     00:07:17.198  READ FPDMA QUEUED
  60 00 20 00 60 00 00 00 8f 7d 18 40 08     00:07:17.198  READ FPDMA QUEUED

Error 22728 [7] occurred at disk power-on lifetime: 52914 hours (2204 days + 18 hours)
  When the command that caused the error occurred, the device was active or idle.

  After command completion occurred, registers were:
  ER -- ST COUNT  LBA_48  LH LM LL DV DC
  -- -- -- == -- == == == -- -- -- -- --
  40 -- 51 00 00 00 01 ab 00 bd 18 40 00  Error: UNC at LBA = 0x1ab00bd18 = 7163919640

  Commands leading to the command that caused the error were:
  CR FEATR COUNT  LBA_48  LH LM LL DV DC  Powered_Up_Time  Command/Feature_Name
  -- == -- == -- == == == -- -- -- -- --  ---------------  --------------------
  60 00 08 00 88 00 00 01 bd ab 18 40 08     00:07:13.785  READ FPDMA QUEUED
  60 00 20 00 f8 00 00 00 16 3e c0 40 08     00:07:13.785  READ FPDMA QUEUED
  61 00 08 00 b8 00 00 03 3a f5 10 40 08     00:07:13.785  WRITE FPDMA QUEUED
  61 00 68 00 b0 00 00 03 3a f4 98 40 08     00:07:13.785  WRITE FPDMA QUEUED
  60 00 08 00 a8 00 00 01 bd a6 c8 40 08     00:07:13.785  READ FPDMA QUEUED

Error 22727 [6] occurred at disk power-on lifetime: 52914 hours (2204 days + 18 hours)
  When the command that caused the error occurred, the device was active or idle.

  After command completion occurred, registers were:
  ER -- ST COUNT  LBA_48  LH LM LL DV DC
  -- -- -- == -- == == == -- -- -- -- --
  40 -- 51 00 00 00 01 ab 00 bd 18 40 00  Error: UNC at LBA = 0x1ab00bd18 = 7163919640

  Commands leading to the command that caused the error were:
  CR FEATR COUNT  LBA_48  LH LM LL DV DC  Powered_Up_Time  Command/Feature_Name
  -- == -- == -- == == == -- -- -- -- --  ---------------  --------------------
  60 04 88 00 d8 00 00 01 bd a6 a8 40 08     00:07:10.574  READ FPDMA QUEUED
  60 04 88 00 d0 00 00 01 bd a2 20 40 08     00:07:10.569  READ FPDMA QUEUED
  60 04 58 00 c8 00 00 01 bd 9d c8 40 08     00:07:10.544  READ FPDMA QUEUED
  60 00 08 00 c0 00 00 01 bd 9d b0 40 08     00:07:10.543  READ FPDMA QUEUED
  60 00 08 00 b8 00 00 01 bd 99 40 40 08     00:07:10.542  READ FPDMA QUEUED

Error 22726 [5] occurred at disk power-on lifetime: 52914 hours (2204 days + 18 hours)
  When the command that caused the error occurred, the device was active or idle.

  After command completion occurred, registers were:
  ER -- ST COUNT  LBA_48  LH LM LL DV DC
  -- -- -- == -- == == == -- -- -- -- --
  40 -- 51 00 fe 00 01 9c 00 bd 62 40 00  Error: UNC at LBA = 0x19c00bd62 = 6912261474

  Commands leading to the command that caused the error were:
  CR FEATR COUNT  LBA_48  LH LM LL DV DC  Powered_Up_Time  Command/Feature_Name
  -- == -- == -- == == == -- -- -- -- --  ---------------  --------------------
  60 04 a8 00 20 00 00 01 bd 99 20 40 08     00:07:06.937  READ FPDMA QUEUED
  60 04 b8 00 18 00 00 01 bd 94 68 40 08     00:07:06.258  READ FPDMA QUEUED
  60 02 78 00 10 00 00 01 bd 91 f0 40 08     00:07:06.255  READ FPDMA QUEUED
  60 02 08 00 08 00 00 01 bd 8f e8 40 08     00:07:06.244  READ FPDMA QUEUED
  60 02 28 00 00 00 00 01 bd 8d c0 40 08     00:07:06.242  READ FPDMA QUEUED

Error 22725 [4] occurred at disk power-on lifetime: 52914 hours (2204 days + 18 hours)
  When the command that caused the error occurred, the device was active or idle.

  After command completion occurred, registers were:
  ER -- ST COUNT  LBA_48  LH LM LL DV DC
  -- -- -- == -- == == == -- -- -- -- --
  40 -- 51 00 00 00 01 ab 00 bd 18 40 00  Error: UNC at LBA = 0x1ab00bd18 = 7163919640

  Commands leading to the command that caused the error were:
  CR FEATR COUNT  LBA_48  LH LM LL DV DC  Powered_Up_Time  Command/Feature_Name
  -- == -- == -- == == == -- -- -- -- --  ---------------  --------------------
  60 00 08 00 b0 00 00 01 bd ab 18 40 08     01:10:31.962  READ FPDMA QUEUED
  61 00 08 00 70 00 00 00 77 37 38 40 08     01:10:31.091  WRITE FPDMA QUEUED
  61 00 08 00 f0 00 00 02 7d be a0 40 08     01:10:29.773  WRITE FPDMA QUEUED
  61 00 08 00 e8 00 00 02 7e e5 90 40 08     01:10:29.773  WRITE FPDMA QUEUED
  61 00 08 00 e0 00 00 02 7e e5 78 40 08     01:10:29.772  WRITE FPDMA QUEUED

Error 22724 [3] occurred at disk power-on lifetime: 52914 hours (2204 days + 18 hours)
  When the command that caused the error occurred, the device was active or idle.

  After command completion occurred, registers were:
  ER -- ST COUNT  LBA_48  LH LM LL DV DC
  -- -- -- == -- == == == -- -- -- -- --
  40 -- 51 00 00 00 01 ab 00 bd 18 40 00  Error: UNC at LBA = 0x1ab00bd18 = 7163919640

  Commands leading to the command that caused the error were:
  CR FEATR COUNT  LBA_48  LH LM LL DV DC  Powered_Up_Time  Command/Feature_Name
  -- == -- == -- == == == -- -- -- -- --  ---------------  --------------------
  60 00 08 00 98 00 00 01 bd ab 18 40 08     01:09:42.200  READ FPDMA QUEUED
  ea 00 00 00 00 00 00 00 00 00 00 e0 08     01:09:42.116  FLUSH CACHE EXT
  61 00 28 00 70 00 00 02 ab 6e c8 40 08     01:09:42.116  WRITE FPDMA QUEUED
  61 0a 00 00 80 00 00 03 3a c1 08 40 08     01:09:42.090  WRITE FPDMA QUEUED
  61 0a 00 00 10 00 00 03 3a 5f 58 40 08     01:09:42.079  WRITE FPDMA QUEUED

Error 22723 [2] occurred at disk power-on lifetime: 52914 hours (2204 days + 18 hours)
  When the command that caused the error occurred, the device was active or idle.

  After command completion occurred, registers were:
  ER -- ST COUNT  LBA_48  LH LM LL DV DC
  -- -- -- == -- == == == -- -- -- -- --
  40 -- 51 00 00 00 01 ab 00 bd 18 40 00  Error: UNC at LBA = 0x1ab00bd18 = 7163919640

  Commands leading to the command that caused the error were:
  CR FEATR COUNT  LBA_48  LH LM LL DV DC  Powered_Up_Time  Command/Feature_Name
  -- == -- == -- == == == -- -- -- -- --  ---------------  --------------------
  60 00 08 00 38 00 00 01 bd ab 18 40 08     01:09:38.837  READ FPDMA QUEUED
  61 00 20 00 00 00 00 00 18 e7 a0 40 08     01:09:38.837  WRITE FPDMA QUEUED
  61 00 08 00 18 00 00 02 60 1e 68 40 08     01:09:38.837  WRITE FPDMA QUEUED
  61 0a 00 00 70 00 00 03 3a 4b 58 40 08     01:09:38.816  WRITE FPDMA QUEUED
  61 04 30 00 30 00 00 03 2e f7 e0 40 08     01:09:38.814  WRITE FPDMA QUEUED

Error 22722 [1] occurred at disk power-on lifetime: 52914 hours (2204 days + 18 hours)
  When the command that caused the error occurred, the device was active or idle.

  After command completion occurred, registers were:
  ER -- ST COUNT  LBA_48  LH LM LL DV DC
  -- -- -- == -- == == == -- -- -- -- --
  40 -- 51 00 00 00 01 ab 00 bd 18 40 00  Error: UNC at LBA = 0x1ab00bd18 = 7163919640

  Commands leading to the command that caused the error were:
  CR FEATR COUNT  LBA_48  LH LM LL DV DC  Powered_Up_Time  Command/Feature_Name
  -- == -- == -- == == == -- -- -- -- --  ---------------  --------------------
  60 00 08 00 90 00 00 01 bd ab 18 40 08     01:09:35.577  READ FPDMA QUEUED
  61 00 20 00 18 00 00 00 18 e1 00 40 08     01:09:35.577  WRITE FPDMA QUEUED
  ea 00 00 00 00 00 00 00 00 00 00 e0 08     01:09:35.551  FLUSH CACHE EXT
  61 00 08 00 80 00 00 02 ef be 70 40 08     01:09:35.551  WRITE FPDMA QUEUED
  61 00 08 00 f8 00 00 00 08 30 80 40 08     01:09:35.551  WRITE FPDMA QUEUED

SMART Extended Self-test Log Version: 1 (1 sectors)
Num  Test_Description    Status                  Remaining  LifeTime(hours)  LBA_of_first_error
# 1  Extended offline    Completed: read failure       90%     44055         15120201
# 2  Short offline       Completed: read failure       90%     44055         15120201

SMART Selective self-test log data structure revision number 1
 SPAN  MIN_LBA  MAX_LBA  CURRENT_TEST_STATUS
    1        0        0  Not_testing
    2        0        0  Not_testing
    3        0        0  Not_testing
    4        0        0  Not_testing
    5        0        0  Not_testing
Selective self-test flags (0x0):
  After scanning selected spans, do NOT read-scan remainder of disk.
If Selective self-test is pending on power-up, resume after 0 minute delay.

SCT Status Version:                  2
SCT Version (vendor specific):       258 (0x0102)
Device State:                        Active (0)
Current Temperature:                    43 Celsius
Power Cycle Min/Max Temperature:     22/44 Celsius
Lifetime    Min/Max Temperature:     11/60 Celsius
Under/Over Temperature Limit Count:   0/0

SCT Temperature History Version:     2
Temperature Sampling Period:         1 minute
Temperature Logging Interval:        1 minute
Min/Max recommended Temperature:      0/60 Celsius
Min/Max Temperature Limit:           -41/85 Celsius
Temperature History Size (Index):    128 (121)

SCT Error Recovery Control:
           Read: Disabled
          Write: Disabled

Device Statistics (GP/SMART Log 0x04) not supported

Pending Defects log (GP Log 0x0c) not supported

SATA Phy Event Counters (GP Log 0x11)
ID      Size     Value  Description
0x0001  2            0  Command failed due to ICRC error
0x0002  2            0  R_ERR response for data FIS
0x0003  2            0  R_ERR response for device-to-host data FIS
0x0004  2            0  R_ERR response for host-to-device data FIS
0x0005  2            0  R_ERR response for non-data FIS
0x0006  2            0  R_ERR response for device-to-host non-data FIS
0x0007  2            0  R_ERR response for host-to-device non-data FIS
0x000a  2            5  Device-to-host register FISes sent due to a COMRESET
0x8000  4       104540  Vendor specific

