smartctl 7.2 2020-12-30 r5155 [FreeBSD 12.2-RELEASE-p11 amd64] (local build)
Copyright (C) 2002-20, Bruce Allen, Christian Franke, www.smartmontools.org

=== START OF INFORMATION SECTION ===
Model Family:     Hitachi Ultrastar A7K2000
Device Model:     HUA722020ALA331
Serial Number:    --
LU WWN Device Id: 5 000cca ...
Firmware Version: JKAOA3NH
User Capacity:    2,000,398,934,016 bytes [2.00 TB]
Sector Size:      512 bytes logical/physical
Rotation Rate:    7200 rpm
Form Factor:      3.5 inches
Device is:        In smartctl database [for details use: -P show]
ATA Version is:   ATA8-ACS T13/1699-D revision 4
SATA Version is:  SATA 2.6, 3.0 Gb/s
Local Time is:    Sun Jan  9 14:36:41 2022 EST
SMART support is: Available - device has SMART capability.
SMART support is: Enabled
AAM feature is:   Unavailable
APM feature is:   Disabled
Rd look-ahead is: Enabled
Write cache is:   Enabled
DSN feature is:   Unavailable
ATA Security is:  Disabled, NOT FROZEN [SEC1]
Wt Cache Reorder: Enabled

=== START OF READ SMART DATA SECTION ===
SMART overall-health self-assessment test result: PASSED

General SMART Values:
Offline data collection status:  (0x84)	Offline data collection activity
					was suspended by an interrupting command from host.
					Auto Offline Data Collection: Enabled.
Self-test execution status:      (   0)	The previous self-test routine completed
					without error or no self-test has ever 
					been run.
Total time to complete Offline 
data collection: 		(21889) seconds.
Offline data collection
capabilities: 			 (0x5b) SMART execute Offline immediate.
					Auto Offline data collection on/off support.
					Suspend Offline collection upon new
					command.
					Offline surface scan supported.
					Self-test supported.
					No Conveyance Self-test supported.
					Selective Self-test supported.
SMART capabilities:            (0x0003)	Saves SMART data before entering
					power-saving mode.
					Supports SMART auto save timer.
Error logging capability:        (0x01)	Error logging supported.
					General Purpose Logging supported.
Short self-test routine 
recommended polling time: 	 (   1) minutes.
Extended self-test routine
recommended polling time: 	 ( 365) minutes.
SCT capabilities: 	       (0x003d)	SCT Status supported.
					SCT Error Recovery Control supported.
					SCT Feature Control supported.
					SCT Data Table supported.

SMART Attributes Data Structure revision number: 16
Vendor Specific SMART Attributes with Thresholds:
ID# ATTRIBUTE_NAME          FLAGS    VALUE WORST THRESH FAIL RAW_VALUE
  1 Raw_Read_Error_Rate     PO-R--   100   100   016    -    0
  2 Throughput_Performance  P-S---   132   132   054    -    106
  3 Spin_Up_Time            POS---   135   135   024    -    498 (Average 576)
  4 Start_Stop_Count        -O--C-   100   100   000    -    120
  5 Reallocated_Sector_Ct   PO--CK   100   100   005    -    0
  7 Seek_Error_Rate         PO-R--   100   100   067    -    0
  8 Seek_Time_Performance   P-S---   123   123   020    -    34
  9 Power_On_Hours          -O--C-   091   091   000    -    69087
 10 Spin_Retry_Count        PO--C-   100   100   060    -    0
 12 Power_Cycle_Count       -O--CK   100   100   000    -    120
192 Power-Off_Retract_Count -O--CK   100   100   000    -    794
193 Load_Cycle_Count        -O--C-   100   100   000    -    794
194 Temperature_Celsius     -O----   240   240   000    -    25 (Min/Max 18/52)
196 Reallocated_Event_Count -O--CK   100   100   000    -    0
197 Current_Pending_Sector  -O---K   100   100   000    -    0
198 Offline_Uncorrectable   ---R--   100   100   000    -    0
199 UDMA_CRC_Error_Count    -O-R--   200   200   000    -    2639
                            ||||||_ K auto-keep
                            |||||__ C event count
                            ||||___ R error rate
                            |||____ S speed/performance
                            ||_____ O updated online
                            |______ P prefailure warning

General Purpose Log Directory Version 1
SMART           Log Directory Version 1 [multi-sector log support]
Address    Access  R/W   Size  Description
0x00       GPL,SL  R/O      1  Log Directory
0x01           SL  R/O      1  Summary SMART error log
0x03       GPL     R/O      1  Ext. Comprehensive SMART error log
0x04       GPL     R/O      7  Device Statistics log
0x06           SL  R/O      1  SMART self-test log
0x07       GPL     R/O      1  Extended self-test log
0x09           SL  R/W      1  Selective self-test log
0x10       GPL     R/O      1  NCQ Command Error log
0x11       GPL     R/O      1  SATA Phy Event Counters log
0x20       GPL     R/O      1  Streaming performance log [OBS-8]
0x21       GPL     R/O      1  Write stream error log
0x22       GPL     R/O      1  Read stream error log
0x24       GPL     R/O     63  Current Device Internal Status Data log
0x80       GPL     R/W     63  Host vendor specific log
0x81-0x9f  GPL,SL  R/W     16  Host vendor specific log
0xe0       GPL,SL  R/W      1  SCT Command/Status
0xe1       GPL,SL  R/W      1  SCT Data Transfer

SMART Extended Comprehensive Error Log Version: 1 (1 sectors)
Device Error Count: 1651 (device log contains only the most recent 4 errors)
	CR     = Command Register
	FEATR  = Features Register
	COUNT  = Count (was: Sector Count) Register
	LBA_48 = Upper bytes of LBA High/Mid/Low Registers ]  ATA-8
	LH     = LBA High (was: Cylinder High) Register    ]   LBA
	LM     = LBA Mid (was: Cylinder Low) Register      ] Register
	LL     = LBA Low (was: Sector Number) Register     ]
	DV     = Device (was: Device/Head) Register
	DC     = Device Control Register
	ER     = Error register
	ST     = Status register
Powered_Up_Time is measured from power on, and printed as
DDd+hh:mm:SS.sss where DD=days, hh=hours, mm=minutes,
SS=sec, and sss=millisec. It "wraps" after 49.710 days.

Error 1651 [2] occurred at disk power-on lifetime: 3551 hours (147 days + 23 hours)
  When the command that caused the error occurred, the device was active or idle.

  After command completion occurred, registers were:
  ER -- ST COUNT  LBA_48  LH LM LL DV DC
  -- -- -- == -- == == == -- -- -- -- --
  84 -- 51 00 d1 00 00 25 dc 06 22 05 00  Error: ICRC, ABRT at LBA = 0x25dc0622 = 635176482

  Commands leading to the command that caused the error were:
  CR FEATR COUNT  LBA_48  LH LM LL DV DC  Powered_Up_Time  Command/Feature_Name
  -- == -- == -- == == == -- -- -- -- --  ---------------  --------------------
  61 00 38 00 00 00 00 25 dc 06 f3 40 00 22d+04:15:28.026  WRITE FPDMA QUEUED
  61 01 00 00 08 00 00 25 dc 05 f3 40 00 22d+04:15:28.026  WRITE FPDMA QUEUED
  61 00 0b 00 00 00 00 25 dc 07 2b 40 00 22d+04:15:28.022  WRITE FPDMA QUEUED
  61 00 0b 00 00 00 00 25 dc 05 e8 40 00 22d+04:15:28.013  WRITE FPDMA QUEUED
  61 00 07 00 10 00 00 25 dc 05 e1 40 00 22d+04:15:27.983  WRITE FPDMA QUEUED

Error 1650 [1] occurred at disk power-on lifetime: 3551 hours (147 days + 23 hours)
  When the command that caused the error occurred, the device was active or idle.

  After command completion occurred, registers were:
  ER -- ST COUNT  LBA_48  LH LM LL DV DC
  -- -- -- == -- == == == -- -- -- -- --
  84 -- 51 00 a1 00 00 25 da f8 e4 05 00  Error: ICRC, ABRT at LBA = 0x25daf8e4 = 635107556

  Commands leading to the command that caused the error were:
  CR FEATR COUNT  LBA_48  LH LM LL DV DC  Powered_Up_Time  Command/Feature_Name
  -- == -- == -- == == == -- -- -- -- --  ---------------  --------------------
  61 00 ac 00 08 00 00 25 da f9 85 40 00 22d+04:01:27.900  WRITE FPDMA QUEUED
  61 01 00 00 00 00 00 25 da f8 85 40 00 22d+04:01:27.899  WRITE FPDMA QUEUED
  61 00 0a 00 10 00 00 25 da f8 6f 40 00 22d+04:01:27.868  WRITE FPDMA QUEUED
  61 01 00 00 08 00 00 25 da f7 6f 40 00 22d+04:01:27.867  WRITE FPDMA QUEUED
  61 00 0c 00 00 00 00 25 da f8 79 40 00 22d+04:01:27.866  WRITE FPDMA QUEUED

Error 1649 [0] occurred at disk power-on lifetime: 3551 hours (147 days + 23 hours)
  When the command that caused the error occurred, the device was active or idle.

  After command completion occurred, registers were:
  ER -- ST COUNT  LBA_48  LH LM LL DV DC
  -- -- -- == -- == == == -- -- -- -- --
  84 -- 51 00 1a 00 00 81 b0 58 55 01 00  Error: ICRC, ABRT at LBA = 0x81b05855 = 2175817813

  Commands leading to the command that caused the error were:
  CR FEATR COUNT  LBA_48  LH LM LL DV DC  Powered_Up_Time  Command/Feature_Name
  -- == -- == -- == == == -- -- -- -- --  ---------------  --------------------
  61 00 39 00 00 00 00 81 b0 58 36 40 00 22d+03:55:07.459  WRITE FPDMA QUEUED
  61 00 40 00 00 00 00 81 b0 57 ef 40 00 22d+03:55:07.453  WRITE FPDMA QUEUED
  61 00 12 00 00 00 00 81 a3 e6 2a 40 00 22d+03:55:07.451  WRITE FPDMA QUEUED
  61 00 24 00 00 00 00 81 a3 e5 cd 40 00 22d+03:55:07.449  WRITE FPDMA QUEUED
  61 00 04 00 00 00 00 81 a1 e9 c9 40 00 22d+03:55:07.445  WRITE FPDMA QUEUED

Error 1648 [3] occurred at disk power-on lifetime: 3551 hours (147 days + 23 hours)
  When the command that caused the error occurred, the device was active or idle.

  After command completion occurred, registers were:
  ER -- ST COUNT  LBA_48  LH LM LL DV DC
  -- -- -- == -- == == == -- -- -- -- --
  84 -- 51 00 11 00 00 b4 69 43 7f 04 00  Error: ICRC, ABRT at LBA = 0xb469437f = 3026797439

  Commands leading to the command that caused the error were:
  CR FEATR COUNT  LBA_48  LH LM LL DV DC  Powered_Up_Time  Command/Feature_Name
  -- == -- == -- == == == -- -- -- -- --  ---------------  --------------------
  60 01 00 00 38 00 00 b4 69 45 90 40 00 22d+03:49:48.860  READ FPDMA QUEUED
  60 01 00 00 30 00 00 b4 69 44 90 40 00 22d+03:49:48.860  READ FPDMA QUEUED
  60 01 00 00 28 00 00 b4 69 43 90 40 00 22d+03:49:48.860  READ FPDMA QUEUED
  60 01 00 00 20 00 00 b4 69 42 90 40 00 22d+03:49:48.860  READ FPDMA QUEUED
  60 01 00 00 18 00 00 b4 69 41 90 40 00 22d+03:49:48.859  READ FPDMA QUEUED

SMART Extended Self-test Log Version: 1 (1 sectors)
Num  Test_Description    Status                  Remaining  LifeTime(hours)  LBA_of_first_error
# 1  Extended offline    Completed without error       00%     26111         -
# 2  Short offline       Completed without error       00%     25948         -
# 3  Short offline       Completed without error       00%     22452         -
# 4  Short offline       Completed without error       00%     21607         -

SMART Selective self-test log data structure revision number 1
 SPAN  MIN_LBA  MAX_LBA  CURRENT_TEST_STATUS
    1        0        0  Not_testing
    2        0        0  Not_testing
    3        0        0  Not_testing
    4        0        0  Not_testing
    5        0        0  Not_testing
Selective self-test flags (0x0):
  After scanning selected spans, do NOT read-scan remainder of disk.
If Selective self-test is pending on power-up, resume after 0 minute delay.

SCT Status Version:                  3
SCT Version (vendor specific):       256 (0x0100)
Device State:                        SMART Off-line Data Collection executing in background (4)
Current Temperature:                    25 Celsius
Power Cycle Min/Max Temperature:     24/28 Celsius
Lifetime    Min/Max Temperature:     18/52 Celsius
Under/Over Temperature Limit Count:   0/0

SCT Temperature History Version:     2
Temperature Sampling Period:         1 minute
Temperature Logging Interval:        1 minute
Min/Max recommended Temperature:      0/60 Celsius
Min/Max Temperature Limit:           -40/70 Celsius
Temperature History Size (Index):    128 (61)

SCT Error Recovery Control:
           Read: Disabled
          Write: Disabled

Device Statistics (GP Log 0x04)
Page  Offset Size        Value Flags Description
0x01  =====  =               =  ===  == General Statistics (rev 1) ==
0x01  0x008  4             120  ---  Lifetime Power-On Resets
0x01  0x010  4           69087  ---  Power-on Hours
0x01  0x018  6    438149992268  ---  Logical Sectors Written
0x01  0x020  6      1622734711  ---  Number of Write Commands
0x01  0x028  6   4518528097830  ---  Logical Sectors Read
0x01  0x030  6      2693713025  ---  Number of Read Commands
0x03  =====  =               =  ===  == Rotating Media Statistics (rev 1) ==
0x03  0x008  4           69068  ---  Spindle Motor Power-on Hours
0x03  0x010  4           69068  ---  Head Flying Hours
0x03  0x018  4             794  ---  Head Load Events
0x03  0x020  4               0  ---  Number of Reallocated Logical Sectors
0x03  0x028  4             468  ---  Read Recovery Attempts
0x03  0x030  4               2  ---  Number of Mechanical Start Failures
0x04  =====  =               =  ===  == General Errors Statistics (rev 1) ==
0x04  0x008  4               0  ---  Number of Reported Uncorrectable Errors
0x04  0x010  4            2117  ---  Resets Between Cmd Acceptance and Completion
0x05  =====  =               =  ===  == Temperature Statistics (rev 1) ==
0x05  0x008  1              26  ---  Current Temperature
0x05  0x010  1              25  N--  Average Short Term Temperature
0x05  0x018  1              25  N--  Average Long Term Temperature
0x05  0x020  1              52  ---  Highest Temperature
0x05  0x028  1              18  ---  Lowest Temperature
0x05  0x030  1              48  N--  Highest Average Short Term Temperature
0x05  0x038  1               0  N--  Lowest Average Short Term Temperature
0x05  0x040  1              45  N--  Highest Average Long Term Temperature
0x05  0x048  1               0  N--  Lowest Average Long Term Temperature
0x05  0x050  4               0  ---  Time in Over-Temperature
0x05  0x058  1              60  ---  Specified Maximum Operating Temperature
0x05  0x060  4               0  ---  Time in Under-Temperature
0x05  0x068  1               0  ---  Specified Minimum Operating Temperature
0x06  =====  =               =  ===  == Transport Statistics (rev 1) ==
0x06  0x008  4            2507  ---  Number of Hardware Resets
0x06  0x010  4            2507  ---  Number of ASR Events
0x06  0x018  4            2639  ---  Number of Interface CRC Errors
                                |||_ C monitored condition met
                                ||__ D supports DSN
                                |___ N normalized value

Pending Defects log (GP Log 0x0c) not supported

SATA Phy Event Counters (GP Log 0x11)
ID      Size     Value  Description
0x0001  2         1648  Command failed due to ICRC error
0x0002  2         1646  R_ERR response for data FIS
0x0005  2            0  R_ERR response for non-data FIS
0x0009  2         1618  Transition from drive PhyRdy to drive PhyNRdy
0x000a  2         1618  Device-to-host register FISes sent due to a COMRESET
0x000b  2         1599  CRC errors within host-to-device FIS
0x000d  2            0  Non-CRC errors within host-to-device FIS



