smartctl 7.5 2025-04-30 r5714 [FreeBSD 14.3-RELEASE-p1 amd64] (local build)
Copyright (C) 2002-25, Bruce Allen, Christian Franke, www.smartmontools.org

=== START OF INFORMATION SECTION ===
Model Family:     Seagate Momentus 7200.4
Device Model:     ST9500420AS
Serial Number:    --
LU WWN Device Id: 5 000c50 ...
Firmware Version: 0002SDM1
User Capacity:    500,107,862,016 bytes [500 GB]
Sector Size:      512 bytes logical/physical
Rotation Rate:    7200 rpm
Device is:        In smartctl database 7.5/5706
ATA Version is:   ATA8-ACS T13/1699-D revision 4
SATA Version is:  SATA 2.6, 3.0 Gb/s
Local Time is:    Wed Jul 30 17:55:36 2025 CDT
SMART support is: Available - device has SMART capability.
SMART support is: Enabled
AAM level is:     208 (intermediate), recommended: 208
APM level is:     128 (minimum power consumption without standby)
Rd look-ahead is: Enabled
Write cache is:   Enabled
DSN feature is:   Unavailable
ATA Security is:  Disabled, frozen [SEC2]

=== START OF READ SMART DATA SECTION ===
SMART overall-health self-assessment test result: PASSED

General SMART Values:
Offline data collection status:  (0x00)	Offline data collection activity
					was never started.
					Auto Offline Data Collection: Disabled.
Self-test execution status:      (   0)	The previous self-test routine completed
					without error or no self-test has ever 
					been run.
Total time to complete Offline 
data collection: 		(    0) seconds.
Offline data collection
capabilities: 			 (0x73) SMART execute Offline immediate.
					Auto Offline data collection on/off support.
					Suspend Offline collection upon new
					command.
					No Offline surface scan supported.
					Self-test supported.
					Conveyance Self-test supported.
					Selective Self-test supported.
SMART capabilities:            (0x0003)	Saves SMART data before entering
					power-saving mode.
					Supports SMART auto save timer.
Error logging capability:        (0x01)	Error logging supported.
					General Purpose Logging supported.
Short self-test routine 
recommended polling time: 	 (   2) minutes.
Extended self-test routine
recommended polling time: 	 ( 111) minutes.
Conveyance self-test routine
recommended polling time: 	 (   3) minutes.
SCT capabilities: 	       (0x103f)	SCT Status supported.
					SCT Error Recovery Control supported.
					SCT Feature Control supported.
					SCT Data Table supported.

SMART Attributes Data Structure revision number: 10
Vendor Specific SMART Attributes with Thresholds:
ID# ATTRIBUTE_NAME          FLAGS    VALUE WORST THRESH FAIL RAW_VALUE
  1 Raw_Read_Error_Rate     POSR--   116   099   006    -    111459826
  3 Spin_Up_Time            PO----   100   098   085    -    0
  4 Start_Stop_Count        -O--CK   096   096   020    -    4321
  5 Reallocated_Sector_Ct   PO--CK   100   100   036    -    1
  7 Seek_Error_Rate         POSR--   078   060   030    -    74132977863
  9 Power_On_Hours          -O--CK   057   057   000    -    38063
 10 Spin_Retry_Count        PO--C-   100   100   097    -    0
 12 Power_Cycle_Count       -O--CK   098   037   020    -    2343
184 End-to-End_Error        -O--CK   100   100   099    -    0
187 Reported_Uncorrect      -O--CK   015   015   000    -    85
188 Command_Timeout         -O--CK   100   099   000    -    4295032858
189 High_Fly_Writes         -O-RCK   100   100   000    -    0
190 Airflow_Temperature_Cel -O---K   067   046   045    -    33 (Min/Max 26/36)
191 G-Sense_Error_Rate      -O--CK   100   100   000    -    16
192 Power-Off_Retract_Count -O--CK   100   100   000    -    13
193 Load_Cycle_Count        -O--CK   001   001   000    -    805397
194 Temperature_Celsius     -O---K   033   054   000    -    33 (0 14 0 0 0)
195 Hardware_ECC_Recovered  -O-RC-   044   031   000    -    111459826
197 Current_Pending_Sector  -O--C-   100   100   000    -    0
198 Offline_Uncorrectable   ----C-   100   100   000    -    0
199 UDMA_CRC_Error_Count    -OSRCK   200   200   000    -    314
240 Head_Flying_Hours       ------   100   253   000    -    36208 (24 115 0)
241 Total_LBAs_Written      ------   100   253   000    -    3053683233
242 Total_LBAs_Read         ------   100   253   000    -    1067775417
254 Free_Fall_Sensor        -O--CK   100   100   000    -    0
                            ||||||_ K auto-keep
                            |||||__ C event count
                            ||||___ R error rate
                            |||____ S speed/performance
                            ||_____ O updated online
                            |______ P prefailure warning

General Purpose Log Directory Version 1
SMART           Log Directory Version 1 [multi-sector log support]
Address    Access  R/W   Size  Description
0x00       GPL,SL  R/O      1  Log Directory
0x01       GPL,SL  R/O      1  Summary SMART error log
0x02       GPL,SL  R/O      5  Comprehensive SMART error log
0x03       GPL,SL  R/O      5  Ext. Comprehensive SMART error log
0x06       GPL,SL  R/O      1  SMART self-test log
0x07       GPL,SL  R/O      1  Extended self-test log
0x09       GPL,SL  R/W      1  Selective self-test log
0x10       GPL,SL  R/O      1  NCQ Command Error log
0x11       GPL,SL  R/O      1  SATA Phy Event Counters log
0x21       GPL,SL  R/O      1  Write stream error log
0x22       GPL,SL  R/O      1  Read stream error log
0x80-0x9f  GPL,SL  R/W     16  Host vendor specific log
0xa1       GPL,SL  VS      20  Device vendor specific log
0xa2       GPL     VS    2248  Device vendor specific log
0xa8       GPL,SL  VS      65  Device vendor specific log
0xa9       GPL,SL  VS       1  Device vendor specific log
0xb0       GPL     VS    2864  Device vendor specific log
0xbe-0xbf  GPL     VS   65535  Device vendor specific log
0xe0       GPL,SL  R/W      1  SCT Command/Status
0xe1       GPL,SL  R/W      1  SCT Data Transfer

SMART Extended Comprehensive Error Log Version: 1 (5 sectors)
Device Error Count: 62 (device log contains only the most recent 20 errors)
	CR     = Command Register
	FEATR  = Features Register
	COUNT  = Count (was: Sector Count) Register
	LBA_48 = Upper bytes of LBA High/Mid/Low Registers ]  ATA-8
	LH     = LBA High (was: Cylinder High) Register    ]   LBA
	LM     = LBA Mid (was: Cylinder Low) Register      ] Register
	LL     = LBA Low (was: Sector Number) Register     ]
	DV     = Device (was: Device/Head) Register
	DC     = Device Control Register
	ER     = Error register
	ST     = Status register
Powered_Up_Time is measured from power on, and printed as
DDd+hh:mm:SS.sss where DD=days, hh=hours, mm=minutes,
SS=sec, and sss=millisec. It "wraps" after 49.710 days.

Error 62 [1] occurred at disk power-on lifetime: 18223 hours (759 days + 7 hours)
  When the command that caused the error occurred, the device was active or idle.

  After command completion occurred, registers were:
  ER -- ST COUNT  LBA_48  LH LM LL DV DC
  -- -- -- == -- == == == -- -- -- -- --
  40 -- 51 00 00 00 13 ab 00 1c 12 00 00  Error: UNC at LBA = 0x13ab001c12 = 84473289746

  Commands leading to the command that caused the error were:
  CR FEATR COUNT  LBA_48  LH LM LL DV DC  Powered_Up_Time  Command/Feature_Name
  -- == -- == -- == == == -- -- -- -- --  ---------------  --------------------
  25 00 00 00 01 00 13 ab 00 1c 12 40 00     00:08:40.788  READ DMA EXT
  25 00 00 00 01 00 13 ab 00 1c 12 40 00     00:08:37.999  READ DMA EXT
  25 00 00 00 01 00 13 ab 00 1c 12 40 00     00:08:35.276  READ DMA EXT
  25 00 00 00 01 00 13 ab 00 1c 12 40 00     00:08:32.537  READ DMA EXT
  25 00 00 00 01 00 13 ab 00 1c 12 40 00     00:08:29.838  READ DMA EXT

Error 61 [0] occurred at disk power-on lifetime: 18223 hours (759 days + 7 hours)
  When the command that caused the error occurred, the device was active or idle.

  After command completion occurred, registers were:
  ER -- ST COUNT  LBA_48  LH LM LL DV DC
  -- -- -- == -- == == == -- -- -- -- --
  40 -- 51 00 00 00 13 ab 00 1c 12 00 00  Error: UNC at LBA = 0x13ab001c12 = 84473289746

  Commands leading to the command that caused the error were:
  CR FEATR COUNT  LBA_48  LH LM LL DV DC  Powered_Up_Time  Command/Feature_Name
  -- == -- == -- == == == -- -- -- -- --  ---------------  --------------------
  25 00 00 00 01 00 13 ab 00 1c 12 40 00     00:08:37.999  READ DMA EXT
  25 00 00 00 01 00 13 ab 00 1c 12 40 00     00:08:35.276  READ DMA EXT
  25 00 00 00 01 00 13 ab 00 1c 12 40 00     00:08:32.537  READ DMA EXT
  25 00 00 00 01 00 13 ab 00 1c 12 40 00     00:08:29.838  READ DMA EXT
  25 00 00 00 01 00 13 ab 00 1c 11 40 00     00:08:29.836  READ DMA EXT

Error 60 [19] occurred at disk power-on lifetime: 18223 hours (759 days + 7 hours)
  When the command that caused the error occurred, the device was active or idle.

  After command completion occurred, registers were:
  ER -- ST COUNT  LBA_48  LH LM LL DV DC
  -- -- -- == -- == == == -- -- -- -- --
  40 -- 51 00 00 00 13 ab 00 1c 12 00 00  Error: UNC at LBA = 0x13ab001c12 = 84473289746

  Commands leading to the command that caused the error were:
  CR FEATR COUNT  LBA_48  LH LM LL DV DC  Powered_Up_Time  Command/Feature_Name
  -- == -- == -- == == == -- -- -- -- --  ---------------  --------------------
  25 00 00 00 01 00 13 ab 00 1c 12 40 00     00:08:35.276  READ DMA EXT
  25 00 00 00 01 00 13 ab 00 1c 12 40 00     00:08:32.537  READ DMA EXT
  25 00 00 00 01 00 13 ab 00 1c 12 40 00     00:08:29.838  READ DMA EXT
  25 00 00 00 01 00 13 ab 00 1c 11 40 00     00:08:29.836  READ DMA EXT
  25 00 00 00 01 00 13 ab 00 1c 10 40 00     00:08:29.835  READ DMA EXT

Error 59 [18] occurred at disk power-on lifetime: 18223 hours (759 days + 7 hours)
  When the command that caused the error occurred, the device was active or idle.

  After command completion occurred, registers were:
  ER -- ST COUNT  LBA_48  LH LM LL DV DC
  -- -- -- == -- == == == -- -- -- -- --
  40 -- 51 00 00 00 13 ab 00 1c 12 00 00  Error: UNC at LBA = 0x13ab001c12 = 84473289746

  Commands leading to the command that caused the error were:
  CR FEATR COUNT  LBA_48  LH LM LL DV DC  Powered_Up_Time  Command/Feature_Name
  -- == -- == -- == == == -- -- -- -- --  ---------------  --------------------
  25 00 00 00 01 00 13 ab 00 1c 12 40 00     00:08:29.838  READ DMA EXT
  25 00 00 00 01 00 13 ab 00 1c 11 40 00     00:08:29.836  READ DMA EXT
  25 00 00 00 01 00 13 ab 00 1c 10 40 00     00:08:29.835  READ DMA EXT
  25 00 00 00 01 00 13 ab 00 1c 0f 40 00     00:08:29.835  READ DMA EXT
  25 00 00 00 01 00 13 ab 00 1c 0e 40 00     00:08:29.835  READ DMA EXT

Error 58 [17] occurred at disk power-on lifetime: 18223 hours (759 days + 7 hours)
  When the command that caused the error occurred, the device was active or idle.

  After command completion occurred, registers were:
  ER -- ST COUNT  LBA_48  LH LM LL DV DC
  -- -- -- == -- == == == -- -- -- -- --
  40 -- 51 00 00 00 13 ab 00 1c 12 00 00  Error: UNC at LBA = 0x13ab001c12 = 84473289746

  Commands leading to the command that caused the error were:
  CR FEATR COUNT  LBA_48  LH LM LL DV DC  Powered_Up_Time  Command/Feature_Name
  -- == -- == -- == == == -- -- -- -- --  ---------------  --------------------
  25 00 00 00 80 00 13 aa 00 1c e8 40 00     00:08:26.984  READ DMA EXT
  25 00 00 00 80 00 13 aa 00 1c e8 40 00     00:08:24.179  READ DMA EXT
  25 00 00 00 80 00 13 aa 00 1c e8 40 00     00:08:21.448  READ DMA EXT
  25 00 00 00 80 00 13 aa 00 1c e8 40 00     00:08:18.642  READ DMA EXT
  25 00 00 00 80 00 13 aa 00 1c e8 40 00     00:08:15.947  READ DMA EXT

Error 57 [16] occurred at disk power-on lifetime: 18223 hours (759 days + 7 hours)
  When the command that caused the error occurred, the device was active or idle.

  After command completion occurred, registers were:
  ER -- ST COUNT  LBA_48  LH LM LL DV DC
  -- -- -- == -- == == == -- -- -- -- --
  40 -- 51 00 00 00 13 ab 00 1c 12 00 00  Error: UNC at LBA = 0x13ab001c12 = 84473289746

  Commands leading to the command that caused the error were:
  CR FEATR COUNT  LBA_48  LH LM LL DV DC  Powered_Up_Time  Command/Feature_Name
  -- == -- == -- == == == -- -- -- -- --  ---------------  --------------------
  25 00 00 00 80 00 13 aa 00 1c e8 40 00     00:08:24.179  READ DMA EXT
  25 00 00 00 80 00 13 aa 00 1c e8 40 00     00:08:21.448  READ DMA EXT
  25 00 00 00 80 00 13 aa 00 1c e8 40 00     00:08:18.642  READ DMA EXT
  25 00 00 00 80 00 13 aa 00 1c e8 40 00     00:08:15.947  READ DMA EXT
  25 00 00 00 40 00 13 aa 00 1c a8 40 00     00:08:15.927  READ DMA EXT

Error 56 [15] occurred at disk power-on lifetime: 18223 hours (759 days + 7 hours)
  When the command that caused the error occurred, the device was active or idle.

  After command completion occurred, registers were:
  ER -- ST COUNT  LBA_48  LH LM LL DV DC
  -- -- -- == -- == == == -- -- -- -- --
  40 -- 51 00 00 00 13 ab 00 1c 12 00 00  Error: UNC at LBA = 0x13ab001c12 = 84473289746

  Commands leading to the command that caused the error were:
  CR FEATR COUNT  LBA_48  LH LM LL DV DC  Powered_Up_Time  Command/Feature_Name
  -- == -- == -- == == == -- -- -- -- --  ---------------  --------------------
  25 00 00 00 80 00 13 aa 00 1c e8 40 00     00:08:21.448  READ DMA EXT
  25 00 00 00 80 00 13 aa 00 1c e8 40 00     00:08:18.642  READ DMA EXT
  25 00 00 00 80 00 13 aa 00 1c e8 40 00     00:08:15.947  READ DMA EXT
  25 00 00 00 40 00 13 aa 00 1c a8 40 00     00:08:15.927  READ DMA EXT
  25 00 00 00 80 00 13 35 00 09 a8 40 00     00:08:15.920  READ DMA EXT

Error 55 [14] occurred at disk power-on lifetime: 18223 hours (759 days + 7 hours)
  When the command that caused the error occurred, the device was active or idle.

  After command completion occurred, registers were:
  ER -- ST COUNT  LBA_48  LH LM LL DV DC
  -- -- -- == -- == == == -- -- -- -- --
  40 -- 51 00 00 00 13 ab 00 1c 12 00 00  Error: UNC at LBA = 0x13ab001c12 = 84473289746

  Commands leading to the command that caused the error were:
  CR FEATR COUNT  LBA_48  LH LM LL DV DC  Powered_Up_Time  Command/Feature_Name
  -- == -- == -- == == == -- -- -- -- --  ---------------  --------------------
  25 00 00 00 80 00 13 aa 00 1c e8 40 00     00:08:18.642  READ DMA EXT
  25 00 00 00 80 00 13 aa 00 1c e8 40 00     00:08:15.947  READ DMA EXT
  25 00 00 00 40 00 13 aa 00 1c a8 40 00     00:08:15.927  READ DMA EXT
  25 00 00 00 80 00 13 35 00 09 a8 40 00     00:08:15.920  READ DMA EXT
  25 00 00 00 80 00 13 35 00 09 28 40 00     00:08:15.909  READ DMA EXT

SMART Extended Self-test Log Version: 1 (1 sectors)
Num  Test_Description    Status                  Remaining  LifeTime(hours)  LBA_of_first_error
# 1  Short offline       Completed without error       00%      9422         -
# 2  Short offline       Completed without error       00%      9414         -

SMART Selective self-test log data structure revision number 1
 SPAN  MIN_LBA  MAX_LBA  CURRENT_TEST_STATUS
    1        0        0  Not_testing
    2        0        0  Not_testing
    3        0        0  Not_testing
    4        0        0  Not_testing
    5        0        0  Not_testing
Selective self-test flags (0x0):
  After scanning selected spans, do NOT read-scan remainder of disk.
If Selective self-test is pending on power-up, resume after 0 minute delay.

SCT Status Version:                  3
SCT Version (vendor specific):       522 (0x020a)
Device State:                        Active (0)
Current Temperature:                    32 Celsius
Power Cycle Min/Max Temperature:     26/36 Celsius
Lifetime    Min/Max Temperature:     14/54 Celsius
Specified Max Operating Temperature:    31 Celsius
Under/Over Temperature Limit Count:   0/0

SCT Temperature History Version:     2
Temperature Sampling Period:         1 minute
Temperature Logging Interval:        1 minute
Min/Max recommended Temperature:     14/55 Celsius
Min/Max Temperature Limit:           10/60 Celsius
Temperature History Size (Index):    128 (57)

SCT Error Recovery Control:
           Read: Disabled
          Write: Disabled

Device Statistics (GP/SMART Log 0x04) not supported

Pending Defects log (GP Log 0x0c) not supported

SATA Phy Event Counters (GP Log 0x11)
ID      Size     Value  Description
0x000a  2           20  Device-to-host register FISes sent due to a COMRESET
0x0001  2            0  Command failed due to ICRC error
0x0003  2            0  R_ERR response for device-to-host data FIS
0x0004  2            0  R_ERR response for host-to-device data FIS
0x0006  2            0  R_ERR response for device-to-host non-data FIS
0x0007  2            0  R_ERR response for host-to-device non-data FIS

