smartctl 7.4 2023-08-01 r5530 [FreeBSD 13.2-RELEASE-p7 amd64] (local build)
Copyright (C) 2002-23, Bruce Allen, Christian Franke, www.smartmontools.org

=== START OF INFORMATION SECTION ===
Model Number:                       SAMSUNG MZVPV256HDGL-00000
Serial Number:                      --
Firmware Version:                   BXW7300Q
PCI Vendor/Subsystem ID:            0x144d
IEEE OUI Identifier:                0x002538
Controller ID:                      1
NVMe Version:                       <1.2
Number of Namespaces:               1
Namespace 1 Size/Capacity:          256,060,514,304 [256 GB]
Namespace 1 Utilization:            3,551,543,296 [3.55 GB]
Namespace 1 Formatted LBA Size:     512
Local Time is:                      Sat Jan  6 22:21:30 2024 CET
Firmware Updates (0x06):            3 Slots
Optional Admin Commands (0x0007):   Security Format Frmw_DL
Optional NVM Commands (0x001f):     Comp Wr_Unc DS_Mngmt Wr_Zero Sav/Sel_Feat
Log Page Attributes (0x01):         S/H_per_NS
Maximum Data Transfer Size:         32 Pages

Supported Power States
St Op     Max   Active     Idle   RL RT WL WT  Ent_Lat  Ex_Lat
 0 +     9.00W       -        -    0  0  0  0        5       5
 1 +     4.60W       -        -    1  1  1  1       30      30
 2 +     3.80W       -        -    2  2  2  2      100     100
 3 -   0.0700W       -        -    3  3  3  3      500    5000
 4 -   0.0050W       -        -    4  4  4  4     2000   22000

Supported LBA Sizes (NSID 0x1)
Id Fmt  Data  Metadt  Rel_Perf
 0 +     512       0         0

=== START OF SMART DATA SECTION ===
SMART overall-health self-assessment test result: PASSED

SMART/Health Information (NVMe Log 0x02)
Critical Warning:                   0x00
Temperature:                        36 Celsius
Available Spare:                    100%
Available Spare Threshold:          10%
Percentage Used:                    8%
Data Units Read:                    23,808,597 [12.1 TB]
Data Units Written:                 40,082,602 [20.5 TB]
Host Read Commands:                 325,824,310
Host Write Commands:                388,244,450
Controller Busy Time:               3,189
Power Cycles:                       2,031
Power On Hours:                     20,554
Unsafe Shutdowns:                   599
Media and Data Integrity Errors:    0
Error Information Log Entries:      4,234

Error Information (NVMe Log 0x01, 16 of 64 entries)
Num   ErrCount  SQId   CmdId  Status  PELoc          LBA  NSID    VS  Message
  0       4234     0  0x5014  0x4004  0x000            0     0     -  Invalid Field in Command
  1       4233     0  0x8003  0x4214  0x000            0     1     -  Invalid Format
  2       4232     0  0x4014  0x4004  0x000            0     0     -  Invalid Field in Command
  3       4231     0  0x2016  0x4004  0x000            0     0     -  Invalid Field in Command
  4       4230     0  0xa012  0x4004  0x000            0     0     -  Invalid Field in Command
  5       4229     0  0xa011  0x4214  0x000            0     1     -  Invalid Format
  6       4228     0  0x201c  0x4004  0x000            0     0     -  Invalid Field in Command
  7       4227     0  0x9012  0x4214  0x000            0     1     -  Invalid Format
  8       4226     0  0x8010  0x4004  0x000            0     0     -  Invalid Field in Command
  9       4225     0  0x7013  0x4002  0x000            0     1     -  Invalid Command Opcode
 10       4224     0  0x001c  0x4004  0x000            0     0     -  Invalid Field in Command
 11       4223     0  0x8018  0x4214  0x000            0     1     -  Invalid Format
 12       4222     0  0x5001  0x4004  0x000            0     0     -  Invalid Field in Command
 13       4221     0  0xa006  0x4004  0x000            0     0     -  Invalid Field in Command
 14       4220     0  0x301a  0x4004  0x000            0     0     -  Invalid Field in Command
 15       4219     0  0x100b  0x4214  0x000            0     1     -  Invalid Format
... (48 entries not read)

Self-tests not supported

