smartctl 7.4 2023-08-01 r5530 [FreeBSD 14.1-RELEASE-p2 amd64] (local build)
Copyright (C) 2002-23, Bruce Allen, Christian Franke, www.smartmontools.org

=== START OF INFORMATION SECTION ===
Model Family:     Toshiba 2.5" HDD MK..52GSX
Device Model:     TOSHIBA MK2552GSX
Serial Number:    --
LU WWN Device Id: 5 000039 ...
Firmware Version: LV011C
User Capacity:    250,059,350,016 bytes [250 GB]
Sector Size:      512 bytes logical/physical
Device is:        In smartctl database 7.3/5528
ATA Version is:   ATA8-ACS (minor revision not indicated)
SATA Version is:  SATA 2.6, 3.0 Gb/s
Local Time is:    Mon Aug  5 19:53:44 2024 CEST
SMART support is: Available - device has SMART capability.
SMART support is: Enabled
AAM feature is:   Unavailable
APM level is:     128 (minimum power consumption without standby)
Rd look-ahead is: Enabled
Write cache is:   Enabled
DSN feature is:   Unavailable
ATA Security is:  Disabled, frozen [SEC2]
Write SCT (Get) Feature Control Command failed: Input/output error
Wt Cache Reorder: Unknown (SCT Feature Control command failed)

=== START OF READ SMART DATA SECTION ===
SMART overall-health self-assessment test result: PASSED
See vendor-specific Attribute list for marginal Attributes.

General SMART Values:
Offline data collection status:  (0x00)	Offline data collection activity
					was never started.
					Auto Offline Data Collection: Disabled.
Self-test execution status:      ( 121)	The previous self-test completed having
					the read element of the test failed.
Total time to complete Offline 
data collection: 		(  120) seconds.
Offline data collection
capabilities: 			 (0x51) SMART execute Offline immediate.
					No Auto Offline data collection support.
					Suspend Offline collection upon new
					command.
					No Offline surface scan supported.
					Self-test supported.
					No Conveyance Self-test supported.
					Selective Self-test supported.
SMART capabilities:            (0x0003)	Saves SMART data before entering
					power-saving mode.
					Supports SMART auto save timer.
Error logging capability:        (0x01)	Error logging supported.
					General Purpose Logging supported.
Short self-test routine 
recommended polling time: 	 (   2) minutes.
Extended self-test routine
recommended polling time: 	 ( 100) minutes.
SCT capabilities: 	       (0x0033)	SCT Status supported.
					SCT Feature Control supported.
					SCT Data Table supported.

SMART Attributes Data Structure revision number: 16
Vendor Specific SMART Attributes with Thresholds:
ID# ATTRIBUTE_NAME          FLAGS    VALUE WORST THRESH FAIL RAW_VALUE
  1 Raw_Read_Error_Rate     POSR--   100   100   050    -    0
  2 Throughput_Performance  POS---   100   100   050    -    0
  3 Spin_Up_Time            PO----   100   100   002    -    1641
  4 Start_Stop_Count        -O--CK   100   100   000    -    6028
  5 Reallocated_Sector_Ct   PO--CK   040   040   010    -    1230
  7 Seek_Error_Rate         POSR--   100   100   050    -    0
  8 Seek_Time_Performance   P-S---   100   100   050    -    0
  9 Power_On_Hours          -O--CK   044   043   000    -    22564
 10 Spin_Retry_Count        PO--C-   220   100   030    -    0
 12 Power_Cycle_Count       -O--CK   100   100   000    -    5719
184 End-to-End_Error        -O--CK   001   001   001    NOW  2382
187 Reported_Uncorrect      -O--CK   001   001   000    -    2382
188 Command_Timeout         -O--CK   100   097   000    -    45
189 High_Fly_Writes         -O-RCK   100   100   001    -    0
190 Airflow_Temperature_Cel -O---K   060   024   045    Past 40 (Min/Max 38/40)
191 G-Sense_Error_Rate      -O--CK   100   100   000    -    1706
192 Power-Off_Retract_Count -O--CK   099   099   000    -    45154993
193 Load_Cycle_Count        -O--CK   057   057   000    -    439890
194 Temperature_Celsius     -O---K   100   100   000    -    40 (Min/Max 7/76)
196 Reallocated_Event_Count -O--CK   100   100   000    -    151
197 Current_Pending_Sector  -O--C-   100   100   000    -    119
198 Offline_Uncorrectable   ----C-   100   100   000    -    0
199 UDMA_CRC_Error_Count    -OSRCK   200   253   000    -    0
220 Disk_Shift              -O----   100   100   000    -    55
222 Loaded_Hours            -O--CK   058   058   000    -    17025
223 Load_Retry_Count        -O--CK   100   100   000    -    0
224 Load_Friction           -O---K   100   100   000    -    0
226 Load-in_Time            -OS--K   100   100   000    -    352
240 Head_Flying_Hours       P-----   100   100   001    -    0
                            ||||||_ K auto-keep
                            |||||__ C event count
                            ||||___ R error rate
                            |||____ S speed/performance
                            ||_____ O updated online
                            |______ P prefailure warning

General Purpose Log Directory Version 1
SMART           Log Directory Version 1 [multi-sector log support]
Address    Access  R/W   Size  Description
0x00       GPL,SL  R/O      1  Log Directory
0x01           SL  R/O      1  Summary SMART error log
0x02           SL  R/O     51  Comprehensive SMART error log
0x03       GPL     R/O     64  Ext. Comprehensive SMART error log
0x06           SL  R/O      1  SMART self-test log
0x07       GPL     R/O      1  Extended self-test log
0x09           SL  R/W      1  Selective self-test log
0x10       GPL     R/O      1  NCQ Command Error log
0x11       GPL     R/O      1  SATA Phy Event Counters log
0x80-0x9f  GPL,SL  R/W     16  Host vendor specific log
0xe0       GPL,SL  R/W      1  SCT Command/Status
0xe1       GPL,SL  R/W      1  SCT Data Transfer

SMART Extended Comprehensive Error Log Version: 1 (64 sectors)
Device Error Count: 2707 (device log contains only the most recent 256 errors)
	CR     = Command Register
	FEATR  = Features Register
	COUNT  = Count (was: Sector Count) Register
	LBA_48 = Upper bytes of LBA High/Mid/Low Registers ]  ATA-8
	LH     = LBA High (was: Cylinder High) Register    ]   LBA
	LM     = LBA Mid (was: Cylinder Low) Register      ] Register
	LL     = LBA Low (was: Sector Number) Register     ]
	DV     = Device (was: Device/Head) Register
	DC     = Device Control Register
	ER     = Error register
	ST     = Status register
Powered_Up_Time is measured from power on, and printed as
DDd+hh:mm:SS.sss where DD=days, hh=hours, mm=minutes,
SS=sec, and sss=millisec. It "wraps" after 49.710 days.

Error 2707 [146] occurred at disk power-on lifetime: 20528 hours (855 days + 8 hours)
  When the command that caused the error occurred, the device was active or idle.

  After command completion occurred, registers were:
  ER -- ST COUNT  LBA_48  LH LM LL DV DC
  -- -- -- == -- == == == -- -- -- -- --
  40 -- 51 00 9f 00 00 03 87 ed c0 e3 00  Error: UNC 159 sectors at LBA = 0x0387edc0 = 59239872

  Commands leading to the command that caused the error were:
  CR FEATR COUNT  LBA_48  LH LM LL DV DC  Powered_Up_Time  Command/Feature_Name
  -- == -- == -- == == == -- -- -- -- --  ---------------  --------------------
  c8 00 00 00 00 87 ed 5e 87 ed 5f e3 00     02:25:33.636  READ DMA
  c8 00 00 00 00 87 ec 5e 87 ec 5f e3 00     02:25:33.634  READ DMA
  25 00 00 02 00 00 00 03 87 ea 5f e0 00     02:25:33.630  READ DMA EXT
  c8 00 00 00 00 87 e9 5e 87 e9 5f e3 00     02:25:33.628  READ DMA
  c8 00 00 00 00 87 e8 5e 87 e8 5f e3 00     02:25:33.624  READ DMA

Error 2706 [145] occurred at disk power-on lifetime: 20528 hours (855 days + 8 hours)
  When the command that caused the error occurred, the device was active or idle.

  After command completion occurred, registers were:
  ER -- ST COUNT  LBA_48  LH LM LL DV DC
  -- -- -- == -- == == == -- -- -- -- --
  40 -- 51 01 03 00 00 03 87 e3 5c e3 00  Error: UNC 259 sectors at LBA = 0x0387e35c = 59237212

  Commands leading to the command that caused the error were:
  CR FEATR COUNT  LBA_48  LH LM LL DV DC  Powered_Up_Time  Command/Feature_Name
  -- == -- == -- == == == -- -- -- -- --  ---------------  --------------------
  25 00 00 02 00 00 00 03 87 e2 5f e0 00     02:25:29.599  READ DMA EXT
  c8 00 00 00 00 87 e1 5e 87 e1 5f e3 00     02:25:29.597  READ DMA
  c8 00 00 b7 00 87 de a8 87 e0 5f e3 00     02:25:29.557  READ DMA
  25 00 00 02 00 00 00 03 87 de 5f e0 00     02:25:21.659  READ DMA EXT
  25 00 00 02 00 00 00 03 87 dc 5f e0 00     02:25:21.656  READ DMA EXT

Error 2705 [144] occurred at disk power-on lifetime: 20528 hours (855 days + 8 hours)
  When the command that caused the error occurred, the device was active or idle.

  After command completion occurred, registers were:
  ER -- ST COUNT  LBA_48  LH LM LL DV DC
  -- -- -- == -- == == == -- -- -- -- --
  40 -- 51 01 b7 00 00 03 87 de a8 e3 00  Error: UNC 439 sectors at LBA = 0x0387dea8 = 59236008

  Commands leading to the command that caused the error were:
  CR FEATR COUNT  LBA_48  LH LM LL DV DC  Powered_Up_Time  Command/Feature_Name
  -- == -- == -- == == == -- -- -- -- --  ---------------  --------------------
  25 00 00 02 00 00 00 03 87 de 5f e0 00     02:25:21.659  READ DMA EXT
  25 00 00 02 00 00 00 03 87 dc 5f e0 00     02:25:21.656  READ DMA EXT
  ca 00 00 00 08 5b a9 6e 5b a9 9f ee 00     02:25:21.656  WRITE DMA
  ca 00 00 00 08 5b a9 2e 5b a9 67 ee 00     02:25:21.655  WRITE DMA
  ca 00 00 00 10 5b a9 0e 5b a9 1f ee 00     02:25:21.655  WRITE DMA

Error 2704 [143] occurred at disk power-on lifetime: 20528 hours (855 days + 8 hours)
  When the command that caused the error occurred, the device was active or idle.

  After command completion occurred, registers were:
  ER -- ST COUNT  LBA_48  LH LM LL DV DC
  -- -- -- == -- == == == -- -- -- -- --
  40 -- 51 00 6b 00 00 03 87 d9 f4 e3 00  Error: UNC 107 sectors at LBA = 0x0387d9f4 = 59234804

  Commands leading to the command that caused the error were:
  CR FEATR COUNT  LBA_48  LH LM LL DV DC  Powered_Up_Time  Command/Feature_Name
  -- == -- == -- == == == -- -- -- -- --  ---------------  --------------------
  c8 00 00 00 00 87 d9 5e 87 d9 5f e3 00     02:25:13.501  READ DMA
  c8 00 00 00 00 87 d8 5e 87 d8 5f e3 00     02:25:13.498  READ DMA
  25 00 00 02 00 00 00 03 87 d6 5f e0 00     02:25:13.493  READ DMA EXT
  c8 00 00 1f 00 87 d5 40 87 d5 5f e3 00     02:25:08.377  READ DMA
  c8 00 00 00 00 87 d4 5e 87 d4 5f e3 00     02:25:04.299  READ DMA

Error 2703 [142] occurred at disk power-on lifetime: 20528 hours (855 days + 8 hours)
  When the command that caused the error occurred, the device was active or idle.

  After command completion occurred, registers were:
  ER -- ST COUNT  LBA_48  LH LM LL DV DC
  -- -- -- == -- == == == -- -- -- -- --
  40 -- 51 00 1f 00 00 03 87 d5 40 e3 00  Error: UNC 31 sectors at LBA = 0x0387d540 = 59233600

  Commands leading to the command that caused the error were:
  CR FEATR COUNT  LBA_48  LH LM LL DV DC  Powered_Up_Time  Command/Feature_Name
  -- == -- == -- == == == -- -- -- -- --  ---------------  --------------------
  c8 00 00 00 00 87 d4 5e 87 d4 5f e3 00     02:25:04.299  READ DMA
  25 00 00 02 00 00 00 03 87 d2 5f e0 00     02:25:04.295  READ DMA EXT
  c8 00 00 d3 00 87 d0 8c 87 d1 5f e3 00     02:25:02.332  READ DMA
  c8 00 00 00 00 87 d0 5e 87 d0 5f e3 00     02:24:52.801  READ DMA
  25 00 00 02 00 00 00 03 87 ce 5f e0 00     02:24:52.797  READ DMA EXT

Error 2702 [141] occurred at disk power-on lifetime: 20528 hours (855 days + 8 hours)
  When the command that caused the error occurred, the device was active or idle.

  After command completion occurred, registers were:
  ER -- ST COUNT  LBA_48  LH LM LL DV DC
  -- -- -- == -- == == == -- -- -- -- --
  40 -- 51 00 d3 00 00 03 87 d0 8c e3 00  Error: UNC 211 sectors at LBA = 0x0387d08c = 59232396

  Commands leading to the command that caused the error were:
  CR FEATR COUNT  LBA_48  LH LM LL DV DC  Powered_Up_Time  Command/Feature_Name
  -- == -- == -- == == == -- -- -- -- --  ---------------  --------------------
  c8 00 00 00 00 87 d0 5e 87 d0 5f e3 00     02:24:52.801  READ DMA
  25 00 00 02 00 00 00 03 87 ce 5f e0 00     02:24:52.797  READ DMA EXT
  c8 00 00 00 00 61 4b 0e 87 cd 5f e3 00     02:24:52.794  READ DMA
  ca 00 00 00 08 5b 76 de 61 4b 07 e0 00     02:24:52.794  WRITE DMA
  ca 00 00 00 08 87 cd 5e 5b 76 d7 ee 00     02:24:52.794  WRITE DMA

Error 2701 [140] occurred at disk power-on lifetime: 20528 hours (855 days + 8 hours)
  When the command that caused the error occurred, the device was active or idle.

  After command completion occurred, registers were:
  ER -- ST COUNT  LBA_48  LH LM LL DV DC
  -- -- -- == -- == == == -- -- -- -- --
  40 -- 51 00 87 00 00 03 87 cb d8 e3 00  Error: UNC 135 sectors at LBA = 0x0387cbd8 = 59231192

  Commands leading to the command that caused the error were:
  CR FEATR COUNT  LBA_48  LH LM LL DV DC  Powered_Up_Time  Command/Feature_Name
  -- == -- == -- == == == -- -- -- -- --  ---------------  --------------------
  25 00 00 02 00 00 00 03 87 ca 5f e0 00     02:24:44.842  READ DMA EXT
  c8 00 00 00 00 87 c9 5e 87 c9 5f e3 00     02:24:44.840  READ DMA
  c8 00 00 00 00 87 c8 5e 87 c8 5f e3 00     02:24:44.839  READ DMA
  25 00 00 02 00 00 00 03 87 c6 5f e0 00     02:24:44.784  READ DMA EXT
  c8 00 00 00 00 87 c5 5e 87 c5 5f e3 00     02:24:44.782  READ DMA

Error 2700 [139] occurred at disk power-on lifetime: 20528 hours (855 days + 8 hours)
  When the command that caused the error occurred, the device was active or idle.

  After command completion occurred, registers were:
  ER -- ST COUNT  LBA_48  LH LM LL DV DC
  -- -- -- == -- == == == -- -- -- -- --
  40 -- 51 00 e8 00 00 03 8f e0 57 e3 00  Error: UNC 232 sectors at LBA = 0x038fe057 = 59760727

  Commands leading to the command that caused the error were:
  CR FEATR COUNT  LBA_48  LH LM LL DV DC  Powered_Up_Time  Command/Feature_Name
  -- == -- == -- == == == -- -- -- -- --  ---------------  --------------------
  25 00 00 02 00 00 00 03 8f df 3f e0 00     02:24:40.586  READ DMA EXT
  c8 00 00 00 00 8f de 3e 8f de 3f e3 00     02:24:40.584  READ DMA
  c8 00 00 9c 00 8f db a3 8f dd 3f e3 00     02:24:40.564  READ DMA
  25 00 00 02 00 00 00 03 8f db 3f e0 00     02:24:36.564  READ DMA EXT
  c8 00 00 00 00 8f da 3e 8f da 3f e3 00     02:24:36.563  READ DMA

SMART Extended Self-test Log Version: 1 (1 sectors)
Num  Test_Description    Status                  Remaining  LifeTime(hours)  LBA_of_first_error
# 1  Short offline       Completed: read failure       90%     20946         474919

SMART Selective self-test log data structure revision number 1
 SPAN  MIN_LBA  MAX_LBA  CURRENT_TEST_STATUS
    1        0        0  Not_testing
    2        0        0  Not_testing
    3        0        0  Not_testing
    4        0        0  Not_testing
    5        0        0  Not_testing
Selective self-test flags (0x0):
  After scanning selected spans, do NOT read-scan remainder of disk.
If Selective self-test is pending on power-up, resume after 0 minute delay.

SCT Status Version:                  2
SCT Version (vendor specific):       1 (0x0001)
Device State:                        Active (0)
Current Temperature:                    40 Celsius
Power Cycle Min/Max Temperature:     38/40 Celsius
Lifetime    Min/Max Temperature:      7/76 Celsius
Under/Over Temperature Limit Count:   0/295921

SCT Temperature History Version:     2
Temperature Sampling Period:         1 minute
Temperature Logging Interval:        1 minute
Min/Max recommended Temperature:      5/55 Celsius
Min/Max Temperature Limit:            5/55 Celsius
Temperature History Size (Index):    478 (340)

SCT Error Recovery Control command not supported

Device Statistics (GP/SMART Log 0x04) not supported

Pending Defects log (GP Log 0x0c) not supported

SATA Phy Event Counters (GP Log 0x11)
ID      Size     Value  Description
0x0001  4            0  Command failed due to ICRC error
0x0002  4            0  R_ERR response for data FIS
0x0003  4            0  R_ERR response for device-to-host data FIS
0x0004  4            0  R_ERR response for host-to-device data FIS
0x0005  4            0  R_ERR response for non-data FIS
0x0006  4            0  R_ERR response for device-to-host non-data FIS
0x0007  4            0  R_ERR response for host-to-device non-data FIS
0x0008  4            0  Device-to-host non-data FIS retries
0x0009  4            7  Transition from drive PhyRdy to drive PhyNRdy
0x000a  4            7  Device-to-host register FISes sent due to a COMRESET
0x000b  4            0  CRC errors within host-to-device FIS
0x000d  4            0  Non-CRC errors within host-to-device FIS
0x000f  4            0  R_ERR response for host-to-device data FIS, CRC
0x0010  4            0  R_ERR response for host-to-device data FIS, non-CRC
0x0012  4            0  R_ERR response for host-to-device non-data FIS, CRC
0x0013  4            0  R_ERR response for host-to-device non-data FIS, non-CRC

