smartctl 7.4 2023-08-01 r5530 [FreeBSD 13.2-STABLE amd64] (local build)
Copyright (C) 2002-23, Bruce Allen, Christian Franke, www.smartmontools.org

=== START OF INFORMATION SECTION ===
Model Number:                       INTEL SSDPEKNU020TZ
Serial Number:                      --
Firmware Version:                   002C
PCI Vendor/Subsystem ID:            0x8086
IEEE OUI Identifier:                0x5cd2e4
Controller ID:                      1
NVMe Version:                       1.4
Number of Namespaces:               1
Namespace 1 Size/Capacity:          2,048,408,248,320 [2.04 TB]
Namespace 1 Formatted LBA Size:     512
Local Time is:                      Fri Oct 20 15:13:30 2023 MDT
Firmware Updates (0x14):            2 Slots, no Reset required
Optional Admin Commands (0x0017):   Security Format Frmw_DL Self_Test
Optional NVM Commands (0x005f):     Comp Wr_Unc DS_Mngmt Wr_Zero Sav/Sel_Feat Timestmp
Log Page Attributes (0x0f):         S/H_per_NS Cmd_Eff_Lg Ext_Get_Lg Telmtry_Lg
Maximum Data Transfer Size:         64 Pages
Warning  Comp. Temp. Threshold:     77 Celsius
Critical Comp. Temp. Threshold:     80 Celsius

Supported Power States
St Op     Max   Active     Idle   RL RT WL WT  Ent_Lat  Ex_Lat
 0 +     5.50W       -        -    0  0  0  0        0       0
 1 +     3.60W       -        -    1  1  1  1        0       0
 2 +     2.60W       -        -    2  2  2  2        0       0
 3 -   0.0250W       -        -    3  3  3  3     5000    5000
 4 -   0.0040W       -        -    4  4  4  4     3000   11999

Supported LBA Sizes (NSID 0x1)
Id Fmt  Data  Metadt  Rel_Perf
 0 +     512       0         0

=== START OF SMART DATA SECTION ===
SMART overall-health self-assessment test result: PASSED

SMART/Health Information (NVMe Log 0x02)
Critical Warning:                   0x00
Temperature:                        26 Celsius
Available Spare:                    100%
Available Spare Threshold:          10%
Percentage Used:                    0%
Data Units Read:                    926,752 [474 GB]
Data Units Written:                 2,798,173 [1.43 TB]
Host Read Commands:                 34,952,691
Host Write Commands:                88,829,405
Controller Busy Time:               805
Power Cycles:                       1,026
Power On Hours:                     342
Unsafe Shutdowns:                   356
Media and Data Integrity Errors:    0
Error Information Log Entries:      0
Warning  Comp. Temperature Time:    0
Critical Comp. Temperature Time:    0
Thermal Temp. 1 Transition Count:   11
Thermal Temp. 1 Total Time:         415

Warning: NVMe Get Log truncated to 0x200 bytes, 0x200 bytes zero filled
Error Information (NVMe Log 0x01, 16 of 256 entries)
No Errors Logged

Warning: NVMe Get Log truncated to 0x200 bytes, 0x034 bytes zero filled
Self-test Log (NVMe Log 0x06)
Self-test status: No self-test in progress
No Self-tests Logged



