smartctl 7.4 2023-08-01 r5530 [FreeBSD 14.0-RELEASE amd64] (local build)
Copyright (C) 2002-23, Bruce Allen, Christian Franke, www.smartmontools.org

=== START OF INFORMATION SECTION ===
Model Family:     Phison Driven SSDs
Device Model:     KINGSTON SA400S37120G
Serial Number:    --
LU WWN Device Id: 5 0026b7 ...
Firmware Version: SBFK71E0
User Capacity:    120,034,123,776 bytes [120 GB]
Sector Size:      512 bytes logical/physical
Rotation Rate:    Solid State Device
Form Factor:      2.5 inches
TRIM Command:     Available
Device is:        In smartctl database 7.3/5528
ATA Version is:   ACS-4 (minor revision not indicated)
SATA Version is:  SATA 3.2, 6.0 Gb/s (current: 3.0 Gb/s)
Local Time is:    Tue Mar 11 09:30:27 2025    
SMART support is: Available - device has SMART capability.
SMART support is: Enabled
AAM feature is:   Unavailable
APM feature is:   Unavailable
Rd look-ahead is: Enabled
Write cache is:   Enabled
DSN feature is:   Unavailable
ATA Security is:  Disabled, frozen [SEC2]
Wt Cache Reorder: Unavailable

=== START OF READ SMART DATA SECTION ===
SMART overall-health self-assessment test result: PASSED

General SMART Values:
Offline data collection status:  (0x00)	Offline data collection activity
					was never started.
					Auto Offline Data Collection: Disabled.
Self-test execution status:      (  32)	The self-test routine was interrupted
					by the host with a hard or soft reset.
Total time to complete Offline 
data collection: 		(65535) seconds.
Offline data collection
capabilities: 			 (0x79) SMART execute Offline immediate.
					No Auto Offline data collection support.
					Suspend Offline collection upon new
					command.
					Offline surface scan supported.
					Self-test supported.
					Conveyance Self-test supported.
					Selective Self-test supported.
SMART capabilities:            (0x0003)	Saves SMART data before entering
					power-saving mode.
					Supports SMART auto save timer.
Error logging capability:        (0x01)	Error logging supported.
					General Purpose Logging supported.
Short self-test routine 
recommended polling time: 	 (   2) minutes.
Extended self-test routine
recommended polling time: 	 (  30) minutes.
Conveyance self-test routine
recommended polling time: 	 (   6) minutes.

SMART Attributes Data Structure revision number: 16
Vendor Specific SMART Attributes with Thresholds:
ID# ATTRIBUTE_NAME          FLAGS    VALUE WORST THRESH FAIL RAW_VALUE
  1 Raw_Read_Error_Rate     -O--CK   000   100   000    -    0
  9 Power_On_Hours          -O--CK   100   100   000    -    17615
 12 Power_Cycle_Count       -O--CK   100   100   000    -    5320
148 Unknown_Attribute       ------   100   100   000    -    0
149 Unknown_Attribute       ------   100   100   000    -    0
167 Write_Protect_Mode      ------   100   100   000    -    0
168 SATA_Phy_Error_Count    -O--C-   100   100   000    -    0
169 Bad_Block_Rate          ------   100   100   000    -    11
170 Bad_Blk_Ct_Lat/Erl      ------   100   100   000    -    0/13
172 Erase_Fail_Count        -O--CK   100   100   000    -    0
173 MaxAvgErase_Ct          ------   100   100   000    -    143 (Average 137)
181 Program_Fail_Count      -O--CK   100   100   000    -    0
182 Erase_Fail_Count        ------   100   100   000    -    0
187 Reported_Uncorrect      -O--CK   100   100   000    -    0
192 Unsafe_Shutdown_Count   -O--C-   100   100   000    -    791
194 Temperature_Celsius     -O---K   072   055   000    -    28 (Min/Max 10/45)
196 Reallocated_Event_Count -O--CK   100   100   000    -    0
199 SATA_CRC_Error_Count    -O--CK   100   100   000    -    0
218 CRC_Error_Count         -O--CK   100   100   000    -    0
231 SSD_Life_Left           ------   014   014   000    -    86
233 Flash_Writes_GiB        -O--CK   100   100   000    -    15415
241 Lifetime_Writes_GiB     -O--CK   100   100   000    -    18138
242 Lifetime_Reads_GiB      -O--CK   100   100   000    -    7812
244 Average_Erase_Count     ------   100   100   000    -    137
245 Max_Erase_Count         ------   100   100   000    -    143
246 Total_Erase_Count       ------   100   100   000    -    798396
                            ||||||_ K auto-keep
                            |||||__ C event count
                            ||||___ R error rate
                            |||____ S speed/performance
                            ||_____ O updated online
                            |______ P prefailure warning

General Purpose Log Directory Version 1
SMART           Log Directory Version 1 [multi-sector log support]
Address    Access  R/W   Size  Description
0x00       GPL,SL  R/O      1  Log Directory
0x01           SL  R/O      1  Summary SMART error log
0x02           SL  R/O     51  Comprehensive SMART error log
0x03       GPL     R/O     64  Ext. Comprehensive SMART error log
0x04       GPL,SL  R/O      8  Device Statistics log
0x06           SL  R/O      1  SMART self-test log
0x07       GPL     R/O      1  Extended self-test log
0x09           SL  R/W      1  Selective self-test log
0x10       GPL     R/O      1  NCQ Command Error log
0x11       GPL     R/O      1  SATA Phy Event Counters log
0x30       GPL,SL  R/O      9  IDENTIFY DEVICE data log
0x80-0x9f  GPL,SL  R/W     16  Host vendor specific log

SMART Extended Comprehensive Error Log Version: 1 (64 sectors)
No Errors Logged

SMART Extended Self-test Log Version: 1 (1 sectors)
Num  Test_Description    Status                  Remaining  LifeTime(hours)  LBA_of_first_error
# 1  Short offline       Interrupted (host reset)      00%     17572         -
# 2  Short offline       Completed without error       00%     17327         -
# 3  Short offline       Completed without error       00%     17327         -
# 4  Short offline       Completed without error       00%     17114         -
# 5  Short offline       Completed without error       00%     15050         -
# 6  Short offline       Completed without error       00%     11144         -
# 7  Short offline       Completed without error       00%      9350         -
# 8  Short offline       Completed without error       00%      9339         -
# 9  Short offline       Completed without error       00%      9329         -
#10  Short offline       Completed without error       00%      9318         -
#11  Short offline       Completed without error       00%      9317         -
#12  Short offline       Completed without error       00%      9288         -
#13  Short offline       Completed without error       00%      9264         -
#14  Short offline       Completed without error       00%      9250         -
#15  Short offline       Completed without error       00%      9236         -
#16  Short offline       Completed without error       00%      9030         -
#17  Extended offline    Interrupted (host reset)      00%      8904         -
#18  Short offline       Completed without error       00%      8867         -
#19  Short offline       Completed without error       00%      8861         -

SMART Selective self-test log data structure revision number 0
Note: revision number not 1 implies that no selective self-test has ever been run
 SPAN  MIN_LBA  MAX_LBA  CURRENT_TEST_STATUS
    1        0        0  Not_testing
    2        0        0  Not_testing
    3        0        0  Not_testing
    4        0        0  Not_testing
    5        0        0  Not_testing
Selective self-test flags (0x0):
  After scanning selected spans, do NOT read-scan remainder of disk.
If Selective self-test is pending on power-up, resume after 0 minute delay.

SCT Commands not supported

Device Statistics (GP Log 0x04)
Page  Offset Size        Value Flags Description
0x01  =====  =               =  ===  == General Statistics (rev 1) ==
0x01  0x008  4            5320  ---  Lifetime Power-On Resets
0x01  0x010  4           17615  ---  Power-on Hours
0x01  0x018  6     38038972741  ---  Logical Sectors Written
0x01  0x028  6     16382956778  ---  Logical Sectors Read
0x04  =====  =               =  ===  == General Errors Statistics (rev 1) ==
0x04  0x008  4               0  ---  Number of Reported Uncorrectable Errors
0x05  =====  =               =  ===  == Temperature Statistics (rev 1) ==
0x05  0x008  1              28  ---  Current Temperature
0x05  0x020  1              45  ---  Highest Temperature
0x05  0x028  1              10  ---  Lowest Temperature
0x06  =====  =               =  ===  == Transport Statistics (rev 1) ==
0x06  0x018  4               0  ---  Number of Interface CRC Errors
0x07  =====  =               =  ===  == Solid State Device Statistics (rev 1) ==
0x07  0x008  1              13  ---  Percentage Used Endurance Indicator
                                |||_ C monitored condition met
                                ||__ D supports DSN
                                |___ N normalized value

Pending Defects log (GP Log 0x0c) not supported

SATA Phy Event Counters (GP Log 0x11)
ID      Size     Value  Description
0x0001  2            0  Command failed due to ICRC error
0x0003  2            0  R_ERR response for device-to-host data FIS
0x0004  2            0  R_ERR response for host-to-device data FIS
0x0006  2            0  R_ERR response for device-to-host non-data FIS
0x0007  2            0  R_ERR response for host-to-device non-data FIS
0x0008  2            0  Device-to-host non-data FIS retries
0x0009  4            7  Transition from drive PhyRdy to drive PhyNRdy
0x000a  4           22  Device-to-host register FISes sent due to a COMRESET
0x000f  2            0  R_ERR response for host-to-device data FIS, CRC
0x0010  2            0  R_ERR response for host-to-device data FIS, non-CRC
0x0012  2            0  R_ERR response for host-to-device non-data FIS, CRC
0x0013  2            0  R_ERR response for host-to-device non-data FIS, non-CRC

