smartctl 7.4 2023-08-01 r5530 [FreeBSD 13.2-RELEASE-p7 amd64] (local build)
Copyright (C) 2002-23, Bruce Allen, Christian Franke, www.smartmontools.org

=== START OF INFORMATION SECTION ===
Model Number:                       FORESEE XP1000F128G
Serial Number:                      --
Firmware Version:                   V1.28
PCI Vendor/Subsystem ID:            0x1d97
IEEE OUI Identifier:                0x3a5a27
Total NVM Capacity:                 128,035,676,160 [128 GB]
Unallocated NVM Capacity:           0
Controller ID:                      0
NVMe Version:                       1.4
Number of Namespaces:               1
Namespace 1 Size/Capacity:          128,035,676,160 [128 GB]
Namespace 1 Formatted LBA Size:     512
Namespace 1 IEEE EUI-64:            3a5a27 ...
Local Time is:                      Mon Jan  8 19:19:00 2024 CET
Firmware Updates (0x02):            1 Slot
Optional Admin Commands (0x0017):   Security Format Frmw_DL Self_Test
Optional NVM Commands (0x005c):     DS_Mngmt Wr_Zero Sav/Sel_Feat Timestmp
Log Page Attributes (0x0a):         Cmd_Eff_Lg Telmtry_Lg
Maximum Data Transfer Size:         32 Pages
Warning  Comp. Temp. Threshold:     85 Celsius
Critical Comp. Temp. Threshold:     90 Celsius

Supported Power States
St Op     Max   Active     Idle   RL RT WL WT  Ent_Lat  Ex_Lat
 0 +     5.00W       -        -    0  0  0  0        5       5
 1 +     4.00W       -        -    1  1  1  1       30      30
 2 +     4.00W       -        -    2  2  2  2       30      30
 3 -   0.0700W       -        -    3  3  3  3     5000    5000
 4 -   0.0050W       -        -    4  4  4  4     5000   10000

Supported LBA Sizes (NSID 0x1)
Id Fmt  Data  Metadt  Rel_Perf
 0 +     512       0         3

=== START OF SMART DATA SECTION ===
SMART overall-health self-assessment test result: PASSED

SMART/Health Information (NVMe Log 0x02)
Critical Warning:                   0x00
Temperature:                        40 Celsius
Available Spare:                    100%
Available Spare Threshold:          10%
Percentage Used:                    0%
Data Units Read:                    26,526 [13.5 GB]
Data Units Written:                 810,470 [414 GB]
Host Read Commands:                 782,336
Host Write Commands:                10,774,633
Controller Busy Time:               0
Power Cycles:                       16
Power On Hours:                     798
Unsafe Shutdowns:                   0
Media and Data Integrity Errors:    0
Error Information Log Entries:      0
Warning  Comp. Temperature Time:    0
Critical Comp. Temperature Time:    0

Error Information (NVMe Log 0x01, 16 of 64 entries)
No Errors Logged

Self-test Log (NVMe Log 0x06)
Self-test status: No self-test in progress
No Self-tests Logged

