smartctl 7.3 2022-02-28 r5338 [OpenBSD 7.3 amd64] (local build)
Copyright (C) 2002-22, Bruce Allen, Christian Franke, www.smartmontools.org

=== START OF INFORMATION SECTION ===
Device Model:     SanDisk X400 M.2 2280 512GB
Serial Number:    --
LU WWN Device Id: 5 001b44 ...
Firmware Version: X4130012
User Capacity:    512,110,190,592 bytes [512 GB]
Sector Size:      512 bytes logical/physical
Rotation Rate:    Solid State Device
Form Factor:      M.2
TRIM Command:     Available, deterministic, zeroed
Device is:        Not in smartctl database 7.3/5319
ATA Version is:   ACS-2 T13/2015-D revision 3
SATA Version is:  SATA 3.2, 6.0 Gb/s (current: 6.0 Gb/s)
Local Time is:    Fri Sep 22 08:06:32 2023 GMT
SMART support is: Available - device has SMART capability.
SMART support is: Enabled

=== START OF READ SMART DATA SECTION ===
SMART Status not supported: Incomplete response, ATA output registers missing
SMART overall-health self-assessment test result: PASSED
Warning: This result is based on an Attribute check.

General SMART Values:
Offline data collection status:  (0x00)	Offline data collection activity
					was never started.
					Auto Offline Data Collection: Disabled.
Self-test execution status:      (   0)	The previous self-test routine completed
					without error or no self-test has ever 
					been run.
Total time to complete Offline 
data collection: 		(    0) seconds.
Offline data collection
capabilities: 			 (0x11) SMART execute Offline immediate.
					No Auto Offline data collection support.
					Suspend Offline collection upon new
					command.
					No Offline surface scan supported.
					Self-test supported.
					No Conveyance Self-test supported.
					No Selective Self-test supported.
SMART capabilities:            (0x0003)	Saves SMART data before entering
					power-saving mode.
					Supports SMART auto save timer.
Error logging capability:        (0x01)	Error logging supported.
					General Purpose Logging supported.
Short self-test routine 
recommended polling time: 	 (   2) minutes.
Extended self-test routine
recommended polling time: 	 (  10) minutes.
SCT capabilities: 	       (0x003d)	SCT Status supported.
					SCT Error Recovery Control supported.
					SCT Feature Control supported.
					SCT Data Table supported.

SMART Attributes Data Structure revision number: 4
Vendor Specific SMART Attributes with Thresholds:
ID# ATTRIBUTE_NAME          FLAG     VALUE WORST THRESH TYPE      UPDATED  WHEN_FAILED RAW_VALUE
  5 Reallocated_Sector_Ct   0x0032   100   100   ---    Old_age   Always       -       0
  9 Power_On_Hours          0x0032   100   100   ---    Old_age   Always       -       16214
 12 Power_Cycle_Count       0x0032   100   100   ---    Old_age   Always       -       9621
175 Program_Fail_Count_Chip 0x0032   100   100   ---    Old_age   Always       -       0
176 Erase_Fail_Count_Chip   0x0032   100   100   ---    Old_age   Always       -       0
177 Wear_Leveling_Count     0x0032   100   100   ---    Old_age   Always       -       64
178 Used_Rsvd_Blk_Cnt_Chip  0x0032   100   100   ---    Old_age   Always       -       0
179 Used_Rsvd_Blk_Cnt_Tot   0x0032   100   100   ---    Old_age   Always       -       0
180 Unused_Rsvd_Blk_Cnt_Tot 0x0033   100   100   004    Pre-fail  Always       -       20740
181 Program_Fail_Cnt_Total  0x0032   100   100   ---    Old_age   Always       -       0
182 Erase_Fail_Count_Total  0x0032   100   100   ---    Old_age   Always       -       0
187 Reported_Uncorrect      0x0032   100   100   ---    Old_age   Always       -       0
194 Temperature_Celsius     0x0022   056   075   ---    Old_age   Always       -       44 (Min/Max 21/75)
195 Hardware_ECC_Recovered  0x0032   100   100   ---    Old_age   Always       -       0
199 UDMA_CRC_Error_Count    0x0032   100   100   ---    Old_age   Always       -       0
230 Unknown_SSD_Attribute   0x0032   100   100   ---    Old_age   Always       -       12313823152947
238 Unknown_Attribute       0x0032   089   100   ---    Old_age   Always       -       14847324
241 Total_LBAs_Written      0x0030   253   253   ---    Old_age   Offline      -       76254004987
242 Total_LBAs_Read         0x0030   253   253   ---    Old_age   Offline      -       104309043556

SMART Error Log Version: 1
No Errors Logged

SMART Self-test log structure revision number 1
Num  Test_Description    Status                  Remaining  LifeTime(hours)  LBA_of_first_error
# 1  Short offline       Completed without error       00%     13627         -
# 2  Short offline       Completed without error       00%     13543         -
# 3  Short offline       Completed without error       00%     13250         -
# 4  Short offline       Completed without error       00%     13175         -
# 5  Short offline       Completed without error       00%     13150         -
# 6  Short offline       Completed without error       00%     13144         -
# 7  Short offline       Completed without error       00%     13105         -
# 8  Short offline       Completed without error       00%     12567         -
# 9  Short offline       Completed without error       00%     12530         -
#10  Short offline       Completed without error       00%     12523         -
#11  Extended offline    Completed without error       00%     12513         -
#12  Short offline       Completed without error       00%     12085         -
#13  Short offline       Completed without error       00%     12003         -
#14  Short offline       Completed without error       00%     11498         -
#15  Short offline       Completed without error       00%     11475         -
#16  Short offline       Aborted by host               00%      3151         -
#17  Short offline       Completed without error       00%     11452         -
#18  Short offline       Completed without error       00%     11440         -
#19  Short offline       Completed without error       00%     11429         -
#20  Short offline       Completed without error       00%     11418         -
#21  Extended offline    Completed without error       00%     11409         -

Selective Self-tests/Logging not supported



