smartctl 7.1 2019-12-30 r5022 [FreeBSD 12.1-RELEASE-p5 amd64] (local build)
Copyright (C) 2002-19, Bruce Allen, Christian Franke, www.smartmontools.org

=== START OF INFORMATION SECTION ===
Model Family:     Marvell based SanDisk SSDs
Device Model:     SanDisk SD5SG2256G1052E
Serial Number:    --
LU WWN Device Id: 5 001b44 ...
Firmware Version: 10.04.01
User Capacity:    256,060,514,304 bytes [256 GB]
Sector Size:      512 bytes logical/physical
Rotation Rate:    Solid State Device
Form Factor:      mSATA
Device is:        In smartctl database [for details use: -P show]
ATA Version is:   ATA8-ACS T13/1699-D revision 6
SATA Version is:  SATA 3.0, 6.0 Gb/s (current: 6.0 Gb/s)
Local Time is:    Fri May 22 13:00:39 2020 PDT
SMART support is: Available - device has SMART capability.
SMART support is: Enabled
AAM feature is:   Unavailable
APM level is:     128 (minimum power consumption without standby)
Rd look-ahead is: Enabled
Write cache is:   Enabled
DSN feature is:   Unavailable
ATA Security is:  ENABLED, PW level HIGH, not locked, not frozen [SEC5]
Wt Cache Reorder: Unavailable

=== START OF READ SMART DATA SECTION ===
SMART overall-health self-assessment test result: PASSED

General SMART Values:
Offline data collection status:  (0x00)	Offline data collection activity
					was never started.
					Auto Offline Data Collection: Disabled.
Self-test execution status:      (   0)	The previous self-test routine completed
					without error or no self-test has ever 
					been run.
Total time to complete Offline 
data collection: 		(    0) seconds.
Offline data collection
capabilities: 			 (0x13) SMART execute Offline immediate.
					Auto Offline data collection on/off support.
					Suspend Offline collection upon new
					command.
					No Offline surface scan supported.
					Self-test supported.
					No Conveyance Self-test supported.
					No Selective Self-test supported.
SMART capabilities:            (0x0003)	Saves SMART data before entering
					power-saving mode.
					Supports SMART auto save timer.
Error logging capability:        (0x01)	Error logging supported.
					General Purpose Logging supported.
Short self-test routine 
recommended polling time: 	 (   2) minutes.
Extended self-test routine
recommended polling time: 	 (  10) minutes.

SMART Attributes Data Structure revision number: 4
Vendor Specific SMART Attributes with Thresholds:
ID# ATTRIBUTE_NAME          FLAGS    VALUE WORST THRESH FAIL RAW_VALUE
  1 Raw_Read_Error_Rate     -OSR--   100   100   ---    -    1
  5 Reallocated_Sector_Ct   -O--CK   100   100   ---    -    0
  9 Power_On_Hours          -O--CK   253   100   ---    -    5914
 12 Power_Cycle_Count       -O--CK   100   100   ---    -    1458
167 Min_Bad_Block/Die       -O--CK   100   100   ---    -    81
168 Maximum_Erase_Cycle     -O--CK   100   100   ---    -    139
169 Total_Bad_Block         -O--CK   100   100   ---    -    460
171 Program_Fail_Count      -O--CK   100   100   ---    -    0
172 Erase_Fail_Count        -O--CK   100   100   ---    -    0
173 Avg_Write/Erase_Count   -O--CK   100   100   ---    -    42
174 Unexpect_Power_Loss_Ct  -O--CK   100   100   ---    -    91
184 End-to-End_Error        -O--CK   100   100   ---    -    0
194 Temperature_Celsius     -O---K   063   060   ---    -    37 (Min/Max 19/60)
212 SATA_PHY_Error          -O--CK   100   100   ---    -    0
230 Perc_Write/Erase_Count  -O--CK   100   100   ---    -    0 0 296
232 Perc_Avail_Resrvd_Space PO--CK   100   100   004    -    100
233 Total_NAND_Writes_GiB   -O--CK   100   100   ---    -    296
241 Total_Writes_GiB        ----CK   253   253   ---    -    10077225827
242 Total_Reads_GiB         ----CK   253   253   ---    -    12702927430
243 Unknown_Attribute       -O--CK   100   100   ---    -    4227858432
                            ||||||_ K auto-keep
                            |||||__ C event count
                            ||||___ R error rate
                            |||____ S speed/performance
                            ||_____ O updated online
                            |______ P prefailure warning

General Purpose Log Directory Version 1
SMART           Log Directory Version 1 [multi-sector log support]
Address    Access  R/W   Size  Description
0x00       GPL,SL  R/O      1  Log Directory
0x01           SL  R/O      1  Summary SMART error log
0x02           SL  R/O      2  Comprehensive SMART error log
0x03       GPL     R/O      1  Ext. Comprehensive SMART error log
0x04       GPL,SL  R/O      8  Device Statistics log
0x06           SL  R/O      1  SMART self-test log
0x07       GPL     R/O      1  Extended self-test log
0x10       GPL     R/O      1  NCQ Command Error log
0x11       GPL     R/O      1  SATA Phy Event Counters log
0x80-0x9f  GPL,SL  R/W     16  Host vendor specific log

SMART Extended Comprehensive Error Log Version: 1 (1 sectors)
No Errors Logged

SMART Extended Self-test Log Version: 1 (1 sectors)
Num  Test_Description    Status                  Remaining  LifeTime(hours)  LBA_of_first_error
# 1  Short offline       Completed without error       00%      3381         -

Selective Self-tests/Logging not supported

SCT Commands not supported

Pending Defects log (GP Log 0x0c) not supported

SATA Phy Event Counters (GP Log 0x11)
ID      Size     Value  Description
0x0001  4            0  Command failed due to ICRC error
0x0002  4            0  R_ERR response for data FIS
0x0005  4            0  R_ERR response for non-data FIS
0x000a  4            6  Device-to-host register FISes sent due to a COMRESET

