smartctl 7.3 2022-02-28 r5338 [FreeBSD 13.1-RELEASE-p3 amd64] (local build)
Copyright (C) 2002-22, Bruce Allen, Christian Franke, www.smartmontools.org

=== START OF INFORMATION SECTION ===
Model Number:                       SAMSUNG MZVLV256HCHP-000L2
Serial Number:                      --
Firmware Version:                   5L0QBXV7
PCI Vendor/Subsystem ID:            0x144d
IEEE OUI Identifier:                0x002538
Controller ID:                      1
NVMe Version:                       <1.2
Number of Namespaces:               1
Namespace 1 Size/Capacity:          256,060,514,304 [256 GB]
Namespace 1 Utilization:            230,025,428,992 [230 GB]
Namespace 1 Formatted LBA Size:     512
Local Time is:                      Wed Jan 25 17:07:11 2023 +0330
Firmware Updates (0x06):            3 Slots
Optional Admin Commands (0x0007):   Security Format Frmw_DL
Optional NVM Commands (0x001f):     Comp Wr_Unc DS_Mngmt Wr_Zero Sav/Sel_Feat
Log Page Attributes (0x01):         S/H_per_NS
Maximum Data Transfer Size:         32 Pages

Supported Power States
St Op     Max   Active     Idle   RL RT WL WT  Ent_Lat  Ex_Lat
 0 +     6.00W       -        -    0  0  0  0        5       5
 1 +     5.10W       -        -    1  1  1  1       30      30
 2 +     3.10W       -        -    2  2  2  2      100     100
 3 -   0.0700W       -        -    3  3  3  3      500    5000
 4 -   0.0050W       -        -    4  4  4  4     2000   22000

Supported LBA Sizes (NSID 0x1)
Id Fmt  Data  Metadt  Rel_Perf
 0 +     512       0         0

=== START OF SMART DATA SECTION ===
SMART overall-health self-assessment test result: PASSED

SMART/Health Information (NVMe Log 0x02)
Critical Warning:                   0x00
Temperature:                        48 Celsius
Available Spare:                    100%
Available Spare Threshold:          10%
Percentage Used:                    15%
Data Units Read:                    94,754,366 [48.5 TB]
Data Units Written:                 80,753,594 [41.3 TB]
Host Read Commands:                 1,282,475,615
Host Write Commands:                1,203,545,204
Controller Busy Time:               10,360
Power Cycles:                       5,076
Power On Hours:                     17,233
Unsafe Shutdowns:                   492
Media and Data Integrity Errors:    0
Error Information Log Entries:      21,322

Error Information (NVMe Log 0x01, 16 of 64 entries)
Num   ErrCount  SQId   CmdId  Status  PELoc          LBA  NSID    VS
  0      21322     0  0x0021  0x4004  0x000            0     0     -
  1      21321     0  0x0020  0x4004  0x000            0     0     -
  2      21320     0  0x0002  0x4004  0x000            0     0     -
  3      21319     0  0x0021  0x4004  0x000            0     0     -
  4      21318     0  0x0020  0x4004  0x000            0     0     -
  5      21317     0  0x0002  0x4004  0x000            0     0     -
  6      21316     0  0x0021  0x4004  0x000            0     0     -
  7      21315     0  0x0020  0x4004  0x000            0     0     -
  8      21314     0  0x0002  0x4004  0x000            0     0     -
  9      21313     0  0x0021  0x4004  0x000            0     0     -
 10      21312     0  0x0020  0x4004  0x000            0     0     -
 11      21311     0  0x0002  0x4004  0x000            0     0     -
 12      21310     0  0x0021  0x4004  0x000            0     0     -
 13      21309     0  0x0020  0x4004  0x000            0     0     -
 14      21308     0  0x0002  0x4004  0x000            0     0     -
 15      21307     0  0x0021  0x4004  0x000            0     0     -
... (48 entries not read)

