smartctl 7.4 2023-08-01 r5530 [FreeBSD 13.2-RELEASE-p10 amd64] (local build)
Copyright (C) 2002-23, Bruce Allen, Christian Franke, www.smartmontools.org

=== START OF INFORMATION SECTION ===
Device Model:     LITEON CV3-8D128-11 SATA 128GB
Serial Number:    --
LU WWN Device Id: 5 002303 ...
Firmware Version: T87110B
User Capacity:    128,035,676,160 bytes [128 GB]
Sector Size:      512 bytes logical/physical
Rotation Rate:    Solid State Device
Form Factor:      M.2
TRIM Command:     Available
Device is:        Not in smartctl database 7.3/5528
ATA Version is:   ATA8-ACS, ATA/ATAPI-7 T13/1532D revision 4a
SATA Version is:  SATA 3.1, 6.0 Gb/s (current: 6.0 Gb/s)
Local Time is:    Mon Apr  1 23:02:00 2024 BST
SMART support is: Available - device has SMART capability.
SMART support is: Enabled
AAM feature is:   Disabled
APM feature is:   Unavailable
Rd look-ahead is: Enabled
Write cache is:   Enabled
DSN feature is:   Unavailable
ATA Security is:  Disabled, frozen [SEC2]
Wt Cache Reorder: Disabled

=== START OF READ SMART DATA SECTION ===
SMART overall-health self-assessment test result: PASSED

General SMART Values:
Offline data collection status:  (0x00)	Offline data collection activity
					was never started.
					Auto Offline Data Collection: Disabled.
Self-test execution status:      (   0)	The previous self-test routine completed
					without error or no self-test has ever 
					been run.
Total time to complete Offline 
data collection: 		(   10) seconds.
Offline data collection
capabilities: 			 (0x15) SMART execute Offline immediate.
					No Auto Offline data collection support.
					Abort Offline collection upon new
					command.
					No Offline surface scan supported.
					Self-test supported.
					No Conveyance Self-test supported.
					No Selective Self-test supported.
SMART capabilities:            (0x0003)	Saves SMART data before entering
					power-saving mode.
					Supports SMART auto save timer.
Error logging capability:        (0x01)	Error logging supported.
					General Purpose Logging supported.
Short self-test routine 
recommended polling time: 	 (   2) minutes.
Extended self-test routine
recommended polling time: 	 (  11) minutes.
SCT capabilities: 	       (0x003d)	SCT Status supported.
					SCT Error Recovery Control supported.
					SCT Feature Control supported.
					SCT Data Table supported.

SMART Attributes Data Structure revision number: 1
Vendor Specific SMART Attributes with Thresholds:
ID# ATTRIBUTE_NAME          FLAGS    VALUE WORST THRESH FAIL RAW_VALUE
  5 Reallocated_Sector_Ct   PO----   100   100   000    -    0
  9 Power_On_Hours          -O----   100   100   000    -    6400
 12 Power_Cycle_Count       PO----   100   100   000    -    118
175 Program_Fail_Count_Chip PO----   100   100   000    -    0
176 Erase_Fail_Count_Chip   PO----   100   100   000    -    0
177 Wear_Leveling_Count     PO----   100   100   000    -    1066695
178 Used_Rsvd_Blk_Cnt_Chip  PO----   100   100   000    -    0
179 Used_Rsvd_Blk_Cnt_Tot   PO----   100   100   000    -    0
180 Unused_Rsvd_Blk_Cnt_Tot PO--CK   100   100   005    -    448
181 Program_Fail_Cnt_Total  PO----   100   100   000    -    0
182 Erase_Fail_Count_Total  PO----   100   100   000    -    0
187 Reported_Uncorrect      PO----   100   100   000    -    0
194 Temperature_Celsius     PO----   100   100   000    -    57
195 Hardware_ECC_Recovered  PO----   100   100   000    -    0
199 UDMA_CRC_Error_Count    PO----   100   100   000    -    0
238 Unknown_Attribute       PO----   060   100   000    -    40
241 Total_LBAs_Written      PO----   100   100   000    -    12120
242 Total_LBAs_Read         PO----   100   100   000    -    7754
                            ||||||_ K auto-keep
                            |||||__ C event count
                            ||||___ R error rate
                            |||____ S speed/performance
                            ||_____ O updated online
                            |______ P prefailure warning

General Purpose Log Directory Version 1
SMART           Log Directory Version 1 [multi-sector log support]
Address    Access  R/W   Size  Description
0x00       GPL,SL  R/O      1  Log Directory
0x01       GPL,SL  R/O      1  Summary SMART error log
0x02       GPL,SL  R/O      2  Comprehensive SMART error log
0x03       GPL,SL  R/O      1  Ext. Comprehensive SMART error log
0x06       GPL,SL  R/O      1  SMART self-test log
0x07       GPL,SL  R/O      1  Extended self-test log
0x09       GPL,SL  R/W      1  Selective self-test log
0x10       GPL,SL  R/O      1  NCQ Command Error log
0x11       GPL,SL  R/O      1  SATA Phy Event Counters log
0x30       GPL,SL  R/O      9  IDENTIFY DEVICE data log
0x80-0x9f  GPL,SL  R/W     16  Host vendor specific log
0xe0       GPL,SL  R/W      1  SCT Command/Status
0xe1       GPL,SL  R/W      1  SCT Data Transfer

SMART Extended Comprehensive Error Log Version: 1 (1 sectors)
Device Error Count: 6 (device log contains only the most recent 4 errors)
	CR     = Command Register
	FEATR  = Features Register
	COUNT  = Count (was: Sector Count) Register
	LBA_48 = Upper bytes of LBA High/Mid/Low Registers ]  ATA-8
	LH     = LBA High (was: Cylinder High) Register    ]   LBA
	LM     = LBA Mid (was: Cylinder Low) Register      ] Register
	LL     = LBA Low (was: Sector Number) Register     ]
	DV     = Device (was: Device/Head) Register
	DC     = Device Control Register
	ER     = Error register
	ST     = Status register
Powered_Up_Time is measured from power on, and printed as
DDd+hh:mm:SS.sss where DD=days, hh=hours, mm=minutes,
SS=sec, and sss=millisec. It "wraps" after 49.710 days.

Error 6 [0] occurred at disk power-on lifetime: 0 hours (0 days + 0 hours)
  When the command that caused the error occurred, the device was active or idle.

  After command completion occurred, registers were:
  ER -- ST COUNT  LBA_48  LH LM LL DV DC
  -- -- -- == -- == == == -- -- -- -- --
  00 -- d0 00 00 00 00 00 00 00 00 40 00   at LBA = 0x00000000 = 0

  Commands leading to the command that caused the error were:
  CR FEATR COUNT  LBA_48  LH LM LL DV DC  Powered_Up_Time  Command/Feature_Name
  -- == -- == -- == == == -- -- -- -- --  ---------------  --------------------
  60 00 00 00 c8 00 00 00 76 6a 6a 00 00     00:00:00.654  READ FPDMA QUEUED
  60 00 00 00 f0 00 00 00 76 6a 6a 00 00     00:00:01.420  READ FPDMA QUEUED
  60 00 00 00 c8 00 00 00 76 6a 6a 00 00     00:00:01.385  READ FPDMA QUEUED
  60 00 00 00 f0 00 00 00 76 6a 6a 00 00     00:00:00.642  READ FPDMA QUEUED
  60 00 00 00 c8 00 00 00 76 6a 6a 00 00     00:00:00.607  READ FPDMA QUEUED

Error 5 [3] log entry is empty
Error 4 [2] log entry is empty
Error 3 [1] occurred at disk power-on lifetime: 0 hours (0 days + 0 hours)
  When the command that caused the error occurred, the device was active or idle.

  After command completion occurred, registers were:
  ER -- ST COUNT  LBA_48  LH LM LL DV DC
  -- -- -- == -- == == == -- -- -- -- --
  00 -- d0 00 00 00 00 00 00 00 00 40 00

  Commands leading to the command that caused the error were:
  CR FEATR COUNT  LBA_48  LH LM LL DV DC  Powered_Up_Time  Command/Feature_Name
  -- == -- == -- == == == -- -- -- -- --  ---------------  --------------------
  60 00 00 00 f0 00 00 00 76 6a 6a 00 00     00:00:00.689  READ FPDMA QUEUED

SMART Extended Self-test Log Version: 1 (1 sectors)
Num  Test_Description    Status                  Remaining  LifeTime(hours)  LBA_of_first_error
# 1  Short offline       Completed without error       00%      5306         -
# 2  Short offline       Completed without error       00%      2147         -
# 3  Short offline       Completed without error       00%      1954         -
# 4  Short offline       Completed without error       00%      1856         -
# 5  Short offline       Completed without error       00%      1757         -
# 6  Short offline       Completed without error       00%      1654         -
# 7  Short offline       Completed without error       00%      1553         -
# 8  Short offline       Completed without error       00%      1450         -
# 9  Short offline       Completed without error       00%      1349         -
#10  Short offline       Completed without error       00%      1243         -
#11  Short offline       Completed without error       00%      1126         -
#12  Short offline       Completed without error       00%       845         -
#13  Short offline       Completed without error       00%         2         -
#14  Short offline       Completed without error       00%         2         -
#15  Short offline       Completed without error       00%         0         -

Selective Self-tests/Logging not supported

SCT Status Version:                  3
SCT Version (vendor specific):       1 (0x0001)
Device State:                        Active (0)
Current Temperature:                    57 Celsius
Power Cycle Min/Max Temperature:      ?/ ? Celsius
Lifetime    Min/Max Temperature:      ?/ ? Celsius
Under/Over Temperature Limit Count:   0/0

SCT Temperature History Version:     2
Temperature Sampling Period:         1 minute
Temperature Logging Interval:        1 minute
Min/Max recommended Temperature:      0/70 Celsius
Min/Max Temperature Limit:            0/70 Celsius
Temperature History Size (Index):    128 (60)

SCT Error Recovery Control:
           Read:      2 (0.2 seconds)
          Write:      2 (0.2 seconds)

Device Statistics (GP/SMART Log 0x04) not supported

Pending Defects log (GP Log 0x0c) not supported

SATA Phy Event Counters (GP Log 0x11)
ID      Size     Value  Description
0x0001  2            0  Command failed due to ICRC error
0x0002  2            0  R_ERR response for data FIS
0x0003  2            0  R_ERR response for device-to-host data FIS
0x0004  2            0  R_ERR response for host-to-device data FIS
0x0005  2            0  R_ERR response for non-data FIS
0x0006  2            0  R_ERR response for device-to-host non-data FIS
0x0007  2            0  R_ERR response for host-to-device non-data FIS
0x0008  2            0  Device-to-host non-data FIS retries
0x0009  2            0  Transition from drive PhyRdy to drive PhyNRdy
0x000a  2           84  Device-to-host register FISes sent due to a COMRESET
0x000b  2            0  CRC errors within host-to-device FIS
0x000d  2            0  Non-CRC errors within host-to-device FIS
0x000f  2            0  R_ERR response for host-to-device data FIS, CRC
0x0010  2            0  R_ERR response for host-to-device data FIS, non-CRC
0x0012  2            0  R_ERR response for host-to-device non-data FIS, CRC
0x0013  2            0  R_ERR response for host-to-device non-data FIS, non-CRC

