smartctl 7.2 2020-12-30 r5155 [FreeBSD 12.2-RELEASE amd64] (local build)
Copyright (C) 2002-20, Bruce Allen, Christian Franke, www.smartmontools.org

=== START OF INFORMATION SECTION ===
Model Family:     HGST Travelstar 5K1000
Device Model:     HGST HTS541010A9E680
Serial Number:    --
LU WWN Device Id: 5 000cca ...
Firmware Version: JA0OA710
User Capacity:    1,000,204,886,016 bytes [1.00 TB]
Sector Sizes:     512 bytes logical, 4096 bytes physical
Rotation Rate:    5400 rpm
Form Factor:      2.5 inches
Device is:        In smartctl database [for details use: -P show]
ATA Version is:   ACS-2, ATA8-ACS T13/1699-D revision 6
SATA Version is:  SATA 3.0, 6.0 Gb/s (current: 6.0 Gb/s)
Local Time is:    Mon Oct 18 08:21:15 2021 EDT
SMART support is: Available - device has SMART capability.
SMART support is: Enabled
AAM feature is:   Unavailable
APM level is:     128 (minimum power consumption without standby)
Rd look-ahead is: Enabled
Write cache is:   Enabled
DSN feature is:   Unavailable
ATA Security is:  Disabled, NOT FROZEN [SEC1]
Wt Cache Reorder: Enabled

=== START OF READ SMART DATA SECTION ===
SMART overall-health self-assessment test result: PASSED
See vendor-specific Attribute list for marginal Attributes.

General SMART Values:
Offline data collection status:  (0x00)	Offline data collection activity
					was never started.
					Auto Offline Data Collection: Disabled.
Self-test execution status:      (   0)	The previous self-test routine completed
					without error or no self-test has ever 
					been run.
Total time to complete Offline 
data collection: 		(   45) seconds.
Offline data collection
capabilities: 			 (0x51) SMART execute Offline immediate.
					No Auto Offline data collection support.
					Suspend Offline collection upon new
					command.
					No Offline surface scan supported.
					Self-test supported.
					No Conveyance Self-test supported.
					Selective Self-test supported.
SMART capabilities:            (0x0003)	Saves SMART data before entering
					power-saving mode.
					Supports SMART auto save timer.
Error logging capability:        (0x01)	Error logging supported.
					General Purpose Logging supported.
Short self-test routine 
recommended polling time: 	 (   2) minutes.
Extended self-test routine
recommended polling time: 	 ( 241) minutes.
SCT capabilities: 	       (0x003d)	SCT Status supported.
					SCT Error Recovery Control supported.
					SCT Feature Control supported.
					SCT Data Table supported.

SMART Attributes Data Structure revision number: 16
Vendor Specific SMART Attributes with Thresholds:
ID# ATTRIBUTE_NAME          FLAGS    VALUE WORST THRESH FAIL RAW_VALUE
  1 Raw_Read_Error_Rate     POSR-K   100   100   062    -    0
  2 Throughput_Performance  P-S--K   100   100   040    -    0
  3 Spin_Up_Time            PO---K   176   100   033    -    1
  4 Start_Stop_Count        -O--CK   095   095   000    -    7953
  5 Reallocated_Sector_Ct   PO--CK   100   100   005    -    0
  7 Seek_Error_Rate         POSR-K   100   100   067    -    0
  8 Seek_Time_Performance   P-S--K   100   100   040    -    0
  9 Power_On_Hours          -O--CK   068   068   000    -    14201
 10 Spin_Retry_Count        PO--CK   100   100   060    -    0
 12 Power_Cycle_Count       -O--CK   097   097   000    -    4785
183 Runtime_Bad_Block       -O--CK   100   100   000    -    0
184 End-to-End_Error        PO--CK   100   100   097    -    0
187 Reported_Uncorrect      -O--CK   100   094   000    -    81607393366
188 Command_Timeout         -O--CK   100   099   000    -    30078475239425
190 Airflow_Temperature_Cel -O---K   063   044   045    Past 37 (Min/Max 35/38)
191 G-Sense_Error_Rate      -O--CK   071   071   000    -    7563
192 Power-Off_Retract_Count -O--CK   100   100   000    -    8454273
193 Load_Cycle_Count        -O--CK   075   075   000    -    259027
196 Reallocated_Event_Count -O--CK   100   100   000    -    0
197 Current_Pending_Sector  -O--CK   100   100   000    -    0
198 Offline_Uncorrectable   ----CK   100   100   000    -    0
199 UDMA_CRC_Error_Count    -OS-CK   100   100   000    -    0
223 Load_Retry_Count        -O-R-K   100   100   000    -    0
                            ||||||_ K auto-keep
                            |||||__ C event count
                            ||||___ R error rate
                            |||____ S speed/performance
                            ||_____ O updated online
                            |______ P prefailure warning

General Purpose Log Directory Version 1
SMART           Log Directory Version 1 [multi-sector log support]
Address    Access  R/W   Size  Description
0x00       GPL,SL  R/O      1  Log Directory
0x01           SL  R/O      1  Summary SMART error log
0x02           SL  R/O      1  Comprehensive SMART error log
0x03       GPL     R/O      1  Ext. Comprehensive SMART error log
0x06           SL  R/O      1  SMART self-test log
0x07       GPL     R/O      1  Extended self-test log
0x09           SL  R/W      1  Selective self-test log
0x10       GPL     R/O      1  NCQ Command Error log
0x11       GPL     R/O      1  SATA Phy Event Counters log
0x80-0x9f  GPL,SL  R/W     16  Host vendor specific log
0xe0       GPL,SL  R/W      1  SCT Command/Status
0xe1       GPL,SL  R/W      1  SCT Data Transfer

SMART Extended Comprehensive Error Log Version: 1 (1 sectors)
Device Error Count: 86 (device log contains only the most recent 4 errors)
	CR     = Command Register
	FEATR  = Features Register
	COUNT  = Count (was: Sector Count) Register
	LBA_48 = Upper bytes of LBA High/Mid/Low Registers ]  ATA-8
	LH     = LBA High (was: Cylinder High) Register    ]   LBA
	LM     = LBA Mid (was: Cylinder Low) Register      ] Register
	LL     = LBA Low (was: Sector Number) Register     ]
	DV     = Device (was: Device/Head) Register
	DC     = Device Control Register
	ER     = Error register
	ST     = Status register
Powered_Up_Time is measured from power on, and printed as
DDd+hh:mm:SS.sss where DD=days, hh=hours, mm=minutes,
SS=sec, and sss=millisec. It "wraps" after 49.710 days.

Error 86 [1] occurred at disk power-on lifetime: 13840 hours (576 days + 16 hours)
  When the command that caused the error occurred, the device was active or idle.

  After command completion occurred, registers were:
  ER -- ST COUNT  LBA_48  LH LM LL DV DC
  -- -- -- == -- == == == -- -- -- -- --
  10 -- 41 05 40 00 00 19 f1 08 00 09 00  Error: IDNF at LBA = 0x19f10800 = 435226624

  Commands leading to the command that caused the error were:
  CR FEATR COUNT  LBA_48  LH LM LL DV DC  Powered_Up_Time  Command/Feature_Name
  -- == -- == -- == == == -- -- -- -- --  ---------------  --------------------
  60 01 00 00 f8 00 00 10 ad 74 c0 40 00  1d+05:49:44.113  READ FPDMA QUEUED
  60 01 00 00 b8 00 00 10 ad 73 c0 40 00  1d+05:49:44.113  READ FPDMA QUEUED
  60 01 00 00 b0 00 00 10 ad 72 c0 40 00  1d+05:49:44.110  READ FPDMA QUEUED
  60 01 00 00 a8 00 00 10 ad 71 c0 40 00  1d+05:49:44.109  READ FPDMA QUEUED
  60 01 00 00 a0 00 00 10 ad 70 c0 40 00  1d+05:49:44.108  READ FPDMA QUEUED

Error 85 [0] occurred at disk power-on lifetime: 12652 hours (527 days + 4 hours)
  When the command that caused the error occurred, the device was active or idle.

  After command completion occurred, registers were:
  ER -- ST COUNT  LBA_48  LH LM LL DV DC
  -- -- -- == -- == == == -- -- -- -- --
  10 -- 41 0a 00 00 00 23 c2 48 00 03 00  Error: IDNF at LBA = 0x23c24800 = 599934976

  Commands leading to the command that caused the error were:
  CR FEATR COUNT  LBA_48  LH LM LL DV DC  Powered_Up_Time  Command/Feature_Name
  -- == -- == -- == == == -- -- -- -- --  ---------------  --------------------
  60 01 00 00 88 00 00 2a 40 07 c0 40 00     17:02:38.509  READ FPDMA QUEUED
  60 01 00 00 80 00 00 2a 40 06 c0 40 00     17:02:38.509  READ FPDMA QUEUED
  60 01 00 00 78 00 00 2a 40 05 c0 40 00     17:02:38.508  READ FPDMA QUEUED
  60 01 00 00 70 00 00 2a 40 04 c0 40 00     17:02:38.505  READ FPDMA QUEUED
  60 01 00 00 68 00 00 2a 40 03 c0 40 00     17:02:38.504  READ FPDMA QUEUED

Error 84 [3] occurred at disk power-on lifetime: 10033 hours (418 days + 1 hours)
  When the command that caused the error occurred, the device was active or idle.

  After command completion occurred, registers were:
  ER -- ST COUNT  LBA_48  LH LM LL DV DC
  -- -- -- == -- == == == -- -- -- -- --
  40 -- 41 00 08 00 00 00 00 00 00 00 00  Error: WP at LBA = 0x00000000 = 0

  Commands leading to the command that caused the error were:
  CR FEATR COUNT  LBA_48  LH LM LL DV DC  Powered_Up_Time  Command/Feature_Name
  -- == -- == -- == == == -- -- -- -- --  ---------------  --------------------
  61 02 c0 00 78 00 00 40 4a 45 40 40 00     00:24:39.490  WRITE FPDMA QUEUED
  61 05 40 00 70 00 00 40 4a 40 00 40 00     00:24:39.480  WRITE FPDMA QUEUED
  61 02 c0 00 60 00 00 40 4a 3d 40 40 00     00:24:39.477  WRITE FPDMA QUEUED
  61 05 40 00 58 00 00 40 4a 38 00 40 00     00:24:39.467  WRITE FPDMA QUEUED
  61 02 c0 00 50 00 00 40 4a 35 40 40 00     00:24:39.463  WRITE FPDMA QUEUED

Error 83 [2] occurred at disk power-on lifetime: 9904 hours (412 days + 16 hours)
  When the command that caused the error occurred, the device was active or idle.

  After command completion occurred, registers were:
  ER -- ST COUNT  LBA_48  LH LM LL DV DC
  -- -- -- == -- == == == -- -- -- -- --
  40 -- 41 00 40 00 00 21 5e af 88 01 00  Error: UNC at LBA = 0x215eaf88 = 559853448

  Commands leading to the command that caused the error were:
  CR FEATR COUNT  LBA_48  LH LM LL DV DC  Powered_Up_Time  Command/Feature_Name
  -- == -- == -- == == == -- -- -- -- --  ---------------  --------------------
  60 01 00 00 78 00 00 6d 28 aa 00 40 00  1d+19:49:58.855  READ FPDMA QUEUED
  60 01 00 00 70 00 00 6d 28 a9 00 40 00  1d+19:49:58.855  READ FPDMA QUEUED
  60 01 00 00 68 00 00 6d 28 a8 00 40 00  1d+19:49:58.851  READ FPDMA QUEUED
  60 01 00 00 60 00 00 6d 28 a7 00 40 00  1d+19:49:58.849  READ FPDMA QUEUED
  60 01 00 00 18 00 00 6d 28 a6 00 40 00  1d+19:49:58.847  READ FPDMA QUEUED

SMART Extended Self-test Log Version: 1 (1 sectors)
Num  Test_Description    Status                  Remaining  LifeTime(hours)  LBA_of_first_error
# 1  Short offline       Completed without error       00%     11878         -
# 2  Short offline       Completed without error       00%     11877         -
# 3  Short offline       Completed without error       00%     11877         -
# 4  Short offline       Completed without error       00%     11877         -
# 5  Short offline       Completed without error       00%     11877         -
# 6  Short offline       Completed without error       00%     11876         -
# 7  Short offline       Completed without error       00%      1603         -

SMART Selective self-test log data structure revision number 1
 SPAN  MIN_LBA  MAX_LBA  CURRENT_TEST_STATUS
    1        0        0  Not_testing
    2        0        0  Not_testing
    3        0        0  Not_testing
    4        0        0  Not_testing
    5        0        0  Not_testing
Selective self-test flags (0x0):
  After scanning selected spans, do NOT read-scan remainder of disk.
If Selective self-test is pending on power-up, resume after 0 minute delay.

SCT Status Version:                  3
SCT Version (vendor specific):       256 (0x0100)
Device State:                        Active (0)
Current Temperature:                    37 Celsius
Power Cycle Min/Max Temperature:     35/38 Celsius
Lifetime    Min/Max Temperature:      7/56 Celsius
Specified Max Operating Temperature:    27 Celsius
Under/Over Temperature Limit Count:   0/0

SCT Temperature History Version:     2
Temperature Sampling Period:         1 minute
Temperature Logging Interval:        1 minute
Min/Max recommended Temperature:      0/60 Celsius
Min/Max Temperature Limit:           -40/65 Celsius
Temperature History Size (Index):    128 (13)

SCT Error Recovery Control:
           Read:     85 (8.5 seconds)
          Write:     85 (8.5 seconds)

Device Statistics (GP/SMART Log 0x04) not supported

Pending Defects log (GP Log 0x0c) not supported

SATA Phy Event Counters (GP Log 0x11)
ID      Size     Value  Description
0x0001  2            0  Command failed due to ICRC error
0x0002  2            0  R_ERR response for data FIS
0x0003  2            0  R_ERR response for device-to-host data FIS
0x0004  2            0  R_ERR response for host-to-device data FIS
0x0005  2            0  R_ERR response for non-data FIS
0x0006  2            0  R_ERR response for device-to-host non-data FIS
0x0007  2            0  R_ERR response for host-to-device non-data FIS
0x0009  2           11  Transition from drive PhyRdy to drive PhyNRdy
0x000a  2            9  Device-to-host register FISes sent due to a COMRESET
0x000b  2            0  CRC errors within host-to-device FIS
0x000d  2            0  Non-CRC errors within host-to-device FIS

