smartctl 7.3 2022-02-28 r5338 [FreeBSD 13.1-RELEASE-p2 amd64] (local build)
Copyright (C) 2002-22, Bruce Allen, Christian Franke, www.smartmontools.org

=== START OF INFORMATION SECTION ===
Model Family:     SAMSUNG SpinPoint F4 EG (AF)
Device Model:     SAMSUNG HD204UI
Serial Number:    --
LU WWN Device Id: 5 0024e9 ...
Firmware Version: 1AQ10001
User Capacity:    2,000,398,934,016 bytes [2.00 TB]
Sector Size:      512 bytes logical/physical
Rotation Rate:    5400 rpm
Form Factor:      3.5 inches
Device is:        In smartctl database 7.3/5319
ATA Version is:   ATA8-ACS T13/1699-D revision 6
SATA Version is:  SATA 2.6, 3.0 Gb/s
Local Time is:    Tue Sep 27 20:53:44 2022 CEST

==> WARNING: Using smartmontools or hdparm with this
drive may result in data loss due to a firmware bug.
****** THIS DRIVE MAY OR MAY NOT BE AFFECTED! ******
Buggy and fixed firmware report same version number!
See the following web pages for details:
http://knowledge.seagate.com/articles/en_US/FAQ/223571en
https://www.smartmontools.org/wiki/SamsungF4EGBadBlocks

SMART support is: Available - device has SMART capability.
SMART support is: Enabled
AAM level is:     128 (quiet), recommended: 254
APM feature is:   Disabled
Rd look-ahead is: Enabled
Write cache is:   Enabled
DSN feature is:   Unavailable
ATA Security is:  Disabled, frozen [SEC2]
Wt Cache Reorder: Enabled

=== START OF READ SMART DATA SECTION ===
SMART overall-health self-assessment test result: PASSED

General SMART Values:
Offline data collection status:  (0x00)	Offline data collection activity
					was never started.
					Auto Offline Data Collection: Disabled.
Self-test execution status:      (   0)	The previous self-test routine completed
					without error or no self-test has ever 
					been run.
Total time to complete Offline 
data collection: 		(20520) seconds.
Offline data collection
capabilities: 			 (0x5b) SMART execute Offline immediate.
					Auto Offline data collection on/off support.
					Suspend Offline collection upon new
					command.
					Offline surface scan supported.
					Self-test supported.
					No Conveyance Self-test supported.
					Selective Self-test supported.
SMART capabilities:            (0x0003)	Saves SMART data before entering
					power-saving mode.
					Supports SMART auto save timer.
Error logging capability:        (0x01)	Error logging supported.
					General Purpose Logging supported.
Short self-test routine 
recommended polling time: 	 (   2) minutes.
Extended self-test routine
recommended polling time: 	 ( 342) minutes.
SCT capabilities: 	       (0x003f)	SCT Status supported.
					SCT Error Recovery Control supported.
					SCT Feature Control supported.
					SCT Data Table supported.

SMART Attributes Data Structure revision number: 16
Vendor Specific SMART Attributes with Thresholds:
ID# ATTRIBUTE_NAME          FLAGS    VALUE WORST THRESH FAIL RAW_VALUE
  1 Raw_Read_Error_Rate     POSR-K   100   100   051    -    135
  2 Throughput_Performance  -OS--K   252   252   000    -    0
  3 Spin_Up_Time            PO---K   067   043   025    -    10258
  4 Start_Stop_Count        -O--CK   096   096   000    -    4343
  5 Reallocated_Sector_Ct   PO--CK   252   252   010    -    0
  7 Seek_Error_Rate         -OSR-K   252   252   051    -    0
  8 Seek_Time_Performance   --S--K   252   252   015    -    0
  9 Power_On_Hours          -O--CK   100   100   000    -    20351
 10 Spin_Retry_Count        -O--CK   252   252   051    -    0
 11 Calibration_Retry_Count -O--CK   252   252   000    -    0
 12 Power_Cycle_Count       -O--CK   098   098   000    -    2646
181 Program_Fail_Cnt_Total  -O---K   100   100   000    -    6794324
191 G-Sense_Error_Rate      -O---K   001   001   000    -    28810582
192 Power-Off_Retract_Count -O---K   252   252   000    -    0
194 Temperature_Celsius     -O----   061   047   000    -    39 (Min/Max 14/53)
195 Hardware_ECC_Recovered  -O-RCK   100   100   000    -    0
196 Reallocated_Event_Count -O--CK   252   252   000    -    0
197 Current_Pending_Sector  -O--CK   252   252   000    -    0
198 Offline_Uncorrectable   ----CK   252   252   000    -    0
199 UDMA_CRC_Error_Count    -OS-CK   200   200   000    -    0
200 Multi_Zone_Error_Rate   -O-R-K   001   001   000    -    106416
223 Load_Retry_Count        -O--CK   252   252   000    -    0
225 Load_Cycle_Count        -O--CK   100   100   000    -    4521
                            ||||||_ K auto-keep
                            |||||__ C event count
                            ||||___ R error rate
                            |||____ S speed/performance
                            ||_____ O updated online
                            |______ P prefailure warning

General Purpose Log Directory Version 1
SMART           Log Directory Version 1 [multi-sector log support]
Address    Access  R/W   Size  Description
0x00       GPL,SL  R/O      1  Log Directory
0x01           SL  R/O      1  Summary SMART error log
0x02           SL  R/O      2  Comprehensive SMART error log
0x03       GPL     R/O      2  Ext. Comprehensive SMART error log
0x06           SL  R/O      1  SMART self-test log
0x07       GPL     R/O      2  Extended self-test log
0x08       GPL     R/O      2  Power Conditions log
0x09           SL  R/W      1  Selective self-test log
0x10       GPL     R/O      1  NCQ Command Error log
0x11       GPL     R/O      1  SATA Phy Event Counters log
0x80-0x9f  GPL,SL  R/W     16  Host vendor specific log
0xe0       GPL,SL  R/W      1  SCT Command/Status
0xe1       GPL,SL  R/W      1  SCT Data Transfer

SMART Extended Comprehensive Error Log Version: 1 (2 sectors)
Device Error Count: 25 (device log contains only the most recent 8 errors)
	CR     = Command Register
	FEATR  = Features Register
	COUNT  = Count (was: Sector Count) Register
	LBA_48 = Upper bytes of LBA High/Mid/Low Registers ]  ATA-8
	LH     = LBA High (was: Cylinder High) Register    ]   LBA
	LM     = LBA Mid (was: Cylinder Low) Register      ] Register
	LL     = LBA Low (was: Sector Number) Register     ]
	DV     = Device (was: Device/Head) Register
	DC     = Device Control Register
	ER     = Error register
	ST     = Status register
Powered_Up_Time is measured from power on, and printed as
DDd+hh:mm:SS.sss where DD=days, hh=hours, mm=minutes,
SS=sec, and sss=millisec. It "wraps" after 49.710 days.

Error 25 [0] occurred at disk power-on lifetime: 1199 hours (49 days + 23 hours)
  When the command that caused the error occurred, the device was active or idle.

  After command completion occurred, registers were:
  ER -- ST COUNT  LBA_48  LH LM LL DV DC
  -- -- -- == -- == == == -- -- -- -- --
  40 -- 51 00 50 00 00 23 8a 74 c0 e0 00  Error: UNC 80 sectors at LBA = 0x238a74c0 = 596276416

  Commands leading to the command that caused the error were:
  CR FEATR COUNT  LBA_48  LH LM LL DV DC  Powered_Up_Time  Command/Feature_Name
  -- == -- == -- == == == -- -- -- -- --  ---------------  --------------------
  25 00 00 00 80 00 00 23 8a 74 90 e0 00     00:03:31.044  READ DMA EXT
  25 00 00 00 80 00 00 23 8a 74 10 e0 00     00:03:31.044  READ DMA EXT
  25 00 00 00 80 00 00 23 8a 73 90 e0 00     00:03:31.044  READ DMA EXT
  25 00 00 00 80 00 00 23 8a 73 10 e0 00     00:03:31.044  READ DMA EXT
  25 00 00 00 80 00 00 23 8a 72 90 e0 00     00:03:31.044  READ DMA EXT

Error 24 [7] occurred at disk power-on lifetime: 1199 hours (49 days + 23 hours)
  When the command that caused the error occurred, the device was active or idle.

  After command completion occurred, registers were:
  ER -- ST COUNT  LBA_48  LH LM LL DV DC
  -- -- -- == -- == == == -- -- -- -- --
  40 -- 51 00 60 00 00 23 8a c4 30 e0 00  Error: UNC 96 sectors at LBA = 0x238ac430 = 596296752

  Commands leading to the command that caused the error were:
  CR FEATR COUNT  LBA_48  LH LM LL DV DC  Powered_Up_Time  Command/Feature_Name
  -- == -- == -- == == == -- -- -- -- --  ---------------  --------------------
  25 00 00 00 80 00 00 23 8a c4 10 e0 00     00:03:29.995  READ DMA EXT
  25 00 00 00 80 00 00 23 8a c3 90 e0 00     00:03:29.995  READ DMA EXT
  25 00 00 00 80 00 00 23 8a c3 10 e0 00     00:03:29.995  READ DMA EXT
  25 00 00 00 80 00 00 23 8a c2 90 e0 00     00:03:29.995  READ DMA EXT
  25 00 00 00 80 00 00 23 8a c2 10 e0 00     00:03:29.995  READ DMA EXT

Error 23 [6] occurred at disk power-on lifetime: 1199 hours (49 days + 23 hours)
  When the command that caused the error occurred, the device was active or idle.

  After command completion occurred, registers were:
  ER -- ST COUNT  LBA_48  LH LM LL DV DC
  -- -- -- == -- == == == -- -- -- -- --
  40 -- 51 00 68 00 00 23 8a b9 28 e0 00  Error: UNC 104 sectors at LBA = 0x238ab928 = 596293928

  Commands leading to the command that caused the error were:
  CR FEATR COUNT  LBA_48  LH LM LL DV DC  Powered_Up_Time  Command/Feature_Name
  -- == -- == -- == == == -- -- -- -- --  ---------------  --------------------
  25 00 00 00 80 00 00 23 8a b9 10 e0 00     00:03:29.990  READ DMA EXT
  25 00 00 00 80 00 00 23 8a b8 90 e0 00     00:03:29.990  READ DMA EXT
  25 00 00 00 80 00 00 23 8a b8 10 e0 00     00:03:29.990  READ DMA EXT
  25 00 00 00 80 00 00 23 8a b7 90 e0 00     00:03:29.990  READ DMA EXT
  25 00 00 00 80 00 00 23 8a b7 10 e0 00     00:03:29.989  READ DMA EXT

Error 22 [5] occurred at disk power-on lifetime: 1198 hours (49 days + 22 hours)
  When the command that caused the error occurred, the device was active or idle.

  After command completion occurred, registers were:
  ER -- ST COUNT  LBA_48  LH LM LL DV DC
  -- -- -- == -- == == == -- -- -- -- --
  40 -- 51 00 08 00 00 23 8a c4 30 e0 00  Error: UNC at LBA = 0x238ac430 = 596296752

  Commands leading to the command that caused the error were:
  CR FEATR COUNT  LBA_48  LH LM LL DV DC  Powered_Up_Time  Command/Feature_Name
  -- == -- == -- == == == -- -- -- -- --  ---------------  --------------------
  42 00 00 00 08 00 00 23 8a c4 30 e0 00     00:03:28.385  READ VERIFY SECTOR(S) EXT
  42 00 00 00 08 00 00 23 8a c4 30 e0 00     00:03:28.385  READ VERIFY SECTOR(S) EXT
  42 00 00 00 08 00 00 23 8a b9 28 e0 00     00:03:28.379  READ VERIFY SECTOR(S) EXT
  42 00 00 00 08 00 00 23 8a b9 28 e0 00     00:03:28.377  READ VERIFY SECTOR(S) EXT
  42 00 00 00 08 00 00 23 8a 8a d0 e0 00     00:03:28.375  READ VERIFY SECTOR(S) EXT

Error 21 [4] occurred at disk power-on lifetime: 1198 hours (49 days + 22 hours)
  When the command that caused the error occurred, the device was active or idle.

  After command completion occurred, registers were:
  ER -- ST COUNT  LBA_48  LH LM LL DV DC
  -- -- -- == -- == == == -- -- -- -- --
  40 -- 51 00 08 00 00 23 8a b9 28 e0 00  Error: UNC at LBA = 0x238ab928 = 596293928

  Commands leading to the command that caused the error were:
  CR FEATR COUNT  LBA_48  LH LM LL DV DC  Powered_Up_Time  Command/Feature_Name
  -- == -- == -- == == == -- -- -- -- --  ---------------  --------------------
  42 00 00 00 08 00 00 23 8a b9 28 e0 00     00:03:28.379  READ VERIFY SECTOR(S) EXT
  42 00 00 00 08 00 00 23 8a b9 28 e0 00     00:03:28.379  READ VERIFY SECTOR(S) EXT
  42 00 00 00 08 00 00 23 8a b9 28 e0 00     00:03:28.377  READ VERIFY SECTOR(S) EXT
  42 00 00 00 08 00 00 23 8a 8a d0 e0 00     00:03:28.375  READ VERIFY SECTOR(S) EXT
  42 00 00 00 08 00 00 23 8a 74 c0 e0 00     00:03:28.374  READ VERIFY SECTOR(S) EXT

Error 20 [3] occurred at disk power-on lifetime: 1198 hours (49 days + 22 hours)
  When the command that caused the error occurred, the device was active or idle.

  After command completion occurred, registers were:
  ER -- ST COUNT  LBA_48  LH LM LL DV DC
  -- -- -- == -- == == == -- -- -- -- --
  40 -- 51 00 08 00 00 23 8a b9 28 e0 00  Error: UNC at LBA = 0x238ab928 = 596293928

  Commands leading to the command that caused the error were:
  CR FEATR COUNT  LBA_48  LH LM LL DV DC  Powered_Up_Time  Command/Feature_Name
  -- == -- == -- == == == -- -- -- -- --  ---------------  --------------------
  42 00 00 00 08 00 00 23 8a b9 28 e0 00     00:03:28.377  READ VERIFY SECTOR(S) EXT
  42 00 00 00 08 00 00 23 8a b9 28 e0 00     00:03:28.377  READ VERIFY SECTOR(S) EXT
  42 00 00 00 08 00 00 23 8a 8a d0 e0 00     00:03:28.375  READ VERIFY SECTOR(S) EXT
  42 00 00 00 08 00 00 23 8a 74 c0 e0 00     00:03:28.374  READ VERIFY SECTOR(S) EXT
  25 00 00 00 30 00 00 49 fd 6a 80 e0 00     00:03:28.373  READ DMA EXT

Error 19 [2] occurred at disk power-on lifetime: 1177 hours (49 days + 1 hours)
  When the command that caused the error occurred, the device was active or idle.

  After command completion occurred, registers were:
  ER -- ST COUNT  LBA_48  LH LM LL DV DC
  -- -- -- == -- == == == -- -- -- -- --
  40 -- 51 00 60 00 00 23 8a c4 30 e0 00  Error: UNC 96 sectors at LBA = 0x238ac430 = 596296752

  Commands leading to the command that caused the error were:
  CR FEATR COUNT  LBA_48  LH LM LL DV DC  Powered_Up_Time  Command/Feature_Name
  -- == -- == -- == == == -- -- -- -- --  ---------------  --------------------
  25 00 00 00 80 00 00 23 8a c4 10 e0 00     00:02:13.221  READ DMA EXT
  25 00 00 00 80 00 00 23 8a c3 90 e0 00     00:02:13.221  READ DMA EXT
  25 00 00 00 80 00 00 23 8a c3 10 e0 00     00:02:13.221  READ DMA EXT
  25 00 00 00 80 00 00 23 8a c2 90 e0 00     00:02:13.221  READ DMA EXT
  25 00 00 00 80 00 00 23 8a c2 10 e0 00     00:02:13.221  READ DMA EXT

Error 18 [1] occurred at disk power-on lifetime: 1177 hours (49 days + 1 hours)
  When the command that caused the error occurred, the device was active or idle.

  After command completion occurred, registers were:
  ER -- ST COUNT  LBA_48  LH LM LL DV DC
  -- -- -- == -- == == == -- -- -- -- --
  40 -- 51 00 68 00 00 23 8a b9 28 e0 00  Error: UNC 104 sectors at LBA = 0x238ab928 = 596293928

  Commands leading to the command that caused the error were:
  CR FEATR COUNT  LBA_48  LH LM LL DV DC  Powered_Up_Time  Command/Feature_Name
  -- == -- == -- == == == -- -- -- -- --  ---------------  --------------------
  25 00 00 00 80 00 00 23 8a b9 10 e0 00     00:02:13.215  READ DMA EXT
  25 00 00 00 80 00 00 23 8a b8 90 e0 00     00:02:13.215  READ DMA EXT
  25 00 00 00 80 00 00 23 8a b8 10 e0 00     00:02:13.215  READ DMA EXT
  25 00 00 00 80 00 00 23 8a b7 90 e0 00     00:02:13.215  READ DMA EXT
  25 00 00 00 80 00 00 23 8a b7 10 e0 00     00:02:13.215  READ DMA EXT

SMART Extended Self-test Log Version: 1 (2 sectors)
No self-tests have been logged.  [To run self-tests, use: smartctl -t]

SMART Selective self-test log data structure revision number 0
Note: revision number not 1 implies that no selective self-test has ever been run
 SPAN  MIN_LBA  MAX_LBA  CURRENT_TEST_STATUS
    1        0        0  Completed [00% left] (0-65535)
    2        0        0  Not_testing
    3        0        0  Not_testing
    4        0        0  Not_testing
    5        0        0  Not_testing
Selective self-test flags (0x0):
  After scanning selected spans, do NOT read-scan remainder of disk.
If Selective self-test is pending on power-up, resume after 0 minute delay.

SCT Status Version:                  2
SCT Version (vendor specific):       256 (0x0100)
Device State:                        Active (0)
Current Temperature:                    39 Celsius
Power Cycle Min/Max Temperature:     18/39 Celsius
Lifetime    Min/Max Temperature:      9/66 Celsius
Specified Max Operating Temperature:    80 Celsius
Under/Over Temperature Limit Count:   0/0

SCT Temperature History Version:     2
Temperature Sampling Period:         5 minutes
Temperature Logging Interval:        5 minutes
Min/Max recommended Temperature:     -5/80 Celsius
Min/Max Temperature Limit:           -10/85 Celsius
Temperature History Size (Index):    128 (119)

SCT Error Recovery Control:
           Read: Disabled
          Write: Disabled

Device Statistics (GP/SMART Log 0x04) not supported

Pending Defects log (GP Log 0x0c) not supported

SATA Phy Event Counters (GP Log 0x11)
ID      Size     Value  Description
0x0001  4            0  Command failed due to ICRC error
0x0002  4            0  R_ERR response for data FIS
0x0003  4            0  R_ERR response for device-to-host data FIS
0x0004  4            0  R_ERR response for host-to-device data FIS
0x0005  4            0  R_ERR response for non-data FIS
0x0006  4            0  R_ERR response for device-to-host non-data FIS
0x0007  4            0  R_ERR response for host-to-device non-data FIS
0x0008  4            0  Device-to-host non-data FIS retries
0x0009  4            2  Transition from drive PhyRdy to drive PhyNRdy
0x000a  4            2  Device-to-host register FISes sent due to a COMRESET
0x000b  4            0  CRC errors within host-to-device FIS
0x000d  4            0  Non-CRC errors within host-to-device FIS
0x000f  4            0  R_ERR response for host-to-device data FIS, CRC
0x0010  4            0  R_ERR response for host-to-device data FIS, non-CRC
0x0012  4            0  R_ERR response for host-to-device non-data FIS, CRC
0x0013  4            0  R_ERR response for host-to-device non-data FIS, non-CRC
0x8e00  4            0  Vendor specific
0x8e01  4            0  Vendor specific
0x8e02  4            0  Vendor specific
0x8e03  4            0  Vendor specific
0x8e04  4            0  Vendor specific
0x8e05  4            0  Vendor specific
0x8e06  4            0  Vendor specific
0x8e07  4            0  Vendor specific
0x8e08  4            0  Vendor specific
0x8e09  4            0  Vendor specific
0x8e0a  4            0  Vendor specific
0x8e0b  4            0  Vendor specific
0x8e0c  4            0  Vendor specific
0x8e0d  4            0  Vendor specific
0x8e0e  4            0  Vendor specific
0x8e0f  4            0  Vendor specific
0x8e10  4            0  Vendor specific
0x8e11  4            0  Vendor specific



