smartctl 7.2 2020-12-30 r5155 [FreeBSD 12.2-RELEASE amd64] (local build)
Copyright (C) 2002-20, Bruce Allen, Christian Franke, www.smartmontools.org

=== START OF INFORMATION SECTION ===
Model Number:                       PC300 NVMe SK hynix 256GB
Serial Number:                      --
Firmware Version:                   20005A00
PCI Vendor/Subsystem ID:            0x1c5c
IEEE OUI Identifier:                0xace42e
Controller ID:                      0
NVMe Version:                       1.2
Number of Namespaces:               1
Namespace 1 Size/Capacity:          256,060,514,304 [256 GB]
Namespace 1 Formatted LBA Size:     512
Namespace 1 IEEE EUI-64:            ace42e ...
Local Time is:                      Sun Sep 12 18:01:56 2021 EDT
Firmware Updates (0x16):            3 Slots, no Reset required
Optional Admin Commands (0x0016):   Format Frmw_DL Self_Test
Optional NVM Commands (0x001e):     Wr_Unc DS_Mngmt Wr_Zero Sav/Sel_Feat
Log Page Attributes (0x02):         Cmd_Eff_Lg
Maximum Data Transfer Size:         32 Pages
Warning  Comp. Temp. Threshold:     88 Celsius
Critical Comp. Temp. Threshold:     90 Celsius

Supported Power States
St Op     Max   Active     Idle   RL RT WL WT  Ent_Lat  Ex_Lat
 0 +     5.87W       -        -    0  0  0  0        5       5
 1 +     2.40W       -        -    1  1  1  1       30      30
 2 +     1.90W       -        -    2  2  2  2      100     100
 3 -   0.1000W       -        -    3  3  3  3     1000    1000
 4 -   0.0060W       -        -    3  3  3  3     1000    5000

Supported LBA Sizes (NSID 0x1)
Id Fmt  Data  Metadt  Rel_Perf
 0 +     512       0         0
 1 -    4096       0         0

=== START OF SMART DATA SECTION ===
SMART overall-health self-assessment test result: PASSED

SMART/Health Information (NVMe Log 0x02)
Critical Warning:                   0x00
Temperature:                        31 Celsius
Available Spare:                    100%
Available Spare Threshold:          10%
Percentage Used:                    5%
Data Units Read:                    30,550,475 [15.6 TB]
Data Units Written:                 56,112,506 [28.7 TB]
Host Read Commands:                 455,626,902
Host Write Commands:                671,674,644
Controller Busy Time:               3,019
Power Cycles:                       5,997
Power On Hours:                     3,839
Unsafe Shutdowns:                   784
Media and Data Integrity Errors:    0
Error Information Log Entries:      3,225,524
Warning  Comp. Temperature Time:    0
Critical Comp. Temperature Time:    0
Temperature Sensor 1:               31 Celsius

Error Information (NVMe Log 0x01, 16 of 255 entries)
No Errors Logged

