smartctl 7.2 2021-09-14 r5236 [FreeBSD 13.0-RELEASE amd64] (local build)
Copyright (C) 2002-20, Bruce Allen, Christian Franke, www.smartmontools.org

=== START OF INFORMATION SECTION ===
Device Model:     TOSHIBA MQ02ABD100H
Serial Number:    --
LU WWN Device Id: 5 000039 ...
Firmware Version: HEF01D
User Capacity:    1,000,204,886,016 bytes [1.00 TB]
Sector Sizes:     512 bytes logical, 4096 bytes physical
Rotation Rate:    5400 rpm
Form Factor:      2.5 inches
TRIM Command:     Available, deterministic
Device is:        Not in smartctl database [for details use: -P showall]
ATA Version is:   ATA8-ACS (minor revision not indicated)
SATA Version is:  SATA 3.0, 6.0 Gb/s (current: 6.0 Gb/s)
Local Time is:    Wed Jan 26 03:00:42 2022 EST
SMART support is: Available - device has SMART capability.
SMART support is: Enabled
AAM feature is:   Unavailable
APM level is:     128 (minimum power consumption without standby)
Rd look-ahead is: Enabled
Write cache is:   Enabled
DSN feature is:   Unavailable
ATA Security is:  Disabled, frozen [SEC2]
Wt Cache Reorder: Enabled

=== START OF READ SMART DATA SECTION ===
SMART overall-health self-assessment test result: PASSED

General SMART Values:
Offline data collection status:  (0x00)	Offline data collection activity
					was never started.
					Auto Offline Data Collection: Disabled.
Self-test execution status:      (  25)	The self-test routine was aborted by
					the host.
Total time to complete Offline 
data collection: 		(  120) seconds.
Offline data collection
capabilities: 			 (0x5b) SMART execute Offline immediate.
					Auto Offline data collection on/off support.
					Suspend Offline collection upon new
					command.
					Offline surface scan supported.
					Self-test supported.
					No Conveyance Self-test supported.
					Selective Self-test supported.
SMART capabilities:            (0x0003)	Saves SMART data before entering
					power-saving mode.
					Supports SMART auto save timer.
Error logging capability:        (0x01)	Error logging supported.
					General Purpose Logging supported.
Short self-test routine 
recommended polling time: 	 (   2) minutes.
Extended self-test routine
recommended polling time: 	 ( 205) minutes.
SCT capabilities: 	       (0x003d)	SCT Status supported.
					SCT Error Recovery Control supported.
					SCT Feature Control supported.
					SCT Data Table supported.

SMART Attributes Data Structure revision number: 128
Vendor Specific SMART Attributes with Thresholds:
ID# ATTRIBUTE_NAME          FLAGS    VALUE WORST THRESH FAIL RAW_VALUE
  1 Raw_Read_Error_Rate     PO-R--   100   100   050    -    0
  3 Spin_Up_Time            POS--K   100   100   001    -    2751
  5 Reallocated_Sector_Ct   PO--CK   100   100   050    -    0
  9 Power_On_Hours          -O--CK   056   056   000    -    17934
 12 Power_Cycle_Count       -O--CK   100   100   000    -    4054
191 G-Sense_Error_Rate      -O--CK   100   100   000    -    83
192 Power-Off_Retract_Count -O--CK   100   100   000    -    131
193 Load_Cycle_Count        -O--CK   059   059   000    -    418500
194 Temperature_Celsius     -O---K   100   100   000    -    37 (Min/Max 19/53)
199 UDMA_CRC_Error_Count    -O--CK   200   253   000    -    0
240 Head_Flying_Hours       -O--CK   061   061   000    -    15715
241 Total_LBAs_Written      -O--CK   100   100   000    -    262497698168
242 Total_LBAs_Read         -O--CK   100   100   000    -    134225226463
254 Free_Fall_Sensor        -O--CK   100   100   000    -    0
                            ||||||_ K auto-keep
                            |||||__ C event count
                            ||||___ R error rate
                            |||____ S speed/performance
                            ||_____ O updated online
                            |______ P prefailure warning

General Purpose Log Directory Version 1
SMART           Log Directory Version 1 [multi-sector log support]
Address    Access  R/W   Size  Description
0x00       GPL,SL  R/O      1  Log Directory
0x01           SL  R/O      1  Summary SMART error log
0x02           SL  R/O     51  Comprehensive SMART error log
0x03       GPL     R/O     64  Ext. Comprehensive SMART error log
0x04       GPL,SL  R/O      8  Device Statistics log
0x06           SL  R/O      1  SMART self-test log
0x07       GPL     R/O      1  Extended self-test log
0x09           SL  R/W      1  Selective self-test log
0x10       GPL     R/O      1  NCQ Command Error log
0x11       GPL     R/O      1  SATA Phy Event Counters log
0x12       GPL     R/O      1  SATA NCQ Non-Data log
0x13       GPL     R/O      1  SATA NCQ Send and Receive log
0x80-0x9f  GPL,SL  R/W     16  Host vendor specific log
0xa7       GPL     VS       8  Device vendor specific log
0xb7       GPL,SL  VS       1  Device vendor specific log
0xe0       GPL,SL  R/W      1  SCT Command/Status
0xe1       GPL,SL  R/W      1  SCT Data Transfer

SMART Extended Comprehensive Error Log Version: 1 (64 sectors)
No Errors Logged

SMART Extended Self-test Log Version: 1 (1 sectors)
Num  Test_Description    Status                  Remaining  LifeTime(hours)  LBA_of_first_error
# 1  Short offline       Aborted by host               90%     17913         -
# 2  Short offline       Completed without error       00%     17866         -
# 3  Short offline       Aborted by host               90%     17864         -
# 4  Short offline       Aborted by host               30%     17541         -
# 5  Short offline       Aborted by host               80%     17520         -
# 6  Short offline       Aborted by host               90%     16586         -
# 7  Short offline       Aborted by host               80%     15619         -
# 8  Short offline       Aborted by host               70%     15517         -
# 9  Short offline       Completed without error       00%     14394         -
#10  Short offline       Aborted by host               90%     11920         -
#11  Short offline       Aborted by host               90%      9884         -
#12  Short offline       Aborted by host               90%      9591         -
#13  Short offline       Aborted by host               50%      9298         -
#14  Short offline       Completed without error       00%      9140         -
#15  Short offline       Completed without error       00%      8887         -
#16  Short offline       Aborted by host               90%      7979         -
#17  Short offline       Aborted by host               90%      7712         -
#18  Short offline       Aborted by host               90%      7712         -
#19  Extended offline    Aborted by host               90%      7308         -

SMART Selective self-test log data structure revision number 1
 SPAN  MIN_LBA  MAX_LBA  CURRENT_TEST_STATUS
    1        0        0  Not_testing
    2        0        0  Not_testing
    3        0        0  Not_testing
    4        0        0  Not_testing
    5        0        0  Not_testing
Selective self-test flags (0x0):
  After scanning selected spans, do NOT read-scan remainder of disk.
If Selective self-test is pending on power-up, resume after 0 minute delay.

SCT Status Version:                  2
SCT Version (vendor specific):       1 (0x0001)
Device State:                        Active (0)
Current Temperature:                    37 Celsius
Power Cycle Min/Max Temperature:     34/38 Celsius
Lifetime    Min/Max Temperature:     19/53 Celsius
Specified Max Operating Temperature:    37 Celsius
Under/Over Temperature Limit Count:   0/0

SCT Temperature History Version:     2
Temperature Sampling Period:         1 minute
Temperature Logging Interval:        10 minutes
Min/Max recommended Temperature:      5/60 Celsius
Min/Max Temperature Limit:            5/60 Celsius
Temperature History Size (Index):    478 (402)

SCT Error Recovery Control:
           Read: Disabled
          Write: Disabled

Device Statistics (GP Log 0x04)
Page  Offset Size        Value Flags Description
0x01  =====  =               =  ===  == General Statistics (rev 2) ==
0x01  0x008  4            4054  ---  Lifetime Power-On Resets
0x01  0x010  4           17934  ---  Power-on Hours
0x01  0x018  6    262497698168  ---  Logical Sectors Written
0x01  0x020  6      2293293090  ---  Number of Write Commands
0x01  0x028  6    134225226463  ---  Logical Sectors Read
0x01  0x030  6      1966674498  ---  Number of Read Commands
0x02  =====  =               =  ===  == Free-Fall Statistics (rev 1) ==
0x02  0x010  4              83  ---  Overlimit Shock Events
0x03  =====  =               =  ===  == Rotating Media Statistics (rev 1) ==
0x03  0x008  4           17868  ---  Spindle Motor Power-on Hours
0x03  0x010  4           15715  ---  Head Flying Hours
0x03  0x018  4          418500  ---  Head Load Events
0x03  0x020  4               0  ---  Number of Reallocated Logical Sectors
0x03  0x028  4               0  ---  Read Recovery Attempts
0x03  0x030  4               0  ---  Number of Mechanical Start Failures
0x04  =====  =               =  ===  == General Errors Statistics (rev 1) ==
0x04  0x008  4               0  ---  Number of Reported Uncorrectable Errors
0x04  0x010  4               0  ---  Resets Between Cmd Acceptance and Completion
0x05  =====  =               =  ===  == Temperature Statistics (rev 1) ==
0x05  0x008  1              37  ---  Current Temperature
0x05  0x010  1              37  N--  Average Short Term Temperature
0x05  0x018  1              36  N--  Average Long Term Temperature
0x05  0x020  1              53  ---  Highest Temperature
0x05  0x028  1              19  ---  Lowest Temperature
0x05  0x030  1              48  N--  Highest Average Short Term Temperature
0x05  0x038  1              29  N--  Lowest Average Short Term Temperature
0x05  0x040  1              40  N--  Highest Average Long Term Temperature
0x05  0x048  1              34  N--  Lowest Average Long Term Temperature
0x05  0x050  4               0  ---  Time in Over-Temperature
0x05  0x058  1              60  ---  Specified Maximum Operating Temperature
0x05  0x060  4               0  ---  Time in Under-Temperature
0x05  0x068  1               5  ---  Specified Minimum Operating Temperature
0x06  =====  =               =  ===  == Transport Statistics (rev 1) ==
0x06  0x008  4           11767  ---  Number of Hardware Resets
0x06  0x018  4               0  ---  Number of Interface CRC Errors
0x07  =====  =               =  ===  == Solid State Device Statistics (rev 1) ==
0x07  0x008  1              29  N--  Percentage Used Endurance Indicator
                                |||_ C monitored condition met
                                ||__ D supports DSN
                                |___ N normalized value

Pending Defects log (GP Log 0x0c) not supported

SATA Phy Event Counters (GP Log 0x11)
ID      Size     Value  Description
0x0001  4            0  Command failed due to ICRC error
0x0002  4            0  R_ERR response for data FIS
0x0003  4            0  R_ERR response for device-to-host data FIS
0x0004  4            0  R_ERR response for host-to-device data FIS
0x0005  4            0  R_ERR response for non-data FIS
0x0006  4            0  R_ERR response for device-to-host non-data FIS
0x0007  4            0  R_ERR response for host-to-device non-data FIS
0x0008  4            0  Device-to-host non-data FIS retries
0x0009  4            8  Transition from drive PhyRdy to drive PhyNRdy
0x000a  4            8  Device-to-host register FISes sent due to a COMRESET
0x000b  4            0  CRC errors within host-to-device FIS
0x000d  4            0  Non-CRC errors within host-to-device FIS
0x000f  4            0  R_ERR response for host-to-device data FIS, CRC
0x0010  4            0  R_ERR response for host-to-device data FIS, non-CRC
0x0012  4            0  R_ERR response for host-to-device non-data FIS, CRC
0x0013  4            0  R_ERR response for host-to-device non-data FIS, non-CRC

