smartctl 7.3 2022-02-28 r5338 [FreeBSD 13.1-RELEASE-p7 amd64] (local build)
Copyright (C) 2002-22, Bruce Allen, Christian Franke, www.smartmontools.org

=== START OF INFORMATION SECTION ===
Model Number:                       PCIe SSD
Serial Number:                      --
Firmware Version:                   EHFM32.1
PCI Vendor/Subsystem ID:            0x1987
IEEE OUI Identifier:                0x6479a7
Controller ID:                      0
NVMe Version:                       1.4
Number of Namespaces:               1
Namespace 1 Size/Capacity:          256,060,514,304 [256 GB]
Namespace 1 Formatted LBA Size:     512
Namespace 1 IEEE EUI-64:            6479a7 ...
Local Time is:                      Thu Jun  8 12:32:45 2023 BST
Firmware Updates (0x12):            1 Slot, no Reset required
Optional Admin Commands (0x0017):   Security Format Frmw_DL Self_Test
Optional NVM Commands (0x005f):     Comp Wr_Unc DS_Mngmt Wr_Zero Sav/Sel_Feat Timestmp
Log Page Attributes (0x1e):         Cmd_Eff_Lg Ext_Get_Lg Telmtry_Lg Pers_Ev_Lg
Maximum Data Transfer Size:         64 Pages
Warning  Comp. Temp. Threshold:     84 Celsius
Critical Comp. Temp. Threshold:     88 Celsius

Supported Power States
St Op     Max   Active     Idle   RL RT WL WT  Ent_Lat  Ex_Lat
 0 +     5.00W       -        -    0  0  0  0        0       0
 1 +     2.40W       -        -    1  1  1  1        0       0
 2 +     1.92W       -        -    2  2  2  2        0       0
 3 -   0.0700W       -        -    3  3  3  3     1000    1000
 4 -   0.0050W       -        -    4  4  4  4    10000   40000

Supported LBA Sizes (NSID 0x1)
Id Fmt  Data  Metadt  Rel_Perf
 0 +     512       0         1
 1 -    4096       0         0

=== START OF SMART DATA SECTION ===
SMART overall-health self-assessment test result: PASSED

SMART/Health Information (NVMe Log 0x02)
Critical Warning:                   0x00
Temperature:                        51 Celsius
Available Spare:                    100%
Available Spare Threshold:          5%
Percentage Used:                    4%
Data Units Read:                    33,997 [17.4 GB]
Data Units Written:                 8,557,831 [4.38 TB]
Host Read Commands:                 1,099,380
Host Write Commands:                433,256,689
Controller Busy Time:               510
Power Cycles:                       26
Power On Hours:                     2,821
Unsafe Shutdowns:                   22
Media and Data Integrity Errors:    0
Error Information Log Entries:      0
Warning  Comp. Temperature Time:    0
Critical Comp. Temperature Time:    0

Error Information (NVMe Log 0x01, 16 of 63 entries)
No Errors Logged

