smartctl 7.4 2023-08-01 r5530 [FreeBSD 14.2-RELEASE-p1 amd64] (local build)
Copyright (C) 2002-23, Bruce Allen, Christian Franke, www.smartmontools.org

=== START OF INFORMATION SECTION ===
Model Family:     Seagate Barracuda 7200.12
Device Model:     ST3250312AS
Serial Number:    --
LU WWN Device Id: 5 000c50 ...
Firmware Version: JC49
User Capacity:    250,059,350,016 bytes [250 GB]
Sector Size:      512 bytes logical/physical
Rotation Rate:    7200 rpm
Device is:        In smartctl database 7.3/5528
ATA Version is:   ATA8-ACS T13/1699-D revision 4
SATA Version is:  SATA 3.0, 6.0 Gb/s (current: 3.0 Gb/s)
Local Time is:    Sat Feb 22 23:48:21 2025 CET
SMART support is: Available - device has SMART capability.
SMART support is: Enabled
AAM feature is:   Disabled
APM feature is:   Unavailable
Rd look-ahead is: Enabled
Write cache is:   Enabled
DSN feature is:   Unavailable
ATA Security is:  Disabled, frozen [SEC2]
Wt Cache Reorder: Unknown

=== START OF READ SMART DATA SECTION ===
SMART overall-health self-assessment test result: PASSED

General SMART Values:
Offline data collection status:  (0x82)	Offline data collection activity
					was completed without error.
					Auto Offline Data Collection: Enabled.
Self-test execution status:      (   0)	The previous self-test routine completed
					without error or no self-test has ever 
					been run.
Total time to complete Offline 
data collection: 		(  600) seconds.
Offline data collection
capabilities: 			 (0x7b) SMART execute Offline immediate.
					Auto Offline data collection on/off support.
					Suspend Offline collection upon new
					command.
					Offline surface scan supported.
					Self-test supported.
					Conveyance Self-test supported.
					Selective Self-test supported.
SMART capabilities:            (0x0003)	Saves SMART data before entering
					power-saving mode.
					Supports SMART auto save timer.
Error logging capability:        (0x01)	Error logging supported.
					General Purpose Logging supported.
Short self-test routine 
recommended polling time: 	 (   1) minutes.
Extended self-test routine
recommended polling time: 	 (  43) minutes.
Conveyance self-test routine
recommended polling time: 	 (   2) minutes.
SCT capabilities: 	       (0x103f)	SCT Status supported.
					SCT Error Recovery Control supported.
					SCT Feature Control supported.
					SCT Data Table supported.

SMART Attributes Data Structure revision number: 10
Vendor Specific SMART Attributes with Thresholds:
ID# ATTRIBUTE_NAME          FLAGS    VALUE WORST THRESH FAIL RAW_VALUE
  1 Raw_Read_Error_Rate     POSR--   116   099   006    -    101443398
  3 Spin_Up_Time            PO----   097   097   000    -    0
  4 Start_Stop_Count        -O--CK   096   096   020    -    4495
  5 Reallocated_Sector_Ct   PO--CK   100   100   036    -    0
  7 Seek_Error_Rate         POSR--   084   060   030    -    319874186
  9 Power_On_Hours          -O--CK   030   030   000    -    61926
 10 Spin_Retry_Count        PO--C-   100   100   097    -    0
 12 Power_Cycle_Count       -O--CK   098   098   020    -    2278
183 Runtime_Bad_Block       -O--CK   100   100   000    -    0
184 End-to-End_Error        -O--CK   100   100   099    -    0
187 Reported_Uncorrect      -O--CK   081   081   000    -    19
188 Command_Timeout         -O--CK   100   100   000    -    2
189 High_Fly_Writes         -O-RCK   100   100   000    -    0
190 Airflow_Temperature_Cel -O---K   075   053   045    -    25 (Min/Max 25/25)
194 Temperature_Celsius     -O---K   025   047   000    -    25 (0 10 0 0 0)
195 Hardware_ECC_Recovered  -O-RC-   020   015   000    -    101443398
197 Current_Pending_Sector  -O--C-   100   100   000    -    0
198 Offline_Uncorrectable   ----C-   100   100   000    -    0
199 UDMA_CRC_Error_Count    -OSRCK   200   200   000    -    0
240 Head_Flying_Hours       ------   100   253   000    -    65818 (165 250 0)
241 Total_LBAs_Written      ------   100   253   000    -    2653987005
242 Total_LBAs_Read         ------   100   253   000    -    4270709652
                            ||||||_ K auto-keep
                            |||||__ C event count
                            ||||___ R error rate
                            |||____ S speed/performance
                            ||_____ O updated online
                            |______ P prefailure warning

General Purpose Log Directory Version 1
SMART           Log Directory Version 1 [multi-sector log support]
Address    Access  R/W   Size  Description
0x00       GPL,SL  R/O      1  Log Directory
0x01       GPL,SL  R/O      1  Summary SMART error log
0x02       GPL,SL  R/O      5  Comprehensive SMART error log
0x03       GPL     R/O      5  Ext. Comprehensive SMART error log
0x06       GPL,SL  R/O      1  SMART self-test log
0x07       GPL     R/O      1  Extended self-test log
0x09       GPL,SL  R/W      1  Selective self-test log
0x10       GPL     R/O      1  NCQ Command Error log
0x11       GPL     R/O      1  SATA Phy Event Counters log
0x21       GPL     R/O      1  Write stream error log
0x22       GPL     R/O      1  Read stream error log
0x80-0x9f  GPL,SL  R/W     16  Host vendor specific log
0xa1       GPL,SL  VS      20  Device vendor specific log
0xa2       GPL     VS    2248  Device vendor specific log
0xa8       GPL,SL  VS     129  Device vendor specific log
0xa9       GPL,SL  VS       1  Device vendor specific log
0xb0       GPL     VS    2928  Device vendor specific log
0xbd       GPL     VS     252  Device vendor specific log
0xbe-0xbf  GPL     VS   65535  Device vendor specific log
0xc0       GPL,SL  VS       1  Device vendor specific log
0xe0       GPL,SL  R/W      1  SCT Command/Status
0xe1       GPL,SL  R/W      1  SCT Data Transfer

SMART Extended Comprehensive Error Log Version: 1 (5 sectors)
Device Error Count: 19
	CR     = Command Register
	FEATR  = Features Register
	COUNT  = Count (was: Sector Count) Register
	LBA_48 = Upper bytes of LBA High/Mid/Low Registers ]  ATA-8
	LH     = LBA High (was: Cylinder High) Register    ]   LBA
	LM     = LBA Mid (was: Cylinder Low) Register      ] Register
	LL     = LBA Low (was: Sector Number) Register     ]
	DV     = Device (was: Device/Head) Register
	DC     = Device Control Register
	ER     = Error register
	ST     = Status register
Powered_Up_Time is measured from power on, and printed as
DDd+hh:mm:SS.sss where DD=days, hh=hours, mm=minutes,
SS=sec, and sss=millisec. It "wraps" after 49.710 days.

Error 19 [18] occurred at disk power-on lifetime: 9295 hours (387 days + 7 hours)
  When the command that caused the error occurred, the device was active or idle.

  After command completion occurred, registers were:
  ER -- ST COUNT  LBA_48  LH LM LL DV DC
  -- -- -- == -- == == == -- -- -- -- --
  40 -- 51 00 00 00 00 00 5d 40 5f 00 00  Error: UNC at LBA = 0x005d405f = 6111327

  Commands leading to the command that caused the error were:
  CR FEATR COUNT  LBA_48  LH LM LL DV DC  Powered_Up_Time  Command/Feature_Name
  -- == -- == -- == == == -- -- -- -- --  ---------------  --------------------
  60 00 00 00 08 00 00 00 5d 40 58 40 00     00:01:24.505  READ FPDMA QUEUED
  ef 00 02 00 00 00 00 00 00 00 00 00 00     00:01:24.475  SET FEATURES [Enable write cache]
  00 00 00 00 00 00 00 00 00 00 00 00 ff     00:01:24.385  NOP [Abort queued commands]
  60 00 00 00 08 00 00 00 5d 40 58 40 00     00:01:21.627  READ FPDMA QUEUED
  ef 00 02 00 00 00 00 00 00 00 00 00 00     00:01:21.619  SET FEATURES [Enable write cache]

Error 18 [17] occurred at disk power-on lifetime: 9295 hours (387 days + 7 hours)
  When the command that caused the error occurred, the device was active or idle.

  After command completion occurred, registers were:
  ER -- ST COUNT  LBA_48  LH LM LL DV DC
  -- -- -- == -- == == == -- -- -- -- --
  40 -- 51 00 00 00 00 00 5d 40 5f 00 00  Error: UNC at LBA = 0x005d405f = 6111327

  Commands leading to the command that caused the error were:
  CR FEATR COUNT  LBA_48  LH LM LL DV DC  Powered_Up_Time  Command/Feature_Name
  -- == -- == -- == == == -- -- -- -- --  ---------------  --------------------
  60 00 00 00 08 00 00 00 5d 40 58 40 00     00:01:21.627  READ FPDMA QUEUED
  ef 00 02 00 00 00 00 00 00 00 00 00 00     00:01:21.619  SET FEATURES [Enable write cache]
  00 00 00 00 00 00 00 00 00 00 00 00 ff     00:01:21.529  NOP [Abort queued commands]
  60 00 00 00 08 00 00 00 5d 40 58 40 00     00:01:18.779  READ FPDMA QUEUED
  ef 00 02 00 00 00 00 00 00 00 00 00 00     00:01:18.764  SET FEATURES [Enable write cache]

Error 17 [16] occurred at disk power-on lifetime: 9295 hours (387 days + 7 hours)
  When the command that caused the error occurred, the device was active or idle.

  After command completion occurred, registers were:
  ER -- ST COUNT  LBA_48  LH LM LL DV DC
  -- -- -- == -- == == == -- -- -- -- --
  40 -- 51 00 00 00 00 00 5d 40 5f 00 00  Error: UNC at LBA = 0x005d405f = 6111327

  Commands leading to the command that caused the error were:
  CR FEATR COUNT  LBA_48  LH LM LL DV DC  Powered_Up_Time  Command/Feature_Name
  -- == -- == -- == == == -- -- -- -- --  ---------------  --------------------
  60 00 00 00 08 00 00 00 5d 40 58 40 00     00:01:18.779  READ FPDMA QUEUED
  ef 00 02 00 00 00 00 00 00 00 00 00 00     00:01:18.764  SET FEATURES [Enable write cache]
  00 00 00 00 00 00 00 00 00 00 00 00 ff     00:01:18.674  NOP [Abort queued commands]
  60 00 00 00 08 00 00 00 5d 40 58 40 00     00:01:15.921  READ FPDMA QUEUED
  ef 00 02 00 00 00 00 00 00 00 00 00 00     00:01:15.894  SET FEATURES [Enable write cache]

Error 16 [15] occurred at disk power-on lifetime: 9295 hours (387 days + 7 hours)
  When the command that caused the error occurred, the device was active or idle.

  After command completion occurred, registers were:
  ER -- ST COUNT  LBA_48  LH LM LL DV DC
  -- -- -- == -- == == == -- -- -- -- --
  40 -- 51 00 00 00 00 00 5d 40 5f 00 00  Error: UNC at LBA = 0x005d405f = 6111327

  Commands leading to the command that caused the error were:
  CR FEATR COUNT  LBA_48  LH LM LL DV DC  Powered_Up_Time  Command/Feature_Name
  -- == -- == -- == == == -- -- -- -- --  ---------------  --------------------
  60 00 00 00 08 00 00 00 5d 40 58 40 00     00:01:15.921  READ FPDMA QUEUED
  ef 00 02 00 00 00 00 00 00 00 00 00 00     00:01:15.894  SET FEATURES [Enable write cache]
  00 00 00 00 00 00 00 00 00 00 00 00 ff     00:01:15.776  NOP [Abort queued commands]
  60 00 00 00 08 00 00 00 5d 40 58 40 00     00:01:13.026  READ FPDMA QUEUED
  ef 00 02 00 00 00 00 00 00 00 00 00 00     00:01:13.023  SET FEATURES [Enable write cache]

Error 15 [14] occurred at disk power-on lifetime: 9295 hours (387 days + 7 hours)
  When the command that caused the error occurred, the device was active or idle.

  After command completion occurred, registers were:
  ER -- ST COUNT  LBA_48  LH LM LL DV DC
  -- -- -- == -- == == == -- -- -- -- --
  40 -- 51 00 00 00 00 00 5d 40 5f 00 00  Error: UNC at LBA = 0x005d405f = 6111327

  Commands leading to the command that caused the error were:
  CR FEATR COUNT  LBA_48  LH LM LL DV DC  Powered_Up_Time  Command/Feature_Name
  -- == -- == -- == == == -- -- -- -- --  ---------------  --------------------
  60 00 00 00 08 00 00 00 5d 40 58 40 00     00:01:13.026  READ FPDMA QUEUED
  ef 00 02 00 00 00 00 00 00 00 00 00 00     00:01:13.023  SET FEATURES [Enable write cache]
  00 00 00 00 00 00 00 00 00 00 00 00 ff     00:01:12.929  NOP [Abort queued commands]
  60 00 00 00 08 00 00 00 5d 40 58 40 00     00:01:10.176  READ FPDMA QUEUED
  ef 00 02 00 00 00 00 00 00 00 00 00 00     00:01:10.121  SET FEATURES [Enable write cache]

Error 14 [13] occurred at disk power-on lifetime: 9295 hours (387 days + 7 hours)
  When the command that caused the error occurred, the device was active or idle.

  After command completion occurred, registers were:
  ER -- ST COUNT  LBA_48  LH LM LL DV DC
  -- -- -- == -- == == == -- -- -- -- --
  40 -- 51 00 00 00 00 00 5d 40 5f 00 00  Error: UNC at LBA = 0x005d405f = 6111327

  Commands leading to the command that caused the error were:
  CR FEATR COUNT  LBA_48  LH LM LL DV DC  Powered_Up_Time  Command/Feature_Name
  -- == -- == -- == == == -- -- -- -- --  ---------------  --------------------
  60 00 00 00 08 00 00 00 5d 40 58 40 00     00:01:10.176  READ FPDMA QUEUED
  ef 00 02 00 00 00 00 00 00 00 00 00 00     00:01:10.121  SET FEATURES [Enable write cache]
  00 00 00 00 00 00 00 00 00 00 00 00 ff     00:01:10.073  NOP [Abort queued commands]
  60 00 00 00 08 00 00 00 5d 40 58 40 00     00:01:07.328  READ FPDMA QUEUED
  ef 00 02 00 00 00 00 00 00 00 00 00 00     00:01:07.250  SET FEATURES [Enable write cache]

Error 13 [12] occurred at disk power-on lifetime: 9295 hours (387 days + 7 hours)
  When the command that caused the error occurred, the device was active or idle.

  After command completion occurred, registers were:
  ER -- ST COUNT  LBA_48  LH LM LL DV DC
  -- -- -- == -- == == == -- -- -- -- --
  40 -- 51 00 00 00 00 00 5d 40 5f 00 00  Error: UNC at LBA = 0x005d405f = 6111327

  Commands leading to the command that caused the error were:
  CR FEATR COUNT  LBA_48  LH LM LL DV DC  Powered_Up_Time  Command/Feature_Name
  -- == -- == -- == == == -- -- -- -- --  ---------------  --------------------
  60 00 00 00 08 00 00 00 5d 40 58 40 00     00:01:07.328  READ FPDMA QUEUED
  ef 00 02 00 00 00 00 00 00 00 00 00 00     00:01:07.250  SET FEATURES [Enable write cache]
  00 00 00 00 00 00 00 00 00 00 00 00 ff     00:01:07.226  NOP [Abort queued commands]
  60 00 00 00 08 00 00 00 5d 40 58 40 00     00:01:04.468  READ FPDMA QUEUED
  ef 00 02 00 00 00 00 00 00 00 00 00 00     00:01:04.457  SET FEATURES [Enable write cache]

Error 12 [11] occurred at disk power-on lifetime: 9295 hours (387 days + 7 hours)
  When the command that caused the error occurred, the device was active or idle.

  After command completion occurred, registers were:
  ER -- ST COUNT  LBA_48  LH LM LL DV DC
  -- -- -- == -- == == == -- -- -- -- --
  40 -- 51 00 00 00 00 00 5d 40 5f 00 00  Error: UNC at LBA = 0x005d405f = 6111327

  Commands leading to the command that caused the error were:
  CR FEATR COUNT  LBA_48  LH LM LL DV DC  Powered_Up_Time  Command/Feature_Name
  -- == -- == -- == == == -- -- -- -- --  ---------------  --------------------
  60 00 00 00 08 00 00 00 5d 40 58 40 00     00:01:04.468  READ FPDMA QUEUED
  ef 00 02 00 00 00 00 00 00 00 00 00 00     00:01:04.457  SET FEATURES [Enable write cache]
  00 00 00 00 00 00 00 00 00 00 00 00 ff     00:01:04.370  NOP [Abort queued commands]
  60 00 00 00 08 00 00 00 5d 40 58 40 00     00:01:01.612  READ FPDMA QUEUED
  ef 00 02 00 00 00 00 00 00 00 00 00 00     00:01:01.602  SET FEATURES [Enable write cache]

SMART Extended Self-test Log Version: 1 (1 sectors)
Num  Test_Description    Status                  Remaining  LifeTime(hours)  LBA_of_first_error
# 1  Extended offline    Completed without error       00%     10064         -
# 2  Short offline       Completed without error       00%     10064         -
# 3  Short offline       Completed without error       00%      9907         -
# 4  Short offline       Completed without error       00%      9907         -
# 5  Extended offline    Completed without error       00%      9859         -
# 6  Extended offline    Completed without error       00%      9858         -
# 7  Short offline       Completed without error       00%      9857         -
# 8  Short offline       Completed without error       00%         0         -

SMART Selective self-test log data structure revision number 1
 SPAN  MIN_LBA  MAX_LBA  CURRENT_TEST_STATUS
    1        0        0  Not_testing
    2        0        0  Not_testing
    3        0        0  Not_testing
    4        0        0  Not_testing
    5        0        0  Not_testing
Selective self-test flags (0x0):
  After scanning selected spans, do NOT read-scan remainder of disk.
If Selective self-test is pending on power-up, resume after 0 minute delay.

SCT Status Version:                  3
SCT Version (vendor specific):       522 (0x020a)
Device State:                        Active (0)
Current Temperature:                    25 Celsius
Power Cycle Min/Max Temperature:     25/25 Celsius
Lifetime    Min/Max Temperature:     10/47 Celsius
Under/Over Temperature Limit Count:   0/0

SCT Temperature History Version:     2
Temperature Sampling Period:         1 minute
Temperature Logging Interval:        59 minutes
Min/Max recommended Temperature:     14/55 Celsius
Min/Max Temperature Limit:           10/60 Celsius
Temperature History Size (Index):    128 (36)

SCT Error Recovery Control:
           Read: Disabled
          Write: Disabled

Device Statistics (GP/SMART Log 0x04) not supported

Pending Defects log (GP Log 0x0c) not supported

SATA Phy Event Counters (GP Log 0x11)
ID      Size     Value  Description
0x000a  2            8  Device-to-host register FISes sent due to a COMRESET
0x0001  2            0  Command failed due to ICRC error
0x0003  2            0  R_ERR response for device-to-host data FIS
0x0004  2            0  R_ERR response for host-to-device data FIS
0x0006  2            0  R_ERR response for device-to-host non-data FIS
0x0007  2            0  R_ERR response for host-to-device non-data FIS

