smartctl 7.4 2023-08-01 r5530 [FreeBSD 14.2-RELEASE-p3 amd64] (local build)
Copyright (C) 2002-23, Bruce Allen, Christian Franke, www.smartmontools.org

=== START OF INFORMATION SECTION ===
Device Model:     TEAM T253256GB
Serial Number:    --
LU WWN Device Id: 5 000000 ...
Firmware Version: SN11986
User Capacity:    256,060,514,304 bytes [256 GB]
Sector Size:      512 bytes logical/physical
Rotation Rate:    Solid State Device
Form Factor:      2.5 inches
TRIM Command:     Available, deterministic, zeroed
Device is:        Not in smartctl database 7.3/5528
ATA Version is:   ACS-4 (minor revision not indicated)
SATA Version is:  SATA 3.2, 6.0 Gb/s (current: 3.0 Gb/s)
Local Time is:    Tue May 13 13:49:58 2025 WITA
SMART support is: Available - device has SMART capability.
SMART support is: Enabled
AAM feature is:   Unavailable
APM feature is:   Unavailable
Rd look-ahead is: Enabled
Write cache is:   Enabled
DSN feature is:   Unavailable
ATA Security is:  Disabled, frozen [SEC2]
Wt Cache Reorder: Enabled

=== START OF READ SMART DATA SECTION ===
SMART overall-health self-assessment test result: PASSED

General SMART Values:
Offline data collection status:  (0x00)	Offline data collection activity
					was never started.
					Auto Offline Data Collection: Disabled.
Self-test execution status:      (   0)	The previous self-test routine completed
					without error or no self-test has ever 
					been run.
Total time to complete Offline 
data collection: 		(   33) seconds.
Offline data collection
capabilities: 			 (0x7b) SMART execute Offline immediate.
					Auto Offline data collection on/off support.
					Suspend Offline collection upon new
					command.
					Offline surface scan supported.
					Self-test supported.
					Conveyance Self-test supported.
					Selective Self-test supported.
SMART capabilities:            (0x0003)	Saves SMART data before entering
					power-saving mode.
					Supports SMART auto save timer.
Error logging capability:        (0x01)	Error logging supported.
					General Purpose Logging supported.
Short self-test routine 
recommended polling time: 	 (   2) minutes.
Extended self-test routine
recommended polling time: 	 (  85) minutes.
Conveyance self-test routine
recommended polling time: 	 (   2) minutes.
SCT capabilities: 	       (0x0031)	SCT Status supported.
					SCT Feature Control supported.
					SCT Data Table supported.

SMART Attributes Data Structure revision number: 20
Vendor Specific SMART Attributes with Thresholds:
ID# ATTRIBUTE_NAME          FLAGS    VALUE WORST THRESH FAIL RAW_VALUE
  5 Reallocated_Sector_Ct   ------+  100   100   010    -    0
  9 Power_On_Hours          ------+  100   100   000    -    234
 12 Power_Cycle_Count       ------+  100   100   000    -    369
164 Unknown_Attribute       ------   100   100   000    -    4296671239
165 Unknown_Attribute       ------   100   100   000    -    26
166 Unknown_Attribute       ------   100   100   000    -    1
167 Unknown_Attribute       ------+  100   100   000    -    7
194 Temperature_Celsius     ------+  035   035   000    -    35 (Min/Max 27/41)
199 UDMA_CRC_Error_Count    ------+  100   100   000    -    5
241 Total_LBAs_Written      ------+  100   100   000    -    556
242 Total_LBAs_Read         ------+  100   100   000    -    1246
                            ||||||_ K auto-keep
                            |||||__ C event count
                            ||||___ R error rate
                            |||____ S speed/performance
                            ||_____ O updated online
                            |______ P prefailure warning

General Purpose Log Directory Version 1
SMART           Log Directory Version 1 [multi-sector log support]
Address    Access  R/W   Size  Description
0x00       GPL,SL  R/O      1  Log Directory
0x01           SL  R/O      1  Summary SMART error log
0x02           SL  R/O     51  Comprehensive SMART error log
0x03       GPL     R/O     64  Ext. Comprehensive SMART error log
0x04       GPL,SL  R/O      8  Device Statistics log
0x06           SL  R/O      1  SMART self-test log
0x07       GPL     R/O      1  Extended self-test log
0x09           SL  R/W      1  Selective self-test log
0x10       GPL     R/O      1  NCQ Command Error log
0x11       GPL     R/O      1  SATA Phy Event Counters log
0x30       GPL,SL  R/O      9  IDENTIFY DEVICE data log
0x80-0x9f  GPL,SL  R/W     16  Host vendor specific log
0xe0       GPL,SL  R/W      1  SCT Command/Status
0xe1       GPL,SL  R/W      1  SCT Data Transfer

SMART Extended Comprehensive Error Log Version: 1 (64 sectors)
Device Error Count: 5
	CR     = Command Register
	FEATR  = Features Register
	COUNT  = Count (was: Sector Count) Register
	LBA_48 = Upper bytes of LBA High/Mid/Low Registers ]  ATA-8
	LH     = LBA High (was: Cylinder High) Register    ]   LBA
	LM     = LBA Mid (was: Cylinder Low) Register      ] Register
	LL     = LBA Low (was: Sector Number) Register     ]
	DV     = Device (was: Device/Head) Register
	DC     = Device Control Register
	ER     = Error register
	ST     = Status register
Powered_Up_Time is measured from power on, and printed as
DDd+hh:mm:SS.sss where DD=days, hh=hours, mm=minutes,
SS=sec, and sss=millisec. It "wraps" after 49.710 days.

Error 5 [4] occurred at disk power-on lifetime: 120 hours (5 days + 0 hours)
  When the command that caused the error occurred, the device was in an unknown state.

  After command completion occurred, registers were:
  ER -- ST COUNT  LBA_48  LH LM LL DV DC
  -- -- -- == -- == == == -- -- -- -- --
  40 -- 41 00 80 00 00 03 f8 70 48 40 80  Error: UNC at LBA = 0x03f87048 = 66613320

  Commands leading to the command that caused the error were:
  CR FEATR COUNT  LBA_48  LH LM LL DV DC  Powered_Up_Time  Command/Feature_Name
  -- == -- == -- == == == -- -- -- -- --  ---------------  --------------------
  60 00 80 00 00 00 00 03 f8 70 c0 40 80     00:02:16.100  READ FPDMA QUEUED
  25 00 00 00 80 00 00 00 00 1d 00 40 80     00:00:45.900  READ DMA EXT
  e1 00 00 00 0f 00 00 00 00 00 00 00 80     00:00:45.900  IDLE IMMEDIATE
  ef 00 03 00 46 00 00 00 00 00 00 00 80     00:00:45.900  SET FEATURES [Set transfer mode]
  ef 00 02 00 00 00 00 00 00 00 00 00 80     00:00:45.900  SET FEATURES [Enable write cache]

Error 4 [3] occurred at disk power-on lifetime: 120 hours (5 days + 0 hours)
  When the command that caused the error occurred, the device was in an unknown state.

  After command completion occurred, registers were:
  ER -- ST COUNT  LBA_48  LH LM LL DV DC
  -- -- -- == -- == == == -- -- -- -- --
  40 -- 41 00 80 00 00 00 00 1c 80 40 80  Error: UNC at LBA = 0x00001c80 = 7296

  Commands leading to the command that caused the error were:
  CR FEATR COUNT  LBA_48  LH LM LL DV DC  Powered_Up_Time  Command/Feature_Name
  -- == -- == -- == == == -- -- -- -- --  ---------------  --------------------
  60 00 80 00 00 00 00 00 00 1c e0 a0 80     00:00:45.000  READ FPDMA QUEUED
  ec 00 00 00 01 00 00 00 00 00 00 a0 80     00:00:23.000  IDENTIFY DEVICE
  ec 00 00 00 01 00 00 00 00 00 00 a0 80     00:00:23.000  IDENTIFY DEVICE
  b0 00 d1 00 01 00 00 00 c2 4f 00 a0 80     00:00:23.000  SMART READ ATTRIBUTE THRESHOLDS [OBS-4]
  b0 00 d0 00 01 00 00 00 c2 4f 00 a0 80     00:00:23.000  SMART READ DATA

Error 3 [2] occurred at disk power-on lifetime: 78 hours (3 days + 6 hours)
  When the command that caused the error occurred, the device was in an unknown state.

  After command completion occurred, registers were:
  ER -- ST COUNT  LBA_48  LH LM LL DV DC
  -- -- -- == -- == == == -- -- -- -- --
  84 -- 51 00 08 00 00 00 00 08 20 40 02  Error: ICRC, ABRT 8 sectors at LBA = 0x00000820 = 2080

  Commands leading to the command that caused the error were:
  CR FEATR COUNT  LBA_48  LH LM LL DV DC  Powered_Up_Time  Command/Feature_Name
  -- == -- == -- == == == -- -- -- -- --  ---------------  --------------------
  25 ff ff 00 08 00 00 00 00 08 20 40 80     00:09:56.100  READ DMA EXT
  25 ff ff 00 08 00 00 00 00 08 10 40 80     00:09:56.100  READ DMA EXT
  25 ff ff 00 08 00 00 00 00 08 08 40 80     00:09:55.800  READ DMA EXT
  25 ff ff 00 08 00 00 00 00 08 00 40 80     00:09:55.800  READ DMA EXT
  25 ff ff 00 01 00 00 00 00 08 00 40 ff     00:09:55.700  READ DMA EXT

Error 2 [1] occurred at disk power-on lifetime: 78 hours (3 days + 6 hours)
  When the command that caused the error occurred, the device was in an unknown state.

  After command completion occurred, registers were:
  ER -- ST COUNT  LBA_48  LH LM LL DV DC
  -- -- -- == -- == == == -- -- -- -- --
  84 -- 51 00 08 00 00 00 00 08 08 40 02  Error: ICRC, ABRT 8 sectors at LBA = 0x00000808 = 2056

  Commands leading to the command that caused the error were:
  CR FEATR COUNT  LBA_48  LH LM LL DV DC  Powered_Up_Time  Command/Feature_Name
  -- == -- == -- == == == -- -- -- -- --  ---------------  --------------------
  25 ff ff 00 08 00 00 00 00 08 08 40 80     00:09:55.800  READ DMA EXT
  25 ff ff 00 08 00 00 00 00 08 00 40 80     00:09:55.800  READ DMA EXT
  25 ff ff 00 01 00 00 00 00 08 00 40 ff     00:09:55.700  READ DMA EXT
  25 ff ff 00 10 00 00 00 00 08 00 40 ff     00:09:35.100  READ DMA EXT
  25 ff ff 00 08 00 00 00 00 08 00 40 ff     00:09:34.000  READ DMA EXT

Error 1 [0] occurred at disk power-on lifetime: 75 hours (3 days + 3 hours)
  When the command that caused the error occurred, the device was in an unknown state.

  After command completion occurred, registers were:
  ER -- ST COUNT  LBA_48  LH LM LL DV DC
  -- -- -- == -- == == == -- -- -- -- --
  84 -- 51 00 01 00 00 00 00 00 00 40 02  Error: ICRC, ABRT 1 sectors at LBA = 0x00000000 = 0

  Commands leading to the command that caused the error were:
  CR FEATR COUNT  LBA_48  LH LM LL DV DC  Powered_Up_Time  Command/Feature_Name
  -- == -- == -- == == == -- -- -- -- --  ---------------  --------------------
  25 ff ff 00 01 00 00 00 00 00 00 40 80     00:00:23.000  READ DMA EXT
  25 ff ff 00 01 00 00 00 00 00 00 40 80     00:00:22.900  READ DMA EXT
  25 ff ff 00 01 00 00 00 00 00 00 40 80     00:00:22.900  READ DMA EXT
  25 ff ff 00 01 00 00 00 00 00 01 40 80     00:00:22.900  READ DMA EXT
  25 ff ff 00 01 00 00 00 00 00 00 40 80     00:00:22.900  READ DMA EXT

SMART Extended Self-test Log Version: 1 (1 sectors)
Num  Test_Description    Status                  Remaining  LifeTime(hours)  LBA_of_first_error
# 1  Short offline       Completed without error       00%       234         -

SMART Selective self-test log data structure revision number 1
 SPAN  MIN_LBA  MAX_LBA  CURRENT_TEST_STATUS
    1        0        0  Not_testing
    2        0        0  Not_testing
    3        0        0  Not_testing
    4        0        0  Not_testing
    5        0        0  Not_testing
Selective self-test flags (0x0):
  After scanning selected spans, do NOT read-scan remainder of disk.
If Selective self-test is pending on power-up, resume after 0 minute delay.

SCT Status Version:                  3
SCT Version (vendor specific):       1 (0x0001)
Device State:                        Active (0)
Current Temperature:                    37 Celsius
Power Cycle Min/Max Temperature:      ?/38 Celsius
Lifetime    Min/Max Temperature:      ?/ ? Celsius
Under/Over Temperature Limit Count:   0/0

SCT Temperature History Version:     2
Temperature Sampling Period:         1 minute
Temperature Logging Interval:        1 minute
Min/Max recommended Temperature:     -127/127 Celsius
Min/Max Temperature Limit:           -127/127 Celsius
Temperature History Size (Index):    478 (242)

SCT Error Recovery Control command not supported

Device Statistics (GP Log 0x04)
Page  Offset Size        Value Flags Description
0x01  =====  =               =  ===  == General Statistics (rev 1) ==
0x01  0x008  4             369  ---  Lifetime Power-On Resets
0x01  0x010  4             234  ---  Power-on Hours
0x01  0x018  6      1167331804  ---  Logical Sectors Written
0x01  0x020  6        10488924  ---  Number of Write Commands
0x01  0x028  6      2614184693  ---  Logical Sectors Read
0x01  0x030  6        20098113  ---  Number of Read Commands
0x01  0x038  6    215591086400  ---  Date and Time TimeStamp
0x07  =====  =               =  ===  == Solid State Device Statistics (rev 1) ==
0x07  0x008  1               1  N--  Percentage Used Endurance Indicator
                                |||_ C monitored condition met
                                ||__ D supports DSN
                                |___ N normalized value

Pending Defects log (GP Log 0x0c) not supported

SATA Phy Event Counters (GP Log 0x11)
ID      Size     Value  Description
0x0001  2            5  Command failed due to ICRC error
0x0003  2            0  R_ERR response for device-to-host data FIS
0x0004  2            0  R_ERR response for host-to-device data FIS
0x0006  2            0  R_ERR response for device-to-host non-data FIS
0x0007  2            0  R_ERR response for host-to-device non-data FIS
0x0008  2            0  Device-to-host non-data FIS retries
0x0009  4            0  Transition from drive PhyRdy to drive PhyNRdy
0x000a  4            3  Device-to-host register FISes sent due to a COMRESET
0x000f  2            0  R_ERR response for host-to-device data FIS, CRC
0x0010  2            0  R_ERR response for host-to-device data FIS, non-CRC
0x0012  2            0  R_ERR response for host-to-device non-data FIS, CRC
0x0013  2            0  R_ERR response for host-to-device non-data FIS, non-CRC

