smartctl 7.2 2020-12-30 r5155 [FreeBSD 12.3-RELEASE amd64] (local build)
Copyright (C) 2002-20, Bruce Allen, Christian Franke, www.smartmontools.org

=== START OF INFORMATION SECTION ===
Model Family:     Western Digital Green
Device Model:     WDC WD20EZRX-00D8PB0
Serial Number:    --
LU WWN Device Id: 5 0014ee ...
Firmware Version: 80.00A80
User Capacity:    2,000,398,934,016 bytes [2.00 TB]
Sector Sizes:     512 bytes logical, 4096 bytes physical
Rotation Rate:    5400 rpm
Device is:        In smartctl database [for details use: -P show]
ATA Version is:   ACS-2 (minor revision not indicated)
SATA Version is:  SATA 3.0, 6.0 Gb/s (current: 3.0 Gb/s)
Local Time is:    Thu Dec 30 16:25:42 2021 AEDT
SMART support is: Available - device has SMART capability.
SMART support is: Enabled
AAM feature is:   Unavailable
APM feature is:   Unavailable
Rd look-ahead is: Enabled
Write cache is:   Enabled
DSN feature is:   Unavailable
ATA Security is:  Disabled, NOT FROZEN [SEC1]
Wt Cache Reorder: Enabled

=== START OF READ SMART DATA SECTION ===
SMART overall-health self-assessment test result: PASSED

General SMART Values:
Offline data collection status:  (0x82)	Offline data collection activity
					was completed without error.
					Auto Offline Data Collection: Enabled.
Self-test execution status:      ( 121)	The previous self-test completed having
					the read element of the test failed.
Total time to complete Offline 
data collection: 		(26400) seconds.
Offline data collection
capabilities: 			 (0x7b) SMART execute Offline immediate.
					Auto Offline data collection on/off support.
					Suspend Offline collection upon new
					command.
					Offline surface scan supported.
					Self-test supported.
					Conveyance Self-test supported.
					Selective Self-test supported.
SMART capabilities:            (0x0003)	Saves SMART data before entering
					power-saving mode.
					Supports SMART auto save timer.
Error logging capability:        (0x01)	Error logging supported.
					General Purpose Logging supported.
Short self-test routine 
recommended polling time: 	 (   2) minutes.
Extended self-test routine
recommended polling time: 	 ( 266) minutes.
Conveyance self-test routine
recommended polling time: 	 (   5) minutes.
SCT capabilities: 	       (0x7035)	SCT Status supported.
					SCT Feature Control supported.
					SCT Data Table supported.

SMART Attributes Data Structure revision number: 16
Vendor Specific SMART Attributes with Thresholds:
ID# ATTRIBUTE_NAME          FLAGS    VALUE WORST THRESH FAIL RAW_VALUE
  1 Raw_Read_Error_Rate     POSR-K   200   200   051    -    225
  3 Spin_Up_Time            POS--K   177   172   021    -    4133
  4 Start_Stop_Count        -O--CK   100   100   000    -    153
  5 Reallocated_Sector_Ct   PO--CK   200   200   140    -    0
  7 Seek_Error_Rate         -OSR-K   200   199   000    -    51
  9 Power_On_Hours          -O--CK   067   067   000    -    24457
 10 Spin_Retry_Count        -O--CK   100   100   000    -    0
 11 Calibration_Retry_Count -O--CK   100   100   000    -    0
 12 Power_Cycle_Count       -O--CK   100   100   000    -    135
192 Power-Off_Retract_Count -O--CK   200   200   000    -    56
193 Load_Cycle_Count        -O--CK   102   102   000    -    294870
194 Temperature_Celsius     -O---K   116   105   000    -    31
196 Reallocated_Event_Count -O--CK   200   200   000    -    0
197 Current_Pending_Sector  -O--CK   200   200   000    -    0
198 Offline_Uncorrectable   ----CK   200   200   000    -    3
199 UDMA_CRC_Error_Count    -O--CK   200   200   000    -    0
200 Multi_Zone_Error_Rate   ---R--   200   200   000    -    6
                            ||||||_ K auto-keep
                            |||||__ C event count
                            ||||___ R error rate
                            |||____ S speed/performance
                            ||_____ O updated online
                            |______ P prefailure warning

General Purpose Log Directory Version 1
SMART           Log Directory Version 1 [multi-sector log support]
Address    Access  R/W   Size  Description
0x00       GPL,SL  R/O      1  Log Directory
0x01           SL  R/O      1  Summary SMART error log
0x02           SL  R/O      5  Comprehensive SMART error log
0x03       GPL     R/O      6  Ext. Comprehensive SMART error log
0x06           SL  R/O      1  SMART self-test log
0x07       GPL     R/O      1  Extended self-test log
0x09           SL  R/W      1  Selective self-test log
0x10       GPL     R/O      1  NCQ Command Error log
0x11       GPL     R/O      1  SATA Phy Event Counters log
0x80-0x9f  GPL,SL  R/W     16  Host vendor specific log
0xa0-0xa7  GPL,SL  VS      16  Device vendor specific log
0xa8-0xb7  GPL,SL  VS       1  Device vendor specific log
0xbd       GPL,SL  VS       1  Device vendor specific log
0xc0       GPL,SL  VS       1  Device vendor specific log
0xc1       GPL     VS      93  Device vendor specific log
0xe0       GPL,SL  R/W      1  SCT Command/Status
0xe1       GPL,SL  R/W      1  SCT Data Transfer

SMART Extended Comprehensive Error Log Version: 1 (6 sectors)
Device Error Count: 39 (device log contains only the most recent 24 errors)
	CR     = Command Register
	FEATR  = Features Register
	COUNT  = Count (was: Sector Count) Register
	LBA_48 = Upper bytes of LBA High/Mid/Low Registers ]  ATA-8
	LH     = LBA High (was: Cylinder High) Register    ]   LBA
	LM     = LBA Mid (was: Cylinder Low) Register      ] Register
	LL     = LBA Low (was: Sector Number) Register     ]
	DV     = Device (was: Device/Head) Register
	DC     = Device Control Register
	ER     = Error register
	ST     = Status register
Powered_Up_Time is measured from power on, and printed as
DDd+hh:mm:SS.sss where DD=days, hh=hours, mm=minutes,
SS=sec, and sss=millisec. It "wraps" after 49.710 days.

Error 39 [14] occurred at disk power-on lifetime: 24418 hours (1017 days + 10 hours)
  When the command that caused the error occurred, the device was active or idle.

  After command completion occurred, registers were:
  ER -- ST COUNT  LBA_48  LH LM LL DV DC
  -- -- -- == -- == == == -- -- -- -- --
  40 -- 51 00 00 00 00 01 2c 8b a8 40 00  Error: WP at LBA = 0x012c8ba8 = 19696552

  Commands leading to the command that caused the error were:
  CR FEATR COUNT  LBA_48  LH LM LL DV DC  Powered_Up_Time  Command/Feature_Name
  -- == -- == -- == == == -- -- -- -- --  ---------------  --------------------
  61 00 08 00 18 00 00 48 43 85 48 40 08     05:18:33.747  WRITE FPDMA QUEUED
  60 00 10 00 10 00 00 e8 e0 86 10 40 08     05:18:33.747  READ FPDMA QUEUED
  60 00 10 00 08 00 00 e8 e0 84 10 40 08     05:18:33.747  READ FPDMA QUEUED
  60 00 10 00 00 00 00 00 00 02 10 40 08     05:18:33.746  READ FPDMA QUEUED
  60 01 00 00 f8 00 00 01 2c 8d 70 40 08     05:18:33.725  READ FPDMA QUEUED

Error 38 [13] occurred at disk power-on lifetime: 24418 hours (1017 days + 10 hours)
  When the command that caused the error occurred, the device was active or idle.

  After command completion occurred, registers were:
  ER -- ST COUNT  LBA_48  LH LM LL DV DC
  -- -- -- == -- == == == -- -- -- -- --
  40 -- 51 00 00 00 00 01 2c 8b a8 40 00  Error: WP at LBA = 0x012c8ba8 = 19696552

  Commands leading to the command that caused the error were:
  CR FEATR COUNT  LBA_48  LH LM LL DV DC  Powered_Up_Time  Command/Feature_Name
  -- == -- == -- == == == -- -- -- -- --  ---------------  --------------------
  61 00 08 00 d8 00 00 48 43 85 48 40 08     05:18:30.240  WRITE FPDMA QUEUED
  60 00 10 00 d0 00 00 e8 e0 86 10 40 08     05:18:30.240  READ FPDMA QUEUED
  60 00 10 00 c8 00 00 e8 e0 84 10 40 08     05:18:30.239  READ FPDMA QUEUED
  60 00 10 00 c0 00 00 00 00 02 10 40 08     05:18:30.239  READ FPDMA QUEUED
  60 01 00 00 b8 00 00 01 2c 8d 70 40 08     05:18:30.239  READ FPDMA QUEUED

Error 37 [12] occurred at disk power-on lifetime: 24418 hours (1017 days + 10 hours)
  When the command that caused the error occurred, the device was active or idle.

  After command completion occurred, registers were:
  ER -- ST COUNT  LBA_48  LH LM LL DV DC
  -- -- -- == -- == == == -- -- -- -- --
  40 -- 51 00 00 00 00 01 2c 8b a8 40 00  Error: WP at LBA = 0x012c8ba8 = 19696552

  Commands leading to the command that caused the error were:
  CR FEATR COUNT  LBA_48  LH LM LL DV DC  Powered_Up_Time  Command/Feature_Name
  -- == -- == -- == == == -- -- -- -- --  ---------------  --------------------
  61 00 08 00 98 00 00 48 43 85 48 40 08     05:18:26.751  WRITE FPDMA QUEUED
  60 00 10 00 90 00 00 e8 e0 86 10 40 08     05:18:26.750  READ FPDMA QUEUED
  60 00 10 00 88 00 00 e8 e0 84 10 40 08     05:18:26.750  READ FPDMA QUEUED
  60 00 10 00 80 00 00 00 00 02 10 40 08     05:18:26.750  READ FPDMA QUEUED
  60 01 00 00 78 00 00 01 2c 8d 70 40 08     05:18:26.733  READ FPDMA QUEUED

Error 36 [11] occurred at disk power-on lifetime: 24418 hours (1017 days + 10 hours)
  When the command that caused the error occurred, the device was active or idle.

  After command completion occurred, registers were:
  ER -- ST COUNT  LBA_48  LH LM LL DV DC
  -- -- -- == -- == == == -- -- -- -- --
  40 -- 51 00 00 00 00 01 2c 8b a8 40 00  Error: WP at LBA = 0x012c8ba8 = 19696552

  Commands leading to the command that caused the error were:
  CR FEATR COUNT  LBA_48  LH LM LL DV DC  Powered_Up_Time  Command/Feature_Name
  -- == -- == -- == == == -- -- -- -- --  ---------------  --------------------
  61 00 08 00 58 00 00 48 43 85 48 40 08     05:18:23.247  WRITE FPDMA QUEUED
  60 00 10 00 50 00 00 e8 e0 86 10 40 08     05:18:23.247  READ FPDMA QUEUED
  60 00 10 00 48 00 00 e8 e0 84 10 40 08     05:18:23.247  READ FPDMA QUEUED
  60 00 10 00 40 00 00 00 00 02 10 40 08     05:18:23.247  READ FPDMA QUEUED
  60 01 00 00 38 00 00 01 2c 8d 70 40 08     05:18:23.246  READ FPDMA QUEUED

Error 35 [10] occurred at disk power-on lifetime: 24418 hours (1017 days + 10 hours)
  When the command that caused the error occurred, the device was active or idle.

  After command completion occurred, registers were:
  ER -- ST COUNT  LBA_48  LH LM LL DV DC
  -- -- -- == -- == == == -- -- -- -- --
  40 -- 51 00 00 00 00 01 2c 8b a8 40 00  Error: WP at LBA = 0x012c8ba8 = 19696552

  Commands leading to the command that caused the error were:
  CR FEATR COUNT  LBA_48  LH LM LL DV DC  Powered_Up_Time  Command/Feature_Name
  -- == -- == -- == == == -- -- -- -- --  ---------------  --------------------
  61 00 08 00 18 00 00 48 43 85 48 40 08     05:18:18.583  WRITE FPDMA QUEUED
  60 00 10 00 10 00 00 e8 e0 86 10 40 08     05:18:18.583  READ FPDMA QUEUED
  60 00 10 00 08 00 00 e8 e0 84 10 40 08     05:18:18.583  READ FPDMA QUEUED
  60 00 10 00 00 00 00 00 00 02 10 40 08     05:18:18.583  READ FPDMA QUEUED
  60 01 00 00 f8 00 00 01 2c 8d 70 40 08     05:18:18.583  READ FPDMA QUEUED

Error 34 [9] occurred at disk power-on lifetime: 24418 hours (1017 days + 10 hours)
  When the command that caused the error occurred, the device was active or idle.

  After command completion occurred, registers were:
  ER -- ST COUNT  LBA_48  LH LM LL DV DC
  -- -- -- == -- == == == -- -- -- -- --
  40 -- 51 00 00 00 00 01 2c 7e 78 40 00  Error: WP at LBA = 0x012c7e78 = 19693176

  Commands leading to the command that caused the error were:
  CR FEATR COUNT  LBA_48  LH LM LL DV DC  Powered_Up_Time  Command/Feature_Name
  -- == -- == -- == == == -- -- -- -- --  ---------------  --------------------
  61 00 18 00 68 00 00 51 c4 fc 18 40 08     05:18:11.403  WRITE FPDMA QUEUED
  61 00 08 00 60 00 00 51 c4 83 88 40 08     05:18:11.403  WRITE FPDMA QUEUED
  60 01 00 00 58 00 00 01 2c 85 70 40 08     05:18:11.403  READ FPDMA QUEUED
  60 01 00 00 50 00 00 01 2c 84 70 40 08     05:18:11.403  READ FPDMA QUEUED
  60 01 00 00 48 00 00 01 2c 83 70 40 08     05:18:11.403  READ FPDMA QUEUED

Error 33 [8] occurred at disk power-on lifetime: 24418 hours (1017 days + 10 hours)
  When the command that caused the error occurred, the device was active or idle.

  After command completion occurred, registers were:
  ER -- ST COUNT  LBA_48  LH LM LL DV DC
  -- -- -- == -- == == == -- -- -- -- --
  40 -- 51 00 00 00 00 01 2c 7e 78 40 00  Error: WP at LBA = 0x012c7e78 = 19693176

  Commands leading to the command that caused the error were:
  CR FEATR COUNT  LBA_48  LH LM LL DV DC  Powered_Up_Time  Command/Feature_Name
  -- == -- == -- == == == -- -- -- -- --  ---------------  --------------------
  61 00 18 00 10 00 00 51 c4 fc 18 40 08     05:18:07.907  WRITE FPDMA QUEUED
  61 00 08 00 08 00 00 51 c4 83 88 40 08     05:18:07.907  WRITE FPDMA QUEUED
  60 01 00 00 00 00 00 01 2c 85 70 40 08     05:18:07.907  READ FPDMA QUEUED
  60 01 00 00 f8 00 00 01 2c 84 70 40 08     05:18:07.907  READ FPDMA QUEUED
  60 01 00 00 f0 00 00 01 2c 83 70 40 08     05:18:07.906  READ FPDMA QUEUED

Error 32 [7] occurred at disk power-on lifetime: 24418 hours (1017 days + 10 hours)
  When the command that caused the error occurred, the device was active or idle.

  After command completion occurred, registers were:
  ER -- ST COUNT  LBA_48  LH LM LL DV DC
  -- -- -- == -- == == == -- -- -- -- --
  40 -- 51 00 00 00 00 01 2c 7e 78 40 00  Error: WP at LBA = 0x012c7e78 = 19693176

  Commands leading to the command that caused the error were:
  CR FEATR COUNT  LBA_48  LH LM LL DV DC  Powered_Up_Time  Command/Feature_Name
  -- == -- == -- == == == -- -- -- -- --  ---------------  --------------------
  61 00 18 00 b8 00 00 51 c4 fc 18 40 08     05:18:04.410  WRITE FPDMA QUEUED
  61 00 08 00 b0 00 00 51 c4 83 88 40 08     05:18:04.410  WRITE FPDMA QUEUED
  60 01 00 00 a8 00 00 01 2c 85 70 40 08     05:18:04.410  READ FPDMA QUEUED
  60 01 00 00 a0 00 00 01 2c 84 70 40 08     05:18:04.410  READ FPDMA QUEUED
  60 01 00 00 98 00 00 01 2c 83 70 40 08     05:18:04.410  READ FPDMA QUEUED

SMART Extended Self-test Log Version: 1 (1 sectors)
Num  Test_Description    Status                  Remaining  LifeTime(hours)  LBA_of_first_error
# 1  Extended offline    Completed: read failure       90%     24457         19398560
# 2  Extended offline    Completed: read failure       90%     24457         19400160
# 3  Short offline       Completed without error       00%     24457         -
# 4  Short offline       Completed: read failure       10%     24434         19689120
# 5  Extended offline    Completed: read failure       90%     24433         19689120
# 6  Extended offline    Completed: read failure       90%     24428         19689120
# 7  Extended offline    Aborted by host               90%     24419         -
# 8  Short offline       Completed without error       00%     24416         -
# 9  Extended offline    Completed without error       00%      4847         -
#10  Extended offline    Completed without error       00%      4823         -
#11  Extended offline    Completed without error       00%      4799         -
#12  Extended offline    Completed without error       00%      4775         -
#13  Extended offline    Completed without error       00%      4751         -
#14  Extended offline    Completed without error       00%      4727         -
#15  Extended offline    Completed without error       00%      4703         -
#16  Extended offline    Completed without error       00%      4679         -
#17  Extended offline    Completed without error       00%      4655         -
#18  Extended offline    Completed without error       00%      4631         -

SMART Selective self-test log data structure revision number 1
 SPAN  MIN_LBA  MAX_LBA  CURRENT_TEST_STATUS
    1        0        0  Not_testing
    2        0        0  Not_testing
    3        0        0  Not_testing
    4        0        0  Not_testing
    5        0        0  Not_testing
Selective self-test flags (0x0):
  After scanning selected spans, do NOT read-scan remainder of disk.
If Selective self-test is pending on power-up, resume after 0 minute delay.

SCT Status Version:                  3
SCT Version (vendor specific):       258 (0x0102)
Device State:                        Active (0)
Current Temperature:                    31 Celsius
Power Cycle Min/Max Temperature:     25/32 Celsius
Lifetime    Min/Max Temperature:     16/42 Celsius
Under/Over Temperature Limit Count:   0/0
Vendor specific:
01 00 00 00 00 00 00 00 00 00 00 00 00 00 00 00
00 00 00 00 00 00 00 00 00 00 00 00 00 00 00 00

SCT Temperature History Version:     2
Temperature Sampling Period:         1 minute
Temperature Logging Interval:        1 minute
Min/Max recommended Temperature:      0/60 Celsius
Min/Max Temperature Limit:           -41/85 Celsius
Temperature History Size (Index):    478 (388)

SCT Error Recovery Control command not supported

Device Statistics (GP/SMART Log 0x04) not supported

Pending Defects log (GP Log 0x0c) not supported

SATA Phy Event Counters (GP Log 0x11)
ID      Size     Value  Description
0x0001  2            0  Command failed due to ICRC error
0x0002  2            0  R_ERR response for data FIS
0x0003  2            0  R_ERR response for device-to-host data FIS
0x0004  2            0  R_ERR response for host-to-device data FIS
0x0005  2            0  R_ERR response for non-data FIS
0x0006  2            0  R_ERR response for device-to-host non-data FIS
0x0007  2            0  R_ERR response for host-to-device non-data FIS
0x0008  2            0  Device-to-host non-data FIS retries
0x0009  2            2  Transition from drive PhyRdy to drive PhyNRdy
0x000a  2            2  Device-to-host register FISes sent due to a COMRESET
0x000b  2            0  CRC errors within host-to-device FIS
0x000f  2            0  R_ERR response for host-to-device data FIS, CRC
0x0012  2            0  R_ERR response for host-to-device non-data FIS, CRC
0x8000  4        74381  Vendor specific



