smartctl 7.3 2022-02-28 r5338 [OpenBSD 7.3 i386] (local build)
Copyright (C) 2002-22, Bruce Allen, Christian Franke, www.smartmontools.org

=== START OF INFORMATION SECTION ===
Device Model:     SAMSUNG MMCRE28GFMXP-MVB
Serial Number:    --
LU WWN Device Id: 5 0000f0 ...
Firmware Version: VBM1AS1Q
User Capacity:    128,035,676,160 bytes [128 GB]
Sector Size:      512 bytes logical/physical
Rotation Rate:    Solid State Device
TRIM Command:     Unavailable
Device is:        Not in smartctl database 7.3/5319
ATA Version is:   ATA/ATAPI-7 T13/1532D revision 1
Local Time is:    Sat Jul 15 00:19:03 2023 MSK
SMART support is: Available - device has SMART capability.
SMART support is: Enabled

=== START OF READ SMART DATA SECTION ===
SMART overall-health self-assessment test result: PASSED

General SMART Values:
Offline data collection status:  (0x00)	Offline data collection activity
					was never started.
					Auto Offline Data Collection: Disabled.
Self-test execution status:      (   0)	The previous self-test routine completed
					without error or no self-test has ever 
					been run.
Total time to complete Offline 
data collection: 		(  240) seconds.
Offline data collection
capabilities: 			 (0x5b) SMART execute Offline immediate.
					Auto Offline data collection on/off support.
					Suspend Offline collection upon new
					command.
					Offline surface scan supported.
					Self-test supported.
					No Conveyance Self-test supported.
					Selective Self-test supported.
SMART capabilities:            (0x0003)	Saves SMART data before entering
					power-saving mode.
					Supports SMART auto save timer.
Error logging capability:        (0x01)	Error logging supported.
					General Purpose Logging supported.
Short self-test routine 
recommended polling time: 	 (   4) minutes.
Extended self-test routine
recommended polling time: 	 (  24) minutes.

SMART Attributes Data Structure revision number: 1
Vendor Specific SMART Attributes with Thresholds:
ID# ATTRIBUTE_NAME          FLAG     VALUE WORST THRESH TYPE      UPDATED  WHEN_FAILED RAW_VALUE
  9 Power_On_Hours          0x0032   099   099   000    Old_age   Always       -       116
 12 Power_Cycle_Count       0x0032   099   099   000    Old_age   Always       -       226
178 Used_Rsvd_Blk_Cnt_Chip  0x0013   085   085   010    Pre-fail  Always       -       9
179 Used_Rsvd_Blk_Cnt_Tot   0x0013   099   099   010    Pre-fail  Always       -       24
180 Unused_Rsvd_Blk_Cnt_Tot 0x0013   099   099   010    Pre-fail  Always       -       3816
183 Runtime_Bad_Block       0x0013   100   100   010    Pre-fail  Always       -       0

SMART Error Log Version: 1
ATA Error Count: 2
	CR = Command Register [HEX]
	FR = Features Register [HEX]
	SC = Sector Count Register [HEX]
	SN = Sector Number Register [HEX]
	CL = Cylinder Low Register [HEX]
	CH = Cylinder High Register [HEX]
	DH = Device/Head Register [HEX]
	DC = Device Command Register [HEX]
	ER = Error register [HEX]
	ST = Status register [HEX]
Powered_Up_Time is measured from power on, and printed as
DDd+hh:mm:SS.sss where DD=days, hh=hours, mm=minutes,
SS=sec, and sss=millisec. It "wraps" after 49.710 days.

Error 2 occurred at disk power-on lifetime: 87 hours (3 days + 15 hours)
  When the command that caused the error occurred, the device was active or idle.

  After command completion occurred, registers were:
  ER ST SC SN CL CH DH
  -- -- -- -- -- -- --
  10 51 01 b0 c2 e7 ee  Error: IDNF 1 sectors at LBA = 0x0ee7c2b0 = 250069680

  Commands leading to the command that caused the error were:
  CR FR SC SN CL CH DH DC   Powered_Up_Time  Command/Feature_Name
  -- -- -- -- -- -- -- --  ----------------  --------------------
  c8 00 01 b0 c2 e7 ee 00      00:08:17.000  READ DMA
  e7 00 00 00 00 00 a0 00      00:08:17.000  FLUSH CACHE
  ca 00 08 30 0a 5f e0 00      00:08:17.000  WRITE DMA
  ca 00 08 10 46 66 e0 00      00:08:17.000  WRITE DMA
  ca 00 08 38 0a 5f e0 00      00:08:17.000  WRITE DMA

Error 1 occurred at disk power-on lifetime: 38 hours (1 days + 14 hours)
  When the command that caused the error occurred, the device was active or idle.

  After command completion occurred, registers were:
  ER ST SC SN CL CH DH
  -- -- -- -- -- -- --
  10 51 01 b0 c2 e7 ee  Error: IDNF 1 sectors at LBA = 0x0ee7c2b0 = 250069680

  Commands leading to the command that caused the error were:
  CR FR SC SN CL CH DH DC   Powered_Up_Time  Command/Feature_Name
  -- -- -- -- -- -- -- --  ----------------  --------------------
  c8 00 01 b0 c2 e7 ee 00      00:11:09.000  READ DMA
  ca 00 08 c0 ec 78 e0 00      00:11:08.000  WRITE DMA
  ca 00 08 00 25 3b e0 00      00:11:08.000  WRITE DMA
  ca 00 08 98 d9 3a e0 00      00:11:06.000  WRITE DMA
  ca 00 10 50 0d 63 e0 00      00:11:06.000  WRITE DMA

SMART Self-test log structure revision number 1
No self-tests have been logged.  [To run self-tests, use: smartctl -t]

SMART Selective self-test log data structure revision number 1
 SPAN  MIN_LBA  MAX_LBA  CURRENT_TEST_STATUS
    1        0        0  Not_testing
    2        0        0  Not_testing
    3        0        0  Not_testing
    4        0        0  Not_testing
    5        0        0  Not_testing
Selective self-test flags (0x0):
  After scanning selected spans, do NOT read-scan remainder of disk.
If Selective self-test is pending on power-up, resume after 0 minute delay.

