smartctl 7.3 2022-02-28 r5338 [FreeBSD 13.1-RELEASE-p1 amd64] (local build)
Copyright (C) 2002-22, Bruce Allen, Christian Franke, www.smartmontools.org

=== START OF INFORMATION SECTION ===
Model Family:     Seagate Barracuda ES
Device Model:     ST3250620NS
Serial Number:    --
Firmware Version: 3BJP
User Capacity:    250,059,350,016 bytes [250 GB]
Sector Size:      512 bytes logical/physical
Device is:        In smartctl database 7.3/5319
ATA Version is:   ATA/ATAPI-7 T13/1532D revision 4a
Local Time is:    Tue Aug 23 23:34:19 2022 CDT
SMART support is: Available - device has SMART capability.
SMART support is: Enabled
AAM feature is:   Unavailable
APM feature is:   Unavailable
Rd look-ahead is: Enabled
Write cache is:   Enabled
DSN feature is:   Unavailable
ATA Security is:  Unavailable
Unexpected SCT status 0xffff (action_code=4, function_code=2)
Wt Cache Reorder: Unknown (SCT Feature Control command failed)

=== START OF READ SMART DATA SECTION ===
SMART overall-health self-assessment test result: PASSED

General SMART Values:
Offline data collection status:  (0x82)	Offline data collection activity
					was completed without error.
					Auto Offline Data Collection: Enabled.
Self-test execution status:      (   0)	The previous self-test routine completed
					without error or no self-test has ever 
					been run.
Total time to complete Offline 
data collection: 		(  430) seconds.
Offline data collection
capabilities: 			 (0x5b) SMART execute Offline immediate.
					Auto Offline data collection on/off support.
					Suspend Offline collection upon new
					command.
					Offline surface scan supported.
					Self-test supported.
					No Conveyance Self-test supported.
					Selective Self-test supported.
SMART capabilities:            (0x0003)	Saves SMART data before entering
					power-saving mode.
					Supports SMART auto save timer.
Error logging capability:        (0x01)	Error logging supported.
					General Purpose Logging supported.
Short self-test routine 
recommended polling time: 	 (   2) minutes.
Extended self-test routine
recommended polling time: 	 (  92) minutes.
SCT capabilities: 	       (0x003f)	SCT Status supported.
					SCT Error Recovery Control supported.
					SCT Feature Control supported.
					SCT Data Table supported.

SMART Attributes Data Structure revision number: 10
Vendor Specific SMART Attributes with Thresholds:
ID# ATTRIBUTE_NAME          FLAGS    VALUE WORST THRESH FAIL RAW_VALUE
  1 Raw_Read_Error_Rate     POSR--   100   253   006    -    0
  3 Spin_Up_Time            PO----   096   096   000    -    0
  4 Start_Stop_Count        -O--CK   100   100   020    -    46
  5 Reallocated_Sector_Ct   PO--CK   100   100   036    -    0
  7 Seek_Error_Rate         POSR--   087   060   030    -    547031865
  9 Power_On_Hours          -O--CK   072   072   000    -    25390
 10 Spin_Retry_Count        PO--C-   100   100   097    -    0
 12 Power_Cycle_Count       -O--CK   100   100   020    -    46
187 Reported_Uncorrect      -O-RCK   089   089   000    -    11
189 High_Fly_Writes         -O---K   100   100   000    -    0
190 Airflow_Temperature_Cel -O-RC-   054   052   000    -    46 (Min/Max 46/47)
194 Temperature_Celsius     ------   046   048   000    -    46 (0 20 0 0 0)
195 Hardware_ECC_Recovered  -O--CK   061   060   000    -    165701571
197 Current_Pending_Sector  ------   037   036   000    -    1296
198 Offline_Uncorrectable   ------   100   036   000    -    0
199 UDMA_CRC_Error_Count    ------   200   200   000    -    0
                            ||||||_ K auto-keep
                            |||||__ C event count
                            ||||___ R error rate
                            |||____ S speed/performance
                            ||_____ O updated online
                            |______ P prefailure warning

General Purpose Log Directory Version 1
SMART           Log Directory Version 1 [multi-sector log support]
Address    Access  R/W   Size  Description
0x00       GPL,SL  R/O      1  Log Directory
0x01       GPL,SL  R/O      1  Summary SMART error log
0x02       GPL,SL  R/O      5  Comprehensive SMART error log
0x03       GPL,SL  R/O      5  Ext. Comprehensive SMART error log
0x06       GPL,SL  R/O      1  SMART self-test log
0x07       GPL,SL  R/O      1  Extended self-test log
0x09       GPL,SL  R/W      1  Selective self-test log
0x10       GPL,SL  R/O      1  NCQ Command Error log
0x11       GPL,SL  R/O      1  SATA Phy Event Counters log
0x20       GPL,SL  R/O      1  Streaming performance log [OBS-8]
0x21       GPL,SL  R/O      1  Write stream error log
0x22       GPL,SL  R/O      1  Read stream error log
0x23       GPL,SL  R/O      1  Delayed sector log [OBS-8]
0x80-0x9f  GPL,SL  R/W     16  Host vendor specific log
0xa0       GPL,SL  VS       1  Device vendor specific log
0xa1       GPL,SL  VS      20  Device vendor specific log
0xa2       GPL,SL  VS     101  Device vendor specific log
0xa8       GPL,SL  VS      20  Device vendor specific log
0xa9       GPL,SL  VS       1  Device vendor specific log
0xe0       GPL,SL  R/W      1  SCT Command/Status
0xe1       GPL,SL  R/W      1  SCT Data Transfer
0xff       GPL     -    23040  Reserved

SMART Extended Comprehensive Error Log Version: 1 (5 sectors)
Device Error Count: 13
	CR     = Command Register
	FEATR  = Features Register
	COUNT  = Count (was: Sector Count) Register
	LBA_48 = Upper bytes of LBA High/Mid/Low Registers ]  ATA-8
	LH     = LBA High (was: Cylinder High) Register    ]   LBA
	LM     = LBA Mid (was: Cylinder Low) Register      ] Register
	LL     = LBA Low (was: Sector Number) Register     ]
	DV     = Device (was: Device/Head) Register
	DC     = Device Control Register
	ER     = Error register
	ST     = Status register
Powered_Up_Time is measured from power on, and printed as
DDd+hh:mm:SS.sss where DD=days, hh=hours, mm=minutes,
SS=sec, and sss=millisec. It "wraps" after 49.710 days.

Error 13 [12] occurred at disk power-on lifetime: 60 hours (2 days + 12 hours)
  When the command that caused the error occurred, the device was active or idle.

  After command completion occurred, registers were:
  ER -- ST COUNT  LBA_48  LH LM LL DV DC
  -- -- -- == -- == == == -- -- -- -- --
  10 -- 01 00 01 00 00 00 00 00 00 00 00  Error: IDNF 1 sectors at LBA = 0x00000000 = 0

  Commands leading to the command that caused the error were:
  CR FEATR COUNT  LBA_48  LH LM LL DV DC  Powered_Up_Time  Command/Feature_Name
  -- == -- == -- == == == -- -- -- -- --  ---------------  --------------------
  35 00 00 02 00 00 00 52 00 63 00 40 00     00:20:40.620  WRITE DMA EXT
  25 00 00 02 00 00 00 50 00 63 00 40 00     00:20:40.607  READ DMA EXT
  25 00 00 02 00 00 00 4e 00 63 00 40 00     00:20:40.597  READ DMA EXT
  25 00 00 02 00 00 00 4c 00 63 00 40 00     00:20:40.581  READ DMA EXT
  35 00 00 02 00 00 00 4a 00 63 00 40 00     00:20:40.568  WRITE DMA EXT

Error 12 [11] occurred at disk power-on lifetime: 9595 hours (399 days + 19 hours)
  When the command that caused the error occurred, the device was active or idle.

  After command completion occurred, registers were:
  ER -- ST COUNT  LBA_48  LH LM LL DV DC
  -- -- -- == -- == == == -- -- -- -- --
  40 -- 51 00 00 00 00 ad 00 1b af 40 00  Error: UNC at LBA = 0xad001baf = 2902465455

  Commands leading to the command that caused the error were:
  CR FEATR COUNT  LBA_48  LH LM LL DV DC  Powered_Up_Time  Command/Feature_Name
  -- == -- == -- == == == -- -- -- -- --  ---------------  --------------------
  25 00 00 00 01 00 00 ad 00 1b af 40 00     03:03:17.511  READ DMA EXT
  25 00 00 00 01 00 00 ad 00 1b af 40 00     03:03:15.553  READ DMA EXT
  25 00 00 00 01 00 00 ad 00 1b af 40 00     03:03:15.421  READ DMA EXT
  35 00 00 00 07 00 00 93 00 6e e7 40 00     03:03:15.412  WRITE DMA EXT
  25 00 00 00 07 00 00 93 00 6e e7 40 00     03:03:14.436  READ DMA EXT

Error 11 [10] occurred at disk power-on lifetime: 9595 hours (399 days + 19 hours)
  When the command that caused the error occurred, the device was active or idle.

  After command completion occurred, registers were:
  ER -- ST COUNT  LBA_48  LH LM LL DV DC
  -- -- -- == -- == == == -- -- -- -- --
  40 -- 51 00 00 00 00 ad 00 1b af 40 00  Error: UNC at LBA = 0xad001baf = 2902465455

  Commands leading to the command that caused the error were:
  CR FEATR COUNT  LBA_48  LH LM LL DV DC  Powered_Up_Time  Command/Feature_Name
  -- == -- == -- == == == -- -- -- -- --  ---------------  --------------------
  25 00 00 00 01 00 00 ad 00 1b af 40 00     03:03:17.511  READ DMA EXT
  25 00 00 00 01 00 00 ad 00 1b af 40 00     03:03:15.553  READ DMA EXT
  35 00 00 00 07 00 00 93 00 6e e7 40 00     03:03:15.421  WRITE DMA EXT
  25 00 00 00 07 00 00 93 00 6e e7 40 00     03:03:15.412  READ DMA EXT
  35 00 00 00 08 00 00 db 00 68 cf 40 00     03:03:14.436  WRITE DMA EXT

Error 10 [9] occurred at disk power-on lifetime: 9595 hours (399 days + 19 hours)
  When the command that caused the error occurred, the device was active or idle.

  After command completion occurred, registers were:
  ER -- ST COUNT  LBA_48  LH LM LL DV DC
  -- -- -- == -- == == == -- -- -- -- --
  40 -- 51 00 00 00 00 ad 00 1b af 40 00  Error: UNC at LBA = 0xad001baf = 2902465455

  Commands leading to the command that caused the error were:
  CR FEATR COUNT  LBA_48  LH LM LL DV DC  Powered_Up_Time  Command/Feature_Name
  -- == -- == -- == == == -- -- -- -- --  ---------------  --------------------
  25 00 00 00 01 00 00 ad 00 1b af 40 00     03:03:11.429  READ DMA EXT
  35 00 00 00 07 00 00 93 00 6e e7 40 00     03:03:15.553  WRITE DMA EXT
  25 00 00 00 07 00 00 93 00 6e e7 40 00     03:03:15.421  READ DMA EXT
  35 00 00 00 08 00 00 db 00 68 cf 40 00     03:03:15.412  WRITE DMA EXT
  25 00 00 00 08 00 00 db 00 68 cf 40 00     03:03:14.436  READ DMA EXT

Error 9 [8] occurred at disk power-on lifetime: 60 hours (2 days + 12 hours)
  When the command that caused the error occurred, the device was active or idle.

  After command completion occurred, registers were:
  ER -- ST COUNT  LBA_48  LH LM LL DV DC
  -- -- -- == -- == == == -- -- -- -- --
  10 -- 01 00 01 00 00 00 00 00 00 00 00  Error: IDNF 1 sectors at LBA = 0x00000000 = 0

  Commands leading to the command that caused the error were:
  CR FEATR COUNT  LBA_48  LH LM LL DV DC  Powered_Up_Time  Command/Feature_Name
  -- == -- == -- == == == -- -- -- -- --  ---------------  --------------------
  35 00 00 02 00 00 00 52 00 63 00 40 00     00:20:40.620  WRITE DMA EXT
  25 00 00 02 00 00 00 50 00 63 00 40 00     00:20:40.607  READ DMA EXT
  25 00 00 02 00 00 00 4e 00 63 00 40 00     00:20:40.597  READ DMA EXT
  25 00 00 02 00 00 00 4c 00 63 00 40 00     00:20:40.581  READ DMA EXT
  35 00 00 02 00 00 00 4a 00 63 00 40 00     00:20:40.568  WRITE DMA EXT

Error 8 [7] occurred at disk power-on lifetime: 9595 hours (399 days + 19 hours)
  When the command that caused the error occurred, the device was active or idle.

  After command completion occurred, registers were:
  ER -- ST COUNT  LBA_48  LH LM LL DV DC
  -- -- -- == -- == == == -- -- -- -- --
  40 -- 51 00 00 00 00 ad 00 1b af 40 00  Error: UNC at LBA = 0xad001baf = 2902465455

  Commands leading to the command that caused the error were:
  CR FEATR COUNT  LBA_48  LH LM LL DV DC  Powered_Up_Time  Command/Feature_Name
  -- == -- == -- == == == -- -- -- -- --  ---------------  --------------------
  25 00 00 00 01 00 00 ad 00 1b af 40 00     03:03:17.511  READ DMA EXT
  25 00 00 00 01 00 00 ad 00 1b af 40 00     03:03:15.553  READ DMA EXT
  25 00 00 00 01 00 00 ad 00 1b af 40 00     03:03:15.421  READ DMA EXT
  35 00 00 00 07 00 00 93 00 6e e7 40 00     03:03:15.412  WRITE DMA EXT
  25 00 00 00 07 00 00 93 00 6e e7 40 00     03:03:14.436  READ DMA EXT

Error 7 [6] occurred at disk power-on lifetime: 9595 hours (399 days + 19 hours)
  When the command that caused the error occurred, the device was active or idle.

  After command completion occurred, registers were:
  ER -- ST COUNT  LBA_48  LH LM LL DV DC
  -- -- -- == -- == == == -- -- -- -- --
  40 -- 51 00 00 00 00 ad 00 1b af 40 00  Error: UNC at LBA = 0xad001baf = 2902465455

  Commands leading to the command that caused the error were:
  CR FEATR COUNT  LBA_48  LH LM LL DV DC  Powered_Up_Time  Command/Feature_Name
  -- == -- == -- == == == -- -- -- -- --  ---------------  --------------------
  25 00 00 00 01 00 00 ad 00 1b af 40 00     03:03:17.511  READ DMA EXT
  25 00 00 00 01 00 00 ad 00 1b af 40 00     03:03:15.553  READ DMA EXT
  35 00 00 00 07 00 00 93 00 6e e7 40 00     03:03:15.421  WRITE DMA EXT
  25 00 00 00 07 00 00 93 00 6e e7 40 00     03:03:15.412  READ DMA EXT
  35 00 00 00 08 00 00 db 00 68 cf 40 00     03:03:14.436  WRITE DMA EXT

Error 6 [5] occurred at disk power-on lifetime: 9595 hours (399 days + 19 hours)
  When the command that caused the error occurred, the device was active or idle.

  After command completion occurred, registers were:
  ER -- ST COUNT  LBA_48  LH LM LL DV DC
  -- -- -- == -- == == == -- -- -- -- --
  40 -- 51 00 00 00 00 ad 00 1b af 40 00  Error: UNC at LBA = 0xad001baf = 2902465455

  Commands leading to the command that caused the error were:
  CR FEATR COUNT  LBA_48  LH LM LL DV DC  Powered_Up_Time  Command/Feature_Name
  -- == -- == -- == == == -- -- -- -- --  ---------------  --------------------
  25 00 00 00 01 00 00 ad 00 1b af 40 00     03:03:11.429  READ DMA EXT
  35 00 00 00 07 00 00 93 00 6e e7 40 00     03:03:15.553  WRITE DMA EXT
  25 00 00 00 07 00 00 93 00 6e e7 40 00     03:03:15.421  READ DMA EXT
  35 00 00 00 08 00 00 db 00 68 cf 40 00     03:03:15.412  WRITE DMA EXT
  25 00 00 00 08 00 00 db 00 68 cf 40 00     03:03:14.436  READ DMA EXT

SMART Extended Self-test Log Version: 1 (1 sectors)

SMART Selective self-test log data structure revision number 1
 SPAN  MIN_LBA  MAX_LBA  CURRENT_TEST_STATUS
    1        0        0  Not_testing
    2        0        0  Not_testing
    3        0        0  Not_testing
    4        0        0  Not_testing
    5        0        0  Not_testing
Selective self-test flags (0x0):
  After scanning selected spans, do NOT read-scan remainder of disk.
If Selective self-test is pending on power-up, resume after 0 minute delay.

SCT Status Version:                  2
SCT Version (vendor specific):       521 (0x0209)
Device State:                        Active (0)
Current Temperature:                    46 Celsius
Power Cycle Min/Max Temperature:     --/47 Celsius
Lifetime    Min/Max Temperature:     --/48 Celsius

Another SCT command is executing, abort Read Data Table
(SCT ext_status_code 0xffff, action_code=4, function_code=2)
Read SCT Temperature History failed

Another SCT command is executing, abort Error Recovery Control
(SCT ext_status_code 0xffff, action_code=4, function_code=2)
SCT (Get) Error Recovery Control command failed

Device Statistics (GP/SMART Log 0x04) not supported

Pending Defects log (GP Log 0x0c) not supported

SATA Phy Event Counters (GP Log 0x11)
ID      Size     Value  Description
0x000a  2           25  Device-to-host register FISes sent due to a COMRESET
0x0001  2            0  Command failed due to ICRC error
0x0003  2            0  R_ERR response for device-to-host data FIS
0x0004  2            0  R_ERR response for host-to-device data FIS
0x0006  2            0  R_ERR response for device-to-host non-data FIS
0x0007  2            0  R_ERR response for host-to-device non-data FIS

