smartctl 7.1 2019-12-30 r5022 [FreeBSD 12.1-RELEASE amd64] (local build)
Copyright (C) 2002-19, Bruce Allen, Christian Franke, www.smartmontools.org

=== START OF INFORMATION SECTION ===
Model Family:     Seagate Momentus 5400.6
Device Model:     ST9160314AS
Serial Number:    --
LU WWN Device Id: 5 000c50 ...
Firmware Version: 0001SDM1
User Capacity:    160,041,885,696 bytes [160 GB]
Sector Size:      512 bytes logical/physical
Rotation Rate:    5400 rpm
Device is:        In smartctl database [for details use: -P show]
ATA Version is:   ATA8-ACS T13/1699-D revision 4
SATA Version is:  SATA 2.6, 3.0 Gb/s
Local Time is:    Thu Mar  4 02:38:46 2021 EST
SMART support is: Available - device has SMART capability.
SMART support is: Enabled
AAM feature is:   Unavailable
APM feature is:   Disabled
Rd look-ahead is: Enabled
Write cache is:   Enabled
DSN feature is:   Unavailable
ATA Security is:  Disabled, frozen [SEC2]
Wt Cache Reorder: Unknown

=== START OF READ SMART DATA SECTION ===
SMART overall-health self-assessment test result: PASSED
See vendor-specific Attribute list for marginal Attributes.

General SMART Values:
Offline data collection status:  (0x82)	Offline data collection activity
					was completed without error.
					Auto Offline Data Collection: Enabled.
Self-test execution status:      (   0)	The previous self-test routine completed
					without error or no self-test has ever 
					been run.
Total time to complete Offline 
data collection: 		(    0) seconds.
Offline data collection
capabilities: 			 (0x7b) SMART execute Offline immediate.
					Auto Offline data collection on/off support.
					Suspend Offline collection upon new
					command.
					Offline surface scan supported.
					Self-test supported.
					Conveyance Self-test supported.
					Selective Self-test supported.
SMART capabilities:            (0x0003)	Saves SMART data before entering
					power-saving mode.
					Supports SMART auto save timer.
Error logging capability:        (0x01)	Error logging supported.
					General Purpose Logging supported.
Short self-test routine 
recommended polling time: 	 (   1) minutes.
Extended self-test routine
recommended polling time: 	 (  55) minutes.
Conveyance self-test routine
recommended polling time: 	 (   2) minutes.
SCT capabilities: 	       (0x103b)	SCT Status supported.
					SCT Error Recovery Control supported.
					SCT Feature Control supported.
					SCT Data Table supported.

SMART Attributes Data Structure revision number: 10
Vendor Specific SMART Attributes with Thresholds:
ID# ATTRIBUTE_NAME          FLAGS    VALUE WORST THRESH FAIL RAW_VALUE
  1 Raw_Read_Error_Rate     POSR--   118   081   006    -    194930574
  3 Spin_Up_Time            PO----   099   099   000    -    0
  4 Start_Stop_Count        -O--CK   098   098   020    -    2548
  5 Reallocated_Sector_Ct   PO--CK   098   098   036    -    52
  7 Seek_Error_Rate         POSR--   078   060   030    -    75103820
  9 Power_On_Hours          -O--CK   082   082   000    -    16437
 10 Spin_Retry_Count        PO--C-   100   100   097    -    0
 12 Power_Cycle_Count       -O--CK   098   037   020    -    2498
184 End-to-End_Error        -O--CK   100   100   099    -    0
187 Reported_Uncorrect      -O--CK   001   001   000    -    22755
188 Command_Timeout         -O--CK   100   098   000    -    42950328832
189 High_Fly_Writes         -O-RCK   100   100   000    -    0
190 Airflow_Temperature_Cel -O---K   060   042   045    Past 40 (Min/Max 27/40 #5)
191 G-Sense_Error_Rate      -O--CK   100   100   000    -    108
192 Power-Off_Retract_Count -O--CK   100   100   000    -    7
193 Load_Cycle_Count        -O--CK   001   001   000    -    1432890
194 Temperature_Celsius     -O---K   040   058   000    -    40 (0 13 0 0 0)
195 Hardware_ECC_Recovered  -O-RC-   063   057   000    -    194930574
197 Current_Pending_Sector  -O--C-   100   100   000    -    0
198 Offline_Uncorrectable   ----C-   100   100   000    -    0
199 UDMA_CRC_Error_Count    -OSRCK   200   200   000    -    1
254 Free_Fall_Sensor        -O--CK   100   100   000    -    0
                            ||||||_ K auto-keep
                            |||||__ C event count
                            ||||___ R error rate
                            |||____ S speed/performance
                            ||_____ O updated online
                            |______ P prefailure warning

General Purpose Log Directory Version 1
SMART           Log Directory Version 1 [multi-sector log support]
Address    Access  R/W   Size  Description
0x00       GPL,SL  R/O      1  Log Directory
0x01       GPL,SL  R/O      1  Summary SMART error log
0x02       GPL,SL  R/O      5  Comprehensive SMART error log
0x03       GPL,SL  R/O      5  Ext. Comprehensive SMART error log
0x06       GPL,SL  R/O      1  SMART self-test log
0x07       GPL,SL  R/O      1  Extended self-test log
0x09       GPL,SL  R/W      1  Selective self-test log
0x10       GPL,SL  R/O      1  NCQ Command Error log
0x11       GPL,SL  R/O      1  SATA Phy Event Counters log
0x21       GPL,SL  R/O      1  Write stream error log
0x22       GPL,SL  R/O      1  Read stream error log
0x80-0x9f  GPL,SL  R/W     16  Host vendor specific log
0xa1       GPL,SL  VS      20  Device vendor specific log
0xa2       GPL     VS    2248  Device vendor specific log
0xa8       GPL,SL  VS      65  Device vendor specific log
0xa9       GPL,SL  VS       1  Device vendor specific log
0xb0       GPL     VS    2864  Device vendor specific log
0xbe-0xbf  GPL     VS   65535  Device vendor specific log
0xe0       GPL,SL  R/W      1  SCT Command/Status
0xe1       GPL,SL  R/W      1  SCT Data Transfer

SMART Extended Comprehensive Error Log Version: 1 (5 sectors)
Device Error Count: 23336 (device log contains only the most recent 20 errors)
	CR     = Command Register
	FEATR  = Features Register
	COUNT  = Count (was: Sector Count) Register
	LBA_48 = Upper bytes of LBA High/Mid/Low Registers ]  ATA-8
	LH     = LBA High (was: Cylinder High) Register    ]   LBA
	LM     = LBA Mid (was: Cylinder Low) Register      ] Register
	LL     = LBA Low (was: Sector Number) Register     ]
	DV     = Device (was: Device/Head) Register
	DC     = Device Control Register
	ER     = Error register
	ST     = Status register
Powered_Up_Time is measured from power on, and printed as
DDd+hh:mm:SS.sss where DD=days, hh=hours, mm=minutes,
SS=sec, and sss=millisec. It "wraps" after 49.710 days.

Error 23336 [15] occurred at disk power-on lifetime: 12682 hours (528 days + 10 hours)
  When the command that caused the error occurred, the device was active or idle.

  After command completion occurred, registers were:
  ER -- ST COUNT  LBA_48  LH LM LL DV DC
  -- -- -- == -- == == == -- -- -- -- --
  04 -- 71 00 00 00 00 00 00 00 80 e0 00  Device Fault; Error: ABRT

  Commands leading to the command that caused the error were:
  CR FEATR COUNT  LBA_48  LH LM LL DV DC  Powered_Up_Time  Command/Feature_Name
  -- == -- == -- == == == -- -- -- -- --  ---------------  --------------------
  2f 00 00 00 01 00 00 00 00 00 10 a0 00  6d+01:58:21.694  READ LOG EXT
  61 00 00 00 02 00 00 01 ca 8d de 40 00  6d+01:58:21.653  WRITE FPDMA QUEUED
  61 00 00 00 10 00 00 01 ca 8b 5e 40 00  6d+01:58:21.653  WRITE FPDMA QUEUED
  61 00 00 00 10 00 00 01 ca 88 ee 40 00  6d+01:58:21.653  WRITE FPDMA QUEUED
  61 00 00 00 0e 00 00 01 ca 80 80 40 00  6d+01:58:21.653  WRITE FPDMA QUEUED

Error 23335 [14] occurred at disk power-on lifetime: 12682 hours (528 days + 10 hours)
  When the command that caused the error occurred, the device was active or idle.

  After command completion occurred, registers were:
  ER -- ST COUNT  LBA_48  LH LM LL DV DC
  -- -- -- == -- == == == -- -- -- -- --
  04 -- 71 00 00 00 00 00 00 00 80 40 00  Device Fault; Error: ABRT at LBA = 0x00000080 = 128

  Commands leading to the command that caused the error were:
  CR FEATR COUNT  LBA_48  LH LM LL DV DC  Powered_Up_Time  Command/Feature_Name
  -- == -- == -- == == == -- -- -- -- --  ---------------  --------------------
  61 00 00 00 02 00 00 01 ca 8d de 40 00  6d+01:58:21.653  WRITE FPDMA QUEUED
  61 00 00 00 10 00 00 01 ca 8b 5e 40 00  6d+01:58:21.653  WRITE FPDMA QUEUED
  61 00 00 00 10 00 00 01 ca 88 ee 40 00  6d+01:58:21.653  WRITE FPDMA QUEUED
  61 00 00 00 0e 00 00 01 ca 80 80 40 00  6d+01:58:21.653  WRITE FPDMA QUEUED
  61 00 00 00 02 00 00 01 ca 8d ce 40 00  6d+01:58:21.652  WRITE FPDMA QUEUED

Error 23334 [13] occurred at disk power-on lifetime: 6533 hours (272 days + 5 hours)
  When the command that caused the error occurred, the device was active or idle.

  After command completion occurred, registers were:
  ER -- ST COUNT  LBA_48  LH LM LL DV DC
  -- -- -- == -- == == == -- -- -- -- --
  40 -- 51 00 00 00 00 03 24 3c f0 00 00  Error: WP at LBA = 0x03243cf0 = 52706544

  Commands leading to the command that caused the error were:
  CR FEATR COUNT  LBA_48  LH LM LL DV DC  Powered_Up_Time  Command/Feature_Name
  -- == -- == -- == == == -- -- -- -- --  ---------------  --------------------
  61 00 00 00 20 00 00 0a 23 74 20 40 00     00:06:52.108  WRITE FPDMA QUEUED
  60 00 00 00 20 00 00 05 53 1e e0 40 00     00:06:52.105  READ FPDMA QUEUED
  60 00 00 00 08 00 00 0e ad 25 f8 40 00     00:06:52.103  READ FPDMA QUEUED
  61 00 00 00 dc 00 00 0c c2 a9 80 40 00     00:06:52.100  WRITE FPDMA QUEUED
  61 00 00 01 00 00 00 0c c2 a2 80 40 00     00:06:52.098  WRITE FPDMA QUEUED

Error 23333 [12] occurred at disk power-on lifetime: 6533 hours (272 days + 5 hours)
  When the command that caused the error occurred, the device was active or idle.

  After command completion occurred, registers were:
  ER -- ST COUNT  LBA_48  LH LM LL DV DC
  -- -- -- == -- == == == -- -- -- -- --
  40 -- 51 00 00 00 00 03 24 3c f0 00 00  Error: WP at LBA = 0x03243cf0 = 52706544

  Commands leading to the command that caused the error were:
  CR FEATR COUNT  LBA_48  LH LM LL DV DC  Powered_Up_Time  Command/Feature_Name
  -- == -- == -- == == == -- -- -- -- --  ---------------  --------------------
  61 00 00 00 08 00 00 00 05 82 e0 40 00     00:06:49.404  WRITE FPDMA QUEUED
  61 00 00 00 08 00 00 00 36 04 18 40 00     00:06:49.402  WRITE FPDMA QUEUED
  61 00 00 00 08 00 00 00 03 4a 28 40 00     00:06:49.401  WRITE FPDMA QUEUED
  61 00 00 00 08 00 00 00 81 82 90 40 00     00:06:49.401  WRITE FPDMA QUEUED
  61 00 00 00 04 00 00 00 7e 41 b8 40 00     00:06:49.397  WRITE FPDMA QUEUED

Error 23332 [11] occurred at disk power-on lifetime: 6533 hours (272 days + 5 hours)
  When the command that caused the error occurred, the device was active or idle.

  After command completion occurred, registers were:
  ER -- ST COUNT  LBA_48  LH LM LL DV DC
  -- -- -- == -- == == == -- -- -- -- --
  40 -- 51 00 00 00 00 03 24 3c f0 00 00  Error: WP at LBA = 0x03243cf0 = 52706544

  Commands leading to the command that caused the error were:
  CR FEATR COUNT  LBA_48  LH LM LL DV DC  Powered_Up_Time  Command/Feature_Name
  -- == -- == -- == == == -- -- -- -- --  ---------------  --------------------
  61 00 00 00 20 00 00 0a 23 74 20 40 00     00:06:46.672  WRITE FPDMA QUEUED
  60 00 00 00 40 00 00 00 33 d0 c0 40 00     00:06:46.671  READ FPDMA QUEUED
  61 00 00 00 08 00 00 00 5f 02 c8 40 00     00:06:46.668  WRITE FPDMA QUEUED
  61 00 00 01 00 00 00 0e 5f 41 a0 40 00     00:06:46.667  WRITE FPDMA QUEUED
  61 00 00 01 00 00 00 0e 5f 40 a0 40 00     00:06:46.665  WRITE FPDMA QUEUED

Error 23331 [10] occurred at disk power-on lifetime: 6533 hours (272 days + 5 hours)
  When the command that caused the error occurred, the device was active or idle.

  After command completion occurred, registers were:
  ER -- ST COUNT  LBA_48  LH LM LL DV DC
  -- -- -- == -- == == == -- -- -- -- --
  40 -- 51 00 00 00 00 03 24 3c f0 00 00  Error: UNC at LBA = 0x03243cf0 = 52706544

  Commands leading to the command that caused the error were:
  CR FEATR COUNT  LBA_48  LH LM LL DV DC  Powered_Up_Time  Command/Feature_Name
  -- == -- == -- == == == -- -- -- -- --  ---------------  --------------------
  60 00 00 00 08 00 00 0e ab 3f 18 40 00     00:06:43.817  READ FPDMA QUEUED
  61 00 00 01 00 00 00 10 87 5c 58 40 00     00:06:43.816  WRITE FPDMA QUEUED
  61 00 00 01 00 00 00 10 87 5b 58 40 00     00:06:43.815  WRITE FPDMA QUEUED
  61 00 00 01 00 00 00 10 87 5a 58 40 00     00:06:43.814  WRITE FPDMA QUEUED
  61 00 00 01 00 00 00 10 87 59 58 40 00     00:06:43.813  WRITE FPDMA QUEUED

Error 23330 [9] occurred at disk power-on lifetime: 6533 hours (272 days + 5 hours)
  When the command that caused the error occurred, the device was active or idle.

  After command completion occurred, registers were:
  ER -- ST COUNT  LBA_48  LH LM LL DV DC
  -- -- -- == -- == == == -- -- -- -- --
  40 -- 51 00 00 00 00 03 24 3c f0 00 00  Error: WP at LBA = 0x03243cf0 = 52706544

  Commands leading to the command that caused the error were:
  CR FEATR COUNT  LBA_48  LH LM LL DV DC  Powered_Up_Time  Command/Feature_Name
  -- == -- == -- == == == -- -- -- -- --  ---------------  --------------------
  61 00 00 01 00 00 00 05 6b d0 c0 40 00     00:06:41.203  WRITE FPDMA QUEUED
  61 00 00 01 00 00 00 05 6b cf c0 40 00     00:06:41.202  WRITE FPDMA QUEUED
  61 00 00 01 00 00 00 05 6b ce c0 40 00     00:06:41.199  WRITE FPDMA QUEUED
  61 00 00 01 00 00 00 05 6b cd c0 40 00     00:06:41.196  WRITE FPDMA QUEUED
  61 00 00 01 00 00 00 08 29 40 a0 40 00     00:06:41.195  WRITE FPDMA QUEUED

Error 23329 [8] occurred at disk power-on lifetime: 6533 hours (272 days + 5 hours)
  When the command that caused the error occurred, the device was active or idle.

  After command completion occurred, registers were:
  ER -- ST COUNT  LBA_48  LH LM LL DV DC
  -- -- -- == -- == == == -- -- -- -- --
  40 -- 51 00 00 00 00 03 24 3c f0 00 00  Error: WP at LBA = 0x03243cf0 = 52706544

  Commands leading to the command that caused the error were:
  CR FEATR COUNT  LBA_48  LH LM LL DV DC  Powered_Up_Time  Command/Feature_Name
  -- == -- == -- == == == -- -- -- -- --  ---------------  --------------------
  61 00 00 01 00 00 00 10 87 3c 58 40 00     00:06:38.424  WRITE FPDMA QUEUED
  61 00 00 01 00 00 00 10 87 3b 58 40 00     00:06:38.423  WRITE FPDMA QUEUED
  61 00 00 01 00 00 00 10 87 3a 58 40 00     00:06:38.422  WRITE FPDMA QUEUED
  61 00 00 01 00 00 00 10 87 39 58 40 00     00:06:38.421  WRITE FPDMA QUEUED
  61 00 00 01 00 00 00 10 87 38 58 40 00     00:06:38.420  WRITE FPDMA QUEUED

SMART Extended Self-test Log Version: 1 (1 sectors)
No self-tests have been logged.  [To run self-tests, use: smartctl -t]

SMART Selective self-test log data structure revision number 1
 SPAN  MIN_LBA  MAX_LBA  CURRENT_TEST_STATUS
    1        0        0  Not_testing
    2        0        0  Not_testing
    3        0        0  Not_testing
    4        0        0  Not_testing
    5        0        0  Not_testing
Selective self-test flags (0x0):
  After scanning selected spans, do NOT read-scan remainder of disk.
If Selective self-test is pending on power-up, resume after 0 minute delay.

SCT Status Version:                  3
SCT Version (vendor specific):       522 (0x020a)
Device State:                        Active (0)
Current Temperature:                    40 Celsius
Power Cycle Min/Max Temperature:     27/40 Celsius
Lifetime    Min/Max Temperature:     13/58 Celsius
Under/Over Temperature Limit Count:   0/115

SCT Temperature History Version:     2
Temperature Sampling Period:         1 minute
Temperature Logging Interval:        1 minute
Min/Max recommended Temperature:      0/ 0 Celsius
Min/Max Temperature Limit:            0/ 0 Celsius
Temperature History Size (Index):    128 (66)

SCT Error Recovery Control:
           Read: Disabled
          Write: Disabled

Device Statistics (GP/SMART Log 0x04) not supported

Pending Defects log (GP Log 0x0c) not supported

SATA Phy Event Counters (GP Log 0x11)
ID      Size     Value  Description
0x000a  2           11  Device-to-host register FISes sent due to a COMRESET
0x0001  2            0  Command failed due to ICRC error
0x0003  2            0  R_ERR response for device-to-host data FIS
0x0004  2            0  R_ERR response for host-to-device data FIS
0x0006  2            0  R_ERR response for device-to-host non-data FIS
0x0007  2            0  R_ERR response for host-to-device non-data FIS



