smartctl 7.2 2020-12-30 r5155 [FreeBSD 13.0-RELEASE amd64] (local build)
Copyright (C) 2002-20, Bruce Allen, Christian Franke, www.smartmontools.org

=== START OF INFORMATION SECTION ===
Model Family:     Western Digital Scorpio Blue Serial ATA (AF)
Device Model:     WDC WD3200BPVT-75ZEST0
Serial Number:    --
LU WWN Device Id: 5 0014ee ...
Firmware Version: 01.01A01
User Capacity:    320,072,933,376 bytes [320 GB]
Sector Sizes:     512 bytes logical, 4096 bytes physical
Rotation Rate:    5400 rpm
Device is:        In smartctl database [for details use: -P show]
ATA Version is:   ATA8-ACS (minor revision not indicated)
SATA Version is:  SATA 2.6, 3.0 Gb/s
Local Time is:    Fri Jul 23 12:43:44 2021 +0430
SMART support is: Available - device has SMART capability.
SMART support is: Enabled
AAM level is:     128 (quiet), recommended: 128
APM level is:     128 (minimum power consumption without standby)
Rd look-ahead is: Enabled
Write cache is:   Enabled
DSN feature is:   Unavailable
ATA Security is:  Disabled, NOT FROZEN [SEC1]
Wt Cache Reorder: Enabled

=== START OF READ SMART DATA SECTION ===
SMART overall-health self-assessment test result: PASSED

General SMART Values:
Offline data collection status:  (0x00)	Offline data collection activity
					was never started.
					Auto Offline Data Collection: Disabled.
Self-test execution status:      (   0)	The previous self-test routine completed
					without error or no self-test has ever 
					been run.
Total time to complete Offline 
data collection: 		( 7200) seconds.
Offline data collection
capabilities: 			 (0x7b) SMART execute Offline immediate.
					Auto Offline data collection on/off support.
					Suspend Offline collection upon new
					command.
					Offline surface scan supported.
					Self-test supported.
					Conveyance Self-test supported.
					Selective Self-test supported.
SMART capabilities:            (0x0003)	Saves SMART data before entering
					power-saving mode.
					Supports SMART auto save timer.
Error logging capability:        (0x01)	Error logging supported.
					General Purpose Logging supported.
Short self-test routine 
recommended polling time: 	 (   2) minutes.
Extended self-test routine
recommended polling time: 	 (  86) minutes.
Conveyance self-test routine
recommended polling time: 	 (   5) minutes.
SCT capabilities: 	       (0x7035)	SCT Status supported.
					SCT Feature Control supported.
					SCT Data Table supported.

SMART Attributes Data Structure revision number: 16
Vendor Specific SMART Attributes with Thresholds:
ID# ATTRIBUTE_NAME          FLAGS    VALUE WORST THRESH FAIL RAW_VALUE
  1 Raw_Read_Error_Rate     POSR-K   200   200   051    -    16
  3 Spin_Up_Time            POS--K   153   147   021    -    1333
  4 Start_Stop_Count        -O--CK   095   095   000    -    5331
  5 Reallocated_Sector_Ct   PO--CK   200   200   140    -    0
  7 Seek_Error_Rate         -OSR-K   200   200   000    -    0
  9 Power_On_Hours          -O--CK   088   088   000    -    9166
 10 Spin_Retry_Count        -O--CK   100   100   000    -    0
 11 Calibration_Retry_Count -O--CK   100   100   000    -    0
 12 Power_Cycle_Count       -O--CK   095   095   000    -    5176
191 G-Sense_Error_Rate      -O--CK   001   001   000    -    73674
192 Power-Off_Retract_Count -O--CK   200   200   000    -    638
193 Load_Cycle_Count        -O--CK   001   001   000    -    1058886
194 Temperature_Celsius     -O---K   102   074   000    -    41
196 Reallocated_Event_Count -O--CK   200   200   000    -    0
197 Current_Pending_Sector  -O--CK   200   200   000    -    0
198 Offline_Uncorrectable   ----CK   100   253   000    -    0
199 UDMA_CRC_Error_Count    -O--CK   200   200   000    -    0
200 Multi_Zone_Error_Rate   ---R--   200   200   000    -    0
240 Head_Flying_Hours       -O--CK   092   092   000    -    6461
241 Total_LBAs_Written      -O--CK   200   200   000    -    17775188826
242 Total_LBAs_Read         -O--CK   200   200   000    -    34765923982
254 Free_Fall_Sensor        -O--CK   200   200   000    -    0
                            ||||||_ K auto-keep
                            |||||__ C event count
                            ||||___ R error rate
                            |||____ S speed/performance
                            ||_____ O updated online
                            |______ P prefailure warning

General Purpose Log Directory Version 1
SMART           Log Directory Version 1 [multi-sector log support]
Address    Access  R/W   Size  Description
0x00       GPL,SL  R/O      1  Log Directory
0x01           SL  R/O      1  Summary SMART error log
0x02           SL  R/O      5  Comprehensive SMART error log
0x03       GPL     R/O      6  Ext. Comprehensive SMART error log
0x06           SL  R/O      1  SMART self-test log
0x07       GPL     R/O      1  Extended self-test log
0x09           SL  R/W      1  Selective self-test log
0x10       GPL     R/O      1  NCQ Command Error log
0x11       GPL     R/O      1  SATA Phy Event Counters log
0x80-0x9f  GPL,SL  R/W     16  Host vendor specific log
0xa0-0xa7  GPL,SL  VS      16  Device vendor specific log
0xa8-0xb7  GPL,SL  VS       1  Device vendor specific log
0xbd       GPL,SL  VS       1  Device vendor specific log
0xc0       GPL,SL  VS       1  Device vendor specific log
0xc1       GPL     VS      93  Device vendor specific log
0xe0       GPL,SL  R/W      1  SCT Command/Status
0xe1       GPL,SL  R/W      1  SCT Data Transfer

SMART Extended Comprehensive Error Log Version: 1 (6 sectors)
Device Error Count: 24
	CR     = Command Register
	FEATR  = Features Register
	COUNT  = Count (was: Sector Count) Register
	LBA_48 = Upper bytes of LBA High/Mid/Low Registers ]  ATA-8
	LH     = LBA High (was: Cylinder High) Register    ]   LBA
	LM     = LBA Mid (was: Cylinder Low) Register      ] Register
	LL     = LBA Low (was: Sector Number) Register     ]
	DV     = Device (was: Device/Head) Register
	DC     = Device Control Register
	ER     = Error register
	ST     = Status register
Powered_Up_Time is measured from power on, and printed as
DDd+hh:mm:SS.sss where DD=days, hh=hours, mm=minutes,
SS=sec, and sss=millisec. It "wraps" after 49.710 days.

Error 24 [23] occurred at disk power-on lifetime: 6031 hours (251 days + 7 hours)
  When the command that caused the error occurred, the device was active or idle.

  After command completion occurred, registers were:
  ER -- ST COUNT  LBA_48  LH LM LL DV DC
  -- -- -- == -- == == == -- -- -- -- --
  40 -- 51 00 08 00 00 00 06 55 77 e0 00  Error: UNC 8 sectors at LBA = 0x00065577 = 415095

  Commands leading to the command that caused the error were:
  CR FEATR COUNT  LBA_48  LH LM LL DV DC  Powered_Up_Time  Command/Feature_Name
  -- == -- == -- == == == -- -- -- -- --  ---------------  --------------------
  25 00 00 00 08 00 00 00 06 55 77 e0 00     02:01:10.432  READ DMA EXT
  35 00 00 00 08 00 00 00 5b e7 bf e0 00     02:01:10.376  WRITE DMA EXT
  35 00 00 00 08 00 00 00 5b e7 c7 e0 00     02:01:10.376  WRITE DMA EXT
  35 00 00 00 08 00 00 00 5b f6 6f e0 00     02:01:10.375  WRITE DMA EXT
  25 00 00 00 08 00 00 00 06 55 6f e0 00     02:01:07.708  READ DMA EXT

Error 23 [22] occurred at disk power-on lifetime: 6031 hours (251 days + 7 hours)
  When the command that caused the error occurred, the device was active or idle.

  After command completion occurred, registers were:
  ER -- ST COUNT  LBA_48  LH LM LL DV DC
  -- -- -- == -- == == == -- -- -- -- --
  40 -- 51 00 08 00 00 00 06 55 6f e0 00  Error: UNC 8 sectors at LBA = 0x0006556f = 415087

  Commands leading to the command that caused the error were:
  CR FEATR COUNT  LBA_48  LH LM LL DV DC  Powered_Up_Time  Command/Feature_Name
  -- == -- == -- == == == -- -- -- -- --  ---------------  --------------------
  25 00 00 00 08 00 00 00 06 55 6f e0 00     02:01:07.708  READ DMA EXT
  25 00 00 00 08 00 00 00 06 55 67 e0 00     02:01:07.705  READ DMA EXT
  25 00 00 00 08 00 00 00 06 55 5f e0 00     02:01:07.705  READ DMA EXT
  35 00 00 00 08 00 00 00 5f e8 4f e0 00     02:01:07.657  WRITE DMA EXT
  35 00 00 00 08 00 00 00 5f e8 07 e0 00     02:01:07.656  WRITE DMA EXT

Error 22 [21] occurred at disk power-on lifetime: 6031 hours (251 days + 7 hours)
  When the command that caused the error occurred, the device was active or idle.

  After command completion occurred, registers were:
  ER -- ST COUNT  LBA_48  LH LM LL DV DC
  -- -- -- == -- == == == -- -- -- -- --
  40 -- 51 00 20 00 00 00 06 55 5f e0 00  Error: UNC 32 sectors at LBA = 0x0006555f = 415071

  Commands leading to the command that caused the error were:
  CR FEATR COUNT  LBA_48  LH LM LL DV DC  Powered_Up_Time  Command/Feature_Name
  -- == -- == -- == == == -- -- -- -- --  ---------------  --------------------
  25 00 00 00 20 00 00 00 06 55 5f e0 00     02:01:05.018  READ DMA EXT
  35 00 00 00 e8 00 00 00 22 ae 47 e0 00     02:01:05.016  WRITE DMA EXT
  25 00 00 00 e8 00 00 02 07 85 27 e0 00     02:01:05.003  READ DMA EXT
  35 00 00 00 08 00 00 00 22 ae 3f e0 00     02:01:05.002  WRITE DMA EXT
  25 00 00 00 08 00 00 01 28 6e 87 e0 00     02:01:05.002  READ DMA EXT

Error 21 [20] occurred at disk power-on lifetime: 5983 hours (249 days + 7 hours)
  When the command that caused the error occurred, the device was active or idle.

  After command completion occurred, registers were:
  ER -- ST COUNT  LBA_48  LH LM LL DV DC
  -- -- -- == -- == == == -- -- -- -- --
  40 -- 51 00 08 00 00 00 06 55 77 e0 00  Error: UNC 8 sectors at LBA = 0x00065577 = 415095

  Commands leading to the command that caused the error were:
  CR FEATR COUNT  LBA_48  LH LM LL DV DC  Powered_Up_Time  Command/Feature_Name
  -- == -- == -- == == == -- -- -- -- --  ---------------  --------------------
  25 00 00 00 08 00 00 00 06 55 77 e0 00     01:56:51.083  READ DMA EXT
  35 00 00 00 08 00 00 00 5b e7 b7 e0 00     01:56:51.023  WRITE DMA EXT
  35 00 00 00 08 00 00 00 5b e7 c7 e0 00     01:56:51.023  WRITE DMA EXT
  35 00 00 00 30 00 00 00 5c 93 87 e0 00     01:56:51.022  WRITE DMA EXT
  25 00 00 00 08 00 00 00 06 55 6f e0 00     01:56:48.357  READ DMA EXT

Error 20 [19] occurred at disk power-on lifetime: 5983 hours (249 days + 7 hours)
  When the command that caused the error occurred, the device was active or idle.

  After command completion occurred, registers were:
  ER -- ST COUNT  LBA_48  LH LM LL DV DC
  -- -- -- == -- == == == -- -- -- -- --
  40 -- 51 00 08 00 00 00 06 55 6f e0 00  Error: UNC 8 sectors at LBA = 0x0006556f = 415087

  Commands leading to the command that caused the error were:
  CR FEATR COUNT  LBA_48  LH LM LL DV DC  Powered_Up_Time  Command/Feature_Name
  -- == -- == -- == == == -- -- -- -- --  ---------------  --------------------
  25 00 00 00 08 00 00 00 06 55 6f e0 00     01:56:48.357  READ DMA EXT
  25 00 00 00 08 00 00 00 06 55 67 e0 00     01:56:48.357  READ DMA EXT
  25 00 00 00 08 00 00 00 06 55 5f e0 00     01:56:48.357  READ DMA EXT
  25 00 00 00 08 00 00 00 06 55 57 e0 00     01:56:48.357  READ DMA EXT
  25 00 00 00 08 00 00 00 06 55 4f e0 00     01:56:48.356  READ DMA EXT

Error 19 [18] occurred at disk power-on lifetime: 5983 hours (249 days + 7 hours)
  When the command that caused the error occurred, the device was active or idle.

  After command completion occurred, registers were:
  ER -- ST COUNT  LBA_48  LH LM LL DV DC
  -- -- -- == -- == == == -- -- -- -- --
  40 -- 51 00 60 00 00 00 06 55 1f e0 00  Error: UNC 96 sectors at LBA = 0x0006551f = 415007

  Commands leading to the command that caused the error were:
  CR FEATR COUNT  LBA_48  LH LM LL DV DC  Powered_Up_Time  Command/Feature_Name
  -- == -- == -- == == == -- -- -- -- --  ---------------  --------------------
  25 00 00 00 60 00 00 00 06 55 1f e0 00     01:56:45.611  READ DMA EXT
  35 00 00 00 50 00 00 03 08 28 97 e0 00     01:56:45.610  WRITE DMA EXT
  25 00 00 00 50 00 00 00 05 5a 6f e0 00     01:56:45.609  READ DMA EXT
  35 00 00 00 20 00 00 06 99 9a 3f e0 00     01:56:45.609  WRITE DMA EXT
  35 00 00 00 60 00 00 06 a4 13 bf e0 00     01:56:45.608  WRITE DMA EXT

Error 18 [17] occurred at disk power-on lifetime: 5957 hours (248 days + 5 hours)
  When the command that caused the error occurred, the device was active or idle.

  After command completion occurred, registers were:
  ER -- ST COUNT  LBA_48  LH LM LL DV DC
  -- -- -- == -- == == == -- -- -- -- --
  40 -- 51 00 08 00 00 00 06 55 77 e0 00  Error: UNC 8 sectors at LBA = 0x00065577 = 415095

  Commands leading to the command that caused the error were:
  CR FEATR COUNT  LBA_48  LH LM LL DV DC  Powered_Up_Time  Command/Feature_Name
  -- == -- == -- == == == -- -- -- -- --  ---------------  --------------------
  25 00 00 00 08 00 00 00 06 55 77 e0 00     01:27:30.054  READ DMA EXT
  25 00 00 00 08 00 00 00 06 55 6f e0 00     01:27:27.394  READ DMA EXT
  25 00 00 00 08 00 00 00 06 55 67 e0 00     01:27:27.394  READ DMA EXT
  25 00 00 00 08 00 00 00 06 55 5f e0 00     01:27:27.343  READ DMA EXT
  35 00 00 00 08 00 00 00 5b e7 b7 e0 00     01:27:27.277  WRITE DMA EXT

Error 17 [16] occurred at disk power-on lifetime: 5957 hours (248 days + 5 hours)
  When the command that caused the error occurred, the device was active or idle.

  After command completion occurred, registers were:
  ER -- ST COUNT  LBA_48  LH LM LL DV DC
  -- -- -- == -- == == == -- -- -- -- --
  40 -- 51 00 08 00 00 00 06 55 6f e0 00  Error: UNC 8 sectors at LBA = 0x0006556f = 415087

  Commands leading to the command that caused the error were:
  CR FEATR COUNT  LBA_48  LH LM LL DV DC  Powered_Up_Time  Command/Feature_Name
  -- == -- == -- == == == -- -- -- -- --  ---------------  --------------------
  25 00 00 00 08 00 00 00 06 55 6f e0 00     01:27:27.394  READ DMA EXT
  25 00 00 00 08 00 00 00 06 55 67 e0 00     01:27:27.394  READ DMA EXT
  25 00 00 00 08 00 00 00 06 55 5f e0 00     01:27:27.343  READ DMA EXT
  35 00 00 00 08 00 00 00 5b e7 b7 e0 00     01:27:27.277  WRITE DMA EXT
  35 00 00 00 08 00 00 00 5b e7 c7 e0 00     01:27:27.265  WRITE DMA EXT

SMART Extended Self-test Log Version: 1 (1 sectors)
Num  Test_Description    Status                  Remaining  LifeTime(hours)  LBA_of_first_error
# 1  Short offline       Completed without error       00%      7029         -
# 2  Short offline       Completed without error       00%      7021         -
# 3  Short offline       Completed without error       00%      7008         -
# 4  Short offline       Completed without error       00%      7001         -
# 5  Extended offline    Completed without error       00%      6994         -
# 6  Short offline       Completed without error       00%      6984         -
# 7  Short offline       Completed without error       00%      6767         -
# 8  Short offline       Completed without error       00%         0         -

SMART Selective self-test log data structure revision number 1
 SPAN  MIN_LBA  MAX_LBA  CURRENT_TEST_STATUS
    1        0        0  Not_testing
    2        0        0  Not_testing
    3        0        0  Not_testing
    4        0        0  Not_testing
    5        0        0  Not_testing
Selective self-test flags (0x0):
  After scanning selected spans, do NOT read-scan remainder of disk.
If Selective self-test is pending on power-up, resume after 0 minute delay.

SCT Status Version:                  3
SCT Version (vendor specific):       258 (0x0102)
Device State:                        Active (0)
Current Temperature:                    41 Celsius
Power Cycle Min/Max Temperature:     36/41 Celsius
Lifetime    Min/Max Temperature:     37/69 Celsius
Specified Max Operating Temperature:    35 Celsius
Under/Over Temperature Limit Count:   0/0
Vendor specific:
01 00 00 00 00 00 00 00 00 00 00 00 00 00 00 00
00 00 00 00 00 00 00 00 00 00 00 00 00 00 00 00

SCT Temperature History Version:     2
Temperature Sampling Period:         1 minute
Temperature Logging Interval:        1 minute
Min/Max recommended Temperature:      0/60 Celsius
Min/Max Temperature Limit:           -41/85 Celsius
Temperature History Size (Index):    128 (34)

SCT Error Recovery Control command not supported

Device Statistics (GP/SMART Log 0x04) not supported

Pending Defects log (GP Log 0x0c) not supported

SATA Phy Event Counters (GP Log 0x11)
ID      Size     Value  Description
0x0001  2            0  Command failed due to ICRC error
0x0002  2            0  R_ERR response for data FIS
0x0003  2            0  R_ERR response for device-to-host data FIS
0x0004  2            0  R_ERR response for host-to-device data FIS
0x0005  2            0  R_ERR response for non-data FIS
0x0006  2            0  R_ERR response for device-to-host non-data FIS
0x0007  2            0  R_ERR response for host-to-device non-data FIS
0x000a  2            2  Device-to-host register FISes sent due to a COMRESET
0x000b  2            0  CRC errors within host-to-device FIS
0x8000  4          434  Vendor specific

