smartctl 7.2 2020-12-30 r5155 [OpenBSD 7.0 amd64] (local build)
Copyright (C) 2002-20, Bruce Allen, Christian Franke, www.smartmontools.org

=== START OF INFORMATION SECTION ===
Device Model:     Netac SSD 240GB
Serial Number:    --
LU WWN Device Id: 0 000000 ...
Firmware Version: FW200326
User Capacity:    240,057,409,536 bytes [240 GB]
Sector Size:      512 bytes logical/physical
Rotation Rate:    Solid State Device
Form Factor:      2.5 inches
TRIM Command:     Available
Device is:        Not in smartctl database [for details use: -P showall]
ATA Version is:   ACS-2 T13/2015-D revision 3
SATA Version is:  SATA 3.2, 6.0 Gb/s (current: 6.0 Gb/s)
Local Time is:    Mon Dec 13 19:18:42 2021 CST
SMART support is: Available - device has SMART capability.
SMART support is: Enabled

=== START OF READ SMART DATA SECTION ===
SMART Status not supported: Incomplete response, ATA output registers missing
SMART overall-health self-assessment test result: PASSED
Warning: This result is based on an Attribute check.

General SMART Values:
Offline data collection status:  (0x00)	Offline data collection activity
					was never started.
					Auto Offline Data Collection: Disabled.
Self-test execution status:      (   0)	The previous self-test routine completed
					without error or no self-test has ever 
					been run.
Total time to complete Offline 
data collection: 		(  120) seconds.
Offline data collection
capabilities: 			 (0x5d) SMART execute Offline immediate.
					No Auto Offline data collection support.
					Abort Offline collection upon new
					command.
					Offline surface scan supported.
					Self-test supported.
					No Conveyance Self-test supported.
					Selective Self-test supported.
SMART capabilities:            (0x0002)	Does not save SMART data before
					entering power-saving mode.
					Supports SMART auto save timer.
Error logging capability:        (0x01)	Error logging supported.
					General Purpose Logging supported.
Short self-test routine 
recommended polling time: 	 (   2) minutes.
Extended self-test routine
recommended polling time: 	 (   4) minutes.

SMART Attributes Data Structure revision number: 1
Vendor Specific SMART Attributes with Thresholds:
ID# ATTRIBUTE_NAME          FLAG     VALUE WORST THRESH TYPE      UPDATED  WHEN_FAILED RAW_VALUE
  1 Raw_Read_Error_Rate     0x0032   100   100   050    Old_age   Always       -       0
  5 Reallocated_Sector_Ct   0x0032   100   100   050    Old_age   Always       -       0
  9 Power_On_Hours          0x0032   100   100   050    Old_age   Always       -       292
 12 Power_Cycle_Count       0x0032   100   100   050    Old_age   Always       -       264
160 Unknown_Attribute       0x0032   100   100   050    Old_age   Always       -       0
161 Unknown_Attribute       0x0032   100   100   050    Old_age   Always       -       0
163 Unknown_Attribute       0x0032   100   100   050    Old_age   Always       -       284
164 Unknown_Attribute       0x0032   100   100   050    Old_age   Always       -       10903
165 Unknown_Attribute       0x0032   100   100   050    Old_age   Always       -       41
166 Unknown_Attribute       0x0032   100   100   050    Old_age   Always       -       1
167 Unknown_Attribute       0x0032   100   100   050    Old_age   Always       -       13
168 Unknown_Attribute       0x0032   100   100   050    Old_age   Always       -       0
169 Unknown_Attribute       0x0032   100   100   050    Old_age   Always       -       0
175 Program_Fail_Count_Chip 0x0032   100   100   050    Old_age   Always       -       83886080
176 Erase_Fail_Count_Chip   0x0032   100   100   050    Old_age   Always       -       157555
177 Wear_Leveling_Count     0x0032   100   100   050    Old_age   Always       -       174110
178 Used_Rsvd_Blk_Cnt_Chip  0x0032   100   100   050    Old_age   Always       -       0
181 Program_Fail_Cnt_Total  0x0032   100   100   050    Old_age   Always       -       0
182 Erase_Fail_Count_Total  0x0032   100   100   050    Old_age   Always       -       0
192 Power-Off_Retract_Count 0x0032   100   100   050    Old_age   Always       -       32
194 Temperature_Celsius     0x0032   100   100   050    Old_age   Always       -       40
195 Hardware_ECC_Recovered  0x0032   100   100   050    Old_age   Always       -       5435
196 Reallocated_Event_Count 0x0032   100   100   050    Old_age   Always       -       0
197 Current_Pending_Sector  0x0032   100   100   050    Old_age   Always       -       0
198 Offline_Uncorrectable   0x0032   100   100   050    Old_age   Always       -       0
199 UDMA_CRC_Error_Count    0x0032   100   100   050    Old_age   Always       -       1
232 Available_Reservd_Space 0x0032   100   100   050    Old_age   Always       -       0
241 Total_LBAs_Written      0x0032   100   100   050    Old_age   Always       -       11215
242 Total_LBAs_Read         0x0032   100   100   050    Old_age   Always       -       4583
249 Unknown_Attribute       0x0032   100   100   050    Old_age   Always       -       12871

SMART Error Log Version: 0
No Errors Logged

SMART Self-test log structure revision number 1
Num  Test_Description    Status                  Remaining  LifeTime(hours)  LBA_of_first_error
# 1  Offline             Completed without error       00%        24         -
# 2  Offline             Self-test routine in progress 10%        24         -
# 3  Offline             Self-test routine in progress 10%        24         -
# 4  Offline             Self-test routine in progress 10%        24         -
# 5  Offline             Self-test routine in progress 10%        24         -
# 6  Offline             Self-test routine in progress 10%        24         -
# 7  Offline             Self-test routine in progress 10%        24         -
# 8  Offline             Self-test routine in progress 10%        24         -
# 9  Offline             Self-test routine in progress 10%        24         -
#10  Offline             Self-test routine in progress 10%        24         -
#11  Offline             Self-test routine in progress 10%        24         -
#12  Offline             Self-test routine in progress 10%        24         -
#13  Offline             Self-test routine in progress 10%        24         -
#14  Offline             Self-test routine in progress 10%        24         -
#15  Offline             Self-test routine in progress 10%        24         -
#16  Offline             Self-test routine in progress 10%        24         -
#17  Offline             Self-test routine in progress 10%        24         -
#18  Offline             Self-test routine in progress 10%        24         -
#19  Offline             Self-test routine in progress 10%        24         -
#20  Offline             Self-test routine in progress 10%        24         -
#21  Offline             Self-test routine in progress 10%        24         -

SMART Selective self-test log data structure revision number 0
Note: revision number not 1 implies that no selective self-test has ever been run
 SPAN  MIN_LBA  MAX_LBA  CURRENT_TEST_STATUS
    1        0        0  Not_testing
    2        0        0  Not_testing
    3        0        0  Not_testing
    4        0        0  Not_testing
    5        0        0  Not_testing
Selective self-test flags (0x0):
  After scanning selected spans, do NOT read-scan remainder of disk.
If Selective self-test is pending on power-up, resume after 0 minute delay.



