smartctl 7.3 2022-02-28 r5338 [FreeBSD 13.1-RELEASE-p8 amd64] (local build)
Copyright (C) 2002-22, Bruce Allen, Christian Franke, www.smartmontools.org

=== START OF INFORMATION SECTION ===
Model Number:                       MTFDHBA512TDV-1AZ1AABHA
Serial Number:                      --
Firmware Version:                   HPS0032
PCI Vendor/Subsystem ID:            0x1344
IEEE OUI Identifier:                0x00a075
Controller ID:                      0
NVMe Version:                       1.3
Number of Namespaces:               1
Namespace 1 Size/Capacity:          512,110,190,592 [512 GB]
Namespace 1 Formatted LBA Size:     512
Namespace 1 IEEE EUI-64:            00a075 ...
Local Time is:                      Sun Jul 16 12:07:53 2023 PDT
Firmware Updates (0x14):            2 Slots, no Reset required
Optional Admin Commands (0x0017):   Security Format Frmw_DL Self_Test
Optional NVM Commands (0x0057):     Comp Wr_Unc DS_Mngmt Sav/Sel_Feat Timestmp
Log Page Attributes (0x1b):         S/H_per_NS Cmd_Eff_Lg Telmtry_Lg Pers_Ev_Lg
Maximum Data Transfer Size:         512 Pages
Warning  Comp. Temp. Threshold:     78 Celsius
Critical Comp. Temp. Threshold:     81 Celsius
Namespace 1 Features (0x08):        No_ID_Reuse

Supported Power States
St Op     Max   Active     Idle   RL RT WL WT  Ent_Lat  Ex_Lat
 0 +     8.25W       -        -    0  0  0  0        0       0
 1 +     3.00W       -        -    1  1  1  1        0       0
 2 +     1.90W       -        -    2  2  2  2        0       0
 3 -   0.0800W       -        -    3  3  3  3    10000    2500
 4 -   0.0050W       -        -    4  4  4  4    12000   35000

Supported LBA Sizes (NSID 0x1)
Id Fmt  Data  Metadt  Rel_Perf
 0 +     512       0         0

=== START OF SMART DATA SECTION ===
SMART overall-health self-assessment test result: PASSED

SMART/Health Information (NVMe Log 0x02)
Critical Warning:                   0x00
Temperature:                        46 Celsius
Available Spare:                    100%
Available Spare Threshold:          5%
Percentage Used:                    0%
Data Units Read:                    5,362,706 [2.74 TB]
Data Units Written:                 3,744,915 [1.91 TB]
Host Read Commands:                 22,317,292
Host Write Commands:                21,270,037
Controller Busy Time:               57
Power Cycles:                       117
Power On Hours:                     397
Unsafe Shutdowns:                   63
Media and Data Integrity Errors:    0
Error Information Log Entries:      24
Warning  Comp. Temperature Time:    0
Critical Comp. Temperature Time:    0
Temperature Sensor 1:               46 Celsius
Temperature Sensor 2:               51 Celsius
Thermal Temp. 1 Transition Count:   107
Thermal Temp. 1 Total Time:         1928

Error Information (NVMe Log 0x01, 16 of 256 entries)
No Errors Logged

