smartctl 7.5 2025-04-30 r5714 [FreeBSD 14.3-RELEASE amd64] (local build)
Copyright (C) 2002-25, Bruce Allen, Christian Franke, www.smartmontools.org

=== START OF INFORMATION SECTION ===
Device Model:     QUMO SSD
Serial Number:    --
Firmware Version: S1102A1
User Capacity:    512,110,190,592 bytes [512 GB]
Sector Size:      512 bytes logical/physical
Rotation Rate:    Solid State Device
Form Factor:      2.5 inches
TRIM Command:     Available
Device is:        Not in smartctl database 7.5/5706
ATA Version is:   ACS-4 (minor revision not indicated)
SATA Version is:  SATA 3.2, 6.0 Gb/s (current: 6.0 Gb/s)
Local Time is:    Tue Aug  5 12:51:52 2025 +07
SMART support is: Available - device has SMART capability.
SMART support is: Enabled
AAM feature is:   Unavailable
APM level is:     254 (maximum performance)
Rd look-ahead is: Enabled
Write cache is:   Enabled
DSN feature is:   Unavailable
ATA Security is:  Disabled, frozen [SEC2]

=== START OF READ SMART DATA SECTION ===
SMART overall-health self-assessment test result: PASSED

General SMART Values:
Offline data collection status:  (0x00)	Offline data collection activity
					was never started.
					Auto Offline Data Collection: Disabled.
Self-test execution status:      (   0)	The previous self-test routine completed
					without error or no self-test has ever 
					been run.
Total time to complete Offline 
data collection: 		(  120) seconds.
Offline data collection
capabilities: 			 (0x11) SMART execute Offline immediate.
					No Auto Offline data collection support.
					Suspend Offline collection upon new
					command.
					No Offline surface scan supported.
					Self-test supported.
					No Conveyance Self-test supported.
					No Selective Self-test supported.
SMART capabilities:            (0x0002)	Does not save SMART data before
					entering power-saving mode.
					Supports SMART auto save timer.
Error logging capability:        (0x01)	Error logging supported.
					General Purpose Logging supported.
Short self-test routine 
recommended polling time: 	 (   2) minutes.
Extended self-test routine
recommended polling time: 	 (  10) minutes.
SCT capabilities: 	       (0x0001)	SCT Status supported.

SMART Attributes Data Structure revision number: 1
Vendor Specific SMART Attributes with Thresholds:
ID# ATTRIBUTE_NAME          FLAGS    VALUE WORST THRESH FAIL RAW_VALUE
  1 Raw_Read_Error_Rate     -O--CK   100   100   050    -    0
  5 Reallocated_Sector_Ct   -O--CK   100   100   050    -    0
  9 Power_On_Hours          -O--CK   100   100   050    -    10634
 12 Power_Cycle_Count       -O--CK   100   100   050    -    1698
160 Unknown_Attribute       -O--CK   100   100   050    -    0
161 Unknown_Attribute       PO--CK   100   100   050    -    100
163 Unknown_Attribute       -O--CK   100   100   050    -    8
164 Unknown_Attribute       -O--CK   100   100   050    -    97695
165 Unknown_Attribute       -O--CK   100   100   050    -    456
166 Unknown_Attribute       -O--CK   100   100   050    -    370
167 Unknown_Attribute       -O--CK   100   100   050    -    432
168 Unknown_Attribute       -O--CK   100   100   050    -    3808
169 Unknown_Attribute       -O--CK   100   100   050    -    89
175 Program_Fail_Count_Chip -O--CK   100   100   050    -    0
176 Erase_Fail_Count_Chip   -O--CK   100   100   050    -    0
177 Wear_Leveling_Count     -O--CK   100   100   050    -    0
178 Used_Rsvd_Blk_Cnt_Chip  -O--CK   100   100   050    -    0
181 Program_Fail_Cnt_Total  -O--CK   100   100   050    -    0
182 Erase_Fail_Count_Total  -O--CK   100   100   050    -    0
192 Power-Off_Retract_Count -O--CK   100   100   050    -    514
194 Temperature_Celsius     -O---K   100   100   050    -    35
195 Hardware_ECC_Recovered  -O--CK   100   100   050    -    0
196 Reallocated_Event_Count -O--CK   100   100   050    -    0
197 Current_Pending_Sector  -O--CK   100   100   050    -    0
198 Offline_Uncorrectable   -O--CK   100   100   050    -    0
199 UDMA_CRC_Error_Count    -O--CK   100   100   050    -    0
232 Available_Reservd_Space -O--CK   100   100   050    -    100
241 Total_LBAs_Written      ----CK   100   100   050    -    1090450
242 Total_LBAs_Read         ----CK   100   100   050    -    2717026
245 Unknown_Attribute       -O--CK   100   100   050    -    2036849
                            ||||||_ K auto-keep
                            |||||__ C event count
                            ||||___ R error rate
                            |||____ S speed/performance
                            ||_____ O updated online
                            |______ P prefailure warning

General Purpose Log Directory Version 1
SMART           Log Directory Version 1 [multi-sector log support]
Address    Access  R/W   Size  Description
0x00       GPL,SL  R/O      1  Log Directory
0x01           SL  R/O      1  Summary SMART error log
0x02           SL  R/O      1  Comprehensive SMART error log
0x03       GPL     R/O      1  Ext. Comprehensive SMART error log
0x04       GPL,SL  R/O      8  Device Statistics log
0x06           SL  R/O      1  SMART self-test log
0x07       GPL     R/O      1  Extended self-test log
0x10       GPL     R/O      1  NCQ Command Error log
0x11       GPL     R/O      1  SATA Phy Event Counters log
0x24       GPL     R/O     88  Current Device Internal Status Data log
0x25       GPL     R/O     32  Saved Device Internal Status Data log
0x30       GPL,SL  R/O      9  IDENTIFY DEVICE data log
0x80-0x9f  GPL,SL  R/W     16  Host vendor specific log

SMART Extended Comprehensive Error Log Version: 1 (1 sectors)
No Errors Logged

SMART Extended Self-test Log Version: 1 (1 sectors)
No self-tests have been logged.  [To run self-tests, use: smartctl -t]

Selective Self-tests/Logging not supported

SCT Status Version:                  3
SCT Version (vendor specific):       0 (0x0000)
Device State:                        Active (0)
Current Temperature:                    35 Celsius
Power Cycle Min/Max Temperature:     35/35 Celsius
Lifetime    Min/Max Temperature:     22/52 Celsius
Specified Max Operating Temperature:   100 Celsius
Under/Over Temperature Limit Count:   0/0

SCT Data Table command not supported

SCT Error Recovery Control command not supported

Device Statistics (GP Log 0x04)
Page  Offset Size        Value Flags Description
0x01  =====  =               =  ===  == General Statistics (rev 1) ==
0x01  0x008  4            1698  ---  Lifetime Power-On Resets
0x01  0x010  4           10634  ---  Power-on Hours
0x01  0x018  6      2744278177  ---  Logical Sectors Written
0x01  0x020  6       764834374  ---  Number of Write Commands
0x01  0x028  6      1969394623  ---  Logical Sectors Read
0x01  0x030  6      1767804518  ---  Number of Read Commands
0x07  =====  =               =  ===  == Solid State Device Statistics (rev 1) ==
0x07  0x008  1              20  ---  Percentage Used Endurance Indicator
                                |||_ C monitored condition met
                                ||__ D supports DSN
                                |___ N normalized value

Pending Defects log (GP Log 0x0c) not supported

SATA Phy Event Counters (GP Log 0x11)
ID      Size     Value  Description
0x0001  4            0  Command failed due to ICRC error
0x0002  4            0  R_ERR response for data FIS
0x0005  4            0  R_ERR response for non-data FIS
0x000a  4           15  Device-to-host register FISes sent due to a COMRESET

