smartctl 7.3 2022-02-28 r5338 [FreeBSD 13.2-RELEASE-p1 amd64] (local build)
Copyright (C) 2002-22, Bruce Allen, Christian Franke, www.smartmontools.org

=== START OF INFORMATION SECTION ===
Model Number:                       PC401 NVMe SK hynix 512GB
Serial Number:                      --
Firmware Version:                   80007E00
PCI Vendor/Subsystem ID:            0x1c5c
IEEE OUI Identifier:                0xace42e
Controller ID:                      1
NVMe Version:                       1.2
Number of Namespaces:               1
Namespace 1 Size/Capacity:          512,110,190,592 [512 GB]
Namespace 1 Utilization:            102,960,947,200 [102 GB]
Namespace 1 Formatted LBA Size:     512
Namespace 1 IEEE EUI-64:            ace42e ...
Local Time is:                      Tue Jun 27 20:54:23 2023 AWST
Firmware Updates (0x14):            2 Slots, no Reset required
Optional Admin Commands (0x0017):   Security Format Frmw_DL Self_Test
Optional NVM Commands (0x001f):     Comp Wr_Unc DS_Mngmt Wr_Zero Sav/Sel_Feat
Log Page Attributes (0x02):         Cmd_Eff_Lg
Maximum Data Transfer Size:         32 Pages
Warning  Comp. Temp. Threshold:     79 Celsius
Critical Comp. Temp. Threshold:     81 Celsius

Supported Power States
St Op     Max   Active     Idle   RL RT WL WT  Ent_Lat  Ex_Lat
 0 +     6.00W       -        -    0  0  0  0        5       5
 1 +     3.80W       -        -    1  1  1  1       30      30
 2 +     2.40W       -        -    2  2  2  2      100     100
 3 -   0.0700W       -        -    3  3  3  3     1000    1000
 4 -   0.0070W       -        -    3  3  3  3     1000    5000

Supported LBA Sizes (NSID 0x1)
Id Fmt  Data  Metadt  Rel_Perf
 0 +     512       0         0
 1 -    4096       0         0

=== START OF SMART DATA SECTION ===
SMART overall-health self-assessment test result: PASSED

SMART/Health Information (NVMe Log 0x02)
Critical Warning:                   0x00
Temperature:                        47 Celsius
Available Spare:                    100%
Available Spare Threshold:          50%
Percentage Used:                    4%
Data Units Read:                    56,376,880 [28.8 TB]
Data Units Written:                 115,826,045 [59.3 TB]
Host Read Commands:                 693,184,158
Host Write Commands:                419,736,702
Controller Busy Time:               96,578
Power Cycles:                       10,874
Power On Hours:                     2,244
Unsafe Shutdowns:                   311
Media and Data Integrity Errors:    0
Error Information Log Entries:      0
Warning  Comp. Temperature Time:    0
Critical Comp. Temperature Time:    0
Temperature Sensor 1:               46 Celsius
Temperature Sensor 2:               82 Celsius

Error Information (NVMe Log 0x01, 16 of 256 entries)
No Errors Logged

