smartctl 7.3 2022-02-28 r5338 [FreeBSD 13.1-RELEASE-p2 amd64] (local build)
Copyright (C) 2002-22, Bruce Allen, Christian Franke, www.smartmontools.org

=== START OF INFORMATION SECTION ===
Model Family:     Western Digital Caviar SE Serial ATA
Device Model:     WDC WD800JD-75MSA3
Serial Number:    --
Firmware Version: 10.01E04
User Capacity:    80,000,000,000 bytes [80.0 GB]
Sector Size:      512 bytes logical/physical
Device is:        In smartctl database 7.3/5319
ATA Version is:   ATA/ATAPI-7 (minor revision not indicated)
Local Time is:    Thu Sep 15 23:42:13 2022 -03
SMART support is: Available - device has SMART capability.
SMART support is: Enabled
AAM level is:     254 (maximum performance), recommended: 128
APM feature is:   Unavailable
Rd look-ahead is: Enabled
Write cache is:   Enabled
DSN feature is:   Unavailable
ATA Security is:  Disabled, frozen [SEC2]
Wt Cache Reorder: Enabled

=== START OF READ SMART DATA SECTION ===
SMART overall-health self-assessment test result: PASSED
See vendor-specific Attribute list for marginal Attributes.

General SMART Values:
Offline data collection status:  (0x82)	Offline data collection activity
					was completed without error.
					Auto Offline Data Collection: Enabled.
Self-test execution status:      (   0)	The previous self-test routine completed
					without error or no self-test has ever 
					been run.
Total time to complete Offline 
data collection: 		( 2460) seconds.
Offline data collection
capabilities: 			 (0x7b) SMART execute Offline immediate.
					Auto Offline data collection on/off support.
					Suspend Offline collection upon new
					command.
					Offline surface scan supported.
					Self-test supported.
					Conveyance Self-test supported.
					Selective Self-test supported.
SMART capabilities:            (0x0003)	Saves SMART data before entering
					power-saving mode.
					Supports SMART auto save timer.
Error logging capability:        (0x01)	Error logging supported.
					General Purpose Logging supported.
Short self-test routine 
recommended polling time: 	 (   2) minutes.
Extended self-test routine
recommended polling time: 	 (  33) minutes.
Conveyance self-test routine
recommended polling time: 	 (   6) minutes.
SCT capabilities: 	       (0x103f)	SCT Status supported.
					SCT Error Recovery Control supported.
					SCT Feature Control supported.
					SCT Data Table supported.

SMART Attributes Data Structure revision number: 16
Vendor Specific SMART Attributes with Thresholds:
ID# ATTRIBUTE_NAME          FLAGS    VALUE WORST THRESH FAIL RAW_VALUE
  1 Raw_Read_Error_Rate     POSR--   200   200   051    -    113
  3 Spin_Up_Time            PO----   184   158   021    -    1783
  4 Start_Stop_Count        -O--CK   095   095   000    -    5502
  5 Reallocated_Sector_Ct   PO--CK   200   200   140    -    0
  7 Seek_Error_Rate         POSR--   100   253   051    -    0
  9 Power_On_Hours          -O--CK   046   046   000    -    39678
 10 Spin_Retry_Count        PO--C-   100   100   051    -    0
 11 Calibration_Retry_Count -O--C-   100   100   051    -    0
 12 Power_Cycle_Count       -O--CK   095   095   000    -    5065
190 Airflow_Temperature_Cel -O---K   054   033   045    Past 46
194 Temperature_Celsius     -O---K   097   076   000    -    46
196 Reallocated_Event_Count -O--CK   200   200   000    -    0
197 Current_Pending_Sector  -O--C-   200   200   000    -    0
198 Offline_Uncorrectable   ----C-   200   200   000    -    0
199 UDMA_CRC_Error_Count    -OSRCK   200   200   000    -    0
200 Multi_Zone_Error_Rate   P--R--   200   200   051    -    0
                            ||||||_ K auto-keep
                            |||||__ C event count
                            ||||___ R error rate
                            |||____ S speed/performance
                            ||_____ O updated online
                            |______ P prefailure warning

General Purpose Log Directory Version 1
SMART           Log Directory Version 1 [multi-sector log support]
Address    Access  R/W   Size  Description
0x00       GPL,SL  R/O      1  Log Directory
0x01           SL  R/O      1  Summary SMART error log
0x02           SL  R/O      5  Comprehensive SMART error log
0x03       GPL     R/O      6  Ext. Comprehensive SMART error log
0x06           SL  R/O      1  SMART self-test log
0x07       GPL     R/O      1  Extended self-test log
0x09           SL  R/W      1  Selective self-test log
0x10       GPL     R/O      1  NCQ Command Error log
0x11       GPL     R/O      1  SATA Phy Event Counters log
0x80-0x9f  GPL,SL  R/W     16  Host vendor specific log
0xa0-0xa7  GPL,SL  VS      16  Device vendor specific log
0xa8-0xb7  GPL,SL  VS       1  Device vendor specific log
0xc0       GPL,SL  VS       1  Device vendor specific log
0xe0       GPL,SL  R/W      1  SCT Command/Status
0xe1       GPL,SL  R/W      1  SCT Data Transfer

SMART Extended Comprehensive Error Log Version: 1 (6 sectors)
Device Error Count: 113 (device log contains only the most recent 24 errors)
	CR     = Command Register
	FEATR  = Features Register
	COUNT  = Count (was: Sector Count) Register
	LBA_48 = Upper bytes of LBA High/Mid/Low Registers ]  ATA-8
	LH     = LBA High (was: Cylinder High) Register    ]   LBA
	LM     = LBA Mid (was: Cylinder Low) Register      ] Register
	LL     = LBA Low (was: Sector Number) Register     ]
	DV     = Device (was: Device/Head) Register
	DC     = Device Control Register
	ER     = Error register
	ST     = Status register
Powered_Up_Time is measured from power on, and printed as
DDd+hh:mm:SS.sss where DD=days, hh=hours, mm=minutes,
SS=sec, and sss=millisec. It "wraps" after 49.710 days.

Error 113 [16] occurred at disk power-on lifetime: 0 hours (0 days + 0 hours)
  When the command that caused the error occurred, the device was in an unknown state.

  After command completion occurred, registers were:
  ER -- ST COUNT  LBA_48  LH LM LL DV DC
  -- -- -- == -- == == == -- -- -- -- --
  40 -- 00 01 00 00 51 00 00 e0 01 00 00

  Commands leading to the command that caused the error were:
  CR FEATR COUNT  LBA_48  LH LM LL DV DC  Powered_Up_Time  Command/Feature_Name
  -- == -- == -- == == == -- -- -- -- --  ---------------  --------------------
  00 99 c8 02 db 00 00 00 00 00 00 00 00     00:00:00.000  NOP [Reserved subcommand] [OBS-ACS-2]
  00 80 00 00 a0 02 3a 00 d4 c8 00 00 00     00:00:41.088  NOP [Abort queued commands]
  00 d3 c8 02 cc 00 80 00 20 00 00 00 00     00:03:05.402  NOP [Reserved subcommand] [OBS-ACS-2]
  00 00 00 00 20 02 39 00 c5 c8 00 00 00     00:00:08.192  NOP [Abort queued commands]

Error 112 [15] occurred at disk power-on lifetime: 0 hours (0 days + 0 hours)
  When the command that caused the error occurred, the device was in an unknown state.

  After command completion occurred, registers were:
  ER -- ST COUNT  LBA_48  LH LM LL DV DC
  -- -- -- == -- == == == -- -- -- -- --
  40 -- 00 01 00 00 51 00 00 e0 01 00 00

  Commands leading to the command that caused the error were:
  CR FEATR COUNT  LBA_48  LH LM LL DV DC  Powered_Up_Time  Command/Feature_Name
  -- == -- == -- == == == -- -- -- -- --  ---------------  --------------------
  00 3a c8 02 d4 00 00 00 00 00 00 00 00     00:00:00.000  NOP [Reserved subcommand] [OBS-ACS-2]
  00 80 00 00 20 02 3a 00 d4 c8 00 00 00     00:00:41.088  NOP [Abort queued commands]
  00 39 c8 02 c5 00 00 00 20 00 00 00 00     00:03:03.507  NOP [Reserved subcommand] [OBS-ACS-2]
  00 00 00 00 20 02 39 00 c5 c8 00 00 00     00:00:08.192  NOP [Abort queued commands]

Error 111 [14] occurred at disk power-on lifetime: 0 hours (0 days + 0 hours)
  When the command that caused the error occurred, the device was in an unknown state.

  After command completion occurred, registers were:
  ER -- ST COUNT  LBA_48  LH LM LL DV DC
  -- -- -- == -- == == == -- -- -- -- --
  40 -- 00 01 00 00 51 00 00 e0 01 00 00

  Commands leading to the command that caused the error were:
  CR FEATR COUNT  LBA_48  LH LM LL DV DC  Powered_Up_Time  Command/Feature_Name
  -- == -- == -- == == == -- -- -- -- --  ---------------  --------------------
  00 d3 c8 02 cc 00 00 00 00 00 00 00 00     00:00:00.000  NOP [Reserved subcommand] [OBS-ACS-2]
  00 00 00 00 20 02 39 00 c5 c8 00 00 00     00:00:08.192  NOP [Abort queued commands]
  00 0b c8 02 bd 00 00 00 20 00 00 00 00     00:03:01.561  NOP [Reserved subcommand] [OBS-ACS-2]
  00 00 00 00 20 02 0b 00 bd c8 00 00 00     00:00:08.192  NOP [Abort queued commands]

Error 110 [13] occurred at disk power-on lifetime: 0 hours (0 days + 0 hours)
  When the command that caused the error occurred, the device was in an unknown state.

  After command completion occurred, registers were:
  ER -- ST COUNT  LBA_48  LH LM LL DV DC
  -- -- -- == -- == == == -- -- -- -- --
  40 -- 00 01 00 00 51 00 00 e0 01 00 00

  Commands leading to the command that caused the error were:
  CR FEATR COUNT  LBA_48  LH LM LL DV DC  Powered_Up_Time  Command/Feature_Name
  -- == -- == -- == == == -- -- -- -- --  ---------------  --------------------
  00 39 c8 02 c5 00 00 00 00 00 00 00 00     00:00:00.000  NOP [Reserved subcommand] [OBS-ACS-2]
  00 00 00 00 20 02 39 00 c5 c8 00 00 00     00:00:08.192  NOP [Abort queued commands]
  00 0b c8 02 bd 00 00 00 20 00 00 00 00     00:02:59.467  NOP [Reserved subcommand] [OBS-ACS-2]
  00 00 00 00 20 02 73 00 b5 c8 00 00 00     00:00:08.192  NOP [Abort queued commands]

Error 109 [12] occurred at disk power-on lifetime: 0 hours (0 days + 0 hours)
  When the command that caused the error occurred, the device was in an unknown state.

  After command completion occurred, registers were:
  ER -- ST COUNT  LBA_48  LH LM LL DV DC
  -- -- -- == -- == == == -- -- -- -- --
  40 -- 00 01 00 00 51 00 00 e0 01 00 00

  Commands leading to the command that caused the error were:
  CR FEATR COUNT  LBA_48  LH LM LL DV DC  Powered_Up_Time  Command/Feature_Name
  -- == -- == -- == == == -- -- -- -- --  ---------------  --------------------
  00 0b c8 02 bd 00 00 00 00 00 00 00 00     00:00:00.000  NOP [Reserved subcommand] [OBS-ACS-2]
  00 00 00 00 20 02 0b 00 bd c8 00 00 00     00:00:08.192  NOP [Abort queued commands]
  00 72 c8 02 b5 00 00 00 20 00 00 00 00     00:02:57.523  NOP [Reserved subcommand] [OBS-ACS-2]
  00 00 00 00 20 02 71 00 b5 c8 00 00 00     00:00:08.192  NOP [Abort queued commands]

Error 108 [11] occurred at disk power-on lifetime: 0 hours (0 days + 0 hours)
  When the command that caused the error occurred, the device was in an unknown state.

  After command completion occurred, registers were:
  ER -- ST COUNT  LBA_48  LH LM LL DV DC
  -- -- -- == -- == == == -- -- -- -- --
  40 -- 00 01 00 00 51 00 00 e0 01 00 00

  Commands leading to the command that caused the error were:
  CR FEATR COUNT  LBA_48  LH LM LL DV DC  Powered_Up_Time  Command/Feature_Name
  -- == -- == -- == == == -- -- -- -- --  ---------------  --------------------
  00 73 c8 02 b5 00 00 00 00 00 00 00 00     00:00:00.000  NOP [Reserved subcommand] [OBS-ACS-2]
  00 00 00 00 20 02 72 00 b5 c8 00 00 00     00:00:08.192  NOP [Abort queued commands]
  00 71 c8 02 b5 00 00 00 20 00 00 00 00     00:02:57.521  NOP [Reserved subcommand] [OBS-ACS-2]
  00 00 00 00 20 02 e9 00 ad c8 00 00 00     00:00:08.192  NOP [Abort queued commands]

Error 107 [10] occurred at disk power-on lifetime: 0 hours (0 days + 0 hours)
  When the command that caused the error occurred, the device was in an unknown state.

  After command completion occurred, registers were:
  ER -- ST COUNT  LBA_48  LH LM LL DV DC
  -- -- -- == -- == == == -- -- -- -- --
  40 -- 00 01 00 00 51 00 00 e0 01 00 00

  Commands leading to the command that caused the error were:
  CR FEATR COUNT  LBA_48  LH LM LL DV DC  Powered_Up_Time  Command/Feature_Name
  -- == -- == -- == == == -- -- -- -- --  ---------------  --------------------
  00 e9 c8 02 ad 00 00 00 00 00 00 00 00     00:00:00.000  NOP [Reserved subcommand] [OBS-ACS-2]
  00 00 00 00 20 02 e8 00 ad c8 00 00 00     00:00:08.192  NOP [Abort queued commands]
  00 e7 c8 02 ad 00 00 00 20 00 00 00 00     00:02:55.591  NOP [Reserved subcommand] [OBS-ACS-2]
  00 00 00 00 20 02 b1 00 a5 c8 00 00 00     00:00:08.192  NOP [Abort queued commands]

Error 106 [9] occurred at disk power-on lifetime: 0 hours (0 days + 0 hours)
  When the command that caused the error occurred, the device was in an unknown state.

  After command completion occurred, registers were:
  ER -- ST COUNT  LBA_48  LH LM LL DV DC
  -- -- -- == -- == == == -- -- -- -- --
  40 -- 00 01 00 00 51 00 00 e0 01 00 00

  Commands leading to the command that caused the error were:
  CR FEATR COUNT  LBA_48  LH LM LL DV DC  Powered_Up_Time  Command/Feature_Name
  -- == -- == -- == == == -- -- -- -- --  ---------------  --------------------
  00 b1 c8 02 a5 00 00 00 00 00 00 00 00     00:00:00.000  NOP [Reserved subcommand] [OBS-ACS-2]
  00 00 00 00 20 02 b1 00 a5 c8 00 00 00     00:00:08.192  NOP [Abort queued commands]
  00 af c8 02 a5 00 00 00 20 00 00 00 00     00:02:53.488  NOP [Reserved subcommand] [OBS-ACS-2]
  00 00 00 00 20 02 af 00 a5 c8 00 00 00     00:00:08.192  NOP [Abort queued commands]

SMART Extended Self-test Log Version: 1 (1 sectors)
Num  Test_Description    Status                  Remaining  LifeTime(hours)  LBA_of_first_error
# 1  Extended offline    Completed without error       00%     24653         -
# 2  Short offline       Completed without error       00%         0         -

SMART Selective self-test log data structure revision number 1
 SPAN  MIN_LBA  MAX_LBA  CURRENT_TEST_STATUS
    1        0        0  Not_testing
    2        0        0  Not_testing
    3        0        0  Not_testing
    4        0        0  Not_testing
    5        0        0  Not_testing
Selective self-test flags (0x0):
  After scanning selected spans, do NOT read-scan remainder of disk.
If Selective self-test is pending on power-up, resume after 0 minute delay.

SCT Status Version:                  2
SCT Version (vendor specific):       258 (0x0102)
Device State:                        Active (0)
Current Temperature:                    46 Celsius
Power Cycle Min/Max Temperature:     --/53 Celsius
Lifetime    Min/Max Temperature:     --/68 Celsius

SCT Temperature History Version:     2
Temperature Sampling Period:         1 minute
Temperature Logging Interval:        1 minute
Min/Max recommended Temperature:      5/65 Celsius
Min/Max Temperature Limit:            1/70 Celsius
Temperature History Size (Index):    128 (44)

SCT Error Recovery Control:
           Read: Disabled
          Write: Disabled

Device Statistics (GP/SMART Log 0x04) not supported

Pending Defects log (GP Log 0x0c) not supported

SATA Phy Event Counters (GP Log 0x11)
ID      Size     Value  Description
0x0001  2            0  Command failed due to ICRC error
0x000a  2            1  Device-to-host register FISes sent due to a COMRESET
0x8000  4        55447  Vendor specific

