smartctl 7.2 2021-09-14 r5236 [FreeBSD 12.1-RELEASE-p21-HBSD amd64] (local build)
Copyright (C) 2002-20, Bruce Allen, Christian Franke, www.smartmontools.org

=== START OF INFORMATION SECTION ===
Device Model:     PLEXTOR PX-128G7Ne
Serial Number:    --
LU WWN Device Id: 5 002303 ...
Add. Product Id:  H8731010
Firmware Version: 1.01
User Capacity:    128,035,676,160 bytes [128 GB]
Sector Size:      512 bytes logical/physical
Rotation Rate:    Solid State Device
TRIM Command:     Available
Device is:        Not in smartctl database [for details use: -P showall]
ATA Version is:   ATA8-ACS, ATA/ATAPI-7 T13/1532D revision 4a
SATA Version is:  SATA 3.1, 6.0 Gb/s (current: 6.0 Gb/s)
Local Time is:    Mon Dec 20 19:32:55 2021 CET
SMART support is: Available - device has SMART capability.
SMART support is: Enabled
AAM feature is:   Unavailable
APM feature is:   Unavailable
Rd look-ahead is: Enabled
Write cache is:   Enabled
DSN feature is:   Unavailable
ATA Security is:  Disabled, frozen [SEC2]
Wt Cache Reorder: Enabled

=== START OF READ SMART DATA SECTION ===
SMART overall-health self-assessment test result: PASSED

General SMART Values:
Offline data collection status:  (0x00)	Offline data collection activity
					was never started.
					Auto Offline Data Collection: Disabled.
Self-test execution status:      (   0)	The previous self-test routine completed
					without error or no self-test has ever 
					been run.
Total time to complete Offline 
data collection: 		(   10) seconds.
Offline data collection
capabilities: 			 (0x15) SMART execute Offline immediate.
					No Auto Offline data collection support.
					Abort Offline collection upon new
					command.
					No Offline surface scan supported.
					Self-test supported.
					No Conveyance Self-test supported.
					No Selective Self-test supported.
SMART capabilities:            (0x0003)	Saves SMART data before entering
					power-saving mode.
					Supports SMART auto save timer.
Error logging capability:        (0x01)	Error logging supported.
					General Purpose Logging supported.
Short self-test routine 
recommended polling time: 	 (   1) minutes.
Extended self-test routine
recommended polling time: 	 (  10) minutes.
SCT capabilities: 	       (0x003d)	SCT Status supported.
					SCT Error Recovery Control supported.
					SCT Feature Control supported.
					SCT Data Table supported.

SMART Attributes Data Structure revision number: 1
Vendor Specific SMART Attributes with Thresholds:
ID# ATTRIBUTE_NAME          FLAGS    VALUE WORST THRESH FAIL RAW_VALUE
  1 Raw_Read_Error_Rate     POSR-K   100   100   000    -    0
  5 Reallocated_Sector_Ct   PO----   100   100   000    -    0
  9 Power_On_Hours          -O----   100   100   000    -    4536
 12 Power_Cycle_Count       PO----   100   100   000    -    668
170 Unknown_Attribute       -O--CK   100   100   000    -    0
171 Unknown_Attribute       PO----   100   100   000    -    0
172 Unknown_Attribute       PO----   100   100   000    -    0
173 Unknown_Attribute       PO----   100   100   000    -    147
174 Unknown_Attribute       PO----   100   100   000    -    437
175 Program_Fail_Count_Chip PO----   100   100   000    -    0
176 Erase_Fail_Count_Chip   PO----   100   100   000    -    0
177 Wear_Leveling_Count     PO----   100   100   000    -    151443
178 Used_Rsvd_Blk_Cnt_Chip  PO----   100   100   000    -    0
179 Used_Rsvd_Blk_Cnt_Tot   PO----   100   100   000    -    0
180 Unused_Rsvd_Blk_Cnt_Tot PO--CK   100   100   000    -    720
181 Program_Fail_Cnt_Total  PO----   100   100   000    -    0
182 Erase_Fail_Count_Total  PO----   100   100   000    -    0
183 Runtime_Bad_Block       -O--CK   100   100   000    -    0
184 End-to-End_Error        PO--CK   094   094   000    -    6
187 Reported_Uncorrect      PO----   100   100   000    -    0
188 Command_Timeout         -O--CK   100   100   000    -    74
192 Power-Off_Retract_Count PO----   100   100   000    -    437
195 Hardware_ECC_Recovered  PO----   100   100   000    -    0
196 Reallocated_Event_Count PO----   100   100   000    -    0
198 Offline_Uncorrectable   PO----   100   100   000    -    0
199 UDMA_CRC_Error_Count    PO----   100   100   000    -    6427
232 Available_Reservd_Space PO----   100   100   010    -    0
233 Media_Wearout_Indicator PO----   100   100   000    -    18930
241 Total_LBAs_Written      PO----   100   100   000    -    407082
242 Total_LBAs_Read         PO----   100   100   000    -    440857
                            ||||||_ K auto-keep
                            |||||__ C event count
                            ||||___ R error rate
                            |||____ S speed/performance
                            ||_____ O updated online
                            |______ P prefailure warning

General Purpose Log Directory Version 1
SMART           Log Directory Version 0
Address    Access  R/W   Size  Description
0x00       GPL,SL  R/O      1  Log Directory
0x01       GPL,SL  R/O      1  Summary SMART error log
0x06       GPL,SL  R/O      1  SMART self-test log
0x07       GPL,SL  R/O      1  Extended self-test log
0x10       GPL,SL  R/O      1  NCQ Command Error log
0x11       GPL,SL  R/O      1  SATA Phy Event Counters log
0x30       GPL,SL  R/O      2  IDENTIFY DEVICE data log
0x80-0x9f  GPL,SL  R/W      1  Host vendor specific log
0xe0       GPL,SL  R/W      1  SCT Command/Status
0xe1       GPL,SL  R/W      1  SCT Data Transfer

SMART Extended Comprehensive Error Log (GP Log 0x03) not supported

SMART Error Log Version: 1
Warning: ATA error count 0 inconsistent with error log pointer 1

ATA Error Count: 0
	CR = Command Register [HEX]
	FR = Features Register [HEX]
	SC = Sector Count Register [HEX]
	SN = Sector Number Register [HEX]
	CL = Cylinder Low Register [HEX]
	CH = Cylinder High Register [HEX]
	DH = Device/Head Register [HEX]
	DC = Device Command Register [HEX]
	ER = Error register [HEX]
	ST = Status register [HEX]
Powered_Up_Time is measured from power on, and printed as
DDd+hh:mm:SS.sss where DD=days, hh=hours, mm=minutes,
SS=sec, and sss=millisec. It "wraps" after 49.710 days.

Error 0 occurred at disk power-on lifetime: 768 hours (32 days + 0 hours)
  When the command that caused the error occurred, the device was in an unknown state.

  After command completion occurred, registers were:
  ER ST SC SN CL CH DH
  -- -- -- -- -- -- --
  00 00 00 00 00 00 00

  Commands leading to the command that caused the error were:
  CR FR SC SN CL CH DH DC   Powered_Up_Time  Command/Feature_Name
  -- -- -- -- -- -- -- --  ----------------  --------------------
  0b 00 00 00 00 70 59 00  11d+00:56:09.984  REQUEST SENSE DATA EXT
  0b 00 00 00 00 70 59 00  11d+00:52:53.376  REQUEST SENSE DATA EXT
  0b 00 00 00 00 70 59 00  11d+00:48:31.232  REQUEST SENSE DATA EXT
  0b 00 00 00 00 70 59 00  11d+00:45:14.624  REQUEST SENSE DATA EXT
  0b 00 00 00 00 70 59 00  11d+00:41:58.016  REQUEST SENSE DATA EXT

Error -1 occurred at disk power-on lifetime: 0 hours (0 days + 0 hours)
  When the command that caused the error occurred, the device was in an unknown state.

  After command completion occurred, registers were:
  ER ST SC SN CL CH DH
  -- -- -- -- -- -- --
  70 38 59 0b 00 60 c9

  Commands leading to the command that caused the error were:
  CR FR SC SN CL CH DH DC   Powered_Up_Time  Command/Feature_Name
  -- -- -- -- -- -- -- --  ----------------  --------------------
  38 70 59 0b 00 60 c6 00      00:00:00.000  CFA WRITE SECTORS WITHOUT ERASE
  38 70 59 0b 00 60 c3 00      00:00:00.000  CFA WRITE SECTORS WITHOUT ERASE
  38 70 59 0b 00 60 c0 00      00:00:00.000  CFA WRITE SECTORS WITHOUT ERASE
  38 70 59 0b 00 60 bd 00      00:00:00.000  CFA WRITE SECTORS WITHOUT ERASE
  00 00 00 00 00 03 00 00      00:00:00.000  NOP [Abort queued commands]

Error -2 occurred at disk power-on lifetime: 0 hours (0 days + 0 hours)
  When the command that caused the error occurred, the device was in an unknown state.

  After command completion occurred, registers were:
  ER ST SC SN CL CH DH
  -- -- -- -- -- -- --
  0b 00 00 60 b9 38 00

  Commands leading to the command that caused the error were:
  CR FR SC SN CL CH DH DC   Powered_Up_Time  Command/Feature_Name
  -- -- -- -- -- -- -- --  ----------------  --------------------
  00 0b 00 60 b6 38 00 59  21d+17:57:28.192  NOP [Reserved subcommand] [OBS-ACS-2]
  00 0b 00 60 b3 38 00 59  21d+17:57:28.192  NOP [Reserved subcommand] [OBS-ACS-2]
  00 0b 00 60 b0 38 00 59  21d+17:57:28.192  NOP [Reserved subcommand] [OBS-ACS-2]
  00 0b 00 60 ad 38 00 59  21d+17:57:28.192  NOP [Reserved subcommand] [OBS-ACS-2]
  00 00 00 03 00 00 00 00  21d+17:57:28.192  NOP [Abort queued commands]

Error -3 occurred at disk power-on lifetime: 0 hours (0 days + 0 hours)
  When the command that caused the error occurred, the device was in an unknown state.

  After command completion occurred, registers were:
  ER ST SC SN CL CH DH
  -- -- -- -- -- -- --
  60 00 aa 38 00 00 00

  Commands leading to the command that caused the error were:
  CR FR SC SN CL CH DH DC   Powered_Up_Time  Command/Feature_Name
  -- -- -- -- -- -- -- --  ----------------  --------------------
  00 60 a7 38 00 00 00 00   2d+04:53:30.752  NOP [Reserved subcommand] [OBS-ACS-2]
  00 60 a4 38 00 00 00 00   2d+04:53:30.752  NOP [Reserved subcommand] [OBS-ACS-2]
  00 60 a0 38 00 00 00 00   2d+04:53:30.752  NOP [Reserved subcommand] [OBS-ACS-2]
  00 60 9d 38 00 00 00 00   2d+04:53:30.752  NOP [Reserved subcommand] [OBS-ACS-2]
  00 03 00 00 00 00 00 00   2d+04:53:30.752  NOP [Reserved subcommand] [OBS-ACS-2]

Error -4 occurred at disk power-on lifetime: 0 hours (0 days + 0 hours)
  When the command that caused the error occurred, the device was in an unknown state.

  After command completion occurred, registers were:
  ER ST SC SN CL CH DH
  -- -- -- -- -- -- --
  38 00 00 00 00 00 00

  Commands leading to the command that caused the error were:
  CR FR SC SN CL CH DH DC   Powered_Up_Time  Command/Feature_Name
  -- -- -- -- -- -- -- --  ----------------  --------------------
  70 38 00 00 00 00 00 e5  18d+15:23:35.641  SEEK [OBS-7]
  70 38 00 00 00 00 00 e2  18d+15:23:35.641  SEEK [OBS-7]
  70 38 00 00 00 00 00 df  18d+15:23:35.641  SEEK [OBS-7]
  70 38 00 00 00 00 00 dc  18d+15:23:35.641  SEEK [OBS-7]
  70 00 00 00 00 00 00 00  18d+15:23:35.641  SEEK [OBS-7]

SMART Extended Self-test Log Version: 1 (1 sectors)
No self-tests have been logged.  [To run self-tests, use: smartctl -t]

Selective Self-tests/Logging not supported

SCT Status Version:                  3
SCT Version (vendor specific):       1 (0x0001)
Device State:                        Active (0)
Current Temperature:                     ? Celsius
Power Cycle Min/Max Temperature:      ?/ ? Celsius
Lifetime    Min/Max Temperature:      ?/ ? Celsius
Under/Over Temperature Limit Count:   0/0

SCT Temperature History Version:     2
Temperature Sampling Period:         0 minutes
Temperature Logging Interval:        0 minutes
Min/Max recommended Temperature:      ?/ ? Celsius
Min/Max Temperature Limit:            ?/ ? Celsius
Temperature History Size (Index):    128 (0)

SCT Error Recovery Control:
           Read:      2 (0.2 seconds)
          Write:      2 (0.2 seconds)

Device Statistics (GP/SMART Log 0x04) not supported

Pending Defects log (GP Log 0x0c) not supported

SATA Phy Event Counters (GP Log 0x11)
ID      Size     Value  Description
0x0001  2            0  Command failed due to ICRC error
0x0002  2            0  R_ERR response for data FIS
0x0003  2            0  R_ERR response for device-to-host data FIS
0x0004  2            0  R_ERR response for host-to-device data FIS
0x0005  2            0  R_ERR response for non-data FIS
0x0006  2            0  R_ERR response for device-to-host non-data FIS
0x0007  2            0  R_ERR response for host-to-device non-data FIS
0x0008  2            0  Device-to-host non-data FIS retries
0x0009  2            0  Transition from drive PhyRdy to drive PhyNRdy
0x000a  2           12  Device-to-host register FISes sent due to a COMRESET
0x000b  2            0  CRC errors within host-to-device FIS
0x000d  2            0  Non-CRC errors within host-to-device FIS
0x000f  2            0  R_ERR response for host-to-device data FIS, CRC
0x0010  2            0  R_ERR response for host-to-device data FIS, non-CRC
0x0012  2            0  R_ERR response for host-to-device non-data FIS, CRC
0x0013  2            0  R_ERR response for host-to-device non-data FIS, non-CRC

