smartctl 7.4 2023-08-01 r5530 [FreeBSD 14.0-STABLE amd64] (local build)
Copyright (C) 2002-23, Bruce Allen, Christian Franke, www.smartmontools.org

=== START OF INFORMATION SECTION ===
Model Family:     WD Blue / Red / Green SSDs
Device Model:     WDC WDS240G2G0B-00EPW0
Serial Number:    --
LU WWN Device Id: 5 001b44 ...
Firmware Version: UJ400400
User Capacity:    240,057,409,536 bytes [240 GB]
Sector Size:      512 bytes logical/physical
Rotation Rate:    Solid State Device
Form Factor:      M.2
TRIM Command:     Available, deterministic
Device is:        In smartctl database 7.3/5528
ATA Version is:   ACS-3, ACS-2 T13/2015-D revision 3
SATA Version is:  SATA 3.2, 6.0 Gb/s (current: 6.0 Gb/s)
Local Time is:    Tue Feb 20 13:52:10 2024 CET
SMART support is: Available - device has SMART capability.
SMART support is: Enabled
AAM feature is:   Unavailable
APM feature is:   Disabled
Rd look-ahead is: Enabled
Write cache is:   Enabled
DSN feature is:   Unavailable
ATA Security is:  Disabled, frozen [SEC2]
Wt Cache Reorder: Unavailable

=== START OF READ SMART DATA SECTION ===
SMART overall-health self-assessment test result: PASSED

General SMART Values:
Offline data collection status:  (0x00)	Offline data collection activity
					was never started.
					Auto Offline Data Collection: Disabled.
Self-test execution status:      (   0)	The previous self-test routine completed
					without error or no self-test has ever 
					been run.
Total time to complete Offline 
data collection: 		(  120) seconds.
Offline data collection
capabilities: 			 (0x11) SMART execute Offline immediate.
					No Auto Offline data collection support.
					Suspend Offline collection upon new
					command.
					No Offline surface scan supported.
					Self-test supported.
					No Conveyance Self-test supported.
					No Selective Self-test supported.
SMART capabilities:            (0x0003)	Saves SMART data before entering
					power-saving mode.
					Supports SMART auto save timer.
Error logging capability:        (0x01)	Error logging supported.
					General Purpose Logging supported.
Short self-test routine 
recommended polling time: 	 (   2) minutes.
Extended self-test routine
recommended polling time: 	 (  41) minutes.

SMART Attributes Data Structure revision number: 1
Vendor Specific SMART Attributes with Thresholds:
ID# ATTRIBUTE_NAME          FLAGS    VALUE WORST THRESH FAIL RAW_VALUE
  5 Reallocated_Sector_Ct   -O--CK   100   100   000    -    0
  9 Power_On_Hours          -O--CK   100   100   000    -    24773
 12 Power_Cycle_Count       -O--CK   100   100   000    -    2030
165 Block_Erase_Count       -O--CK   100   100   000    -    4003
166 Minimum_PE_Cycles_TLC   -O--CK   100   100   ---    -    36
167 Max_Bad_Blocks_per_Die  -O--CK   100   100   ---    -    16
168 Maximum_PE_Cycles_TLC   -O--CK   100   100   ---    -    43
169 Total_Bad_Blocks        -O--CK   100   100   ---    -    94
170 Grown_Bad_Blocks        -O--CK   100   100   ---    -    0
171 Program_Fail_Count      -O--CK   100   100   000    -    0
172 Erase_Fail_Count        -O--CK   100   100   000    -    0
173 Average_PE_Cycles_TLC   -O--CK   100   100   000    -    36
174 Unexpected_Power_Loss   -O--CK   100   100   000    -    1161
184 End-to-End_Error        -O--CK   100   100   ---    -    0
187 Reported_Uncorrect      -O--CK   100   100   000    -    0
188 Command_Timeout         -O--CK   100   100   ---    -    0
194 Temperature_Celsius     -O---K   060   053   000    -    40 (Min/Max 14/53)
199 UDMA_CRC_Error_Count    -O--CK   100   100   ---    -    0
230 Media_Wearout_Indicator -O--CK   100   100   000    -    0x0b2b07140b2b
232 Available_Reservd_Space PO--CK   100   100   005    -    100
233 NAND_GB_Written_TLC     -O--CK   100   100   ---    -    9158
234 NAND_GB_Written_SLC     -O--CK   100   100   000    -    31897
241 Host_Writes_GiB         ----CK   100   100   000    -    13334
242 Host_Reads_GiB          ----CK   100   100   000    -    2244
244 Temp_Throttle_Status    -O--CK   000   100   ---    -    0
                            ||||||_ K auto-keep
                            |||||__ C event count
                            ||||___ R error rate
                            |||____ S speed/performance
                            ||_____ O updated online
                            |______ P prefailure warning

General Purpose Log Directory Version 1
SMART           Log Directory Version 1 [multi-sector log support]
Address    Access  R/W   Size  Description
0x00       GPL,SL  R/O      1  Log Directory
0x01           SL  R/O      1  Summary SMART error log
0x02           SL  R/O      1  Comprehensive SMART error log
0x03       GPL     R/O     16  Ext. Comprehensive SMART error log
0x04       GPL,SL  R/O      8  Device Statistics log
0x06           SL  R/O      1  SMART self-test log
0x07       GPL     R/O      1  Extended self-test log
0x10       GPL     R/O      1  NCQ Command Error log
0x11       GPL     R/O      1  SATA Phy Event Counters log
0x30       GPL,SL  R/O      9  IDENTIFY DEVICE data log
0x80-0x9f  GPL,SL  R/W     16  Host vendor specific log
0xa1       GPL,SL  VS       1  Device vendor specific log
0xa2       GPL,SL  VS       2  Device vendor specific log
0xa3-0xa4  GPL,SL  VS       1  Device vendor specific log
0xa7       GPL,SL  VS       1  Device vendor specific log
0xa9       GPL,SL  VS       4  Device vendor specific log

Warning! SMART Extended Comprehensive Error Log Structure error: invalid SMART checksum.
SMART Extended Comprehensive Error Log Version: 1 (16 sectors)
No Errors Logged

SMART Extended Self-test Log Version: 1 (1 sectors)
Num  Test_Description    Status                  Remaining  LifeTime(hours)  LBA_of_first_error
# 1  Short offline       Completed without error       00%     23872         -
# 2  Extended offline    Completed without error       00%     19452         -
# 3  Extended offline    Self-test routine in progress 10%     19452         -
# 4  Extended offline    Self-test routine in progress 10%     19452         -
# 5  Short offline       Completed without error       00%     19451         -
# 6  Extended offline    Aborted by host               60%     19451         -
# 7  Short offline       Completed without error       00%     19451         -
# 8  Short offline       Completed without error       00%     13969         -
# 9  Short offline       Completed without error       00%     13969         -
#10  Short offline       Completed without error       00%      6910         -
#11  Short offline       Completed without error       00%      1430         -
#12  Short offline       Completed without error       00%        14         -

Selective Self-tests/Logging not supported

SCT Commands not supported

Device Statistics (GP Log 0x04)
Page  Offset Size        Value Flags Description
0x01  =====  =               =  ===  == General Statistics (rev 1) ==
0x01  0x008  4            2030  ---  Lifetime Power-On Resets
0x01  0x010  4           24773  ---  Power-on Hours
0x01  0x018  6     27964894098  ---  Logical Sectors Written
0x01  0x028  6      4707202151  ---  Logical Sectors Read
0x01  0x038  6           24773  ---  Date and Time TimeStamp
0x05  =====  =               =  ===  == Temperature Statistics (rev 1) ==
0x05  0x008  1              40  ---  Current Temperature
0x05  0x010  1               -  ---  Average Short Term Temperature
0x05  0x018  1               -  ---  Average Long Term Temperature
0x05  0x020  1              52  ---  Highest Temperature
0x05  0x028  1              26  ---  Lowest Temperature
0x05  0x030  1              46  ---  Highest Average Short Term Temperature
0x05  0x038  1              46  ---  Lowest Average Short Term Temperature
0x05  0x040  1               -  ---  Highest Average Long Term Temperature
0x05  0x048  1               -  ---  Lowest Average Long Term Temperature
0x05  0x050  4               0  ---  Time in Over-Temperature
0x05  0x058  1              95  ---  Specified Maximum Operating Temperature
0x05  0x060  4               0  ---  Time in Under-Temperature
0x05  0x068  1               0  ---  Specified Minimum Operating Temperature
0x07  =====  =               =  ===  == Solid State Device Statistics (rev 1) ==
0x07  0x008  1               7  N--  Percentage Used Endurance Indicator
                                |||_ C monitored condition met
                                ||__ D supports DSN
                                |___ N normalized value

Pending Defects log (GP Log 0x0c) not supported

SATA Phy Event Counters (GP Log 0x11)
ID      Size     Value  Description
0x0003  2            0  R_ERR response for device-to-host data FIS
0x0004  2            0  R_ERR response for host-to-device data FIS
0x0006  2            0  R_ERR response for device-to-host non-data FIS
0x0007  2            0  R_ERR response for host-to-device non-data FIS
0x0009  2            8  Transition from drive PhyRdy to drive PhyNRdy
0x000a  2            9  Device-to-host register FISes sent due to a COMRESET
0x000f  2            0  R_ERR response for host-to-device data FIS, CRC
0x0012  2            0  R_ERR response for host-to-device non-data FIS, CRC
0x0001  2            0  Command failed due to ICRC error

