smartctl 7.4 2023-08-01 r5530 [FreeBSD 13.2-RELEASE-p7 amd64] (local build)
Copyright (C) 2002-23, Bruce Allen, Christian Franke, www.smartmontools.org

=== START OF INFORMATION SECTION ===
Model Number:                       THNSN5128GPU7 TOSHIBA
Serial Number:                      --
Firmware Version:                   57MB4102
PCI Vendor/Subsystem ID:            0x1179
IEEE OUI Identifier:                0x0d0800
Controller ID:                      0
NVMe Version:                       <1.2
Number of Namespaces:               1
Namespace 1 Size/Capacity:          128,035,676,160 [128 GB]
Namespace 1 Formatted LBA Size:     512
Namespace 1 IEEE EUI-64:            00080d ...
Local Time is:                      Sun Dec 17 14:00:50 2023 AEDT
Firmware Updates (0x02):            1 Slot
Optional Admin Commands (0x0006):   Format Frmw_DL
Optional NVM Commands (0x000e):     Wr_Unc DS_Mngmt Wr_Zero
Warning  Comp. Temp. Threshold:     78 Celsius
Critical Comp. Temp. Threshold:     82 Celsius

Supported Power States
St Op     Max   Active     Idle   RL RT WL WT  Ent_Lat  Ex_Lat
 0 +     6.00W       -        -    0  0  0  0        0       0
 1 +     2.40W       -        -    1  1  1  1        0       0
 2 +     1.90W       -        -    2  2  2  2        0       0
 3 -   0.1600W       -        -    3  3  3  3     1000    1000
 4 -   0.0120W       -        -    4  4  4  4     5000   10000
 5 -   0.0060W       -        -    5  5  5  5   100000   50000

Supported LBA Sizes (NSID 0x1)
Id Fmt  Data  Metadt  Rel_Perf
 0 +     512       0         2
 1 -    4096       0         1

=== START OF SMART DATA SECTION ===
SMART overall-health self-assessment test result: PASSED

SMART/Health Information (NVMe Log 0x02)
Critical Warning:                   0x00
Temperature:                        74 Celsius
Available Spare:                    100%
Available Spare Threshold:          10%
Percentage Used:                    4%
Data Units Read:                    5,932,885 [3.03 TB]
Data Units Written:                 7,520,876 [3.85 TB]
Host Read Commands:                 84,278,916
Host Write Commands:                102,407,381
Controller Busy Time:               0
Power Cycles:                       1,691
Power On Hours:                     2,868
Unsafe Shutdowns:                   50
Media and Data Integrity Errors:    0
Error Information Log Entries:      20
Warning  Comp. Temperature Time:    90
Critical Comp. Temperature Time:    56
Temperature Sensor 1:               74 Celsius

Error Information (NVMe Log 0x01, 16 of 128 entries)
Num   ErrCount  SQId   CmdId  Status  PELoc          LBA  NSID    VS  Message
  0         20     -       -       -      -            -     -     -  -
  1         19     -       -       -      -            -     -     -  -
  2         18     -       -       -      -            -     -     -  -
  3         17     -       -       -      -            -     -     -  -
  4         16     -       -       -      -            -     -     -  -
  5         15     -       -       -      -            -     -     -  -
  6         14     -       -       -      -            -     -     -  -
  7         13     -       -       -      -            -     -     -  -
  8         12     -       -       -      -            -     -     -  -
  9         11     -       -       -      -            -     -     -  -
 10         10     -       -       -      -            -     -     -  -
 11          9     -       -       -      -            -     -     -  -
 12          8     -       -       -      -            -     -     -  -
 13          7     -       -       -      -            -     -     -  -
 14          6     -       -       -      -            -     -     -  -
 15          5     -       -       -      -            -     -     -  -
... (112 entries not read)

Self-tests not supported

