smartctl 7.2 2020-12-30 r5155 [FreeBSD 13.0-RELEASE-p3 amd64] (local build)
Copyright (C) 2002-20, Bruce Allen, Christian Franke, www.smartmontools.org

=== START OF INFORMATION SECTION ===
Model Family:     Western Digital Purple
Device Model:     WDC WD20PURX-64P6ZY0
Serial Number:    --
LU WWN Device Id: 5 0014ee ...
Firmware Version: 80.00A80
User Capacity:    2,000,398,934,016 bytes [2.00 TB]
Sector Sizes:     512 bytes logical, 4096 bytes physical
Rotation Rate:    5400 rpm
Device is:        In smartctl database [for details use: -P show]
ATA Version is:   ACS-2 (minor revision not indicated)
SATA Version is:  SATA 3.0, 6.0 Gb/s (current: 6.0 Gb/s)
Local Time is:    Tue Oct 12 16:34:44 2021 EEST
SMART support is: Available - device has SMART capability.
SMART support is: Enabled
AAM feature is:   Unavailable
APM feature is:   Unavailable
Rd look-ahead is: Enabled
Write cache is:   Enabled
DSN feature is:   Unavailable
ATA Security is:  Disabled, NOT FROZEN [SEC1]
Wt Cache Reorder: Enabled

=== START OF READ SMART DATA SECTION ===
SMART overall-health self-assessment test result: PASSED

General SMART Values:
Offline data collection status:  (0x00)	Offline data collection activity
					was never started.
					Auto Offline Data Collection: Disabled.
Self-test execution status:      (   0)	The previous self-test routine completed
					without error or no self-test has ever 
					been run.
Total time to complete Offline 
data collection: 		(25500) seconds.
Offline data collection
capabilities: 			 (0x7b) SMART execute Offline immediate.
					Auto Offline data collection on/off support.
					Suspend Offline collection upon new
					command.
					Offline surface scan supported.
					Self-test supported.
					Conveyance Self-test supported.
					Selective Self-test supported.
SMART capabilities:            (0x0003)	Saves SMART data before entering
					power-saving mode.
					Supports SMART auto save timer.
Error logging capability:        (0x01)	Error logging supported.
					General Purpose Logging supported.
Short self-test routine 
recommended polling time: 	 (   2) minutes.
Extended self-test routine
recommended polling time: 	 ( 258) minutes.
Conveyance self-test routine
recommended polling time: 	 (   5) minutes.
SCT capabilities: 	       (0x703d)	SCT Status supported.
					SCT Error Recovery Control supported.
					SCT Feature Control supported.
					SCT Data Table supported.

SMART Attributes Data Structure revision number: 16
Vendor Specific SMART Attributes with Thresholds:
ID# ATTRIBUTE_NAME          FLAGS    VALUE WORST THRESH FAIL RAW_VALUE
  1 Raw_Read_Error_Rate     POSR-K   200   200   051    -    7
  3 Spin_Up_Time            POS--K   175   175   021    -    4225
  4 Start_Stop_Count        -O--CK   100   100   000    -    132
  5 Reallocated_Sector_Ct   PO--CK   200   200   140    -    0
  7 Seek_Error_Rate         -OSR-K   200   200   000    -    0
  9 Power_On_Hours          -O--CK   051   051   000    -    35935
 10 Spin_Retry_Count        -O--CK   100   100   000    -    0
 11 Calibration_Retry_Count -O--CK   100   100   000    -    0
 12 Power_Cycle_Count       -O--CK   100   100   000    -    132
192 Power-Off_Retract_Count -O--CK   200   200   000    -    99
193 Load_Cycle_Count        -O--CK   200   200   000    -    383
194 Temperature_Celsius     -O---K   109   095   000    -    38
196 Reallocated_Event_Count -O--CK   200   200   000    -    0
197 Current_Pending_Sector  -O--CK   200   200   000    -    0
198 Offline_Uncorrectable   ----CK   100   253   000    -    0
199 UDMA_CRC_Error_Count    -O--CK   200   200   000    -    0
200 Multi_Zone_Error_Rate   ---R--   200   200   000    -    0
                            ||||||_ K auto-keep
                            |||||__ C event count
                            ||||___ R error rate
                            |||____ S speed/performance
                            ||_____ O updated online
                            |______ P prefailure warning

General Purpose Log Directory Version 1
SMART           Log Directory Version 1 [multi-sector log support]
Address    Access  R/W   Size  Description
0x00       GPL,SL  R/O      1  Log Directory
0x01           SL  R/O      1  Summary SMART error log
0x02           SL  R/O      5  Comprehensive SMART error log
0x03       GPL     R/O      6  Ext. Comprehensive SMART error log
0x06           SL  R/O      1  SMART self-test log
0x07       GPL     R/O      1  Extended self-test log
0x09           SL  R/W      1  Selective self-test log
0x10       GPL     R/O      1  NCQ Command Error log
0x11       GPL     R/O      1  SATA Phy Event Counters log
0x21       GPL     R/O      1  Write stream error log
0x22       GPL     R/O      1  Read stream error log
0x80-0x9f  GPL,SL  R/W     16  Host vendor specific log
0xa0-0xa7  GPL,SL  VS      16  Device vendor specific log
0xa8-0xb6  GPL,SL  VS       1  Device vendor specific log
0xb7       GPL,SL  VS      39  Device vendor specific log
0xbd       GPL,SL  VS       1  Device vendor specific log
0xc0       GPL,SL  VS       1  Device vendor specific log
0xc1       GPL     VS      93  Device vendor specific log
0xe0       GPL,SL  R/W      1  SCT Command/Status
0xe1       GPL,SL  R/W      1  SCT Data Transfer

SMART Extended Comprehensive Error Log Version: 1 (6 sectors)
Device Error Count: 8
	CR     = Command Register
	FEATR  = Features Register
	COUNT  = Count (was: Sector Count) Register
	LBA_48 = Upper bytes of LBA High/Mid/Low Registers ]  ATA-8
	LH     = LBA High (was: Cylinder High) Register    ]   LBA
	LM     = LBA Mid (was: Cylinder Low) Register      ] Register
	LL     = LBA Low (was: Sector Number) Register     ]
	DV     = Device (was: Device/Head) Register
	DC     = Device Control Register
	ER     = Error register
	ST     = Status register
Powered_Up_Time is measured from power on, and printed as
DDd+hh:mm:SS.sss where DD=days, hh=hours, mm=minutes,
SS=sec, and sss=millisec. It "wraps" after 49.710 days.

Error 8 [7] occurred at disk power-on lifetime: 25582 hours (1065 days + 22 hours)
  When the command that caused the error occurred, the device was active or idle.

  After command completion occurred, registers were:
  ER -- ST COUNT  LBA_48  LH LM LL DV DC
  -- -- -- == -- == == == -- -- -- -- --
  10 -- 51 00 00 00 00 4a aa cc 38 40 00  Error: IDNF at LBA = 0x4aaacc38 = 1252707384

  Commands leading to the command that caused the error were:
  CR FEATR COUNT  LBA_48  LH LM LL DV DC  Powered_Up_Time  Command/Feature_Name
  -- == -- == -- == == == -- -- -- -- --  ---------------  --------------------
  61 00 10 00 00 00 00 4a aa cc 38 40 00     00:52:40.631  WRITE FPDMA QUEUED
  61 00 20 00 00 00 00 49 55 79 48 40 00     00:52:40.630  WRITE FPDMA QUEUED
  61 00 18 00 00 00 00 48 00 24 00 40 00     00:52:40.630  WRITE FPDMA QUEUED
  61 00 08 00 00 00 00 48 00 23 f8 40 00     00:52:40.498  WRITE FPDMA QUEUED
  61 00 10 00 00 00 00 bd 55 7e a8 40 00     00:52:40.497  WRITE FPDMA QUEUED

Error 7 [6] occurred at disk power-on lifetime: 25582 hours (1065 days + 22 hours)
  When the command that caused the error occurred, the device was active or idle.

  After command completion occurred, registers were:
  ER -- ST COUNT  LBA_48  LH LM LL DV DC
  -- -- -- == -- == == == -- -- -- -- --
  40 -- 51 00 00 00 00 00 00 02 10 40 00  Error: WP at LBA = 0x00000210 = 528

  Commands leading to the command that caused the error were:
  CR FEATR COUNT  LBA_48  LH LM LL DV DC  Powered_Up_Time  Command/Feature_Name
  -- == -- == -- == == == -- -- -- -- --  ---------------  --------------------
  61 01 00 00 08 00 00 00 dc b0 78 40 00     00:52:33.227  WRITE FPDMA QUEUED
  61 01 00 00 00 00 00 00 dc af 78 40 00     00:52:33.227  WRITE FPDMA QUEUED
  61 00 f0 00 50 00 00 00 dc ae 88 40 00     00:52:33.226  WRITE FPDMA QUEUED
  61 01 00 00 48 00 00 00 dc ad 88 40 00     00:52:33.226  WRITE FPDMA QUEUED
  61 01 00 00 40 00 00 00 dc ac 88 40 00     00:52:33.226  WRITE FPDMA QUEUED

Error 6 [5] occurred at disk power-on lifetime: 25582 hours (1065 days + 22 hours)
  When the command that caused the error occurred, the device was active or idle.

  After command completion occurred, registers were:
  ER -- ST COUNT  LBA_48  LH LM LL DV DC
  -- -- -- == -- == == == -- -- -- -- --
  10 -- 51 00 00 00 00 00 dc 9c 58 40 00  Error: IDNF at LBA = 0x00dc9c58 = 14457944

  Commands leading to the command that caused the error were:
  CR FEATR COUNT  LBA_48  LH LM LL DV DC  Powered_Up_Time  Command/Feature_Name
  -- == -- == -- == == == -- -- -- -- --  ---------------  --------------------
  61 00 80 00 00 00 00 00 dc 9c 58 40 00     00:52:26.170  WRITE FPDMA QUEUED
  61 00 80 00 00 00 00 00 dc 96 c8 40 00     00:52:26.167  WRITE FPDMA QUEUED
  61 00 98 00 10 00 00 00 dc 96 28 40 00     00:52:26.166  WRITE FPDMA QUEUED
  61 01 00 00 08 00 00 00 dc 95 28 40 00     00:52:26.166  WRITE FPDMA QUEUED
  61 01 00 00 00 00 00 00 dc 94 28 40 00     00:52:26.166  WRITE FPDMA QUEUED

Error 5 [4] occurred at disk power-on lifetime: 25257 hours (1052 days + 9 hours)
  When the command that caused the error occurred, the device was active or idle.

  After command completion occurred, registers were:
  ER -- ST COUNT  LBA_48  LH LM LL DV DC
  -- -- -- == -- == == == -- -- -- -- --
  10 -- 51 00 10 00 00 21 36 31 98 40 00  Error: IDNF 16 sectors at LBA = 0x21363198 = 557199768

  Commands leading to the command that caused the error were:
  CR FEATR COUNT  LBA_48  LH LM LL DV DC  Powered_Up_Time  Command/Feature_Name
  -- == -- == -- == == == -- -- -- -- --  ---------------  --------------------
  35 00 00 00 10 00 00 21 36 31 98 40 00  8d+12:03:40.091  WRITE DMA EXT
  35 00 00 00 10 00 00 21 36 31 98 40 00  8d+12:03:33.095  WRITE DMA EXT
  35 00 00 00 10 00 00 21 36 31 98 40 00  8d+12:03:26.099  WRITE DMA EXT
  35 00 00 01 00 00 00 21 36 30 98 40 00  8d+12:03:25.982  WRITE DMA EXT
  ea 00 00 00 00 00 00 00 00 00 00 40 00  8d+12:03:25.876  FLUSH CACHE EXT

Error 4 [3] occurred at disk power-on lifetime: 25257 hours (1052 days + 9 hours)
  When the command that caused the error occurred, the device was active or idle.

  After command completion occurred, registers were:
  ER -- ST COUNT  LBA_48  LH LM LL DV DC
  -- -- -- == -- == == == -- -- -- -- --
  10 -- 51 00 10 00 00 21 36 31 98 40 00  Error: IDNF 16 sectors at LBA = 0x21363198 = 557199768

  Commands leading to the command that caused the error were:
  CR FEATR COUNT  LBA_48  LH LM LL DV DC  Powered_Up_Time  Command/Feature_Name
  -- == -- == -- == == == -- -- -- -- --  ---------------  --------------------
  35 00 00 00 10 00 00 21 36 31 98 40 00  8d+12:03:33.095  WRITE DMA EXT
  35 00 00 00 10 00 00 21 36 31 98 40 00  8d+12:03:26.099  WRITE DMA EXT
  35 00 00 01 00 00 00 21 36 30 98 40 00  8d+12:03:25.982  WRITE DMA EXT
  ea 00 00 00 00 00 00 00 00 00 00 40 00  8d+12:03:25.876  FLUSH CACHE EXT
  35 00 00 00 38 00 00 28 55 13 b8 40 00  8d+12:03:25.876  WRITE DMA EXT

Error 3 [2] occurred at disk power-on lifetime: 25257 hours (1052 days + 9 hours)
  When the command that caused the error occurred, the device was active or idle.

  After command completion occurred, registers were:
  ER -- ST COUNT  LBA_48  LH LM LL DV DC
  -- -- -- == -- == == == -- -- -- -- --
  10 -- 51 00 10 00 00 21 36 31 98 40 00  Error: IDNF 16 sectors at LBA = 0x21363198 = 557199768

  Commands leading to the command that caused the error were:
  CR FEATR COUNT  LBA_48  LH LM LL DV DC  Powered_Up_Time  Command/Feature_Name
  -- == -- == -- == == == -- -- -- -- --  ---------------  --------------------
  35 00 00 00 10 00 00 21 36 31 98 40 00  8d+12:03:26.099  WRITE DMA EXT
  35 00 00 01 00 00 00 21 36 30 98 40 00  8d+12:03:25.982  WRITE DMA EXT
  ea 00 00 00 00 00 00 00 00 00 00 40 00  8d+12:03:25.876  FLUSH CACHE EXT
  35 00 00 00 38 00 00 28 55 13 b8 40 00  8d+12:03:25.876  WRITE DMA EXT
  35 00 00 00 18 00 00 24 a1 7e 88 40 00  8d+12:03:25.789  WRITE DMA EXT

Error 2 [1] occurred at disk power-on lifetime: 25257 hours (1052 days + 9 hours)
  When the command that caused the error occurred, the device was active or idle.

  After command completion occurred, registers were:
  ER -- ST COUNT  LBA_48  LH LM LL DV DC
  -- -- -- == -- == == == -- -- -- -- --
  10 -- 51 00 20 00 00 26 81 1b 30 40 00  Error: IDNF 32 sectors at LBA = 0x26811b30 = 645995312

  Commands leading to the command that caused the error were:
  CR FEATR COUNT  LBA_48  LH LM LL DV DC  Powered_Up_Time  Command/Feature_Name
  -- == -- == -- == == == -- -- -- -- --  ---------------  --------------------
  35 00 00 00 20 00 00 26 81 1b 30 40 00  8d+12:03:15.521  WRITE DMA EXT
  35 00 00 00 48 00 00 24 e7 07 20 40 00  8d+12:03:15.520  WRITE DMA EXT
  35 00 00 00 08 00 00 26 81 1b 28 40 00  8d+12:03:15.359  WRITE DMA EXT
  ea 00 00 00 00 00 00 00 00 00 00 40 00  8d+12:03:15.211  FLUSH CACHE EXT
  35 00 00 00 18 00 00 24 e7 06 d8 40 00  8d+12:03:10.178  WRITE DMA EXT

Error 1 [0] occurred at disk power-on lifetime: 25257 hours (1052 days + 9 hours)
  When the command that caused the error occurred, the device was active or idle.

  After command completion occurred, registers were:
  ER -- ST COUNT  LBA_48  LH LM LL DV DC
  -- -- -- == -- == == == -- -- -- -- --
  10 -- 51 00 18 00 00 24 e7 06 d8 40 00  Error: IDNF 24 sectors at LBA = 0x24e706d8 = 619120344

  Commands leading to the command that caused the error were:
  CR FEATR COUNT  LBA_48  LH LM LL DV DC  Powered_Up_Time  Command/Feature_Name
  -- == -- == -- == == == -- -- -- -- --  ---------------  --------------------
  35 00 00 00 18 00 00 24 e7 06 d8 40 00  8d+12:03:03.181  WRITE DMA EXT
  ea 00 00 00 00 00 00 00 00 00 00 40 00  8d+12:03:02.488  FLUSH CACHE EXT
  35 00 00 00 28 00 00 24 e7 06 90 40 00  8d+12:03:02.474  WRITE DMA EXT
  ea 00 00 00 00 00 00 00 00 00 00 40 00  8d+12:03:02.092  FLUSH CACHE EXT
  35 00 00 00 38 00 00 24 e7 06 48 40 00  8d+12:03:02.091  WRITE DMA EXT

SMART Extended Self-test Log Version: 1 (1 sectors)
Num  Test_Description    Status                  Remaining  LifeTime(hours)  LBA_of_first_error
# 1  Extended offline    Completed without error       00%     19024         -

SMART Selective self-test log data structure revision number 1
 SPAN  MIN_LBA  MAX_LBA  CURRENT_TEST_STATUS
    1        0        0  Not_testing
    2        0        0  Not_testing
    3        0        0  Not_testing
    4        0        0  Not_testing
    5        0        0  Not_testing
Selective self-test flags (0x0):
  After scanning selected spans, do NOT read-scan remainder of disk.
If Selective self-test is pending on power-up, resume after 0 minute delay.

SCT Status Version:                  3
SCT Version (vendor specific):       258 (0x0102)
Device State:                        Active (0)
Current Temperature:                    38 Celsius
Power Cycle Min/Max Temperature:     32/43 Celsius
Lifetime    Min/Max Temperature:     17/52 Celsius
Under/Over Temperature Limit Count:   0/0
Vendor specific:
01 00 00 00 00 00 00 00 00 00 00 00 00 00 00 00
00 00 00 00 00 00 00 00 00 00 00 00 00 00 00 00

SCT Temperature History Version:     2
Temperature Sampling Period:         1 minute
Temperature Logging Interval:        1 minute
Min/Max recommended Temperature:      0/60 Celsius
Min/Max Temperature Limit:           -41/85 Celsius
Temperature History Size (Index):    478 (49)

SCT Error Recovery Control:
           Read:     70 (7.0 seconds)
          Write:     70 (7.0 seconds)

Device Statistics (GP/SMART Log 0x04) not supported

Pending Defects log (GP Log 0x0c) not supported

SATA Phy Event Counters (GP Log 0x11)
ID      Size     Value  Description
0x0001  2            0  Command failed due to ICRC error
0x0002  2            0  R_ERR response for data FIS
0x0003  2            0  R_ERR response for device-to-host data FIS
0x0004  2            0  R_ERR response for host-to-device data FIS
0x0005  2            0  R_ERR response for non-data FIS
0x0006  2            0  R_ERR response for device-to-host non-data FIS
0x0007  2            0  R_ERR response for host-to-device non-data FIS
0x0008  2            0  Device-to-host non-data FIS retries
0x0009  2            5  Transition from drive PhyRdy to drive PhyNRdy
0x000a  2            6  Device-to-host register FISes sent due to a COMRESET
0x000b  2            0  CRC errors within host-to-device FIS
0x000f  2            0  R_ERR response for host-to-device data FIS, CRC
0x0012  2            0  R_ERR response for host-to-device non-data FIS, CRC
0x8000  4      2757102  Vendor specific



