smartctl 7.3 2022-02-28 r5338 [FreeBSD 13.2-RELEASE amd64] (local build)
Copyright (C) 2002-22, Bruce Allen, Christian Franke, www.smartmontools.org

=== START OF INFORMATION SECTION ===
Model Number:                       THNSN5512GPU7 TOSHIBA
Serial Number:                      --
Firmware Version:                   57HA4103
PCI Vendor/Subsystem ID:            0x1179
IEEE OUI Identifier:                0x00080d
Controller ID:                      0
NVMe Version:                       <1.2
Number of Namespaces:               1
Namespace 1 Size/Capacity:          512,110,190,592 [512 GB]
Namespace 1 Formatted LBA Size:     512
Namespace 1 IEEE EUI-64:            00080d ...
Local Time is:                      Sun Oct 29 00:17:51 2023    
Firmware Updates (0x02):            1 Slot
Optional Admin Commands (0x0006):   Format Frmw_DL
Optional NVM Commands (0x000e):     Wr_Unc DS_Mngmt Wr_Zero
Log Page Attributes (0x02):         Cmd_Eff_Lg
Warning  Comp. Temp. Threshold:     78 Celsius
Critical Comp. Temp. Threshold:     82 Celsius

Supported Power States
St Op     Max   Active     Idle   RL RT WL WT  Ent_Lat  Ex_Lat
 0 +     6.00W       -        -    0  0  0  0        0       0
 1 +     4.20W       -        -    1  1  1  1        0       0
 2 +     3.20W       -        -    2  2  2  2        0       0
 3 -   0.1600W       -        -    3  3  3  3     1000    1000
 4 -   0.0120W       -        -    4  4  4  4     5000   20000
 5 -   0.0060W       -        -    5  5  5  5   100000   60000

Supported LBA Sizes (NSID 0x1)
Id Fmt  Data  Metadt  Rel_Perf
 0 +     512       0         2
 1 -    4096       0         1

=== START OF SMART DATA SECTION ===
SMART overall-health self-assessment test result: PASSED

SMART/Health Information (NVMe Log 0x02)
Critical Warning:                   0x00
Temperature:                        34 Celsius
Available Spare:                    100%
Available Spare Threshold:          5%
Percentage Used:                    3%
Data Units Read:                    31,579,523 [16.1 TB]
Data Units Written:                 12,839,485 [6.57 TB]
Host Read Commands:                 279,339,340
Host Write Commands:                287,863,134
Controller Busy Time:               5,641
Power Cycles:                       344
Power On Hours:                     29,007
Unsafe Shutdowns:                   68
Media and Data Integrity Errors:    0
Error Information Log Entries:      0
Warning  Comp. Temperature Time:    0
Critical Comp. Temperature Time:    0
Temperature Sensor 1:               34 Celsius

Error Information (NVMe Log 0x01, 16 of 128 entries)
No Errors Logged

