smartctl 7.1 2019-12-30 r5022 [MidnightBSD 2.1.5 amd64] (local build)
Copyright (C) 2002-19, Bruce Allen, Christian Franke, www.smartmontools.org

=== START OF INFORMATION SECTION ===
Model Number:                       LENSE30512GMSP34MEAT3TA
Serial Number:                      --
Firmware Version:                   2.5.0412
PCI Vendor/Subsystem ID:            0x17aa
IEEE OUI Identifier:                0xa03299
Controller ID:                      1
Number of Namespaces:               1
Namespace 1 Size/Capacity:          512,110,190,592 [512 GB]
Namespace 1 Utilization:            0
Namespace 1 Formatted LBA Size:     512
Namespace 1 IEEE EUI-64:            a03299 ...
Local Time is:                      Wed Mar 23 21:23:16 2022 PDT
Firmware Updates (0x02):            1 Slot
Optional Admin Commands (0x0017):   Security Format Frmw_DL Self_Test
Optional NVM Commands (0x0016):     Wr_Unc DS_Mngmt Sav/Sel_Feat
Maximum Data Transfer Size:         32 Pages
Warning  Comp. Temp. Threshold:     70 Celsius
Critical Comp. Temp. Threshold:     80 Celsius

Supported Power States
St Op     Max   Active     Idle   RL RT WL WT  Ent_Lat  Ex_Lat
 0 +     6.50W       -        -    0  0  0  0        0       0
 1 +     4.60W       -        -    1  1  1  1        5       5
 2 +     3.90W       -        -    2  2  2  2        5       5
 3 -   0.1000W       -        -    3  3  3  3       60    1000
 4 -   0.0100W       -        -    4  4  4  4    30000    1500

Supported LBA Sizes (NSID 0x1)
Id Fmt  Data  Metadt  Rel_Perf
 0 -     512       0         0

=== START OF SMART DATA SECTION ===
SMART overall-health self-assessment test result: PASSED

SMART/Health Information (NVMe Log 0x02)
Critical Warning:                   0x00
Temperature:                        37 Celsius
Available Spare:                    100%
Available Spare Threshold:          3%
Percentage Used:                    4%
Data Units Read:                    21,208,443 [10.8 TB]
Data Units Written:                 23,947,308 [12.2 TB]
Host Read Commands:                 361,362,028
Host Write Commands:                441,311,154
Controller Busy Time:               1,926
Power Cycles:                       3,729
Power On Hours:                     1,498
Unsafe Shutdowns:                   445
Media and Data Integrity Errors:    0
Error Information Log Entries:      14
Warning  Comp. Temperature Time:    0
Critical Comp. Temperature Time:    0
Temperature Sensor 1:               46 Celsius
Temperature Sensor 2:               37 Celsius

Error Information (NVMe Log 0x01, max 4 entries)
Num   ErrCount  SQId   CmdId  Status  PELoc          LBA  NSID    VS
  0         14     0       -  0xc003  0x000            0     0     -
  1         13     0       -  0xc003  0x000            0     0     -
  2         12     0       -  0xc003  0x000            0     0     -
  3         11     0       -  0xc003  0x000            0     0     -

