smartctl 7.2 2020-12-30 r5155 [FreeBSD 13.0-RELEASE-p4 amd64] (local build)
Copyright (C) 2002-20, Bruce Allen, Christian Franke, www.smartmontools.org

=== START OF INFORMATION SECTION ===
Model Number:                       Samsung SSD 960 EVO 500GB
Serial Number:                      --
Firmware Version:                   3B7QCXE7
PCI Vendor/Subsystem ID:            0x144d
IEEE OUI Identifier:                0x002538
Total NVM Capacity:                 500,107,862,016 [500 GB]
Unallocated NVM Capacity:           0
Controller ID:                      2
NVMe Version:                       1.2
Number of Namespaces:               1
Namespace 1 Size/Capacity:          500,107,862,016 [500 GB]
Namespace 1 Utilization:            118,437,613,568 [118 GB]
Namespace 1 Formatted LBA Size:     512
Namespace 1 IEEE EUI-64:            002538 ...
Local Time is:                      Mon Nov  1 15:23:17 2021 EDT
Firmware Updates (0x16):            3 Slots, no Reset required
Optional Admin Commands (0x0007):   Security Format Frmw_DL
Optional NVM Commands (0x001f):     Comp Wr_Unc DS_Mngmt Wr_Zero Sav/Sel_Feat
Log Page Attributes (0x03):         S/H_per_NS Cmd_Eff_Lg
Maximum Data Transfer Size:         512 Pages
Warning  Comp. Temp. Threshold:     83 Celsius
Critical Comp. Temp. Threshold:     85 Celsius

Supported Power States
St Op     Max   Active     Idle   RL RT WL WT  Ent_Lat  Ex_Lat
 0 +     6.04W       -        -    0  0  0  0        0       0
 1 +     5.09W       -        -    1  1  1  1        0       0
 2 +     4.08W       -        -    2  2  2  2        0       0
 3 -   0.0400W       -        -    3  3  3  3      210    1500
 4 -   0.0050W       -        -    4  4  4  4     2200    6000

Supported LBA Sizes (NSID 0x1)
Id Fmt  Data  Metadt  Rel_Perf
 0 +     512       0         0

=== START OF SMART DATA SECTION ===
SMART overall-health self-assessment test result: PASSED

SMART/Health Information (NVMe Log 0x02)
Critical Warning:                   0x00
Temperature:                        43 Celsius
Available Spare:                    100%
Available Spare Threshold:          10%
Percentage Used:                    0%
Data Units Read:                    7,567,451 [3.87 TB]
Data Units Written:                 8,534,303 [4.36 TB]
Host Read Commands:                 28,573,607
Host Write Commands:                49,123,261
Controller Busy Time:               177
Power Cycles:                       112
Power On Hours:                     431
Unsafe Shutdowns:                   69
Media and Data Integrity Errors:    0
Error Information Log Entries:      1,446
Warning  Comp. Temperature Time:    0
Critical Comp. Temperature Time:    0
Temperature Sensor 1:               43 Celsius
Temperature Sensor 2:               52 Celsius

Error Information (NVMe Log 0x01, 16 of 64 entries)
Num   ErrCount  SQId   CmdId  Status  PELoc          LBA  NSID    VS
  0       1446     0  0x0010  0x421a  0x028            0     0     -
  1       1445     0  0x0010  0x421a  0x028            0     0     -
  2       1444     0  0x0010  0x421a  0x028            0     0     -
  3       1443     0  0x0010  0x421a  0x028            0     0     -
  4       1442     0  0x0016  0x421a  0x028            0     0     -
  5       1441     0  0x000e  0x4004      -            0     0     -
  6       1440     0  0x000c  0x4004      -            0     0     -
  7       1439     0  0x0007  0x4004      -            0     0     -
  8       1438     0  0x00d4  0x4004      -            0     0     -
  9       1437     0  0x00d3  0x4004      -            0     0     -
 10       1436     0  0x0076  0x4212  0x028            0     -     -
 11       1435     0  0x0055  0x4004      -            0     0     -
 12       1434     0  0x0054  0x4004      -            0     0     -
 13       1433     0  0x0052  0x4004      -            0     0     -
 14       1432     0  0x0051  0x4004      -            0     0     -
 15       1431     0  0x0050  0x4004      -            0     0     -
... (48 entries not read)

