smartctl 7.1 2019-12-30 r5022 [x86_64-unknown-openbsd6.8] (local build)
Copyright (C) 2002-19, Bruce Allen, Christian Franke, www.smartmontools.org

=== START OF INFORMATION SECTION ===
Model Family:     SAMSUNG SpinPoint F2 EG
Device Model:     SAMSUNG HD154UI
Serial Number:    --
LU WWN Device Id: 5 0024e9 ...
Firmware Version: 1AG01118
User Capacity:    1,500,300,828,160 bytes [1.50 TB]
Sector Size:      512 bytes logical/physical
Device is:        In smartctl database [for details use: -P show]
ATA Version is:   ATA/ATAPI-7, ATA8-ACS T13/1699-D revision 3b
Local Time is:    Mon Oct 19 06:59:49 2020 CEST
SMART support is: Available - device has SMART capability.
SMART support is: Enabled

=== START OF READ SMART DATA SECTION ===
SMART Status not supported: Incomplete response, ATA output registers missing
SMART overall-health self-assessment test result: PASSED
Warning: This result is based on an Attribute check.

General SMART Values:
Offline data collection status:  (0x00)	Offline data collection activity
					was never started.
					Auto Offline Data Collection: Disabled.
Self-test execution status:      (  41)	The self-test routine was interrupted
					by the host with a hard or soft reset.
Total time to complete Offline 
data collection: 		(18583) seconds.
Offline data collection
capabilities: 			 (0x7b) SMART execute Offline immediate.
					Auto Offline data collection on/off support.
					Suspend Offline collection upon new
					command.
					Offline surface scan supported.
					Self-test supported.
					Conveyance Self-test supported.
					Selective Self-test supported.
SMART capabilities:            (0x0003)	Saves SMART data before entering
					power-saving mode.
					Supports SMART auto save timer.
Error logging capability:        (0x01)	Error logging supported.
					General Purpose Logging supported.
Short self-test routine 
recommended polling time: 	 (   2) minutes.
Extended self-test routine
recommended polling time: 	 ( 311) minutes.
Conveyance self-test routine
recommended polling time: 	 (  32) minutes.
SCT capabilities: 	       (0x003f)	SCT Status supported.
					SCT Error Recovery Control supported.
					SCT Feature Control supported.
					SCT Data Table supported.

SMART Attributes Data Structure revision number: 16
Vendor Specific SMART Attributes with Thresholds:
ID# ATTRIBUTE_NAME          FLAG     VALUE WORST THRESH TYPE      UPDATED  WHEN_FAILED RAW_VALUE
  1 Raw_Read_Error_Rate     0x000f   100   100   051    Pre-fail  Always       -       0
  3 Spin_Up_Time            0x0007   072   072   011    Pre-fail  Always       -       9150
  4 Start_Stop_Count        0x0032   100   100   000    Old_age   Always       -       111
  5 Reallocated_Sector_Ct   0x0033   100   100   010    Pre-fail  Always       -       0
  7 Seek_Error_Rate         0x000f   100   100   051    Pre-fail  Always       -       0
  8 Seek_Time_Performance   0x0025   100   100   015    Pre-fail  Offline      -       0
  9 Power_On_Hours          0x0032   085   085   000    Old_age   Always       -       77168
 10 Spin_Retry_Count        0x0033   100   100   051    Pre-fail  Always       -       0
 11 Calibration_Retry_Count 0x0012   100   100   000    Old_age   Always       -       0
 12 Power_Cycle_Count       0x0032   100   100   000    Old_age   Always       -       111
 13 Read_Soft_Error_Rate    0x000e   100   100   000    Old_age   Always       -       0
183 Runtime_Bad_Block       0x0032   100   100   000    Old_age   Always       -       0
184 End-to-End_Error        0x0033   100   100   000    Pre-fail  Always       -       0
187 Reported_Uncorrect      0x0032   100   100   000    Old_age   Always       -       1
188 Command_Timeout         0x0032   100   100   000    Old_age   Always       -       0
190 Airflow_Temperature_Cel 0x0022   076   064   000    Old_age   Always       -       24 (Min/Max 24/32)
194 Temperature_Celsius     0x0022   076   063   000    Old_age   Always       -       24 (Min/Max 23/33)
195 Hardware_ECC_Recovered  0x001a   100   100   000    Old_age   Always       -       2692735490
196 Reallocated_Event_Count 0x0032   100   100   000    Old_age   Always       -       0
197 Current_Pending_Sector  0x0012   100   100   000    Old_age   Always       -       0
198 Offline_Uncorrectable   0x0030   100   100   000    Old_age   Offline      -       0
199 UDMA_CRC_Error_Count    0x003e   100   100   000    Old_age   Always       -       0
200 Multi_Zone_Error_Rate   0x000a   100   100   000    Old_age   Always       -       0
201 Soft_Read_Error_Rate    0x000a   100   100   000    Old_age   Always       -       0

SMART Error Log Version: 1
No Errors Logged

SMART Self-test log structure revision number 1
Num  Test_Description    Status                  Remaining  LifeTime(hours)  LBA_of_first_error
# 1  Extended offline    Interrupted (host reset)      90%       571         -
# 2  Extended offline    Interrupted (host reset)      90%     44830         -
# 3  Short offline       Interrupted (host reset)      90%     44830         -

SMART Selective self-test log data structure revision number 1
 SPAN  MIN_LBA  MAX_LBA  CURRENT_TEST_STATUS
    1        0        0  Not_testing
    2        0        0  Not_testing
    3        0        0  Not_testing
    4        0        0  Not_testing
    5        0        0  Not_testing
Selective self-test flags (0x0):
  After scanning selected spans, do NOT read-scan remainder of disk.
If Selective self-test is pending on power-up, resume after 0 minute delay.

