smartctl 7.3 2022-02-28 r5338 [FreeBSD 13.1-RELEASE amd64] (local build)
Copyright (C) 2002-22, Bruce Allen, Christian Franke, www.smartmontools.org

=== START OF INFORMATION SECTION ===
Model Family:     Crucial/Micron Client SSDs
Device Model:     CT480BX500SSD1
Serial Number:    --
LU WWN Device Id: 5 00a075 ...
Firmware Version: M6CR054
User Capacity:    480,103,981,056 bytes [480 GB]
Sector Size:      512 bytes logical/physical
Rotation Rate:    Solid State Device
Form Factor:      2.5 inches
TRIM Command:     Available
Device is:        In smartctl database 7.3/5319
ATA Version is:   ACS-3 T13/2161-D revision 4
SATA Version is:  SATA 3.3, 6.0 Gb/s (current: 6.0 Gb/s)
Local Time is:    Mon Mar 13 23:49:04 2023 UTC
SMART support is: Available - device has SMART capability.
SMART support is: Enabled
AAM feature is:   Unavailable
APM feature is:   Unavailable
Rd look-ahead is: Enabled
Write cache is:   Enabled
DSN feature is:   Unavailable
ATA Security is:  Disabled, frozen [SEC2]
Wt Cache Reorder: Unavailable

=== START OF READ SMART DATA SECTION ===
SMART overall-health self-assessment test result: PASSED

General SMART Values:
Offline data collection status:  (0x00)	Offline data collection activity
					was never started.
					Auto Offline Data Collection: Disabled.
Self-test execution status:      (   0)	The previous self-test routine completed
					without error or no self-test has ever 
					been run.
Total time to complete Offline 
data collection: 		(  120) seconds.
Offline data collection
capabilities: 			 (0x11) SMART execute Offline immediate.
					No Auto Offline data collection support.
					Suspend Offline collection upon new
					command.
					No Offline surface scan supported.
					Self-test supported.
					No Conveyance Self-test supported.
					No Selective Self-test supported.
SMART capabilities:            (0x0002)	Does not save SMART data before
					entering power-saving mode.
					Supports SMART auto save timer.
Error logging capability:        (0x01)	Error logging supported.
					General Purpose Logging supported.
Short self-test routine 
recommended polling time: 	 (   2) minutes.
Extended self-test routine
recommended polling time: 	 (  10) minutes.

SMART Attributes Data Structure revision number: 16
Vendor Specific SMART Attributes with Thresholds:
ID# ATTRIBUTE_NAME          FLAGS    VALUE WORST THRESH FAIL RAW_VALUE
  1 Raw_Read_Error_Rate     POSR-K   100   100   000    -    0
  5 Reallocate_NAND_Blk_Cnt -O--CK   100   100   010    -    0
  9 Power_On_Hours          -O--CK   100   100   000    -    378
 12 Power_Cycle_Count       -O--CK   100   100   000    -    171
171 Program_Fail_Count      -O--CK   100   100   000    -    0
172 Erase_Fail_Count        -O--CK   100   100   000    -    0
173 Ave_Block-Erase_Count   -O--CK   099   099   000    -    10
174 Unexpect_Power_Loss_Ct  -O--CK   100   100   000    -    8
180 Unused_Reserve_NAND_Blk PO--CK   100   100   000    -    36
183 SATA_Interfac_Downshift -O--CK   100   100   000    -    1
184 Error_Correction_Count  -O--CK   100   100   000    -    0
187 Reported_Uncorrect      -O--CK   100   100   000    -    0
194 Temperature_Celsius     -O---K   059   055   000    -    41 (Min/Max 19/45)
196 Reallocated_Event_Count -O--CK   100   100   000    -    0
197 Current_Pending_ECC_Cnt -O--CK   100   100   000    -    0
198 Offline_Uncorrectable   ----CK   100   100   000    -    0
199 UDMA_CRC_Error_Count    -O--CK   100   100   000    -    0
202 Percent_Lifetime_Remain ----CK   099   099   001    -    1
206 Write_Error_Rate        -OSR--   100   100   000    -    0
210 Success_RAIN_Recov_Cnt  -O--CK   100   100   000    -    0
246 Total_LBAs_Written      -O--CK   100   100   000    -    3051444233
247 Host_Program_Page_Count -O--CK   100   100   000    -    95357632
248 FTL_Program_Page_Count  -O--CK   100   100   000    -    44990304
249 Unkn_CrucialMicron_Attr -O--CK   100   100   000    -    0
250 Read_Error_Retry_Rate   -O--CK   100   100   000    -    0
251 Unkn_CrucialMicron_Attr -O--CK   100   100   000    -    739346702
252 Unkn_CrucialMicron_Attr -O--CK   100   100   000    -    3
253 Unkn_CrucialMicron_Attr -O--CK   100   100   000    -    0
254 Unkn_CrucialMicron_Attr -O--CK   100   100   000    -    2
223 Unkn_CrucialMicron_Attr -O--CK   100   100   000    -    0
                            ||||||_ K auto-keep
                            |||||__ C event count
                            ||||___ R error rate
                            |||____ S speed/performance
                            ||_____ O updated online
                            |______ P prefailure warning

General Purpose Log Directory Version 1
SMART           Log Directory Version 1 [multi-sector log support]
Address    Access  R/W   Size  Description
0x00       GPL,SL  R/O      1  Log Directory
0x06           SL  R/O      1  SMART self-test log
0x07       GPL     R/O      1  Extended self-test log
0x10       GPL     R/O      1  NCQ Command Error log
0x11       GPL     R/O      1  SATA Phy Event Counters log
0x24       GPL     R/O     88  Current Device Internal Status Data log
0x30       GPL,SL  R/O      9  IDENTIFY DEVICE data log
0x80-0x9f  GPL,SL  R/W     16  Host vendor specific log

SMART Extended Comprehensive Error Log (GP Log 0x03) not supported

SMART Error Log not supported

SMART Extended Self-test Log Version: 1 (1 sectors)
Num  Test_Description    Status                  Remaining  LifeTime(hours)  LBA_of_first_error
# 1  Short offline       Completed without error       00%       373         -
# 2  Short offline       Completed without error       00%       349         -
# 3  Extended offline    Completed without error       00%       342         -
# 4  Short offline       Completed without error       00%       298         -
# 5  Short offline       Completed without error       00%       291         -
# 6  Short offline       Completed without error       00%       290         -
# 7  Short offline       Completed without error       00%       279         -
# 8  Short offline       Completed without error       00%       233         -
# 9  Short offline       Completed without error       00%       230         -
#10  Short offline       Completed without error       00%       222         -
#11  Short offline       Completed without error       00%       221         -
#12  Short offline       Completed without error       00%       214         -
#13  Short offline       Completed without error       00%       197         -
#14  Short offline       Completed without error       00%       196         -
#15  Short offline       Completed without error       00%       189         -
#16  Short offline       Completed without error       00%       173         -
#17  Short offline       Completed without error       00%       170         -
#18  Short offline       Completed without error       00%       160         -
#19  Short offline       Completed without error       00%       147         -

Selective Self-tests/Logging not supported

SCT Commands not supported

Device Statistics (GP/SMART Log 0x04) not supported

Pending Defects log (GP Log 0x0c) not supported

SATA Phy Event Counters (GP Log 0x11)
ID      Size     Value  Description
0x0001  4            0  Command failed due to ICRC error
0x0002  4            0  R_ERR response for data FIS
0x0005  4            0  R_ERR response for non-data FIS
0x000a  4            8  Device-to-host register FISes sent due to a COMRESET

