smartctl 7.2 2020-12-30 r5155 [FreeBSD 12.2-RELEASE-p4 amd64] (local build)
Copyright (C) 2002-20, Bruce Allen, Christian Franke, www.smartmontools.org

=== START OF INFORMATION SECTION ===
Model Family:     Western Digital Blue
Device Model:     WDC WD5000AZLX-60K2TA0
Serial Number:    --
LU WWN Device Id: 5 0014ee ...
Firmware Version: 01.01A01
User Capacity:    500,107,862,016 bytes [500 GB]
Sector Sizes:     512 bytes logical, 4096 bytes physical
Rotation Rate:    7200 rpm
Form Factor:      3.5 inches
Device is:        In smartctl database [for details use: -P show]
ATA Version is:   ACS-3 T13/2161-D revision 5
SATA Version is:  SATA 3.1, 6.0 Gb/s (current: 6.0 Gb/s)
Local Time is:    Wed Mar 17 21:36:42 2021 CET
SMART support is: Available - device has SMART capability.
SMART support is: Enabled
AAM feature is:   Unavailable
APM level is:     128 (minimum power consumption without standby)
Rd look-ahead is: Enabled
Write cache is:   Enabled
DSN feature is:   Unavailable
ATA Security is:  Disabled, frozen [SEC2]
Wt Cache Reorder: Enabled

=== START OF READ SMART DATA SECTION ===
SMART overall-health self-assessment test result: PASSED

General SMART Values:
Offline data collection status:  (0x82)	Offline data collection activity
					was completed without error.
					Auto Offline Data Collection: Enabled.
Self-test execution status:      (   0)	The previous self-test routine completed
					without error or no self-test has ever 
					been run.
Total time to complete Offline 
data collection: 		( 5820) seconds.
Offline data collection
capabilities: 			 (0x5b) SMART execute Offline immediate.
					Auto Offline data collection on/off support.
					Suspend Offline collection upon new
					command.
					Offline surface scan supported.
					Self-test supported.
					No Conveyance Self-test supported.
					Selective Self-test supported.
SMART capabilities:            (0x0003)	Saves SMART data before entering
					power-saving mode.
					Supports SMART auto save timer.
Error logging capability:        (0x01)	Error logging supported.
					General Purpose Logging supported.
Short self-test routine 
recommended polling time: 	 (   2) minutes.
Extended self-test routine
recommended polling time: 	 (  63) minutes.
SCT capabilities: 	       (0x303d)	SCT Status supported.
					SCT Error Recovery Control supported.
					SCT Feature Control supported.
					SCT Data Table supported.

SMART Attributes Data Structure revision number: 16
Vendor Specific SMART Attributes with Thresholds:
ID# ATTRIBUTE_NAME          FLAGS    VALUE WORST THRESH FAIL RAW_VALUE
  1 Raw_Read_Error_Rate     POSR-K   200   200   051    -    0
  3 Spin_Up_Time            POS--K   181   171   021    -    1925
  4 Start_Stop_Count        -O--CK   100   100   000    -    193
  5 Reallocated_Sector_Ct   PO--CK   200   200   140    -    0
  7 Seek_Error_Rate         POSR-K   200   200   051    -    0
  9 Power_On_Hours          -O--CK   057   057   000    -    31765
 10 Spin_Retry_Count        PO--CK   100   100   051    -    0
 11 Calibration_Retry_Count -O--CK   100   100   000    -    0
 12 Power_Cycle_Count       -O--CK   100   100   000    -    191
183 Runtime_Bad_Block       -O--CK   100   100   000    -    0
184 End-to-End_Error        PO--CK   100   100   097    -    0
187 Reported_Uncorrect      -O--CK   100   100   000    -    0
188 Command_Timeout         -O--CK   100   100   000    -    0
190 Airflow_Temperature_Cel -O---K   060   054   040    -    40 (Min/Max 29/42)
192 Power-Off_Retract_Count -O--CK   200   200   000    -    55
193 Load_Cycle_Count        -O--CK   200   200   000    -    240
194 Temperature_Celsius     -O---K   103   097   000    -    40
196 Reallocated_Event_Count -O--CK   200   200   000    -    0
197 Current_Pending_Sector  -O--CK   200   200   000    -    0
198 Offline_Uncorrectable   ----CK   200   200   000    -    0
199 UDMA_CRC_Error_Count    -O--CK   200   200   000    -    0
200 Multi_Zone_Error_Rate   ---R--   200   200   000    -    0
                            ||||||_ K auto-keep
                            |||||__ C event count
                            ||||___ R error rate
                            |||____ S speed/performance
                            ||_____ O updated online
                            |______ P prefailure warning

General Purpose Log Directory Version 1
SMART           Log Directory Version 1 [multi-sector log support]
Address    Access  R/W   Size  Description
0x00       GPL,SL  R/O      1  Log Directory
0x01           SL  R/O      1  Summary SMART error log
0x02           SL  R/O      5  Comprehensive SMART error log
0x03       GPL     R/O      6  Ext. Comprehensive SMART error log
0x04       GPL,SL  R/O      8  Device Statistics log
0x06           SL  R/O      1  SMART self-test log
0x07       GPL     R/O      1  Extended self-test log
0x08       GPL     R/O      2  Power Conditions log
0x09           SL  R/W      1  Selective self-test log
0x0d       GPL,SL  R/O      8  LPS Mis-alignment log
0x10       GPL     R/O      1  NCQ Command Error log
0x11       GPL     R/O      1  SATA Phy Event Counters log
0x30       GPL,SL  R/O      9  IDENTIFY DEVICE data log
0x80-0x9f  GPL,SL  R/W     16  Host vendor specific log
0xa0-0xa7  GPL,SL  VS      16  Device vendor specific log
0xa8-0xb5  GPL,SL  VS       1  Device vendor specific log
0xb6       GPL     VS    3971  Device vendor specific log
0xb6       SL      VS       1  Device vendor specific log
0xb7       GPL,SL  VS      48  Device vendor specific log
0xbd       GPL,SL  VS       1  Device vendor specific log
0xc0       GPL,SL  VS       1  Device vendor specific log
0xc1       GPL     VS      93  Device vendor specific log
0xe0       GPL,SL  R/W      1  SCT Command/Status
0xe1       GPL,SL  R/W      1  SCT Data Transfer

SMART Extended Comprehensive Error Log Version: 1 (6 sectors)
Device Error Count: 387 (device log contains only the most recent 24 errors)
	CR     = Command Register
	FEATR  = Features Register
	COUNT  = Count (was: Sector Count) Register
	LBA_48 = Upper bytes of LBA High/Mid/Low Registers ]  ATA-8
	LH     = LBA High (was: Cylinder High) Register    ]   LBA
	LM     = LBA Mid (was: Cylinder Low) Register      ] Register
	LL     = LBA Low (was: Sector Number) Register     ]
	DV     = Device (was: Device/Head) Register
	DC     = Device Control Register
	ER     = Error register
	ST     = Status register
Powered_Up_Time is measured from power on, and printed as
DDd+hh:mm:SS.sss where DD=days, hh=hours, mm=minutes,
SS=sec, and sss=millisec. It "wraps" after 49.710 days.

Error 387 [2] occurred at disk power-on lifetime: 31322 hours (1305 days + 2 hours)
  When the command that caused the error occurred, the device was active or idle.

  After command completion occurred, registers were:
  ER -- ST COUNT  LBA_48  LH LM LL DV DC
  -- -- -- == -- == == == -- -- -- -- --
  04 -- 51 00 00 00 00 00 00 00 02 e0 00

  Commands leading to the command that caused the error were:
  CR FEATR COUNT  LBA_48  LH LM LL DV DC  Powered_Up_Time  Command/Feature_Name
  -- == -- == -- == == == -- -- -- -- --  ---------------  --------------------
  b4 00 20 00 00 00 00 46 72 4c 6b e0 00 12d+11:52:23.881  SANITIZE DEVICE
  f5 00 00 00 00 00 00 00 00 00 00 e0 00 12d+11:52:23.881  SECURITY FREEZE LOCK
  25 00 00 00 01 00 00 00 00 00 00 e0 00 12d+11:52:23.695  READ DMA EXT
  25 00 00 00 01 00 00 39 c0 00 20 e0 00 12d+11:52:23.227  READ DMA EXT
  25 00 00 00 01 00 00 00 06 40 28 e0 00 12d+11:52:23.226  READ DMA EXT

Error 386 [1] occurred at disk power-on lifetime: 31321 hours (1305 days + 1 hours)
  When the command that caused the error occurred, the device was active or idle.

  After command completion occurred, registers were:
  ER -- ST COUNT  LBA_48  LH LM LL DV DC
  -- -- -- == -- == == == -- -- -- -- --
  04 -- 51 00 00 00 00 00 00 00 02 e0 00

  Commands leading to the command that caused the error were:
  CR FEATR COUNT  LBA_48  LH LM LL DV DC  Powered_Up_Time  Command/Feature_Name
  -- == -- == -- == == == -- -- -- -- --  ---------------  --------------------
  b4 00 20 00 00 00 00 46 72 4c 6b e0 00 12d+11:44:44.113  SANITIZE DEVICE
  f5 00 00 00 00 00 00 00 00 00 00 e0 00 12d+11:44:44.113  SECURITY FREEZE LOCK
  25 00 00 00 01 00 00 00 00 00 00 e0 00 12d+11:44:43.926  READ DMA EXT
  25 00 00 00 01 00 00 39 c0 00 20 e0 00 12d+11:44:43.458  READ DMA EXT
  25 00 00 00 01 00 00 00 06 40 28 e0 00 12d+11:44:43.458  READ DMA EXT

Error 385 [0] occurred at disk power-on lifetime: 31187 hours (1299 days + 11 hours)
  When the command that caused the error occurred, the device was active or idle.

  After command completion occurred, registers were:
  ER -- ST COUNT  LBA_48  LH LM LL DV DC
  -- -- -- == -- == == == -- -- -- -- --
  04 -- 51 00 00 00 00 00 00 00 02 e0 00

  Commands leading to the command that caused the error were:
  CR FEATR COUNT  LBA_48  LH LM LL DV DC  Powered_Up_Time  Command/Feature_Name
  -- == -- == -- == == == -- -- -- -- --  ---------------  --------------------
  b4 00 20 00 00 00 00 46 72 4c 6b e0 00  6d+20:58:45.355  SANITIZE DEVICE
  f5 00 00 00 00 00 00 00 00 00 00 e0 00  6d+20:58:45.355  SECURITY FREEZE LOCK
  25 00 00 00 01 00 00 00 00 00 00 e0 00  6d+20:58:45.169  READ DMA EXT
  25 00 00 00 01 00 00 39 c0 00 20 e0 00  6d+20:58:44.701  READ DMA EXT
  25 00 00 00 01 00 00 00 06 40 28 e0 00  6d+20:58:44.701  READ DMA EXT

Error 384 [23] occurred at disk power-on lifetime: 30507 hours (1271 days + 3 hours)
  When the command that caused the error occurred, the device was active or idle.

  After command completion occurred, registers were:
  ER -- ST COUNT  LBA_48  LH LM LL DV DC
  -- -- -- == -- == == == -- -- -- -- --
  04 -- 51 00 00 00 00 00 00 00 02 e0 00

  Commands leading to the command that caused the error were:
  CR FEATR COUNT  LBA_48  LH LM LL DV DC  Powered_Up_Time  Command/Feature_Name
  -- == -- == -- == == == -- -- -- -- --  ---------------  --------------------
  b4 00 20 00 00 00 00 46 72 4c 6b e0 00 28d+06:31:10.192  SANITIZE DEVICE
  f5 00 00 00 00 00 00 00 00 00 00 e0 00 28d+06:31:10.192  SECURITY FREEZE LOCK
  25 00 00 00 01 00 00 00 00 00 00 e0 00 28d+06:31:10.005  READ DMA EXT
  25 00 00 00 01 00 00 39 c0 00 20 e0 00 28d+06:31:09.537  READ DMA EXT
  25 00 00 00 01 00 00 00 06 40 28 e0 00 28d+06:31:09.537  READ DMA EXT

Error 383 [22] occurred at disk power-on lifetime: 30506 hours (1271 days + 2 hours)
  When the command that caused the error occurred, the device was active or idle.

  After command completion occurred, registers were:
  ER -- ST COUNT  LBA_48  LH LM LL DV DC
  -- -- -- == -- == == == -- -- -- -- --
  04 -- 51 00 00 00 00 00 00 00 02 e0 00

  Commands leading to the command that caused the error were:
  CR FEATR COUNT  LBA_48  LH LM LL DV DC  Powered_Up_Time  Command/Feature_Name
  -- == -- == -- == == == -- -- -- -- --  ---------------  --------------------
  b4 00 20 00 00 00 00 46 72 4c 6b e0 00 28d+05:25:32.131  SANITIZE DEVICE
  f5 00 00 00 00 00 00 00 00 00 00 e0 00 28d+05:25:32.131  SECURITY FREEZE LOCK
  25 00 00 00 01 00 00 00 00 00 00 e0 00 28d+05:25:31.944  READ DMA EXT
  25 00 00 00 01 00 00 39 c0 00 20 e0 00 28d+05:25:31.477  READ DMA EXT
  25 00 00 00 01 00 00 00 06 40 28 e0 00 28d+05:25:31.477  READ DMA EXT

Error 382 [21] occurred at disk power-on lifetime: 30496 hours (1270 days + 16 hours)
  When the command that caused the error occurred, the device was active or idle.

  After command completion occurred, registers were:
  ER -- ST COUNT  LBA_48  LH LM LL DV DC
  -- -- -- == -- == == == -- -- -- -- --
  04 -- 51 00 00 00 00 00 00 00 02 e0 00

  Commands leading to the command that caused the error were:
  CR FEATR COUNT  LBA_48  LH LM LL DV DC  Powered_Up_Time  Command/Feature_Name
  -- == -- == -- == == == -- -- -- -- --  ---------------  --------------------
  b4 00 20 00 00 00 00 46 72 4c 6b e0 00 27d+19:04:36.235  SANITIZE DEVICE
  f5 00 00 00 00 00 00 00 00 00 00 e0 00 27d+19:04:36.235  SECURITY FREEZE LOCK
  25 00 00 00 01 00 00 00 00 00 00 e0 00 27d+19:04:36.049  READ DMA EXT
  25 00 00 00 01 00 00 39 c0 00 20 e0 00 27d+19:04:35.580  READ DMA EXT
  25 00 00 00 01 00 00 00 06 40 28 e0 00 27d+19:04:35.580  READ DMA EXT

Error 381 [20] occurred at disk power-on lifetime: 28639 hours (1193 days + 7 hours)
  When the command that caused the error occurred, the device was active or idle.

  After command completion occurred, registers were:
  ER -- ST COUNT  LBA_48  LH LM LL DV DC
  -- -- -- == -- == == == -- -- -- -- --
  04 -- 51 00 00 00 00 00 00 00 02 e0 00

  Commands leading to the command that caused the error were:
  CR FEATR COUNT  LBA_48  LH LM LL DV DC  Powered_Up_Time  Command/Feature_Name
  -- == -- == -- == == == -- -- -- -- --  ---------------  --------------------
  b4 00 20 00 00 00 00 46 72 4c 6b e0 00     03:08:51.683  SANITIZE DEVICE
  f5 00 00 00 00 00 00 00 00 00 00 e0 00     03:08:51.683  SECURITY FREEZE LOCK
  25 00 00 00 01 00 00 00 00 00 00 e0 00     03:08:51.503  READ DMA EXT
  25 00 00 00 01 00 00 39 c0 00 20 e0 00     03:08:51.048  READ DMA EXT
  25 00 00 00 01 00 00 00 06 40 28 e0 00     03:08:51.047  READ DMA EXT

Error 380 [19] occurred at disk power-on lifetime: 28638 hours (1193 days + 6 hours)
  When the command that caused the error occurred, the device was active or idle.

  After command completion occurred, registers were:
  ER -- ST COUNT  LBA_48  LH LM LL DV DC
  -- -- -- == -- == == == -- -- -- -- --
  04 -- 51 00 00 00 00 00 00 00 02 e0 00

  Commands leading to the command that caused the error were:
  CR FEATR COUNT  LBA_48  LH LM LL DV DC  Powered_Up_Time  Command/Feature_Name
  -- == -- == -- == == == -- -- -- -- --  ---------------  --------------------
  b4 00 20 00 00 00 00 46 72 4c 6b e0 00     02:29:50.583  SANITIZE DEVICE
  f5 00 00 00 00 00 00 00 00 00 00 e0 00     02:29:50.583  SECURITY FREEZE LOCK
  25 00 00 00 01 00 00 00 00 00 00 e0 00     02:29:50.404  READ DMA EXT
  25 00 00 00 01 00 00 39 c0 00 20 e0 00     02:29:49.948  READ DMA EXT
  25 00 00 00 01 00 00 00 06 40 28 e0 00     02:29:49.948  READ DMA EXT

SMART Extended Self-test Log Version: 1 (1 sectors)
Num  Test_Description    Status                  Remaining  LifeTime(hours)  LBA_of_first_error
# 1  Short offline       Completed without error       00%         0         -

SMART Selective self-test log data structure revision number 1
 SPAN  MIN_LBA  MAX_LBA  CURRENT_TEST_STATUS
    1        0        0  Not_testing
    2        0        0  Not_testing
    3        0        0  Not_testing
    4        0        0  Not_testing
    5        0        0  Not_testing
Selective self-test flags (0x0):
  After scanning selected spans, do NOT read-scan remainder of disk.
If Selective self-test is pending on power-up, resume after 0 minute delay.

SCT Status Version:                  3
SCT Version (vendor specific):       258 (0x0102)
Device State:                        Active (0)
Current Temperature:                    40 Celsius
Power Cycle Min/Max Temperature:     29/42 Celsius
Lifetime    Min/Max Temperature:     23/46 Celsius
Under/Over Temperature Limit Count:   0/0
Vendor specific:
01 00 00 00 00 00 00 00 00 00 00 00 00 00 00 00
00 00 00 00 00 00 00 00 00 00 00 00 00 00 00 00

SCT Temperature History Version:     2
Temperature Sampling Period:         1 minute
Temperature Logging Interval:        1 minute
Min/Max recommended Temperature:      0/60 Celsius
Min/Max Temperature Limit:           -41/85 Celsius
Temperature History Size (Index):    128 (82)

SCT Error Recovery Control:
           Read:     85 (8.5 seconds)
          Write:     85 (8.5 seconds)

Device Statistics (GP Log 0x04)
Page  Offset Size        Value Flags Description
0x01  =====  =               =  ===  == General Statistics (rev 1) ==
0x01  0x008  4             191  ---  Lifetime Power-On Resets
0x01  0x010  4           31765  ---  Power-on Hours
0x01  0x018  6     75103724418  ---  Logical Sectors Written
0x01  0x020  6      1096562635  ---  Number of Write Commands
0x01  0x028  6     64007860179  ---  Logical Sectors Read
0x01  0x030  6      1435352796  ---  Number of Read Commands
0x01  0x038  6      2684850304  ---  Date and Time TimeStamp
0x03  =====  =               =  ===  == Rotating Media Statistics (rev 1) ==
0x03  0x008  4           30257  ---  Spindle Motor Power-on Hours
0x03  0x010  4           30168  ---  Head Flying Hours
0x03  0x018  4             296  ---  Head Load Events
0x03  0x020  4               0  ---  Number of Reallocated Logical Sectors
0x03  0x028  4              64  ---  Read Recovery Attempts
0x03  0x030  4               0  ---  Number of Mechanical Start Failures
0x03  0x038  4               0  ---  Number of Realloc. Candidate Logical Sectors
0x03  0x040  4              55  ---  Number of High Priority Unload Events
0x04  =====  =               =  ===  == General Errors Statistics (rev 1) ==
0x04  0x008  4               0  ---  Number of Reported Uncorrectable Errors
0x04  0x010  4               0  ---  Resets Between Cmd Acceptance and Completion
0x05  =====  =               =  ===  == Temperature Statistics (rev 1) ==
0x05  0x008  1              40  ---  Current Temperature
0x05  0x010  1              40  ---  Average Short Term Temperature
0x05  0x018  1              38  ---  Average Long Term Temperature
0x05  0x020  1              46  ---  Highest Temperature
0x05  0x028  1              28  ---  Lowest Temperature
0x05  0x030  1              42  ---  Highest Average Short Term Temperature
0x05  0x038  1              31  ---  Lowest Average Short Term Temperature
0x05  0x040  1              39  ---  Highest Average Long Term Temperature
0x05  0x048  1              32  ---  Lowest Average Long Term Temperature
0x05  0x050  4               0  ---  Time in Over-Temperature
0x05  0x058  1              60  ---  Specified Maximum Operating Temperature
0x05  0x060  4               0  ---  Time in Under-Temperature
0x05  0x068  1               0  ---  Specified Minimum Operating Temperature
0x06  =====  =               =  ===  == Transport Statistics (rev 1) ==
0x06  0x008  4            1149  ---  Number of Hardware Resets
0x06  0x010  4             882  ---  Number of ASR Events
0x06  0x018  4               0  ---  Number of Interface CRC Errors
                                |||_ C monitored condition met
                                ||__ D supports DSN
                                |___ N normalized value

Pending Defects log (GP Log 0x0c) not supported

SATA Phy Event Counters (GP Log 0x11)
ID      Size     Value  Description
0x0001  2            0  Command failed due to ICRC error
0x0002  2            0  R_ERR response for data FIS
0x0003  2            0  R_ERR response for device-to-host data FIS
0x0004  2            0  R_ERR response for host-to-device data FIS
0x0005  2            0  R_ERR response for non-data FIS
0x0006  2            0  R_ERR response for device-to-host non-data FIS
0x0007  2            0  R_ERR response for host-to-device non-data FIS
0x0008  2            0  Device-to-host non-data FIS retries
0x0009  2           50  Transition from drive PhyRdy to drive PhyNRdy
0x000a  2           51  Device-to-host register FISes sent due to a COMRESET
0x000b  2            0  CRC errors within host-to-device FIS
0x000d  2            0  Non-CRC errors within host-to-device FIS
0x000f  2            0  R_ERR response for host-to-device data FIS, CRC
0x0012  2            0  R_ERR response for host-to-device non-data FIS, CRC
0x8000  4     11265691  Vendor specific



