smartctl 7.4 2023-08-01 r5530 [OpenBSD 7.5 amd64] (local build)
Copyright (C) 2002-23, Bruce Allen, Christian Franke, www.smartmontools.org

=== START OF INFORMATION SECTION ===
Model Family:     Phison Driven SSDs
Device Model:     Patriot Burst
Serial Number:    --
LU WWN Device Id: 0 000000 ...
Firmware Version: SBFM91.2
User Capacity:    120,034,123,776 bytes [120 GB]
Sector Size:      512 bytes logical/physical
Rotation Rate:    Solid State Device
Form Factor:      2.5 inches
TRIM Command:     Available
Device is:        In smartctl database 7.3/5528
ATA Version is:   ACS-4 (minor revision not indicated)
SATA Version is:  SATA 3.2, 6.0 Gb/s (current: 6.0 Gb/s)
Local Time is:    Sat Jun 15 21:07:12 2024 CEST
SMART support is: Available - device has SMART capability.
SMART support is: Enabled

=== START OF READ SMART DATA SECTION ===
SMART Status not supported: Incomplete response, ATA output registers missing
SMART overall-health self-assessment test result: PASSED
Warning: This result is based on an Attribute check.

General SMART Values:
Offline data collection status:  (0x00)	Offline data collection activity
					was never started.
					Auto Offline Data Collection: Disabled.
Self-test execution status:      (   0)	The previous self-test routine completed
					without error or no self-test has ever 
					been run.
Total time to complete Offline 
data collection: 		(65535) seconds.
Offline data collection
capabilities: 			 (0x79) SMART execute Offline immediate.
					No Auto Offline data collection support.
					Suspend Offline collection upon new
					command.
					Offline surface scan supported.
					Self-test supported.
					Conveyance Self-test supported.
					Selective Self-test supported.
SMART capabilities:            (0x0003)	Saves SMART data before entering
					power-saving mode.
					Supports SMART auto save timer.
Error logging capability:        (0x01)	Error logging supported.
					General Purpose Logging supported.
Short self-test routine 
recommended polling time: 	 (   2) minutes.
Extended self-test routine
recommended polling time: 	 (  30) minutes.
Conveyance self-test routine
recommended polling time: 	 (   6) minutes.

SMART Attributes Data Structure revision number: 16
Vendor Specific SMART Attributes with Thresholds:
ID# ATTRIBUTE_NAME          FLAG     VALUE WORST THRESH TYPE      UPDATED  WHEN_FAILED RAW_VALUE
  1 Raw_Read_Error_Rate     0x000b   100   100   050    Pre-fail  Always       -       0
  9 Power_On_Hours          0x0012   100   100   000    Old_age   Always       -       19776
 12 Power_Cycle_Count       0x0012   100   100   000    Old_age   Always       -       1568
168 SATA_Phy_Error_Count    0x0012   100   100   000    Old_age   Always       -       0
170 Bad_Blk_Ct_Lat/Erl      0x0003   091   091   000    Pre-fail  Always       -       0/179
173 MaxAvgErase_Ct          0x0012   100   100   000    Old_age   Always       -       73 (Average 70)
192 Unsafe_Shutdown_Count   0x0012   100   100   000    Old_age   Always       -       208
194 Temperature_Celsius     0x0023   067   067   000    Pre-fail  Always       -       33 (Min/Max 33/33)
218 CRC_Error_Count         0x000b   100   100   050    Pre-fail  Always       -       0
231 SSD_Life_Left           0x0013   100   100   000    Pre-fail  Always       -       97
241 Lifetime_Writes_GiB     0x0012   100   100   000    Old_age   Always       -       4964

SMART Error Log Version: 1
No Errors Logged

SMART Self-test log structure revision number 1
Num  Test_Description    Status                  Remaining  LifeTime(hours)  LBA_of_first_error
# 1  Short offline       Completed without error       00%     19771         -
# 2  Short offline       Completed without error       00%     19764         -
# 3  Short offline       Completed without error       00%     19755         -
# 4  Short offline       Completed without error       00%     19739         -
# 5  Short offline       Completed without error       00%     19731         -
# 6  Short offline       Completed without error       00%     19722         -
# 7  Short offline       Completed without error       00%     19698         -
# 8  Extended offline    Completed without error       00%     19696         -
# 9  Short offline       Completed without error       00%     19691         -
#10  Short offline       Completed without error       00%     19682         -
#11  Short offline       Completed without error       00%     19675         -
#12  Short offline       Completed without error       00%     19651         -
#13  Short offline       Completed without error       00%     19640         -
#14  Short offline       Completed without error       00%     19631         -
#15  Short offline       Completed without error       00%     19629         -
#16  Short offline       Completed without error       00%     19624         -
#17  Short offline       Completed without error       00%     19615         -
#18  Short offline       Completed without error       00%     19601         -
#19  Short offline       Completed without error       00%     19596         -
#20  Short offline       Completed without error       00%     19592         -
#21  Short offline       Completed without error       00%     19591         -

SMART Selective self-test log data structure revision number 0
Note: revision number not 1 implies that no selective self-test has ever been run
 SPAN  MIN_LBA  MAX_LBA  CURRENT_TEST_STATUS
    1        0        0  Not_testing
    2        0        0  Not_testing
    3        0        0  Not_testing
    4        0        0  Not_testing
    5        0        0  Not_testing
Selective self-test flags (0x0):
  After scanning selected spans, do NOT read-scan remainder of disk.
If Selective self-test is pending on power-up, resume after 0 minute delay.

The above only provides legacy SMART information - try 'smartctl -x' for more



