smartctl 7.4 2023-08-01 r5530 [FreeBSD 13.2-RELEASE-p10 amd64] (local build)
Copyright (C) 2002-23, Bruce Allen, Christian Franke, www.smartmontools.org

=== START OF INFORMATION SECTION ===
Model Family:     SandForce Driven SSDs
Device Model:     KINGSTON SMS200S3120G
Serial Number:    --
LU WWN Device Id: 5 0026b7 ...
Firmware Version: 60AABBF0
User Capacity:    120,034,123,776 bytes [120 GB]
Sector Size:      512 bytes logical/physical
Rotation Rate:    Solid State Device
TRIM Command:     Available
Device is:        In smartctl database 7.3/5528
ATA Version is:   ATA8-ACS, ACS-2 T13/2015-D revision 3
SATA Version is:  SATA 3.0, 6.0 Gb/s (current: 6.0 Gb/s)
Local Time is:    Mon Apr  1 21:37:08 2024 CEST
SMART support is: Available - device has SMART capability.
SMART support is: Enabled
AAM feature is:   Unavailable
APM level is:     254 (maximum performance)
Rd look-ahead is: Enabled
Write cache is:   Enabled
DSN feature is:   Unavailable
ATA Security is:  Disabled, NOT FROZEN [SEC1]
Wt Cache Reorder: Unavailable

=== START OF READ SMART DATA SECTION ===
SMART overall-health self-assessment test result: PASSED

General SMART Values:
Offline data collection status:  (0x02)	Offline data collection activity
					was completed without error.
					Auto Offline Data Collection: Disabled.
Self-test execution status:      (   0)	The previous self-test routine completed
					without error or no self-test has ever 
					been run.
Total time to complete Offline 
data collection: 		(    0) seconds.
Offline data collection
capabilities: 			 (0x7d) SMART execute Offline immediate.
					No Auto Offline data collection support.
					Abort Offline collection upon new
					command.
					Offline surface scan supported.
					Self-test supported.
					Conveyance Self-test supported.
					Selective Self-test supported.
SMART capabilities:            (0x0003)	Saves SMART data before entering
					power-saving mode.
					Supports SMART auto save timer.
Error logging capability:        (0x01)	Error logging supported.
					General Purpose Logging supported.
Short self-test routine 
recommended polling time: 	 (   1) minutes.
Extended self-test routine
recommended polling time: 	 (  48) minutes.
Conveyance self-test routine
recommended polling time: 	 (   2) minutes.
SCT capabilities: 	       (0x0025)	SCT Status supported.
					SCT Data Table supported.

SMART Attributes Data Structure revision number: 10
Vendor Specific SMART Attributes with Thresholds:
ID# ATTRIBUTE_NAME          FLAGS    VALUE WORST THRESH FAIL RAW_VALUE
  1 Raw_Read_Error_Rate     -O--CK   095   095   050    -    2/17536330
  5 Retired_Block_Count     PO--CK   100   100   003    -    0
  9 Power_On_Hours_and_Msec -O--CK   067   067   000    -    29414h+35m+19.320s
 12 Power_Cycle_Count       -O--CK   100   100   000    -    84
171 Program_Fail_Count      -O-R--   100   100   000    -    0
172 Erase_Fail_Count        -O--CK   100   100   000    -    0
174 Unexpect_Power_Loss_Ct  ----CK   000   000   000    -    76
177 Wear_Range_Delta        ------   000   000   000    -    3
181 Program_Fail_Count      -O-R--   100   100   000    -    0
182 Erase_Fail_Count        -O--CK   100   100   000    -    0
187 Reported_Uncorrect      -O--C-   100   100   000    -    0
189 Airflow_Temperature_Cel ------   051   062   000    -    51 (Min/Max 11/62)
194 Temperature_Celsius     -O---K   051   062   000    -    51 (Min/Max 11/62)
195 ECC_Uncorr_Error_Count  --SRC-   104   104   000    -    2/17536330
196 Reallocated_Event_Count PO--CK   100   100   003    -    0
201 Unc_Soft_Read_Err_Rate  --SRC-   104   104   000    -    2/17536330
204 Soft_ECC_Correct_Rate   --SRC-   104   104   000    -    2/17536330
230 Life_Curve_Status       PO--C-   100   100   000    -    100
231 SSD_Life_Left           ------   096   096   011    -    141733920769
233 SandForce_Internal      -O--CK   000   000   000    -    18396
234 SandForce_Internal      -O--CK   000   000   000    -    12447
241 Lifetime_Writes_GiB     -O--CK   000   000   000    -    12447
242 Lifetime_Reads_GiB      -O--CK   000   000   000    -    63
244 Unknown_Attribute       ------   097   097   010    -    9568358
                            ||||||_ K auto-keep
                            |||||__ C event count
                            ||||___ R error rate
                            |||____ S speed/performance
                            ||_____ O updated online
                            |______ P prefailure warning

General Purpose Log Directory Version 1
SMART           Log Directory Version 1 [multi-sector log support]
Address    Access  R/W   Size  Description
0x00       GPL,SL  R/O      1  Log Directory
0x04       GPL,SL  R/O      6  Device Statistics log
0x06           SL  R/O      1  SMART self-test log
0x07       GPL     R/O      1  Extended self-test log
0x09           SL  R/W      1  Selective self-test log
0x10       GPL     R/O      1  NCQ Command Error log
0x11       GPL     R/O      1  SATA Phy Event Counters log
0x80-0x9f  GPL,SL  R/W     16  Host vendor specific log
0xb7       GPL,SL  VS      16  Device vendor specific log
0xe0       GPL,SL  R/W      1  SCT Command/Status
0xe1       GPL,SL  R/W      1  SCT Data Transfer

SMART Extended Comprehensive Error Log (GP Log 0x03) not supported

SMART Error Log not supported

SMART Extended Self-test Log Version: 1 (1 sectors)
Num  Test_Description    Status                  Remaining  LifeTime(hours)  LBA_of_first_error
# 1  Short offline       Completed without error       00%     26298         -
# 2  Short offline       Completed without error       00%     25150         -

SMART Selective self-test log data structure revision number 1
 SPAN  MIN_LBA  MAX_LBA  CURRENT_TEST_STATUS
    1        0        0  Not_testing
    2        0        0  Not_testing
    3        0        0  Not_testing
    4        0        0  Not_testing
    5        0        0  Not_testing
Selective self-test flags (0x0):
  After scanning selected spans, do NOT read-scan remainder of disk.
If Selective self-test is pending on power-up, resume after 0 minute delay.

SCT Status Version:                  3
SCT Version (vendor specific):       0 (0x0000)
Device State:                        Active (0)
Current Temperature:                    51 Celsius
Power Cycle Min/Max Temperature:     11/62 Celsius
Lifetime    Min/Max Temperature:     11/62 Celsius
Under/Over Temperature Limit Count:   0/0

SCT Temperature History Version:     2
Temperature Sampling Period:         1 minute
Temperature Logging Interval:        10 minutes
Min/Max recommended Temperature:      0/70 Celsius
Min/Max Temperature Limit:            0/80 Celsius
Temperature History Size (Index):    478 (266)

SCT Error Recovery Control command not supported

Device Statistics (GP Log 0x04)
Page  Offset Size        Value Flags Description
0x01  =====  =               =  ===  == General Statistics (rev 2) ==
0x01  0x008  4              84  ---  Lifetime Power-On Resets
0x01  0x010  4           29414  ---  Power-on Hours
0x01  0x018  6     26104279852  ---  Logical Sectors Written
0x01  0x028  6       133536942  ---  Logical Sectors Read
0x04  =====  =               =  ===  == General Errors Statistics (rev 1) ==
0x04  0x008  4             142  ---  Number of Reported Uncorrectable Errors
0x04  0x010  4               0  ---  Resets Between Cmd Acceptance and Completion
0x05  =====  =               =  ===  == Temperature Statistics (rev 1) ==
0x05  0x008  1              51  ---  Current Temperature
0x05  0x010  1              46  ---  Average Short Term Temperature
0x05  0x018  1              45  ---  Average Long Term Temperature
0x05  0x020  1              61  ---  Highest Temperature
0x05  0x028  1            -128  ---  Lowest Temperature
0x05  0x030  1              57  ---  Highest Average Short Term Temperature
0x05  0x038  1              41  ---  Lowest Average Short Term Temperature
0x05  0x040  1              55  ---  Highest Average Long Term Temperature
0x05  0x048  1              44  ---  Lowest Average Long Term Temperature
0x05  0x050  4               0  ---  Time in Over-Temperature
0x05  0x058  1              70  ---  Specified Maximum Operating Temperature
0x05  0x060  4             100  ---  Time in Under-Temperature
0x05  0x068  1               0  ---  Specified Minimum Operating Temperature
0x06  =====  =               =  ===  == Transport Statistics (rev 1) ==
0x06  0x008  4               0  ---  Number of Hardware Resets
0x06  0x010  4             690  ---  Number of ASR Events
0x06  0x018  4               0  ---  Number of Interface CRC Errors
0x07  =====  =               =  ===  == Solid State Device Statistics (rev 1) ==
0x07  0x008  1               3  ---  Percentage Used Endurance Indicator
                                |||_ C monitored condition met
                                ||__ D supports DSN
                                |___ N normalized value

Pending Defects log (GP Log 0x0c) not supported

SATA Phy Event Counters (GP Log 0x11)
ID      Size     Value  Description
0x0001  2            0  Command failed due to ICRC error
0x0003  2            0  R_ERR response for device-to-host data FIS
0x0004  2            0  R_ERR response for host-to-device data FIS
0x0006  2            0  R_ERR response for device-to-host non-data FIS
0x0007  2            0  R_ERR response for host-to-device non-data FIS
0x0008  2            0  Device-to-host non-data FIS retries
0x0009  2           45  Transition from drive PhyRdy to drive PhyNRdy
0x000a  2           43  Device-to-host register FISes sent due to a COMRESET
0x000f  2            0  R_ERR response for host-to-device data FIS, CRC
0x0010  2            0  R_ERR response for host-to-device data FIS, non-CRC
0x0012  2            0  R_ERR response for host-to-device non-data FIS, CRC
0x0013  2            0  R_ERR response for host-to-device non-data FIS, non-CRC
0x0002  2            0  R_ERR response for data FIS
0x0005  2            0  R_ERR response for non-data FIS
0x000b  2            0  CRC errors within host-to-device FIS
0x000d  2            0  Non-CRC errors within host-to-device FIS

