smartctl 7.2 2020-12-30 r5155 [OpenBSD 7.0 amd64] (local build)
Copyright (C) 2002-20, Bruce Allen, Christian Franke, www.smartmontools.org

=== START OF INFORMATION SECTION ===
Model Family:     Toshiba 2.5" HDD MK..76GSX
Device Model:     TOSHIBA MK5076GSX
Serial Number:    --
LU WWN Device Id: 5 000039 ...
Firmware Version: GS001C
User Capacity:    500,107,862,016 bytes [500 GB]
Sector Size:      512 bytes logical/physical
Rotation Rate:    5400 rpm
Form Factor:      2.5 inches
Device is:        In smartctl database [for details use: -P show]
ATA Version is:   ATA8-ACS (minor revision not indicated)
SATA Version is:  SATA 2.6, 3.0 Gb/s (current: 3.0 Gb/s)
Local Time is:    Sun Dec  3 20:41:33 2023 CET
SMART support is: Available - device has SMART capability.
SMART support is: Enabled

=== START OF READ SMART DATA SECTION ===
SMART Status not supported: Incomplete response, ATA output registers missing
SMART overall-health self-assessment test result: PASSED
Warning: This result is based on an Attribute check.

General SMART Values:
Offline data collection status:  (0x82)	Offline data collection activity
					was completed without error.
					Auto Offline Data Collection: Enabled.
Self-test execution status:      (  20)	The self-test routine was aborted by
					the host.
Total time to complete Offline 
data collection: 		(  120) seconds.
Offline data collection
capabilities: 			 (0x51) SMART execute Offline immediate.
					No Auto Offline data collection support.
					Suspend Offline collection upon new
					command.
					No Offline surface scan supported.
					Self-test supported.
					No Conveyance Self-test supported.
					Selective Self-test supported.
SMART capabilities:            (0x0003)	Saves SMART data before entering
					power-saving mode.
					Supports SMART auto save timer.
Error logging capability:        (0x01)	Error logging supported.
					General Purpose Logging supported.
Short self-test routine 
recommended polling time: 	 (   2) minutes.
Extended self-test routine
recommended polling time: 	 ( 140) minutes.
SCT capabilities: 	       (0x003f)	SCT Status supported.
					SCT Error Recovery Control supported.
					SCT Feature Control supported.
					SCT Data Table supported.

SMART Attributes Data Structure revision number: 16
Vendor Specific SMART Attributes with Thresholds:
ID# ATTRIBUTE_NAME          FLAG     VALUE WORST THRESH TYPE      UPDATED  WHEN_FAILED RAW_VALUE
  1 Raw_Read_Error_Rate     0x002f   100   100   050    Pre-fail  Always       -       0
  2 Throughput_Performance  0x0027   100   100   050    Pre-fail  Always       -       0
  3 Spin_Up_Time            0x0023   100   100   002    Pre-fail  Always       -       2081
  4 Start_Stop_Count        0x0032   100   100   000    Old_age   Always       -       7903
  5 Reallocated_Sector_Ct   0x0033   100   100   010    Pre-fail  Always       -       0
  7 Seek_Error_Rate         0x002f   100   100   050    Pre-fail  Always       -       0
  8 Seek_Time_Performance   0x0025   100   100   050    Pre-fail  Offline      -       0
  9 Power_On_Minutes        0x0032   094   094   000    Old_age   Always       -       42h+59m
 10 Spin_Retry_Count        0x0033   253   100   030    Pre-fail  Always       -       0
 12 Power_Cycle_Count       0x0032   100   100   000    Old_age   Always       -       7864
183 Runtime_Bad_Block       0x0032   100   100   001    Old_age   Always       -       0
184 End-to-End_Error        0x0033   100   100   097    Pre-fail  Always       -       0
185 Unknown_Attribute       0x0032   100   100   001    Old_age   Always       -       65535
187 Reported_Uncorrect      0x0032   100   100   000    Old_age   Always       -       0
188 Command_Timeout         0x0032   100   098   000    Old_age   Always       -       5
189 High_Fly_Writes         0x003a   100   100   001    Old_age   Always       -       0
190 Airflow_Temperature_Cel 0x0022   059   050   040    Old_age   Always       -       41 (Min/Max 24/42)
191 G-Sense_Error_Rate      0x0032   100   100   000    Old_age   Always       -       208
192 Power-Off_Retract_Count 0x0022   100   100   000    Old_age   Always       -       1769499
193 Load_Cycle_Count        0x0032   098   098   000    Old_age   Always       -       24459
196 Reallocated_Event_Count 0x0032   100   100   000    Old_age   Always       -       0
197 Current_Pending_Sector  0x0032   100   100   000    Old_age   Always       -       0
199 UDMA_CRC_Error_Count    0x0032   200   200   000    Old_age   Always       -       0

SMART Error Log Version: 1
No Errors Logged

SMART Self-test log structure revision number 1
Num  Test_Description    Status                  Remaining  LifeTime(hours)  LBA_of_first_error
# 1  Short offline       Aborted by host               40%      2024         -
# 2  Short offline       Completed without error       00%      2023         -
# 3  Short offline       Completed without error       00%      1830         -
# 4  Short offline       Completed without error       00%      1829         -
# 5  Short offline       Completed without error       00%      1828         -
# 6  Short offline       Completed without error       00%      1734         -
# 7  Short offline       Completed without error       00%      1733         -
# 8  Short offline       Completed without error       00%      1441         -
# 9  Short offline       Completed without error       00%      1439         -
#10  Short offline       Completed without error       00%      1438         -
#11  Short offline       Aborted by host               30%      1438         -
#12  Short offline       Completed without error       00%      1438         -
#13  Short offline       Completed without error       00%      1438         -
#14  Short offline       Completed without error       00%      1435         -
#15  Short offline       Completed without error       00%      1434         -
#16  Short offline       Aborted by host               30%      1422         -
#17  Short offline       Completed without error       00%      1419         -
#18  Short offline       Aborted by host               20%      1417         -

SMART Selective self-test log data structure revision number 1
 SPAN  MIN_LBA  MAX_LBA  CURRENT_TEST_STATUS
    1        0        0  Not_testing
    2        0        0  Not_testing
    3        0        0  Not_testing
    4        0        0  Not_testing
    5        0        0  Not_testing
Selective self-test flags (0x0):
  After scanning selected spans, do NOT read-scan remainder of disk.
If Selective self-test is pending on power-up, resume after 0 minute delay.

