smartctl 7.3 2022-02-28 r5338 [FreeBSD 13.1-RELEASE amd64] (local build)
Copyright (C) 2002-22, Bruce Allen, Christian Franke, www.smartmontools.org

=== START OF INFORMATION SECTION ===
Model Number:                       KINGSTON RBUSNS8154P3512GJ1
Serial Number:                      --
Firmware Version:                   E8FK12.3
PCI Vendor/Subsystem ID:            0x2646
IEEE OUI Identifier:                0x0026b7
Total NVM Capacity:                 512,110,190,592 [512 GB]
Unallocated NVM Capacity:           0
Controller ID:                      0
NVMe Version:                       1.2
Number of Namespaces:               1
Namespace 1 Size/Capacity:          512,110,190,592 [512 GB]
Namespace 1 Formatted LBA Size:     512
Namespace 1 IEEE EUI-64:            0026b7 ...
Local Time is:                      Sat Mar 11 20:18:02 2023 UTC
Firmware Updates (0x12):            1 Slot, no Reset required
Optional Admin Commands (0x0007):   Security Format Frmw_DL
Optional NVM Commands (0x001e):     Wr_Unc DS_Mngmt Wr_Zero Sav/Sel_Feat
Log Page Attributes (0x04):         Ext_Get_Lg
Maximum Data Transfer Size:         512 Pages
Warning  Comp. Temp. Threshold:     84 Celsius
Critical Comp. Temp. Threshold:     88 Celsius

Supported Power States
St Op     Max   Active     Idle   RL RT WL WT  Ent_Lat  Ex_Lat
 0 +     7.90W  0.0790W       -    0  0  0  0      600     600
 1 +     7.90W  0.0790W       -    0  0  0  0      600     600
 2 +     7.90W  0.0790W       -    0  0  0  0      600     600
 3 -   0.1000W  0.0790W       -    3  3  3  3     1000    1000
 4 -   0.0050W  0.0790W       -    4  4  4  4   400000   90000

Supported LBA Sizes (NSID 0x1)
Id Fmt  Data  Metadt  Rel_Perf
 0 +     512       0         1
 1 -    4096       0         0

=== START OF SMART DATA SECTION ===
SMART overall-health self-assessment test result: PASSED

SMART/Health Information (NVMe Log 0x02)
Critical Warning:                   0x00
Temperature:                        35 Celsius
Available Spare:                    100%
Available Spare Threshold:          10%
Percentage Used:                    7%
Data Units Read:                    18,964,540 [9.70 TB]
Data Units Written:                 73,085,250 [37.4 TB]
Host Read Commands:                 233,272,138
Host Write Commands:                724,745,988
Controller Busy Time:               1,468
Power Cycles:                       695
Power On Hours:                     15,703
Unsafe Shutdowns:                   218
Media and Data Integrity Errors:    0
Error Information Log Entries:      12,020
Warning  Comp. Temperature Time:    0
Critical Comp. Temperature Time:    0
Temperature Sensor 2:               35 Celsius

Error Information (NVMe Log 0x01, 16 of 16 entries)
Num   ErrCount  SQId   CmdId  Status  PELoc          LBA  NSID    VS
  0      12020     0  0x000a  0x0004      -   4009754624     1     -
  1      12019     0  0x5009  0x0005      -            6     0     -
  2      12018     0  0x0009  0x0005      -           12     0     -
  3      12017     0  0x000a  0x0004      -   4009754624     1     -
  4      12016     0  0x000c  0x0005      -            6     0     -
  5      12015     0  0x0005  0x0005      -           12     0     -
  6      12014     0  0x000a  0x0004      -   4009754624     1     -
  7      12013     0  0x5014  0x0005      -            6     0     -
  8      12012     0  0x0015  0x0005      -           12     0     -
  9      12011     0  0x000a  0x0004      -   4009754624     1     -
 10      12010     0  0x0018  0x0005      -            6     0     -
 11      12009     0  0x0015  0x0005      -           12     0     -
 12      12008     0  0x000a  0x0004      -   4009754624     1     -
 13      12007     0  0x5000  0x0005      -            6     0     -
 14      12006     0  0x0001  0x0005      -           12     0     -
 15      12005     0  0x000a  0x0004      -   4009754624     1     -

