smartctl 7.1 2019-12-30 r5022 [FreeBSD 12.2-RELEASE amd64] (local build)
Copyright (C) 2002-19, Bruce Allen, Christian Franke, www.smartmontools.org

=== START OF INFORMATION SECTION ===
Model Number:                       SAMSUNG MZVLV256HCHP-00000
Serial Number:                      --
Firmware Version:                   BXV7000Q
PCI Vendor/Subsystem ID:            0x144d
IEEE OUI Identifier:                0x002538
Controller ID:                      1
Number of Namespaces:               1
Namespace 1 Size/Capacity:          256,060,514,304 [256 GB]
Namespace 1 Utilization:            27,566,579,712 [27.5 GB]
Namespace 1 Formatted LBA Size:     512
Local Time is:                      Mon Dec  7 00:59:04 2020 CET
Firmware Updates (0x06):            3 Slots
Optional Admin Commands (0x0007):   Security Format Frmw_DL
Optional NVM Commands (0x001f):     Comp Wr_Unc DS_Mngmt Wr_Zero Sav/Sel_Feat
Maximum Data Transfer Size:         32 Pages

Supported Power States
St Op     Max   Active     Idle   RL RT WL WT  Ent_Lat  Ex_Lat
 0 +     6.00W       -        -    0  0  0  0        5       5
 1 +     4.20W       -        -    1  1  1  1       30      30
 2 +     3.10W       -        -    2  2  2  2      100     100
 3 -   0.0700W       -        -    3  3  3  3      500    5000
 4 -   0.0050W       -        -    4  4  4  4     2000   22000

Supported LBA Sizes (NSID 0x1)
Id Fmt  Data  Metadt  Rel_Perf
 0 +     512       0         0

=== START OF SMART DATA SECTION ===
SMART overall-health self-assessment test result: PASSED

SMART/Health Information (NVMe Log 0x02)
Critical Warning:                   0x00
Temperature:                        39 Celsius
Available Spare:                    100%
Available Spare Threshold:          10%
Percentage Used:                    0%
Data Units Read:                    3,079,501 [1.57 TB]
Data Units Written:                 3,265,723 [1.67 TB]
Host Read Commands:                 144,317,068
Host Write Commands:                56,737,433
Controller Busy Time:               258
Power Cycles:                       255
Power On Hours:                     144
Unsafe Shutdowns:                   65
Media and Data Integrity Errors:    0
Error Information Log Entries:      224

Error Information (NVMe Log 0x01, max 64 entries)
Num   ErrCount  SQId   CmdId  Status  PELoc          LBA  NSID    VS
  0        224     0  0x0006  0x4004  0x000            0     0     -
  1        223     0  0x0008  0x4004  0x000            0     0     -
  2        222     0  0x0017  0x4004  0x000            0     0     -
  3        221     0  0x000f  0x4004  0x000            0     0     -
  4        220     0  0x000b  0x4004  0x000            0     0     -
  5        219     0  0x000b  0x4004  0x000            0     0     -
  6        218     0  0x0017  0x4004  0x000            0     0     -
  7        217     0  0x0017  0x4004  0x000            0     0     -
  8        216     0  0x000b  0x4004  0x000            0     0     -
  9        215     0  0x0003  0x4004  0x000            0     0     -
 10        214     0  0x0017  0x4004  0x000            0     0     -
 11        213     0  0x001d  0x4004  0x000            0     0     -
 12        212     0  0x001b  0x4004  0x000            0     0     -
 13        211     0  0x000b  0x4004  0x000            0     0     -
 14        210     0  0x001b  0x4004  0x000            0     0     -
 15        209     0  0x0003  0x4004  0x000            0     0     -
... (48 entries not shown)

