smartctl 7.3 2022-02-28 r5338 [FreeBSD 13.1-RELEASE-p7 amd64] (local build)
Copyright (C) 2002-22, Bruce Allen, Christian Franke, www.smartmontools.org

=== START OF INFORMATION SECTION ===
Model Family:     Hitachi/HGST Travelstar Z5K320
Device Model:     HTS543232A7A384
Serial Number:    --
LU WWN Device Id: 5 000cca ...
Firmware Version: ES2OA60W
User Capacity:    320,072,933,376 bytes [320 GB]
Sector Size:      512 bytes logical/physical
Rotation Rate:    5400 rpm
Form Factor:      2.5 inches
Device is:        In smartctl database 7.3/5319
ATA Version is:   ATA8-ACS T13/1699-D revision 6
SATA Version is:  SATA 2.6, 3.0 Gb/s
Local Time is:    Fri May  5 18:48:15 2023 IST
SMART support is: Available - device has SMART capability.
SMART support is: Enabled
AAM feature is:   Unavailable
APM level is:     128 (minimum power consumption without standby)
Rd look-ahead is: Enabled
Write cache is:   Enabled
DSN feature is:   Unavailable
ATA Security is:  Disabled, frozen [SEC2]
Wt Cache Reorder: Enabled

=== START OF READ SMART DATA SECTION ===
SMART overall-health self-assessment test result: PASSED

General SMART Values:
Offline data collection status:  (0x00)	Offline data collection activity
					was never started.
					Auto Offline Data Collection: Disabled.
Self-test execution status:      (   0)	The previous self-test routine completed
					without error or no self-test has ever 
					been run.
Total time to complete Offline 
data collection: 		(   45) seconds.
Offline data collection
capabilities: 			 (0x5b) SMART execute Offline immediate.
					Auto Offline data collection on/off support.
					Suspend Offline collection upon new
					command.
					Offline surface scan supported.
					Self-test supported.
					No Conveyance Self-test supported.
					Selective Self-test supported.
SMART capabilities:            (0x0003)	Saves SMART data before entering
					power-saving mode.
					Supports SMART auto save timer.
Error logging capability:        (0x01)	Error logging supported.
					General Purpose Logging supported.
Short self-test routine 
recommended polling time: 	 (   2) minutes.
Extended self-test routine
recommended polling time: 	 ( 102) minutes.
SCT capabilities: 	       (0x003d)	SCT Status supported.
					SCT Error Recovery Control supported.
					SCT Feature Control supported.
					SCT Data Table supported.

SMART Attributes Data Structure revision number: 16
Vendor Specific SMART Attributes with Thresholds:
ID# ATTRIBUTE_NAME          FLAGS    VALUE WORST THRESH FAIL RAW_VALUE
  1 Raw_Read_Error_Rate     PO-R--   100   100   062    -    0
  2 Throughput_Performance  --S---   100   100   000    -    0
  3 Spin_Up_Time            POS---   214   214   033    -    1
  4 Start_Stop_Count        -O--C-   094   094   000    -    10382
  5 Reallocated_Sector_Ct   PO--CK   100   100   005    -    0
  7 Seek_Error_Rate         -O-R--   100   100   000    -    0
  8 Seek_Time_Performance   --S---   100   100   000    -    0
  9 Power_On_Hours          -O--C-   055   055   000    -    19942
 10 Spin_Retry_Count        -O--C-   100   100   000    -    0
 12 Power_Cycle_Count       -O--CK   096   096   000    -    7377
191 G-Sense_Error_Rate      -O-R--   100   100   000    -    0
192 Power-Off_Retract_Count -O--CK   099   099   000    -    313
193 Load_Cycle_Count        -O--C-   001   001   000    -    1483988
194 Temperature_Celsius     -O----   171   171   000    -    35 (Min/Max 13/52)
196 Reallocated_Event_Count -O--CK   100   100   000    -    25
197 Current_Pending_Sector  -O---K   100   100   000    -    2
198 Offline_Uncorrectable   ---R--   100   100   000    -    0
199 UDMA_CRC_Error_Count    -O-R--   200   200   000    -    0
223 Load_Retry_Count        -O-R--   100   100   000    -    0
240 Head_Flying_Hours       -O--CK   070   070   000    -    13345
241 Total_LBAs_Written      -O--CK   100   100   000    -    39675524917
242 Total_LBAs_Read         -O--CK   099   099   000    -    72255255726
254 Free_Fall_Sensor        -O--CK   100   100   000    -    0
                            ||||||_ K auto-keep
                            |||||__ C event count
                            ||||___ R error rate
                            |||____ S speed/performance
                            ||_____ O updated online
                            |______ P prefailure warning

General Purpose Log Directory Version 1
SMART           Log Directory Version 1 [multi-sector log support]
Address    Access  R/W   Size  Description
0x00       GPL,SL  R/O      1  Log Directory
0x01           SL  R/O      1  Summary SMART error log
0x02           SL  R/O      1  Comprehensive SMART error log
0x03       GPL     R/O      1  Ext. Comprehensive SMART error log
0x04       GPL     R/O      7  Device Statistics log
0x06           SL  R/O      1  SMART self-test log
0x07       GPL     R/O      1  Extended self-test log
0x09           SL  R/W      1  Selective self-test log
0x10       GPL     R/O      1  NCQ Command Error log
0x11       GPL     R/O      1  SATA Phy Event Counters log
0x80-0x9f  GPL,SL  R/W     16  Host vendor specific log
0xe0       GPL,SL  R/W      1  SCT Command/Status
0xe1       GPL,SL  R/W      1  SCT Data Transfer

SMART Extended Comprehensive Error Log Version: 1 (1 sectors)
Device Error Count: 132 (device log contains only the most recent 4 errors)
	CR     = Command Register
	FEATR  = Features Register
	COUNT  = Count (was: Sector Count) Register
	LBA_48 = Upper bytes of LBA High/Mid/Low Registers ]  ATA-8
	LH     = LBA High (was: Cylinder High) Register    ]   LBA
	LM     = LBA Mid (was: Cylinder Low) Register      ] Register
	LL     = LBA Low (was: Sector Number) Register     ]
	DV     = Device (was: Device/Head) Register
	DC     = Device Control Register
	ER     = Error register
	ST     = Status register
Powered_Up_Time is measured from power on, and printed as
DDd+hh:mm:SS.sss where DD=days, hh=hours, mm=minutes,
SS=sec, and sss=millisec. It "wraps" after 49.710 days.

Error 132 [3] occurred at disk power-on lifetime: 19926 hours (830 days + 6 hours)
  When the command that caused the error occurred, the device was active or idle.

  After command completion occurred, registers were:
  ER -- ST COUNT  LBA_48  LH LM LL DV DC
  -- -- -- == -- == == == -- -- -- -- --
  40 -- 51 00 2b 00 00 1d 2f b1 fd 0d 00  Error: WP at LBA = 0x1d2fb1fd = 489665021

  Commands leading to the command that caused the error were:
  CR FEATR COUNT  LBA_48  LH LM LL DV DC  Powered_Up_Time  Command/Feature_Name
  -- == -- == -- == == == -- -- -- -- --  ---------------  --------------------
  61 00 18 00 e0 00 00 03 52 86 d0 40 00     00:33:50.332  WRITE FPDMA QUEUED
  61 00 28 00 d8 00 00 03 52 86 a8 40 00     00:33:50.332  WRITE FPDMA QUEUED
  61 03 c0 00 d0 00 00 03 52 82 28 40 00     00:33:50.332  WRITE FPDMA QUEUED
  61 00 38 00 c8 00 00 03 52 7e a8 40 00     00:33:50.332  WRITE FPDMA QUEUED
  60 00 40 00 c0 00 00 1d 2f b1 e8 40 00     00:33:50.332  READ FPDMA QUEUED

Error 131 [2] occurred at disk power-on lifetime: 19926 hours (830 days + 6 hours)
  When the command that caused the error occurred, the device was active or idle.

  After command completion occurred, registers were:
  ER -- ST COUNT  LBA_48  LH LM LL DV DC
  -- -- -- == -- == == == -- -- -- -- --
  40 -- 51 00 2b 00 00 1d 2f b1 fd 0d 00  Error: WP at LBA = 0x1d2fb1fd = 489665021

  Commands leading to the command that caused the error were:
  CR FEATR COUNT  LBA_48  LH LM LL DV DC  Powered_Up_Time  Command/Feature_Name
  -- == -- == -- == == == -- -- -- -- --  ---------------  --------------------
  61 00 18 00 b0 00 00 03 52 86 d0 40 00     00:33:43.388  WRITE FPDMA QUEUED
  61 00 28 00 a8 00 00 03 52 86 a8 40 00     00:33:43.388  WRITE FPDMA QUEUED
  61 03 c0 00 a0 00 00 03 52 82 28 40 00     00:33:43.388  WRITE FPDMA QUEUED
  61 00 38 00 98 00 00 03 52 7e a8 40 00     00:33:43.388  WRITE FPDMA QUEUED
  61 00 40 00 90 00 00 03 52 7e 68 40 00     00:33:43.388  WRITE FPDMA QUEUED

Error 130 [1] occurred at disk power-on lifetime: 19926 hours (830 days + 6 hours)
  When the command that caused the error occurred, the device was active or idle.

  After command completion occurred, registers were:
  ER -- ST COUNT  LBA_48  LH LM LL DV DC
  -- -- -- == -- == == == -- -- -- -- --
  40 -- 51 00 29 00 00 1d 2f b1 ff 0d 00  Error: WP at LBA = 0x1d2fb1ff = 489665023

  Commands leading to the command that caused the error were:
  CR FEATR COUNT  LBA_48  LH LM LL DV DC  Powered_Up_Time  Command/Feature_Name
  -- == -- == -- == == == -- -- -- -- --  ---------------  --------------------
  61 00 18 00 a8 00 00 03 52 86 d0 40 00     00:33:37.243  WRITE FPDMA QUEUED
  61 00 28 00 a0 00 00 03 52 86 a8 40 00     00:33:37.243  WRITE FPDMA QUEUED
  61 03 c0 00 98 00 00 03 52 82 28 40 00     00:33:37.243  WRITE FPDMA QUEUED
  61 00 38 00 90 00 00 03 52 7e a8 40 00     00:33:37.243  WRITE FPDMA QUEUED
  61 00 40 00 88 00 00 03 52 7e 68 40 00     00:33:37.243  WRITE FPDMA QUEUED

Error 129 [0] occurred at disk power-on lifetime: 19926 hours (830 days + 6 hours)
  When the command that caused the error occurred, the device was active or idle.

  After command completion occurred, registers were:
  ER -- ST COUNT  LBA_48  LH LM LL DV DC
  -- -- -- == -- == == == -- -- -- -- --
  40 -- 51 00 29 00 00 1d 2f b1 ff 0d 00  Error: WP at LBA = 0x1d2fb1ff = 489665023

  Commands leading to the command that caused the error were:
  CR FEATR COUNT  LBA_48  LH LM LL DV DC  Powered_Up_Time  Command/Feature_Name
  -- == -- == -- == == == -- -- -- -- --  ---------------  --------------------
  61 00 18 00 a0 00 00 03 52 86 d0 40 00     00:33:31.248  WRITE FPDMA QUEUED
  61 00 28 00 98 00 00 03 52 86 a8 40 00     00:33:31.235  WRITE FPDMA QUEUED
  61 03 c0 00 90 00 00 03 52 82 28 40 00     00:33:31.234  WRITE FPDMA QUEUED
  61 00 38 00 88 00 00 03 52 7e a8 40 00     00:33:31.234  WRITE FPDMA QUEUED
  61 00 40 00 80 00 00 03 52 7e 68 40 00     00:33:31.234  WRITE FPDMA QUEUED

SMART Extended Self-test Log Version: 1 (1 sectors)
Num  Test_Description    Status                  Remaining  LifeTime(hours)  LBA_of_first_error
# 1  Short offline       Completed without error       00%     18626         -
# 2  Short offline       Completed without error       00%     13905         -
# 3  Short offline       Completed without error       00%     10725         -
# 4  Short offline       Completed without error       00%      7363         -
# 5  Short offline       Completed without error       00%      7348         -
# 6  Short offline       Completed without error       00%      7341         -
# 7  Short offline       Completed without error       00%      7341         -
# 8  Short offline       Completed without error       00%      7341         -
# 9  Short offline       Completed without error       00%      7341         -
#10  Short offline       Completed without error       00%      4829         -
#11  Short offline       Completed without error       00%      1672         -
#12  Short offline       Completed without error       00%      1442         -
#13  Short offline       Completed without error       00%      1132         -
#14  Short offline       Completed without error       00%      1110         -
#15  Short offline       Completed without error       00%      1110         -
#16  Short offline       Completed without error       00%      1110         -
#17  Short offline       Completed without error       00%      1110         -
#18  Short offline       Completed without error       00%       626         -
#19  Short offline       Completed without error       00%       502         -

SMART Selective self-test log data structure revision number 1
 SPAN  MIN_LBA  MAX_LBA  CURRENT_TEST_STATUS
    1        0        0  Not_testing
    2        0        0  Not_testing
    3        0        0  Not_testing
    4        0        0  Not_testing
    5        0        0  Not_testing
Selective self-test flags (0x0):
  After scanning selected spans, do NOT read-scan remainder of disk.
If Selective self-test is pending on power-up, resume after 0 minute delay.

SCT Status Version:                  3
SCT Version (vendor specific):       256 (0x0100)
Device State:                        Active (0)
Current Temperature:                    35 Celsius
Power Cycle Min/Max Temperature:     30/35 Celsius
Lifetime    Min/Max Temperature:     13/52 Celsius
Specified Max Operating Temperature:    35 Celsius
Under/Over Temperature Limit Count:   0/0

SCT Temperature History Version:     2
Temperature Sampling Period:         1 minute
Temperature Logging Interval:        1 minute
Min/Max recommended Temperature:      0/60 Celsius
Min/Max Temperature Limit:           -40/65 Celsius
Temperature History Size (Index):    128 (7)

SCT Error Recovery Control:
           Read: Disabled
          Write: Disabled

Device Statistics (GP Log 0x04)
Page  Offset Size        Value Flags Description
0x01  =====  =               =  ===  == General Statistics (rev 1) ==
0x01  0x008  4            7377  ---  Lifetime Power-On Resets
0x01  0x010  4           19942  ---  Power-on Hours
0x01  0x018  6     39675528155  ---  Logical Sectors Written
0x01  0x020  6       566928480  ---  Number of Write Commands
0x01  0x028  6     72371319116  ---  Logical Sectors Read
0x01  0x030  6       974888571  ---  Number of Read Commands
0x03  =====  =               =  ===  == Rotating Media Statistics (rev 1) ==
0x03  0x008  4           13465  ---  Spindle Motor Power-on Hours
0x03  0x010  4           13345  ---  Head Flying Hours
0x03  0x018  4         1483988  ---  Head Load Events
0x03  0x020  4              11  ---  Number of Reallocated Logical Sectors
0x03  0x028  4            3666  ---  Read Recovery Attempts
0x03  0x030  4               0  ---  Number of Mechanical Start Failures
0x04  =====  =               =  ===  == General Errors Statistics (rev 1) ==
0x04  0x008  4             130  ---  Number of Reported Uncorrectable Errors
0x04  0x010  4            9491  ---  Resets Between Cmd Acceptance and Completion
0x05  =====  =               =  ===  == Temperature Statistics (rev 1) ==
0x05  0x008  1              35  ---  Current Temperature
0x05  0x010  1              37  N--  Average Short Term Temperature
0x05  0x018  1              36  N--  Average Long Term Temperature
0x05  0x020  1              52  ---  Highest Temperature
0x05  0x028  1              13  ---  Lowest Temperature
0x05  0x030  1              44  N--  Highest Average Short Term Temperature
0x05  0x038  1              22  N--  Lowest Average Short Term Temperature
0x05  0x040  1              42  N--  Highest Average Long Term Temperature
0x05  0x048  1              23  N--  Lowest Average Long Term Temperature
0x05  0x050  4               0  ---  Time in Over-Temperature
0x05  0x058  1              60  ---  Specified Maximum Operating Temperature
0x05  0x060  4               0  ---  Time in Under-Temperature
0x05  0x068  1               0  ---  Specified Minimum Operating Temperature
0x06  =====  =               =  ===  == Transport Statistics (rev 1) ==
0x06  0x008  4           60059  ---  Number of Hardware Resets
0x06  0x010  4            9392  ---  Number of ASR Events
0x06  0x018  4               0  ---  Number of Interface CRC Errors
                                |||_ C monitored condition met
                                ||__ D supports DSN
                                |___ N normalized value

Pending Defects log (GP Log 0x0c) not supported

SATA Phy Event Counters (GP Log 0x11)
ID      Size     Value  Description
0x0001  2            0  Command failed due to ICRC error
0x0002  2            0  R_ERR response for data FIS
0x0003  2            0  R_ERR response for device-to-host data FIS
0x0004  2            0  R_ERR response for host-to-device data FIS
0x0005  2            0  R_ERR response for non-data FIS
0x0006  2            0  R_ERR response for device-to-host non-data FIS
0x0007  2            0  R_ERR response for host-to-device non-data FIS
0x0009  2            2  Transition from drive PhyRdy to drive PhyNRdy
0x000a  2            2  Device-to-host register FISes sent due to a COMRESET
0x000b  2            0  CRC errors within host-to-device FIS
0x000d  2            0  Non-CRC errors within host-to-device FIS

