smartctl 7.4 2023-08-01 r5530 [OpenBSD 7.6 amd64] (local build)
Copyright (C) 2002-23, Bruce Allen, Christian Franke, www.smartmontools.org

=== START OF INFORMATION SECTION ===
Device Model:     MT-64
Serial Number:    --
LU WWN Device Id: 0 000000 ...
Firmware Version: Q0927A
User Capacity:    64,023,257,088 bytes [64.0 GB]
Sector Size:      512 bytes logical/physical
Rotation Rate:    Solid State Device
Form Factor:      2.5 inches
TRIM Command:     Available
Device is:        Not in smartctl database 7.3/5528
ATA Version is:   ACS-2 (minor revision not indicated)
SATA Version is:  SATA 3.1, 6.0 Gb/s (current: 3.0 Gb/s)
Local Time is:    Thu Feb  6 21:56:17 2025 CET
SMART support is: Available - device has SMART capability.
SMART support is: Enabled

=== START OF READ SMART DATA SECTION ===
SMART Status not supported: Incomplete response, ATA output registers missing
SMART overall-health self-assessment test result: PASSED
Warning: This result is based on an Attribute check.

General SMART Values:
Offline data collection status:  (0x00)	Offline data collection activity
					was never started.
					Auto Offline Data Collection: Disabled.
Self-test execution status:      (   0)	The previous self-test routine completed
					without error or no self-test has ever 
					been run.
Total time to complete Offline 
data collection: 		(    0) seconds.
Offline data collection
capabilities: 			 (0x11) SMART execute Offline immediate.
					No Auto Offline data collection support.
					Suspend Offline collection upon new
					command.
					No Offline surface scan supported.
					Self-test supported.
					No Conveyance Self-test supported.
					No Selective Self-test supported.
SMART capabilities:            (0x0002)	Does not save SMART data before
					entering power-saving mode.
					Supports SMART auto save timer.
Error logging capability:        (0x01)	Error logging supported.
					General Purpose Logging supported.
Short self-test routine 
recommended polling time: 	 (   1) minutes.
Extended self-test routine
recommended polling time: 	 (   1) minutes.

SMART Attributes Data Structure revision number: 1
Vendor Specific SMART Attributes with Thresholds:
ID# ATTRIBUTE_NAME          FLAG     VALUE WORST THRESH TYPE      UPDATED  WHEN_FAILED RAW_VALUE
  1 Raw_Read_Error_Rate     0x0000   100   100   050    Old_age   Offline      -       0
  5 Reallocated_Sector_Ct   0x0002   100   100   050    Old_age   Always       -       0
  9 Power_On_Hours          0x0000   100   100   050    Old_age   Offline      -       3116
 12 Power_Cycle_Count       0x0000   100   100   050    Old_age   Offline      -       1155
160 Unknown_Attribute       0x0000   100   100   050    Old_age   Offline      -       0
161 Unknown_Attribute       0x0000   100   100   050    Old_age   Offline      -       57
162 Unknown_Attribute       0x0000   100   100   050    Old_age   Offline      -       1
163 Unknown_Attribute       0x0000   100   100   050    Old_age   Offline      -       4
164 Unknown_Attribute       0x0000   100   100   050    Old_age   Offline      -       26220
165 Unknown_Attribute       0x0000   100   100   050    Old_age   Offline      -       35
166 Unknown_Attribute       0x0000   100   100   050    Old_age   Offline      -       17
167 Unknown_Attribute       0x0000   100   100   050    Old_age   Offline      -       25
168 Unknown_Attribute       0x0000   100   100   050    Old_age   Offline      -       3000
169 Unknown_Attribute       0x0000   100   100   050    Old_age   Offline      -       100
192 Power-Off_Retract_Count 0x0000   100   100   050    Old_age   Offline      -       155
194 Temperature_Celsius     0x0000   100   100   050    Old_age   Offline      -       37
195 Hardware_ECC_Recovered  0x0000   100   100   050    Old_age   Offline      -       43191
196 Reallocated_Event_Count 0x0000   100   100   050    Old_age   Offline      -       0
199 UDMA_CRC_Error_Count    0x0000   100   100   050    Old_age   Offline      -       0
241 Total_LBAs_Written      0x0000   100   100   050    Old_age   Offline      -       31900
242 Total_LBAs_Read         0x0000   100   100   050    Old_age   Offline      -       19949
245 Unknown_Attribute       0x0000   100   100   050    Old_age   Offline      -       47776

SMART Error Log Version: 1
No Errors Logged

Warning! SMART Self-Test Log Structure error: invalid SMART checksum.
SMART Self-test log structure revision number 1
Num  Test_Description    Status                  Remaining  LifeTime(hours)  LBA_of_first_error
# 1  Short offline       Completed without error       00%         0         -

Selective Self-tests/Logging not supported

The above only provides legacy SMART information - try 'smartctl -x' for more



