smartctl 7.3 2022-02-28 r5338 [FreeBSD 13.1-RELEASE-p2 amd64] (local build)
Copyright (C) 2002-22, Bruce Allen, Christian Franke, www.smartmontools.org

=== START OF INFORMATION SECTION ===
Model Family:     Western Digital Black Mobile
Device Model:     WDC WD7500BPKX-00HPJT0
Serial Number:    --
LU WWN Device Id: 5 0014ee ...
Firmware Version: 01.01A01
User Capacity:    750,156,374,016 bytes [750 GB]
Sector Sizes:     512 bytes logical, 4096 bytes physical
Rotation Rate:    7200 rpm
Device is:        In smartctl database 7.3/5319
ATA Version is:   ATA8-ACS (minor revision not indicated)
SATA Version is:  SATA 3.0, 6.0 Gb/s (current: 6.0 Gb/s)
Local Time is:    Thu Sep 29 18:15:05 2022 MDT
SMART support is: Available - device has SMART capability.
SMART support is: Enabled
AAM feature is:   Unavailable
APM level is:     128 (minimum power consumption without standby)
Rd look-ahead is: Enabled
Write cache is:   Enabled
DSN feature is:   Unavailable
ATA Security is:  Disabled, NOT FROZEN [SEC1]
Wt Cache Reorder: Enabled

=== START OF READ SMART DATA SECTION ===
SMART overall-health self-assessment test result: PASSED

General SMART Values:
Offline data collection status:  (0x00)	Offline data collection activity
					was never started.
					Auto Offline Data Collection: Disabled.
Self-test execution status:      (   0)	The previous self-test routine completed
					without error or no self-test has ever 
					been run.
Total time to complete Offline 
data collection: 		(12900) seconds.
Offline data collection
capabilities: 			 (0x7b) SMART execute Offline immediate.
					Auto Offline data collection on/off support.
					Suspend Offline collection upon new
					command.
					Offline surface scan supported.
					Self-test supported.
					Conveyance Self-test supported.
					Selective Self-test supported.
SMART capabilities:            (0x0003)	Saves SMART data before entering
					power-saving mode.
					Supports SMART auto save timer.
Error logging capability:        (0x01)	Error logging supported.
					General Purpose Logging supported.
Short self-test routine 
recommended polling time: 	 (   2) minutes.
Extended self-test routine
recommended polling time: 	 ( 128) minutes.
Conveyance self-test routine
recommended polling time: 	 (   5) minutes.
SCT capabilities: 	       (0x70b5)	SCT Status supported.
					SCT Feature Control supported.
					SCT Data Table supported.

SMART Attributes Data Structure revision number: 16
Vendor Specific SMART Attributes with Thresholds:
ID# ATTRIBUTE_NAME          FLAGS    VALUE WORST THRESH FAIL RAW_VALUE
  1 Raw_Read_Error_Rate     POSR-K   200   200   051    -    5
  3 Spin_Up_Time            POS--K   193   190   021    -    1325
  4 Start_Stop_Count        -O--CK   100   100   000    -    183
  5 Reallocated_Sector_Ct   PO--CK   200   200   140    -    0
  7 Seek_Error_Rate         -OSR-K   200   200   000    -    0
  9 Power_On_Hours          -O--CK   063   063   000    -    27385
 10 Spin_Retry_Count        -O--CK   100   100   000    -    0
 11 Calibration_Retry_Count -O--CK   100   100   000    -    0
 12 Power_Cycle_Count       -O--CK   100   100   000    -    183
192 Power-Off_Retract_Count -O--CK   200   200   000    -    146
193 Load_Cycle_Count        -O--CK   002   002   000    -    596282
194 Temperature_Celsius     -O---K   106   085   000    -    41
196 Reallocated_Event_Count -O--CK   200   200   000    -    0
197 Current_Pending_Sector  -O--CK   200   200   000    -    0
198 Offline_Uncorrectable   ----CK   100   253   000    -    0
199 UDMA_CRC_Error_Count    -O--CK   200   200   000    -    0
200 Multi_Zone_Error_Rate   ---R--   200   200   000    -    0
                            ||||||_ K auto-keep
                            |||||__ C event count
                            ||||___ R error rate
                            |||____ S speed/performance
                            ||_____ O updated online
                            |______ P prefailure warning

General Purpose Log Directory Version 1
SMART           Log Directory Version 1 [multi-sector log support]
Address    Access  R/W   Size  Description
0x00       GPL,SL  R/O      1  Log Directory
0x01           SL  R/O      1  Summary SMART error log
0x02           SL  R/O      5  Comprehensive SMART error log
0x03       GPL     R/O      6  Ext. Comprehensive SMART error log
0x06           SL  R/O      1  SMART self-test log
0x07       GPL     R/O      1  Extended self-test log
0x09           SL  R/W      1  Selective self-test log
0x10       GPL     R/O      1  NCQ Command Error log
0x11       GPL     R/O      1  SATA Phy Event Counters log
0x80-0x9f  GPL,SL  R/W     16  Host vendor specific log
0xa0-0xa7  GPL,SL  VS      16  Device vendor specific log
0xa8-0xb7  GPL,SL  VS       1  Device vendor specific log
0xbd       GPL,SL  VS       1  Device vendor specific log
0xc0       GPL,SL  VS       1  Device vendor specific log
0xc1       GPL     VS      93  Device vendor specific log
0xe0       GPL,SL  R/W      1  SCT Command/Status
0xe1       GPL,SL  R/W      1  SCT Data Transfer

SMART Extended Comprehensive Error Log Version: 1 (6 sectors)
Device Error Count: 5
	CR     = Command Register
	FEATR  = Features Register
	COUNT  = Count (was: Sector Count) Register
	LBA_48 = Upper bytes of LBA High/Mid/Low Registers ]  ATA-8
	LH     = LBA High (was: Cylinder High) Register    ]   LBA
	LM     = LBA Mid (was: Cylinder Low) Register      ] Register
	LL     = LBA Low (was: Sector Number) Register     ]
	DV     = Device (was: Device/Head) Register
	DC     = Device Control Register
	ER     = Error register
	ST     = Status register
Powered_Up_Time is measured from power on, and printed as
DDd+hh:mm:SS.sss where DD=days, hh=hours, mm=minutes,
SS=sec, and sss=millisec. It "wraps" after 49.710 days.

Error 5 [4] occurred at disk power-on lifetime: 6219 hours (259 days + 3 hours)
  When the command that caused the error occurred, the device was active or idle.

  After command completion occurred, registers were:
  ER -- ST COUNT  LBA_48  LH LM LL DV DC
  -- -- -- == -- == == == -- -- -- -- --
  40 -- 51 00 00 00 00 4b 57 18 f8 40 00  Error: UNC at LBA = 0x4b5718f8 = 1263999224

  Commands leading to the command that caused the error were:
  CR FEATR COUNT  LBA_48  LH LM LL DV DC  Powered_Up_Time  Command/Feature_Name
  -- == -- == -- == == == -- -- -- -- --  ---------------  --------------------
  60 00 08 00 50 00 00 4b 57 1c 60 40 08     23:32:22.887  READ FPDMA QUEUED
  60 00 80 00 48 00 00 4b 57 1b 90 40 08     23:32:22.887  READ FPDMA QUEUED
  60 01 00 00 40 00 00 4b 57 1a 90 40 08     23:32:22.886  READ FPDMA QUEUED
  60 01 00 00 38 00 00 4b 57 19 90 40 08     23:32:22.886  READ FPDMA QUEUED
  60 01 00 00 30 00 00 4b 57 18 90 40 08     23:32:22.886  READ FPDMA QUEUED

Error 4 [3] occurred at disk power-on lifetime: 6219 hours (259 days + 3 hours)
  When the command that caused the error occurred, the device was active or idle.

  After command completion occurred, registers were:
  ER -- ST COUNT  LBA_48  LH LM LL DV DC
  -- -- -- == -- == == == -- -- -- -- --
  40 -- 51 00 00 00 00 4b 57 18 f8 40 00  Error: UNC at LBA = 0x4b5718f8 = 1263999224

  Commands leading to the command that caused the error were:
  CR FEATR COUNT  LBA_48  LH LM LL DV DC  Powered_Up_Time  Command/Feature_Name
  -- == -- == -- == == == -- -- -- -- --  ---------------  --------------------
  60 00 08 00 20 00 00 4b 57 1c 60 40 08     23:32:20.680  READ FPDMA QUEUED
  60 00 80 00 18 00 00 4b 57 1b 90 40 08     23:32:20.680  READ FPDMA QUEUED
  60 01 00 00 10 00 00 4b 57 1a 90 40 08     23:32:20.679  READ FPDMA QUEUED
  60 01 00 00 08 00 00 4b 57 19 90 40 08     23:32:20.679  READ FPDMA QUEUED
  60 01 00 00 00 00 00 4b 57 18 90 40 08     23:32:20.679  READ FPDMA QUEUED

Error 3 [2] occurred at disk power-on lifetime: 6219 hours (259 days + 3 hours)
  When the command that caused the error occurred, the device was active or idle.

  After command completion occurred, registers were:
  ER -- ST COUNT  LBA_48  LH LM LL DV DC
  -- -- -- == -- == == == -- -- -- -- --
  40 -- 51 00 00 00 00 4b 57 18 f8 40 00  Error: UNC at LBA = 0x4b5718f8 = 1263999224

  Commands leading to the command that caused the error were:
  CR FEATR COUNT  LBA_48  LH LM LL DV DC  Powered_Up_Time  Command/Feature_Name
  -- == -- == -- == == == -- -- -- -- --  ---------------  --------------------
  60 00 08 00 f0 00 00 4b 57 1c 60 40 08     23:32:18.474  READ FPDMA QUEUED
  60 00 80 00 e8 00 00 4b 57 1b 90 40 08     23:32:18.474  READ FPDMA QUEUED
  60 01 00 00 e0 00 00 4b 57 1a 90 40 08     23:32:18.473  READ FPDMA QUEUED
  60 01 00 00 d8 00 00 4b 57 19 90 40 08     23:32:18.473  READ FPDMA QUEUED
  60 01 00 00 d0 00 00 4b 57 18 90 40 08     23:32:18.472  READ FPDMA QUEUED

Error 2 [1] occurred at disk power-on lifetime: 6219 hours (259 days + 3 hours)
  When the command that caused the error occurred, the device was active or idle.

  After command completion occurred, registers were:
  ER -- ST COUNT  LBA_48  LH LM LL DV DC
  -- -- -- == -- == == == -- -- -- -- --
  40 -- 51 00 00 00 00 4b 57 18 f8 40 00  Error: UNC at LBA = 0x4b5718f8 = 1263999224

  Commands leading to the command that caused the error were:
  CR FEATR COUNT  LBA_48  LH LM LL DV DC  Powered_Up_Time  Command/Feature_Name
  -- == -- == -- == == == -- -- -- -- --  ---------------  --------------------
  60 00 08 00 c0 00 00 4b 57 1c 60 40 08     23:32:16.260  READ FPDMA QUEUED
  60 00 80 00 b8 00 00 4b 57 1b 90 40 08     23:32:16.260  READ FPDMA QUEUED
  60 01 00 00 b0 00 00 4b 57 1a 90 40 08     23:32:16.259  READ FPDMA QUEUED
  60 01 00 00 a8 00 00 4b 57 19 90 40 08     23:32:16.259  READ FPDMA QUEUED
  60 01 00 00 a0 00 00 4b 57 18 90 40 08     23:32:16.258  READ FPDMA QUEUED

Error 1 [0] occurred at disk power-on lifetime: 6219 hours (259 days + 3 hours)
  When the command that caused the error occurred, the device was active or idle.

  After command completion occurred, registers were:
  ER -- ST COUNT  LBA_48  LH LM LL DV DC
  -- -- -- == -- == == == -- -- -- -- --
  40 -- 51 00 00 00 00 4b 57 18 f8 40 00  Error: UNC at LBA = 0x4b5718f8 = 1263999224

  Commands leading to the command that caused the error were:
  CR FEATR COUNT  LBA_48  LH LM LL DV DC  Powered_Up_Time  Command/Feature_Name
  -- == -- == -- == == == -- -- -- -- --  ---------------  --------------------
  60 00 08 00 90 00 00 4b 57 1c 60 40 08     23:32:14.061  READ FPDMA QUEUED
  60 00 80 00 88 00 00 4b 57 1b 90 40 08     23:32:14.051  READ FPDMA QUEUED
  60 01 00 00 80 00 00 4b 57 1a 90 40 08     23:32:14.050  READ FPDMA QUEUED
  60 01 00 00 78 00 00 4b 57 19 90 40 08     23:32:14.050  READ FPDMA QUEUED
  60 01 00 00 70 00 00 4b 57 18 90 40 08     23:32:14.050  READ FPDMA QUEUED

SMART Extended Self-test Log Version: 1 (1 sectors)
Num  Test_Description    Status                  Remaining  LifeTime(hours)  LBA_of_first_error
# 1  Short offline       Completed without error       00%      5688         -
# 2  Short offline       Completed without error       00%      5665         -
# 3  Short offline       Completed without error       00%      5641         -
# 4  Extended offline    Completed without error       00%      5622         -
# 5  Short offline       Completed without error       00%      5617         -
# 6  Short offline       Completed without error       00%      5593         -
# 7  Short offline       Completed without error       00%      5569         -
# 8  Short offline       Completed without error       00%      5545         -
# 9  Short offline       Completed without error       00%      5521         -
#10  Short offline       Completed without error       00%      5497         -
#11  Short offline       Completed without error       00%      5473         -
#12  Short offline       Completed without error       00%      5449         -
#13  Short offline       Completed without error       00%      5424         -
#14  Short offline       Completed without error       00%      5401         -
#15  Short offline       Completed without error       00%      5377         -
#16  Short offline       Completed without error       00%      5354         -
#17  Short offline       Completed without error       00%      5329         -
#18  Short offline       Completed without error       00%      5305         -

SMART Selective self-test log data structure revision number 1
 SPAN  MIN_LBA  MAX_LBA  CURRENT_TEST_STATUS
    1        0        0  Not_testing
    2        0        0  Not_testing
    3        0        0  Not_testing
    4        0        0  Not_testing
    5        0        0  Not_testing
Selective self-test flags (0x0):
  After scanning selected spans, do NOT read-scan remainder of disk.
If Selective self-test is pending on power-up, resume after 0 minute delay.

SCT Status Version:                  3
SCT Version (vendor specific):       258 (0x0102)
Device State:                        Active (0)
Current Temperature:                    41 Celsius
Power Cycle Min/Max Temperature:     35/52 Celsius
Lifetime    Min/Max Temperature:      0/62 Celsius
Under/Over Temperature Limit Count:   0/0
Vendor specific:
01 00 00 00 00 00 00 00 00 00 00 00 00 00 00 00
00 00 00 00 00 00 00 00 00 00 00 00 00 00 00 00

SCT Temperature History Version:     2
Temperature Sampling Period:         1 minute
Temperature Logging Interval:        1 minute
Min/Max recommended Temperature:      0/60 Celsius
Min/Max Temperature Limit:           -41/85 Celsius
Temperature History Size (Index):    128 (91)

SCT Error Recovery Control command not supported

Device Statistics (GP/SMART Log 0x04) not supported

Pending Defects log (GP Log 0x0c) not supported

SATA Phy Event Counters (GP Log 0x11)
ID      Size     Value  Description
0x0001  2            0  Command failed due to ICRC error
0x0002  2            0  R_ERR response for data FIS
0x0003  2            0  R_ERR response for device-to-host data FIS
0x0004  2            0  R_ERR response for host-to-device data FIS
0x0005  2            0  R_ERR response for non-data FIS
0x0006  2            0  R_ERR response for device-to-host non-data FIS
0x0007  2            0  R_ERR response for host-to-device non-data FIS
0x0008  2            0  Device-to-host non-data FIS retries
0x0009  2          159  Transition from drive PhyRdy to drive PhyNRdy
0x000a  2          160  Device-to-host register FISes sent due to a COMRESET
0x000b  2            0  CRC errors within host-to-device FIS
0x000f  2            0  R_ERR response for host-to-device data FIS, CRC
0x0012  2            0  R_ERR response for host-to-device non-data FIS, CRC
0x8000  4     24934606  Vendor specific



