smartctl 7.4 2023-08-01 r5530 [OpenBSD 7.5 amd64] (local build)
Copyright (C) 2002-23, Bruce Allen, Christian Franke, www.smartmontools.org

=== START OF INFORMATION SECTION ===
Model Family:     Western Digital Black Mobile
Device Model:     WDC WD7500BPKX-00HPJT0
Serial Number:    --
LU WWN Device Id: 5 0014ee ...
Firmware Version: 01.01A01
User Capacity:    750,156,374,016 bytes [750 GB]
Sector Sizes:     512 bytes logical, 4096 bytes physical
Rotation Rate:    7200 rpm
Device is:        In smartctl database 7.3/5528
ATA Version is:   ATA8-ACS (minor revision not indicated)
SATA Version is:  SATA 3.0, 6.0 Gb/s (current: 3.0 Gb/s)
Local Time is:    Sun Apr 28 18:39:15 2024 EDT
SMART support is: Available - device has SMART capability.
SMART support is: Enabled

=== START OF READ SMART DATA SECTION ===
SMART Status not supported: Incomplete response, ATA output registers missing
SMART overall-health self-assessment test result: PASSED
Warning: This result is based on an Attribute check.

General SMART Values:
Offline data collection status:  (0x00)	Offline data collection activity
					was never started.
					Auto Offline Data Collection: Disabled.
Self-test execution status:      (   0)	The previous self-test routine completed
					without error or no self-test has ever 
					been run.
Total time to complete Offline 
data collection: 		(13200) seconds.
Offline data collection
capabilities: 			 (0x7b) SMART execute Offline immediate.
					Auto Offline data collection on/off support.
					Suspend Offline collection upon new
					command.
					Offline surface scan supported.
					Self-test supported.
					Conveyance Self-test supported.
					Selective Self-test supported.
SMART capabilities:            (0x0003)	Saves SMART data before entering
					power-saving mode.
					Supports SMART auto save timer.
Error logging capability:        (0x01)	Error logging supported.
					General Purpose Logging supported.
Short self-test routine 
recommended polling time: 	 (   2) minutes.
Extended self-test routine
recommended polling time: 	 ( 131) minutes.
Conveyance self-test routine
recommended polling time: 	 (   5) minutes.
SCT capabilities: 	       (0x70b5)	SCT Status supported.
					SCT Feature Control supported.
					SCT Data Table supported.

SMART Attributes Data Structure revision number: 16
Vendor Specific SMART Attributes with Thresholds:
ID# ATTRIBUTE_NAME          FLAG     VALUE WORST THRESH TYPE      UPDATED  WHEN_FAILED RAW_VALUE
  1 Raw_Read_Error_Rate     0x002f   200   200   051    Pre-fail  Always       -       0
  3 Spin_Up_Time            0x0027   195   192   021    Pre-fail  Always       -       1216
  4 Start_Stop_Count        0x0032   097   097   000    Old_age   Always       -       3789
  5 Reallocated_Sector_Ct   0x0033   200   200   140    Pre-fail  Always       -       0
  7 Seek_Error_Rate         0x002e   200   200   000    Old_age   Always       -       0
  9 Power_On_Hours          0x0032   081   081   000    Old_age   Always       -       14403
 10 Spin_Retry_Count        0x0032   100   100   000    Old_age   Always       -       0
 11 Calibration_Retry_Count 0x0032   100   100   000    Old_age   Always       -       0
 12 Power_Cycle_Count       0x0032   097   097   000    Old_age   Always       -       3789
192 Power-Off_Retract_Count 0x0032   200   200   000    Old_age   Always       -       32
193 Load_Cycle_Count        0x0032   001   001   000    Old_age   Always       -       888578
194 Temperature_Celsius     0x0022   102   095   000    Old_age   Always       -       45
196 Reallocated_Event_Count 0x0032   200   200   000    Old_age   Always       -       0
197 Current_Pending_Sector  0x0032   200   200   000    Old_age   Always       -       0
198 Offline_Uncorrectable   0x0030   100   253   000    Old_age   Offline      -       0
199 UDMA_CRC_Error_Count    0x0032   200   200   000    Old_age   Always       -       0
200 Multi_Zone_Error_Rate   0x0008   100   253   000    Old_age   Offline      -       0

SMART Error Log Version: 1
No Errors Logged

SMART Self-test log structure revision number 1
Num  Test_Description    Status                  Remaining  LifeTime(hours)  LBA_of_first_error
# 1  Extended offline    Interrupted (host reset)      90%     14381         -
# 2  Extended offline    Interrupted (host reset)      90%     14351         -
# 3  Extended offline    Interrupted (host reset)      90%     14307         -
# 4  Extended offline    Interrupted (host reset)      80%     14205         -
# 5  Extended offline    Interrupted (host reset)      90%     14123         -
# 6  Extended offline    Interrupted (host reset)      90%     14096         -
# 7  Extended offline    Interrupted (host reset)      90%     14090         -
# 8  Extended offline    Interrupted (host reset)      70%     14041         -
# 9  Extended offline    Interrupted (host reset)      90%     14014         -
#10  Extended offline    Interrupted (host reset)      10%      4697         -
#11  Short offline       Completed without error       00%       784         -
#12  Short offline       Completed without error       00%       729         -
#13  Extended offline    Interrupted (host reset)      60%       679         -
#14  Extended offline    Interrupted (host reset)      70%       608         -
#15  Short offline       Completed without error       00%       177         -

SMART Selective self-test log data structure revision number 1
 SPAN  MIN_LBA  MAX_LBA  CURRENT_TEST_STATUS
    1        0        0  Not_testing
    2        0        0  Not_testing
    3        0        0  Not_testing
    4        0        0  Not_testing
    5        0        0  Not_testing
Selective self-test flags (0x0):
  After scanning selected spans, do NOT read-scan remainder of disk.
If Selective self-test is pending on power-up, resume after 0 minute delay.

The above only provides legacy SMART information - try 'smartctl -x' for more

