smartctl 7.2 2021-09-14 r5236 [FreeBSD 12.1-RELEASE-p22-HBSD amd64] (local build)
Copyright (C) 2002-20, Bruce Allen, Christian Franke, www.smartmontools.org

=== START OF INFORMATION SECTION ===
Model Number:                       ATP NVMe M.2 2280 SSD
Serial Number:                      --
Firmware Version:                   42A4SB6B
PCI Vendor/Subsystem ID:            0x1db2
IEEE OUI Identifier:                0x141357
Controller ID:                      1
NVMe Version:                       1.3
Number of Namespaces:               1
Namespace 1 Size/Capacity:          240,057,409,536 [240 GB]
Namespace 1 Utilization:            3,911,192,576 [3.91 GB]
Namespace 1 Formatted LBA Size:     512
Namespace 1 IEEE EUI-64:            141357 ...
Local Time is:                      Thu Apr  7 20:37:40 2022 CEST
Firmware Updates (0x14):            2 Slots, no Reset required
Optional Admin Commands (0x0017):   Security Format Frmw_DL Self_Test
Optional NVM Commands (0x005f):     Comp Wr_Unc DS_Mngmt Wr_Zero Sav/Sel_Feat Timestmp
Log Page Attributes (0x0b):         S/H_per_NS Cmd_Eff_Lg Telmtry_Lg
Maximum Data Transfer Size:         64 Pages
Warning  Comp. Temp. Threshold:     75 Celsius
Critical Comp. Temp. Threshold:     80 Celsius

Supported Power States
St Op     Max   Active     Idle   RL RT WL WT  Ent_Lat  Ex_Lat
 0 +     9.00W       -        -    0  0  0  0        0       0
 1 +     4.60W       -        -    1  1  1  1        0       0
 2 +     3.80W       -        -    2  2  2  2        0       0
 3 -   0.0450W       -        -    3  3  3  3     2000    2000
 4 -   0.0040W       -        -    4  4  4  4    15000   15000

Supported LBA Sizes (NSID 0x1)
Id Fmt  Data  Metadt  Rel_Perf
 0 +     512       0         0

=== START OF SMART DATA SECTION ===
SMART overall-health self-assessment test result: PASSED

SMART/Health Information (NVMe Log 0x02)
Critical Warning:                   0x00
Temperature:                        35 Celsius
Available Spare:                    100%
Available Spare Threshold:          10%
Percentage Used:                    3%
Data Units Read:                    4,863 [2.48 GB]
Data Units Written:                 4,992,454 [2.55 TB]
Host Read Commands:                 145,318
Host Write Commands:                216,847,154
Controller Busy Time:               851
Power Cycles:                       84
Power On Hours:                     2,750
Unsafe Shutdowns:                   13
Media and Data Integrity Errors:    0
Error Information Log Entries:      0
Warning  Comp. Temperature Time:    0
Critical Comp. Temperature Time:    0
Temperature Sensor 1:               39 Celsius
Temperature Sensor 2:               35 Celsius
Temperature Sensor 3:               47 Celsius
Temperature Sensor 4:               35 Celsius
Temperature Sensor 5:               35 Celsius
Temperature Sensor 6:               35 Celsius

Error Information (NVMe Log 0x01, 16 of 256 entries)
No Errors Logged



