smartctl 7.2 2020-12-30 r5155 [FreeBSD 12.1-RELEASE-p12-HBSD amd64] (local build)
Copyright (C) 2002-20, Bruce Allen, Christian Franke, www.smartmontools.org

=== START OF INFORMATION SECTION ===
Model Number:                       ATP NVMe M.2 2280 SSD
Serial Number:                      --
Firmware Version:                   42A4SB6B
PCI Vendor/Subsystem ID:            0x1db2
IEEE OUI Identifier:                0x141357
Controller ID:                      1
NVMe Version:                       1.3
Number of Namespaces:               1
Namespace 1 Size/Capacity:          240,057,409,536 [240 GB]
Namespace 1 Utilization:            10,870,919,168 [10.8 GB]
Namespace 1 Formatted LBA Size:     512
Namespace 1 IEEE EUI-64:            141357 ...
Local Time is:                      Wed Feb  3 16:39:37 2021 CET
Firmware Updates (0x14):            2 Slots, no Reset required
Optional Admin Commands (0x0017):   Security Format Frmw_DL Self_Test
Optional NVM Commands (0x005f):     Comp Wr_Unc DS_Mngmt Wr_Zero Sav/Sel_Feat Timestmp
Log Page Attributes (0x0b):         S/H_per_NS Cmd_Eff_Lg Telmtry_Lg
Maximum Data Transfer Size:         64 Pages
Warning  Comp. Temp. Threshold:     75 Celsius
Critical Comp. Temp. Threshold:     80 Celsius

Supported Power States
St Op     Max   Active     Idle   RL RT WL WT  Ent_Lat  Ex_Lat
 0 +     9.00W       -        -    0  0  0  0        0       0
 1 +     4.60W       -        -    1  1  1  1        0       0
 2 +     3.80W       -        -    2  2  2  2        0       0
 3 -   0.0450W       -        -    3  3  3  3     2000    2000
 4 -   0.0040W       -        -    4  4  4  4    15000   15000

Supported LBA Sizes (NSID 0x1)
Id Fmt  Data  Metadt  Rel_Perf
 0 +     512       0         0

=== START OF SMART DATA SECTION ===
SMART overall-health self-assessment test result: PASSED

SMART/Health Information (NVMe Log 0x02)
Critical Warning:                   0x00
Temperature:                        50 Celsius
Available Spare:                    100%
Available Spare Threshold:          10%
Percentage Used:                    0%
Data Units Read:                    16,573 [8.48 GB]
Data Units Written:                 162,483 [83.1 GB]
Host Read Commands:                 306,572
Host Write Commands:                2,186,739
Controller Busy Time:               64
Power Cycles:                       4
Power On Hours:                     142
Unsafe Shutdowns:                   1
Media and Data Integrity Errors:    0
Error Information Log Entries:      0
Warning  Comp. Temperature Time:    0
Critical Comp. Temperature Time:    0
Temperature Sensor 1:               51 Celsius
Temperature Sensor 2:               50 Celsius
Temperature Sensor 3:               58 Celsius
Temperature Sensor 4:               50 Celsius
Temperature Sensor 5:               50 Celsius
Temperature Sensor 6:               41 Celsius

Error Information (NVMe Log 0x01, 16 of 256 entries)
No Errors Logged

