smartctl 7.2 2020-12-30 r5155 [FreeBSD 13.0-ALPHA2 amd64] (local build)
Copyright (C) 2002-20, Bruce Allen, Christian Franke, www.smartmontools.org

=== START OF INFORMATION SECTION ===
Model Number:                       SAMSUNG MZVKW512HMJP-00000
Serial Number:                      --
Firmware Version:                   CXA7500Q
PCI Vendor/Subsystem ID:            0x144d
IEEE OUI Identifier:                0x002538
Total NVM Capacity:                 512,110,190,592 [512 GB]
Unallocated NVM Capacity:           0
Controller ID:                      2
NVMe Version:                       1.2
Number of Namespaces:               1
Namespace 1 Size/Capacity:          512,110,190,592 [512 GB]
Namespace 1 Formatted LBA Size:     512
Namespace 1 IEEE EUI-64:            002538 ...
Local Time is:                      Sat Feb 13 16:15:41 2021 CET
Firmware Updates (0x16):            3 Slots, no Reset required
Optional Admin Commands (0x0017):   Security Format Frmw_DL Self_Test
Optional NVM Commands (0x001f):     Comp Wr_Unc DS_Mngmt Wr_Zero Sav/Sel_Feat
Log Page Attributes (0x03):         S/H_per_NS Cmd_Eff_Lg
Warning  Comp. Temp. Threshold:     70 Celsius
Critical Comp. Temp. Threshold:     73 Celsius

Supported Power States
St Op     Max   Active     Idle   RL RT WL WT  Ent_Lat  Ex_Lat
 0 +     6.80W       -        -    0  0  0  0        0       0
 1 +     5.60W       -        -    1  1  1  1        0       0
 2 +     4.40W       -        -    2  2  2  2        0       0
 3 -   0.0400W       -        -    3  3  3  3      210    1500
 4 -   0.0050W       -        -    4  4  4  4     2200    6000

Supported LBA Sizes (NSID 0x1)
Id Fmt  Data  Metadt  Rel_Perf
 0 +     512       0         0

=== START OF SMART DATA SECTION ===
SMART overall-health self-assessment test result: PASSED

SMART/Health Information (NVMe Log 0x02)
Critical Warning:                   0x00
Temperature:                        37 Celsius
Available Spare:                    100%
Available Spare Threshold:          10%
Percentage Used:                    6%
Data Units Read:                    39,444,686 [20.1 TB]
Data Units Written:                 75,202,027 [38.5 TB]
Host Read Commands:                 5,728,379,345
Host Write Commands:                2,555,879,397
Controller Busy Time:               13,885
Power Cycles:                       24
Power On Hours:                     10,340
Unsafe Shutdowns:                   6
Media and Data Integrity Errors:    0
Error Information Log Entries:      11
Warning  Comp. Temperature Time:    0
Critical Comp. Temperature Time:    0
Temperature Sensor 1:               37 Celsius
Temperature Sensor 2:               65 Celsius

Error Information (NVMe Log 0x01, 16 of 64 entries)
Num   ErrCount  SQId   CmdId  Status  PELoc          LBA  NSID    VS
  0         11     0  0x0011  0x4016  0x004            0     1     -
  1         10     0  0x0016  0x4016  0x004            0     1     -
  2          9     0  0x0011  0x4016  0x004            0     1     -
  3          8     0  0x0011  0x4016  0x004            0     1     -
  4          7     0  0x0011  0x4016  0x004            0     1     -
  5          6     0  0x0011  0x4016  0x004            0     1     -
  6          5     0  0x0011  0x4016  0x004            0     1     -
  7          4     0  0x0011  0x4016  0x004            0     1     -
  8          3     0  0x0011  0x4016  0x004            0     1     -
  9          2     0  0x0011  0x4016  0x004            0     1     -
 10          1     0  0x0011  0x4016  0x004            0     1     -



