smartctl 7.4 2023-08-01 r5530 [OpenBSD 7.6 amd64] (local build)
Copyright (C) 2002-23, Bruce Allen, Christian Franke, www.smartmontools.org

=== START OF INFORMATION SECTION ===
Model Number:                       KXG60ZNV1T02 NVMe TOSHIBA 1024GB
Serial Number:                      --
Firmware Version:                   10604106
PCI Vendor/Subsystem ID:            0x1179
IEEE OUI Identifier:                0x8ce38e
Total NVM Capacity:                 1,024,209,543,168 [1.02 TB]
Unallocated NVM Capacity:           0
Controller ID:                      0
NVMe Version:                       1.3
Number of Namespaces:               1
Local Time is:                      Fri Jan  3 14:18:17 2025 PST
Firmware Updates (0x14):            2 Slots, no Reset required
Optional Admin Commands (0x0017):   Security Format Frmw_DL Self_Test
Optional NVM Commands (0x005f):     Comp Wr_Unc DS_Mngmt Wr_Zero Sav/Sel_Feat Timestmp
Log Page Attributes (0x0e):         Cmd_Eff_Lg Ext_Get_Lg Telmtry_Lg
Maximum Data Transfer Size:         512 Pages
Warning  Comp. Temp. Threshold:     78 Celsius
Critical Comp. Temp. Threshold:     82 Celsius

Supported Power States
St Op     Max   Active     Idle   RL RT WL WT  Ent_Lat  Ex_Lat
 0 +     6.00W       -        -    0  0  0  0        1       1
 1 +     2.40W       -        -    1  1  1  1        1       1
 2 +     1.90W       -        -    2  2  2  2        1       1
 3 -   0.0500W       -        -    3  3  3  3     1500    1500
 4 -   0.0030W       -        -    4  4  4  4    50000   80000

=== START OF SMART DATA SECTION ===
SMART overall-health self-assessment test result: PASSED

SMART/Health Information (NVMe Log 0x02)
Critical Warning:                   0x00
Temperature:                        42 Celsius
Available Spare:                    100%
Available Spare Threshold:          10%
Percentage Used:                    7%
Data Units Read:                    24,225,549 [12.4 TB]
Data Units Written:                 42,410,167 [21.7 TB]
Host Read Commands:                 374,367,846
Host Write Commands:                853,458,124
Controller Busy Time:               2,004
Power Cycles:                       852
Power On Hours:                     15,529
Unsafe Shutdowns:                   165
Media and Data Integrity Errors:    0
Error Information Log Entries:      2
Warning  Comp. Temperature Time:    0
Critical Comp. Temperature Time:    0
Temperature Sensor 1:               42 Celsius
Thermal Temp. 1 Transition Count:   4
Thermal Temp. 1 Total Time:         1346

Error Information (NVMe Log 0x01, 16 of 256 entries)
No Errors Logged

Self-test Log (NVMe Log 0x06)
Self-test status: No self-test in progress
Num  Test_Description  Status                       Power_on_Hours  Failing_LBA  NSID Seg SCT Code
 0   Short             Completed without error               13368            -     -   -   -    -
 1   Short             Completed without error               12696            -     -   -   -    -
 2   Short             Completed without error                8648            -     -   -   -    -
 3   Short             Completed without error                6636            -     -   -   -    -
 4   Short             Completed without error                5966            -     -   -   -    -
 5   Short             Completed without error                   2            -     -   -   -    -

