smartctl 7.1 2019-12-30 r5022 [FreeBSD 12.1-RELEASE amd64] (local build)
Copyright (C) 2002-19, Bruce Allen, Christian Franke, www.smartmontools.org

=== START OF INFORMATION SECTION ===
Model Number:                       INTEL SSDPEKNW010T8
Serial Number:                      --
Firmware Version:                   002C
PCI Vendor/Subsystem ID:            0x8086
IEEE OUI Identifier:                0x5cd2e4
Controller ID:                      1
Number of Namespaces:               1
Namespace 1 Size/Capacity:          1,024,209,543,168 [1.02 TB]
Namespace 1 Formatted LBA Size:     512
Local Time is:                      Sun Feb 28 02:09:44 2021 EST
Firmware Updates (0x14):            2 Slots, no Reset required
Optional Admin Commands (0x0017):   Security Format Frmw_DL Self_Test
Optional NVM Commands (0x005f):     Comp Wr_Unc DS_Mngmt Wr_Zero Sav/Sel_Feat Timestmp
Maximum Data Transfer Size:         32 Pages
Warning  Comp. Temp. Threshold:     77 Celsius
Critical Comp. Temp. Threshold:     80 Celsius

Supported Power States
St Op     Max   Active     Idle   RL RT WL WT  Ent_Lat  Ex_Lat
 0 +     4.00W       -        -    0  0  0  0        0       0
 1 +     3.00W       -        -    1  1  1  1        0       0
 2 +     2.20W       -        -    2  2  2  2        0       0
 3 -   0.0300W       -        -    3  3  3  3     5000    5000
 4 -   0.0040W       -        -    4  4  4  4     5000    9000

Supported LBA Sizes (NSID 0x1)
Id Fmt  Data  Metadt  Rel_Perf
 0 +     512       0         0

=== START OF SMART DATA SECTION ===
SMART overall-health self-assessment test result: PASSED

SMART/Health Information (NVMe Log 0x02)
Critical Warning:                   0x00
Temperature:                        37 Celsius
Available Spare:                    100%
Available Spare Threshold:          10%
Percentage Used:                    0%
Data Units Read:                    21,652,668 [11.0 TB]
Data Units Written:                 12,300,574 [6.29 TB]
Host Read Commands:                 186,517,985
Host Write Commands:                123,466,264
Controller Busy Time:               1,625
Power Cycles:                       405
Power On Hours:                     3,691
Unsafe Shutdowns:                   38
Media and Data Integrity Errors:    0
Error Information Log Entries:      0
Warning  Comp. Temperature Time:    0
Critical Comp. Temperature Time:    0
Thermal Temp. 1 Transition Count:   756
Thermal Temp. 1 Total Time:         10177

Error Information (NVMe Log 0x01, max 256 entries)
No Errors Logged

