smartctl 7.2 2020-12-30 r5155 [FreeBSD 12.1-RELEASE-p18-HBSD amd64] (local build)
Copyright (C) 2002-20, Bruce Allen, Christian Franke, www.smartmontools.org

=== START OF INFORMATION SECTION ===
Device Model:     SAMSUNG HD082GJ
Serial Number:    --
LU WWN Device Id: 5 0000f0 ...
Firmware Version: JE100-19
User Capacity:    80,026,361,856 bytes [80.0 GB]
Sector Size:      512 bytes logical/physical
Device is:        Not in smartctl database [for details use: -P showall]
ATA Version is:   ATA/ATAPI-7, ATA8-ACS T13/1699-D revision 3b
Local Time is:    Thu Jun 24 23:34:18 2021 MSK
SMART support is: Available - device has SMART capability.
SMART support is: Enabled
AAM feature is:   Disabled
APM feature is:   Disabled
Rd look-ahead is: Enabled
Write cache is:   Enabled
DSN feature is:   Unavailable
ATA Security is:  Disabled, frozen [SEC2]
Wt Cache Reorder: Enabled

=== START OF READ SMART DATA SECTION ===
SMART overall-health self-assessment test result: PASSED

General SMART Values:
Offline data collection status:  (0x02)	Offline data collection activity
					was completed without error.
					Auto Offline Data Collection: Disabled.
Self-test execution status:      (   0)	The previous self-test routine completed
					without error or no self-test has ever 
					been run.
Total time to complete Offline 
data collection: 		( 1463) seconds.
Offline data collection
capabilities: 			 (0x5b) SMART execute Offline immediate.
					Auto Offline data collection on/off support.
					Suspend Offline collection upon new
					command.
					Offline surface scan supported.
					Self-test supported.
					No Conveyance Self-test supported.
					Selective Self-test supported.
SMART capabilities:            (0x0003)	Saves SMART data before entering
					power-saving mode.
					Supports SMART auto save timer.
Error logging capability:        (0x01)	Error logging supported.
					General Purpose Logging supported.
Short self-test routine 
recommended polling time: 	 (   2) minutes.
Extended self-test routine
recommended polling time: 	 (  24) minutes.
SCT capabilities: 	       (0x003f)	SCT Status supported.
					SCT Error Recovery Control supported.
					SCT Feature Control supported.
					SCT Data Table supported.

SMART Attributes Data Structure revision number: 16
Vendor Specific SMART Attributes with Thresholds:
ID# ATTRIBUTE_NAME          FLAGS    VALUE WORST THRESH FAIL RAW_VALUE
  1 Raw_Read_Error_Rate     POSR--   100   100   051    -    0
  3 Spin_Up_Time            POS---   253   253   025    -    4288
  4 Start_Stop_Count        -O--CK   100   100   000    -    924
  5 Reallocated_Sector_Ct   PO--CK   100   100   010    -    1
  7 Seek_Error_Rate         POSR--   253   253   051    -    0
  8 Seek_Time_Performance   P-S--K   253   253   015    -    0
  9 Power_On_Hours          -O--CK   100   100   000    -    2617
 10 Spin_Retry_Count        PO--CK   253   253   051    -    0
 11 Calibration_Retry_Count -O--C-   253   100   000    -    0
 12 Power_Cycle_Count       -O--CK   100   100   000    -    472
 13 Read_Soft_Error_Rate    -OSR--   100   100   000    -    257867794
184 End-to-End_Error        PO--CK   253   253   099    -    0
187 Reported_Uncorrect      -O--CK   001   001   000    -    327928
188 Command_Timeout         -O--CK   253   253   000    -    0
190 Airflow_Temperature_Cel -O---K   121   118   000    -    39 (Min/Max 9/40)
194 Temperature_Celsius     -O---K   118   115   000    -    40 (Min/Max 9/41)
195 Hardware_ECC_Recovered  -O-RC-   100   100   000    -    257867794
196 Reallocated_Event_Count -O--CK   100   100   000    -    1
197 Current_Pending_Sector  -O--C-   253   100   000    -    0
198 Offline_Uncorrectable   ----CK   253   253   000    -    0
199 UDMA_CRC_Error_Count    -OSRCK   200   200   000    -    3
200 Multi_Zone_Error_Rate   -O-R--   100   100   000    -    0
201 Soft_Read_Error_Rate    -O-R--   100   100   000    -    0
202 Data_Address_Mark_Errs  -O--CK   253   253   000    -    0
                            ||||||_ K auto-keep
                            |||||__ C event count
                            ||||___ R error rate
                            |||____ S speed/performance
                            ||_____ O updated online
                            |______ P prefailure warning

General Purpose Log Directory Version 1
SMART           Log Directory Version 1 [multi-sector log support]
Address    Access  R/W   Size  Description
0x00       GPL,SL  R/O      1  Log Directory
0x01           SL  R/O      1  Summary SMART error log
0x02           SL  R/O      2  Comprehensive SMART error log
0x03       GPL     R/O      2  Ext. Comprehensive SMART error log
0x06           SL  R/O      1  SMART self-test log
0x10       GPL     R/O      1  NCQ Command Error log
0x11       GPL     R/O      1  SATA Phy Event Counters log
0x80-0x9f  GPL,SL  R/W     16  Host vendor specific log
0xe0       GPL,SL  R/W      1  SCT Command/Status
0xe1       GPL,SL  R/W      1  SCT Data Transfer

SMART Extended Comprehensive Error Log Version: 1 (2 sectors)
Device Error Count: 255 (device log contains only the most recent 8 errors)
	CR     = Command Register
	FEATR  = Features Register
	COUNT  = Count (was: Sector Count) Register
	LBA_48 = Upper bytes of LBA High/Mid/Low Registers ]  ATA-8
	LH     = LBA High (was: Cylinder High) Register    ]   LBA
	LM     = LBA Mid (was: Cylinder Low) Register      ] Register
	LL     = LBA Low (was: Sector Number) Register     ]
	DV     = Device (was: Device/Head) Register
	DC     = Device Control Register
	ER     = Error register
	ST     = Status register
Powered_Up_Time is measured from power on, and printed as
DDd+hh:mm:SS.sss where DD=days, hh=hours, mm=minutes,
SS=sec, and sss=millisec. It "wraps" after 49.710 days.

Error 255 [6] occurred at disk power-on lifetime: 8827 hours (367 days + 19 hours)
  When the command that caused the error occurred, the device was in an unknown state.

  After command completion occurred, registers were:
  ER -- ST COUNT  LBA_48  LH LM LL DV DC
  -- -- -- == -- == == == -- -- -- -- --
  00 -- 00 68 00 e3 17 dc 00 00 00 c8 00

  Commands leading to the command that caused the error were:
  CR FEATR COUNT  LBA_48  LH LM LL DV DC  Powered_Up_Time  Command/Feature_Name
  -- == -- == -- == == == -- -- -- -- --  ---------------  --------------------
  93 00 00 00 68 c8 00 00 e3 17 db 00 00     00:00:00.008  DOWNLOAD MICROCODE DMA
  93 00 00 00 68 c8 00 00 e3 17 da 00 00     00:00:00.008  DOWNLOAD MICROCODE DMA
  54 00 00 00 68 c8 00 00 e3 17 d9 00 00     00:00:00.008  [RESERVED]
  54 00 00 00 68 c8 00 00 e3 17 d8 00 00     00:00:00.008  [RESERVED]
  00 00 16 01 13 00 00 20 c0 00 20 02 a1     00:00:01.742  NOP [Reserved subcommand] [OBS-ACS-2]

Error 254 [5] occurred at disk power-on lifetime: 8833 hours (368 days + 1 hours)
  When the command that caused the error occurred, the device was in an unknown state.

  After command completion occurred, registers were:
  ER -- ST COUNT  LBA_48  LH LM LL DV DC
  -- -- -- == -- == == == -- -- -- -- --
  00 -- 00 68 00 e1 7f 2f 00 00 00 c8 00

  Commands leading to the command that caused the error were:
  CR FEATR COUNT  LBA_48  LH LM LL DV DC  Powered_Up_Time  Command/Feature_Name
  -- == -- == -- == == == -- -- -- -- --  ---------------  --------------------
  ab 00 00 00 68 c8 00 00 e1 7f 2e 00 00     00:00:00.007  [RESERVED]
  ab 00 00 00 68 c8 00 00 e1 7f 2d 00 00     00:00:00.007  [RESERVED]
  ab 00 00 00 68 c8 00 00 e1 7f 2c 00 00     00:00:00.007  [RESERVED]
  ab 00 00 00 68 c8 00 00 e1 7f 2b 00 00     00:00:00.007  [RESERVED]
  00 00 16 01 17 00 00 00 c0 00 40 01 a1     00:00:01.742  NOP [Reserved subcommand] [OBS-ACS-2]

Error 253 [4] occurred at disk power-on lifetime: 8589 hours (357 days + 21 hours)
  When the command that caused the error occurred, the device was in an unknown state.

  After command completion occurred, registers were:
  ER -- ST COUNT  LBA_48  LH LM LL DV DC
  -- -- -- == -- == == == -- -- -- -- --
  7f -- 00 34 00 e0 75 0f 00 00 00 25 ff

  Commands leading to the command that caused the error were:
  CR FEATR COUNT  LBA_48  LH LM LL DV DC  Powered_Up_Time  Command/Feature_Name
  -- == -- == -- == == == -- -- -- -- --  ---------------  --------------------
  ac 00 26 00 0e 25 00 00 e0 75 0f 00 ff 49d+12:23:10.080  [RESERVED]
  6d 00 52 00 bc 25 00 00 e0 75 0e 00 ff 49d+12:23:10.080  [RESERVED]
  6d 00 7f 00 3d 25 00 00 e0 75 0e 00 ff 49d+12:23:10.080  [RESERVED]
  6d 00 7f 00 be 25 00 00 e0 75 0d 00 ff 49d+12:23:10.080  [RESERVED]
  00 11 89 11 91 00 00 11 07 c9 b1 04 11 49d+12:23:10.080  NOP [Reserved subcommand] [OBS-ACS-2]

Error 252 [3] occurred at disk power-on lifetime: 12722 hours (530 days + 2 hours)
  When the command that caused the error occurred, the device was in a reserved state.

  After command completion occurred, registers were:
  ER -- ST COUNT  LBA_48  LH LM LL DV DC
  -- -- -- == -- == == == -- -- -- -- --
  00 -- 00 00 00 00 00 00 00 00 00 00 00

  Commands leading to the command that caused the error were:
  CR FEATR COUNT  LBA_48  LH LM LL DV DC  Powered_Up_Time  Command/Feature_Name
  -- == -- == -- == == == -- -- -- -- --  ---------------  --------------------
  00 00 16 01 0f 00 00 20 c0 00 20 03 a1     00:00:01.742  NOP [Reserved subcommand] [OBS-ACS-2]

Error 251 [2] occurred at disk power-on lifetime: 8827 hours (367 days + 19 hours)
  When the command that caused the error occurred, the device was in an unknown state.

  After command completion occurred, registers were:
  ER -- ST COUNT  LBA_48  LH LM LL DV DC
  -- -- -- == -- == == == -- -- -- -- --
  17 -- 68 c8 e3 00 00 3f 00 08 93 00 db

  Commands leading to the command that caused the error were:
  CR FEATR COUNT  LBA_48  LH LM LL DV DC  Powered_Up_Time  Command/Feature_Name
  -- == -- == -- == == == -- -- -- -- --  ---------------  --------------------
  08 00 00 00 00 93 e3 da c8 17 68 3f 08 20d+04:40:30.464  DEVICE RESET
  d9 e3 17 54 c8 00 00 08 00 00 3f 68 d8 12d+07:08:41.059  [RESERVED]
  ce 01 13 20 20 00 00 00 02 c0 00 03 00 20d+04:40:30.464  WRITE MULTIPLE FUA EXT
  00 00 00 00 84 00 e1 2f 51 7f 68 a2 07  4d+09:27:38.881  NOP [Abort queued commands]
  2f e1 7f ab c8 00 00 07 00 00 be 68 2e 37d+00:35:29.121  READ LOG EXT

Error 250 [1] occurred at disk power-on lifetime: 26624 hours (1109 days + 8 hours)
  When the command that caused the error occurred, the device was in an unknown state.

  After command completion occurred, registers were:
  ER -- ST COUNT  LBA_48  LH LM LL DV DC
  -- -- -- == -- == == == -- -- -- -- --
  c8 -- 7f be ab 68 00 00 00 00 07 2c e1  Device Fault; Error: 

  Commands leading to the command that caused the error were:
  CR FEATR COUNT  LBA_48  LH LM LL DV DC  Powered_Up_Time  Command/Feature_Name
  -- == -- == -- == == == -- -- -- -- --  ---------------  --------------------
  00 00 8c 00 00 c7 00 00 03 00 f5 06 16 24d+16:39:11.104  NOP [Reserved subcommand] [OBS-ACS-2]
  8c 08 40 d5 67 00 00 e0 11 51 82 00 00  4d+15:50:58.977  [VENDOR SPECIFIC]
  e0 00 00 00 00 d5 08 00 67 00 00 82 00     00:00:35.625  STANDBY IMMEDIATE

Error 249 [0] occurred at disk power-on lifetime: 0 hours (0 days + 0 hours)
  When the command that caused the error occurred, the device was in an unknown state.

  After command completion occurred, registers were:
  ER -- ST COUNT  LBA_48  LH LM LL DV DC
  -- -- -- == -- == == == -- -- -- -- --
  67 -- 13 82 d5 00 11 51 00 00 e0 8d 08

  Commands leading to the command that caused the error were:
  CR FEATR COUNT  LBA_48  LH LM LL DV DC  Powered_Up_Time  Command/Feature_Name
  -- == -- == -- == == == -- -- -- -- --  ---------------  --------------------
  e6 00 69 00 00 e0 d5 08 82 67 00 c8 b7 12d+10:15:41.824  SLEEP
  08 cb 27 e0 82 00 00 b7 00 69 c8 00 08 39d+00:09:07.691  DEVICE RESET
  b7 00 69 00 00 e0 6b 08 5f d7 00 c8 b7     00:00:00.000  [RESERVED FOR COMPACTFLASH ASSOCIATION]
  08 00 00 00 f5 00 c7 00 06 03 00 00 00 39d+00:09:16.703  DEVICE RESET
  a1 d5 67 e0 82 8d 00 00 00 11 51 25 08 27d+04:50:55.104  IDENTIFY PACKET DEVICE

Error 248 [7] occurred at disk power-on lifetime: 8830 hours (367 days + 22 hours)
  When the command that caused the error occurred, the device was in an unknown state.

  After command completion occurred, registers were:
  ER -- ST COUNT  LBA_48  LH LM LL DV DC
  -- -- -- == -- == == == -- -- -- -- --
  00 -- 00 28 00 e3 1d f6 00 00 00 c8 00

  Commands leading to the command that caused the error were:
  CR FEATR COUNT  LBA_48  LH LM LL DV DC  Powered_Up_Time  Command/Feature_Name
  -- == -- == -- == == == -- -- -- -- --  ---------------  --------------------
  81 00 00 00 28 c8 00 00 e3 1d f5 00 00     00:00:00.008  [VENDOR SPECIFIC]
  81 00 00 00 28 c8 00 00 e3 1d f4 00 00     00:00:00.008  [VENDOR SPECIFIC]
  81 00 00 00 28 c8 00 00 e3 1d f3 00 00     00:00:00.008  [VENDOR SPECIFIC]
  81 00 00 00 28 c8 00 00 e3 1d f2 00 00     00:00:00.008  [VENDOR SPECIFIC]
  00 00 16 01 0f 00 00 20 c0 00 20 03 a1     00:00:01.742  NOP [Reserved subcommand] [OBS-ACS-2]

SMART Extended Self-test Log (GP Log 0x07) not supported

SMART Self-test log structure revision number 1
No self-tests have been logged.  [To run self-tests, use: smartctl -t]

SMART Selective self-test log data structure revision number 0
Note: revision number not 1 implies that no selective self-test has ever been run
 SPAN  MIN_LBA  MAX_LBA  CURRENT_TEST_STATUS
    1        0        0  Not_testing
    2        0        0  Not_testing
    3        0        0  Not_testing
    4        0        0  Not_testing
    5        0        0  Not_testing
Selective self-test flags (0x0):
  After scanning selected spans, do NOT read-scan remainder of disk.
If Selective self-test is pending on power-up, resume after 0 minute delay.

SCT Status Version:                  2
SCT Version (vendor specific):       256 (0x0100)
Device State:                        Active (0)
Current Temperature:                    40 Celsius
Power Cycle Min/Max Temperature:     35/41 Celsius
Lifetime    Min/Max Temperature:      9/41 Celsius
Under/Over Temperature Limit Count:   0/0

SCT Temperature History Version:     2
Temperature Sampling Period:         1 minute
Temperature Logging Interval:        1 minute
Min/Max recommended Temperature:     -4/72 Celsius
Min/Max Temperature Limit:           -9/77 Celsius
Temperature History Size (Index):    128 (51)

SCT Error Recovery Control:
           Read: Disabled
          Write: Disabled

Device Statistics (GP/SMART Log 0x04) not supported

Pending Defects log (GP Log 0x0c) not supported

SATA Phy Event Counters (GP Log 0x11)
ID      Size     Value  Description
0x0001  2            1  Command failed due to ICRC error
0x0002  2            1  R_ERR response for data FIS
0x0003  2            1  R_ERR response for device-to-host data FIS
0x0004  2            0  R_ERR response for host-to-device data FIS
0x0005  2            0  R_ERR response for non-data FIS
0x0006  2            0  R_ERR response for device-to-host non-data FIS
0x0007  2            0  R_ERR response for host-to-device non-data FIS
0x0008  2            0  Device-to-host non-data FIS retries
0x0009  2            0  Transition from drive PhyRdy to drive PhyNRdy
0x000a  2            6  Device-to-host register FISes sent due to a COMRESET
0x000b  2            0  CRC errors within host-to-device FIS
0x000d  2            0  Non-CRC errors within host-to-device FIS
0x000f  2            0  R_ERR response for host-to-device data FIS, CRC
0x0010  2            0  R_ERR response for host-to-device data FIS, non-CRC
0x0012  2            0  R_ERR response for host-to-device non-data FIS, CRC
0x0013  2            0  R_ERR response for host-to-device non-data FIS, non-CRC
0x8001  2            0  Vendor specific

