smartctl 7.1 2019-12-30 r5022 [FreeBSD 12.1-RELEASE amd64] (local build)
Copyright (C) 2002-19, Bruce Allen, Christian Franke, www.smartmontools.org

=== START OF INFORMATION SECTION ===
Model Family:     Hitachi Travelstar 5K320
Device Model:     HTS543216L9A300
Serial Number:    --
LU WWN Device Id: 5 000cca ...
Firmware Version: FB2OC40C
User Capacity:    160,041,885,696 bytes [160 GB]
Sector Size:      512 bytes logical/physical
Rotation Rate:    5400 rpm
Device is:        In smartctl database [for details use: -P show]
ATA Version is:   ATA8-ACS T13/1699-D revision 3f
SATA Version is:  SATA 2.6, 3.0 Gb/s
Local Time is:    Wed Mar 10 09:23:13 2021 EST
SMART support is: Available - device has SMART capability.
SMART support is: Enabled
AAM feature is:   Disabled
APM level is:     128 (minimum power consumption without standby)
Rd look-ahead is: Enabled
Write cache is:   Enabled
DSN feature is:   Unavailable
ATA Security is:  Disabled, frozen [SEC2]
Wt Cache Reorder: Enabled

=== START OF READ SMART DATA SECTION ===
SMART overall-health self-assessment test result: PASSED

General SMART Values:
Offline data collection status:  (0x85)	Offline data collection activity
					was aborted by an interrupting command from host.
					Auto Offline Data Collection: Enabled.
Self-test execution status:      (   0)	The previous self-test routine completed
					without error or no self-test has ever 
					been run.
Total time to complete Offline 
data collection: 		(  645) seconds.
Offline data collection
capabilities: 			 (0x5b) SMART execute Offline immediate.
					Auto Offline data collection on/off support.
					Suspend Offline collection upon new
					command.
					Offline surface scan supported.
					Self-test supported.
					No Conveyance Self-test supported.
					Selective Self-test supported.
SMART capabilities:            (0x0003)	Saves SMART data before entering
					power-saving mode.
					Supports SMART auto save timer.
Error logging capability:        (0x01)	Error logging supported.
					General Purpose Logging supported.
Short self-test routine 
recommended polling time: 	 (   2) minutes.
Extended self-test routine
recommended polling time: 	 (  67) minutes.
SCT capabilities: 	       (0x003d)	SCT Status supported.
					SCT Error Recovery Control supported.
					SCT Feature Control supported.
					SCT Data Table supported.

SMART Attributes Data Structure revision number: 16
Vendor Specific SMART Attributes with Thresholds:
ID# ATTRIBUTE_NAME          FLAGS    VALUE WORST THRESH FAIL RAW_VALUE
  1 Raw_Read_Error_Rate     PO-R--   100   100   062    -    0
  2 Throughput_Performance  P-S---   100   100   040    -    920
  3 Spin_Up_Time            POS---   253   253   033    -    0
  4 Start_Stop_Count        -O--C-   093   093   000    -    11531
  5 Reallocated_Sector_Ct   PO--CK   098   098   005    -    0
  7 Seek_Error_Rate         PO-R--   100   100   067    -    0
  8 Seek_Time_Performance   P-S---   100   100   040    -    0
  9 Power_On_Hours          -O--C-   010   010   000    -    39464
 10 Spin_Retry_Count        PO--C-   100   100   060    -    0
 12 Power_Cycle_Count       -O--CK   094   094   000    -    9965
191 G-Sense_Error_Rate      -O-R--   100   100   000    -    0
192 Power-Off_Retract_Count -O--CK   099   099   000    -    315
193 Load_Cycle_Count        -O--C-   001   001   000    -    1464539
194 Temperature_Celsius     -O----   189   189   000    -    29 (Min/Max 1/67)
196 Reallocated_Event_Count -O--CK   098   098   000    -    517
197 Current_Pending_Sector  -O---K   100   100   000    -    2
198 Offline_Uncorrectable   ---R--   100   100   000    -    0
199 UDMA_CRC_Error_Count    -O-R--   200   200   000    -    29
223 Load_Retry_Count        -O-R--   100   100   000    -    0
                            ||||||_ K auto-keep
                            |||||__ C event count
                            ||||___ R error rate
                            |||____ S speed/performance
                            ||_____ O updated online
                            |______ P prefailure warning

General Purpose Log Directory Version 1
SMART           Log Directory Version 1 [multi-sector log support]
Address    Access  R/W   Size  Description
0x00       GPL,SL  R/O      1  Log Directory
0x01           SL  R/O      1  Summary SMART error log
0x02           SL  R/O      1  Comprehensive SMART error log
0x03       GPL     R/O      1  Ext. Comprehensive SMART error log
0x06           SL  R/O      1  SMART self-test log
0x07       GPL     R/O      1  Extended self-test log
0x09           SL  R/W      1  Selective self-test log
0x10       GPL     R/O      1  NCQ Command Error log
0x11       GPL     R/O      1  SATA Phy Event Counters log
0x80-0x9f  GPL,SL  R/W     16  Host vendor specific log

SMART Extended Comprehensive Error Log Version: 1 (1 sectors)
Device Error Count: 15 (device log contains only the most recent 4 errors)
	CR     = Command Register
	FEATR  = Features Register
	COUNT  = Count (was: Sector Count) Register
	LBA_48 = Upper bytes of LBA High/Mid/Low Registers ]  ATA-8
	LH     = LBA High (was: Cylinder High) Register    ]   LBA
	LM     = LBA Mid (was: Cylinder Low) Register      ] Register
	LL     = LBA Low (was: Sector Number) Register     ]
	DV     = Device (was: Device/Head) Register
	DC     = Device Control Register
	ER     = Error register
	ST     = Status register
Powered_Up_Time is measured from power on, and printed as
DDd+hh:mm:SS.sss where DD=days, hh=hours, mm=minutes,
SS=sec, and sss=millisec. It "wraps" after 49.710 days.

Error 15 [2] occurred at disk power-on lifetime: 39436 hours (1643 days + 4 hours)
  When the command that caused the error occurred, the device was active or idle.

  After command completion occurred, registers were:
  ER -- ST COUNT  LBA_48  LH LM LL DV DC
  -- -- -- == -- == == == -- -- -- -- --
  40 -- 51 00 0f 00 00 11 f9 eb b9 e1 00  Error: UNC 15 sectors at LBA = 0x11f9ebb9 = 301591481

  Commands leading to the command that caused the error were:
  CR FEATR COUNT  LBA_48  LH LM LL DV DC  Powered_Up_Time  Command/Feature_Name
  -- == -- == -- == == == -- -- -- -- --  ---------------  --------------------
  25 00 00 00 10 00 00 11 f9 eb b8 e0 00     00:18:50.600  READ DMA EXT
  35 00 00 02 00 00 00 09 75 d5 08 e0 00     00:18:50.600  WRITE DMA EXT
  35 00 00 02 00 00 00 09 75 d3 08 e0 00     00:18:50.600  WRITE DMA EXT
  35 00 00 02 00 00 00 09 75 d1 08 e0 00     00:18:50.600  WRITE DMA EXT
  35 00 00 02 00 00 00 09 75 cf 08 e0 00     00:18:50.600  WRITE DMA EXT

Error 14 [1] occurred at disk power-on lifetime: 39436 hours (1643 days + 4 hours)
  When the command that caused the error occurred, the device was active or idle.

  After command completion occurred, registers were:
  ER -- ST COUNT  LBA_48  LH LM LL DV DC
  -- -- -- == -- == == == -- -- -- -- --
  40 -- 51 00 42 00 00 11 f5 cf 16 e1 00  Error: UNC 66 sectors at LBA = 0x11f5cf16 = 301322006

  Commands leading to the command that caused the error were:
  CR FEATR COUNT  LBA_48  LH LM LL DV DC  Powered_Up_Time  Command/Feature_Name
  -- == -- == -- == == == -- -- -- -- --  ---------------  --------------------
  25 00 00 00 58 00 00 11 f5 cf 00 e0 00     00:17:41.300  READ DMA EXT
  35 00 00 02 00 00 00 08 b6 63 00 e0 00     00:17:41.300  WRITE DMA EXT
  25 00 00 00 08 00 00 11 f6 d6 80 e0 00     00:17:41.300  READ DMA EXT
  ca 00 00 00 e8 00 00 00 ba 1b 00 ea 00     00:17:41.300  WRITE DMA
  25 00 00 00 a0 00 00 11 f5 cd 68 e0 00     00:17:38.300  READ DMA EXT

Error 13 [0] occurred at disk power-on lifetime: 39436 hours (1643 days + 4 hours)
  When the command that caused the error occurred, the device was active or idle.

  After command completion occurred, registers were:
  ER -- ST COUNT  LBA_48  LH LM LL DV DC
  -- -- -- == -- == == == -- -- -- -- --
  40 -- 51 00 dc 00 00 11 f5 ca 2c e1 00  Error: UNC 220 sectors at LBA = 0x11f5ca2c = 301320748

  Commands leading to the command that caused the error were:
  CR FEATR COUNT  LBA_48  LH LM LL DV DC  Powered_Up_Time  Command/Feature_Name
  -- == -- == -- == == == -- -- -- -- --  ---------------  --------------------
  25 00 00 00 f8 00 00 11 f5 ca 10 e0 00     00:17:08.900  READ DMA EXT
  ca 00 00 00 a0 00 00 00 f5 df 20 e1 00     00:17:08.900  WRITE DMA
  ca 00 00 00 08 00 00 00 f5 c8 88 e1 00     00:17:08.900  WRITE DMA
  25 00 00 00 08 00 00 11 f5 ca 08 e0 00     00:17:03.100  READ DMA EXT
  ca 00 00 00 08 00 00 00 f5 c8 10 e1 00     00:17:03.100  WRITE DMA

Error 12 [3] occurred at disk power-on lifetime: 39216 hours (1634 days + 0 hours)
  When the command that caused the error occurred, the device was active or idle.

  After command completion occurred, registers were:
  ER -- ST COUNT  LBA_48  LH LM LL DV DC
  -- -- -- == -- == == == -- -- -- -- --
  84 -- 51 01 51 00 00 02 29 85 6f 42 00  Error: ICRC, ABRT at LBA = 0x0229856f = 36275567

  Commands leading to the command that caused the error were:
  CR FEATR COUNT  LBA_48  LH LM LL DV DC  Powered_Up_Time  Command/Feature_Name
  -- == -- == -- == == == -- -- -- -- --  ---------------  --------------------
  61 00 40 00 e8 00 00 02 19 91 60 40 08     00:01:21.500  WRITE FPDMA QUEUED
  61 00 80 00 e0 00 00 02 19 86 e0 40 08     00:01:21.500  WRITE FPDMA QUEUED
  61 00 40 00 d8 00 00 02 19 87 80 40 08     00:01:21.500  WRITE FPDMA QUEUED
  61 00 20 00 d0 00 00 02 19 88 20 40 08     00:01:21.500  WRITE FPDMA QUEUED
  61 00 20 00 c8 00 00 02 19 89 20 40 08     00:01:21.500  WRITE FPDMA QUEUED

SMART Extended Self-test Log Version: 1 (1 sectors)
Num  Test_Description    Status                  Remaining  LifeTime(hours)  LBA_of_first_error
# 1  Short offline       Completed without error       00%     39431         -
# 2  Short offline       Completed without error       00%     39420         -
# 3  Extended offline    Completed: read failure       10%     39411         222189803
# 4  Short offline       Completed without error       00%     39398         -
# 5  Short offline       Completed without error       00%     39387         -
# 6  Short offline       Completed without error       00%     39376         -
# 7  Short offline       Completed without error       00%     39365         -
# 8  Short offline       Completed without error       00%     39354         -
# 9  Short offline       Completed without error       00%     39342         -
#10  Short offline       Completed without error       00%     39333         -
#11  Short offline       Completed without error       00%     39321         -
#12  Short offline       Completed without error       00%     39311         -
#13  Short offline       Completed without error       00%     39300         -
#14  Short offline       Completed without error       00%     39289         -
#15  Short offline       Completed without error       00%     39277         -
#16  Short offline       Completed without error       00%     39266         -
#17  Short offline       Completed without error       00%     39255         -
#18  Short offline       Completed without error       00%     39244         -

SMART Selective self-test log data structure revision number 1
 SPAN  MIN_LBA  MAX_LBA  CURRENT_TEST_STATUS
    1        0        0  Not_testing
    2        0        0  Not_testing
    3        0        0  Not_testing
    4        0        0  Not_testing
    5        0        0  Not_testing
Selective self-test flags (0x0):
  After scanning selected spans, do NOT read-scan remainder of disk.
If Selective self-test is pending on power-up, resume after 0 minute delay.

SCT Status Version:                  3
SCT Version (vendor specific):       256 (0x0100)
Device State:                        Active (0)
Current Temperature:                    29 Celsius
Power Cycle Min/Max Temperature:     22/30 Celsius
Lifetime    Min/Max Temperature:      1/67 Celsius
Specified Max Operating Temperature:    37 Celsius
Under/Over Temperature Limit Count:   0/0

SCT Temperature History Version:     2
Temperature Sampling Period:         1 minute
Temperature Logging Interval:        1 minute
Min/Max recommended Temperature:      5/60 Celsius
Min/Max Temperature Limit:           -40/65 Celsius
Temperature History Size (Index):    478 (59)

SCT Error Recovery Control:
           Read: Disabled
          Write: Disabled

Device Statistics (GP/SMART Log 0x04) not supported

Pending Defects log (GP Log 0x0c) not supported

SATA Phy Event Counters (GP Log 0x11)
ID      Size     Value  Description
0x0001  2            0  Command failed due to ICRC error
0x0002  2            0  R_ERR response for data FIS
0x0005  2            0  R_ERR response for non-data FIS
0x0009  2            7  Transition from drive PhyRdy to drive PhyNRdy
0x000a  2            5  Device-to-host register FISes sent due to a COMRESET
0x000b  2            0  CRC errors within host-to-device FIS
0x000d  2            0  Non-CRC errors within host-to-device FIS

